[32m[I 2022-06-30 12:36:38,456][0m Trial 146 finished with value: 0.819 and parameters: {'lr': 0.000742063174644335, 'weight_decay': 0.0006235543439127002, 'dropout': 0.6551012676252257, 'patience': 80, 'lr_reduce_freq': 120, 'spt_alg': 'prim', 'spt_attr': 'similarity', 'manifold': 'PoincareBall', 'num_layers': 3, 'dim': 512, 'num_adj': 2, 'add_rate': 0.7215192179418133, 'tem': 1.174077215982627, 'consis_rate': 1.611732538062427, 'use_att': 1}. Best is trial 83 with value: 0.8199.[0m

cur_param: {'lr': 0.002446282208997442, 'weight_decay': 0.0005438035704313008, 'dropout': 0.4164274776339579, 'patience': 90, 'lr_reduce_freq': 120, 'spt_alg': 'prim', 'spt_attr': 'similarity', 'manifold': 'PoincareBall', 'num_layers': 3, 'dim': 496, 'num_adj': 4, 'add_rate': 0.5902282437059126, 'tem': 1.223822480943212, 'consis_rate': 0.48430288790986387, 'use_att': 1}
mean: 0.8085000000000001
[0.807 0.803 0.805 0.823 0.821 0.803 0.787 0.815 0.807 0.814]
cur_param: {'lr': 0.00281028380621053, 'weight_decay': 0.0005100292386383217, 'dropout': 0.13846940372583622, 'patience': 80, 'lr_reduce_freq': 120, 'spt_alg': 'prim', 'spt_attr': 'similarity', 'manifold': 'PoincareBall', 'num_layers': 3, 'dim': 496, 'num_adj': 2, 'add_rate': 0.6383748349734559, 'tem': 1.1611554416821326, 'consis_rate': 1.5041531834557302, 'use_att': 1}
mean: 0.8090999999999999
[0.807 0.801 0.809 0.807 0.815 0.81  0.811 0.818 0.804 0.809]
cur_param: {'lr': 0.001890460298414694, 'weight_decay': 0.000635664704318449, 'dropout': 0.49338987558181663, 'patience': 80, 'lr_reduce_freq': 130, 'spt_alg': 'prim', 'spt_attr': 'similarity', 'manifold': 'PoincareBall', 'num_layers': 3, 'dim': 512, 'num_adj': 2, 'add_rate': 0.5613083195360259, 'tem': 1.265928860441394, 'consis_rate': 1.5350993773945283, 'use_att': 1}
mean: 0.8160000000000001
[0.823 0.81  0.82  0.818 0.821 0.801 0.813 0.816 0.82  0.818]
cur_param: {'lr': 0.00220132741627219, 'weight_decay': 0.000687124209222917, 'dropout': 0.5435532229376254, 'patience': 80, 'lr_reduce_freq': 140, 'spt_alg': 'prim', 'spt_attr': 'similarity', 'manifold': 'PoincareBall', 'num_layers': 3, 'dim': 208, 'num_adj': 2, 'add_rate': 0.664369929993757, 'tem': 1.4241091550943368, 'consis_rate': 1.5822334261620126, 'use_att': 1}
mean: 0.8124
[0.819 0.807 0.82  0.799 0.81  0.818 0.812 0.811 0.815 0.813]
cur_param: {'lr': 0.003395467388598534, 'weight_decay': 0.000586290729368359, 'dropout': 0.5276000357535954, 'patience': 80, 'lr_reduce_freq': 110, 'spt_alg': 'prim', 'spt_attr': 'similarity', 'manifold': 'PoincareBall', 'num_layers': 3, 'dim': 480, 'num_adj': 2, 'add_rate': 0.5704446470889375, 'tem': 1.3713853431838312, 'consis_rate': 1.7281188387937008, 'use_att': 1}
mean: 0.8137000000000001
[0.807 0.825 0.821 0.812 0.813 0.82  0.802 0.825 0.811 0.801]
cur_param: {'lr': 0.0025405959964321977, 'weight_decay': 0.0008463020753942896, 'dropout': 0.4530403522661161, 'patience': 80, 'lr_reduce_freq': 150, 'spt_alg': 'prim', 'spt_attr': 'similarity', 'manifold': 'PoincareBall', 'num_layers': 3, 'dim': 160, 'num_adj': 2, 'add_rate': 0.8315203522989065, 'tem': 1.2773161657329766, 'consis_rate': 1.8760918562321538, 'use_att': 1}
mean: 0.8082
[0.811 0.805 0.798 0.812 0.8   0.806 0.83  0.805 0.813 0.802]
cur_param: {'lr': 0.0020755316293135447, 'weight_decay': 0.0006390203005318569, 'dropout': 0.583136609537051, 'patience': 80, 'lr_reduce_freq': 140, 'spt_alg': 'prim', 'spt_attr': 'similarity', 'manifold': 'PoincareBall', 'num_layers': 3, 'dim': 496, 'num_adj': 2, 'add_rate': 0.7883325478879877, 'tem': 1.3111300870276885, 'consis_rate': 1.413660785519578, 'use_att': 1}
mean: 0.8158
[0.813 0.81  0.814 0.826 0.826 0.819 0.816 0.818 0.812 0.804]
cur_param: {'lr': 0.0016100750613164344, 'weight_decay': 0.0007435324623170103, 'dropout': 0.6143638875749474, 'patience': 80, 'lr_reduce_freq': 130, 'spt_alg': 'prim', 'spt_attr': 'similarity', 'manifold': 'PoincareBall', 'num_layers': 3, 'dim': 240, 'num_adj': 2, 'add_rate': 0.7517772019262943, 'tem': 1.1299686998911127, 'consis_rate': 1.4677938723800577, 'use_att': 1}
mean: 0.8179000000000001
[0.825 0.821 0.81  0.822 0.819 0.817 0.811 0.812 0.82  0.822]
cur_param: {'lr': 0.0015794307525795962, 'weight_decay': 0.0005777918961196362, 'dropout': 0.5669229008300672, 'patience': 80, 'lr_reduce_freq': 130, 'spt_alg': 'prim', 'spt_attr': 'similarity', 'manifold': 'PoincareBall', 'num_layers': 3, 'dim': 256, 'num_adj': 2, 'add_rate': 0.7482476831254703, 'tem': 1.204515122547651, 'consis_rate': 1.4799241007994903, 'use_att': 1}
mean: 0.8160999999999999
[0.818 0.819 0.814 0.827 0.81  0.814 0.815 0.82  0.808 0.816]
cur_param: {'lr': 0.0012117402863759327, 'weight_decay': 0.0007250812839225373, 'dropout': 0.6431965249911248, 'patience': 70, 'lr_reduce_freq': 120, 'spt_alg': 'prim', 'spt_attr': 'similarity', 'manifold': 'PoincareBall', 'num_layers': 4, 'dim': 272, 'num_adj': 2, 'add_rate': 0.7662732129916099, 'tem': 1.4601625694714646, 'consis_rate': 1.539150992856461, 'use_att': 1}
mean: 0.7943
[0.781 0.782 0.804 0.792 0.804 0.798 0.806 0.802 0.785 0.789]
cur_param: {'lr': 0.003041841278616801, 'weight_decay': 0.0005065933899222441, 'dropout': 0.4851425484446993, 'patience': 80, 'lr_reduce_freq': 120, 'spt_alg': 'prim', 'spt_attr': 'similarity', 'manifold': 'PoincareBall', 'num_layers': 3, 'dim': 240, 'num_adj': 2, 'add_rate': 0.5416449660319385, 'tem': 1.1443430720210372, 'consis_rate': 1.5864487661687359, 'use_att': 1}
mean: 0.8131
[0.803 0.799 0.813 0.808 0.822 0.799 0.83  0.812 0.813 0.832]
cur_param: {'lr': 0.0010657149023236782, 'weight_decay': 0.000798834863869305, 'dropout': 0.5045589398778145, 'patience': 80, 'lr_reduce_freq': 110, 'spt_alg': 'prim', 'spt_attr': 'similarity', 'manifold': 'PoincareBall', 'num_layers': 3, 'dim': 288, 'num_adj': 2, 'add_rate': 0.6807481119420534, 'tem': 1.1872287320767039, 'consis_rate': 1.4618762844184636, 'use_att': 1}
mean: 0.8098000000000001
[0.808 0.811 0.818 0.811 0.798 0.808 0.803 0.825 0.819 0.797]
cur_param: {'lr': 0.001733549302585701, 'weight_decay': 0.0009243824085260739, 'dropout': 0.6187503254652528, 'patience': 80, 'lr_reduce_freq': 130, 'spt_alg': 'prim', 'spt_attr': 'similarity', 'manifold': 'PoincareBall', 'num_layers': 3, 'dim': 224, 'num_adj': 2, 'add_rate': 0.8160263081604848, 'tem': 1.1284396810432717, 'consis_rate': 1.650774798742879, 'use_att': 1}
mean: 0.8160999999999999
[0.829 0.805 0.831 0.821 0.799 0.818 0.816 0.818 0.816 0.808]
cur_param: {'lr': 0.001390863185711752, 'weight_decay': 0.0010279571457893191, 'dropout': 0.6044398677446766, 'patience': 80, 'lr_reduce_freq': 130, 'spt_alg': 'prim', 'spt_attr': 'similarity', 'manifold': 'PoincareBall', 'num_layers': 3, 'dim': 512, 'num_adj': 2, 'add_rate': 0.8491149916988722, 'tem': 1.2381167645070252, 'consis_rate': 1.5980749902893243, 'use_att': 1}
mean: 0.8183999999999999
[0.821 0.818 0.821 0.801 0.831 0.814 0.81  0.828 0.82  0.82 ]
cur_param: {'lr': 0.0009007832795155702, 'weight_decay': 0.0006859175372003164, 'dropout': 0.5554523107786705, 'patience': 80, 'lr_reduce_freq': 130, 'spt_alg': 'prim', 'spt_attr': 'similarity', 'manifold': 'PoincareBall', 'num_layers': 3, 'dim': 512, 'num_adj': 2, 'add_rate': 0.880867120586083, 'tem': 1.2356680646066676, 'consis_rate': 1.6087603272895081, 'use_att': 1}
mean: 0.8183
[0.812 0.818 0.82  0.817 0.818 0.812 0.81  0.818 0.83  0.828]
cur_param: {'lr': 0.0008038309673714435, 'weight_decay': 0.0006915975521691529, 'dropout': 0.5968216664564346, 'patience': 80, 'lr_reduce_freq': 130, 'spt_alg': 'prim', 'spt_attr': 'similarity', 'manifold': 'PoincareBall', 'num_layers': 3, 'dim': 512, 'num_adj': 2, 'add_rate': 0.8805262802261414, 'tem': 1.2368550895131647, 'consis_rate': 1.3910069963750054, 'use_att': 1}
mean: 0.8167
[0.816 0.821 0.819 0.812 0.808 0.832 0.816 0.81  0.812 0.821]
cur_param: {'lr': 0.0008992020071494591, 'weight_decay': 0.0006808134473368593, 'dropout': 0.604444210834191, 'patience': 80, 'lr_reduce_freq': 120, 'spt_alg': 'prim', 'spt_attr': 'similarity', 'manifold': 'PoincareBall', 'num_layers': 3, 'dim': 512, 'num_adj': 2, 'add_rate': 0.8853537581209188, 'tem': 1.224410329449198, 'consis_rate': 1.5094385309837135, 'use_att': 1}
mean: 0.8170999999999999
[0.811 0.815 0.827 0.815 0.812 0.822 0.816 0.811 0.814 0.828]
cur_param: {'lr': 0.000742063174644335, 'weight_decay': 0.0006235543439127002, 'dropout': 0.6551012676252257, 'patience': 80, 'lr_reduce_freq': 120, 'spt_alg': 'prim', 'spt_attr': 'similarity', 'manifold': 'PoincareBall', 'num_layers': 3, 'dim': 512, 'num_adj': 2, 'add_rate': 0.7215192179418133, 'tem': 1.174077215982627, 'consis_rate': 1.611732538062427, 'use_att': 1}
mean: 0.819
[0.82  0.815 0.811 0.817 0.816 0.83  0.825 0.821 0.821 0.814]
cur_param: {'lr': 0.0007483280837556123, 'weight_decay': 0.0007439801390230317, 'dropout': 0.7090873817552098, 'patience': 80, 'lr_reduce_freq': 120, 'spt_alg': 'prim', 'spt_attr': 'similarity', 'manifold': 'PoincareBall', 'num_layers': 3, 'dim': 512, 'num_adj': 2, 'add_rate': 0.7142450716193985, 'tem': 1.1801748182690739, 'consis_rate': 1.6051803952361365, 'use_att': 1}[32m[I 2022-06-30 12:54:22,440][0m Trial 147 finished with value: 0.8213999999999999 and parameters: {'lr': 0.0007483280837556123, 'weight_decay': 0.0007439801390230317, 'dropout': 0.7090873817552098, 'patience': 80, 'lr_reduce_freq': 120, 'spt_alg': 'prim', 'spt_attr': 'similarity', 'manifold': 'PoincareBall', 'num_layers': 3, 'dim': 512, 'num_adj': 2, 'add_rate': 0.7142450716193985, 'tem': 1.1801748182690739, 'consis_rate': 1.6051803952361365, 'use_att': 1}. Best is trial 147 with value: 0.8213999999999999.[0m
[32m[I 2022-06-30 13:10:12,020][0m Trial 148 finished with value: 0.8154 and parameters: {'lr': 0.0009500481108400591, 'weight_decay': 0.00085190239244728, 'dropout': 0.7221159245193929, 'patience': 80, 'lr_reduce_freq': 130, 'spt_alg': 'prim', 'spt_attr': 'similarity', 'manifold': 'PoincareBall', 'num_layers': 3, 'dim': 512, 'num_adj': 2, 'add_rate': 0.7184731501736343, 'tem': 1.1726513297215035, 'consis_rate': 1.6219743854682267, 'use_att': 1}. Best is trial 147 with value: 0.8213999999999999.[0m
[32m[I 2022-06-30 13:30:30,468][0m Trial 149 finished with value: 0.8177999999999999 and parameters: {'lr': 0.0006677059314775086, 'weight_decay': 0.0010508080701642278, 'dropout': 0.6892390532276336, 'patience': 80, 'lr_reduce_freq': 120, 'spt_alg': 'prim', 'spt_attr': 'similarity', 'manifold': 'PoincareBall', 'num_layers': 3, 'dim': 512, 'num_adj': 2, 'add_rate': 0.7358976180358224, 'tem': 1.123729143042984, 'consis_rate': 1.604611639523685, 'use_att': 1}. Best is trial 147 with value: 0.8213999999999999.[0m

mean: 0.8213999999999999
[0.825 0.817 0.825 0.826 0.832 0.82  0.825 0.812 0.817 0.815]
cur_param: {'lr': 0.0009500481108400591, 'weight_decay': 0.00085190239244728, 'dropout': 0.7221159245193929, 'patience': 80, 'lr_reduce_freq': 130, 'spt_alg': 'prim', 'spt_attr': 'similarity', 'manifold': 'PoincareBall', 'num_layers': 3, 'dim': 512, 'num_adj': 2, 'add_rate': 0.7184731501736343, 'tem': 1.1726513297215035, 'consis_rate': 1.6219743854682267, 'use_att': 1}
mean: 0.8154
[0.821 0.788 0.824 0.819 0.823 0.821 0.815 0.814 0.824 0.805]
cur_param: {'lr': 0.0006677059314775086, 'weight_decay': 0.0010508080701642278, 'dropout': 0.6892390532276336, 'patience': 80, 'lr_reduce_freq': 120, 'spt_alg': 'prim', 'spt_attr': 'similarity', 'manifold': 'PoincareBall', 'num_layers': 3, 'dim': 512, 'num_adj': 2, 'add_rate': 0.7358976180358224, 'tem': 1.123729143042984, 'consis_rate': 1.604611639523685, 'use_att': 1}
mean: 0.8177999999999999
[0.828 0.809 0.82  0.824 0.823 0.822 0.815 0.821 0.814 0.802]
best param:--lr 0.0007483280837556123 --weight_decay 0.0007439801390230317 --dropout 0.7090873817552098 --patience 80 --lr_reduce_freq 120 --spt_alg prim --spt_attr similarity --manifold PoincareBall --num_layers 3 --dim 512 --num_adj 2 --add_rate 0.7142450716193985 --tem 1.1801748182690739 --consis_rate 1.6051803952361365 --use_att 1 
best score:0.8213999999999999

Final results: 
0.8213999999999999
