[32m[I 2022-06-22 18:41:19,573][0m Trial 54 finished with value: 0.8025 and parameters: {'lr': 0.004625930851572328, 'weight_decay': 0.0007035963616581556, 'dropout': 0.5890654772771674, 'patience': 80, 'lr_reduce_freq': 150, 'spt_alg': 'prim', 'spt_attr': 'similarity', 'manifold': 'PoincareBall', 'num_layers': 3, 'num_adj': 8, 'add_rate': 0.12073102768061506, 'tem': 0.8514353292533836, 'consis_rate': 0.7907903293489404, 'use_att': 1}. Best is trial 37 with value: 0.8079000000000001.[0m
[32m[I 2022-06-22 19:08:13,814][0m Trial 55 finished with value: 0.7899 and parameters: {'lr': 0.017005223693513028, 'weight_decay': 0.001014460880132257, 'dropout': 0.576357819667718, 'patience': 80, 'lr_reduce_freq': 150, 'spt_alg': 'prim', 'spt_attr': 'similarity', 'manifold': 'PoincareBall', 'num_layers': 3, 'num_adj': 8, 'add_rate': 0.12572288735513298, 'tem': 0.8148318238776251, 'consis_rate': 0.674787522565325, 'use_att': 1}. Best is trial 37 with value: 0.8079000000000001.[0m

mean: 0.8079000000000001
[0.803 0.81  0.798 0.814 0.794 0.812 0.813 0.807 0.818 0.81 ]
cur_param: {'lr': 0.017063900842643698, 'weight_decay': 0.010284812462739778, 'dropout': 0.6962170649009215, 'patience': 100, 'lr_reduce_freq': 150, 'spt_alg': 'kruskal', 'spt_attr': 'similarity', 'manifold': 'PoincareBall', 'num_layers': 4, 'num_adj': 8, 'add_rate': 0.43349622344521566, 'tem': 1.7654294890931375, 'consis_rate': 0.4551127507240318, 'use_att': 1}
mean: 0.3255
[0.319 0.319 0.319 0.319 0.319 0.319 0.319 0.384 0.319 0.319]
cur_param: {'lr': 0.0016099479077544886, 'weight_decay': 0.0013033337198172545, 'dropout': 0.8386463806190807, 'patience': 100, 'lr_reduce_freq': 130, 'spt_alg': 'prim', 'spt_attr': 'similarity', 'manifold': 'PoincareBall', 'num_layers': 3, 'num_adj': 8, 'add_rate': 0.5326172459506274, 'tem': 1.4576897335412666, 'consis_rate': 0.8724605920976394, 'use_att': 0}
mean: 0.6088
[0.533 0.611 0.753 0.629 0.59  0.632 0.666 0.595 0.643 0.436]
cur_param: {'lr': 0.003109125006261958, 'weight_decay': 0.004379076479986676, 'dropout': 0.6190724695228828, 'patience': 100, 'lr_reduce_freq': 130, 'spt_alg': 'kruskal', 'spt_attr': 'similarity', 'manifold': 'PoincareBall', 'num_layers': 3, 'num_adj': 2, 'add_rate': 0.26539600092421634, 'tem': 1.8648829446837976, 'consis_rate': 1.027959060583571, 'use_att': 1}
mean: 0.6987
[0.771 0.782 0.417 0.784 0.566 0.688 0.68  0.763 0.768 0.768]
cur_param: {'lr': 0.005657967013160391, 'weight_decay': 0.0006901148176590642, 'dropout': 0.45101610769257006, 'patience': 80, 'lr_reduce_freq': 130, 'spt_alg': 'prim', 'spt_attr': 'similarity', 'manifold': 'PoincareBall', 'num_layers': 3, 'num_adj': 8, 'add_rate': 0.41456670693398845, 'tem': 1.901032035776758, 'consis_rate': 1.2675880573790959, 'use_att': 1}
mean: 0.8024000000000001
[0.785 0.802 0.797 0.8   0.804 0.803 0.817 0.815 0.81  0.791]
cur_param: {'lr': 0.007407299679406638, 'weight_decay': 0.0005429623762692022, 'dropout': 0.4446234479282525, 'patience': 80, 'lr_reduce_freq': 130, 'spt_alg': 'prim', 'spt_attr': 'similarity', 'manifold': 'PoincareBall', 'num_layers': 3, 'num_adj': 8, 'add_rate': 0.4650902059961698, 'tem': 1.7165864846647738, 'consis_rate': 1.3348055562316323, 'use_att': 1}
mean: 0.7987
[0.798 0.815 0.772 0.811 0.806 0.807 0.796 0.799 0.802 0.781]
cur_param: {'lr': 0.004064328200624314, 'weight_decay': 0.0012709691325159755, 'dropout': 0.6881212773946053, 'patience': 80, 'lr_reduce_freq': 150, 'spt_alg': 'prim', 'spt_attr': 'similarity', 'manifold': 'PoincareBall', 'num_layers': 3, 'num_adj': 8, 'add_rate': 0.4109314230314813, 'tem': 1.8953552740308959, 'consis_rate': 1.2654704199015625, 'use_att': 1}
mean: 0.7960999999999999
[0.764 0.801 0.793 0.813 0.789 0.804 0.788 0.807 0.815 0.787]
cur_param: {'lr': 0.011043953285756239, 'weight_decay': 0.0006921252281008765, 'dropout': 0.6133701335136921, 'patience': 80, 'lr_reduce_freq': 130, 'spt_alg': 'prim', 'spt_attr': 'similarity', 'manifold': 'PoincareBall', 'num_layers': 3, 'num_adj': 8, 'add_rate': 0.621688257240263, 'tem': 1.6002490005720817, 'consis_rate': 0.9030942268426434, 'use_att': 1}
mean: 0.8023
[0.795 0.795 0.812 0.811 0.792 0.817 0.794 0.801 0.82  0.786]
cur_param: {'lr': 0.011181403381931196, 'weight_decay': 0.0006863954648901753, 'dropout': 0.6088875417903352, 'patience': 80, 'lr_reduce_freq': 130, 'spt_alg': 'prim', 'spt_attr': 'similarity', 'manifold': 'PoincareBall', 'num_layers': 4, 'num_adj': 8, 'add_rate': 0.6374588666012643, 'tem': 1.5681411573718496, 'consis_rate': 0.8975369711448403, 'use_att': 1}
mean: 0.7522
[0.739 0.712 0.778 0.768 0.795 0.758 0.71  0.752 0.784 0.726]
cur_param: {'lr': 0.006432451354875481, 'weight_decay': 0.0005027643544697074, 'dropout': 0.4871430462782342, 'patience': 80, 'lr_reduce_freq': 130, 'spt_alg': 'prim', 'spt_attr': 'similarity', 'manifold': 'PoincareBall', 'num_layers': 3, 'num_adj': 8, 'add_rate': 0.7703275194242227, 'tem': 0.23061440807009348, 'consis_rate': 0.741967908737644, 'use_att': 1}
mean: 0.7954000000000001
[0.776 0.8   0.792 0.81  0.775 0.813 0.793 0.802 0.8   0.793]
cur_param: {'lr': 0.02857832783761583, 'weight_decay': 0.0861311689691492, 'dropout': 0.2697179959873729, 'patience': 80, 'lr_reduce_freq': 150, 'spt_alg': 'prim', 'spt_attr': 'similarity', 'manifold': 'PoincareBall', 'num_layers': 3, 'num_adj': 8, 'add_rate': 0.6090103036861043, 'tem': 1.899501245538792, 'consis_rate': 1.0611396695283157, 'use_att': 1}
mean: 0.30229999999999996
[0.319 0.319 0.152 0.319 0.319 0.319 0.319 0.319 0.319 0.319]
cur_param: {'lr': 0.009114167678055079, 'weight_decay': 0.001116643040042111, 'dropout': 0.7426276544191315, 'patience': 100, 'lr_reduce_freq': 150, 'spt_alg': 'prim', 'spt_attr': 'similarity', 'manifold': 'PoincareBall', 'num_layers': 3, 'num_adj': 8, 'add_rate': 0.5513101230540868, 'tem': 1.791732699557569, 'consis_rate': 0.5752225849239292, 'use_att': 1}
mean: 0.7868999999999999
[0.79  0.794 0.771 0.802 0.787 0.789 0.775 0.789 0.818 0.754]
cur_param: {'lr': 0.007958586992369438, 'weight_decay': 0.0006803740547705517, 'dropout': 0.6594690855179323, 'patience': 80, 'lr_reduce_freq': 130, 'spt_alg': 'prim', 'spt_attr': 'similarity', 'manifold': 'PoincareBall', 'num_layers': 3, 'num_adj': 8, 'add_rate': 0.18383674052076995, 'tem': 0.3656525663304746, 'consis_rate': 0.907823889627613, 'use_att': 1}
mean: 0.8012
[0.783 0.809 0.81  0.807 0.8   0.797 0.795 0.801 0.815 0.795]
cur_param: {'lr': 0.011366996056184093, 'weight_decay': 0.0021134148287039346, 'dropout': 0.5447335990580906, 'patience': 100, 'lr_reduce_freq': 110, 'spt_alg': 'kruskal', 'spt_attr': 'similarity', 'manifold': 'PoincareBall', 'num_layers': 4, 'num_adj': 8, 'add_rate': 0.25963694581752805, 'tem': 1.4855519025252921, 'consis_rate': 0.966734670631479, 'use_att': 1}
mean: 0.7481
[0.732 0.707 0.761 0.797 0.744 0.761 0.772 0.733 0.784 0.69 ]
cur_param: {'lr': 0.006935223488940968, 'weight_decay': 0.0014214307531727295, 'dropout': 0.6757121823355761, 'patience': 80, 'lr_reduce_freq': 130, 'spt_alg': 'prim', 'spt_attr': 'similarity', 'manifold': 'PoincareBall', 'num_layers': 3, 'num_adj': 8, 'add_rate': 0.1885056243313567, 'tem': 0.8101543842648276, 'consis_rate': 0.8339034482451579, 'use_att': 1}
mean: 0.7954
[0.797 0.806 0.794 0.791 0.796 0.801 0.771 0.807 0.812 0.779]
cur_param: {'lr': 0.008031047143567635, 'weight_decay': 0.0006753263214101576, 'dropout': 0.5938761153890407, 'patience': 80, 'lr_reduce_freq': 130, 'spt_alg': 'prim', 'spt_attr': 'similarity', 'manifold': 'PoincareBall', 'num_layers': 3, 'num_adj': 8, 'add_rate': 0.10433636512660467, 'tem': 0.9695892291475794, 'consis_rate': 0.9085114961525357, 'use_att': 1}
mean: 0.8019999999999999
[0.79  0.804 0.823 0.782 0.798 0.804 0.798 0.813 0.808 0.8  ]
cur_param: {'lr': 0.0059181487301081, 'weight_decay': 0.38385700069199985, 'dropout': 0.42148374997019544, 'patience': 80, 'lr_reduce_freq': 130, 'spt_alg': 'prim', 'spt_attr': 'similarity', 'manifold': 'PoincareBall', 'num_layers': 3, 'num_adj': 8, 'add_rate': 0.14087869188909166, 'tem': 1.0246662004095113, 'consis_rate': 0.5919241463025846, 'use_att': 1}
mean: 0.30199999999999994
[0.319 0.319 0.319 0.319 0.319 0.319 0.149 0.319 0.319 0.319]
cur_param: {'lr': 0.004625930851572328, 'weight_decay': 0.0007035963616581556, 'dropout': 0.5890654772771674, 'patience': 80, 'lr_reduce_freq': 150, 'spt_alg': 'prim', 'spt_attr': 'similarity', 'manifold': 'PoincareBall', 'num_layers': 3, 'num_adj': 8, 'add_rate': 0.12073102768061506, 'tem': 0.8514353292533836, 'consis_rate': 0.7907903293489404, 'use_att': 1}
mean: 0.8025
[0.793 0.805 0.813 0.8   0.789 0.803 0.805 0.816 0.808 0.793]
cur_param: {'lr': 0.017005223693513028, 'weight_decay': 0.001014460880132257, 'dropout': 0.576357819667718, 'patience': 80, 'lr_reduce_freq': 150, 'spt_alg': 'prim', 'spt_attr': 'similarity', 'manifold': 'PoincareBall', 'num_layers': 3, 'num_adj': 8, 'add_rate': 0.12572288735513298, 'tem': 0.8148318238776251, 'consis_rate': 0.674787522565325, 'use_att': 1}
mean: 0.7899
[0.785 0.798 0.793 0.779 0.798 0.793 0.783 0.793 0.799 0.778]
cur_param: {'lr': 0.009964087502777382, 'weight_decay': 0.000625607445972824, 'dropout': 0.6067828512637352, 'patience': 80, 'lr_reduce_freq': 150, 'spt_alg': 'prim', 'spt_attr': 'similarity', 'manifold': 'PoincareBall', 'num_layers': 3, 'num_adj': 8, 'add_rate': 0.10849108379091528, 'tem': 0.6435380147818106, 'consis_rate': 0.7907268239336187, 'use_att': 1}[32m[I 2022-06-22 19:38:36,339][0m Trial 56 finished with value: 0.8014000000000001 and parameters: {'lr': 0.009964087502777382, 'weight_decay': 0.000625607445972824, 'dropout': 0.6067828512637352, 'patience': 80, 'lr_reduce_freq': 150, 'spt_alg': 'prim', 'spt_attr': 'similarity', 'manifold': 'PoincareBall', 'num_layers': 3, 'num_adj': 8, 'add_rate': 0.10849108379091528, 'tem': 0.6435380147818106, 'consis_rate': 0.7907268239336187, 'use_att': 1}. Best is trial 37 with value: 0.8079000000000001.[0m
[32m[I 2022-06-22 20:12:19,842][0m Trial 57 finished with value: 0.7974 and parameters: {'lr': 0.012583882745318136, 'weight_decay': 0.0005231576864831208, 'dropout': 0.5330175103608213, 'patience': 80, 'lr_reduce_freq': 130, 'spt_alg': 'prim', 'spt_attr': 'similarity', 'manifold': 'PoincareBall', 'num_layers': 3, 'num_adj': 8, 'add_rate': 0.6896718312368395, 'tem': 0.8865564556817456, 'consis_rate': 1.1094691400161505, 'use_att': 1}. Best is trial 37 with value: 0.8079000000000001.[0m
[32m[I 2022-06-22 21:00:39,762][0m Trial 58 finished with value: 0.7676000000000001 and parameters: {'lr': 0.004530946576088389, 'weight_decay': 0.0016072576987585252, 'dropout': 0.7770278066436744, 'patience': 80, 'lr_reduce_freq': 150, 'spt_alg': 'prim', 'spt_attr': 'similarity', 'manifold': 'PoincareBall', 'num_layers': 3, 'num_adj': 8, 'add_rate': 0.1558035879282158, 'tem': 1.1518904979213103, 'consis_rate': 1.202320501028463, 'use_att': 1}. Best is trial 37 with value: 0.8079000000000001.[0m
[32m[I 2022-06-22 21:34:08,967][0m Trial 59 finished with value: 0.8093 and parameters: {'lr': 0.009419718239741318, 'weight_decay': 0.0010296404742399698, 'dropout': 0.47703998829972216, 'patience': 80, 'lr_reduce_freq': 110, 'spt_alg': 'prim', 'spt_attr': 'similarity', 'manifold': 'PoincareBall', 'num_layers': 3, 'num_adj': 8, 'add_rate': 0.4696773122372754, 'tem': 1.0465615237596635, 'consis_rate': 0.8466408048728727, 'use_att': 1}. Best is trial 59 with value: 0.8093.[0m
[32m[I 2022-06-22 22:33:36,473][0m Trial 60 finished with value: 0.7996000000000001 and parameters: {'lr': 0.003713430935375619, 'weight_decay': 0.002376349637920015, 'dropout': 0.46234606245961885, 'patience': 100, 'lr_reduce_freq': 110, 'spt_alg': 'prim', 'spt_attr': 'similarity', 'manifold': 'PoincareBall', 'num_layers': 3, 'num_adj': 8, 'add_rate': 0.5672618727907934, 'tem': 1.3190662225150127, 'consis_rate': 0.7242085455039908, 'use_att': 1}. Best is trial 59 with value: 0.8093.[0m
[32m[I 2022-06-22 23:10:13,458][0m Trial 61 finished with value: 0.8072000000000001 and parameters: {'lr': 0.008208435015223933, 'weight_decay': 0.0010618797869504253, 'dropout': 0.5830944009953712, 'patience': 80, 'lr_reduce_freq': 130, 'spt_alg': 'prim', 'spt_attr': 'similarity', 'manifold': 'PoincareBall', 'num_layers': 3, 'num_adj': 8, 'add_rate': 0.4708305087397131, 'tem': 1.0472614720142854, 'consis_rate': 0.854948839297194, 'use_att': 1}. Best is trial 59 with value: 0.8093.[0m
[32m[I 2022-06-22 23:41:57,913][0m Trial 62 finished with value: 0.8041 and parameters: {'lr': 0.009845919252081487, 'weight_decay': 0.0010304748422084382, 'dropout': 0.5037333649714245, 'patience': 80, 'lr_reduce_freq': 110, 'spt_alg': 'prim', 'spt_attr': 'similarity', 'manifold': 'PoincareBall', 'num_layers': 3, 'num_adj': 8, 'add_rate': 0.4624083863333831, 'tem': 1.118828404424911, 'consis_rate': 0.8531506295852918, 'use_att': 1}. Best is trial 59 with value: 0.8093.[0m
[32m[I 2022-06-23 00:13:22,344][0m Trial 63 finished with value: 0.8036999999999999 and parameters: {'lr': 0.014168006366868272, 'weight_decay': 0.0010175913236684414, 'dropout': 0.5111973311671709, 'patience': 80, 'lr_reduce_freq': 110, 'spt_alg': 'prim', 'spt_attr': 'similarity', 'manifold': 'PoincareBall', 'num_layers': 3, 'num_adj': 8, 'add_rate': 0.45841531098843524, 'tem': 1.126160407926572, 'consis_rate': 0.8281248238806899, 'use_att': 1}. Best is trial 59 with value: 0.8093.[0m
[32m[I 2022-06-23 00:48:19,493][0m Trial 64 finished with value: 0.7889 and parameters: {'lr': 0.014724113958613096, 'weight_decay': 0.0031362256629822124, 'dropout': 0.4969561371996899, 'patience': 80, 'lr_reduce_freq': 110, 'spt_alg': 'prim', 'spt_attr': 'similarity', 'manifold': 'PoincareBall', 'num_layers': 3, 'num_adj': 8, 'add_rate': 0.4669552206785938, 'tem': 1.115954430740332, 'consis_rate': 0.8352826390120314, 'use_att': 1}. Best is trial 59 with value: 0.8093.[0m
[32m[I 2022-06-23 01:16:43,853][0m Trial 65 finished with value: 0.7889000000000002 and parameters: {'lr': 0.022396940255595427, 'weight_decay': 0.0010288795527745426, 'dropout': 0.39984418800413946, 'patience': 80, 'lr_reduce_freq': 110, 'spt_alg': 'prim', 'spt_attr': 'similarity', 'manifold': 'PoincareBall', 'num_layers': 3, 'num_adj': 8, 'add_rate': 0.5088843989081716, 'tem': 0.7455153257929337, 'consis_rate': 0.5971602532110645, 'use_att': 1}. Best is trial 59 with value: 0.8093.[0m
[32m[I 2022-06-23 01:25:08,137][0m Trial 66 finished with value: 0.7907 and parameters: {'lr': 0.009354163937618322, 'weight_decay': 0.0017226083794501233, 'dropout': 0.5217890645817058, 'patience': 80, 'lr_reduce_freq': 110, 'spt_alg': 'prim', 'spt_attr': 'similarity', 'manifold': 'PoincareBall', 'num_layers': 3, 'num_adj': 8, 'add_rate': 0.44775246885119335, 'tem': 1.07075872287294, 'consis_rate': 0.4886039244641238, 'use_att': 0}. Best is trial 59 with value: 0.8093.[0m
[32m[I 2022-06-23 01:56:14,406][0m Trial 67 finished with value: 0.7873 and parameters: {'lr': 0.01629627196894693, 'weight_decay': 0.0014576777278781285, 'dropout': 0.6447748754040955, 'patience': 80, 'lr_reduce_freq': 110, 'spt_alg': 'prim', 'spt_attr': 'similarity', 'manifold': 'PoincareBall', 'num_layers': 3, 'num_adj': 8, 'add_rate': 0.35233891314349686, 'tem': 1.2093196774462245, 'consis_rate': 0.7969446527642825, 'use_att': 1}. Best is trial 59 with value: 0.8093.[0m
[32m[I 2022-06-23 02:28:10,060][0m Trial 68 finished with value: 0.8056999999999999 and parameters: {'lr': 0.01337646177084316, 'weight_decay': 0.0008732704846403323, 'dropout': 0.5560453669075858, 'patience': 80, 'lr_reduce_freq': 110, 'spt_alg': 'prim', 'spt_attr': 'similarity', 'manifold': 'PoincareBall', 'num_layers': 3, 'num_adj': 8, 'add_rate': 0.47288229716472957, 'tem': 0.9083747197494781, 'consis_rate': 0.6666295716679685, 'use_att': 1}. Best is trial 59 with value: 0.8093.[0m
[32m[I 2022-06-23 03:17:41,294][0m Trial 69 finished with value: 0.6231 and parameters: {'lr': 0.01303687163752585, 'weight_decay': 0.005949135037586389, 'dropout': 0.5582524814681066, 'patience': 80, 'lr_reduce_freq': 110, 'spt_alg': 'kruskal', 'spt_attr': 'similarity', 'manifold': 'PoincareBall', 'num_layers': 3, 'num_adj': 8, 'add_rate': 0.47312187435491115, 'tem': 0.9375874025436886, 'consis_rate': 0.5297745032220048, 'use_att': 1}. Best is trial 59 with value: 0.8093.[0m
[32m[I 2022-06-23 03:20:30,153][0m Trial 70 finished with value: 0.7369 and parameters: {'lr': 0.029479733752762697, 'weight_decay': 0.0009078139219415001, 'dropout': 0.35197338396471106, 'patience': 80, 'lr_reduce_freq': 110, 'spt_alg': 'prim', 'spt_attr': 'similarity', 'manifold': 'PoincareBall', 'num_layers': 4, 'num_adj': 2, 'add_rate': 0.5257906489594657, 'tem': 0.9907825242547162, 'consis_rate': 0.3459676115961109, 'use_att': 0}. Best is trial 59 with value: 0.8093.[0m
[32m[I 2022-06-23 03:49:26,330][0m Trial 71 finished with value: 0.8004000000000001 and parameters: {'lr': 0.02146232510643234, 'weight_decay': 0.0010885883878836338, 'dropout': 0.4841945484914652, 'patience': 80, 'lr_reduce_freq': 110, 'spt_alg': 'prim', 'spt_attr': 'similarity', 'manifold': 'PoincareBall', 'num_layers': 3, 'num_adj': 8, 'add_rate': 0.41187668415524736, 'tem': 0.877949951212003, 'consis_rate': 0.6806643937658764, 'use_att': 1}. Best is trial 59 with value: 0.8093.[0m
[32m[I 2022-06-23 04:18:51,078][0m Trial 72 finished with value: 0.7979 and parameters: {'lr': 0.01891491816801931, 'weight_decay': 0.0008606501205285837, 'dropout': 0.5479469715192965, 'patience': 80, 'lr_reduce_freq': 110, 'spt_alg': 'prim', 'spt_attr': 'similarity', 'manifold': 'PoincareBall', 'num_layers': 3, 'num_adj': 8, 'add_rate': 0.43602093711969764, 'tem': 0.8268878857276164, 'consis_rate': 0.7410541373387526, 'use_att': 1}. Best is trial 59 with value: 0.8093.[0m
[32m[I 2022-06-23 04:57:12,985][0m Trial 73 finished with value: 0.8051999999999999 and parameters: {'lr': 0.008266565124096648, 'weight_decay': 0.001828216725292792, 'dropout': 0.5152490977567488, 'patience': 80, 'lr_reduce_freq': 110, 'spt_alg': 'prim', 'spt_attr': 'similarity', 'manifold': 'PoincareBall', 'num_layers': 3, 'num_adj': 8, 'add_rate': 0.3824463557823234, 'tem': 0.5224154976067064, 'consis_rate': 0.6449061463841032, 'use_att': 1}. Best is trial 59 with value: 0.8093.[0m
