[32m[I 2022-06-23 15:43:26,941][0m Trial 93 finished with value: 0.8006 and parameters: {'lr': 0.010085683659510462, 'weight_decay': 0.0021765679603115173, 'dropout': 0.5041474682154536, 'patience': 80, 'lr_reduce_freq': 110, 'spt_alg': 'prim', 'spt_attr': 'similarity', 'manifold': 'PoincareBall', 'num_layers': 3, 'num_adj': 8, 'add_rate': 0.48175991825245756, 'tem': 0.9293350601353019, 'consis_rate': 0.7141489597533431, 'use_att': 1}. Best is trial 59 with value: 0.8093.[0m

mean: 0.8009000000000001
[0.783 0.81  0.8   0.804 0.788 0.802 0.787 0.818 0.811 0.806]
cur_param: {'lr': 0.00666508143433343, 'weight_decay': 0.002530742132242524, 'dropout': 0.4792757984096671, 'patience': 100, 'lr_reduce_freq': 110, 'spt_alg': 'prim', 'spt_attr': 'similarity', 'manifold': 'PoincareBall', 'num_layers': 3, 'num_adj': 8, 'add_rate': 0.36555763868753927, 'tem': 0.726576186622859, 'consis_rate': 0.6346211629675652, 'use_att': 1}
mean: 0.8027000000000001
[0.788 0.803 0.805 0.797 0.8   0.816 0.796 0.815 0.814 0.793]
cur_param: {'lr': 0.010456737500982133, 'weight_decay': 0.025906138464604076, 'dropout': 0.2893462848316758, 'patience': 80, 'lr_reduce_freq': 110, 'spt_alg': 'prim', 'spt_attr': 'similarity', 'manifold': 'PoincareBall', 'num_layers': 3, 'num_adj': 8, 'add_rate': 0.33624157707579155, 'tem': 0.31735130529096056, 'consis_rate': 0.3878421773740687, 'use_att': 1}
mean: 0.2877
[0.319 0.319 0.319 0.319 0.149 0.319 0.177 0.319 0.318 0.319]
cur_param: {'lr': 0.012205855844204805, 'weight_decay': 0.0031970735944417197, 'dropout': 0.5221100709014821, 'patience': 80, 'lr_reduce_freq': 90, 'spt_alg': 'prim', 'spt_attr': 'similarity', 'manifold': 'PoincareBall', 'num_layers': 3, 'num_adj': 6, 'add_rate': 0.3979748530996847, 'tem': 0.5502434103280149, 'consis_rate': 0.5326960225153485, 'use_att': 1}
mean: 0.7917000000000001
[0.788 0.751 0.802 0.806 0.778 0.8   0.809 0.786 0.799 0.798]
cur_param: {'lr': 0.007688761130801128, 'weight_decay': 0.0013945223742026051, 'dropout': 0.6286971410710239, 'patience': 80, 'lr_reduce_freq': 110, 'spt_alg': 'prim', 'spt_attr': 'similarity', 'manifold': 'PoincareBall', 'num_layers': 3, 'num_adj': 8, 'add_rate': 0.4856825776588931, 'tem': 0.4229211193916381, 'consis_rate': 0.7030645606708746, 'use_att': 1}
mean: 0.7991000000000001
[0.79  0.793 0.789 0.813 0.803 0.805 0.799 0.807 0.809 0.783]
cur_param: {'lr': 0.08102391338559753, 'weight_decay': 0.0008204651525042814, 'dropout': 0.5616607979501543, 'patience': 100, 'lr_reduce_freq': 110, 'spt_alg': 'kruskal', 'spt_attr': 'similarity', 'manifold': 'PoincareBall', 'num_layers': 3, 'num_adj': 8, 'add_rate': 0.2973351081716794, 'tem': 0.5793740582057271, 'consis_rate': 1.065217671917375, 'use_att': 1}
mean: 0.7337
[0.612 0.734 0.737 0.742 0.764 0.756 0.777 0.804 0.79  0.621]
cur_param: {'lr': 0.014441100012707023, 'weight_decay': 0.0011592737170604314, 'dropout': 0.5126359685558962, 'patience': 80, 'lr_reduce_freq': 110, 'spt_alg': 'prim', 'spt_attr': 'similarity', 'manifold': 'PoincareBall', 'num_layers': 3, 'num_adj': 8, 'add_rate': 0.4538894607779374, 'tem': 1.1669466824056107, 'consis_rate': 0.7648542925412227, 'use_att': 1}
mean: 0.8029
[0.81  0.806 0.808 0.8   0.798 0.809 0.8   0.815 0.787 0.796]
cur_param: {'lr': 0.009442446111864677, 'weight_decay': 0.0019271713159200769, 'dropout': 0.4699268994778621, 'patience': 80, 'lr_reduce_freq': 110, 'spt_alg': 'prim', 'spt_attr': 'similarity', 'manifold': 'PoincareBall', 'num_layers': 3, 'num_adj': 8, 'add_rate': 0.5114069876069269, 'tem': 1.072104235633518, 'consis_rate': 0.8355163819503749, 'use_att': 1}
mean: 0.7973000000000001
[0.787 0.804 0.792 0.793 0.797 0.802 0.789 0.811 0.799 0.799]
cur_param: {'lr': 0.014097372019285515, 'weight_decay': 0.0013139014395172842, 'dropout': 0.4279675378251752, 'patience': 80, 'lr_reduce_freq': 110, 'spt_alg': 'prim', 'spt_attr': 'similarity', 'manifold': 'PoincareBall', 'num_layers': 3, 'num_adj': 8, 'add_rate': 0.42799033648447177, 'tem': 0.6686120395924434, 'consis_rate': 0.9537428140726214, 'use_att': 1}
mean: 0.7937000000000001
[0.775 0.813 0.788 0.801 0.795 0.815 0.789 0.789 0.796 0.776]
cur_param: {'lr': 0.010468183065380181, 'weight_decay': 0.0009829636794570294, 'dropout': 0.5058965427165822, 'patience': 80, 'lr_reduce_freq': 90, 'spt_alg': 'prim', 'spt_attr': 'similarity', 'manifold': 'PoincareBall', 'num_layers': 3, 'num_adj': 8, 'add_rate': 0.39804764066253806, 'tem': 1.3283707642849585, 'consis_rate': 0.8469328608355264, 'use_att': 1}
mean: 0.8074999999999999
[0.789 0.804 0.823 0.798 0.818 0.821 0.802 0.81  0.819 0.791]
cur_param: {'lr': 0.006967246412573057, 'weight_decay': 0.009507610268890201, 'dropout': 0.5422955735835704, 'patience': 80, 'lr_reduce_freq': 90, 'spt_alg': 'prim', 'spt_attr': 'similarity', 'manifold': 'PoincareBall', 'num_layers': 3, 'num_adj': 8, 'add_rate': 0.3766646590890446, 'tem': 1.3021982023957543, 'consis_rate': 1.0189632394963013, 'use_att': 1}
mean: 0.3436
[0.227 0.339 0.362 0.429 0.442 0.144 0.433 0.319 0.319 0.422]
cur_param: {'lr': 0.010435845147482138, 'weight_decay': 0.0015517101559554686, 'dropout': 0.580954391857969, 'patience': 80, 'lr_reduce_freq': 90, 'spt_alg': 'prim', 'spt_attr': 'similarity', 'manifold': 'PoincareBall', 'num_layers': 4, 'num_adj': 6, 'add_rate': 0.35035237646952505, 'tem': 1.3773059533835816, 'consis_rate': 0.8746688270583025, 'use_att': 0}
mean: 0.7337999999999999
[0.748 0.718 0.716 0.77  0.699 0.745 0.741 0.737 0.762 0.702]
cur_param: {'lr': 0.008002425424497965, 'weight_decay': 0.03381637982808799, 'dropout': 0.3949095140417679, 'patience': 80, 'lr_reduce_freq': 90, 'spt_alg': 'prim', 'spt_attr': 'similarity', 'manifold': 'PoincareBall', 'num_layers': 3, 'num_adj': 8, 'add_rate': 0.4039242090352602, 'tem': 1.0301075411213887, 'consis_rate': 0.21135398253628024, 'use_att': 1}
mean: 0.2849
[0.319 0.319 0.319 0.149 0.149 0.319 0.319 0.319 0.318 0.319]
cur_param: {'lr': 0.006361761372846269, 'weight_decay': 0.0008220709409324016, 'dropout': 0.4391319874878082, 'patience': 80, 'lr_reduce_freq': 90, 'spt_alg': 'prim', 'spt_attr': 'similarity', 'manifold': 'PoincareBall', 'num_layers': 3, 'num_adj': 8, 'add_rate': 0.551877026681732, 'tem': 1.216051662219387, 'consis_rate': 0.6278802033312111, 'use_att': 1}
mean: 0.8034000000000001
[0.798 0.805 0.805 0.804 0.79  0.814 0.806 0.805 0.817 0.79 ]
cur_param: {'lr': 0.008352229082548443, 'weight_decay': 0.0006002762061933611, 'dropout': 0.33254722422067373, 'patience': 80, 'lr_reduce_freq': 70, 'spt_alg': 'prim', 'spt_attr': 'similarity', 'manifold': 'PoincareBall', 'num_layers': 3, 'num_adj': 4, 'add_rate': 0.42571579120148945, 'tem': 0.504849442522971, 'consis_rate': 0.9488424021545748, 'use_att': 1}
mean: 0.8009000000000001
[0.788 0.805 0.803 0.802 0.819 0.787 0.794 0.792 0.821 0.798]
cur_param: {'lr': 0.005538157481927824, 'weight_decay': 0.0011844149909259545, 'dropout': 0.6556360344524459, 'patience': 80, 'lr_reduce_freq': 130, 'spt_alg': 'prim', 'spt_attr': 'similarity', 'manifold': 'PoincareBall', 'num_layers': 3, 'num_adj': 8, 'add_rate': 0.32064839822406765, 'tem': 0.4423795318089129, 'consis_rate': 0.5633281566593784, 'use_att': 1}
mean: 0.8015000000000001
[0.782 0.8   0.807 0.795 0.802 0.799 0.797 0.811 0.829 0.793]
cur_param: {'lr': 0.012131165044088076, 'weight_decay': 0.0009714995609821532, 'dropout': 0.4576044460382433, 'patience': 80, 'lr_reduce_freq': 110, 'spt_alg': 'prim', 'spt_attr': 'similarity', 'manifold': 'PoincareBall', 'num_layers': 3, 'num_adj': 8, 'add_rate': 0.45469613693066646, 'tem': 1.1246842579338492, 'consis_rate': 0.8614201923608693, 'use_att': 1}
mean: 0.7998000000000001
[0.798 0.807 0.795 0.808 0.791 0.817 0.782 0.795 0.815 0.79 ]
cur_param: {'lr': 0.010038362988250607, 'weight_decay': 0.0010539171462615117, 'dropout': 0.4933312065299245, 'patience': 80, 'lr_reduce_freq': 110, 'spt_alg': 'prim', 'spt_attr': 'similarity', 'manifold': 'PoincareBall', 'num_layers': 3, 'num_adj': 8, 'add_rate': 0.4848541432501101, 'tem': 1.0791867852043602, 'consis_rate': 0.7815546840540936, 'use_att': 1}
mean: 0.8037000000000001
[0.8   0.814 0.801 0.791 0.803 0.816 0.8   0.817 0.799 0.796]
cur_param: {'lr': 0.010085683659510462, 'weight_decay': 0.0021765679603115173, 'dropout': 0.5041474682154536, 'patience': 80, 'lr_reduce_freq': 110, 'spt_alg': 'prim', 'spt_attr': 'similarity', 'manifold': 'PoincareBall', 'num_layers': 3, 'num_adj': 8, 'add_rate': 0.48175991825245756, 'tem': 0.9293350601353019, 'consis_rate': 0.7141489597533431, 'use_att': 1}
mean: 0.8006
[0.794 0.806 0.797 0.801 0.783 0.808 0.788 0.799 0.813 0.817]
cur_param: {'lr': 0.016450968794454256, 'weight_decay': 0.0007809547071942034, 'dropout': 0.5468528344977657, 'patience': 80, 'lr_reduce_freq': 130, 'spt_alg': 'prim', 'spt_attr': 'similarity', 'manifold': 'PoincareBall', 'num_layers': 3, 'num_adj': 8, 'add_rate': 0.9119331183970483, 'tem': 0.9929081357290606, 'consis_rate': 0.7803122684395641, 'use_att': 1}[32m[I 2022-06-23 16:20:10,262][0m Trial 94 finished with value: 0.8026 and parameters: {'lr': 0.016450968794454256, 'weight_decay': 0.0007809547071942034, 'dropout': 0.5468528344977657, 'patience': 80, 'lr_reduce_freq': 130, 'spt_alg': 'prim', 'spt_attr': 'similarity', 'manifold': 'PoincareBall', 'num_layers': 3, 'num_adj': 8, 'add_rate': 0.9119331183970483, 'tem': 0.9929081357290606, 'consis_rate': 0.7803122684395641, 'use_att': 1}. Best is trial 59 with value: 0.8093.[0m
[32m[I 2022-06-23 16:52:31,035][0m Trial 95 finished with value: 0.8004 and parameters: {'lr': 0.011779623025852072, 'weight_decay': 0.0012533095284006064, 'dropout': 0.5720895705196701, 'patience': 80, 'lr_reduce_freq': 110, 'spt_alg': 'prim', 'spt_attr': 'edge_degree', 'manifold': 'PoincareBall', 'num_layers': 3, 'num_adj': 8, 'add_rate': 0.5061216852879892, 'tem': 0.7607955113731568, 'consis_rate': 0.6660059609630905, 'use_att': 1}. Best is trial 59 with value: 0.8093.[0m
[32m[I 2022-06-23 17:27:49,419][0m Trial 96 finished with value: 0.8022 and parameters: {'lr': 0.008619745223312832, 'weight_decay': 0.0005775420393276047, 'dropout': 0.5975332888072138, 'patience': 80, 'lr_reduce_freq': 90, 'spt_alg': 'prim', 'spt_attr': 'similarity', 'manifold': 'PoincareBall', 'num_layers': 3, 'num_adj': 8, 'add_rate': 0.39417996186093035, 'tem': 1.2573084633809575, 'consis_rate': 0.9254461687194839, 'use_att': 1}. Best is trial 59 with value: 0.8093.[0m
[32m[I 2022-06-23 18:09:00,912][0m Trial 97 finished with value: 0.8023 and parameters: {'lr': 0.0073050631672304965, 'weight_decay': 0.0015071047844427657, 'dropout': 0.47841358049409, 'patience': 80, 'lr_reduce_freq': 130, 'spt_alg': 'kruskal', 'spt_attr': 'similarity', 'manifold': 'PoincareBall', 'num_layers': 3, 'num_adj': 8, 'add_rate': 0.5851061309321575, 'tem': 1.0467807861439555, 'consis_rate': 1.1322793446012893, 'use_att': 1}. Best is trial 59 with value: 0.8093.[0m
[32m[I 2022-06-23 18:51:19,002][0m Trial 98 finished with value: 0.7935000000000001 and parameters: {'lr': 0.009034377677680058, 'weight_decay': 0.0035675032148440944, 'dropout': 0.4971497974094388, 'patience': 80, 'lr_reduce_freq': 110, 'spt_alg': 'prim', 'spt_attr': 'similarity', 'manifold': 'PoincareBall', 'num_layers': 3, 'num_adj': 8, 'add_rate': 0.37721506487569456, 'tem': 0.967586265005897, 'consis_rate': 0.9844198845136053, 'use_att': 1}. Best is trial 59 with value: 0.8093.[0m
[32m[I 2022-06-23 19:47:28,834][0m Trial 99 finished with value: 0.7703000000000001 and parameters: {'lr': 0.010709677572687612, 'weight_decay': 0.00078244918809816, 'dropout': 0.5265902515690994, 'patience': 100, 'lr_reduce_freq': 110, 'spt_alg': 'prim', 'spt_attr': 'edge_degree', 'manifold': 'PoincareBall', 'num_layers': 4, 'num_adj': 8, 'add_rate': 0.425089483655259, 'tem': 1.1660972192012384, 'consis_rate': 0.7406990078842662, 'use_att': 1}. Best is trial 59 with value: 0.8093.[0m
[32m[I 2022-06-23 19:54:54,455][0m Trial 100 finished with value: 0.7972 and parameters: {'lr': 0.00486150071725394, 'weight_decay': 0.001805740288564499, 'dropout': 0.6265767206437852, 'patience': 80, 'lr_reduce_freq': 130, 'spt_alg': 'prim', 'spt_attr': 'similarity', 'manifold': 'PoincareBall', 'num_layers': 3, 'num_adj': 6, 'add_rate': 0.5476129091515316, 'tem': 1.4172268200809117, 'consis_rate': 0.812599908471419, 'use_att': 0}. Best is trial 59 with value: 0.8093.[0m
[32m[I 2022-06-23 20:26:05,392][0m Trial 101 finished with value: 0.7983 and parameters: {'lr': 0.013201000293817784, 'weight_decay': 0.0010319041022372412, 'dropout': 0.5084514594698377, 'patience': 80, 'lr_reduce_freq': 110, 'spt_alg': 'prim', 'spt_attr': 'similarity', 'manifold': 'PoincareBall', 'num_layers': 3, 'num_adj': 8, 'add_rate': 0.4672926596199145, 'tem': 1.1075553015595319, 'consis_rate': 0.8612372999517975, 'use_att': 1}. Best is trial 59 with value: 0.8093.[0m
[32m[I 2022-06-23 20:54:29,885][0m Trial 102 finished with value: 0.7979 and parameters: {'lr': 0.018777600408457645, 'weight_decay': 0.0009720411236464571, 'dropout': 0.4493640571543743, 'patience': 80, 'lr_reduce_freq': 110, 'spt_alg': 'prim', 'spt_attr': 'similarity', 'manifold': 'PoincareBall', 'num_layers': 3, 'num_adj': 8, 'add_rate': 0.44249735660992245, 'tem': 1.334324929273793, 'consis_rate': 0.6117143801209731, 'use_att': 1}. Best is trial 59 with value: 0.8093.[0m
[32m[I 2022-06-23 21:27:05,576][0m Trial 103 finished with value: 0.7956 and parameters: {'lr': 0.015020569104627164, 'weight_decay': 0.0011291826268774354, 'dropout': 0.4172871425939436, 'patience': 80, 'lr_reduce_freq': 110, 'spt_alg': 'prim', 'spt_attr': 'similarity', 'manifold': 'PoincareBall', 'num_layers': 3, 'num_adj': 8, 'add_rate': 0.4835963055628279, 'tem': 1.5166685405903961, 'consis_rate': 0.706730895088133, 'use_att': 1}. Best is trial 59 with value: 0.8093.[0m
[32m[I 2022-06-23 22:02:38,021][0m Trial 104 finished with value: 0.808 and parameters: {'lr': 0.009512909408952127, 'weight_decay': 0.000932663032377796, 'dropout': 0.533937145188328, 'patience': 80, 'lr_reduce_freq': 110, 'spt_alg': 'prim', 'spt_attr': 'similarity', 'manifold': 'PoincareBall', 'num_layers': 3, 'num_adj': 8, 'add_rate': 0.33949987411123356, 'tem': 1.083976816763157, 'consis_rate': 1.0600427561602324, 'use_att': 1}. Best is trial 59 with value: 0.8093.[0m
[32m[I 2022-06-23 22:33:07,929][0m Trial 105 finished with value: 0.8058 and parameters: {'lr': 0.009797655259501848, 'weight_decay': 0.0007456654225311711, 'dropout': 0.5567844622068866, 'patience': 80, 'lr_reduce_freq': 110, 'spt_alg': 'prim', 'spt_attr': 'similarity', 'manifold': 'PoincareBall', 'num_layers': 3, 'num_adj': 8, 'add_rate': 0.3367925786435412, 'tem': 1.077554871388436, 'consis_rate': 1.0539046732356976, 'use_att': 1}. Best is trial 59 with value: 0.8093.[0m
[32m[I 2022-06-23 23:06:51,669][0m Trial 106 finished with value: 0.7999 and parameters: {'lr': 0.007509551449211471, 'weight_decay': 0.0006084790554380996, 'dropout': 0.5701300629932367, 'patience': 80, 'lr_reduce_freq': 90, 'spt_alg': 'prim', 'spt_attr': 'similarity', 'manifold': 'PoincareBall', 'num_layers': 3, 'num_adj': 8, 'add_rate': 0.2790113208117188, 'tem': 1.9265362527107852, 'consis_rate': 1.235268828382493, 'use_att': 1}. Best is trial 59 with value: 0.8093.[0m
[32m[I 2022-06-23 23:45:15,356][0m Trial 107 finished with value: 0.8055 and parameters: {'lr': 0.006101781070708168, 'weight_decay': 0.0007312066042297181, 'dropout': 0.5311823448546327, 'patience': 80, 'lr_reduce_freq': 110, 'spt_alg': 'prim', 'spt_attr': 'similarity', 'manifold': 'PoincareBall', 'num_layers': 3, 'num_adj': 8, 'add_rate': 0.3396381467220173, 'tem': 1.206900342681012, 'consis_rate': 1.0844029781010822, 'use_att': 1}. Best is trial 59 with value: 0.8093.[0m
[32m[I 2022-06-24 00:09:43,515][0m Trial 108 finished with value: 0.7978000000000001 and parameters: {'lr': 0.006158854091726424, 'weight_decay': 0.0005046659662897539, 'dropout': 0.5960563021481382, 'patience': 60, 'lr_reduce_freq': 130, 'spt_alg': 'prim', 'spt_attr': 'edge_degree', 'manifold': 'PoincareBall', 'num_layers': 3, 'num_adj': 8, 'add_rate': 0.2428020427277165, 'tem': 1.1944949653960566, 'consis_rate': 1.0703029001808606, 'use_att': 1}. Best is trial 59 with value: 0.8093.[0m
[32m[I 2022-06-24 00:50:01,962][0m Trial 109 finished with value: 0.8023 and parameters: {'lr': 0.005337642084489124, 'weight_decay': 0.000772211550967217, 'dropout': 0.5326669052377128, 'patience': 80, 'lr_reduce_freq': 50, 'spt_alg': 'prim', 'spt_attr': 'similarity', 'manifold': 'PoincareBall', 'num_layers': 3, 'num_adj': 8, 'add_rate': 0.33663388558322854, 'tem': 0.6152695262210217, 'consis_rate': 1.1518984445965188, 'use_att': 1}. Best is trial 59 with value: 0.8093.[0m
[32m[I 2022-06-24 01:26:26,233][0m Trial 110 finished with value: 0.8056000000000001 and parameters: {'lr': 0.006894405239333222, 'weight_decay': 0.0008693466934143548, 'dropout': 0.5562303709228391, 'patience': 80, 'lr_reduce_freq': 110, 'spt_alg': 'prim', 'spt_attr': 'similarity', 'manifold': 'PoincareBall', 'num_layers': 3, 'num_adj': 8, 'add_rate': 0.29224817884496324, 'tem': 1.230452560861948, 'consis_rate': 1.0347145320258482, 'use_att': 1}. Best is trial 59 with value: 0.8093.[0m
[32m[I 2022-06-24 02:01:53,626][0m Trial 111 finished with value: 0.8083 and parameters: {'lr': 0.00691273786052701, 'weight_decay': 0.000664056704989154, 'dropout': 0.5610903857388554, 'patience': 80, 'lr_reduce_freq': 110, 'spt_alg': 'prim', 'spt_attr': 'similarity', 'manifold': 'PoincareBall', 'num_layers': 3, 'num_adj': 8, 'add_rate': 0.3038254435744214, 'tem': 1.2349564462221032, 'consis_rate': 1.0241411075897047, 'use_att': 1}. Best is trial 59 with value: 0.8093.[0m
