[32m[I 2022-06-22 17:17:11,247][0m Trial 74 finished with value: 0.8090999999999999 and parameters: {'lr': 0.001120497559358418, 'weight_decay': 0.0013509706474177513, 'dropout': 0.6379641368593179, 'patience': 60, 'lr_reduce_freq': 150, 'spt_alg': 'kruskal', 'spt_attr': 'edge_degree', 'manifold': 'PoincareBall', 'num_layers': 3, 'num_adj': 6, 'add_rate': 0.3465616547247786, 'tem': 0.8206184714516596, 'consis_rate': 1.367672518748498, 'use_att': 1}. Best is trial 63 with value: 0.813.[0m

mean: 0.7979
[0.815 0.796 0.787 0.797 0.793 0.801 0.807 0.797 0.793 0.793]
cur_param: {'lr': 0.0018048411339712416, 'weight_decay': 0.0007040198927668477, 'dropout': 0.38527219686663944, 'patience': 80, 'lr_reduce_freq': 150, 'spt_alg': 'kruskal', 'spt_attr': 'edge_degree', 'manifold': 'PoincareBall', 'num_layers': 3, 'num_adj': 4, 'add_rate': 0.5239581147724958, 'tem': 0.685215166264278, 'consis_rate': 1.316083327293012, 'use_att': 1}
mean: 0.8074
[0.806 0.797 0.794 0.806 0.808 0.825 0.806 0.816 0.803 0.813]
cur_param: {'lr': 0.0018021043836761361, 'weight_decay': 0.0006777978519146874, 'dropout': 0.5596689702790938, 'patience': 60, 'lr_reduce_freq': 150, 'spt_alg': 'kruskal', 'spt_attr': 'edge_degree', 'manifold': 'PoincareBall', 'num_layers': 3, 'num_adj': 4, 'add_rate': 0.28859182047185294, 'tem': 0.6730393214023828, 'consis_rate': 1.3147255180171555, 'use_att': 1}
mean: 0.8089999999999999
[0.807 0.812 0.798 0.815 0.801 0.82  0.816 0.812 0.805 0.804]
cur_param: {'lr': 0.0035944305957128324, 'weight_decay': 0.0006907883061864193, 'dropout': 0.5420299981158276, 'patience': 60, 'lr_reduce_freq': 150, 'spt_alg': 'kruskal', 'spt_attr': 'edge_degree', 'manifold': 'PoincareBall', 'num_layers': 3, 'num_adj': 4, 'add_rate': 0.28744992288176596, 'tem': 0.6948939495774974, 'consis_rate': 1.212821905026362, 'use_att': 1}
mean: 0.8091000000000002
[0.807 0.808 0.8   0.804 0.799 0.81  0.817 0.824 0.812 0.81 ]
cur_param: {'lr': 0.002750518232146187, 'weight_decay': 0.0006941561275453586, 'dropout': 0.5523980343075855, 'patience': 60, 'lr_reduce_freq': 150, 'spt_alg': 'kruskal', 'spt_attr': 'edge_degree', 'manifold': 'PoincareBall', 'num_layers': 3, 'num_adj': 4, 'add_rate': 0.2921809540271273, 'tem': 0.6740305477500558, 'consis_rate': 1.3240240349124213, 'use_att': 1}
mean: 0.8072000000000001
[0.799 0.802 0.807 0.798 0.803 0.825 0.809 0.807 0.806 0.816]
cur_param: {'lr': 0.002835345183665568, 'weight_decay': 0.0006940212125114623, 'dropout': 0.5734161176909578, 'patience': 60, 'lr_reduce_freq': 150, 'spt_alg': 'kruskal', 'spt_attr': 'edge_degree', 'manifold': 'PoincareBall', 'num_layers': 3, 'num_adj': 4, 'add_rate': 0.2745515935054119, 'tem': 0.6536390665532785, 'consis_rate': 1.3245205265078805, 'use_att': 1}
mean: 0.8073
[0.808 0.803 0.802 0.821 0.799 0.816 0.798 0.819 0.802 0.805]
cur_param: {'lr': 0.0037581878569474592, 'weight_decay': 0.0006347332078781212, 'dropout': 0.5784587411616325, 'patience': 60, 'lr_reduce_freq': 130, 'spt_alg': 'kruskal', 'spt_attr': 'edge_degree', 'manifold': 'PoincareBall', 'num_layers': 3, 'num_adj': 4, 'add_rate': 0.20897417861864687, 'tem': 0.6181613804014794, 'consis_rate': 1.232013227902637, 'use_att': 1}
mean: 0.8054
[0.801 0.811 0.801 0.816 0.787 0.804 0.804 0.82  0.806 0.804]
cur_param: {'lr': 0.0022543927901253345, 'weight_decay': 0.0010810090558702214, 'dropout': 0.5309381974229802, 'patience': 60, 'lr_reduce_freq': 150, 'spt_alg': 'kruskal', 'spt_attr': 'edge_degree', 'manifold': 'PoincareBall', 'num_layers': 3, 'num_adj': 4, 'add_rate': 0.24045091907251886, 'tem': 0.7540093987008135, 'consis_rate': 1.4475500966730512, 'use_att': 1}
mean: 0.813
[0.813 0.806 0.79  0.822 0.806 0.816 0.819 0.824 0.821 0.813]
cur_param: {'lr': 0.0022526888058902075, 'weight_decay': 0.0010648372023692987, 'dropout': 0.4831580963487338, 'patience': 60, 'lr_reduce_freq': 150, 'spt_alg': 'kruskal', 'spt_attr': 'edge_degree', 'manifold': 'PoincareBall', 'num_layers': 3, 'num_adj': 4, 'add_rate': 0.16863971368402686, 'tem': 0.7778630547475951, 'consis_rate': 1.1642933026909856, 'use_att': 1}
mean: 0.8055000000000001
[0.808 0.788 0.807 0.814 0.8   0.812 0.804 0.805 0.81  0.807]
cur_param: {'lr': 0.0016112251336289382, 'weight_decay': 0.000957480957243914, 'dropout': 0.5139585133324305, 'patience': 60, 'lr_reduce_freq': 130, 'spt_alg': 'kruskal', 'spt_attr': 'edge_degree', 'manifold': 'PoincareBall', 'num_layers': 3, 'num_adj': 4, 'add_rate': 0.2298130012276062, 'tem': 0.7283170157918534, 'consis_rate': 1.4705257126522495, 'use_att': 1}
mean: 0.808
[0.803 0.805 0.808 0.804 0.811 0.811 0.811 0.804 0.813 0.81 ]
cur_param: {'lr': 0.0015097559523594344, 'weight_decay': 0.0010070686270581496, 'dropout': 0.5168527115170614, 'patience': 60, 'lr_reduce_freq': 130, 'spt_alg': 'kruskal', 'spt_attr': 'edge_degree', 'manifold': 'PoincareBall', 'num_layers': 3, 'num_adj': 4, 'add_rate': 0.2398534318505272, 'tem': 0.751091759866242, 'consis_rate': 1.4102104724912956, 'use_att': 1}
mean: 0.8051
[0.81  0.787 0.796 0.809 0.807 0.808 0.818 0.81  0.804 0.802]
cur_param: {'lr': 0.0025081817219023746, 'weight_decay': 0.0015432101525565912, 'dropout': 0.6486831238128201, 'patience': 60, 'lr_reduce_freq': 130, 'spt_alg': 'kruskal', 'spt_attr': 'edge_degree', 'manifold': 'PoincareBall', 'num_layers': 3, 'num_adj': 2, 'add_rate': 0.22230830502069365, 'tem': 0.5247083309039989, 'consis_rate': 1.4447235678522912, 'use_att': 1}
mean: 0.8089000000000001
[0.805 0.784 0.792 0.829 0.807 0.809 0.825 0.82  0.809 0.809]
cur_param: {'lr': 0.004925324784502726, 'weight_decay': 0.0015695215414872493, 'dropout': 0.7213987675415199, 'patience': 60, 'lr_reduce_freq': 130, 'spt_alg': 'kruskal', 'spt_attr': 'edge_degree', 'manifold': 'PoincareBall', 'num_layers': 4, 'num_adj': 2, 'add_rate': 0.3329616421255222, 'tem': 0.5279919538770468, 'consis_rate': 1.5820030381088623, 'use_att': 1}
mean: 0.4685
[0.462 0.754 0.307 0.4   0.367 0.468 0.426 0.349 0.691 0.461]
cur_param: {'lr': 0.003222462881305638, 'weight_decay': 0.0012062638721084945, 'dropout': 0.6641200380722309, 'patience': 60, 'lr_reduce_freq': 150, 'spt_alg': 'kruskal', 'spt_attr': 'edge_degree', 'manifold': 'PoincareBall', 'num_layers': 3, 'num_adj': 2, 'add_rate': 0.28613930026330153, 'tem': 0.6087952189593833, 'consis_rate': 1.2160153138664123, 'use_att': 1}
mean: 0.8071999999999999
[0.807 0.799 0.805 0.817 0.8   0.811 0.818 0.8   0.808 0.807]
cur_param: {'lr': 0.002603224009642223, 'weight_decay': 0.0005353734684823282, 'dropout': 0.5980867589621977, 'patience': 60, 'lr_reduce_freq': 150, 'spt_alg': 'kruskal', 'spt_attr': 'edge_degree', 'manifold': 'PoincareBall', 'num_layers': 3, 'num_adj': 2, 'add_rate': 0.14680522786763972, 'tem': 0.49019930133225215, 'consis_rate': 1.1173352401775198, 'use_att': 1}
mean: 0.8
[0.787 0.788 0.802 0.806 0.799 0.806 0.794 0.791 0.817 0.81 ]
cur_param: {'lr': 0.0021125082601062286, 'weight_decay': 0.000793970921223553, 'dropout': 0.5381054732987918, 'patience': 60, 'lr_reduce_freq': 130, 'spt_alg': 'kruskal', 'spt_attr': 'edge_degree', 'manifold': 'PoincareBall', 'num_layers': 3, 'num_adj': 4, 'add_rate': 0.24047090497605594, 'tem': 0.709770307068467, 'consis_rate': 1.446782813450552, 'use_att': 1}
mean: 0.8079000000000001
[0.81  0.805 0.792 0.813 0.81  0.815 0.822 0.807 0.798 0.807]
cur_param: {'lr': 0.0016624850807274096, 'weight_decay': 0.0009253808554632702, 'dropout': 0.6436354081236283, 'patience': 60, 'lr_reduce_freq': 130, 'spt_alg': 'kruskal', 'spt_attr': 'edge_degree', 'manifold': 'PoincareBall', 'num_layers': 3, 'num_adj': 6, 'add_rate': 0.1966139045692534, 'tem': 0.8125677735413487, 'consis_rate': 1.4800805090001905, 'use_att': 1}
mean: 0.8095000000000001
[0.818 0.809 0.8   0.812 0.811 0.818 0.799 0.806 0.806 0.816]
cur_param: {'lr': 0.0021449055685161993, 'weight_decay': 0.0014394437253212938, 'dropout': 0.6247632046062674, 'patience': 60, 'lr_reduce_freq': 130, 'spt_alg': 'kruskal', 'spt_attr': 'edge_degree', 'manifold': 'PoincareBall', 'num_layers': 3, 'num_adj': 6, 'add_rate': 0.18559694147657016, 'tem': 0.6029441426788396, 'consis_rate': 1.3578613972366116, 'use_att': 1}
mean: 0.8099000000000001
[0.803 0.82  0.805 0.813 0.815 0.804 0.809 0.819 0.809 0.802]
cur_param: {'lr': 0.001120497559358418, 'weight_decay': 0.0013509706474177513, 'dropout': 0.6379641368593179, 'patience': 60, 'lr_reduce_freq': 150, 'spt_alg': 'kruskal', 'spt_attr': 'edge_degree', 'manifold': 'PoincareBall', 'num_layers': 3, 'num_adj': 6, 'add_rate': 0.3465616547247786, 'tem': 0.8206184714516596, 'consis_rate': 1.367672518748498, 'use_att': 1}
mean: 0.8090999999999999
[0.813 0.823 0.811 0.814 0.808 0.791 0.804 0.802 0.816 0.809]
cur_param: {'lr': 0.001121823953885207, 'weight_decay': 0.001905103911975894, 'dropout': 0.6335800661719022, 'patience': 60, 'lr_reduce_freq': 130, 'spt_alg': 'kruskal', 'spt_attr': 'edge_degree', 'manifold': 'PoincareBall', 'num_layers': 3, 'num_adj': 6, 'add_rate': 0.19418019199366662, 'tem': 0.8253575174532864, 'consis_rate': 1.3650122927778159, 'use_att': 1}[32m[I 2022-06-22 17:53:58,760][0m Trial 75 finished with value: 0.7797 and parameters: {'lr': 0.001121823953885207, 'weight_decay': 0.001905103911975894, 'dropout': 0.6335800661719022, 'patience': 60, 'lr_reduce_freq': 130, 'spt_alg': 'kruskal', 'spt_attr': 'edge_degree', 'manifold': 'PoincareBall', 'num_layers': 3, 'num_adj': 6, 'add_rate': 0.19418019199366662, 'tem': 0.8253575174532864, 'consis_rate': 1.3650122927778159, 'use_att': 1}. Best is trial 63 with value: 0.813.[0m
[32m[I 2022-06-22 18:37:07,816][0m Trial 76 finished with value: 0.7761 and parameters: {'lr': 0.0013075130788002798, 'weight_decay': 0.0013291693687955413, 'dropout': 0.7014818092478511, 'patience': 60, 'lr_reduce_freq': 110, 'spt_alg': 'kruskal', 'spt_attr': 'similarity', 'manifold': 'PoincareBall', 'num_layers': 3, 'num_adj': 6, 'add_rate': 0.35617114706827324, 'tem': 0.8134549404170426, 'consis_rate': 1.6894040025836738, 'use_att': 1}. Best is trial 63 with value: 0.813.[0m
[32m[I 2022-06-22 19:10:16,319][0m Trial 77 finished with value: 0.8131999999999999 and parameters: {'lr': 0.0020928167872821327, 'weight_decay': 0.0008747776376450779, 'dropout': 0.7729548439983659, 'patience': 60, 'lr_reduce_freq': 150, 'spt_alg': 'kruskal', 'spt_attr': 'edge_degree', 'manifold': 'PoincareBall', 'num_layers': 3, 'num_adj': 6, 'add_rate': 0.3934649965208969, 'tem': 0.9687161977308819, 'consis_rate': 1.052600110509095, 'use_att': 1}. Best is trial 77 with value: 0.8131999999999999.[0m
[32m[I 2022-06-22 19:35:44,471][0m Trial 78 finished with value: 0.2638 and parameters: {'lr': 0.0022095480925142332, 'weight_decay': 0.0008808617276341216, 'dropout': 0.8771977156741525, 'patience': 60, 'lr_reduce_freq': 130, 'spt_alg': 'kruskal', 'spt_attr': 'edge_degree', 'manifold': 'PoincareBall', 'num_layers': 4, 'num_adj': 6, 'add_rate': 0.10169396840667463, 'tem': 0.8870798221906033, 'consis_rate': 1.033998172062593, 'use_att': 1}. Best is trial 77 with value: 0.8131999999999999.[0m
[32m[I 2022-06-22 19:56:11,429][0m Trial 79 finished with value: 0.8096 and parameters: {'lr': 0.003553116450257378, 'weight_decay': 0.0005770741144056958, 'dropout': 0.47152427680073694, 'patience': 60, 'lr_reduce_freq': 130, 'spt_alg': 'kruskal', 'spt_attr': 'edge_degree', 'manifold': 'PoincareBall', 'num_layers': 3, 'num_adj': 6, 'add_rate': 0.395243528258913, 'tem': 0.971373653270449, 'consis_rate': 1.1999224089855651, 'use_att': 1}. Best is trial 77 with value: 0.8131999999999999.[0m
[32m[I 2022-06-22 20:20:10,862][0m Trial 80 finished with value: 0.8047000000000001 and parameters: {'lr': 0.0030637938822555624, 'weight_decay': 0.0005615457170291271, 'dropout': 0.4678763428710287, 'patience': 60, 'lr_reduce_freq': 110, 'spt_alg': 'kruskal', 'spt_attr': 'similarity', 'manifold': 'PoincareBall', 'num_layers': 3, 'num_adj': 6, 'add_rate': 0.39584761940276886, 'tem': 0.9732366374144478, 'consis_rate': 1.0548551674460336, 'use_att': 1}. Best is trial 77 with value: 0.8131999999999999.[0m
[32m[I 2022-06-22 20:42:26,852][0m Trial 81 finished with value: 0.8088000000000001 and parameters: {'lr': 0.0021644777020958066, 'weight_decay': 0.0008185157963512234, 'dropout': 0.6060333098405637, 'patience': 60, 'lr_reduce_freq': 130, 'spt_alg': 'kruskal', 'spt_attr': 'edge_degree', 'manifold': 'PoincareBall', 'num_layers': 3, 'num_adj': 6, 'add_rate': 0.13949681531246894, 'tem': 0.9100229482020836, 'consis_rate': 1.1196942209867828, 'use_att': 1}. Best is trial 77 with value: 0.8131999999999999.[0m
[32m[I 2022-06-22 21:27:07,101][0m Trial 82 finished with value: 0.8078000000000001 and parameters: {'lr': 0.0016226712092837624, 'weight_decay': 0.0010920710354776983, 'dropout': 0.7906918282319498, 'patience': 60, 'lr_reduce_freq': 130, 'spt_alg': 'kruskal', 'spt_attr': 'edge_degree', 'manifold': 'PoincareBall', 'num_layers': 3, 'num_adj': 6, 'add_rate': 0.4495729077221433, 'tem': 0.5960215415459167, 'consis_rate': 1.1976240855007851, 'use_att': 1}. Best is trial 77 with value: 0.8131999999999999.[0m
[32m[I 2022-06-22 21:46:35,617][0m Trial 83 finished with value: 0.8034000000000001 and parameters: {'lr': 0.003719860455866173, 'weight_decay': 0.0005837053431532225, 'dropout': 0.4510300688827947, 'patience': 60, 'lr_reduce_freq': 150, 'spt_alg': 'kruskal', 'spt_attr': 'edge_degree', 'manifold': 'PoincareBall', 'num_layers': 3, 'num_adj': 6, 'add_rate': 0.392549458302808, 'tem': 0.7575080426853489, 'consis_rate': 1.2614890510182133, 'use_att': 1}. Best is trial 77 with value: 0.8131999999999999.[0m
[32m[I 2022-06-22 22:20:57,259][0m Trial 84 finished with value: 0.8067 and parameters: {'lr': 0.001446034841526908, 'weight_decay': 0.0016772115024369378, 'dropout': 0.501193578233952, 'patience': 60, 'lr_reduce_freq': 130, 'spt_alg': 'kruskal', 'spt_attr': 'edge_degree', 'manifold': 'PoincareBall', 'num_layers': 3, 'num_adj': 6, 'add_rate': 0.3080531943043396, 'tem': 1.0806498150759434, 'consis_rate': 1.4954599434287044, 'use_att': 1}. Best is trial 77 with value: 0.8131999999999999.[0m
[32m[I 2022-06-22 22:38:15,817][0m Trial 85 finished with value: 0.8083000000000002 and parameters: {'lr': 0.0047780070542625475, 'weight_decay': 0.0009537286334303925, 'dropout': 0.5389121390714888, 'patience': 60, 'lr_reduce_freq': 150, 'spt_alg': 'kruskal', 'spt_attr': 'edge_degree', 'manifold': 'PoincareBall', 'num_layers': 3, 'num_adj': 6, 'add_rate': 0.26098842161101005, 'tem': 0.9908053808383095, 'consis_rate': 1.5580108530448804, 'use_att': 1}. Best is trial 77 with value: 0.8131999999999999.[0m
[32m[I 2022-06-22 22:50:54,397][0m Trial 86 finished with value: 0.23679999999999998 and parameters: {'lr': 0.0036128383255436057, 'weight_decay': 0.023323540249487098, 'dropout': 0.6947821209378843, 'patience': 60, 'lr_reduce_freq': 130, 'spt_alg': 'kruskal', 'spt_attr': 'edge_degree', 'manifold': 'PoincareBall', 'num_layers': 3, 'num_adj': 6, 'add_rate': 0.19139622951002344, 'tem': 0.8634479096550796, 'consis_rate': 1.196037720130139, 'use_att': 1}. Best is trial 77 with value: 0.8131999999999999.[0m
[32m[I 2022-06-22 23:06:36,227][0m Trial 87 finished with value: 0.221 and parameters: {'lr': 0.0020499527189787353, 'weight_decay': 0.0008061958647517574, 'dropout': 0.9383019296150523, 'patience': 60, 'lr_reduce_freq': 110, 'spt_alg': 'kruskal', 'spt_attr': 'edge_degree', 'manifold': 'PoincareBall', 'num_layers': 3, 'num_adj': 6, 'add_rate': 0.15925880072333218, 'tem': 1.761116617880539, 'consis_rate': 0.9661516745142535, 'use_att': 1}. Best is trial 77 with value: 0.8131999999999999.[0m
[32m[I 2022-06-22 23:25:14,488][0m Trial 88 finished with value: 0.8084000000000001 and parameters: {'lr': 0.006691225384793535, 'weight_decay': 0.001167207027395622, 'dropout': 0.4689103094434101, 'patience': 60, 'lr_reduce_freq': 150, 'spt_alg': 'kruskal', 'spt_attr': 'edge_degree', 'manifold': 'PoincareBall', 'num_layers': 3, 'num_adj': 6, 'add_rate': 0.44087298350647763, 'tem': 1.2196791486073322, 'consis_rate': 1.278889118072836, 'use_att': 1}. Best is trial 77 with value: 0.8131999999999999.[0m
[32m[I 2022-06-22 23:58:24,741][0m Trial 89 finished with value: 0.8108999999999998 and parameters: {'lr': 0.0017061996116129, 'weight_decay': 0.0005010683177702376, 'dropout': 0.7602478566331825, 'patience': 60, 'lr_reduce_freq': 130, 'spt_alg': 'kruskal', 'spt_attr': 'edge_degree', 'manifold': 'PoincareBall', 'num_layers': 3, 'num_adj': 6, 'add_rate': 0.4028483044765392, 'tem': 0.7182889386636391, 'consis_rate': 1.1375912102192962, 'use_att': 1}. Best is trial 77 with value: 0.8131999999999999.[0m
[32m[I 2022-06-23 00:24:07,998][0m Trial 90 finished with value: 0.197 and parameters: {'lr': 0.0017108876252696613, 'weight_decay': 0.0005969778236958813, 'dropout': 0.866918173592892, 'patience': 60, 'lr_reduce_freq': 130, 'spt_alg': 'prim', 'spt_attr': 'edge_degree', 'manifold': 'PoincareBall', 'num_layers': 4, 'num_adj': 6, 'add_rate': 0.47107929913249624, 'tem': 0.9106221505456625, 'consis_rate': 1.1389846536737702, 'use_att': 1}. Best is trial 77 with value: 0.8131999999999999.[0m
[32m[I 2022-06-23 00:59:49,264][0m Trial 91 finished with value: 0.8135999999999999 and parameters: {'lr': 0.0014308678622871255, 'weight_decay': 0.0005250559238576774, 'dropout': 0.7516917106803588, 'patience': 60, 'lr_reduce_freq': 130, 'spt_alg': 'kruskal', 'spt_attr': 'edge_degree', 'manifold': 'PoincareBall', 'num_layers': 3, 'num_adj': 6, 'add_rate': 0.37725085836092453, 'tem': 0.7144159136477004, 'consis_rate': 1.0200398294022317, 'use_att': 1}. Best is trial 91 with value: 0.8135999999999999.[0m
[32m[I 2022-06-23 01:37:52,657][0m Trial 92 finished with value: 0.8061 and parameters: {'lr': 0.0014434751010437956, 'weight_decay': 0.000921457919793866, 'dropout': 0.7526964027072112, 'patience': 60, 'lr_reduce_freq': 130, 'spt_alg': 'kruskal', 'spt_attr': 'edge_degree', 'manifold': 'PoincareBall', 'num_layers': 3, 'num_adj': 6, 'add_rate': 0.37137539318728796, 'tem': 0.6242844359064721, 'consis_rate': 1.0185329241904377, 'use_att': 1}. Best is trial 91 with value: 0.8135999999999999.[0m
