nohup: ignoring input
[32m[I 2022-06-29 01:31:02,368][0m A new study created in memory with name: no-name-90e29b97-e86e-46c4-9cc8-403067f0cec0[0m
[32m[I 2022-06-29 01:37:04,168][0m Trial 0 finished with value: 0.35479999999999995 and parameters: {'lr': 0.04747106211042377, 'weight_decay': 0.013185537407525084, 'dropout': 0.3548020749290125, 'patience': 70, 'lr_reduce_freq': 110, 'spt_alg': 'kruskal', 'spt_attr': 'similarity', 'manifold': 'Hyperboloid', 'num_layers': 3, 'dim': 272, 'num_adj': 4, 'add_rate': 0.430889245375077, 'tem': 0.5114155042404163, 'consis_rate': 1.341871691765386, 'use_att': 0}. Best is trial 0 with value: 0.35479999999999995.[0m
[32m[I 2022-06-29 02:14:52,267][0m Trial 1 finished with value: 0.3269 and parameters: {'lr': 0.028545597514241485, 'weight_decay': 0.0045361708568646695, 'dropout': 0.6931321303124867, 'patience': 70, 'lr_reduce_freq': 140, 'spt_alg': 'kruskal', 'spt_attr': 'similarity', 'manifold': 'Hyperboloid', 'num_layers': 5, 'dim': 320, 'num_adj': 4, 'add_rate': 0.8695202806405952, 'tem': 0.7811044884125943, 'consis_rate': 1.5507026930190235, 'use_att': 1}. Best is trial 0 with value: 0.35479999999999995.[0m
[32m[I 2022-06-29 02:22:08,467][0m Trial 2 finished with value: 0.788 and parameters: {'lr': 0.005146813177544829, 'weight_decay': 0.0021335466347619557, 'dropout': 0.5331819328898697, 'patience': 100, 'lr_reduce_freq': 80, 'spt_alg': 'kruskal', 'spt_attr': 'edge_degree', 'manifold': 'Hyperboloid', 'num_layers': 3, 'dim': 208, 'num_adj': 2, 'add_rate': 0.36222182095559363, 'tem': 0.7307481444723318, 'consis_rate': 1.224495141058226, 'use_att': 0}. Best is trial 2 with value: 0.788.[0m
[32m[I 2022-06-29 02:45:46,119][0m Trial 3 finished with value: 0.6883999999999999 and parameters: {'lr': 0.07337797649414404, 'weight_decay': 0.0031944305399598007, 'dropout': 0.12462114357360551, 'patience': 70, 'lr_reduce_freq': 100, 'spt_alg': 'prim', 'spt_attr': 'edge_degree', 'manifold': 'Hyperboloid', 'num_layers': 3, 'dim': 192, 'num_adj': 2, 'add_rate': 0.6743562033479035, 'tem': 1.0869554065837481, 'consis_rate': 1.5044291964171344, 'use_att': 1}. Best is trial 2 with value: 0.788.[0m
[32m[I 2022-06-29 02:55:44,092][0m Trial 4 finished with value: 0.5055000000000001 and parameters: {'lr': 0.003157757831630713, 'weight_decay': 0.007352616439014619, 'dropout': 0.26385738319667645, 'patience': 80, 'lr_reduce_freq': 110, 'spt_alg': 'kruskal', 'spt_attr': 'similarity', 'manifold': 'PoincareBall', 'num_layers': 3, 'dim': 192, 'num_adj': 4, 'add_rate': 0.2615353737113194, 'tem': 1.4747602521677048, 'consis_rate': 1.8051072506419346, 'use_att': 0}. Best is trial 2 with value: 0.788.[0m
[32m[I 2022-06-29 03:02:22,244][0m Trial 5 finished with value: 0.7893000000000001 and parameters: {'lr': 0.09422937622059605, 'weight_decay': 0.0008931489911181619, 'dropout': 0.19309402165569245, 'patience': 100, 'lr_reduce_freq': 80, 'spt_alg': 'prim', 'spt_attr': 'edge_degree', 'manifold': 'PoincareBall', 'num_layers': 4, 'dim': 272, 'num_adj': 2, 'add_rate': 0.8181764419627826, 'tem': 1.2332772619000827, 'consis_rate': 1.2648858463876327, 'use_att': 0}. Best is trial 5 with value: 0.7893000000000001.[0m
[32m[I 2022-06-29 03:18:47,369][0m Trial 6 finished with value: 0.7746000000000001 and parameters: {'lr': 0.001865567789463532, 'weight_decay': 0.0005606821415444768, 'dropout': 0.5145550391813921, 'patience': 80, 'lr_reduce_freq': 130, 'spt_alg': 'prim', 'spt_attr': 'edge_degree', 'manifold': 'Hyperboloid', 'num_layers': 5, 'dim': 336, 'num_adj': 4, 'add_rate': 0.8520583820489662, 'tem': 0.8270971780143396, 'consis_rate': 0.7635040263497337, 'use_att': 0}. Best is trial 5 with value: 0.7893000000000001.[0m
[32m[I 2022-06-29 03:38:55,202][0m Trial 7 finished with value: 0.27149999999999996 and parameters: {'lr': 0.0016607092743713516, 'weight_decay': 0.039573327425864245, 'dropout': 0.2344624249609955, 'patience': 80, 'lr_reduce_freq': 120, 'spt_alg': 'kruskal', 'spt_attr': 'edge_degree', 'manifold': 'Hyperboloid', 'num_layers': 3, 'dim': 464, 'num_adj': 2, 'add_rate': 0.5913603934264827, 'tem': 1.300729619461226, 'consis_rate': 0.8442789586561874, 'use_att': 1}. Best is trial 5 with value: 0.7893000000000001.[0m
[32m[I 2022-06-29 03:43:46,009][0m Trial 8 finished with value: 0.3016 and parameters: {'lr': 0.006050674876640023, 'weight_decay': 0.0026873219820627682, 'dropout': 0.6685307036128447, 'patience': 80, 'lr_reduce_freq': 140, 'spt_alg': 'prim', 'spt_attr': 'edge_degree', 'manifold': 'Hyperboloid', 'num_layers': 4, 'dim': 304, 'num_adj': 2, 'add_rate': 0.7488787405507608, 'tem': 1.1744536703534578, 'consis_rate': 1.580706640904555, 'use_att': 0}. Best is trial 5 with value: 0.7893000000000001.[0m
[32m[I 2022-06-29 05:25:03,365][0m Trial 9 finished with value: 0.31479999999999997 and parameters: {'lr': 0.0009534078340736494, 'weight_decay': 0.0026143760802296856, 'dropout': 0.29938018218077445, 'patience': 100, 'lr_reduce_freq': 70, 'spt_alg': 'prim', 'spt_attr': 'similarity', 'manifold': 'Hyperboloid', 'num_layers': 5, 'dim': 128, 'num_adj': 6, 'add_rate': 0.4005097507718648, 'tem': 0.6520827188009883, 'consis_rate': 0.2111219328408301, 'use_att': 1}. Best is trial 5 with value: 0.7893000000000001.[0m
[32m[I 2022-06-29 05:30:04,687][0m Trial 10 finished with value: 0.7978000000000001 and parameters: {'lr': 0.016290844438989503, 'weight_decay': 0.0005509004275373914, 'dropout': 0.10694509687745324, 'patience': 50, 'lr_reduce_freq': 30, 'spt_alg': 'prim', 'spt_attr': 'edge_degree', 'manifold': 'PoincareBall', 'num_layers': 4, 'dim': 432, 'num_adj': 6, 'add_rate': 0.13472643378587568, 'tem': 1.4968422189361732, 'consis_rate': 1.9534976943088882, 'use_att': 0}. Best is trial 10 with value: 0.7978000000000001.[0m
[32m[I 2022-06-29 05:34:54,581][0m Trial 11 finished with value: 0.7969000000000002 and parameters: {'lr': 0.01817724403423362, 'weight_decay': 0.0005264937132076778, 'dropout': 0.13760613764084734, 'patience': 50, 'lr_reduce_freq': 40, 'spt_alg': 'prim', 'spt_attr': 'edge_degree', 'manifold': 'PoincareBall', 'num_layers': 4, 'dim': 432, 'num_adj': 6, 'add_rate': 0.1437218953331085, 'tem': 1.480923434618794, 'consis_rate': 1.9161622220777472, 'use_att': 0}. Best is trial 10 with value: 0.7978000000000001.[0m
[32m[I 2022-06-29 05:39:25,875][0m Trial 12 finished with value: 0.7881 and parameters: {'lr': 0.015344075794812426, 'weight_decay': 0.0011226215279268802, 'dropout': 0.11714149950853286, 'patience': 50, 'lr_reduce_freq': 30, 'spt_alg': 'prim', 'spt_attr': 'edge_degree', 'manifold': 'PoincareBall', 'num_layers': 4, 'dim': 464, 'num_adj': 6, 'add_rate': 0.10795380854726962, 'tem': 1.4947811129031334, 'consis_rate': 1.8495482064508282, 'use_att': 0}. Best is trial 10 with value: 0.7978000000000001.[0m
[32m[I 2022-06-29 05:44:15,662][0m Trial 13 finished with value: 0.7971 and parameters: {'lr': 0.013880874529636855, 'weight_decay': 0.000656428418936213, 'dropout': 0.39437437623379074, 'patience': 50, 'lr_reduce_freq': 30, 'spt_alg': 'prim', 'spt_attr': 'edge_degree', 'manifold': 'PoincareBall', 'num_layers': 4, 'dim': 400, 'num_adj': 6, 'add_rate': 0.1200775980765669, 'tem': 1.3452758722445122, 'consis_rate': 1.9853844731269077, 'use_att': 0}. Best is trial 10 with value: 0.7978000000000001.[0m
[32m[I 2022-06-29 05:49:43,233][0m Trial 14 finished with value: 0.7913000000000001 and parameters: {'lr': 0.010895880079341528, 'weight_decay': 0.0010796428826216208, 'dropout': 0.40964109304312035, 'patience': 60, 'lr_reduce_freq': 50, 'spt_alg': 'prim', 'spt_attr': 'edge_degree', 'manifold': 'PoincareBall', 'num_layers': 4, 'dim': 400, 'num_adj': 6, 'add_rate': 0.24207508763078583, 'tem': 1.3563832926681276, 'consis_rate': 1.9593249964472539, 'use_att': 0}. Best is trial 10 with value: 0.7978000000000001.[0m
[32m[I 2022-06-29 06:01:23,116][0m Trial 15 finished with value: 0.7997000000000001 and parameters: {'lr': 0.03343834597452252, 'weight_decay': 0.0013545553429182777, 'dropout': 0.5824115155521132, 'patience': 60, 'lr_reduce_freq': 60, 'spt_alg': 'prim', 'spt_attr': 'edge_degree', 'manifold': 'PoincareBall', 'num_layers': 4, 'dim': 512, 'num_adj': 6, 'add_rate': 0.25161629239769984, 'tem': 0.9534196430202633, 'consis_rate': 0.9037939598167484, 'use_att': 0}. Best is trial 15 with value: 0.7997000000000001.[0m
[32m[I 2022-06-29 06:11:44,690][0m Trial 16 finished with value: 0.7516 and parameters: {'lr': 0.03368431319172069, 'weight_decay': 0.0015254041729354185, 'dropout': 0.7612600455263066, 'patience': 60, 'lr_reduce_freq': 50, 'spt_alg': 'prim', 'spt_attr': 'edge_degree', 'manifold': 'PoincareBall', 'num_layers': 4, 'dim': 512, 'num_adj': 6, 'add_rate': 0.25445639222192024, 'tem': 0.9503072101114091, 'consis_rate': 0.8900783148552678, 'use_att': 0}. Best is trial 15 with value: 0.7997000000000001.[0m
cmd: --dataset cora --model HGCN --c 0.5
cur_param: {'lr': 0.04747106211042377, 'weight_decay': 0.013185537407525084, 'dropout': 0.3548020749290125, 'patience': 70, 'lr_reduce_freq': 110, 'spt_alg': 'kruskal', 'spt_attr': 'similarity', 'manifold': 'Hyperboloid', 'num_layers': 3, 'dim': 272, 'num_adj': 4, 'add_rate': 0.430889245375077, 'tem': 0.5114155042404163, 'consis_rate': 1.341871691765386, 'use_att': 0}
mean: 0.35479999999999995
[0.311 0.319 0.319 0.7   0.319 0.319 0.319 0.319 0.303 0.32 ]
cur_param: {'lr': 0.028545597514241485, 'weight_decay': 0.0045361708568646695, 'dropout': 0.6931321303124867, 'patience': 70, 'lr_reduce_freq': 140, 'spt_alg': 'kruskal', 'spt_attr': 'similarity', 'manifold': 'Hyperboloid', 'num_layers': 5, 'dim': 320, 'num_adj': 4, 'add_rate': 0.8695202806405952, 'tem': 0.7811044884125943, 'consis_rate': 1.5507026930190235, 'use_att': 1}
mean: 0.3269
[0.319 0.319 0.319 0.398 0.319 0.319 0.319 0.319 0.319 0.319]
cur_param: {'lr': 0.005146813177544829, 'weight_decay': 0.0021335466347619557, 'dropout': 0.5331819328898697, 'patience': 100, 'lr_reduce_freq': 80, 'spt_alg': 'kruskal', 'spt_attr': 'edge_degree', 'manifold': 'Hyperboloid', 'num_layers': 3, 'dim': 208, 'num_adj': 2, 'add_rate': 0.36222182095559363, 'tem': 0.7307481444723318, 'consis_rate': 1.224495141058226, 'use_att': 0}
mean: 0.788
[0.804 0.798 0.781 0.788 0.783 0.774 0.789 0.779 0.802 0.782]
cur_param: {'lr': 0.07337797649414404, 'weight_decay': 0.0031944305399598007, 'dropout': 0.12462114357360551, 'patience': 70, 'lr_reduce_freq': 100, 'spt_alg': 'prim', 'spt_attr': 'edge_degree', 'manifold': 'Hyperboloid', 'num_layers': 3, 'dim': 192, 'num_adj': 2, 'add_rate': 0.6743562033479035, 'tem': 1.0869554065837481, 'consis_rate': 1.5044291964171344, 'use_att': 1}
mean: 0.6883999999999999
[0.697 0.664 0.686 0.645 0.674 0.666 0.705 0.691 0.731 0.725]
cur_param: {'lr': 0.003157757831630713, 'weight_decay': 0.007352616439014619, 'dropout': 0.26385738319667645, 'patience': 80, 'lr_reduce_freq': 110, 'spt_alg': 'kruskal', 'spt_attr': 'similarity', 'manifold': 'PoincareBall', 'num_layers': 3, 'dim': 192, 'num_adj': 4, 'add_rate': 0.2615353737113194, 'tem': 1.4747602521677048, 'consis_rate': 1.8051072506419346, 'use_att': 0}
mean: 0.5055000000000001
[0.295 0.225 0.691 0.3   0.326 0.224 0.776 0.763 0.716 0.739]
cur_param: {'lr': 0.09422937622059605, 'weight_decay': 0.0008931489911181619, 'dropout': 0.19309402165569245, 'patience': 100, 'lr_reduce_freq': 80, 'spt_alg': 'prim', 'spt_attr': 'edge_degree', 'manifold': 'PoincareBall', 'num_layers': 4, 'dim': 272, 'num_adj': 2, 'add_rate': 0.8181764419627826, 'tem': 1.2332772619000827, 'consis_rate': 1.2648858463876327, 'use_att': 0}
mean: 0.7893000000000001
[0.794 0.784 0.81  0.782 0.77  0.777 0.79  0.778 0.791 0.817]
cur_param: {'lr': 0.001865567789463532, 'weight_decay': 0.0005606821415444768, 'dropout': 0.5145550391813921, 'patience': 80, 'lr_reduce_freq': 130, 'spt_alg': 'prim', 'spt_attr': 'edge_degree', 'manifold': 'Hyperboloid', 'num_layers': 5, 'dim': 336, 'num_adj': 4, 'add_rate': 0.8520583820489662, 'tem': 0.8270971780143396, 'consis_rate': 0.7635040263497337, 'use_att': 0}
mean: 0.7746000000000001
[0.771 0.793 0.776 0.742 0.793 0.799 0.754 0.788 0.759 0.771]
cur_param: {'lr': 0.0016607092743713516, 'weight_decay': 0.039573327425864245, 'dropout': 0.2344624249609955, 'patience': 80, 'lr_reduce_freq': 120, 'spt_alg': 'kruskal', 'spt_attr': 'edge_degree', 'manifold': 'Hyperboloid', 'num_layers': 3, 'dim': 464, 'num_adj': 2, 'add_rate': 0.5913603934264827, 'tem': 1.300729619461226, 'consis_rate': 0.8442789586561874, 'use_att': 1}
mean: 0.27149999999999996
[0.319 0.319 0.319 0.319 0.319 0.149 0.149 0.319 0.319 0.184]
cur_param: {'lr': 0.006050674876640023, 'weight_decay': 0.0026873219820627682, 'dropout': 0.6685307036128447, 'patience': 80, 'lr_reduce_freq': 140, 'spt_alg': 'prim', 'spt_attr': 'edge_degree', 'manifold': 'Hyperboloid', 'num_layers': 4, 'dim': 304, 'num_adj': 2, 'add_rate': 0.7488787405507608, 'tem': 1.1744536703534578, 'consis_rate': 1.580706640904555, 'use_att': 0}
mean: 0.3016
[0.309 0.316 0.294 0.319 0.318 0.275 0.253 0.296 0.303 0.333]
cur_param: {'lr': 0.0009534078340736494, 'weight_decay': 0.0026143760802296856, 'dropout': 0.29938018218077445, 'patience': 100, 'lr_reduce_freq': 70, 'spt_alg': 'prim', 'spt_attr': 'similarity', 'manifold': 'Hyperboloid', 'num_layers': 5, 'dim': 128, 'num_adj': 6, 'add_rate': 0.4005097507718648, 'tem': 0.6520827188009883, 'consis_rate': 0.2111219328408301, 'use_att': 1}
mean: 0.31479999999999997
[0.362 0.465 0.145 0.373 0.328 0.149 0.259 0.227 0.401 0.439]
cur_param: {'lr': 0.016290844438989503, 'weight_decay': 0.0005509004275373914, 'dropout': 0.10694509687745324, 'patience': 50, 'lr_reduce_freq': 30, 'spt_alg': 'prim', 'spt_attr': 'edge_degree', 'manifold': 'PoincareBall', 'num_layers': 4, 'dim': 432, 'num_adj': 6, 'add_rate': 0.13472643378587568, 'tem': 1.4968422189361732, 'consis_rate': 1.9534976943088882, 'use_att': 0}
mean: 0.7978000000000001
[0.816 0.776 0.792 0.811 0.819 0.787 0.804 0.787 0.799 0.787]
cur_param: {'lr': 0.01817724403423362, 'weight_decay': 0.0005264937132076778, 'dropout': 0.13760613764084734, 'patience': 50, 'lr_reduce_freq': 40, 'spt_alg': 'prim', 'spt_attr': 'edge_degree', 'manifold': 'PoincareBall', 'num_layers': 4, 'dim': 432, 'num_adj': 6, 'add_rate': 0.1437218953331085, 'tem': 1.480923434618794, 'consis_rate': 1.9161622220777472, 'use_att': 0}
mean: 0.7969000000000002
[0.789 0.793 0.815 0.81  0.785 0.795 0.786 0.798 0.81  0.788]
cur_param: {'lr': 0.015344075794812426, 'weight_decay': 0.0011226215279268802, 'dropout': 0.11714149950853286, 'patience': 50, 'lr_reduce_freq': 30, 'spt_alg': 'prim', 'spt_attr': 'edge_degree', 'manifold': 'PoincareBall', 'num_layers': 4, 'dim': 464, 'num_adj': 6, 'add_rate': 0.10795380854726962, 'tem': 1.4947811129031334, 'consis_rate': 1.8495482064508282, 'use_att': 0}
mean: 0.7881
[0.796 0.791 0.792 0.779 0.785 0.805 0.813 0.772 0.77  0.778]
cur_param: {'lr': 0.013880874529636855, 'weight_decay': 0.000656428418936213, 'dropout': 0.39437437623379074, 'patience': 50, 'lr_reduce_freq': 30, 'spt_alg': 'prim', 'spt_attr': 'edge_degree', 'manifold': 'PoincareBall', 'num_layers': 4, 'dim': 400, 'num_adj': 6, 'add_rate': 0.1200775980765669, 'tem': 1.3452758722445122, 'consis_rate': 1.9853844731269077, 'use_att': 0}
mean: 0.7971
[0.789 0.764 0.805 0.807 0.788 0.818 0.792 0.789 0.806 0.813]
cur_param: {'lr': 0.010895880079341528, 'weight_decay': 0.0010796428826216208, 'dropout': 0.40964109304312035, 'patience': 60, 'lr_reduce_freq': 50, 'spt_alg': 'prim', 'spt_attr': 'edge_degree', 'manifold': 'PoincareBall', 'num_layers': 4, 'dim': 400, 'num_adj': 6, 'add_rate': 0.24207508763078583, 'tem': 1.3563832926681276, 'consis_rate': 1.9593249964472539, 'use_att': 0}
mean: 0.7913000000000001
[0.778 0.799 0.809 0.801 0.787 0.761 0.79  0.794 0.803 0.791]
cur_param: {'lr': 0.03343834597452252, 'weight_decay': 0.0013545553429182777, 'dropout': 0.5824115155521132, 'patience': 60, 'lr_reduce_freq': 60, 'spt_alg': 'prim', 'spt_attr': 'edge_degree', 'manifold': 'PoincareBall', 'num_layers': 4, 'dim': 512, 'num_adj': 6, 'add_rate': 0.25161629239769984, 'tem': 0.9534196430202633, 'consis_rate': 0.9037939598167484, 'use_att': 0}
mean: 0.7997000000000001
[0.8   0.79  0.803 0.815 0.786 0.81  0.784 0.812 0.801 0.796]
cur_param: {'lr': 0.03368431319172069, 'weight_decay': 0.0015254041729354185, 'dropout': 0.7612600455263066, 'patience': 60, 'lr_reduce_freq': 50, 'spt_alg': 'prim', 'spt_attr': 'edge_degree', 'manifold': 'PoincareBall', 'num_layers': 4, 'dim': 512, 'num_adj': 6, 'add_rate': 0.25445639222192024, 'tem': 0.9503072101114091, 'consis_rate': 0.8900783148552678, 'use_att': 0}
mean: 0.7516
[0.81  0.803 0.806 0.775 0.804 0.807 0.796 0.79  0.34  0.785]
cur_param: {'lr': 0.03039889050651065, 'weight_decay': 0.009387339091308318, 'dropout': 0.5753344599059825, 'patience': 60, 'lr_reduce_freq': 60, 'spt_alg': 'prim', 'spt_attr': 'edge_degree', 'manifold': 'PoincareBall', 'num_layers': 4, 'dim': 512, 'num_adj': 6, 'add_rate': 0.547604364110844, 'tem': 0.9658343249810849, 'consis_rate': 0.5334448221630355, 'use_att': 0}
mean: 0.3061
[0.314 0.319 0.293 0.319 0.319 0.288 0.316 0.304 0.319 0.27 ][32m[I 2022-06-29 06:17:44,402][0m Trial 17 finished with value: 0.3061 and parameters: {'lr': 0.03039889050651065, 'weight_decay': 0.009387339091308318, 'dropout': 0.5753344599059825, 'patience': 60, 'lr_reduce_freq': 60, 'spt_alg': 'prim', 'spt_attr': 'edge_degree', 'manifold': 'PoincareBall', 'num_layers': 4, 'dim': 512, 'num_adj': 6, 'add_rate': 0.547604364110844, 'tem': 0.9658343249810849, 'consis_rate': 0.5334448221630355, 'use_att': 0}. Best is trial 15 with value: 0.7997000000000001.[0m
[32m[I 2022-06-29 07:07:15,707][0m Trial 18 finished with value: 0.7876 and parameters: {'lr': 0.009236882236315795, 'weight_decay': 0.0015841470292810211, 'dropout': 0.6152940242924085, 'patience': 60, 'lr_reduce_freq': 60, 'spt_alg': 'prim', 'spt_attr': 'similarity', 'manifold': 'PoincareBall', 'num_layers': 4, 'dim': 368, 'num_adj': 4, 'add_rate': 0.20170759350448858, 'tem': 1.1009676137323718, 'consis_rate': 1.061599376335844, 'use_att': 1}. Best is trial 15 with value: 0.7997000000000001.[0m
[32m[I 2022-06-29 07:12:22,318][0m Trial 19 finished with value: 0.31520000000000004 and parameters: {'lr': 0.05123810286016112, 'weight_decay': 0.020289599471715526, 'dropout': 0.48023750243115, 'patience': 50, 'lr_reduce_freq': 40, 'spt_alg': 'prim', 'spt_attr': 'edge_degree', 'manifold': 'PoincareBall', 'num_layers': 4, 'dim': 464, 'num_adj': 6, 'add_rate': 0.30430768120265195, 'tem': 0.9139534232182107, 'consis_rate': 0.6238535973532469, 'use_att': 0}. Best is trial 15 with value: 0.7997000000000001.[0m
[32m[I 2022-06-29 07:20:56,708][0m Trial 20 finished with value: 0.7886 and parameters: {'lr': 0.004256694747364884, 'weight_decay': 0.0008387901118181933, 'dropout': 0.3405567969803791, 'patience': 90, 'lr_reduce_freq': 80, 'spt_alg': 'prim', 'spt_attr': 'edge_degree', 'manifold': 'PoincareBall', 'num_layers': 5, 'dim': 496, 'num_adj': 4, 'add_rate': 0.48872703851222027, 'tem': 1.0680064391936614, 'consis_rate': 0.3396387515904822, 'use_att': 0}. Best is trial 15 with value: 0.7997000000000001.[0m
[32m[I 2022-06-29 07:26:33,839][0m Trial 21 finished with value: 0.7993 and parameters: {'lr': 0.014451329561305367, 'weight_decay': 0.0006156103404541128, 'dropout': 0.4129485105484135, 'patience': 50, 'lr_reduce_freq': 30, 'spt_alg': 'prim', 'spt_attr': 'edge_degree', 'manifold': 'PoincareBall', 'num_layers': 4, 'dim': 400, 'num_adj': 6, 'add_rate': 0.16079914901833336, 'tem': 1.3616870848446205, 'consis_rate': 1.7395149702518737, 'use_att': 0}. Best is trial 15 with value: 0.7997000000000001.[0m
[32m[I 2022-06-29 07:36:42,685][0m Trial 22 finished with value: 0.6678 and parameters: {'lr': 0.02185881529052993, 'weight_decay': 0.0005083242964544053, 'dropout': 0.7910889991736125, 'patience': 50, 'lr_reduce_freq': 30, 'spt_alg': 'prim', 'spt_attr': 'edge_degree', 'manifold': 'PoincareBall', 'num_layers': 4, 'dim': 416, 'num_adj': 6, 'add_rate': 0.1778257165060018, 'tem': 1.395899778694907, 'consis_rate': 1.7099382226865567, 'use_att': 0}. Best is trial 15 with value: 0.7997000000000001.[0m
[32m[I 2022-06-29 07:44:51,195][0m Trial 23 finished with value: 0.7917000000000001 and parameters: {'lr': 0.010042079472741845, 'weight_decay': 0.0014741708445960425, 'dropout': 0.43694735005326707, 'patience': 60, 'lr_reduce_freq': 50, 'spt_alg': 'prim', 'spt_attr': 'edge_degree', 'manifold': 'PoincareBall', 'num_layers': 4, 'dim': 448, 'num_adj': 6, 'add_rate': 0.3195224729532036, 'tem': 1.2455322763061825, 'consis_rate': 1.0543761522766655, 'use_att': 0}. Best is trial 15 with value: 0.7997000000000001.[0m
[32m[I 2022-06-29 07:56:01,492][0m Trial 24 finished with value: 0.7992999999999999 and parameters: {'lr': 0.04150583181234061, 'weight_decay': 0.0007895442638157452, 'dropout': 0.6201018488392953, 'patience': 50, 'lr_reduce_freq': 40, 'spt_alg': 'prim', 'spt_attr': 'edge_degree', 'manifold': 'PoincareBall', 'num_layers': 4, 'dim': 352, 'num_adj': 6, 'add_rate': 0.20191618906938408, 'tem': 0.8692122075450421, 'consis_rate': 1.6831063300524503, 'use_att': 0}. Best is trial 15 with value: 0.7997000000000001.[0m
[32m[I 2022-06-29 08:06:58,597][0m Trial 25 finished with value: 0.8081000000000002 and parameters: {'lr': 0.047391507742030096, 'weight_decay': 0.000898121820921064, 'dropout': 0.6231711691325342, 'patience': 60, 'lr_reduce_freq': 60, 'spt_alg': 'prim', 'spt_attr': 'edge_degree', 'manifold': 'PoincareBall', 'num_layers': 4, 'dim': 368, 'num_adj': 6, 'add_rate': 0.2024949047262394, 'tem': 0.8523607164145545, 'consis_rate': 1.3995741451844317, 'use_att': 0}. Best is trial 25 with value: 0.8081000000000002.[0m
