nohup: ignoring input
[32m[I 2022-06-21 17:46:51,762][0m A new study created in memory with name: no-name-d6ffdbd3-4d6a-4a9a-9415-2753659bf5b6[0m
[32m[I 2022-06-21 17:59:22,609][0m Trial 0 finished with value: 0.319 and parameters: {'lr': 0.02240234092533529, 'weight_decay': 0.24333776547523459, 'dropout': 0.059176403648582135, 'patience': 60, 'lr_reduce_freq': 110, 'spt_alg': 'kruskal', 'spt_attr': 'edge_degree', 'manifold': 'PoincareBall', 'num_layers': 4, 'num_adj': 2, 'add_rate': 0.7521180612863883, 'tem': 0.3632364443687245, 'consis_rate': 1.041241387838485, 'use_att': 1}. Best is trial 0 with value: 0.319.[0m
[32m[I 2022-06-21 18:53:29,423][0m Trial 1 finished with value: 0.2359 and parameters: {'lr': 0.0022166910150567378, 'weight_decay': 0.04805126028825058, 'dropout': 0.6125073480535207, 'patience': 80, 'lr_reduce_freq': 110, 'spt_alg': 'kruskal', 'spt_attr': 'edge_degree', 'manifold': 'PoincareBall', 'num_layers': 4, 'num_adj': 8, 'add_rate': 0.9491930546415658, 'tem': 1.3921558519010429, 'consis_rate': 1.880851381547478, 'use_att': 1}. Best is trial 0 with value: 0.319.[0m
[32m[I 2022-06-21 18:58:56,596][0m Trial 2 finished with value: 0.7939 and parameters: {'lr': 0.009242013328322706, 'weight_decay': 0.0023905401239084174, 'dropout': 0.32850636755545226, 'patience': 60, 'lr_reduce_freq': 150, 'spt_alg': 'prim', 'spt_attr': 'similarity', 'manifold': 'PoincareBall', 'num_layers': 3, 'num_adj': 6, 'add_rate': 0.3738694304329654, 'tem': 0.3591689918106654, 'consis_rate': 0.6635893899962408, 'use_att': 0}. Best is trial 2 with value: 0.7939.[0m
[32m[I 2022-06-21 19:42:09,418][0m Trial 3 finished with value: 0.7799 and parameters: {'lr': 0.004156676796661114, 'weight_decay': 0.0009033802567493895, 'dropout': 0.18943205713544714, 'patience': 80, 'lr_reduce_freq': 70, 'spt_alg': 'prim', 'spt_attr': 'similarity', 'manifold': 'PoincareBall', 'num_layers': 4, 'num_adj': 6, 'add_rate': 0.5435887045389672, 'tem': 0.2889293130225046, 'consis_rate': 0.43160951596566693, 'use_att': 1}. Best is trial 2 with value: 0.7939.[0m
[32m[I 2022-06-21 19:50:30,390][0m Trial 4 finished with value: 0.31679999999999997 and parameters: {'lr': 0.006092531907062152, 'weight_decay': 0.03091904407533941, 'dropout': 0.8779587440888671, 'patience': 100, 'lr_reduce_freq': 150, 'spt_alg': 'kruskal', 'spt_attr': 'edge_degree', 'manifold': 'PoincareBall', 'num_layers': 3, 'num_adj': 8, 'add_rate': 0.3847027476849846, 'tem': 0.8873428398508547, 'consis_rate': 0.8897115113281253, 'use_att': 0}. Best is trial 2 with value: 0.7939.[0m
[32m[I 2022-06-21 20:02:12,361][0m Trial 5 finished with value: 0.7869 and parameters: {'lr': 0.035465314723220724, 'weight_decay': 0.002315469997913045, 'dropout': 0.12173587890963083, 'patience': 60, 'lr_reduce_freq': 110, 'spt_alg': 'prim', 'spt_attr': 'similarity', 'manifold': 'PoincareBall', 'num_layers': 3, 'num_adj': 4, 'add_rate': 0.3637858634733462, 'tem': 0.6694473466690386, 'consis_rate': 0.8718675367169839, 'use_att': 1}. Best is trial 2 with value: 0.7939.[0m
[32m[I 2022-06-21 20:08:28,326][0m Trial 6 finished with value: 0.6142000000000001 and parameters: {'lr': 0.09560835996498317, 'weight_decay': 0.003197443464476491, 'dropout': 0.47651111398441076, 'patience': 60, 'lr_reduce_freq': 130, 'spt_alg': 'kruskal', 'spt_attr': 'similarity', 'manifold': 'PoincareBall', 'num_layers': 3, 'num_adj': 2, 'add_rate': 0.21718752328454793, 'tem': 0.7875753560549263, 'consis_rate': 0.9229557996479394, 'use_att': 1}. Best is trial 2 with value: 0.7939.[0m
[32m[I 2022-06-21 20:30:53,625][0m Trial 7 finished with value: 0.319 and parameters: {'lr': 0.040375339741148916, 'weight_decay': 0.09001382846361036, 'dropout': 0.21015709580353995, 'patience': 80, 'lr_reduce_freq': 130, 'spt_alg': 'prim', 'spt_attr': 'similarity', 'manifold': 'PoincareBall', 'num_layers': 4, 'num_adj': 4, 'add_rate': 0.6656743742586657, 'tem': 1.9436940409208234, 'consis_rate': 1.009915865112578, 'use_att': 1}. Best is trial 2 with value: 0.7939.[0m
[32m[I 2022-06-21 20:37:24,690][0m Trial 8 finished with value: 0.2863 and parameters: {'lr': 0.0063172920547645275, 'weight_decay': 0.1794753894860093, 'dropout': 0.6560812512711108, 'patience': 80, 'lr_reduce_freq': 50, 'spt_alg': 'prim', 'spt_attr': 'similarity', 'manifold': 'PoincareBall', 'num_layers': 3, 'num_adj': 8, 'add_rate': 0.780612998237264, 'tem': 1.0333995628289763, 'consis_rate': 1.667125976980823, 'use_att': 0}. Best is trial 2 with value: 0.7939.[0m
[32m[I 2022-06-21 20:49:00,530][0m Trial 9 finished with value: 0.795 and parameters: {'lr': 0.02707883161788249, 'weight_decay': 0.0006631015396905319, 'dropout': 0.25100156145003827, 'patience': 100, 'lr_reduce_freq': 110, 'spt_alg': 'kruskal', 'spt_attr': 'similarity', 'manifold': 'PoincareBall', 'num_layers': 3, 'num_adj': 2, 'add_rate': 0.8294380428922626, 'tem': 0.7976317441087972, 'consis_rate': 0.478127632297169, 'use_att': 1}. Best is trial 9 with value: 0.795.[0m
[32m[I 2022-06-21 21:04:51,360][0m Trial 10 finished with value: 0.3186 and parameters: {'lr': 0.0011756212085300487, 'weight_decay': 0.009510867159550547, 'dropout': 0.37669205027532615, 'patience': 100, 'lr_reduce_freq': 70, 'spt_alg': 'kruskal', 'spt_attr': 'similarity', 'manifold': 'PoincareBall', 'num_layers': 3, 'num_adj': 2, 'add_rate': 0.888476135797745, 'tem': 1.40695055311091, 'consis_rate': 0.20077102951284465, 'use_att': 1}. Best is trial 9 with value: 0.795.[0m
[32m[I 2022-06-21 21:12:20,588][0m Trial 11 finished with value: 0.7994000000000001 and parameters: {'lr': 0.014777019735714738, 'weight_decay': 0.000625888957000836, 'dropout': 0.3495421484668492, 'patience': 100, 'lr_reduce_freq': 150, 'spt_alg': 'prim', 'spt_attr': 'similarity', 'manifold': 'PoincareBall', 'num_layers': 3, 'num_adj': 6, 'add_rate': 0.14113713931882965, 'tem': 0.5634324584354429, 'consis_rate': 0.5278631766495877, 'use_att': 0}. Best is trial 11 with value: 0.7994000000000001.[0m
[32m[I 2022-06-21 21:17:41,946][0m Trial 12 finished with value: 0.8028000000000001 and parameters: {'lr': 0.013394886813206924, 'weight_decay': 0.0008799373093508388, 'dropout': 0.38781925493945807, 'patience': 100, 'lr_reduce_freq': 90, 'spt_alg': 'kruskal', 'spt_attr': 'similarity', 'manifold': 'PoincareBall', 'num_layers': 3, 'num_adj': 4, 'add_rate': 0.11313202776342242, 'tem': 0.645311080825139, 'consis_rate': 1.3852649051638908, 'use_att': 0}. Best is trial 12 with value: 0.8028000000000001.[0m
[32m[I 2022-06-21 21:25:07,288][0m Trial 13 finished with value: 0.8042999999999999 and parameters: {'lr': 0.010889275137400454, 'weight_decay': 0.0005138297662871452, 'dropout': 0.4790153144778555, 'patience': 100, 'lr_reduce_freq': 90, 'spt_alg': 'prim', 'spt_attr': 'similarity', 'manifold': 'PoincareBall', 'num_layers': 3, 'num_adj': 6, 'add_rate': 0.12169544037600719, 'tem': 0.5897996788487279, 'consis_rate': 1.3753951369922, 'use_att': 0}. Best is trial 13 with value: 0.8042999999999999.[0m
[32m[I 2022-06-21 21:28:22,493][0m Trial 14 finished with value: 0.3041 and parameters: {'lr': 0.013980147970476612, 'weight_decay': 0.0067348391493696385, 'dropout': 0.5297094581060326, 'patience': 100, 'lr_reduce_freq': 90, 'spt_alg': 'kruskal', 'spt_attr': 'similarity', 'manifold': 'PoincareBall', 'num_layers': 3, 'num_adj': 4, 'add_rate': 0.11687190559858648, 'tem': 1.2576747388798712, 'consis_rate': 1.3708985313528594, 'use_att': 0}. Best is trial 13 with value: 0.8042999999999999.[0m
[32m[I 2022-06-21 21:35:59,237][0m Trial 15 finished with value: 0.8031 and parameters: {'lr': 0.0033414220476968063, 'weight_decay': 0.0014835926147217415, 'dropout': 0.7030232206885655, 'patience': 100, 'lr_reduce_freq': 90, 'spt_alg': 'prim', 'spt_attr': 'edge_degree', 'manifold': 'PoincareBall', 'num_layers': 3, 'num_adj': 6, 'add_rate': 0.25351164825001316, 'tem': 0.5462642123534536, 'consis_rate': 1.4268901384704944, 'use_att': 0}. Best is trial 13 with value: 0.8042999999999999.[0m
[32m[I 2022-06-21 21:46:14,286][0m Trial 16 finished with value: 0.7915 and parameters: {'lr': 0.003220279600248411, 'weight_decay': 0.001970983700887187, 'dropout': 0.7838786685437618, 'patience': 100, 'lr_reduce_freq': 70, 'spt_alg': 'prim', 'spt_attr': 'edge_degree', 'manifold': 'PoincareBall', 'num_layers': 3, 'num_adj': 6, 'add_rate': 0.2567636127009405, 'tem': 0.4985419074991961, 'consis_rate': 1.328015328350495, 'use_att': 0}. Best is trial 13 with value: 0.8042999999999999.[0m
[32m[I 2022-06-21 21:52:36,094][0m Trial 17 finished with value: 0.2303 and parameters: {'lr': 0.0016212516578888454, 'weight_decay': 0.005910448859250005, 'dropout': 0.736182313912665, 'patience': 80, 'lr_reduce_freq': 50, 'spt_alg': 'prim', 'spt_attr': 'edge_degree', 'manifold': 'PoincareBall', 'num_layers': 3, 'num_adj': 6, 'add_rate': 0.27011096352189906, 'tem': 1.0518841278331652, 'consis_rate': 1.6230518673966812, 'use_att': 0}. Best is trial 13 with value: 0.8042999999999999.[0m
cmd: --dataset cora --model HGCN --c None --dim 64
cur_param: {'lr': 0.02240234092533529, 'weight_decay': 0.24333776547523459, 'dropout': 0.059176403648582135, 'patience': 60, 'lr_reduce_freq': 110, 'spt_alg': 'kruskal', 'spt_attr': 'edge_degree', 'manifold': 'PoincareBall', 'num_layers': 4, 'num_adj': 2, 'add_rate': 0.7521180612863883, 'tem': 0.3632364443687245, 'consis_rate': 1.041241387838485, 'use_att': 1}
mean: 0.319
[0.319 0.319 0.319 0.319 0.319 0.319 0.319 0.319 0.319 0.319]
cur_param: {'lr': 0.0022166910150567378, 'weight_decay': 0.04805126028825058, 'dropout': 0.6125073480535207, 'patience': 80, 'lr_reduce_freq': 110, 'spt_alg': 'kruskal', 'spt_attr': 'edge_degree', 'manifold': 'PoincareBall', 'num_layers': 4, 'num_adj': 8, 'add_rate': 0.9491930546415658, 'tem': 1.3921558519010429, 'consis_rate': 1.880851381547478, 'use_att': 1}
mean: 0.2359
[0.319 0.358 0.091 0.064 0.149 0.309 0.103 0.319 0.319 0.328]
cur_param: {'lr': 0.009242013328322706, 'weight_decay': 0.0023905401239084174, 'dropout': 0.32850636755545226, 'patience': 60, 'lr_reduce_freq': 150, 'spt_alg': 'prim', 'spt_attr': 'similarity', 'manifold': 'PoincareBall', 'num_layers': 3, 'num_adj': 6, 'add_rate': 0.3738694304329654, 'tem': 0.3591689918106654, 'consis_rate': 0.6635893899962408, 'use_att': 0}
mean: 0.7939
[0.788 0.789 0.786 0.796 0.791 0.792 0.78  0.808 0.807 0.802]
cur_param: {'lr': 0.004156676796661114, 'weight_decay': 0.0009033802567493895, 'dropout': 0.18943205713544714, 'patience': 80, 'lr_reduce_freq': 70, 'spt_alg': 'prim', 'spt_attr': 'similarity', 'manifold': 'PoincareBall', 'num_layers': 4, 'num_adj': 6, 'add_rate': 0.5435887045389672, 'tem': 0.2889293130225046, 'consis_rate': 0.43160951596566693, 'use_att': 1}
mean: 0.7799
[0.785 0.795 0.792 0.789 0.759 0.77  0.765 0.775 0.789 0.78 ]
cur_param: {'lr': 0.006092531907062152, 'weight_decay': 0.03091904407533941, 'dropout': 0.8779587440888671, 'patience': 100, 'lr_reduce_freq': 150, 'spt_alg': 'kruskal', 'spt_attr': 'edge_degree', 'manifold': 'PoincareBall', 'num_layers': 3, 'num_adj': 8, 'add_rate': 0.3847027476849846, 'tem': 0.8873428398508547, 'consis_rate': 0.8897115113281253, 'use_att': 0}
mean: 0.31679999999999997
[0.317 0.317 0.319 0.319 0.319 0.294 0.319 0.319 0.326 0.319]
cur_param: {'lr': 0.035465314723220724, 'weight_decay': 0.002315469997913045, 'dropout': 0.12173587890963083, 'patience': 60, 'lr_reduce_freq': 110, 'spt_alg': 'prim', 'spt_attr': 'similarity', 'manifold': 'PoincareBall', 'num_layers': 3, 'num_adj': 4, 'add_rate': 0.3637858634733462, 'tem': 0.6694473466690386, 'consis_rate': 0.8718675367169839, 'use_att': 1}
mean: 0.7869
[0.797 0.789 0.784 0.757 0.791 0.809 0.795 0.804 0.787 0.756]
cur_param: {'lr': 0.09560835996498317, 'weight_decay': 0.003197443464476491, 'dropout': 0.47651111398441076, 'patience': 60, 'lr_reduce_freq': 130, 'spt_alg': 'kruskal', 'spt_attr': 'similarity', 'manifold': 'PoincareBall', 'num_layers': 3, 'num_adj': 2, 'add_rate': 0.21718752328454793, 'tem': 0.7875753560549263, 'consis_rate': 0.9229557996479394, 'use_att': 1}
mean: 0.6142000000000001
[0.496 0.676 0.537 0.522 0.699 0.679 0.641 0.692 0.542 0.658]
cur_param: {'lr': 0.040375339741148916, 'weight_decay': 0.09001382846361036, 'dropout': 0.21015709580353995, 'patience': 80, 'lr_reduce_freq': 130, 'spt_alg': 'prim', 'spt_attr': 'similarity', 'manifold': 'PoincareBall', 'num_layers': 4, 'num_adj': 4, 'add_rate': 0.6656743742586657, 'tem': 1.9436940409208234, 'consis_rate': 1.009915865112578, 'use_att': 1}
mean: 0.319
[0.319 0.319 0.319 0.319 0.319 0.319 0.319 0.319 0.319 0.319]
cur_param: {'lr': 0.0063172920547645275, 'weight_decay': 0.1794753894860093, 'dropout': 0.6560812512711108, 'patience': 80, 'lr_reduce_freq': 50, 'spt_alg': 'prim', 'spt_attr': 'similarity', 'manifold': 'PoincareBall', 'num_layers': 3, 'num_adj': 8, 'add_rate': 0.780612998237264, 'tem': 1.0333995628289763, 'consis_rate': 1.667125976980823, 'use_att': 0}
mean: 0.2863
[0.319 0.319 0.149 0.319 0.319 0.318 0.143 0.319 0.339 0.319]
cur_param: {'lr': 0.02707883161788249, 'weight_decay': 0.0006631015396905319, 'dropout': 0.25100156145003827, 'patience': 100, 'lr_reduce_freq': 110, 'spt_alg': 'kruskal', 'spt_attr': 'similarity', 'manifold': 'PoincareBall', 'num_layers': 3, 'num_adj': 2, 'add_rate': 0.8294380428922626, 'tem': 0.7976317441087972, 'consis_rate': 0.478127632297169, 'use_att': 1}
mean: 0.795
[0.791 0.81  0.771 0.762 0.801 0.813 0.82  0.788 0.793 0.801]
cur_param: {'lr': 0.0011756212085300487, 'weight_decay': 0.009510867159550547, 'dropout': 0.37669205027532615, 'patience': 100, 'lr_reduce_freq': 70, 'spt_alg': 'kruskal', 'spt_attr': 'similarity', 'manifold': 'PoincareBall', 'num_layers': 3, 'num_adj': 2, 'add_rate': 0.888476135797745, 'tem': 1.40695055311091, 'consis_rate': 0.20077102951284465, 'use_att': 1}
mean: 0.3186
[0.25  0.271 0.357 0.319 0.409 0.394 0.379 0.257 0.42  0.13 ]
cur_param: {'lr': 0.014777019735714738, 'weight_decay': 0.000625888957000836, 'dropout': 0.3495421484668492, 'patience': 100, 'lr_reduce_freq': 150, 'spt_alg': 'prim', 'spt_attr': 'similarity', 'manifold': 'PoincareBall', 'num_layers': 3, 'num_adj': 6, 'add_rate': 0.14113713931882965, 'tem': 0.5634324584354429, 'consis_rate': 0.5278631766495877, 'use_att': 0}
mean: 0.7994000000000001
[0.801 0.796 0.795 0.804 0.805 0.791 0.785 0.8   0.81  0.807]
cur_param: {'lr': 0.013394886813206924, 'weight_decay': 0.0008799373093508388, 'dropout': 0.38781925493945807, 'patience': 100, 'lr_reduce_freq': 90, 'spt_alg': 'kruskal', 'spt_attr': 'similarity', 'manifold': 'PoincareBall', 'num_layers': 3, 'num_adj': 4, 'add_rate': 0.11313202776342242, 'tem': 0.645311080825139, 'consis_rate': 1.3852649051638908, 'use_att': 0}
mean: 0.8028000000000001
[0.805 0.804 0.789 0.814 0.794 0.8   0.805 0.814 0.799 0.804]
cur_param: {'lr': 0.010889275137400454, 'weight_decay': 0.0005138297662871452, 'dropout': 0.4790153144778555, 'patience': 100, 'lr_reduce_freq': 90, 'spt_alg': 'prim', 'spt_attr': 'similarity', 'manifold': 'PoincareBall', 'num_layers': 3, 'num_adj': 6, 'add_rate': 0.12169544037600719, 'tem': 0.5897996788487279, 'consis_rate': 1.3753951369922, 'use_att': 0}
mean: 0.8042999999999999
[0.805 0.816 0.805 0.804 0.797 0.795 0.814 0.807 0.805 0.795]
cur_param: {'lr': 0.013980147970476612, 'weight_decay': 0.0067348391493696385, 'dropout': 0.5297094581060326, 'patience': 100, 'lr_reduce_freq': 90, 'spt_alg': 'kruskal', 'spt_attr': 'similarity', 'manifold': 'PoincareBall', 'num_layers': 3, 'num_adj': 4, 'add_rate': 0.11687190559858648, 'tem': 1.2576747388798712, 'consis_rate': 1.3708985313528594, 'use_att': 0}
mean: 0.3041
[0.319 0.281 0.319 0.319 0.319 0.302 0.319 0.28  0.348 0.235]
cur_param: {'lr': 0.0033414220476968063, 'weight_decay': 0.0014835926147217415, 'dropout': 0.7030232206885655, 'patience': 100, 'lr_reduce_freq': 90, 'spt_alg': 'prim', 'spt_attr': 'edge_degree', 'manifold': 'PoincareBall', 'num_layers': 3, 'num_adj': 6, 'add_rate': 0.25351164825001316, 'tem': 0.5462642123534536, 'consis_rate': 1.4268901384704944, 'use_att': 0}
mean: 0.8031
[0.814 0.788 0.807 0.81  0.808 0.812 0.776 0.802 0.798 0.816]
cur_param: {'lr': 0.003220279600248411, 'weight_decay': 0.001970983700887187, 'dropout': 0.7838786685437618, 'patience': 100, 'lr_reduce_freq': 70, 'spt_alg': 'prim', 'spt_attr': 'edge_degree', 'manifold': 'PoincareBall', 'num_layers': 3, 'num_adj': 6, 'add_rate': 0.2567636127009405, 'tem': 0.4985419074991961, 'consis_rate': 1.328015328350495, 'use_att': 0}
mean: 0.7915
[0.817 0.789 0.777 0.805 0.806 0.801 0.753 0.794 0.784 0.789]
cur_param: {'lr': 0.0016212516578888454, 'weight_decay': 0.005910448859250005, 'dropout': 0.736182313912665, 'patience': 80, 'lr_reduce_freq': 50, 'spt_alg': 'prim', 'spt_attr': 'edge_degree', 'manifold': 'PoincareBall', 'num_layers': 3, 'num_adj': 6, 'add_rate': 0.27011096352189906, 'tem': 1.0518841278331652, 'consis_rate': 1.6230518673966812, 'use_att': 0}
mean: 0.2303
[0.218 0.327 0.19  0.174 0.148 0.187 0.208 0.19  0.317 0.344]
cur_param: {'lr': 0.0028963761964280773, 'weight_decay': 0.01575066440393021, 'dropout': 0.9014458778386059, 'patience': 100, 'lr_reduce_freq': 90, 'spt_alg': 'prim', 'spt_attr': 'edge_degree', 'manifold': 'PoincareBall', 'num_layers': 4, 'num_adj': 8, 'add_rate': 0.5335514780513412, 'tem': 1.8777746805335238, 'consis_rate': 1.235324827118096, 'use_att': 0}[32m[I 2022-06-21 22:03:46,497][0m Trial 18 finished with value: 0.25420000000000004 and parameters: {'lr': 0.0028963761964280773, 'weight_decay': 0.01575066440393021, 'dropout': 0.9014458778386059, 'patience': 100, 'lr_reduce_freq': 90, 'spt_alg': 'prim', 'spt_attr': 'edge_degree', 'manifold': 'PoincareBall', 'num_layers': 4, 'num_adj': 8, 'add_rate': 0.5335514780513412, 'tem': 1.8777746805335238, 'consis_rate': 1.235324827118096, 'use_att': 0}. Best is trial 13 with value: 0.8042999999999999.[0m
[32m[I 2022-06-21 22:10:34,260][0m Trial 19 finished with value: 0.8029 and parameters: {'lr': 0.00573132258522221, 'weight_decay': 0.0014097428351328607, 'dropout': 0.5874589698308891, 'patience': 100, 'lr_reduce_freq': 70, 'spt_alg': 'prim', 'spt_attr': 'edge_degree', 'manifold': 'PoincareBall', 'num_layers': 3, 'num_adj': 6, 'add_rate': 0.4620378490931516, 'tem': 0.26654355450322065, 'consis_rate': 1.561820822501704, 'use_att': 0}. Best is trial 13 with value: 0.8042999999999999.[0m
[32m[I 2022-06-21 22:17:55,338][0m Trial 20 finished with value: 0.4383 and parameters: {'lr': 0.0010271080157469212, 'weight_decay': 0.003521699001334221, 'dropout': 0.7389710190570524, 'patience': 80, 'lr_reduce_freq': 90, 'spt_alg': 'prim', 'spt_attr': 'edge_degree', 'manifold': 'PoincareBall', 'num_layers': 3, 'num_adj': 4, 'add_rate': 0.2096865253314843, 'tem': 1.6551391327521099, 'consis_rate': 1.8787264750656896, 'use_att': 0}. Best is trial 13 with value: 0.8042999999999999.[0m
[32m[I 2022-06-21 22:24:56,473][0m Trial 21 finished with value: 0.8036 and parameters: {'lr': 0.005645848092960048, 'weight_decay': 0.0013364450818974193, 'dropout': 0.6226720126651097, 'patience': 100, 'lr_reduce_freq': 70, 'spt_alg': 'prim', 'spt_attr': 'edge_degree', 'manifold': 'PoincareBall', 'num_layers': 3, 'num_adj': 6, 'add_rate': 0.46416629264463694, 'tem': 0.2060058324419362, 'consis_rate': 1.6024015224599995, 'use_att': 0}. Best is trial 13 with value: 0.8042999999999999.[0m
[32m[I 2022-06-21 22:31:11,985][0m Trial 22 finished with value: 0.8052000000000001 and parameters: {'lr': 0.009119522488736207, 'weight_decay': 0.0012896306632951178, 'dropout': 0.5162558640057734, 'patience': 100, 'lr_reduce_freq': 70, 'spt_alg': 'prim', 'spt_attr': 'edge_degree', 'manifold': 'PoincareBall', 'num_layers': 3, 'num_adj': 6, 'add_rate': 0.6314976291872508, 'tem': 0.46718368126309334, 'consis_rate': 1.520594778437043, 'use_att': 0}. Best is trial 22 with value: 0.8052000000000001.[0m
[32m[I 2022-06-21 22:37:08,410][0m Trial 23 finished with value: 0.7993 and parameters: {'lr': 0.009237433683187407, 'weight_decay': 0.0005256373771613844, 'dropout': 0.535132205463962, 'patience': 100, 'lr_reduce_freq': 50, 'spt_alg': 'prim', 'spt_attr': 'edge_degree', 'manifold': 'PoincareBall', 'num_layers': 3, 'num_adj': 6, 'add_rate': 0.6310296168168829, 'tem': 0.2317921711624153, 'consis_rate': 1.7965654466672774, 'use_att': 0}. Best is trial 22 with value: 0.8052000000000001.[0m
[32m[I 2022-06-21 22:45:08,051][0m Trial 24 finished with value: 0.7961 and parameters: {'lr': 0.00773045428444512, 'weight_decay': 0.001104179198096057, 'dropout': 0.46133862052758295, 'patience': 100, 'lr_reduce_freq': 70, 'spt_alg': 'prim', 'spt_attr': 'edge_degree', 'manifold': 'PoincareBall', 'num_layers': 3, 'num_adj': 8, 'add_rate': 0.6382666299692389, 'tem': 0.4351550225658968, 'consis_rate': 1.730657453655351, 'use_att': 0}. Best is trial 22 with value: 0.8052000000000001.[0m
[32m[I 2022-06-21 22:53:20,142][0m Trial 25 finished with value: 0.78 and parameters: {'lr': 0.005221986248523117, 'weight_decay': 0.005397710263016885, 'dropout': 0.45636918896813095, 'patience': 80, 'lr_reduce_freq': 70, 'spt_alg': 'prim', 'spt_attr': 'edge_degree', 'manifold': 'PoincareBall', 'num_layers': 3, 'num_adj': 6, 'add_rate': 0.4563437782491085, 'tem': 0.20489507372451984, 'consis_rate': 1.5192858861701408, 'use_att': 0}. Best is trial 22 with value: 0.8052000000000001.[0m
[32m[I 2022-06-21 22:56:59,502][0m Trial 26 finished with value: 0.3099 and parameters: {'lr': 0.01944681355115375, 'weight_decay': 0.01336370186724596, 'dropout': 0.5570395541342358, 'patience': 100, 'lr_reduce_freq': 50, 'spt_alg': 'prim', 'spt_attr': 'edge_degree', 'manifold': 'PoincareBall', 'num_layers': 3, 'num_adj': 4, 'add_rate': 0.6881683277191791, 'tem': 0.7084030713232556, 'consis_rate': 1.1783639099604473, 'use_att': 0}. Best is trial 22 with value: 0.8052000000000001.[0m
