[32m[I 2022-06-26 23:29:49,333][0m Trial 70 finished with value: 0.8281999999999998 and parameters: {'lr': 0.0050377024135704294, 'weight_decay': 0.0007974034777024048, 'dropout': 0.7088886318937898, 'patience': 80, 'lr_reduce_freq': 90, 'spt_alg': 'prim', 'spt_attr': 'edge_degree', 'manifold': 'PoincareBall', 'num_layers': 3, 'dim': 336, 'num_adj': 6, 'add_rate': 0.4924438523129478, 'tem': 1.1263229568931772, 'consis_rate': 1.6925325255379633, 'use_att': 1}. Best is trial 70 with value: 0.8281999999999998.[0m

mean: 0.8099999999999999
[0.805 0.809 0.809 0.807 0.823 0.788 0.811 0.827 0.811 0.81 ]
cur_param: {'lr': 0.003670272995220415, 'weight_decay': 0.0005707696764810353, 'dropout': 0.5878370422510737, 'patience': 100, 'lr_reduce_freq': 90, 'spt_alg': 'kruskal', 'spt_attr': 'edge_degree', 'manifold': 'PoincareBall', 'num_layers': 3, 'dim': 268, 'num_adj': 6, 'add_rate': 0.33089472468173725, 'tem': 0.843829799774127, 'consis_rate': 1.7426672189088888, 'use_att': 1}
mean: 0.8170999999999999
[0.808 0.825 0.805 0.822 0.829 0.813 0.804 0.821 0.819 0.825]
cur_param: {'lr': 0.0032805014899363084, 'weight_decay': 0.000499844454223118, 'dropout': 0.5203212215777839, 'patience': 110, 'lr_reduce_freq': 80, 'spt_alg': 'kruskal', 'spt_attr': 'edge_degree', 'manifold': 'PoincareBall', 'num_layers': 3, 'dim': 296, 'num_adj': 6, 'add_rate': 0.39001576072836086, 'tem': 0.815790248845823, 'consis_rate': 1.9946019958628718, 'use_att': 1}
mean: 0.8093
[0.813 0.816 0.824 0.786 0.802 0.81  0.824 0.789 0.802 0.827]
cur_param: {'lr': 0.002696764624203404, 'weight_decay': 0.0006616708835861571, 'dropout': 0.6968177419530508, 'patience': 100, 'lr_reduce_freq': 80, 'spt_alg': 'kruskal', 'spt_attr': 'edge_degree', 'manifold': 'PoincareBall', 'num_layers': 3, 'dim': 280, 'num_adj': 6, 'add_rate': 0.3101570120735873, 'tem': 0.8518380107649054, 'consis_rate': 1.909789442497908, 'use_att': 1}
mean: 0.8148
[0.816 0.819 0.806 0.827 0.81  0.805 0.818 0.813 0.817 0.817]
cur_param: {'lr': 0.004226928867141102, 'weight_decay': 0.00047606273970038316, 'dropout': 0.5808163197773748, 'patience': 90, 'lr_reduce_freq': 80, 'spt_alg': 'prim', 'spt_attr': 'edge_degree', 'manifold': 'PoincareBall', 'num_layers': 3, 'dim': 288, 'num_adj': 6, 'add_rate': 0.3490647096038247, 'tem': 0.8346326019667766, 'consis_rate': 1.8196156684988534, 'use_att': 1}
mean: 0.8156000000000001
[0.825 0.803 0.826 0.817 0.825 0.807 0.815 0.801 0.814 0.823]
cur_param: {'lr': 0.004678858590779894, 'weight_decay': 0.0005289119178261054, 'dropout': 0.61252173766926, 'patience': 100, 'lr_reduce_freq': 90, 'spt_alg': 'kruskal', 'spt_attr': 'edge_degree', 'manifold': 'PoincareBall', 'num_layers': 3, 'dim': 308, 'num_adj': 6, 'add_rate': 0.41508121503967443, 'tem': 0.800746297301631, 'consis_rate': 1.9397211673009274, 'use_att': 1}
mean: 0.8150000000000001
[0.803 0.837 0.822 0.81  0.801 0.794 0.835 0.819 0.814 0.815]
cur_param: {'lr': 0.0038656943528901605, 'weight_decay': 0.0005596961284712677, 'dropout': 0.6283838397911137, 'patience': 90, 'lr_reduce_freq': 80, 'spt_alg': 'kruskal', 'spt_attr': 'edge_degree', 'manifold': 'PoincareBall', 'num_layers': 3, 'dim': 276, 'num_adj': 6, 'add_rate': 0.3752977197368568, 'tem': 0.882947597757066, 'consis_rate': 1.9604906288774568, 'use_att': 1}
mean: 0.8189
[0.823 0.827 0.828 0.807 0.811 0.805 0.828 0.827 0.826 0.807]
cur_param: {'lr': 0.0049393214219449096, 'weight_decay': 0.0006016731909833091, 'dropout': 0.6733513583337579, 'patience': 80, 'lr_reduce_freq': 90, 'spt_alg': 'kruskal', 'spt_attr': 'similarity', 'manifold': 'Hyperboloid', 'num_layers': 3, 'dim': 296, 'num_adj': 4, 'add_rate': 0.472443481054721, 'tem': 0.8595250696233283, 'consis_rate': 1.7282177988496426, 'use_att': 1}
mean: 0.8109999999999999
[0.828 0.805 0.792 0.818 0.822 0.799 0.801 0.829 0.811 0.805]
cur_param: {'lr': 0.0039084503291101184, 'weight_decay': 0.0005602500380369658, 'dropout': 0.6272395653579571, 'patience': 90, 'lr_reduce_freq': 80, 'spt_alg': 'kruskal', 'spt_attr': 'edge_degree', 'manifold': 'PoincareBall', 'num_layers': 3, 'dim': 276, 'num_adj': 6, 'add_rate': 0.37573042226292325, 'tem': 0.8824874475250156, 'consis_rate': 1.9695406972672678, 'use_att': 1}
mean: 0.8173
[0.822 0.829 0.831 0.818 0.793 0.813 0.816 0.821 0.827 0.803]
cur_param: {'lr': 0.0030590619457960596, 'weight_decay': 0.000583932121484587, 'dropout': 0.6417168569869617, 'patience': 90, 'lr_reduce_freq': 80, 'spt_alg': 'kruskal', 'spt_attr': 'edge_degree', 'manifold': 'PoincareBall', 'num_layers': 3, 'dim': 284, 'num_adj': 6, 'add_rate': 0.39863616337539526, 'tem': 0.8383973260822373, 'consis_rate': 1.94891956794151, 'use_att': 1}
mean: 0.8158999999999998
[0.815 0.82  0.805 0.815 0.825 0.818 0.816 0.817 0.809 0.819]
cur_param: {'lr': 0.0035706301374477745, 'weight_decay': 0.0006288862850536658, 'dropout': 0.5484129194795256, 'patience': 90, 'lr_reduce_freq': 80, 'spt_alg': 'kruskal', 'spt_attr': 'edge_degree', 'manifold': 'PoincareBall', 'num_layers': 3, 'dim': 268, 'num_adj': 6, 'add_rate': 0.35204447145364787, 'tem': 0.817028560773498, 'consis_rate': 1.9848020330865692, 'use_att': 1}
mean: 0.8161999999999999
[0.82  0.814 0.806 0.817 0.832 0.81  0.821 0.802 0.816 0.824]
cur_param: {'lr': 0.004504711734828637, 'weight_decay': 0.0004902040271131098, 'dropout': 0.6328218784558278, 'patience': 100, 'lr_reduce_freq': 80, 'spt_alg': 'kruskal', 'spt_attr': 'edge_degree', 'manifold': 'PoincareBall', 'num_layers': 3, 'dim': 216, 'num_adj': 6, 'add_rate': 0.30001369383399623, 'tem': 0.8725045599191691, 'consis_rate': 1.9264305550546879, 'use_att': 1}
mean: 0.8192999999999999
[0.812 0.827 0.82  0.804 0.82  0.793 0.817 0.836 0.828 0.836]
cur_param: {'lr': 0.005373543964915981, 'weight_decay': 0.0004866954038191994, 'dropout': 0.6362519611624304, 'patience': 100, 'lr_reduce_freq': 80, 'spt_alg': 'kruskal', 'spt_attr': 'edge_degree', 'manifold': 'PoincareBall', 'num_layers': 3, 'dim': 224, 'num_adj': 6, 'add_rate': 0.3039193902201917, 'tem': 0.827070494480596, 'consis_rate': 1.8791744094853506, 'use_att': 1}
mean: 0.8140000000000001
[0.817 0.808 0.811 0.823 0.823 0.789 0.817 0.818 0.813 0.821]
cur_param: {'lr': 0.005794012041582736, 'weight_decay': 0.00043870492715905785, 'dropout': 0.6591319186372263, 'patience': 100, 'lr_reduce_freq': 80, 'spt_alg': 'kruskal', 'spt_attr': 'edge_degree', 'manifold': 'PoincareBall', 'num_layers': 3, 'dim': 216, 'num_adj': 6, 'add_rate': 0.3212417227647639, 'tem': 0.8660252268420414, 'consis_rate': 1.9171982501609723, 'use_att': 0}
mean: 0.8086
[0.801 0.832 0.811 0.816 0.809 0.802 0.815 0.814 0.805 0.781]
cur_param: {'lr': 0.006371900589681151, 'weight_decay': 0.0005239337624277751, 'dropout': 0.727071416409221, 'patience': 100, 'lr_reduce_freq': 80, 'spt_alg': 'kruskal', 'spt_attr': 'edge_degree', 'manifold': 'PoincareBall', 'num_layers': 3, 'dim': 232, 'num_adj': 6, 'add_rate': 0.3357935763776414, 'tem': 0.8473551357582947, 'consis_rate': 1.9322641797234628, 'use_att': 1}
mean: 0.8164
[0.821 0.832 0.833 0.801 0.824 0.818 0.796 0.816 0.819 0.804]
cur_param: {'lr': 0.004498359500357777, 'weight_decay': 0.0007517970394688636, 'dropout': 0.6899391435392251, 'patience': 110, 'lr_reduce_freq': 110, 'spt_alg': 'kruskal', 'spt_attr': 'edge_degree', 'manifold': 'PoincareBall', 'num_layers': 3, 'dim': 212, 'num_adj': 6, 'add_rate': 0.5387158793518484, 'tem': 0.9037488486688374, 'consis_rate': 1.8401142123664962, 'use_att': 1}
mean: 0.8157
[0.819 0.828 0.803 0.807 0.83  0.811 0.821 0.812 0.816 0.81 ]
cur_param: {'lr': 0.005072969319991233, 'weight_decay': 0.0007848656789685412, 'dropout': 0.7099916694274472, 'patience': 80, 'lr_reduce_freq': 80, 'spt_alg': 'kruskal', 'spt_attr': 'edge_degree', 'manifold': 'PoincareBall', 'num_layers': 3, 'dim': 316, 'num_adj': 6, 'add_rate': 0.4894087024970862, 'tem': 0.8110950488622811, 'consis_rate': 1.6912459739925825, 'use_att': 1}
mean: 0.8202
[0.824 0.834 0.825 0.84  0.822 0.811 0.8   0.813 0.822 0.811]
cur_param: {'lr': 0.0050377024135704294, 'weight_decay': 0.0007974034777024048, 'dropout': 0.7088886318937898, 'patience': 80, 'lr_reduce_freq': 90, 'spt_alg': 'prim', 'spt_attr': 'edge_degree', 'manifold': 'PoincareBall', 'num_layers': 3, 'dim': 336, 'num_adj': 6, 'add_rate': 0.4924438523129478, 'tem': 1.1263229568931772, 'consis_rate': 1.6925325255379633, 'use_att': 1}
mean: 0.8281999999999998
[0.826 0.822 0.828 0.822 0.834 0.83  0.836 0.828 0.834 0.822]
cur_param: {'lr': 0.005053185408316613, 'weight_decay': 0.0007791895873040912, 'dropout': 0.7063695410956804, 'patience': 80, 'lr_reduce_freq': 90, 'spt_alg': 'prim', 'spt_attr': 'edge_degree', 'manifold': 'PoincareBall', 'num_layers': 3, 'dim': 332, 'num_adj': 6, 'add_rate': 0.4861852392798021, 'tem': 1.0767117951621117, 'consis_rate': 1.6793610813170057, 'use_att': 1}[32m[I 2022-06-26 23:47:16,281][0m Trial 71 finished with value: 0.8205 and parameters: {'lr': 0.005053185408316613, 'weight_decay': 0.0007791895873040912, 'dropout': 0.7063695410956804, 'patience': 80, 'lr_reduce_freq': 90, 'spt_alg': 'prim', 'spt_attr': 'edge_degree', 'manifold': 'PoincareBall', 'num_layers': 3, 'dim': 332, 'num_adj': 6, 'add_rate': 0.4861852392798021, 'tem': 1.0767117951621117, 'consis_rate': 1.6793610813170057, 'use_att': 1}. Best is trial 70 with value: 0.8281999999999998.[0m
[32m[I 2022-06-27 00:04:46,480][0m Trial 72 finished with value: 0.8163 and parameters: {'lr': 0.0051572484621677985, 'weight_decay': 0.0007805932724964178, 'dropout': 0.7096364720855789, 'patience': 80, 'lr_reduce_freq': 100, 'spt_alg': 'prim', 'spt_attr': 'edge_degree', 'manifold': 'PoincareBall', 'num_layers': 3, 'dim': 332, 'num_adj': 6, 'add_rate': 0.48853468860211535, 'tem': 1.1016234333006332, 'consis_rate': 1.6486057950505986, 'use_att': 1}. Best is trial 70 with value: 0.8281999999999998.[0m
[32m[I 2022-06-27 00:21:36,632][0m Trial 73 finished with value: 0.818 and parameters: {'lr': 0.00547188616392486, 'weight_decay': 0.0007996891312858483, 'dropout': 0.7027130670889169, 'patience': 80, 'lr_reduce_freq': 90, 'spt_alg': 'prim', 'spt_attr': 'edge_degree', 'manifold': 'PoincareBall', 'num_layers': 3, 'dim': 320, 'num_adj': 6, 'add_rate': 0.4574091857300735, 'tem': 1.0980611918249763, 'consis_rate': 1.6861101998803312, 'use_att': 1}. Best is trial 70 with value: 0.8281999999999998.[0m
[32m[I 2022-06-27 00:39:18,700][0m Trial 74 finished with value: 0.8205 and parameters: {'lr': 0.004981648166328675, 'weight_decay': 0.0007733483406357571, 'dropout': 0.7251171653511136, 'patience': 80, 'lr_reduce_freq': 90, 'spt_alg': 'prim', 'spt_attr': 'edge_degree', 'manifold': 'PoincareBall', 'num_layers': 3, 'dim': 336, 'num_adj': 6, 'add_rate': 0.4981218241213921, 'tem': 1.1253414079981885, 'consis_rate': 1.632720083682671, 'use_att': 1}. Best is trial 70 with value: 0.8281999999999998.[0m
[32m[I 2022-06-27 00:57:02,058][0m Trial 75 finished with value: 0.8248 and parameters: {'lr': 0.005037653636875082, 'weight_decay': 0.000731927054705973, 'dropout': 0.7477187600767842, 'patience': 80, 'lr_reduce_freq': 90, 'spt_alg': 'prim', 'spt_attr': 'edge_degree', 'manifold': 'PoincareBall', 'num_layers': 3, 'dim': 336, 'num_adj': 6, 'add_rate': 0.4995884778605304, 'tem': 1.127980990389835, 'consis_rate': 1.6371578419234345, 'use_att': 1}. Best is trial 70 with value: 0.8281999999999998.[0m
[32m[I 2022-06-27 01:14:49,618][0m Trial 76 finished with value: 0.821 and parameters: {'lr': 0.005013017827555491, 'weight_decay': 0.0007738510393627313, 'dropout': 0.7523093603659632, 'patience': 80, 'lr_reduce_freq': 100, 'spt_alg': 'prim', 'spt_attr': 'edge_degree', 'manifold': 'PoincareBall', 'num_layers': 3, 'dim': 336, 'num_adj': 6, 'add_rate': 0.4769436254417857, 'tem': 1.1322341536831806, 'consis_rate': 1.6362787437131487, 'use_att': 1}. Best is trial 70 with value: 0.8281999999999998.[0m
[32m[I 2022-06-27 01:19:48,880][0m Trial 77 finished with value: 0.8070999999999999 and parameters: {'lr': 0.004813445856079344, 'weight_decay': 0.000738991511850291, 'dropout': 0.7523871270504794, 'patience': 80, 'lr_reduce_freq': 100, 'spt_alg': 'prim', 'spt_attr': 'similarity', 'manifold': 'PoincareBall', 'num_layers': 3, 'dim': 336, 'num_adj': 6, 'add_rate': 0.4999059785697976, 'tem': 1.1333544716405626, 'consis_rate': 1.6212947343588568, 'use_att': 0}. Best is trial 70 with value: 0.8281999999999998.[0m
[32m[I 2022-06-27 01:42:08,476][0m Trial 78 finished with value: 0.8165000000000001 and parameters: {'lr': 0.0058500589210670915, 'weight_decay': 0.0007162051771947082, 'dropout': 0.797287431693968, 'patience': 80, 'lr_reduce_freq': 90, 'spt_alg': 'prim', 'spt_attr': 'edge_degree', 'manifold': 'Hyperboloid', 'num_layers': 3, 'dim': 332, 'num_adj': 6, 'add_rate': 0.4760026505635223, 'tem': 1.1533242065923905, 'consis_rate': 1.6376187974116319, 'use_att': 1}. Best is trial 70 with value: 0.8281999999999998.[0m
[32m[I 2022-06-27 01:59:42,908][0m Trial 79 finished with value: 0.82 and parameters: {'lr': 0.006299084474969543, 'weight_decay': 0.0007657473465614366, 'dropout': 0.7484224701390303, 'patience': 80, 'lr_reduce_freq': 100, 'spt_alg': 'prim', 'spt_attr': 'edge_degree', 'manifold': 'PoincareBall', 'num_layers': 3, 'dim': 328, 'num_adj': 6, 'add_rate': 0.5097125589378878, 'tem': 1.1369706327159672, 'consis_rate': 1.580550144466089, 'use_att': 1}. Best is trial 70 with value: 0.8281999999999998.[0m
[32m[I 2022-06-27 02:16:31,117][0m Trial 80 finished with value: 0.8154999999999999 and parameters: {'lr': 0.005032199707696566, 'weight_decay': 0.0007734119678847637, 'dropout': 0.7662068082477844, 'patience': 80, 'lr_reduce_freq': 90, 'spt_alg': 'prim', 'spt_attr': 'edge_degree', 'manifold': 'PoincareBall', 'num_layers': 3, 'dim': 332, 'num_adj': 6, 'add_rate': 0.4663099627458372, 'tem': 1.114798465615045, 'consis_rate': 1.6003927358520202, 'use_att': 1}. Best is trial 70 with value: 0.8281999999999998.[0m
[32m[I 2022-06-27 02:34:10,565][0m Trial 81 finished with value: 0.818 and parameters: {'lr': 0.005116191207024923, 'weight_decay': 0.0007376798786742269, 'dropout': 0.7163402708155393, 'patience': 80, 'lr_reduce_freq': 90, 'spt_alg': 'prim', 'spt_attr': 'edge_degree', 'manifold': 'PoincareBall', 'num_layers': 3, 'dim': 324, 'num_adj': 6, 'add_rate': 0.49001923756716476, 'tem': 1.073964483586729, 'consis_rate': 1.6576929163085263, 'use_att': 1}. Best is trial 70 with value: 0.8281999999999998.[0m
[32m[I 2022-06-27 02:51:30,088][0m Trial 82 finished with value: 0.8185 and parameters: {'lr': 0.00559915052856242, 'weight_decay': 0.0007997422578698561, 'dropout': 0.7284877388552758, 'patience': 80, 'lr_reduce_freq': 100, 'spt_alg': 'prim', 'spt_attr': 'edge_degree', 'manifold': 'PoincareBall', 'num_layers': 3, 'dim': 316, 'num_adj': 6, 'add_rate': 0.48350074978368063, 'tem': 1.1676828836047666, 'consis_rate': 1.691669849676306, 'use_att': 1}. Best is trial 70 with value: 0.8281999999999998.[0m
[32m[I 2022-06-27 03:08:45,855][0m Trial 83 finished with value: 0.8225 and parameters: {'lr': 0.0047519845230988705, 'weight_decay': 0.0006997304101922534, 'dropout': 0.7432781804227478, 'patience': 80, 'lr_reduce_freq': 90, 'spt_alg': 'prim', 'spt_attr': 'edge_degree', 'manifold': 'PoincareBall', 'num_layers': 3, 'dim': 336, 'num_adj': 6, 'add_rate': 0.45427972192149035, 'tem': 1.119660227070227, 'consis_rate': 1.6380428336311206, 'use_att': 1}. Best is trial 70 with value: 0.8281999999999998.[0m
[32m[I 2022-06-27 03:25:32,357][0m Trial 84 finished with value: 0.8209 and parameters: {'lr': 0.004792575315592027, 'weight_decay': 0.0007504705832803701, 'dropout': 0.7474665170888216, 'patience': 80, 'lr_reduce_freq': 90, 'spt_alg': 'prim', 'spt_attr': 'edge_degree', 'manifold': 'PoincareBall', 'num_layers': 3, 'dim': 336, 'num_adj': 6, 'add_rate': 0.45090120384321286, 'tem': 1.1207716107799517, 'consis_rate': 1.6401562119025606, 'use_att': 1}. Best is trial 70 with value: 0.8281999999999998.[0m
[32m[I 2022-06-27 03:41:39,571][0m Trial 85 finished with value: 0.8135 and parameters: {'lr': 0.00976281107868359, 'weight_decay': 0.0007268342460114905, 'dropout': 0.7437048774292008, 'patience': 80, 'lr_reduce_freq': 90, 'spt_alg': 'prim', 'spt_attr': 'edge_degree', 'manifold': 'PoincareBall', 'num_layers': 3, 'dim': 336, 'num_adj': 6, 'add_rate': 0.4544707472858248, 'tem': 1.1170284830048647, 'consis_rate': 1.6368647028577596, 'use_att': 1}. Best is trial 70 with value: 0.8281999999999998.[0m
[32m[I 2022-06-27 03:58:51,924][0m Trial 86 finished with value: 0.8215 and parameters: {'lr': 0.004741649385726493, 'weight_decay': 0.0007502355693618022, 'dropout': 0.7332960143193252, 'patience': 80, 'lr_reduce_freq': 90, 'spt_alg': 'prim', 'spt_attr': 'edge_degree', 'manifold': 'PoincareBall', 'num_layers': 3, 'dim': 328, 'num_adj': 6, 'add_rate': 0.44506943041679636, 'tem': 1.1467314250416678, 'consis_rate': 1.665717400940405, 'use_att': 1}. Best is trial 70 with value: 0.8281999999999998.[0m
[32m[I 2022-06-27 04:16:06,969][0m Trial 87 finished with value: 0.8240999999999999 and parameters: {'lr': 0.004714075916333666, 'weight_decay': 0.0007020880282122292, 'dropout': 0.7591149254951294, 'patience': 80, 'lr_reduce_freq': 90, 'spt_alg': 'prim', 'spt_attr': 'edge_degree', 'manifold': 'PoincareBall', 'num_layers': 3, 'dim': 328, 'num_adj': 6, 'add_rate': 0.44524204833963965, 'tem': 1.195901726189246, 'consis_rate': 1.6116120572577357, 'use_att': 1}. Best is trial 70 with value: 0.8281999999999998.[0m
