[32m[I 2022-06-24 13:04:28,824][0m Trial 149 finished with value: 0.8089999999999999 and parameters: {'lr': 0.0018705241610359655, 'weight_decay': 0.00074217418094456, 'dropout': 0.5955551519270853, 'patience': 80, 'lr_reduce_freq': 90, 'spt_alg': 'prim', 'spt_attr': 'similarity', 'manifold': 'PoincareBall', 'num_layers': 3, 'num_adj': 6, 'add_rate': 0.5126972227702338, 'tem': 0.6434298307146626, 'consis_rate': 0.4672456635936459, 'use_att': 1}. Best is trial 107 with value: 0.8168.[0m

mean: 0.8076000000000001
[0.795 0.795 0.81  0.825 0.802 0.806 0.806 0.808 0.814 0.815]
cur_param: {'lr': 0.0022584690758217364, 'weight_decay': 0.0009151358998787842, 'dropout': 0.6537494894206654, 'patience': 80, 'lr_reduce_freq': 90, 'spt_alg': 'prim', 'spt_attr': 'similarity', 'manifold': 'PoincareBall', 'num_layers': 3, 'num_adj': 6, 'add_rate': 0.46206633582638545, 'tem': 0.5778229200066411, 'consis_rate': 0.38613704681192, 'use_att': 1}
mean: 0.8112999999999999
[0.795 0.805 0.81  0.817 0.812 0.815 0.806 0.816 0.826 0.811]
cur_param: {'lr': 0.002831532666516546, 'weight_decay': 0.0006287476147276247, 'dropout': 0.7028145432387763, 'patience': 80, 'lr_reduce_freq': 90, 'spt_alg': 'prim', 'spt_attr': 'similarity', 'manifold': 'PoincareBall', 'num_layers': 3, 'num_adj': 6, 'add_rate': 0.5147434431852705, 'tem': 0.7499176306687666, 'consis_rate': 0.31521011872788884, 'use_att': 1}
mean: 0.8119999999999999
[0.806 0.808 0.815 0.826 0.799 0.8   0.802 0.823 0.823 0.818]
cur_param: {'lr': 0.0029917568501488783, 'weight_decay': 0.0006319426656524252, 'dropout': 0.7015880964292787, 'patience': 80, 'lr_reduce_freq': 90, 'spt_alg': 'prim', 'spt_attr': 'similarity', 'manifold': 'PoincareBall', 'num_layers': 3, 'num_adj': 6, 'add_rate': 0.6188315092003606, 'tem': 0.7673459957672282, 'consis_rate': 0.46359332925439756, 'use_att': 1}
mean: 0.8125
[0.812 0.794 0.826 0.826 0.806 0.801 0.801 0.818 0.827 0.814]
cur_param: {'lr': 0.0034301857570260604, 'weight_decay': 0.0006260181674079204, 'dropout': 0.702813344005518, 'patience': 80, 'lr_reduce_freq': 90, 'spt_alg': 'prim', 'spt_attr': 'similarity', 'manifold': 'PoincareBall', 'num_layers': 4, 'num_adj': 6, 'add_rate': 0.6646272520439293, 'tem': 0.7682540094235298, 'consis_rate': 0.29455600918689195, 'use_att': 1}
mean: 0.7636
[0.779 0.772 0.761 0.764 0.772 0.706 0.738 0.786 0.781 0.777]
cur_param: {'lr': 0.0031099882516387395, 'weight_decay': 0.0006276599732798447, 'dropout': 0.6684742455273277, 'patience': 80, 'lr_reduce_freq': 90, 'spt_alg': 'prim', 'spt_attr': 'similarity', 'manifold': 'PoincareBall', 'num_layers': 3, 'num_adj': 6, 'add_rate': 0.6178717100637827, 'tem': 0.8411445852993391, 'consis_rate': 0.20773897439081682, 'use_att': 1}
mean: 0.8044
[0.791 0.792 0.809 0.824 0.811 0.778 0.805 0.801 0.819 0.814]
cur_param: {'lr': 0.002273622607594082, 'weight_decay': 0.000705131429482633, 'dropout': 0.7813987729190695, 'patience': 80, 'lr_reduce_freq': 90, 'spt_alg': 'prim', 'spt_attr': 'similarity', 'manifold': 'PoincareBall', 'num_layers': 3, 'num_adj': 6, 'add_rate': 0.5886811229828144, 'tem': 0.7354692014635039, 'consis_rate': 0.4326341420744446, 'use_att': 1}
mean: 0.8063
[0.807 0.805 0.792 0.824 0.818 0.813 0.815 0.796 0.799 0.794]
cur_param: {'lr': 0.002790389318318248, 'weight_decay': 0.0007433583743039487, 'dropout': 0.6904187093583518, 'patience': 80, 'lr_reduce_freq': 70, 'spt_alg': 'prim', 'spt_attr': 'similarity', 'manifold': 'PoincareBall', 'num_layers': 3, 'num_adj': 6, 'add_rate': 0.6553708113455705, 'tem': 0.8899072922815717, 'consis_rate': 0.35631190582649697, 'use_att': 1}
mean: 0.8102
[0.818 0.812 0.802 0.823 0.804 0.805 0.796 0.808 0.82  0.814]
cur_param: {'lr': 0.002070414523422337, 'weight_decay': 0.0005838051162212045, 'dropout': 0.6301714433752421, 'patience': 80, 'lr_reduce_freq': 90, 'spt_alg': 'prim', 'spt_attr': 'similarity', 'manifold': 'PoincareBall', 'num_layers': 3, 'num_adj': 6, 'add_rate': 0.5273102101303146, 'tem': 1.1996859144264727, 'consis_rate': 0.47505252585810376, 'use_att': 1}
mean: 0.8097999999999999
[0.795 0.814 0.814 0.82  0.809 0.794 0.811 0.805 0.822 0.814]
cur_param: {'lr': 0.0029532456598275283, 'weight_decay': 0.0008575259652560464, 'dropout': 0.7181931571191086, 'patience': 80, 'lr_reduce_freq': 90, 'spt_alg': 'prim', 'spt_attr': 'similarity', 'manifold': 'PoincareBall', 'num_layers': 3, 'num_adj': 6, 'add_rate': 0.5106958286140547, 'tem': 0.6179424797080483, 'consis_rate': 0.49915711289277714, 'use_att': 1}
mean: 0.8089999999999999
[0.814 0.799 0.803 0.822 0.821 0.789 0.81  0.806 0.821 0.805]
cur_param: {'lr': 0.0037458768266802724, 'weight_decay': 0.01245662150352655, 'dropout': 0.7586815153700862, 'patience': 80, 'lr_reduce_freq': 90, 'spt_alg': 'prim', 'spt_attr': 'similarity', 'manifold': 'PoincareBall', 'num_layers': 3, 'num_adj': 6, 'add_rate': 0.5375883669552375, 'tem': 0.7991679235976155, 'consis_rate': 0.31465048825620134, 'use_att': 1}
mean: 0.29500000000000004
[0.357 0.319 0.408 0.163 0.385 0.167 0.319 0.145 0.322 0.365]
cur_param: {'lr': 0.0032803716228886936, 'weight_decay': 0.0956167265457451, 'dropout': 0.8241186574325876, 'patience': 80, 'lr_reduce_freq': 90, 'spt_alg': 'prim', 'spt_attr': 'similarity', 'manifold': 'PoincareBall', 'num_layers': 3, 'num_adj': 6, 'add_rate': 0.7304400787535255, 'tem': 0.6397712121386767, 'consis_rate': 0.558297783326433, 'use_att': 1}
mean: 0.26609999999999995
[0.319 0.319 0.149 0.13  0.319 0.149 0.319 0.319 0.319 0.319]
cur_param: {'lr': 0.0054522093620073455, 'weight_decay': 0.0012479117830805275, 'dropout': 0.7015009083880354, 'patience': 80, 'lr_reduce_freq': 90, 'spt_alg': 'prim', 'spt_attr': 'similarity', 'manifold': 'PoincareBall', 'num_layers': 3, 'num_adj': 6, 'add_rate': 0.5676370662091168, 'tem': 0.7553697530044637, 'consis_rate': 0.40506209107997315, 'use_att': 1}
mean: 0.8061
[0.807 0.78  0.787 0.808 0.828 0.812 0.787 0.817 0.823 0.812]
cur_param: {'lr': 0.0024981514374339485, 'weight_decay': 0.20710959058591558, 'dropout': 0.5708724259113973, 'patience': 80, 'lr_reduce_freq': 90, 'spt_alg': 'prim', 'spt_attr': 'similarity', 'manifold': 'PoincareBall', 'num_layers': 3, 'num_adj': 6, 'add_rate': 0.49451667529150756, 'tem': 0.7056035089775442, 'consis_rate': 0.27222743659496623, 'use_att': 1}
mean: 0.2506
[0.143 0.319 0.149 0.13  0.312 0.177 0.319 0.319 0.319 0.319]
cur_param: {'lr': 0.00288192452852506, 'weight_decay': 0.06060810408527387, 'dropout': 0.6721310275554749, 'patience': 80, 'lr_reduce_freq': 90, 'spt_alg': 'prim', 'spt_attr': 'similarity', 'manifold': 'PoincareBall', 'num_layers': 3, 'num_adj': 6, 'add_rate': 0.6297062760726798, 'tem': 0.6670147550218741, 'consis_rate': 0.5159144305728698, 'use_att': 1}
mean: 0.26849999999999996
[0.319 0.319 0.149 0.13  0.313 0.179 0.319 0.319 0.319 0.319]
cur_param: {'lr': 0.0023935475166281944, 'weight_decay': 0.0009670858735940247, 'dropout': 0.7292449877902137, 'patience': 80, 'lr_reduce_freq': 90, 'spt_alg': 'prim', 'spt_attr': 'similarity', 'manifold': 'PoincareBall', 'num_layers': 3, 'num_adj': 6, 'add_rate': 0.6912331696286544, 'tem': 0.7235603345147982, 'consis_rate': 0.6029291950493441, 'use_att': 1}
mean: 0.8095000000000001
[0.802 0.801 0.798 0.818 0.819 0.818 0.799 0.816 0.821 0.803]
cur_param: {'lr': 0.0043619940419480936, 'weight_decay': 0.49277108718269313, 'dropout': 0.790301380543203, 'patience': 80, 'lr_reduce_freq': 90, 'spt_alg': 'prim', 'spt_attr': 'similarity', 'manifold': 'PoincareBall', 'num_layers': 3, 'num_adj': 6, 'add_rate': 0.4335533764066747, 'tem': 0.7908255460770994, 'consis_rate': 0.38557898598453977, 'use_att': 1}
mean: 0.3021
[0.149 0.319 0.319 0.319 0.319 0.32  0.319 0.319 0.319 0.319]
cur_param: {'lr': 0.0018705241610359655, 'weight_decay': 0.00074217418094456, 'dropout': 0.5955551519270853, 'patience': 80, 'lr_reduce_freq': 90, 'spt_alg': 'prim', 'spt_attr': 'similarity', 'manifold': 'PoincareBall', 'num_layers': 3, 'num_adj': 6, 'add_rate': 0.5126972227702338, 'tem': 0.6434298307146626, 'consis_rate': 0.4672456635936459, 'use_att': 1}
mean: 0.8089999999999999
[0.817 0.802 0.811 0.814 0.806 0.822 0.789 0.801 0.817 0.811]
best param:{'lr': 0.002811620933392091, 'weight_decay': 0.0010587788750608088, 'dropout': 0.6852879023460303, 'patience': 80, 'lr_reduce_freq': 110, 'spt_alg': 'prim', 'spt_attr': 'edge_degree', 'manifold': 'PoincareBall', 'num_layers': 3, 'num_adj': 6, 'add_rate': 0.5114129634416814, 'tem': 1.056068905303546, 'consis_rate': 0.9365966425970494, 'use_att': 1}
best score:0.8168

Final results:

0.8168
