[32m[I 2022-07-01 22:56:54,929][0m Trial 126 finished with value: 0.5346 and parameters: {'lr': 0.08054319258407391, 'weight_decay': 0.02388296550936105, 'dropout': 0.496932079017533, 'patience': 100, 'lr_reduce_freq': 30, 'spt_alg': 'kruskal', 'spt_attr': 'edge_degree', 'manifold': 'PoincareBall', 'num_layers': 3, 'dim': 192, 'num_adj': 4, 'add_rate': 0.5115604682059621, 'tem': 1.4991873194618743, 'consis_rate': 1.9262488086372866, 'use_att': 1}. Best is trial 105 with value: 0.8254999999999999.[0m

cur_param: {'lr': 0.0633248227879975, 'weight_decay': 0.024740059328968594, 'dropout': 0.44453649667648376, 'patience': 100, 'lr_reduce_freq': 30, 'spt_alg': 'kruskal', 'spt_attr': 'edge_degree', 'manifold': 'PoincareBall', 'num_layers': 3, 'dim': 256, 'num_adj': 4, 'add_rate': 0.6123173155048789, 'tem': 1.4020625576681442, 'consis_rate': 1.931512965153365, 'use_att': 1}
mean: 0.7724
[0.82  0.835 0.82  0.319 0.825 0.805 0.82  0.821 0.828 0.831]
cur_param: {'lr': 0.0893823540000462, 'weight_decay': 0.012790326257314268, 'dropout': 0.3616622833909802, 'patience': 100, 'lr_reduce_freq': 45, 'spt_alg': 'kruskal', 'spt_attr': 'edge_degree', 'manifold': 'PoincareBall', 'num_layers': 3, 'dim': 224, 'num_adj': 4, 'add_rate': 0.6446598280353978, 'tem': 1.3043340897954256, 'consis_rate': 1.9747316209250134, 'use_att': 1}
mean: 0.8129
[0.813 0.815 0.807 0.819 0.812 0.822 0.801 0.802 0.82  0.818]
cur_param: {'lr': 0.07214911876699011, 'weight_decay': 0.018977326694498673, 'dropout': 0.36542258995788274, 'patience': 100, 'lr_reduce_freq': 30, 'spt_alg': 'kruskal', 'spt_attr': 'edge_degree', 'manifold': 'PoincareBall', 'num_layers': 3, 'dim': 208, 'num_adj': 4, 'add_rate': 0.6873487711137364, 'tem': 1.3315284667520955, 'consis_rate': 1.97417086381154, 'use_att': 1}
mean: 0.82
[0.804 0.821 0.812 0.814 0.82  0.826 0.821 0.827 0.827 0.828]
cur_param: {'lr': 0.07182485378217277, 'weight_decay': 0.015725206869595925, 'dropout': 0.41629802982885333, 'patience': 100, 'lr_reduce_freq': 30, 'spt_alg': 'kruskal', 'spt_attr': 'edge_degree', 'manifold': 'PoincareBall', 'num_layers': 3, 'dim': 192, 'num_adj': 4, 'add_rate': 0.5004503914205655, 'tem': 1.276987777565206, 'consis_rate': 1.9142715279366505, 'use_att': 1}
mean: 0.8192999999999999
[0.815 0.81  0.816 0.817 0.824 0.817 0.83  0.821 0.829 0.814]
cur_param: {'lr': 0.057527812388306294, 'weight_decay': 0.02509795737077329, 'dropout': 0.38790852175542834, 'patience': 100, 'lr_reduce_freq': 30, 'spt_alg': 'kruskal', 'spt_attr': 'edge_degree', 'manifold': 'PoincareBall', 'num_layers': 3, 'dim': 208, 'num_adj': 4, 'add_rate': 0.6253645956587538, 'tem': 1.3276360207360498, 'consis_rate': 1.8718387595534611, 'use_att': 1}
mean: 0.30519999999999997
[0.319 0.319 0.149 0.319 0.351 0.319 0.319 0.319 0.319 0.319]
cur_param: {'lr': 0.08853972078581288, 'weight_decay': 0.021834312143881703, 'dropout': 0.3599074187820829, 'patience': 50, 'lr_reduce_freq': 45, 'spt_alg': 'kruskal', 'spt_attr': 'edge_degree', 'manifold': 'PoincareBall', 'num_layers': 3, 'dim': 240, 'num_adj': 4, 'add_rate': 0.5722311166425781, 'tem': 1.2948943769896246, 'consis_rate': 1.9291344383280509, 'use_att': 1}
mean: 0.7848999999999999
[0.823 0.804 0.816 0.806 0.823 0.833 0.821 0.813 0.824 0.486]
cur_param: {'lr': 0.04534304934072769, 'weight_decay': 0.030650080844439095, 'dropout': 0.28265756501848455, 'patience': 100, 'lr_reduce_freq': 30, 'spt_alg': 'kruskal', 'spt_attr': 'edge_degree', 'manifold': 'PoincareBall', 'num_layers': 5, 'dim': 160, 'num_adj': 4, 'add_rate': 0.5412370649776621, 'tem': 1.446557730616834, 'consis_rate': 1.9997592412547123, 'use_att': 1}
mean: 0.319
[0.319 0.319 0.319 0.319 0.319 0.319 0.319 0.319 0.319 0.319]
cur_param: {'lr': 0.07212816082842073, 'weight_decay': 0.01829339670580047, 'dropout': 0.33199797343835546, 'patience': 100, 'lr_reduce_freq': 30, 'spt_alg': 'kruskal', 'spt_attr': 'edge_degree', 'manifold': 'PoincareBall', 'num_layers': 3, 'dim': 208, 'num_adj': 4, 'add_rate': 0.665903188379456, 'tem': 1.3547917674536458, 'consis_rate': 1.7477168971176344, 'use_att': 0}
mean: 0.8071999999999999
[0.809 0.797 0.813 0.804 0.812 0.814 0.803 0.81  0.803 0.807]
cur_param: {'lr': 0.09981079321534432, 'weight_decay': 0.020269333981350637, 'dropout': 0.31236899404871765, 'patience': 100, 'lr_reduce_freq': 45, 'spt_alg': 'kruskal', 'spt_attr': 'edge_degree', 'manifold': 'Hyperboloid', 'num_layers': 3, 'dim': 224, 'num_adj': 4, 'add_rate': 0.7140514029848948, 'tem': 1.225393263090493, 'consis_rate': 1.116343430848085, 'use_att': 1}
mean: 0.7295999999999999
[0.718 0.743 0.752 0.75  0.737 0.7   0.703 0.716 0.741 0.736]
cur_param: {'lr': 0.08207809753477834, 'weight_decay': 0.01473685139936226, 'dropout': 0.4585275426230099, 'patience': 100, 'lr_reduce_freq': 30, 'spt_alg': 'kruskal', 'spt_attr': 'edge_degree', 'manifold': 'PoincareBall', 'num_layers': 3, 'dim': 176, 'num_adj': 4, 'add_rate': 0.5984025000336138, 'tem': 1.2608050741563783, 'consis_rate': 1.8331558789268678, 'use_att': 1}
mean: 0.8206999999999999
[0.826 0.821 0.814 0.82  0.818 0.821 0.82  0.819 0.824 0.824]
cur_param: {'lr': 0.08062461531381435, 'weight_decay': 0.01500903607770261, 'dropout': 0.4488296346357078, 'patience': 100, 'lr_reduce_freq': 120, 'spt_alg': 'kruskal', 'spt_attr': 'edge_degree', 'manifold': 'PoincareBall', 'num_layers': 3, 'dim': 176, 'num_adj': 4, 'add_rate': 0.5941417851570573, 'tem': 1.2532788516434175, 'consis_rate': 1.822951935110294, 'use_att': 1}
mean: 0.8117999999999999
[0.82  0.815 0.822 0.807 0.807 0.815 0.78  0.816 0.816 0.82 ]
cur_param: {'lr': 0.06785654804088358, 'weight_decay': 0.013420620516625527, 'dropout': 0.3727881631984241, 'patience': 100, 'lr_reduce_freq': 30, 'spt_alg': 'kruskal', 'spt_attr': 'edge_degree', 'manifold': 'PoincareBall', 'num_layers': 3, 'dim': 192, 'num_adj': 4, 'add_rate': 0.6881322510200112, 'tem': 1.3309697729260284, 'consis_rate': 1.9553942243049525, 'use_att': 1}
mean: 0.8177999999999999
[0.8   0.812 0.818 0.814 0.816 0.807 0.821 0.824 0.829 0.837]
cur_param: {'lr': 0.06254156706200688, 'weight_decay': 0.017678759466840818, 'dropout': 0.4636504854241877, 'patience': 100, 'lr_reduce_freq': 30, 'spt_alg': 'kruskal', 'spt_attr': 'edge_degree', 'manifold': 'PoincareBall', 'num_layers': 3, 'dim': 176, 'num_adj': 4, 'add_rate': 0.6297850416275335, 'tem': 1.3705613819668017, 'consis_rate': 1.886626992170171, 'use_att': 1}
mean: 0.8202999999999999
[0.819 0.829 0.813 0.812 0.819 0.822 0.828 0.819 0.823 0.819]
cur_param: {'lr': 0.052504726702101295, 'weight_decay': 0.011895504947192263, 'dropout': 0.503525731300628, 'patience': 100, 'lr_reduce_freq': 30, 'spt_alg': 'kruskal', 'spt_attr': 'edge_degree', 'manifold': 'PoincareBall', 'num_layers': 3, 'dim': 160, 'num_adj': 4, 'add_rate': 0.6080525826510303, 'tem': 1.4911651763307576, 'consis_rate': 1.7887234159846142, 'use_att': 1}
mean: 0.8218
[0.822 0.819 0.824 0.81  0.83  0.818 0.824 0.829 0.818 0.824]
cur_param: {'lr': 0.058006491835342205, 'weight_decay': 0.016203777493865573, 'dropout': 0.4018698617459339, 'patience': 100, 'lr_reduce_freq': 30, 'spt_alg': 'kruskal', 'spt_attr': 'edge_degree', 'manifold': 'PoincareBall', 'num_layers': 3, 'dim': 160, 'num_adj': 4, 'add_rate': 0.6097008438361511, 'tem': 1.432676432316919, 'consis_rate': 1.7795270483484606, 'use_att': 1}
mean: 0.8155999999999999
[0.812 0.835 0.829 0.785 0.819 0.821 0.825 0.8   0.821 0.809]
cur_param: {'lr': 0.049652448090044134, 'weight_decay': 0.012222935356371986, 'dropout': 0.42386149477894197, 'patience': 100, 'lr_reduce_freq': 30, 'spt_alg': 'kruskal', 'spt_attr': 'edge_degree', 'manifold': 'PoincareBall', 'num_layers': 3, 'dim': 144, 'num_adj': 4, 'add_rate': 0.5858531139512788, 'tem': 1.3936067976239461, 'consis_rate': 1.845437158242666, 'use_att': 1}
mean: 0.8193999999999999
[0.83  0.813 0.813 0.822 0.83  0.816 0.801 0.821 0.822 0.826]
cur_param: {'lr': 0.08054319258407391, 'weight_decay': 0.02388296550936105, 'dropout': 0.496932079017533, 'patience': 100, 'lr_reduce_freq': 30, 'spt_alg': 'kruskal', 'spt_attr': 'edge_degree', 'manifold': 'PoincareBall', 'num_layers': 3, 'dim': 192, 'num_adj': 4, 'add_rate': 0.5115604682059621, 'tem': 1.4991873194618743, 'consis_rate': 1.9262488086372866, 'use_att': 1}
mean: 0.5346
[0.335 0.325 0.319 0.832 0.365 0.822 0.826 0.799 0.375 0.348]
cur_param: {'lr': 0.03927485108005985, 'weight_decay': 0.02689467902210447, 'dropout': 0.5092999239112954, 'patience': 100, 'lr_reduce_freq': 30, 'spt_alg': 'kruskal', 'spt_attr': 'edge_degree', 'manifold': 'PoincareBall', 'num_layers': 3, 'dim': 176, 'num_adj': 4, 'add_rate': 0.5424293364015881, 'tem': 1.2587522509968265, 'consis_rate': 1.8874662487939085, 'use_att': 1}
mean: 0.319
[0.319 0.319 0.319 0.319 0.319 0.319 0.319 0.319 0.319 0.319][32m[I 2022-07-01 23:05:43,758][0m Trial 127 finished with value: 0.319 and parameters: {'lr': 0.03927485108005985, 'weight_decay': 0.02689467902210447, 'dropout': 0.5092999239112954, 'patience': 100, 'lr_reduce_freq': 30, 'spt_alg': 'kruskal', 'spt_attr': 'edge_degree', 'manifold': 'PoincareBall', 'num_layers': 3, 'dim': 176, 'num_adj': 4, 'add_rate': 0.5424293364015881, 'tem': 1.2587522509968265, 'consis_rate': 1.8874662487939085, 'use_att': 1}. Best is trial 105 with value: 0.8254999999999999.[0m
[32m[I 2022-07-01 23:14:35,325][0m Trial 128 finished with value: 0.3189 and parameters: {'lr': 0.05316256737696391, 'weight_decay': 0.02062142070845082, 'dropout': 0.5245896453344046, 'patience': 100, 'lr_reduce_freq': 30, 'spt_alg': 'prim', 'spt_attr': 'edge_degree', 'manifold': 'PoincareBall', 'num_layers': 3, 'dim': 160, 'num_adj': 4, 'add_rate': 0.6598735599907412, 'tem': 1.4780847222486497, 'consis_rate': 1.8190510022294002, 'use_att': 1}. Best is trial 105 with value: 0.8254999999999999.[0m
[32m[I 2022-07-01 23:25:40,926][0m Trial 129 finished with value: 0.37289999999999995 and parameters: {'lr': 0.06359937415122058, 'weight_decay': 0.012021088651065114, 'dropout': 0.38465498651131946, 'patience': 100, 'lr_reduce_freq': 150, 'spt_alg': 'prim', 'spt_attr': 'edge_degree', 'manifold': 'PoincareBall', 'num_layers': 4, 'dim': 192, 'num_adj': 4, 'add_rate': 0.5621691115716553, 'tem': 1.2732212247879633, 'consis_rate': 1.710768342415213, 'use_att': 1}. Best is trial 105 with value: 0.8254999999999999.[0m
