[32m[I 2022-06-21 23:10:15,754][0m Trial 27 finished with value: 0.37449999999999994 and parameters: {'lr': 0.012102887680409742, 'weight_decay': 0.000500050361409617, 'dropout': 0.8128914930430409, 'patience': 100, 'lr_reduce_freq': 70, 'spt_alg': 'prim', 'spt_attr': 'edge_degree', 'manifold': 'PoincareBall', 'num_layers': 4, 'num_adj': 6, 'add_rate': 0.5894652910007764, 'tem': 0.4221278252502283, 'consis_rate': 1.9798816529002146, 'use_att': 0}. Best is trial 22 with value: 0.8052000000000001.[0m
[32m[I 2022-06-21 23:15:15,756][0m Trial 28 finished with value: 0.738 and parameters: {'lr': 0.061586479615937266, 'weight_decay': 0.0012900346129796716, 'dropout': 0.6751415258839228, 'patience': 80, 'lr_reduce_freq': 90, 'spt_alg': 'prim', 'spt_attr': 'edge_degree', 'manifold': 'PoincareBall', 'num_layers': 3, 'num_adj': 8, 'add_rate': 0.46946763181765233, 'tem': 0.9286721526269872, 'consis_rate': 1.5107585283397293, 'use_att': 0}. Best is trial 22 with value: 0.8052000000000001.[0m
[32m[I 2022-06-21 23:22:07,607][0m Trial 29 finished with value: 0.2916 and parameters: {'lr': 0.022763613649414982, 'weight_decay': 0.003830249287027625, 'dropout': 0.6185916089441598, 'patience': 100, 'lr_reduce_freq': 130, 'spt_alg': 'prim', 'spt_attr': 'edge_degree', 'manifold': 'PoincareBall', 'num_layers': 4, 'num_adj': 6, 'add_rate': 0.72366005812812, 'tem': 0.393475174526291, 'consis_rate': 1.1532959475996947, 'use_att': 0}. Best is trial 22 with value: 0.8052000000000001.[0m
[32m[I 2022-06-21 23:26:28,946][0m Trial 30 finished with value: 0.2535 and parameters: {'lr': 0.004317159251112657, 'weight_decay': 0.02710601727291865, 'dropout': 0.05816040893943125, 'patience': 100, 'lr_reduce_freq': 50, 'spt_alg': 'prim', 'spt_attr': 'edge_degree', 'manifold': 'PoincareBall', 'num_layers': 3, 'num_adj': 4, 'add_rate': 0.7871383249699205, 'tem': 0.5580547476747303, 'consis_rate': 1.2585000970269975, 'use_att': 0}. Best is trial 22 with value: 0.8052000000000001.[0m
[32m[I 2022-06-21 23:34:32,610][0m Trial 31 finished with value: 0.8035 and parameters: {'lr': 0.002821210229552658, 'weight_decay': 0.0016483570804920608, 'dropout': 0.6762620620278925, 'patience': 100, 'lr_reduce_freq': 90, 'spt_alg': 'prim', 'spt_attr': 'edge_degree', 'manifold': 'PoincareBall', 'num_layers': 3, 'num_adj': 6, 'add_rate': 0.3218866022702225, 'tem': 0.5756593237108412, 'consis_rate': 1.3898611114018937, 'use_att': 0}. Best is trial 22 with value: 0.8052000000000001.[0m
[32m[I 2022-06-21 23:43:43,339][0m Trial 32 finished with value: 0.8019000000000002 and parameters: {'lr': 0.002283142656522665, 'weight_decay': 0.001744992708020045, 'dropout': 0.4974791150164891, 'patience': 100, 'lr_reduce_freq': 90, 'spt_alg': 'prim', 'spt_attr': 'edge_degree', 'manifold': 'PoincareBall', 'num_layers': 3, 'num_adj': 6, 'add_rate': 0.3142761105531159, 'tem': 0.3237950456749616, 'consis_rate': 1.516376164843333, 'use_att': 0}. Best is trial 22 with value: 0.8052000000000001.[0m
[32m[I 2022-06-21 23:48:36,207][0m Trial 33 finished with value: 0.31839999999999996 and parameters: {'lr': 0.008617784513504135, 'weight_decay': 0.40874164633511006, 'dropout': 0.6280810797110129, 'patience': 100, 'lr_reduce_freq': 110, 'spt_alg': 'prim', 'spt_attr': 'edge_degree', 'manifold': 'PoincareBall', 'num_layers': 3, 'num_adj': 6, 'add_rate': 0.4083215027722015, 'tem': 0.4803171872467785, 'consis_rate': 1.0882303862834832, 'use_att': 0}. Best is trial 22 with value: 0.8052000000000001.[0m
[32m[I 2022-06-22 00:00:58,101][0m Trial 34 finished with value: 0.7729999999999999 and parameters: {'lr': 0.0023989010737814043, 'weight_decay': 0.0008590332871432555, 'dropout': 0.5864707759076018, 'patience': 80, 'lr_reduce_freq': 70, 'spt_alg': 'prim', 'spt_attr': 'edge_degree', 'manifold': 'PoincareBall', 'num_layers': 4, 'num_adj': 6, 'add_rate': 0.18020954669648623, 'tem': 0.6466406197209292, 'consis_rate': 1.7284630094909317, 'use_att': 0}. Best is trial 22 with value: 0.8052000000000001.[0m
[32m[I 2022-06-22 00:10:48,900][0m Trial 35 finished with value: 0.7898000000000001 and parameters: {'lr': 0.004222733955785372, 'weight_decay': 0.0025521125266019223, 'dropout': 0.28665797040731666, 'patience': 100, 'lr_reduce_freq': 90, 'spt_alg': 'prim', 'spt_attr': 'edge_degree', 'manifold': 'PoincareBall', 'num_layers': 3, 'num_adj': 8, 'add_rate': 0.32223228772967355, 'tem': 0.34259364752580274, 'consis_rate': 1.439474794326093, 'use_att': 0}. Best is trial 22 with value: 0.8052000000000001.[0m
[32m[I 2022-06-22 00:17:28,763][0m Trial 36 finished with value: 0.781 and parameters: {'lr': 0.00755569692173018, 'weight_decay': 0.0008963528770422733, 'dropout': 0.8109032291631493, 'patience': 100, 'lr_reduce_freq': 70, 'spt_alg': 'prim', 'spt_attr': 'similarity', 'manifold': 'PoincareBall', 'num_layers': 3, 'num_adj': 6, 'add_rate': 0.5084585975220653, 'tem': 0.8251476034973184, 'consis_rate': 1.6370269369439538, 'use_att': 0}. Best is trial 22 with value: 0.8052000000000001.[0m

mean: 0.25420000000000004
[0.306 0.302 0.318 0.306 0.115 0.242 0.319 0.26  0.146 0.228]
cur_param: {'lr': 0.00573132258522221, 'weight_decay': 0.0014097428351328607, 'dropout': 0.5874589698308891, 'patience': 100, 'lr_reduce_freq': 70, 'spt_alg': 'prim', 'spt_attr': 'edge_degree', 'manifold': 'PoincareBall', 'num_layers': 3, 'num_adj': 6, 'add_rate': 0.4620378490931516, 'tem': 0.26654355450322065, 'consis_rate': 1.561820822501704, 'use_att': 0}
mean: 0.8029
[0.806 0.791 0.807 0.8   0.798 0.803 0.795 0.805 0.815 0.809]
cur_param: {'lr': 0.0010271080157469212, 'weight_decay': 0.003521699001334221, 'dropout': 0.7389710190570524, 'patience': 80, 'lr_reduce_freq': 90, 'spt_alg': 'prim', 'spt_attr': 'edge_degree', 'manifold': 'PoincareBall', 'num_layers': 3, 'num_adj': 4, 'add_rate': 0.2096865253314843, 'tem': 1.6551391327521099, 'consis_rate': 1.8787264750656896, 'use_att': 0}
mean: 0.4383
[0.296 0.517 0.537 0.495 0.533 0.555 0.388 0.278 0.395 0.389]
cur_param: {'lr': 0.005645848092960048, 'weight_decay': 0.0013364450818974193, 'dropout': 0.6226720126651097, 'patience': 100, 'lr_reduce_freq': 70, 'spt_alg': 'prim', 'spt_attr': 'edge_degree', 'manifold': 'PoincareBall', 'num_layers': 3, 'num_adj': 6, 'add_rate': 0.46416629264463694, 'tem': 0.2060058324419362, 'consis_rate': 1.6024015224599995, 'use_att': 0}
mean: 0.8036
[0.812 0.793 0.801 0.811 0.81  0.791 0.803 0.8   0.813 0.802]
cur_param: {'lr': 0.009119522488736207, 'weight_decay': 0.0012896306632951178, 'dropout': 0.5162558640057734, 'patience': 100, 'lr_reduce_freq': 70, 'spt_alg': 'prim', 'spt_attr': 'edge_degree', 'manifold': 'PoincareBall', 'num_layers': 3, 'num_adj': 6, 'add_rate': 0.6314976291872508, 'tem': 0.46718368126309334, 'consis_rate': 1.520594778437043, 'use_att': 0}
mean: 0.8052000000000001
[0.795 0.796 0.811 0.799 0.805 0.811 0.802 0.809 0.812 0.812]
cur_param: {'lr': 0.009237433683187407, 'weight_decay': 0.0005256373771613844, 'dropout': 0.535132205463962, 'patience': 100, 'lr_reduce_freq': 50, 'spt_alg': 'prim', 'spt_attr': 'edge_degree', 'manifold': 'PoincareBall', 'num_layers': 3, 'num_adj': 6, 'add_rate': 0.6310296168168829, 'tem': 0.2317921711624153, 'consis_rate': 1.7965654466672774, 'use_att': 0}
mean: 0.7993
[0.803 0.794 0.793 0.787 0.808 0.798 0.807 0.799 0.796 0.808]
cur_param: {'lr': 0.00773045428444512, 'weight_decay': 0.001104179198096057, 'dropout': 0.46133862052758295, 'patience': 100, 'lr_reduce_freq': 70, 'spt_alg': 'prim', 'spt_attr': 'edge_degree', 'manifold': 'PoincareBall', 'num_layers': 3, 'num_adj': 8, 'add_rate': 0.6382666299692389, 'tem': 0.4351550225658968, 'consis_rate': 1.730657453655351, 'use_att': 0}
mean: 0.7961
[0.803 0.793 0.773 0.79  0.801 0.795 0.799 0.815 0.796 0.796]
cur_param: {'lr': 0.005221986248523117, 'weight_decay': 0.005397710263016885, 'dropout': 0.45636918896813095, 'patience': 80, 'lr_reduce_freq': 70, 'spt_alg': 'prim', 'spt_attr': 'edge_degree', 'manifold': 'PoincareBall', 'num_layers': 3, 'num_adj': 6, 'add_rate': 0.4563437782491085, 'tem': 0.20489507372451984, 'consis_rate': 1.5192858861701408, 'use_att': 0}
mean: 0.78
[0.757 0.783 0.778 0.776 0.76  0.8   0.789 0.768 0.795 0.794]
cur_param: {'lr': 0.01944681355115375, 'weight_decay': 0.01336370186724596, 'dropout': 0.5570395541342358, 'patience': 100, 'lr_reduce_freq': 50, 'spt_alg': 'prim', 'spt_attr': 'edge_degree', 'manifold': 'PoincareBall', 'num_layers': 3, 'num_adj': 4, 'add_rate': 0.6881683277191791, 'tem': 0.7084030713232556, 'consis_rate': 1.1783639099604473, 'use_att': 0}
mean: 0.3099
[0.319 0.293 0.319 0.319 0.319 0.314 0.289 0.315 0.297 0.315]
cur_param: {'lr': 0.012102887680409742, 'weight_decay': 0.000500050361409617, 'dropout': 0.8128914930430409, 'patience': 100, 'lr_reduce_freq': 70, 'spt_alg': 'prim', 'spt_attr': 'edge_degree', 'manifold': 'PoincareBall', 'num_layers': 4, 'num_adj': 6, 'add_rate': 0.5894652910007764, 'tem': 0.4221278252502283, 'consis_rate': 1.9798816529002146, 'use_att': 0}
mean: 0.37449999999999994
[0.498 0.402 0.461 0.334 0.412 0.319 0.318 0.306 0.278 0.417]
cur_param: {'lr': 0.061586479615937266, 'weight_decay': 0.0012900346129796716, 'dropout': 0.6751415258839228, 'patience': 80, 'lr_reduce_freq': 90, 'spt_alg': 'prim', 'spt_attr': 'edge_degree', 'manifold': 'PoincareBall', 'num_layers': 3, 'num_adj': 8, 'add_rate': 0.46946763181765233, 'tem': 0.9286721526269872, 'consis_rate': 1.5107585283397293, 'use_att': 0}
mean: 0.738
[0.774 0.786 0.73  0.757 0.691 0.766 0.649 0.686 0.797 0.744]
cur_param: {'lr': 0.022763613649414982, 'weight_decay': 0.003830249287027625, 'dropout': 0.6185916089441598, 'patience': 100, 'lr_reduce_freq': 130, 'spt_alg': 'prim', 'spt_attr': 'edge_degree', 'manifold': 'PoincareBall', 'num_layers': 4, 'num_adj': 6, 'add_rate': 0.72366005812812, 'tem': 0.393475174526291, 'consis_rate': 1.1532959475996947, 'use_att': 0}
mean: 0.2916
[0.294 0.204 0.314 0.319 0.316 0.317 0.319 0.223 0.301 0.309]
cur_param: {'lr': 0.004317159251112657, 'weight_decay': 0.02710601727291865, 'dropout': 0.05816040893943125, 'patience': 100, 'lr_reduce_freq': 50, 'spt_alg': 'prim', 'spt_attr': 'edge_degree', 'manifold': 'PoincareBall', 'num_layers': 3, 'num_adj': 4, 'add_rate': 0.7871383249699205, 'tem': 0.5580547476747303, 'consis_rate': 1.2585000970269975, 'use_att': 0}
mean: 0.2535
[0.179 0.319 0.318 0.316 0.161 0.315 0.304 0.166 0.307 0.15 ]
cur_param: {'lr': 0.002821210229552658, 'weight_decay': 0.0016483570804920608, 'dropout': 0.6762620620278925, 'patience': 100, 'lr_reduce_freq': 90, 'spt_alg': 'prim', 'spt_attr': 'edge_degree', 'manifold': 'PoincareBall', 'num_layers': 3, 'num_adj': 6, 'add_rate': 0.3218866022702225, 'tem': 0.5756593237108412, 'consis_rate': 1.3898611114018937, 'use_att': 0}
mean: 0.8035
[0.806 0.805 0.806 0.804 0.808 0.8   0.796 0.81  0.799 0.801]
cur_param: {'lr': 0.002283142656522665, 'weight_decay': 0.001744992708020045, 'dropout': 0.4974791150164891, 'patience': 100, 'lr_reduce_freq': 90, 'spt_alg': 'prim', 'spt_attr': 'edge_degree', 'manifold': 'PoincareBall', 'num_layers': 3, 'num_adj': 6, 'add_rate': 0.3142761105531159, 'tem': 0.3237950456749616, 'consis_rate': 1.516376164843333, 'use_att': 0}
mean: 0.8019000000000002
[0.814 0.805 0.81  0.801 0.79  0.797 0.802 0.801 0.802 0.797]
cur_param: {'lr': 0.008617784513504135, 'weight_decay': 0.40874164633511006, 'dropout': 0.6280810797110129, 'patience': 100, 'lr_reduce_freq': 110, 'spt_alg': 'prim', 'spt_attr': 'edge_degree', 'manifold': 'PoincareBall', 'num_layers': 3, 'num_adj': 6, 'add_rate': 0.4083215027722015, 'tem': 0.4803171872467785, 'consis_rate': 1.0882303862834832, 'use_att': 0}
mean: 0.31839999999999996
[0.317 0.319 0.319 0.319 0.319 0.319 0.319 0.319 0.316 0.318]
cur_param: {'lr': 0.0023989010737814043, 'weight_decay': 0.0008590332871432555, 'dropout': 0.5864707759076018, 'patience': 80, 'lr_reduce_freq': 70, 'spt_alg': 'prim', 'spt_attr': 'edge_degree', 'manifold': 'PoincareBall', 'num_layers': 4, 'num_adj': 6, 'add_rate': 0.18020954669648623, 'tem': 0.6466406197209292, 'consis_rate': 1.7284630094909317, 'use_att': 0}
mean: 0.7729999999999999
[0.753 0.779 0.771 0.789 0.752 0.798 0.779 0.75  0.793 0.766]
cur_param: {'lr': 0.004222733955785372, 'weight_decay': 0.0025521125266019223, 'dropout': 0.28665797040731666, 'patience': 100, 'lr_reduce_freq': 90, 'spt_alg': 'prim', 'spt_attr': 'edge_degree', 'manifold': 'PoincareBall', 'num_layers': 3, 'num_adj': 8, 'add_rate': 0.32223228772967355, 'tem': 0.34259364752580274, 'consis_rate': 1.439474794326093, 'use_att': 0}
mean: 0.7898000000000001
[0.799 0.776 0.792 0.786 0.777 0.802 0.794 0.785 0.787 0.8  ]
cur_param: {'lr': 0.00755569692173018, 'weight_decay': 0.0008963528770422733, 'dropout': 0.8109032291631493, 'patience': 100, 'lr_reduce_freq': 70, 'spt_alg': 'prim', 'spt_attr': 'similarity', 'manifold': 'PoincareBall', 'num_layers': 3, 'num_adj': 6, 'add_rate': 0.5084585975220653, 'tem': 0.8251476034973184, 'consis_rate': 1.6370269369439538, 'use_att': 0}
mean: 0.781
[0.751 0.812 0.771 0.799 0.8   0.779 0.755 0.77  0.764 0.809]
cur_param: {'lr': 0.00183134291974219, 'weight_decay': 0.002413008823396147, 'dropout': 0.4399943063619859, 'patience': 80, 'lr_reduce_freq': 110, 'spt_alg': 'prim', 'spt_attr': 'edge_degree', 'manifold': 'PoincareBall', 'num_layers': 3, 'num_adj': 8, 'add_rate': 0.5786375174580629, 'tem': 0.9129549080261152, 'consis_rate': 1.2755164223442736, 'use_att': 1}[32m[I 2022-06-22 01:06:53,389][0m Trial 37 finished with value: 0.8068 and parameters: {'lr': 0.00183134291974219, 'weight_decay': 0.002413008823396147, 'dropout': 0.4399943063619859, 'patience': 80, 'lr_reduce_freq': 110, 'spt_alg': 'prim', 'spt_attr': 'edge_degree', 'manifold': 'PoincareBall', 'num_layers': 3, 'num_adj': 8, 'add_rate': 0.5786375174580629, 'tem': 0.9129549080261152, 'consis_rate': 1.2755164223442736, 'use_att': 1}. Best is trial 37 with value: 0.8068.[0m
[32m[I 2022-06-22 02:35:11,739][0m Trial 38 finished with value: 0.7671 and parameters: {'lr': 0.0016331780713993787, 'weight_decay': 0.0024625116169808134, 'dropout': 0.40304007431365935, 'patience': 60, 'lr_reduce_freq': 110, 'spt_alg': 'kruskal', 'spt_attr': 'similarity', 'manifold': 'PoincareBall', 'num_layers': 4, 'num_adj': 8, 'add_rate': 0.6063534351233939, 'tem': 0.9438858078768646, 'consis_rate': 1.271397200231812, 'use_att': 1}. Best is trial 37 with value: 0.8068.[0m
[32m[I 2022-06-22 03:16:47,469][0m Trial 39 finished with value: 0.7919 and parameters: {'lr': 0.011225454635946801, 'weight_decay': 0.004449056274090729, 'dropout': 0.4149275424928511, 'patience': 80, 'lr_reduce_freq': 130, 'spt_alg': 'prim', 'spt_attr': 'edge_degree', 'manifold': 'PoincareBall', 'num_layers': 3, 'num_adj': 8, 'add_rate': 0.5568894362586485, 'tem': 1.328788695957975, 'consis_rate': 0.7292636875628542, 'use_att': 1}. Best is trial 37 with value: 0.8068.[0m
[32m[I 2022-06-22 03:55:14,863][0m Trial 40 finished with value: 0.7962 and parameters: {'lr': 0.01689376146439922, 'weight_decay': 0.0007385495164992855, 'dropout': 0.3169116594709425, 'patience': 80, 'lr_reduce_freq': 110, 'spt_alg': 'prim', 'spt_attr': 'similarity', 'manifold': 'PoincareBall', 'num_layers': 3, 'num_adj': 8, 'add_rate': 0.6890640642932411, 'tem': 1.1578597617302815, 'consis_rate': 0.9850727476800469, 'use_att': 1}. Best is trial 37 with value: 0.8068.[0m
[32m[I 2022-06-22 04:35:31,277][0m Trial 41 finished with value: 0.8123999999999999 and parameters: {'lr': 0.0016942127395876375, 'weight_decay': 0.0012072911132748091, 'dropout': 0.5224726207053338, 'patience': 80, 'lr_reduce_freq': 110, 'spt_alg': 'prim', 'spt_attr': 'edge_degree', 'manifold': 'PoincareBall', 'num_layers': 3, 'num_adj': 6, 'add_rate': 0.4178471281425423, 'tem': 0.7167109377291936, 'consis_rate': 1.3268261896067979, 'use_att': 1}. Best is trial 41 with value: 0.8123999999999999.[0m
[32m[I 2022-06-22 05:13:44,368][0m Trial 42 finished with value: 0.8093999999999999 and parameters: {'lr': 0.0017093237347980594, 'weight_decay': 0.0010736142508346845, 'dropout': 0.4774649963836094, 'patience': 80, 'lr_reduce_freq': 130, 'spt_alg': 'prim', 'spt_attr': 'edge_degree', 'manifold': 'PoincareBall', 'num_layers': 3, 'num_adj': 6, 'add_rate': 0.4139006761613714, 'tem': 0.743720965235102, 'consis_rate': 1.1283338954653748, 'use_att': 1}. Best is trial 41 with value: 0.8123999999999999.[0m
[32m[I 2022-06-22 05:59:00,825][0m Trial 43 finished with value: 0.8029 and parameters: {'lr': 0.0014820430185957761, 'weight_decay': 0.0010938975353063604, 'dropout': 0.4366948766828616, 'patience': 80, 'lr_reduce_freq': 130, 'spt_alg': 'prim', 'spt_attr': 'edge_degree', 'manifold': 'PoincareBall', 'num_layers': 3, 'num_adj': 8, 'add_rate': 0.38245176365607003, 'tem': 0.7247083323667267, 'consis_rate': 0.7586335573560392, 'use_att': 1}. Best is trial 41 with value: 0.8123999999999999.[0m
[32m[I 2022-06-22 06:29:12,486][0m Trial 44 finished with value: 0.8062999999999999 and parameters: {'lr': 0.0018970872938808157, 'weight_decay': 0.002911763931293648, 'dropout': 0.4960245422987713, 'patience': 80, 'lr_reduce_freq': 130, 'spt_alg': 'prim', 'spt_attr': 'edge_degree', 'manifold': 'PoincareBall', 'num_layers': 3, 'num_adj': 4, 'add_rate': 0.4190154712148439, 'tem': 0.7942505385265282, 'consis_rate': 1.1026426626673014, 'use_att': 1}. Best is trial 41 with value: 0.8123999999999999.[0m
[32m[I 2022-06-22 07:00:40,624][0m Trial 45 finished with value: 0.8099000000000001 and parameters: {'lr': 0.001916527247719101, 'weight_decay': 0.0028297159912792206, 'dropout': 0.515318990511197, 'patience': 80, 'lr_reduce_freq': 150, 'spt_alg': 'kruskal', 'spt_attr': 'edge_degree', 'manifold': 'PoincareBall', 'num_layers': 3, 'num_adj': 4, 'add_rate': 0.42590598710956307, 'tem': 0.8549098237495562, 'consis_rate': 1.0621650848518291, 'use_att': 1}. Best is trial 41 with value: 0.8123999999999999.[0m
[32m[I 2022-06-22 07:28:49,402][0m Trial 46 finished with value: 0.8071000000000002 and parameters: {'lr': 0.001863570593502319, 'weight_decay': 0.002922441856456155, 'dropout': 0.33386923977974187, 'patience': 80, 'lr_reduce_freq': 150, 'spt_alg': 'kruskal', 'spt_attr': 'edge_degree', 'manifold': 'PoincareBall', 'num_layers': 3, 'num_adj': 4, 'add_rate': 0.41860878665416146, 'tem': 0.8646641304879534, 'consis_rate': 0.941149926747332, 'use_att': 1}. Best is trial 41 with value: 0.8123999999999999.[0m
[32m[I 2022-06-22 07:38:30,804][0m Trial 47 finished with value: 0.3177 and parameters: {'lr': 0.0012984169326578884, 'weight_decay': 0.009431284306517273, 'dropout': 0.1582887180769736, 'patience': 60, 'lr_reduce_freq': 150, 'spt_alg': 'kruskal', 'spt_attr': 'edge_degree', 'manifold': 'PoincareBall', 'num_layers': 3, 'num_adj': 2, 'add_rate': 0.3545336134756525, 'tem': 0.9533031831880385, 'consis_rate': 1.0115187093818312, 'use_att': 1}. Best is trial 41 with value: 0.8123999999999999.[0m
[32m[I 2022-06-22 08:17:17,824][0m Trial 48 finished with value: 0.7815 and parameters: {'lr': 0.0019438171119171676, 'weight_decay': 0.007972029337932675, 'dropout': 0.0002958367836091713, 'patience': 80, 'lr_reduce_freq': 150, 'spt_alg': 'kruskal', 'spt_attr': 'edge_degree', 'manifold': 'PoincareBall', 'num_layers': 3, 'num_adj': 4, 'add_rate': 0.49271563945815666, 'tem': 0.8714158763252815, 'consis_rate': 0.814884202937166, 'use_att': 1}. Best is trial 41 with value: 0.8123999999999999.[0m
[32m[I 2022-06-22 08:36:05,548][0m Trial 49 finished with value: 0.191 and parameters: {'lr': 0.001002757350371217, 'weight_decay': 0.042739398634907916, 'dropout': 0.3587228581776842, 'patience': 80, 'lr_reduce_freq': 150, 'spt_alg': 'kruskal', 'spt_attr': 'edge_degree', 'manifold': 'PoincareBall', 'num_layers': 4, 'num_adj': 4, 'add_rate': 0.4237050668967343, 'tem': 1.1394139251464945, 'consis_rate': 0.972038601116985, 'use_att': 1}. Best is trial 41 with value: 0.8123999999999999.[0m
[32m[I 2022-06-22 09:08:00,739][0m Trial 50 finished with value: 0.8063 and parameters: {'lr': 0.001299026566414325, 'weight_decay': 0.002360592950031263, 'dropout': 0.2699700999891662, 'patience': 80, 'lr_reduce_freq': 150, 'spt_alg': 'kruskal', 'spt_attr': 'edge_degree', 'manifold': 'PoincareBall', 'num_layers': 3, 'num_adj': 4, 'add_rate': 0.5621139166152403, 'tem': 1.0214693107191626, 'consis_rate': 0.8741868368644065, 'use_att': 1}. Best is trial 41 with value: 0.8123999999999999.[0m
[32m[I 2022-06-22 09:32:44,199][0m Trial 51 finished with value: 0.8062000000000001 and parameters: {'lr': 0.0019571184339619804, 'weight_decay': 0.002044815671010355, 'dropout': 0.24649878331959946, 'patience': 80, 'lr_reduce_freq': 150, 'spt_alg': 'kruskal', 'spt_attr': 'edge_degree', 'manifold': 'PoincareBall', 'num_layers': 3, 'num_adj': 4, 'add_rate': 0.5480957935338882, 'tem': 1.0307388008653011, 'consis_rate': 0.5919429304448458, 'use_att': 1}. Best is trial 41 with value: 0.8123999999999999.[0m
[32m[I 2022-06-22 10:12:21,178][0m Trial 52 finished with value: 0.7988000000000001 and parameters: {'lr': 0.0013124585298270068, 'weight_decay': 0.0046439276184395495, 'dropout': 0.2559417222892734, 'patience': 80, 'lr_reduce_freq': 150, 'spt_alg': 'kruskal', 'spt_attr': 'edge_degree', 'manifold': 'PoincareBall', 'num_layers': 3, 'num_adj': 4, 'add_rate': 0.5708881870322787, 'tem': 0.9937917408800017, 'consis_rate': 0.9158430154333824, 'use_att': 1}. Best is trial 41 with value: 0.8123999999999999.[0m
[32m[I 2022-06-22 10:29:14,588][0m Trial 53 finished with value: 0.7994000000000001 and parameters: {'lr': 0.0024552367306392036, 'weight_decay': 0.0030556610284159535, 'dropout': 0.20368249677469152, 'patience': 80, 'lr_reduce_freq': 130, 'spt_alg': 'kruskal', 'spt_attr': 'edge_degree', 'manifold': 'PoincareBall', 'num_layers': 3, 'num_adj': 2, 'add_rate': 0.5070556306274316, 'tem': 0.8548974044717143, 'consis_rate': 0.8361900610192541, 'use_att': 1}. Best is trial 41 with value: 0.8123999999999999.[0m
