[32m[I 2022-06-29 08:10:43,572][0m Trial 26 finished with value: 0.32089999999999996 and parameters: {'lr': 0.06200898607191759, 'weight_decay': 0.004454447122034906, 'dropout': 0.7116282069071238, 'patience': 60, 'lr_reduce_freq': 70, 'spt_alg': 'prim', 'spt_attr': 'edge_degree', 'manifold': 'PoincareBall', 'num_layers': 4, 'dim': 384, 'num_adj': 4, 'add_rate': 0.3294086152276131, 'tem': 1.0328088766291215, 'consis_rate': 1.4148573853077753, 'use_att': 0}. Best is trial 25 with value: 0.8081000000000002.[0m
[32m[I 2022-06-29 09:07:47,833][0m Trial 27 finished with value: 0.7935000000000001 and parameters: {'lr': 0.021424911039655447, 'weight_decay': 0.00118049502649384, 'dropout': 0.557398406781121, 'patience': 70, 'lr_reduce_freq': 90, 'spt_alg': 'kruskal', 'spt_attr': 'similarity', 'manifold': 'PoincareBall', 'num_layers': 4, 'dim': 288, 'num_adj': 6, 'add_rate': 0.4373412371545146, 'tem': 0.6413561308456981, 'consis_rate': 1.2304260882556648, 'use_att': 1}. Best is trial 25 with value: 0.8081000000000002.[0m
[32m[I 2022-06-29 09:14:50,181][0m Trial 28 finished with value: 0.47140000000000004 and parameters: {'lr': 0.08330042327024872, 'weight_decay': 0.0021655803881746745, 'dropout': 0.47844837349669145, 'patience': 60, 'lr_reduce_freq': 60, 'spt_alg': 'prim', 'spt_attr': 'edge_degree', 'manifold': 'PoincareBall', 'num_layers': 4, 'dim': 240, 'num_adj': 6, 'add_rate': 0.2695699424031298, 'tem': 0.6959277933325352, 'consis_rate': 0.9776555852253218, 'use_att': 0}. Best is trial 25 with value: 0.8081000000000002.[0m
[32m[I 2022-06-29 09:20:36,559][0m Trial 29 finished with value: 0.36639999999999995 and parameters: {'lr': 0.04715537653202305, 'weight_decay': 0.0008034411800461021, 'dropout': 0.6206717577848833, 'patience': 70, 'lr_reduce_freq': 70, 'spt_alg': 'kruskal', 'spt_attr': 'similarity', 'manifold': 'PoincareBall', 'num_layers': 5, 'dim': 368, 'num_adj': 4, 'add_rate': 0.3891500414923398, 'tem': 0.5662774366505592, 'consis_rate': 1.3845234105938848, 'use_att': 0}. Best is trial 25 with value: 0.8081000000000002.[0m
[32m[I 2022-06-29 09:25:23,632][0m Trial 30 finished with value: 0.8023 and parameters: {'lr': 0.026398446457690572, 'weight_decay': 0.0017498119712582925, 'dropout': 0.3721862803025268, 'patience': 70, 'lr_reduce_freq': 90, 'spt_alg': 'prim', 'spt_attr': 'edge_degree', 'manifold': 'PoincareBall', 'num_layers': 3, 'dim': 480, 'num_adj': 6, 'add_rate': 0.44230197395360926, 'tem': 0.8656352890038617, 'consis_rate': 1.1628773812434536, 'use_att': 0}. Best is trial 25 with value: 0.8081000000000002.[0m
[32m[I 2022-06-29 09:30:04,039][0m Trial 31 finished with value: 0.8071000000000002 and parameters: {'lr': 0.026354381819745396, 'weight_decay': 0.0017047857435334589, 'dropout': 0.3534013953661333, 'patience': 70, 'lr_reduce_freq': 100, 'spt_alg': 'prim', 'spt_attr': 'edge_degree', 'manifold': 'PoincareBall', 'num_layers': 3, 'dim': 480, 'num_adj': 6, 'add_rate': 0.45515561886440525, 'tem': 0.8996553210689728, 'consis_rate': 1.1189908414041516, 'use_att': 0}. Best is trial 25 with value: 0.8081000000000002.[0m
[32m[I 2022-06-29 09:34:45,657][0m Trial 32 finished with value: 0.7978 and parameters: {'lr': 0.02695823311678512, 'weight_decay': 0.0019675232544548653, 'dropout': 0.3472737111456489, 'patience': 70, 'lr_reduce_freq': 100, 'spt_alg': 'prim', 'spt_attr': 'edge_degree', 'manifold': 'PoincareBall', 'num_layers': 3, 'dim': 480, 'num_adj': 6, 'add_rate': 0.4702244565997144, 'tem': 0.8032558081083284, 'consis_rate': 1.1543218168431117, 'use_att': 0}. Best is trial 25 with value: 0.8081000000000002.[0m
[32m[I 2022-06-29 09:40:01,329][0m Trial 33 finished with value: 0.7956000000000001 and parameters: {'lr': 0.0385325514250998, 'weight_decay': 0.0034833301518232317, 'dropout': 0.37957121281749473, 'patience': 70, 'lr_reduce_freq': 90, 'spt_alg': 'prim', 'spt_attr': 'edge_degree', 'manifold': 'PoincareBall', 'num_layers': 3, 'dim': 496, 'num_adj': 6, 'add_rate': 0.5644958484447441, 'tem': 0.8989174944245563, 'consis_rate': 0.9504718165397842, 'use_att': 0}. Best is trial 25 with value: 0.8081000000000002.[0m
[32m[I 2022-06-29 10:30:46,148][0m Trial 34 finished with value: 0.7876 and parameters: {'lr': 0.06661209429593007, 'weight_decay': 0.0016586126326837056, 'dropout': 0.473768713966898, 'patience': 70, 'lr_reduce_freq': 110, 'spt_alg': 'kruskal', 'spt_attr': 'edge_degree', 'manifold': 'PoincareBall', 'num_layers': 3, 'dim': 480, 'num_adj': 6, 'add_rate': 0.35815386503292734, 'tem': 0.8369589546884099, 'consis_rate': 0.7518955434567194, 'use_att': 1}. Best is trial 25 with value: 0.8081000000000002.[0m
[32m[I 2022-06-29 10:35:12,876][0m Trial 35 finished with value: 0.7936 and parameters: {'lr': 0.02497909012245644, 'weight_decay': 0.0052033236378649156, 'dropout': 0.2982757186005424, 'patience': 70, 'lr_reduce_freq': 100, 'spt_alg': 'prim', 'spt_attr': 'similarity', 'manifold': 'PoincareBall', 'num_layers': 3, 'dim': 512, 'num_adj': 4, 'add_rate': 0.6779245245944725, 'tem': 0.7488352276073035, 'consis_rate': 1.1682063912406762, 'use_att': 0}. Best is trial 25 with value: 0.8081000000000002.[0m

cur_param: {'lr': 0.009236882236315795, 'weight_decay': 0.0015841470292810211, 'dropout': 0.6152940242924085, 'patience': 60, 'lr_reduce_freq': 60, 'spt_alg': 'prim', 'spt_attr': 'similarity', 'manifold': 'PoincareBall', 'num_layers': 4, 'dim': 368, 'num_adj': 4, 'add_rate': 0.20170759350448858, 'tem': 1.1009676137323718, 'consis_rate': 1.061599376335844, 'use_att': 1}
mean: 0.7876
[0.79  0.8   0.775 0.787 0.771 0.803 0.781 0.772 0.8   0.797]
cur_param: {'lr': 0.05123810286016112, 'weight_decay': 0.020289599471715526, 'dropout': 0.48023750243115, 'patience': 50, 'lr_reduce_freq': 40, 'spt_alg': 'prim', 'spt_attr': 'edge_degree', 'manifold': 'PoincareBall', 'num_layers': 4, 'dim': 464, 'num_adj': 6, 'add_rate': 0.30430768120265195, 'tem': 0.9139534232182107, 'consis_rate': 0.6238535973532469, 'use_att': 0}
mean: 0.31520000000000004
[0.318 0.319 0.317 0.317 0.312 0.31  0.319 0.304 0.317 0.319]
cur_param: {'lr': 0.004256694747364884, 'weight_decay': 0.0008387901118181933, 'dropout': 0.3405567969803791, 'patience': 90, 'lr_reduce_freq': 80, 'spt_alg': 'prim', 'spt_attr': 'edge_degree', 'manifold': 'PoincareBall', 'num_layers': 5, 'dim': 496, 'num_adj': 4, 'add_rate': 0.48872703851222027, 'tem': 1.0680064391936614, 'consis_rate': 0.3396387515904822, 'use_att': 0}
mean: 0.7886
[0.786 0.771 0.781 0.81  0.798 0.802 0.779 0.81  0.763 0.786]
cur_param: {'lr': 0.014451329561305367, 'weight_decay': 0.0006156103404541128, 'dropout': 0.4129485105484135, 'patience': 50, 'lr_reduce_freq': 30, 'spt_alg': 'prim', 'spt_attr': 'edge_degree', 'manifold': 'PoincareBall', 'num_layers': 4, 'dim': 400, 'num_adj': 6, 'add_rate': 0.16079914901833336, 'tem': 1.3616870848446205, 'consis_rate': 1.7395149702518737, 'use_att': 0}
mean: 0.7993
[0.811 0.777 0.782 0.829 0.799 0.808 0.806 0.789 0.799 0.793]
cur_param: {'lr': 0.02185881529052993, 'weight_decay': 0.0005083242964544053, 'dropout': 0.7910889991736125, 'patience': 50, 'lr_reduce_freq': 30, 'spt_alg': 'prim', 'spt_attr': 'edge_degree', 'manifold': 'PoincareBall', 'num_layers': 4, 'dim': 416, 'num_adj': 6, 'add_rate': 0.1778257165060018, 'tem': 1.395899778694907, 'consis_rate': 1.7099382226865567, 'use_att': 0}
mean: 0.6678
[0.64  0.713 0.764 0.502 0.776 0.692 0.452 0.702 0.737 0.7  ]
cur_param: {'lr': 0.010042079472741845, 'weight_decay': 0.0014741708445960425, 'dropout': 0.43694735005326707, 'patience': 60, 'lr_reduce_freq': 50, 'spt_alg': 'prim', 'spt_attr': 'edge_degree', 'manifold': 'PoincareBall', 'num_layers': 4, 'dim': 448, 'num_adj': 6, 'add_rate': 0.3195224729532036, 'tem': 1.2455322763061825, 'consis_rate': 1.0543761522766655, 'use_att': 0}
mean: 0.7917000000000001
[0.809 0.779 0.794 0.8   0.791 0.807 0.806 0.753 0.782 0.796]
cur_param: {'lr': 0.04150583181234061, 'weight_decay': 0.0007895442638157452, 'dropout': 0.6201018488392953, 'patience': 50, 'lr_reduce_freq': 40, 'spt_alg': 'prim', 'spt_attr': 'edge_degree', 'manifold': 'PoincareBall', 'num_layers': 4, 'dim': 352, 'num_adj': 6, 'add_rate': 0.20191618906938408, 'tem': 0.8692122075450421, 'consis_rate': 1.6831063300524503, 'use_att': 0}
mean: 0.7992999999999999
[0.794 0.771 0.811 0.798 0.806 0.812 0.799 0.804 0.817 0.781]
cur_param: {'lr': 0.047391507742030096, 'weight_decay': 0.000898121820921064, 'dropout': 0.6231711691325342, 'patience': 60, 'lr_reduce_freq': 60, 'spt_alg': 'prim', 'spt_attr': 'edge_degree', 'manifold': 'PoincareBall', 'num_layers': 4, 'dim': 368, 'num_adj': 6, 'add_rate': 0.2024949047262394, 'tem': 0.8523607164145545, 'consis_rate': 1.3995741451844317, 'use_att': 0}
mean: 0.8081000000000002
[0.817 0.789 0.81  0.806 0.825 0.805 0.806 0.812 0.793 0.818]
cur_param: {'lr': 0.06200898607191759, 'weight_decay': 0.004454447122034906, 'dropout': 0.7116282069071238, 'patience': 60, 'lr_reduce_freq': 70, 'spt_alg': 'prim', 'spt_attr': 'edge_degree', 'manifold': 'PoincareBall', 'num_layers': 4, 'dim': 384, 'num_adj': 4, 'add_rate': 0.3294086152276131, 'tem': 1.0328088766291215, 'consis_rate': 1.4148573853077753, 'use_att': 0}
mean: 0.32089999999999996
[0.319 0.319 0.319 0.319 0.319 0.338 0.319 0.319 0.319 0.319]
cur_param: {'lr': 0.021424911039655447, 'weight_decay': 0.00118049502649384, 'dropout': 0.557398406781121, 'patience': 70, 'lr_reduce_freq': 90, 'spt_alg': 'kruskal', 'spt_attr': 'similarity', 'manifold': 'PoincareBall', 'num_layers': 4, 'dim': 288, 'num_adj': 6, 'add_rate': 0.4373412371545146, 'tem': 0.6413561308456981, 'consis_rate': 1.2304260882556648, 'use_att': 1}
mean: 0.7935000000000001
[0.813 0.791 0.804 0.794 0.794 0.79  0.788 0.783 0.776 0.802]
cur_param: {'lr': 0.08330042327024872, 'weight_decay': 0.0021655803881746745, 'dropout': 0.47844837349669145, 'patience': 60, 'lr_reduce_freq': 60, 'spt_alg': 'prim', 'spt_attr': 'edge_degree', 'manifold': 'PoincareBall', 'num_layers': 4, 'dim': 240, 'num_adj': 6, 'add_rate': 0.2695699424031298, 'tem': 0.6959277933325352, 'consis_rate': 0.9776555852253218, 'use_att': 0}
mean: 0.47140000000000004
[0.319 0.807 0.825 0.319 0.811 0.319 0.319 0.357 0.319 0.319]
cur_param: {'lr': 0.04715537653202305, 'weight_decay': 0.0008034411800461021, 'dropout': 0.6206717577848833, 'patience': 70, 'lr_reduce_freq': 70, 'spt_alg': 'kruskal', 'spt_attr': 'similarity', 'manifold': 'PoincareBall', 'num_layers': 5, 'dim': 368, 'num_adj': 4, 'add_rate': 0.3891500414923398, 'tem': 0.5662774366505592, 'consis_rate': 1.3845234105938848, 'use_att': 0}
mean: 0.36639999999999995
[0.793 0.319 0.319 0.319 0.319 0.319 0.319 0.319 0.319 0.319]
cur_param: {'lr': 0.026398446457690572, 'weight_decay': 0.0017498119712582925, 'dropout': 0.3721862803025268, 'patience': 70, 'lr_reduce_freq': 90, 'spt_alg': 'prim', 'spt_attr': 'edge_degree', 'manifold': 'PoincareBall', 'num_layers': 3, 'dim': 480, 'num_adj': 6, 'add_rate': 0.44230197395360926, 'tem': 0.8656352890038617, 'consis_rate': 1.1628773812434536, 'use_att': 0}
mean: 0.8023
[0.786 0.803 0.8   0.787 0.801 0.807 0.819 0.808 0.806 0.806]
cur_param: {'lr': 0.026354381819745396, 'weight_decay': 0.0017047857435334589, 'dropout': 0.3534013953661333, 'patience': 70, 'lr_reduce_freq': 100, 'spt_alg': 'prim', 'spt_attr': 'edge_degree', 'manifold': 'PoincareBall', 'num_layers': 3, 'dim': 480, 'num_adj': 6, 'add_rate': 0.45515561886440525, 'tem': 0.8996553210689728, 'consis_rate': 1.1189908414041516, 'use_att': 0}
mean: 0.8071000000000002
[0.8   0.812 0.802 0.8   0.819 0.806 0.806 0.817 0.811 0.798]
cur_param: {'lr': 0.02695823311678512, 'weight_decay': 0.0019675232544548653, 'dropout': 0.3472737111456489, 'patience': 70, 'lr_reduce_freq': 100, 'spt_alg': 'prim', 'spt_attr': 'edge_degree', 'manifold': 'PoincareBall', 'num_layers': 3, 'dim': 480, 'num_adj': 6, 'add_rate': 0.4702244565997144, 'tem': 0.8032558081083284, 'consis_rate': 1.1543218168431117, 'use_att': 0}
mean: 0.7978
[0.802 0.791 0.812 0.795 0.801 0.788 0.816 0.796 0.792 0.785]
cur_param: {'lr': 0.0385325514250998, 'weight_decay': 0.0034833301518232317, 'dropout': 0.37957121281749473, 'patience': 70, 'lr_reduce_freq': 90, 'spt_alg': 'prim', 'spt_attr': 'edge_degree', 'manifold': 'PoincareBall', 'num_layers': 3, 'dim': 496, 'num_adj': 6, 'add_rate': 0.5644958484447441, 'tem': 0.8989174944245563, 'consis_rate': 0.9504718165397842, 'use_att': 0}
mean: 0.7956000000000001
[0.794 0.786 0.801 0.777 0.787 0.79  0.814 0.808 0.807 0.792]
cur_param: {'lr': 0.06661209429593007, 'weight_decay': 0.0016586126326837056, 'dropout': 0.473768713966898, 'patience': 70, 'lr_reduce_freq': 110, 'spt_alg': 'kruskal', 'spt_attr': 'edge_degree', 'manifold': 'PoincareBall', 'num_layers': 3, 'dim': 480, 'num_adj': 6, 'add_rate': 0.35815386503292734, 'tem': 0.8369589546884099, 'consis_rate': 0.7518955434567194, 'use_att': 1}
mean: 0.7876
[0.793 0.796 0.773 0.781 0.739 0.79  0.81  0.813 0.802 0.779]
cur_param: {'lr': 0.02497909012245644, 'weight_decay': 0.0052033236378649156, 'dropout': 0.2982757186005424, 'patience': 70, 'lr_reduce_freq': 100, 'spt_alg': 'prim', 'spt_attr': 'similarity', 'manifold': 'PoincareBall', 'num_layers': 3, 'dim': 512, 'num_adj': 4, 'add_rate': 0.6779245245944725, 'tem': 0.7488352276073035, 'consis_rate': 1.1682063912406762, 'use_att': 0}
mean: 0.7936
[0.783 0.78  0.792 0.807 0.801 0.804 0.786 0.797 0.794 0.792]
cur_param: {'lr': 0.056728989591739505, 'weight_decay': 0.0011649460727275057, 'dropout': 0.6687467387507042, 'patience': 90, 'lr_reduce_freq': 120, 'spt_alg': 'kruskal', 'spt_attr': 'edge_degree', 'manifold': 'Hyperboloid', 'num_layers': 3, 'dim': 432, 'num_adj': 6, 'add_rate': 0.5227837304854915, 'tem': 0.9983954863493796, 'consis_rate': 1.336646523496348, 'use_att': 0}[32m[I 2022-06-29 10:48:41,017][0m Trial 36 finished with value: 0.8025 and parameters: {'lr': 0.056728989591739505, 'weight_decay': 0.0011649460727275057, 'dropout': 0.6687467387507042, 'patience': 90, 'lr_reduce_freq': 120, 'spt_alg': 'kruskal', 'spt_attr': 'edge_degree', 'manifold': 'Hyperboloid', 'num_layers': 3, 'dim': 432, 'num_adj': 6, 'add_rate': 0.5227837304854915, 'tem': 0.9983954863493796, 'consis_rate': 1.336646523496348, 'use_att': 0}. Best is trial 25 with value: 0.8081000000000002.[0m
[32m[I 2022-06-29 11:01:41,465][0m Trial 37 finished with value: 0.7991999999999999 and parameters: {'lr': 0.05717797537827988, 'weight_decay': 0.0019576136798857714, 'dropout': 0.6653942885916824, 'patience': 90, 'lr_reduce_freq': 120, 'spt_alg': 'kruskal', 'spt_attr': 'edge_degree', 'manifold': 'Hyperboloid', 'num_layers': 3, 'dim': 432, 'num_adj': 4, 'add_rate': 0.6185247060439036, 'tem': 1.0130001947870337, 'consis_rate': 1.3149856991408904, 'use_att': 0}. Best is trial 25 with value: 0.8081000000000002.[0m
[32m[I 2022-06-29 12:10:14,322][0m Trial 38 finished with value: 0.7116 and parameters: {'lr': 0.09602507256063633, 'weight_decay': 0.0009883548687836436, 'dropout': 0.7269002669526423, 'patience': 90, 'lr_reduce_freq': 150, 'spt_alg': 'kruskal', 'spt_attr': 'edge_degree', 'manifold': 'Hyperboloid', 'num_layers': 3, 'dim': 336, 'num_adj': 6, 'add_rate': 0.5381823173085546, 'tem': 1.1470907651021813, 'consis_rate': 1.5272970416812537, 'use_att': 1}. Best is trial 25 with value: 0.8081000000000002.[0m
[32m[I 2022-06-29 12:29:05,424][0m Trial 39 finished with value: 0.7832000000000001 and parameters: {'lr': 0.044643265649656545, 'weight_decay': 0.004086790011768521, 'dropout': 0.21141926186518722, 'patience': 80, 'lr_reduce_freq': 120, 'spt_alg': 'kruskal', 'spt_attr': 'similarity', 'manifold': 'Hyperboloid', 'num_layers': 3, 'dim': 448, 'num_adj': 6, 'add_rate': 0.4497978769895696, 'tem': 0.7548253671790218, 'consis_rate': 1.438836855439125, 'use_att': 0}. Best is trial 25 with value: 0.8081000000000002.[0m
[32m[I 2022-06-29 12:35:14,530][0m Trial 40 finished with value: 0.2535 and parameters: {'lr': 0.0005122461334245335, 'weight_decay': 0.006096679116348905, 'dropout': 0.5202645712417727, 'patience': 80, 'lr_reduce_freq': 130, 'spt_alg': 'kruskal', 'spt_attr': 'edge_degree', 'manifold': 'Hyperboloid', 'num_layers': 3, 'dim': 416, 'num_adj': 4, 'add_rate': 0.6444903336974844, 'tem': 0.859781359909599, 'consis_rate': 1.3130844892991822, 'use_att': 0}. Best is trial 25 with value: 0.8081000000000002.[0m
[32m[I 2022-06-29 12:43:26,843][0m Trial 41 finished with value: 0.8012 and parameters: {'lr': 0.03244271249023104, 'weight_decay': 0.0013009238257496469, 'dropout': 0.665994742760699, 'patience': 60, 'lr_reduce_freq': 80, 'spt_alg': 'kruskal', 'spt_attr': 'edge_degree', 'manifold': 'Hyperboloid', 'num_layers': 3, 'dim': 480, 'num_adj': 6, 'add_rate': 0.5090690948414985, 'tem': 0.9674506156962659, 'consis_rate': 1.1385888420630887, 'use_att': 0}. Best is trial 25 with value: 0.8081000000000002.[0m
[32m[I 2022-06-29 12:59:09,768][0m Trial 42 finished with value: 0.7935000000000001 and parameters: {'lr': 0.06770761117876803, 'weight_decay': 0.0025527684040574953, 'dropout': 0.6742986031181885, 'patience': 70, 'lr_reduce_freq': 80, 'spt_alg': 'kruskal', 'spt_attr': 'edge_degree', 'manifold': 'Hyperboloid', 'num_layers': 3, 'dim': 480, 'num_adj': 6, 'add_rate': 0.5077429210283323, 'tem': 0.914414198972511, 'consis_rate': 1.1435362122509625, 'use_att': 0}. Best is trial 25 with value: 0.8081000000000002.[0m
[32m[I 2022-06-29 13:10:27,726][0m Trial 43 finished with value: 0.8055 and parameters: {'lr': 0.020559717000826924, 'weight_decay': 0.0012761768809989326, 'dropout': 0.738282527990826, 'patience': 100, 'lr_reduce_freq': 100, 'spt_alg': 'kruskal', 'spt_attr': 'edge_degree', 'manifold': 'Hyperboloid', 'num_layers': 3, 'dim': 448, 'num_adj': 6, 'add_rate': 0.41013380479369294, 'tem': 0.9798943281582063, 'consis_rate': 1.256672444370011, 'use_att': 0}. Best is trial 25 with value: 0.8081000000000002.[0m
[32m[I 2022-06-29 13:25:23,123][0m Trial 44 finished with value: 0.7659 and parameters: {'lr': 0.007261230400444019, 'weight_decay': 0.0031698795241174573, 'dropout': 0.739457888685369, 'patience': 100, 'lr_reduce_freq': 100, 'spt_alg': 'kruskal', 'spt_attr': 'edge_degree', 'manifold': 'Hyperboloid', 'num_layers': 3, 'dim': 448, 'num_adj': 6, 'add_rate': 0.38338616718839064, 'tem': 1.0461155551785328, 'consis_rate': 1.4653026701277116, 'use_att': 0}. Best is trial 25 with value: 0.8081000000000002.[0m
[32m[I 2022-06-29 13:28:54,173][0m Trial 45 finished with value: 0.7967 and parameters: {'lr': 0.020993694246312523, 'weight_decay': 0.0009564201662761153, 'dropout': 0.3012527136392305, 'patience': 100, 'lr_reduce_freq': 110, 'spt_alg': 'kruskal', 'spt_attr': 'edge_degree', 'manifold': 'Hyperboloid', 'num_layers': 3, 'dim': 320, 'num_adj': 2, 'add_rate': 0.7088297058511612, 'tem': 0.7980796207569073, 'consis_rate': 1.2630648797067572, 'use_att': 0}. Best is trial 25 with value: 0.8081000000000002.[0m
[32m[I 2022-06-29 14:18:36,370][0m Trial 46 finished with value: 0.762 and parameters: {'lr': 0.0263180874382427, 'weight_decay': 0.0018745684345984552, 'dropout': 0.7939295120154369, 'patience': 90, 'lr_reduce_freq': 130, 'spt_alg': 'kruskal', 'spt_attr': 'edge_degree', 'manifold': 'Hyperboloid', 'num_layers': 3, 'dim': 416, 'num_adj': 6, 'add_rate': 0.5820996188239168, 'tem': 1.1196436749620666, 'consis_rate': 1.6093528533060355, 'use_att': 1}. Best is trial 25 with value: 0.8081000000000002.[0m
[32m[I 2022-06-29 14:27:22,397][0m Trial 47 finished with value: 0.7891 and parameters: {'lr': 0.012759336532554883, 'weight_decay': 0.0024396213216432315, 'dropout': 0.27240755970154634, 'patience': 90, 'lr_reduce_freq': 90, 'spt_alg': 'kruskal', 'spt_attr': 'edge_degree', 'manifold': 'Hyperboloid', 'num_layers': 3, 'dim': 160, 'num_adj': 6, 'add_rate': 0.4138062588469059, 'tem': 0.8828955601533746, 'consis_rate': 1.3540405220953606, 'use_att': 0}. Best is trial 25 with value: 0.8081000000000002.[0m
[32m[I 2022-06-29 14:35:55,334][0m Trial 48 finished with value: 0.7964000000000001 and parameters: {'lr': 0.017711507921414075, 'weight_decay': 0.0007860740207477614, 'dropout': 0.7565741602116571, 'patience': 80, 'lr_reduce_freq': 110, 'spt_alg': 'kruskal', 'spt_attr': 'edge_degree', 'manifold': 'Hyperboloid', 'num_layers': 3, 'dim': 464, 'num_adj': 6, 'add_rate': 0.4539344777945673, 'tem': 1.004571657183137, 'consis_rate': 1.0738317415245364, 'use_att': 0}. Best is trial 25 with value: 0.8081000000000002.[0m
[32m[I 2022-06-29 14:47:33,748][0m Trial 49 finished with value: 0.319 and parameters: {'lr': 0.08026155701175712, 'weight_decay': 0.0010676116118289376, 'dropout': 0.6986360590792892, 'patience': 100, 'lr_reduce_freq': 120, 'spt_alg': 'kruskal', 'spt_attr': 'edge_degree', 'manifold': 'Hyperboloid', 'num_layers': 5, 'dim': 432, 'num_adj': 6, 'add_rate': 0.3540902320149101, 'tem': 0.7102382796226336, 'consis_rate': 1.2343452443448437, 'use_att': 0}. Best is trial 25 with value: 0.8081000000000002.[0m
[32m[I 2022-06-29 14:56:16,408][0m Trial 50 finished with value: 0.35740000000000005 and parameters: {'lr': 0.039415978401445215, 'weight_decay': 0.017695381771174978, 'dropout': 0.3241926861914417, 'patience': 100, 'lr_reduce_freq': 100, 'spt_alg': 'prim', 'spt_attr': 'similarity', 'manifold': 'Hyperboloid', 'num_layers': 3, 'dim': 384, 'num_adj': 6, 'add_rate': 0.5122632385349081, 'tem': 0.8288738196856372, 'consis_rate': 1.5982746679900715, 'use_att': 0}. Best is trial 25 with value: 0.8081000000000002.[0m
[32m[I 2022-06-29 15:04:31,613][0m Trial 51 finished with value: 0.7972 and parameters: {'lr': 0.031813571938664104, 'weight_decay': 0.0012749778347043474, 'dropout': 0.6794202887327903, 'patience': 60, 'lr_reduce_freq': 90, 'spt_alg': 'kruskal', 'spt_attr': 'edge_degree', 'manifold': 'Hyperboloid', 'num_layers': 3, 'dim': 496, 'num_adj': 6, 'add_rate': 0.5236988042037384, 'tem': 0.9704684355050447, 'consis_rate': 1.1812705477514818, 'use_att': 0}. Best is trial 25 with value: 0.8081000000000002.[0m
