[32m[I 2022-07-01 05:17:24,195][0m Trial 143 finished with value: 0.8182 and parameters: {'lr': 0.007321976550842886, 'weight_decay': 0.0007570883166909125, 'dropout': 0.7714397977595032, 'patience': 100, 'lr_reduce_freq': 90, 'spt_alg': 'kruskal', 'spt_attr': 'similarity', 'manifold': 'Hyperboloid', 'num_layers': 3, 'dim': 208, 'num_adj': 4, 'add_rate': 0.4240595088462577, 'tem': 1.1734020659390405, 'consis_rate': 0.49665431639307644, 'use_att': 1}. Best is trial 103 with value: 0.8194000000000001.[0m

cur_param: {'lr': 0.011033723667366102, 'weight_decay': 0.0009242804099447894, 'dropout': 0.7837950581357019, 'patience': 100, 'lr_reduce_freq': 90, 'spt_alg': 'kruskal', 'spt_attr': 'similarity', 'manifold': 'PoincareBall', 'num_layers': 3, 'dim': 336, 'num_adj': 4, 'add_rate': 0.6100767405977757, 'tem': 1.0270094369894842, 'consis_rate': 0.9315077084773307, 'use_att': 1}
mean: 0.8105
[0.805 0.788 0.816 0.812 0.81  0.823 0.8   0.816 0.819 0.816]
cur_param: {'lr': 0.014000936582206384, 'weight_decay': 0.0007170207534117575, 'dropout': 0.7017706388407027, 'patience': 100, 'lr_reduce_freq': 70, 'spt_alg': 'kruskal', 'spt_attr': 'similarity', 'manifold': 'PoincareBall', 'num_layers': 3, 'dim': 400, 'num_adj': 4, 'add_rate': 0.5201083767148426, 'tem': 0.9161603045060456, 'consis_rate': 0.8099949030093434, 'use_att': 1}
mean: 0.8053000000000001
[0.797 0.82  0.804 0.783 0.807 0.812 0.815 0.812 0.82  0.783]
cur_param: {'lr': 0.004934433372954258, 'weight_decay': 0.001161038108674135, 'dropout': 0.7986108085568685, 'patience': 100, 'lr_reduce_freq': 80, 'spt_alg': 'kruskal', 'spt_attr': 'similarity', 'manifold': 'PoincareBall', 'num_layers': 3, 'dim': 352, 'num_adj': 4, 'add_rate': 0.6441170980697015, 'tem': 0.878601251197367, 'consis_rate': 0.26918587876097766, 'use_att': 1}
mean: 0.8135999999999999
[0.827 0.82  0.824 0.807 0.799 0.805 0.826 0.797 0.806 0.825]
cur_param: {'lr': 0.006406838384294869, 'weight_decay': 0.00084680259807198, 'dropout': 0.7667590966417211, 'patience': 100, 'lr_reduce_freq': 90, 'spt_alg': 'kruskal', 'spt_attr': 'similarity', 'manifold': 'PoincareBall', 'num_layers': 3, 'dim': 304, 'num_adj': 4, 'add_rate': 0.5829537139172474, 'tem': 1.0420305909913017, 'consis_rate': 0.9055345002219571, 'use_att': 1}
mean: 0.8141999999999999
[0.808 0.827 0.808 0.814 0.821 0.82  0.804 0.821 0.815 0.804]
cur_param: {'lr': 0.009032090341438976, 'weight_decay': 0.0010444522832986493, 'dropout': 0.7257151887204982, 'patience': 100, 'lr_reduce_freq': 40, 'spt_alg': 'kruskal', 'spt_attr': 'similarity', 'manifold': 'Hyperboloid', 'num_layers': 3, 'dim': 272, 'num_adj': 4, 'add_rate': 0.6793541905059814, 'tem': 1.127089090941672, 'consis_rate': 0.7482762163410773, 'use_att': 1}
mean: 0.8126999999999999
[0.804 0.804 0.815 0.813 0.806 0.814 0.814 0.817 0.826 0.814]
cur_param: {'lr': 0.009902314300378572, 'weight_decay': 0.0008276410201173868, 'dropout': 0.7480173871719461, 'patience': 100, 'lr_reduce_freq': 90, 'spt_alg': 'kruskal', 'spt_attr': 'similarity', 'manifold': 'Hyperboloid', 'num_layers': 3, 'dim': 336, 'num_adj': 4, 'add_rate': 0.6298942761801773, 'tem': 1.1151071296674668, 'consis_rate': 0.5891759937567311, 'use_att': 1}
mean: 0.8115
[0.802 0.826 0.803 0.81  0.812 0.817 0.813 0.809 0.821 0.802]
cur_param: {'lr': 0.007528000679059234, 'weight_decay': 0.0011020629765222181, 'dropout': 0.7829559629788859, 'patience': 60, 'lr_reduce_freq': 100, 'spt_alg': 'kruskal', 'spt_attr': 'similarity', 'manifold': 'Hyperboloid', 'num_layers': 3, 'dim': 192, 'num_adj': 4, 'add_rate': 0.7924379009019852, 'tem': 1.1747745180477358, 'consis_rate': 1.6534064726689257, 'use_att': 1}
mean: 0.8163
[0.812 0.807 0.819 0.829 0.824 0.798 0.81  0.818 0.831 0.815]
cur_param: {'lr': 0.005696712226387033, 'weight_decay': 0.001371642223648074, 'dropout': 0.7821335697784215, 'patience': 70, 'lr_reduce_freq': 100, 'spt_alg': 'kruskal', 'spt_attr': 'similarity', 'manifold': 'Hyperboloid', 'num_layers': 3, 'dim': 352, 'num_adj': 4, 'add_rate': 0.7932649948492372, 'tem': 0.9459393388941593, 'consis_rate': 1.6448571598733914, 'use_att': 1}
mean: 0.8132999999999999
[0.821 0.819 0.81  0.82  0.809 0.79  0.82  0.805 0.821 0.818]
cur_param: {'lr': 0.007620586655426123, 'weight_decay': 0.0012362292012437009, 'dropout': 0.7730902832231901, 'patience': 70, 'lr_reduce_freq': 100, 'spt_alg': 'kruskal', 'spt_attr': 'similarity', 'manifold': 'Hyperboloid', 'num_layers': 3, 'dim': 320, 'num_adj': 4, 'add_rate': 0.8237465440162802, 'tem': 1.1796788562715976, 'consis_rate': 1.68394591623456, 'use_att': 1}
mean: 0.8119999999999999
[0.808 0.808 0.818 0.827 0.802 0.803 0.81  0.822 0.81  0.812]
cur_param: {'lr': 0.006717584357605465, 'weight_decay': 0.001122257040321393, 'dropout': 0.7592728764159982, 'patience': 60, 'lr_reduce_freq': 90, 'spt_alg': 'kruskal', 'spt_attr': 'similarity', 'manifold': 'PoincareBall', 'num_layers': 3, 'dim': 368, 'num_adj': 4, 'add_rate': 0.5402671562059589, 'tem': 0.9745687821165894, 'consis_rate': 0.8654282275626753, 'use_att': 1}
mean: 0.8138
[0.817 0.827 0.799 0.808 0.819 0.816 0.811 0.822 0.812 0.807]
cur_param: {'lr': 0.00815215029456089, 'weight_decay': 0.0015892944180281737, 'dropout': 0.799680469728623, 'patience': 100, 'lr_reduce_freq': 80, 'spt_alg': 'kruskal', 'spt_attr': 'similarity', 'manifold': 'Hyperboloid', 'num_layers': 5, 'dim': 160, 'num_adj': 4, 'add_rate': 0.8644626189994169, 'tem': 1.0150639618804422, 'consis_rate': 0.7829866567875179, 'use_att': 1}
mean: 0.34269999999999995
[0.321 0.319 0.319 0.319 0.32  0.319 0.511 0.319 0.319 0.361]
cur_param: {'lr': 0.011489953413799036, 'weight_decay': 0.0009594150190690325, 'dropout': 0.7390659804831219, 'patience': 50, 'lr_reduce_freq': 100, 'spt_alg': 'kruskal', 'spt_attr': 'similarity', 'manifold': 'Hyperboloid', 'num_layers': 3, 'dim': 208, 'num_adj': 4, 'add_rate': 0.8089217080407036, 'tem': 1.245662607180108, 'consis_rate': 0.640717190249074, 'use_att': 1}
mean: 0.8112999999999999
[0.809 0.815 0.817 0.804 0.823 0.821 0.803 0.815 0.801 0.805]
cur_param: {'lr': 0.01663034027544191, 'weight_decay': 0.0013977493048955235, 'dropout': 0.7848420536217047, 'patience': 60, 'lr_reduce_freq': 70, 'spt_alg': 'kruskal', 'spt_attr': 'similarity', 'manifold': 'Hyperboloid', 'num_layers': 3, 'dim': 384, 'num_adj': 4, 'add_rate': 0.7714658380305381, 'tem': 1.0579112888898343, 'consis_rate': 1.517073371851088, 'use_att': 1}
mean: 0.8077
[0.796 0.797 0.803 0.825 0.802 0.817 0.799 0.823 0.815 0.8  ]
cur_param: {'lr': 0.010440502731366588, 'weight_decay': 0.0010905405164780614, 'dropout': 0.7558883534064287, 'patience': 60, 'lr_reduce_freq': 90, 'spt_alg': 'kruskal', 'spt_attr': 'similarity', 'manifold': 'PoincareBall', 'num_layers': 3, 'dim': 224, 'num_adj': 4, 'add_rate': 0.5700656569373244, 'tem': 1.2138463306923224, 'consis_rate': 0.7326101419865739, 'use_att': 1}
mean: 0.8093999999999999
[0.818 0.809 0.808 0.819 0.818 0.799 0.796 0.82  0.792 0.815]
cur_param: {'lr': 0.009044575631393898, 'weight_decay': 0.0010059983102316764, 'dropout': 0.6878935965765249, 'patience': 50, 'lr_reduce_freq': 100, 'spt_alg': 'kruskal', 'spt_attr': 'similarity', 'manifold': 'Hyperboloid', 'num_layers': 3, 'dim': 192, 'num_adj': 4, 'add_rate': 0.7555667094817935, 'tem': 1.1502238051715155, 'consis_rate': 1.460445451177101, 'use_att': 1}
mean: 0.8072000000000001
[0.816 0.81  0.806 0.805 0.817 0.788 0.803 0.811 0.803 0.813]
cur_param: {'lr': 0.008654445847279436, 'weight_decay': 0.0009143591849692525, 'dropout': 0.7291336806623838, 'patience': 100, 'lr_reduce_freq': 100, 'spt_alg': 'kruskal', 'spt_attr': 'similarity', 'manifold': 'Hyperboloid', 'num_layers': 3, 'dim': 208, 'num_adj': 4, 'add_rate': 0.7175502599414734, 'tem': 1.1831842545460114, 'consis_rate': 1.4265013913634317, 'use_att': 1}
mean: 0.8145999999999999
[0.813 0.815 0.822 0.82  0.823 0.801 0.824 0.81  0.811 0.807]
cur_param: {'lr': 0.007321976550842886, 'weight_decay': 0.0007570883166909125, 'dropout': 0.7714397977595032, 'patience': 100, 'lr_reduce_freq': 90, 'spt_alg': 'kruskal', 'spt_attr': 'similarity', 'manifold': 'Hyperboloid', 'num_layers': 3, 'dim': 208, 'num_adj': 4, 'add_rate': 0.4240595088462577, 'tem': 1.1734020659390405, 'consis_rate': 0.49665431639307644, 'use_att': 1}
mean: 0.8182
[0.816 0.803 0.819 0.823 0.823 0.823 0.816 0.817 0.813 0.829]
cur_param: {'lr': 0.01994284397208448, 'weight_decay': 0.0006729548053179623, 'dropout': 0.7729391058376313, 'patience': 100, 'lr_reduce_freq': 80, 'spt_alg': 'kruskal', 'spt_attr': 'similarity', 'manifold': 'Hyperboloid', 'num_layers': 3, 'dim': 240, 'num_adj': 4, 'add_rate': 0.7215076153427307, 'tem': 1.1894625335141797, 'consis_rate': 0.3659151571648771, 'use_att': 1}
mean: 0.8064
[0.809 0.809 0.819 0.787 0.816 0.815 0.794 0.816 0.789 0.81 ][32m[I 2022-07-01 05:36:35,576][0m Trial 144 finished with value: 0.8064 and parameters: {'lr': 0.01994284397208448, 'weight_decay': 0.0006729548053179623, 'dropout': 0.7729391058376313, 'patience': 100, 'lr_reduce_freq': 80, 'spt_alg': 'kruskal', 'spt_attr': 'similarity', 'manifold': 'Hyperboloid', 'num_layers': 3, 'dim': 240, 'num_adj': 4, 'add_rate': 0.7215076153427307, 'tem': 1.1894625335141797, 'consis_rate': 0.3659151571648771, 'use_att': 1}. Best is trial 103 with value: 0.8194000000000001.[0m
[32m[I 2022-07-01 05:58:28,381][0m Trial 145 finished with value: 0.8150999999999999 and parameters: {'lr': 0.006825176796063676, 'weight_decay': 0.0007767766589847975, 'dropout': 0.7885902217555186, 'patience': 100, 'lr_reduce_freq': 100, 'spt_alg': 'kruskal', 'spt_attr': 'similarity', 'manifold': 'Hyperboloid', 'num_layers': 3, 'dim': 208, 'num_adj': 4, 'add_rate': 0.39755644298519727, 'tem': 1.2032842068822696, 'consis_rate': 0.4927540695850324, 'use_att': 1}. Best is trial 103 with value: 0.8194000000000001.[0m
[32m[I 2022-07-01 06:20:06,283][0m Trial 146 finished with value: 0.8118000000000001 and parameters: {'lr': 0.005885100574657089, 'weight_decay': 0.0007584986995235241, 'dropout': 0.79999057772833, 'patience': 100, 'lr_reduce_freq': 90, 'spt_alg': 'kruskal', 'spt_attr': 'similarity', 'manifold': 'Hyperboloid', 'num_layers': 3, 'dim': 208, 'num_adj': 4, 'add_rate': 0.39141243640587087, 'tem': 1.2533365609277263, 'consis_rate': 0.5212529810692708, 'use_att': 1}. Best is trial 103 with value: 0.8194000000000001.[0m
[32m[I 2022-07-01 06:39:57,387][0m Trial 147 finished with value: 0.8148 and parameters: {'lr': 0.0050603482679147235, 'weight_decay': 0.0007883062568843438, 'dropout': 0.7841911994556046, 'patience': 100, 'lr_reduce_freq': 80, 'spt_alg': 'kruskal', 'spt_attr': 'edge_degree', 'manifold': 'Hyperboloid', 'num_layers': 3, 'dim': 192, 'num_adj': 4, 'add_rate': 0.37010050185533805, 'tem': 1.2783521177487673, 'consis_rate': 1.0933466932869838, 'use_att': 1}. Best is trial 103 with value: 0.8194000000000001.[0m
[32m[I 2022-07-01 07:00:54,092][0m Trial 148 finished with value: 0.8160000000000001 and parameters: {'lr': 0.004182831870631324, 'weight_decay': 0.0007033956836945768, 'dropout': 0.7613812577532542, 'patience': 100, 'lr_reduce_freq': 100, 'spt_alg': 'kruskal', 'spt_attr': 'similarity', 'manifold': 'Hyperboloid', 'num_layers': 3, 'dim': 224, 'num_adj': 4, 'add_rate': 0.45778212096110965, 'tem': 1.1695157370967064, 'consis_rate': 0.4375863862585607, 'use_att': 1}. Best is trial 103 with value: 0.8194000000000001.[0m
[32m[I 2022-07-01 07:24:47,152][0m Trial 149 finished with value: 0.8138 and parameters: {'lr': 0.012719981793925776, 'weight_decay': 0.0005860263928044805, 'dropout': 0.7672342663574461, 'patience': 100, 'lr_reduce_freq': 100, 'spt_alg': 'kruskal', 'spt_attr': 'similarity', 'manifold': 'Hyperboloid', 'num_layers': 3, 'dim': 224, 'num_adj': 4, 'add_rate': 0.4338376951163298, 'tem': 1.2232936044214122, 'consis_rate': 0.4151727475259629, 'use_att': 1}. Best is trial 103 with value: 0.8194000000000001.[0m

cur_param: {'lr': 0.006825176796063676, 'weight_decay': 0.0007767766589847975, 'dropout': 0.7885902217555186, 'patience': 100, 'lr_reduce_freq': 100, 'spt_alg': 'kruskal', 'spt_attr': 'similarity', 'manifold': 'Hyperboloid', 'num_layers': 3, 'dim': 208, 'num_adj': 4, 'add_rate': 0.39755644298519727, 'tem': 1.2032842068822696, 'consis_rate': 0.4927540695850324, 'use_att': 1}
mean: 0.8150999999999999
[0.817 0.811 0.833 0.823 0.83  0.8   0.82  0.813 0.802 0.802]
cur_param: {'lr': 0.005885100574657089, 'weight_decay': 0.0007584986995235241, 'dropout': 0.79999057772833, 'patience': 100, 'lr_reduce_freq': 90, 'spt_alg': 'kruskal', 'spt_attr': 'similarity', 'manifold': 'Hyperboloid', 'num_layers': 3, 'dim': 208, 'num_adj': 4, 'add_rate': 0.39141243640587087, 'tem': 1.2533365609277263, 'consis_rate': 0.5212529810692708, 'use_att': 1}
mean: 0.8118000000000001
[0.821 0.805 0.812 0.827 0.822 0.808 0.81  0.802 0.811 0.8  ]
cur_param: {'lr': 0.0050603482679147235, 'weight_decay': 0.0007883062568843438, 'dropout': 0.7841911994556046, 'patience': 100, 'lr_reduce_freq': 80, 'spt_alg': 'kruskal', 'spt_attr': 'edge_degree', 'manifold': 'Hyperboloid', 'num_layers': 3, 'dim': 192, 'num_adj': 4, 'add_rate': 0.37010050185533805, 'tem': 1.2783521177487673, 'consis_rate': 1.0933466932869838, 'use_att': 1}
mean: 0.8148
[0.814 0.795 0.825 0.826 0.821 0.824 0.834 0.796 0.803 0.81 ]
cur_param: {'lr': 0.004182831870631324, 'weight_decay': 0.0007033956836945768, 'dropout': 0.7613812577532542, 'patience': 100, 'lr_reduce_freq': 100, 'spt_alg': 'kruskal', 'spt_attr': 'similarity', 'manifold': 'Hyperboloid', 'num_layers': 3, 'dim': 224, 'num_adj': 4, 'add_rate': 0.45778212096110965, 'tem': 1.1695157370967064, 'consis_rate': 0.4375863862585607, 'use_att': 1}
mean: 0.8160000000000001
[0.823 0.824 0.822 0.804 0.809 0.833 0.817 0.813 0.811 0.804]
cur_param: {'lr': 0.012719981793925776, 'weight_decay': 0.0005860263928044805, 'dropout': 0.7672342663574461, 'patience': 100, 'lr_reduce_freq': 100, 'spt_alg': 'kruskal', 'spt_attr': 'similarity', 'manifold': 'Hyperboloid', 'num_layers': 3, 'dim': 224, 'num_adj': 4, 'add_rate': 0.4338376951163298, 'tem': 1.2232936044214122, 'consis_rate': 0.4151727475259629, 'use_att': 1}
mean: 0.8138
[0.81  0.816 0.807 0.814 0.819 0.831 0.808 0.819 0.819 0.795]
best param:--lr 0.009250999384460137 --weight_decay 0.0010409623683768179 --dropout 0.7854035457803722 --patience 100 --lr_reduce_freq 90 --spt_alg kruskal --spt_attr similarity --manifold Hyperboloid --num_layers 3 --dim 352 --num_adj 4 --add_rate 0.4456428084909376 --tem 1.061721881094904 --consis_rate 0.7485495409609603 --use_att 1 
best score:0.8194000000000001

Final results: 
0.8194000000000001
