nohup: ignoring input
[32m[I 2022-06-21 17:46:57,918][0m A new study created in memory with name: no-name-0faa7d39-9750-4351-8248-bf286caa2a5e[0m
[32m[I 2022-06-21 17:54:41,285][0m Trial 0 finished with value: 0.7936000000000001 and parameters: {'lr': 0.006295732408157506, 'weight_decay': 0.000768718193121983, 'dropout': 0.20143870515170625, 'patience': 100, 'lr_reduce_freq': 110, 'spt_alg': 'kruskal', 'spt_attr': 'similarity', 'manifold': 'PoincareBall', 'num_layers': 3, 'num_adj': 8, 'add_rate': 0.5840429972834312, 'tem': 0.8898328133718874, 'consis_rate': 0.9374444130178885, 'use_att': 0}. Best is trial 0 with value: 0.7936000000000001.[0m
[32m[I 2022-06-21 17:59:00,531][0m Trial 1 finished with value: 0.6724 and parameters: {'lr': 0.03709264506244998, 'weight_decay': 0.0039375494709561676, 'dropout': 0.07149985079726985, 'patience': 80, 'lr_reduce_freq': 70, 'spt_alg': 'kruskal', 'spt_attr': 'similarity', 'manifold': 'PoincareBall', 'num_layers': 4, 'num_adj': 4, 'add_rate': 0.5267815350254206, 'tem': 1.0345160268698406, 'consis_rate': 1.8696644379537037, 'use_att': 0}. Best is trial 0 with value: 0.7936000000000001.[0m
[32m[I 2022-06-21 18:03:03,669][0m Trial 2 finished with value: 0.7917000000000001 and parameters: {'lr': 0.00431671494432741, 'weight_decay': 0.0010247083543868222, 'dropout': 0.197371879943108, 'patience': 60, 'lr_reduce_freq': 70, 'spt_alg': 'prim', 'spt_attr': 'similarity', 'manifold': 'PoincareBall', 'num_layers': 3, 'num_adj': 6, 'add_rate': 0.8105077515459674, 'tem': 0.4526914920011842, 'consis_rate': 1.2224455198585844, 'use_att': 0}. Best is trial 0 with value: 0.7936000000000001.[0m
[32m[I 2022-06-21 18:30:10,109][0m Trial 3 finished with value: 0.3642 and parameters: {'lr': 0.01103336838456877, 'weight_decay': 0.004038323388037881, 'dropout': 0.4802912713067406, 'patience': 100, 'lr_reduce_freq': 130, 'spt_alg': 'kruskal', 'spt_attr': 'similarity', 'manifold': 'PoincareBall', 'num_layers': 4, 'num_adj': 4, 'add_rate': 0.3061300350573414, 'tem': 1.217430364597741, 'consis_rate': 1.8618504011480372, 'use_att': 1}. Best is trial 0 with value: 0.7936000000000001.[0m
[32m[I 2022-06-21 18:36:34,378][0m Trial 4 finished with value: 0.7857000000000001 and parameters: {'lr': 0.0029152129494967025, 'weight_decay': 0.0034134980615441266, 'dropout': 0.12943929408690982, 'patience': 100, 'lr_reduce_freq': 50, 'spt_alg': 'prim', 'spt_attr': 'similarity', 'manifold': 'PoincareBall', 'num_layers': 3, 'num_adj': 6, 'add_rate': 0.6426963017006586, 'tem': 0.9273180201180271, 'consis_rate': 1.8933323152266843, 'use_att': 0}. Best is trial 0 with value: 0.7936000000000001.[0m
[32m[I 2022-06-21 18:56:20,320][0m Trial 5 finished with value: 0.321 and parameters: {'lr': 0.009374457301652588, 'weight_decay': 0.01755349331742479, 'dropout': 0.40977488061483863, 'patience': 60, 'lr_reduce_freq': 130, 'spt_alg': 'kruskal', 'spt_attr': 'edge_degree', 'manifold': 'PoincareBall', 'num_layers': 3, 'num_adj': 8, 'add_rate': 0.7595056055901849, 'tem': 1.2464624791064751, 'consis_rate': 0.95502894177027, 'use_att': 1}. Best is trial 0 with value: 0.7936000000000001.[0m
[32m[I 2022-06-21 19:10:21,753][0m Trial 6 finished with value: 0.3021 and parameters: {'lr': 0.05412864443581738, 'weight_decay': 0.3600732609902421, 'dropout': 0.7088612690257935, 'patience': 60, 'lr_reduce_freq': 50, 'spt_alg': 'kruskal', 'spt_attr': 'similarity', 'manifold': 'PoincareBall', 'num_layers': 3, 'num_adj': 6, 'add_rate': 0.4361195460338856, 'tem': 1.338200799311, 'consis_rate': 1.422022635499311, 'use_att': 1}. Best is trial 0 with value: 0.7936000000000001.[0m
[32m[I 2022-06-21 19:13:15,732][0m Trial 7 finished with value: 0.2173 and parameters: {'lr': 0.0018192738791793688, 'weight_decay': 0.012148820979679243, 'dropout': 0.7357242850205808, 'patience': 60, 'lr_reduce_freq': 70, 'spt_alg': 'kruskal', 'spt_attr': 'similarity', 'manifold': 'PoincareBall', 'num_layers': 3, 'num_adj': 4, 'add_rate': 0.3243137603676938, 'tem': 1.2084817712649203, 'consis_rate': 0.730123351565025, 'use_att': 0}. Best is trial 0 with value: 0.7936000000000001.[0m
[32m[I 2022-06-21 19:35:34,392][0m Trial 8 finished with value: 0.8069000000000001 and parameters: {'lr': 0.006843331316068863, 'weight_decay': 0.0008437079614063993, 'dropout': 0.23391275311033324, 'patience': 80, 'lr_reduce_freq': 110, 'spt_alg': 'kruskal', 'spt_attr': 'edge_degree', 'manifold': 'PoincareBall', 'num_layers': 3, 'num_adj': 6, 'add_rate': 0.5902125826668398, 'tem': 1.4948258456267913, 'consis_rate': 1.2636287372618646, 'use_att': 1}. Best is trial 8 with value: 0.8069000000000001.[0m
[32m[I 2022-06-21 19:40:30,413][0m Trial 9 finished with value: 0.31850000000000006 and parameters: {'lr': 0.048537668877537805, 'weight_decay': 0.2851976294577805, 'dropout': 0.2806121612719248, 'patience': 60, 'lr_reduce_freq': 90, 'spt_alg': 'kruskal', 'spt_attr': 'edge_degree', 'manifold': 'PoincareBall', 'num_layers': 4, 'num_adj': 8, 'add_rate': 0.35624606019175487, 'tem': 1.0970652202923166, 'consis_rate': 0.33720936867424733, 'use_att': 0}. Best is trial 8 with value: 0.8069000000000001.[0m
[32m[I 2022-06-21 19:47:30,523][0m Trial 10 finished with value: 0.319 and parameters: {'lr': 0.01712744310266692, 'weight_decay': 0.09079996770384556, 'dropout': 0.9216166122024407, 'patience': 80, 'lr_reduce_freq': 150, 'spt_alg': 'prim', 'spt_attr': 'edge_degree', 'manifold': 'PoincareBall', 'num_layers': 3, 'num_adj': 2, 'add_rate': 0.16680427764438777, 'tem': 1.9658165960411822, 'consis_rate': 1.4781601697601139, 'use_att': 1}. Best is trial 8 with value: 0.8069000000000001.[0m
[32m[I 2022-06-21 20:21:47,748][0m Trial 11 finished with value: 0.8051 and parameters: {'lr': 0.005968119807511067, 'weight_decay': 0.0008397699450004914, 'dropout': 0.0012892485236774276, 'patience': 100, 'lr_reduce_freq': 110, 'spt_alg': 'kruskal', 'spt_attr': 'edge_degree', 'manifold': 'PoincareBall', 'num_layers': 3, 'num_adj': 8, 'add_rate': 0.6140867012444041, 'tem': 1.7015235773971729, 'consis_rate': 0.7383413725883501, 'use_att': 1}. Best is trial 8 with value: 0.8069000000000001.[0m
[32m[I 2022-06-21 21:09:12,155][0m Trial 12 finished with value: 0.8053000000000001 and parameters: {'lr': 0.001251770441014448, 'weight_decay': 0.000544872287500333, 'dropout': 0.003071054303024817, 'patience': 80, 'lr_reduce_freq': 110, 'spt_alg': 'kruskal', 'spt_attr': 'edge_degree', 'manifold': 'PoincareBall', 'num_layers': 3, 'num_adj': 8, 'add_rate': 0.8986211996012159, 'tem': 1.7602776501138866, 'consis_rate': 0.5366983130606062, 'use_att': 1}. Best is trial 8 with value: 0.8069000000000001.[0m
[32m[I 2022-06-21 21:48:27,834][0m Trial 13 finished with value: 0.8009000000000001 and parameters: {'lr': 0.00141482116576695, 'weight_decay': 0.0005188644144063135, 'dropout': 0.32736172815452846, 'patience': 80, 'lr_reduce_freq': 130, 'spt_alg': 'kruskal', 'spt_attr': 'edge_degree', 'manifold': 'PoincareBall', 'num_layers': 3, 'num_adj': 6, 'add_rate': 0.9204569305413007, 'tem': 1.6062404343341705, 'consis_rate': 0.2864379835058745, 'use_att': 1}. Best is trial 8 with value: 0.8069000000000001.[0m
[32m[I 2022-06-21 23:00:17,272][0m Trial 14 finished with value: 0.8066000000000001 and parameters: {'lr': 0.0011537239644796489, 'weight_decay': 0.0020506691761720637, 'dropout': 0.5067897238312853, 'patience': 80, 'lr_reduce_freq': 90, 'spt_alg': 'kruskal', 'spt_attr': 'edge_degree', 'manifold': 'PoincareBall', 'num_layers': 3, 'num_adj': 8, 'add_rate': 0.9164881672660574, 'tem': 1.5706509240587605, 'consis_rate': 0.5927676658688009, 'use_att': 1}. Best is trial 8 with value: 0.8069000000000001.[0m
[32m[I 2022-06-21 23:51:52,791][0m Trial 15 finished with value: 0.7889999999999999 and parameters: {'lr': 0.01881255466447637, 'weight_decay': 0.0019853665385438746, 'dropout': 0.5564966540974666, 'patience': 80, 'lr_reduce_freq': 90, 'spt_alg': 'prim', 'spt_attr': 'edge_degree', 'manifold': 'PoincareBall', 'num_layers': 4, 'num_adj': 6, 'add_rate': 0.7350655904545612, 'tem': 1.447782681013765, 'consis_rate': 1.2310902331930473, 'use_att': 1}. Best is trial 8 with value: 0.8069000000000001.[0m
[32m[I 2022-06-22 00:03:19,335][0m Trial 16 finished with value: 0.3085 and parameters: {'lr': 0.002543502470692174, 'weight_decay': 0.011872007100353712, 'dropout': 0.624448781999081, 'patience': 80, 'lr_reduce_freq': 90, 'spt_alg': 'kruskal', 'spt_attr': 'edge_degree', 'manifold': 'PoincareBall', 'num_layers': 3, 'num_adj': 2, 'add_rate': 0.7057316631911716, 'tem': 1.9274521536267857, 'consis_rate': 1.4958174063067482, 'use_att': 1}. Best is trial 8 with value: 0.8069000000000001.[0m
[32m[I 2022-06-22 00:20:22,999][0m Trial 17 finished with value: 0.5234 and parameters: {'lr': 0.09367021038534773, 'weight_decay': 0.0018412245222388646, 'dropout': 0.41748254486689507, 'patience': 80, 'lr_reduce_freq': 150, 'spt_alg': 'kruskal', 'spt_attr': 'edge_degree', 'manifold': 'PoincareBall', 'num_layers': 3, 'num_adj': 8, 'add_rate': 0.16061694673127114, 'tem': 0.6387402186660329, 'consis_rate': 0.5747827938973223, 'use_att': 1}. Best is trial 8 with value: 0.8069000000000001.[0m
cmd: --dataset cora --model HGCN --c None --dim 128
cur_param: {'lr': 0.006295732408157506, 'weight_decay': 0.000768718193121983, 'dropout': 0.20143870515170625, 'patience': 100, 'lr_reduce_freq': 110, 'spt_alg': 'kruskal', 'spt_attr': 'similarity', 'manifold': 'PoincareBall', 'num_layers': 3, 'num_adj': 8, 'add_rate': 0.5840429972834312, 'tem': 0.8898328133718874, 'consis_rate': 0.9374444130178885, 'use_att': 0}
mean: 0.7936000000000001
[0.801 0.778 0.802 0.799 0.797 0.785 0.79  0.796 0.799 0.789]
cur_param: {'lr': 0.03709264506244998, 'weight_decay': 0.0039375494709561676, 'dropout': 0.07149985079726985, 'patience': 80, 'lr_reduce_freq': 70, 'spt_alg': 'kruskal', 'spt_attr': 'similarity', 'manifold': 'PoincareBall', 'num_layers': 4, 'num_adj': 4, 'add_rate': 0.5267815350254206, 'tem': 1.0345160268698406, 'consis_rate': 1.8696644379537037, 'use_att': 0}
mean: 0.6724
[0.54  0.725 0.761 0.735 0.497 0.741 0.679 0.741 0.592 0.713]
cur_param: {'lr': 0.00431671494432741, 'weight_decay': 0.0010247083543868222, 'dropout': 0.197371879943108, 'patience': 60, 'lr_reduce_freq': 70, 'spt_alg': 'prim', 'spt_attr': 'similarity', 'manifold': 'PoincareBall', 'num_layers': 3, 'num_adj': 6, 'add_rate': 0.8105077515459674, 'tem': 0.4526914920011842, 'consis_rate': 1.2224455198585844, 'use_att': 0}
mean: 0.7917000000000001
[0.79  0.79  0.794 0.792 0.785 0.795 0.808 0.784 0.805 0.774]
cur_param: {'lr': 0.01103336838456877, 'weight_decay': 0.004038323388037881, 'dropout': 0.4802912713067406, 'patience': 100, 'lr_reduce_freq': 130, 'spt_alg': 'kruskal', 'spt_attr': 'similarity', 'manifold': 'PoincareBall', 'num_layers': 4, 'num_adj': 4, 'add_rate': 0.3061300350573414, 'tem': 1.217430364597741, 'consis_rate': 1.8618504011480372, 'use_att': 1}
mean: 0.3642
[0.319 0.319 0.319 0.319 0.771 0.319 0.319 0.319 0.319 0.319]
cur_param: {'lr': 0.0029152129494967025, 'weight_decay': 0.0034134980615441266, 'dropout': 0.12943929408690982, 'patience': 100, 'lr_reduce_freq': 50, 'spt_alg': 'prim', 'spt_attr': 'similarity', 'manifold': 'PoincareBall', 'num_layers': 3, 'num_adj': 6, 'add_rate': 0.6426963017006586, 'tem': 0.9273180201180271, 'consis_rate': 1.8933323152266843, 'use_att': 0}
mean: 0.7857000000000001
[0.782 0.791 0.794 0.791 0.785 0.777 0.788 0.779 0.779 0.791]
cur_param: {'lr': 0.009374457301652588, 'weight_decay': 0.01755349331742479, 'dropout': 0.40977488061483863, 'patience': 60, 'lr_reduce_freq': 130, 'spt_alg': 'kruskal', 'spt_attr': 'edge_degree', 'manifold': 'PoincareBall', 'num_layers': 3, 'num_adj': 8, 'add_rate': 0.7595056055901849, 'tem': 1.2464624791064751, 'consis_rate': 0.95502894177027, 'use_att': 1}
mean: 0.321
[0.319 0.319 0.319 0.327 0.319 0.319 0.319 0.331 0.319 0.319]
cur_param: {'lr': 0.05412864443581738, 'weight_decay': 0.3600732609902421, 'dropout': 0.7088612690257935, 'patience': 60, 'lr_reduce_freq': 50, 'spt_alg': 'kruskal', 'spt_attr': 'similarity', 'manifold': 'PoincareBall', 'num_layers': 3, 'num_adj': 6, 'add_rate': 0.4361195460338856, 'tem': 1.338200799311, 'consis_rate': 1.422022635499311, 'use_att': 1}
mean: 0.3021
[0.319 0.319 0.319 0.319 0.32  0.319 0.319 0.319 0.149 0.319]
cur_param: {'lr': 0.0018192738791793688, 'weight_decay': 0.012148820979679243, 'dropout': 0.7357242850205808, 'patience': 60, 'lr_reduce_freq': 70, 'spt_alg': 'kruskal', 'spt_attr': 'similarity', 'manifold': 'PoincareBall', 'num_layers': 3, 'num_adj': 4, 'add_rate': 0.3243137603676938, 'tem': 1.2084817712649203, 'consis_rate': 0.730123351565025, 'use_att': 0}
mean: 0.2173
[0.149 0.166 0.179 0.145 0.329 0.109 0.292 0.314 0.319 0.171]
cur_param: {'lr': 0.006843331316068863, 'weight_decay': 0.0008437079614063993, 'dropout': 0.23391275311033324, 'patience': 80, 'lr_reduce_freq': 110, 'spt_alg': 'kruskal', 'spt_attr': 'edge_degree', 'manifold': 'PoincareBall', 'num_layers': 3, 'num_adj': 6, 'add_rate': 0.5902125826668398, 'tem': 1.4948258456267913, 'consis_rate': 1.2636287372618646, 'use_att': 1}
mean: 0.8069000000000001
[0.805 0.807 0.815 0.814 0.806 0.803 0.796 0.803 0.807 0.813]
cur_param: {'lr': 0.048537668877537805, 'weight_decay': 0.2851976294577805, 'dropout': 0.2806121612719248, 'patience': 60, 'lr_reduce_freq': 90, 'spt_alg': 'kruskal', 'spt_attr': 'edge_degree', 'manifold': 'PoincareBall', 'num_layers': 4, 'num_adj': 8, 'add_rate': 0.35624606019175487, 'tem': 1.0970652202923166, 'consis_rate': 0.33720936867424733, 'use_att': 0}
mean: 0.31850000000000006
[0.319 0.319 0.317 0.318 0.319 0.319 0.319 0.319 0.319 0.317]
cur_param: {'lr': 0.01712744310266692, 'weight_decay': 0.09079996770384556, 'dropout': 0.9216166122024407, 'patience': 80, 'lr_reduce_freq': 150, 'spt_alg': 'prim', 'spt_attr': 'edge_degree', 'manifold': 'PoincareBall', 'num_layers': 3, 'num_adj': 2, 'add_rate': 0.16680427764438777, 'tem': 1.9658165960411822, 'consis_rate': 1.4781601697601139, 'use_att': 1}
mean: 0.319
[0.319 0.319 0.319 0.319 0.319 0.319 0.319 0.319 0.319 0.319]
cur_param: {'lr': 0.005968119807511067, 'weight_decay': 0.0008397699450004914, 'dropout': 0.0012892485236774276, 'patience': 100, 'lr_reduce_freq': 110, 'spt_alg': 'kruskal', 'spt_attr': 'edge_degree', 'manifold': 'PoincareBall', 'num_layers': 3, 'num_adj': 8, 'add_rate': 0.6140867012444041, 'tem': 1.7015235773971729, 'consis_rate': 0.7383413725883501, 'use_att': 1}
mean: 0.8051
[0.805 0.799 0.812 0.806 0.803 0.813 0.816 0.798 0.796 0.803]
cur_param: {'lr': 0.001251770441014448, 'weight_decay': 0.000544872287500333, 'dropout': 0.003071054303024817, 'patience': 80, 'lr_reduce_freq': 110, 'spt_alg': 'kruskal', 'spt_attr': 'edge_degree', 'manifold': 'PoincareBall', 'num_layers': 3, 'num_adj': 8, 'add_rate': 0.8986211996012159, 'tem': 1.7602776501138866, 'consis_rate': 0.5366983130606062, 'use_att': 1}
mean: 0.8053000000000001
[0.805 0.807 0.804 0.79  0.795 0.816 0.815 0.799 0.816 0.806]
cur_param: {'lr': 0.00141482116576695, 'weight_decay': 0.0005188644144063135, 'dropout': 0.32736172815452846, 'patience': 80, 'lr_reduce_freq': 130, 'spt_alg': 'kruskal', 'spt_attr': 'edge_degree', 'manifold': 'PoincareBall', 'num_layers': 3, 'num_adj': 6, 'add_rate': 0.9204569305413007, 'tem': 1.6062404343341705, 'consis_rate': 0.2864379835058745, 'use_att': 1}
mean: 0.8009000000000001
[0.798 0.801 0.786 0.795 0.8   0.796 0.806 0.813 0.804 0.81 ]
cur_param: {'lr': 0.0011537239644796489, 'weight_decay': 0.0020506691761720637, 'dropout': 0.5067897238312853, 'patience': 80, 'lr_reduce_freq': 90, 'spt_alg': 'kruskal', 'spt_attr': 'edge_degree', 'manifold': 'PoincareBall', 'num_layers': 3, 'num_adj': 8, 'add_rate': 0.9164881672660574, 'tem': 1.5706509240587605, 'consis_rate': 0.5927676658688009, 'use_att': 1}
mean: 0.8066000000000001
[0.811 0.803 0.816 0.783 0.811 0.799 0.813 0.813 0.82  0.797]
cur_param: {'lr': 0.01881255466447637, 'weight_decay': 0.0019853665385438746, 'dropout': 0.5564966540974666, 'patience': 80, 'lr_reduce_freq': 90, 'spt_alg': 'prim', 'spt_attr': 'edge_degree', 'manifold': 'PoincareBall', 'num_layers': 4, 'num_adj': 6, 'add_rate': 0.7350655904545612, 'tem': 1.447782681013765, 'consis_rate': 1.2310902331930473, 'use_att': 1}
mean: 0.7889999999999999
[0.803 0.779 0.798 0.787 0.789 0.777 0.789 0.772 0.809 0.787]
cur_param: {'lr': 0.002543502470692174, 'weight_decay': 0.011872007100353712, 'dropout': 0.624448781999081, 'patience': 80, 'lr_reduce_freq': 90, 'spt_alg': 'kruskal', 'spt_attr': 'edge_degree', 'manifold': 'PoincareBall', 'num_layers': 3, 'num_adj': 2, 'add_rate': 0.7057316631911716, 'tem': 1.9274521536267857, 'consis_rate': 1.4958174063067482, 'use_att': 1}
mean: 0.3085
[0.319 0.372 0.275 0.239 0.399 0.319 0.319 0.343 0.181 0.319]
cur_param: {'lr': 0.09367021038534773, 'weight_decay': 0.0018412245222388646, 'dropout': 0.41748254486689507, 'patience': 80, 'lr_reduce_freq': 150, 'spt_alg': 'kruskal', 'spt_attr': 'edge_degree', 'manifold': 'PoincareBall', 'num_layers': 3, 'num_adj': 8, 'add_rate': 0.16061694673127114, 'tem': 0.6387402186660329, 'consis_rate': 0.5747827938973223, 'use_att': 1}
mean: 0.5234
[0.684 0.506 0.22  0.642 0.621 0.399 0.468 0.623 0.382 0.689]
cur_param: {'lr': 0.0010996613488290141, 'weight_decay': 0.028496521238004634, 'dropout': 0.3339238339702138, 'patience': 80, 'lr_reduce_freq': 110, 'spt_alg': 'prim', 'spt_attr': 'edge_degree', 'manifold': 'PoincareBall', 'num_layers': 4, 'num_adj': 6, 'add_rate': 0.8445362558170513, 'tem': 1.504135590482404, 'consis_rate': 1.006289601476284, 'use_att': 1}[32m[I 2022-06-22 00:57:41,182][0m Trial 18 finished with value: 0.1783 and parameters: {'lr': 0.0010996613488290141, 'weight_decay': 0.028496521238004634, 'dropout': 0.3339238339702138, 'patience': 80, 'lr_reduce_freq': 110, 'spt_alg': 'prim', 'spt_attr': 'edge_degree', 'manifold': 'PoincareBall', 'num_layers': 4, 'num_adj': 6, 'add_rate': 0.8445362558170513, 'tem': 1.504135590482404, 'consis_rate': 1.006289601476284, 'use_att': 1}. Best is trial 8 with value: 0.8069000000000001.[0m
[32m[I 2022-06-22 01:17:34,012][0m Trial 19 finished with value: 0.33380000000000004 and parameters: {'lr': 0.003395015530861378, 'weight_decay': 0.006597510976425351, 'dropout': 0.8907946349880729, 'patience': 100, 'lr_reduce_freq': 90, 'spt_alg': 'kruskal', 'spt_attr': 'edge_degree', 'manifold': 'PoincareBall', 'num_layers': 3, 'num_adj': 4, 'add_rate': 0.49045526766725, 'tem': 1.8000202983246292, 'consis_rate': 1.2282325097546796, 'use_att': 1}. Best is trial 8 with value: 0.8069000000000001.[0m
[32m[I 2022-06-22 01:40:12,462][0m Trial 20 finished with value: 0.8097 and parameters: {'lr': 0.02357680434646212, 'weight_decay': 0.0016640407655683915, 'dropout': 0.5385006443030298, 'patience': 80, 'lr_reduce_freq': 70, 'spt_alg': 'kruskal', 'spt_attr': 'edge_degree', 'manifold': 'PoincareBall', 'num_layers': 3, 'num_adj': 8, 'add_rate': 0.42924057642694, 'tem': 1.4945790329665414, 'consis_rate': 0.7875974040686526, 'use_att': 1}. Best is trial 20 with value: 0.8097.[0m
[32m[I 2022-06-22 02:03:50,262][0m Trial 21 finished with value: 0.8085000000000001 and parameters: {'lr': 0.0259422679084481, 'weight_decay': 0.0014821559467350558, 'dropout': 0.5460621612566342, 'patience': 80, 'lr_reduce_freq': 70, 'spt_alg': 'kruskal', 'spt_attr': 'edge_degree', 'manifold': 'PoincareBall', 'num_layers': 3, 'num_adj': 8, 'add_rate': 0.41107722588190565, 'tem': 1.4741181166595088, 'consis_rate': 0.78985034678308, 'use_att': 1}. Best is trial 20 with value: 0.8097.[0m
[32m[I 2022-06-22 02:26:58,807][0m Trial 22 finished with value: 0.8063 and parameters: {'lr': 0.02267065371318519, 'weight_decay': 0.0011844442446528492, 'dropout': 0.6148099740949476, 'patience': 80, 'lr_reduce_freq': 70, 'spt_alg': 'kruskal', 'spt_attr': 'edge_degree', 'manifold': 'PoincareBall', 'num_layers': 3, 'num_adj': 8, 'add_rate': 0.42430104600237495, 'tem': 1.4133170009999325, 'consis_rate': 0.7469997026591008, 'use_att': 1}. Best is trial 20 with value: 0.8097.[0m
[32m[I 2022-06-22 02:44:23,992][0m Trial 23 finished with value: 0.7962999999999999 and parameters: {'lr': 0.028976457725820054, 'weight_decay': 0.0015351570232397362, 'dropout': 0.7799400633064785, 'patience': 80, 'lr_reduce_freq': 50, 'spt_alg': 'kruskal', 'spt_attr': 'edge_degree', 'manifold': 'PoincareBall', 'num_layers': 3, 'num_adj': 6, 'add_rate': 0.23752192679809656, 'tem': 1.5871558555641152, 'consis_rate': 1.6426692611749945, 'use_att': 1}. Best is trial 20 with value: 0.8097.[0m
[32m[I 2022-06-22 03:07:24,118][0m Trial 24 finished with value: 0.3196 and parameters: {'lr': 0.013066798119677508, 'weight_decay': 0.006850778934784914, 'dropout': 0.597076758695648, 'patience': 80, 'lr_reduce_freq': 70, 'spt_alg': 'kruskal', 'spt_attr': 'edge_degree', 'manifold': 'PoincareBall', 'num_layers': 3, 'num_adj': 8, 'add_rate': 0.521431421525276, 'tem': 1.357375014146862, 'consis_rate': 0.8760841550131624, 'use_att': 1}. Best is trial 20 with value: 0.8097.[0m
[32m[I 2022-06-22 03:26:51,869][0m Trial 25 finished with value: 0.3083 and parameters: {'lr': 0.007086479478876618, 'weight_decay': 0.0490898606560143, 'dropout': 0.39844348271470875, 'patience': 80, 'lr_reduce_freq': 50, 'spt_alg': 'kruskal', 'spt_attr': 'edge_degree', 'manifold': 'PoincareBall', 'num_layers': 3, 'num_adj': 6, 'add_rate': 0.41135984635294864, 'tem': 0.2675412049069552, 'consis_rate': 1.0814999788650643, 'use_att': 1}. Best is trial 20 with value: 0.8097.[0m
[32m[I 2022-06-22 03:40:43,898][0m Trial 26 finished with value: 0.2958 and parameters: {'lr': 0.09347076042719409, 'weight_decay': 0.00644705530138487, 'dropout': 0.6746302666745827, 'patience': 60, 'lr_reduce_freq': 70, 'spt_alg': 'kruskal', 'spt_attr': 'edge_degree', 'manifold': 'PoincareBall', 'num_layers': 3, 'num_adj': 8, 'add_rate': 0.24802429036328477, 'tem': 1.6827870190061271, 'consis_rate': 0.8218543698582373, 'use_att': 1}. Best is trial 20 with value: 0.8097.[0m
