[32m[I 2022-06-22 01:47:52,113][0m Trial 27 finished with value: 0.30199999999999994 and parameters: {'lr': 0.06683942445785686, 'weight_decay': 0.012924236200275128, 'dropout': 0.5812052141070216, 'patience': 60, 'lr_reduce_freq': 90, 'spt_alg': 'prim', 'spt_attr': 'edge_degree', 'manifold': 'PoincareBall', 'num_layers': 3, 'num_adj': 8, 'add_rate': 0.5329799621381464, 'tem': 1.8511225835585994, 'consis_rate': 1.0245748071114695, 'use_att': 1}. Best is trial 18 with value: 0.8044.[0m
[32m[I 2022-06-22 02:08:31,274][0m Trial 28 finished with value: 0.319 and parameters: {'lr': 0.019649525223432687, 'weight_decay': 0.049420979563753166, 'dropout': 0.7343105708685667, 'patience': 80, 'lr_reduce_freq': 110, 'spt_alg': 'prim', 'spt_attr': 'edge_degree', 'manifold': 'PoincareBall', 'num_layers': 3, 'num_adj': 6, 'add_rate': 0.28816480086002616, 'tem': 1.676393531727887, 'consis_rate': 1.3764222288428332, 'use_att': 1}. Best is trial 18 with value: 0.8044.[0m
[32m[I 2022-06-22 02:31:31,003][0m Trial 29 finished with value: 0.4042 and parameters: {'lr': 0.008267361968980607, 'weight_decay': 0.0008859960133545552, 'dropout': 0.911661704313523, 'patience': 60, 'lr_reduce_freq': 130, 'spt_alg': 'kruskal', 'spt_attr': 'edge_degree', 'manifold': 'PoincareBall', 'num_layers': 3, 'num_adj': 6, 'add_rate': 0.22547606132995152, 'tem': 1.9898163945840945, 'consis_rate': 1.3070905883828405, 'use_att': 1}. Best is trial 18 with value: 0.8044.[0m
[32m[I 2022-06-22 02:51:21,504][0m Trial 30 finished with value: 0.7872000000000001 and parameters: {'lr': 0.024291142856811866, 'weight_decay': 0.0019413580445275629, 'dropout': 0.5035040938755839, 'patience': 80, 'lr_reduce_freq': 90, 'spt_alg': 'prim', 'spt_attr': 'edge_degree', 'manifold': 'PoincareBall', 'num_layers': 3, 'num_adj': 4, 'add_rate': 0.7557262497078656, 'tem': 1.0272205318127754, 'consis_rate': 0.7946356745214531, 'use_att': 1}. Best is trial 18 with value: 0.8044.[0m
[32m[I 2022-06-22 03:13:43,901][0m Trial 31 finished with value: 0.8006 and parameters: {'lr': 0.005318854287699789, 'weight_decay': 0.0008044543228069636, 'dropout': 0.3604558579604528, 'patience': 60, 'lr_reduce_freq': 90, 'spt_alg': 'prim', 'spt_attr': 'edge_degree', 'manifold': 'PoincareBall', 'num_layers': 3, 'num_adj': 6, 'add_rate': 0.3657504784298643, 'tem': 1.9721527655214017, 'consis_rate': 1.1531149900160917, 'use_att': 1}. Best is trial 18 with value: 0.8044.[0m
[32m[I 2022-06-22 03:37:08,888][0m Trial 32 finished with value: 0.8019000000000002 and parameters: {'lr': 0.005141893064152414, 'weight_decay': 0.0007879113360120821, 'dropout': 0.43744892919259437, 'patience': 60, 'lr_reduce_freq': 90, 'spt_alg': 'prim', 'spt_attr': 'edge_degree', 'manifold': 'PoincareBall', 'num_layers': 3, 'num_adj': 6, 'add_rate': 0.31642981173805856, 'tem': 1.805569624393014, 'consis_rate': 0.9935973318305872, 'use_att': 1}. Best is trial 18 with value: 0.8044.[0m
[32m[I 2022-06-22 04:05:48,812][0m Trial 33 finished with value: 0.7964 and parameters: {'lr': 0.0025958177026415606, 'weight_decay': 0.0012466718278603798, 'dropout': 0.37239213305173147, 'patience': 60, 'lr_reduce_freq': 110, 'spt_alg': 'prim', 'spt_attr': 'edge_degree', 'manifold': 'PoincareBall', 'num_layers': 3, 'num_adj': 6, 'add_rate': 0.3080978587772021, 'tem': 1.7570386742970188, 'consis_rate': 0.9899451148890753, 'use_att': 1}. Best is trial 18 with value: 0.8044.[0m
[32m[I 2022-06-22 04:43:57,717][0m Trial 34 finished with value: 0.7794000000000001 and parameters: {'lr': 0.011482851775276004, 'weight_decay': 0.0006997007321072888, 'dropout': 0.46091013977296835, 'patience': 60, 'lr_reduce_freq': 70, 'spt_alg': 'prim', 'spt_attr': 'edge_degree', 'manifold': 'PoincareBall', 'num_layers': 4, 'num_adj': 8, 'add_rate': 0.2137240635742757, 'tem': 1.63069469181419, 'consis_rate': 0.9493919888981153, 'use_att': 1}. Best is trial 18 with value: 0.8044.[0m
[32m[I 2022-06-22 05:05:06,340][0m Trial 35 finished with value: 0.7988 and parameters: {'lr': 0.005942486233396079, 'weight_decay': 0.002186998665624183, 'dropout': 0.14925261174582427, 'patience': 60, 'lr_reduce_freq': 90, 'spt_alg': 'kruskal', 'spt_attr': 'similarity', 'manifold': 'PoincareBall', 'num_layers': 3, 'num_adj': 4, 'add_rate': 0.32591651481520084, 'tem': 1.8189061440262164, 'consis_rate': 0.4614885147227078, 'use_att': 1}. Best is trial 18 with value: 0.8044.[0m
[32m[I 2022-06-22 06:16:27,437][0m Trial 36 finished with value: 0.6761000000000001 and parameters: {'lr': 0.003453062961087318, 'weight_decay': 0.004257111244994466, 'dropout': 0.3777046705460951, 'patience': 60, 'lr_reduce_freq': 110, 'spt_alg': 'prim', 'spt_attr': 'edge_degree', 'manifold': 'PoincareBall', 'num_layers': 4, 'num_adj': 6, 'add_rate': 0.4972310463872129, 'tem': 1.2661366905169251, 'consis_rate': 0.6832181730766318, 'use_att': 1}. Best is trial 18 with value: 0.8044.[0m

mean: 0.8044
[0.803 0.8   0.793 0.811 0.809 0.816 0.804 0.795 0.8   0.813]
cur_param: {'lr': 0.013204781677994859, 'weight_decay': 0.003091094542215423, 'dropout': 0.4198543939247135, 'patience': 80, 'lr_reduce_freq': 110, 'spt_alg': 'prim', 'spt_attr': 'edge_degree', 'manifold': 'PoincareBall', 'num_layers': 3, 'num_adj': 4, 'add_rate': 0.3405352161619245, 'tem': 1.8259490023644185, 'consis_rate': 1.096644080176137, 'use_att': 1}
mean: 0.7828
[0.768 0.762 0.797 0.765 0.793 0.804 0.786 0.781 0.792 0.78 ]
cur_param: {'lr': 0.009099138265182992, 'weight_decay': 0.0011509712118118972, 'dropout': 0.788710414539401, 'patience': 100, 'lr_reduce_freq': 150, 'spt_alg': 'prim', 'spt_attr': 'edge_degree', 'manifold': 'PoincareBall', 'num_layers': 3, 'num_adj': 8, 'add_rate': 0.4891038852561241, 'tem': 1.7439361112769398, 'consis_rate': 1.485794718941968, 'use_att': 1}
mean: 0.7525000000000001
[0.735 0.739 0.772 0.762 0.768 0.725 0.714 0.727 0.809 0.774]
cur_param: {'lr': 0.00508784277799281, 'weight_decay': 0.0009069477688882628, 'dropout': 0.3179737700151928, 'patience': 60, 'lr_reduce_freq': 90, 'spt_alg': 'prim', 'spt_attr': 'edge_degree', 'manifold': 'PoincareBall', 'num_layers': 3, 'num_adj': 6, 'add_rate': 0.3853787610491254, 'tem': 1.997839402411448, 'consis_rate': 1.1459001673667863, 'use_att': 1}
mean: 0.7976000000000001
[0.796 0.788 0.792 0.803 0.783 0.801 0.811 0.797 0.804 0.801]
cur_param: {'lr': 0.005056890907855307, 'weight_decay': 0.000885707793125855, 'dropout': 0.5319980646932596, 'patience': 60, 'lr_reduce_freq': 90, 'spt_alg': 'prim', 'spt_attr': 'edge_degree', 'manifold': 'PoincareBall', 'num_layers': 3, 'num_adj': 6, 'add_rate': 0.3840298405890444, 'tem': 1.9498979866831119, 'consis_rate': 1.1824480977571579, 'use_att': 1}
mean: 0.7997
[0.791 0.786 0.804 0.824 0.802 0.798 0.818 0.789 0.794 0.791]
cur_param: {'lr': 0.003924838308049071, 'weight_decay': 0.0028005271305415243, 'dropout': 0.5603284041427898, 'patience': 60, 'lr_reduce_freq': 110, 'spt_alg': 'prim', 'spt_attr': 'edge_degree', 'manifold': 'PoincareBall', 'num_layers': 3, 'num_adj': 6, 'add_rate': 0.35885810864374873, 'tem': 1.6871273800395723, 'consis_rate': 1.102385912815491, 'use_att': 1}
mean: 0.7945
[0.785 0.781 0.804 0.798 0.79  0.776 0.827 0.783 0.81  0.791]
cur_param: {'lr': 0.002159264564479674, 'weight_decay': 0.0009588307015630774, 'dropout': 0.49095573541714943, 'patience': 60, 'lr_reduce_freq': 90, 'spt_alg': 'prim', 'spt_attr': 'edge_degree', 'manifold': 'PoincareBall', 'num_layers': 3, 'num_adj': 6, 'add_rate': 0.273873168313692, 'tem': 1.8884027831520118, 'consis_rate': 0.7522927930922441, 'use_att': 1}
mean: 0.7942
[0.789 0.792 0.802 0.818 0.775 0.783 0.803 0.797 0.787 0.796]
cur_param: {'lr': 0.014511362135200243, 'weight_decay': 0.0157028830139297, 'dropout': 0.6456696158307439, 'patience': 60, 'lr_reduce_freq': 110, 'spt_alg': 'prim', 'spt_attr': 'edge_degree', 'manifold': 'PoincareBall', 'num_layers': 3, 'num_adj': 4, 'add_rate': 0.4936794761457731, 'tem': 1.647405360549277, 'consis_rate': 1.4416598093795927, 'use_att': 1}
mean: 0.28579999999999994
[0.318 0.149 0.328 0.319 0.319 0.319 0.319 0.319 0.149 0.319]
cur_param: {'lr': 0.001504576141721544, 'weight_decay': 0.004106793796002261, 'dropout': 0.38286387422107254, 'patience': 80, 'lr_reduce_freq': 130, 'spt_alg': 'prim', 'spt_attr': 'edge_degree', 'manifold': 'PoincareBall', 'num_layers': 3, 'num_adj': 6, 'add_rate': 0.3972915590911233, 'tem': 1.375446900658186, 'consis_rate': 1.2093406888759421, 'use_att': 1}
mean: 0.7926
[0.778 0.792 0.798 0.794 0.794 0.8   0.796 0.777 0.811 0.786]
cur_param: {'lr': 0.06683942445785686, 'weight_decay': 0.012924236200275128, 'dropout': 0.5812052141070216, 'patience': 60, 'lr_reduce_freq': 90, 'spt_alg': 'prim', 'spt_attr': 'edge_degree', 'manifold': 'PoincareBall', 'num_layers': 3, 'num_adj': 8, 'add_rate': 0.5329799621381464, 'tem': 1.8511225835585994, 'consis_rate': 1.0245748071114695, 'use_att': 1}
mean: 0.30199999999999994
[0.319 0.319 0.319 0.319 0.149 0.319 0.319 0.319 0.319 0.319]
cur_param: {'lr': 0.019649525223432687, 'weight_decay': 0.049420979563753166, 'dropout': 0.7343105708685667, 'patience': 80, 'lr_reduce_freq': 110, 'spt_alg': 'prim', 'spt_attr': 'edge_degree', 'manifold': 'PoincareBall', 'num_layers': 3, 'num_adj': 6, 'add_rate': 0.28816480086002616, 'tem': 1.676393531727887, 'consis_rate': 1.3764222288428332, 'use_att': 1}
mean: 0.319
[0.319 0.319 0.319 0.319 0.319 0.319 0.319 0.319 0.319 0.319]
cur_param: {'lr': 0.008267361968980607, 'weight_decay': 0.0008859960133545552, 'dropout': 0.911661704313523, 'patience': 60, 'lr_reduce_freq': 130, 'spt_alg': 'kruskal', 'spt_attr': 'edge_degree', 'manifold': 'PoincareBall', 'num_layers': 3, 'num_adj': 6, 'add_rate': 0.22547606132995152, 'tem': 1.9898163945840945, 'consis_rate': 1.3070905883828405, 'use_att': 1}
mean: 0.4042
[0.461 0.318 0.367 0.588 0.426 0.381 0.413 0.349 0.397 0.342]
cur_param: {'lr': 0.024291142856811866, 'weight_decay': 0.0019413580445275629, 'dropout': 0.5035040938755839, 'patience': 80, 'lr_reduce_freq': 90, 'spt_alg': 'prim', 'spt_attr': 'edge_degree', 'manifold': 'PoincareBall', 'num_layers': 3, 'num_adj': 4, 'add_rate': 0.7557262497078656, 'tem': 1.0272205318127754, 'consis_rate': 0.7946356745214531, 'use_att': 1}
mean: 0.7872000000000001
[0.767 0.777 0.806 0.781 0.789 0.796 0.78  0.801 0.783 0.792]
cur_param: {'lr': 0.005318854287699789, 'weight_decay': 0.0008044543228069636, 'dropout': 0.3604558579604528, 'patience': 60, 'lr_reduce_freq': 90, 'spt_alg': 'prim', 'spt_attr': 'edge_degree', 'manifold': 'PoincareBall', 'num_layers': 3, 'num_adj': 6, 'add_rate': 0.3657504784298643, 'tem': 1.9721527655214017, 'consis_rate': 1.1531149900160917, 'use_att': 1}
mean: 0.8006
[0.788 0.801 0.795 0.825 0.799 0.808 0.805 0.794 0.801 0.79 ]
cur_param: {'lr': 0.005141893064152414, 'weight_decay': 0.0007879113360120821, 'dropout': 0.43744892919259437, 'patience': 60, 'lr_reduce_freq': 90, 'spt_alg': 'prim', 'spt_attr': 'edge_degree', 'manifold': 'PoincareBall', 'num_layers': 3, 'num_adj': 6, 'add_rate': 0.31642981173805856, 'tem': 1.805569624393014, 'consis_rate': 0.9935973318305872, 'use_att': 1}
mean: 0.8019000000000002
[0.801 0.798 0.801 0.81  0.787 0.812 0.813 0.796 0.795 0.806]
cur_param: {'lr': 0.0025958177026415606, 'weight_decay': 0.0012466718278603798, 'dropout': 0.37239213305173147, 'patience': 60, 'lr_reduce_freq': 110, 'spt_alg': 'prim', 'spt_attr': 'edge_degree', 'manifold': 'PoincareBall', 'num_layers': 3, 'num_adj': 6, 'add_rate': 0.3080978587772021, 'tem': 1.7570386742970188, 'consis_rate': 0.9899451148890753, 'use_att': 1}
mean: 0.7964
[0.791 0.794 0.805 0.815 0.769 0.8   0.794 0.808 0.801 0.787]
cur_param: {'lr': 0.011482851775276004, 'weight_decay': 0.0006997007321072888, 'dropout': 0.46091013977296835, 'patience': 60, 'lr_reduce_freq': 70, 'spt_alg': 'prim', 'spt_attr': 'edge_degree', 'manifold': 'PoincareBall', 'num_layers': 4, 'num_adj': 8, 'add_rate': 0.2137240635742757, 'tem': 1.63069469181419, 'consis_rate': 0.9493919888981153, 'use_att': 1}
mean: 0.7794000000000001
[0.786 0.796 0.77  0.782 0.781 0.781 0.768 0.774 0.783 0.773]
cur_param: {'lr': 0.005942486233396079, 'weight_decay': 0.002186998665624183, 'dropout': 0.14925261174582427, 'patience': 60, 'lr_reduce_freq': 90, 'spt_alg': 'kruskal', 'spt_attr': 'similarity', 'manifold': 'PoincareBall', 'num_layers': 3, 'num_adj': 4, 'add_rate': 0.32591651481520084, 'tem': 1.8189061440262164, 'consis_rate': 0.4614885147227078, 'use_att': 1}
mean: 0.7988
[0.788 0.797 0.805 0.799 0.805 0.801 0.778 0.796 0.816 0.803]
cur_param: {'lr': 0.003453062961087318, 'weight_decay': 0.004257111244994466, 'dropout': 0.3777046705460951, 'patience': 60, 'lr_reduce_freq': 110, 'spt_alg': 'prim', 'spt_attr': 'edge_degree', 'manifold': 'PoincareBall', 'num_layers': 4, 'num_adj': 6, 'add_rate': 0.4972310463872129, 'tem': 1.2661366905169251, 'consis_rate': 0.6832181730766318, 'use_att': 1}
mean: 0.6761000000000001
[0.743 0.739 0.745 0.726 0.748 0.768 0.455 0.395 0.746 0.696]
cur_param: {'lr': 0.005518651031659729, 'weight_decay': 0.0011567590649834416, 'dropout': 0.6121905043518923, 'patience': 100, 'lr_reduce_freq': 130, 'spt_alg': 'prim', 'spt_attr': 'similarity', 'manifold': 'PoincareBall', 'num_layers': 3, 'num_adj': 8, 'add_rate': 0.42151815668305126, 'tem': 1.8845347332005051, 'consis_rate': 0.8822407564019635, 'use_att': 1}[32m[I 2022-06-22 07:08:42,546][0m Trial 37 finished with value: 0.8079000000000001 and parameters: {'lr': 0.005518651031659729, 'weight_decay': 0.0011567590649834416, 'dropout': 0.6121905043518923, 'patience': 100, 'lr_reduce_freq': 130, 'spt_alg': 'prim', 'spt_attr': 'similarity', 'manifold': 'PoincareBall', 'num_layers': 3, 'num_adj': 8, 'add_rate': 0.42151815668305126, 'tem': 1.8845347332005051, 'consis_rate': 0.8822407564019635, 'use_att': 1}. Best is trial 37 with value: 0.8079000000000001.[0m
[32m[I 2022-06-22 07:55:48,401][0m Trial 38 finished with value: 0.3255 and parameters: {'lr': 0.017063900842643698, 'weight_decay': 0.010284812462739778, 'dropout': 0.6962170649009215, 'patience': 100, 'lr_reduce_freq': 150, 'spt_alg': 'kruskal', 'spt_attr': 'similarity', 'manifold': 'PoincareBall', 'num_layers': 4, 'num_adj': 8, 'add_rate': 0.43349622344521566, 'tem': 1.7654294890931375, 'consis_rate': 0.4551127507240318, 'use_att': 1}. Best is trial 37 with value: 0.8079000000000001.[0m
[32m[I 2022-06-22 08:16:31,384][0m Trial 39 finished with value: 0.6088 and parameters: {'lr': 0.0016099479077544886, 'weight_decay': 0.0013033337198172545, 'dropout': 0.8386463806190807, 'patience': 100, 'lr_reduce_freq': 130, 'spt_alg': 'prim', 'spt_attr': 'similarity', 'manifold': 'PoincareBall', 'num_layers': 3, 'num_adj': 8, 'add_rate': 0.5326172459506274, 'tem': 1.4576897335412666, 'consis_rate': 0.8724605920976394, 'use_att': 0}. Best is trial 37 with value: 0.8079000000000001.[0m
[32m[I 2022-06-22 08:49:07,473][0m Trial 40 finished with value: 0.6987 and parameters: {'lr': 0.003109125006261958, 'weight_decay': 0.004379076479986676, 'dropout': 0.6190724695228828, 'patience': 100, 'lr_reduce_freq': 130, 'spt_alg': 'kruskal', 'spt_attr': 'similarity', 'manifold': 'PoincareBall', 'num_layers': 3, 'num_adj': 2, 'add_rate': 0.26539600092421634, 'tem': 1.8648829446837976, 'consis_rate': 1.027959060583571, 'use_att': 1}. Best is trial 37 with value: 0.8079000000000001.[0m
[32m[I 2022-06-22 09:24:59,094][0m Trial 41 finished with value: 0.8024000000000001 and parameters: {'lr': 0.005657967013160391, 'weight_decay': 0.0006901148176590642, 'dropout': 0.45101610769257006, 'patience': 80, 'lr_reduce_freq': 130, 'spt_alg': 'prim', 'spt_attr': 'similarity', 'manifold': 'PoincareBall', 'num_layers': 3, 'num_adj': 8, 'add_rate': 0.41456670693398845, 'tem': 1.901032035776758, 'consis_rate': 1.2675880573790959, 'use_att': 1}. Best is trial 37 with value: 0.8079000000000001.[0m
[32m[I 2022-06-22 09:57:47,649][0m Trial 42 finished with value: 0.7987 and parameters: {'lr': 0.007407299679406638, 'weight_decay': 0.0005429623762692022, 'dropout': 0.4446234479282525, 'patience': 80, 'lr_reduce_freq': 130, 'spt_alg': 'prim', 'spt_attr': 'similarity', 'manifold': 'PoincareBall', 'num_layers': 3, 'num_adj': 8, 'add_rate': 0.4650902059961698, 'tem': 1.7165864846647738, 'consis_rate': 1.3348055562316323, 'use_att': 1}. Best is trial 37 with value: 0.8079000000000001.[0m
[32m[I 2022-06-22 10:44:43,883][0m Trial 43 finished with value: 0.7960999999999999 and parameters: {'lr': 0.004064328200624314, 'weight_decay': 0.0012709691325159755, 'dropout': 0.6881212773946053, 'patience': 80, 'lr_reduce_freq': 150, 'spt_alg': 'prim', 'spt_attr': 'similarity', 'manifold': 'PoincareBall', 'num_layers': 3, 'num_adj': 8, 'add_rate': 0.4109314230314813, 'tem': 1.8953552740308959, 'consis_rate': 1.2654704199015625, 'use_att': 1}. Best is trial 37 with value: 0.8079000000000001.[0m
[32m[I 2022-06-22 11:20:28,053][0m Trial 44 finished with value: 0.8023 and parameters: {'lr': 0.011043953285756239, 'weight_decay': 0.0006921252281008765, 'dropout': 0.6133701335136921, 'patience': 80, 'lr_reduce_freq': 130, 'spt_alg': 'prim', 'spt_attr': 'similarity', 'manifold': 'PoincareBall', 'num_layers': 3, 'num_adj': 8, 'add_rate': 0.621688257240263, 'tem': 1.6002490005720817, 'consis_rate': 0.9030942268426434, 'use_att': 1}. Best is trial 37 with value: 0.8079000000000001.[0m
[32m[I 2022-06-22 12:30:30,073][0m Trial 45 finished with value: 0.7522 and parameters: {'lr': 0.011181403381931196, 'weight_decay': 0.0006863954648901753, 'dropout': 0.6088875417903352, 'patience': 80, 'lr_reduce_freq': 130, 'spt_alg': 'prim', 'spt_attr': 'similarity', 'manifold': 'PoincareBall', 'num_layers': 4, 'num_adj': 8, 'add_rate': 0.6374588666012643, 'tem': 1.5681411573718496, 'consis_rate': 0.8975369711448403, 'use_att': 1}. Best is trial 37 with value: 0.8079000000000001.[0m
[32m[I 2022-06-22 13:10:49,374][0m Trial 46 finished with value: 0.7954000000000001 and parameters: {'lr': 0.006432451354875481, 'weight_decay': 0.0005027643544697074, 'dropout': 0.4871430462782342, 'patience': 80, 'lr_reduce_freq': 130, 'spt_alg': 'prim', 'spt_attr': 'similarity', 'manifold': 'PoincareBall', 'num_layers': 3, 'num_adj': 8, 'add_rate': 0.7703275194242227, 'tem': 0.23061440807009348, 'consis_rate': 0.741967908737644, 'use_att': 1}. Best is trial 37 with value: 0.8079000000000001.[0m
[32m[I 2022-06-22 13:36:13,163][0m Trial 47 finished with value: 0.30229999999999996 and parameters: {'lr': 0.02857832783761583, 'weight_decay': 0.0861311689691492, 'dropout': 0.2697179959873729, 'patience': 80, 'lr_reduce_freq': 150, 'spt_alg': 'prim', 'spt_attr': 'similarity', 'manifold': 'PoincareBall', 'num_layers': 3, 'num_adj': 8, 'add_rate': 0.6090103036861043, 'tem': 1.899501245538792, 'consis_rate': 1.0611396695283157, 'use_att': 1}. Best is trial 37 with value: 0.8079000000000001.[0m
[32m[I 2022-06-22 14:23:20,279][0m Trial 48 finished with value: 0.7868999999999999 and parameters: {'lr': 0.009114167678055079, 'weight_decay': 0.001116643040042111, 'dropout': 0.7426276544191315, 'patience': 100, 'lr_reduce_freq': 150, 'spt_alg': 'prim', 'spt_attr': 'similarity', 'manifold': 'PoincareBall', 'num_layers': 3, 'num_adj': 8, 'add_rate': 0.5513101230540868, 'tem': 1.791732699557569, 'consis_rate': 0.5752225849239292, 'use_att': 1}. Best is trial 37 with value: 0.8079000000000001.[0m
[32m[I 2022-06-22 14:57:28,857][0m Trial 49 finished with value: 0.8012 and parameters: {'lr': 0.007958586992369438, 'weight_decay': 0.0006803740547705517, 'dropout': 0.6594690855179323, 'patience': 80, 'lr_reduce_freq': 130, 'spt_alg': 'prim', 'spt_attr': 'similarity', 'manifold': 'PoincareBall', 'num_layers': 3, 'num_adj': 8, 'add_rate': 0.18383674052076995, 'tem': 0.3656525663304746, 'consis_rate': 0.907823889627613, 'use_att': 1}. Best is trial 37 with value: 0.8079000000000001.[0m
[32m[I 2022-06-22 16:19:31,888][0m Trial 50 finished with value: 0.7481 and parameters: {'lr': 0.011366996056184093, 'weight_decay': 0.0021134148287039346, 'dropout': 0.5447335990580906, 'patience': 100, 'lr_reduce_freq': 110, 'spt_alg': 'kruskal', 'spt_attr': 'similarity', 'manifold': 'PoincareBall', 'num_layers': 4, 'num_adj': 8, 'add_rate': 0.25963694581752805, 'tem': 1.4855519025252921, 'consis_rate': 0.966734670631479, 'use_att': 1}. Best is trial 37 with value: 0.8079000000000001.[0m
[32m[I 2022-06-22 16:58:29,895][0m Trial 51 finished with value: 0.7954 and parameters: {'lr': 0.006935223488940968, 'weight_decay': 0.0014214307531727295, 'dropout': 0.6757121823355761, 'patience': 80, 'lr_reduce_freq': 130, 'spt_alg': 'prim', 'spt_attr': 'similarity', 'manifold': 'PoincareBall', 'num_layers': 3, 'num_adj': 8, 'add_rate': 0.1885056243313567, 'tem': 0.8101543842648276, 'consis_rate': 0.8339034482451579, 'use_att': 1}. Best is trial 37 with value: 0.8079000000000001.[0m
[32m[I 2022-06-22 17:30:09,219][0m Trial 52 finished with value: 0.8019999999999999 and parameters: {'lr': 0.008031047143567635, 'weight_decay': 0.0006753263214101576, 'dropout': 0.5938761153890407, 'patience': 80, 'lr_reduce_freq': 130, 'spt_alg': 'prim', 'spt_attr': 'similarity', 'manifold': 'PoincareBall', 'num_layers': 3, 'num_adj': 8, 'add_rate': 0.10433636512660467, 'tem': 0.9695892291475794, 'consis_rate': 0.9085114961525357, 'use_att': 1}. Best is trial 37 with value: 0.8079000000000001.[0m
[32m[I 2022-06-22 17:58:54,606][0m Trial 53 finished with value: 0.30199999999999994 and parameters: {'lr': 0.0059181487301081, 'weight_decay': 0.38385700069199985, 'dropout': 0.42148374997019544, 'patience': 80, 'lr_reduce_freq': 130, 'spt_alg': 'prim', 'spt_attr': 'similarity', 'manifold': 'PoincareBall', 'num_layers': 3, 'num_adj': 8, 'add_rate': 0.14087869188909166, 'tem': 1.0246662004095113, 'consis_rate': 0.5919241463025846, 'use_att': 1}. Best is trial 37 with value: 0.8079000000000001.[0m
