[32m[I 2022-06-30 08:03:39,520][0m Trial 91 finished with value: 0.5377 and parameters: {'lr': 0.013690355601716452, 'weight_decay': 0.008108235938071518, 'dropout': 0.7616010562946776, 'patience': 90, 'lr_reduce_freq': 40, 'spt_alg': 'prim', 'spt_attr': 'similarity', 'manifold': 'PoincareBall', 'num_layers': 3, 'dim': 464, 'num_adj': 2, 'add_rate': 0.8270128510439181, 'tem': 1.1314106988581523, 'consis_rate': 1.1094846151258067, 'use_att': 1}. Best is trial 84 with value: 0.8213999999999999.[0m

cur_param: {'lr': 0.008015902076258099, 'weight_decay': 0.0035149145810875124, 'dropout': 0.7689227140300381, 'patience': 90, 'lr_reduce_freq': 40, 'spt_alg': 'prim', 'spt_attr': 'similarity', 'manifold': 'PoincareBall', 'num_layers': 3, 'dim': 400, 'num_adj': 4, 'add_rate': 0.5580558673820377, 'tem': 1.2037961686491374, 'consis_rate': 1.1310671124811857, 'use_att': 1}
mean: 0.8043000000000001
[0.808 0.804 0.806 0.801 0.824 0.784 0.802 0.802 0.822 0.79 ]
cur_param: {'lr': 0.03852682741594721, 'weight_decay': 0.0015439322860374201, 'dropout': 0.7775931496096605, 'patience': 80, 'lr_reduce_freq': 70, 'spt_alg': 'prim', 'spt_attr': 'similarity', 'manifold': 'PoincareBall', 'num_layers': 3, 'dim': 448, 'num_adj': 4, 'add_rate': 0.5473237132974021, 'tem': 1.1585045624408812, 'consis_rate': 1.035127959827404, 'use_att': 1}
mean: 0.8070999999999999
[0.807 0.823 0.804 0.784 0.807 0.802 0.798 0.816 0.818 0.812]
cur_param: {'lr': 0.028317645243528193, 'weight_decay': 0.005971818393052656, 'dropout': 0.7964971755384876, 'patience': 90, 'lr_reduce_freq': 50, 'spt_alg': 'prim', 'spt_attr': 'similarity', 'manifold': 'PoincareBall', 'num_layers': 3, 'dim': 496, 'num_adj': 4, 'add_rate': 0.6074699966197521, 'tem': 1.3590144916242604, 'consis_rate': 1.5811842352772945, 'use_att': 1}
mean: 0.8122
[0.822 0.798 0.788 0.821 0.826 0.811 0.792 0.815 0.828 0.821]
cur_param: {'lr': 0.016182297744489336, 'weight_decay': 0.004207608750159214, 'dropout': 0.7547897020800047, 'patience': 80, 'lr_reduce_freq': 40, 'spt_alg': 'prim', 'spt_attr': 'similarity', 'manifold': 'PoincareBall', 'num_layers': 3, 'dim': 400, 'num_adj': 4, 'add_rate': 0.7561011278331707, 'tem': 1.2206251441097253, 'consis_rate': 0.8523837552910098, 'use_att': 1}
mean: 0.8183999999999999
[0.833 0.793 0.828 0.798 0.818 0.812 0.827 0.82  0.832 0.823]
cur_param: {'lr': 0.015727902063323335, 'weight_decay': 0.0026265248499356287, 'dropout': 0.6839624411922951, 'patience': 100, 'lr_reduce_freq': 60, 'spt_alg': 'prim', 'spt_attr': 'similarity', 'manifold': 'Hyperboloid', 'num_layers': 3, 'dim': 480, 'num_adj': 4, 'add_rate': 0.8014575515610068, 'tem': 1.1088430333246009, 'consis_rate': 0.7949608958676442, 'use_att': 1}
mean: 0.797
[0.805 0.784 0.807 0.805 0.8   0.78  0.802 0.787 0.79  0.81 ]
cur_param: {'lr': 0.01981347292297427, 'weight_decay': 0.004448936336915827, 'dropout': 0.7085085617546341, 'patience': 90, 'lr_reduce_freq': 40, 'spt_alg': 'prim', 'spt_attr': 'similarity', 'manifold': 'PoincareBall', 'num_layers': 3, 'dim': 448, 'num_adj': 2, 'add_rate': 0.7303848089822148, 'tem': 1.1748392309765456, 'consis_rate': 0.8627541674959577, 'use_att': 1}
mean: 0.8199
[0.818 0.822 0.819 0.821 0.828 0.815 0.826 0.812 0.817 0.821]
cur_param: {'lr': 0.09488331528921808, 'weight_decay': 0.00441916915265639, 'dropout': 0.7516064875602857, 'patience': 90, 'lr_reduce_freq': 40, 'spt_alg': 'prim', 'spt_attr': 'similarity', 'manifold': 'PoincareBall', 'num_layers': 3, 'dim': 448, 'num_adj': 2, 'add_rate': 0.7516655599590496, 'tem': 1.403536918597184, 'consis_rate': 0.7142399738538263, 'use_att': 1}
mean: 0.8074
[0.799 0.804 0.816 0.797 0.81  0.809 0.815 0.811 0.801 0.812]
cur_param: {'lr': 0.020729973538651594, 'weight_decay': 0.004254059487206223, 'dropout': 0.7083488662772146, 'patience': 90, 'lr_reduce_freq': 40, 'spt_alg': 'prim', 'spt_attr': 'similarity', 'manifold': 'PoincareBall', 'num_layers': 3, 'dim': 496, 'num_adj': 2, 'add_rate': 0.8069299586670998, 'tem': 1.212210138228238, 'consis_rate': 0.9190728533067389, 'use_att': 1}
mean: 0.8105
[0.822 0.826 0.789 0.814 0.804 0.826 0.799 0.806 0.813 0.806]
cur_param: {'lr': 0.027497003456358988, 'weight_decay': 0.003531847292905501, 'dropout': 0.718320677174006, 'patience': 90, 'lr_reduce_freq': 40, 'spt_alg': 'prim', 'spt_attr': 'similarity', 'manifold': 'PoincareBall', 'num_layers': 3, 'dim': 432, 'num_adj': 2, 'add_rate': 0.6470018065246663, 'tem': 1.2789248555288633, 'consis_rate': 0.7447171959237159, 'use_att': 1}
mean: 0.8105
[0.805 0.807 0.787 0.802 0.812 0.832 0.822 0.814 0.807 0.817]
cur_param: {'lr': 0.017704066412732984, 'weight_decay': 0.0022076875493128784, 'dropout': 0.6711685967400978, 'patience': 80, 'lr_reduce_freq': 50, 'spt_alg': 'prim', 'spt_attr': 'similarity', 'manifold': 'PoincareBall', 'num_layers': 3, 'dim': 384, 'num_adj': 4, 'add_rate': 0.6942125223418618, 'tem': 1.1676300935651278, 'consis_rate': 0.841286751264452, 'use_att': 1}
mean: 0.8157
[0.821 0.827 0.807 0.828 0.807 0.811 0.806 0.831 0.804 0.815]
cur_param: {'lr': 0.014095636765706729, 'weight_decay': 0.005936648214461426, 'dropout': 0.7635301498248526, 'patience': 90, 'lr_reduce_freq': 50, 'spt_alg': 'prim', 'spt_attr': 'similarity', 'manifold': 'PoincareBall', 'num_layers': 3, 'dim': 464, 'num_adj': 2, 'add_rate': 0.848414801724062, 'tem': 1.1346962807896621, 'consis_rate': 0.9586245392452191, 'use_att': 1}
mean: 0.8213999999999999
[0.828 0.817 0.826 0.815 0.83  0.812 0.825 0.831 0.818 0.812]
cur_param: {'lr': 0.035355431887376366, 'weight_decay': 0.007351718428953256, 'dropout': 0.7553868766072483, 'patience': 90, 'lr_reduce_freq': 40, 'spt_alg': 'prim', 'spt_attr': 'similarity', 'manifold': 'PoincareBall', 'num_layers': 4, 'dim': 464, 'num_adj': 2, 'add_rate': 0.7788829943149368, 'tem': 1.1188296921001681, 'consis_rate': 1.0414295337840491, 'use_att': 1}
mean: 0.34070000000000006
[0.319 0.319 0.521 0.319 0.319 0.319 0.319 0.319 0.334 0.319]
cur_param: {'lr': 0.021301766717993935, 'weight_decay': 0.0055106414725060865, 'dropout': 0.7767356160701074, 'patience': 100, 'lr_reduce_freq': 60, 'spt_alg': 'prim', 'spt_attr': 'similarity', 'manifold': 'PoincareBall', 'num_layers': 3, 'dim': 432, 'num_adj': 2, 'add_rate': 0.8449512942239109, 'tem': 1.493658495398007, 'consis_rate': 0.9667968877458198, 'use_att': 1}
mean: 0.8196999999999999
[0.83  0.804 0.813 0.803 0.84  0.822 0.825 0.826 0.811 0.823]
cur_param: {'lr': 0.01064904351655089, 'weight_decay': 0.006181512682217314, 'dropout': 0.7700422927062789, 'patience': 100, 'lr_reduce_freq': 60, 'spt_alg': 'prim', 'spt_attr': 'similarity', 'manifold': 'PoincareBall', 'num_layers': 3, 'dim': 400, 'num_adj': 2, 'add_rate': 0.8346535429736798, 'tem': 1.4775188826120726, 'consis_rate': 0.8492908052270618, 'use_att': 1}
mean: 0.7709
[0.818 0.834 0.816 0.833 0.808 0.33  0.816 0.813 0.822 0.819]
cur_param: {'lr': 0.020959580429209698, 'weight_decay': 0.010621857929279875, 'dropout': 0.7427889776876035, 'patience': 100, 'lr_reduce_freq': 50, 'spt_alg': 'prim', 'spt_attr': 'similarity', 'manifold': 'PoincareBall', 'num_layers': 5, 'dim': 432, 'num_adj': 2, 'add_rate': 0.8581865492207342, 'tem': 1.4274658323377485, 'consis_rate': 0.9772081854277053, 'use_att': 0}
mean: 0.3074
[0.21  0.319 0.319 0.319 0.319 0.321 0.319 0.319 0.311 0.318]
cur_param: {'lr': 0.0480984877209565, 'weight_decay': 0.005404443835668532, 'dropout': 0.6488099670986036, 'patience': 100, 'lr_reduce_freq': 50, 'spt_alg': 'prim', 'spt_attr': 'similarity', 'manifold': 'PoincareBall', 'num_layers': 3, 'dim': 448, 'num_adj': 2, 'add_rate': 0.8802752519113731, 'tem': 1.4960870971309812, 'consis_rate': 0.8905473575672008, 'use_att': 1}
mean: 0.8055000000000001
[0.812 0.802 0.804 0.811 0.82  0.808 0.801 0.802 0.803 0.792]
cur_param: {'lr': 0.018823214736303707, 'weight_decay': 0.004748983482976751, 'dropout': 0.779283727394525, 'patience': 90, 'lr_reduce_freq': 60, 'spt_alg': 'prim', 'spt_attr': 'similarity', 'manifold': 'Hyperboloid', 'num_layers': 3, 'dim': 416, 'num_adj': 2, 'add_rate': 0.7409589831694827, 'tem': 1.0285209237014479, 'consis_rate': 0.9499251570957354, 'use_att': 1}
mean: 0.8137000000000001
[0.826 0.797 0.807 0.809 0.821 0.822 0.816 0.802 0.814 0.823]
cur_param: {'lr': 0.013690355601716452, 'weight_decay': 0.008108235938071518, 'dropout': 0.7616010562946776, 'patience': 90, 'lr_reduce_freq': 40, 'spt_alg': 'prim', 'spt_attr': 'similarity', 'manifold': 'PoincareBall', 'num_layers': 3, 'dim': 464, 'num_adj': 2, 'add_rate': 0.8270128510439181, 'tem': 1.1314106988581523, 'consis_rate': 1.1094846151258067, 'use_att': 1}
mean: 0.5377
[0.805 0.319 0.319 0.81  0.429 0.326 0.832 0.377 0.815 0.345]
cur_param: {'lr': 0.012983519445352828, 'weight_decay': 0.006617369130044138, 'dropout': 0.7290071217350385, 'patience': 90, 'lr_reduce_freq': 40, 'spt_alg': 'prim', 'spt_attr': 'similarity', 'manifold': 'PoincareBall', 'num_layers': 3, 'dim': 432, 'num_adj': 2, 'add_rate': 0.7745621923032111, 'tem': 1.232687292913472, 'consis_rate': 1.1711373906797735, 'use_att': 1}[32m[I 2022-06-30 08:16:58,789][0m Trial 92 finished with value: 0.8183 and parameters: {'lr': 0.012983519445352828, 'weight_decay': 0.006617369130044138, 'dropout': 0.7290071217350385, 'patience': 90, 'lr_reduce_freq': 40, 'spt_alg': 'prim', 'spt_attr': 'similarity', 'manifold': 'PoincareBall', 'num_layers': 3, 'dim': 432, 'num_adj': 2, 'add_rate': 0.7745621923032111, 'tem': 1.232687292913472, 'consis_rate': 1.1711373906797735, 'use_att': 1}. Best is trial 84 with value: 0.8213999999999999.[0m
[32m[I 2022-06-30 08:31:52,510][0m Trial 93 finished with value: 0.8205 and parameters: {'lr': 0.03364629212621941, 'weight_decay': 0.00658287850550531, 'dropout': 0.7250035656806867, 'patience': 90, 'lr_reduce_freq': 40, 'spt_alg': 'prim', 'spt_attr': 'similarity', 'manifold': 'PoincareBall', 'num_layers': 3, 'dim': 432, 'num_adj': 2, 'add_rate': 0.8676345237622685, 'tem': 1.0904839640117865, 'consis_rate': 1.0623870449582726, 'use_att': 1}. Best is trial 84 with value: 0.8213999999999999.[0m
[32m[I 2022-06-30 08:48:18,744][0m Trial 94 finished with value: 0.821 and parameters: {'lr': 0.03325937718067949, 'weight_decay': 0.009232658405586288, 'dropout': 0.7283290300765249, 'patience': 90, 'lr_reduce_freq': 50, 'spt_alg': 'prim', 'spt_attr': 'similarity', 'manifold': 'PoincareBall', 'num_layers': 3, 'dim': 432, 'num_adj': 2, 'add_rate': 0.7766104210232233, 'tem': 1.087481757058542, 'consis_rate': 1.052644663568709, 'use_att': 1}. Best is trial 84 with value: 0.8213999999999999.[0m
[32m[I 2022-06-30 09:03:36,113][0m Trial 95 finished with value: 0.8150999999999999 and parameters: {'lr': 0.03425854804972608, 'weight_decay': 0.008914941087910872, 'dropout': 0.7296368810958546, 'patience': 90, 'lr_reduce_freq': 50, 'spt_alg': 'prim', 'spt_attr': 'similarity', 'manifold': 'PoincareBall', 'num_layers': 3, 'dim': 368, 'num_adj': 2, 'add_rate': 0.7683411836449184, 'tem': 1.0860308987224951, 'consis_rate': 1.0646654427106053, 'use_att': 1}. Best is trial 84 with value: 0.8213999999999999.[0m
[32m[I 2022-06-30 09:21:59,645][0m Trial 96 finished with value: 0.8128 and parameters: {'lr': 0.0407638601816973, 'weight_decay': 0.006184242609019994, 'dropout': 0.6097613425948318, 'patience': 100, 'lr_reduce_freq': 50, 'spt_alg': 'prim', 'spt_attr': 'similarity', 'manifold': 'PoincareBall', 'num_layers': 3, 'dim': 432, 'num_adj': 2, 'add_rate': 0.8766285089605128, 'tem': 1.1734711998613119, 'consis_rate': 0.8787313101026778, 'use_att': 1}. Best is trial 84 with value: 0.8213999999999999.[0m
[32m[I 2022-06-30 09:35:22,675][0m Trial 97 finished with value: 0.8165999999999999 and parameters: {'lr': 0.025511725199432376, 'weight_decay': 0.006750778359513602, 'dropout': 0.6872093196258926, 'patience': 90, 'lr_reduce_freq': 60, 'spt_alg': 'prim', 'spt_attr': 'similarity', 'manifold': 'PoincareBall', 'num_layers': 3, 'dim': 384, 'num_adj': 2, 'add_rate': 0.8608830572524644, 'tem': 1.0929022794161325, 'consis_rate': 0.996088487543429, 'use_att': 1}. Best is trial 84 with value: 0.8213999999999999.[0m
[32m[I 2022-06-30 09:44:49,731][0m Trial 98 finished with value: 0.38570000000000004 and parameters: {'lr': 0.014291128559005164, 'weight_decay': 0.00868687654680343, 'dropout': 0.7111231549798425, 'patience': 90, 'lr_reduce_freq': 50, 'spt_alg': 'prim', 'spt_attr': 'similarity', 'manifold': 'PoincareBall', 'num_layers': 3, 'dim': 400, 'num_adj': 2, 'add_rate': 0.8199953484722128, 'tem': 1.0193536389503097, 'consis_rate': 0.797691000788543, 'use_att': 1}. Best is trial 84 with value: 0.8213999999999999.[0m
[32m[I 2022-06-30 10:07:08,055][0m Trial 99 finished with value: 0.8144 and parameters: {'lr': 0.057866152475144914, 'weight_decay': 0.009847695246288755, 'dropout': 0.7453190106863189, 'patience': 90, 'lr_reduce_freq': 70, 'spt_alg': 'prim', 'spt_attr': 'similarity', 'manifold': 'PoincareBall', 'num_layers': 3, 'dim': 432, 'num_adj': 2, 'add_rate': 0.7842162906432707, 'tem': 1.3325432056162774, 'consis_rate': 1.1887664963138282, 'use_att': 1}. Best is trial 84 with value: 0.8213999999999999.[0m
[32m[I 2022-06-30 10:21:12,127][0m Trial 100 finished with value: 0.3191 and parameters: {'lr': 0.02193475272620852, 'weight_decay': 0.012277048566524666, 'dropout': 0.7040975845631697, 'patience': 100, 'lr_reduce_freq': 40, 'spt_alg': 'prim', 'spt_attr': 'similarity', 'manifold': 'PoincareBall', 'num_layers': 4, 'dim': 416, 'num_adj': 2, 'add_rate': 0.8504626953496044, 'tem': 1.2189303573845836, 'consis_rate': 0.9469019784038467, 'use_att': 1}. Best is trial 84 with value: 0.8213999999999999.[0m
[32m[I 2022-06-30 10:31:37,382][0m Trial 101 finished with value: 0.8193999999999999 and parameters: {'lr': 0.02708640219900922, 'weight_decay': 0.005660142869494764, 'dropout': 0.7306303725955949, 'patience': 70, 'lr_reduce_freq': 40, 'spt_alg': 'prim', 'spt_attr': 'similarity', 'manifold': 'PoincareBall', 'num_layers': 3, 'dim': 448, 'num_adj': 2, 'add_rate': 0.7188384597447826, 'tem': 1.2220612881583306, 'consis_rate': 1.1647853444737946, 'use_att': 1}. Best is trial 84 with value: 0.8213999999999999.[0m
[32m[I 2022-06-30 10:41:44,195][0m Trial 102 finished with value: 0.8153 and parameters: {'lr': 0.026050289191749804, 'weight_decay': 0.005685407899606153, 'dropout': 0.7284769908534231, 'patience': 70, 'lr_reduce_freq': 40, 'spt_alg': 'prim', 'spt_attr': 'similarity', 'manifold': 'PoincareBall', 'num_layers': 3, 'dim': 400, 'num_adj': 2, 'add_rate': 0.7088393776603236, 'tem': 1.2313731896243114, 'consis_rate': 1.2354159435957413, 'use_att': 1}. Best is trial 84 with value: 0.8213999999999999.[0m
[32m[I 2022-06-30 10:51:29,666][0m Trial 103 finished with value: 0.8151999999999999 and parameters: {'lr': 0.032030507982513, 'weight_decay': 0.005302346000738841, 'dropout': 0.678229618279051, 'patience': 70, 'lr_reduce_freq': 30, 'spt_alg': 'prim', 'spt_attr': 'similarity', 'manifold': 'PoincareBall', 'num_layers': 3, 'dim': 416, 'num_adj': 2, 'add_rate': 0.7575373343920195, 'tem': 1.138892684892479, 'consis_rate': 1.0234401642950273, 'use_att': 1}. Best is trial 84 with value: 0.8213999999999999.[0m
[32m[I 2022-06-30 11:02:03,451][0m Trial 104 finished with value: 0.8185999999999998 and parameters: {'lr': 0.015149151896097989, 'weight_decay': 0.006977135149022124, 'dropout': 0.7535744655749731, 'patience': 70, 'lr_reduce_freq': 50, 'spt_alg': 'prim', 'spt_attr': 'similarity', 'manifold': 'PoincareBall', 'num_layers': 3, 'dim': 432, 'num_adj': 2, 'add_rate': 0.7324936813168421, 'tem': 1.1773977687781882, 'consis_rate': 1.0650383518336128, 'use_att': 1}. Best is trial 84 with value: 0.8213999999999999.[0m
[32m[I 2022-06-30 11:14:26,265][0m Trial 105 finished with value: 0.8124 and parameters: {'lr': 0.014986056613175234, 'weight_decay': 0.006908936815855968, 'dropout': 0.7167169268248597, 'patience': 90, 'lr_reduce_freq': 50, 'spt_alg': 'prim', 'spt_attr': 'similarity', 'manifold': 'PoincareBall', 'num_layers': 3, 'dim': 432, 'num_adj': 2, 'add_rate': 0.7368450713767273, 'tem': 1.0681692474459257, 'consis_rate': 1.067451819773898, 'use_att': 1}. Best is trial 84 with value: 0.8213999999999999.[0m
[32m[I 2022-06-30 11:26:33,660][0m Trial 106 finished with value: 0.817 and parameters: {'lr': 0.023224121336290916, 'weight_decay': 0.008041852176306322, 'dropout': 0.7580898878323087, 'patience': 70, 'lr_reduce_freq': 60, 'spt_alg': 'prim', 'spt_attr': 'similarity', 'manifold': 'PoincareBall', 'num_layers': 3, 'dim': 480, 'num_adj': 2, 'add_rate': 0.7884504727954933, 'tem': 1.1752365544549543, 'consis_rate': 1.1604526568179194, 'use_att': 1}. Best is trial 84 with value: 0.8213999999999999.[0m
[32m[I 2022-06-30 11:28:53,773][0m Trial 107 finished with value: 0.8053000000000001 and parameters: {'lr': 0.019985455480460643, 'weight_decay': 0.0047058393078963125, 'dropout': 0.7425010754155124, 'patience': 90, 'lr_reduce_freq': 50, 'spt_alg': 'prim', 'spt_attr': 'similarity', 'manifold': 'PoincareBall', 'num_layers': 3, 'dim': 448, 'num_adj': 2, 'add_rate': 0.724796482534994, 'tem': 1.1449843268832727, 'consis_rate': 0.9668986450013646, 'use_att': 0}. Best is trial 84 with value: 0.8213999999999999.[0m
[32m[I 2022-06-30 11:44:30,498][0m Trial 108 finished with value: 0.319 and parameters: {'lr': 0.03966203502819761, 'weight_decay': 0.011925786718994792, 'dropout': 0.6947128688082194, 'patience': 90, 'lr_reduce_freq': 60, 'spt_alg': 'prim', 'spt_attr': 'similarity', 'manifold': 'PoincareBall', 'num_layers': 5, 'dim': 464, 'num_adj': 2, 'add_rate': 0.6795554350091827, 'tem': 1.373816767617195, 'consis_rate': 0.8987655134925485, 'use_att': 1}. Best is trial 84 with value: 0.8213999999999999.[0m
[32m[I 2022-06-30 12:07:35,334][0m Trial 109 finished with value: 0.546 and parameters: {'lr': 0.01108491684994623, 'weight_decay': 0.0062228086290572245, 'dropout': 0.7281249212205468, 'patience': 90, 'lr_reduce_freq': 50, 'spt_alg': 'prim', 'spt_attr': 'similarity', 'manifold': 'Hyperboloid', 'num_layers': 3, 'dim': 496, 'num_adj': 2, 'add_rate': 0.8154739919539236, 'tem': 1.2950225150067858, 'consis_rate': 1.0108797866817611, 'use_att': 1}. Best is trial 84 with value: 0.8213999999999999.[0m
