[32m[I 2022-06-25 23:36:08,051][0m Trial 149 finished with value: 0.8168000000000001 and parameters: {'lr': 0.006936705747289074, 'weight_decay': 0.001182094126299123, 'dropout': 0.8164086359015104, 'patience': 100, 'lr_reduce_freq': 130, 'spt_alg': 'prim', 'spt_attr': 'edge_degree', 'manifold': 'PoincareBall', 'num_layers': 3, 'num_adj': 8, 'add_rate': 0.7442837414042911, 'tem': 1.7019681714935517, 'consis_rate': 1.4549540596549912, 'use_att': 1}. Best is trial 121 with value: 0.8208.[0m

mean: 0.8171999999999999
[0.824 0.798 0.819 0.823 0.823 0.822 0.81  0.814 0.816 0.823]
cur_param: {'lr': 0.0014843336229230697, 'weight_decay': 0.0008191129588174202, 'dropout': 0.8113226185442423, 'patience': 100, 'lr_reduce_freq': 150, 'spt_alg': 'prim', 'spt_attr': 'edge_degree', 'manifold': 'PoincareBall', 'num_layers': 3, 'num_adj': 8, 'add_rate': 0.619127333020437, 'tem': 1.6098705880339423, 'consis_rate': 1.3565420445473575, 'use_att': 1}
mean: 0.8177
[0.818 0.812 0.811 0.819 0.815 0.807 0.811 0.844 0.828 0.812]
cur_param: {'lr': 0.0018984835612301978, 'weight_decay': 0.000595620895970777, 'dropout': 0.7827970990189679, 'patience': 100, 'lr_reduce_freq': 150, 'spt_alg': 'prim', 'spt_attr': 'edge_degree', 'manifold': 'PoincareBall', 'num_layers': 3, 'num_adj': 8, 'add_rate': 0.6696747548934529, 'tem': 1.6722610179668742, 'consis_rate': 1.40860251105493, 'use_att': 1}
mean: 0.8163
[0.808 0.818 0.826 0.826 0.816 0.811 0.809 0.81  0.821 0.818]
cur_param: {'lr': 0.002158130724009197, 'weight_decay': 0.001162980193674193, 'dropout': 0.7502975949119891, 'patience': 100, 'lr_reduce_freq': 150, 'spt_alg': 'prim', 'spt_attr': 'edge_degree', 'manifold': 'PoincareBall', 'num_layers': 3, 'num_adj': 8, 'add_rate': 0.6006936887215949, 'tem': 1.7654319403135543, 'consis_rate': 1.5291564918861602, 'use_att': 1}
mean: 0.8176
[0.798 0.82  0.821 0.822 0.823 0.812 0.809 0.811 0.832 0.828]
cur_param: {'lr': 0.0012232916934884648, 'weight_decay': 0.0005041646436667898, 'dropout': 0.8833589635612257, 'patience': 100, 'lr_reduce_freq': 150, 'spt_alg': 'prim', 'spt_attr': 'edge_degree', 'manifold': 'PoincareBall', 'num_layers': 3, 'num_adj': 8, 'add_rate': 0.5829015517081138, 'tem': 0.4873983262717255, 'consis_rate': 1.488661673910568, 'use_att': 1}
mean: 0.7929
[0.791 0.81  0.796 0.802 0.814 0.765 0.766 0.826 0.806 0.753]
cur_param: {'lr': 0.0016070719498088425, 'weight_decay': 0.0009645787956511894, 'dropout': 0.8115039815468716, 'patience': 100, 'lr_reduce_freq': 150, 'spt_alg': 'prim', 'spt_attr': 'edge_degree', 'manifold': 'PoincareBall', 'num_layers': 3, 'num_adj': 8, 'add_rate': 0.6969256478046008, 'tem': 1.5462397152175889, 'consis_rate': 1.356392677043752, 'use_att': 1}
mean: 0.8174999999999999
[0.833 0.813 0.83  0.816 0.814 0.806 0.806 0.824 0.832 0.801]
cur_param: {'lr': 0.001398157753881031, 'weight_decay': 0.0007383045608889407, 'dropout': 0.7721879280253855, 'patience': 100, 'lr_reduce_freq': 150, 'spt_alg': 'prim', 'spt_attr': 'edge_degree', 'manifold': 'PoincareBall', 'num_layers': 3, 'num_adj': 8, 'add_rate': 0.5234230081583018, 'tem': 1.5833203205901623, 'consis_rate': 1.4368416022438666, 'use_att': 0}
mean: 0.8148
[0.806 0.809 0.815 0.819 0.815 0.818 0.821 0.814 0.804 0.827]
cur_param: {'lr': 0.0017578924821302342, 'weight_decay': 0.0013274941686448613, 'dropout': 0.8295042936564208, 'patience': 100, 'lr_reduce_freq': 150, 'spt_alg': 'prim', 'spt_attr': 'edge_degree', 'manifold': 'PoincareBall', 'num_layers': 3, 'num_adj': 8, 'add_rate': 0.6340421139018962, 'tem': 0.6576678042561497, 'consis_rate': 1.200597239970628, 'use_att': 1}
mean: 0.8127000000000001
[0.82  0.8   0.82  0.807 0.817 0.808 0.806 0.818 0.821 0.81 ]
cur_param: {'lr': 0.0010719736377099633, 'weight_decay': 0.00888674178959704, 'dropout': 0.7978804003868519, 'patience': 100, 'lr_reduce_freq': 150, 'spt_alg': 'prim', 'spt_attr': 'similarity', 'manifold': 'PoincareBall', 'num_layers': 3, 'num_adj': 8, 'add_rate': 0.5562402585036801, 'tem': 1.0336086052797526, 'consis_rate': 1.2389888855554003, 'use_att': 1}
mean: 0.4023
[0.354 0.496 0.38  0.388 0.387 0.437 0.259 0.47  0.413 0.439]
cur_param: {'lr': 0.0017640365847510166, 'weight_decay': 0.0010528823490755963, 'dropout': 0.787938740457754, 'patience': 100, 'lr_reduce_freq': 150, 'spt_alg': 'prim', 'spt_attr': 'edge_degree', 'manifold': 'PoincareBall', 'num_layers': 3, 'num_adj': 8, 'add_rate': 0.6481744081521695, 'tem': 1.6286729834028164, 'consis_rate': 1.4615773768577172, 'use_att': 1}
mean: 0.8177
[0.816 0.815 0.824 0.817 0.811 0.831 0.813 0.822 0.826 0.802]
cur_param: {'lr': 0.0020304913028050676, 'weight_decay': 0.0009628014927110625, 'dropout': 0.8512451714746214, 'patience': 100, 'lr_reduce_freq': 150, 'spt_alg': 'prim', 'spt_attr': 'edge_degree', 'manifold': 'PoincareBall', 'num_layers': 3, 'num_adj': 8, 'add_rate': 0.6631357626686073, 'tem': 1.5872454519100436, 'consis_rate': 1.3881817431616812, 'use_att': 1}
mean: 0.8080999999999999
[0.809 0.818 0.811 0.791 0.819 0.814 0.786 0.821 0.821 0.791]
cur_param: {'lr': 0.001626128684108736, 'weight_decay': 0.03452030218090802, 'dropout': 0.7923210650868363, 'patience': 100, 'lr_reduce_freq': 150, 'spt_alg': 'prim', 'spt_attr': 'edge_degree', 'manifold': 'PoincareBall', 'num_layers': 3, 'num_adj': 8, 'add_rate': 0.6097867661991586, 'tem': 1.6894049036011105, 'consis_rate': 1.43646738671842, 'use_att': 1}
mean: 0.30789999999999995
[0.319 0.319 0.319 0.146 0.346 0.319 0.319 0.354 0.319 0.319]
cur_param: {'lr': 0.0013193455441381139, 'weight_decay': 0.000635890701432327, 'dropout': 0.7575513486650582, 'patience': 100, 'lr_reduce_freq': 150, 'spt_alg': 'prim', 'spt_attr': 'edge_degree', 'manifold': 'PoincareBall', 'num_layers': 3, 'num_adj': 8, 'add_rate': 0.8647966461923152, 'tem': 1.5039383234266894, 'consis_rate': 1.5554588901864144, 'use_att': 1}
mean: 0.8174999999999999
[0.815 0.81  0.821 0.82  0.812 0.813 0.823 0.823 0.826 0.812]
cur_param: {'lr': 0.0014941210572425466, 'weight_decay': 0.0008251959409930206, 'dropout': 0.8251081404822871, 'patience': 100, 'lr_reduce_freq': 150, 'spt_alg': 'prim', 'spt_attr': 'edge_degree', 'manifold': 'PoincareBall', 'num_layers': 3, 'num_adj': 8, 'add_rate': 0.6559029283050114, 'tem': 1.7632350891456443, 'consis_rate': 1.485685165911379, 'use_att': 1}
mean: 0.8160000000000001
[0.821 0.814 0.835 0.808 0.821 0.804 0.805 0.833 0.82  0.799]
cur_param: {'lr': 0.0019337978137344964, 'weight_decay': 0.0007312647949938932, 'dropout': 0.729319204779381, 'patience': 100, 'lr_reduce_freq': 150, 'spt_alg': 'prim', 'spt_attr': 'edge_degree', 'manifold': 'PoincareBall', 'num_layers': 3, 'num_adj': 8, 'add_rate': 0.7258660483512323, 'tem': 0.3764928070329454, 'consis_rate': 1.3290752374210373, 'use_att': 1}
mean: 0.8135
[0.817 0.804 0.814 0.812 0.81  0.814 0.821 0.814 0.814 0.815]
cur_param: {'lr': 0.002554045561830356, 'weight_decay': 0.0009367277292774747, 'dropout': 0.7767877850923858, 'patience': 100, 'lr_reduce_freq': 150, 'spt_alg': 'prim', 'spt_attr': 'edge_degree', 'manifold': 'PoincareBall', 'num_layers': 3, 'num_adj': 8, 'add_rate': 0.6168603991389231, 'tem': 1.6362813556505116, 'consis_rate': 1.586462341282189, 'use_att': 1}
mean: 0.8177999999999999
[0.83  0.819 0.823 0.806 0.814 0.817 0.811 0.801 0.829 0.828]
cur_param: {'lr': 0.002253945518344835, 'weight_decay': 0.0005656114968608423, 'dropout': 0.8686909360176321, 'patience': 100, 'lr_reduce_freq': 150, 'spt_alg': 'prim', 'spt_attr': 'edge_degree', 'manifold': 'PoincareBall', 'num_layers': 3, 'num_adj': 8, 'add_rate': 0.6859346965765227, 'tem': 1.591808542843194, 'consis_rate': 1.4002750174971859, 'use_att': 1}
mean: 0.795
[0.789 0.812 0.791 0.807 0.811 0.799 0.755 0.814 0.821 0.751]
cur_param: {'lr': 0.006936705747289074, 'weight_decay': 0.001182094126299123, 'dropout': 0.8164086359015104, 'patience': 100, 'lr_reduce_freq': 130, 'spt_alg': 'prim', 'spt_attr': 'edge_degree', 'manifold': 'PoincareBall', 'num_layers': 3, 'num_adj': 8, 'add_rate': 0.7442837414042911, 'tem': 1.7019681714935517, 'consis_rate': 1.4549540596549912, 'use_att': 1}
mean: 0.8168000000000001
[0.823 0.809 0.808 0.801 0.818 0.81  0.817 0.828 0.833 0.821]
best param:{'lr': 0.001707504742271649, 'weight_decay': 0.0008953665558199746, 'dropout': 0.827614242627509, 'patience': 100, 'lr_reduce_freq': 150, 'spt_alg': 'prim', 'spt_attr': 'edge_degree', 'manifold': 'PoincareBall', 'num_layers': 3, 'num_adj': 8, 'add_rate': 0.5964670806883148, 'tem': 0.5870464372309184, 'consis_rate': 1.4894310721594985, 'use_att': 1}
best score:0.8208

Final results:

0.8208
