[32m[I 2022-06-27 09:53:50,244][0m Trial 107 finished with value: 0.8199 and parameters: {'lr': 0.004073777994832259, 'weight_decay': 0.0007916241350935404, 'dropout': 0.7736990885869829, 'patience': 80, 'lr_reduce_freq': 90, 'spt_alg': 'prim', 'spt_attr': 'edge_degree', 'manifold': 'PoincareBall', 'num_layers': 3, 'dim': 328, 'num_adj': 6, 'add_rate': 0.5168715556833207, 'tem': 1.079236044639769, 'consis_rate': 1.55926231413221, 'use_att': 1}. Best is trial 70 with value: 0.8281999999999998.[0m

cur_param: {'lr': 0.005315791417941914, 'weight_decay': 0.0007475512778578702, 'dropout': 0.7346124823956781, 'patience': 80, 'lr_reduce_freq': 100, 'spt_alg': 'prim', 'spt_attr': 'edge_degree', 'manifold': 'Hyperboloid', 'num_layers': 3, 'dim': 332, 'num_adj': 6, 'add_rate': 0.41903503368558837, 'tem': 1.1479833947709663, 'consis_rate': 1.571426861821551, 'use_att': 1}
mean: 0.8137000000000001
[0.828 0.817 0.808 0.819 0.82  0.812 0.812 0.791 0.805 0.825]
cur_param: {'lr': 0.0023663820665787228, 'weight_decay': 0.0007105534148153364, 'dropout': 0.7702600926378743, 'patience': 80, 'lr_reduce_freq': 90, 'spt_alg': 'prim', 'spt_attr': 'edge_degree', 'manifold': 'PoincareBall', 'num_layers': 3, 'dim': 328, 'num_adj': 6, 'add_rate': 0.4487146187071879, 'tem': 1.1693027102261453, 'consis_rate': 1.6108411018823146, 'use_att': 1}
mean: 0.8172
[0.81  0.798 0.824 0.815 0.832 0.833 0.814 0.808 0.814 0.824]
cur_param: {'lr': 0.004853365084247605, 'weight_decay': 0.0007606140368274897, 'dropout': 0.7856563534833177, 'patience': 80, 'lr_reduce_freq': 90, 'spt_alg': 'prim', 'spt_attr': 'edge_degree', 'manifold': 'PoincareBall', 'num_layers': 3, 'dim': 336, 'num_adj': 6, 'add_rate': 0.46479187914960657, 'tem': 1.1432089646600299, 'consis_rate': 1.6497271138539964, 'use_att': 1}
mean: 0.8192
[0.831 0.825 0.832 0.809 0.824 0.81  0.837 0.787 0.829 0.808]
cur_param: {'lr': 0.0047811281404132, 'weight_decay': 0.0007235456763133825, 'dropout': 0.746857725870956, 'patience': 80, 'lr_reduce_freq': 90, 'spt_alg': 'prim', 'spt_attr': 'edge_degree', 'manifold': 'PoincareBall', 'num_layers': 3, 'dim': 320, 'num_adj': 6, 'add_rate': 0.43259721617940217, 'tem': 1.1112580123294336, 'consis_rate': 1.6682600315338325, 'use_att': 1}
mean: 0.8194000000000001
[0.799 0.818 0.827 0.82  0.836 0.826 0.826 0.806 0.81  0.826]
cur_param: {'lr': 0.005400124360775092, 'weight_decay': 0.0006659782762257902, 'dropout': 0.7556087429237683, 'patience': 80, 'lr_reduce_freq': 100, 'spt_alg': 'prim', 'spt_attr': 'edge_degree', 'manifold': 'PoincareBall', 'num_layers': 3, 'dim': 324, 'num_adj': 6, 'add_rate': 0.4417170031297527, 'tem': 1.1236941941075629, 'consis_rate': 1.5462237515114898, 'use_att': 1}
mean: 0.8213999999999999
[0.82  0.828 0.823 0.825 0.825 0.825 0.826 0.832 0.813 0.797]
cur_param: {'lr': 0.005310613042510782, 'weight_decay': 0.0006757656765731589, 'dropout': 0.7557179327327729, 'patience': 80, 'lr_reduce_freq': 100, 'spt_alg': 'prim', 'spt_attr': 'edge_degree', 'manifold': 'PoincareBall', 'num_layers': 3, 'dim': 324, 'num_adj': 6, 'add_rate': 0.43957286609315327, 'tem': 1.157946238870991, 'consis_rate': 1.5186593420271544, 'use_att': 1}
mean: 0.8197999999999999
[0.826 0.833 0.817 0.829 0.822 0.824 0.816 0.832 0.798 0.801]
cur_param: {'lr': 0.004360229884616043, 'weight_decay': 0.0006949597713277807, 'dropout': 0.7376700669681707, 'patience': 80, 'lr_reduce_freq': 100, 'spt_alg': 'prim', 'spt_attr': 'edge_degree', 'manifold': 'PoincareBall', 'num_layers': 3, 'dim': 328, 'num_adj': 6, 'add_rate': 0.4536979544842022, 'tem': 1.1994504784948639, 'consis_rate': 1.5406729923279026, 'use_att': 1}
mean: 0.8209
[0.812 0.826 0.826 0.811 0.827 0.824 0.826 0.825 0.81  0.822]
cur_param: {'lr': 0.00579814260835161, 'weight_decay': 0.0006876749230109521, 'dropout': 0.7343408627851868, 'patience': 80, 'lr_reduce_freq': 100, 'spt_alg': 'prim', 'spt_attr': 'edge_degree', 'manifold': 'PoincareBall', 'num_layers': 3, 'dim': 324, 'num_adj': 2, 'add_rate': 0.47590468993362406, 'tem': 1.1931238052836877, 'consis_rate': 1.543040284127133, 'use_att': 1}
mean: 0.8187
[0.833 0.822 0.822 0.813 0.824 0.829 0.827 0.812 0.805 0.8  ]
cur_param: {'lr': 0.004341864706685753, 'weight_decay': 0.000662890474570104, 'dropout': 0.7393333429695335, 'patience': 80, 'lr_reduce_freq': 100, 'spt_alg': 'prim', 'spt_attr': 'edge_degree', 'manifold': 'PoincareBall', 'num_layers': 3, 'dim': 316, 'num_adj': 4, 'add_rate': 0.4681662279662479, 'tem': 1.1796323081494304, 'consis_rate': 1.5508533362584422, 'use_att': 1}
mean: 0.8199
[0.795 0.806 0.829 0.822 0.836 0.816 0.82  0.817 0.825 0.833]
cur_param: {'lr': 0.005466363377274453, 'weight_decay': 0.0007027575175049958, 'dropout': 0.7607634218554007, 'patience': 80, 'lr_reduce_freq': 100, 'spt_alg': 'prim', 'spt_attr': 'edge_degree', 'manifold': 'PoincareBall', 'num_layers': 3, 'dim': 328, 'num_adj': 6, 'add_rate': 0.42218969278967, 'tem': 1.1031016969935725, 'consis_rate': 1.5111096528544792, 'use_att': 1}
mean: 0.818
[0.82  0.827 0.788 0.813 0.831 0.822 0.806 0.824 0.821 0.828]
cur_param: {'lr': 0.004738891829558056, 'weight_decay': 0.0007365980382522116, 'dropout': 0.7510497832920059, 'patience': 80, 'lr_reduce_freq': 90, 'spt_alg': 'prim', 'spt_attr': 'edge_degree', 'manifold': 'PoincareBall', 'num_layers': 3, 'dim': 336, 'num_adj': 6, 'add_rate': 0.5192433733542129, 'tem': 1.1245913549452498, 'consis_rate': 1.5905347802760192, 'use_att': 1}
mean: 0.8232999999999999
[0.819 0.84  0.823 0.824 0.823 0.827 0.833 0.825 0.796 0.823]
cur_param: {'lr': 0.004565996943763855, 'weight_decay': 0.000736316499727434, 'dropout': 0.7523244237510152, 'patience': 80, 'lr_reduce_freq': 120, 'spt_alg': 'prim', 'spt_attr': 'edge_degree', 'manifold': 'PoincareBall', 'num_layers': 3, 'dim': 332, 'num_adj': 6, 'add_rate': 0.45838663991121964, 'tem': 1.1391460819762, 'consis_rate': 1.5875287762189831, 'use_att': 1}
mean: 0.8207000000000001
[0.831 0.838 0.817 0.814 0.831 0.812 0.817 0.807 0.822 0.818]
cur_param: {'lr': 0.0051956333829606465, 'weight_decay': 0.0006444018124593665, 'dropout': 0.7754251548277513, 'patience': 80, 'lr_reduce_freq': 100, 'spt_alg': 'prim', 'spt_attr': 'edge_degree', 'manifold': 'PoincareBall', 'num_layers': 3, 'dim': 332, 'num_adj': 6, 'add_rate': 0.5059781848144252, 'tem': 1.1976617480759753, 'consis_rate': 1.6264777075621242, 'use_att': 1}
mean: 0.8191
[0.836 0.829 0.8   0.818 0.829 0.799 0.822 0.811 0.82  0.827]
cur_param: {'lr': 0.004703135890500314, 'weight_decay': 0.0007461683907659564, 'dropout': 0.7665167465075309, 'patience': 80, 'lr_reduce_freq': 90, 'spt_alg': 'prim', 'spt_attr': 'edge_degree', 'manifold': 'PoincareBall', 'num_layers': 3, 'dim': 336, 'num_adj': 6, 'add_rate': 0.5165532346605597, 'tem': 1.1255054848027413, 'consis_rate': 1.6119818612035226, 'use_att': 1}
mean: 0.8240999999999999
[0.813 0.836 0.821 0.823 0.828 0.829 0.834 0.819 0.826 0.812]
cur_param: {'lr': 0.004073327831619582, 'weight_decay': 0.0007631425925363339, 'dropout': 0.7874962476831938, 'patience': 80, 'lr_reduce_freq': 90, 'spt_alg': 'prim', 'spt_attr': 'edge_degree', 'manifold': 'PoincareBall', 'num_layers': 3, 'dim': 336, 'num_adj': 6, 'add_rate': 0.5276821364742322, 'tem': 1.1270220478948052, 'consis_rate': 1.6138469803806608, 'use_att': 1}
mean: 0.8226999999999999
[0.833 0.831 0.824 0.814 0.82  0.815 0.836 0.822 0.81  0.822]
cur_param: {'lr': 0.00467982605150675, 'weight_decay': 0.0007143931736471792, 'dropout': 0.7925037660150548, 'patience': 80, 'lr_reduce_freq': 90, 'spt_alg': 'prim', 'spt_attr': 'edge_degree', 'manifold': 'PoincareBall', 'num_layers': 3, 'dim': 336, 'num_adj': 6, 'add_rate': 0.5220798628627054, 'tem': 1.108086806025929, 'consis_rate': 1.6143743881784534, 'use_att': 1}
mean: 0.8165000000000001
[0.819 0.824 0.814 0.809 0.812 0.809 0.832 0.818 0.825 0.803]
cur_param: {'lr': 0.0039921015512163, 'weight_decay': 0.0007448632867114817, 'dropout': 0.7885175762187373, 'patience': 80, 'lr_reduce_freq': 90, 'spt_alg': 'prim', 'spt_attr': 'edge_degree', 'manifold': 'PoincareBall', 'num_layers': 3, 'dim': 324, 'num_adj': 6, 'add_rate': 0.5151277387210919, 'tem': 1.0873977930826024, 'consis_rate': 1.5541851757564977, 'use_att': 1}
mean: 0.8224
[0.826 0.828 0.823 0.832 0.835 0.817 0.827 0.812 0.822 0.802]
cur_param: {'lr': 0.004073777994832259, 'weight_decay': 0.0007916241350935404, 'dropout': 0.7736990885869829, 'patience': 80, 'lr_reduce_freq': 90, 'spt_alg': 'prim', 'spt_attr': 'edge_degree', 'manifold': 'PoincareBall', 'num_layers': 3, 'dim': 328, 'num_adj': 6, 'add_rate': 0.5168715556833207, 'tem': 1.079236044639769, 'consis_rate': 1.55926231413221, 'use_att': 1}
mean: 0.8199
[0.835 0.811 0.823 0.822 0.828 0.83  0.806 0.811 0.818 0.815]
cur_param: {'lr': 0.0033398758330258523, 'weight_decay': 0.000762315474666333, 'dropout': 0.7873116786772465, 'patience': 80, 'lr_reduce_freq': 90, 'spt_alg': 'prim', 'spt_attr': 'similarity', 'manifold': 'PoincareBall', 'num_layers': 3, 'dim': 320, 'num_adj': 6, 'add_rate': 0.5257557119459094, 'tem': 1.093057937278695, 'consis_rate': 1.5817886552752447, 'use_att': 1}[32m[I 2022-06-27 10:15:05,908][0m Trial 108 finished with value: 0.8132999999999999 and parameters: {'lr': 0.0033398758330258523, 'weight_decay': 0.000762315474666333, 'dropout': 0.7873116786772465, 'patience': 80, 'lr_reduce_freq': 90, 'spt_alg': 'prim', 'spt_attr': 'similarity', 'manifold': 'PoincareBall', 'num_layers': 3, 'dim': 320, 'num_adj': 6, 'add_rate': 0.5257557119459094, 'tem': 1.093057937278695, 'consis_rate': 1.5817886552752447, 'use_att': 1}. Best is trial 70 with value: 0.8281999999999998.[0m
[32m[I 2022-06-27 10:34:23,764][0m Trial 109 finished with value: 0.8236999999999999 and parameters: {'lr': 0.0040058518631209275, 'weight_decay': 0.0007446109387237407, 'dropout': 0.7671049054666589, 'patience': 80, 'lr_reduce_freq': 90, 'spt_alg': 'prim', 'spt_attr': 'edge_degree', 'manifold': 'PoincareBall', 'num_layers': 3, 'dim': 332, 'num_adj': 6, 'add_rate': 0.5325690845595034, 'tem': 1.0846865879531944, 'consis_rate': 1.5936857286897816, 'use_att': 1}. Best is trial 70 with value: 0.8281999999999998.[0m
[32m[I 2022-06-27 10:42:34,754][0m Trial 110 finished with value: 0.8042 and parameters: {'lr': 0.0037847573338941547, 'weight_decay': 0.0007423736331238157, 'dropout': 0.7652708315463914, 'patience': 80, 'lr_reduce_freq': 90, 'spt_alg': 'prim', 'spt_attr': 'edge_degree', 'manifold': 'Hyperboloid', 'num_layers': 3, 'dim': 332, 'num_adj': 6, 'add_rate': 0.5318714199530588, 'tem': 1.0563265354105422, 'consis_rate': 1.597803079381728, 'use_att': 0}. Best is trial 70 with value: 0.8281999999999998.[0m
[32m[I 2022-06-27 11:03:02,852][0m Trial 111 finished with value: 0.8222999999999999 and parameters: {'lr': 0.004141970836915939, 'weight_decay': 0.0007332423254850439, 'dropout': 0.7995674239735285, 'patience': 80, 'lr_reduce_freq': 90, 'spt_alg': 'prim', 'spt_attr': 'edge_degree', 'manifold': 'PoincareBall', 'num_layers': 3, 'dim': 336, 'num_adj': 6, 'add_rate': 0.5464239387864147, 'tem': 1.0848400400792682, 'consis_rate': 1.607292846141994, 'use_att': 1}. Best is trial 70 with value: 0.8281999999999998.[0m
[32m[I 2022-06-27 11:23:04,331][0m Trial 112 finished with value: 0.8234 and parameters: {'lr': 0.0042017805311886855, 'weight_decay': 0.0007293651655484964, 'dropout': 0.7998103380411101, 'patience': 80, 'lr_reduce_freq': 90, 'spt_alg': 'prim', 'spt_attr': 'edge_degree', 'manifold': 'PoincareBall', 'num_layers': 3, 'dim': 336, 'num_adj': 6, 'add_rate': 0.5443509586935615, 'tem': 1.064386765977708, 'consis_rate': 1.5685853302016048, 'use_att': 1}. Best is trial 70 with value: 0.8281999999999998.[0m
[32m[I 2022-06-27 11:41:58,387][0m Trial 113 finished with value: 0.8240999999999999 and parameters: {'lr': 0.004198116337079132, 'weight_decay': 0.0007301677050545977, 'dropout': 0.7957577403486908, 'patience': 80, 'lr_reduce_freq': 90, 'spt_alg': 'prim', 'spt_attr': 'edge_degree', 'manifold': 'PoincareBall', 'num_layers': 3, 'dim': 336, 'num_adj': 6, 'add_rate': 0.5441879656727886, 'tem': 1.0632671380938508, 'consis_rate': 1.5620803837653678, 'use_att': 1}. Best is trial 70 with value: 0.8281999999999998.[0m
[32m[I 2022-06-27 12:01:33,235][0m Trial 114 finished with value: 0.8238 and parameters: {'lr': 0.003943537734675201, 'weight_decay': 0.0007279535592274113, 'dropout': 0.7988391809201356, 'patience': 80, 'lr_reduce_freq': 90, 'spt_alg': 'prim', 'spt_attr': 'edge_degree', 'manifold': 'PoincareBall', 'num_layers': 3, 'dim': 336, 'num_adj': 6, 'add_rate': 0.5455805751785681, 'tem': 1.0599273010472128, 'consis_rate': 1.5682542759286702, 'use_att': 1}. Best is trial 70 with value: 0.8281999999999998.[0m
[32m[I 2022-06-27 12:21:36,235][0m Trial 115 finished with value: 0.8215 and parameters: {'lr': 0.0036007810047095695, 'weight_decay': 0.0007241567700606938, 'dropout': 0.7919249315545749, 'patience': 80, 'lr_reduce_freq': 90, 'spt_alg': 'prim', 'spt_attr': 'edge_degree', 'manifold': 'PoincareBall', 'num_layers': 3, 'dim': 332, 'num_adj': 6, 'add_rate': 0.5513501025389709, 'tem': 1.0295516012734645, 'consis_rate': 1.566207894077029, 'use_att': 1}. Best is trial 70 with value: 0.8281999999999998.[0m
[32m[I 2022-06-27 12:41:33,956][0m Trial 116 finished with value: 0.8229 and parameters: {'lr': 0.003913783916287036, 'weight_decay': 0.0007127000223790031, 'dropout': 0.7804782725967001, 'patience': 80, 'lr_reduce_freq': 90, 'spt_alg': 'prim', 'spt_attr': 'edge_degree', 'manifold': 'PoincareBall', 'num_layers': 3, 'dim': 336, 'num_adj': 6, 'add_rate': 0.5336685728456485, 'tem': 1.0607466824549674, 'consis_rate': 1.5914265123806204, 'use_att': 1}. Best is trial 70 with value: 0.8281999999999998.[0m
[32m[I 2022-06-27 13:01:30,153][0m Trial 117 finished with value: 0.8231999999999999 and parameters: {'lr': 0.004295164286688442, 'weight_decay': 0.0007049510899884854, 'dropout': 0.7814106542430155, 'patience': 80, 'lr_reduce_freq': 90, 'spt_alg': 'prim', 'spt_attr': 'edge_degree', 'manifold': 'PoincareBall', 'num_layers': 3, 'dim': 336, 'num_adj': 6, 'add_rate': 0.5595123330349555, 'tem': 1.0698916860279213, 'consis_rate': 1.5328425655889943, 'use_att': 1}. Best is trial 70 with value: 0.8281999999999998.[0m
[32m[I 2022-06-27 13:17:40,160][0m Trial 118 finished with value: 0.8209 and parameters: {'lr': 0.003472526700475991, 'weight_decay': 0.0007080169913690421, 'dropout': 0.7818551991180157, 'patience': 80, 'lr_reduce_freq': 90, 'spt_alg': 'prim', 'spt_attr': 'edge_degree', 'manifold': 'PoincareBall', 'num_layers': 3, 'dim': 332, 'num_adj': 6, 'add_rate': 0.5638507645936068, 'tem': 1.063059913598248, 'consis_rate': 1.52497416812186, 'use_att': 1}. Best is trial 70 with value: 0.8281999999999998.[0m
[32m[I 2022-06-27 13:27:27,535][0m Trial 119 finished with value: 0.8212999999999999 and parameters: {'lr': 0.004286269618362045, 'weight_decay': 0.0007253187361234593, 'dropout': 0.7796940619782472, 'patience': 80, 'lr_reduce_freq': 90, 'spt_alg': 'prim', 'spt_attr': 'edge_degree', 'manifold': 'PoincareBall', 'num_layers': 3, 'dim': 336, 'num_adj': 6, 'add_rate': 0.5574997496712781, 'tem': 1.04986400858842, 'consis_rate': 1.5738023420795124, 'use_att': 1}. Best is trial 70 with value: 0.8281999999999998.[0m
[32m[I 2022-06-27 13:37:17,130][0m Trial 120 finished with value: 0.8196999999999999 and parameters: {'lr': 0.0037502965847669087, 'weight_decay': 0.0007635877115172928, 'dropout': 0.7949695873039927, 'patience': 80, 'lr_reduce_freq': 90, 'spt_alg': 'prim', 'spt_attr': 'edge_degree', 'manifold': 'PoincareBall', 'num_layers': 3, 'dim': 332, 'num_adj': 6, 'add_rate': 0.5448853420689937, 'tem': 1.0159740760594314, 'consis_rate': 1.57920242439329, 'use_att': 1}. Best is trial 70 with value: 0.8281999999999998.[0m
[32m[I 2022-06-27 13:46:54,400][0m Trial 121 finished with value: 0.8219 and parameters: {'lr': 0.003929672609163554, 'weight_decay': 0.0006970252985824736, 'dropout': 0.7705069254878776, 'patience': 80, 'lr_reduce_freq': 90, 'spt_alg': 'prim', 'spt_attr': 'edge_degree', 'manifold': 'PoincareBall', 'num_layers': 3, 'dim': 336, 'num_adj': 6, 'add_rate': 0.5381656352792317, 'tem': 1.0397335593719985, 'consis_rate': 1.532446836404076, 'use_att': 1}. Best is trial 70 with value: 0.8281999999999998.[0m
[32m[I 2022-06-27 13:56:00,346][0m Trial 122 finished with value: 0.8202999999999999 and parameters: {'lr': 0.004486617884475087, 'weight_decay': 0.0006833988956974327, 'dropout': 0.7670696564449323, 'patience': 80, 'lr_reduce_freq': 90, 'spt_alg': 'prim', 'spt_attr': 'edge_degree', 'manifold': 'PoincareBall', 'num_layers': 3, 'dim': 336, 'num_adj': 6, 'add_rate': 0.5279319563657296, 'tem': 1.0520495008189577, 'consis_rate': 1.5889684516458205, 'use_att': 1}. Best is trial 70 with value: 0.8281999999999998.[0m
[32m[I 2022-06-27 14:05:44,669][0m Trial 123 finished with value: 0.8193999999999999 and parameters: {'lr': 0.004082382875580824, 'weight_decay': 0.0006467246942156871, 'dropout': 0.7834817809952416, 'patience': 80, 'lr_reduce_freq': 90, 'spt_alg': 'prim', 'spt_attr': 'edge_degree', 'manifold': 'PoincareBall', 'num_layers': 3, 'dim': 328, 'num_adj': 6, 'add_rate': 0.5356155313287825, 'tem': 1.0634752914100984, 'consis_rate': 1.6223840245562373, 'use_att': 1}. Best is trial 70 with value: 0.8281999999999998.[0m
[32m[I 2022-06-27 14:15:17,241][0m Trial 124 finished with value: 0.8176 and parameters: {'lr': 0.004359312667391386, 'weight_decay': 0.0007182117947532683, 'dropout': 0.777663651398981, 'patience': 80, 'lr_reduce_freq': 90, 'spt_alg': 'prim', 'spt_attr': 'edge_degree', 'manifold': 'PoincareBall', 'num_layers': 3, 'dim': 332, 'num_adj': 6, 'add_rate': 0.5814563163524105, 'tem': 1.0713398463067398, 'consis_rate': 1.592213114447826, 'use_att': 1}. Best is trial 70 with value: 0.8281999999999998.[0m
