[32m[I 2022-06-29 23:39:25,147][0m Trial 90 finished with value: 0.256 and parameters: {'lr': 0.0021053588578393554, 'weight_decay': 0.049993099811348224, 'dropout': 0.5939995541752867, 'patience': 80, 'lr_reduce_freq': 150, 'spt_alg': 'prim', 'spt_attr': 'similarity', 'manifold': 'PoincareBall', 'num_layers': 3, 'dim': 288, 'num_adj': 2, 'add_rate': 0.8535625821061832, 'tem': 1.4734295362335288, 'consis_rate': 1.7194421184303992, 'use_att': 1}. Best is trial 83 with value: 0.8199.[0m

mean: 0.8150000000000001
[0.826 0.82  0.809 0.803 0.824 0.814 0.812 0.811 0.813 0.818]
cur_param: {'lr': 0.0020105254005272372, 'weight_decay': 0.0008566740537123456, 'dropout': 0.4627825677454457, 'patience': 80, 'lr_reduce_freq': 150, 'spt_alg': 'prim', 'spt_attr': 'similarity', 'manifold': 'PoincareBall', 'num_layers': 3, 'dim': 464, 'num_adj': 2, 'add_rate': 0.7482642094992604, 'tem': 1.4590285123122904, 'consis_rate': 1.7633185830679345, 'use_att': 1}
mean: 0.8126
[0.802 0.819 0.817 0.815 0.805 0.809 0.806 0.803 0.825 0.825]
cur_param: {'lr': 0.0026065173148869408, 'weight_decay': 0.0006069800907016277, 'dropout': 0.5726151998446841, 'patience': 80, 'lr_reduce_freq': 140, 'spt_alg': 'prim', 'spt_attr': 'similarity', 'manifold': 'PoincareBall', 'num_layers': 3, 'dim': 464, 'num_adj': 2, 'add_rate': 0.7068265206179959, 'tem': 1.433296118369189, 'consis_rate': 1.8840192335056032, 'use_att': 1}
mean: 0.8183999999999999
[0.824 0.825 0.815 0.812 0.803 0.821 0.823 0.812 0.819 0.83 ]
cur_param: {'lr': 0.0025178424967946043, 'weight_decay': 0.0006074528791378818, 'dropout': 0.5751313809629315, 'patience': 80, 'lr_reduce_freq': 150, 'spt_alg': 'prim', 'spt_attr': 'similarity', 'manifold': 'PoincareBall', 'num_layers': 3, 'dim': 256, 'num_adj': 2, 'add_rate': 0.6829074842759448, 'tem': 1.3944796211071646, 'consis_rate': 1.9111876170673647, 'use_att': 1}
mean: 0.8151999999999999
[0.829 0.816 0.809 0.814 0.831 0.812 0.807 0.815 0.812 0.807]
cur_param: {'lr': 0.0013251694331942781, 'weight_decay': 0.0007346476664143707, 'dropout': 0.5712905359538701, 'patience': 80, 'lr_reduce_freq': 150, 'spt_alg': 'prim', 'spt_attr': 'similarity', 'manifold': 'PoincareBall', 'num_layers': 3, 'dim': 240, 'num_adj': 2, 'add_rate': 0.6854310038882083, 'tem': 1.411217627155559, 'consis_rate': 1.8968830804383554, 'use_att': 1}
mean: 0.8123999999999999
[0.822 0.822 0.803 0.8   0.829 0.797 0.815 0.81  0.814 0.812]
cur_param: {'lr': 0.002598774664403595, 'weight_decay': 0.0006553887151330283, 'dropout': 0.6013006535831837, 'patience': 80, 'lr_reduce_freq': 140, 'spt_alg': 'prim', 'spt_attr': 'similarity', 'manifold': 'PoincareBall', 'num_layers': 3, 'dim': 208, 'num_adj': 2, 'add_rate': 0.8539885127329154, 'tem': 1.3896516851600729, 'consis_rate': 1.9952232355678727, 'use_att': 1}
mean: 0.8181999999999998
[0.827 0.814 0.813 0.806 0.828 0.814 0.816 0.818 0.834 0.812]
cur_param: {'lr': 0.0026474785084720353, 'weight_decay': 0.000923381761334443, 'dropout': 0.5945852991308729, 'patience': 90, 'lr_reduce_freq': 140, 'spt_alg': 'prim', 'spt_attr': 'similarity', 'manifold': 'PoincareBall', 'num_layers': 3, 'dim': 208, 'num_adj': 2, 'add_rate': 0.8437506567830141, 'tem': 1.3709518459275685, 'consis_rate': 1.996802413990371, 'use_att': 1}
mean: 0.8134
[0.824 0.805 0.815 0.821 0.826 0.811 0.796 0.815 0.815 0.806]
cur_param: {'lr': 0.005809980988147605, 'weight_decay': 0.0006620897361306467, 'dropout': 0.575145651456829, 'patience': 80, 'lr_reduce_freq': 140, 'spt_alg': 'prim', 'spt_attr': 'similarity', 'manifold': 'PoincareBall', 'num_layers': 3, 'dim': 240, 'num_adj': 2, 'add_rate': 0.8118878083532945, 'tem': 1.4482776653897824, 'consis_rate': 1.88050196187601, 'use_att': 1}
mean: 0.8139
[0.825 0.802 0.802 0.817 0.82  0.815 0.806 0.816 0.815 0.821]
cur_param: {'lr': 0.0025989637754657837, 'weight_decay': 0.000597001959150635, 'dropout': 0.6000827250357987, 'patience': 80, 'lr_reduce_freq': 150, 'spt_alg': 'prim', 'spt_attr': 'similarity', 'manifold': 'PoincareBall', 'num_layers': 3, 'dim': 160, 'num_adj': 2, 'add_rate': 0.7006688373744366, 'tem': 1.3260204035038992, 'consis_rate': 1.935319332152303, 'use_att': 1}
mean: 0.8085000000000001
[0.799 0.807 0.813 0.81  0.812 0.798 0.811 0.816 0.814 0.805]
cur_param: {'lr': 0.0017483565492736545, 'weight_decay': 0.0007614023867033226, 'dropout': 0.5587117167825039, 'patience': 80, 'lr_reduce_freq': 150, 'spt_alg': 'prim', 'spt_attr': 'similarity', 'manifold': 'PoincareBall', 'num_layers': 3, 'dim': 272, 'num_adj': 2, 'add_rate': 0.6460690117614035, 'tem': 1.4095387221143065, 'consis_rate': 1.724923425416547, 'use_att': 1}
mean: 0.8173
[0.824 0.814 0.809 0.818 0.812 0.823 0.826 0.81  0.819 0.818]
cur_param: {'lr': 0.001533275739418226, 'weight_decay': 0.0008260707822499624, 'dropout': 0.5617600569511542, 'patience': 80, 'lr_reduce_freq': 140, 'spt_alg': 'prim', 'spt_attr': 'similarity', 'manifold': 'PoincareBall', 'num_layers': 3, 'dim': 256, 'num_adj': 2, 'add_rate': 0.8571040905602713, 'tem': 1.3887018621620715, 'consis_rate': 1.6579633246073753, 'use_att': 1}
mean: 0.8199
[0.82  0.818 0.818 0.816 0.822 0.831 0.831 0.816 0.814 0.813]
cur_param: {'lr': 0.0014676625862330268, 'weight_decay': 0.0008037240874601136, 'dropout': 0.5201787396639989, 'patience': 80, 'lr_reduce_freq': 140, 'spt_alg': 'prim', 'spt_attr': 'similarity', 'manifold': 'PoincareBall', 'num_layers': 3, 'dim': 288, 'num_adj': 2, 'add_rate': 0.8608600250525498, 'tem': 1.3096041279226385, 'consis_rate': 1.56602518381138, 'use_att': 1}
mean: 0.8167
[0.81  0.828 0.822 0.823 0.814 0.824 0.797 0.819 0.811 0.819]
cur_param: {'lr': 0.0012743639826193907, 'weight_decay': 0.0010234442119594269, 'dropout': 0.5580751586877781, 'patience': 90, 'lr_reduce_freq': 140, 'spt_alg': 'prim', 'spt_attr': 'similarity', 'manifold': 'PoincareBall', 'num_layers': 3, 'dim': 272, 'num_adj': 2, 'add_rate': 0.8639994528270705, 'tem': 1.3093574986439047, 'consis_rate': 1.619695520609154, 'use_att': 1}
mean: 0.812
[0.82  0.821 0.81  0.8   0.812 0.818 0.817 0.81  0.822 0.79 ]
cur_param: {'lr': 0.0018609121821473692, 'weight_decay': 0.000859469271808862, 'dropout': 0.5568104435030146, 'patience': 80, 'lr_reduce_freq': 140, 'spt_alg': 'prim', 'spt_attr': 'similarity', 'manifold': 'PoincareBall', 'num_layers': 3, 'dim': 304, 'num_adj': 2, 'add_rate': 0.8989711284938282, 'tem': 1.3463593096523636, 'consis_rate': 1.715488369262321, 'use_att': 1}
mean: 0.8156000000000001
[0.835 0.814 0.815 0.817 0.812 0.809 0.827 0.805 0.807 0.815]
cur_param: {'lr': 0.0014170769064792282, 'weight_decay': 0.0008282137936666686, 'dropout': 0.5161660110086441, 'patience': 80, 'lr_reduce_freq': 130, 'spt_alg': 'prim', 'spt_attr': 'similarity', 'manifold': 'PoincareBall', 'num_layers': 5, 'dim': 288, 'num_adj': 2, 'add_rate': 0.805045834547998, 'tem': 1.3795094700719772, 'consis_rate': 1.6442391707873574, 'use_att': 1}
mean: 0.7612
[0.777 0.733 0.781 0.767 0.777 0.726 0.792 0.738 0.772 0.749]
cur_param: {'lr': 0.0010090095961966775, 'weight_decay': 0.0007625986488183152, 'dropout': 0.5251972993374519, 'patience': 80, 'lr_reduce_freq': 130, 'spt_alg': 'prim', 'spt_attr': 'similarity', 'manifold': 'PoincareBall', 'num_layers': 3, 'dim': 224, 'num_adj': 2, 'add_rate': 0.6531133734948253, 'tem': 1.436819928032174, 'consis_rate': 1.8535413555476694, 'use_att': 1}
mean: 0.8143
[0.817 0.821 0.826 0.817 0.81  0.802 0.795 0.813 0.823 0.819]
cur_param: {'lr': 0.0017066080666066977, 'weight_decay': 0.010767149358506527, 'dropout': 0.6352981144687356, 'patience': 90, 'lr_reduce_freq': 140, 'spt_alg': 'prim', 'spt_attr': 'similarity', 'manifold': 'PoincareBall', 'num_layers': 3, 'dim': 256, 'num_adj': 2, 'add_rate': 0.8733188793696542, 'tem': 1.496205836146931, 'consis_rate': 1.9591260208184984, 'use_att': 1}
mean: 0.30480000000000007
[0.343 0.321 0.319 0.326 0.382 0.152 0.366 0.319 0.2   0.32 ]
cur_param: {'lr': 0.0021053588578393554, 'weight_decay': 0.049993099811348224, 'dropout': 0.5939995541752867, 'patience': 80, 'lr_reduce_freq': 150, 'spt_alg': 'prim', 'spt_attr': 'similarity', 'manifold': 'PoincareBall', 'num_layers': 3, 'dim': 288, 'num_adj': 2, 'add_rate': 0.8535625821061832, 'tem': 1.4734295362335288, 'consis_rate': 1.7194421184303992, 'use_att': 1}
mean: 0.256
[0.13  0.161 0.319 0.13  0.319 0.319 0.16  0.357 0.346 0.319]
cur_param: {'lr': 0.0016946039063563774, 'weight_decay': 0.0008974085949948375, 'dropout': 0.5545733382799088, 'patience': 80, 'lr_reduce_freq': 140, 'spt_alg': 'prim', 'spt_attr': 'similarity', 'manifold': 'PoincareBall', 'num_layers': 3, 'dim': 304, 'num_adj': 2, 'add_rate': 0.8895315892170601, 'tem': 1.3449147364464664, 'consis_rate': 1.7015799332035908, 'use_att': 1}
mean: 0.8108000000000001
[0.826 0.795 0.82  0.824 0.802 0.81  0.801 0.799 0.817 0.814][32m[I 2022-06-29 23:53:28,833][0m Trial 91 finished with value: 0.8108000000000001 and parameters: {'lr': 0.0016946039063563774, 'weight_decay': 0.0008974085949948375, 'dropout': 0.5545733382799088, 'patience': 80, 'lr_reduce_freq': 140, 'spt_alg': 'prim', 'spt_attr': 'similarity', 'manifold': 'PoincareBall', 'num_layers': 3, 'dim': 304, 'num_adj': 2, 'add_rate': 0.8895315892170601, 'tem': 1.3449147364464664, 'consis_rate': 1.7015799332035908, 'use_att': 1}. Best is trial 83 with value: 0.8199.[0m
[32m[I 2022-06-30 00:07:44,871][0m Trial 92 finished with value: 0.8137000000000001 and parameters: {'lr': 0.001089336892116681, 'weight_decay': 0.0007956570063479738, 'dropout': 0.48832437006879115, 'patience': 80, 'lr_reduce_freq': 140, 'spt_alg': 'prim', 'spt_attr': 'similarity', 'manifold': 'PoincareBall', 'num_layers': 3, 'dim': 304, 'num_adj': 2, 'add_rate': 0.838877177759702, 'tem': 1.2604216715992278, 'consis_rate': 1.542497052797626, 'use_att': 1}. Best is trial 83 with value: 0.8199.[0m
[32m[I 2022-06-30 00:24:38,293][0m Trial 93 finished with value: 0.8155999999999999 and parameters: {'lr': 0.0008228236043698944, 'weight_decay': 0.0010030307220737318, 'dropout': 0.5662553215944257, 'patience': 80, 'lr_reduce_freq': 140, 'spt_alg': 'prim', 'spt_attr': 'similarity', 'manifold': 'PoincareBall', 'num_layers': 3, 'dim': 320, 'num_adj': 2, 'add_rate': 0.897932142762309, 'tem': 1.3425455306785548, 'consis_rate': 1.832217111360621, 'use_att': 1}. Best is trial 83 with value: 0.8199.[0m
[32m[I 2022-06-30 00:36:04,892][0m Trial 94 finished with value: 0.8183 and parameters: {'lr': 0.002896696806149704, 'weight_decay': 0.0006432370550661842, 'dropout': 0.6132618338919282, 'patience': 80, 'lr_reduce_freq': 130, 'spt_alg': 'prim', 'spt_attr': 'similarity', 'manifold': 'PoincareBall', 'num_layers': 3, 'dim': 192, 'num_adj': 2, 'add_rate': 0.7970176778867717, 'tem': 1.293921788659911, 'consis_rate': 1.6664897519040713, 'use_att': 1}. Best is trial 83 with value: 0.8199.[0m
[32m[I 2022-06-30 00:48:26,114][0m Trial 95 finished with value: 0.812 and parameters: {'lr': 0.0027054066641072983, 'weight_decay': 0.0005523965549370386, 'dropout': 0.6159645056470975, 'patience': 80, 'lr_reduce_freq': 130, 'spt_alg': 'prim', 'spt_attr': 'similarity', 'manifold': 'PoincareBall', 'num_layers': 3, 'dim': 144, 'num_adj': 2, 'add_rate': 0.7951334537289189, 'tem': 1.3022535887395772, 'consis_rate': 1.6618796024250586, 'use_att': 1}. Best is trial 83 with value: 0.8199.[0m
[32m[I 2022-06-30 00:58:47,392][0m Trial 96 finished with value: 0.8106 and parameters: {'lr': 0.003651832955218815, 'weight_decay': 0.0006456369413879716, 'dropout': 0.5280887836716768, 'patience': 80, 'lr_reduce_freq': 130, 'spt_alg': 'prim', 'spt_attr': 'similarity', 'manifold': 'PoincareBall', 'num_layers': 3, 'dim': 192, 'num_adj': 2, 'add_rate': 0.8251135667665103, 'tem': 1.3828479041219748, 'consis_rate': 1.5983295585732529, 'use_att': 1}. Best is trial 83 with value: 0.8199.[0m
[32m[I 2022-06-30 01:14:10,820][0m Trial 97 finished with value: 0.8083 and parameters: {'lr': 0.0015609812251428069, 'weight_decay': 0.0011244800904541274, 'dropout': 0.5874762193594688, 'patience': 80, 'lr_reduce_freq': 130, 'spt_alg': 'prim', 'spt_attr': 'similarity', 'manifold': 'PoincareBall', 'num_layers': 3, 'dim': 176, 'num_adj': 2, 'add_rate': 0.7290288909381175, 'tem': 1.1580180578769894, 'consis_rate': 1.7381979912273549, 'use_att': 1}. Best is trial 83 with value: 0.8199.[0m
[32m[I 2022-06-30 01:24:30,795][0m Trial 98 finished with value: 0.8032999999999999 and parameters: {'lr': 0.006232818452317778, 'weight_decay': 0.00075786373555178, 'dropout': 0.4773145440378616, 'patience': 90, 'lr_reduce_freq': 150, 'spt_alg': 'prim', 'spt_attr': 'similarity', 'manifold': 'PoincareBall', 'num_layers': 3, 'dim': 208, 'num_adj': 2, 'add_rate': 0.8600533865332809, 'tem': 1.4238026454757753, 'consis_rate': 1.5641605778058003, 'use_att': 1}. Best is trial 83 with value: 0.8199.[0m
[32m[I 2022-06-30 01:35:05,490][0m Trial 99 finished with value: 0.8139 and parameters: {'lr': 0.00289155982934356, 'weight_decay': 0.0005505412518853934, 'dropout': 0.518560778691614, 'patience': 80, 'lr_reduce_freq': 120, 'spt_alg': 'prim', 'spt_attr': 'similarity', 'manifold': 'PoincareBall', 'num_layers': 3, 'dim': 272, 'num_adj': 2, 'add_rate': 0.7915553719187955, 'tem': 1.2502573221146296, 'consis_rate': 1.8632190260294768, 'use_att': 1}. Best is trial 83 with value: 0.8199.[0m
[32m[I 2022-06-30 01:45:03,483][0m Trial 100 finished with value: 0.8152999999999999 and parameters: {'lr': 0.0022093873141229062, 'weight_decay': 0.0006637516803567867, 'dropout': 0.43865201264385184, 'patience': 70, 'lr_reduce_freq': 140, 'spt_alg': 'prim', 'spt_attr': 'similarity', 'manifold': 'PoincareBall', 'num_layers': 3, 'dim': 256, 'num_adj': 2, 'add_rate': 0.708159451830604, 'tem': 1.2861144388307442, 'consis_rate': 1.806923210721215, 'use_att': 1}. Best is trial 83 with value: 0.8199.[0m
[32m[I 2022-06-30 01:58:57,396][0m Trial 101 finished with value: 0.8158 and parameters: {'lr': 0.001988977075703759, 'weight_decay': 0.0008775558925820921, 'dropout': 0.6072397232613067, 'patience': 80, 'lr_reduce_freq': 140, 'spt_alg': 'prim', 'spt_attr': 'similarity', 'manifold': 'PoincareBall', 'num_layers': 3, 'dim': 192, 'num_adj': 2, 'add_rate': 0.8798081076526026, 'tem': 1.36382749019812, 'consis_rate': 1.7024455754932044, 'use_att': 1}. Best is trial 83 with value: 0.8199.[0m
[32m[I 2022-06-30 02:12:39,053][0m Trial 102 finished with value: 0.8103999999999999 and parameters: {'lr': 0.001853746130695077, 'weight_decay': 0.0007062280182340251, 'dropout': 0.6359577323421501, 'patience': 80, 'lr_reduce_freq': 140, 'spt_alg': 'prim', 'spt_attr': 'similarity', 'manifold': 'PoincareBall', 'num_layers': 3, 'dim': 192, 'num_adj': 2, 'add_rate': 0.8194680533208938, 'tem': 1.4041984333669435, 'consis_rate': 1.6512681647363288, 'use_att': 1}. Best is trial 83 with value: 0.8199.[0m
[32m[I 2022-06-30 02:26:34,793][0m Trial 103 finished with value: 0.8115 and parameters: {'lr': 0.003970503043707464, 'weight_decay': 0.00095363023489133, 'dropout': 0.6517095349965129, 'patience': 80, 'lr_reduce_freq': 150, 'spt_alg': 'prim', 'spt_attr': 'similarity', 'manifold': 'PoincareBall', 'num_layers': 3, 'dim': 176, 'num_adj': 2, 'add_rate': 0.876626721628379, 'tem': 1.3215665563223127, 'consis_rate': 1.6855345748520973, 'use_att': 1}. Best is trial 83 with value: 0.8199.[0m
[32m[I 2022-06-30 02:37:53,337][0m Trial 104 finished with value: 0.8128 and parameters: {'lr': 0.002813337466102115, 'weight_decay': 0.0006363911832250772, 'dropout': 0.6065406734126995, 'patience': 80, 'lr_reduce_freq': 130, 'spt_alg': 'prim', 'spt_attr': 'similarity', 'manifold': 'PoincareBall', 'num_layers': 3, 'dim': 224, 'num_adj': 2, 'add_rate': 0.8449580079582512, 'tem': 1.3591565648316524, 'consis_rate': 1.621656311800635, 'use_att': 1}. Best is trial 83 with value: 0.8199.[0m
[32m[I 2022-06-30 03:09:10,142][0m Trial 105 finished with value: 0.7758 and parameters: {'lr': 0.001528283177975937, 'weight_decay': 0.0005485945845883841, 'dropout': 0.5791551873934324, 'patience': 80, 'lr_reduce_freq': 140, 'spt_alg': 'prim', 'spt_attr': 'similarity', 'manifold': 'PoincareBall', 'num_layers': 5, 'dim': 208, 'num_adj': 2, 'add_rate': 0.6634869909504408, 'tem': 1.3014309848672252, 'consis_rate': 1.9543198556927395, 'use_att': 1}. Best is trial 83 with value: 0.8199.[0m
[32m[I 2022-06-30 03:19:57,479][0m Trial 106 finished with value: 0.8068 and parameters: {'lr': 0.003629102255648232, 'weight_decay': 0.0008207902328034003, 'dropout': 0.5455165339248571, 'patience': 80, 'lr_reduce_freq': 130, 'spt_alg': 'prim', 'spt_attr': 'similarity', 'manifold': 'PoincareBall', 'num_layers': 3, 'dim': 224, 'num_adj': 2, 'add_rate': 0.8131993681374142, 'tem': 1.4673356907225223, 'consis_rate': 1.7455003852888173, 'use_att': 1}. Best is trial 83 with value: 0.8199.[0m
[32m[I 2022-06-30 03:36:15,858][0m Trial 107 finished with value: 0.817 and parameters: {'lr': 0.0011979660411160853, 'weight_decay': 0.0007305096316914827, 'dropout': 0.6085773403590963, 'patience': 80, 'lr_reduce_freq': 120, 'spt_alg': 'prim', 'spt_attr': 'similarity', 'manifold': 'PoincareBall', 'num_layers': 3, 'dim': 176, 'num_adj': 2, 'add_rate': 0.752217594405718, 'tem': 1.4406685226632387, 'consis_rate': 1.5227196792861015, 'use_att': 1}. Best is trial 83 with value: 0.8199.[0m
[32m[I 2022-06-30 03:55:47,959][0m Trial 108 finished with value: 0.8078 and parameters: {'lr': 0.0006478191043815291, 'weight_decay': 0.0007340278341022544, 'dropout': 0.4022117286556513, 'patience': 80, 'lr_reduce_freq': 120, 'spt_alg': 'prim', 'spt_attr': 'similarity', 'manifold': 'PoincareBall', 'num_layers': 3, 'dim': 160, 'num_adj': 2, 'add_rate': 0.7458035761532704, 'tem': 1.433820699224778, 'consis_rate': 1.4504004547505553, 'use_att': 1}. Best is trial 83 with value: 0.8199.[0m
