[32m[I 2022-06-30 03:20:01,058][0m Trial 72 finished with value: 0.8125 and parameters: {'lr': 0.023082960575895817, 'weight_decay': 0.00277490061342955, 'dropout': 0.749112701692354, 'patience': 80, 'lr_reduce_freq': 30, 'spt_alg': 'prim', 'spt_attr': 'similarity', 'manifold': 'PoincareBall', 'num_layers': 3, 'dim': 464, 'num_adj': 4, 'add_rate': 0.6162895539293451, 'tem': 1.3470723652747356, 'consis_rate': 1.2190285560755805, 'use_att': 1}. Best is trial 59 with value: 0.8209.[0m

mean: 0.8142000000000001
[0.827 0.814 0.808 0.815 0.823 0.822 0.799 0.81  0.808 0.816]
cur_param: {'lr': 0.02408650740295233, 'weight_decay': 0.003057663094974801, 'dropout': 0.739064643167151, 'patience': 80, 'lr_reduce_freq': 30, 'spt_alg': 'prim', 'spt_attr': 'similarity', 'manifold': 'PoincareBall', 'num_layers': 3, 'dim': 464, 'num_adj': 4, 'add_rate': 0.49089649668185487, 'tem': 1.3046946193318512, 'consis_rate': 1.3991789223399314, 'use_att': 1}
mean: 0.8149999999999998
[0.821 0.812 0.802 0.815 0.813 0.815 0.815 0.808 0.824 0.825]
cur_param: {'lr': 0.02503113427276036, 'weight_decay': 0.004973123677308606, 'dropout': 0.7364884458658011, 'patience': 90, 'lr_reduce_freq': 30, 'spt_alg': 'prim', 'spt_attr': 'similarity', 'manifold': 'PoincareBall', 'num_layers': 5, 'dim': 448, 'num_adj': 4, 'add_rate': 0.5287014336694602, 'tem': 1.4462118315178702, 'consis_rate': 1.3905431333714844, 'use_att': 0}
mean: 0.42780000000000007
[0.336 0.552 0.487 0.319 0.364 0.417 0.44  0.525 0.319 0.519]
cur_param: {'lr': 0.01674167825630451, 'weight_decay': 0.002790374436653458, 'dropout': 0.6959328040796888, 'patience': 80, 'lr_reduce_freq': 50, 'spt_alg': 'prim', 'spt_attr': 'similarity', 'manifold': 'PoincareBall', 'num_layers': 3, 'dim': 480, 'num_adj': 4, 'add_rate': 0.4732673401590974, 'tem': 1.2076626707707052, 'consis_rate': 1.2995490255847748, 'use_att': 1}
mean: 0.8161999999999999
[0.826 0.796 0.826 0.808 0.818 0.824 0.812 0.818 0.817 0.817]
cur_param: {'lr': 0.01674869292188655, 'weight_decay': 0.0028167891353616135, 'dropout': 0.757489084520037, 'patience': 90, 'lr_reduce_freq': 50, 'spt_alg': 'prim', 'spt_attr': 'similarity', 'manifold': 'PoincareBall', 'num_layers': 3, 'dim': 480, 'num_adj': 4, 'add_rate': 0.624344731496036, 'tem': 1.3159627334446486, 'consis_rate': 1.2720565148822467, 'use_att': 1}
mean: 0.8209
[0.83  0.812 0.807 0.819 0.811 0.821 0.828 0.823 0.836 0.822]
cur_param: {'lr': 0.02938008928422968, 'weight_decay': 0.004801356703931924, 'dropout': 0.756824553143432, 'patience': 90, 'lr_reduce_freq': 50, 'spt_alg': 'prim', 'spt_attr': 'similarity', 'manifold': 'Hyperboloid', 'num_layers': 3, 'dim': 512, 'num_adj': 4, 'add_rate': 0.6277851347828547, 'tem': 1.3162749368567102, 'consis_rate': 1.2649643225326885, 'use_att': 1}
mean: 0.7963
[0.794 0.799 0.798 0.792 0.805 0.82  0.786 0.786 0.782 0.801]
cur_param: {'lr': 0.015923703816722208, 'weight_decay': 0.0026780311704446276, 'dropout': 0.6996789609248761, 'patience': 80, 'lr_reduce_freq': 40, 'spt_alg': 'prim', 'spt_attr': 'similarity', 'manifold': 'PoincareBall', 'num_layers': 3, 'dim': 480, 'num_adj': 4, 'add_rate': 0.4696524841126154, 'tem': 1.1988999648998122, 'consis_rate': 1.3678105015789268, 'use_att': 1}
mean: 0.8122
[0.831 0.789 0.799 0.802 0.81  0.83  0.812 0.824 0.811 0.814]
cur_param: {'lr': 0.020377029473970684, 'weight_decay': 0.0020007949565469052, 'dropout': 0.7248276778108906, 'patience': 80, 'lr_reduce_freq': 60, 'spt_alg': 'prim', 'spt_attr': 'similarity', 'manifold': 'PoincareBall', 'num_layers': 3, 'dim': 480, 'num_adj': 4, 'add_rate': 0.4932908831041816, 'tem': 1.3130404361438552, 'consis_rate': 1.2916412586079087, 'use_att': 1}
mean: 0.8143
[0.818 0.812 0.818 0.812 0.84  0.831 0.808 0.799 0.801 0.804]
cur_param: {'lr': 0.017323764298463277, 'weight_decay': 0.0026068140904082094, 'dropout': 0.7742647076711846, 'patience': 90, 'lr_reduce_freq': 40, 'spt_alg': 'prim', 'spt_attr': 'similarity', 'manifold': 'PoincareBall', 'num_layers': 3, 'dim': 448, 'num_adj': 4, 'add_rate': 0.5664865574160566, 'tem': 1.411768913912723, 'consis_rate': 1.1049663597720951, 'use_att': 1}
mean: 0.817
[0.815 0.803 0.807 0.811 0.813 0.837 0.829 0.814 0.826 0.815]
cur_param: {'lr': 0.017872380008902303, 'weight_decay': 0.0037956361448440675, 'dropout': 0.7603553090962609, 'patience': 90, 'lr_reduce_freq': 50, 'spt_alg': 'prim', 'spt_attr': 'similarity', 'manifold': 'PoincareBall', 'num_layers': 3, 'dim': 496, 'num_adj': 4, 'add_rate': 0.6449221167297949, 'tem': 1.4183231174715705, 'consis_rate': 1.0623503928449596, 'use_att': 1}
mean: 0.8192999999999999
[0.819 0.823 0.825 0.826 0.815 0.814 0.826 0.833 0.793 0.819]
cur_param: {'lr': 0.009048448345528771, 'weight_decay': 0.0038132703572175074, 'dropout': 0.7699344564246827, 'patience': 90, 'lr_reduce_freq': 50, 'spt_alg': 'prim', 'spt_attr': 'similarity', 'manifold': 'PoincareBall', 'num_layers': 3, 'dim': 496, 'num_adj': 4, 'add_rate': 0.645716028466522, 'tem': 1.3868709782686246, 'consis_rate': 1.1002763867965806, 'use_att': 1}
mean: 0.8084
[0.827 0.814 0.798 0.808 0.791 0.826 0.809 0.802 0.787 0.822]
cur_param: {'lr': 0.016582242387595234, 'weight_decay': 0.002347717536153769, 'dropout': 0.7238409021925464, 'patience': 90, 'lr_reduce_freq': 70, 'spt_alg': 'prim', 'spt_attr': 'similarity', 'manifold': 'PoincareBall', 'num_layers': 3, 'dim': 432, 'num_adj': 4, 'add_rate': 0.5762948659850294, 'tem': 1.444187891979646, 'consis_rate': 1.0726099974878731, 'use_att': 1}
mean: 0.8091000000000002
[0.82  0.794 0.796 0.803 0.822 0.811 0.8   0.823 0.812 0.81 ]
cur_param: {'lr': 0.047452996311190536, 'weight_decay': 0.005509210457458084, 'dropout': 0.6297878221491151, 'patience': 90, 'lr_reduce_freq': 60, 'spt_alg': 'prim', 'spt_attr': 'similarity', 'manifold': 'PoincareBall', 'num_layers': 3, 'dim': 480, 'num_adj': 4, 'add_rate': 0.7330577455944755, 'tem': 1.349847383323018, 'consis_rate': 0.9823516536263645, 'use_att': 1}
mean: 0.8133000000000001
[0.805 0.824 0.825 0.812 0.81  0.82  0.81  0.816 0.8   0.811]
cur_param: {'lr': 0.022412752064366867, 'weight_decay': 0.004464625053623242, 'dropout': 0.7690624850630843, 'patience': 100, 'lr_reduce_freq': 40, 'spt_alg': 'prim', 'spt_attr': 'similarity', 'manifold': 'PoincareBall', 'num_layers': 5, 'dim': 512, 'num_adj': 4, 'add_rate': 0.5865874179151811, 'tem': 1.1876670116038508, 'consis_rate': 1.1512238089419438, 'use_att': 1}
mean: 0.319
[0.319 0.319 0.319 0.319 0.319 0.319 0.319 0.319 0.319 0.319]
cur_param: {'lr': 0.01046376027693517, 'weight_decay': 0.007746049676587317, 'dropout': 0.660502731411717, 'patience': 90, 'lr_reduce_freq': 50, 'spt_alg': 'prim', 'spt_attr': 'similarity', 'manifold': 'PoincareBall', 'num_layers': 4, 'dim': 496, 'num_adj': 4, 'add_rate': 0.6645603816247131, 'tem': 1.4187447710228502, 'consis_rate': 0.9259156140608511, 'use_att': 0}
mean: 0.29850000000000004
[0.271 0.281 0.221 0.304 0.319 0.318 0.316 0.319 0.317 0.319]
cur_param: {'lr': 0.03132877296949507, 'weight_decay': 0.0036603994570277164, 'dropout': 0.71198791330523, 'patience': 100, 'lr_reduce_freq': 50, 'spt_alg': 'prim', 'spt_attr': 'similarity', 'manifold': 'PoincareBall', 'num_layers': 3, 'dim': 432, 'num_adj': 4, 'add_rate': 0.7156880058475739, 'tem': 1.4766177892793932, 'consis_rate': 1.259966324260374, 'use_att': 1}
mean: 0.8133999999999999
[0.819 0.803 0.807 0.807 0.813 0.825 0.805 0.816 0.817 0.822]
cur_param: {'lr': 0.017543085005036638, 'weight_decay': 0.002322687228495534, 'dropout': 0.7363037376567759, 'patience': 90, 'lr_reduce_freq': 40, 'spt_alg': 'prim', 'spt_attr': 'similarity', 'manifold': 'PoincareBall', 'num_layers': 3, 'dim': 464, 'num_adj': 4, 'add_rate': 0.5266896182507319, 'tem': 1.2932597284662, 'consis_rate': 1.4324500544547698, 'use_att': 1}
mean: 0.8135999999999999
[0.818 0.833 0.794 0.838 0.795 0.823 0.812 0.82  0.812 0.791]
cur_param: {'lr': 0.023082960575895817, 'weight_decay': 0.00277490061342955, 'dropout': 0.749112701692354, 'patience': 80, 'lr_reduce_freq': 30, 'spt_alg': 'prim', 'spt_attr': 'similarity', 'manifold': 'PoincareBall', 'num_layers': 3, 'dim': 464, 'num_adj': 4, 'add_rate': 0.6162895539293451, 'tem': 1.3470723652747356, 'consis_rate': 1.2190285560755805, 'use_att': 1}
mean: 0.8125
[0.818 0.796 0.811 0.823 0.82  0.812 0.814 0.8   0.819 0.812]
cur_param: {'lr': 0.02874488280824814, 'weight_decay': 0.003700187657115404, 'dropout': 0.7706647820037319, 'patience': 80, 'lr_reduce_freq': 40, 'spt_alg': 'prim', 'spt_attr': 'similarity', 'manifold': 'PoincareBall', 'num_layers': 3, 'dim': 448, 'num_adj': 4, 'add_rate': 0.559402307831184, 'tem': 1.1992334997969463, 'consis_rate': 1.1518587902382103, 'use_att': 1}
mean: 0.8175999999999999
[0.81  0.808 0.819 0.816 0.814 0.819 0.826 0.824 0.831 0.809][32m[I 2022-06-30 03:38:30,380][0m Trial 73 finished with value: 0.8175999999999999 and parameters: {'lr': 0.02874488280824814, 'weight_decay': 0.003700187657115404, 'dropout': 0.7706647820037319, 'patience': 80, 'lr_reduce_freq': 40, 'spt_alg': 'prim', 'spt_attr': 'similarity', 'manifold': 'PoincareBall', 'num_layers': 3, 'dim': 448, 'num_adj': 4, 'add_rate': 0.559402307831184, 'tem': 1.1992334997969463, 'consis_rate': 1.1518587902382103, 'use_att': 1}. Best is trial 59 with value: 0.8209.[0m
[32m[I 2022-06-30 03:54:19,203][0m Trial 74 finished with value: 0.8043000000000001 and parameters: {'lr': 0.008015902076258099, 'weight_decay': 0.0035149145810875124, 'dropout': 0.7689227140300381, 'patience': 90, 'lr_reduce_freq': 40, 'spt_alg': 'prim', 'spt_attr': 'similarity', 'manifold': 'PoincareBall', 'num_layers': 3, 'dim': 400, 'num_adj': 4, 'add_rate': 0.5580558673820377, 'tem': 1.2037961686491374, 'consis_rate': 1.1310671124811857, 'use_att': 1}. Best is trial 59 with value: 0.8209.[0m
[32m[I 2022-06-30 04:10:52,938][0m Trial 75 finished with value: 0.8070999999999999 and parameters: {'lr': 0.03852682741594721, 'weight_decay': 0.0015439322860374201, 'dropout': 0.7775931496096605, 'patience': 80, 'lr_reduce_freq': 70, 'spt_alg': 'prim', 'spt_attr': 'similarity', 'manifold': 'PoincareBall', 'num_layers': 3, 'dim': 448, 'num_adj': 4, 'add_rate': 0.5473237132974021, 'tem': 1.1585045624408812, 'consis_rate': 1.035127959827404, 'use_att': 1}. Best is trial 59 with value: 0.8209.[0m
[32m[I 2022-06-30 04:32:44,236][0m Trial 76 finished with value: 0.8122 and parameters: {'lr': 0.028317645243528193, 'weight_decay': 0.005971818393052656, 'dropout': 0.7964971755384876, 'patience': 90, 'lr_reduce_freq': 50, 'spt_alg': 'prim', 'spt_attr': 'similarity', 'manifold': 'PoincareBall', 'num_layers': 3, 'dim': 496, 'num_adj': 4, 'add_rate': 0.6074699966197521, 'tem': 1.3590144916242604, 'consis_rate': 1.5811842352772945, 'use_att': 1}. Best is trial 59 with value: 0.8209.[0m
[32m[I 2022-06-30 04:50:21,832][0m Trial 77 finished with value: 0.8183999999999999 and parameters: {'lr': 0.016182297744489336, 'weight_decay': 0.004207608750159214, 'dropout': 0.7547897020800047, 'patience': 80, 'lr_reduce_freq': 40, 'spt_alg': 'prim', 'spt_attr': 'similarity', 'manifold': 'PoincareBall', 'num_layers': 3, 'dim': 400, 'num_adj': 4, 'add_rate': 0.7561011278331707, 'tem': 1.2206251441097253, 'consis_rate': 0.8523837552910098, 'use_att': 1}. Best is trial 59 with value: 0.8209.[0m
[32m[I 2022-06-30 05:15:29,519][0m Trial 78 finished with value: 0.797 and parameters: {'lr': 0.015727902063323335, 'weight_decay': 0.0026265248499356287, 'dropout': 0.6839624411922951, 'patience': 100, 'lr_reduce_freq': 60, 'spt_alg': 'prim', 'spt_attr': 'similarity', 'manifold': 'Hyperboloid', 'num_layers': 3, 'dim': 480, 'num_adj': 4, 'add_rate': 0.8014575515610068, 'tem': 1.1088430333246009, 'consis_rate': 0.7949608958676442, 'use_att': 1}. Best is trial 59 with value: 0.8209.[0m
[32m[I 2022-06-30 05:26:46,939][0m Trial 79 finished with value: 0.8199 and parameters: {'lr': 0.01981347292297427, 'weight_decay': 0.004448936336915827, 'dropout': 0.7085085617546341, 'patience': 90, 'lr_reduce_freq': 40, 'spt_alg': 'prim', 'spt_attr': 'similarity', 'manifold': 'PoincareBall', 'num_layers': 3, 'dim': 448, 'num_adj': 2, 'add_rate': 0.7303848089822148, 'tem': 1.1748392309765456, 'consis_rate': 0.8627541674959577, 'use_att': 1}. Best is trial 59 with value: 0.8209.[0m
[32m[I 2022-06-30 05:41:26,155][0m Trial 80 finished with value: 0.8074 and parameters: {'lr': 0.09488331528921808, 'weight_decay': 0.00441916915265639, 'dropout': 0.7516064875602857, 'patience': 90, 'lr_reduce_freq': 40, 'spt_alg': 'prim', 'spt_attr': 'similarity', 'manifold': 'PoincareBall', 'num_layers': 3, 'dim': 448, 'num_adj': 2, 'add_rate': 0.7516655599590496, 'tem': 1.403536918597184, 'consis_rate': 0.7142399738538263, 'use_att': 1}. Best is trial 59 with value: 0.8209.[0m
[32m[I 2022-06-30 05:54:19,359][0m Trial 81 finished with value: 0.8105 and parameters: {'lr': 0.020729973538651594, 'weight_decay': 0.004254059487206223, 'dropout': 0.7083488662772146, 'patience': 90, 'lr_reduce_freq': 40, 'spt_alg': 'prim', 'spt_attr': 'similarity', 'manifold': 'PoincareBall', 'num_layers': 3, 'dim': 496, 'num_adj': 2, 'add_rate': 0.8069299586670998, 'tem': 1.212210138228238, 'consis_rate': 0.9190728533067389, 'use_att': 1}. Best is trial 59 with value: 0.8209.[0m
[32m[I 2022-06-30 06:03:36,874][0m Trial 82 finished with value: 0.8105 and parameters: {'lr': 0.027497003456358988, 'weight_decay': 0.003531847292905501, 'dropout': 0.718320677174006, 'patience': 90, 'lr_reduce_freq': 40, 'spt_alg': 'prim', 'spt_attr': 'similarity', 'manifold': 'PoincareBall', 'num_layers': 3, 'dim': 432, 'num_adj': 2, 'add_rate': 0.6470018065246663, 'tem': 1.2789248555288633, 'consis_rate': 0.7447171959237159, 'use_att': 1}. Best is trial 59 with value: 0.8209.[0m
[32m[I 2022-06-30 06:18:15,257][0m Trial 83 finished with value: 0.8157 and parameters: {'lr': 0.017704066412732984, 'weight_decay': 0.0022076875493128784, 'dropout': 0.6711685967400978, 'patience': 80, 'lr_reduce_freq': 50, 'spt_alg': 'prim', 'spt_attr': 'similarity', 'manifold': 'PoincareBall', 'num_layers': 3, 'dim': 384, 'num_adj': 4, 'add_rate': 0.6942125223418618, 'tem': 1.1676300935651278, 'consis_rate': 0.841286751264452, 'use_att': 1}. Best is trial 59 with value: 0.8209.[0m
[32m[I 2022-06-30 06:31:39,813][0m Trial 84 finished with value: 0.8213999999999999 and parameters: {'lr': 0.014095636765706729, 'weight_decay': 0.005936648214461426, 'dropout': 0.7635301498248526, 'patience': 90, 'lr_reduce_freq': 50, 'spt_alg': 'prim', 'spt_attr': 'similarity', 'manifold': 'PoincareBall', 'num_layers': 3, 'dim': 464, 'num_adj': 2, 'add_rate': 0.848414801724062, 'tem': 1.1346962807896621, 'consis_rate': 0.9586245392452191, 'use_att': 1}. Best is trial 84 with value: 0.8213999999999999.[0m
[32m[I 2022-06-30 06:45:01,350][0m Trial 85 finished with value: 0.34070000000000006 and parameters: {'lr': 0.035355431887376366, 'weight_decay': 0.007351718428953256, 'dropout': 0.7553868766072483, 'patience': 90, 'lr_reduce_freq': 40, 'spt_alg': 'prim', 'spt_attr': 'similarity', 'manifold': 'PoincareBall', 'num_layers': 4, 'dim': 464, 'num_adj': 2, 'add_rate': 0.7788829943149368, 'tem': 1.1188296921001681, 'consis_rate': 1.0414295337840491, 'use_att': 1}. Best is trial 84 with value: 0.8213999999999999.[0m
[32m[I 2022-06-30 06:59:25,706][0m Trial 86 finished with value: 0.8196999999999999 and parameters: {'lr': 0.021301766717993935, 'weight_decay': 0.0055106414725060865, 'dropout': 0.7767356160701074, 'patience': 100, 'lr_reduce_freq': 60, 'spt_alg': 'prim', 'spt_attr': 'similarity', 'manifold': 'PoincareBall', 'num_layers': 3, 'dim': 432, 'num_adj': 2, 'add_rate': 0.8449512942239109, 'tem': 1.493658495398007, 'consis_rate': 0.9667968877458198, 'use_att': 1}. Best is trial 84 with value: 0.8213999999999999.[0m
[32m[I 2022-06-30 07:13:19,395][0m Trial 87 finished with value: 0.7709 and parameters: {'lr': 0.01064904351655089, 'weight_decay': 0.006181512682217314, 'dropout': 0.7700422927062789, 'patience': 100, 'lr_reduce_freq': 60, 'spt_alg': 'prim', 'spt_attr': 'similarity', 'manifold': 'PoincareBall', 'num_layers': 3, 'dim': 400, 'num_adj': 2, 'add_rate': 0.8346535429736798, 'tem': 1.4775188826120726, 'consis_rate': 0.8492908052270618, 'use_att': 1}. Best is trial 84 with value: 0.8213999999999999.[0m
[32m[I 2022-06-30 07:16:13,352][0m Trial 88 finished with value: 0.3074 and parameters: {'lr': 0.020959580429209698, 'weight_decay': 0.010621857929279875, 'dropout': 0.7427889776876035, 'patience': 100, 'lr_reduce_freq': 50, 'spt_alg': 'prim', 'spt_attr': 'similarity', 'manifold': 'PoincareBall', 'num_layers': 5, 'dim': 432, 'num_adj': 2, 'add_rate': 0.8581865492207342, 'tem': 1.4274658323377485, 'consis_rate': 0.9772081854277053, 'use_att': 0}. Best is trial 84 with value: 0.8213999999999999.[0m
[32m[I 2022-06-30 07:29:51,849][0m Trial 89 finished with value: 0.8055000000000001 and parameters: {'lr': 0.0480984877209565, 'weight_decay': 0.005404443835668532, 'dropout': 0.6488099670986036, 'patience': 100, 'lr_reduce_freq': 50, 'spt_alg': 'prim', 'spt_attr': 'similarity', 'manifold': 'PoincareBall', 'num_layers': 3, 'dim': 448, 'num_adj': 2, 'add_rate': 0.8802752519113731, 'tem': 1.4960870971309812, 'consis_rate': 0.8905473575672008, 'use_att': 1}. Best is trial 84 with value: 0.8213999999999999.[0m
[32m[I 2022-06-30 07:52:17,307][0m Trial 90 finished with value: 0.8137000000000001 and parameters: {'lr': 0.018823214736303707, 'weight_decay': 0.004748983482976751, 'dropout': 0.779283727394525, 'patience': 90, 'lr_reduce_freq': 60, 'spt_alg': 'prim', 'spt_attr': 'similarity', 'manifold': 'Hyperboloid', 'num_layers': 3, 'dim': 416, 'num_adj': 2, 'add_rate': 0.7409589831694827, 'tem': 1.0285209237014479, 'consis_rate': 0.9499251570957354, 'use_att': 1}. Best is trial 84 with value: 0.8213999999999999.[0m
