[32m[I 2022-06-30 04:11:42,125][0m Trial 109 finished with value: 0.8089000000000001 and parameters: {'lr': 0.001188234424984458, 'weight_decay': 0.0006277960351661393, 'dropout': 0.6523256392775112, 'patience': 90, 'lr_reduce_freq': 120, 'spt_alg': 'prim', 'spt_attr': 'similarity', 'manifold': 'PoincareBall', 'num_layers': 3, 'dim': 176, 'num_adj': 2, 'add_rate': 0.7629143872774315, 'tem': 1.3932089279352569, 'consis_rate': 1.513661520409665, 'use_att': 1}. Best is trial 83 with value: 0.8199.[0m

cur_param: {'lr': 0.001089336892116681, 'weight_decay': 0.0007956570063479738, 'dropout': 0.48832437006879115, 'patience': 80, 'lr_reduce_freq': 140, 'spt_alg': 'prim', 'spt_attr': 'similarity', 'manifold': 'PoincareBall', 'num_layers': 3, 'dim': 304, 'num_adj': 2, 'add_rate': 0.838877177759702, 'tem': 1.2604216715992278, 'consis_rate': 1.542497052797626, 'use_att': 1}
mean: 0.8137000000000001
[0.83  0.813 0.83  0.811 0.805 0.809 0.821 0.806 0.808 0.804]
cur_param: {'lr': 0.0008228236043698944, 'weight_decay': 0.0010030307220737318, 'dropout': 0.5662553215944257, 'patience': 80, 'lr_reduce_freq': 140, 'spt_alg': 'prim', 'spt_attr': 'similarity', 'manifold': 'PoincareBall', 'num_layers': 3, 'dim': 320, 'num_adj': 2, 'add_rate': 0.897932142762309, 'tem': 1.3425455306785548, 'consis_rate': 1.832217111360621, 'use_att': 1}
mean: 0.8155999999999999
[0.83  0.808 0.816 0.818 0.804 0.826 0.817 0.805 0.822 0.81 ]
cur_param: {'lr': 0.002896696806149704, 'weight_decay': 0.0006432370550661842, 'dropout': 0.6132618338919282, 'patience': 80, 'lr_reduce_freq': 130, 'spt_alg': 'prim', 'spt_attr': 'similarity', 'manifold': 'PoincareBall', 'num_layers': 3, 'dim': 192, 'num_adj': 2, 'add_rate': 0.7970176778867717, 'tem': 1.293921788659911, 'consis_rate': 1.6664897519040713, 'use_att': 1}
mean: 0.8183
[0.825 0.826 0.803 0.829 0.822 0.804 0.817 0.814 0.82  0.823]
cur_param: {'lr': 0.0027054066641072983, 'weight_decay': 0.0005523965549370386, 'dropout': 0.6159645056470975, 'patience': 80, 'lr_reduce_freq': 130, 'spt_alg': 'prim', 'spt_attr': 'similarity', 'manifold': 'PoincareBall', 'num_layers': 3, 'dim': 144, 'num_adj': 2, 'add_rate': 0.7951334537289189, 'tem': 1.3022535887395772, 'consis_rate': 1.6618796024250586, 'use_att': 1}
mean: 0.812
[0.811 0.817 0.811 0.801 0.814 0.813 0.808 0.817 0.82  0.808]
cur_param: {'lr': 0.003651832955218815, 'weight_decay': 0.0006456369413879716, 'dropout': 0.5280887836716768, 'patience': 80, 'lr_reduce_freq': 130, 'spt_alg': 'prim', 'spt_attr': 'similarity', 'manifold': 'PoincareBall', 'num_layers': 3, 'dim': 192, 'num_adj': 2, 'add_rate': 0.8251135667665103, 'tem': 1.3828479041219748, 'consis_rate': 1.5983295585732529, 'use_att': 1}
mean: 0.8106
[0.815 0.816 0.793 0.82  0.803 0.824 0.81  0.801 0.82  0.804]
cur_param: {'lr': 0.0015609812251428069, 'weight_decay': 0.0011244800904541274, 'dropout': 0.5874762193594688, 'patience': 80, 'lr_reduce_freq': 130, 'spt_alg': 'prim', 'spt_attr': 'similarity', 'manifold': 'PoincareBall', 'num_layers': 3, 'dim': 176, 'num_adj': 2, 'add_rate': 0.7290288909381175, 'tem': 1.1580180578769894, 'consis_rate': 1.7381979912273549, 'use_att': 1}
mean: 0.8083
[0.802 0.791 0.821 0.812 0.824 0.813 0.804 0.8   0.805 0.811]
cur_param: {'lr': 0.006232818452317778, 'weight_decay': 0.00075786373555178, 'dropout': 0.4773145440378616, 'patience': 90, 'lr_reduce_freq': 150, 'spt_alg': 'prim', 'spt_attr': 'similarity', 'manifold': 'PoincareBall', 'num_layers': 3, 'dim': 208, 'num_adj': 2, 'add_rate': 0.8600533865332809, 'tem': 1.4238026454757753, 'consis_rate': 1.5641605778058003, 'use_att': 1}
mean: 0.8032999999999999
[0.809 0.806 0.776 0.802 0.816 0.806 0.801 0.811 0.792 0.814]
cur_param: {'lr': 0.00289155982934356, 'weight_decay': 0.0005505412518853934, 'dropout': 0.518560778691614, 'patience': 80, 'lr_reduce_freq': 120, 'spt_alg': 'prim', 'spt_attr': 'similarity', 'manifold': 'PoincareBall', 'num_layers': 3, 'dim': 272, 'num_adj': 2, 'add_rate': 0.7915553719187955, 'tem': 1.2502573221146296, 'consis_rate': 1.8632190260294768, 'use_att': 1}
mean: 0.8139
[0.812 0.812 0.818 0.821 0.798 0.808 0.827 0.809 0.816 0.818]
cur_param: {'lr': 0.0022093873141229062, 'weight_decay': 0.0006637516803567867, 'dropout': 0.43865201264385184, 'patience': 70, 'lr_reduce_freq': 140, 'spt_alg': 'prim', 'spt_attr': 'similarity', 'manifold': 'PoincareBall', 'num_layers': 3, 'dim': 256, 'num_adj': 2, 'add_rate': 0.708159451830604, 'tem': 1.2861144388307442, 'consis_rate': 1.806923210721215, 'use_att': 1}
mean: 0.8152999999999999
[0.813 0.821 0.812 0.818 0.827 0.811 0.822 0.804 0.808 0.817]
cur_param: {'lr': 0.001988977075703759, 'weight_decay': 0.0008775558925820921, 'dropout': 0.6072397232613067, 'patience': 80, 'lr_reduce_freq': 140, 'spt_alg': 'prim', 'spt_attr': 'similarity', 'manifold': 'PoincareBall', 'num_layers': 3, 'dim': 192, 'num_adj': 2, 'add_rate': 0.8798081076526026, 'tem': 1.36382749019812, 'consis_rate': 1.7024455754932044, 'use_att': 1}
mean: 0.8158
[0.821 0.813 0.811 0.826 0.821 0.813 0.81  0.81  0.813 0.82 ]
cur_param: {'lr': 0.001853746130695077, 'weight_decay': 0.0007062280182340251, 'dropout': 0.6359577323421501, 'patience': 80, 'lr_reduce_freq': 140, 'spt_alg': 'prim', 'spt_attr': 'similarity', 'manifold': 'PoincareBall', 'num_layers': 3, 'dim': 192, 'num_adj': 2, 'add_rate': 0.8194680533208938, 'tem': 1.4041984333669435, 'consis_rate': 1.6512681647363288, 'use_att': 1}
mean: 0.8103999999999999
[0.819 0.8   0.807 0.815 0.803 0.808 0.815 0.811 0.808 0.818]
cur_param: {'lr': 0.003970503043707464, 'weight_decay': 0.00095363023489133, 'dropout': 0.6517095349965129, 'patience': 80, 'lr_reduce_freq': 150, 'spt_alg': 'prim', 'spt_attr': 'similarity', 'manifold': 'PoincareBall', 'num_layers': 3, 'dim': 176, 'num_adj': 2, 'add_rate': 0.876626721628379, 'tem': 1.3215665563223127, 'consis_rate': 1.6855345748520973, 'use_att': 1}
mean: 0.8115
[0.806 0.821 0.817 0.803 0.834 0.798 0.828 0.796 0.803 0.809]
cur_param: {'lr': 0.002813337466102115, 'weight_decay': 0.0006363911832250772, 'dropout': 0.6065406734126995, 'patience': 80, 'lr_reduce_freq': 130, 'spt_alg': 'prim', 'spt_attr': 'similarity', 'manifold': 'PoincareBall', 'num_layers': 3, 'dim': 224, 'num_adj': 2, 'add_rate': 0.8449580079582512, 'tem': 1.3591565648316524, 'consis_rate': 1.621656311800635, 'use_att': 1}
mean: 0.8128
[0.829 0.806 0.812 0.826 0.814 0.796 0.806 0.81  0.825 0.804]
cur_param: {'lr': 0.001528283177975937, 'weight_decay': 0.0005485945845883841, 'dropout': 0.5791551873934324, 'patience': 80, 'lr_reduce_freq': 140, 'spt_alg': 'prim', 'spt_attr': 'similarity', 'manifold': 'PoincareBall', 'num_layers': 5, 'dim': 208, 'num_adj': 2, 'add_rate': 0.6634869909504408, 'tem': 1.3014309848672252, 'consis_rate': 1.9543198556927395, 'use_att': 1}
mean: 0.7758
[0.763 0.798 0.8   0.768 0.783 0.769 0.761 0.768 0.774 0.774]
cur_param: {'lr': 0.003629102255648232, 'weight_decay': 0.0008207902328034003, 'dropout': 0.5455165339248571, 'patience': 80, 'lr_reduce_freq': 130, 'spt_alg': 'prim', 'spt_attr': 'similarity', 'manifold': 'PoincareBall', 'num_layers': 3, 'dim': 224, 'num_adj': 2, 'add_rate': 0.8131993681374142, 'tem': 1.4673356907225223, 'consis_rate': 1.7455003852888173, 'use_att': 1}
mean: 0.8068
[0.805 0.815 0.788 0.809 0.791 0.813 0.818 0.807 0.811 0.811]
cur_param: {'lr': 0.0011979660411160853, 'weight_decay': 0.0007305096316914827, 'dropout': 0.6085773403590963, 'patience': 80, 'lr_reduce_freq': 120, 'spt_alg': 'prim', 'spt_attr': 'similarity', 'manifold': 'PoincareBall', 'num_layers': 3, 'dim': 176, 'num_adj': 2, 'add_rate': 0.752217594405718, 'tem': 1.4406685226632387, 'consis_rate': 1.5227196792861015, 'use_att': 1}
mean: 0.817
[0.81  0.816 0.822 0.822 0.827 0.812 0.827 0.81  0.807 0.817]
cur_param: {'lr': 0.0006478191043815291, 'weight_decay': 0.0007340278341022544, 'dropout': 0.4022117286556513, 'patience': 80, 'lr_reduce_freq': 120, 'spt_alg': 'prim', 'spt_attr': 'similarity', 'manifold': 'PoincareBall', 'num_layers': 3, 'dim': 160, 'num_adj': 2, 'add_rate': 0.7458035761532704, 'tem': 1.433820699224778, 'consis_rate': 1.4504004547505553, 'use_att': 1}
mean: 0.8078
[0.806 0.799 0.802 0.8   0.815 0.814 0.815 0.8   0.817 0.81 ]
cur_param: {'lr': 0.001188234424984458, 'weight_decay': 0.0006277960351661393, 'dropout': 0.6523256392775112, 'patience': 90, 'lr_reduce_freq': 120, 'spt_alg': 'prim', 'spt_attr': 'similarity', 'manifold': 'PoincareBall', 'num_layers': 3, 'dim': 176, 'num_adj': 2, 'add_rate': 0.7629143872774315, 'tem': 1.3932089279352569, 'consis_rate': 1.513661520409665, 'use_att': 1}
mean: 0.8089000000000001
[0.803 0.807 0.818 0.833 0.816 0.799 0.795 0.813 0.787 0.818]
cur_param: {'lr': 0.005623946977036683, 'weight_decay': 0.0005381991040649499, 'dropout': 0.585582805426423, 'patience': 80, 'lr_reduce_freq': 120, 'spt_alg': 'prim', 'spt_attr': 'similarity', 'manifold': 'PoincareBall', 'num_layers': 3, 'dim': 288, 'num_adj': 2, 'add_rate': 0.719807156671663, 'tem': 1.2320710344260297, 'consis_rate': 1.5783302048439236, 'use_att': 1}[32m[I 2022-06-30 04:20:39,711][0m Trial 110 finished with value: 0.8153 and parameters: {'lr': 0.005623946977036683, 'weight_decay': 0.0005381991040649499, 'dropout': 0.585582805426423, 'patience': 80, 'lr_reduce_freq': 120, 'spt_alg': 'prim', 'spt_attr': 'similarity', 'manifold': 'PoincareBall', 'num_layers': 3, 'dim': 288, 'num_adj': 2, 'add_rate': 0.719807156671663, 'tem': 1.2320710344260297, 'consis_rate': 1.5783302048439236, 'use_att': 1}. Best is trial 83 with value: 0.8199.[0m
[32m[I 2022-06-30 04:33:13,617][0m Trial 111 finished with value: 0.8119 and parameters: {'lr': 0.0030480636053592572, 'weight_decay': 0.0008943818861761815, 'dropout': 0.627808801174265, 'patience': 80, 'lr_reduce_freq': 140, 'spt_alg': 'prim', 'spt_attr': 'similarity', 'manifold': 'PoincareBall', 'num_layers': 3, 'dim': 176, 'num_adj': 2, 'add_rate': 0.7904052782904873, 'tem': 1.3334683653264936, 'consis_rate': 1.8120459764331804, 'use_att': 1}. Best is trial 83 with value: 0.8199.[0m
[32m[I 2022-06-30 04:53:49,162][0m Trial 112 finished with value: 0.8142000000000001 and parameters: {'lr': 0.0008675899864285086, 'weight_decay': 0.0006999069705280885, 'dropout': 0.612225321915074, 'patience': 80, 'lr_reduce_freq': 130, 'spt_alg': 'prim', 'spt_attr': 'similarity', 'manifold': 'PoincareBall', 'num_layers': 3, 'dim': 192, 'num_adj': 2, 'add_rate': 0.8375874924330844, 'tem': 1.3640553838876897, 'consis_rate': 1.6930955299184203, 'use_att': 1}. Best is trial 83 with value: 0.8199.[0m
[32m[I 2022-06-30 05:08:47,730][0m Trial 113 finished with value: 0.818 and parameters: {'lr': 0.0019809259883079703, 'weight_decay': 0.0007798769309708406, 'dropout': 0.5631942745524334, 'patience': 80, 'lr_reduce_freq': 140, 'spt_alg': 'prim', 'spt_attr': 'similarity', 'manifold': 'PoincareBall', 'num_layers': 3, 'dim': 128, 'num_adj': 2, 'add_rate': 0.634330464054384, 'tem': 1.41473801498803, 'consis_rate': 1.538418592906849, 'use_att': 1}. Best is trial 83 with value: 0.8199.[0m
[32m[I 2022-06-30 05:19:23,520][0m Trial 114 finished with value: 0.2622 and parameters: {'lr': 0.002264594225652485, 'weight_decay': 0.025382416182142268, 'dropout': 0.5582904608134621, 'patience': 80, 'lr_reduce_freq': 130, 'spt_alg': 'prim', 'spt_attr': 'similarity', 'manifold': 'PoincareBall', 'num_layers': 3, 'dim': 272, 'num_adj': 2, 'add_rate': 0.6996769749493192, 'tem': 1.4453460587130182, 'consis_rate': 1.4856775135131257, 'use_att': 1}. Best is trial 83 with value: 0.8199.[0m
[32m[I 2022-06-30 05:37:04,628][0m Trial 115 finished with value: 0.8149 and parameters: {'lr': 0.0011842426445878454, 'weight_decay': 0.0011025002673902243, 'dropout': 0.5365764743715163, 'patience': 80, 'lr_reduce_freq': 150, 'spt_alg': 'prim', 'spt_attr': 'similarity', 'manifold': 'PoincareBall', 'num_layers': 3, 'dim': 128, 'num_adj': 2, 'add_rate': 0.6384311598770376, 'tem': 1.4147679492420902, 'consis_rate': 1.5445830776924687, 'use_att': 1}. Best is trial 83 with value: 0.8199.[0m
[32m[I 2022-06-30 05:50:09,529][0m Trial 116 finished with value: 0.8129 and parameters: {'lr': 0.0014598387854950835, 'weight_decay': 0.0005894054764343458, 'dropout': 0.5101490073296037, 'patience': 80, 'lr_reduce_freq': 120, 'spt_alg': 'prim', 'spt_attr': 'similarity', 'manifold': 'PoincareBall', 'num_layers': 3, 'dim': 144, 'num_adj': 2, 'add_rate': 0.6043553707722812, 'tem': 1.481980518463695, 'consis_rate': 1.6196229943829739, 'use_att': 1}. Best is trial 83 with value: 0.8199.[0m
[32m[I 2022-06-30 06:08:48,883][0m Trial 117 finished with value: 0.7797000000000001 and parameters: {'lr': 0.0017911438482699712, 'weight_decay': 0.0007526322046956334, 'dropout': 0.48322845369908707, 'patience': 70, 'lr_reduce_freq': 130, 'spt_alg': 'prim', 'spt_attr': 'similarity', 'manifold': 'PoincareBall', 'num_layers': 4, 'dim': 144, 'num_adj': 2, 'add_rate': 0.6250403057955444, 'tem': 1.1974292175689107, 'consis_rate': 0.24295585439170442, 'use_att': 1}. Best is trial 83 with value: 0.8199.[0m
[32m[I 2022-06-30 06:17:05,567][0m Trial 118 finished with value: 0.3614 and parameters: {'lr': 0.0024314551527248327, 'weight_decay': 0.007510936351681013, 'dropout': 0.566918426448446, 'patience': 80, 'lr_reduce_freq': 140, 'spt_alg': 'prim', 'spt_attr': 'similarity', 'manifold': 'PoincareBall', 'num_layers': 3, 'dim': 480, 'num_adj': 2, 'add_rate': 0.7367539880000619, 'tem': 1.2872670941135103, 'consis_rate': 1.4389683911064692, 'use_att': 1}. Best is trial 83 with value: 0.8199.[0m
[32m[I 2022-06-30 06:27:29,006][0m Trial 119 finished with value: 0.8131 and parameters: {'lr': 0.003033911682983132, 'weight_decay': 0.0006576217526409041, 'dropout': 0.5303529522537406, 'patience': 80, 'lr_reduce_freq': 150, 'spt_alg': 'prim', 'spt_attr': 'similarity', 'manifold': 'PoincareBall', 'num_layers': 3, 'dim': 256, 'num_adj': 2, 'add_rate': 0.7596777623357462, 'tem': 1.2576527795723922, 'consis_rate': 1.9270456957207251, 'use_att': 1}. Best is trial 83 with value: 0.8199.[0m
[32m[I 2022-06-30 06:36:37,637][0m Trial 120 finished with value: 0.8109999999999999 and parameters: {'lr': 0.008441418621054296, 'weight_decay': 0.0005464566361572787, 'dropout': 0.5485530820951579, 'patience': 80, 'lr_reduce_freq': 110, 'spt_alg': 'prim', 'spt_attr': 'similarity', 'manifold': 'PoincareBall', 'num_layers': 3, 'dim': 128, 'num_adj': 2, 'add_rate': 0.7159773283128416, 'tem': 1.3855015238395716, 'consis_rate': 1.7533661567355951, 'use_att': 1}. Best is trial 83 with value: 0.8199.[0m
[32m[I 2022-06-30 06:50:43,177][0m Trial 121 finished with value: 0.8161999999999999 and parameters: {'lr': 0.002030807417864914, 'weight_decay': 0.000957105900558754, 'dropout': 0.6100087834693706, 'patience': 80, 'lr_reduce_freq': 140, 'spt_alg': 'prim', 'spt_attr': 'similarity', 'manifold': 'PoincareBall', 'num_layers': 3, 'dim': 208, 'num_adj': 2, 'add_rate': 0.8545796127665714, 'tem': 1.3137875051355972, 'consis_rate': 1.6696496387461566, 'use_att': 1}. Best is trial 83 with value: 0.8199.[0m
[32m[I 2022-06-30 07:03:42,051][0m Trial 122 finished with value: 0.8160999999999999 and parameters: {'lr': 0.0020574228497141096, 'weight_decay': 0.0007905902421570121, 'dropout': 0.5854730006818761, 'patience': 80, 'lr_reduce_freq': 140, 'spt_alg': 'prim', 'spt_attr': 'similarity', 'manifold': 'PoincareBall', 'num_layers': 3, 'dim': 208, 'num_adj': 2, 'add_rate': 0.8540295431455124, 'tem': 1.3987724842753808, 'consis_rate': 1.6507061554519584, 'use_att': 1}. Best is trial 83 with value: 0.8199.[0m
[32m[I 2022-06-30 07:17:42,960][0m Trial 123 finished with value: 0.8119999999999999 and parameters: {'lr': 0.0016320111562162227, 'weight_decay': 0.0009822108267223942, 'dropout': 0.5968066462920344, 'patience': 80, 'lr_reduce_freq': 130, 'spt_alg': 'prim', 'spt_attr': 'similarity', 'manifold': 'PoincareBall', 'num_layers': 3, 'dim': 240, 'num_adj': 2, 'add_rate': 0.8230308019896592, 'tem': 1.314266551882362, 'consis_rate': 1.572371062580646, 'use_att': 1}. Best is trial 83 with value: 0.8199.[0m
[32m[I 2022-06-30 07:27:53,642][0m Trial 124 finished with value: 0.8136000000000001 and parameters: {'lr': 0.004240558623768205, 'weight_decay': 0.0006058756764177532, 'dropout': 0.6255599271596102, 'patience': 80, 'lr_reduce_freq': 140, 'spt_alg': 'prim', 'spt_attr': 'similarity', 'manifold': 'PoincareBall', 'num_layers': 3, 'dim': 224, 'num_adj': 2, 'add_rate': 0.803520915463523, 'tem': 1.243495409126654, 'consis_rate': 1.7791075018881999, 'use_att': 1}. Best is trial 83 with value: 0.8199.[0m
[32m[I 2022-06-30 07:37:11,482][0m Trial 125 finished with value: 0.8128 and parameters: {'lr': 0.005046556959176651, 'weight_decay': 0.0007032993450034104, 'dropout': 0.567051913556975, 'patience': 80, 'lr_reduce_freq': 150, 'spt_alg': 'prim', 'spt_attr': 'similarity', 'manifold': 'PoincareBall', 'num_layers': 3, 'dim': 352, 'num_adj': 2, 'add_rate': 0.7772355791106208, 'tem': 1.4481768455502795, 'consis_rate': 1.9806858209154163, 'use_att': 1}. Best is trial 83 with value: 0.8199.[0m
[32m[I 2022-06-30 08:16:19,142][0m Trial 126 finished with value: 0.7547 and parameters: {'lr': 0.0013624581963533819, 'weight_decay': 0.0012016414991997046, 'dropout': 0.5138758267322826, 'patience': 80, 'lr_reduce_freq': 140, 'spt_alg': 'prim', 'spt_attr': 'similarity', 'manifold': 'PoincareBall', 'num_layers': 5, 'dim': 480, 'num_adj': 2, 'add_rate': 0.8631740102933697, 'tem': 1.333822005021725, 'consis_rate': 1.6252467366908347, 'use_att': 1}. Best is trial 83 with value: 0.8199.[0m
