[32m[I 2022-06-22 10:42:54,630][0m Trial 54 finished with value: 0.205 and parameters: {'lr': 0.0015117886107727033, 'weight_decay': 0.10986020314459378, 'dropout': 0.35449595558307, 'patience': 80, 'lr_reduce_freq': 150, 'spt_alg': 'kruskal', 'spt_attr': 'edge_degree', 'manifold': 'PoincareBall', 'num_layers': 3, 'num_adj': 4, 'add_rate': 0.4406966194848143, 'tem': 0.7662204190875039, 'consis_rate': 1.0712106425346049, 'use_att': 1}. Best is trial 41 with value: 0.8123999999999999.[0m
[32m[I 2022-06-22 11:16:00,981][0m Trial 55 finished with value: 0.8061 and parameters: {'lr': 0.001188678598812474, 'weight_decay': 0.0020419789506867818, 'dropout': 0.42630150308571835, 'patience': 80, 'lr_reduce_freq': 130, 'spt_alg': 'kruskal', 'spt_attr': 'edge_degree', 'manifold': 'PoincareBall', 'num_layers': 3, 'num_adj': 4, 'add_rate': 0.37104915408013067, 'tem': 1.0840598250388591, 'consis_rate': 1.1628522616851493, 'use_att': 1}. Best is trial 41 with value: 0.8123999999999999.[0m

mean: 0.8068
[0.808 0.815 0.812 0.806 0.807 0.777 0.807 0.82  0.802 0.814]
cur_param: {'lr': 0.0016331780713993787, 'weight_decay': 0.0024625116169808134, 'dropout': 0.40304007431365935, 'patience': 60, 'lr_reduce_freq': 110, 'spt_alg': 'kruskal', 'spt_attr': 'similarity', 'manifold': 'PoincareBall', 'num_layers': 4, 'num_adj': 8, 'add_rate': 0.6063534351233939, 'tem': 0.9438858078768646, 'consis_rate': 1.271397200231812, 'use_att': 1}
mean: 0.7671
[0.781 0.777 0.748 0.777 0.695 0.771 0.769 0.786 0.8   0.767]
cur_param: {'lr': 0.011225454635946801, 'weight_decay': 0.004449056274090729, 'dropout': 0.4149275424928511, 'patience': 80, 'lr_reduce_freq': 130, 'spt_alg': 'prim', 'spt_attr': 'edge_degree', 'manifold': 'PoincareBall', 'num_layers': 3, 'num_adj': 8, 'add_rate': 0.5568894362586485, 'tem': 1.328788695957975, 'consis_rate': 0.7292636875628542, 'use_att': 1}
mean: 0.7919
[0.802 0.795 0.798 0.788 0.765 0.774 0.804 0.797 0.782 0.814]
cur_param: {'lr': 0.01689376146439922, 'weight_decay': 0.0007385495164992855, 'dropout': 0.3169116594709425, 'patience': 80, 'lr_reduce_freq': 110, 'spt_alg': 'prim', 'spt_attr': 'similarity', 'manifold': 'PoincareBall', 'num_layers': 3, 'num_adj': 8, 'add_rate': 0.6890640642932411, 'tem': 1.1578597617302815, 'consis_rate': 0.9850727476800469, 'use_att': 1}
mean: 0.7962
[0.802 0.801 0.812 0.795 0.794 0.791 0.788 0.791 0.8   0.788]
cur_param: {'lr': 0.0016942127395876375, 'weight_decay': 0.0012072911132748091, 'dropout': 0.5224726207053338, 'patience': 80, 'lr_reduce_freq': 110, 'spt_alg': 'prim', 'spt_attr': 'edge_degree', 'manifold': 'PoincareBall', 'num_layers': 3, 'num_adj': 6, 'add_rate': 0.4178471281425423, 'tem': 0.7167109377291936, 'consis_rate': 1.3268261896067979, 'use_att': 1}
mean: 0.8123999999999999
[0.804 0.815 0.81  0.821 0.819 0.806 0.801 0.808 0.821 0.819]
cur_param: {'lr': 0.0017093237347980594, 'weight_decay': 0.0010736142508346845, 'dropout': 0.4774649963836094, 'patience': 80, 'lr_reduce_freq': 130, 'spt_alg': 'prim', 'spt_attr': 'edge_degree', 'manifold': 'PoincareBall', 'num_layers': 3, 'num_adj': 6, 'add_rate': 0.4139006761613714, 'tem': 0.743720965235102, 'consis_rate': 1.1283338954653748, 'use_att': 1}
mean: 0.8093999999999999
[0.795 0.795 0.816 0.816 0.808 0.813 0.809 0.803 0.813 0.826]
cur_param: {'lr': 0.0014820430185957761, 'weight_decay': 0.0010938975353063604, 'dropout': 0.4366948766828616, 'patience': 80, 'lr_reduce_freq': 130, 'spt_alg': 'prim', 'spt_attr': 'edge_degree', 'manifold': 'PoincareBall', 'num_layers': 3, 'num_adj': 8, 'add_rate': 0.38245176365607003, 'tem': 0.7247083323667267, 'consis_rate': 0.7586335573560392, 'use_att': 1}
mean: 0.8029
[0.796 0.805 0.815 0.807 0.812 0.788 0.789 0.817 0.796 0.804]
cur_param: {'lr': 0.0018970872938808157, 'weight_decay': 0.002911763931293648, 'dropout': 0.4960245422987713, 'patience': 80, 'lr_reduce_freq': 130, 'spt_alg': 'prim', 'spt_attr': 'edge_degree', 'manifold': 'PoincareBall', 'num_layers': 3, 'num_adj': 4, 'add_rate': 0.4190154712148439, 'tem': 0.7942505385265282, 'consis_rate': 1.1026426626673014, 'use_att': 1}
mean: 0.8062999999999999
[0.799 0.8   0.808 0.806 0.798 0.802 0.813 0.814 0.815 0.808]
cur_param: {'lr': 0.001916527247719101, 'weight_decay': 0.0028297159912792206, 'dropout': 0.515318990511197, 'patience': 80, 'lr_reduce_freq': 150, 'spt_alg': 'kruskal', 'spt_attr': 'edge_degree', 'manifold': 'PoincareBall', 'num_layers': 3, 'num_adj': 4, 'add_rate': 0.42590598710956307, 'tem': 0.8549098237495562, 'consis_rate': 1.0621650848518291, 'use_att': 1}
mean: 0.8099000000000001
[0.814 0.817 0.812 0.811 0.816 0.812 0.796 0.809 0.816 0.796]
cur_param: {'lr': 0.001863570593502319, 'weight_decay': 0.002922441856456155, 'dropout': 0.33386923977974187, 'patience': 80, 'lr_reduce_freq': 150, 'spt_alg': 'kruskal', 'spt_attr': 'edge_degree', 'manifold': 'PoincareBall', 'num_layers': 3, 'num_adj': 4, 'add_rate': 0.41860878665416146, 'tem': 0.8646641304879534, 'consis_rate': 0.941149926747332, 'use_att': 1}
mean: 0.8071000000000002
[0.812 0.8   0.804 0.799 0.801 0.821 0.811 0.803 0.814 0.806]
cur_param: {'lr': 0.0012984169326578884, 'weight_decay': 0.009431284306517273, 'dropout': 0.1582887180769736, 'patience': 60, 'lr_reduce_freq': 150, 'spt_alg': 'kruskal', 'spt_attr': 'edge_degree', 'manifold': 'PoincareBall', 'num_layers': 3, 'num_adj': 2, 'add_rate': 0.3545336134756525, 'tem': 0.9533031831880385, 'consis_rate': 1.0115187093818312, 'use_att': 1}
mean: 0.3177
[0.239 0.249 0.149 0.336 0.362 0.429 0.549 0.258 0.476 0.13 ]
cur_param: {'lr': 0.0019438171119171676, 'weight_decay': 0.007972029337932675, 'dropout': 0.0002958367836091713, 'patience': 80, 'lr_reduce_freq': 150, 'spt_alg': 'kruskal', 'spt_attr': 'edge_degree', 'manifold': 'PoincareBall', 'num_layers': 3, 'num_adj': 4, 'add_rate': 0.49271563945815666, 'tem': 0.8714158763252815, 'consis_rate': 0.814884202937166, 'use_att': 1}
mean: 0.7815
[0.776 0.789 0.736 0.815 0.795 0.788 0.791 0.799 0.764 0.762]
cur_param: {'lr': 0.001002757350371217, 'weight_decay': 0.042739398634907916, 'dropout': 0.3587228581776842, 'patience': 80, 'lr_reduce_freq': 150, 'spt_alg': 'kruskal', 'spt_attr': 'edge_degree', 'manifold': 'PoincareBall', 'num_layers': 4, 'num_adj': 4, 'add_rate': 0.4237050668967343, 'tem': 1.1394139251464945, 'consis_rate': 0.972038601116985, 'use_att': 1}
mean: 0.191
[0.319 0.355 0.22  0.15  0.103 0.319 0.064 0.128 0.103 0.149]
cur_param: {'lr': 0.001299026566414325, 'weight_decay': 0.002360592950031263, 'dropout': 0.2699700999891662, 'patience': 80, 'lr_reduce_freq': 150, 'spt_alg': 'kruskal', 'spt_attr': 'edge_degree', 'manifold': 'PoincareBall', 'num_layers': 3, 'num_adj': 4, 'add_rate': 0.5621139166152403, 'tem': 1.0214693107191626, 'consis_rate': 0.8741868368644065, 'use_att': 1}
mean: 0.8063
[0.807 0.794 0.812 0.799 0.793 0.816 0.8   0.824 0.813 0.805]
cur_param: {'lr': 0.0019571184339619804, 'weight_decay': 0.002044815671010355, 'dropout': 0.24649878331959946, 'patience': 80, 'lr_reduce_freq': 150, 'spt_alg': 'kruskal', 'spt_attr': 'edge_degree', 'manifold': 'PoincareBall', 'num_layers': 3, 'num_adj': 4, 'add_rate': 0.5480957935338882, 'tem': 1.0307388008653011, 'consis_rate': 0.5919429304448458, 'use_att': 1}
mean: 0.8062000000000001
[0.814 0.795 0.809 0.805 0.794 0.816 0.801 0.821 0.807 0.8  ]
cur_param: {'lr': 0.0013124585298270068, 'weight_decay': 0.0046439276184395495, 'dropout': 0.2559417222892734, 'patience': 80, 'lr_reduce_freq': 150, 'spt_alg': 'kruskal', 'spt_attr': 'edge_degree', 'manifold': 'PoincareBall', 'num_layers': 3, 'num_adj': 4, 'add_rate': 0.5708881870322787, 'tem': 0.9937917408800017, 'consis_rate': 0.9158430154333824, 'use_att': 1}
mean: 0.7988000000000001
[0.796 0.801 0.794 0.773 0.779 0.812 0.808 0.813 0.804 0.808]
cur_param: {'lr': 0.0024552367306392036, 'weight_decay': 0.0030556610284159535, 'dropout': 0.20368249677469152, 'patience': 80, 'lr_reduce_freq': 130, 'spt_alg': 'kruskal', 'spt_attr': 'edge_degree', 'manifold': 'PoincareBall', 'num_layers': 3, 'num_adj': 2, 'add_rate': 0.5070556306274316, 'tem': 0.8548974044717143, 'consis_rate': 0.8361900610192541, 'use_att': 1}
mean: 0.7994000000000001
[0.808 0.791 0.795 0.797 0.817 0.794 0.803 0.794 0.793 0.802]
cur_param: {'lr': 0.0015117886107727033, 'weight_decay': 0.10986020314459378, 'dropout': 0.35449595558307, 'patience': 80, 'lr_reduce_freq': 150, 'spt_alg': 'kruskal', 'spt_attr': 'edge_degree', 'manifold': 'PoincareBall', 'num_layers': 3, 'num_adj': 4, 'add_rate': 0.4406966194848143, 'tem': 0.7662204190875039, 'consis_rate': 1.0712106425346049, 'use_att': 1}
mean: 0.205
[0.319 0.103 0.144 0.319 0.144 0.144 0.149 0.319 0.319 0.09 ]
cur_param: {'lr': 0.001188678598812474, 'weight_decay': 0.0020419789506867818, 'dropout': 0.42630150308571835, 'patience': 80, 'lr_reduce_freq': 130, 'spt_alg': 'kruskal', 'spt_attr': 'edge_degree', 'manifold': 'PoincareBall', 'num_layers': 3, 'num_adj': 4, 'add_rate': 0.37104915408013067, 'tem': 1.0840598250388591, 'consis_rate': 1.1628522616851493, 'use_att': 1}
mean: 0.8061
[0.811 0.799 0.806 0.811 0.809 0.82  0.798 0.815 0.792 0.8  ]
cur_param: {'lr': 0.0034000433465819573, 'weight_decay': 0.0035595561719645808, 'dropout': 0.33239188676144105, 'patience': 80, 'lr_reduce_freq': 110, 'spt_alg': 'kruskal', 'spt_attr': 'edge_degree', 'manifold': 'PoincareBall', 'num_layers': 3, 'num_adj': 2, 'add_rate': 0.4847689249412167, 'tem': 1.171475261084407, 'consis_rate': 0.37444714713876437, 'use_att': 1}[32m[I 2022-06-22 11:32:07,380][0m Trial 56 finished with value: 0.7979 and parameters: {'lr': 0.0034000433465819573, 'weight_decay': 0.0035595561719645808, 'dropout': 0.33239188676144105, 'patience': 80, 'lr_reduce_freq': 110, 'spt_alg': 'kruskal', 'spt_attr': 'edge_degree', 'manifold': 'PoincareBall', 'num_layers': 3, 'num_adj': 2, 'add_rate': 0.4847689249412167, 'tem': 1.171475261084407, 'consis_rate': 0.37444714713876437, 'use_att': 1}. Best is trial 41 with value: 0.8123999999999999.[0m
[32m[I 2022-06-22 11:55:49,659][0m Trial 57 finished with value: 0.8074 and parameters: {'lr': 0.0018048411339712416, 'weight_decay': 0.0007040198927668477, 'dropout': 0.38527219686663944, 'patience': 80, 'lr_reduce_freq': 150, 'spt_alg': 'kruskal', 'spt_attr': 'edge_degree', 'manifold': 'PoincareBall', 'num_layers': 3, 'num_adj': 4, 'add_rate': 0.5239581147724958, 'tem': 0.685215166264278, 'consis_rate': 1.316083327293012, 'use_att': 1}. Best is trial 41 with value: 0.8123999999999999.[0m
[32m[I 2022-06-22 12:14:44,198][0m Trial 58 finished with value: 0.8089999999999999 and parameters: {'lr': 0.0018021043836761361, 'weight_decay': 0.0006777978519146874, 'dropout': 0.5596689702790938, 'patience': 60, 'lr_reduce_freq': 150, 'spt_alg': 'kruskal', 'spt_attr': 'edge_degree', 'manifold': 'PoincareBall', 'num_layers': 3, 'num_adj': 4, 'add_rate': 0.28859182047185294, 'tem': 0.6730393214023828, 'consis_rate': 1.3147255180171555, 'use_att': 1}. Best is trial 41 with value: 0.8123999999999999.[0m
[32m[I 2022-06-22 12:29:25,271][0m Trial 59 finished with value: 0.8091000000000002 and parameters: {'lr': 0.0035944305957128324, 'weight_decay': 0.0006907883061864193, 'dropout': 0.5420299981158276, 'patience': 60, 'lr_reduce_freq': 150, 'spt_alg': 'kruskal', 'spt_attr': 'edge_degree', 'manifold': 'PoincareBall', 'num_layers': 3, 'num_adj': 4, 'add_rate': 0.28744992288176596, 'tem': 0.6948939495774974, 'consis_rate': 1.212821905026362, 'use_att': 1}. Best is trial 41 with value: 0.8123999999999999.[0m
[32m[I 2022-06-22 12:46:55,487][0m Trial 60 finished with value: 0.8072000000000001 and parameters: {'lr': 0.002750518232146187, 'weight_decay': 0.0006941561275453586, 'dropout': 0.5523980343075855, 'patience': 60, 'lr_reduce_freq': 150, 'spt_alg': 'kruskal', 'spt_attr': 'edge_degree', 'manifold': 'PoincareBall', 'num_layers': 3, 'num_adj': 4, 'add_rate': 0.2921809540271273, 'tem': 0.6740305477500558, 'consis_rate': 1.3240240349124213, 'use_att': 1}. Best is trial 41 with value: 0.8123999999999999.[0m
[32m[I 2022-06-22 13:04:09,742][0m Trial 61 finished with value: 0.8073 and parameters: {'lr': 0.002835345183665568, 'weight_decay': 0.0006940212125114623, 'dropout': 0.5734161176909578, 'patience': 60, 'lr_reduce_freq': 150, 'spt_alg': 'kruskal', 'spt_attr': 'edge_degree', 'manifold': 'PoincareBall', 'num_layers': 3, 'num_adj': 4, 'add_rate': 0.2745515935054119, 'tem': 0.6536390665532785, 'consis_rate': 1.3245205265078805, 'use_att': 1}. Best is trial 41 with value: 0.8123999999999999.[0m
[32m[I 2022-06-22 13:18:58,448][0m Trial 62 finished with value: 0.8054 and parameters: {'lr': 0.0037581878569474592, 'weight_decay': 0.0006347332078781212, 'dropout': 0.5784587411616325, 'patience': 60, 'lr_reduce_freq': 130, 'spt_alg': 'kruskal', 'spt_attr': 'edge_degree', 'manifold': 'PoincareBall', 'num_layers': 3, 'num_adj': 4, 'add_rate': 0.20897417861864687, 'tem': 0.6181613804014794, 'consis_rate': 1.232013227902637, 'use_att': 1}. Best is trial 41 with value: 0.8123999999999999.[0m
[32m[I 2022-06-22 13:37:23,992][0m Trial 63 finished with value: 0.813 and parameters: {'lr': 0.0022543927901253345, 'weight_decay': 0.0010810090558702214, 'dropout': 0.5309381974229802, 'patience': 60, 'lr_reduce_freq': 150, 'spt_alg': 'kruskal', 'spt_attr': 'edge_degree', 'manifold': 'PoincareBall', 'num_layers': 3, 'num_adj': 4, 'add_rate': 0.24045091907251886, 'tem': 0.7540093987008135, 'consis_rate': 1.4475500966730512, 'use_att': 1}. Best is trial 63 with value: 0.813.[0m
[32m[I 2022-06-22 13:53:30,269][0m Trial 64 finished with value: 0.8055000000000001 and parameters: {'lr': 0.0022526888058902075, 'weight_decay': 0.0010648372023692987, 'dropout': 0.4831580963487338, 'patience': 60, 'lr_reduce_freq': 150, 'spt_alg': 'kruskal', 'spt_attr': 'edge_degree', 'manifold': 'PoincareBall', 'num_layers': 3, 'num_adj': 4, 'add_rate': 0.16863971368402686, 'tem': 0.7778630547475951, 'consis_rate': 1.1642933026909856, 'use_att': 1}. Best is trial 63 with value: 0.813.[0m
[32m[I 2022-06-22 14:13:44,036][0m Trial 65 finished with value: 0.808 and parameters: {'lr': 0.0016112251336289382, 'weight_decay': 0.000957480957243914, 'dropout': 0.5139585133324305, 'patience': 60, 'lr_reduce_freq': 130, 'spt_alg': 'kruskal', 'spt_attr': 'edge_degree', 'manifold': 'PoincareBall', 'num_layers': 3, 'num_adj': 4, 'add_rate': 0.2298130012276062, 'tem': 0.7283170157918534, 'consis_rate': 1.4705257126522495, 'use_att': 1}. Best is trial 63 with value: 0.813.[0m
[32m[I 2022-06-22 14:33:51,262][0m Trial 66 finished with value: 0.8051 and parameters: {'lr': 0.0015097559523594344, 'weight_decay': 0.0010070686270581496, 'dropout': 0.5168527115170614, 'patience': 60, 'lr_reduce_freq': 130, 'spt_alg': 'kruskal', 'spt_attr': 'edge_degree', 'manifold': 'PoincareBall', 'num_layers': 3, 'num_adj': 4, 'add_rate': 0.2398534318505272, 'tem': 0.751091759866242, 'consis_rate': 1.4102104724912956, 'use_att': 1}. Best is trial 63 with value: 0.813.[0m
[32m[I 2022-06-22 14:49:08,231][0m Trial 67 finished with value: 0.8089000000000001 and parameters: {'lr': 0.0025081817219023746, 'weight_decay': 0.0015432101525565912, 'dropout': 0.6486831238128201, 'patience': 60, 'lr_reduce_freq': 130, 'spt_alg': 'kruskal', 'spt_attr': 'edge_degree', 'manifold': 'PoincareBall', 'num_layers': 3, 'num_adj': 2, 'add_rate': 0.22230830502069365, 'tem': 0.5247083309039989, 'consis_rate': 1.4447235678522912, 'use_att': 1}. Best is trial 63 with value: 0.813.[0m
[32m[I 2022-06-22 15:03:42,364][0m Trial 68 finished with value: 0.4685 and parameters: {'lr': 0.004925324784502726, 'weight_decay': 0.0015695215414872493, 'dropout': 0.7213987675415199, 'patience': 60, 'lr_reduce_freq': 130, 'spt_alg': 'kruskal', 'spt_attr': 'edge_degree', 'manifold': 'PoincareBall', 'num_layers': 4, 'num_adj': 2, 'add_rate': 0.3329616421255222, 'tem': 0.5279919538770468, 'consis_rate': 1.5820030381088623, 'use_att': 1}. Best is trial 63 with value: 0.813.[0m
[32m[I 2022-06-22 15:17:19,118][0m Trial 69 finished with value: 0.8071999999999999 and parameters: {'lr': 0.003222462881305638, 'weight_decay': 0.0012062638721084945, 'dropout': 0.6641200380722309, 'patience': 60, 'lr_reduce_freq': 150, 'spt_alg': 'kruskal', 'spt_attr': 'edge_degree', 'manifold': 'PoincareBall', 'num_layers': 3, 'num_adj': 2, 'add_rate': 0.28613930026330153, 'tem': 0.6087952189593833, 'consis_rate': 1.2160153138664123, 'use_att': 1}. Best is trial 63 with value: 0.813.[0m
[32m[I 2022-06-22 15:28:52,551][0m Trial 70 finished with value: 0.8 and parameters: {'lr': 0.002603224009642223, 'weight_decay': 0.0005353734684823282, 'dropout': 0.5980867589621977, 'patience': 60, 'lr_reduce_freq': 150, 'spt_alg': 'kruskal', 'spt_attr': 'edge_degree', 'manifold': 'PoincareBall', 'num_layers': 3, 'num_adj': 2, 'add_rate': 0.14680522786763972, 'tem': 0.49019930133225215, 'consis_rate': 1.1173352401775198, 'use_att': 1}. Best is trial 63 with value: 0.813.[0m
[32m[I 2022-06-22 15:47:10,501][0m Trial 71 finished with value: 0.8079000000000001 and parameters: {'lr': 0.0021125082601062286, 'weight_decay': 0.000793970921223553, 'dropout': 0.5381054732987918, 'patience': 60, 'lr_reduce_freq': 130, 'spt_alg': 'kruskal', 'spt_attr': 'edge_degree', 'manifold': 'PoincareBall', 'num_layers': 3, 'num_adj': 4, 'add_rate': 0.24047090497605594, 'tem': 0.709770307068467, 'consis_rate': 1.446782813450552, 'use_att': 1}. Best is trial 63 with value: 0.813.[0m
[32m[I 2022-06-22 16:12:37,505][0m Trial 72 finished with value: 0.8095000000000001 and parameters: {'lr': 0.0016624850807274096, 'weight_decay': 0.0009253808554632702, 'dropout': 0.6436354081236283, 'patience': 60, 'lr_reduce_freq': 130, 'spt_alg': 'kruskal', 'spt_attr': 'edge_degree', 'manifold': 'PoincareBall', 'num_layers': 3, 'num_adj': 6, 'add_rate': 0.1966139045692534, 'tem': 0.8125677735413487, 'consis_rate': 1.4800805090001905, 'use_att': 1}. Best is trial 63 with value: 0.813.[0m
[32m[I 2022-06-22 16:37:35,634][0m Trial 73 finished with value: 0.8099000000000001 and parameters: {'lr': 0.0021449055685161993, 'weight_decay': 0.0014394437253212938, 'dropout': 0.6247632046062674, 'patience': 60, 'lr_reduce_freq': 130, 'spt_alg': 'kruskal', 'spt_attr': 'edge_degree', 'manifold': 'PoincareBall', 'num_layers': 3, 'num_adj': 6, 'add_rate': 0.18559694147657016, 'tem': 0.6029441426788396, 'consis_rate': 1.3578613972366116, 'use_att': 1}. Best is trial 63 with value: 0.813.[0m
