[32m[I 2022-06-29 20:39:59,727][0m Trial 52 finished with value: 0.8061999999999999 and parameters: {'lr': 0.004579297143471623, 'weight_decay': 0.0007933344052222107, 'dropout': 0.5151146076684427, 'patience': 90, 'lr_reduce_freq': 110, 'spt_alg': 'kruskal', 'spt_attr': 'similarity', 'manifold': 'Hyperboloid', 'num_layers': 3, 'dim': 128, 'num_adj': 4, 'add_rate': 0.2964506264416985, 'tem': 1.383192285375257, 'consis_rate': 1.998091968869458, 'use_att': 1}. Best is trial 42 with value: 0.8126.[0m
[32m[I 2022-06-29 21:10:53,445][0m Trial 53 finished with value: 0.8057000000000001 and parameters: {'lr': 0.004567374453896347, 'weight_decay': 0.0007660978644709187, 'dropout': 0.5146394305621328, 'patience': 90, 'lr_reduce_freq': 120, 'spt_alg': 'kruskal', 'spt_attr': 'similarity', 'manifold': 'Hyperboloid', 'num_layers': 3, 'dim': 128, 'num_adj': 6, 'add_rate': 0.3599718792286111, 'tem': 1.38721056681672, 'consis_rate': 1.8011922582316409, 'use_att': 1}. Best is trial 42 with value: 0.8126.[0m

mean: 0.7998
[0.806 0.816 0.78  0.783 0.794 0.809 0.783 0.815 0.818 0.794]
cur_param: {'lr': 0.01079413305357339, 'weight_decay': 0.0005163434153154353, 'dropout': 0.40015411910571497, 'patience': 90, 'lr_reduce_freq': 120, 'spt_alg': 'prim', 'spt_attr': 'similarity', 'manifold': 'Hyperboloid', 'num_layers': 3, 'dim': 144, 'num_adj': 6, 'add_rate': 0.10608561624525137, 'tem': 1.4541634248773148, 'consis_rate': 1.8595153069504844, 'use_att': 1}
mean: 0.8069000000000001
[0.794 0.809 0.804 0.803 0.812 0.817 0.797 0.794 0.813 0.826]
cur_param: {'lr': 0.010559782398272429, 'weight_decay': 0.0005898828704243675, 'dropout': 0.6329207136918461, 'patience': 100, 'lr_reduce_freq': 50, 'spt_alg': 'prim', 'spt_attr': 'similarity', 'manifold': 'Hyperboloid', 'num_layers': 5, 'dim': 128, 'num_adj': 6, 'add_rate': 0.12950792495203478, 'tem': 1.4966897254975493, 'consis_rate': 1.8349371341400917, 'use_att': 1}
mean: 0.7603
[0.674 0.767 0.814 0.775 0.788 0.736 0.757 0.747 0.752 0.793]
cur_param: {'lr': 0.004093003167778761, 'weight_decay': 0.010690981245113888, 'dropout': 0.39374029780216185, 'patience': 80, 'lr_reduce_freq': 100, 'spt_alg': 'kruskal', 'spt_attr': 'edge_degree', 'manifold': 'Hyperboloid', 'num_layers': 4, 'dim': 176, 'num_adj': 6, 'add_rate': 0.20223050245660268, 'tem': 1.419680099130638, 'consis_rate': 1.5345756278942262, 'use_att': 1}
mean: 0.3218
[0.319 0.319 0.319 0.319 0.34  0.319 0.319 0.326 0.319 0.319]
cur_param: {'lr': 0.0015671174329752095, 'weight_decay': 0.004183095302804165, 'dropout': 0.328060556449083, 'patience': 90, 'lr_reduce_freq': 80, 'spt_alg': 'prim', 'spt_attr': 'similarity', 'manifold': 'Hyperboloid', 'num_layers': 3, 'dim': 240, 'num_adj': 6, 'add_rate': 0.36465056543848723, 'tem': 1.3854203168958068, 'consis_rate': 1.397167658929994, 'use_att': 1}
mean: 0.5757000000000001
[0.7   0.541 0.603 0.763 0.401 0.545 0.456 0.573 0.525 0.65 ]
cur_param: {'lr': 0.006921042175563011, 'weight_decay': 0.0005106270980307721, 'dropout': 0.4566895083885206, 'patience': 90, 'lr_reduce_freq': 120, 'spt_alg': 'prim', 'spt_attr': 'similarity', 'manifold': 'Hyperboloid', 'num_layers': 3, 'dim': 192, 'num_adj': 4, 'add_rate': 0.26976708745881417, 'tem': 1.3309456145775527, 'consis_rate': 1.9399346574916587, 'use_att': 1}
mean: 0.8099000000000001
[0.808 0.799 0.804 0.8   0.819 0.825 0.799 0.823 0.822 0.8  ]
cur_param: {'lr': 0.01330294570916532, 'weight_decay': 0.0007878055268694916, 'dropout': 0.47634906539179933, 'patience': 90, 'lr_reduce_freq': 110, 'spt_alg': 'prim', 'spt_attr': 'similarity', 'manifold': 'Hyperboloid', 'num_layers': 3, 'dim': 192, 'num_adj': 4, 'add_rate': 0.12083284552502005, 'tem': 1.4488371338234254, 'consis_rate': 1.9227284936581208, 'use_att': 1}
mean: 0.8126
[0.823 0.81  0.808 0.801 0.813 0.808 0.822 0.817 0.816 0.808]
cur_param: {'lr': 0.009022601854450564, 'weight_decay': 0.0007690752485801926, 'dropout': 0.4823149611371, 'patience': 90, 'lr_reduce_freq': 110, 'spt_alg': 'prim', 'spt_attr': 'similarity', 'manifold': 'Hyperboloid', 'num_layers': 3, 'dim': 192, 'num_adj': 4, 'add_rate': 0.1049227380987231, 'tem': 1.4508062353788644, 'consis_rate': 1.9026467559585742, 'use_att': 1}
mean: 0.805
[0.807 0.805 0.797 0.799 0.8   0.803 0.802 0.823 0.809 0.805]
cur_param: {'lr': 0.0005754368982901885, 'weight_decay': 0.0005576440753216482, 'dropout': 0.5435707793984902, 'patience': 100, 'lr_reduce_freq': 120, 'spt_alg': 'prim', 'spt_attr': 'similarity', 'manifold': 'Hyperboloid', 'num_layers': 3, 'dim': 160, 'num_adj': 4, 'add_rate': 0.14726244433730787, 'tem': 1.3537159998210297, 'consis_rate': 1.827859612353348, 'use_att': 1}
mean: 0.7936
[0.799 0.805 0.797 0.787 0.787 0.794 0.778 0.812 0.799 0.778]
cur_param: {'lr': 0.007248977653419399, 'weight_decay': 0.0008668290858140914, 'dropout': 0.49899382986181245, 'patience': 100, 'lr_reduce_freq': 140, 'spt_alg': 'prim', 'spt_attr': 'edge_degree', 'manifold': 'Hyperboloid', 'num_layers': 5, 'dim': 208, 'num_adj': 4, 'add_rate': 0.1854285819850892, 'tem': 0.9618683628303599, 'consis_rate': 1.9128060039755712, 'use_att': 1}
mean: 0.7528999999999999
[0.786 0.758 0.755 0.775 0.689 0.721 0.793 0.732 0.765 0.755]
cur_param: {'lr': 0.004440866870347964, 'weight_decay': 0.0005249645215017963, 'dropout': 0.4632749230585907, 'patience': 90, 'lr_reduce_freq': 100, 'spt_alg': 'kruskal', 'spt_attr': 'similarity', 'manifold': 'Hyperboloid', 'num_layers': 3, 'dim': 224, 'num_adj': 6, 'add_rate': 0.30609437027363234, 'tem': 1.4590366434840898, 'consis_rate': 1.7921959400107572, 'use_att': 1}
mean: 0.8066000000000001
[0.793 0.809 0.814 0.792 0.804 0.801 0.811 0.816 0.814 0.812]
cur_param: {'lr': 0.0033922420522098846, 'weight_decay': 0.0005216623745115909, 'dropout': 0.46136674583346704, 'patience': 100, 'lr_reduce_freq': 90, 'spt_alg': 'kruskal', 'spt_attr': 'similarity', 'manifold': 'Hyperboloid', 'num_layers': 3, 'dim': 240, 'num_adj': 6, 'add_rate': 0.31756749083224667, 'tem': 1.4516457725265113, 'consis_rate': 1.7537461111777537, 'use_att': 1}
mean: 0.8
[0.808 0.8   0.791 0.817 0.799 0.796 0.797 0.803 0.788 0.801]
cur_param: {'lr': 0.0010373323258166256, 'weight_decay': 0.0006767642555789954, 'dropout': 0.6199111102588918, 'patience': 90, 'lr_reduce_freq': 110, 'spt_alg': 'kruskal', 'spt_attr': 'similarity', 'manifold': 'Hyperboloid', 'num_layers': 4, 'dim': 224, 'num_adj': 6, 'add_rate': 0.29311771315643065, 'tem': 1.4995721546578547, 'consis_rate': 1.6227195364652607, 'use_att': 1}
mean: 0.7908000000000001
[0.802 0.786 0.807 0.778 0.796 0.789 0.785 0.782 0.79  0.793]
cur_param: {'lr': 0.0044634966096247786, 'weight_decay': 0.0010022279321017448, 'dropout': 0.5509144519112862, 'patience': 90, 'lr_reduce_freq': 90, 'spt_alg': 'kruskal', 'spt_attr': 'similarity', 'manifold': 'Hyperboloid', 'num_layers': 3, 'dim': 144, 'num_adj': 6, 'add_rate': 0.132771385615799, 'tem': 1.403889082109064, 'consis_rate': 1.5651070644082186, 'use_att': 1}
mean: 0.7995
[0.804 0.79  0.804 0.799 0.794 0.791 0.796 0.8   0.803 0.814]
cur_param: {'lr': 0.002078503555528158, 'weight_decay': 0.0006448196407802192, 'dropout': 0.6929992494872514, 'patience': 90, 'lr_reduce_freq': 130, 'spt_alg': 'kruskal', 'spt_attr': 'edge_degree', 'manifold': 'Hyperboloid', 'num_layers': 5, 'dim': 272, 'num_adj': 6, 'add_rate': 0.17972411844911343, 'tem': 1.4465958349228658, 'consis_rate': 1.826706926289516, 'use_att': 1}
mean: 0.7542
[0.678 0.758 0.768 0.777 0.766 0.718 0.772 0.781 0.75  0.774]
cur_param: {'lr': 0.014888952885291091, 'weight_decay': 0.0005083169557628017, 'dropout': 0.38297097309110545, 'patience': 90, 'lr_reduce_freq': 100, 'spt_alg': 'kruskal', 'spt_attr': 'similarity', 'manifold': 'Hyperboloid', 'num_layers': 3, 'dim': 176, 'num_adj': 4, 'add_rate': 0.23919043707786017, 'tem': 1.3499756978626136, 'consis_rate': 1.9420327610297614, 'use_att': 1}
mean: 0.8027000000000001
[0.803 0.783 0.808 0.813 0.805 0.8   0.815 0.803 0.791 0.806]
cur_param: {'lr': 0.004579297143471623, 'weight_decay': 0.0007933344052222107, 'dropout': 0.5151146076684427, 'patience': 90, 'lr_reduce_freq': 110, 'spt_alg': 'kruskal', 'spt_attr': 'similarity', 'manifold': 'Hyperboloid', 'num_layers': 3, 'dim': 128, 'num_adj': 4, 'add_rate': 0.2964506264416985, 'tem': 1.383192285375257, 'consis_rate': 1.998091968869458, 'use_att': 1}
mean: 0.8061999999999999
[0.805 0.815 0.818 0.809 0.804 0.803 0.815 0.781 0.803 0.809]
cur_param: {'lr': 0.004567374453896347, 'weight_decay': 0.0007660978644709187, 'dropout': 0.5146394305621328, 'patience': 90, 'lr_reduce_freq': 120, 'spt_alg': 'kruskal', 'spt_attr': 'similarity', 'manifold': 'Hyperboloid', 'num_layers': 3, 'dim': 128, 'num_adj': 6, 'add_rate': 0.3599718792286111, 'tem': 1.38721056681672, 'consis_rate': 1.8011922582316409, 'use_att': 1}
mean: 0.8057000000000001
[0.808 0.809 0.794 0.802 0.81  0.808 0.812 0.809 0.785 0.82 ]
cur_param: {'lr': 0.007058424166590886, 'weight_decay': 0.0005026177492786483, 'dropout': 0.4811016580273568, 'patience': 100, 'lr_reduce_freq': 110, 'spt_alg': 'kruskal', 'spt_attr': 'similarity', 'manifold': 'Hyperboloid', 'num_layers': 3, 'dim': 160, 'num_adj': 4, 'add_rate': 0.31338850410553576, 'tem': 1.4622696285728314, 'consis_rate': 1.7120020938569467, 'use_att': 1}
mean:[32m[I 2022-06-29 21:29:48,480][0m Trial 54 finished with value: 0.8098000000000001 and parameters: {'lr': 0.007058424166590886, 'weight_decay': 0.0005026177492786483, 'dropout': 0.4811016580273568, 'patience': 100, 'lr_reduce_freq': 110, 'spt_alg': 'kruskal', 'spt_attr': 'similarity', 'manifold': 'Hyperboloid', 'num_layers': 3, 'dim': 160, 'num_adj': 4, 'add_rate': 0.31338850410553576, 'tem': 1.4622696285728314, 'consis_rate': 1.7120020938569467, 'use_att': 1}. Best is trial 42 with value: 0.8126.[0m
[32m[I 2022-06-29 21:51:30,129][0m Trial 55 finished with value: 0.8084999999999999 and parameters: {'lr': 0.003219318770090648, 'weight_decay': 0.0006041847668314073, 'dropout': 0.46702408139861146, 'patience': 100, 'lr_reduce_freq': 120, 'spt_alg': 'kruskal', 'spt_attr': 'similarity', 'manifold': 'Hyperboloid', 'num_layers': 3, 'dim': 160, 'num_adj': 4, 'add_rate': 0.6269803238503611, 'tem': 1.4723963612769837, 'consis_rate': 1.7159539980391179, 'use_att': 1}. Best is trial 42 with value: 0.8126.[0m
[32m[I 2022-06-29 22:18:47,808][0m Trial 56 finished with value: 0.7976 and parameters: {'lr': 0.0011537940591875363, 'weight_decay': 0.0006494682203185937, 'dropout': 0.3492587893779867, 'patience': 100, 'lr_reduce_freq': 140, 'spt_alg': 'kruskal', 'spt_attr': 'similarity', 'manifold': 'Hyperboloid', 'num_layers': 3, 'dim': 160, 'num_adj': 4, 'add_rate': 0.6124089241263264, 'tem': 1.4748132129214742, 'consis_rate': 1.7202138015216117, 'use_att': 1}. Best is trial 42 with value: 0.8126.[0m
[32m[I 2022-06-29 22:37:50,674][0m Trial 57 finished with value: 0.8042 and parameters: {'lr': 0.007160163913827128, 'weight_decay': 0.0009653674890409558, 'dropout': 0.40419400827539864, 'patience': 100, 'lr_reduce_freq': 130, 'spt_alg': 'kruskal', 'spt_attr': 'similarity', 'manifold': 'Hyperboloid', 'num_layers': 3, 'dim': 192, 'num_adj': 4, 'add_rate': 0.6581070453840575, 'tem': 0.7098049653012708, 'consis_rate': 1.3103181148926613, 'use_att': 1}. Best is trial 42 with value: 0.8126.[0m
[32m[I 2022-06-29 23:01:03,060][0m Trial 58 finished with value: 0.8023999999999999 and parameters: {'lr': 0.003077272801659419, 'weight_decay': 0.0005007323272461124, 'dropout': 0.4798779801168745, 'patience': 100, 'lr_reduce_freq': 120, 'spt_alg': 'kruskal', 'spt_attr': 'similarity', 'manifold': 'Hyperboloid', 'num_layers': 3, 'dim': 160, 'num_adj': 4, 'add_rate': 0.5632960752512071, 'tem': 1.3349595496023927, 'consis_rate': 1.2002442305074594, 'use_att': 1}. Best is trial 42 with value: 0.8126.[0m
[32m[I 2022-06-29 23:19:17,400][0m Trial 59 finished with value: 0.8100999999999999 and parameters: {'lr': 0.01589975063419279, 'weight_decay': 0.0006136859783174466, 'dropout': 0.6040516235279794, 'patience': 100, 'lr_reduce_freq': 110, 'spt_alg': 'kruskal', 'spt_attr': 'similarity', 'manifold': 'Hyperboloid', 'num_layers': 3, 'dim': 144, 'num_adj': 4, 'add_rate': 0.7210303769799133, 'tem': 1.4329710031740128, 'consis_rate': 1.395271458225592, 'use_att': 1}. Best is trial 42 with value: 0.8126.[0m
[32m[I 2022-06-29 23:54:34,656][0m Trial 60 finished with value: 0.7994000000000001 and parameters: {'lr': 0.016206421374110512, 'weight_decay': 0.0006225699938816, 'dropout': 0.609211572575587, 'patience': 100, 'lr_reduce_freq': 110, 'spt_alg': 'kruskal', 'spt_attr': 'similarity', 'manifold': 'Hyperboloid', 'num_layers': 4, 'dim': 304, 'num_adj': 4, 'add_rate': 0.7890561407908014, 'tem': 1.4200490054214454, 'consis_rate': 1.3593737588599104, 'use_att': 1}. Best is trial 42 with value: 0.8126.[0m
[32m[I 2022-06-30 00:09:52,298][0m Trial 61 finished with value: 0.3189 and parameters: {'lr': 0.02274544192622196, 'weight_decay': 0.032715953534616184, 'dropout': 0.5622886049806173, 'patience': 100, 'lr_reduce_freq': 120, 'spt_alg': 'kruskal', 'spt_attr': 'similarity', 'manifold': 'Hyperboloid', 'num_layers': 3, 'dim': 144, 'num_adj': 4, 'add_rate': 0.7340884308794589, 'tem': 1.4247670053251213, 'consis_rate': 1.0628974852575093, 'use_att': 1}. Best is trial 42 with value: 0.8126.[0m
[32m[I 2022-06-30 00:35:20,612][0m Trial 62 finished with value: 0.8132999999999999 and parameters: {'lr': 0.012684168401093368, 'weight_decay': 0.0007862387755269403, 'dropout': 0.7467847427456373, 'patience': 100, 'lr_reduce_freq': 110, 'spt_alg': 'kruskal', 'spt_attr': 'similarity', 'manifold': 'Hyperboloid', 'num_layers': 3, 'dim': 176, 'num_adj': 4, 'add_rate': 0.6878049184840925, 'tem': 1.4980369409269716, 'consis_rate': 1.5772492365573947, 'use_att': 1}. Best is trial 62 with value: 0.8132999999999999.[0m
[32m[I 2022-06-30 01:05:30,795][0m Trial 63 finished with value: 0.8084000000000001 and parameters: {'lr': 0.013535976678930821, 'weight_decay': 0.0013176608322076238, 'dropout': 0.7965933439326921, 'patience': 100, 'lr_reduce_freq': 110, 'spt_alg': 'kruskal', 'spt_attr': 'similarity', 'manifold': 'Hyperboloid', 'num_layers': 3, 'dim': 176, 'num_adj': 4, 'add_rate': 0.6746215234201751, 'tem': 1.4961045850476016, 'consis_rate': 1.5770419658796468, 'use_att': 1}. Best is trial 62 with value: 0.8132999999999999.[0m
[32m[I 2022-06-30 01:28:19,487][0m Trial 64 finished with value: 0.8172 and parameters: {'lr': 0.008976279102267361, 'weight_decay': 0.0007707148794540221, 'dropout': 0.7324950843640361, 'patience': 100, 'lr_reduce_freq': 100, 'spt_alg': 'kruskal', 'spt_attr': 'similarity', 'manifold': 'Hyperboloid', 'num_layers': 3, 'dim': 192, 'num_adj': 4, 'add_rate': 0.7409102577604596, 'tem': 1.2037656178134086, 'consis_rate': 1.6929308934789693, 'use_att': 1}. Best is trial 64 with value: 0.8172.[0m
[32m[I 2022-06-30 01:51:52,468][0m Trial 65 finished with value: 0.8145 and parameters: {'lr': 0.00893988970325767, 'weight_decay': 0.0010599924036775177, 'dropout': 0.7230823493551355, 'patience': 100, 'lr_reduce_freq': 100, 'spt_alg': 'kruskal', 'spt_attr': 'similarity', 'manifold': 'Hyperboloid', 'num_layers': 3, 'dim': 192, 'num_adj': 4, 'add_rate': 0.7425166919944435, 'tem': 1.1433954548050052, 'consis_rate': 1.4637607492349825, 'use_att': 1}. Best is trial 64 with value: 0.8172.[0m
[32m[I 2022-06-30 02:16:50,011][0m Trial 66 finished with value: 0.8150000000000001 and parameters: {'lr': 0.017597951226755042, 'weight_decay': 0.001047313501324221, 'dropout': 0.7436517797654302, 'patience': 100, 'lr_reduce_freq': 90, 'spt_alg': 'kruskal', 'spt_attr': 'similarity', 'manifold': 'Hyperboloid', 'num_layers': 3, 'dim': 192, 'num_adj': 4, 'add_rate': 0.7862599372577278, 'tem': 1.1452020695538647, 'consis_rate': 1.482891320148782, 'use_att': 1}. Best is trial 64 with value: 0.8172.[0m
[32m[I 2022-06-30 02:43:16,858][0m Trial 67 finished with value: 0.8119999999999999 and parameters: {'lr': 0.017217319246301543, 'weight_decay': 0.001025065776910963, 'dropout': 0.7337653394173413, 'patience': 100, 'lr_reduce_freq': 90, 'spt_alg': 'kruskal', 'spt_attr': 'similarity', 'manifold': 'Hyperboloid', 'num_layers': 3, 'dim': 208, 'num_adj': 4, 'add_rate': 0.8026957489285665, 'tem': 1.2015613130103866, 'consis_rate': 1.435083628172255, 'use_att': 1}. Best is trial 64 with value: 0.8172.[0m
[32m[I 2022-06-30 03:07:41,001][0m Trial 68 finished with value: 0.8025 and parameters: {'lr': 0.023248392555531672, 'weight_decay': 0.0010580669519126592, 'dropout': 0.7555925051636767, 'patience': 100, 'lr_reduce_freq': 90, 'spt_alg': 'kruskal', 'spt_attr': 'similarity', 'manifold': 'Hyperboloid', 'num_layers': 3, 'dim': 208, 'num_adj': 4, 'add_rate': 0.8036533671616527, 'tem': 1.1467138063251099, 'consis_rate': 1.45694673133731, 'use_att': 1}. Best is trial 64 with value: 0.8172.[0m
[32m[I 2022-06-30 03:34:55,844][0m Trial 69 finished with value: 0.8122999999999999 and parameters: {'lr': 0.01765844549945957, 'weight_decay': 0.0014639536304191917, 'dropout': 0.7347502435242059, 'patience': 100, 'lr_reduce_freq': 90, 'spt_alg': 'kruskal', 'spt_attr': 'similarity', 'manifold': 'Hyperboloid', 'num_layers': 3, 'dim': 256, 'num_adj': 4, 'add_rate': 0.7384882379165627, 'tem': 1.0479952674675417, 'consis_rate': 1.1765861285488783, 'use_att': 1}. Best is trial 64 with value: 0.8172.[0m
[32m[I 2022-06-30 04:01:33,507][0m Trial 70 finished with value: 0.7779 and parameters: {'lr': 0.034982187846751805, 'weight_decay': 0.002604885430201351, 'dropout': 0.7374018526642574, 'patience': 100, 'lr_reduce_freq': 90, 'spt_alg': 'kruskal', 'spt_attr': 'similarity', 'manifold': 'Hyperboloid', 'num_layers': 3, 'dim': 240, 'num_adj': 4, 'add_rate': 0.8949142436554082, 'tem': 1.0467360619456532, 'consis_rate': 0.9295295425221882, 'use_att': 1}. Best is trial 64 with value: 0.8172.[0m
