[32m[I 2022-06-29 14:08:35,632][0m Trial 26 finished with value: 0.8028000000000001 and parameters: {'lr': 0.007643838693281581, 'weight_decay': 0.0013753146941547032, 'dropout': 0.19348210625942056, 'patience': 70, 'lr_reduce_freq': 110, 'spt_alg': 'kruskal', 'spt_attr': 'edge_degree', 'manifold': 'PoincareBall', 'num_layers': 3, 'dim': 192, 'num_adj': 6, 'add_rate': 0.21272804958210864, 'tem': 0.9928902204890859, 'consis_rate': 1.4690402937326805, 'use_att': 1}. Best is trial 14 with value: 0.8093.[0m
[32m[I 2022-06-29 14:18:58,741][0m Trial 27 finished with value: 0.8083 and parameters: {'lr': 0.004292184784267118, 'weight_decay': 0.000812901082768978, 'dropout': 0.3008180375853361, 'patience': 60, 'lr_reduce_freq': 80, 'spt_alg': 'prim', 'spt_attr': 'edge_degree', 'manifold': 'PoincareBall', 'num_layers': 3, 'dim': 352, 'num_adj': 4, 'add_rate': 0.28611409951221645, 'tem': 0.730511635485755, 'consis_rate': 1.8621637775442617, 'use_att': 1}. Best is trial 14 with value: 0.8093.[0m
[32m[I 2022-06-29 14:58:21,238][0m Trial 28 finished with value: 0.7189 and parameters: {'lr': 0.0019927047497929652, 'weight_decay': 0.012806300364601812, 'dropout': 0.23416112065633404, 'patience': 70, 'lr_reduce_freq': 130, 'spt_alg': 'kruskal', 'spt_attr': 'edge_degree', 'manifold': 'PoincareBall', 'num_layers': 3, 'dim': 384, 'num_adj': 6, 'add_rate': 0.3258684336811896, 'tem': 1.1480996552351994, 'consis_rate': 1.2028281525546303, 'use_att': 1}. Best is trial 14 with value: 0.8093.[0m
[32m[I 2022-06-29 15:18:13,863][0m Trial 29 finished with value: 0.31989999999999996 and parameters: {'lr': 0.00957206089810229, 'weight_decay': 0.006794318366763016, 'dropout': 0.3964026077077534, 'patience': 80, 'lr_reduce_freq': 110, 'spt_alg': 'kruskal', 'spt_attr': 'edge_degree', 'manifold': 'Hyperboloid', 'num_layers': 5, 'dim': 128, 'num_adj': 2, 'add_rate': 0.18101199515159705, 'tem': 0.6155412716126358, 'consis_rate': 0.8886273073703412, 'use_att': 1}. Best is trial 14 with value: 0.8093.[0m
[32m[I 2022-06-29 15:45:16,075][0m Trial 30 finished with value: 0.7979 and parameters: {'lr': 0.014792542660089992, 'weight_decay': 0.0017313585193298384, 'dropout': 0.13337579802581467, 'patience': 50, 'lr_reduce_freq': 70, 'spt_alg': 'kruskal', 'spt_attr': 'edge_degree', 'manifold': 'PoincareBall', 'num_layers': 4, 'dim': 448, 'num_adj': 6, 'add_rate': 0.4402765736045387, 'tem': 0.8775909070049519, 'consis_rate': 1.598750056850831, 'use_att': 1}. Best is trial 14 with value: 0.8093.[0m
[32m[I 2022-06-29 15:58:20,410][0m Trial 31 finished with value: 0.8051999999999999 and parameters: {'lr': 0.004973920912392952, 'weight_decay': 0.0009183834069146803, 'dropout': 0.2957186146248309, 'patience': 60, 'lr_reduce_freq': 80, 'spt_alg': 'prim', 'spt_attr': 'edge_degree', 'manifold': 'PoincareBall', 'num_layers': 3, 'dim': 368, 'num_adj': 4, 'add_rate': 0.30351064419223983, 'tem': 0.739743484460909, 'consis_rate': 1.8723576575200989, 'use_att': 1}. Best is trial 14 with value: 0.8093.[0m
[32m[I 2022-06-29 16:09:49,280][0m Trial 32 finished with value: 0.8105 and parameters: {'lr': 0.00334861897358168, 'weight_decay': 0.0007909481891296183, 'dropout': 0.45034203718390997, 'patience': 60, 'lr_reduce_freq': 40, 'spt_alg': 'prim', 'spt_attr': 'edge_degree', 'manifold': 'PoincareBall', 'num_layers': 3, 'dim': 336, 'num_adj': 4, 'add_rate': 0.26124044321016693, 'tem': 0.7364399962582358, 'consis_rate': 1.8341579836838529, 'use_att': 1}. Best is trial 32 with value: 0.8105.[0m
[32m[I 2022-06-29 16:20:38,074][0m Trial 33 finished with value: 0.8091000000000002 and parameters: {'lr': 0.002410653053161328, 'weight_decay': 0.0005251777247584432, 'dropout': 0.4355087385116526, 'patience': 60, 'lr_reduce_freq': 40, 'spt_alg': 'prim', 'spt_attr': 'edge_degree', 'manifold': 'PoincareBall', 'num_layers': 3, 'dim': 320, 'num_adj': 4, 'add_rate': 0.11407330210069153, 'tem': 0.5951993553131006, 'consis_rate': 0.6387205403631502, 'use_att': 1}. Best is trial 32 with value: 0.8105.[0m
[32m[I 2022-06-29 16:51:15,582][0m Trial 34 finished with value: 0.7133999999999999 and parameters: {'lr': 0.0007373514371298926, 'weight_decay': 0.0007085883212574819, 'dropout': 0.4428098023157083, 'patience': 70, 'lr_reduce_freq': 40, 'spt_alg': 'prim', 'spt_attr': 'edge_degree', 'manifold': 'Hyperboloid', 'num_layers': 3, 'dim': 304, 'num_adj': 4, 'add_rate': 0.11496222555935096, 'tem': 0.5854379636232276, 'consis_rate': 0.6172497094596537, 'use_att': 1}. Best is trial 32 with value: 0.8105.[0m
[32m[I 2022-06-29 17:01:21,271][0m Trial 35 finished with value: 0.21869999999999998 and parameters: {'lr': 0.002608507026156288, 'weight_decay': 0.043762083928058325, 'dropout': 0.4711910324292651, 'patience': 50, 'lr_reduce_freq': 40, 'spt_alg': 'prim', 'spt_attr': 'edge_degree', 'manifold': 'PoincareBall', 'num_layers': 4, 'dim': 432, 'num_adj': 4, 'add_rate': 0.16528062339309912, 'tem': 0.532073215505993, 'consis_rate': 0.38918289126802313, 'use_att': 1}. Best is trial 32 with value: 0.8105.[0m

mean: 0.8036000000000001
[0.816 0.794 0.783 0.813 0.817 0.807 0.797 0.789 0.801 0.819]
cur_param: {'lr': 0.031249074853728534, 'weight_decay': 0.0024970216461010102, 'dropout': 0.5025431052096864, 'patience': 80, 'lr_reduce_freq': 150, 'spt_alg': 'kruskal', 'spt_attr': 'edge_degree', 'manifold': 'PoincareBall', 'num_layers': 3, 'dim': 272, 'num_adj': 6, 'add_rate': 0.5026065774825106, 'tem': 0.6847744865626155, 'consis_rate': 1.7660435353308264, 'use_att': 1}
mean: 0.8072999999999999
[0.805 0.818 0.804 0.814 0.803 0.819 0.814 0.812 0.779 0.805]
cur_param: {'lr': 0.07721481053587224, 'weight_decay': 0.010692654784181735, 'dropout': 0.3365788114076297, 'patience': 100, 'lr_reduce_freq': 120, 'spt_alg': 'kruskal', 'spt_attr': 'edge_degree', 'manifold': 'PoincareBall', 'num_layers': 5, 'dim': 176, 'num_adj': 4, 'add_rate': 0.703045478259117, 'tem': 1.0728856273741547, 'consis_rate': 1.5107941870548827, 'use_att': 1}
mean: 0.319
[0.319 0.319 0.319 0.319 0.319 0.319 0.319 0.319 0.319 0.319]
cur_param: {'lr': 0.011734947974120225, 'weight_decay': 0.003172131156941726, 'dropout': 0.5334709464741157, 'patience': 80, 'lr_reduce_freq': 150, 'spt_alg': 'kruskal', 'spt_attr': 'edge_degree', 'manifold': 'PoincareBall', 'num_layers': 3, 'dim': 272, 'num_adj': 6, 'add_rate': 0.10845886440486358, 'tem': 0.6597704425508438, 'consis_rate': 1.7675402356785994, 'use_att': 1}
mean: 0.8032999999999999
[0.813 0.795 0.813 0.823 0.788 0.79  0.808 0.79  0.802 0.811]
cur_param: {'lr': 0.03484174520108495, 'weight_decay': 0.002530820862227674, 'dropout': 0.47722648749198887, 'patience': 90, 'lr_reduce_freq': 140, 'spt_alg': 'kruskal', 'spt_attr': 'edge_degree', 'manifold': 'PoincareBall', 'num_layers': 3, 'dim': 304, 'num_adj': 6, 'add_rate': 0.47658104127302314, 'tem': 0.672886930382985, 'consis_rate': 1.7891751393258268, 'use_att': 1}
mean: 0.8049999999999999
[0.804 0.806 0.797 0.807 0.789 0.806 0.826 0.804 0.815 0.796]
cur_param: {'lr': 0.024915872912198187, 'weight_decay': 0.0016276817666892622, 'dropout': 0.39306908119188116, 'patience': 60, 'lr_reduce_freq': 110, 'spt_alg': 'kruskal', 'spt_attr': 'edge_degree', 'manifold': 'PoincareBall', 'num_layers': 3, 'dim': 240, 'num_adj': 6, 'add_rate': 0.523893771485891, 'tem': 0.8309669144969537, 'consis_rate': 1.6238505682101396, 'use_att': 1}
mean: 0.8078
[0.809 0.794 0.805 0.789 0.805 0.812 0.819 0.794 0.829 0.822]
cur_param: {'lr': 0.006711152822467508, 'weight_decay': 0.0012675289973515583, 'dropout': 0.40548741855649734, 'patience': 60, 'lr_reduce_freq': 110, 'spt_alg': 'kruskal', 'spt_attr': 'edge_degree', 'manifold': 'PoincareBall', 'num_layers': 3, 'dim': 224, 'num_adj': 6, 'add_rate': 0.34951533396174045, 'tem': 0.8740004441889153, 'consis_rate': 1.2096193740516885, 'use_att': 1}
mean: 0.8088999999999998
[0.803 0.812 0.804 0.815 0.797 0.799 0.815 0.81  0.815 0.819]
cur_param: {'lr': 0.005536092369265179, 'weight_decay': 0.0051151347369885625, 'dropout': 0.27205812168807564, 'patience': 60, 'lr_reduce_freq': 90, 'spt_alg': 'kruskal', 'spt_attr': 'edge_degree', 'manifold': 'PoincareBall', 'num_layers': 3, 'dim': 160, 'num_adj': 6, 'add_rate': 0.355851632984297, 'tem': 0.8929638594606802, 'consis_rate': 1.1786805562970881, 'use_att': 1}
mean: 0.7992
[0.807 0.786 0.778 0.807 0.812 0.788 0.809 0.795 0.801 0.809]
cur_param: {'lr': 0.007643838693281581, 'weight_decay': 0.0013753146941547032, 'dropout': 0.19348210625942056, 'patience': 70, 'lr_reduce_freq': 110, 'spt_alg': 'kruskal', 'spt_attr': 'edge_degree', 'manifold': 'PoincareBall', 'num_layers': 3, 'dim': 192, 'num_adj': 6, 'add_rate': 0.21272804958210864, 'tem': 0.9928902204890859, 'consis_rate': 1.4690402937326805, 'use_att': 1}
mean: 0.8028000000000001
[0.77  0.815 0.797 0.817 0.815 0.791 0.809 0.816 0.799 0.799]
cur_param: {'lr': 0.004292184784267118, 'weight_decay': 0.000812901082768978, 'dropout': 0.3008180375853361, 'patience': 60, 'lr_reduce_freq': 80, 'spt_alg': 'prim', 'spt_attr': 'edge_degree', 'manifold': 'PoincareBall', 'num_layers': 3, 'dim': 352, 'num_adj': 4, 'add_rate': 0.28611409951221645, 'tem': 0.730511635485755, 'consis_rate': 1.8621637775442617, 'use_att': 1}
mean: 0.8083
[0.799 0.796 0.826 0.807 0.8   0.813 0.813 0.819 0.806 0.804]
cur_param: {'lr': 0.0019927047497929652, 'weight_decay': 0.012806300364601812, 'dropout': 0.23416112065633404, 'patience': 70, 'lr_reduce_freq': 130, 'spt_alg': 'kruskal', 'spt_attr': 'edge_degree', 'manifold': 'PoincareBall', 'num_layers': 3, 'dim': 384, 'num_adj': 6, 'add_rate': 0.3258684336811896, 'tem': 1.1480996552351994, 'consis_rate': 1.2028281525546303, 'use_att': 1}
mean: 0.7189
[0.793 0.383 0.795 0.399 0.791 0.77  0.81  0.823 0.817 0.808]
cur_param: {'lr': 0.00957206089810229, 'weight_decay': 0.006794318366763016, 'dropout': 0.3964026077077534, 'patience': 80, 'lr_reduce_freq': 110, 'spt_alg': 'kruskal', 'spt_attr': 'edge_degree', 'manifold': 'Hyperboloid', 'num_layers': 5, 'dim': 128, 'num_adj': 2, 'add_rate': 0.18101199515159705, 'tem': 0.6155412716126358, 'consis_rate': 0.8886273073703412, 'use_att': 1}
mean: 0.31989999999999996
[0.319 0.319 0.319 0.328 0.319 0.319 0.319 0.319 0.319 0.319]
cur_param: {'lr': 0.014792542660089992, 'weight_decay': 0.0017313585193298384, 'dropout': 0.13337579802581467, 'patience': 50, 'lr_reduce_freq': 70, 'spt_alg': 'kruskal', 'spt_attr': 'edge_degree', 'manifold': 'PoincareBall', 'num_layers': 4, 'dim': 448, 'num_adj': 6, 'add_rate': 0.4402765736045387, 'tem': 0.8775909070049519, 'consis_rate': 1.598750056850831, 'use_att': 1}
mean: 0.7979
[0.807 0.793 0.809 0.796 0.768 0.803 0.798 0.8   0.789 0.816]
cur_param: {'lr': 0.004973920912392952, 'weight_decay': 0.0009183834069146803, 'dropout': 0.2957186146248309, 'patience': 60, 'lr_reduce_freq': 80, 'spt_alg': 'prim', 'spt_attr': 'edge_degree', 'manifold': 'PoincareBall', 'num_layers': 3, 'dim': 368, 'num_adj': 4, 'add_rate': 0.30351064419223983, 'tem': 0.739743484460909, 'consis_rate': 1.8723576575200989, 'use_att': 1}
mean: 0.8051999999999999
[0.801 0.803 0.799 0.793 0.829 0.788 0.817 0.801 0.803 0.818]
cur_param: {'lr': 0.00334861897358168, 'weight_decay': 0.0007909481891296183, 'dropout': 0.45034203718390997, 'patience': 60, 'lr_reduce_freq': 40, 'spt_alg': 'prim', 'spt_attr': 'edge_degree', 'manifold': 'PoincareBall', 'num_layers': 3, 'dim': 336, 'num_adj': 4, 'add_rate': 0.26124044321016693, 'tem': 0.7364399962582358, 'consis_rate': 1.8341579836838529, 'use_att': 1}
mean: 0.8105
[0.802 0.804 0.815 0.808 0.812 0.814 0.808 0.808 0.814 0.82 ]
cur_param: {'lr': 0.002410653053161328, 'weight_decay': 0.0005251777247584432, 'dropout': 0.4355087385116526, 'patience': 60, 'lr_reduce_freq': 40, 'spt_alg': 'prim', 'spt_attr': 'edge_degree', 'manifold': 'PoincareBall', 'num_layers': 3, 'dim': 320, 'num_adj': 4, 'add_rate': 0.11407330210069153, 'tem': 0.5951993553131006, 'consis_rate': 0.6387205403631502, 'use_att': 1}
mean: 0.8091000000000002
[0.813 0.816 0.803 0.814 0.803 0.802 0.805 0.821 0.808 0.806]
cur_param: {'lr': 0.0007373514371298926, 'weight_decay': 0.0007085883212574819, 'dropout': 0.4428098023157083, 'patience': 70, 'lr_reduce_freq': 40, 'spt_alg': 'prim', 'spt_attr': 'edge_degree', 'manifold': 'Hyperboloid', 'num_layers': 3, 'dim': 304, 'num_adj': 4, 'add_rate': 0.11496222555935096, 'tem': 0.5854379636232276, 'consis_rate': 0.6172497094596537, 'use_att': 1}
mean: 0.7133999999999999
[0.78  0.584 0.738 0.752 0.662 0.747 0.77  0.722 0.771 0.608]
cur_param: {'lr': 0.002608507026156288, 'weight_decay': 0.043762083928058325, 'dropout': 0.4711910324292651, 'patience': 50, 'lr_reduce_freq': 40, 'spt_alg': 'prim', 'spt_attr': 'edge_degree', 'manifold': 'PoincareBall', 'num_layers': 4, 'dim': 432, 'num_adj': 4, 'add_rate': 0.16528062339309912, 'tem': 0.532073215505993, 'consis_rate': 0.38918289126802313, 'use_att': 1}
mean: 0.21869999999999998
[0.13  0.149 0.091 0.152 0.397 0.319 0.149 0.103 0.378 0.319]
cur_param: {'lr': 0.001060945920369604, 'weight_decay': 0.0005473503195369619, 'dropout': 0.6333774020726103, 'patience': 60, 'lr_reduce_freq': 40, 'spt_alg': 'prim', 'spt_attr': 'edge_degree', 'manifold': 'Hyperboloid', 'num_layers': 3, 'dim': 384, 'num_adj': 4, 'add_rate': 0.22446395985690654, 'tem': 0.5957241914703119, 'consis_rate': 0.5773653223555609, 'use_att': 1}[32m[I 2022-06-29 17:29:18,579][0m Trial 36 finished with value: 0.7973000000000001 and parameters: {'lr': 0.001060945920369604, 'weight_decay': 0.0005473503195369619, 'dropout': 0.6333774020726103, 'patience': 60, 'lr_reduce_freq': 40, 'spt_alg': 'prim', 'spt_attr': 'edge_degree', 'manifold': 'Hyperboloid', 'num_layers': 3, 'dim': 384, 'num_adj': 4, 'add_rate': 0.22446395985690654, 'tem': 0.5957241914703119, 'consis_rate': 0.5773653223555609, 'use_att': 1}. Best is trial 32 with value: 0.8105.[0m
[32m[I 2022-06-29 17:39:27,675][0m Trial 37 finished with value: 0.8036 and parameters: {'lr': 0.003910997260407336, 'weight_decay': 0.0005082401016917534, 'dropout': 0.35283197592047183, 'patience': 70, 'lr_reduce_freq': 30, 'spt_alg': 'prim', 'spt_attr': 'edge_degree', 'manifold': 'PoincareBall', 'num_layers': 3, 'dim': 480, 'num_adj': 4, 'add_rate': 0.13947948037636465, 'tem': 0.6996625602073209, 'consis_rate': 0.246460367956856, 'use_att': 1}. Best is trial 32 with value: 0.8105.[0m
[32m[I 2022-06-29 17:42:39,399][0m Trial 38 finished with value: 0.35319999999999996 and parameters: {'lr': 0.0024437646357757152, 'weight_decay': 0.003977620249460379, 'dropout': 0.5331717691338473, 'patience': 50, 'lr_reduce_freq': 50, 'spt_alg': 'prim', 'spt_attr': 'edge_degree', 'manifold': 'Hyperboloid', 'num_layers': 3, 'dim': 336, 'num_adj': 2, 'add_rate': 0.194218803069083, 'tem': 0.6330972920510431, 'consis_rate': 1.889097949741097, 'use_att': 0}. Best is trial 32 with value: 0.8105.[0m
[32m[I 2022-06-29 18:01:04,599][0m Trial 39 finished with value: 0.2853 and parameters: {'lr': 0.003628778367192679, 'weight_decay': 0.02470495274315283, 'dropout': 0.32987297250495906, 'patience': 70, 'lr_reduce_freq': 60, 'spt_alg': 'prim', 'spt_attr': 'edge_degree', 'manifold': 'PoincareBall', 'num_layers': 4, 'dim': 320, 'num_adj': 4, 'add_rate': 0.25570644369939566, 'tem': 0.7547129348550816, 'consis_rate': 1.9895958912248508, 'use_att': 1}. Best is trial 32 with value: 0.8105.[0m
[32m[I 2022-06-29 18:13:35,396][0m Trial 40 finished with value: 0.24010000000000004 and parameters: {'lr': 0.001472255292211868, 'weight_decay': 0.01612735606664143, 'dropout': 0.4467411565966155, 'patience': 50, 'lr_reduce_freq': 60, 'spt_alg': 'prim', 'spt_attr': 'similarity', 'manifold': 'PoincareBall', 'num_layers': 3, 'dim': 256, 'num_adj': 4, 'add_rate': 0.6774010615520817, 'tem': 0.8329952305965236, 'consis_rate': 0.6798318133208848, 'use_att': 1}. Best is trial 32 with value: 0.8105.[0m
[32m[I 2022-06-29 18:22:50,989][0m Trial 41 finished with value: 0.8055 and parameters: {'lr': 0.006901234228508943, 'weight_decay': 0.0011568515327782722, 'dropout': 0.38643016296004734, 'patience': 60, 'lr_reduce_freq': 40, 'spt_alg': 'prim', 'spt_attr': 'edge_degree', 'manifold': 'PoincareBall', 'num_layers': 3, 'dim': 208, 'num_adj': 4, 'add_rate': 0.14601724712441053, 'tem': 0.9026608350842079, 'consis_rate': 0.9998556478810802, 'use_att': 1}. Best is trial 32 with value: 0.8105.[0m
[32m[I 2022-06-29 18:36:39,136][0m Trial 42 finished with value: 0.8073 and parameters: {'lr': 0.009734887934961096, 'weight_decay': 0.0007688280555421815, 'dropout': 0.43443524798001465, 'patience': 60, 'lr_reduce_freq': 30, 'spt_alg': 'prim', 'spt_attr': 'edge_degree', 'manifold': 'PoincareBall', 'num_layers': 3, 'dim': 304, 'num_adj': 6, 'add_rate': 0.2418208217891614, 'tem': 0.7976761128207, 'consis_rate': 1.3331019047884358, 'use_att': 1}. Best is trial 32 with value: 0.8105.[0m
[32m[I 2022-06-29 18:50:48,985][0m Trial 43 finished with value: 0.8088 and parameters: {'lr': 0.002781998123300432, 'weight_decay': 0.0009754255324763199, 'dropout': 0.3731432807679522, 'patience': 60, 'lr_reduce_freq': 90, 'spt_alg': 'prim', 'spt_attr': 'edge_degree', 'manifold': 'PoincareBall', 'num_layers': 3, 'dim': 160, 'num_adj': 4, 'add_rate': 0.39866996370225294, 'tem': 0.97385593032668, 'consis_rate': 1.9031542626266424, 'use_att': 1}. Best is trial 32 with value: 0.8105.[0m
[32m[I 2022-06-29 18:54:05,490][0m Trial 44 finished with value: 0.7987 and parameters: {'lr': 0.0057408318285182055, 'weight_decay': 0.0018697200739228135, 'dropout': 0.49745527568942505, 'patience': 60, 'lr_reduce_freq': 100, 'spt_alg': 'kruskal', 'spt_attr': 'edge_degree', 'manifold': 'PoincareBall', 'num_layers': 3, 'dim': 416, 'num_adj': 6, 'add_rate': 0.25870480124290796, 'tem': 0.8511239583330891, 'consis_rate': 1.674385577029384, 'use_att': 0}. Best is trial 32 with value: 0.8105.[0m
[32m[I 2022-06-29 19:08:37,557][0m Trial 45 finished with value: 0.8101 and parameters: {'lr': 0.01931758913246494, 'weight_decay': 0.0012958388398054371, 'dropout': 0.41937110979781833, 'patience': 70, 'lr_reduce_freq': 50, 'spt_alg': 'prim', 'spt_attr': 'similarity', 'manifold': 'PoincareBall', 'num_layers': 3, 'dim': 352, 'num_adj': 4, 'add_rate': 0.35438430523596853, 'tem': 1.0472812795086377, 'consis_rate': 1.8254582855762236, 'use_att': 1}. Best is trial 32 with value: 0.8105.[0m
[32m[I 2022-06-29 20:13:41,276][0m Trial 46 finished with value: 0.7342000000000001 and parameters: {'lr': 0.018707396307713637, 'weight_decay': 0.0010098929154971916, 'dropout': 0.24282470571064477, 'patience': 70, 'lr_reduce_freq': 50, 'spt_alg': 'prim', 'spt_attr': 'similarity', 'manifold': 'Hyperboloid', 'num_layers': 5, 'dim': 512, 'num_adj': 4, 'add_rate': 0.5529638072877593, 'tem': 1.05685666236418, 'consis_rate': 1.8526634098480388, 'use_att': 1}. Best is trial 32 with value: 0.8105.[0m
[32m[I 2022-06-29 20:17:01,995][0m Trial 47 finished with value: 0.7912000000000001 and parameters: {'lr': 0.0564171818339133, 'weight_decay': 0.0006567788763038437, 'dropout': 0.32002946295224566, 'patience': 70, 'lr_reduce_freq': 40, 'spt_alg': 'prim', 'spt_attr': 'similarity', 'manifold': 'PoincareBall', 'num_layers': 4, 'dim': 352, 'num_adj': 2, 'add_rate': 0.10025995362102641, 'tem': 1.1136107934309583, 'consis_rate': 1.8153725666839065, 'use_att': 0}. Best is trial 32 with value: 0.8105.[0m
[32m[I 2022-06-29 20:32:23,185][0m Trial 48 finished with value: 0.8177 and parameters: {'lr': 0.012990931361752467, 'weight_decay': 0.00298476443096909, 'dropout': 0.7947732220716717, 'patience': 70, 'lr_reduce_freq': 30, 'spt_alg': 'prim', 'spt_attr': 'similarity', 'manifold': 'PoincareBall', 'num_layers': 3, 'dim': 400, 'num_adj': 4, 'add_rate': 0.19437315064894378, 'tem': 1.2121567192912577, 'consis_rate': 1.5479553178378858, 'use_att': 1}. Best is trial 48 with value: 0.8177.[0m
[32m[I 2022-06-29 20:48:30,750][0m Trial 49 finished with value: 0.8145 and parameters: {'lr': 0.011930259506412421, 'weight_decay': 0.003223315597268952, 'dropout': 0.6633821157676422, 'patience': 80, 'lr_reduce_freq': 30, 'spt_alg': 'prim', 'spt_attr': 'similarity', 'manifold': 'PoincareBall', 'num_layers': 3, 'dim': 416, 'num_adj': 4, 'add_rate': 0.19663994418388672, 'tem': 1.2432289089937894, 'consis_rate': 1.53820444890777, 'use_att': 1}. Best is trial 48 with value: 0.8177.[0m
[32m[I 2022-06-29 21:05:05,794][0m Trial 50 finished with value: 0.8111 and parameters: {'lr': 0.012146314266735377, 'weight_decay': 0.0031807854284401334, 'dropout': 0.6938988017900997, 'patience': 80, 'lr_reduce_freq': 30, 'spt_alg': 'prim', 'spt_attr': 'similarity', 'manifold': 'PoincareBall', 'num_layers': 3, 'dim': 416, 'num_adj': 4, 'add_rate': 0.4559340421588934, 'tem': 1.2498787975154453, 'consis_rate': 1.5213119541225488, 'use_att': 1}. Best is trial 48 with value: 0.8177.[0m
[32m[I 2022-06-29 21:23:07,619][0m Trial 51 finished with value: 0.8158 and parameters: {'lr': 0.011932264537357847, 'weight_decay': 0.0031319219901717655, 'dropout': 0.7973517915583828, 'patience': 80, 'lr_reduce_freq': 30, 'spt_alg': 'prim', 'spt_attr': 'similarity', 'manifold': 'PoincareBall', 'num_layers': 3, 'dim': 400, 'num_adj': 4, 'add_rate': 0.43966032008871886, 'tem': 1.243478479496787, 'consis_rate': 1.4811151311436723, 'use_att': 1}. Best is trial 48 with value: 0.8177.[0m
[32m[I 2022-06-29 21:36:44,387][0m Trial 52 finished with value: 0.8115 and parameters: {'lr': 0.012340249960801311, 'weight_decay': 0.002111027825283151, 'dropout': 0.793990040689638, 'patience': 80, 'lr_reduce_freq': 30, 'spt_alg': 'prim', 'spt_attr': 'similarity', 'manifold': 'PoincareBall', 'num_layers': 3, 'dim': 416, 'num_adj': 4, 'add_rate': 0.4290353104117041, 'tem': 1.2462257333304805, 'consis_rate': 1.5155885099566593, 'use_att': 1}. Best is trial 48 with value: 0.8177.[0m
