[32m[I 2022-06-30 19:00:19,057][0m Trial 107 finished with value: 0.319 and parameters: {'lr': 0.009230432508039853, 'weight_decay': 0.015784702290637637, 'dropout': 0.7499730295330741, 'patience': 100, 'lr_reduce_freq': 90, 'spt_alg': 'kruskal', 'spt_attr': 'similarity', 'manifold': 'Hyperboloid', 'num_layers': 3, 'dim': 320, 'num_adj': 4, 'add_rate': 0.4968105629796092, 'tem': 1.0930703302722762, 'consis_rate': 0.8466987124022464, 'use_att': 1}. Best is trial 103 with value: 0.8194000000000001.[0m

mean: 0.8141999999999999
[0.811 0.813 0.815 0.822 0.822 0.801 0.822 0.812 0.814 0.81 ]
cur_param: {'lr': 0.010385403977187496, 'weight_decay': 0.000935747101709217, 'dropout': 0.7969831015917712, 'patience': 100, 'lr_reduce_freq': 80, 'spt_alg': 'kruskal', 'spt_attr': 'similarity', 'manifold': 'Hyperboloid', 'num_layers': 3, 'dim': 176, 'num_adj': 4, 'add_rate': 0.6038053203822225, 'tem': 0.8700454983064971, 'consis_rate': 0.6595887078850294, 'use_att': 1}
mean: 0.8119
[0.797 0.807 0.814 0.814 0.809 0.802 0.821 0.82  0.818 0.817]
cur_param: {'lr': 0.006319878074830988, 'weight_decay': 0.0008428297787947504, 'dropout': 0.7596450239382597, 'patience': 50, 'lr_reduce_freq': 70, 'spt_alg': 'kruskal', 'spt_attr': 'similarity', 'manifold': 'Hyperboloid', 'num_layers': 3, 'dim': 176, 'num_adj': 4, 'add_rate': 0.5325668805857836, 'tem': 0.9259834163845524, 'consis_rate': 0.4784476806152831, 'use_att': 1}
mean: 0.8116
[0.813 0.805 0.819 0.813 0.8   0.814 0.818 0.818 0.809 0.807]
cur_param: {'lr': 0.011712076972865703, 'weight_decay': 0.0011185153779174801, 'dropout': 0.778882277764318, 'patience': 100, 'lr_reduce_freq': 80, 'spt_alg': 'kruskal', 'spt_attr': 'similarity', 'manifold': 'Hyperboloid', 'num_layers': 3, 'dim': 192, 'num_adj': 4, 'add_rate': 0.5929277853685382, 'tem': 0.9853299970718234, 'consis_rate': 0.7063703235057981, 'use_att': 1}
mean: 0.8180999999999999
[0.829 0.799 0.808 0.823 0.824 0.818 0.825 0.83  0.818 0.807]
cur_param: {'lr': 0.008801534097990385, 'weight_decay': 0.0012459372898549507, 'dropout': 0.7767228658142757, 'patience': 100, 'lr_reduce_freq': 80, 'spt_alg': 'kruskal', 'spt_attr': 'similarity', 'manifold': 'Hyperboloid', 'num_layers': 3, 'dim': 192, 'num_adj': 4, 'add_rate': 0.5954222245141921, 'tem': 0.9849014560880445, 'consis_rate': 0.7890815860641996, 'use_att': 1}
mean: 0.8106
[0.818 0.807 0.825 0.811 0.814 0.797 0.814 0.797 0.808 0.815]
cur_param: {'lr': 0.005267038391762602, 'weight_decay': 0.0011013542734606878, 'dropout': 0.7229484787974482, 'patience': 100, 'lr_reduce_freq': 70, 'spt_alg': 'kruskal', 'spt_attr': 'similarity', 'manifold': 'PoincareBall', 'num_layers': 3, 'dim': 192, 'num_adj': 4, 'add_rate': 0.5746924882207978, 'tem': 1.1746803368965815, 'consis_rate': 0.7143241882857245, 'use_att': 1}
mean: 0.8102
[0.819 0.829 0.805 0.818 0.803 0.813 0.789 0.811 0.808 0.807]
cur_param: {'lr': 0.011483409039272544, 'weight_decay': 0.000713341947119835, 'dropout': 0.7008446306335546, 'patience': 100, 'lr_reduce_freq': 80, 'spt_alg': 'kruskal', 'spt_attr': 'similarity', 'manifold': 'Hyperboloid', 'num_layers': 5, 'dim': 208, 'num_adj': 4, 'add_rate': 0.6450331429863111, 'tem': 0.9309637730592977, 'consis_rate': 0.5524470309863805, 'use_att': 1}
mean: 0.7558
[0.78  0.667 0.745 0.765 0.742 0.765 0.754 0.788 0.773 0.779]
cur_param: {'lr': 0.007713239212344241, 'weight_decay': 0.0009960861110796942, 'dropout': 0.7859932399073376, 'patience': 100, 'lr_reduce_freq': 90, 'spt_alg': 'kruskal', 'spt_attr': 'similarity', 'manifold': 'Hyperboloid', 'num_layers': 3, 'dim': 352, 'num_adj': 4, 'add_rate': 0.5167052855263878, 'tem': 1.0060241775424308, 'consis_rate': 0.9525851517636076, 'use_att': 1}
mean: 0.8173
[0.829 0.815 0.819 0.824 0.809 0.819 0.805 0.819 0.82  0.814]
cur_param: {'lr': 0.006531608870227388, 'weight_decay': 0.0011267023078878628, 'dropout': 0.7891923852431869, 'patience': 100, 'lr_reduce_freq': 80, 'spt_alg': 'kruskal', 'spt_attr': 'similarity', 'manifold': 'Hyperboloid', 'num_layers': 3, 'dim': 336, 'num_adj': 4, 'add_rate': 0.5089766665616323, 'tem': 1.0239643707144344, 'consis_rate': 0.8533362351733261, 'use_att': 1}
mean: 0.8157
[0.827 0.821 0.807 0.805 0.799 0.813 0.824 0.832 0.811 0.818]
cur_param: {'lr': 0.007648756718675182, 'weight_decay': 0.002073942829631291, 'dropout': 0.7860618047192617, 'patience': 100, 'lr_reduce_freq': 90, 'spt_alg': 'kruskal', 'spt_attr': 'similarity', 'manifold': 'Hyperboloid', 'num_layers': 3, 'dim': 352, 'num_adj': 4, 'add_rate': 0.5116378619991555, 'tem': 1.0166202298386735, 'consis_rate': 1.006555092617381, 'use_att': 1}
mean: 0.7985
[0.809 0.795 0.794 0.817 0.781 0.788 0.816 0.791 0.805 0.789]
cur_param: {'lr': 0.005309633348271497, 'weight_decay': 0.0037420427555164824, 'dropout': 0.750127927568514, 'patience': 100, 'lr_reduce_freq': 70, 'spt_alg': 'kruskal', 'spt_attr': 'edge_degree', 'manifold': 'Hyperboloid', 'num_layers': 3, 'dim': 336, 'num_adj': 4, 'add_rate': 0.4718157701183032, 'tem': 1.1938319426832091, 'consis_rate': 0.8890564190745006, 'use_att': 1}
mean: 0.5259999999999999
[0.435 0.501 0.674 0.507 0.513 0.508 0.479 0.679 0.475 0.489]
cur_param: {'lr': 0.006389758538351159, 'weight_decay': 0.0011930398563097914, 'dropout': 0.7668607909123556, 'patience': 100, 'lr_reduce_freq': 80, 'spt_alg': 'kruskal', 'spt_attr': 'similarity', 'manifold': 'Hyperboloid', 'num_layers': 3, 'dim': 384, 'num_adj': 4, 'add_rate': 0.5512508506325519, 'tem': 0.9649281503611801, 'consis_rate': 0.8651009051626646, 'use_att': 1}
mean: 0.8087
[0.814 0.79  0.812 0.807 0.824 0.81  0.801 0.816 0.812 0.801]
cur_param: {'lr': 0.009396170072071145, 'weight_decay': 0.001069049673353806, 'dropout': 0.7954945530229227, 'patience': 100, 'lr_reduce_freq': 80, 'spt_alg': 'kruskal', 'spt_attr': 'similarity', 'manifold': 'Hyperboloid', 'num_layers': 3, 'dim': 352, 'num_adj': 4, 'add_rate': 0.4399198690617942, 'tem': 1.0277309293518746, 'consis_rate': 0.6163574428529425, 'use_att': 1}
mean: 0.8143
[0.818 0.8   0.808 0.816 0.809 0.802 0.813 0.825 0.823 0.829]
cur_param: {'lr': 0.009250999384460137, 'weight_decay': 0.0010409623683768179, 'dropout': 0.7854035457803722, 'patience': 100, 'lr_reduce_freq': 90, 'spt_alg': 'kruskal', 'spt_attr': 'similarity', 'manifold': 'Hyperboloid', 'num_layers': 3, 'dim': 352, 'num_adj': 4, 'add_rate': 0.4456428084909376, 'tem': 1.061721881094904, 'consis_rate': 0.7485495409609603, 'use_att': 1}
mean: 0.8194000000000001
[0.818 0.819 0.81  0.831 0.821 0.81  0.825 0.826 0.819 0.815]
cur_param: {'lr': 0.00782173027068609, 'weight_decay': 0.0013167301662262848, 'dropout': 0.7227772985512185, 'patience': 100, 'lr_reduce_freq': 90, 'spt_alg': 'kruskal', 'spt_attr': 'similarity', 'manifold': 'Hyperboloid', 'num_layers': 3, 'dim': 336, 'num_adj': 4, 'add_rate': 0.4500810813723065, 'tem': 1.0639653875461013, 'consis_rate': 0.7436703235822686, 'use_att': 1}
mean: 0.8089000000000001
[0.808 0.793 0.811 0.827 0.804 0.812 0.809 0.801 0.81  0.814]
cur_param: {'lr': 0.015112017977533601, 'weight_decay': 0.0017015836247901719, 'dropout': 0.7693784077755808, 'patience': 100, 'lr_reduce_freq': 90, 'spt_alg': 'kruskal', 'spt_attr': 'similarity', 'manifold': 'Hyperboloid', 'num_layers': 3, 'dim': 368, 'num_adj': 4, 'add_rate': 0.39661030949675075, 'tem': 1.1216267216163116, 'consis_rate': 0.8252479165805611, 'use_att': 1}
mean: 0.8103
[0.806 0.811 0.792 0.805 0.815 0.814 0.817 0.821 0.818 0.804]
cur_param: {'lr': 0.011071362967040931, 'weight_decay': 0.0008118398625048687, 'dropout': 0.13216026571236017, 'patience': 100, 'lr_reduce_freq': 100, 'spt_alg': 'kruskal', 'spt_attr': 'similarity', 'manifold': 'Hyperboloid', 'num_layers': 3, 'dim': 384, 'num_adj': 4, 'add_rate': 0.5256259870062493, 'tem': 0.9932595042725091, 'consis_rate': 0.7775909342953617, 'use_att': 1}
mean: 0.8016000000000002
[0.797 0.804 0.808 0.784 0.818 0.804 0.801 0.793 0.801 0.806]
cur_param: {'lr': 0.009230432508039853, 'weight_decay': 0.015784702290637637, 'dropout': 0.7499730295330741, 'patience': 100, 'lr_reduce_freq': 90, 'spt_alg': 'kruskal', 'spt_attr': 'similarity', 'manifold': 'Hyperboloid', 'num_layers': 3, 'dim': 320, 'num_adj': 4, 'add_rate': 0.4968105629796092, 'tem': 1.0930703302722762, 'consis_rate': 0.8466987124022464, 'use_att': 1}
mean: 0.319
[0.319 0.319 0.319 0.319 0.319 0.319 0.319 0.319 0.319 0.319]
cur_param: {'lr': 0.006985758533039353, 'weight_decay': 0.0010296851998298862, 'dropout': 0.7842889609877697, 'patience': 100, 'lr_reduce_freq': 80, 'spt_alg': 'kruskal', 'spt_attr': 'similarity', 'manifold': 'PoincareBall', 'num_layers': 3, 'dim': 304, 'num_adj': 4, 'add_rate': 0.5728288466362703, 'tem': 1.1588148120693027, 'consis_rate': 0.9605589308886333, 'use_att': 1}
mean: 0.8177999999999999
[0.819 0.827 0.801 0.809 0.826 0.811 0.827 0.819 0.821 0.818][32m[I 2022-06-30 19:08:35,861][0m Trial 108 finished with value: 0.8177999999999999 and parameters: {'lr': 0.006985758533039353, 'weight_decay': 0.0010296851998298862, 'dropout': 0.7842889609877697, 'patience': 100, 'lr_reduce_freq': 80, 'spt_alg': 'kruskal', 'spt_attr': 'similarity', 'manifold': 'PoincareBall', 'num_layers': 3, 'dim': 304, 'num_adj': 4, 'add_rate': 0.5728288466362703, 'tem': 1.1588148120693027, 'consis_rate': 0.9605589308886333, 'use_att': 1}. Best is trial 103 with value: 0.8194000000000001.[0m
[32m[I 2022-06-30 19:23:36,301][0m Trial 109 finished with value: 0.31880000000000003 and parameters: {'lr': 0.004925553690387607, 'weight_decay': 0.005202377632660796, 'dropout': 0.786353965296227, 'patience': 100, 'lr_reduce_freq': 70, 'spt_alg': 'kruskal', 'spt_attr': 'similarity', 'manifold': 'PoincareBall', 'num_layers': 5, 'dim': 304, 'num_adj': 4, 'add_rate': 0.511965823386938, 'tem': 1.2577394040930119, 'consis_rate': 0.9139948145482828, 'use_att': 1}. Best is trial 103 with value: 0.8194000000000001.[0m
[32m[I 2022-06-30 19:31:17,608][0m Trial 110 finished with value: 0.8111 and parameters: {'lr': 0.00382796108650277, 'weight_decay': 0.0010167420852005547, 'dropout': 0.7751021393748362, 'patience': 90, 'lr_reduce_freq': 60, 'spt_alg': 'kruskal', 'spt_attr': 'similarity', 'manifold': 'PoincareBall', 'num_layers': 3, 'dim': 304, 'num_adj': 4, 'add_rate': 0.5584294630974289, 'tem': 1.1621529035345395, 'consis_rate': 0.9790807440409833, 'use_att': 1}. Best is trial 103 with value: 0.8194000000000001.[0m
[32m[I 2022-06-30 19:38:56,545][0m Trial 111 finished with value: 0.8143 and parameters: {'lr': 0.0067827437174497055, 'weight_decay': 0.0011258041098691752, 'dropout': 0.7083513873751757, 'patience': 100, 'lr_reduce_freq': 80, 'spt_alg': 'kruskal', 'spt_attr': 'similarity', 'manifold': 'PoincareBall', 'num_layers': 3, 'dim': 352, 'num_adj': 4, 'add_rate': 0.5755904583261194, 'tem': 1.2120063252550206, 'consis_rate': 1.050000626858307, 'use_att': 1}. Best is trial 103 with value: 0.8194000000000001.[0m
[32m[I 2022-06-30 19:47:46,511][0m Trial 112 finished with value: 0.8148 and parameters: {'lr': 0.007909568719308908, 'weight_decay': 0.0013791727018447842, 'dropout': 0.7282355514884564, 'patience': 100, 'lr_reduce_freq': 90, 'spt_alg': 'kruskal', 'spt_attr': 'similarity', 'manifold': 'PoincareBall', 'num_layers': 3, 'dim': 336, 'num_adj': 4, 'add_rate': 0.6256923410867927, 'tem': 1.035381218660988, 'consis_rate': 0.8140590979136935, 'use_att': 1}. Best is trial 103 with value: 0.8194000000000001.[0m
[32m[I 2022-06-30 20:00:01,298][0m Trial 113 finished with value: 0.8145999999999999 and parameters: {'lr': 0.007464058781585108, 'weight_decay': 0.001331342729185708, 'dropout': 0.6883777304813369, 'patience': 100, 'lr_reduce_freq': 90, 'spt_alg': 'kruskal', 'spt_attr': 'similarity', 'manifold': 'PoincareBall', 'num_layers': 3, 'dim': 336, 'num_adj': 4, 'add_rate': 0.6190370533639344, 'tem': 1.0368583352920164, 'consis_rate': 0.7421977909384281, 'use_att': 1}. Best is trial 103 with value: 0.8194000000000001.[0m
[32m[I 2022-06-30 20:12:26,164][0m Trial 114 finished with value: 0.8096 and parameters: {'lr': 0.008164356326090045, 'weight_decay': 0.0013502327731944035, 'dropout': 0.7589910085437037, 'patience': 100, 'lr_reduce_freq': 90, 'spt_alg': 'kruskal', 'spt_attr': 'similarity', 'manifold': 'PoincareBall', 'num_layers': 3, 'dim': 336, 'num_adj': 4, 'add_rate': 0.6203015616336007, 'tem': 1.0363324142975536, 'consis_rate': 0.7214622151588754, 'use_att': 1}. Best is trial 103 with value: 0.8194000000000001.[0m
[32m[I 2022-06-30 20:28:42,202][0m Trial 115 finished with value: 0.7885 and parameters: {'lr': 0.06712179200737534, 'weight_decay': 0.0011911116041170146, 'dropout': 0.6829080959594239, 'patience': 100, 'lr_reduce_freq': 80, 'spt_alg': 'kruskal', 'spt_attr': 'similarity', 'manifold': 'PoincareBall', 'num_layers': 3, 'dim': 320, 'num_adj': 4, 'add_rate': 0.5340885013530069, 'tem': 1.007453989694535, 'consis_rate': 0.6823589305628598, 'use_att': 1}. Best is trial 103 with value: 0.8194000000000001.[0m
[32m[I 2022-06-30 20:40:43,967][0m Trial 116 finished with value: 0.8107 and parameters: {'lr': 0.005797883292347448, 'weight_decay': 0.0018409678042496686, 'dropout': 0.7372569218535762, 'patience': 100, 'lr_reduce_freq': 80, 'spt_alg': 'kruskal', 'spt_attr': 'similarity', 'manifold': 'PoincareBall', 'num_layers': 3, 'dim': 352, 'num_adj': 4, 'add_rate': 0.48376826919350546, 'tem': 0.9027459336498783, 'consis_rate': 0.6149643831639516, 'use_att': 1}. Best is trial 103 with value: 0.8194000000000001.[0m
[32m[I 2022-06-30 20:54:54,400][0m Trial 117 finished with value: 0.8150000000000001 and parameters: {'lr': 0.007442537370878574, 'weight_decay': 0.0016020783716890388, 'dropout': 0.7857109798002289, 'patience': 100, 'lr_reduce_freq': 90, 'spt_alg': 'kruskal', 'spt_attr': 'similarity', 'manifold': 'PoincareBall', 'num_layers': 3, 'dim': 336, 'num_adj': 4, 'add_rate': 0.592751743034418, 'tem': 1.0362523810964273, 'consis_rate': 0.7604269569698592, 'use_att': 1}. Best is trial 103 with value: 0.8194000000000001.[0m
[32m[I 2022-06-30 21:12:22,418][0m Trial 118 finished with value: 0.8132999999999999 and parameters: {'lr': 0.015672810653304847, 'weight_decay': 0.0024352240619455495, 'dropout': 0.7854088689223941, 'patience': 100, 'lr_reduce_freq': 80, 'spt_alg': 'kruskal', 'spt_attr': 'similarity', 'manifold': 'PoincareBall', 'num_layers': 3, 'dim': 368, 'num_adj': 4, 'add_rate': 0.5925989343246328, 'tem': 0.56452648669077, 'consis_rate': 0.8032476371100465, 'use_att': 1}. Best is trial 103 with value: 0.8194000000000001.[0m
[32m[I 2022-06-30 21:24:19,715][0m Trial 119 finished with value: 0.8047000000000001 and parameters: {'lr': 0.01278040080587746, 'weight_decay': 0.0016301309317759561, 'dropout': 0.7979428155747629, 'patience': 100, 'lr_reduce_freq': 90, 'spt_alg': 'kruskal', 'spt_attr': 'similarity', 'manifold': 'PoincareBall', 'num_layers': 3, 'dim': 304, 'num_adj': 4, 'add_rate': 0.45393488312289254, 'tem': 1.0703757486063528, 'consis_rate': 0.9655290894573992, 'use_att': 1}. Best is trial 103 with value: 0.8194000000000001.[0m
[32m[I 2022-06-30 21:40:03,531][0m Trial 120 finished with value: 0.8087 and parameters: {'lr': 0.01200116709913704, 'weight_decay': 0.001857771565614511, 'dropout': 0.7704823051771374, 'patience': 100, 'lr_reduce_freq': 90, 'spt_alg': 'kruskal', 'spt_attr': 'similarity', 'manifold': 'PoincareBall', 'num_layers': 3, 'dim': 288, 'num_adj': 4, 'add_rate': 0.8797059419054204, 'tem': 0.948213570705782, 'consis_rate': 0.8758907753995542, 'use_att': 1}. Best is trial 103 with value: 0.8194000000000001.[0m
[32m[I 2022-06-30 21:52:07,355][0m Trial 121 finished with value: 0.8076000000000001 and parameters: {'lr': 0.0070783398661923074, 'weight_decay': 0.001347062046961512, 'dropout': 0.7499876716696612, 'patience': 100, 'lr_reduce_freq': 90, 'spt_alg': 'kruskal', 'spt_attr': 'similarity', 'manifold': 'PoincareBall', 'num_layers': 3, 'dim': 336, 'num_adj': 4, 'add_rate': 0.6135843240117257, 'tem': 1.0351608147514852, 'consis_rate': 0.6461239703815809, 'use_att': 1}. Best is trial 103 with value: 0.8194000000000001.[0m
[32m[I 2022-06-30 22:07:07,795][0m Trial 122 finished with value: 0.8126999999999999 and parameters: {'lr': 0.005977341619383832, 'weight_decay': 0.001442093483614677, 'dropout': 0.7807303423256263, 'patience': 100, 'lr_reduce_freq': 100, 'spt_alg': 'kruskal', 'spt_attr': 'similarity', 'manifold': 'PoincareBall', 'num_layers': 3, 'dim': 320, 'num_adj': 4, 'add_rate': 0.6343376898213091, 'tem': 0.9882600421530674, 'consis_rate': 0.7612467245831213, 'use_att': 1}. Best is trial 103 with value: 0.8194000000000001.[0m
[32m[I 2022-06-30 22:23:34,385][0m Trial 123 finished with value: 0.8104000000000001 and parameters: {'lr': 0.007692192853900805, 'weight_decay': 0.001002718034951042, 'dropout': 0.7434143503533213, 'patience': 100, 'lr_reduce_freq': 80, 'spt_alg': 'kruskal', 'spt_attr': 'similarity', 'manifold': 'PoincareBall', 'num_layers': 3, 'dim': 352, 'num_adj': 4, 'add_rate': 0.5721504440967683, 'tem': 1.0597177006654552, 'consis_rate': 0.7516138415723347, 'use_att': 1}. Best is trial 103 with value: 0.8194000000000001.[0m
[32m[I 2022-06-30 22:39:20,296][0m Trial 124 finished with value: 0.8092 and parameters: {'lr': 0.009940850273849751, 'weight_decay': 0.0012653327847720406, 'dropout': 0.7646135618099772, 'patience': 100, 'lr_reduce_freq': 90, 'spt_alg': 'kruskal', 'spt_attr': 'similarity', 'manifold': 'PoincareBall', 'num_layers': 3, 'dim': 336, 'num_adj': 4, 'add_rate': 0.5502071216531543, 'tem': 1.0021188470703024, 'consis_rate': 0.5604038677945962, 'use_att': 1}. Best is trial 103 with value: 0.8194000000000001.[0m
