[32m[I 2022-06-30 22:58:34,054][0m Trial 125 finished with value: 0.8130000000000001 and parameters: {'lr': 0.007280115659510851, 'weight_decay': 0.0015398406402639831, 'dropout': 0.7312943874305486, 'patience': 100, 'lr_reduce_freq': 80, 'spt_alg': 'kruskal', 'spt_attr': 'similarity', 'manifold': 'PoincareBall', 'num_layers': 3, 'dim': 320, 'num_adj': 4, 'add_rate': 0.5871314954521083, 'tem': 1.0997287819255592, 'consis_rate': 0.8382886164415604, 'use_att': 1}. Best is trial 103 with value: 0.8194000000000001.[0m

cur_param: {'lr': 0.004925553690387607, 'weight_decay': 0.005202377632660796, 'dropout': 0.786353965296227, 'patience': 100, 'lr_reduce_freq': 70, 'spt_alg': 'kruskal', 'spt_attr': 'similarity', 'manifold': 'PoincareBall', 'num_layers': 5, 'dim': 304, 'num_adj': 4, 'add_rate': 0.511965823386938, 'tem': 1.2577394040930119, 'consis_rate': 0.9139948145482828, 'use_att': 1}
mean: 0.31880000000000003
[0.319 0.319 0.319 0.319 0.319 0.319 0.319 0.319 0.317 0.319]
cur_param: {'lr': 0.00382796108650277, 'weight_decay': 0.0010167420852005547, 'dropout': 0.7751021393748362, 'patience': 90, 'lr_reduce_freq': 60, 'spt_alg': 'kruskal', 'spt_attr': 'similarity', 'manifold': 'PoincareBall', 'num_layers': 3, 'dim': 304, 'num_adj': 4, 'add_rate': 0.5584294630974289, 'tem': 1.1621529035345395, 'consis_rate': 0.9790807440409833, 'use_att': 1}
mean: 0.8111
[0.814 0.813 0.795 0.827 0.797 0.805 0.801 0.809 0.827 0.823]
cur_param: {'lr': 0.0067827437174497055, 'weight_decay': 0.0011258041098691752, 'dropout': 0.7083513873751757, 'patience': 100, 'lr_reduce_freq': 80, 'spt_alg': 'kruskal', 'spt_attr': 'similarity', 'manifold': 'PoincareBall', 'num_layers': 3, 'dim': 352, 'num_adj': 4, 'add_rate': 0.5755904583261194, 'tem': 1.2120063252550206, 'consis_rate': 1.050000626858307, 'use_att': 1}
mean: 0.8143
[0.824 0.828 0.829 0.809 0.809 0.798 0.815 0.815 0.808 0.808]
cur_param: {'lr': 0.007909568719308908, 'weight_decay': 0.0013791727018447842, 'dropout': 0.7282355514884564, 'patience': 100, 'lr_reduce_freq': 90, 'spt_alg': 'kruskal', 'spt_attr': 'similarity', 'manifold': 'PoincareBall', 'num_layers': 3, 'dim': 336, 'num_adj': 4, 'add_rate': 0.6256923410867927, 'tem': 1.035381218660988, 'consis_rate': 0.8140590979136935, 'use_att': 1}
mean: 0.8148
[0.83  0.824 0.803 0.804 0.827 0.809 0.811 0.812 0.814 0.814]
cur_param: {'lr': 0.007464058781585108, 'weight_decay': 0.001331342729185708, 'dropout': 0.6883777304813369, 'patience': 100, 'lr_reduce_freq': 90, 'spt_alg': 'kruskal', 'spt_attr': 'similarity', 'manifold': 'PoincareBall', 'num_layers': 3, 'dim': 336, 'num_adj': 4, 'add_rate': 0.6190370533639344, 'tem': 1.0368583352920164, 'consis_rate': 0.7421977909384281, 'use_att': 1}
mean: 0.8145999999999999
[0.824 0.818 0.8   0.817 0.822 0.812 0.813 0.827 0.814 0.799]
cur_param: {'lr': 0.008164356326090045, 'weight_decay': 0.0013502327731944035, 'dropout': 0.7589910085437037, 'patience': 100, 'lr_reduce_freq': 90, 'spt_alg': 'kruskal', 'spt_attr': 'similarity', 'manifold': 'PoincareBall', 'num_layers': 3, 'dim': 336, 'num_adj': 4, 'add_rate': 0.6203015616336007, 'tem': 1.0363324142975536, 'consis_rate': 0.7214622151588754, 'use_att': 1}
mean: 0.8096
[0.803 0.814 0.807 0.796 0.803 0.821 0.811 0.818 0.813 0.81 ]
cur_param: {'lr': 0.06712179200737534, 'weight_decay': 0.0011911116041170146, 'dropout': 0.6829080959594239, 'patience': 100, 'lr_reduce_freq': 80, 'spt_alg': 'kruskal', 'spt_attr': 'similarity', 'manifold': 'PoincareBall', 'num_layers': 3, 'dim': 320, 'num_adj': 4, 'add_rate': 0.5340885013530069, 'tem': 1.007453989694535, 'consis_rate': 0.6823589305628598, 'use_att': 1}
mean: 0.7885
[0.805 0.781 0.782 0.797 0.777 0.778 0.797 0.781 0.8   0.787]
cur_param: {'lr': 0.005797883292347448, 'weight_decay': 0.0018409678042496686, 'dropout': 0.7372569218535762, 'patience': 100, 'lr_reduce_freq': 80, 'spt_alg': 'kruskal', 'spt_attr': 'similarity', 'manifold': 'PoincareBall', 'num_layers': 3, 'dim': 352, 'num_adj': 4, 'add_rate': 0.48376826919350546, 'tem': 0.9027459336498783, 'consis_rate': 0.6149643831639516, 'use_att': 1}
mean: 0.8107
[0.815 0.816 0.81  0.787 0.81  0.803 0.819 0.806 0.811 0.83 ]
cur_param: {'lr': 0.007442537370878574, 'weight_decay': 0.0016020783716890388, 'dropout': 0.7857109798002289, 'patience': 100, 'lr_reduce_freq': 90, 'spt_alg': 'kruskal', 'spt_attr': 'similarity', 'manifold': 'PoincareBall', 'num_layers': 3, 'dim': 336, 'num_adj': 4, 'add_rate': 0.592751743034418, 'tem': 1.0362523810964273, 'consis_rate': 0.7604269569698592, 'use_att': 1}
mean: 0.8150000000000001
[0.805 0.799 0.82  0.815 0.806 0.818 0.82  0.833 0.823 0.811]
cur_param: {'lr': 0.015672810653304847, 'weight_decay': 0.0024352240619455495, 'dropout': 0.7854088689223941, 'patience': 100, 'lr_reduce_freq': 80, 'spt_alg': 'kruskal', 'spt_attr': 'similarity', 'manifold': 'PoincareBall', 'num_layers': 3, 'dim': 368, 'num_adj': 4, 'add_rate': 0.5925989343246328, 'tem': 0.56452648669077, 'consis_rate': 0.8032476371100465, 'use_att': 1}
mean: 0.8132999999999999
[0.813 0.83  0.81  0.809 0.813 0.82  0.819 0.803 0.809 0.807]
cur_param: {'lr': 0.01278040080587746, 'weight_decay': 0.0016301309317759561, 'dropout': 0.7979428155747629, 'patience': 100, 'lr_reduce_freq': 90, 'spt_alg': 'kruskal', 'spt_attr': 'similarity', 'manifold': 'PoincareBall', 'num_layers': 3, 'dim': 304, 'num_adj': 4, 'add_rate': 0.45393488312289254, 'tem': 1.0703757486063528, 'consis_rate': 0.9655290894573992, 'use_att': 1}
mean: 0.8047000000000001
[0.802 0.804 0.803 0.803 0.805 0.806 0.815 0.802 0.799 0.808]
cur_param: {'lr': 0.01200116709913704, 'weight_decay': 0.001857771565614511, 'dropout': 0.7704823051771374, 'patience': 100, 'lr_reduce_freq': 90, 'spt_alg': 'kruskal', 'spt_attr': 'similarity', 'manifold': 'PoincareBall', 'num_layers': 3, 'dim': 288, 'num_adj': 4, 'add_rate': 0.8797059419054204, 'tem': 0.948213570705782, 'consis_rate': 0.8758907753995542, 'use_att': 1}
mean: 0.8087
[0.809 0.823 0.814 0.797 0.819 0.823 0.783 0.791 0.818 0.81 ]
cur_param: {'lr': 0.0070783398661923074, 'weight_decay': 0.001347062046961512, 'dropout': 0.7499876716696612, 'patience': 100, 'lr_reduce_freq': 90, 'spt_alg': 'kruskal', 'spt_attr': 'similarity', 'manifold': 'PoincareBall', 'num_layers': 3, 'dim': 336, 'num_adj': 4, 'add_rate': 0.6135843240117257, 'tem': 1.0351608147514852, 'consis_rate': 0.6461239703815809, 'use_att': 1}
mean: 0.8076000000000001
[0.809 0.801 0.818 0.797 0.802 0.816 0.791 0.82  0.814 0.808]
cur_param: {'lr': 0.005977341619383832, 'weight_decay': 0.001442093483614677, 'dropout': 0.7807303423256263, 'patience': 100, 'lr_reduce_freq': 100, 'spt_alg': 'kruskal', 'spt_attr': 'similarity', 'manifold': 'PoincareBall', 'num_layers': 3, 'dim': 320, 'num_adj': 4, 'add_rate': 0.6343376898213091, 'tem': 0.9882600421530674, 'consis_rate': 0.7612467245831213, 'use_att': 1}
mean: 0.8126999999999999
[0.815 0.814 0.816 0.818 0.818 0.804 0.812 0.818 0.808 0.804]
cur_param: {'lr': 0.007692192853900805, 'weight_decay': 0.001002718034951042, 'dropout': 0.7434143503533213, 'patience': 100, 'lr_reduce_freq': 80, 'spt_alg': 'kruskal', 'spt_attr': 'similarity', 'manifold': 'PoincareBall', 'num_layers': 3, 'dim': 352, 'num_adj': 4, 'add_rate': 0.5721504440967683, 'tem': 1.0597177006654552, 'consis_rate': 0.7516138415723347, 'use_att': 1}
mean: 0.8104000000000001
[0.812 0.817 0.802 0.818 0.784 0.81  0.798 0.822 0.82  0.821]
cur_param: {'lr': 0.009940850273849751, 'weight_decay': 0.0012653327847720406, 'dropout': 0.7646135618099772, 'patience': 100, 'lr_reduce_freq': 90, 'spt_alg': 'kruskal', 'spt_attr': 'similarity', 'manifold': 'PoincareBall', 'num_layers': 3, 'dim': 336, 'num_adj': 4, 'add_rate': 0.5502071216531543, 'tem': 1.0021188470703024, 'consis_rate': 0.5604038677945962, 'use_att': 1}
mean: 0.8092
[0.816 0.819 0.807 0.808 0.821 0.823 0.793 0.815 0.809 0.781]
cur_param: {'lr': 0.007280115659510851, 'weight_decay': 0.0015398406402639831, 'dropout': 0.7312943874305486, 'patience': 100, 'lr_reduce_freq': 80, 'spt_alg': 'kruskal', 'spt_attr': 'similarity', 'manifold': 'PoincareBall', 'num_layers': 3, 'dim': 320, 'num_adj': 4, 'add_rate': 0.5871314954521083, 'tem': 1.0997287819255592, 'consis_rate': 0.8382886164415604, 'use_att': 1}
mean: 0.8130000000000001
[0.81  0.831 0.812 0.802 0.805 0.816 0.823 0.822 0.806 0.803]
cur_param: {'lr': 0.008316296507243753, 'weight_decay': 0.001957809257884212, 'dropout': 0.7563521933782492, 'patience': 100, 'lr_reduce_freq': 100, 'spt_alg': 'kruskal', 'spt_attr': 'edge_degree', 'manifold': 'PoincareBall', 'num_layers': 4, 'dim': 368, 'num_adj': 4, 'add_rate': 0.6617674410578382, 'tem': 1.0813435674415743, 'consis_rate': 0.701052586275593, 'use_att': 1}
mean: 0.7816
[0.814 0.771 0.784 0.8   0.769 0.747 0.768 0.788 0.772 0.803][32m[I 2022-06-30 23:47:30,747][0m Trial 126 finished with value: 0.7816 and parameters: {'lr': 0.008316296507243753, 'weight_decay': 0.001957809257884212, 'dropout': 0.7563521933782492, 'patience': 100, 'lr_reduce_freq': 100, 'spt_alg': 'kruskal', 'spt_attr': 'edge_degree', 'manifold': 'PoincareBall', 'num_layers': 4, 'dim': 368, 'num_adj': 4, 'add_rate': 0.6617674410578382, 'tem': 1.0813435674415743, 'consis_rate': 0.701052586275593, 'use_att': 1}. Best is trial 103 with value: 0.8194000000000001.[0m
[32m[I 2022-07-01 00:02:30,553][0m Trial 127 finished with value: 0.8105 and parameters: {'lr': 0.011033723667366102, 'weight_decay': 0.0009242804099447894, 'dropout': 0.7837950581357019, 'patience': 100, 'lr_reduce_freq': 90, 'spt_alg': 'kruskal', 'spt_attr': 'similarity', 'manifold': 'PoincareBall', 'num_layers': 3, 'dim': 336, 'num_adj': 4, 'add_rate': 0.6100767405977757, 'tem': 1.0270094369894842, 'consis_rate': 0.9315077084773307, 'use_att': 1}. Best is trial 103 with value: 0.8194000000000001.[0m
[32m[I 2022-07-01 00:18:24,873][0m Trial 128 finished with value: 0.8053000000000001 and parameters: {'lr': 0.014000936582206384, 'weight_decay': 0.0007170207534117575, 'dropout': 0.7017706388407027, 'patience': 100, 'lr_reduce_freq': 70, 'spt_alg': 'kruskal', 'spt_attr': 'similarity', 'manifold': 'PoincareBall', 'num_layers': 3, 'dim': 400, 'num_adj': 4, 'add_rate': 0.5201083767148426, 'tem': 0.9161603045060456, 'consis_rate': 0.8099949030093434, 'use_att': 1}. Best is trial 103 with value: 0.8194000000000001.[0m
[32m[I 2022-07-01 00:37:15,482][0m Trial 129 finished with value: 0.8135999999999999 and parameters: {'lr': 0.004934433372954258, 'weight_decay': 0.001161038108674135, 'dropout': 0.7986108085568685, 'patience': 100, 'lr_reduce_freq': 80, 'spt_alg': 'kruskal', 'spt_attr': 'similarity', 'manifold': 'PoincareBall', 'num_layers': 3, 'dim': 352, 'num_adj': 4, 'add_rate': 0.6441170980697015, 'tem': 0.878601251197367, 'consis_rate': 0.26918587876097766, 'use_att': 1}. Best is trial 103 with value: 0.8194000000000001.[0m
[32m[I 2022-07-01 00:54:50,929][0m Trial 130 finished with value: 0.8141999999999999 and parameters: {'lr': 0.006406838384294869, 'weight_decay': 0.00084680259807198, 'dropout': 0.7667590966417211, 'patience': 100, 'lr_reduce_freq': 90, 'spt_alg': 'kruskal', 'spt_attr': 'similarity', 'manifold': 'PoincareBall', 'num_layers': 3, 'dim': 304, 'num_adj': 4, 'add_rate': 0.5829537139172474, 'tem': 1.0420305909913017, 'consis_rate': 0.9055345002219571, 'use_att': 1}. Best is trial 103 with value: 0.8194000000000001.[0m
[32m[I 2022-07-01 01:16:12,767][0m Trial 131 finished with value: 0.8126999999999999 and parameters: {'lr': 0.009032090341438976, 'weight_decay': 0.0010444522832986493, 'dropout': 0.7257151887204982, 'patience': 100, 'lr_reduce_freq': 40, 'spt_alg': 'kruskal', 'spt_attr': 'similarity', 'manifold': 'Hyperboloid', 'num_layers': 3, 'dim': 272, 'num_adj': 4, 'add_rate': 0.6793541905059814, 'tem': 1.127089090941672, 'consis_rate': 0.7482762163410773, 'use_att': 1}. Best is trial 103 with value: 0.8194000000000001.[0m
[32m[I 2022-07-01 01:36:18,243][0m Trial 132 finished with value: 0.8115 and parameters: {'lr': 0.009902314300378572, 'weight_decay': 0.0008276410201173868, 'dropout': 0.7480173871719461, 'patience': 100, 'lr_reduce_freq': 90, 'spt_alg': 'kruskal', 'spt_attr': 'similarity', 'manifold': 'Hyperboloid', 'num_layers': 3, 'dim': 336, 'num_adj': 4, 'add_rate': 0.6298942761801773, 'tem': 1.1151071296674668, 'consis_rate': 0.5891759937567311, 'use_att': 1}. Best is trial 103 with value: 0.8194000000000001.[0m
[32m[I 2022-07-01 01:56:44,582][0m Trial 133 finished with value: 0.8163 and parameters: {'lr': 0.007528000679059234, 'weight_decay': 0.0011020629765222181, 'dropout': 0.7829559629788859, 'patience': 60, 'lr_reduce_freq': 100, 'spt_alg': 'kruskal', 'spt_attr': 'similarity', 'manifold': 'Hyperboloid', 'num_layers': 3, 'dim': 192, 'num_adj': 4, 'add_rate': 0.7924379009019852, 'tem': 1.1747745180477358, 'consis_rate': 1.6534064726689257, 'use_att': 1}. Best is trial 103 with value: 0.8194000000000001.[0m
[32m[I 2022-07-01 02:16:51,610][0m Trial 134 finished with value: 0.8132999999999999 and parameters: {'lr': 0.005696712226387033, 'weight_decay': 0.001371642223648074, 'dropout': 0.7821335697784215, 'patience': 70, 'lr_reduce_freq': 100, 'spt_alg': 'kruskal', 'spt_attr': 'similarity', 'manifold': 'Hyperboloid', 'num_layers': 3, 'dim': 352, 'num_adj': 4, 'add_rate': 0.7932649948492372, 'tem': 0.9459393388941593, 'consis_rate': 1.6448571598733914, 'use_att': 1}. Best is trial 103 with value: 0.8194000000000001.[0m
[32m[I 2022-07-01 02:38:05,009][0m Trial 135 finished with value: 0.8119999999999999 and parameters: {'lr': 0.007620586655426123, 'weight_decay': 0.0012362292012437009, 'dropout': 0.7730902832231901, 'patience': 70, 'lr_reduce_freq': 100, 'spt_alg': 'kruskal', 'spt_attr': 'similarity', 'manifold': 'Hyperboloid', 'num_layers': 3, 'dim': 320, 'num_adj': 4, 'add_rate': 0.8237465440162802, 'tem': 1.1796788562715976, 'consis_rate': 1.68394591623456, 'use_att': 1}. Best is trial 103 with value: 0.8194000000000001.[0m
[32m[I 2022-07-01 02:48:31,748][0m Trial 136 finished with value: 0.8138 and parameters: {'lr': 0.006717584357605465, 'weight_decay': 0.001122257040321393, 'dropout': 0.7592728764159982, 'patience': 60, 'lr_reduce_freq': 90, 'spt_alg': 'kruskal', 'spt_attr': 'similarity', 'manifold': 'PoincareBall', 'num_layers': 3, 'dim': 368, 'num_adj': 4, 'add_rate': 0.5402671562059589, 'tem': 0.9745687821165894, 'consis_rate': 0.8654282275626753, 'use_att': 1}. Best is trial 103 with value: 0.8194000000000001.[0m
[32m[I 2022-07-01 03:37:40,414][0m Trial 137 finished with value: 0.34269999999999995 and parameters: {'lr': 0.00815215029456089, 'weight_decay': 0.0015892944180281737, 'dropout': 0.799680469728623, 'patience': 100, 'lr_reduce_freq': 80, 'spt_alg': 'kruskal', 'spt_attr': 'similarity', 'manifold': 'Hyperboloid', 'num_layers': 5, 'dim': 160, 'num_adj': 4, 'add_rate': 0.8644626189994169, 'tem': 1.0150639618804422, 'consis_rate': 0.7829866567875179, 'use_att': 1}. Best is trial 103 with value: 0.8194000000000001.[0m
[32m[I 2022-07-01 03:52:50,757][0m Trial 138 finished with value: 0.8112999999999999 and parameters: {'lr': 0.011489953413799036, 'weight_decay': 0.0009594150190690325, 'dropout': 0.7390659804831219, 'patience': 50, 'lr_reduce_freq': 100, 'spt_alg': 'kruskal', 'spt_attr': 'similarity', 'manifold': 'Hyperboloid', 'num_layers': 3, 'dim': 208, 'num_adj': 4, 'add_rate': 0.8089217080407036, 'tem': 1.245662607180108, 'consis_rate': 0.640717190249074, 'use_att': 1}. Best is trial 103 with value: 0.8194000000000001.[0m
[32m[I 2022-07-01 04:12:01,519][0m Trial 139 finished with value: 0.8077 and parameters: {'lr': 0.01663034027544191, 'weight_decay': 0.0013977493048955235, 'dropout': 0.7848420536217047, 'patience': 60, 'lr_reduce_freq': 70, 'spt_alg': 'kruskal', 'spt_attr': 'similarity', 'manifold': 'Hyperboloid', 'num_layers': 3, 'dim': 384, 'num_adj': 4, 'add_rate': 0.7714658380305381, 'tem': 1.0579112888898343, 'consis_rate': 1.517073371851088, 'use_att': 1}. Best is trial 103 with value: 0.8194000000000001.[0m
[32m[I 2022-07-01 04:23:10,334][0m Trial 140 finished with value: 0.8093999999999999 and parameters: {'lr': 0.010440502731366588, 'weight_decay': 0.0010905405164780614, 'dropout': 0.7558883534064287, 'patience': 60, 'lr_reduce_freq': 90, 'spt_alg': 'kruskal', 'spt_attr': 'similarity', 'manifold': 'PoincareBall', 'num_layers': 3, 'dim': 224, 'num_adj': 4, 'add_rate': 0.5700656569373244, 'tem': 1.2138463306923224, 'consis_rate': 0.7326101419865739, 'use_att': 1}. Best is trial 103 with value: 0.8194000000000001.[0m
[32m[I 2022-07-01 04:36:35,693][0m Trial 141 finished with value: 0.8072000000000001 and parameters: {'lr': 0.009044575631393898, 'weight_decay': 0.0010059983102316764, 'dropout': 0.6878935965765249, 'patience': 50, 'lr_reduce_freq': 100, 'spt_alg': 'kruskal', 'spt_attr': 'similarity', 'manifold': 'Hyperboloid', 'num_layers': 3, 'dim': 192, 'num_adj': 4, 'add_rate': 0.7555667094817935, 'tem': 1.1502238051715155, 'consis_rate': 1.460445451177101, 'use_att': 1}. Best is trial 103 with value: 0.8194000000000001.[0m
[32m[I 2022-07-01 04:56:29,332][0m Trial 142 finished with value: 0.8145999999999999 and parameters: {'lr': 0.008654445847279436, 'weight_decay': 0.0009143591849692525, 'dropout': 0.7291336806623838, 'patience': 100, 'lr_reduce_freq': 100, 'spt_alg': 'kruskal', 'spt_attr': 'similarity', 'manifold': 'Hyperboloid', 'num_layers': 3, 'dim': 208, 'num_adj': 4, 'add_rate': 0.7175502599414734, 'tem': 1.1831842545460114, 'consis_rate': 1.4265013913634317, 'use_att': 1}. Best is trial 103 with value: 0.8194000000000001.[0m
