[32m[I 2022-06-22 11:21:55,597][0m Trial 54 finished with value: 0.7936 and parameters: {'lr': 0.03653007575225438, 'weight_decay': 0.0016418078275279215, 'dropout': 0.5380946586377633, 'patience': 100, 'lr_reduce_freq': 90, 'spt_alg': 'kruskal', 'spt_attr': 'edge_degree', 'manifold': 'PoincareBall', 'num_layers': 3, 'num_adj': 2, 'add_rate': 0.325788153892239, 'tem': 1.8703780267650574, 'consis_rate': 1.9503603560918585, 'use_att': 1}. Best is trial 53 with value: 0.8106.[0m
[32m[I 2022-06-22 11:49:39,852][0m Trial 55 finished with value: 0.8141 and parameters: {'lr': 0.0020522290833972796, 'weight_decay': 0.0008376151834201512, 'dropout': 0.5013235105284299, 'patience': 100, 'lr_reduce_freq': 90, 'spt_alg': 'kruskal', 'spt_attr': 'edge_degree', 'manifold': 'PoincareBall', 'num_layers': 3, 'num_adj': 6, 'add_rate': 0.37797499112045857, 'tem': 1.751193370832614, 'consis_rate': 1.189700858414079, 'use_att': 1}. Best is trial 55 with value: 0.8141.[0m

mean: 0.8099000000000001
[0.81  0.811 0.798 0.81  0.819 0.805 0.822 0.819 0.798 0.807]
cur_param: {'lr': 0.0023121191916868826, 'weight_decay': 0.003888472063888155, 'dropout': 0.3596106726965316, 'patience': 60, 'lr_reduce_freq': 50, 'spt_alg': 'kruskal', 'spt_attr': 'similarity', 'manifold': 'PoincareBall', 'num_layers': 4, 'num_adj': 2, 'add_rate': 0.24748532676817311, 'tem': 1.6114650109127313, 'consis_rate': 0.9221640147289935, 'use_att': 1}
mean: 0.7433000000000001
[0.749 0.701 0.777 0.76  0.735 0.724 0.784 0.772 0.681 0.75 ]
cur_param: {'lr': 0.0018853288876631753, 'weight_decay': 0.00961746585743007, 'dropout': 0.564600729290604, 'patience': 60, 'lr_reduce_freq': 70, 'spt_alg': 'kruskal', 'spt_attr': 'similarity', 'manifold': 'PoincareBall', 'num_layers': 3, 'num_adj': 2, 'add_rate': 0.28791675663192695, 'tem': 1.8602894921966984, 'consis_rate': 0.6992480426828946, 'use_att': 0}
mean: 0.2165
[0.149 0.216 0.201 0.146 0.336 0.316 0.188 0.164 0.287 0.162]
cur_param: {'lr': 0.00351648467132786, 'weight_decay': 0.0009739753572163157, 'dropout': 0.4869811728188226, 'patience': 60, 'lr_reduce_freq': 70, 'spt_alg': 'prim', 'spt_attr': 'similarity', 'manifold': 'PoincareBall', 'num_layers': 3, 'num_adj': 2, 'add_rate': 0.13093481608918106, 'tem': 1.6886726567459667, 'consis_rate': 0.9772631012758265, 'use_att': 1}
mean: 0.8061
[0.807 0.811 0.811 0.822 0.789 0.805 0.792 0.784 0.816 0.824]
cur_param: {'lr': 0.004517748873859643, 'weight_decay': 0.002264560404614274, 'dropout': 0.14773650299143248, 'patience': 60, 'lr_reduce_freq': 70, 'spt_alg': 'kruskal', 'spt_attr': 'similarity', 'manifold': 'PoincareBall', 'num_layers': 3, 'num_adj': 4, 'add_rate': 0.4021634968985144, 'tem': 1.517382413030335, 'consis_rate': 1.1503377598079165, 'use_att': 1}
mean: 0.8019999999999999
[0.804 0.789 0.803 0.816 0.8   0.809 0.793 0.799 0.802 0.805]
cur_param: {'lr': 0.005719142679374784, 'weight_decay': 0.0015066066321594571, 'dropout': 0.2589131586617984, 'patience': 100, 'lr_reduce_freq': 70, 'spt_alg': 'kruskal', 'spt_attr': 'similarity', 'manifold': 'PoincareBall', 'num_layers': 3, 'num_adj': 4, 'add_rate': 0.3417277214651731, 'tem': 1.292946692735668, 'consis_rate': 1.0159591620907937, 'use_att': 1}
mean: 0.7992000000000001
[0.804 0.79  0.804 0.817 0.792 0.81  0.777 0.795 0.791 0.812]
cur_param: {'lr': 0.008936307350279817, 'weight_decay': 0.000704067016932585, 'dropout': 0.061251982282769485, 'patience': 80, 'lr_reduce_freq': 90, 'spt_alg': 'kruskal', 'spt_attr': 'similarity', 'manifold': 'PoincareBall', 'num_layers': 3, 'num_adj': 4, 'add_rate': 0.446737804190571, 'tem': 1.4905894316535073, 'consis_rate': 0.8307215938495428, 'use_att': 1}
mean: 0.7988
[0.789 0.803 0.783 0.791 0.816 0.798 0.801 0.807 0.806 0.794]
cur_param: {'lr': 0.013102515815093132, 'weight_decay': 0.003907532718050814, 'dropout': 0.20503480471596364, 'patience': 60, 'lr_reduce_freq': 50, 'spt_alg': 'kruskal', 'spt_attr': 'edge_degree', 'manifold': 'PoincareBall', 'num_layers': 3, 'num_adj': 2, 'add_rate': 0.5300404589743368, 'tem': 1.4412467553385746, 'consis_rate': 1.3101301548451536, 'use_att': 1}
mean: 0.7941999999999999
[0.806 0.808 0.789 0.797 0.783 0.815 0.771 0.779 0.794 0.8  ]
cur_param: {'lr': 0.0015734598279153445, 'weight_decay': 0.0010508666559460435, 'dropout': 0.359570050715164, 'patience': 100, 'lr_reduce_freq': 70, 'spt_alg': 'kruskal', 'spt_attr': 'edge_degree', 'manifold': 'PoincareBall', 'num_layers': 3, 'num_adj': 4, 'add_rate': 0.208679828327889, 'tem': 1.186321625101682, 'consis_rate': 0.430093652613599, 'use_att': 1}
mean: 0.8078000000000001
[0.804 0.814 0.811 0.816 0.805 0.813 0.799 0.799 0.814 0.803]
cur_param: {'lr': 0.0016284595764993292, 'weight_decay': 0.0010306692402512862, 'dropout': 0.36720575771165825, 'patience': 100, 'lr_reduce_freq': 90, 'spt_alg': 'kruskal', 'spt_attr': 'similarity', 'manifold': 'PoincareBall', 'num_layers': 3, 'num_adj': 6, 'add_rate': 0.21255898313204008, 'tem': 1.199469436437748, 'consis_rate': 0.21195428925347615, 'use_att': 1}
mean: 0.8035
[0.802 0.806 0.786 0.812 0.808 0.799 0.82  0.81  0.799 0.793]
cur_param: {'lr': 0.0021606789177229914, 'weight_decay': 0.0006827611537760466, 'dropout': 0.3097833146377372, 'patience': 100, 'lr_reduce_freq': 70, 'spt_alg': 'kruskal', 'spt_attr': 'edge_degree', 'manifold': 'PoincareBall', 'num_layers': 3, 'num_adj': 2, 'add_rate': 0.19521640357272485, 'tem': 1.6707339417822673, 'consis_rate': 0.4849493625345883, 'use_att': 1}
mean: 0.8083
[0.8   0.808 0.793 0.828 0.808 0.818 0.809 0.807 0.808 0.804]
cur_param: {'lr': 0.0021732297825846013, 'weight_decay': 0.0006385271035543056, 'dropout': 0.3017992720502951, 'patience': 100, 'lr_reduce_freq': 50, 'spt_alg': 'kruskal', 'spt_attr': 'edge_degree', 'manifold': 'PoincareBall', 'num_layers': 3, 'num_adj': 2, 'add_rate': 0.2891414150109308, 'tem': 1.7505356813236939, 'consis_rate': 0.47870854169140803, 'use_att': 0}
mean: 0.7934000000000001
[0.782 0.806 0.804 0.793 0.802 0.79  0.805 0.776 0.788 0.788]
cur_param: {'lr': 0.0028952388810282005, 'weight_decay': 0.1854988431975021, 'dropout': 0.461260456575105, 'patience': 60, 'lr_reduce_freq': 90, 'spt_alg': 'kruskal', 'spt_attr': 'edge_degree', 'manifold': 'PoincareBall', 'num_layers': 4, 'num_adj': 2, 'add_rate': 0.18069768959253338, 'tem': 1.9990313976756893, 'consis_rate': 0.6556370817997368, 'use_att': 1}
mean: 0.26549999999999996
[0.132 0.149 0.142 0.319 0.319 0.319 0.319 0.319 0.318 0.319]
cur_param: {'lr': 0.06764294379187169, 'weight_decay': 0.0017207772069519553, 'dropout': 0.6647570114468789, 'patience': 100, 'lr_reduce_freq': 70, 'spt_alg': 'prim', 'spt_attr': 'similarity', 'manifold': 'PoincareBall', 'num_layers': 3, 'num_adj': 2, 'add_rate': 0.10554322326498194, 'tem': 1.6552008519440162, 'consis_rate': 0.7589846435222465, 'use_att': 1}
mean: 0.6444
[0.655 0.553 0.694 0.776 0.477 0.733 0.634 0.576 0.678 0.668]
cur_param: {'lr': 0.0013263850887001642, 'weight_decay': 0.0005026824940140226, 'dropout': 0.37632771818031024, 'patience': 100, 'lr_reduce_freq': 70, 'spt_alg': 'kruskal', 'spt_attr': 'edge_degree', 'manifold': 'PoincareBall', 'num_layers': 3, 'num_adj': 2, 'add_rate': 0.18198374724505378, 'tem': 1.5399021205338244, 'consis_rate': 0.37125883034760643, 'use_att': 1}
mean: 0.8071000000000002
[0.808 0.815 0.808 0.828 0.811 0.787 0.801 0.805 0.798 0.81 ]
cur_param: {'lr': 0.0015852741143121613, 'weight_decay': 0.0009383101918705315, 'dropout': 0.31039533550356047, 'patience': 100, 'lr_reduce_freq': 70, 'spt_alg': 'kruskal', 'spt_attr': 'edge_degree', 'manifold': 'PoincareBall', 'num_layers': 3, 'num_adj': 4, 'add_rate': 0.2672685857992006, 'tem': 1.3853314136560981, 'consis_rate': 0.43610527400603805, 'use_att': 1}
mean: 0.8038000000000001
[0.8   0.806 0.788 0.813 0.809 0.809 0.796 0.796 0.818 0.803]
cur_param: {'lr': 0.0010231502355153193, 'weight_decay': 0.0012626580457720318, 'dropout': 0.536135373115251, 'patience': 100, 'lr_reduce_freq': 90, 'spt_alg': 'kruskal', 'spt_attr': 'edge_degree', 'manifold': 'PoincareBall', 'num_layers': 3, 'num_adj': 4, 'add_rate': 0.32419158093665446, 'tem': 1.7477619145178886, 'consis_rate': 1.989656021932314, 'use_att': 1}
mean: 0.8106
[0.829 0.811 0.807 0.822 0.804 0.81  0.803 0.798 0.813 0.809]
cur_param: {'lr': 0.03653007575225438, 'weight_decay': 0.0016418078275279215, 'dropout': 0.5380946586377633, 'patience': 100, 'lr_reduce_freq': 90, 'spt_alg': 'kruskal', 'spt_attr': 'edge_degree', 'manifold': 'PoincareBall', 'num_layers': 3, 'num_adj': 2, 'add_rate': 0.325788153892239, 'tem': 1.8703780267650574, 'consis_rate': 1.9503603560918585, 'use_att': 1}
mean: 0.7936
[0.806 0.811 0.806 0.791 0.807 0.771 0.8   0.789 0.757 0.798]
cur_param: {'lr': 0.0020522290833972796, 'weight_decay': 0.0008376151834201512, 'dropout': 0.5013235105284299, 'patience': 100, 'lr_reduce_freq': 90, 'spt_alg': 'kruskal', 'spt_attr': 'edge_degree', 'manifold': 'PoincareBall', 'num_layers': 3, 'num_adj': 6, 'add_rate': 0.37797499112045857, 'tem': 1.751193370832614, 'consis_rate': 1.189700858414079, 'use_att': 1}
mean: 0.8141
[0.797 0.816 0.816 0.821 0.82  0.815 0.819 0.806 0.806 0.825]
cur_param: {'lr': 0.001115592546412631, 'weight_decay': 0.0006335904241872939, 'dropout': 0.5785984676093857, 'patience': 100, 'lr_reduce_freq': 90, 'spt_alg': 'kruskal', 'spt_attr': 'edge_degree', 'manifold': 'PoincareBall', 'num_layers': 3, 'num_adj': 6, 'add_rate': 0.32611366155801724, 'tem': 1.757556932900237, 'consis_rate': 1.735168817088974, 'use_att': 1}[32m[I 2022-06-22 12:21:38,640][0m Trial 56 finished with value: 0.8046000000000001 and parameters: {'lr': 0.001115592546412631, 'weight_decay': 0.0006335904241872939, 'dropout': 0.5785984676093857, 'patience': 100, 'lr_reduce_freq': 90, 'spt_alg': 'kruskal', 'spt_attr': 'edge_degree', 'manifold': 'PoincareBall', 'num_layers': 3, 'num_adj': 6, 'add_rate': 0.32611366155801724, 'tem': 1.757556932900237, 'consis_rate': 1.735168817088974, 'use_att': 1}. Best is trial 55 with value: 0.8141.[0m
[32m[I 2022-06-22 12:54:38,223][0m Trial 57 finished with value: 0.8110999999999999 and parameters: {'lr': 0.001971567175726452, 'weight_decay': 0.0008051586985605673, 'dropout': 0.5037563551019331, 'patience': 100, 'lr_reduce_freq': 90, 'spt_alg': 'kruskal', 'spt_attr': 'edge_degree', 'manifold': 'PoincareBall', 'num_layers': 3, 'num_adj': 8, 'add_rate': 0.3547059990406723, 'tem': 1.9356142424886311, 'consis_rate': 1.6432443164516202, 'use_att': 1}. Best is trial 55 with value: 0.8141.[0m
[32m[I 2022-06-22 13:26:05,679][0m Trial 58 finished with value: 0.8130000000000001 and parameters: {'lr': 0.0028306198048054683, 'weight_decay': 0.001283473989523531, 'dropout': 0.5069328182237003, 'patience': 100, 'lr_reduce_freq': 110, 'spt_alg': 'kruskal', 'spt_attr': 'edge_degree', 'manifold': 'PoincareBall', 'num_layers': 3, 'num_adj': 8, 'add_rate': 0.35418924490149317, 'tem': 1.924012325860149, 'consis_rate': 1.70151056335847, 'use_att': 1}. Best is trial 55 with value: 0.8141.[0m
[32m[I 2022-06-22 13:57:59,825][0m Trial 59 finished with value: 0.8108000000000001 and parameters: {'lr': 0.002564827097346242, 'weight_decay': 0.00083170915595985, 'dropout': 0.5147471586444144, 'patience': 100, 'lr_reduce_freq': 110, 'spt_alg': 'kruskal', 'spt_attr': 'edge_degree', 'manifold': 'PoincareBall', 'num_layers': 3, 'num_adj': 8, 'add_rate': 0.3417461696783885, 'tem': 1.9280627431036215, 'consis_rate': 1.8149583870523895, 'use_att': 1}. Best is trial 55 with value: 0.8141.[0m
[32m[I 2022-06-22 14:42:46,937][0m Trial 60 finished with value: 0.7889 and parameters: {'lr': 0.0028079780080680844, 'weight_decay': 0.0008941598682288677, 'dropout': 0.5016079396477946, 'patience': 100, 'lr_reduce_freq': 110, 'spt_alg': 'prim', 'spt_attr': 'edge_degree', 'manifold': 'PoincareBall', 'num_layers': 4, 'num_adj': 8, 'add_rate': 0.34279320412648656, 'tem': 1.9174374867707902, 'consis_rate': 1.796629491934669, 'use_att': 1}. Best is trial 55 with value: 0.8141.[0m
[32m[I 2022-06-22 15:16:19,719][0m Trial 61 finished with value: 0.8097999999999999 and parameters: {'lr': 0.0025872868311712515, 'weight_decay': 0.001247555208597941, 'dropout': 0.44939472352727383, 'patience': 100, 'lr_reduce_freq': 110, 'spt_alg': 'kruskal', 'spt_attr': 'edge_degree', 'manifold': 'PoincareBall', 'num_layers': 3, 'num_adj': 8, 'add_rate': 0.4330345793020589, 'tem': 1.9486035121730232, 'consis_rate': 1.9900862932224215, 'use_att': 1}. Best is trial 55 with value: 0.8141.[0m
[32m[I 2022-06-22 15:49:35,285][0m Trial 62 finished with value: 0.8154999999999999 and parameters: {'lr': 0.003443359411564813, 'weight_decay': 0.0012277603188626408, 'dropout': 0.4284480250475252, 'patience': 100, 'lr_reduce_freq': 130, 'spt_alg': 'kruskal', 'spt_attr': 'edge_degree', 'manifold': 'PoincareBall', 'num_layers': 3, 'num_adj': 8, 'add_rate': 0.35953159399164986, 'tem': 1.9369224094554263, 'consis_rate': 1.9952985813651243, 'use_att': 1}. Best is trial 62 with value: 0.8154999999999999.[0m
[32m[I 2022-06-22 16:14:34,597][0m Trial 63 finished with value: 0.3283 and parameters: {'lr': 0.003520169804286634, 'weight_decay': 0.021822148339289322, 'dropout': 0.40707563814228637, 'patience': 100, 'lr_reduce_freq': 130, 'spt_alg': 'kruskal', 'spt_attr': 'edge_degree', 'manifold': 'PoincareBall', 'num_layers': 3, 'num_adj': 8, 'add_rate': 0.3632222238341369, 'tem': 1.7912468464768556, 'consis_rate': 1.6025532632610973, 'use_att': 1}. Best is trial 62 with value: 0.8154999999999999.[0m
[32m[I 2022-06-22 16:46:30,254][0m Trial 64 finished with value: 0.8078000000000001 and parameters: {'lr': 0.0018748229607000917, 'weight_decay': 0.0008554157959672346, 'dropout': 0.5100933563645809, 'patience': 100, 'lr_reduce_freq': 130, 'spt_alg': 'kruskal', 'spt_attr': 'edge_degree', 'manifold': 'PoincareBall', 'num_layers': 3, 'num_adj': 8, 'add_rate': 0.2741646042236817, 'tem': 1.9261386299555996, 'consis_rate': 1.8474232687066443, 'use_att': 1}. Best is trial 62 with value: 0.8154999999999999.[0m
[32m[I 2022-06-22 17:17:38,450][0m Trial 65 finished with value: 0.8101 and parameters: {'lr': 0.003211600059594868, 'weight_decay': 0.0011920239733044955, 'dropout': 0.6540404390886092, 'patience': 100, 'lr_reduce_freq': 110, 'spt_alg': 'kruskal', 'spt_attr': 'edge_degree', 'manifold': 'PoincareBall', 'num_layers': 3, 'num_adj': 8, 'add_rate': 0.3101524352242765, 'tem': 1.9984351265265285, 'consis_rate': 1.7346831514556666, 'use_att': 1}. Best is trial 62 with value: 0.8154999999999999.[0m
[32m[I 2022-06-22 18:00:49,354][0m Trial 66 finished with value: 0.8077 and parameters: {'lr': 0.0010286524520118296, 'weight_decay': 0.0005451136382287776, 'dropout': 0.636651503419458, 'patience': 100, 'lr_reduce_freq': 110, 'spt_alg': 'kruskal', 'spt_attr': 'edge_degree', 'manifold': 'PoincareBall', 'num_layers': 3, 'num_adj': 8, 'add_rate': 0.3113507986469051, 'tem': 1.829663552589079, 'consis_rate': 1.7034636170652886, 'use_att': 1}. Best is trial 62 with value: 0.8154999999999999.[0m
[32m[I 2022-06-22 18:34:48,358][0m Trial 67 finished with value: 0.8174999999999999 and parameters: {'lr': 0.0032534615532520197, 'weight_decay': 0.0011927997696869806, 'dropout': 0.7086433493707192, 'patience': 100, 'lr_reduce_freq': 110, 'spt_alg': 'kruskal', 'spt_attr': 'edge_degree', 'manifold': 'PoincareBall', 'num_layers': 3, 'num_adj': 8, 'add_rate': 0.389041747306814, 'tem': 1.9727061684612763, 'consis_rate': 1.905763264497347, 'use_att': 1}. Best is trial 67 with value: 0.8174999999999999.[0m
[32m[I 2022-06-22 18:43:38,363][0m Trial 68 finished with value: 0.8031 and parameters: {'lr': 0.003785451958520078, 'weight_decay': 0.0018967390447296685, 'dropout': 0.7438044449857291, 'patience': 100, 'lr_reduce_freq': 150, 'spt_alg': 'kruskal', 'spt_attr': 'edge_degree', 'manifold': 'PoincareBall', 'num_layers': 3, 'num_adj': 8, 'add_rate': 0.45878724166099627, 'tem': 1.8915808408152022, 'consis_rate': 1.9056967262151927, 'use_att': 0}. Best is trial 67 with value: 0.8174999999999999.[0m
[32m[I 2022-06-22 19:30:13,249][0m Trial 69 finished with value: 0.8135 and parameters: {'lr': 0.0012943192871648843, 'weight_decay': 0.0012932282479768509, 'dropout': 0.587603294236149, 'patience': 100, 'lr_reduce_freq': 110, 'spt_alg': 'kruskal', 'spt_attr': 'edge_degree', 'manifold': 'PoincareBall', 'num_layers': 3, 'num_adj': 8, 'add_rate': 0.49049864897036366, 'tem': 1.731077236617178, 'consis_rate': 1.5580854088076597, 'use_att': 1}. Best is trial 67 with value: 0.8174999999999999.[0m
[32m[I 2022-06-22 20:15:03,242][0m Trial 70 finished with value: 0.8112 and parameters: {'lr': 0.0014088070606466136, 'weight_decay': 0.000769848409672924, 'dropout': 0.6993597247493581, 'patience': 100, 'lr_reduce_freq': 110, 'spt_alg': 'kruskal', 'spt_attr': 'edge_degree', 'manifold': 'PoincareBall', 'num_layers': 3, 'num_adj': 8, 'add_rate': 0.48641289050893777, 'tem': 1.812280269442826, 'consis_rate': 1.5532168610807482, 'use_att': 1}. Best is trial 67 with value: 0.8174999999999999.[0m
[32m[I 2022-06-22 21:03:11,861][0m Trial 71 finished with value: 0.8179000000000001 and parameters: {'lr': 0.0013791803113789483, 'weight_decay': 0.0007654178801603685, 'dropout': 0.7096076451888563, 'patience': 100, 'lr_reduce_freq': 110, 'spt_alg': 'kruskal', 'spt_attr': 'edge_degree', 'manifold': 'PoincareBall', 'num_layers': 3, 'num_adj': 8, 'add_rate': 0.5131757045317479, 'tem': 1.8120748669401507, 'consis_rate': 1.5487455268740709, 'use_att': 1}. Best is trial 71 with value: 0.8179000000000001.[0m
[32m[I 2022-06-22 21:51:54,158][0m Trial 72 finished with value: 0.8170999999999999 and parameters: {'lr': 0.0012900664029236169, 'weight_decay': 0.0006019614424865227, 'dropout': 0.7023276639626513, 'patience': 100, 'lr_reduce_freq': 110, 'spt_alg': 'kruskal', 'spt_attr': 'edge_degree', 'manifold': 'PoincareBall', 'num_layers': 3, 'num_adj': 8, 'add_rate': 0.5106514661148389, 'tem': 1.811687932916696, 'consis_rate': 1.51716545634337, 'use_att': 1}. Best is trial 71 with value: 0.8179000000000001.[0m
[32m[I 2022-06-22 22:40:34,456][0m Trial 73 finished with value: 0.8196 and parameters: {'lr': 0.0012758469250208986, 'weight_decay': 0.0006251821282509948, 'dropout': 0.715386692216834, 'patience': 100, 'lr_reduce_freq': 110, 'spt_alg': 'kruskal', 'spt_attr': 'edge_degree', 'manifold': 'PoincareBall', 'num_layers': 3, 'num_adj': 8, 'add_rate': 0.4953143481838856, 'tem': 1.811854627137149, 'consis_rate': 1.5210434113452582, 'use_att': 1}. Best is trial 73 with value: 0.8196.[0m
