[32m[I 2022-06-30 15:22:14,860][0m Trial 129 finished with value: 0.3292 and parameters: {'lr': 0.034646138888713394, 'weight_decay': 0.009371853689701094, 'dropout': 0.7523048452683874, 'patience': 100, 'lr_reduce_freq': 50, 'spt_alg': 'kruskal', 'spt_attr': 'similarity', 'manifold': 'PoincareBall', 'num_layers': 4, 'dim': 368, 'num_adj': 2, 'add_rate': 0.6335850428998234, 'tem': 0.9419889293190469, 'consis_rate': 0.6266645054821475, 'use_att': 1}. Best is trial 120 with value: 0.8225999999999999.[0m

mean: 0.8145
[0.812 0.832 0.805 0.824 0.813 0.823 0.787 0.82  0.807 0.822]
cur_param: {'lr': 0.013123101756998231, 'weight_decay': 0.0050476284552631485, 'dropout': 0.7997128638335957, 'patience': 70, 'lr_reduce_freq': 40, 'spt_alg': 'prim', 'spt_attr': 'similarity', 'manifold': 'PoincareBall', 'num_layers': 3, 'dim': 448, 'num_adj': 2, 'add_rate': 0.7948978808451295, 'tem': 1.2822986386889905, 'consis_rate': 0.8561962715723699, 'use_att': 1}
mean: 0.818
[0.797 0.822 0.827 0.82  0.822 0.827 0.803 0.814 0.818 0.83 ]
cur_param: {'lr': 0.015577723514697314, 'weight_decay': 0.005115620257815938, 'dropout': 0.7576431753893995, 'patience': 70, 'lr_reduce_freq': 40, 'spt_alg': 'prim', 'spt_attr': 'similarity', 'manifold': 'PoincareBall', 'num_layers': 3, 'dim': 448, 'num_adj': 2, 'add_rate': 0.7950109396208643, 'tem': 1.1550329566384145, 'consis_rate': 1.1322659798144517, 'use_att': 1}
mean: 0.8145
[0.817 0.818 0.824 0.806 0.813 0.82  0.819 0.79  0.828 0.81 ]
cur_param: {'lr': 0.013420225009124383, 'weight_decay': 0.006589432049247804, 'dropout': 0.7802670401885504, 'patience': 70, 'lr_reduce_freq': 40, 'spt_alg': 'prim', 'spt_attr': 'similarity', 'manifold': 'PoincareBall', 'num_layers': 3, 'dim': 432, 'num_adj': 2, 'add_rate': 0.8387592252146765, 'tem': 1.4592135149991075, 'consis_rate': 0.8427938442534797, 'use_att': 1}
mean: 0.8161999999999999
[0.821 0.817 0.805 0.818 0.813 0.821 0.811 0.817 0.821 0.818]
cur_param: {'lr': 0.007467281638518032, 'weight_decay': 0.005738332071411042, 'dropout': 0.742611790375882, 'patience': 90, 'lr_reduce_freq': 50, 'spt_alg': 'prim', 'spt_attr': 'similarity', 'manifold': 'PoincareBall', 'num_layers': 3, 'dim': 480, 'num_adj': 2, 'add_rate': 0.748805390387421, 'tem': 1.3316171474579288, 'consis_rate': 0.9381879129122269, 'use_att': 1}
mean: 0.8166
[0.83  0.806 0.819 0.824 0.822 0.822 0.825 0.806 0.805 0.807]
cur_param: {'lr': 0.009948480910294044, 'weight_decay': 0.004421485705852437, 'dropout': 0.7997585567955243, 'patience': 70, 'lr_reduce_freq': 40, 'spt_alg': 'prim', 'spt_attr': 'similarity', 'manifold': 'PoincareBall', 'num_layers': 3, 'dim': 448, 'num_adj': 2, 'add_rate': 0.7163721732037396, 'tem': 1.0970035908671616, 'consis_rate': 1.1990837073036982, 'use_att': 1}
mean: 0.8170999999999999
[0.822 0.809 0.816 0.812 0.828 0.825 0.821 0.81  0.813 0.815]
cur_param: {'lr': 0.019978355398194297, 'weight_decay': 0.01428071443593577, 'dropout': 0.7146458805411734, 'patience': 90, 'lr_reduce_freq': 50, 'spt_alg': 'prim', 'spt_attr': 'similarity', 'manifold': 'PoincareBall', 'num_layers': 3, 'dim': 432, 'num_adj': 2, 'add_rate': 0.7706449472208711, 'tem': 1.2717550677277112, 'consis_rate': 1.0510173041603643, 'use_att': 1}
mean: 0.3062
[0.319 0.319 0.319 0.319 0.319 0.319 0.176 0.334 0.319 0.319]
cur_param: {'lr': 0.01655642495766629, 'weight_decay': 0.007257830616382529, 'dropout': 0.7629673775276561, 'patience': 100, 'lr_reduce_freq': 60, 'spt_alg': 'prim', 'spt_attr': 'similarity', 'manifold': 'PoincareBall', 'num_layers': 3, 'dim': 464, 'num_adj': 2, 'add_rate': 0.6968847845238584, 'tem': 1.1244707803719265, 'consis_rate': 0.8149675814349494, 'use_att': 1}
mean: 0.8151999999999999
[0.822 0.803 0.816 0.821 0.826 0.809 0.808 0.819 0.814 0.814]
cur_param: {'lr': 0.023113168597282973, 'weight_decay': 0.009424444852772931, 'dropout': 0.729112713255771, 'patience': 90, 'lr_reduce_freq': 40, 'spt_alg': 'prim', 'spt_attr': 'similarity', 'manifold': 'PoincareBall', 'num_layers': 3, 'dim': 416, 'num_adj': 2, 'add_rate': 0.6626535797431111, 'tem': 1.2749387610124063, 'consis_rate': 0.7620526571329289, 'use_att': 1}
mean: 0.8200000000000001
[0.817 0.811 0.829 0.815 0.828 0.832 0.823 0.808 0.814 0.823]
cur_param: {'lr': 0.02990095005649478, 'weight_decay': 0.009651366360400586, 'dropout': 0.7008146407378063, 'patience': 90, 'lr_reduce_freq': 40, 'spt_alg': 'kruskal', 'spt_attr': 'similarity', 'manifold': 'PoincareBall', 'num_layers': 3, 'dim': 416, 'num_adj': 2, 'add_rate': 0.8829912018019117, 'tem': 1.0427956280652317, 'consis_rate': 0.6580238961292373, 'use_att': 1}
mean: 0.8225999999999999
[0.817 0.82  0.825 0.826 0.82  0.837 0.812 0.821 0.818 0.83 ]
cur_param: {'lr': 0.030689933638912942, 'weight_decay': 0.009468294847976021, 'dropout': 0.7001442959254386, 'patience': 90, 'lr_reduce_freq': 40, 'spt_alg': 'kruskal', 'spt_attr': 'similarity', 'manifold': 'PoincareBall', 'num_layers': 3, 'dim': 416, 'num_adj': 2, 'add_rate': 0.6658797461107581, 'tem': 0.9607792423153902, 'consis_rate': 0.519736880548547, 'use_att': 1}
mean: 0.8176
[0.827 0.798 0.814 0.817 0.821 0.821 0.823 0.825 0.819 0.811]
cur_param: {'lr': 0.026119625606169858, 'weight_decay': 0.010211046065933486, 'dropout': 0.7302111797808127, 'patience': 90, 'lr_reduce_freq': 40, 'spt_alg': 'kruskal', 'spt_attr': 'similarity', 'manifold': 'PoincareBall', 'num_layers': 3, 'dim': 416, 'num_adj': 2, 'add_rate': 0.8729091800737379, 'tem': 1.0363847990490203, 'consis_rate': 0.7354434208108016, 'use_att': 1}
mean: 0.76
[0.817 0.824 0.821 0.319 0.82  0.816 0.8   0.774 0.795 0.814]
cur_param: {'lr': 0.04351504429863692, 'weight_decay': 0.011061739780643537, 'dropout': 0.6833168124047564, 'patience': 90, 'lr_reduce_freq': 50, 'spt_alg': 'kruskal', 'spt_attr': 'similarity', 'manifold': 'PoincareBall', 'num_layers': 3, 'dim': 432, 'num_adj': 2, 'add_rate': 0.682952779339118, 'tem': 0.9930611818209564, 'consis_rate': 0.6477518364861465, 'use_att': 1}
mean: 0.8139
[0.826 0.804 0.81  0.817 0.807 0.814 0.815 0.802 0.825 0.819]
cur_param: {'lr': 0.03601523004573536, 'weight_decay': 0.008515613069237468, 'dropout': 0.5472896216906673, 'patience': 90, 'lr_reduce_freq': 40, 'spt_alg': 'kruskal', 'spt_attr': 'similarity', 'manifold': 'PoincareBall', 'num_layers': 3, 'dim': 400, 'num_adj': 2, 'add_rate': 0.643502095232753, 'tem': 1.230980998436168, 'consis_rate': 0.768536326276463, 'use_att': 1}
mean: 0.8083
[0.815 0.813 0.803 0.808 0.817 0.813 0.797 0.784 0.809 0.824]
cur_param: {'lr': 0.02268839321404666, 'weight_decay': 0.01383104002715792, 'dropout': 0.7433027631703868, 'patience': 90, 'lr_reduce_freq': 30, 'spt_alg': 'kruskal', 'spt_attr': 'similarity', 'manifold': 'PoincareBall', 'num_layers': 3, 'dim': 432, 'num_adj': 2, 'add_rate': 0.8460909707469437, 'tem': 1.0793601854131871, 'consis_rate': 0.5625988483635906, 'use_att': 1}
mean: 0.319
[0.319 0.319 0.319 0.319 0.319 0.319 0.319 0.319 0.319 0.319]
cur_param: {'lr': 0.027620675503292832, 'weight_decay': 0.016189936308644785, 'dropout': 0.6714157681545642, 'patience': 90, 'lr_reduce_freq': 50, 'spt_alg': 'prim', 'spt_attr': 'similarity', 'manifold': 'PoincareBall', 'num_layers': 3, 'dim': 416, 'num_adj': 2, 'add_rate': 0.8872629095583799, 'tem': 1.0458229481614558, 'consis_rate': 1.0132283676919236, 'use_att': 0}
mean: 0.31870000000000004
[0.319 0.32  0.319 0.319 0.319 0.317 0.319 0.319 0.319 0.317]
cur_param: {'lr': 0.024130970297396817, 'weight_decay': 0.009359827729521687, 'dropout': 0.7172699691746067, 'patience': 90, 'lr_reduce_freq': 40, 'spt_alg': 'prim', 'spt_attr': 'similarity', 'manifold': 'PoincareBall', 'num_layers': 3, 'dim': 384, 'num_adj': 2, 'add_rate': 0.6639484876246137, 'tem': 0.9294243463750893, 'consis_rate': 0.6618461701655303, 'use_att': 1}
mean: 0.8193999999999999
[0.83  0.819 0.823 0.816 0.827 0.824 0.818 0.811 0.815 0.811]
cur_param: {'lr': 0.03098729220847258, 'weight_decay': 0.03562082775512469, 'dropout': 0.7087128207274039, 'patience': 90, 'lr_reduce_freq': 30, 'spt_alg': 'prim', 'spt_attr': 'similarity', 'manifold': 'PoincareBall', 'num_layers': 3, 'dim': 384, 'num_adj': 2, 'add_rate': 0.6578546997007585, 'tem': 0.9222867433045899, 'consis_rate': 0.702997962187149, 'use_att': 1}
mean: 0.3198
[0.319 0.328 0.319 0.319 0.319 0.319 0.318 0.319 0.319 0.319]
cur_param: {'lr': 0.034646138888713394, 'weight_decay': 0.009371853689701094, 'dropout': 0.7523048452683874, 'patience': 100, 'lr_reduce_freq': 50, 'spt_alg': 'kruskal', 'spt_attr': 'similarity', 'manifold': 'PoincareBall', 'num_layers': 4, 'dim': 368, 'num_adj': 2, 'add_rate': 0.6335850428998234, 'tem': 0.9419889293190469, 'consis_rate': 0.6266645054821475, 'use_att': 1}
mean: 0.3292
[0.319 0.421 0.319 0.319 0.319 0.319 0.319 0.319 0.319 0.319]
cur_param: {'lr': 0.025037700511526314, 'weight_decay': 0.008012143813094088, 'dropout': 0.6533884840620097, 'patience': 90, 'lr_reduce_freq': 40, 'spt_alg': 'prim', 'spt_attr': 'similarity', 'manifold': 'Hyperboloid', 'num_layers': 5, 'dim': 512, 'num_adj': 2, 'add_rate': 0.6995104784120609, 'tem': 1.1072841666099156, 'consis_rate': 0.6817674716876583, 'use_att': 1}[32m[I 2022-06-30 15:34:20,359][0m Trial 130 finished with value: 0.319 and parameters: {'lr': 0.025037700511526314, 'weight_decay': 0.008012143813094088, 'dropout': 0.6533884840620097, 'patience': 90, 'lr_reduce_freq': 40, 'spt_alg': 'prim', 'spt_attr': 'similarity', 'manifold': 'Hyperboloid', 'num_layers': 5, 'dim': 512, 'num_adj': 2, 'add_rate': 0.6995104784120609, 'tem': 1.1072841666099156, 'consis_rate': 0.6817674716876583, 'use_att': 1}. Best is trial 120 with value: 0.8225999999999999.[0m
[32m[I 2022-06-30 15:43:16,092][0m Trial 131 finished with value: 0.8119999999999999 and parameters: {'lr': 0.05202332403557525, 'weight_decay': 0.006466676157423702, 'dropout': 0.7190919821453483, 'patience': 90, 'lr_reduce_freq': 40, 'spt_alg': 'prim', 'spt_attr': 'similarity', 'manifold': 'PoincareBall', 'num_layers': 3, 'dim': 432, 'num_adj': 2, 'add_rate': 0.6072035497552744, 'tem': 1.0070751265810507, 'consis_rate': 1.249160639453325, 'use_att': 1}. Best is trial 120 with value: 0.8225999999999999.[0m
[32m[I 2022-06-30 15:48:51,199][0m Trial 132 finished with value: 0.32849999999999996 and parameters: {'lr': 0.019159346614457968, 'weight_decay': 0.011144786909069764, 'dropout': 0.7305262986551162, 'patience': 90, 'lr_reduce_freq': 40, 'spt_alg': 'prim', 'spt_attr': 'similarity', 'manifold': 'PoincareBall', 'num_layers': 3, 'dim': 400, 'num_adj': 2, 'add_rate': 0.7277694948549212, 'tem': 1.1924513229182676, 'consis_rate': 1.1108426082721923, 'use_att': 1}. Best is trial 120 with value: 0.8225999999999999.[0m
[32m[I 2022-06-30 16:01:11,251][0m Trial 133 finished with value: 0.8205 and parameters: {'lr': 0.021902455859975967, 'weight_decay': 0.007179834810188918, 'dropout': 0.7627904453382913, 'patience': 90, 'lr_reduce_freq': 50, 'spt_alg': 'prim', 'spt_attr': 'similarity', 'manifold': 'PoincareBall', 'num_layers': 3, 'dim': 384, 'num_adj': 2, 'add_rate': 0.8597116390825718, 'tem': 1.0706888686445348, 'consis_rate': 0.4725794581214694, 'use_att': 1}. Best is trial 120 with value: 0.8225999999999999.[0m
[32m[I 2022-06-30 16:14:45,456][0m Trial 134 finished with value: 0.8209 and parameters: {'lr': 0.022370801425328754, 'weight_decay': 0.009006135491442132, 'dropout': 0.779013065196834, 'patience': 90, 'lr_reduce_freq': 50, 'spt_alg': 'prim', 'spt_attr': 'similarity', 'manifold': 'PoincareBall', 'num_layers': 3, 'dim': 368, 'num_adj': 2, 'add_rate': 0.864479395404698, 'tem': 1.0525828919053575, 'consis_rate': 0.3730363263599689, 'use_att': 1}. Best is trial 120 with value: 0.8225999999999999.[0m
[32m[I 2022-06-30 16:27:06,223][0m Trial 135 finished with value: 0.7688999999999999 and parameters: {'lr': 0.022324099614814095, 'weight_decay': 0.008939675822846188, 'dropout': 0.7790805868401325, 'patience': 90, 'lr_reduce_freq': 50, 'spt_alg': 'prim', 'spt_attr': 'similarity', 'manifold': 'PoincareBall', 'num_layers': 3, 'dim': 368, 'num_adj': 2, 'add_rate': 0.8561488558656735, 'tem': 1.00179443717637, 'consis_rate': 0.4174573619804638, 'use_att': 1}. Best is trial 120 with value: 0.8225999999999999.[0m
[32m[I 2022-06-30 16:37:53,781][0m Trial 136 finished with value: 0.8149000000000001 and parameters: {'lr': 0.028142711253558477, 'weight_decay': 0.0074470956027864205, 'dropout': 0.7725364341133487, 'patience': 90, 'lr_reduce_freq': 60, 'spt_alg': 'prim', 'spt_attr': 'similarity', 'manifold': 'PoincareBall', 'num_layers': 3, 'dim': 352, 'num_adj': 2, 'add_rate': 0.8650542795053188, 'tem': 1.0844062302760897, 'consis_rate': 0.3498109197452892, 'use_att': 1}. Best is trial 120 with value: 0.8225999999999999.[0m
[32m[I 2022-06-30 16:47:49,718][0m Trial 137 finished with value: 0.6194 and parameters: {'lr': 0.024097471939994446, 'weight_decay': 0.010340989425717607, 'dropout': 0.7408585092005442, 'patience': 90, 'lr_reduce_freq': 50, 'spt_alg': 'prim', 'spt_attr': 'similarity', 'manifold': 'PoincareBall', 'num_layers': 3, 'dim': 384, 'num_adj': 2, 'add_rate': 0.8292794196462024, 'tem': 1.0588937793056954, 'consis_rate': 0.5184319216480335, 'use_att': 1}. Best is trial 120 with value: 0.8225999999999999.[0m
[32m[I 2022-06-30 16:59:01,994][0m Trial 138 finished with value: 0.8204 and parameters: {'lr': 0.020764775940047456, 'weight_decay': 0.008426142937291884, 'dropout': 0.7660889073639634, 'patience': 90, 'lr_reduce_freq': 50, 'spt_alg': 'prim', 'spt_attr': 'similarity', 'manifold': 'PoincareBall', 'num_layers': 3, 'dim': 384, 'num_adj': 2, 'add_rate': 0.8870050076180626, 'tem': 1.4991007523047486, 'consis_rate': 0.43826756751616225, 'use_att': 1}. Best is trial 120 with value: 0.8225999999999999.[0m
[32m[I 2022-06-30 17:05:08,812][0m Trial 139 finished with value: 0.3217 and parameters: {'lr': 0.020886646980603316, 'weight_decay': 0.01140304530535557, 'dropout': 0.7859183769108735, 'patience': 90, 'lr_reduce_freq': 60, 'spt_alg': 'prim', 'spt_attr': 'similarity', 'manifold': 'PoincareBall', 'num_layers': 3, 'dim': 384, 'num_adj': 2, 'add_rate': 0.8874594602882192, 'tem': 1.4422034542404625, 'consis_rate': 0.30162827548011406, 'use_att': 1}. Best is trial 120 with value: 0.8225999999999999.[0m
[32m[I 2022-06-30 17:19:00,706][0m Trial 140 finished with value: 0.6436999999999999 and parameters: {'lr': 0.03180369517900535, 'weight_decay': 0.01312946472272529, 'dropout': 0.763825204551153, 'patience': 90, 'lr_reduce_freq': 50, 'spt_alg': 'prim', 'spt_attr': 'similarity', 'manifold': 'PoincareBall', 'num_layers': 3, 'dim': 368, 'num_adj': 2, 'add_rate': 0.8968446163551931, 'tem': 1.4877555624655172, 'consis_rate': 0.4715372533015479, 'use_att': 1}. Best is trial 120 with value: 0.8225999999999999.[0m
[32m[I 2022-06-30 17:30:26,257][0m Trial 141 finished with value: 0.7218 and parameters: {'lr': 0.018268990994902527, 'weight_decay': 0.008504474903158442, 'dropout': 0.7511348372703511, 'patience': 90, 'lr_reduce_freq': 50, 'spt_alg': 'prim', 'spt_attr': 'similarity', 'manifold': 'PoincareBall', 'num_layers': 3, 'dim': 384, 'num_adj': 2, 'add_rate': 0.8443912433680506, 'tem': 1.46203983450938, 'consis_rate': 0.2722255507947337, 'use_att': 1}. Best is trial 120 with value: 0.8225999999999999.[0m
[32m[I 2022-06-30 17:40:37,702][0m Trial 142 finished with value: 0.7191 and parameters: {'lr': 0.023604866314756424, 'weight_decay': 0.009419092394715296, 'dropout': 0.7012352428868149, 'patience': 90, 'lr_reduce_freq': 50, 'spt_alg': 'prim', 'spt_attr': 'similarity', 'manifold': 'PoincareBall', 'num_layers': 3, 'dim': 320, 'num_adj': 2, 'add_rate': 0.874708131412674, 'tem': 1.0690195792564332, 'consis_rate': 0.37529688119116833, 'use_att': 1}. Best is trial 120 with value: 0.8225999999999999.[0m
[32m[I 2022-06-30 17:51:16,219][0m Trial 143 finished with value: 0.8149999999999998 and parameters: {'lr': 0.026969840105723713, 'weight_decay': 0.00720059062944078, 'dropout': 0.7709557202538021, 'patience': 90, 'lr_reduce_freq': 60, 'spt_alg': 'prim', 'spt_attr': 'similarity', 'manifold': 'PoincareBall', 'num_layers': 3, 'dim': 336, 'num_adj': 2, 'add_rate': 0.8168008986388655, 'tem': 1.13400561115937, 'consis_rate': 0.4485159525423358, 'use_att': 1}. Best is trial 120 with value: 0.8225999999999999.[0m
[32m[I 2022-06-30 18:01:21,992][0m Trial 144 finished with value: 0.8137000000000001 and parameters: {'lr': 0.020924836173533155, 'weight_decay': 0.005766058804796959, 'dropout': 0.7239260382199684, 'patience': 90, 'lr_reduce_freq': 70, 'spt_alg': 'prim', 'spt_attr': 'similarity', 'manifold': 'PoincareBall', 'num_layers': 3, 'dim': 416, 'num_adj': 2, 'add_rate': 0.8649835757566825, 'tem': 1.0159488800127985, 'consis_rate': 0.5759587375836066, 'use_att': 1}. Best is trial 120 with value: 0.8225999999999999.[0m
[32m[I 2022-06-30 18:12:17,604][0m Trial 145 finished with value: 0.8122999999999999 and parameters: {'lr': 0.0182496404396437, 'weight_decay': 0.008012292722490948, 'dropout': 0.737446328796516, 'patience': 90, 'lr_reduce_freq': 50, 'spt_alg': 'prim', 'spt_attr': 'similarity', 'manifold': 'PoincareBall', 'num_layers': 3, 'dim': 448, 'num_adj': 2, 'add_rate': 0.8350174121963702, 'tem': 1.0506397299971892, 'consis_rate': 0.4850222715153358, 'use_att': 1}. Best is trial 120 with value: 0.8225999999999999.[0m
[32m[I 2022-06-30 18:24:49,818][0m Trial 146 finished with value: 0.8126 and parameters: {'lr': 0.03756498703614161, 'weight_decay': 0.0070238745745844905, 'dropout': 0.7822006518691271, 'patience': 90, 'lr_reduce_freq': 80, 'spt_alg': 'prim', 'spt_attr': 'similarity', 'manifold': 'PoincareBall', 'num_layers': 3, 'dim': 480, 'num_adj': 2, 'add_rate': 0.662471842183777, 'tem': 0.9823025703443504, 'consis_rate': 0.41609806553471845, 'use_att': 1}. Best is trial 120 with value: 0.8225999999999999.[0m
[32m[I 2022-06-30 18:34:35,712][0m Trial 147 finished with value: 0.8173 and parameters: {'lr': 0.024642651165394998, 'weight_decay': 0.0054694467666940895, 'dropout': 0.7602000370509115, 'patience': 90, 'lr_reduce_freq': 50, 'spt_alg': 'prim', 'spt_attr': 'similarity', 'manifold': 'PoincareBall', 'num_layers': 3, 'dim': 368, 'num_adj': 2, 'add_rate': 0.6227256617610318, 'tem': 1.38186975550227, 'consis_rate': 0.5358739649578714, 'use_att': 1}. Best is trial 120 with value: 0.8225999999999999.[0m
