[32m[I 2022-06-27 19:15:05,133][0m Trial 144 finished with value: 0.8220999999999998 and parameters: {'lr': 0.00462389758290307, 'weight_decay': 0.0007019370776812166, 'dropout': 0.7450243954580468, 'patience': 80, 'lr_reduce_freq': 90, 'spt_alg': 'prim', 'spt_attr': 'edge_degree', 'manifold': 'PoincareBall', 'num_layers': 3, 'dim': 328, 'num_adj': 6, 'add_rate': 0.524763225267356, 'tem': 1.1326817313965163, 'consis_rate': 1.6070110304430656, 'use_att': 1}. Best is trial 70 with value: 0.8281999999999998.[0m

cur_param: {'lr': 0.0045703941905075535, 'weight_decay': 0.0002712271260833896, 'dropout': 0.7618027514645864, 'patience': 80, 'lr_reduce_freq': 90, 'spt_alg': 'prim', 'spt_attr': 'edge_degree', 'manifold': 'PoincareBall', 'num_layers': 3, 'dim': 332, 'num_adj': 6, 'add_rate': 0.5206864318342317, 'tem': 1.09357977114279, 'consis_rate': 1.501783491333403, 'use_att': 1}
mean: 0.8185
[0.825 0.824 0.82  0.805 0.828 0.803 0.815 0.826 0.806 0.833]
cur_param: {'lr': 0.003971363925062181, 'weight_decay': 0.000759636111757129, 'dropout': 0.788097222760538, 'patience': 80, 'lr_reduce_freq': 90, 'spt_alg': 'prim', 'spt_attr': 'edge_degree', 'manifold': 'PoincareBall', 'num_layers': 3, 'dim': 328, 'num_adj': 6, 'add_rate': 0.5320138788922005, 'tem': 1.0672173471325355, 'consis_rate': 1.6134558933986556, 'use_att': 1}
mean: 0.8221999999999998
[0.831 0.816 0.82  0.823 0.824 0.831 0.822 0.822 0.808 0.825]
cur_param: {'lr': 0.0034881418855193507, 'weight_decay': 0.000711494679794936, 'dropout': 0.7730735706022427, 'patience': 80, 'lr_reduce_freq': 90, 'spt_alg': 'prim', 'spt_attr': 'edge_degree', 'manifold': 'PoincareBall', 'num_layers': 3, 'dim': 336, 'num_adj': 6, 'add_rate': 0.5483135786939459, 'tem': 1.0815939901439775, 'consis_rate': 1.57408101094459, 'use_att': 1}
mean: 0.8206000000000001
[0.829 0.829 0.809 0.818 0.826 0.824 0.841 0.816 0.822 0.792]
cur_param: {'lr': 0.004413168860258786, 'weight_decay': 0.000788549869240009, 'dropout': 0.7833413729096075, 'patience': 80, 'lr_reduce_freq': 90, 'spt_alg': 'prim', 'spt_attr': 'similarity', 'manifold': 'PoincareBall', 'num_layers': 3, 'dim': 332, 'num_adj': 6, 'add_rate': 0.5079420676752671, 'tem': 1.1090927391864258, 'consis_rate': 1.5335292017347242, 'use_att': 1}
mean: 0.8194999999999999
[0.813 0.83  0.806 0.819 0.816 0.827 0.823 0.832 0.809 0.82 ]
cur_param: {'lr': 0.004070642643857587, 'weight_decay': 0.0007487029639963988, 'dropout': 0.7879668682161944, 'patience': 80, 'lr_reduce_freq': 90, 'spt_alg': 'prim', 'spt_attr': 'edge_degree', 'manifold': 'PoincareBall', 'num_layers': 3, 'dim': 320, 'num_adj': 6, 'add_rate': 0.5145044544488137, 'tem': 1.1002473111252902, 'consis_rate': 1.5548741701975062, 'use_att': 1}
mean: 0.8208
[0.818 0.836 0.821 0.83  0.824 0.817 0.82  0.808 0.806 0.828]
cur_param: {'lr': 0.0039504464517784, 'weight_decay': 0.0007419411179030974, 'dropout': 0.7896188426207997, 'patience': 80, 'lr_reduce_freq': 90, 'spt_alg': 'prim', 'spt_attr': 'edge_degree', 'manifold': 'PoincareBall', 'num_layers': 3, 'dim': 328, 'num_adj': 6, 'add_rate': 0.5412135285816939, 'tem': 1.1197730549168796, 'consis_rate': 1.6248631397375028, 'use_att': 1}
mean: 0.8205
[0.838 0.819 0.812 0.801 0.83  0.824 0.82  0.817 0.812 0.832]
cur_param: {'lr': 0.003123270615177739, 'weight_decay': 0.0007678226261043819, 'dropout': 0.7687333303470535, 'patience': 80, 'lr_reduce_freq': 90, 'spt_alg': 'prim', 'spt_attr': 'edge_degree', 'manifold': 'PoincareBall', 'num_layers': 3, 'dim': 324, 'num_adj': 6, 'add_rate': 0.5198288101898495, 'tem': 1.0896768140906077, 'consis_rate': 1.5996191076945083, 'use_att': 1}
mean: 0.818
[0.823 0.817 0.811 0.824 0.823 0.821 0.821 0.824 0.806 0.81 ]
cur_param: {'lr': 0.003672626846878668, 'weight_decay': 0.0006962100407682388, 'dropout': 0.7772314778435403, 'patience': 80, 'lr_reduce_freq': 90, 'spt_alg': 'prim', 'spt_attr': 'edge_degree', 'manifold': 'PoincareBall', 'num_layers': 3, 'dim': 336, 'num_adj': 6, 'add_rate': 0.5138186277111931, 'tem': 1.074217095523271, 'consis_rate': 1.5667877247059996, 'use_att': 1}
mean: 0.8251
[0.826 0.823 0.837 0.818 0.818 0.818 0.833 0.821 0.821 0.836]
cur_param: {'lr': 0.003223384164911468, 'weight_decay': 0.0006921116894870003, 'dropout': 0.799912408079864, 'patience': 80, 'lr_reduce_freq': 90, 'spt_alg': 'prim', 'spt_attr': 'edge_degree', 'manifold': 'PoincareBall', 'num_layers': 3, 'dim': 336, 'num_adj': 6, 'add_rate': 0.5027839215654214, 'tem': 1.0444582703483116, 'consis_rate': 1.5853287335836974, 'use_att': 1}
mean: 0.8251
[0.834 0.823 0.835 0.832 0.808 0.829 0.839 0.828 0.819 0.804]
cur_param: {'lr': 0.0032579895222479465, 'weight_decay': 0.0006911503094740113, 'dropout': 0.7996859911719407, 'patience': 80, 'lr_reduce_freq': 90, 'spt_alg': 'prim', 'spt_attr': 'edge_degree', 'manifold': 'Hyperboloid', 'num_layers': 3, 'dim': 332, 'num_adj': 6, 'add_rate': 0.4998640728222841, 'tem': 1.0441532868563936, 'consis_rate': 1.5657328580037047, 'use_att': 0}
mean: 0.8084000000000001
[0.779 0.824 0.814 0.82  0.811 0.801 0.815 0.819 0.79  0.811]
cur_param: {'lr': 0.00365421828439354, 'weight_decay': 0.0007227599209427042, 'dropout': 0.7778023688968873, 'patience': 80, 'lr_reduce_freq': 90, 'spt_alg': 'prim', 'spt_attr': 'edge_degree', 'manifold': 'PoincareBall', 'num_layers': 3, 'dim': 336, 'num_adj': 6, 'add_rate': 0.5106413729064594, 'tem': 1.0173647500444307, 'consis_rate': 1.5864637767096381, 'use_att': 1}
mean: 0.8221999999999999
[0.811 0.83  0.823 0.816 0.82  0.827 0.824 0.819 0.82  0.832]
cur_param: {'lr': 0.0037838633079156306, 'weight_decay': 0.0007316696416617396, 'dropout': 0.7933888029209247, 'patience': 80, 'lr_reduce_freq': 90, 'spt_alg': 'prim', 'spt_attr': 'edge_degree', 'manifold': 'PoincareBall', 'num_layers': 3, 'dim': 332, 'num_adj': 6, 'add_rate': 0.5258826071827668, 'tem': 1.0715047642338267, 'consis_rate': 1.6048105980062521, 'use_att': 1}
mean: 0.8181
[0.81  0.833 0.821 0.816 0.822 0.809 0.833 0.824 0.802 0.811]
cur_param: {'lr': 0.004188295206263189, 'weight_decay': 0.0007096835379399292, 'dropout': 0.7808781012987449, 'patience': 80, 'lr_reduce_freq': 90, 'spt_alg': 'prim', 'spt_attr': 'edge_degree', 'manifold': 'PoincareBall', 'num_layers': 3, 'dim': 328, 'num_adj': 6, 'add_rate': 0.495020016932928, 'tem': 1.0578186333122492, 'consis_rate': 1.5762786652478893, 'use_att': 1}
mean: 0.8196
[0.836 0.81  0.823 0.796 0.829 0.818 0.835 0.815 0.818 0.816]
cur_param: {'lr': 0.003170681997770864, 'weight_decay': 0.0007544721610196509, 'dropout': 0.7610626323483615, 'patience': 80, 'lr_reduce_freq': 90, 'spt_alg': 'prim', 'spt_attr': 'edge_degree', 'manifold': 'PoincareBall', 'num_layers': 3, 'dim': 336, 'num_adj': 6, 'add_rate': 0.534290427908463, 'tem': 1.0478957615511286, 'consis_rate': 1.5656740489352188, 'use_att': 1}
mean: 0.821
[0.821 0.821 0.826 0.792 0.826 0.83  0.836 0.815 0.812 0.831]
cur_param: {'lr': 0.00280458189780685, 'weight_decay': 0.0006997845879410146, 'dropout': 0.7721316937966145, 'patience': 80, 'lr_reduce_freq': 90, 'spt_alg': 'prim', 'spt_attr': 'edge_degree', 'manifold': 'PoincareBall', 'num_layers': 3, 'dim': 336, 'num_adj': 6, 'add_rate': 0.54249862218161, 'tem': 1.159738001215826, 'consis_rate': 1.5879237411147584, 'use_att': 1}
mean: 0.8221999999999999
[0.793 0.814 0.837 0.806 0.814 0.823 0.844 0.831 0.82  0.84 ]
cur_param: {'lr': 0.0034735872865523042, 'weight_decay': 0.0007171899618091198, 'dropout': 0.7662304137433279, 'patience': 80, 'lr_reduce_freq': 90, 'spt_alg': 'prim', 'spt_attr': 'edge_degree', 'manifold': 'PoincareBall', 'num_layers': 3, 'dim': 336, 'num_adj': 6, 'add_rate': 0.5520579933346847, 'tem': 1.0648459744748848, 'consis_rate': 1.6211287505479415, 'use_att': 1}
mean: 0.8190000000000002
[0.823 0.826 0.826 0.798 0.823 0.796 0.83  0.819 0.81  0.839]
cur_param: {'lr': 0.004902008348279194, 'weight_decay': 0.0006738797255307548, 'dropout': 0.7837309055263221, 'patience': 80, 'lr_reduce_freq': 90, 'spt_alg': 'prim', 'spt_attr': 'edge_degree', 'manifold': 'PoincareBall', 'num_layers': 3, 'dim': 332, 'num_adj': 6, 'add_rate': 0.506085637721707, 'tem': 1.075808926399246, 'consis_rate': 1.6474314531392855, 'use_att': 1}
mean: 0.8161999999999999
[0.822 0.823 0.816 0.805 0.816 0.809 0.819 0.826 0.802 0.824]
cur_param: {'lr': 0.00462389758290307, 'weight_decay': 0.0007019370776812166, 'dropout': 0.7450243954580468, 'patience': 80, 'lr_reduce_freq': 90, 'spt_alg': 'prim', 'spt_attr': 'edge_degree', 'manifold': 'PoincareBall', 'num_layers': 3, 'dim': 328, 'num_adj': 6, 'add_rate': 0.524763225267356, 'tem': 1.1326817313965163, 'consis_rate': 1.6070110304430656, 'use_att': 1}
mean: 0.8220999999999998
[0.818 0.829 0.828 0.811 0.837 0.818 0.831 0.824 0.813 0.812]
cur_param: {'lr': 0.004445166335639026, 'weight_decay': 0.0006547579172795811, 'dropout': 0.794885661609047, 'patience': 80, 'lr_reduce_freq': 90, 'spt_alg': 'prim', 'spt_attr': 'edge_degree', 'manifold': 'PoincareBall', 'num_layers': 3, 'dim': 336, 'num_adj': 6, 'add_rate': 0.4947947102939864, 'tem': 1.033159152404501, 'consis_rate': 1.594147467967974, 'use_att': 1}[32m[I 2022-06-27 19:42:48,028][0m Trial 145 finished with value: 0.8237 and parameters: {'lr': 0.004445166335639026, 'weight_decay': 0.0006547579172795811, 'dropout': 0.794885661609047, 'patience': 80, 'lr_reduce_freq': 90, 'spt_alg': 'prim', 'spt_attr': 'edge_degree', 'manifold': 'PoincareBall', 'num_layers': 3, 'dim': 336, 'num_adj': 6, 'add_rate': 0.4947947102939864, 'tem': 1.033159152404501, 'consis_rate': 1.594147467967974, 'use_att': 1}. Best is trial 70 with value: 0.8281999999999998.[0m
[32m[I 2022-06-27 20:28:41,822][0m Trial 146 finished with value: 0.8192 and parameters: {'lr': 0.003655330867967867, 'weight_decay': 0.000781664823074336, 'dropout': 0.7955506919300279, 'patience': 80, 'lr_reduce_freq': 90, 'spt_alg': 'prim', 'spt_attr': 'edge_degree', 'manifold': 'PoincareBall', 'num_layers': 3, 'dim': 332, 'num_adj': 6, 'add_rate': 0.4942159115175174, 'tem': 1.03832723636092, 'consis_rate': 1.5800725891990646, 'use_att': 1}. Best is trial 70 with value: 0.8281999999999998.[0m
[32m[I 2022-06-27 21:14:52,288][0m Trial 147 finished with value: 0.8192999999999999 and parameters: {'lr': 0.004395102781721125, 'weight_decay': 0.0006528685744423599, 'dropout': 0.7991673910257163, 'patience': 80, 'lr_reduce_freq': 90, 'spt_alg': 'prim', 'spt_attr': 'edge_degree', 'manifold': 'PoincareBall', 'num_layers': 3, 'dim': 332, 'num_adj': 6, 'add_rate': 0.5592317303279465, 'tem': 1.0548328634528281, 'consis_rate': 1.5939689005995432, 'use_att': 1}. Best is trial 70 with value: 0.8281999999999998.[0m
[32m[I 2022-06-27 21:47:04,941][0m Trial 148 finished with value: 0.8193999999999999 and parameters: {'lr': 0.004173128422373556, 'weight_decay': 0.0006842173145710944, 'dropout': 0.7769633092663023, 'patience': 80, 'lr_reduce_freq': 90, 'spt_alg': 'prim', 'spt_attr': 'edge_degree', 'manifold': 'PoincareBall', 'num_layers': 3, 'dim': 336, 'num_adj': 4, 'add_rate': 0.5026280011316357, 'tem': 1.0132147002484067, 'consis_rate': 1.5539881835400555, 'use_att': 1}. Best is trial 70 with value: 0.8281999999999998.[0m
[32m[I 2022-06-27 22:34:11,375][0m Trial 149 finished with value: 0.8243 and parameters: {'lr': 0.004476170453230262, 'weight_decay': 0.0007329502044869295, 'dropout': 0.7868914478058509, 'patience': 80, 'lr_reduce_freq': 90, 'spt_alg': 'prim', 'spt_attr': 'edge_degree', 'manifold': 'PoincareBall', 'num_layers': 3, 'dim': 336, 'num_adj': 6, 'add_rate': 0.5293936733667897, 'tem': 1.0251362752121194, 'consis_rate': 1.6136448794049127, 'use_att': 1}. Best is trial 70 with value: 0.8281999999999998.[0m

mean: 0.8237
[0.816 0.828 0.834 0.828 0.819 0.813 0.835 0.812 0.827 0.825]
cur_param: {'lr': 0.003655330867967867, 'weight_decay': 0.000781664823074336, 'dropout': 0.7955506919300279, 'patience': 80, 'lr_reduce_freq': 90, 'spt_alg': 'prim', 'spt_attr': 'edge_degree', 'manifold': 'PoincareBall', 'num_layers': 3, 'dim': 332, 'num_adj': 6, 'add_rate': 0.4942159115175174, 'tem': 1.03832723636092, 'consis_rate': 1.5800725891990646, 'use_att': 1}
mean: 0.8192
[0.803 0.831 0.813 0.811 0.822 0.825 0.838 0.813 0.807 0.829]
cur_param: {'lr': 0.004395102781721125, 'weight_decay': 0.0006528685744423599, 'dropout': 0.7991673910257163, 'patience': 80, 'lr_reduce_freq': 90, 'spt_alg': 'prim', 'spt_attr': 'edge_degree', 'manifold': 'PoincareBall', 'num_layers': 3, 'dim': 332, 'num_adj': 6, 'add_rate': 0.5592317303279465, 'tem': 1.0548328634528281, 'consis_rate': 1.5939689005995432, 'use_att': 1}
mean: 0.8192999999999999
[0.82  0.826 0.816 0.818 0.815 0.82  0.806 0.82  0.823 0.829]
cur_param: {'lr': 0.004173128422373556, 'weight_decay': 0.0006842173145710944, 'dropout': 0.7769633092663023, 'patience': 80, 'lr_reduce_freq': 90, 'spt_alg': 'prim', 'spt_attr': 'edge_degree', 'manifold': 'PoincareBall', 'num_layers': 3, 'dim': 336, 'num_adj': 4, 'add_rate': 0.5026280011316357, 'tem': 1.0132147002484067, 'consis_rate': 1.5539881835400555, 'use_att': 1}
mean: 0.8193999999999999
[0.803 0.818 0.829 0.814 0.805 0.825 0.82  0.835 0.819 0.826]
cur_param: {'lr': 0.004476170453230262, 'weight_decay': 0.0007329502044869295, 'dropout': 0.7868914478058509, 'patience': 80, 'lr_reduce_freq': 90, 'spt_alg': 'prim', 'spt_attr': 'edge_degree', 'manifold': 'PoincareBall', 'num_layers': 3, 'dim': 336, 'num_adj': 6, 'add_rate': 0.5293936733667897, 'tem': 1.0251362752121194, 'consis_rate': 1.6136448794049127, 'use_att': 1}
mean: 0.8243
[0.834 0.828 0.824 0.817 0.826 0.816 0.836 0.816 0.82  0.826]
best param:{'lr': 0.0050377024135704294, 'weight_decay': 0.0007974034777024048, 'dropout': 0.7088886318937898, 'patience': 80, 'lr_reduce_freq': 90, 'spt_alg': 'prim', 'spt_attr': 'edge_degree', 'manifold': 'PoincareBall', 'num_layers': 3, 'dim': 336, 'num_adj': 6, 'add_rate': 0.4924438523129478, 'tem': 1.1263229568931772, 'consis_rate': 1.6925325255379633, 'use_att': 1}
best score:0.8281999999999998

Final results:

0.8281999999999998
