[32m[I 2022-06-23 15:47:28,295][0m Trial 93 finished with value: 0.8170999999999999 and parameters: {'lr': 0.0017441045389735906, 'weight_decay': 0.000915523485456127, 'dropout': 0.8106532129680869, 'patience': 100, 'lr_reduce_freq': 150, 'spt_alg': 'prim', 'spt_attr': 'edge_degree', 'manifold': 'PoincareBall', 'num_layers': 3, 'num_adj': 8, 'add_rate': 0.6567116418779705, 'tem': 1.5716401774361624, 'consis_rate': 1.4639704761619274, 'use_att': 1}. Best is trial 86 with value: 0.8200999999999998.[0m

mean: 0.2735
[0.319 0.319 0.318 0.091 0.29  0.319 0.119 0.319 0.322 0.319]
cur_param: {'lr': 0.0012381483967700048, 'weight_decay': 0.001075856307118221, 'dropout': 0.8562527324020782, 'patience': 100, 'lr_reduce_freq': 110, 'spt_alg': 'kruskal', 'spt_attr': 'edge_degree', 'manifold': 'PoincareBall', 'num_layers': 3, 'num_adj': 8, 'add_rate': 0.6070765938857137, 'tem': 1.8075646047931138, 'consis_rate': 1.356350725760801, 'use_att': 1}
mean: 0.8091000000000002
[0.809 0.819 0.816 0.805 0.815 0.809 0.784 0.813 0.82  0.801]
cur_param: {'lr': 0.0014973081272592582, 'weight_decay': 0.0005909485009498059, 'dropout': 0.7571435427866131, 'patience': 100, 'lr_reduce_freq': 130, 'spt_alg': 'kruskal', 'spt_attr': 'edge_degree', 'manifold': 'PoincareBall', 'num_layers': 4, 'num_adj': 8, 'add_rate': 0.550372378056021, 'tem': 1.6131854754387644, 'consis_rate': 1.4448646342097717, 'use_att': 1}
mean: 0.7478999999999999
[0.75  0.703 0.75  0.778 0.757 0.751 0.739 0.741 0.766 0.744]
cur_param: {'lr': 0.001819802068194661, 'weight_decay': 0.001343847987804818, 'dropout': 0.5955901792753423, 'patience': 100, 'lr_reduce_freq': 110, 'spt_alg': 'prim', 'spt_attr': 'edge_degree', 'manifold': 'PoincareBall', 'num_layers': 3, 'num_adj': 8, 'add_rate': 0.6860557550624157, 'tem': 1.8831780946118473, 'consis_rate': 1.5395148789665216, 'use_att': 1}
mean: 0.8105
[0.817 0.802 0.82  0.806 0.809 0.81  0.805 0.803 0.82  0.813]
cur_param: {'lr': 0.0011804110736936403, 'weight_decay': 0.0005144397874195108, 'dropout': 0.6865643694139653, 'patience': 100, 'lr_reduce_freq': 110, 'spt_alg': 'kruskal', 'spt_attr': 'edge_degree', 'manifold': 'PoincareBall', 'num_layers': 3, 'num_adj': 6, 'add_rate': 0.4970876241358475, 'tem': 1.9780355625469817, 'consis_rate': 1.6144946402901392, 'use_att': 0}
mean: 0.8049
[0.803 0.798 0.784 0.797 0.821 0.799 0.82  0.802 0.804 0.821]
cur_param: {'lr': 0.00312156627731383, 'weight_decay': 0.0018532453624407609, 'dropout': 0.7695469047515687, 'patience': 100, 'lr_reduce_freq': 130, 'spt_alg': 'kruskal', 'spt_attr': 'edge_degree', 'manifold': 'PoincareBall', 'num_layers': 3, 'num_adj': 8, 'add_rate': 0.3991713775313048, 'tem': 1.783792100988132, 'consis_rate': 1.6803499422558277, 'use_att': 1}
mean: 0.8119999999999999
[0.818 0.808 0.822 0.815 0.809 0.81  0.805 0.807 0.808 0.818]
cur_param: {'lr': 0.0012830130469952392, 'weight_decay': 0.0006715963903194444, 'dropout': 0.7956546589136466, 'patience': 100, 'lr_reduce_freq': 130, 'spt_alg': 'kruskal', 'spt_attr': 'edge_degree', 'manifold': 'PoincareBall', 'num_layers': 3, 'num_adj': 8, 'add_rate': 0.565925838889864, 'tem': 1.7260608427724087, 'consis_rate': 1.4157988337314116, 'use_att': 1}
mean: 0.8179000000000001
[0.823 0.823 0.821 0.804 0.817 0.814 0.82  0.833 0.824 0.8  ]
cur_param: {'lr': 0.0014239987879409272, 'weight_decay': 0.0007348073210762062, 'dropout': 0.7145339412342642, 'patience': 100, 'lr_reduce_freq': 130, 'spt_alg': 'kruskal', 'spt_attr': 'edge_degree', 'manifold': 'PoincareBall', 'num_layers': 3, 'num_adj': 8, 'add_rate': 0.4509917378654599, 'tem': 1.7165184320364033, 'consis_rate': 1.3683885841868553, 'use_att': 1}
mean: 0.8147
[0.813 0.807 0.82  0.826 0.816 0.819 0.82  0.799 0.812 0.815]
cur_param: {'lr': 0.001391666307093202, 'weight_decay': 0.0007140115757330874, 'dropout': 0.7132115113815115, 'patience': 100, 'lr_reduce_freq': 150, 'spt_alg': 'kruskal', 'spt_attr': 'edge_degree', 'manifold': 'PoincareBall', 'num_layers': 3, 'num_adj': 8, 'add_rate': 0.4562370352319146, 'tem': 1.7267624082034678, 'consis_rate': 1.375521540233402, 'use_att': 1}
mean: 0.8176
[0.811 0.817 0.818 0.832 0.816 0.824 0.828 0.797 0.825 0.808]
cur_param: {'lr': 0.001706264316777631, 'weight_decay': 0.0007454967185226777, 'dropout': 0.806637936441413, 'patience': 100, 'lr_reduce_freq': 150, 'spt_alg': 'kruskal', 'spt_attr': 'edge_degree', 'manifold': 'PoincareBall', 'num_layers': 3, 'num_adj': 8, 'add_rate': 0.451323065757716, 'tem': 1.7082008897729126, 'consis_rate': 1.37211632577039, 'use_att': 1}
mean: 0.8186
[0.817 0.817 0.828 0.814 0.823 0.813 0.813 0.831 0.822 0.808]
cur_param: {'lr': 0.0016933359888737728, 'weight_decay': 0.0006914931266477695, 'dropout': 0.804785246347421, 'patience': 100, 'lr_reduce_freq': 150, 'spt_alg': 'kruskal', 'spt_attr': 'edge_degree', 'manifold': 'PoincareBall', 'num_layers': 3, 'num_adj': 8, 'add_rate': 0.4520566072274188, 'tem': 1.6444611815718824, 'consis_rate': 1.3453781369229667, 'use_att': 1}
mean: 0.8183
[0.822 0.816 0.821 0.835 0.803 0.812 0.812 0.823 0.818 0.821]
cur_param: {'lr': 0.0017109755907234701, 'weight_decay': 0.000672250795219083, 'dropout': 0.8079017327948128, 'patience': 100, 'lr_reduce_freq': 150, 'spt_alg': 'kruskal', 'spt_attr': 'edge_degree', 'manifold': 'PoincareBall', 'num_layers': 3, 'num_adj': 8, 'add_rate': 0.6387664500298785, 'tem': 1.6385946645277958, 'consis_rate': 1.3927676626662286, 'use_att': 1}
mean: 0.8200999999999998
[0.814 0.818 0.824 0.825 0.822 0.815 0.811 0.837 0.821 0.814]
cur_param: {'lr': 0.0011562132340546428, 'weight_decay': 0.0006602220484411743, 'dropout': 0.9341905553536204, 'patience': 100, 'lr_reduce_freq': 150, 'spt_alg': 'kruskal', 'spt_attr': 'edge_degree', 'manifold': 'PoincareBall', 'num_layers': 3, 'num_adj': 8, 'add_rate': 0.6475972912240648, 'tem': 1.616195439872799, 'consis_rate': 1.266138230092508, 'use_att': 1}
mean: 0.25210000000000005
[0.13  0.413 0.319 0.242 0.257 0.324 0.116 0.383 0.234 0.103]
cur_param: {'lr': 0.0017151975614578994, 'weight_decay': 0.0005006947040554228, 'dropout': 0.803246555848817, 'patience': 100, 'lr_reduce_freq': 150, 'spt_alg': 'kruskal', 'spt_attr': 'edge_degree', 'manifold': 'PoincareBall', 'num_layers': 3, 'num_adj': 8, 'add_rate': 0.509815015565922, 'tem': 1.6396169114864994, 'consis_rate': 1.3908359715320633, 'use_att': 1}
mean: 0.8159000000000001
[0.803 0.822 0.806 0.839 0.823 0.808 0.814 0.832 0.817 0.795]
cur_param: {'lr': 0.0014189423933901738, 'weight_decay': 0.0006909984305124808, 'dropout': 0.884278072447294, 'patience': 100, 'lr_reduce_freq': 150, 'spt_alg': 'kruskal', 'spt_attr': 'edge_degree', 'manifold': 'PoincareBall', 'num_layers': 4, 'num_adj': 8, 'add_rate': 0.5522304880134563, 'tem': 1.5602444802376523, 'consis_rate': 1.3106843441949338, 'use_att': 1}
mean: 0.1359
[0.137 0.141 0.141 0.216 0.141 0.091 0.091 0.147 0.163 0.091]
cur_param: {'lr': 0.0017799165799297892, 'weight_decay': 0.000986475854216286, 'dropout': 0.789106429239953, 'patience': 100, 'lr_reduce_freq': 150, 'spt_alg': 'prim', 'spt_attr': 'edge_degree', 'manifold': 'PoincareBall', 'num_layers': 3, 'num_adj': 8, 'add_rate': 0.6059731538612713, 'tem': 1.6872142817785636, 'consis_rate': 1.483979325833426, 'use_att': 1}
mean: 0.8192999999999999
[0.822 0.817 0.816 0.831 0.805 0.831 0.812 0.827 0.82  0.812]
cur_param: {'lr': 0.001712712396169526, 'weight_decay': 0.0009723182407685756, 'dropout': 0.8002784591102567, 'patience': 100, 'lr_reduce_freq': 150, 'spt_alg': 'prim', 'spt_attr': 'edge_degree', 'manifold': 'PoincareBall', 'num_layers': 3, 'num_adj': 8, 'add_rate': 0.6346257900507459, 'tem': 1.6894631710056607, 'consis_rate': 1.4614227284237475, 'use_att': 1}
mean: 0.8195
[0.819 0.817 0.822 0.818 0.822 0.825 0.813 0.829 0.828 0.802]
cur_param: {'lr': 0.001722483260938788, 'weight_decay': 0.0009983670746523386, 'dropout': 0.7904420230770904, 'patience': 100, 'lr_reduce_freq': 150, 'spt_alg': 'prim', 'spt_attr': 'edge_degree', 'manifold': 'PoincareBall', 'num_layers': 3, 'num_adj': 8, 'add_rate': 0.6547773395650016, 'tem': 1.574532123594747, 'consis_rate': 1.451649981024465, 'use_att': 1}
mean: 0.8180999999999999
[0.823 0.815 0.824 0.804 0.82  0.822 0.82  0.821 0.82  0.812]
cur_param: {'lr': 0.0017441045389735906, 'weight_decay': 0.000915523485456127, 'dropout': 0.8106532129680869, 'patience': 100, 'lr_reduce_freq': 150, 'spt_alg': 'prim', 'spt_attr': 'edge_degree', 'manifold': 'PoincareBall', 'num_layers': 3, 'num_adj': 8, 'add_rate': 0.6567116418779705, 'tem': 1.5716401774361624, 'consis_rate': 1.4639704761619274, 'use_att': 1}
mean: 0.8170999999999999
[0.825 0.823 0.831 0.813 0.814 0.817 0.799 0.824 0.826 0.799]
cur_param: {'lr': 0.0023502022636234096, 'weight_decay': 0.001005672246012917, 'dropout': 0.8413662496036186, 'patience': 100, 'lr_reduce_freq': 150, 'spt_alg': 'prim', 'spt_attr': 'edge_degree', 'manifold': 'PoincareBall', 'num_layers': 3, 'num_adj': 8, 'add_rate': 0.7818735939043222, 'tem': 1.6899488239819205, 'consis_rate': 1.4087113017326178, 'use_att': 1}[32m[I 2022-06-23 16:45:58,845][0m Trial 94 finished with value: 0.817 and parameters: {'lr': 0.0023502022636234096, 'weight_decay': 0.001005672246012917, 'dropout': 0.8413662496036186, 'patience': 100, 'lr_reduce_freq': 150, 'spt_alg': 'prim', 'spt_attr': 'edge_degree', 'manifold': 'PoincareBall', 'num_layers': 3, 'num_adj': 8, 'add_rate': 0.7818735939043222, 'tem': 1.6899488239819205, 'consis_rate': 1.4087113017326178, 'use_att': 1}. Best is trial 86 with value: 0.8200999999999998.[0m
[32m[I 2022-06-23 17:33:02,140][0m Trial 95 finished with value: 0.8179000000000001 and parameters: {'lr': 0.0020326865760899693, 'weight_decay': 0.0007229949484014536, 'dropout': 0.7796240829307297, 'patience': 100, 'lr_reduce_freq': 150, 'spt_alg': 'prim', 'spt_attr': 'edge_degree', 'manifold': 'PoincareBall', 'num_layers': 3, 'num_adj': 8, 'add_rate': 0.6292900910015675, 'tem': 0.7845693724021111, 'consis_rate': 1.3123468148833708, 'use_att': 1}. Best is trial 86 with value: 0.8200999999999998.[0m
[32m[I 2022-06-23 18:27:25,692][0m Trial 96 finished with value: 0.8177 and parameters: {'lr': 0.0015419777962037925, 'weight_decay': 0.00104352113505196, 'dropout': 0.7796742053944948, 'patience': 100, 'lr_reduce_freq': 150, 'spt_alg': 'prim', 'spt_attr': 'edge_degree', 'manifold': 'PoincareBall', 'num_layers': 3, 'num_adj': 8, 'add_rate': 0.6089254807217704, 'tem': 0.73308203691218, 'consis_rate': 1.2633451828599558, 'use_att': 1}. Best is trial 86 with value: 0.8200999999999998.[0m
[32m[I 2022-06-23 18:43:55,841][0m Trial 97 finished with value: 0.7625 and parameters: {'lr': 0.002056145577851684, 'weight_decay': 0.0008169480603224024, 'dropout': 0.9057953314756885, 'patience': 100, 'lr_reduce_freq': 150, 'spt_alg': 'prim', 'spt_attr': 'edge_degree', 'manifold': 'PoincareBall', 'num_layers': 3, 'num_adj': 8, 'add_rate': 0.6761234175244463, 'tem': 0.8038104370879575, 'consis_rate': 1.4700169401815926, 'use_att': 0}. Best is trial 86 with value: 0.8200999999999998.[0m
[32m[I 2022-06-23 20:29:39,648][0m Trial 98 finished with value: 0.8052999999999999 and parameters: {'lr': 0.0010099850066076692, 'weight_decay': 0.0005811348882396787, 'dropout': 0.8649738046747554, 'patience': 100, 'lr_reduce_freq': 150, 'spt_alg': 'prim', 'spt_attr': 'edge_degree', 'manifold': 'PoincareBall', 'num_layers': 3, 'num_adj': 8, 'add_rate': 0.7103199722943421, 'tem': 0.24942799023635953, 'consis_rate': 1.328289010501065, 'use_att': 1}. Best is trial 86 with value: 0.8200999999999998.[0m
[32m[I 2022-06-23 21:26:47,412][0m Trial 99 finished with value: 0.8105999999999998 and parameters: {'lr': 0.0017469545689308328, 'weight_decay': 0.0016139351487391821, 'dropout': 0.8210721820768466, 'patience': 100, 'lr_reduce_freq': 150, 'spt_alg': 'prim', 'spt_attr': 'edge_degree', 'manifold': 'PoincareBall', 'num_layers': 3, 'num_adj': 8, 'add_rate': 0.5859433634561303, 'tem': 0.43175860485816153, 'consis_rate': 1.2741432911220159, 'use_att': 1}. Best is trial 86 with value: 0.8200999999999998.[0m
[32m[I 2022-06-23 22:17:20,844][0m Trial 100 finished with value: 0.8158999999999998 and parameters: {'lr': 0.002253015539447775, 'weight_decay': 0.0009763702337831693, 'dropout': 0.7883096219968413, 'patience': 100, 'lr_reduce_freq': 150, 'spt_alg': 'prim', 'spt_attr': 'edge_degree', 'manifold': 'PoincareBall', 'num_layers': 3, 'num_adj': 8, 'add_rate': 0.7362468184625998, 'tem': 0.9598872919150687, 'consis_rate': 1.1947302611131922, 'use_att': 1}. Best is trial 86 with value: 0.8200999999999998.[0m
[32m[I 2022-06-23 23:09:40,636][0m Trial 101 finished with value: 0.8163 and parameters: {'lr': 0.0015880420934713594, 'weight_decay': 0.0010602760082904033, 'dropout': 0.7674683535302972, 'patience': 100, 'lr_reduce_freq': 150, 'spt_alg': 'prim', 'spt_attr': 'edge_degree', 'manifold': 'PoincareBall', 'num_layers': 3, 'num_adj': 8, 'add_rate': 0.6190474547476174, 'tem': 0.6358754947752738, 'consis_rate': 1.4264156743164431, 'use_att': 1}. Best is trial 86 with value: 0.8200999999999998.[0m
[32m[I 2022-06-23 23:58:19,086][0m Trial 102 finished with value: 0.8167 and parameters: {'lr': 0.001883673464408911, 'weight_decay': 0.0007636510715899277, 'dropout': 0.79065343886002, 'patience': 100, 'lr_reduce_freq': 150, 'spt_alg': 'prim', 'spt_attr': 'edge_degree', 'manifold': 'PoincareBall', 'num_layers': 3, 'num_adj': 8, 'add_rate': 0.6246040760523262, 'tem': 0.7413619567529166, 'consis_rate': 1.4931028501738102, 'use_att': 1}. Best is trial 86 with value: 0.8200999999999998.[0m
[32m[I 2022-06-24 00:47:33,662][0m Trial 103 finished with value: 0.8146999999999999 and parameters: {'lr': 0.0014874288878260037, 'weight_decay': 0.0006353968116722603, 'dropout': 0.7420687361656159, 'patience': 100, 'lr_reduce_freq': 150, 'spt_alg': 'prim', 'spt_attr': 'edge_degree', 'manifold': 'PoincareBall', 'num_layers': 3, 'num_adj': 8, 'add_rate': 0.6058578275563451, 'tem': 0.8610812027335608, 'consis_rate': 1.5905116472529863, 'use_att': 1}. Best is trial 86 with value: 0.8200999999999998.[0m
[32m[I 2022-06-24 01:44:09,490][0m Trial 104 finished with value: 0.8120999999999998 and parameters: {'lr': 0.0019654887659224735, 'weight_decay': 0.001104872186076715, 'dropout': 0.8483547342866548, 'patience': 100, 'lr_reduce_freq': 150, 'spt_alg': 'prim', 'spt_attr': 'edge_degree', 'manifold': 'PoincareBall', 'num_layers': 3, 'num_adj': 8, 'add_rate': 0.6371021467120491, 'tem': 0.6731273159916428, 'consis_rate': 1.2350658900080211, 'use_att': 1}. Best is trial 86 with value: 0.8200999999999998.[0m
[32m[I 2022-06-24 03:33:37,704][0m Trial 105 finished with value: 0.7835000000000001 and parameters: {'lr': 0.001128002877374028, 'weight_decay': 0.0014368998616504838, 'dropout': 0.8808097415734832, 'patience': 100, 'lr_reduce_freq': 150, 'spt_alg': 'prim', 'spt_attr': 'edge_degree', 'manifold': 'PoincareBall', 'num_layers': 3, 'num_adj': 8, 'add_rate': 0.6696759210850931, 'tem': 1.4471199772508405, 'consis_rate': 1.305507310055627, 'use_att': 1}. Best is trial 86 with value: 0.8200999999999998.[0m
[32m[I 2022-06-24 04:32:29,288][0m Trial 106 finished with value: 0.8183 and parameters: {'lr': 0.0015300996893282102, 'weight_decay': 0.0009422740855125996, 'dropout': 0.826256288121176, 'patience': 100, 'lr_reduce_freq': 150, 'spt_alg': 'prim', 'spt_attr': 'edge_degree', 'manifold': 'PoincareBall', 'num_layers': 3, 'num_adj': 8, 'add_rate': 0.5956265256110396, 'tem': 0.5616126564983828, 'consis_rate': 1.3989260404478616, 'use_att': 1}. Best is trial 86 with value: 0.8200999999999998.[0m
[32m[I 2022-06-24 05:27:48,516][0m Trial 107 finished with value: 0.818 and parameters: {'lr': 0.0016845165710882375, 'weight_decay': 0.0008877671275458575, 'dropout': 0.8325824841986804, 'patience': 100, 'lr_reduce_freq': 150, 'spt_alg': 'prim', 'spt_attr': 'edge_degree', 'manifold': 'PoincareBall', 'num_layers': 3, 'num_adj': 8, 'add_rate': 0.5408858101785959, 'tem': 0.4113645304250028, 'consis_rate': 1.4562137891689348, 'use_att': 1}. Best is trial 86 with value: 0.8200999999999998.[0m
[32m[I 2022-06-24 07:41:04,205][0m Trial 108 finished with value: 0.5918 and parameters: {'lr': 0.0025633751135129873, 'weight_decay': 0.0008882234889584907, 'dropout': 0.8293629225000048, 'patience': 100, 'lr_reduce_freq': 150, 'spt_alg': 'prim', 'spt_attr': 'edge_degree', 'manifold': 'PoincareBall', 'num_layers': 4, 'num_adj': 8, 'add_rate': 0.5699688664408961, 'tem': 0.4837928941578972, 'consis_rate': 1.4690465946017184, 'use_att': 1}. Best is trial 86 with value: 0.8200999999999998.[0m
[32m[I 2022-06-24 08:27:31,230][0m Trial 109 finished with value: 0.8160999999999999 and parameters: {'lr': 0.001717820361031554, 'weight_decay': 0.000562887207692253, 'dropout': 0.7549437751209965, 'patience': 100, 'lr_reduce_freq': 150, 'spt_alg': 'prim', 'spt_attr': 'edge_degree', 'manifold': 'PoincareBall', 'num_layers': 3, 'num_adj': 8, 'add_rate': 0.5448091010613378, 'tem': 0.4356806187690802, 'consis_rate': 1.5738174091079318, 'use_att': 1}. Best is trial 86 with value: 0.8200999999999998.[0m
[32m[I 2022-06-24 09:57:27,274][0m Trial 110 finished with value: 0.7788 and parameters: {'lr': 0.0011794378989389285, 'weight_decay': 0.0014830317920432128, 'dropout': 0.8710500147035427, 'patience': 100, 'lr_reduce_freq': 130, 'spt_alg': 'prim', 'spt_attr': 'edge_degree', 'manifold': 'PoincareBall', 'num_layers': 3, 'num_adj': 8, 'add_rate': 0.5283730424665923, 'tem': 0.34055874750048754, 'consis_rate': 1.5173215193211125, 'use_att': 1}. Best is trial 86 with value: 0.8200999999999998.[0m
[32m[I 2022-06-24 10:47:22,351][0m Trial 111 finished with value: 0.8206 and parameters: {'lr': 0.002070565160110371, 'weight_decay': 0.0007618667680623256, 'dropout': 0.8132781953176633, 'patience': 100, 'lr_reduce_freq': 150, 'spt_alg': 'prim', 'spt_attr': 'edge_degree', 'manifold': 'PoincareBall', 'num_layers': 3, 'num_adj': 8, 'add_rate': 0.5796133274058297, 'tem': 0.5945084882337229, 'consis_rate': 1.3950031841192303, 'use_att': 1}. Best is trial 111 with value: 0.8206.[0m
