[32m[I 2022-06-29 18:57:58,036][0m Trial 72 finished with value: 0.8134 and parameters: {'lr': 0.0034228083820304765, 'weight_decay': 0.0005038525778562501, 'dropout': 0.5056461664176852, 'patience': 80, 'lr_reduce_freq': 130, 'spt_alg': 'prim', 'spt_attr': 'similarity', 'manifold': 'PoincareBall', 'num_layers': 3, 'dim': 496, 'num_adj': 2, 'add_rate': 0.8737035849997308, 'tem': 1.2699230112158735, 'consis_rate': 1.6548234049978294, 'use_att': 1}. Best is trial 61 with value: 0.818.[0m

cur_param: {'lr': 0.01853758647635587, 'weight_decay': 0.0013844089600620535, 'dropout': 0.37770654648931157, 'patience': 90, 'lr_reduce_freq': 100, 'spt_alg': 'prim', 'spt_attr': 'edge_degree', 'manifold': 'Hyperboloid', 'num_layers': 3, 'dim': 432, 'num_adj': 6, 'add_rate': 0.4740305408365702, 'tem': 1.0599117967840255, 'consis_rate': 1.105705611847137, 'use_att': 0}
mean: 0.7967000000000001
[0.792 0.8   0.792 0.807 0.811 0.799 0.813 0.77  0.8   0.783]
cur_param: {'lr': 0.024097010488998757, 'weight_decay': 0.0007160714485577922, 'dropout': 0.4379570396921523, 'patience': 70, 'lr_reduce_freq': 80, 'spt_alg': 'kruskal', 'spt_attr': 'edge_degree', 'manifold': 'Hyperboloid', 'num_layers': 3, 'dim': 496, 'num_adj': 6, 'add_rate': 0.7782585903066732, 'tem': 0.9865773926116411, 'consis_rate': 1.4905196850380684, 'use_att': 0}
mean: 0.8093999999999999
[0.814 0.801 0.826 0.808 0.811 0.811 0.789 0.799 0.822 0.813]
cur_param: {'lr': 0.012321795481524726, 'weight_decay': 0.04101944224943919, 'dropout': 0.4248050260721782, 'patience': 70, 'lr_reduce_freq': 140, 'spt_alg': 'prim', 'spt_attr': 'edge_degree', 'manifold': 'PoincareBall', 'num_layers': 5, 'dim': 496, 'num_adj': 6, 'add_rate': 0.8926997419924879, 'tem': 0.8581702931019234, 'consis_rate': 1.4985261796542981, 'use_att': 0}
mean: 0.3186
[0.319 0.319 0.319 0.319 0.317 0.319 0.319 0.319 0.319 0.317]
cur_param: {'lr': 0.007312752133939045, 'weight_decay': 0.0007253311239133243, 'dropout': 0.4547269030345795, 'patience': 80, 'lr_reduce_freq': 110, 'spt_alg': 'prim', 'spt_attr': 'edge_degree', 'manifold': 'PoincareBall', 'num_layers': 3, 'dim': 512, 'num_adj': 6, 'add_rate': 0.8294750660851804, 'tem': 1.1009845164552878, 'consis_rate': 1.3574495853852098, 'use_att': 0}
mean: 0.8044
[0.794 0.806 0.827 0.811 0.79  0.809 0.818 0.805 0.777 0.807]
cur_param: {'lr': 0.005139706158830381, 'weight_decay': 0.000683274610044689, 'dropout': 0.5364664310641712, 'patience': 80, 'lr_reduce_freq': 110, 'spt_alg': 'kruskal', 'spt_attr': 'edge_degree', 'manifold': 'Hyperboloid', 'num_layers': 3, 'dim': 512, 'num_adj': 2, 'add_rate': 0.8294003725062393, 'tem': 1.184276953959794, 'consis_rate': 1.370468875320379, 'use_att': 1}
mean: 0.8132999999999999
[0.806 0.821 0.799 0.818 0.824 0.817 0.817 0.811 0.813 0.807]
cur_param: {'lr': 0.004538489412366636, 'weight_decay': 0.0006857940352862421, 'dropout': 0.454238798069559, 'patience': 80, 'lr_reduce_freq': 110, 'spt_alg': 'prim', 'spt_attr': 'edge_degree', 'manifold': 'PoincareBall', 'num_layers': 3, 'dim': 512, 'num_adj': 2, 'add_rate': 0.7672167075967056, 'tem': 1.1833517668265454, 'consis_rate': 1.565115879446728, 'use_att': 1}
mean: 0.8153
[0.809 0.818 0.819 0.81  0.818 0.831 0.83  0.816 0.814 0.788]
cur_param: {'lr': 0.00460814347874921, 'weight_decay': 0.0006690318142620254, 'dropout': 0.4580628479665416, 'patience': 80, 'lr_reduce_freq': 110, 'spt_alg': 'prim', 'spt_attr': 'edge_degree', 'manifold': 'PoincareBall', 'num_layers': 3, 'dim': 512, 'num_adj': 2, 'add_rate': 0.7776936130532195, 'tem': 1.1970590861812211, 'consis_rate': 1.6653204802868062, 'use_att': 1}
mean: 0.818
[0.811 0.828 0.815 0.804 0.818 0.832 0.827 0.819 0.819 0.807]
cur_param: {'lr': 0.0038611164262987076, 'weight_decay': 0.0005790517711389827, 'dropout': 0.4991631426147166, 'patience': 80, 'lr_reduce_freq': 100, 'spt_alg': 'prim', 'spt_attr': 'edge_degree', 'manifold': 'PoincareBall', 'num_layers': 3, 'dim': 496, 'num_adj': 2, 'add_rate': 0.761258740223476, 'tem': 1.2125116873142443, 'consis_rate': 1.7786501070465328, 'use_att': 1}
mean: 0.8148
[0.795 0.821 0.827 0.816 0.825 0.8   0.809 0.823 0.828 0.804]
cur_param: {'lr': 0.004770352262551984, 'weight_decay': 0.0006181167264897018, 'dropout': 0.5475151421424957, 'patience': 80, 'lr_reduce_freq': 120, 'spt_alg': 'prim', 'spt_attr': 'edge_degree', 'manifold': 'PoincareBall', 'num_layers': 3, 'dim': 512, 'num_adj': 2, 'add_rate': 0.7773352810115843, 'tem': 1.2345441977514966, 'consis_rate': 1.7924139477330945, 'use_att': 1}
mean: 0.8129
[0.821 0.812 0.796 0.807 0.833 0.843 0.783 0.825 0.799 0.81 ]
cur_param: {'lr': 0.003970680536490044, 'weight_decay': 0.000601523157531908, 'dropout': 0.5027748660605699, 'patience': 80, 'lr_reduce_freq': 110, 'spt_alg': 'prim', 'spt_attr': 'edge_degree', 'manifold': 'PoincareBall', 'num_layers': 3, 'dim': 512, 'num_adj': 2, 'add_rate': 0.7804221506455163, 'tem': 1.2312241779044168, 'consis_rate': 1.8418974420883463, 'use_att': 1}
mean: 0.8178999999999998
[0.796 0.814 0.814 0.823 0.834 0.84  0.802 0.81  0.826 0.82 ]
cur_param: {'lr': 0.004158305649052252, 'weight_decay': 0.000578392575833282, 'dropout': 0.5377967931789174, 'patience': 80, 'lr_reduce_freq': 110, 'spt_alg': 'prim', 'spt_attr': 'edge_degree', 'manifold': 'PoincareBall', 'num_layers': 3, 'dim': 512, 'num_adj': 2, 'add_rate': 0.7792940522290129, 'tem': 1.2158421216459656, 'consis_rate': 1.8440947261956049, 'use_att': 1}
mean: 0.8114999999999999
[0.796 0.812 0.795 0.799 0.829 0.834 0.79  0.811 0.821 0.828]
cur_param: {'lr': 0.004615160694389405, 'weight_decay': 0.0005728963652216811, 'dropout': 0.5406011798125785, 'patience': 80, 'lr_reduce_freq': 120, 'spt_alg': 'prim', 'spt_attr': 'edge_degree', 'manifold': 'PoincareBall', 'num_layers': 3, 'dim': 512, 'num_adj': 2, 'add_rate': 0.7770281433847647, 'tem': 1.2095225652496693, 'consis_rate': 1.8181883247752433, 'use_att': 1}
mean: 0.8135
[0.825 0.811 0.81  0.797 0.833 0.837 0.795 0.815 0.806 0.806]
cur_param: {'lr': 0.003271818389107674, 'weight_decay': 0.0005011650896155942, 'dropout': 0.5046854450019476, 'patience': 80, 'lr_reduce_freq': 130, 'spt_alg': 'prim', 'spt_attr': 'edge_degree', 'manifold': 'PoincareBall', 'num_layers': 3, 'dim': 512, 'num_adj': 2, 'add_rate': 0.7314023840811646, 'tem': 1.278701568903493, 'consis_rate': 1.7793115370203982, 'use_att': 1}
mean: 0.8143
[0.809 0.805 0.808 0.797 0.833 0.818 0.823 0.816 0.822 0.812]
cur_param: {'lr': 0.0032093728789476515, 'weight_decay': 0.0005099944875174439, 'dropout': 0.5017818508706239, 'patience': 80, 'lr_reduce_freq': 130, 'spt_alg': 'prim', 'spt_attr': 'similarity', 'manifold': 'PoincareBall', 'num_layers': 3, 'dim': 496, 'num_adj': 2, 'add_rate': 0.7328480156835294, 'tem': 1.2851578110994548, 'consis_rate': 1.6594786439121194, 'use_att': 1}
mean: 0.8175000000000001
[0.812 0.822 0.811 0.828 0.826 0.817 0.808 0.82  0.82  0.811]
cur_param: {'lr': 0.0031705567759298054, 'weight_decay': 0.0005115516116083928, 'dropout': 0.49560267627868543, 'patience': 80, 'lr_reduce_freq': 140, 'spt_alg': 'prim', 'spt_attr': 'similarity', 'manifold': 'PoincareBall', 'num_layers': 5, 'dim': 496, 'num_adj': 2, 'add_rate': 0.7280877298571228, 'tem': 1.3227521249513468, 'consis_rate': 1.897858318401685, 'use_att': 1}
mean: 0.7834000000000001
[0.798 0.773 0.787 0.778 0.796 0.787 0.778 0.777 0.769 0.791]
cur_param: {'lr': 0.003284702434307698, 'weight_decay': 0.0005069131191308934, 'dropout': 0.5703311156140293, 'patience': 80, 'lr_reduce_freq': 130, 'spt_alg': 'prim', 'spt_attr': 'similarity', 'manifold': 'PoincareBall', 'num_layers': 3, 'dim': 496, 'num_adj': 2, 'add_rate': 0.8602916379152153, 'tem': 1.2789519142197645, 'consis_rate': 1.6594901024722681, 'use_att': 1}
mean: 0.8164999999999999
[0.816 0.819 0.816 0.806 0.827 0.825 0.834 0.806 0.822 0.794]
cur_param: {'lr': 0.0032370377853273937, 'weight_decay': 0.0005021164727153759, 'dropout': 0.4982156775631349, 'patience': 80, 'lr_reduce_freq': 130, 'spt_alg': 'prim', 'spt_attr': 'similarity', 'manifold': 'PoincareBall', 'num_layers': 3, 'dim': 496, 'num_adj': 2, 'add_rate': 0.8009826369308428, 'tem': 1.2796451403176885, 'consis_rate': 1.6826919153189515, 'use_att': 1}
mean: 0.8135999999999999
[0.794 0.814 0.81  0.838 0.826 0.812 0.802 0.815 0.819 0.806]
cur_param: {'lr': 0.0034228083820304765, 'weight_decay': 0.0005038525778562501, 'dropout': 0.5056461664176852, 'patience': 80, 'lr_reduce_freq': 130, 'spt_alg': 'prim', 'spt_attr': 'similarity', 'manifold': 'PoincareBall', 'num_layers': 3, 'dim': 496, 'num_adj': 2, 'add_rate': 0.8737035849997308, 'tem': 1.2699230112158735, 'consis_rate': 1.6548234049978294, 'use_att': 1}
mean: 0.8134
[0.805 0.821 0.812 0.788 0.827 0.816 0.815 0.821 0.81  0.819]
cur_param: {'lr': 0.002314236311649949, 'weight_decay': 0.0005991280034822475, 'dropout': 0.46465167021796555, 'patience': 80, 'lr_reduce_freq': 150, 'spt_alg': 'prim', 'spt_attr': 'similarity', 'manifold': 'PoincareBall', 'num_layers': 3, 'dim': 464, 'num_adj': 2, 'add_rate': 0.7492473822321012, 'tem': 1.4195468497202657, 'consis_rate': 1.7569424163776723, 'use_att': 1}[32m[I 2022-06-29 19:11:20,080][0m Trial 73 finished with value: 0.8150000000000001 and parameters: {'lr': 0.002314236311649949, 'weight_decay': 0.0005991280034822475, 'dropout': 0.46465167021796555, 'patience': 80, 'lr_reduce_freq': 150, 'spt_alg': 'prim', 'spt_attr': 'similarity', 'manifold': 'PoincareBall', 'num_layers': 3, 'dim': 464, 'num_adj': 2, 'add_rate': 0.7492473822321012, 'tem': 1.4195468497202657, 'consis_rate': 1.7569424163776723, 'use_att': 1}. Best is trial 61 with value: 0.818.[0m
[32m[I 2022-06-29 19:25:45,391][0m Trial 74 finished with value: 0.8126 and parameters: {'lr': 0.0020105254005272372, 'weight_decay': 0.0008566740537123456, 'dropout': 0.4627825677454457, 'patience': 80, 'lr_reduce_freq': 150, 'spt_alg': 'prim', 'spt_attr': 'similarity', 'manifold': 'PoincareBall', 'num_layers': 3, 'dim': 464, 'num_adj': 2, 'add_rate': 0.7482642094992604, 'tem': 1.4590285123122904, 'consis_rate': 1.7633185830679345, 'use_att': 1}. Best is trial 61 with value: 0.818.[0m
[32m[I 2022-06-29 19:41:02,981][0m Trial 75 finished with value: 0.8183999999999999 and parameters: {'lr': 0.0026065173148869408, 'weight_decay': 0.0006069800907016277, 'dropout': 0.5726151998446841, 'patience': 80, 'lr_reduce_freq': 140, 'spt_alg': 'prim', 'spt_attr': 'similarity', 'manifold': 'PoincareBall', 'num_layers': 3, 'dim': 464, 'num_adj': 2, 'add_rate': 0.7068265206179959, 'tem': 1.433296118369189, 'consis_rate': 1.8840192335056032, 'use_att': 1}. Best is trial 75 with value: 0.8183999999999999.[0m
[32m[I 2022-06-29 19:56:16,401][0m Trial 76 finished with value: 0.8151999999999999 and parameters: {'lr': 0.0025178424967946043, 'weight_decay': 0.0006074528791378818, 'dropout': 0.5751313809629315, 'patience': 80, 'lr_reduce_freq': 150, 'spt_alg': 'prim', 'spt_attr': 'similarity', 'manifold': 'PoincareBall', 'num_layers': 3, 'dim': 256, 'num_adj': 2, 'add_rate': 0.6829074842759448, 'tem': 1.3944796211071646, 'consis_rate': 1.9111876170673647, 'use_att': 1}. Best is trial 75 with value: 0.8183999999999999.[0m
[32m[I 2022-06-29 20:15:00,306][0m Trial 77 finished with value: 0.8123999999999999 and parameters: {'lr': 0.0013251694331942781, 'weight_decay': 0.0007346476664143707, 'dropout': 0.5712905359538701, 'patience': 80, 'lr_reduce_freq': 150, 'spt_alg': 'prim', 'spt_attr': 'similarity', 'manifold': 'PoincareBall', 'num_layers': 3, 'dim': 240, 'num_adj': 2, 'add_rate': 0.6854310038882083, 'tem': 1.411217627155559, 'consis_rate': 1.8968830804383554, 'use_att': 1}. Best is trial 75 with value: 0.8183999999999999.[0m
[32m[I 2022-06-29 20:31:01,054][0m Trial 78 finished with value: 0.8181999999999998 and parameters: {'lr': 0.002598774664403595, 'weight_decay': 0.0006553887151330283, 'dropout': 0.6013006535831837, 'patience': 80, 'lr_reduce_freq': 140, 'spt_alg': 'prim', 'spt_attr': 'similarity', 'manifold': 'PoincareBall', 'num_layers': 3, 'dim': 208, 'num_adj': 2, 'add_rate': 0.8539885127329154, 'tem': 1.3896516851600729, 'consis_rate': 1.9952232355678727, 'use_att': 1}. Best is trial 75 with value: 0.8183999999999999.[0m
[32m[I 2022-06-29 20:48:30,217][0m Trial 79 finished with value: 0.8134 and parameters: {'lr': 0.0026474785084720353, 'weight_decay': 0.000923381761334443, 'dropout': 0.5945852991308729, 'patience': 90, 'lr_reduce_freq': 140, 'spt_alg': 'prim', 'spt_attr': 'similarity', 'manifold': 'PoincareBall', 'num_layers': 3, 'dim': 208, 'num_adj': 2, 'add_rate': 0.8437506567830141, 'tem': 1.3709518459275685, 'consis_rate': 1.996802413990371, 'use_att': 1}. Best is trial 75 with value: 0.8183999999999999.[0m
[32m[I 2022-06-29 21:00:53,542][0m Trial 80 finished with value: 0.8139 and parameters: {'lr': 0.005809980988147605, 'weight_decay': 0.0006620897361306467, 'dropout': 0.575145651456829, 'patience': 80, 'lr_reduce_freq': 140, 'spt_alg': 'prim', 'spt_attr': 'similarity', 'manifold': 'PoincareBall', 'num_layers': 3, 'dim': 240, 'num_adj': 2, 'add_rate': 0.8118878083532945, 'tem': 1.4482776653897824, 'consis_rate': 1.88050196187601, 'use_att': 1}. Best is trial 75 with value: 0.8183999999999999.[0m
[32m[I 2022-06-29 21:17:23,216][0m Trial 81 finished with value: 0.8085000000000001 and parameters: {'lr': 0.0025989637754657837, 'weight_decay': 0.000597001959150635, 'dropout': 0.6000827250357987, 'patience': 80, 'lr_reduce_freq': 150, 'spt_alg': 'prim', 'spt_attr': 'similarity', 'manifold': 'PoincareBall', 'num_layers': 3, 'dim': 160, 'num_adj': 2, 'add_rate': 0.7006688373744366, 'tem': 1.3260204035038992, 'consis_rate': 1.935319332152303, 'use_att': 1}. Best is trial 75 with value: 0.8183999999999999.[0m
[32m[I 2022-06-29 21:30:32,464][0m Trial 82 finished with value: 0.8173 and parameters: {'lr': 0.0017483565492736545, 'weight_decay': 0.0007614023867033226, 'dropout': 0.5587117167825039, 'patience': 80, 'lr_reduce_freq': 150, 'spt_alg': 'prim', 'spt_attr': 'similarity', 'manifold': 'PoincareBall', 'num_layers': 3, 'dim': 272, 'num_adj': 2, 'add_rate': 0.6460690117614035, 'tem': 1.4095387221143065, 'consis_rate': 1.724923425416547, 'use_att': 1}. Best is trial 75 with value: 0.8183999999999999.[0m
[32m[I 2022-06-29 21:44:22,240][0m Trial 83 finished with value: 0.8199 and parameters: {'lr': 0.001533275739418226, 'weight_decay': 0.0008260707822499624, 'dropout': 0.5617600569511542, 'patience': 80, 'lr_reduce_freq': 140, 'spt_alg': 'prim', 'spt_attr': 'similarity', 'manifold': 'PoincareBall', 'num_layers': 3, 'dim': 256, 'num_adj': 2, 'add_rate': 0.8571040905602713, 'tem': 1.3887018621620715, 'consis_rate': 1.6579633246073753, 'use_att': 1}. Best is trial 83 with value: 0.8199.[0m
[32m[I 2022-06-29 21:58:05,373][0m Trial 84 finished with value: 0.8167 and parameters: {'lr': 0.0014676625862330268, 'weight_decay': 0.0008037240874601136, 'dropout': 0.5201787396639989, 'patience': 80, 'lr_reduce_freq': 140, 'spt_alg': 'prim', 'spt_attr': 'similarity', 'manifold': 'PoincareBall', 'num_layers': 3, 'dim': 288, 'num_adj': 2, 'add_rate': 0.8608600250525498, 'tem': 1.3096041279226385, 'consis_rate': 1.56602518381138, 'use_att': 1}. Best is trial 83 with value: 0.8199.[0m
[32m[I 2022-06-29 22:13:12,885][0m Trial 85 finished with value: 0.812 and parameters: {'lr': 0.0012743639826193907, 'weight_decay': 0.0010234442119594269, 'dropout': 0.5580751586877781, 'patience': 90, 'lr_reduce_freq': 140, 'spt_alg': 'prim', 'spt_attr': 'similarity', 'manifold': 'PoincareBall', 'num_layers': 3, 'dim': 272, 'num_adj': 2, 'add_rate': 0.8639994528270705, 'tem': 1.3093574986439047, 'consis_rate': 1.619695520609154, 'use_att': 1}. Best is trial 83 with value: 0.8199.[0m
[32m[I 2022-06-29 22:26:07,330][0m Trial 86 finished with value: 0.8156000000000001 and parameters: {'lr': 0.0018609121821473692, 'weight_decay': 0.000859469271808862, 'dropout': 0.5568104435030146, 'patience': 80, 'lr_reduce_freq': 140, 'spt_alg': 'prim', 'spt_attr': 'similarity', 'manifold': 'PoincareBall', 'num_layers': 3, 'dim': 304, 'num_adj': 2, 'add_rate': 0.8989711284938282, 'tem': 1.3463593096523636, 'consis_rate': 1.715488369262321, 'use_att': 1}. Best is trial 83 with value: 0.8199.[0m
[32m[I 2022-06-29 23:03:32,219][0m Trial 87 finished with value: 0.7612 and parameters: {'lr': 0.0014170769064792282, 'weight_decay': 0.0008282137936666686, 'dropout': 0.5161660110086441, 'patience': 80, 'lr_reduce_freq': 130, 'spt_alg': 'prim', 'spt_attr': 'similarity', 'manifold': 'PoincareBall', 'num_layers': 5, 'dim': 288, 'num_adj': 2, 'add_rate': 0.805045834547998, 'tem': 1.3795094700719772, 'consis_rate': 1.6442391707873574, 'use_att': 1}. Best is trial 83 with value: 0.8199.[0m
[32m[I 2022-06-29 23:17:43,460][0m Trial 88 finished with value: 0.8143 and parameters: {'lr': 0.0010090095961966775, 'weight_decay': 0.0007625986488183152, 'dropout': 0.5251972993374519, 'patience': 80, 'lr_reduce_freq': 130, 'spt_alg': 'prim', 'spt_attr': 'similarity', 'manifold': 'PoincareBall', 'num_layers': 3, 'dim': 224, 'num_adj': 2, 'add_rate': 0.6531133734948253, 'tem': 1.436819928032174, 'consis_rate': 1.8535413555476694, 'use_att': 1}. Best is trial 83 with value: 0.8199.[0m
[32m[I 2022-06-29 23:29:53,182][0m Trial 89 finished with value: 0.30480000000000007 and parameters: {'lr': 0.0017066080666066977, 'weight_decay': 0.010767149358506527, 'dropout': 0.6352981144687356, 'patience': 90, 'lr_reduce_freq': 140, 'spt_alg': 'prim', 'spt_attr': 'similarity', 'manifold': 'PoincareBall', 'num_layers': 3, 'dim': 256, 'num_adj': 2, 'add_rate': 0.8733188793696542, 'tem': 1.496205836146931, 'consis_rate': 1.9591260208184984, 'use_att': 1}. Best is trial 83 with value: 0.8199.[0m
