nohup: ignoring input
[32m[I 2022-06-29 01:32:12,107][0m A new study created in memory with name: no-name-aec005f9-2cfb-44b2-b958-a48dba8ab103[0m
[32m[I 2022-06-29 02:12:28,801][0m Trial 0 finished with value: 0.7389 and parameters: {'lr': 0.0033813753450851066, 'weight_decay': 0.0015608232343617958, 'dropout': 0.7546641608593386, 'patience': 80, 'lr_reduce_freq': 120, 'spt_alg': 'kruskal', 'spt_attr': 'edge_degree', 'manifold': 'Hyperboloid', 'num_layers': 4, 'dim': 432, 'num_adj': 2, 'add_rate': 0.44469190076813037, 'tem': 0.6663592698032833, 'consis_rate': 0.591389409353308, 'use_att': 1}. Best is trial 0 with value: 0.7389.[0m
[32m[I 2022-06-29 02:24:25,704][0m Trial 1 finished with value: 0.2887 and parameters: {'lr': 0.0006053532736830932, 'weight_decay': 0.0023425313830794893, 'dropout': 0.4295966575090837, 'patience': 60, 'lr_reduce_freq': 80, 'spt_alg': 'prim', 'spt_attr': 'edge_degree', 'manifold': 'Hyperboloid', 'num_layers': 4, 'dim': 496, 'num_adj': 4, 'add_rate': 0.16354466058084097, 'tem': 0.5547058978595094, 'consis_rate': 0.509086878981804, 'use_att': 0}. Best is trial 0 with value: 0.7389.[0m
[32m[I 2022-06-29 03:02:44,286][0m Trial 2 finished with value: 0.7513 and parameters: {'lr': 0.002904776462012873, 'weight_decay': 0.004024510757723725, 'dropout': 0.5011437143524109, 'patience': 50, 'lr_reduce_freq': 50, 'spt_alg': 'kruskal', 'spt_attr': 'edge_degree', 'manifold': 'Hyperboloid', 'num_layers': 3, 'dim': 464, 'num_adj': 4, 'add_rate': 0.15319791991407047, 'tem': 1.319686382710785, 'consis_rate': 1.9525472634896806, 'use_att': 1}. Best is trial 2 with value: 0.7513.[0m
[32m[I 2022-06-29 03:33:28,893][0m Trial 3 finished with value: 0.3112 and parameters: {'lr': 0.010176855262894163, 'weight_decay': 0.040661128863306965, 'dropout': 0.7350352691570036, 'patience': 70, 'lr_reduce_freq': 50, 'spt_alg': 'prim', 'spt_attr': 'edge_degree', 'manifold': 'Hyperboloid', 'num_layers': 4, 'dim': 496, 'num_adj': 6, 'add_rate': 0.23704440182403577, 'tem': 1.4813167209327454, 'consis_rate': 1.9479825802761355, 'use_att': 1}. Best is trial 2 with value: 0.7513.[0m
[32m[I 2022-06-29 03:35:55,248][0m Trial 4 finished with value: 0.8044 and parameters: {'lr': 0.003294705125709941, 'weight_decay': 0.000870721847331164, 'dropout': 0.31210190775238306, 'patience': 50, 'lr_reduce_freq': 100, 'spt_alg': 'kruskal', 'spt_attr': 'similarity', 'manifold': 'PoincareBall', 'num_layers': 3, 'dim': 496, 'num_adj': 4, 'add_rate': 0.5796608442515814, 'tem': 1.3731077799907305, 'consis_rate': 0.8232557895523329, 'use_att': 0}. Best is trial 4 with value: 0.8044.[0m
[32m[I 2022-06-29 03:53:38,562][0m Trial 5 finished with value: 0.30890000000000006 and parameters: {'lr': 0.005174375066345477, 'weight_decay': 0.01982536807418153, 'dropout': 0.35691492545048065, 'patience': 80, 'lr_reduce_freq': 120, 'spt_alg': 'prim', 'spt_attr': 'similarity', 'manifold': 'Hyperboloid', 'num_layers': 3, 'dim': 144, 'num_adj': 2, 'add_rate': 0.6909694379598429, 'tem': 1.2572104112486153, 'consis_rate': 0.7927841844785619, 'use_att': 1}. Best is trial 4 with value: 0.8044.[0m
[32m[I 2022-06-29 04:16:36,058][0m Trial 6 finished with value: 0.8092 and parameters: {'lr': 0.008790456134474977, 'weight_decay': 0.0072342390021874585, 'dropout': 0.2756975327679078, 'patience': 60, 'lr_reduce_freq': 100, 'spt_alg': 'kruskal', 'spt_attr': 'edge_degree', 'manifold': 'PoincareBall', 'num_layers': 3, 'dim': 128, 'num_adj': 6, 'add_rate': 0.19617408740959164, 'tem': 0.8187181538702019, 'consis_rate': 1.990105205659403, 'use_att': 1}. Best is trial 6 with value: 0.8092.[0m
[32m[I 2022-06-29 04:23:05,718][0m Trial 7 finished with value: 0.799 and parameters: {'lr': 0.016649445125507038, 'weight_decay': 0.0006318115838561258, 'dropout': 0.6797950127616177, 'patience': 70, 'lr_reduce_freq': 130, 'spt_alg': 'kruskal', 'spt_attr': 'similarity', 'manifold': 'PoincareBall', 'num_layers': 4, 'dim': 224, 'num_adj': 6, 'add_rate': 0.2824593460787693, 'tem': 0.7564457214437059, 'consis_rate': 1.5792687570171984, 'use_att': 0}. Best is trial 6 with value: 0.8092.[0m
[32m[I 2022-06-29 05:47:40,181][0m Trial 8 finished with value: 0.7607999999999999 and parameters: {'lr': 0.02067602678000962, 'weight_decay': 0.002252465789518809, 'dropout': 0.5754987490688999, 'patience': 70, 'lr_reduce_freq': 70, 'spt_alg': 'prim', 'spt_attr': 'edge_degree', 'manifold': 'Hyperboloid', 'num_layers': 4, 'dim': 416, 'num_adj': 6, 'add_rate': 0.41107323812739904, 'tem': 1.3920505919368402, 'consis_rate': 1.3179266975645452, 'use_att': 1}. Best is trial 6 with value: 0.8092.[0m
[32m[I 2022-06-29 06:17:47,655][0m Trial 9 finished with value: 0.2845 and parameters: {'lr': 0.006309707705557718, 'weight_decay': 0.01500693200123448, 'dropout': 0.7585857687062327, 'patience': 60, 'lr_reduce_freq': 50, 'spt_alg': 'prim', 'spt_attr': 'edge_degree', 'manifold': 'PoincareBall', 'num_layers': 5, 'dim': 400, 'num_adj': 4, 'add_rate': 0.245227674921747, 'tem': 1.3498194531259882, 'consis_rate': 0.7863914497805478, 'use_att': 1}. Best is trial 6 with value: 0.8092.[0m
[32m[I 2022-06-29 06:27:47,354][0m Trial 10 finished with value: 0.3136 and parameters: {'lr': 0.0717038224343937, 'weight_decay': 0.008682747275159951, 'dropout': 0.10393067456855604, 'patience': 100, 'lr_reduce_freq': 100, 'spt_alg': 'kruskal', 'spt_attr': 'similarity', 'manifold': 'PoincareBall', 'num_layers': 5, 'dim': 288, 'num_adj': 6, 'add_rate': 0.7998016994287676, 'tem': 0.9491031902411575, 'consis_rate': 1.4179729126979081, 'use_att': 0}. Best is trial 6 with value: 0.8092.[0m
[32m[I 2022-06-29 06:32:40,834][0m Trial 11 finished with value: 0.7902 and parameters: {'lr': 0.0012581248095898869, 'weight_decay': 0.000560179673088726, 'dropout': 0.2429756294673649, 'patience': 50, 'lr_reduce_freq': 150, 'spt_alg': 'kruskal', 'spt_attr': 'similarity', 'manifold': 'PoincareBall', 'num_layers': 3, 'dim': 128, 'num_adj': 4, 'add_rate': 0.6105195923644572, 'tem': 1.0565263358990968, 'consis_rate': 1.0155163963486418, 'use_att': 0}. Best is trial 6 with value: 0.8092.[0m
[32m[I 2022-06-29 06:35:04,971][0m Trial 12 finished with value: 0.7938000000000001 and parameters: {'lr': 0.039885914452833876, 'weight_decay': 0.006024347140070342, 'dropout': 0.2759971806766591, 'patience': 50, 'lr_reduce_freq': 100, 'spt_alg': 'kruskal', 'spt_attr': 'similarity', 'manifold': 'PoincareBall', 'num_layers': 3, 'dim': 336, 'num_adj': 2, 'add_rate': 0.5919949716256688, 'tem': 0.9451259249935604, 'consis_rate': 0.35910514312189057, 'use_att': 0}. Best is trial 6 with value: 0.8092.[0m
[32m[I 2022-06-29 06:39:08,473][0m Trial 13 finished with value: 0.7975000000000001 and parameters: {'lr': 0.0018202947398562358, 'weight_decay': 0.0011435233005576556, 'dropout': 0.16118203929217279, 'patience': 60, 'lr_reduce_freq': 90, 'spt_alg': 'kruskal', 'spt_attr': 'similarity', 'manifold': 'PoincareBall', 'num_layers': 3, 'dim': 224, 'num_adj': 4, 'add_rate': 0.38428602295831343, 'tem': 1.1475452814018023, 'consis_rate': 1.0986954671675981, 'use_att': 0}. Best is trial 6 with value: 0.8092.[0m
[32m[I 2022-06-29 07:38:52,791][0m Trial 14 finished with value: 0.8093 and parameters: {'lr': 0.011345216643586358, 'weight_decay': 0.004049331681350738, 'dropout': 0.3263951288747121, 'patience': 100, 'lr_reduce_freq': 30, 'spt_alg': 'kruskal', 'spt_attr': 'edge_degree', 'manifold': 'PoincareBall', 'num_layers': 3, 'dim': 352, 'num_adj': 6, 'add_rate': 0.8416664219261263, 'tem': 0.8208178066199421, 'consis_rate': 1.6431710133006305, 'use_att': 1}. Best is trial 14 with value: 0.8093.[0m
[32m[I 2022-06-29 08:32:33,982][0m Trial 15 finished with value: 0.8067 and parameters: {'lr': 0.01391996578416494, 'weight_decay': 0.0039748257946830194, 'dropout': 0.4166637867468893, 'patience': 100, 'lr_reduce_freq': 30, 'spt_alg': 'kruskal', 'spt_attr': 'edge_degree', 'manifold': 'PoincareBall', 'num_layers': 3, 'dim': 336, 'num_adj': 6, 'add_rate': 0.8996597040365569, 'tem': 0.8046401751368227, 'consis_rate': 1.688264650017921, 'use_att': 1}. Best is trial 14 with value: 0.8093.[0m
[32m[I 2022-06-29 09:09:23,280][0m Trial 16 finished with value: 0.8042 and parameters: {'lr': 0.024811519932264478, 'weight_decay': 0.009598458617082367, 'dropout': 0.20063550519757883, 'patience': 90, 'lr_reduce_freq': 30, 'spt_alg': 'kruskal', 'spt_attr': 'edge_degree', 'manifold': 'PoincareBall', 'num_layers': 3, 'dim': 272, 'num_adj': 6, 'add_rate': 0.7723592271799243, 'tem': 0.7909743527223986, 'consis_rate': 1.737849679494447, 'use_att': 1}. Best is trial 14 with value: 0.8093.[0m
[32m[I 2022-06-29 10:14:15,723][0m Trial 17 finished with value: 0.30199999999999994 and parameters: {'lr': 0.008211452567745985, 'weight_decay': 0.024008308708127, 'dropout': 0.36161157252788184, 'patience': 90, 'lr_reduce_freq': 60, 'spt_alg': 'kruskal', 'spt_attr': 'edge_degree', 'manifold': 'PoincareBall', 'num_layers': 5, 'dim': 192, 'num_adj': 6, 'add_rate': 0.8922733992379377, 'tem': 0.5058276539444964, 'consis_rate': 1.9884629065611035, 'use_att': 1}. Best is trial 14 with value: 0.8093.[0m
cmd: --dataset cora --model HGCN --c 2
cur_param: {'lr': 0.0033813753450851066, 'weight_decay': 0.0015608232343617958, 'dropout': 0.7546641608593386, 'patience': 80, 'lr_reduce_freq': 120, 'spt_alg': 'kruskal', 'spt_attr': 'edge_degree', 'manifold': 'Hyperboloid', 'num_layers': 4, 'dim': 432, 'num_adj': 2, 'add_rate': 0.44469190076813037, 'tem': 0.6663592698032833, 'consis_rate': 0.591389409353308, 'use_att': 1}
mean: 0.7389
[0.737 0.733 0.771 0.693 0.711 0.714 0.796 0.741 0.745 0.748]
cur_param: {'lr': 0.0006053532736830932, 'weight_decay': 0.0023425313830794893, 'dropout': 0.4295966575090837, 'patience': 60, 'lr_reduce_freq': 80, 'spt_alg': 'prim', 'spt_attr': 'edge_degree', 'manifold': 'Hyperboloid', 'num_layers': 4, 'dim': 496, 'num_adj': 4, 'add_rate': 0.16354466058084097, 'tem': 0.5547058978595094, 'consis_rate': 0.509086878981804, 'use_att': 0}
mean: 0.2887
[0.166 0.345 0.156 0.252 0.659 0.467 0.352 0.163 0.178 0.149]
cur_param: {'lr': 0.002904776462012873, 'weight_decay': 0.004024510757723725, 'dropout': 0.5011437143524109, 'patience': 50, 'lr_reduce_freq': 50, 'spt_alg': 'kruskal', 'spt_attr': 'edge_degree', 'manifold': 'Hyperboloid', 'num_layers': 3, 'dim': 464, 'num_adj': 4, 'add_rate': 0.15319791991407047, 'tem': 1.319686382710785, 'consis_rate': 1.9525472634896806, 'use_att': 1}
mean: 0.7513
[0.76  0.726 0.763 0.773 0.778 0.772 0.767 0.747 0.648 0.779]
cur_param: {'lr': 0.010176855262894163, 'weight_decay': 0.040661128863306965, 'dropout': 0.7350352691570036, 'patience': 70, 'lr_reduce_freq': 50, 'spt_alg': 'prim', 'spt_attr': 'edge_degree', 'manifold': 'Hyperboloid', 'num_layers': 4, 'dim': 496, 'num_adj': 6, 'add_rate': 0.23704440182403577, 'tem': 1.4813167209327454, 'consis_rate': 1.9479825802761355, 'use_att': 1}
mean: 0.3112
[0.319 0.319 0.319 0.319 0.319 0.319 0.319 0.245 0.319 0.315]
cur_param: {'lr': 0.003294705125709941, 'weight_decay': 0.000870721847331164, 'dropout': 0.31210190775238306, 'patience': 50, 'lr_reduce_freq': 100, 'spt_alg': 'kruskal', 'spt_attr': 'similarity', 'manifold': 'PoincareBall', 'num_layers': 3, 'dim': 496, 'num_adj': 4, 'add_rate': 0.5796608442515814, 'tem': 1.3731077799907305, 'consis_rate': 0.8232557895523329, 'use_att': 0}
mean: 0.8044
[0.797 0.809 0.807 0.822 0.803 0.801 0.805 0.807 0.799 0.794]
cur_param: {'lr': 0.005174375066345477, 'weight_decay': 0.01982536807418153, 'dropout': 0.35691492545048065, 'patience': 80, 'lr_reduce_freq': 120, 'spt_alg': 'prim', 'spt_attr': 'similarity', 'manifold': 'Hyperboloid', 'num_layers': 3, 'dim': 144, 'num_adj': 2, 'add_rate': 0.6909694379598429, 'tem': 1.2572104112486153, 'consis_rate': 0.7927841844785619, 'use_att': 1}
mean: 0.30890000000000006
[0.319 0.319 0.319 0.388 0.319 0.319 0.319 0.319 0.149 0.319]
cur_param: {'lr': 0.008790456134474977, 'weight_decay': 0.0072342390021874585, 'dropout': 0.2756975327679078, 'patience': 60, 'lr_reduce_freq': 100, 'spt_alg': 'kruskal', 'spt_attr': 'edge_degree', 'manifold': 'PoincareBall', 'num_layers': 3, 'dim': 128, 'num_adj': 6, 'add_rate': 0.19617408740959164, 'tem': 0.8187181538702019, 'consis_rate': 1.990105205659403, 'use_att': 1}
mean: 0.8092
[0.802 0.82  0.822 0.815 0.814 0.809 0.817 0.819 0.78  0.794]
cur_param: {'lr': 0.016649445125507038, 'weight_decay': 0.0006318115838561258, 'dropout': 0.6797950127616177, 'patience': 70, 'lr_reduce_freq': 130, 'spt_alg': 'kruskal', 'spt_attr': 'similarity', 'manifold': 'PoincareBall', 'num_layers': 4, 'dim': 224, 'num_adj': 6, 'add_rate': 0.2824593460787693, 'tem': 0.7564457214437059, 'consis_rate': 1.5792687570171984, 'use_att': 0}
mean: 0.799
[0.784 0.804 0.796 0.804 0.79  0.811 0.81  0.795 0.81  0.786]
cur_param: {'lr': 0.02067602678000962, 'weight_decay': 0.002252465789518809, 'dropout': 0.5754987490688999, 'patience': 70, 'lr_reduce_freq': 70, 'spt_alg': 'prim', 'spt_attr': 'edge_degree', 'manifold': 'Hyperboloid', 'num_layers': 4, 'dim': 416, 'num_adj': 6, 'add_rate': 0.41107323812739904, 'tem': 1.3920505919368402, 'consis_rate': 1.3179266975645452, 'use_att': 1}
mean: 0.7607999999999999
[0.791 0.767 0.77  0.775 0.785 0.743 0.705 0.78  0.731 0.761]
cur_param: {'lr': 0.006309707705557718, 'weight_decay': 0.01500693200123448, 'dropout': 0.7585857687062327, 'patience': 60, 'lr_reduce_freq': 50, 'spt_alg': 'prim', 'spt_attr': 'edge_degree', 'manifold': 'PoincareBall', 'num_layers': 5, 'dim': 400, 'num_adj': 4, 'add_rate': 0.245227674921747, 'tem': 1.3498194531259882, 'consis_rate': 0.7863914497805478, 'use_att': 1}
mean: 0.2845
[0.319 0.319 0.144 0.319 0.319 0.319 0.149 0.319 0.319 0.319]
cur_param: {'lr': 0.0717038224343937, 'weight_decay': 0.008682747275159951, 'dropout': 0.10393067456855604, 'patience': 100, 'lr_reduce_freq': 100, 'spt_alg': 'kruskal', 'spt_attr': 'similarity', 'manifold': 'PoincareBall', 'num_layers': 5, 'dim': 288, 'num_adj': 6, 'add_rate': 0.7998016994287676, 'tem': 0.9491031902411575, 'consis_rate': 1.4179729126979081, 'use_att': 0}
mean: 0.3136
[0.314 0.319 0.319 0.324 0.308 0.319 0.292 0.319 0.315 0.307]
cur_param: {'lr': 0.0012581248095898869, 'weight_decay': 0.000560179673088726, 'dropout': 0.2429756294673649, 'patience': 50, 'lr_reduce_freq': 150, 'spt_alg': 'kruskal', 'spt_attr': 'similarity', 'manifold': 'PoincareBall', 'num_layers': 3, 'dim': 128, 'num_adj': 4, 'add_rate': 0.6105195923644572, 'tem': 1.0565263358990968, 'consis_rate': 1.0155163963486418, 'use_att': 0}
mean: 0.7902
[0.794 0.791 0.792 0.794 0.802 0.779 0.789 0.786 0.784 0.791]
cur_param: {'lr': 0.039885914452833876, 'weight_decay': 0.006024347140070342, 'dropout': 0.2759971806766591, 'patience': 50, 'lr_reduce_freq': 100, 'spt_alg': 'kruskal', 'spt_attr': 'similarity', 'manifold': 'PoincareBall', 'num_layers': 3, 'dim': 336, 'num_adj': 2, 'add_rate': 0.5919949716256688, 'tem': 0.9451259249935604, 'consis_rate': 0.35910514312189057, 'use_att': 0}
mean: 0.7938000000000001
[0.789 0.786 0.785 0.81  0.788 0.803 0.784 0.797 0.796 0.8  ]
cur_param: {'lr': 0.0018202947398562358, 'weight_decay': 0.0011435233005576556, 'dropout': 0.16118203929217279, 'patience': 60, 'lr_reduce_freq': 90, 'spt_alg': 'kruskal', 'spt_attr': 'similarity', 'manifold': 'PoincareBall', 'num_layers': 3, 'dim': 224, 'num_adj': 4, 'add_rate': 0.38428602295831343, 'tem': 1.1475452814018023, 'consis_rate': 1.0986954671675981, 'use_att': 0}
mean: 0.7975000000000001
[0.783 0.796 0.792 0.808 0.793 0.798 0.804 0.807 0.798 0.796]
cur_param: {'lr': 0.011345216643586358, 'weight_decay': 0.004049331681350738, 'dropout': 0.3263951288747121, 'patience': 100, 'lr_reduce_freq': 30, 'spt_alg': 'kruskal', 'spt_attr': 'edge_degree', 'manifold': 'PoincareBall', 'num_layers': 3, 'dim': 352, 'num_adj': 6, 'add_rate': 0.8416664219261263, 'tem': 0.8208178066199421, 'consis_rate': 1.6431710133006305, 'use_att': 1}
mean: 0.8093
[0.809 0.813 0.814 0.787 0.812 0.81  0.799 0.821 0.814 0.814]
cur_param: {'lr': 0.01391996578416494, 'weight_decay': 0.0039748257946830194, 'dropout': 0.4166637867468893, 'patience': 100, 'lr_reduce_freq': 30, 'spt_alg': 'kruskal', 'spt_attr': 'edge_degree', 'manifold': 'PoincareBall', 'num_layers': 3, 'dim': 336, 'num_adj': 6, 'add_rate': 0.8996597040365569, 'tem': 0.8046401751368227, 'consis_rate': 1.688264650017921, 'use_att': 1}
mean: 0.8067
[0.805 0.815 0.801 0.801 0.81  0.803 0.809 0.807 0.808 0.808]
cur_param: {'lr': 0.024811519932264478, 'weight_decay': 0.009598458617082367, 'dropout': 0.20063550519757883, 'patience': 90, 'lr_reduce_freq': 30, 'spt_alg': 'kruskal', 'spt_attr': 'edge_degree', 'manifold': 'PoincareBall', 'num_layers': 3, 'dim': 272, 'num_adj': 6, 'add_rate': 0.7723592271799243, 'tem': 0.7909743527223986, 'consis_rate': 1.737849679494447, 'use_att': 1}
mean: 0.8042
[0.793 0.806 0.814 0.8   0.817 0.801 0.794 0.799 0.812 0.806]
cur_param: {'lr': 0.008211452567745985, 'weight_decay': 0.024008308708127, 'dropout': 0.36161157252788184, 'patience': 90, 'lr_reduce_freq': 60, 'spt_alg': 'kruskal', 'spt_attr': 'edge_degree', 'manifold': 'PoincareBall', 'num_layers': 5, 'dim': 192, 'num_adj': 6, 'add_rate': 0.8922733992379377, 'tem': 0.5058276539444964, 'consis_rate': 1.9884629065611035, 'use_att': 1}
mean: 0.30199999999999994
[0.319 0.319 0.149 0.319 0.319 0.319 0.319 0.319 0.319 0.319]
cur_param: {'lr': 0.04560703779243539, 'weight_decay': 0.006700121699045261, 'dropout': 0.5842461627511758, 'patience': 90, 'lr_reduce_freq': 80, 'spt_alg': 'kruskal', 'spt_attr': 'edge_degree', 'manifold': 'PoincareBall', 'num_layers': 3, 'dim': 368, 'num_adj': 6, 'add_rate': 0.32717099880172146, 'tem': 0.8802887299711338, 'consis_rate': 1.3388167576933525, 'use_att': 1}[32m[I 2022-06-29 10:55:09,606][0m Trial 18 finished with value: 0.8036000000000001 and parameters: {'lr': 0.04560703779243539, 'weight_decay': 0.006700121699045261, 'dropout': 0.5842461627511758, 'patience': 90, 'lr_reduce_freq': 80, 'spt_alg': 'kruskal', 'spt_attr': 'edge_degree', 'manifold': 'PoincareBall', 'num_layers': 3, 'dim': 368, 'num_adj': 6, 'add_rate': 0.32717099880172146, 'tem': 0.8802887299711338, 'consis_rate': 1.3388167576933525, 'use_att': 1}. Best is trial 14 with value: 0.8093.[0m
[32m[I 2022-06-29 11:23:16,712][0m Trial 19 finished with value: 0.8072999999999999 and parameters: {'lr': 0.031249074853728534, 'weight_decay': 0.0024970216461010102, 'dropout': 0.5025431052096864, 'patience': 80, 'lr_reduce_freq': 150, 'spt_alg': 'kruskal', 'spt_attr': 'edge_degree', 'manifold': 'PoincareBall', 'num_layers': 3, 'dim': 272, 'num_adj': 6, 'add_rate': 0.5026065774825106, 'tem': 0.6847744865626155, 'consis_rate': 1.7660435353308264, 'use_att': 1}. Best is trial 14 with value: 0.8093.[0m
[32m[I 2022-06-29 12:07:46,264][0m Trial 20 finished with value: 0.319 and parameters: {'lr': 0.07721481053587224, 'weight_decay': 0.010692654784181735, 'dropout': 0.3365788114076297, 'patience': 100, 'lr_reduce_freq': 120, 'spt_alg': 'kruskal', 'spt_attr': 'edge_degree', 'manifold': 'PoincareBall', 'num_layers': 5, 'dim': 176, 'num_adj': 4, 'add_rate': 0.703045478259117, 'tem': 1.0728856273741547, 'consis_rate': 1.5107941870548827, 'use_att': 1}. Best is trial 14 with value: 0.8093.[0m
[32m[I 2022-06-29 12:30:01,370][0m Trial 21 finished with value: 0.8032999999999999 and parameters: {'lr': 0.011734947974120225, 'weight_decay': 0.003172131156941726, 'dropout': 0.5334709464741157, 'patience': 80, 'lr_reduce_freq': 150, 'spt_alg': 'kruskal', 'spt_attr': 'edge_degree', 'manifold': 'PoincareBall', 'num_layers': 3, 'dim': 272, 'num_adj': 6, 'add_rate': 0.10845886440486358, 'tem': 0.6597704425508438, 'consis_rate': 1.7675402356785994, 'use_att': 1}. Best is trial 14 with value: 0.8093.[0m
[32m[I 2022-06-29 12:59:20,161][0m Trial 22 finished with value: 0.8049999999999999 and parameters: {'lr': 0.03484174520108495, 'weight_decay': 0.002530820862227674, 'dropout': 0.47722648749198887, 'patience': 90, 'lr_reduce_freq': 140, 'spt_alg': 'kruskal', 'spt_attr': 'edge_degree', 'manifold': 'PoincareBall', 'num_layers': 3, 'dim': 304, 'num_adj': 6, 'add_rate': 0.47658104127302314, 'tem': 0.672886930382985, 'consis_rate': 1.7891751393258268, 'use_att': 1}. Best is trial 14 with value: 0.8093.[0m
[32m[I 2022-06-29 13:17:38,653][0m Trial 23 finished with value: 0.8078 and parameters: {'lr': 0.024915872912198187, 'weight_decay': 0.0016276817666892622, 'dropout': 0.39306908119188116, 'patience': 60, 'lr_reduce_freq': 110, 'spt_alg': 'kruskal', 'spt_attr': 'edge_degree', 'manifold': 'PoincareBall', 'num_layers': 3, 'dim': 240, 'num_adj': 6, 'add_rate': 0.523893771485891, 'tem': 0.8309669144969537, 'consis_rate': 1.6238505682101396, 'use_att': 1}. Best is trial 14 with value: 0.8093.[0m
[32m[I 2022-06-29 13:34:59,790][0m Trial 24 finished with value: 0.8088999999999998 and parameters: {'lr': 0.006711152822467508, 'weight_decay': 0.0012675289973515583, 'dropout': 0.40548741855649734, 'patience': 60, 'lr_reduce_freq': 110, 'spt_alg': 'kruskal', 'spt_attr': 'edge_degree', 'manifold': 'PoincareBall', 'num_layers': 3, 'dim': 224, 'num_adj': 6, 'add_rate': 0.34951533396174045, 'tem': 0.8740004441889153, 'consis_rate': 1.2096193740516885, 'use_att': 1}. Best is trial 14 with value: 0.8093.[0m
[32m[I 2022-06-29 13:53:08,484][0m Trial 25 finished with value: 0.7992 and parameters: {'lr': 0.005536092369265179, 'weight_decay': 0.0051151347369885625, 'dropout': 0.27205812168807564, 'patience': 60, 'lr_reduce_freq': 90, 'spt_alg': 'kruskal', 'spt_attr': 'edge_degree', 'manifold': 'PoincareBall', 'num_layers': 3, 'dim': 160, 'num_adj': 6, 'add_rate': 0.355851632984297, 'tem': 0.8929638594606802, 'consis_rate': 1.1786805562970881, 'use_att': 1}. Best is trial 14 with value: 0.8093.[0m
