[32m[I 2022-06-23 15:47:55,218][0m Trial 112 finished with value: 0.8072000000000001 and parameters: {'lr': 0.0023404775974082657, 'weight_decay': 0.002243582287277296, 'dropout': 0.7533074684530394, 'patience': 80, 'lr_reduce_freq': 110, 'spt_alg': 'prim', 'spt_attr': 'edge_degree', 'manifold': 'PoincareBall', 'num_layers': 3, 'num_adj': 6, 'add_rate': 0.5196368696324329, 'tem': 0.4710287412253341, 'consis_rate': 0.8940314531332036, 'use_att': 1}. Best is trial 107 with value: 0.8168.[0m

mean: 0.7968999999999999
[0.798 0.807 0.787 0.798 0.815 0.806 0.81  0.767 0.779 0.802]
cur_param: {'lr': 0.0013993873124019936, 'weight_decay': 0.0007633508447792646, 'dropout': 0.8285763183822089, 'patience': 60, 'lr_reduce_freq': 110, 'spt_alg': 'kruskal', 'spt_attr': 'edge_degree', 'manifold': 'PoincareBall', 'num_layers': 3, 'num_adj': 6, 'add_rate': 0.42172964575763655, 'tem': 0.8513332874325614, 'consis_rate': 1.0799565307104688, 'use_att': 1}
mean: 0.7462
[0.767 0.807 0.818 0.807 0.791 0.775 0.319 0.772 0.796 0.81 ]
cur_param: {'lr': 0.0017015753914962136, 'weight_decay': 0.0013930054417128155, 'dropout': 0.7164201349755941, 'patience': 60, 'lr_reduce_freq': 130, 'spt_alg': 'kruskal', 'spt_attr': 'edge_degree', 'manifold': 'PoincareBall', 'num_layers': 3, 'num_adj': 6, 'add_rate': 0.3890044789172044, 'tem': 0.7793902663892793, 'consis_rate': 1.0506501121978238, 'use_att': 1}
mean: 0.8090999999999999
[0.814 0.793 0.798 0.82  0.815 0.819 0.8   0.812 0.818 0.802]
cur_param: {'lr': 0.002709342457899565, 'weight_decay': 0.0012252959577815801, 'dropout': 0.7790566458605792, 'patience': 80, 'lr_reduce_freq': 130, 'spt_alg': 'prim', 'spt_attr': 'edge_degree', 'manifold': 'PoincareBall', 'num_layers': 3, 'num_adj': 6, 'add_rate': 0.43677812832514484, 'tem': 0.5536776106754099, 'consis_rate': 1.0033814271600032, 'use_att': 1}
mean: 0.8104999999999999
[0.806 0.816 0.793 0.817 0.826 0.808 0.805 0.808 0.826 0.8  ]
cur_param: {'lr': 0.002621943285897697, 'weight_decay': 0.001909637408230529, 'dropout': 0.7876313429025961, 'patience': 80, 'lr_reduce_freq': 130, 'spt_alg': 'kruskal', 'spt_attr': 'similarity', 'manifold': 'PoincareBall', 'num_layers': 3, 'num_adj': 6, 'add_rate': 0.4399608982159949, 'tem': 0.5760628719207097, 'consis_rate': 0.9932045204809887, 'use_att': 1}
mean: 0.805
[0.803 0.799 0.788 0.794 0.82  0.819 0.808 0.804 0.811 0.804]
cur_param: {'lr': 0.0011530664363085575, 'weight_decay': 0.000627923447362472, 'dropout': 0.7701953668246294, 'patience': 60, 'lr_reduce_freq': 130, 'spt_alg': 'prim', 'spt_attr': 'edge_degree', 'manifold': 'PoincareBall', 'num_layers': 3, 'num_adj': 6, 'add_rate': 0.49712355178063916, 'tem': 1.5260645791366545, 'consis_rate': 0.8134232236656479, 'use_att': 1}
mean: 0.8056000000000001
[0.797 0.791 0.799 0.796 0.816 0.809 0.808 0.809 0.82  0.811]
cur_param: {'lr': 0.04363763086931418, 'weight_decay': 0.0012185734783869526, 'dropout': 0.7383712652955817, 'patience': 80, 'lr_reduce_freq': 130, 'spt_alg': 'kruskal', 'spt_attr': 'edge_degree', 'manifold': 'PoincareBall', 'num_layers': 3, 'num_adj': 6, 'add_rate': 0.3724204019314758, 'tem': 0.6420528286665889, 'consis_rate': 0.8852053038607305, 'use_att': 1}
mean: 0.7702000000000001
[0.789 0.797 0.785 0.763 0.735 0.783 0.772 0.751 0.74  0.787]
cur_param: {'lr': 0.0019169183953528564, 'weight_decay': 0.0010203529161894231, 'dropout': 0.8051844275853635, 'patience': 80, 'lr_reduce_freq': 130, 'spt_alg': 'prim', 'spt_attr': 'edge_degree', 'manifold': 'PoincareBall', 'num_layers': 3, 'num_adj': 6, 'add_rate': 0.9370316660957856, 'tem': 0.9422251283383574, 'consis_rate': 1.1402612438434745, 'use_att': 1}
mean: 0.8096
[0.808 0.816 0.809 0.802 0.814 0.813 0.822 0.805 0.815 0.792]
cur_param: {'lr': 0.002368364398669879, 'weight_decay': 0.00082009271016247, 'dropout': 0.8040548998176564, 'patience': 80, 'lr_reduce_freq': 130, 'spt_alg': 'prim', 'spt_attr': 'edge_degree', 'manifold': 'PoincareBall', 'num_layers': 3, 'num_adj': 6, 'add_rate': 0.47998400911081934, 'tem': 0.9631309233269137, 'consis_rate': 1.1721188182095608, 'use_att': 1}
mean: 0.8102
[0.805 0.809 0.798 0.812 0.815 0.799 0.818 0.82  0.82  0.806]
cur_param: {'lr': 0.0023841851268700917, 'weight_decay': 0.0008252817727354494, 'dropout': 0.8443562394884541, 'patience': 80, 'lr_reduce_freq': 130, 'spt_alg': 'prim', 'spt_attr': 'edge_degree', 'manifold': 'PoincareBall', 'num_layers': 3, 'num_adj': 6, 'add_rate': 0.8492089490788567, 'tem': 1.027584500655267, 'consis_rate': 1.1767700453598444, 'use_att': 1}
mean: 0.7980000000000002
[0.809 0.789 0.793 0.802 0.801 0.793 0.829 0.788 0.788 0.788]
cur_param: {'lr': 0.003067966606811323, 'weight_decay': 0.0005019268801409883, 'dropout': 0.8045437862538708, 'patience': 80, 'lr_reduce_freq': 130, 'spt_alg': 'prim', 'spt_attr': 'edge_degree', 'manifold': 'PoincareBall', 'num_layers': 3, 'num_adj': 6, 'add_rate': 0.4755143978651716, 'tem': 0.4322065962852111, 'consis_rate': 1.2904678971494243, 'use_att': 1}
mean: 0.8034000000000001
[0.795 0.792 0.797 0.8   0.812 0.799 0.817 0.81  0.809 0.803]
cur_param: {'lr': 0.0019544219501460673, 'weight_decay': 0.0014970556104690696, 'dropout': 0.9136272671913904, 'patience': 80, 'lr_reduce_freq': 150, 'spt_alg': 'prim', 'spt_attr': 'edge_degree', 'manifold': 'PoincareBall', 'num_layers': 3, 'num_adj': 6, 'add_rate': 0.9069538744038153, 'tem': 1.1152626258198333, 'consis_rate': 1.2383514381702825, 'use_att': 1}
mean: 0.5698000000000001
[0.453 0.592 0.648 0.566 0.599 0.493 0.616 0.682 0.485 0.564]
cur_param: {'lr': 0.002851157792719235, 'weight_decay': 0.001022241716468847, 'dropout': 0.6843314975000004, 'patience': 80, 'lr_reduce_freq': 110, 'spt_alg': 'prim', 'spt_attr': 'edge_degree', 'manifold': 'PoincareBall', 'num_layers': 3, 'num_adj': 6, 'add_rate': 0.5208823464760182, 'tem': 0.9514589593995424, 'consis_rate': 0.9597562554332271, 'use_att': 1}
mean: 0.8118000000000001
[0.797 0.813 0.822 0.81  0.815 0.812 0.801 0.817 0.811 0.82 ]
cur_param: {'lr': 0.002811620933392091, 'weight_decay': 0.0010587788750608088, 'dropout': 0.6852879023460303, 'patience': 80, 'lr_reduce_freq': 110, 'spt_alg': 'prim', 'spt_attr': 'edge_degree', 'manifold': 'PoincareBall', 'num_layers': 3, 'num_adj': 6, 'add_rate': 0.5114129634416814, 'tem': 1.056068905303546, 'consis_rate': 0.9365966425970494, 'use_att': 1}
mean: 0.8168
[0.82  0.817 0.822 0.821 0.822 0.805 0.813 0.812 0.811 0.825]
cur_param: {'lr': 0.0026640306656095848, 'weight_decay': 0.0017517355527871124, 'dropout': 0.6830567576214706, 'patience': 80, 'lr_reduce_freq': 110, 'spt_alg': 'prim', 'spt_attr': 'edge_degree', 'manifold': 'PoincareBall', 'num_layers': 3, 'num_adj': 6, 'add_rate': 0.5238729788732072, 'tem': 0.5445771470364059, 'consis_rate': 0.96094690293012, 'use_att': 1}
mean: 0.8106
[0.818 0.796 0.819 0.807 0.826 0.809 0.801 0.815 0.814 0.801]
cur_param: {'lr': 0.0027373853778866197, 'weight_decay': 0.0016862224005648103, 'dropout': 0.6856359739335554, 'patience': 80, 'lr_reduce_freq': 110, 'spt_alg': 'prim', 'spt_attr': 'edge_degree', 'manifold': 'PoincareBall', 'num_layers': 3, 'num_adj': 6, 'add_rate': 0.5384698749018356, 'tem': 0.5484442541447457, 'consis_rate': 0.849377092469505, 'use_att': 1}
mean: 0.8084000000000001
[0.795 0.792 0.82  0.807 0.826 0.796 0.793 0.814 0.817 0.824]
cur_param: {'lr': 0.004247929787235546, 'weight_decay': 0.0011939454416564636, 'dropout': 0.7251092324232858, 'patience': 80, 'lr_reduce_freq': 110, 'spt_alg': 'prim', 'spt_attr': 'edge_degree', 'manifold': 'PoincareBall', 'num_layers': 4, 'num_adj': 6, 'add_rate': 0.5976095392080143, 'tem': 1.0711110804611126, 'consis_rate': 0.776853377320418, 'use_att': 1}
mean: 0.7438
[0.757 0.762 0.743 0.707 0.785 0.698 0.741 0.765 0.74  0.74 ]
cur_param: {'lr': 0.002959560264832406, 'weight_decay': 0.0027251175641886095, 'dropout': 0.7683637689506708, 'patience': 80, 'lr_reduce_freq': 110, 'spt_alg': 'prim', 'spt_attr': 'edge_degree', 'manifold': 'PoincareBall', 'num_layers': 3, 'num_adj': 6, 'add_rate': 0.5221635749738203, 'tem': 0.38035600678055026, 'consis_rate': 0.95762659153616, 'use_att': 1}
mean: 0.8026
[0.804 0.811 0.789 0.792 0.818 0.8   0.815 0.787 0.819 0.791]
cur_param: {'lr': 0.0023404775974082657, 'weight_decay': 0.002243582287277296, 'dropout': 0.7533074684530394, 'patience': 80, 'lr_reduce_freq': 110, 'spt_alg': 'prim', 'spt_attr': 'edge_degree', 'manifold': 'PoincareBall', 'num_layers': 3, 'num_adj': 6, 'add_rate': 0.5196368696324329, 'tem': 0.4710287412253341, 'consis_rate': 0.8940314531332036, 'use_att': 1}
mean: 0.8072000000000001
[0.789 0.794 0.807 0.808 0.807 0.815 0.811 0.814 0.82  0.807]
cur_param: {'lr': 0.002137679221858621, 'weight_decay': 0.0013881913662832333, 'dropout': 0.7134294936856148, 'patience': 80, 'lr_reduce_freq': 110, 'spt_alg': 'prim', 'spt_attr': 'edge_degree', 'manifold': 'PoincareBall', 'num_layers': 3, 'num_adj': 6, 'add_rate': 0.5015406293400347, 'tem': 1.017884853372002, 'consis_rate': 1.0003286454044602, 'use_att': 1}[32m[I 2022-06-23 16:25:50,377][0m Trial 113 finished with value: 0.8049000000000002 and parameters: {'lr': 0.002137679221858621, 'weight_decay': 0.0013881913662832333, 'dropout': 0.7134294936856148, 'patience': 80, 'lr_reduce_freq': 110, 'spt_alg': 'prim', 'spt_attr': 'edge_degree', 'manifold': 'PoincareBall', 'num_layers': 3, 'num_adj': 6, 'add_rate': 0.5015406293400347, 'tem': 1.017884853372002, 'consis_rate': 1.0003286454044602, 'use_att': 1}. Best is trial 107 with value: 0.8168.[0m
[32m[I 2022-06-23 17:01:53,644][0m Trial 114 finished with value: 0.8121 and parameters: {'lr': 0.002580528732295819, 'weight_decay': 0.0018254686949130856, 'dropout': 0.6629846594303793, 'patience': 80, 'lr_reduce_freq': 90, 'spt_alg': 'prim', 'spt_attr': 'edge_degree', 'manifold': 'PoincareBall', 'num_layers': 3, 'num_adj': 6, 'add_rate': 0.45783673569577926, 'tem': 0.7023107413236294, 'consis_rate': 0.6986547713306307, 'use_att': 1}. Best is trial 107 with value: 0.8168.[0m
[32m[I 2022-06-23 17:34:54,949][0m Trial 115 finished with value: 0.8051 and parameters: {'lr': 0.003227520465125654, 'weight_decay': 0.0021501908968915343, 'dropout': 0.6718232342029747, 'patience': 80, 'lr_reduce_freq': 90, 'spt_alg': 'prim', 'spt_attr': 'edge_degree', 'manifold': 'PoincareBall', 'num_layers': 3, 'num_adj': 6, 'add_rate': 0.45479596455465, 'tem': 0.9168093885883047, 'consis_rate': 0.6256693081190223, 'use_att': 1}. Best is trial 107 with value: 0.8168.[0m
[32m[I 2022-06-23 18:06:45,999][0m Trial 116 finished with value: 0.8122 and parameters: {'lr': 0.0027179807922442386, 'weight_decay': 0.0007503618796107076, 'dropout': 0.6566955498535678, 'patience': 80, 'lr_reduce_freq': 90, 'spt_alg': 'prim', 'spt_attr': 'edge_degree', 'manifold': 'PoincareBall', 'num_layers': 3, 'num_adj': 6, 'add_rate': 0.4778419576449018, 'tem': 0.6939830303016341, 'consis_rate': 0.42237508111617716, 'use_att': 1}. Best is trial 107 with value: 0.8168.[0m
[32m[I 2022-06-23 18:33:41,843][0m Trial 117 finished with value: 0.8088999999999998 and parameters: {'lr': 0.0039003614779111817, 'weight_decay': 0.0007398944557880159, 'dropout': 0.6547166902892507, 'patience': 80, 'lr_reduce_freq': 90, 'spt_alg': 'prim', 'spt_attr': 'edge_degree', 'manifold': 'PoincareBall', 'num_layers': 3, 'num_adj': 6, 'add_rate': 0.4787948945558728, 'tem': 0.6605748326247989, 'consis_rate': 0.7003919424254909, 'use_att': 1}. Best is trial 107 with value: 0.8168.[0m
[32m[I 2022-06-23 19:14:29,508][0m Trial 118 finished with value: 0.8115 and parameters: {'lr': 0.0025890375608946625, 'weight_decay': 0.0010330237653660603, 'dropout': 0.7425428043821313, 'patience': 80, 'lr_reduce_freq': 90, 'spt_alg': 'prim', 'spt_attr': 'similarity', 'manifold': 'PoincareBall', 'num_layers': 3, 'num_adj': 6, 'add_rate': 0.46284303473290594, 'tem': 0.6910798727796092, 'consis_rate': 0.34031477102794366, 'use_att': 1}. Best is trial 107 with value: 0.8168.[0m
[32m[I 2022-06-23 19:52:43,403][0m Trial 119 finished with value: 0.8116999999999999 and parameters: {'lr': 0.0028899525012088963, 'weight_decay': 0.0010652737980180907, 'dropout': 0.7385044882523553, 'patience': 80, 'lr_reduce_freq': 90, 'spt_alg': 'prim', 'spt_attr': 'similarity', 'manifold': 'PoincareBall', 'num_layers': 3, 'num_adj': 6, 'add_rate': 0.4581575915368086, 'tem': 0.6970162657554028, 'consis_rate': 0.5133189825614417, 'use_att': 1}. Best is trial 107 with value: 0.8168.[0m
[32m[I 2022-06-23 20:36:26,322][0m Trial 120 finished with value: 0.8119 and parameters: {'lr': 0.0025911001609345585, 'weight_decay': 0.0010038069832983725, 'dropout': 0.7423331189500677, 'patience': 80, 'lr_reduce_freq': 90, 'spt_alg': 'prim', 'spt_attr': 'similarity', 'manifold': 'PoincareBall', 'num_layers': 3, 'num_adj': 6, 'add_rate': 0.5495153343680443, 'tem': 0.6842185570876944, 'consis_rate': 0.37212017722762797, 'use_att': 1}. Best is trial 107 with value: 0.8168.[0m
[32m[I 2022-06-23 21:11:59,160][0m Trial 121 finished with value: 0.8108000000000001 and parameters: {'lr': 0.0029332585542201656, 'weight_decay': 0.0009833278440709457, 'dropout': 0.7329092009611781, 'patience': 80, 'lr_reduce_freq': 90, 'spt_alg': 'prim', 'spt_attr': 'similarity', 'manifold': 'PoincareBall', 'num_layers': 3, 'num_adj': 6, 'add_rate': 0.5470070053827267, 'tem': 0.6982051791050459, 'consis_rate': 0.3088805319660674, 'use_att': 1}. Best is trial 107 with value: 0.8168.[0m
[32m[I 2022-06-23 21:50:44,564][0m Trial 122 finished with value: 0.8129000000000002 and parameters: {'lr': 0.0029312162674152735, 'weight_decay': 0.0009959204329804186, 'dropout': 0.7474394301062844, 'patience': 80, 'lr_reduce_freq': 90, 'spt_alg': 'prim', 'spt_attr': 'similarity', 'manifold': 'PoincareBall', 'num_layers': 3, 'num_adj': 6, 'add_rate': 0.548396581323449, 'tem': 0.6893903851165953, 'consis_rate': 0.32437168272394423, 'use_att': 1}. Best is trial 107 with value: 0.8168.[0m
[32m[I 2022-06-23 22:26:25,670][0m Trial 123 finished with value: 0.8090999999999999 and parameters: {'lr': 0.0032771584486916932, 'weight_decay': 0.0006867652638152086, 'dropout': 0.7487011583347669, 'patience': 80, 'lr_reduce_freq': 90, 'spt_alg': 'prim', 'spt_attr': 'similarity', 'manifold': 'PoincareBall', 'num_layers': 3, 'num_adj': 6, 'add_rate': 0.6116472823563567, 'tem': 0.7087948683230028, 'consis_rate': 0.47711610295422396, 'use_att': 1}. Best is trial 107 with value: 0.8168.[0m
[32m[I 2022-06-23 23:05:37,350][0m Trial 124 finished with value: 0.8107999999999999 and parameters: {'lr': 0.002517352162207484, 'weight_decay': 0.001114847723479951, 'dropout': 0.7017274504943726, 'patience': 80, 'lr_reduce_freq': 90, 'spt_alg': 'prim', 'spt_attr': 'similarity', 'manifold': 'PoincareBall', 'num_layers': 3, 'num_adj': 6, 'add_rate': 0.5669879966372904, 'tem': 0.735949536707263, 'consis_rate': 0.26512847074427376, 'use_att': 1}. Best is trial 107 with value: 0.8168.[0m
[32m[I 2022-06-23 23:40:33,508][0m Trial 125 finished with value: 0.8131 and parameters: {'lr': 0.0030949197471961906, 'weight_decay': 0.0006467100895236841, 'dropout': 0.7388092788090557, 'patience': 80, 'lr_reduce_freq': 90, 'spt_alg': 'prim', 'spt_attr': 'similarity', 'manifold': 'PoincareBall', 'num_layers': 3, 'num_adj': 6, 'add_rate': 0.4910150255499427, 'tem': 0.6666957516492463, 'consis_rate': 0.3643884826425053, 'use_att': 1}. Best is trial 107 with value: 0.8168.[0m
[32m[I 2022-06-24 00:10:15,527][0m Trial 126 finished with value: 0.8093 and parameters: {'lr': 0.0040419863878398445, 'weight_decay': 0.0008979922181664576, 'dropout': 0.7128369344990207, 'patience': 80, 'lr_reduce_freq': 90, 'spt_alg': 'prim', 'spt_attr': 'similarity', 'manifold': 'PoincareBall', 'num_layers': 3, 'num_adj': 6, 'add_rate': 0.45827302407072545, 'tem': 0.668025282499792, 'consis_rate': 0.40685633113231906, 'use_att': 1}. Best is trial 107 with value: 0.8168.[0m
[32m[I 2022-06-24 00:41:12,138][0m Trial 127 finished with value: 0.8076000000000001 and parameters: {'lr': 0.004633485247606349, 'weight_decay': 0.001007021320860622, 'dropout': 0.6664637976191047, 'patience': 80, 'lr_reduce_freq': 90, 'spt_alg': 'prim', 'spt_attr': 'similarity', 'manifold': 'PoincareBall', 'num_layers': 3, 'num_adj': 6, 'add_rate': 0.5808478933210734, 'tem': 0.6408116818392786, 'consis_rate': 0.34752363388568397, 'use_att': 1}. Best is trial 107 with value: 0.8168.[0m
[32m[I 2022-06-24 01:12:07,644][0m Trial 128 finished with value: 0.8107999999999999 and parameters: {'lr': 0.003356519225221185, 'weight_decay': 0.0006576191439615046, 'dropout': 0.7369342582133555, 'patience': 80, 'lr_reduce_freq': 90, 'spt_alg': 'prim', 'spt_attr': 'similarity', 'manifold': 'PoincareBall', 'num_layers': 3, 'num_adj': 6, 'add_rate': 0.5052107760933913, 'tem': 0.7751398855939313, 'consis_rate': 0.5462921056581675, 'use_att': 1}. Best is trial 107 with value: 0.8168.[0m
[32m[I 2022-06-24 01:46:09,571][0m Trial 129 finished with value: 0.8122999999999999 and parameters: {'lr': 0.00272527978583942, 'weight_decay': 0.000774010792655043, 'dropout': 0.7015697132916202, 'patience': 80, 'lr_reduce_freq': 90, 'spt_alg': 'prim', 'spt_attr': 'similarity', 'manifold': 'PoincareBall', 'num_layers': 3, 'num_adj': 6, 'add_rate': 0.5484838387572409, 'tem': 0.5891927307867991, 'consis_rate': 0.24078710859712094, 'use_att': 1}. Best is trial 107 with value: 0.8168.[0m
[32m[I 2022-06-24 02:04:27,218][0m Trial 130 finished with value: 0.5352 and parameters: {'lr': 0.09378986638907023, 'weight_decay': 0.0007658379575535482, 'dropout': 0.6886975045510662, 'patience': 80, 'lr_reduce_freq': 90, 'spt_alg': 'prim', 'spt_attr': 'similarity', 'manifold': 'PoincareBall', 'num_layers': 3, 'num_adj': 6, 'add_rate': 0.5430758728818789, 'tem': 0.5079494656706806, 'consis_rate': 0.26364080107221155, 'use_att': 1}. Best is trial 107 with value: 0.8168.[0m
