nohup: ignoring input
[32m[I 2022-06-29 01:32:02,783][0m A new study created in memory with name: no-name-97f20215-87a7-4841-8d53-98c98b1060b4[0m
[32m[I 2022-06-29 02:10:55,748][0m Trial 0 finished with value: 0.7859999999999999 and parameters: {'lr': 0.003490808760693802, 'weight_decay': 0.000977275176796664, 'dropout': 0.6898805622874887, 'patience': 50, 'lr_reduce_freq': 40, 'spt_alg': 'prim', 'spt_attr': 'edge_degree', 'manifold': 'PoincareBall', 'num_layers': 4, 'dim': 416, 'num_adj': 6, 'add_rate': 0.6133837002615918, 'tem': 1.3959622545284067, 'consis_rate': 0.7566642419935188, 'use_att': 1}. Best is trial 0 with value: 0.7859999999999999.[0m
[32m[I 2022-06-29 03:05:35,435][0m Trial 1 finished with value: 0.2259 and parameters: {'lr': 0.0018723267364603613, 'weight_decay': 0.015470879201877044, 'dropout': 0.2414548549482421, 'patience': 90, 'lr_reduce_freq': 40, 'spt_alg': 'kruskal', 'spt_attr': 'edge_degree', 'manifold': 'Hyperboloid', 'num_layers': 5, 'dim': 400, 'num_adj': 4, 'add_rate': 0.8546661777013593, 'tem': 0.928959997213674, 'consis_rate': 0.6058403916880665, 'use_att': 1}. Best is trial 0 with value: 0.7859999999999999.[0m
[32m[I 2022-06-29 03:12:16,939][0m Trial 2 finished with value: 0.30569999999999997 and parameters: {'lr': 0.03566522312913775, 'weight_decay': 0.011758619994744389, 'dropout': 0.2941428132068351, 'patience': 100, 'lr_reduce_freq': 50, 'spt_alg': 'kruskal', 'spt_attr': 'edge_degree', 'manifold': 'PoincareBall', 'num_layers': 4, 'dim': 400, 'num_adj': 4, 'add_rate': 0.7733405310496981, 'tem': 0.7667402531059061, 'consis_rate': 0.3315787117628821, 'use_att': 0}. Best is trial 0 with value: 0.7859999999999999.[0m
[32m[I 2022-06-29 03:16:50,402][0m Trial 3 finished with value: 0.31839999999999996 and parameters: {'lr': 0.02410455868687655, 'weight_decay': 0.041077462297876066, 'dropout': 0.4153954989925117, 'patience': 80, 'lr_reduce_freq': 50, 'spt_alg': 'prim', 'spt_attr': 'edge_degree', 'manifold': 'PoincareBall', 'num_layers': 3, 'dim': 208, 'num_adj': 4, 'add_rate': 0.28805128515063194, 'tem': 0.7325880274356041, 'consis_rate': 0.599651206037251, 'use_att': 0}. Best is trial 0 with value: 0.7859999999999999.[0m
[32m[I 2022-06-29 03:43:08,856][0m Trial 4 finished with value: 0.7691000000000001 and parameters: {'lr': 0.004436008130628258, 'weight_decay': 0.0013506949974207631, 'dropout': 0.16873144257874564, 'patience': 50, 'lr_reduce_freq': 100, 'spt_alg': 'kruskal', 'spt_attr': 'similarity', 'manifold': 'Hyperboloid', 'num_layers': 4, 'dim': 320, 'num_adj': 2, 'add_rate': 0.6824940651364797, 'tem': 0.7812291066382064, 'consis_rate': 1.0142108129764702, 'use_att': 1}. Best is trial 0 with value: 0.7859999999999999.[0m
[32m[I 2022-06-29 04:03:30,180][0m Trial 5 finished with value: 0.7956000000000001 and parameters: {'lr': 0.08657794792710559, 'weight_decay': 0.004128860902717535, 'dropout': 0.29916249474374573, 'patience': 60, 'lr_reduce_freq': 30, 'spt_alg': 'kruskal', 'spt_attr': 'similarity', 'manifold': 'PoincareBall', 'num_layers': 3, 'dim': 432, 'num_adj': 2, 'add_rate': 0.6177352681744387, 'tem': 1.0028064456029142, 'consis_rate': 0.9114998549985398, 'use_att': 1}. Best is trial 5 with value: 0.7956000000000001.[0m
[32m[I 2022-06-29 04:22:33,813][0m Trial 6 finished with value: 0.319 and parameters: {'lr': 0.00921246845604206, 'weight_decay': 0.04578813984616352, 'dropout': 0.4763313720630048, 'patience': 90, 'lr_reduce_freq': 110, 'spt_alg': 'prim', 'spt_attr': 'similarity', 'manifold': 'Hyperboloid', 'num_layers': 4, 'dim': 144, 'num_adj': 2, 'add_rate': 0.38554561408198873, 'tem': 0.7966031437685167, 'consis_rate': 1.4512007874001662, 'use_att': 1}. Best is trial 5 with value: 0.7956000000000001.[0m
[32m[I 2022-06-29 04:35:17,302][0m Trial 7 finished with value: 0.20390000000000003 and parameters: {'lr': 0.000721461475059426, 'weight_decay': 0.021954001778128257, 'dropout': 0.5705658830317257, 'patience': 100, 'lr_reduce_freq': 90, 'spt_alg': 'prim', 'spt_attr': 'edge_degree', 'manifold': 'PoincareBall', 'num_layers': 5, 'dim': 368, 'num_adj': 6, 'add_rate': 0.47482447069202594, 'tem': 1.358609609462174, 'consis_rate': 1.1682182958901366, 'use_att': 0}. Best is trial 5 with value: 0.7956000000000001.[0m
[32m[I 2022-06-29 04:42:38,638][0m Trial 8 finished with value: 0.7944 and parameters: {'lr': 0.003679484089670646, 'weight_decay': 0.0008112604478631027, 'dropout': 0.19930372426670703, 'patience': 100, 'lr_reduce_freq': 90, 'spt_alg': 'prim', 'spt_attr': 'edge_degree', 'manifold': 'PoincareBall', 'num_layers': 5, 'dim': 320, 'num_adj': 4, 'add_rate': 0.3171855999168843, 'tem': 0.8427459650027362, 'consis_rate': 0.5397406220220428, 'use_att': 0}. Best is trial 5 with value: 0.7956000000000001.[0m
[32m[I 2022-06-29 04:47:45,986][0m Trial 9 finished with value: 0.7856000000000001 and parameters: {'lr': 0.007989696386332363, 'weight_decay': 0.0028303050095528715, 'dropout': 0.2692679020705077, 'patience': 50, 'lr_reduce_freq': 40, 'spt_alg': 'prim', 'spt_attr': 'edge_degree', 'manifold': 'PoincareBall', 'num_layers': 4, 'dim': 496, 'num_adj': 6, 'add_rate': 0.3310326839400124, 'tem': 0.8897651741986845, 'consis_rate': 0.4532777165334394, 'use_att': 0}. Best is trial 5 with value: 0.7956000000000001.[0m
[32m[I 2022-06-29 05:09:10,844][0m Trial 10 finished with value: 0.47590000000000005 and parameters: {'lr': 0.0964468416938722, 'weight_decay': 0.005257188202676169, 'dropout': 0.7964507571452928, 'patience': 70, 'lr_reduce_freq': 150, 'spt_alg': 'kruskal', 'spt_attr': 'similarity', 'manifold': 'Hyperboloid', 'num_layers': 3, 'dim': 512, 'num_adj': 2, 'add_rate': 0.153485185345188, 'tem': 0.509078760715136, 'consis_rate': 1.8781894831505968, 'use_att': 1}. Best is trial 5 with value: 0.7956000000000001.[0m
[32m[I 2022-06-29 05:13:00,225][0m Trial 11 finished with value: 0.7922 and parameters: {'lr': 0.0010970597427081609, 'weight_decay': 0.0006069477239097215, 'dropout': 0.11131877236378789, 'patience': 70, 'lr_reduce_freq': 70, 'spt_alg': 'kruskal', 'spt_attr': 'similarity', 'manifold': 'PoincareBall', 'num_layers': 3, 'dim': 272, 'num_adj': 2, 'add_rate': 0.5815735527525397, 'tem': 1.1298884484303011, 'consis_rate': 1.0446230782230705, 'use_att': 0}. Best is trial 5 with value: 0.7956000000000001.[0m
[32m[I 2022-06-29 05:38:56,434][0m Trial 12 finished with value: 0.3257 and parameters: {'lr': 0.09885152309262923, 'weight_decay': 0.003166932539198182, 'dropout': 0.37138620988195326, 'patience': 60, 'lr_reduce_freq': 130, 'spt_alg': 'kruskal', 'spt_attr': 'similarity', 'manifold': 'PoincareBall', 'num_layers': 5, 'dim': 272, 'num_adj': 4, 'add_rate': 0.16409825977909132, 'tem': 1.1068442141986319, 'consis_rate': 0.21013636033706673, 'use_att': 1}. Best is trial 5 with value: 0.7956000000000001.[0m
[32m[I 2022-06-29 05:42:09,293][0m Trial 13 finished with value: 0.8012 and parameters: {'lr': 0.01906213558902763, 'weight_decay': 0.0067745885957633265, 'dropout': 0.2040260060766555, 'patience': 60, 'lr_reduce_freq': 70, 'spt_alg': 'prim', 'spt_attr': 'similarity', 'manifold': 'PoincareBall', 'num_layers': 3, 'dim': 448, 'num_adj': 2, 'add_rate': 0.4833697981101299, 'tem': 1.1118329215197065, 'consis_rate': 0.792679169255551, 'use_att': 0}. Best is trial 13 with value: 0.8012.[0m
[32m[I 2022-06-29 05:44:51,420][0m Trial 14 finished with value: 0.8004 and parameters: {'lr': 0.03134133323321522, 'weight_decay': 0.0061977866581266125, 'dropout': 0.33437614139726785, 'patience': 60, 'lr_reduce_freq': 70, 'spt_alg': 'prim', 'spt_attr': 'similarity', 'manifold': 'PoincareBall', 'num_layers': 3, 'dim': 448, 'num_adj': 2, 'add_rate': 0.4974590117172492, 'tem': 1.176120071159254, 'consis_rate': 0.8300264994101778, 'use_att': 0}. Best is trial 13 with value: 0.8012.[0m
[32m[I 2022-06-29 05:48:09,654][0m Trial 15 finished with value: 0.7062 and parameters: {'lr': 0.020161579948237206, 'weight_decay': 0.007554105609981979, 'dropout': 0.5158650364999962, 'patience': 60, 'lr_reduce_freq': 70, 'spt_alg': 'prim', 'spt_attr': 'similarity', 'manifold': 'PoincareBall', 'num_layers': 3, 'dim': 464, 'num_adj': 2, 'add_rate': 0.4671003022074729, 'tem': 1.2352063247128449, 'consis_rate': 1.2775916783205845, 'use_att': 0}. Best is trial 13 with value: 0.8012.[0m
[32m[I 2022-06-29 05:50:41,033][0m Trial 16 finished with value: 0.7985 and parameters: {'lr': 0.03915761101170662, 'weight_decay': 0.002060622225974449, 'dropout': 0.37521568698035557, 'patience': 70, 'lr_reduce_freq': 70, 'spt_alg': 'prim', 'spt_attr': 'similarity', 'manifold': 'PoincareBall', 'num_layers': 3, 'dim': 464, 'num_adj': 2, 'add_rate': 0.510236893093097, 'tem': 1.191812139971946, 'consis_rate': 1.446322991424465, 'use_att': 0}. Best is trial 13 with value: 0.8012.[0m
cmd: --dataset cora --model HGCN --c 1
cur_param: {'lr': 0.003490808760693802, 'weight_decay': 0.000977275176796664, 'dropout': 0.6898805622874887, 'patience': 50, 'lr_reduce_freq': 40, 'spt_alg': 'prim', 'spt_attr': 'edge_degree', 'manifold': 'PoincareBall', 'num_layers': 4, 'dim': 416, 'num_adj': 6, 'add_rate': 0.6133837002615918, 'tem': 1.3959622545284067, 'consis_rate': 0.7566642419935188, 'use_att': 1}
mean: 0.7859999999999999
[0.814 0.735 0.785 0.777 0.789 0.798 0.773 0.782 0.802 0.805]
cur_param: {'lr': 0.0018723267364603613, 'weight_decay': 0.015470879201877044, 'dropout': 0.2414548549482421, 'patience': 90, 'lr_reduce_freq': 40, 'spt_alg': 'kruskal', 'spt_attr': 'edge_degree', 'manifold': 'Hyperboloid', 'num_layers': 5, 'dim': 400, 'num_adj': 4, 'add_rate': 0.8546661777013593, 'tem': 0.928959997213674, 'consis_rate': 0.6058403916880665, 'use_att': 1}
mean: 0.2259
[0.319 0.319 0.319 0.149 0.159 0.319 0.137 0.15  0.149 0.239]
cur_param: {'lr': 0.03566522312913775, 'weight_decay': 0.011758619994744389, 'dropout': 0.2941428132068351, 'patience': 100, 'lr_reduce_freq': 50, 'spt_alg': 'kruskal', 'spt_attr': 'edge_degree', 'manifold': 'PoincareBall', 'num_layers': 4, 'dim': 400, 'num_adj': 4, 'add_rate': 0.7733405310496981, 'tem': 0.7667402531059061, 'consis_rate': 0.3315787117628821, 'use_att': 0}
mean: 0.30569999999999997
[0.289 0.272 0.319 0.27  0.318 0.319 0.317 0.319 0.315 0.319]
cur_param: {'lr': 0.02410455868687655, 'weight_decay': 0.041077462297876066, 'dropout': 0.4153954989925117, 'patience': 80, 'lr_reduce_freq': 50, 'spt_alg': 'prim', 'spt_attr': 'edge_degree', 'manifold': 'PoincareBall', 'num_layers': 3, 'dim': 208, 'num_adj': 4, 'add_rate': 0.28805128515063194, 'tem': 0.7325880274356041, 'consis_rate': 0.599651206037251, 'use_att': 0}
mean: 0.31839999999999996
[0.317 0.319 0.319 0.317 0.319 0.318 0.319 0.319 0.319 0.318]
cur_param: {'lr': 0.004436008130628258, 'weight_decay': 0.0013506949974207631, 'dropout': 0.16873144257874564, 'patience': 50, 'lr_reduce_freq': 100, 'spt_alg': 'kruskal', 'spt_attr': 'similarity', 'manifold': 'Hyperboloid', 'num_layers': 4, 'dim': 320, 'num_adj': 2, 'add_rate': 0.6824940651364797, 'tem': 0.7812291066382064, 'consis_rate': 1.0142108129764702, 'use_att': 1}
mean: 0.7691000000000001
[0.788 0.779 0.714 0.788 0.8   0.776 0.734 0.784 0.761 0.767]
cur_param: {'lr': 0.08657794792710559, 'weight_decay': 0.004128860902717535, 'dropout': 0.29916249474374573, 'patience': 60, 'lr_reduce_freq': 30, 'spt_alg': 'kruskal', 'spt_attr': 'similarity', 'manifold': 'PoincareBall', 'num_layers': 3, 'dim': 432, 'num_adj': 2, 'add_rate': 0.6177352681744387, 'tem': 1.0028064456029142, 'consis_rate': 0.9114998549985398, 'use_att': 1}
mean: 0.7956000000000001
[0.787 0.807 0.804 0.773 0.804 0.802 0.778 0.809 0.8   0.792]
cur_param: {'lr': 0.00921246845604206, 'weight_decay': 0.04578813984616352, 'dropout': 0.4763313720630048, 'patience': 90, 'lr_reduce_freq': 110, 'spt_alg': 'prim', 'spt_attr': 'similarity', 'manifold': 'Hyperboloid', 'num_layers': 4, 'dim': 144, 'num_adj': 2, 'add_rate': 0.38554561408198873, 'tem': 0.7966031437685167, 'consis_rate': 1.4512007874001662, 'use_att': 1}
mean: 0.319
[0.319 0.319 0.319 0.319 0.319 0.319 0.319 0.319 0.319 0.319]
cur_param: {'lr': 0.000721461475059426, 'weight_decay': 0.021954001778128257, 'dropout': 0.5705658830317257, 'patience': 100, 'lr_reduce_freq': 90, 'spt_alg': 'prim', 'spt_attr': 'edge_degree', 'manifold': 'PoincareBall', 'num_layers': 5, 'dim': 368, 'num_adj': 6, 'add_rate': 0.47482447069202594, 'tem': 1.358609609462174, 'consis_rate': 1.1682182958901366, 'use_att': 0}
mean: 0.20390000000000003
[0.128 0.158 0.319 0.159 0.307 0.158 0.123 0.2   0.328 0.159]
cur_param: {'lr': 0.003679484089670646, 'weight_decay': 0.0008112604478631027, 'dropout': 0.19930372426670703, 'patience': 100, 'lr_reduce_freq': 90, 'spt_alg': 'prim', 'spt_attr': 'edge_degree', 'manifold': 'PoincareBall', 'num_layers': 5, 'dim': 320, 'num_adj': 4, 'add_rate': 0.3171855999168843, 'tem': 0.8427459650027362, 'consis_rate': 0.5397406220220428, 'use_att': 0}
mean: 0.7944
[0.786 0.791 0.807 0.804 0.8   0.803 0.782 0.796 0.782 0.793]
cur_param: {'lr': 0.007989696386332363, 'weight_decay': 0.0028303050095528715, 'dropout': 0.2692679020705077, 'patience': 50, 'lr_reduce_freq': 40, 'spt_alg': 'prim', 'spt_attr': 'edge_degree', 'manifold': 'PoincareBall', 'num_layers': 4, 'dim': 496, 'num_adj': 6, 'add_rate': 0.3310326839400124, 'tem': 0.8897651741986845, 'consis_rate': 0.4532777165334394, 'use_att': 0}
mean: 0.7856000000000001
[0.792 0.774 0.78  0.799 0.769 0.79  0.803 0.772 0.796 0.781]
cur_param: {'lr': 0.0964468416938722, 'weight_decay': 0.005257188202676169, 'dropout': 0.7964507571452928, 'patience': 70, 'lr_reduce_freq': 150, 'spt_alg': 'kruskal', 'spt_attr': 'similarity', 'manifold': 'Hyperboloid', 'num_layers': 3, 'dim': 512, 'num_adj': 2, 'add_rate': 0.153485185345188, 'tem': 0.509078760715136, 'consis_rate': 1.8781894831505968, 'use_att': 1}
mean: 0.47590000000000005
[0.441 0.449 0.586 0.319 0.424 0.481 0.663 0.498 0.474 0.424]
cur_param: {'lr': 0.0010970597427081609, 'weight_decay': 0.0006069477239097215, 'dropout': 0.11131877236378789, 'patience': 70, 'lr_reduce_freq': 70, 'spt_alg': 'kruskal', 'spt_attr': 'similarity', 'manifold': 'PoincareBall', 'num_layers': 3, 'dim': 272, 'num_adj': 2, 'add_rate': 0.5815735527525397, 'tem': 1.1298884484303011, 'consis_rate': 1.0446230782230705, 'use_att': 0}
mean: 0.7922
[0.801 0.786 0.792 0.796 0.788 0.787 0.794 0.795 0.792 0.791]
cur_param: {'lr': 0.09885152309262923, 'weight_decay': 0.003166932539198182, 'dropout': 0.37138620988195326, 'patience': 60, 'lr_reduce_freq': 130, 'spt_alg': 'kruskal', 'spt_attr': 'similarity', 'manifold': 'PoincareBall', 'num_layers': 5, 'dim': 272, 'num_adj': 4, 'add_rate': 0.16409825977909132, 'tem': 1.1068442141986319, 'consis_rate': 0.21013636033706673, 'use_att': 1}
mean: 0.3257
[0.319 0.319 0.319 0.319 0.387 0.319 0.319 0.318 0.319 0.319]
cur_param: {'lr': 0.01906213558902763, 'weight_decay': 0.0067745885957633265, 'dropout': 0.2040260060766555, 'patience': 60, 'lr_reduce_freq': 70, 'spt_alg': 'prim', 'spt_attr': 'similarity', 'manifold': 'PoincareBall', 'num_layers': 3, 'dim': 448, 'num_adj': 2, 'add_rate': 0.4833697981101299, 'tem': 1.1118329215197065, 'consis_rate': 0.792679169255551, 'use_att': 0}
mean: 0.8012
[0.797 0.807 0.807 0.793 0.807 0.79  0.804 0.808 0.804 0.795]
cur_param: {'lr': 0.03134133323321522, 'weight_decay': 0.0061977866581266125, 'dropout': 0.33437614139726785, 'patience': 60, 'lr_reduce_freq': 70, 'spt_alg': 'prim', 'spt_attr': 'similarity', 'manifold': 'PoincareBall', 'num_layers': 3, 'dim': 448, 'num_adj': 2, 'add_rate': 0.4974590117172492, 'tem': 1.176120071159254, 'consis_rate': 0.8300264994101778, 'use_att': 0}
mean: 0.8004
[0.8   0.808 0.81  0.787 0.801 0.808 0.8   0.798 0.807 0.785]
cur_param: {'lr': 0.020161579948237206, 'weight_decay': 0.007554105609981979, 'dropout': 0.5158650364999962, 'patience': 60, 'lr_reduce_freq': 70, 'spt_alg': 'prim', 'spt_attr': 'similarity', 'manifold': 'PoincareBall', 'num_layers': 3, 'dim': 464, 'num_adj': 2, 'add_rate': 0.4671003022074729, 'tem': 1.2352063247128449, 'consis_rate': 1.2775916783205845, 'use_att': 0}
mean: 0.7062
[0.804 0.802 0.829 0.803 0.797 0.319 0.789 0.792 0.813 0.314]
cur_param: {'lr': 0.03915761101170662, 'weight_decay': 0.002060622225974449, 'dropout': 0.37521568698035557, 'patience': 70, 'lr_reduce_freq': 70, 'spt_alg': 'prim', 'spt_attr': 'similarity', 'manifold': 'PoincareBall', 'num_layers': 3, 'dim': 464, 'num_adj': 2, 'add_rate': 0.510236893093097, 'tem': 1.191812139971946, 'consis_rate': 1.446322991424465, 'use_att': 0}
mean: 0.7985
[0.787 0.798 0.809 0.764 0.803 0.821 0.811 0.799 0.793 0.8  ]
cur_param: {'lr': 0.014057261674790942, 'weight_decay': 0.008151784453624175, 'dropout': 0.10710409383581652, 'patience': 60, 'lr_reduce_freq': 80, 'spt_alg': 'prim', 'spt_attr': 'similarity', 'manifold': 'PoincareBall', 'num_layers': 3, 'dim': 368, 'num_adj': 2, 'add_rate': 0.720827558565234, 'tem': 1.4931873197309602, 'consis_rate': 0.8269815011807593, 'use_att': 0}
mean: 0.7471
[0.786 0.317 0.807 0.795 0.798 0.8   0.797 0.789 0.803 0.779][32m[I 2022-06-29 05:53:39,802][0m Trial 17 finished with value: 0.7471 and parameters: {'lr': 0.014057261674790942, 'weight_decay': 0.008151784453624175, 'dropout': 0.10710409383581652, 'patience': 60, 'lr_reduce_freq': 80, 'spt_alg': 'prim', 'spt_attr': 'similarity', 'manifold': 'PoincareBall', 'num_layers': 3, 'dim': 368, 'num_adj': 2, 'add_rate': 0.720827558565234, 'tem': 1.4931873197309602, 'consis_rate': 0.8269815011807593, 'use_att': 0}. Best is trial 13 with value: 0.8012.[0m
[32m[I 2022-06-29 05:59:16,154][0m Trial 18 finished with value: 0.3297 and parameters: {'lr': 0.04724985338468786, 'weight_decay': 0.023101032662513978, 'dropout': 0.586567320975246, 'patience': 80, 'lr_reduce_freq': 110, 'spt_alg': 'prim', 'spt_attr': 'similarity', 'manifold': 'Hyperboloid', 'num_layers': 3, 'dim': 464, 'num_adj': 4, 'add_rate': 0.39871403313549003, 'tem': 1.0355489604199746, 'consis_rate': 1.7612840090357447, 'use_att': 0}. Best is trial 13 with value: 0.8012.[0m
[32m[I 2022-06-29 06:02:56,657][0m Trial 19 finished with value: 0.7480000000000001 and parameters: {'lr': 0.014608847022189798, 'weight_decay': 0.006547427592617508, 'dropout': 0.3665362104408134, 'patience': 60, 'lr_reduce_freq': 60, 'spt_alg': 'prim', 'spt_attr': 'similarity', 'manifold': 'PoincareBall', 'num_layers': 3, 'dim': 336, 'num_adj': 2, 'add_rate': 0.5427049676407295, 'tem': 1.2856690186520316, 'consis_rate': 0.7121488684701464, 'use_att': 0}. Best is trial 13 with value: 0.8012.[0m
[32m[I 2022-06-29 06:04:50,366][0m Trial 20 finished with value: 0.7914000000000001 and parameters: {'lr': 0.05410996480256803, 'weight_decay': 0.0018397232789403356, 'dropout': 0.19257626574644854, 'patience': 50, 'lr_reduce_freq': 80, 'spt_alg': 'prim', 'spt_attr': 'similarity', 'manifold': 'PoincareBall', 'num_layers': 3, 'dim': 512, 'num_adj': 2, 'add_rate': 0.21988817313774284, 'tem': 0.6595955587058309, 'consis_rate': 1.2849296294092096, 'use_att': 0}. Best is trial 13 with value: 0.8012.[0m
[32m[I 2022-06-29 06:07:10,297][0m Trial 21 finished with value: 0.8018000000000001 and parameters: {'lr': 0.029522631459747112, 'weight_decay': 0.002191214024256502, 'dropout': 0.333763806330079, 'patience': 70, 'lr_reduce_freq': 70, 'spt_alg': 'prim', 'spt_attr': 'similarity', 'manifold': 'PoincareBall', 'num_layers': 3, 'dim': 448, 'num_adj': 2, 'add_rate': 0.49041769070930613, 'tem': 1.1731544697782499, 'consis_rate': 1.4721826526627702, 'use_att': 0}. Best is trial 21 with value: 0.8018000000000001.[0m
[32m[I 2022-06-29 06:09:54,081][0m Trial 22 finished with value: 0.8007000000000002 and parameters: {'lr': 0.024525587424410487, 'weight_decay': 0.003270084212195515, 'dropout': 0.28854492550612937, 'patience': 70, 'lr_reduce_freq': 60, 'spt_alg': 'prim', 'spt_attr': 'similarity', 'manifold': 'PoincareBall', 'num_layers': 3, 'dim': 448, 'num_adj': 2, 'add_rate': 0.4282356661073264, 'tem': 1.0951757483881681, 'consis_rate': 1.6154770196763009, 'use_att': 0}. Best is trial 21 with value: 0.8018000000000001.[0m
[32m[I 2022-06-29 06:12:37,141][0m Trial 23 finished with value: 0.7992 and parameters: {'lr': 0.018523466841131386, 'weight_decay': 0.0030609125225215346, 'dropout': 0.23157144960451503, 'patience': 70, 'lr_reduce_freq': 60, 'spt_alg': 'prim', 'spt_attr': 'similarity', 'manifold': 'PoincareBall', 'num_layers': 3, 'dim': 368, 'num_adj': 2, 'add_rate': 0.4202841978584316, 'tem': 1.072360486186834, 'consis_rate': 1.5154971781538673, 'use_att': 0}. Best is trial 21 with value: 0.8018000000000001.[0m
[32m[I 2022-06-29 06:16:44,301][0m Trial 24 finished with value: 0.8055999999999999 and parameters: {'lr': 0.011745337306338265, 'weight_decay': 0.0020286617443314014, 'dropout': 0.4236772422366285, 'patience': 80, 'lr_reduce_freq': 60, 'spt_alg': 'prim', 'spt_attr': 'similarity', 'manifold': 'PoincareBall', 'num_layers': 3, 'dim': 480, 'num_adj': 4, 'add_rate': 0.4267938770943062, 'tem': 1.2757401366913625, 'consis_rate': 1.6893589511421232, 'use_att': 0}. Best is trial 24 with value: 0.8055999999999999.[0m
[32m[I 2022-06-29 06:20:29,720][0m Trial 25 finished with value: 0.8061999999999999 and parameters: {'lr': 0.010132853093611578, 'weight_decay': 0.0017774707106525108, 'dropout': 0.43458767865470627, 'patience': 80, 'lr_reduce_freq': 80, 'spt_alg': 'prim', 'spt_attr': 'similarity', 'manifold': 'PoincareBall', 'num_layers': 3, 'dim': 480, 'num_adj': 4, 'add_rate': 0.24720323129703897, 'tem': 1.3055729554651765, 'consis_rate': 1.9964966362766914, 'use_att': 0}. Best is trial 25 with value: 0.8061999999999999.[0m
