nohup: ignoring input
[32m[I 2022-06-20 20:52:38,689][0m A new study created in memory with name: no-name-580d892f-e52e-42d0-9932-015e56d9e8e2[0m
[32m[I 2022-06-20 20:56:57,890][0m Trial 0 finished with value: 0.3187 and parameters: {'lr': 0.007846648364404546, 'weight_decay': 0.19651565326214313, 'dropout': 0.830805027923722, 'patience': 60, 'lr_reduce_freq': 150, 'spt_alg': 'kruskal', 'spt_attr': 'similarity', 'manifold': 'PoincareBall', 'num_layers': 3, 'num_adj': 4, 'add_rate': 0.33540883065961136, 'tem': 0.4570970392450733, 'consis_rate': 1.061601938334349, 'use_att': 0}. Best is trial 0 with value: 0.3187.[0m
[32m[I 2022-06-20 21:53:35,250][0m Trial 1 finished with value: 0.285 and parameters: {'lr': 0.028425993953517203, 'weight_decay': 0.15121294872060487, 'dropout': 0.7382482027991899, 'patience': 100, 'lr_reduce_freq': 90, 'spt_alg': 'prim', 'spt_attr': 'edge_degree', 'manifold': 'PoincareBall', 'num_layers': 4, 'num_adj': 6, 'add_rate': 0.7635930130575678, 'tem': 1.8753592619707533, 'consis_rate': 0.5106272604022901, 'use_att': 1}. Best is trial 0 with value: 0.3187.[0m
[32m[I 2022-06-20 22:36:11,087][0m Trial 2 finished with value: 0.7976 and parameters: {'lr': 0.03383564751942889, 'weight_decay': 0.0006783362543105625, 'dropout': 0.6558140567714987, 'patience': 100, 'lr_reduce_freq': 150, 'spt_alg': 'prim', 'spt_attr': 'similarity', 'manifold': 'PoincareBall', 'num_layers': 3, 'num_adj': 6, 'add_rate': 0.9117303755493521, 'tem': 0.8863703347632377, 'consis_rate': 0.7613482912771123, 'use_att': 1}. Best is trial 2 with value: 0.7976.[0m
[32m[I 2022-06-20 23:46:03,521][0m Trial 3 finished with value: 0.30219999999999997 and parameters: {'lr': 0.0024566501279686083, 'weight_decay': 0.04483121105887152, 'dropout': 0.15654975106662664, 'patience': 80, 'lr_reduce_freq': 70, 'spt_alg': 'kruskal', 'spt_attr': 'similarity', 'manifold': 'PoincareBall', 'num_layers': 5, 'num_adj': 8, 'add_rate': 0.25132694818894874, 'tem': 0.5112087054227547, 'consis_rate': 1.858255462204401, 'use_att': 1}. Best is trial 2 with value: 0.7976.[0m
[32m[I 2022-06-21 00:01:25,535][0m Trial 4 finished with value: 0.3 and parameters: {'lr': 0.008344216664226072, 'weight_decay': 0.1998130569497212, 'dropout': 0.7116635310049405, 'patience': 100, 'lr_reduce_freq': 150, 'spt_alg': 'kruskal', 'spt_attr': 'similarity', 'manifold': 'PoincareBall', 'num_layers': 3, 'num_adj': 2, 'add_rate': 0.10651277581018913, 'tem': 0.7714245861315301, 'consis_rate': 0.3613512225327691, 'use_att': 1}. Best is trial 2 with value: 0.7976.[0m
[32m[I 2022-06-21 00:05:48,882][0m Trial 5 finished with value: 0.2835 and parameters: {'lr': 0.07933234695574191, 'weight_decay': 0.029151646250790662, 'dropout': 0.3063486468175092, 'patience': 100, 'lr_reduce_freq': 110, 'spt_alg': 'prim', 'spt_attr': 'edge_degree', 'manifold': 'PoincareBall', 'num_layers': 5, 'num_adj': 2, 'add_rate': 0.6376696428516793, 'tem': 0.6809167578049058, 'consis_rate': 0.2731341709440159, 'use_att': 0}. Best is trial 2 with value: 0.7976.[0m
[32m[I 2022-06-21 01:49:03,819][0m Trial 6 finished with value: 0.793 and parameters: {'lr': 0.020218929665855465, 'weight_decay': 0.0008540437660324911, 'dropout': 0.5655825840381473, 'patience': 60, 'lr_reduce_freq': 130, 'spt_alg': 'kruskal', 'spt_attr': 'similarity', 'manifold': 'PoincareBall', 'num_layers': 5, 'num_adj': 8, 'add_rate': 0.8435783251561544, 'tem': 0.23933793556318525, 'consis_rate': 1.0770165340225275, 'use_att': 1}. Best is trial 2 with value: 0.7976.[0m
[32m[I 2022-06-21 01:53:08,055][0m Trial 7 finished with value: 0.3089 and parameters: {'lr': 0.062175958553809536, 'weight_decay': 0.00960746439224656, 'dropout': 0.7444200201658313, 'patience': 80, 'lr_reduce_freq': 70, 'spt_alg': 'prim', 'spt_attr': 'edge_degree', 'manifold': 'PoincareBall', 'num_layers': 5, 'num_adj': 2, 'add_rate': 0.8830839510718269, 'tem': 0.5158631874636059, 'consis_rate': 0.4038358959438897, 'use_att': 0}. Best is trial 2 with value: 0.7976.[0m
[32m[I 2022-06-21 01:58:30,125][0m Trial 8 finished with value: 0.3156 and parameters: {'lr': 0.012196426128110244, 'weight_decay': 0.014690350607702364, 'dropout': 0.48623990285906277, 'patience': 60, 'lr_reduce_freq': 110, 'spt_alg': 'prim', 'spt_attr': 'edge_degree', 'manifold': 'PoincareBall', 'num_layers': 4, 'num_adj': 4, 'add_rate': 0.42767912555703835, 'tem': 1.0420558083033151, 'consis_rate': 0.3510611423183442, 'use_att': 0}. Best is trial 2 with value: 0.7976.[0m
[32m[I 2022-06-21 02:47:31,925][0m Trial 9 finished with value: 0.8082 and parameters: {'lr': 0.0024005376066545394, 'weight_decay': 0.0010717616722218518, 'dropout': 0.011136013508027908, 'patience': 100, 'lr_reduce_freq': 70, 'spt_alg': 'prim', 'spt_attr': 'edge_degree', 'manifold': 'PoincareBall', 'num_layers': 3, 'num_adj': 6, 'add_rate': 0.5968015566394057, 'tem': 1.9652661226017352, 'consis_rate': 0.6124450865630953, 'use_att': 1}. Best is trial 9 with value: 0.8082.[0m
[32m[I 2022-06-21 03:57:19,327][0m Trial 10 finished with value: 0.8011000000000001 and parameters: {'lr': 0.0010346658060714467, 'weight_decay': 0.003141579984471262, 'dropout': 0.0037649677160950705, 'patience': 80, 'lr_reduce_freq': 50, 'spt_alg': 'prim', 'spt_attr': 'edge_degree', 'manifold': 'PoincareBall', 'num_layers': 3, 'num_adj': 6, 'add_rate': 0.5751594001918595, 'tem': 1.9932266991550587, 'consis_rate': 1.6028602374212504, 'use_att': 1}. Best is trial 9 with value: 0.8082.[0m
[32m[I 2022-06-21 05:04:02,348][0m Trial 11 finished with value: 0.8035 and parameters: {'lr': 0.0010027984879295436, 'weight_decay': 0.0026319646464295944, 'dropout': 0.040263330450863104, 'patience': 80, 'lr_reduce_freq': 50, 'spt_alg': 'prim', 'spt_attr': 'edge_degree', 'manifold': 'PoincareBall', 'num_layers': 3, 'num_adj': 6, 'add_rate': 0.5876406039970796, 'tem': 1.9708575305257976, 'consis_rate': 1.713308278294158, 'use_att': 1}. Best is trial 9 with value: 0.8082.[0m
[32m[I 2022-06-21 06:11:42,559][0m Trial 12 finished with value: 0.807 and parameters: {'lr': 0.0011838183334140367, 'weight_decay': 0.002869889993146683, 'dropout': 0.026275691360061457, 'patience': 80, 'lr_reduce_freq': 50, 'spt_alg': 'prim', 'spt_attr': 'edge_degree', 'manifold': 'PoincareBall', 'num_layers': 3, 'num_adj': 6, 'add_rate': 0.6708521245912817, 'tem': 1.5665993465032322, 'consis_rate': 1.459108608795856, 'use_att': 1}. Best is trial 9 with value: 0.8082.[0m
[32m[I 2022-06-21 07:10:33,933][0m Trial 13 finished with value: 0.8096 and parameters: {'lr': 0.0027048843333733245, 'weight_decay': 0.0023602734013827517, 'dropout': 0.28208794096006784, 'patience': 80, 'lr_reduce_freq': 70, 'spt_alg': 'prim', 'spt_attr': 'edge_degree', 'manifold': 'PoincareBall', 'num_layers': 3, 'num_adj': 8, 'add_rate': 0.7194158023888202, 'tem': 1.5158943368850402, 'consis_rate': 1.38552444266842, 'use_att': 1}. Best is trial 13 with value: 0.8096.[0m
[32m[I 2022-06-21 08:18:33,235][0m Trial 14 finished with value: 0.8088000000000001 and parameters: {'lr': 0.003394368273865746, 'weight_decay': 0.0012139570466729078, 'dropout': 0.2877688230249153, 'patience': 100, 'lr_reduce_freq': 90, 'spt_alg': 'prim', 'spt_attr': 'edge_degree', 'manifold': 'PoincareBall', 'num_layers': 3, 'num_adj': 8, 'add_rate': 0.7428294057717494, 'tem': 1.4561143185858065, 'consis_rate': 1.3442525612662624, 'use_att': 1}. Best is trial 13 with value: 0.8096.[0m
[32m[I 2022-06-21 09:29:32,940][0m Trial 15 finished with value: 0.7983 and parameters: {'lr': 0.004101974344492416, 'weight_decay': 0.005995702141723879, 'dropout': 0.32235601899988964, 'patience': 80, 'lr_reduce_freq': 90, 'spt_alg': 'prim', 'spt_attr': 'edge_degree', 'manifold': 'PoincareBall', 'num_layers': 3, 'num_adj': 8, 'add_rate': 0.7470665756367519, 'tem': 1.3753770987011822, 'consis_rate': 1.3494262805196677, 'use_att': 1}. Best is trial 13 with value: 0.8096.[0m
[32m[I 2022-06-21 10:42:55,466][0m Trial 16 finished with value: 0.7942 and parameters: {'lr': 0.004474817806840457, 'weight_decay': 0.0015862437891665056, 'dropout': 0.3125042940012832, 'patience': 100, 'lr_reduce_freq': 90, 'spt_alg': 'prim', 'spt_attr': 'edge_degree', 'manifold': 'PoincareBall', 'num_layers': 4, 'num_adj': 8, 'add_rate': 0.4530365916184869, 'tem': 1.3888441664906026, 'consis_rate': 1.2846968260095235, 'use_att': 1}. Best is trial 13 with value: 0.8096.[0m
[32m[I 2022-06-21 11:47:24,820][0m Trial 17 finished with value: 0.7946000000000001 and parameters: {'lr': 0.0022675600741079156, 'weight_decay': 0.006419322041386775, 'dropout': 0.1992166313095714, 'patience': 60, 'lr_reduce_freq': 70, 'spt_alg': 'prim', 'spt_attr': 'edge_degree', 'manifold': 'PoincareBall', 'num_layers': 3, 'num_adj': 8, 'add_rate': 0.7190940638761073, 'tem': 1.6398884118908832, 'consis_rate': 0.8901839494564318, 'use_att': 1}. Best is trial 13 with value: 0.8096.[0m
cmd: --dataset cora --model HGCN --c None --dim 256
cur_param: {'lr': 0.007846648364404546, 'weight_decay': 0.19651565326214313, 'dropout': 0.830805027923722, 'patience': 60, 'lr_reduce_freq': 150, 'spt_alg': 'kruskal', 'spt_attr': 'similarity', 'manifold': 'PoincareBall', 'num_layers': 3, 'num_adj': 4, 'add_rate': 0.33540883065961136, 'tem': 0.4570970392450733, 'consis_rate': 1.061601938334349, 'use_att': 0}
mean: 0.3187
[0.319 0.318 0.319 0.319 0.319 0.317 0.319 0.319 0.319 0.319]
cur_param: {'lr': 0.028425993953517203, 'weight_decay': 0.15121294872060487, 'dropout': 0.7382482027991899, 'patience': 100, 'lr_reduce_freq': 90, 'spt_alg': 'prim', 'spt_attr': 'edge_degree', 'manifold': 'PoincareBall', 'num_layers': 4, 'num_adj': 6, 'add_rate': 0.7635930130575678, 'tem': 1.8753592619707533, 'consis_rate': 0.5106272604022901, 'use_att': 1}
mean: 0.285
[0.319 0.149 0.319 0.319 0.319 0.319 0.319 0.149 0.319 0.319]
cur_param: {'lr': 0.03383564751942889, 'weight_decay': 0.0006783362543105625, 'dropout': 0.6558140567714987, 'patience': 100, 'lr_reduce_freq': 150, 'spt_alg': 'prim', 'spt_attr': 'similarity', 'manifold': 'PoincareBall', 'num_layers': 3, 'num_adj': 6, 'add_rate': 0.9117303755493521, 'tem': 0.8863703347632377, 'consis_rate': 0.7613482912771123, 'use_att': 1}
mean: 0.7976
[0.819 0.8   0.777 0.81  0.766 0.807 0.819 0.813 0.781 0.784]
cur_param: {'lr': 0.0024566501279686083, 'weight_decay': 0.04483121105887152, 'dropout': 0.15654975106662664, 'patience': 80, 'lr_reduce_freq': 70, 'spt_alg': 'kruskal', 'spt_attr': 'similarity', 'manifold': 'PoincareBall', 'num_layers': 5, 'num_adj': 8, 'add_rate': 0.25132694818894874, 'tem': 0.5112087054227547, 'consis_rate': 1.858255462204401, 'use_att': 1}
mean: 0.30219999999999997
[0.319 0.319 0.319 0.149 0.319 0.319 0.319 0.319 0.319 0.321]
cur_param: {'lr': 0.008344216664226072, 'weight_decay': 0.1998130569497212, 'dropout': 0.7116635310049405, 'patience': 100, 'lr_reduce_freq': 150, 'spt_alg': 'kruskal', 'spt_attr': 'similarity', 'manifold': 'PoincareBall', 'num_layers': 3, 'num_adj': 2, 'add_rate': 0.10651277581018913, 'tem': 0.7714245861315301, 'consis_rate': 0.3613512225327691, 'use_att': 1}
mean: 0.3
[0.319 0.149 0.319 0.319 0.32  0.319 0.319 0.298 0.319 0.319]
cur_param: {'lr': 0.07933234695574191, 'weight_decay': 0.029151646250790662, 'dropout': 0.3063486468175092, 'patience': 100, 'lr_reduce_freq': 110, 'spt_alg': 'prim', 'spt_attr': 'edge_degree', 'manifold': 'PoincareBall', 'num_layers': 5, 'num_adj': 2, 'add_rate': 0.6376696428516793, 'tem': 0.6809167578049058, 'consis_rate': 0.2731341709440159, 'use_att': 0}
mean: 0.2835
[0.237 0.227 0.319 0.319 0.273 0.317 0.312 0.193 0.319 0.319]
cur_param: {'lr': 0.020218929665855465, 'weight_decay': 0.0008540437660324911, 'dropout': 0.5655825840381473, 'patience': 60, 'lr_reduce_freq': 130, 'spt_alg': 'kruskal', 'spt_attr': 'similarity', 'manifold': 'PoincareBall', 'num_layers': 5, 'num_adj': 8, 'add_rate': 0.8435783251561544, 'tem': 0.23933793556318525, 'consis_rate': 1.0770165340225275, 'use_att': 1}
mean: 0.793
[0.786 0.804 0.771 0.803 0.804 0.797 0.785 0.794 0.806 0.78 ]
cur_param: {'lr': 0.062175958553809536, 'weight_decay': 0.00960746439224656, 'dropout': 0.7444200201658313, 'patience': 80, 'lr_reduce_freq': 70, 'spt_alg': 'prim', 'spt_attr': 'edge_degree', 'manifold': 'PoincareBall', 'num_layers': 5, 'num_adj': 2, 'add_rate': 0.8830839510718269, 'tem': 0.5158631874636059, 'consis_rate': 0.4038358959438897, 'use_att': 0}
mean: 0.3089
[0.318 0.319 0.319 0.319 0.224 0.314 0.319 0.319 0.319 0.319]
cur_param: {'lr': 0.012196426128110244, 'weight_decay': 0.014690350607702364, 'dropout': 0.48623990285906277, 'patience': 60, 'lr_reduce_freq': 110, 'spt_alg': 'prim', 'spt_attr': 'edge_degree', 'manifold': 'PoincareBall', 'num_layers': 4, 'num_adj': 4, 'add_rate': 0.42767912555703835, 'tem': 1.0420558083033151, 'consis_rate': 0.3510611423183442, 'use_att': 0}
mean: 0.3156
[0.317 0.307 0.317 0.319 0.317 0.305 0.317 0.319 0.319 0.319]
cur_param: {'lr': 0.0024005376066545394, 'weight_decay': 0.0010717616722218518, 'dropout': 0.011136013508027908, 'patience': 100, 'lr_reduce_freq': 70, 'spt_alg': 'prim', 'spt_attr': 'edge_degree', 'manifold': 'PoincareBall', 'num_layers': 3, 'num_adj': 6, 'add_rate': 0.5968015566394057, 'tem': 1.9652661226017352, 'consis_rate': 0.6124450865630953, 'use_att': 1}
mean: 0.8082
[0.806 0.809 0.81  0.798 0.816 0.813 0.803 0.81  0.807 0.81 ]
cur_param: {'lr': 0.0010346658060714467, 'weight_decay': 0.003141579984471262, 'dropout': 0.0037649677160950705, 'patience': 80, 'lr_reduce_freq': 50, 'spt_alg': 'prim', 'spt_attr': 'edge_degree', 'manifold': 'PoincareBall', 'num_layers': 3, 'num_adj': 6, 'add_rate': 0.5751594001918595, 'tem': 1.9932266991550587, 'consis_rate': 1.6028602374212504, 'use_att': 1}
mean: 0.8011000000000001
[0.798 0.805 0.794 0.791 0.803 0.805 0.805 0.807 0.802 0.801]
cur_param: {'lr': 0.0010027984879295436, 'weight_decay': 0.0026319646464295944, 'dropout': 0.040263330450863104, 'patience': 80, 'lr_reduce_freq': 50, 'spt_alg': 'prim', 'spt_attr': 'edge_degree', 'manifold': 'PoincareBall', 'num_layers': 3, 'num_adj': 6, 'add_rate': 0.5876406039970796, 'tem': 1.9708575305257976, 'consis_rate': 1.713308278294158, 'use_att': 1}
mean: 0.8035
[0.798 0.8   0.802 0.794 0.807 0.798 0.812 0.811 0.808 0.805]
cur_param: {'lr': 0.0011838183334140367, 'weight_decay': 0.002869889993146683, 'dropout': 0.026275691360061457, 'patience': 80, 'lr_reduce_freq': 50, 'spt_alg': 'prim', 'spt_attr': 'edge_degree', 'manifold': 'PoincareBall', 'num_layers': 3, 'num_adj': 6, 'add_rate': 0.6708521245912817, 'tem': 1.5665993465032322, 'consis_rate': 1.459108608795856, 'use_att': 1}
mean: 0.807
[0.804 0.806 0.813 0.799 0.811 0.802 0.801 0.814 0.816 0.804]
cur_param: {'lr': 0.0027048843333733245, 'weight_decay': 0.0023602734013827517, 'dropout': 0.28208794096006784, 'patience': 80, 'lr_reduce_freq': 70, 'spt_alg': 'prim', 'spt_attr': 'edge_degree', 'manifold': 'PoincareBall', 'num_layers': 3, 'num_adj': 8, 'add_rate': 0.7194158023888202, 'tem': 1.5158943368850402, 'consis_rate': 1.38552444266842, 'use_att': 1}
mean: 0.8096
[0.812 0.814 0.803 0.809 0.813 0.81  0.801 0.816 0.808 0.81 ]
cur_param: {'lr': 0.003394368273865746, 'weight_decay': 0.0012139570466729078, 'dropout': 0.2877688230249153, 'patience': 100, 'lr_reduce_freq': 90, 'spt_alg': 'prim', 'spt_attr': 'edge_degree', 'manifold': 'PoincareBall', 'num_layers': 3, 'num_adj': 8, 'add_rate': 0.7428294057717494, 'tem': 1.4561143185858065, 'consis_rate': 1.3442525612662624, 'use_att': 1}
mean: 0.8088000000000001
[0.807 0.803 0.814 0.805 0.816 0.814 0.812 0.803 0.807 0.807]
cur_param: {'lr': 0.004101974344492416, 'weight_decay': 0.005995702141723879, 'dropout': 0.32235601899988964, 'patience': 80, 'lr_reduce_freq': 90, 'spt_alg': 'prim', 'spt_attr': 'edge_degree', 'manifold': 'PoincareBall', 'num_layers': 3, 'num_adj': 8, 'add_rate': 0.7470665756367519, 'tem': 1.3753770987011822, 'consis_rate': 1.3494262805196677, 'use_att': 1}
mean: 0.7983
[0.79  0.791 0.809 0.776 0.819 0.807 0.778 0.81  0.803 0.8  ]
cur_param: {'lr': 0.004474817806840457, 'weight_decay': 0.0015862437891665056, 'dropout': 0.3125042940012832, 'patience': 100, 'lr_reduce_freq': 90, 'spt_alg': 'prim', 'spt_attr': 'edge_degree', 'manifold': 'PoincareBall', 'num_layers': 4, 'num_adj': 8, 'add_rate': 0.4530365916184869, 'tem': 1.3888441664906026, 'consis_rate': 1.2846968260095235, 'use_att': 1}
mean: 0.7942
[0.776 0.793 0.802 0.794 0.794 0.779 0.805 0.813 0.788 0.798]
cur_param: {'lr': 0.0022675600741079156, 'weight_decay': 0.006419322041386775, 'dropout': 0.1992166313095714, 'patience': 60, 'lr_reduce_freq': 70, 'spt_alg': 'prim', 'spt_attr': 'edge_degree', 'manifold': 'PoincareBall', 'num_layers': 3, 'num_adj': 8, 'add_rate': 0.7190940638761073, 'tem': 1.6398884118908832, 'consis_rate': 0.8901839494564318, 'use_att': 1}
mean: 0.7946000000000001
[0.797 0.798 0.785 0.793 0.788 0.808 0.782 0.804 0.794 0.797]
cur_param: {'lr': 0.003952651689228136, 'weight_decay': 0.0005062110888732009, 'dropout': 0.434140775662616, 'patience': 80, 'lr_reduce_freq': 110, 'spt_alg': 'kruskal', 'spt_attr': 'edge_degree', 'manifold': 'PoincareBall', 'num_layers': 3, 'num_adj': 8, 'add_rate': 0.8026933578898809, 'tem': 1.170372422011397, 'consis_rate': 1.9225240501503806, 'use_att': 0}[32m[I 2022-06-21 11:55:12,691][0m Trial 18 finished with value: 0.8031 and parameters: {'lr': 0.003952651689228136, 'weight_decay': 0.0005062110888732009, 'dropout': 0.434140775662616, 'patience': 80, 'lr_reduce_freq': 110, 'spt_alg': 'kruskal', 'spt_attr': 'edge_degree', 'manifold': 'PoincareBall', 'num_layers': 3, 'num_adj': 8, 'add_rate': 0.8026933578898809, 'tem': 1.170372422011397, 'consis_rate': 1.9225240501503806, 'use_att': 0}. Best is trial 13 with value: 0.8096.[0m
[32m[I 2022-06-21 12:38:28,057][0m Trial 19 finished with value: 0.7959 and parameters: {'lr': 0.001878914841482805, 'weight_decay': 0.0013231187912461316, 'dropout': 0.19269865211084158, 'patience': 100, 'lr_reduce_freq': 130, 'spt_alg': 'prim', 'spt_attr': 'edge_degree', 'manifold': 'PoincareBall', 'num_layers': 4, 'num_adj': 4, 'add_rate': 0.4971099378722248, 'tem': 1.6484919561860396, 'consis_rate': 1.2424646619663982, 'use_att': 1}. Best is trial 13 with value: 0.8096.[0m
[32m[I 2022-06-21 13:26:16,218][0m Trial 20 finished with value: 0.3245 and parameters: {'lr': 0.0056380878555994515, 'weight_decay': 0.07766213991782424, 'dropout': 0.41796415248055363, 'patience': 80, 'lr_reduce_freq': 90, 'spt_alg': 'prim', 'spt_attr': 'edge_degree', 'manifold': 'PoincareBall', 'num_layers': 3, 'num_adj': 8, 'add_rate': 0.9296091186193483, 'tem': 1.3174070808325458, 'consis_rate': 1.5487102015003338, 'use_att': 1}. Best is trial 13 with value: 0.8096.[0m
[32m[I 2022-06-21 14:19:45,121][0m Trial 21 finished with value: 0.8084999999999999 and parameters: {'lr': 0.002774479541537001, 'weight_decay': 0.001358113539387113, 'dropout': 0.17716049859923305, 'patience': 100, 'lr_reduce_freq': 70, 'spt_alg': 'prim', 'spt_attr': 'edge_degree', 'manifold': 'PoincareBall', 'num_layers': 3, 'num_adj': 6, 'add_rate': 0.6741326054578561, 'tem': 1.758517030887989, 'consis_rate': 0.6331542637452021, 'use_att': 1}. Best is trial 13 with value: 0.8096.[0m
[32m[I 2022-06-21 15:28:20,982][0m Trial 22 finished with value: 0.8082 and parameters: {'lr': 0.0016706422059547738, 'weight_decay': 0.001980151627692399, 'dropout': 0.13508788715470385, 'patience': 100, 'lr_reduce_freq': 70, 'spt_alg': 'prim', 'spt_attr': 'edge_degree', 'manifold': 'PoincareBall', 'num_layers': 3, 'num_adj': 8, 'add_rate': 0.6852079606665709, 'tem': 1.770070750532064, 'consis_rate': 0.8946131494010486, 'use_att': 1}. Best is trial 13 with value: 0.8096.[0m
