[32m[I 2022-06-29 06:24:47,530][0m Trial 26 finished with value: 0.8019999999999999 and parameters: {'lr': 0.005579209513921139, 'weight_decay': 0.0015396031123592069, 'dropout': 0.4440671428230186, 'patience': 80, 'lr_reduce_freq': 100, 'spt_alg': 'prim', 'spt_attr': 'similarity', 'manifold': 'PoincareBall', 'num_layers': 3, 'dim': 496, 'num_adj': 4, 'add_rate': 0.2485379802864699, 'tem': 1.3074618014448496, 'consis_rate': 1.9854422897803647, 'use_att': 0}. Best is trial 25 with value: 0.8061999999999999.[0m
[32m[I 2022-06-29 06:32:04,645][0m Trial 27 finished with value: 0.8046000000000001 and parameters: {'lr': 0.006133877040828333, 'weight_decay': 0.0011422933329655349, 'dropout': 0.43751080886243454, 'patience': 90, 'lr_reduce_freq': 120, 'spt_alg': 'prim', 'spt_attr': 'similarity', 'manifold': 'Hyperboloid', 'num_layers': 3, 'dim': 496, 'num_adj': 4, 'add_rate': 0.2557696916868165, 'tem': 1.320984160132656, 'consis_rate': 1.9655371288261516, 'use_att': 0}. Best is trial 25 with value: 0.8061999999999999.[0m
[32m[I 2022-06-29 06:39:25,851][0m Trial 28 finished with value: 0.8038000000000001 and parameters: {'lr': 0.008216837446143745, 'weight_decay': 0.0011891152442418465, 'dropout': 0.5164211145425213, 'patience': 90, 'lr_reduce_freq': 130, 'spt_alg': 'prim', 'spt_attr': 'similarity', 'manifold': 'Hyperboloid', 'num_layers': 3, 'dim': 480, 'num_adj': 4, 'add_rate': 0.10083211532916125, 'tem': 1.407505475119966, 'consis_rate': 1.746385878827228, 'use_att': 0}. Best is trial 25 with value: 0.8061999999999999.[0m
[32m[I 2022-06-29 07:10:45,858][0m Trial 29 finished with value: 0.7499 and parameters: {'lr': 0.005863676454228302, 'weight_decay': 0.0008885537116330003, 'dropout': 0.6563361567645778, 'patience': 90, 'lr_reduce_freq': 130, 'spt_alg': 'prim', 'spt_attr': 'similarity', 'manifold': 'Hyperboloid', 'num_layers': 5, 'dim': 416, 'num_adj': 6, 'add_rate': 0.21916140689567756, 'tem': 1.4581618443843616, 'consis_rate': 1.9978428446913243, 'use_att': 0}. Best is trial 25 with value: 0.8061999999999999.[0m
[32m[I 2022-06-29 07:19:15,332][0m Trial 30 finished with value: 0.8097999999999999 and parameters: {'lr': 0.0025227696392523223, 'weight_decay': 0.0005182376145348242, 'dropout': 0.4903915921586156, 'patience': 80, 'lr_reduce_freq': 110, 'spt_alg': 'prim', 'spt_attr': 'similarity', 'manifold': 'Hyperboloid', 'num_layers': 4, 'dim': 512, 'num_adj': 4, 'add_rate': 0.33962803143565234, 'tem': 1.3732249218616461, 'consis_rate': 1.7319131552566314, 'use_att': 0}. Best is trial 30 with value: 0.8097999999999999.[0m
[32m[I 2022-06-29 07:29:21,643][0m Trial 31 finished with value: 0.8045000000000002 and parameters: {'lr': 0.01187707914377044, 'weight_decay': 0.0005330098852264355, 'dropout': 0.4296248190650263, 'patience': 80, 'lr_reduce_freq': 120, 'spt_alg': 'prim', 'spt_attr': 'similarity', 'manifold': 'Hyperboloid', 'num_layers': 4, 'dim': 512, 'num_adj': 4, 'add_rate': 0.3318909491007874, 'tem': 1.3732606100570683, 'consis_rate': 1.796903774922675, 'use_att': 0}. Best is trial 30 with value: 0.8097999999999999.[0m
[32m[I 2022-06-29 07:38:57,948][0m Trial 32 finished with value: 0.7964 and parameters: {'lr': 0.002323178370740637, 'weight_decay': 0.0006983029573785991, 'dropout': 0.4912140475673569, 'patience': 80, 'lr_reduce_freq': 150, 'spt_alg': 'prim', 'spt_attr': 'similarity', 'manifold': 'Hyperboloid', 'num_layers': 4, 'dim': 480, 'num_adj': 4, 'add_rate': 0.2771821691530667, 'tem': 1.298734643102796, 'consis_rate': 1.6504679421714197, 'use_att': 0}. Best is trial 30 with value: 0.8097999999999999.[0m
[32m[I 2022-06-29 07:51:11,809][0m Trial 33 finished with value: 0.7751 and parameters: {'lr': 0.001687949919333081, 'weight_decay': 0.001173560507842651, 'dropout': 0.5809103984039417, 'patience': 90, 'lr_reduce_freq': 110, 'spt_alg': 'prim', 'spt_attr': 'similarity', 'manifold': 'Hyperboloid', 'num_layers': 4, 'dim': 400, 'num_adj': 4, 'add_rate': 0.35643900430616354, 'tem': 1.4254135282218434, 'consis_rate': 1.8726471936985445, 'use_att': 0}. Best is trial 30 with value: 0.8097999999999999.[0m
[32m[I 2022-06-29 08:00:06,340][0m Trial 34 finished with value: 0.7939 and parameters: {'lr': 0.002643537134533966, 'weight_decay': 0.0009666839684375036, 'dropout': 0.5407155036482704, 'patience': 80, 'lr_reduce_freq': 120, 'spt_alg': 'prim', 'spt_attr': 'edge_degree', 'manifold': 'Hyperboloid', 'num_layers': 4, 'dim': 480, 'num_adj': 4, 'add_rate': 0.18359622600536388, 'tem': 1.2539209318561984, 'consis_rate': 1.6373093371984437, 'use_att': 0}. Best is trial 30 with value: 0.8097999999999999.[0m
[32m[I 2022-06-29 08:44:16,841][0m Trial 35 finished with value: 0.7863 and parameters: {'lr': 0.005388622737965646, 'weight_decay': 0.0015745879189446616, 'dropout': 0.4095530838646573, 'patience': 90, 'lr_reduce_freq': 100, 'spt_alg': 'prim', 'spt_attr': 'similarity', 'manifold': 'Hyperboloid', 'num_layers': 4, 'dim': 416, 'num_adj': 4, 'add_rate': 0.27989180658890334, 'tem': 1.346434784608982, 'consis_rate': 1.8965009068343308, 'use_att': 1}. Best is trial 30 with value: 0.8097999999999999.[0m

cur_param: {'lr': 0.04724985338468786, 'weight_decay': 0.023101032662513978, 'dropout': 0.586567320975246, 'patience': 80, 'lr_reduce_freq': 110, 'spt_alg': 'prim', 'spt_attr': 'similarity', 'manifold': 'Hyperboloid', 'num_layers': 3, 'dim': 464, 'num_adj': 4, 'add_rate': 0.39871403313549003, 'tem': 1.0355489604199746, 'consis_rate': 1.7612840090357447, 'use_att': 0}
mean: 0.3297
[0.319 0.366 0.381 0.319 0.319 0.319 0.317 0.319 0.319 0.319]
cur_param: {'lr': 0.014608847022189798, 'weight_decay': 0.006547427592617508, 'dropout': 0.3665362104408134, 'patience': 60, 'lr_reduce_freq': 60, 'spt_alg': 'prim', 'spt_attr': 'similarity', 'manifold': 'PoincareBall', 'num_layers': 3, 'dim': 336, 'num_adj': 2, 'add_rate': 0.5427049676407295, 'tem': 1.2856690186520316, 'consis_rate': 0.7121488684701464, 'use_att': 0}
mean: 0.7480000000000001
[0.802 0.807 0.802 0.798 0.795 0.298 0.804 0.803 0.791 0.78 ]
cur_param: {'lr': 0.05410996480256803, 'weight_decay': 0.0018397232789403356, 'dropout': 0.19257626574644854, 'patience': 50, 'lr_reduce_freq': 80, 'spt_alg': 'prim', 'spt_attr': 'similarity', 'manifold': 'PoincareBall', 'num_layers': 3, 'dim': 512, 'num_adj': 2, 'add_rate': 0.21988817313774284, 'tem': 0.6595955587058309, 'consis_rate': 1.2849296294092096, 'use_att': 0}
mean: 0.7914000000000001
[0.793 0.8   0.794 0.781 0.794 0.794 0.784 0.79  0.783 0.801]
cur_param: {'lr': 0.029522631459747112, 'weight_decay': 0.002191214024256502, 'dropout': 0.333763806330079, 'patience': 70, 'lr_reduce_freq': 70, 'spt_alg': 'prim', 'spt_attr': 'similarity', 'manifold': 'PoincareBall', 'num_layers': 3, 'dim': 448, 'num_adj': 2, 'add_rate': 0.49041769070930613, 'tem': 1.1731544697782499, 'consis_rate': 1.4721826526627702, 'use_att': 0}
mean: 0.8018000000000001
[0.815 0.797 0.793 0.775 0.821 0.809 0.806 0.8   0.812 0.79 ]
cur_param: {'lr': 0.024525587424410487, 'weight_decay': 0.003270084212195515, 'dropout': 0.28854492550612937, 'patience': 70, 'lr_reduce_freq': 60, 'spt_alg': 'prim', 'spt_attr': 'similarity', 'manifold': 'PoincareBall', 'num_layers': 3, 'dim': 448, 'num_adj': 2, 'add_rate': 0.4282356661073264, 'tem': 1.0951757483881681, 'consis_rate': 1.6154770196763009, 'use_att': 0}
mean: 0.8007000000000002
[0.815 0.812 0.811 0.802 0.792 0.797 0.777 0.818 0.815 0.768]
cur_param: {'lr': 0.018523466841131386, 'weight_decay': 0.0030609125225215346, 'dropout': 0.23157144960451503, 'patience': 70, 'lr_reduce_freq': 60, 'spt_alg': 'prim', 'spt_attr': 'similarity', 'manifold': 'PoincareBall', 'num_layers': 3, 'dim': 368, 'num_adj': 2, 'add_rate': 0.4202841978584316, 'tem': 1.072360486186834, 'consis_rate': 1.5154971781538673, 'use_att': 0}
mean: 0.7992
[0.8   0.801 0.806 0.805 0.793 0.795 0.799 0.799 0.799 0.795]
cur_param: {'lr': 0.011745337306338265, 'weight_decay': 0.0020286617443314014, 'dropout': 0.4236772422366285, 'patience': 80, 'lr_reduce_freq': 60, 'spt_alg': 'prim', 'spt_attr': 'similarity', 'manifold': 'PoincareBall', 'num_layers': 3, 'dim': 480, 'num_adj': 4, 'add_rate': 0.4267938770943062, 'tem': 1.2757401366913625, 'consis_rate': 1.6893589511421232, 'use_att': 0}
mean: 0.8055999999999999
[0.819 0.803 0.803 0.797 0.797 0.799 0.8   0.806 0.815 0.817]
cur_param: {'lr': 0.010132853093611578, 'weight_decay': 0.0017774707106525108, 'dropout': 0.43458767865470627, 'patience': 80, 'lr_reduce_freq': 80, 'spt_alg': 'prim', 'spt_attr': 'similarity', 'manifold': 'PoincareBall', 'num_layers': 3, 'dim': 480, 'num_adj': 4, 'add_rate': 0.24720323129703897, 'tem': 1.3055729554651765, 'consis_rate': 1.9964966362766914, 'use_att': 0}
mean: 0.8061999999999999
[0.828 0.803 0.794 0.794 0.823 0.826 0.806 0.794 0.797 0.797]
cur_param: {'lr': 0.005579209513921139, 'weight_decay': 0.0015396031123592069, 'dropout': 0.4440671428230186, 'patience': 80, 'lr_reduce_freq': 100, 'spt_alg': 'prim', 'spt_attr': 'similarity', 'manifold': 'PoincareBall', 'num_layers': 3, 'dim': 496, 'num_adj': 4, 'add_rate': 0.2485379802864699, 'tem': 1.3074618014448496, 'consis_rate': 1.9854422897803647, 'use_att': 0}
mean: 0.8019999999999999
[0.805 0.79  0.802 0.811 0.78  0.804 0.804 0.792 0.825 0.807]
cur_param: {'lr': 0.006133877040828333, 'weight_decay': 0.0011422933329655349, 'dropout': 0.43751080886243454, 'patience': 90, 'lr_reduce_freq': 120, 'spt_alg': 'prim', 'spt_attr': 'similarity', 'manifold': 'Hyperboloid', 'num_layers': 3, 'dim': 496, 'num_adj': 4, 'add_rate': 0.2557696916868165, 'tem': 1.320984160132656, 'consis_rate': 1.9655371288261516, 'use_att': 0}
mean: 0.8046000000000001
[0.811 0.791 0.8   0.813 0.806 0.788 0.813 0.81  0.809 0.805]
cur_param: {'lr': 0.008216837446143745, 'weight_decay': 0.0011891152442418465, 'dropout': 0.5164211145425213, 'patience': 90, 'lr_reduce_freq': 130, 'spt_alg': 'prim', 'spt_attr': 'similarity', 'manifold': 'Hyperboloid', 'num_layers': 3, 'dim': 480, 'num_adj': 4, 'add_rate': 0.10083211532916125, 'tem': 1.407505475119966, 'consis_rate': 1.746385878827228, 'use_att': 0}
mean: 0.8038000000000001
[0.813 0.807 0.808 0.807 0.81  0.794 0.802 0.801 0.8   0.796]
cur_param: {'lr': 0.005863676454228302, 'weight_decay': 0.0008885537116330003, 'dropout': 0.6563361567645778, 'patience': 90, 'lr_reduce_freq': 130, 'spt_alg': 'prim', 'spt_attr': 'similarity', 'manifold': 'Hyperboloid', 'num_layers': 5, 'dim': 416, 'num_adj': 6, 'add_rate': 0.21916140689567756, 'tem': 1.4581618443843616, 'consis_rate': 1.9978428446913243, 'use_att': 0}
mean: 0.7499
[0.701 0.786 0.784 0.738 0.797 0.736 0.763 0.759 0.718 0.717]
cur_param: {'lr': 0.0025227696392523223, 'weight_decay': 0.0005182376145348242, 'dropout': 0.4903915921586156, 'patience': 80, 'lr_reduce_freq': 110, 'spt_alg': 'prim', 'spt_attr': 'similarity', 'manifold': 'Hyperboloid', 'num_layers': 4, 'dim': 512, 'num_adj': 4, 'add_rate': 0.33962803143565234, 'tem': 1.3732249218616461, 'consis_rate': 1.7319131552566314, 'use_att': 0}
mean: 0.8097999999999999
[0.81  0.825 0.789 0.802 0.806 0.822 0.801 0.813 0.829 0.801]
cur_param: {'lr': 0.01187707914377044, 'weight_decay': 0.0005330098852264355, 'dropout': 0.4296248190650263, 'patience': 80, 'lr_reduce_freq': 120, 'spt_alg': 'prim', 'spt_attr': 'similarity', 'manifold': 'Hyperboloid', 'num_layers': 4, 'dim': 512, 'num_adj': 4, 'add_rate': 0.3318909491007874, 'tem': 1.3732606100570683, 'consis_rate': 1.796903774922675, 'use_att': 0}
mean: 0.8045000000000002
[0.811 0.808 0.781 0.81  0.793 0.814 0.791 0.81  0.806 0.821]
cur_param: {'lr': 0.002323178370740637, 'weight_decay': 0.0006983029573785991, 'dropout': 0.4912140475673569, 'patience': 80, 'lr_reduce_freq': 150, 'spt_alg': 'prim', 'spt_attr': 'similarity', 'manifold': 'Hyperboloid', 'num_layers': 4, 'dim': 480, 'num_adj': 4, 'add_rate': 0.2771821691530667, 'tem': 1.298734643102796, 'consis_rate': 1.6504679421714197, 'use_att': 0}
mean: 0.7964
[0.773 0.809 0.784 0.777 0.806 0.802 0.811 0.8   0.816 0.786]
cur_param: {'lr': 0.001687949919333081, 'weight_decay': 0.001173560507842651, 'dropout': 0.5809103984039417, 'patience': 90, 'lr_reduce_freq': 110, 'spt_alg': 'prim', 'spt_attr': 'similarity', 'manifold': 'Hyperboloid', 'num_layers': 4, 'dim': 400, 'num_adj': 4, 'add_rate': 0.35643900430616354, 'tem': 1.4254135282218434, 'consis_rate': 1.8726471936985445, 'use_att': 0}
mean: 0.7751
[0.776 0.803 0.773 0.701 0.781 0.776 0.786 0.77  0.789 0.796]
cur_param: {'lr': 0.002643537134533966, 'weight_decay': 0.0009666839684375036, 'dropout': 0.5407155036482704, 'patience': 80, 'lr_reduce_freq': 120, 'spt_alg': 'prim', 'spt_attr': 'edge_degree', 'manifold': 'Hyperboloid', 'num_layers': 4, 'dim': 480, 'num_adj': 4, 'add_rate': 0.18359622600536388, 'tem': 1.2539209318561984, 'consis_rate': 1.6373093371984437, 'use_att': 0}
mean: 0.7939
[0.788 0.801 0.794 0.816 0.796 0.781 0.79  0.799 0.81  0.764]
cur_param: {'lr': 0.005388622737965646, 'weight_decay': 0.0015745879189446616, 'dropout': 0.4095530838646573, 'patience': 90, 'lr_reduce_freq': 100, 'spt_alg': 'prim', 'spt_attr': 'similarity', 'manifold': 'Hyperboloid', 'num_layers': 4, 'dim': 416, 'num_adj': 4, 'add_rate': 0.27989180658890334, 'tem': 1.346434784608982, 'consis_rate': 1.8965009068343308, 'use_att': 1}
mean: 0.7863
[0.777 0.783 0.794 0.774 0.791 0.797 0.783 0.792 0.782 0.79 ]
cur_param: {'lr': 0.002946890454769742, 'weight_decay': 0.0006941600539715479, 'dropout': 0.46262178105929413, 'patience': 80, 'lr_reduce_freq': 140, 'spt_alg': 'kruskal', 'spt_attr': 'edge_degree', 'manifold': 'Hyperboloid', 'num_layers': 4, 'dim': 512, 'num_adj': 4, 'add_rate': 0.8489438634615503, 'tem': 1.2314126924120297, 'consis_rate': 1.7071810341929572, 'use_att': 0}[32m[I 2022-06-29 08:52:12,852][0m Trial 36 finished with value: 0.7998 and parameters: {'lr': 0.002946890454769742, 'weight_decay': 0.0006941600539715479, 'dropout': 0.46262178105929413, 'patience': 80, 'lr_reduce_freq': 140, 'spt_alg': 'kruskal', 'spt_attr': 'edge_degree', 'manifold': 'Hyperboloid', 'num_layers': 4, 'dim': 512, 'num_adj': 4, 'add_rate': 0.8489438634615503, 'tem': 1.2314126924120297, 'consis_rate': 1.7071810341929572, 'use_att': 0}. Best is trial 30 with value: 0.8097999999999999.[0m
[32m[I 2022-06-29 09:38:49,055][0m Trial 37 finished with value: 0.8069000000000001 and parameters: {'lr': 0.01079413305357339, 'weight_decay': 0.0005163434153154353, 'dropout': 0.40015411910571497, 'patience': 90, 'lr_reduce_freq': 120, 'spt_alg': 'prim', 'spt_attr': 'similarity', 'manifold': 'Hyperboloid', 'num_layers': 3, 'dim': 144, 'num_adj': 6, 'add_rate': 0.10608561624525137, 'tem': 1.4541634248773148, 'consis_rate': 1.8595153069504844, 'use_att': 1}. Best is trial 30 with value: 0.8097999999999999.[0m
[32m[I 2022-06-29 11:25:29,504][0m Trial 38 finished with value: 0.7603 and parameters: {'lr': 0.010559782398272429, 'weight_decay': 0.0005898828704243675, 'dropout': 0.6329207136918461, 'patience': 100, 'lr_reduce_freq': 50, 'spt_alg': 'prim', 'spt_attr': 'similarity', 'manifold': 'Hyperboloid', 'num_layers': 5, 'dim': 128, 'num_adj': 6, 'add_rate': 0.12950792495203478, 'tem': 1.4966897254975493, 'consis_rate': 1.8349371341400917, 'use_att': 1}. Best is trial 30 with value: 0.8097999999999999.[0m
[32m[I 2022-06-29 11:56:40,600][0m Trial 39 finished with value: 0.3218 and parameters: {'lr': 0.004093003167778761, 'weight_decay': 0.010690981245113888, 'dropout': 0.39374029780216185, 'patience': 80, 'lr_reduce_freq': 100, 'spt_alg': 'kruskal', 'spt_attr': 'edge_degree', 'manifold': 'Hyperboloid', 'num_layers': 4, 'dim': 176, 'num_adj': 6, 'add_rate': 0.20223050245660268, 'tem': 1.419680099130638, 'consis_rate': 1.5345756278942262, 'use_att': 1}. Best is trial 30 with value: 0.8097999999999999.[0m
[32m[I 2022-06-29 12:57:08,579][0m Trial 40 finished with value: 0.5757000000000001 and parameters: {'lr': 0.0015671174329752095, 'weight_decay': 0.004183095302804165, 'dropout': 0.328060556449083, 'patience': 90, 'lr_reduce_freq': 80, 'spt_alg': 'prim', 'spt_attr': 'similarity', 'manifold': 'Hyperboloid', 'num_layers': 3, 'dim': 240, 'num_adj': 6, 'add_rate': 0.36465056543848723, 'tem': 1.3854203168958068, 'consis_rate': 1.397167658929994, 'use_att': 1}. Best is trial 30 with value: 0.8097999999999999.[0m
[32m[I 2022-06-29 13:24:54,842][0m Trial 41 finished with value: 0.8099000000000001 and parameters: {'lr': 0.006921042175563011, 'weight_decay': 0.0005106270980307721, 'dropout': 0.4566895083885206, 'patience': 90, 'lr_reduce_freq': 120, 'spt_alg': 'prim', 'spt_attr': 'similarity', 'manifold': 'Hyperboloid', 'num_layers': 3, 'dim': 192, 'num_adj': 4, 'add_rate': 0.26976708745881417, 'tem': 1.3309456145775527, 'consis_rate': 1.9399346574916587, 'use_att': 1}. Best is trial 41 with value: 0.8099000000000001.[0m
[32m[I 2022-06-29 13:47:19,192][0m Trial 42 finished with value: 0.8126 and parameters: {'lr': 0.01330294570916532, 'weight_decay': 0.0007878055268694916, 'dropout': 0.47634906539179933, 'patience': 90, 'lr_reduce_freq': 110, 'spt_alg': 'prim', 'spt_attr': 'similarity', 'manifold': 'Hyperboloid', 'num_layers': 3, 'dim': 192, 'num_adj': 4, 'add_rate': 0.12083284552502005, 'tem': 1.4488371338234254, 'consis_rate': 1.9227284936581208, 'use_att': 1}. Best is trial 42 with value: 0.8126.[0m
[32m[I 2022-06-29 14:08:13,006][0m Trial 43 finished with value: 0.805 and parameters: {'lr': 0.009022601854450564, 'weight_decay': 0.0007690752485801926, 'dropout': 0.4823149611371, 'patience': 90, 'lr_reduce_freq': 110, 'spt_alg': 'prim', 'spt_attr': 'similarity', 'manifold': 'Hyperboloid', 'num_layers': 3, 'dim': 192, 'num_adj': 4, 'add_rate': 0.1049227380987231, 'tem': 1.4508062353788644, 'consis_rate': 1.9026467559585742, 'use_att': 1}. Best is trial 42 with value: 0.8126.[0m
[32m[I 2022-06-29 14:58:12,144][0m Trial 44 finished with value: 0.7936 and parameters: {'lr': 0.0005754368982901885, 'weight_decay': 0.0005576440753216482, 'dropout': 0.5435707793984902, 'patience': 100, 'lr_reduce_freq': 120, 'spt_alg': 'prim', 'spt_attr': 'similarity', 'manifold': 'Hyperboloid', 'num_layers': 3, 'dim': 160, 'num_adj': 4, 'add_rate': 0.14726244433730787, 'tem': 1.3537159998210297, 'consis_rate': 1.827859612353348, 'use_att': 1}. Best is trial 42 with value: 0.8126.[0m
[32m[I 2022-06-29 16:01:28,523][0m Trial 45 finished with value: 0.7528999999999999 and parameters: {'lr': 0.007248977653419399, 'weight_decay': 0.0008668290858140914, 'dropout': 0.49899382986181245, 'patience': 100, 'lr_reduce_freq': 140, 'spt_alg': 'prim', 'spt_attr': 'edge_degree', 'manifold': 'Hyperboloid', 'num_layers': 5, 'dim': 208, 'num_adj': 4, 'add_rate': 0.1854285819850892, 'tem': 0.9618683628303599, 'consis_rate': 1.9128060039755712, 'use_att': 1}. Best is trial 42 with value: 0.8126.[0m
[32m[I 2022-06-29 16:29:46,359][0m Trial 46 finished with value: 0.8066000000000001 and parameters: {'lr': 0.004440866870347964, 'weight_decay': 0.0005249645215017963, 'dropout': 0.4632749230585907, 'patience': 90, 'lr_reduce_freq': 100, 'spt_alg': 'kruskal', 'spt_attr': 'similarity', 'manifold': 'Hyperboloid', 'num_layers': 3, 'dim': 224, 'num_adj': 6, 'add_rate': 0.30609437027363234, 'tem': 1.4590366434840898, 'consis_rate': 1.7921959400107572, 'use_att': 1}. Best is trial 42 with value: 0.8126.[0m
[32m[I 2022-06-29 17:01:52,198][0m Trial 47 finished with value: 0.8 and parameters: {'lr': 0.0033922420522098846, 'weight_decay': 0.0005216623745115909, 'dropout': 0.46136674583346704, 'patience': 100, 'lr_reduce_freq': 90, 'spt_alg': 'kruskal', 'spt_attr': 'similarity', 'manifold': 'Hyperboloid', 'num_layers': 3, 'dim': 240, 'num_adj': 6, 'add_rate': 0.31756749083224667, 'tem': 1.4516457725265113, 'consis_rate': 1.7537461111777537, 'use_att': 1}. Best is trial 42 with value: 0.8126.[0m
[32m[I 2022-06-29 18:10:17,379][0m Trial 48 finished with value: 0.7908000000000001 and parameters: {'lr': 0.0010373323258166256, 'weight_decay': 0.0006767642555789954, 'dropout': 0.6199111102588918, 'patience': 90, 'lr_reduce_freq': 110, 'spt_alg': 'kruskal', 'spt_attr': 'similarity', 'manifold': 'Hyperboloid', 'num_layers': 4, 'dim': 224, 'num_adj': 6, 'add_rate': 0.29311771315643065, 'tem': 1.4995721546578547, 'consis_rate': 1.6227195364652607, 'use_att': 1}. Best is trial 42 with value: 0.8126.[0m
[32m[I 2022-06-29 18:41:47,853][0m Trial 49 finished with value: 0.7995 and parameters: {'lr': 0.0044634966096247786, 'weight_decay': 0.0010022279321017448, 'dropout': 0.5509144519112862, 'patience': 90, 'lr_reduce_freq': 90, 'spt_alg': 'kruskal', 'spt_attr': 'similarity', 'manifold': 'Hyperboloid', 'num_layers': 3, 'dim': 144, 'num_adj': 6, 'add_rate': 0.132771385615799, 'tem': 1.403889082109064, 'consis_rate': 1.5651070644082186, 'use_att': 1}. Best is trial 42 with value: 0.8126.[0m
[32m[I 2022-06-29 19:56:08,761][0m Trial 50 finished with value: 0.7542 and parameters: {'lr': 0.002078503555528158, 'weight_decay': 0.0006448196407802192, 'dropout': 0.6929992494872514, 'patience': 90, 'lr_reduce_freq': 130, 'spt_alg': 'kruskal', 'spt_attr': 'edge_degree', 'manifold': 'Hyperboloid', 'num_layers': 5, 'dim': 272, 'num_adj': 6, 'add_rate': 0.17972411844911343, 'tem': 1.4465958349228658, 'consis_rate': 1.826706926289516, 'use_att': 1}. Best is trial 42 with value: 0.8126.[0m
[32m[I 2022-06-29 20:16:15,786][0m Trial 51 finished with value: 0.8027000000000001 and parameters: {'lr': 0.014888952885291091, 'weight_decay': 0.0005083169557628017, 'dropout': 0.38297097309110545, 'patience': 90, 'lr_reduce_freq': 100, 'spt_alg': 'kruskal', 'spt_attr': 'similarity', 'manifold': 'Hyperboloid', 'num_layers': 3, 'dim': 176, 'num_adj': 4, 'add_rate': 0.23919043707786017, 'tem': 1.3499756978626136, 'consis_rate': 1.9420327610297614, 'use_att': 1}. Best is trial 42 with value: 0.8126.[0m
