[32m[I 2022-07-01 11:59:22,036][0m Trial 72 finished with value: 0.8115 and parameters: {'lr': 0.06685275930721099, 'weight_decay': 0.01139581971153194, 'dropout': 0.4090422961505314, 'patience': 90, 'lr_reduce_freq': 30, 'spt_alg': 'prim', 'spt_attr': 'edge_degree', 'manifold': 'PoincareBall', 'num_layers': 3, 'dim': 192, 'num_adj': 4, 'add_rate': 0.34909564600037657, 'tem': 1.112673706981931, 'consis_rate': 1.8715510659833987, 'use_att': 1}. Best is trial 71 with value: 0.8189.[0m

cur_param: {'lr': 0.018058818327005892, 'weight_decay': 0.001334477717361865, 'dropout': 0.10267213643371918, 'patience': 90, 'lr_reduce_freq': 30, 'spt_alg': 'prim', 'spt_attr': 'similarity', 'manifold': 'PoincareBall', 'num_layers': 3, 'dim': 288, 'num_adj': 6, 'add_rate': 0.16882976925847193, 'tem': 1.3865001369277936, 'consis_rate': 1.5272195200694716, 'use_att': 1}
mean: 0.8079000000000001
[0.798 0.816 0.819 0.817 0.793 0.814 0.797 0.81  0.818 0.797]
cur_param: {'lr': 0.039516888392751505, 'weight_decay': 0.0016897339163299645, 'dropout': 0.13971942398419224, 'patience': 100, 'lr_reduce_freq': 30, 'spt_alg': 'prim', 'spt_attr': 'similarity', 'manifold': 'PoincareBall', 'num_layers': 3, 'dim': 368, 'num_adj': 6, 'add_rate': 0.21699700138435346, 'tem': 1.2946732488364527, 'consis_rate': 1.9018818151468593, 'use_att': 1}
mean: 0.8064
[0.813 0.81  0.806 0.801 0.824 0.8   0.799 0.802 0.807 0.802]
cur_param: {'lr': 0.0064510485743596606, 'weight_decay': 0.0011015495677544264, 'dropout': 0.19035688868393608, 'patience': 90, 'lr_reduce_freq': 30, 'spt_alg': 'kruskal', 'spt_attr': 'similarity', 'manifold': 'Hyperboloid', 'num_layers': 5, 'dim': 224, 'num_adj': 4, 'add_rate': 0.2874994794385001, 'tem': 1.3535796124807773, 'consis_rate': 1.4271222892984212, 'use_att': 1}
mean: 0.7815000000000001
[0.756 0.784 0.756 0.771 0.776 0.786 0.794 0.799 0.804 0.789]
cur_param: {'lr': 0.010494667410940009, 'weight_decay': 0.0009716898893663791, 'dropout': 0.10003492233893424, 'patience': 100, 'lr_reduce_freq': 30, 'spt_alg': 'prim', 'spt_attr': 'similarity', 'manifold': 'PoincareBall', 'num_layers': 4, 'dim': 272, 'num_adj': 6, 'add_rate': 0.26743396633849037, 'tem': 1.4757580011283142, 'consis_rate': 1.7280642548653995, 'use_att': 1}
mean: 0.808
[0.811 0.799 0.806 0.821 0.817 0.79  0.806 0.802 0.815 0.813]
cur_param: {'lr': 0.01642333463188271, 'weight_decay': 0.003117745908993266, 'dropout': 0.48283176885729734, 'patience': 90, 'lr_reduce_freq': 45, 'spt_alg': 'prim', 'spt_attr': 'edge_degree', 'manifold': 'PoincareBall', 'num_layers': 3, 'dim': 320, 'num_adj': 6, 'add_rate': 0.39506463803504144, 'tem': 1.1503444033939925, 'consis_rate': 1.84673642646597, 'use_att': 1}
mean: 0.8131999999999999
[0.812 0.8   0.801 0.809 0.82  0.815 0.826 0.81  0.825 0.814]
cur_param: {'lr': 0.062455318396824104, 'weight_decay': 0.00966113034865956, 'dropout': 0.47576545473920817, 'patience': 90, 'lr_reduce_freq': 30, 'spt_alg': 'prim', 'spt_attr': 'edge_degree', 'manifold': 'PoincareBall', 'num_layers': 3, 'dim': 192, 'num_adj': 4, 'add_rate': 0.3987452794928441, 'tem': 1.1605560193800213, 'consis_rate': 1.8282331332935506, 'use_att': 1}
mean: 0.8126
[0.814 0.801 0.812 0.796 0.818 0.794 0.825 0.825 0.826 0.815]
cur_param: {'lr': 0.0810632648088608, 'weight_decay': 0.00877609928283991, 'dropout': 0.4661393357799919, 'patience': 90, 'lr_reduce_freq': 30, 'spt_alg': 'prim', 'spt_attr': 'edge_degree', 'manifold': 'PoincareBall', 'num_layers': 3, 'dim': 176, 'num_adj': 4, 'add_rate': 0.4019758411940155, 'tem': 1.161702065361768, 'consis_rate': 1.8447401685122682, 'use_att': 1}
mean: 0.8112
[0.82  0.807 0.809 0.805 0.813 0.801 0.822 0.819 0.8   0.816]
cur_param: {'lr': 0.058191117256672836, 'weight_decay': 0.0030102835496132996, 'dropout': 0.48662463820578683, 'patience': 90, 'lr_reduce_freq': 30, 'spt_alg': 'prim', 'spt_attr': 'edge_degree', 'manifold': 'PoincareBall', 'num_layers': 3, 'dim': 192, 'num_adj': 4, 'add_rate': 0.3536817258501751, 'tem': 1.2114164909827048, 'consis_rate': 1.9149507070792358, 'use_att': 1}
mean: 0.8101
[0.817 0.812 0.813 0.807 0.798 0.813 0.801 0.817 0.81  0.813]
cur_param: {'lr': 0.07142973592416035, 'weight_decay': 0.009159832152599611, 'dropout': 0.45668548967130496, 'patience': 90, 'lr_reduce_freq': 30, 'spt_alg': 'prim', 'spt_attr': 'edge_degree', 'manifold': 'PoincareBall', 'num_layers': 3, 'dim': 144, 'num_adj': 4, 'add_rate': 0.3883194220988665, 'tem': 1.1543542854933282, 'consis_rate': 1.8521021267306386, 'use_att': 1}
mean: 0.8103999999999999
[0.808 0.806 0.827 0.814 0.793 0.809 0.81  0.798 0.818 0.821]
cur_param: {'lr': 0.08946703175697465, 'weight_decay': 0.006508276145447672, 'dropout': 0.5609099574664672, 'patience': 90, 'lr_reduce_freq': 30, 'spt_alg': 'prim', 'spt_attr': 'edge_degree', 'manifold': 'PoincareBall', 'num_layers': 3, 'dim': 176, 'num_adj': 4, 'add_rate': 0.4106968539251101, 'tem': 1.1130661956973746, 'consis_rate': 1.8036622009118177, 'use_att': 1}
mean: 0.8150000000000001
[0.824 0.802 0.825 0.813 0.815 0.83  0.814 0.81  0.823 0.794]
cur_param: {'lr': 0.04991515428164128, 'weight_decay': 0.00600774848004567, 'dropout': 0.5633658671930436, 'patience': 90, 'lr_reduce_freq': 45, 'spt_alg': 'prim', 'spt_attr': 'edge_degree', 'manifold': 'PoincareBall', 'num_layers': 3, 'dim': 176, 'num_adj': 4, 'add_rate': 0.47871959121925045, 'tem': 1.110289387974033, 'consis_rate': 1.768983515864402, 'use_att': 1}
mean: 0.8092
[0.806 0.813 0.808 0.796 0.809 0.783 0.829 0.82  0.804 0.824]
cur_param: {'lr': 0.034449280615157965, 'weight_decay': 0.014081913857548027, 'dropout': 0.5484446700663428, 'patience': 100, 'lr_reduce_freq': 45, 'spt_alg': 'prim', 'spt_attr': 'edge_degree', 'manifold': 'PoincareBall', 'num_layers': 3, 'dim': 208, 'num_adj': 4, 'add_rate': 0.4407413595347952, 'tem': 1.2667220381057072, 'consis_rate': 1.9430532900431592, 'use_att': 1}
mean: 0.4239
[0.349 0.319 0.828 0.319 0.319 0.319 0.319 0.829 0.319 0.319]
cur_param: {'lr': 0.017117131475846873, 'weight_decay': 0.007465082778504392, 'dropout': 0.6171402068786076, 'patience': 100, 'lr_reduce_freq': 30, 'spt_alg': 'prim', 'spt_attr': 'edge_degree', 'manifold': 'PoincareBall', 'num_layers': 3, 'dim': 128, 'num_adj': 4, 'add_rate': 0.42704365027231406, 'tem': 1.194461924455846, 'consis_rate': 1.8219033663382205, 'use_att': 0}
mean: 0.8036
[0.815 0.804 0.811 0.809 0.788 0.815 0.806 0.808 0.801 0.779]
cur_param: {'lr': 0.02618837780888644, 'weight_decay': 0.004947375702166286, 'dropout': 0.511083196132493, 'patience': 90, 'lr_reduce_freq': 45, 'spt_alg': 'prim', 'spt_attr': 'edge_degree', 'manifold': 'Hyperboloid', 'num_layers': 3, 'dim': 160, 'num_adj': 4, 'add_rate': 0.5359382122957711, 'tem': 1.0908947247850345, 'consis_rate': 1.71052621628902, 'use_att': 1}
mean: 0.8037000000000001
[0.82  0.795 0.795 0.805 0.811 0.793 0.814 0.8   0.804 0.8  ]
cur_param: {'lr': 0.09785553373078101, 'weight_decay': 0.021292314242236977, 'dropout': 0.5871666271688354, 'patience': 90, 'lr_reduce_freq': 30, 'spt_alg': 'kruskal', 'spt_attr': 'edge_degree', 'manifold': 'PoincareBall', 'num_layers': 4, 'dim': 336, 'num_adj': 4, 'add_rate': 0.38258003221291476, 'tem': 1.4261177832060896, 'consis_rate': 1.9607626175715687, 'use_att': 1}
mean: 0.32880000000000004
[0.319 0.319 0.319 0.319 0.319 0.325 0.319 0.411 0.319 0.319]
cur_param: {'lr': 0.00862232507875393, 'weight_decay': 0.009074151427228361, 'dropout': 0.6811585286995573, 'patience': 100, 'lr_reduce_freq': 45, 'spt_alg': 'prim', 'spt_attr': 'edge_degree', 'manifold': 'PoincareBall', 'num_layers': 5, 'dim': 416, 'num_adj': 4, 'add_rate': 0.315607101737834, 'tem': 1.210799263818888, 'consis_rate': 1.5190169990387306, 'use_att': 1}
mean: 0.319
[0.319 0.319 0.319 0.319 0.319 0.319 0.319 0.319 0.319 0.319]
cur_param: {'lr': 0.07424634005316566, 'weight_decay': 0.009868201465074479, 'dropout': 0.41216974429561526, 'patience': 90, 'lr_reduce_freq': 30, 'spt_alg': 'prim', 'spt_attr': 'edge_degree', 'manifold': 'PoincareBall', 'num_layers': 3, 'dim': 176, 'num_adj': 4, 'add_rate': 0.39559603318487113, 'tem': 1.1700485673817664, 'consis_rate': 1.8675044912473866, 'use_att': 1}
mean: 0.8189
[0.811 0.823 0.836 0.81  0.827 0.828 0.799 0.809 0.817 0.829]
cur_param: {'lr': 0.06685275930721099, 'weight_decay': 0.01139581971153194, 'dropout': 0.4090422961505314, 'patience': 90, 'lr_reduce_freq': 30, 'spt_alg': 'prim', 'spt_attr': 'edge_degree', 'manifold': 'PoincareBall', 'num_layers': 3, 'dim': 192, 'num_adj': 4, 'add_rate': 0.34909564600037657, 'tem': 1.112673706981931, 'consis_rate': 1.8715510659833987, 'use_att': 1}
mean: 0.8115
[0.821 0.804 0.817 0.817 0.808 0.81  0.803 0.812 0.813 0.81 ]
cur_param: {'lr': 0.06737892689975383, 'weight_decay': 0.010797328224237365, 'dropout': 0.39678262838651923, 'patience': 90, 'lr_reduce_freq': 30, 'spt_alg': 'prim', 'spt_attr': 'edge_degree', 'manifold': 'PoincareBall', 'num_layers': 3, 'dim': 192, 'num_adj': 4, 'add_rate': 0.40936957040183086, 'tem': 1.1233557620648777, 'consis_rate': 1.8724837951517899, 'use_att': 1}[32m[I 2022-07-01 12:07:30,888][0m Trial 73 finished with value: 0.8166999999999998 and parameters: {'lr': 0.06737892689975383, 'weight_decay': 0.010797328224237365, 'dropout': 0.39678262838651923, 'patience': 90, 'lr_reduce_freq': 30, 'spt_alg': 'prim', 'spt_attr': 'edge_degree', 'manifold': 'PoincareBall', 'num_layers': 3, 'dim': 192, 'num_adj': 4, 'add_rate': 0.40936957040183086, 'tem': 1.1233557620648777, 'consis_rate': 1.8724837951517899, 'use_att': 1}. Best is trial 71 with value: 0.8189.[0m
[32m[I 2022-07-01 12:14:17,616][0m Trial 74 finished with value: 0.8043999999999999 and parameters: {'lr': 0.048714119687941516, 'weight_decay': 0.007472897764397261, 'dropout': 0.43360599115346543, 'patience': 90, 'lr_reduce_freq': 30, 'spt_alg': 'prim', 'spt_attr': 'edge_degree', 'manifold': 'PoincareBall', 'num_layers': 3, 'dim': 160, 'num_adj': 4, 'add_rate': 0.46849903110884017, 'tem': 1.1842079737271962, 'consis_rate': 1.7587661627873905, 'use_att': 1}. Best is trial 71 with value: 0.8189.[0m
[32m[I 2022-07-01 12:22:43,002][0m Trial 75 finished with value: 0.8126999999999999 and parameters: {'lr': 0.08312525346908455, 'weight_decay': 0.010915251112294385, 'dropout': 0.38166424763435525, 'patience': 90, 'lr_reduce_freq': 30, 'spt_alg': 'prim', 'spt_attr': 'edge_degree', 'manifold': 'PoincareBall', 'num_layers': 3, 'dim': 208, 'num_adj': 4, 'add_rate': 0.41665549498009685, 'tem': 1.2760626885452468, 'consis_rate': 1.8869797072143508, 'use_att': 1}. Best is trial 71 with value: 0.8189.[0m
[32m[I 2022-07-01 12:31:57,441][0m Trial 76 finished with value: 0.8221999999999999 and parameters: {'lr': 0.08294523504183361, 'weight_decay': 0.015814687261448784, 'dropout': 0.3937112008069934, 'patience': 100, 'lr_reduce_freq': 30, 'spt_alg': 'prim', 'spt_attr': 'edge_degree', 'manifold': 'PoincareBall', 'num_layers': 3, 'dim': 208, 'num_adj': 4, 'add_rate': 0.40984410442795194, 'tem': 1.2899990031402444, 'consis_rate': 1.9852979496600565, 'use_att': 1}. Best is trial 76 with value: 0.8221999999999999.[0m
[32m[I 2022-07-01 12:42:35,287][0m Trial 77 finished with value: 0.8203000000000001 and parameters: {'lr': 0.08308769951174393, 'weight_decay': 0.0166636947129428, 'dropout': 0.3832582712259211, 'patience': 100, 'lr_reduce_freq': 30, 'spt_alg': 'prim', 'spt_attr': 'edge_degree', 'manifold': 'PoincareBall', 'num_layers': 3, 'dim': 208, 'num_adj': 4, 'add_rate': 0.5785059912824015, 'tem': 1.2789779933774141, 'consis_rate': 1.9736094862994062, 'use_att': 1}. Best is trial 76 with value: 0.8221999999999999.[0m
[32m[I 2022-07-01 12:54:14,597][0m Trial 78 finished with value: 0.8238999999999999 and parameters: {'lr': 0.08326863518106904, 'weight_decay': 0.017638798982526547, 'dropout': 0.38133505958474495, 'patience': 100, 'lr_reduce_freq': 30, 'spt_alg': 'prim', 'spt_attr': 'edge_degree', 'manifold': 'PoincareBall', 'num_layers': 3, 'dim': 208, 'num_adj': 4, 'add_rate': 0.6814678705485357, 'tem': 1.2805537012616652, 'consis_rate': 1.998373609044664, 'use_att': 1}. Best is trial 78 with value: 0.8238999999999999.[0m
[32m[I 2022-07-01 13:06:26,043][0m Trial 79 finished with value: 0.8225999999999999 and parameters: {'lr': 0.08638270142471295, 'weight_decay': 0.02051205894392695, 'dropout': 0.3790859221602531, 'patience': 100, 'lr_reduce_freq': 30, 'spt_alg': 'prim', 'spt_attr': 'edge_degree', 'manifold': 'PoincareBall', 'num_layers': 3, 'dim': 208, 'num_adj': 4, 'add_rate': 0.6513274756022436, 'tem': 1.3631069409913816, 'consis_rate': 1.9750523998204443, 'use_att': 1}. Best is trial 78 with value: 0.8238999999999999.[0m
[32m[I 2022-07-01 13:13:50,115][0m Trial 80 finished with value: 0.5102 and parameters: {'lr': 0.08296054365250101, 'weight_decay': 0.028690299304302485, 'dropout': 0.3499689598187516, 'patience': 100, 'lr_reduce_freq': 45, 'spt_alg': 'prim', 'spt_attr': 'edge_degree', 'manifold': 'Hyperboloid', 'num_layers': 3, 'dim': 512, 'num_adj': 4, 'add_rate': 0.6689959044258597, 'tem': 1.354271235048557, 'consis_rate': 1.97422071624446, 'use_att': 0}. Best is trial 78 with value: 0.8238999999999999.[0m
[32m[I 2022-07-01 13:23:59,347][0m Trial 81 finished with value: 0.8208 and parameters: {'lr': 0.07970062504765857, 'weight_decay': 0.018270365772049102, 'dropout': 0.371207456905635, 'patience': 100, 'lr_reduce_freq': 30, 'spt_alg': 'prim', 'spt_attr': 'edge_degree', 'manifold': 'PoincareBall', 'num_layers': 3, 'dim': 208, 'num_adj': 4, 'add_rate': 0.5873447954174397, 'tem': 1.2789639347388084, 'consis_rate': 1.9983997391648352, 'use_att': 1}. Best is trial 78 with value: 0.8238999999999999.[0m
[32m[I 2022-07-01 13:34:32,651][0m Trial 82 finished with value: 0.8234 and parameters: {'lr': 0.05676557295790093, 'weight_decay': 0.018996502781472344, 'dropout': 0.40378649351419904, 'patience': 100, 'lr_reduce_freq': 30, 'spt_alg': 'prim', 'spt_attr': 'edge_degree', 'manifold': 'PoincareBall', 'num_layers': 3, 'dim': 224, 'num_adj': 4, 'add_rate': 0.583259716023096, 'tem': 1.3965254456084186, 'consis_rate': 1.9972121417928759, 'use_att': 1}. Best is trial 78 with value: 0.8238999999999999.[0m
[32m[I 2022-07-01 13:40:42,242][0m Trial 83 finished with value: 0.32100000000000006 and parameters: {'lr': 0.0438314070612187, 'weight_decay': 0.02062120876720389, 'dropout': 0.4263514558254133, 'patience': 100, 'lr_reduce_freq': 30, 'spt_alg': 'prim', 'spt_attr': 'edge_degree', 'manifold': 'PoincareBall', 'num_layers': 3, 'dim': 224, 'num_adj': 4, 'add_rate': 0.5871822669183265, 'tem': 1.3825822682048001, 'consis_rate': 1.9952351864783553, 'use_att': 1}. Best is trial 78 with value: 0.8238999999999999.[0m
[32m[I 2022-07-01 13:52:19,192][0m Trial 84 finished with value: 0.6314 and parameters: {'lr': 0.07536177989147887, 'weight_decay': 0.026643445452991826, 'dropout': 0.4033144744766786, 'patience': 100, 'lr_reduce_freq': 135, 'spt_alg': 'prim', 'spt_attr': 'edge_degree', 'manifold': 'PoincareBall', 'num_layers': 3, 'dim': 208, 'num_adj': 4, 'add_rate': 0.626092098795368, 'tem': 1.4123736333340537, 'consis_rate': 1.9225621363327543, 'use_att': 1}. Best is trial 78 with value: 0.8238999999999999.[0m
[32m[I 2022-07-01 14:03:44,085][0m Trial 85 finished with value: 0.8195 and parameters: {'lr': 0.056710893702031896, 'weight_decay': 0.016921716824646958, 'dropout': 0.3775483119287709, 'patience': 100, 'lr_reduce_freq': 30, 'spt_alg': 'prim', 'spt_attr': 'edge_degree', 'manifold': 'PoincareBall', 'num_layers': 3, 'dim': 176, 'num_adj': 4, 'add_rate': 0.7509977203773295, 'tem': 1.3426754820794506, 'consis_rate': 1.9550736120060446, 'use_att': 1}. Best is trial 78 with value: 0.8238999999999999.[0m
[32m[I 2022-07-01 14:14:10,112][0m Trial 86 finished with value: 0.8253 and parameters: {'lr': 0.05846684918539945, 'weight_decay': 0.017502702661672396, 'dropout': 0.37212281392560226, 'patience': 100, 'lr_reduce_freq': 30, 'spt_alg': 'kruskal', 'spt_attr': 'edge_degree', 'manifold': 'PoincareBall', 'num_layers': 3, 'dim': 240, 'num_adj': 4, 'add_rate': 0.7399064651999409, 'tem': 1.3457974153441965, 'consis_rate': 1.9997140834389675, 'use_att': 1}. Best is trial 86 with value: 0.8253.[0m
[32m[I 2022-07-01 14:23:37,174][0m Trial 87 finished with value: 0.32939999999999997 and parameters: {'lr': 0.055178059464418366, 'weight_decay': 0.017287909196152026, 'dropout': 0.367277100912541, 'patience': 100, 'lr_reduce_freq': 30, 'spt_alg': 'kruskal', 'spt_attr': 'edge_degree', 'manifold': 'PoincareBall', 'num_layers': 4, 'dim': 240, 'num_adj': 4, 'add_rate': 0.7427102121489663, 'tem': 1.3433098602928446, 'consis_rate': 1.9993426483525192, 'use_att': 1}. Best is trial 86 with value: 0.8253.[0m
[32m[I 2022-07-01 14:30:44,794][0m Trial 88 finished with value: 0.37679999999999997 and parameters: {'lr': 0.09742128449179052, 'weight_decay': 0.03539681423172914, 'dropout': 0.3369362017025106, 'patience': 100, 'lr_reduce_freq': 30, 'spt_alg': 'kruskal', 'spt_attr': 'edge_degree', 'manifold': 'PoincareBall', 'num_layers': 3, 'dim': 144, 'num_adj': 4, 'add_rate': 0.7224494499550207, 'tem': 1.4634952490134547, 'consis_rate': 1.9463015187314805, 'use_att': 1}. Best is trial 86 with value: 0.8253.[0m
[32m[I 2022-07-01 14:37:15,373][0m Trial 89 finished with value: 0.33270000000000005 and parameters: {'lr': 0.036564215299802916, 'weight_decay': 0.017098370065404447, 'dropout': 0.38507526619290444, 'patience': 100, 'lr_reduce_freq': 45, 'spt_alg': 'kruskal', 'spt_attr': 'edge_degree', 'manifold': 'PoincareBall', 'num_layers': 3, 'dim': 224, 'num_adj': 4, 'add_rate': 0.6797108712941335, 'tem': 1.2917154159974065, 'consis_rate': 1.9461014860947712, 'use_att': 1}. Best is trial 86 with value: 0.8253.[0m
