[32m[I 2022-06-24 12:20:41,559][0m Trial 112 finished with value: 0.7371 and parameters: {'lr': 0.0013498105928626428, 'weight_decay': 0.0009114042035244492, 'dropout': 0.9018185211309697, 'patience': 100, 'lr_reduce_freq': 150, 'spt_alg': 'prim', 'spt_attr': 'edge_degree', 'manifold': 'PoincareBall', 'num_layers': 3, 'num_adj': 8, 'add_rate': 0.5783639441027956, 'tem': 0.5482342790638457, 'consis_rate': 1.4025470134679021, 'use_att': 1}. Best is trial 111 with value: 0.8206.[0m

mean: 0.817
[0.83  0.804 0.814 0.819 0.806 0.814 0.811 0.818 0.825 0.829]
cur_param: {'lr': 0.0020326865760899693, 'weight_decay': 0.0007229949484014536, 'dropout': 0.7796240829307297, 'patience': 100, 'lr_reduce_freq': 150, 'spt_alg': 'prim', 'spt_attr': 'edge_degree', 'manifold': 'PoincareBall', 'num_layers': 3, 'num_adj': 8, 'add_rate': 0.6292900910015675, 'tem': 0.7845693724021111, 'consis_rate': 1.3123468148833708, 'use_att': 1}
mean: 0.8179000000000001
[0.817 0.817 0.824 0.826 0.823 0.816 0.806 0.803 0.832 0.815]
cur_param: {'lr': 0.0015419777962037925, 'weight_decay': 0.00104352113505196, 'dropout': 0.7796742053944948, 'patience': 100, 'lr_reduce_freq': 150, 'spt_alg': 'prim', 'spt_attr': 'edge_degree', 'manifold': 'PoincareBall', 'num_layers': 3, 'num_adj': 8, 'add_rate': 0.6089254807217704, 'tem': 0.73308203691218, 'consis_rate': 1.2633451828599558, 'use_att': 1}
mean: 0.8177
[0.822 0.818 0.823 0.821 0.811 0.807 0.818 0.83  0.818 0.809]
cur_param: {'lr': 0.002056145577851684, 'weight_decay': 0.0008169480603224024, 'dropout': 0.9057953314756885, 'patience': 100, 'lr_reduce_freq': 150, 'spt_alg': 'prim', 'spt_attr': 'edge_degree', 'manifold': 'PoincareBall', 'num_layers': 3, 'num_adj': 8, 'add_rate': 0.6761234175244463, 'tem': 0.8038104370879575, 'consis_rate': 1.4700169401815926, 'use_att': 0}
mean: 0.7625
[0.733 0.768 0.69  0.787 0.812 0.754 0.782 0.784 0.759 0.756]
cur_param: {'lr': 0.0010099850066076692, 'weight_decay': 0.0005811348882396787, 'dropout': 0.8649738046747554, 'patience': 100, 'lr_reduce_freq': 150, 'spt_alg': 'prim', 'spt_attr': 'edge_degree', 'manifold': 'PoincareBall', 'num_layers': 3, 'num_adj': 8, 'add_rate': 0.7103199722943421, 'tem': 0.24942799023635953, 'consis_rate': 1.328289010501065, 'use_att': 1}
mean: 0.8052999999999999
[0.803 0.819 0.816 0.8   0.824 0.794 0.781 0.826 0.814 0.776]
cur_param: {'lr': 0.0017469545689308328, 'weight_decay': 0.0016139351487391821, 'dropout': 0.8210721820768466, 'patience': 100, 'lr_reduce_freq': 150, 'spt_alg': 'prim', 'spt_attr': 'edge_degree', 'manifold': 'PoincareBall', 'num_layers': 3, 'num_adj': 8, 'add_rate': 0.5859433634561303, 'tem': 0.43175860485816153, 'consis_rate': 1.2741432911220159, 'use_att': 1}
mean: 0.8105999999999998
[0.826 0.817 0.801 0.807 0.817 0.814 0.795 0.802 0.815 0.812]
cur_param: {'lr': 0.002253015539447775, 'weight_decay': 0.0009763702337831693, 'dropout': 0.7883096219968413, 'patience': 100, 'lr_reduce_freq': 150, 'spt_alg': 'prim', 'spt_attr': 'edge_degree', 'manifold': 'PoincareBall', 'num_layers': 3, 'num_adj': 8, 'add_rate': 0.7362468184625998, 'tem': 0.9598872919150687, 'consis_rate': 1.1947302611131922, 'use_att': 1}
mean: 0.8158999999999998
[0.82  0.817 0.82  0.817 0.815 0.812 0.82  0.794 0.823 0.821]
cur_param: {'lr': 0.0015880420934713594, 'weight_decay': 0.0010602760082904033, 'dropout': 0.7674683535302972, 'patience': 100, 'lr_reduce_freq': 150, 'spt_alg': 'prim', 'spt_attr': 'edge_degree', 'manifold': 'PoincareBall', 'num_layers': 3, 'num_adj': 8, 'add_rate': 0.6190474547476174, 'tem': 0.6358754947752738, 'consis_rate': 1.4264156743164431, 'use_att': 1}
mean: 0.8163
[0.825 0.802 0.815 0.816 0.82  0.812 0.816 0.828 0.819 0.81 ]
cur_param: {'lr': 0.001883673464408911, 'weight_decay': 0.0007636510715899277, 'dropout': 0.79065343886002, 'patience': 100, 'lr_reduce_freq': 150, 'spt_alg': 'prim', 'spt_attr': 'edge_degree', 'manifold': 'PoincareBall', 'num_layers': 3, 'num_adj': 8, 'add_rate': 0.6246040760523262, 'tem': 0.7413619567529166, 'consis_rate': 1.4931028501738102, 'use_att': 1}
mean: 0.8167
[0.824 0.813 0.807 0.835 0.822 0.803 0.807 0.815 0.829 0.812]
cur_param: {'lr': 0.0014874288878260037, 'weight_decay': 0.0006353968116722603, 'dropout': 0.7420687361656159, 'patience': 100, 'lr_reduce_freq': 150, 'spt_alg': 'prim', 'spt_attr': 'edge_degree', 'manifold': 'PoincareBall', 'num_layers': 3, 'num_adj': 8, 'add_rate': 0.6058578275563451, 'tem': 0.8610812027335608, 'consis_rate': 1.5905116472529863, 'use_att': 1}
mean: 0.8146999999999999
[0.809 0.811 0.825 0.823 0.808 0.811 0.816 0.814 0.815 0.815]
cur_param: {'lr': 0.0019654887659224735, 'weight_decay': 0.001104872186076715, 'dropout': 0.8483547342866548, 'patience': 100, 'lr_reduce_freq': 150, 'spt_alg': 'prim', 'spt_attr': 'edge_degree', 'manifold': 'PoincareBall', 'num_layers': 3, 'num_adj': 8, 'add_rate': 0.6371021467120491, 'tem': 0.6731273159916428, 'consis_rate': 1.2350658900080211, 'use_att': 1}
mean: 0.8120999999999998
[0.823 0.816 0.801 0.798 0.815 0.81  0.794 0.828 0.84  0.796]
cur_param: {'lr': 0.001128002877374028, 'weight_decay': 0.0014368998616504838, 'dropout': 0.8808097415734832, 'patience': 100, 'lr_reduce_freq': 150, 'spt_alg': 'prim', 'spt_attr': 'edge_degree', 'manifold': 'PoincareBall', 'num_layers': 3, 'num_adj': 8, 'add_rate': 0.6696759210850931, 'tem': 1.4471199772508405, 'consis_rate': 1.305507310055627, 'use_att': 1}
mean: 0.7835000000000001
[0.814 0.815 0.765 0.796 0.702 0.801 0.765 0.81  0.775 0.792]
cur_param: {'lr': 0.0015300996893282102, 'weight_decay': 0.0009422740855125996, 'dropout': 0.826256288121176, 'patience': 100, 'lr_reduce_freq': 150, 'spt_alg': 'prim', 'spt_attr': 'edge_degree', 'manifold': 'PoincareBall', 'num_layers': 3, 'num_adj': 8, 'add_rate': 0.5956265256110396, 'tem': 0.5616126564983828, 'consis_rate': 1.3989260404478616, 'use_att': 1}
mean: 0.8183
[0.817 0.82  0.828 0.808 0.823 0.802 0.823 0.832 0.82  0.81 ]
cur_param: {'lr': 0.0016845165710882375, 'weight_decay': 0.0008877671275458575, 'dropout': 0.8325824841986804, 'patience': 100, 'lr_reduce_freq': 150, 'spt_alg': 'prim', 'spt_attr': 'edge_degree', 'manifold': 'PoincareBall', 'num_layers': 3, 'num_adj': 8, 'add_rate': 0.5408858101785959, 'tem': 0.4113645304250028, 'consis_rate': 1.4562137891689348, 'use_att': 1}
mean: 0.818
[0.83  0.816 0.823 0.812 0.818 0.81  0.819 0.818 0.825 0.809]
cur_param: {'lr': 0.0025633751135129873, 'weight_decay': 0.0008882234889584907, 'dropout': 0.8293629225000048, 'patience': 100, 'lr_reduce_freq': 150, 'spt_alg': 'prim', 'spt_attr': 'edge_degree', 'manifold': 'PoincareBall', 'num_layers': 4, 'num_adj': 8, 'add_rate': 0.5699688664408961, 'tem': 0.4837928941578972, 'consis_rate': 1.4690465946017184, 'use_att': 1}
mean: 0.5918
[0.575 0.655 0.603 0.642 0.657 0.346 0.584 0.625 0.584 0.647]
cur_param: {'lr': 0.001717820361031554, 'weight_decay': 0.000562887207692253, 'dropout': 0.7549437751209965, 'patience': 100, 'lr_reduce_freq': 150, 'spt_alg': 'prim', 'spt_attr': 'edge_degree', 'manifold': 'PoincareBall', 'num_layers': 3, 'num_adj': 8, 'add_rate': 0.5448091010613378, 'tem': 0.4356806187690802, 'consis_rate': 1.5738174091079318, 'use_att': 1}
mean: 0.8160999999999999
[0.825 0.814 0.825 0.816 0.813 0.818 0.804 0.808 0.824 0.814]
cur_param: {'lr': 0.0011794378989389285, 'weight_decay': 0.0014830317920432128, 'dropout': 0.8710500147035427, 'patience': 100, 'lr_reduce_freq': 130, 'spt_alg': 'prim', 'spt_attr': 'edge_degree', 'manifold': 'PoincareBall', 'num_layers': 3, 'num_adj': 8, 'add_rate': 0.5283730424665923, 'tem': 0.34055874750048754, 'consis_rate': 1.5173215193211125, 'use_att': 1}
mean: 0.7788
[0.806 0.74  0.798 0.796 0.683 0.798 0.79  0.755 0.827 0.795]
cur_param: {'lr': 0.002070565160110371, 'weight_decay': 0.0007618667680623256, 'dropout': 0.8132781953176633, 'patience': 100, 'lr_reduce_freq': 150, 'spt_alg': 'prim', 'spt_attr': 'edge_degree', 'manifold': 'PoincareBall', 'num_layers': 3, 'num_adj': 8, 'add_rate': 0.5796133274058297, 'tem': 0.5945084882337229, 'consis_rate': 1.3950031841192303, 'use_att': 1}
mean: 0.8206
[0.828 0.824 0.816 0.826 0.821 0.81  0.808 0.83  0.827 0.816]
cur_param: {'lr': 0.0013498105928626428, 'weight_decay': 0.0009114042035244492, 'dropout': 0.9018185211309697, 'patience': 100, 'lr_reduce_freq': 150, 'spt_alg': 'prim', 'spt_attr': 'edge_degree', 'manifold': 'PoincareBall', 'num_layers': 3, 'num_adj': 8, 'add_rate': 0.5783639441027956, 'tem': 0.5482342790638457, 'consis_rate': 1.4025470134679021, 'use_att': 1}
mean: 0.7371
[0.784 0.814 0.79  0.795 0.684 0.317 0.777 0.82  0.814 0.776]
cur_param: {'lr': 0.0021179241066797538, 'weight_decay': 0.0007904414907150605, 'dropout': 0.8169461805376361, 'patience': 100, 'lr_reduce_freq': 150, 'spt_alg': 'prim', 'spt_attr': 'edge_degree', 'manifold': 'PoincareBall', 'num_layers': 3, 'num_adj': 8, 'add_rate': 0.6995482980375952, 'tem': 0.39014762255258784, 'consis_rate': 1.3307268728502755, 'use_att': 1}[32m[I 2022-06-24 13:11:02,461][0m Trial 113 finished with value: 0.8137000000000001 and parameters: {'lr': 0.0021179241066797538, 'weight_decay': 0.0007904414907150605, 'dropout': 0.8169461805376361, 'patience': 100, 'lr_reduce_freq': 150, 'spt_alg': 'prim', 'spt_attr': 'edge_degree', 'manifold': 'PoincareBall', 'num_layers': 3, 'num_adj': 8, 'add_rate': 0.6995482980375952, 'tem': 0.39014762255258784, 'consis_rate': 1.3307268728502755, 'use_att': 1}. Best is trial 111 with value: 0.8206.[0m
[32m[I 2022-06-24 13:45:12,766][0m Trial 114 finished with value: 0.8192999999999999 and parameters: {'lr': 0.0024067108672114405, 'weight_decay': 0.0006152353225281364, 'dropout': 0.798239201884032, 'patience': 100, 'lr_reduce_freq': 150, 'spt_alg': 'prim', 'spt_attr': 'edge_degree', 'manifold': 'PoincareBall', 'num_layers': 3, 'num_adj': 8, 'add_rate': 0.5917012603548808, 'tem': 1.6410741966443751, 'consis_rate': 1.450494198909073, 'use_att': 1}. Best is trial 111 with value: 0.8206.[0m
[32m[I 2022-06-24 14:23:33,318][0m Trial 115 finished with value: 0.8192999999999999 and parameters: {'lr': 0.002447119360524048, 'weight_decay': 0.0005064759881222768, 'dropout': 0.831737207823637, 'patience': 100, 'lr_reduce_freq': 150, 'spt_alg': 'prim', 'spt_attr': 'edge_degree', 'manifold': 'PoincareBall', 'num_layers': 3, 'num_adj': 8, 'add_rate': 0.589552227903704, 'tem': 0.5749699116571598, 'consis_rate': 1.3505847187382183, 'use_att': 1}. Best is trial 111 with value: 0.8206.[0m
[32m[I 2022-06-24 15:02:41,672][0m Trial 116 finished with value: 0.8117000000000001 and parameters: {'lr': 0.002390587609513076, 'weight_decay': 0.0005523619612702224, 'dropout': 0.8410848833325119, 'patience': 100, 'lr_reduce_freq': 150, 'spt_alg': 'prim', 'spt_attr': 'edge_degree', 'manifold': 'PoincareBall', 'num_layers': 3, 'num_adj': 8, 'add_rate': 0.5862683760951148, 'tem': 0.5274012169383753, 'consis_rate': 1.4469621119409726, 'use_att': 1}. Best is trial 111 with value: 0.8206.[0m
[32m[I 2022-06-24 15:12:31,002][0m Trial 117 finished with value: 0.2613 and parameters: {'lr': 0.0026514077510975736, 'weight_decay': 0.0005033651128142451, 'dropout': 0.9447002611509521, 'patience': 100, 'lr_reduce_freq': 150, 'spt_alg': 'prim', 'spt_attr': 'edge_degree', 'manifold': 'PoincareBall', 'num_layers': 3, 'num_adj': 8, 'add_rate': 0.6041592015687265, 'tem': 0.6115541530810397, 'consis_rate': 1.3430470850473526, 'use_att': 0}. Best is trial 111 with value: 0.8206.[0m
[32m[I 2022-06-24 16:17:09,284][0m Trial 118 finished with value: 0.8188000000000001 and parameters: {'lr': 0.00186057063746225, 'weight_decay': 0.0006426895297226633, 'dropout': 0.8101997307739173, 'patience': 100, 'lr_reduce_freq': 150, 'spt_alg': 'prim', 'spt_attr': 'edge_degree', 'manifold': 'PoincareBall', 'num_layers': 3, 'num_adj': 8, 'add_rate': 0.6568281134833001, 'tem': 0.3536253979610686, 'consis_rate': 1.5126872444047563, 'use_att': 1}. Best is trial 111 with value: 0.8206.[0m
[32m[I 2022-06-24 17:34:08,963][0m Trial 119 finished with value: 0.8057000000000001 and parameters: {'lr': 0.0019293587115145083, 'weight_decay': 0.00062250031661427, 'dropout': 0.8562658752531496, 'patience': 100, 'lr_reduce_freq': 150, 'spt_alg': 'prim', 'spt_attr': 'edge_degree', 'manifold': 'PoincareBall', 'num_layers': 3, 'num_adj': 8, 'add_rate': 0.6601547964035557, 'tem': 0.21090562721786718, 'consis_rate': 1.6474322112126432, 'use_att': 1}. Best is trial 111 with value: 0.8206.[0m
[32m[I 2022-06-24 18:40:20,328][0m Trial 120 finished with value: 0.8175999999999999 and parameters: {'lr': 0.0023565690564790534, 'weight_decay': 0.0006631285936904406, 'dropout': 0.8065570102674838, 'patience': 100, 'lr_reduce_freq': 150, 'spt_alg': 'prim', 'spt_attr': 'edge_degree', 'manifold': 'PoincareBall', 'num_layers': 3, 'num_adj': 8, 'add_rate': 0.6455094880732734, 'tem': 0.3177383108746156, 'consis_rate': 1.3820007025481718, 'use_att': 1}. Best is trial 111 with value: 0.8206.[0m
[32m[I 2022-06-24 19:53:31,078][0m Trial 121 finished with value: 0.8208 and parameters: {'lr': 0.001707504742271649, 'weight_decay': 0.0008953665558199746, 'dropout': 0.827614242627509, 'patience': 100, 'lr_reduce_freq': 150, 'spt_alg': 'prim', 'spt_attr': 'edge_degree', 'manifold': 'PoincareBall', 'num_layers': 3, 'num_adj': 8, 'add_rate': 0.5964670806883148, 'tem': 0.5870464372309184, 'consis_rate': 1.4894310721594985, 'use_att': 1}. Best is trial 121 with value: 0.8208.[0m
[32m[I 2022-06-24 20:48:14,566][0m Trial 122 finished with value: 0.30300000000000005 and parameters: {'lr': 0.0018356123040987873, 'weight_decay': 0.16434819432139888, 'dropout': 0.8044382822598346, 'patience': 100, 'lr_reduce_freq': 150, 'spt_alg': 'prim', 'spt_attr': 'edge_degree', 'manifold': 'PoincareBall', 'num_layers': 3, 'num_adj': 8, 'add_rate': 0.5930072649438591, 'tem': 0.5285365038549205, 'consis_rate': 1.5095074498684693, 'use_att': 1}. Best is trial 121 with value: 0.8208.[0m
[32m[I 2022-06-24 22:05:31,877][0m Trial 123 finished with value: 0.8184999999999999 and parameters: {'lr': 0.001544425805847352, 'weight_decay': 0.0009608632740688126, 'dropout': 0.760186545596859, 'patience': 100, 'lr_reduce_freq': 150, 'spt_alg': 'prim', 'spt_attr': 'edge_degree', 'manifold': 'PoincareBall', 'num_layers': 3, 'num_adj': 8, 'add_rate': 0.6261009044277341, 'tem': 1.6447813364856845, 'consis_rate': 1.4222522879393846, 'use_att': 1}. Best is trial 121 with value: 0.8208.[0m
[32m[I 2022-06-24 23:55:21,900][0m Trial 124 finished with value: 0.7215999999999999 and parameters: {'lr': 0.0015078097846519978, 'weight_decay': 0.0007916687645768064, 'dropout': 0.9091762908937181, 'patience': 100, 'lr_reduce_freq': 150, 'spt_alg': 'prim', 'spt_attr': 'edge_degree', 'manifold': 'PoincareBall', 'num_layers': 3, 'num_adj': 8, 'add_rate': 0.47756548927456055, 'tem': 0.5893080145482652, 'consis_rate': 1.5283737744425443, 'use_att': 1}. Best is trial 121 with value: 0.8208.[0m
[32m[I 2022-06-25 00:50:34,063][0m Trial 125 finished with value: 0.319 and parameters: {'lr': 0.0020577139307171974, 'weight_decay': 0.45679532359524844, 'dropout': 0.7338278814355095, 'patience': 100, 'lr_reduce_freq': 150, 'spt_alg': 'prim', 'spt_attr': 'edge_degree', 'manifold': 'PoincareBall', 'num_layers': 3, 'num_adj': 8, 'add_rate': 0.6261174018560227, 'tem': 0.6879787426277804, 'consis_rate': 1.493874880839477, 'use_att': 1}. Best is trial 121 with value: 0.8208.[0m
[32m[I 2022-06-25 02:00:56,151][0m Trial 126 finished with value: 0.8122999999999999 and parameters: {'lr': 0.0021856115991460865, 'weight_decay': 0.0005721170442396824, 'dropout': 0.7600081616650326, 'patience': 100, 'lr_reduce_freq': 150, 'spt_alg': 'prim', 'spt_attr': 'similarity', 'manifold': 'PoincareBall', 'num_layers': 3, 'num_adj': 8, 'add_rate': 0.6850385252704094, 'tem': 0.47950436684454945, 'consis_rate': 1.3824130741878649, 'use_att': 1}. Best is trial 121 with value: 0.8208.[0m
[32m[I 2022-06-25 02:50:56,095][0m Trial 127 finished with value: 0.3323 and parameters: {'lr': 0.0015478732262695733, 'weight_decay': 0.014658652229813465, 'dropout': 0.8261889149777691, 'patience': 100, 'lr_reduce_freq': 150, 'spt_alg': 'prim', 'spt_attr': 'edge_degree', 'manifold': 'PoincareBall', 'num_layers': 3, 'num_adj': 8, 'add_rate': 0.5617752407902685, 'tem': 1.6485325544544251, 'consis_rate': 1.4209729781389577, 'use_att': 1}. Best is trial 121 with value: 0.8208.[0m
[32m[I 2022-06-25 04:09:49,908][0m Trial 128 finished with value: 0.8100999999999999 and parameters: {'lr': 0.002917381840580003, 'weight_decay': 0.0011109379395382462, 'dropout': 0.8646971417522059, 'patience': 100, 'lr_reduce_freq': 150, 'spt_alg': 'prim', 'spt_attr': 'edge_degree', 'manifold': 'PoincareBall', 'num_layers': 3, 'num_adj': 8, 'add_rate': 0.5929825271562139, 'tem': 0.5746017038486249, 'consis_rate': 1.5678248284343181, 'use_att': 1}. Best is trial 121 with value: 0.8208.[0m
[32m[I 2022-06-25 06:28:17,947][0m Trial 129 finished with value: 0.7217 and parameters: {'lr': 0.001825462033115484, 'weight_decay': 0.0006792569053118615, 'dropout': 0.7689301355748609, 'patience': 100, 'lr_reduce_freq': 150, 'spt_alg': 'prim', 'spt_attr': 'edge_degree', 'manifold': 'PoincareBall', 'num_layers': 4, 'num_adj': 8, 'add_rate': 0.42440454903050223, 'tem': 1.5282434274137544, 'consis_rate': 1.6152535134117483, 'use_att': 1}. Best is trial 121 with value: 0.8208.[0m
[32m[I 2022-06-25 07:38:09,481][0m Trial 130 finished with value: 0.8135 and parameters: {'lr': 0.002380175937218295, 'weight_decay': 0.000886109210914875, 'dropout': 0.8449224612441526, 'patience': 100, 'lr_reduce_freq': 150, 'spt_alg': 'prim', 'spt_attr': 'edge_degree', 'manifold': 'PoincareBall', 'num_layers': 3, 'num_adj': 8, 'add_rate': 0.6391538356313352, 'tem': 1.6521373806297097, 'consis_rate': 1.289584811153849, 'use_att': 1}. Best is trial 121 with value: 0.8208.[0m
