nohup: ignoring input
[32m[I 2022-06-21 17:46:48,496][0m A new study created in memory with name: no-name-93cdb126-388f-487d-bfd7-c57bf0205dcb[0m
[32m[I 2022-06-21 17:53:17,707][0m Trial 0 finished with value: 0.319 and parameters: {'lr': 0.028307024797487153, 'weight_decay': 0.007173139487286067, 'dropout': 0.9078815657945667, 'patience': 80, 'lr_reduce_freq': 130, 'spt_alg': 'kruskal', 'spt_attr': 'similarity', 'manifold': 'PoincareBall', 'num_layers': 4, 'num_adj': 6, 'add_rate': 0.26768443293602806, 'tem': 1.094151483262289, 'consis_rate': 1.3125641624119884, 'use_att': 0}. Best is trial 0 with value: 0.319.[0m
[32m[I 2022-06-21 17:56:06,833][0m Trial 1 finished with value: 0.2954 and parameters: {'lr': 0.09475883422084605, 'weight_decay': 0.16132631451650686, 'dropout': 0.7152717252354397, 'patience': 60, 'lr_reduce_freq': 130, 'spt_alg': 'kruskal', 'spt_attr': 'edge_degree', 'manifold': 'PoincareBall', 'num_layers': 4, 'num_adj': 4, 'add_rate': 0.31909604402089276, 'tem': 0.5919770726455795, 'consis_rate': 0.9171031615911029, 'use_att': 0}. Best is trial 0 with value: 0.319.[0m
[32m[I 2022-06-21 18:31:52,510][0m Trial 2 finished with value: 0.31880000000000003 and parameters: {'lr': 0.02017657421864714, 'weight_decay': 0.17952428060876735, 'dropout': 0.41484641251940907, 'patience': 100, 'lr_reduce_freq': 50, 'spt_alg': 'prim', 'spt_attr': 'similarity', 'manifold': 'PoincareBall', 'num_layers': 3, 'num_adj': 8, 'add_rate': 0.7234256716351996, 'tem': 0.24667669076177562, 'consis_rate': 0.5838370411675444, 'use_att': 1}. Best is trial 0 with value: 0.319.[0m
[32m[I 2022-06-21 18:48:10,871][0m Trial 3 finished with value: 0.2878 and parameters: {'lr': 0.006012532734689117, 'weight_decay': 0.006788879805328752, 'dropout': 0.6411790306767199, 'patience': 100, 'lr_reduce_freq': 150, 'spt_alg': 'prim', 'spt_attr': 'similarity', 'manifold': 'PoincareBall', 'num_layers': 4, 'num_adj': 2, 'add_rate': 0.45351633410735437, 'tem': 0.4965506308536409, 'consis_rate': 0.9528735523597454, 'use_att': 1}. Best is trial 0 with value: 0.319.[0m
[32m[I 2022-06-21 18:59:59,270][0m Trial 4 finished with value: 0.22049999999999997 and parameters: {'lr': 0.0035063073532827123, 'weight_decay': 0.007040571968304702, 'dropout': 0.8027242042174098, 'patience': 80, 'lr_reduce_freq': 110, 'spt_alg': 'kruskal', 'spt_attr': 'similarity', 'manifold': 'PoincareBall', 'num_layers': 4, 'num_adj': 8, 'add_rate': 0.13323174546833969, 'tem': 1.7937499381282689, 'consis_rate': 0.3219583972575145, 'use_att': 0}. Best is trial 0 with value: 0.319.[0m
[32m[I 2022-06-21 19:07:37,845][0m Trial 5 finished with value: 0.7071000000000001 and parameters: {'lr': 0.002079224686323656, 'weight_decay': 0.005800205634923155, 'dropout': 0.04516961016047399, 'patience': 80, 'lr_reduce_freq': 130, 'spt_alg': 'prim', 'spt_attr': 'edge_degree', 'manifold': 'PoincareBall', 'num_layers': 4, 'num_adj': 2, 'add_rate': 0.8314071044209513, 'tem': 0.7271883623174735, 'consis_rate': 1.3642463690943245, 'use_att': 0}. Best is trial 5 with value: 0.7071000000000001.[0m
[32m[I 2022-06-21 19:15:39,104][0m Trial 6 finished with value: 0.8008000000000001 and parameters: {'lr': 0.004354051619813301, 'weight_decay': 0.0019041252393154507, 'dropout': 0.5726890732464164, 'patience': 80, 'lr_reduce_freq': 90, 'spt_alg': 'prim', 'spt_attr': 'edge_degree', 'manifold': 'PoincareBall', 'num_layers': 3, 'num_adj': 6, 'add_rate': 0.49418384391590775, 'tem': 1.6545267651845408, 'consis_rate': 1.2854773935263435, 'use_att': 0}. Best is trial 6 with value: 0.8008000000000001.[0m
[32m[I 2022-06-21 19:28:38,643][0m Trial 7 finished with value: 0.30199999999999994 and parameters: {'lr': 0.037059073561995365, 'weight_decay': 0.02770179906404169, 'dropout': 0.4403087658894298, 'patience': 100, 'lr_reduce_freq': 90, 'spt_alg': 'kruskal', 'spt_attr': 'similarity', 'manifold': 'PoincareBall', 'num_layers': 4, 'num_adj': 2, 'add_rate': 0.22602824232632626, 'tem': 1.9429520894179226, 'consis_rate': 0.28646396719506634, 'use_att': 1}. Best is trial 6 with value: 0.8008000000000001.[0m
[32m[I 2022-06-21 19:44:02,683][0m Trial 8 finished with value: 0.285 and parameters: {'lr': 0.03746888182647299, 'weight_decay': 0.0918486809491527, 'dropout': 0.6344809263523418, 'patience': 60, 'lr_reduce_freq': 110, 'spt_alg': 'kruskal', 'spt_attr': 'similarity', 'manifold': 'PoincareBall', 'num_layers': 3, 'num_adj': 8, 'add_rate': 0.13421264608449546, 'tem': 0.43833786805775654, 'consis_rate': 0.8448287250079642, 'use_att': 1}. Best is trial 6 with value: 0.8008000000000001.[0m
[32m[I 2022-06-21 19:47:42,255][0m Trial 9 finished with value: 0.1662 and parameters: {'lr': 0.0022917403892972663, 'weight_decay': 0.26842954908422506, 'dropout': 0.5629911685971645, 'patience': 80, 'lr_reduce_freq': 70, 'spt_alg': 'kruskal', 'spt_attr': 'similarity', 'manifold': 'PoincareBall', 'num_layers': 4, 'num_adj': 4, 'add_rate': 0.1733133783351329, 'tem': 0.6506623160386125, 'consis_rate': 0.6394436436091834, 'use_att': 0}. Best is trial 6 with value: 0.8008000000000001.[0m
[32m[I 2022-06-21 19:59:01,040][0m Trial 10 finished with value: 0.7692 and parameters: {'lr': 0.001145889195678136, 'weight_decay': 0.0005890381708659141, 'dropout': 0.23054440544471758, 'patience': 60, 'lr_reduce_freq': 70, 'spt_alg': 'prim', 'spt_attr': 'edge_degree', 'manifold': 'PoincareBall', 'num_layers': 3, 'num_adj': 6, 'add_rate': 0.567430243796716, 'tem': 1.5159733915942213, 'consis_rate': 1.8117382974136562, 'use_att': 0}. Best is trial 6 with value: 0.8008000000000001.[0m
[32m[I 2022-06-21 20:10:14,153][0m Trial 11 finished with value: 0.7705 and parameters: {'lr': 0.001083428743298152, 'weight_decay': 0.0005254562185613067, 'dropout': 0.22107885272313738, 'patience': 60, 'lr_reduce_freq': 70, 'spt_alg': 'prim', 'spt_attr': 'edge_degree', 'manifold': 'PoincareBall', 'num_layers': 3, 'num_adj': 6, 'add_rate': 0.5781225176733225, 'tem': 1.5732800569518866, 'consis_rate': 1.9716789562188146, 'use_att': 0}. Best is trial 6 with value: 0.8008000000000001.[0m
[32m[I 2022-06-21 20:15:18,387][0m Trial 12 finished with value: 0.7954000000000001 and parameters: {'lr': 0.0066082708786658634, 'weight_decay': 0.0005716896052981555, 'dropout': 0.2657286425474858, 'patience': 60, 'lr_reduce_freq': 70, 'spt_alg': 'prim', 'spt_attr': 'edge_degree', 'manifold': 'PoincareBall', 'num_layers': 3, 'num_adj': 6, 'add_rate': 0.598736554503906, 'tem': 1.4537420304317892, 'consis_rate': 1.9228064624370123, 'use_att': 0}. Best is trial 6 with value: 0.8008000000000001.[0m
[32m[I 2022-06-21 20:20:40,592][0m Trial 13 finished with value: 0.7903 and parameters: {'lr': 0.009734978583840414, 'weight_decay': 0.001625468487462153, 'dropout': 0.3159117237809134, 'patience': 60, 'lr_reduce_freq': 90, 'spt_alg': 'prim', 'spt_attr': 'edge_degree', 'manifold': 'PoincareBall', 'num_layers': 3, 'num_adj': 6, 'add_rate': 0.4324515547224371, 'tem': 1.253703800943069, 'consis_rate': 1.6156113141056314, 'use_att': 0}. Best is trial 6 with value: 0.8008000000000001.[0m
[32m[I 2022-06-21 20:25:22,114][0m Trial 14 finished with value: 0.7838999999999999 and parameters: {'lr': 0.007325177637984185, 'weight_decay': 0.0016107031142861528, 'dropout': 0.02490969220645542, 'patience': 80, 'lr_reduce_freq': 50, 'spt_alg': 'prim', 'spt_attr': 'edge_degree', 'manifold': 'PoincareBall', 'num_layers': 3, 'num_adj': 4, 'add_rate': 0.6779593076438524, 'tem': 1.1996425266851576, 'consis_rate': 1.7148740230437314, 'use_att': 0}. Best is trial 6 with value: 0.8008000000000001.[0m
[32m[I 2022-06-21 20:31:11,661][0m Trial 15 finished with value: 0.7905000000000001 and parameters: {'lr': 0.014744759843861808, 'weight_decay': 0.001645930004480317, 'dropout': 0.33130100685724306, 'patience': 60, 'lr_reduce_freq': 90, 'spt_alg': 'prim', 'spt_attr': 'edge_degree', 'manifold': 'PoincareBall', 'num_layers': 3, 'num_adj': 6, 'add_rate': 0.9360990650426944, 'tem': 1.560521684555317, 'consis_rate': 1.2538802430660974, 'use_att': 0}. Best is trial 6 with value: 0.8008000000000001.[0m
[32m[I 2022-06-21 20:37:00,595][0m Trial 16 finished with value: 0.7795 and parameters: {'lr': 0.004410871234800914, 'weight_decay': 0.002750263608330456, 'dropout': 0.15660550346713845, 'patience': 100, 'lr_reduce_freq': 70, 'spt_alg': 'prim', 'spt_attr': 'edge_degree', 'manifold': 'PoincareBall', 'num_layers': 3, 'num_adj': 4, 'add_rate': 0.4411339350413539, 'tem': 1.3947096272562067, 'consis_rate': 1.5364653262201482, 'use_att': 0}. Best is trial 6 with value: 0.8008000000000001.[0m
[32m[I 2022-06-21 20:44:24,570][0m Trial 17 finished with value: 0.1609 and parameters: {'lr': 0.002945353832896386, 'weight_decay': 0.024121639393815834, 'dropout': 0.5169760057705545, 'patience': 80, 'lr_reduce_freq': 50, 'spt_alg': 'prim', 'spt_attr': 'edge_degree', 'manifold': 'PoincareBall', 'num_layers': 3, 'num_adj': 8, 'add_rate': 0.6560036992044403, 'tem': 0.9138153443415808, 'consis_rate': 1.925352287890529, 'use_att': 0}. Best is trial 6 with value: 0.8008000000000001.[0m
cmd: --dataset cora --model HGCN --c None --dim 32
cur_param: {'lr': 0.028307024797487153, 'weight_decay': 0.007173139487286067, 'dropout': 0.9078815657945667, 'patience': 80, 'lr_reduce_freq': 130, 'spt_alg': 'kruskal', 'spt_attr': 'similarity', 'manifold': 'PoincareBall', 'num_layers': 4, 'num_adj': 6, 'add_rate': 0.26768443293602806, 'tem': 1.094151483262289, 'consis_rate': 1.3125641624119884, 'use_att': 0}
mean: 0.319
[0.318 0.319 0.319 0.319 0.319 0.319 0.318 0.319 0.321 0.319]
cur_param: {'lr': 0.09475883422084605, 'weight_decay': 0.16132631451650686, 'dropout': 0.7152717252354397, 'patience': 60, 'lr_reduce_freq': 130, 'spt_alg': 'kruskal', 'spt_attr': 'edge_degree', 'manifold': 'PoincareBall', 'num_layers': 4, 'num_adj': 4, 'add_rate': 0.31909604402089276, 'tem': 0.5919770726455795, 'consis_rate': 0.9171031615911029, 'use_att': 0}
mean: 0.2954
[0.271 0.319 0.149 0.317 0.319 0.319 0.319 0.316 0.306 0.319]
cur_param: {'lr': 0.02017657421864714, 'weight_decay': 0.17952428060876735, 'dropout': 0.41484641251940907, 'patience': 100, 'lr_reduce_freq': 50, 'spt_alg': 'prim', 'spt_attr': 'similarity', 'manifold': 'PoincareBall', 'num_layers': 3, 'num_adj': 8, 'add_rate': 0.7234256716351996, 'tem': 0.24667669076177562, 'consis_rate': 0.5838370411675444, 'use_att': 1}
mean: 0.31880000000000003
[0.319 0.319 0.319 0.319 0.319 0.319 0.319 0.319 0.317 0.319]
cur_param: {'lr': 0.006012532734689117, 'weight_decay': 0.006788879805328752, 'dropout': 0.6411790306767199, 'patience': 100, 'lr_reduce_freq': 150, 'spt_alg': 'prim', 'spt_attr': 'similarity', 'manifold': 'PoincareBall', 'num_layers': 4, 'num_adj': 2, 'add_rate': 0.45351633410735437, 'tem': 0.4965506308536409, 'consis_rate': 0.9528735523597454, 'use_att': 1}
mean: 0.2878
[0.319 0.219 0.319 0.319 0.321 0.319 0.333 0.149 0.261 0.319]
cur_param: {'lr': 0.0035063073532827123, 'weight_decay': 0.007040571968304702, 'dropout': 0.8027242042174098, 'patience': 80, 'lr_reduce_freq': 110, 'spt_alg': 'kruskal', 'spt_attr': 'similarity', 'manifold': 'PoincareBall', 'num_layers': 4, 'num_adj': 8, 'add_rate': 0.13323174546833969, 'tem': 1.7937499381282689, 'consis_rate': 0.3219583972575145, 'use_att': 0}
mean: 0.22049999999999997
[0.244 0.153 0.255 0.097 0.286 0.237 0.162 0.31  0.31  0.151]
cur_param: {'lr': 0.002079224686323656, 'weight_decay': 0.005800205634923155, 'dropout': 0.04516961016047399, 'patience': 80, 'lr_reduce_freq': 130, 'spt_alg': 'prim', 'spt_attr': 'edge_degree', 'manifold': 'PoincareBall', 'num_layers': 4, 'num_adj': 2, 'add_rate': 0.8314071044209513, 'tem': 0.7271883623174735, 'consis_rate': 1.3642463690943245, 'use_att': 0}
mean: 0.7071000000000001
[0.697 0.685 0.732 0.705 0.678 0.766 0.7   0.7   0.732 0.676]
cur_param: {'lr': 0.004354051619813301, 'weight_decay': 0.0019041252393154507, 'dropout': 0.5726890732464164, 'patience': 80, 'lr_reduce_freq': 90, 'spt_alg': 'prim', 'spt_attr': 'edge_degree', 'manifold': 'PoincareBall', 'num_layers': 3, 'num_adj': 6, 'add_rate': 0.49418384391590775, 'tem': 1.6545267651845408, 'consis_rate': 1.2854773935263435, 'use_att': 0}
mean: 0.8008000000000001
[0.806 0.789 0.799 0.819 0.815 0.802 0.8   0.783 0.811 0.784]
cur_param: {'lr': 0.037059073561995365, 'weight_decay': 0.02770179906404169, 'dropout': 0.4403087658894298, 'patience': 100, 'lr_reduce_freq': 90, 'spt_alg': 'kruskal', 'spt_attr': 'similarity', 'manifold': 'PoincareBall', 'num_layers': 4, 'num_adj': 2, 'add_rate': 0.22602824232632626, 'tem': 1.9429520894179226, 'consis_rate': 0.28646396719506634, 'use_att': 1}
mean: 0.30199999999999994
[0.319 0.319 0.319 0.319 0.319 0.319 0.149 0.319 0.319 0.319]
cur_param: {'lr': 0.03746888182647299, 'weight_decay': 0.0918486809491527, 'dropout': 0.6344809263523418, 'patience': 60, 'lr_reduce_freq': 110, 'spt_alg': 'kruskal', 'spt_attr': 'similarity', 'manifold': 'PoincareBall', 'num_layers': 3, 'num_adj': 8, 'add_rate': 0.13421264608449546, 'tem': 0.43833786805775654, 'consis_rate': 0.8448287250079642, 'use_att': 1}
mean: 0.285
[0.149 0.319 0.319 0.149 0.319 0.319 0.319 0.319 0.319 0.319]
cur_param: {'lr': 0.0022917403892972663, 'weight_decay': 0.26842954908422506, 'dropout': 0.5629911685971645, 'patience': 80, 'lr_reduce_freq': 70, 'spt_alg': 'kruskal', 'spt_attr': 'similarity', 'manifold': 'PoincareBall', 'num_layers': 4, 'num_adj': 4, 'add_rate': 0.1733133783351329, 'tem': 0.6506623160386125, 'consis_rate': 0.6394436436091834, 'use_att': 0}
mean: 0.1662
[0.103 0.149 0.317 0.144 0.064 0.13  0.149 0.318 0.144 0.144]
cur_param: {'lr': 0.001145889195678136, 'weight_decay': 0.0005890381708659141, 'dropout': 0.23054440544471758, 'patience': 60, 'lr_reduce_freq': 70, 'spt_alg': 'prim', 'spt_attr': 'edge_degree', 'manifold': 'PoincareBall', 'num_layers': 3, 'num_adj': 6, 'add_rate': 0.567430243796716, 'tem': 1.5159733915942213, 'consis_rate': 1.8117382974136562, 'use_att': 0}
mean: 0.7692
[0.773 0.762 0.769 0.757 0.753 0.767 0.784 0.757 0.798 0.772]
cur_param: {'lr': 0.001083428743298152, 'weight_decay': 0.0005254562185613067, 'dropout': 0.22107885272313738, 'patience': 60, 'lr_reduce_freq': 70, 'spt_alg': 'prim', 'spt_attr': 'edge_degree', 'manifold': 'PoincareBall', 'num_layers': 3, 'num_adj': 6, 'add_rate': 0.5781225176733225, 'tem': 1.5732800569518866, 'consis_rate': 1.9716789562188146, 'use_att': 0}
mean: 0.7705
[0.759 0.775 0.766 0.764 0.76  0.773 0.784 0.758 0.795 0.771]
cur_param: {'lr': 0.0066082708786658634, 'weight_decay': 0.0005716896052981555, 'dropout': 0.2657286425474858, 'patience': 60, 'lr_reduce_freq': 70, 'spt_alg': 'prim', 'spt_attr': 'edge_degree', 'manifold': 'PoincareBall', 'num_layers': 3, 'num_adj': 6, 'add_rate': 0.598736554503906, 'tem': 1.4537420304317892, 'consis_rate': 1.9228064624370123, 'use_att': 0}
mean: 0.7954000000000001
[0.794 0.794 0.782 0.787 0.806 0.802 0.796 0.787 0.813 0.793]
cur_param: {'lr': 0.009734978583840414, 'weight_decay': 0.001625468487462153, 'dropout': 0.3159117237809134, 'patience': 60, 'lr_reduce_freq': 90, 'spt_alg': 'prim', 'spt_attr': 'edge_degree', 'manifold': 'PoincareBall', 'num_layers': 3, 'num_adj': 6, 'add_rate': 0.4324515547224371, 'tem': 1.253703800943069, 'consis_rate': 1.6156113141056314, 'use_att': 0}
mean: 0.7903
[0.786 0.779 0.771 0.813 0.783 0.799 0.802 0.785 0.797 0.788]
cur_param: {'lr': 0.007325177637984185, 'weight_decay': 0.0016107031142861528, 'dropout': 0.02490969220645542, 'patience': 80, 'lr_reduce_freq': 50, 'spt_alg': 'prim', 'spt_attr': 'edge_degree', 'manifold': 'PoincareBall', 'num_layers': 3, 'num_adj': 4, 'add_rate': 0.6779593076438524, 'tem': 1.1996425266851576, 'consis_rate': 1.7148740230437314, 'use_att': 0}
mean: 0.7838999999999999
[0.791 0.799 0.788 0.768 0.784 0.786 0.769 0.791 0.782 0.781]
cur_param: {'lr': 0.014744759843861808, 'weight_decay': 0.001645930004480317, 'dropout': 0.33130100685724306, 'patience': 60, 'lr_reduce_freq': 90, 'spt_alg': 'prim', 'spt_attr': 'edge_degree', 'manifold': 'PoincareBall', 'num_layers': 3, 'num_adj': 6, 'add_rate': 0.9360990650426944, 'tem': 1.560521684555317, 'consis_rate': 1.2538802430660974, 'use_att': 0}
mean: 0.7905000000000001
[0.793 0.786 0.79  0.8   0.79  0.786 0.781 0.777 0.795 0.807]
cur_param: {'lr': 0.004410871234800914, 'weight_decay': 0.002750263608330456, 'dropout': 0.15660550346713845, 'patience': 100, 'lr_reduce_freq': 70, 'spt_alg': 'prim', 'spt_attr': 'edge_degree', 'manifold': 'PoincareBall', 'num_layers': 3, 'num_adj': 4, 'add_rate': 0.4411339350413539, 'tem': 1.3947096272562067, 'consis_rate': 1.5364653262201482, 'use_att': 0}
mean: 0.7795
[0.784 0.786 0.8   0.764 0.761 0.796 0.77  0.77  0.786 0.778]
cur_param: {'lr': 0.002945353832896386, 'weight_decay': 0.024121639393815834, 'dropout': 0.5169760057705545, 'patience': 80, 'lr_reduce_freq': 50, 'spt_alg': 'prim', 'spt_attr': 'edge_degree', 'manifold': 'PoincareBall', 'num_layers': 3, 'num_adj': 8, 'add_rate': 0.6560036992044403, 'tem': 0.9138153443415808, 'consis_rate': 1.925352287890529, 'use_att': 0}
mean: 0.1609
[0.237 0.066 0.094 0.13  0.16  0.15  0.142 0.295 0.176 0.159]
cur_param: {'lr': 0.012359652650635235, 'weight_decay': 0.0007752622052408434, 'dropout': 0.39826953793936526, 'patience': 60, 'lr_reduce_freq': 110, 'spt_alg': 'prim', 'spt_attr': 'edge_degree', 'manifold': 'PoincareBall', 'num_layers': 3, 'num_adj': 6, 'add_rate': 0.36832712388447314, 'tem': 1.775104727722191, 'consis_rate': 1.1261177362252965, 'use_att': 1}[32m[I 2022-06-21 21:02:13,530][0m Trial 18 finished with value: 0.8044 and parameters: {'lr': 0.012359652650635235, 'weight_decay': 0.0007752622052408434, 'dropout': 0.39826953793936526, 'patience': 60, 'lr_reduce_freq': 110, 'spt_alg': 'prim', 'spt_attr': 'edge_degree', 'manifold': 'PoincareBall', 'num_layers': 3, 'num_adj': 6, 'add_rate': 0.36832712388447314, 'tem': 1.775104727722191, 'consis_rate': 1.1261177362252965, 'use_att': 1}. Best is trial 18 with value: 0.8044.[0m
[32m[I 2022-06-21 21:23:02,090][0m Trial 19 finished with value: 0.7828 and parameters: {'lr': 0.013204781677994859, 'weight_decay': 0.003091094542215423, 'dropout': 0.4198543939247135, 'patience': 80, 'lr_reduce_freq': 110, 'spt_alg': 'prim', 'spt_attr': 'edge_degree', 'manifold': 'PoincareBall', 'num_layers': 3, 'num_adj': 4, 'add_rate': 0.3405352161619245, 'tem': 1.8259490023644185, 'consis_rate': 1.096644080176137, 'use_att': 1}. Best is trial 18 with value: 0.8044.[0m
[32m[I 2022-06-21 22:14:15,474][0m Trial 20 finished with value: 0.7525000000000001 and parameters: {'lr': 0.009099138265182992, 'weight_decay': 0.0011509712118118972, 'dropout': 0.788710414539401, 'patience': 100, 'lr_reduce_freq': 150, 'spt_alg': 'prim', 'spt_attr': 'edge_degree', 'manifold': 'PoincareBall', 'num_layers': 3, 'num_adj': 8, 'add_rate': 0.4891038852561241, 'tem': 1.7439361112769398, 'consis_rate': 1.485794718941968, 'use_att': 1}. Best is trial 18 with value: 0.8044.[0m
[32m[I 2022-06-21 22:38:14,527][0m Trial 21 finished with value: 0.7976000000000001 and parameters: {'lr': 0.00508784277799281, 'weight_decay': 0.0009069477688882628, 'dropout': 0.3179737700151928, 'patience': 60, 'lr_reduce_freq': 90, 'spt_alg': 'prim', 'spt_attr': 'edge_degree', 'manifold': 'PoincareBall', 'num_layers': 3, 'num_adj': 6, 'add_rate': 0.3853787610491254, 'tem': 1.997839402411448, 'consis_rate': 1.1459001673667863, 'use_att': 1}. Best is trial 18 with value: 0.8044.[0m
[32m[I 2022-06-21 23:03:42,513][0m Trial 22 finished with value: 0.7997 and parameters: {'lr': 0.005056890907855307, 'weight_decay': 0.000885707793125855, 'dropout': 0.5319980646932596, 'patience': 60, 'lr_reduce_freq': 90, 'spt_alg': 'prim', 'spt_attr': 'edge_degree', 'manifold': 'PoincareBall', 'num_layers': 3, 'num_adj': 6, 'add_rate': 0.3840298405890444, 'tem': 1.9498979866831119, 'consis_rate': 1.1824480977571579, 'use_att': 1}. Best is trial 18 with value: 0.8044.[0m
[32m[I 2022-06-21 23:37:39,279][0m Trial 23 finished with value: 0.7945 and parameters: {'lr': 0.003924838308049071, 'weight_decay': 0.0028005271305415243, 'dropout': 0.5603284041427898, 'patience': 60, 'lr_reduce_freq': 110, 'spt_alg': 'prim', 'spt_attr': 'edge_degree', 'manifold': 'PoincareBall', 'num_layers': 3, 'num_adj': 6, 'add_rate': 0.35885810864374873, 'tem': 1.6871273800395723, 'consis_rate': 1.102385912815491, 'use_att': 1}. Best is trial 18 with value: 0.8044.[0m
[32m[I 2022-06-22 00:13:16,115][0m Trial 24 finished with value: 0.7942 and parameters: {'lr': 0.002159264564479674, 'weight_decay': 0.0009588307015630774, 'dropout': 0.49095573541714943, 'patience': 60, 'lr_reduce_freq': 90, 'spt_alg': 'prim', 'spt_attr': 'edge_degree', 'manifold': 'PoincareBall', 'num_layers': 3, 'num_adj': 6, 'add_rate': 0.273873168313692, 'tem': 1.8884027831520118, 'consis_rate': 0.7522927930922441, 'use_att': 1}. Best is trial 18 with value: 0.8044.[0m
[32m[I 2022-06-22 00:23:38,262][0m Trial 25 finished with value: 0.28579999999999994 and parameters: {'lr': 0.014511362135200243, 'weight_decay': 0.0157028830139297, 'dropout': 0.6456696158307439, 'patience': 60, 'lr_reduce_freq': 110, 'spt_alg': 'prim', 'spt_attr': 'edge_degree', 'manifold': 'PoincareBall', 'num_layers': 3, 'num_adj': 4, 'add_rate': 0.4936794761457731, 'tem': 1.647405360549277, 'consis_rate': 1.4416598093795927, 'use_att': 1}. Best is trial 18 with value: 0.8044.[0m
[32m[I 2022-06-22 01:30:31,714][0m Trial 26 finished with value: 0.7926 and parameters: {'lr': 0.001504576141721544, 'weight_decay': 0.004106793796002261, 'dropout': 0.38286387422107254, 'patience': 80, 'lr_reduce_freq': 130, 'spt_alg': 'prim', 'spt_attr': 'edge_degree', 'manifold': 'PoincareBall', 'num_layers': 3, 'num_adj': 6, 'add_rate': 0.3972915590911233, 'tem': 1.375446900658186, 'consis_rate': 1.2093406888759421, 'use_att': 1}. Best is trial 18 with value: 0.8044.[0m
