[32m[I 2022-06-25 08:40:18,799][0m Trial 131 finished with value: 0.8196 and parameters: {'lr': 0.0016870197137856251, 'weight_decay': 0.0009718126657364906, 'dropout': 0.7833526481469087, 'patience': 100, 'lr_reduce_freq': 150, 'spt_alg': 'prim', 'spt_attr': 'edge_degree', 'manifold': 'PoincareBall', 'num_layers': 3, 'num_adj': 8, 'add_rate': 0.6552306983938554, 'tem': 1.5984588057060463, 'consis_rate': 1.477167324786618, 'use_att': 1}. Best is trial 121 with value: 0.8208.[0m

mean: 0.8137000000000001
[0.814 0.814 0.804 0.817 0.81  0.799 0.817 0.835 0.821 0.806]
cur_param: {'lr': 0.0024067108672114405, 'weight_decay': 0.0006152353225281364, 'dropout': 0.798239201884032, 'patience': 100, 'lr_reduce_freq': 150, 'spt_alg': 'prim', 'spt_attr': 'edge_degree', 'manifold': 'PoincareBall', 'num_layers': 3, 'num_adj': 8, 'add_rate': 0.5917012603548808, 'tem': 1.6410741966443751, 'consis_rate': 1.450494198909073, 'use_att': 1}
mean: 0.8192999999999999
[0.808 0.818 0.831 0.823 0.826 0.81  0.797 0.822 0.831 0.827]
cur_param: {'lr': 0.002447119360524048, 'weight_decay': 0.0005064759881222768, 'dropout': 0.831737207823637, 'patience': 100, 'lr_reduce_freq': 150, 'spt_alg': 'prim', 'spt_attr': 'edge_degree', 'manifold': 'PoincareBall', 'num_layers': 3, 'num_adj': 8, 'add_rate': 0.589552227903704, 'tem': 0.5749699116571598, 'consis_rate': 1.3505847187382183, 'use_att': 1}
mean: 0.8192999999999999
[0.82  0.813 0.824 0.821 0.81  0.819 0.798 0.828 0.835 0.825]
cur_param: {'lr': 0.002390587609513076, 'weight_decay': 0.0005523619612702224, 'dropout': 0.8410848833325119, 'patience': 100, 'lr_reduce_freq': 150, 'spt_alg': 'prim', 'spt_attr': 'edge_degree', 'manifold': 'PoincareBall', 'num_layers': 3, 'num_adj': 8, 'add_rate': 0.5862683760951148, 'tem': 0.5274012169383753, 'consis_rate': 1.4469621119409726, 'use_att': 1}
mean: 0.8117000000000001
[0.812 0.811 0.806 0.819 0.815 0.816 0.81  0.816 0.815 0.797]
cur_param: {'lr': 0.0026514077510975736, 'weight_decay': 0.0005033651128142451, 'dropout': 0.9447002611509521, 'patience': 100, 'lr_reduce_freq': 150, 'spt_alg': 'prim', 'spt_attr': 'edge_degree', 'manifold': 'PoincareBall', 'num_layers': 3, 'num_adj': 8, 'add_rate': 0.6041592015687265, 'tem': 0.6115541530810397, 'consis_rate': 1.3430470850473526, 'use_att': 0}
mean: 0.2613
[0.147 0.144 0.145 0.145 0.319 0.585 0.322 0.301 0.188 0.317]
cur_param: {'lr': 0.00186057063746225, 'weight_decay': 0.0006426895297226633, 'dropout': 0.8101997307739173, 'patience': 100, 'lr_reduce_freq': 150, 'spt_alg': 'prim', 'spt_attr': 'edge_degree', 'manifold': 'PoincareBall', 'num_layers': 3, 'num_adj': 8, 'add_rate': 0.6568281134833001, 'tem': 0.3536253979610686, 'consis_rate': 1.5126872444047563, 'use_att': 1}
mean: 0.8188000000000001
[0.827 0.81  0.818 0.822 0.813 0.811 0.826 0.822 0.824 0.815]
cur_param: {'lr': 0.0019293587115145083, 'weight_decay': 0.00062250031661427, 'dropout': 0.8562658752531496, 'patience': 100, 'lr_reduce_freq': 150, 'spt_alg': 'prim', 'spt_attr': 'edge_degree', 'manifold': 'PoincareBall', 'num_layers': 3, 'num_adj': 8, 'add_rate': 0.6601547964035557, 'tem': 0.21090562721786718, 'consis_rate': 1.6474322112126432, 'use_att': 1}
mean: 0.8057000000000001
[0.81  0.812 0.816 0.807 0.816 0.796 0.791 0.813 0.815 0.781]
cur_param: {'lr': 0.0023565690564790534, 'weight_decay': 0.0006631285936904406, 'dropout': 0.8065570102674838, 'patience': 100, 'lr_reduce_freq': 150, 'spt_alg': 'prim', 'spt_attr': 'edge_degree', 'manifold': 'PoincareBall', 'num_layers': 3, 'num_adj': 8, 'add_rate': 0.6455094880732734, 'tem': 0.3177383108746156, 'consis_rate': 1.3820007025481718, 'use_att': 1}
mean: 0.8175999999999999
[0.821 0.819 0.824 0.82  0.822 0.796 0.827 0.817 0.824 0.806]
cur_param: {'lr': 0.001707504742271649, 'weight_decay': 0.0008953665558199746, 'dropout': 0.827614242627509, 'patience': 100, 'lr_reduce_freq': 150, 'spt_alg': 'prim', 'spt_attr': 'edge_degree', 'manifold': 'PoincareBall', 'num_layers': 3, 'num_adj': 8, 'add_rate': 0.5964670806883148, 'tem': 0.5870464372309184, 'consis_rate': 1.4894310721594985, 'use_att': 1}
mean: 0.8208
[0.826 0.822 0.827 0.806 0.821 0.82  0.81  0.831 0.827 0.818]
cur_param: {'lr': 0.0018356123040987873, 'weight_decay': 0.16434819432139888, 'dropout': 0.8044382822598346, 'patience': 100, 'lr_reduce_freq': 150, 'spt_alg': 'prim', 'spt_attr': 'edge_degree', 'manifold': 'PoincareBall', 'num_layers': 3, 'num_adj': 8, 'add_rate': 0.5930072649438591, 'tem': 0.5285365038549205, 'consis_rate': 1.5095074498684693, 'use_att': 1}
mean: 0.30300000000000005
[0.319 0.319 0.319 0.319 0.149 0.319 0.319 0.329 0.319 0.319]
cur_param: {'lr': 0.001544425805847352, 'weight_decay': 0.0009608632740688126, 'dropout': 0.760186545596859, 'patience': 100, 'lr_reduce_freq': 150, 'spt_alg': 'prim', 'spt_attr': 'edge_degree', 'manifold': 'PoincareBall', 'num_layers': 3, 'num_adj': 8, 'add_rate': 0.6261009044277341, 'tem': 1.6447813364856845, 'consis_rate': 1.4222522879393846, 'use_att': 1}
mean: 0.8184999999999999
[0.817 0.816 0.817 0.829 0.811 0.817 0.816 0.829 0.818 0.815]
cur_param: {'lr': 0.0015078097846519978, 'weight_decay': 0.0007916687645768064, 'dropout': 0.9091762908937181, 'patience': 100, 'lr_reduce_freq': 150, 'spt_alg': 'prim', 'spt_attr': 'edge_degree', 'manifold': 'PoincareBall', 'num_layers': 3, 'num_adj': 8, 'add_rate': 0.47756548927456055, 'tem': 0.5893080145482652, 'consis_rate': 1.5283737744425443, 'use_att': 1}
mean: 0.7215999999999999
[0.763 0.773 0.789 0.746 0.662 0.318 0.78  0.836 0.795 0.754]
cur_param: {'lr': 0.0020577139307171974, 'weight_decay': 0.45679532359524844, 'dropout': 0.7338278814355095, 'patience': 100, 'lr_reduce_freq': 150, 'spt_alg': 'prim', 'spt_attr': 'edge_degree', 'manifold': 'PoincareBall', 'num_layers': 3, 'num_adj': 8, 'add_rate': 0.6261174018560227, 'tem': 0.6879787426277804, 'consis_rate': 1.493874880839477, 'use_att': 1}
mean: 0.319
[0.319 0.319 0.319 0.319 0.319 0.319 0.319 0.319 0.319 0.319]
cur_param: {'lr': 0.0021856115991460865, 'weight_decay': 0.0005721170442396824, 'dropout': 0.7600081616650326, 'patience': 100, 'lr_reduce_freq': 150, 'spt_alg': 'prim', 'spt_attr': 'similarity', 'manifold': 'PoincareBall', 'num_layers': 3, 'num_adj': 8, 'add_rate': 0.6850385252704094, 'tem': 0.47950436684454945, 'consis_rate': 1.3824130741878649, 'use_att': 1}
mean: 0.8122999999999999
[0.819 0.8   0.799 0.804 0.814 0.808 0.818 0.803 0.833 0.825]
cur_param: {'lr': 0.0015478732262695733, 'weight_decay': 0.014658652229813465, 'dropout': 0.8261889149777691, 'patience': 100, 'lr_reduce_freq': 150, 'spt_alg': 'prim', 'spt_attr': 'edge_degree', 'manifold': 'PoincareBall', 'num_layers': 3, 'num_adj': 8, 'add_rate': 0.5617752407902685, 'tem': 1.6485325544544251, 'consis_rate': 1.4209729781389577, 'use_att': 1}
mean: 0.3323
[0.366 0.319 0.318 0.319 0.338 0.319 0.322 0.332 0.363 0.327]
cur_param: {'lr': 0.002917381840580003, 'weight_decay': 0.0011109379395382462, 'dropout': 0.8646971417522059, 'patience': 100, 'lr_reduce_freq': 150, 'spt_alg': 'prim', 'spt_attr': 'edge_degree', 'manifold': 'PoincareBall', 'num_layers': 3, 'num_adj': 8, 'add_rate': 0.5929825271562139, 'tem': 0.5746017038486249, 'consis_rate': 1.5678248284343181, 'use_att': 1}
mean: 0.8100999999999999
[0.816 0.819 0.793 0.825 0.814 0.817 0.781 0.82  0.825 0.791]
cur_param: {'lr': 0.001825462033115484, 'weight_decay': 0.0006792569053118615, 'dropout': 0.7689301355748609, 'patience': 100, 'lr_reduce_freq': 150, 'spt_alg': 'prim', 'spt_attr': 'edge_degree', 'manifold': 'PoincareBall', 'num_layers': 4, 'num_adj': 8, 'add_rate': 0.42440454903050223, 'tem': 1.5282434274137544, 'consis_rate': 1.6152535134117483, 'use_att': 1}
mean: 0.7217
[0.721 0.681 0.726 0.788 0.736 0.691 0.675 0.732 0.756 0.711]
cur_param: {'lr': 0.002380175937218295, 'weight_decay': 0.000886109210914875, 'dropout': 0.8449224612441526, 'patience': 100, 'lr_reduce_freq': 150, 'spt_alg': 'prim', 'spt_attr': 'edge_degree', 'manifold': 'PoincareBall', 'num_layers': 3, 'num_adj': 8, 'add_rate': 0.6391538356313352, 'tem': 1.6521373806297097, 'consis_rate': 1.289584811153849, 'use_att': 1}
mean: 0.8135
[0.81  0.807 0.81  0.824 0.818 0.813 0.793 0.823 0.822 0.815]
cur_param: {'lr': 0.0016870197137856251, 'weight_decay': 0.0009718126657364906, 'dropout': 0.7833526481469087, 'patience': 100, 'lr_reduce_freq': 150, 'spt_alg': 'prim', 'spt_attr': 'edge_degree', 'manifold': 'PoincareBall', 'num_layers': 3, 'num_adj': 8, 'add_rate': 0.6552306983938554, 'tem': 1.5984588057060463, 'consis_rate': 1.477167324786618, 'use_att': 1}
mean: 0.8196
[0.815 0.815 0.817 0.822 0.815 0.824 0.811 0.833 0.821 0.823]
cur_param: {'lr': 0.0016256089703688035, 'weight_decay': 0.0007100093394153007, 'dropout': 0.737174317577053, 'patience': 100, 'lr_reduce_freq': 150, 'spt_alg': 'prim', 'spt_attr': 'edge_degree', 'manifold': 'PoincareBall', 'num_layers': 3, 'num_adj': 8, 'add_rate': 0.718061015719701, 'tem': 1.6962934349554126, 'consis_rate': 1.4814240222997097, 'use_att': 1}[32m[I 2022-06-25 09:37:15,890][0m Trial 132 finished with value: 0.8171999999999999 and parameters: {'lr': 0.0016256089703688035, 'weight_decay': 0.0007100093394153007, 'dropout': 0.737174317577053, 'patience': 100, 'lr_reduce_freq': 150, 'spt_alg': 'prim', 'spt_attr': 'edge_degree', 'manifold': 'PoincareBall', 'num_layers': 3, 'num_adj': 8, 'add_rate': 0.718061015719701, 'tem': 1.6962934349554126, 'consis_rate': 1.4814240222997097, 'use_att': 1}. Best is trial 121 with value: 0.8208.[0m
[32m[I 2022-06-25 10:43:55,715][0m Trial 133 finished with value: 0.8177 and parameters: {'lr': 0.0014843336229230697, 'weight_decay': 0.0008191129588174202, 'dropout': 0.8113226185442423, 'patience': 100, 'lr_reduce_freq': 150, 'spt_alg': 'prim', 'spt_attr': 'edge_degree', 'manifold': 'PoincareBall', 'num_layers': 3, 'num_adj': 8, 'add_rate': 0.619127333020437, 'tem': 1.6098705880339423, 'consis_rate': 1.3565420445473575, 'use_att': 1}. Best is trial 121 with value: 0.8208.[0m
[32m[I 2022-06-25 11:38:57,243][0m Trial 134 finished with value: 0.8163 and parameters: {'lr': 0.0018984835612301978, 'weight_decay': 0.000595620895970777, 'dropout': 0.7827970990189679, 'patience': 100, 'lr_reduce_freq': 150, 'spt_alg': 'prim', 'spt_attr': 'edge_degree', 'manifold': 'PoincareBall', 'num_layers': 3, 'num_adj': 8, 'add_rate': 0.6696747548934529, 'tem': 1.6722610179668742, 'consis_rate': 1.40860251105493, 'use_att': 1}. Best is trial 121 with value: 0.8208.[0m
[32m[I 2022-06-25 12:32:55,675][0m Trial 135 finished with value: 0.8176 and parameters: {'lr': 0.002158130724009197, 'weight_decay': 0.001162980193674193, 'dropout': 0.7502975949119891, 'patience': 100, 'lr_reduce_freq': 150, 'spt_alg': 'prim', 'spt_attr': 'edge_degree', 'manifold': 'PoincareBall', 'num_layers': 3, 'num_adj': 8, 'add_rate': 0.6006936887215949, 'tem': 1.7654319403135543, 'consis_rate': 1.5291564918861602, 'use_att': 1}. Best is trial 121 with value: 0.8208.[0m
[32m[I 2022-06-25 14:24:26,077][0m Trial 136 finished with value: 0.7929 and parameters: {'lr': 0.0012232916934884648, 'weight_decay': 0.0005041646436667898, 'dropout': 0.8833589635612257, 'patience': 100, 'lr_reduce_freq': 150, 'spt_alg': 'prim', 'spt_attr': 'edge_degree', 'manifold': 'PoincareBall', 'num_layers': 3, 'num_adj': 8, 'add_rate': 0.5829015517081138, 'tem': 0.4873983262717255, 'consis_rate': 1.488661673910568, 'use_att': 1}. Best is trial 121 with value: 0.8208.[0m
[32m[I 2022-06-25 15:30:37,080][0m Trial 137 finished with value: 0.8174999999999999 and parameters: {'lr': 0.0016070719498088425, 'weight_decay': 0.0009645787956511894, 'dropout': 0.8115039815468716, 'patience': 100, 'lr_reduce_freq': 150, 'spt_alg': 'prim', 'spt_attr': 'edge_degree', 'manifold': 'PoincareBall', 'num_layers': 3, 'num_adj': 8, 'add_rate': 0.6969256478046008, 'tem': 1.5462397152175889, 'consis_rate': 1.356392677043752, 'use_att': 1}. Best is trial 121 with value: 0.8208.[0m
[32m[I 2022-06-25 15:41:56,914][0m Trial 138 finished with value: 0.8148 and parameters: {'lr': 0.001398157753881031, 'weight_decay': 0.0007383045608889407, 'dropout': 0.7721879280253855, 'patience': 100, 'lr_reduce_freq': 150, 'spt_alg': 'prim', 'spt_attr': 'edge_degree', 'manifold': 'PoincareBall', 'num_layers': 3, 'num_adj': 8, 'add_rate': 0.5234230081583018, 'tem': 1.5833203205901623, 'consis_rate': 1.4368416022438666, 'use_att': 0}. Best is trial 121 with value: 0.8208.[0m
[32m[I 2022-06-25 16:42:54,940][0m Trial 139 finished with value: 0.8127000000000001 and parameters: {'lr': 0.0017578924821302342, 'weight_decay': 0.0013274941686448613, 'dropout': 0.8295042936564208, 'patience': 100, 'lr_reduce_freq': 150, 'spt_alg': 'prim', 'spt_attr': 'edge_degree', 'manifold': 'PoincareBall', 'num_layers': 3, 'num_adj': 8, 'add_rate': 0.6340421139018962, 'tem': 0.6576678042561497, 'consis_rate': 1.200597239970628, 'use_att': 1}. Best is trial 121 with value: 0.8208.[0m
[32m[I 2022-06-25 17:20:40,320][0m Trial 140 finished with value: 0.4023 and parameters: {'lr': 0.0010719736377099633, 'weight_decay': 0.00888674178959704, 'dropout': 0.7978804003868519, 'patience': 100, 'lr_reduce_freq': 150, 'spt_alg': 'prim', 'spt_attr': 'similarity', 'manifold': 'PoincareBall', 'num_layers': 3, 'num_adj': 8, 'add_rate': 0.5562402585036801, 'tem': 1.0336086052797526, 'consis_rate': 1.2389888855554003, 'use_att': 1}. Best is trial 121 with value: 0.8208.[0m
[32m[I 2022-06-25 18:05:17,279][0m Trial 141 finished with value: 0.8177 and parameters: {'lr': 0.0017640365847510166, 'weight_decay': 0.0010528823490755963, 'dropout': 0.787938740457754, 'patience': 100, 'lr_reduce_freq': 150, 'spt_alg': 'prim', 'spt_attr': 'edge_degree', 'manifold': 'PoincareBall', 'num_layers': 3, 'num_adj': 8, 'add_rate': 0.6481744081521695, 'tem': 1.6286729834028164, 'consis_rate': 1.4615773768577172, 'use_att': 1}. Best is trial 121 with value: 0.8208.[0m
[32m[I 2022-06-25 18:52:04,664][0m Trial 142 finished with value: 0.8080999999999999 and parameters: {'lr': 0.0020304913028050676, 'weight_decay': 0.0009628014927110625, 'dropout': 0.8512451714746214, 'patience': 100, 'lr_reduce_freq': 150, 'spt_alg': 'prim', 'spt_attr': 'edge_degree', 'manifold': 'PoincareBall', 'num_layers': 3, 'num_adj': 8, 'add_rate': 0.6631357626686073, 'tem': 1.5872454519100436, 'consis_rate': 1.3881817431616812, 'use_att': 1}. Best is trial 121 with value: 0.8208.[0m
[32m[I 2022-06-25 19:24:22,505][0m Trial 143 finished with value: 0.30789999999999995 and parameters: {'lr': 0.001626128684108736, 'weight_decay': 0.03452030218090802, 'dropout': 0.7923210650868363, 'patience': 100, 'lr_reduce_freq': 150, 'spt_alg': 'prim', 'spt_attr': 'edge_degree', 'manifold': 'PoincareBall', 'num_layers': 3, 'num_adj': 8, 'add_rate': 0.6097867661991586, 'tem': 1.6894049036011105, 'consis_rate': 1.43646738671842, 'use_att': 1}. Best is trial 121 with value: 0.8208.[0m
[32m[I 2022-06-25 20:16:18,654][0m Trial 144 finished with value: 0.8174999999999999 and parameters: {'lr': 0.0013193455441381139, 'weight_decay': 0.000635890701432327, 'dropout': 0.7575513486650582, 'patience': 100, 'lr_reduce_freq': 150, 'spt_alg': 'prim', 'spt_attr': 'edge_degree', 'manifold': 'PoincareBall', 'num_layers': 3, 'num_adj': 8, 'add_rate': 0.8647966461923152, 'tem': 1.5039383234266894, 'consis_rate': 1.5554588901864144, 'use_att': 1}. Best is trial 121 with value: 0.8208.[0m
[32m[I 2022-06-25 21:03:27,061][0m Trial 145 finished with value: 0.8160000000000001 and parameters: {'lr': 0.0014941210572425466, 'weight_decay': 0.0008251959409930206, 'dropout': 0.8251081404822871, 'patience': 100, 'lr_reduce_freq': 150, 'spt_alg': 'prim', 'spt_attr': 'edge_degree', 'manifold': 'PoincareBall', 'num_layers': 3, 'num_adj': 8, 'add_rate': 0.6559029283050114, 'tem': 1.7632350891456443, 'consis_rate': 1.485685165911379, 'use_att': 1}. Best is trial 121 with value: 0.8208.[0m
[32m[I 2022-06-25 21:45:16,820][0m Trial 146 finished with value: 0.8135 and parameters: {'lr': 0.0019337978137344964, 'weight_decay': 0.0007312647949938932, 'dropout': 0.729319204779381, 'patience': 100, 'lr_reduce_freq': 150, 'spt_alg': 'prim', 'spt_attr': 'edge_degree', 'manifold': 'PoincareBall', 'num_layers': 3, 'num_adj': 8, 'add_rate': 0.7258660483512323, 'tem': 0.3764928070329454, 'consis_rate': 1.3290752374210373, 'use_att': 1}. Best is trial 121 with value: 0.8208.[0m
[32m[I 2022-06-25 22:24:05,531][0m Trial 147 finished with value: 0.8177999999999999 and parameters: {'lr': 0.002554045561830356, 'weight_decay': 0.0009367277292774747, 'dropout': 0.7767877850923858, 'patience': 100, 'lr_reduce_freq': 150, 'spt_alg': 'prim', 'spt_attr': 'edge_degree', 'manifold': 'PoincareBall', 'num_layers': 3, 'num_adj': 8, 'add_rate': 0.6168603991389231, 'tem': 1.6362813556505116, 'consis_rate': 1.586462341282189, 'use_att': 1}. Best is trial 121 with value: 0.8208.[0m
[32m[I 2022-06-25 23:11:36,162][0m Trial 148 finished with value: 0.795 and parameters: {'lr': 0.002253945518344835, 'weight_decay': 0.0005656114968608423, 'dropout': 0.8686909360176321, 'patience': 100, 'lr_reduce_freq': 150, 'spt_alg': 'prim', 'spt_attr': 'edge_degree', 'manifold': 'PoincareBall', 'num_layers': 3, 'num_adj': 8, 'add_rate': 0.6859346965765227, 'tem': 1.591808542843194, 'consis_rate': 1.4002750174971859, 'use_att': 1}. Best is trial 121 with value: 0.8208.[0m
