[32m[I 2022-06-30 12:50:13,985][0m Trial 89 finished with value: 0.8181999999999998 and parameters: {'lr': 0.010307604236576822, 'weight_decay': 0.000911669755749703, 'dropout': 0.7975950017954802, 'patience': 100, 'lr_reduce_freq': 80, 'spt_alg': 'kruskal', 'spt_attr': 'similarity', 'manifold': 'Hyperboloid', 'num_layers': 3, 'dim': 176, 'num_adj': 4, 'add_rate': 0.5995620064026985, 'tem': 0.9291014730152591, 'consis_rate': 0.7061586826056224, 'use_att': 1}. Best is trial 89 with value: 0.8181999999999998.[0m

mean: 0.8149
[0.807 0.813 0.802 0.818 0.813 0.815 0.82  0.818 0.829 0.814]
cur_param: {'lr': 0.026610372236517427, 'weight_decay': 0.0015643411822588976, 'dropout': 0.7641963752612295, 'patience': 100, 'lr_reduce_freq': 80, 'spt_alg': 'kruskal', 'spt_attr': 'similarity', 'manifold': 'Hyperboloid', 'num_layers': 3, 'dim': 256, 'num_adj': 4, 'add_rate': 0.7544349427796716, 'tem': 0.9816364396751533, 'consis_rate': 1.0062311486254933, 'use_att': 1}
mean: 0.8041
[0.81  0.784 0.819 0.802 0.789 0.813 0.805 0.82  0.798 0.801]
cur_param: {'lr': 0.01757721255875361, 'weight_decay': 0.0015212847278173777, 'dropout': 0.6674563685112402, 'patience': 100, 'lr_reduce_freq': 90, 'spt_alg': 'kruskal', 'spt_attr': 'similarity', 'manifold': 'Hyperboloid', 'num_layers': 3, 'dim': 208, 'num_adj': 4, 'add_rate': 0.8208826279225484, 'tem': 0.8991656525727548, 'consis_rate': 1.1277275119736339, 'use_att': 1}
mean: 0.8037000000000001
[0.809 0.783 0.81  0.814 0.811 0.812 0.81  0.8   0.802 0.786]
cur_param: {'lr': 0.012596817623488474, 'weight_decay': 0.0010877493628801214, 'dropout': 0.7733288409560796, 'patience': 100, 'lr_reduce_freq': 80, 'spt_alg': 'kruskal', 'spt_attr': 'similarity', 'manifold': 'Hyperboloid', 'num_layers': 3, 'dim': 288, 'num_adj': 4, 'add_rate': 0.7604685822355743, 'tem': 1.0203818324479987, 'consis_rate': 1.4932548143072137, 'use_att': 1}
mean: 0.8088999999999998
[0.818 0.808 0.814 0.798 0.813 0.814 0.798 0.825 0.811 0.79 ]
cur_param: {'lr': 0.009091349032058027, 'weight_decay': 0.0008666703634119565, 'dropout': 0.7218990562929036, 'patience': 100, 'lr_reduce_freq': 90, 'spt_alg': 'kruskal', 'spt_attr': 'similarity', 'manifold': 'Hyperboloid', 'num_layers': 3, 'dim': 256, 'num_adj': 4, 'add_rate': 0.6980023170554254, 'tem': 1.1283639065351954, 'consis_rate': 1.3384869121446927, 'use_att': 1}
mean: 0.8145
[0.807 0.81  0.805 0.837 0.828 0.799 0.824 0.804 0.806 0.825]
cur_param: {'lr': 0.009416361475527962, 'weight_decay': 0.00230762251614851, 'dropout': 0.6988854356329957, 'patience': 100, 'lr_reduce_freq': 100, 'spt_alg': 'kruskal', 'spt_attr': 'edge_degree', 'manifold': 'Hyperboloid', 'num_layers': 3, 'dim': 256, 'num_adj': 4, 'add_rate': 0.6943386497854694, 'tem': 1.0847847821608276, 'consis_rate': 1.172137975823345, 'use_att': 1}
mean: 0.7982000000000001
[0.799 0.811 0.799 0.808 0.78  0.803 0.81  0.802 0.763 0.807]
cur_param: {'lr': 0.00841720988649579, 'weight_decay': 0.0018293901089036868, 'dropout': 0.6692142994335399, 'patience': 100, 'lr_reduce_freq': 100, 'spt_alg': 'kruskal', 'spt_attr': 'similarity', 'manifold': 'Hyperboloid', 'num_layers': 3, 'dim': 288, 'num_adj': 4, 'add_rate': 0.7025328188097698, 'tem': 1.1168855873725523, 'consis_rate': 1.23833705331208, 'use_att': 1}
mean: 0.8022
[0.807 0.797 0.805 0.8   0.806 0.791 0.814 0.815 0.801 0.786]
cur_param: {'lr': 0.011518670139925823, 'weight_decay': 0.0008905344667132935, 'dropout': 0.7178348006714511, 'patience': 100, 'lr_reduce_freq': 80, 'spt_alg': 'kruskal', 'spt_attr': 'similarity', 'manifold': 'Hyperboloid', 'num_layers': 5, 'dim': 256, 'num_adj': 4, 'add_rate': 0.8361326535988234, 'tem': 1.1527942113506426, 'consis_rate': 1.3840848409679436, 'use_att': 1}
mean: 0.7473
[0.731 0.718 0.743 0.71  0.79  0.748 0.775 0.776 0.747 0.735]
cur_param: {'lr': 0.013248066214670838, 'weight_decay': 0.0013136526146256932, 'dropout': 0.7772576936567106, 'patience': 100, 'lr_reduce_freq': 90, 'spt_alg': 'kruskal', 'spt_attr': 'similarity', 'manifold': 'Hyperboloid', 'num_layers': 3, 'dim': 352, 'num_adj': 4, 'add_rate': 0.644765898365198, 'tem': 1.0621445073069176, 'consis_rate': 1.3356910296503828, 'use_att': 1}
mean: 0.8164999999999999
[0.823 0.817 0.818 0.795 0.822 0.827 0.831 0.816 0.808 0.808]
cur_param: {'lr': 0.013064689711936079, 'weight_decay': 0.0012552466642783598, 'dropout': 0.7821237443919815, 'patience': 100, 'lr_reduce_freq': 90, 'spt_alg': 'kruskal', 'spt_attr': 'similarity', 'manifold': 'Hyperboloid', 'num_layers': 3, 'dim': 336, 'num_adj': 4, 'add_rate': 0.6509133407698249, 'tem': 1.0747902245724517, 'consis_rate': 1.3296320302805424, 'use_att': 1}
mean: 0.8093
[0.811 0.807 0.795 0.802 0.817 0.814 0.82  0.813 0.801 0.813]
cur_param: {'lr': 0.018918951340971518, 'weight_decay': 0.0008758438834547963, 'dropout': 0.7366567991805193, 'patience': 100, 'lr_reduce_freq': 100, 'spt_alg': 'kruskal', 'spt_attr': 'similarity', 'manifold': 'Hyperboloid', 'num_layers': 3, 'dim': 368, 'num_adj': 4, 'add_rate': 0.7681509562187377, 'tem': 0.9527200497095741, 'consis_rate': 1.5614010330282393, 'use_att': 1}
mean: 0.8089999999999999
[0.817 0.802 0.815 0.793 0.819 0.815 0.788 0.814 0.822 0.805]
cur_param: {'lr': 0.00992589917875716, 'weight_decay': 0.0014644592131534638, 'dropout': 0.7454285754610017, 'patience': 100, 'lr_reduce_freq': 70, 'spt_alg': 'kruskal', 'spt_attr': 'similarity', 'manifold': 'Hyperboloid', 'num_layers': 3, 'dim': 352, 'num_adj': 4, 'add_rate': 0.7014091257604529, 'tem': 1.0540055124585188, 'consis_rate': 1.136200350787755, 'use_att': 1}
mean: 0.8069000000000001
[0.815 0.804 0.796 0.808 0.808 0.809 0.814 0.793 0.801 0.821]
cur_param: {'lr': 0.028211930251716314, 'weight_decay': 0.0007473113637222327, 'dropout': 0.7143640402923924, 'patience': 100, 'lr_reduce_freq': 80, 'spt_alg': 'kruskal', 'spt_attr': 'similarity', 'manifold': 'Hyperboloid', 'num_layers': 3, 'dim': 192, 'num_adj': 4, 'add_rate': 0.7422285339739567, 'tem': 1.0054601399397187, 'consis_rate': 1.2084750446075874, 'use_att': 1}
mean: 0.8073
[0.807 0.827 0.803 0.8   0.808 0.805 0.807 0.806 0.802 0.808]
cur_param: {'lr': 0.014175659591195938, 'weight_decay': 0.0011574237686139965, 'dropout': 0.7808234535130789, 'patience': 100, 'lr_reduce_freq': 100, 'spt_alg': 'kruskal', 'spt_attr': 'similarity', 'manifold': 'Hyperboloid', 'num_layers': 3, 'dim': 224, 'num_adj': 4, 'add_rate': 0.7817287321216184, 'tem': 0.8412876333777575, 'consis_rate': 1.2869395375250643, 'use_att': 1}
mean: 0.8114000000000001
[0.825 0.818 0.817 0.819 0.824 0.815 0.805 0.801 0.798 0.792]
cur_param: {'lr': 0.021289616113462476, 'weight_decay': 0.0014020930434887429, 'dropout': 0.64890082510163, 'patience': 100, 'lr_reduce_freq': 90, 'spt_alg': 'kruskal', 'spt_attr': 'similarity', 'manifold': 'Hyperboloid', 'num_layers': 3, 'dim': 320, 'num_adj': 4, 'add_rate': 0.6713349718824035, 'tem': 1.1017110396179008, 'consis_rate': 1.3445232017416424, 'use_att': 1}
mean: 0.7976
[0.774 0.81  0.808 0.811 0.789 0.787 0.795 0.81  0.789 0.803]
cur_param: {'lr': 0.008282606585450129, 'weight_decay': 0.0016923810811313373, 'dropout': 0.6793868122587048, 'patience': 100, 'lr_reduce_freq': 30, 'spt_alg': 'kruskal', 'spt_attr': 'edge_degree', 'manifold': 'Hyperboloid', 'num_layers': 3, 'dim': 384, 'num_adj': 4, 'add_rate': 0.6342040034786184, 'tem': 1.137176265242531, 'consis_rate': 1.0853356021026295, 'use_att': 1}
mean: 0.8105
[0.825 0.804 0.822 0.816 0.814 0.804 0.811 0.797 0.803 0.809]
cur_param: {'lr': 0.010470008928918783, 'weight_decay': 0.0009505100187172323, 'dropout': 0.7622200777075244, 'patience': 100, 'lr_reduce_freq': 90, 'spt_alg': 'kruskal', 'spt_attr': 'similarity', 'manifold': 'Hyperboloid', 'num_layers': 3, 'dim': 176, 'num_adj': 4, 'add_rate': 0.7096645337860331, 'tem': 0.9345830355057598, 'consis_rate': 0.9568606878304251, 'use_att': 1}
mean: 0.8137000000000001
[0.813 0.815 0.822 0.811 0.822 0.8   0.809 0.819 0.809 0.817]
cur_param: {'lr': 0.010307604236576822, 'weight_decay': 0.000911669755749703, 'dropout': 0.7975950017954802, 'patience': 100, 'lr_reduce_freq': 80, 'spt_alg': 'kruskal', 'spt_attr': 'similarity', 'manifold': 'Hyperboloid', 'num_layers': 3, 'dim': 176, 'num_adj': 4, 'add_rate': 0.5995620064026985, 'tem': 0.9291014730152591, 'consis_rate': 0.7061586826056224, 'use_att': 1}
mean: 0.8181999999999998
[0.817 0.822 0.815 0.83  0.823 0.807 0.822 0.816 0.813 0.817]
cur_param: {'lr': 0.006361419924695291, 'weight_decay': 0.0009451181193164699, 'dropout': 0.7986931173506164, 'patience': 100, 'lr_reduce_freq': 80, 'spt_alg': 'kruskal', 'spt_attr': 'similarity', 'manifold': 'Hyperboloid', 'num_layers': 3, 'dim': 176, 'num_adj': 4, 'add_rate': 0.595132651499987, 'tem': 0.9702357755432387, 'consis_rate': 0.6733276917506932, 'use_att': 1}[32m[I 2022-06-30 13:17:58,203][0m Trial 90 finished with value: 0.8141999999999999 and parameters: {'lr': 0.006361419924695291, 'weight_decay': 0.0009451181193164699, 'dropout': 0.7986931173506164, 'patience': 100, 'lr_reduce_freq': 80, 'spt_alg': 'kruskal', 'spt_attr': 'similarity', 'manifold': 'Hyperboloid', 'num_layers': 3, 'dim': 176, 'num_adj': 4, 'add_rate': 0.595132651499987, 'tem': 0.9702357755432387, 'consis_rate': 0.6733276917506932, 'use_att': 1}. Best is trial 89 with value: 0.8181999999999998.[0m
[32m[I 2022-06-30 13:41:06,944][0m Trial 91 finished with value: 0.8119 and parameters: {'lr': 0.010385403977187496, 'weight_decay': 0.000935747101709217, 'dropout': 0.7969831015917712, 'patience': 100, 'lr_reduce_freq': 80, 'spt_alg': 'kruskal', 'spt_attr': 'similarity', 'manifold': 'Hyperboloid', 'num_layers': 3, 'dim': 176, 'num_adj': 4, 'add_rate': 0.6038053203822225, 'tem': 0.8700454983064971, 'consis_rate': 0.6595887078850294, 'use_att': 1}. Best is trial 89 with value: 0.8181999999999998.[0m
[32m[I 2022-06-30 13:54:49,679][0m Trial 92 finished with value: 0.8116 and parameters: {'lr': 0.006319878074830988, 'weight_decay': 0.0008428297787947504, 'dropout': 0.7596450239382597, 'patience': 50, 'lr_reduce_freq': 70, 'spt_alg': 'kruskal', 'spt_attr': 'similarity', 'manifold': 'Hyperboloid', 'num_layers': 3, 'dim': 176, 'num_adj': 4, 'add_rate': 0.5325668805857836, 'tem': 0.9259834163845524, 'consis_rate': 0.4784476806152831, 'use_att': 1}. Best is trial 89 with value: 0.8181999999999998.[0m
[32m[I 2022-06-30 14:17:07,092][0m Trial 93 finished with value: 0.8180999999999999 and parameters: {'lr': 0.011712076972865703, 'weight_decay': 0.0011185153779174801, 'dropout': 0.778882277764318, 'patience': 100, 'lr_reduce_freq': 80, 'spt_alg': 'kruskal', 'spt_attr': 'similarity', 'manifold': 'Hyperboloid', 'num_layers': 3, 'dim': 192, 'num_adj': 4, 'add_rate': 0.5929277853685382, 'tem': 0.9853299970718234, 'consis_rate': 0.7063703235057981, 'use_att': 1}. Best is trial 89 with value: 0.8181999999999998.[0m
[32m[I 2022-06-30 14:37:11,236][0m Trial 94 finished with value: 0.8106 and parameters: {'lr': 0.008801534097990385, 'weight_decay': 0.0012459372898549507, 'dropout': 0.7767228658142757, 'patience': 100, 'lr_reduce_freq': 80, 'spt_alg': 'kruskal', 'spt_attr': 'similarity', 'manifold': 'Hyperboloid', 'num_layers': 3, 'dim': 192, 'num_adj': 4, 'add_rate': 0.5954222245141921, 'tem': 0.9849014560880445, 'consis_rate': 0.7890815860641996, 'use_att': 1}. Best is trial 89 with value: 0.8181999999999998.[0m
[32m[I 2022-06-30 14:49:56,502][0m Trial 95 finished with value: 0.8102 and parameters: {'lr': 0.005267038391762602, 'weight_decay': 0.0011013542734606878, 'dropout': 0.7229484787974482, 'patience': 100, 'lr_reduce_freq': 70, 'spt_alg': 'kruskal', 'spt_attr': 'similarity', 'manifold': 'PoincareBall', 'num_layers': 3, 'dim': 192, 'num_adj': 4, 'add_rate': 0.5746924882207978, 'tem': 1.1746803368965815, 'consis_rate': 0.7143241882857245, 'use_att': 1}. Best is trial 89 with value: 0.8181999999999998.[0m
[32m[I 2022-06-30 15:51:13,444][0m Trial 96 finished with value: 0.7558 and parameters: {'lr': 0.011483409039272544, 'weight_decay': 0.000713341947119835, 'dropout': 0.7008446306335546, 'patience': 100, 'lr_reduce_freq': 80, 'spt_alg': 'kruskal', 'spt_attr': 'similarity', 'manifold': 'Hyperboloid', 'num_layers': 5, 'dim': 208, 'num_adj': 4, 'add_rate': 0.6450331429863111, 'tem': 0.9309637730592977, 'consis_rate': 0.5524470309863805, 'use_att': 1}. Best is trial 89 with value: 0.8181999999999998.[0m
[32m[I 2022-06-30 16:09:12,911][0m Trial 97 finished with value: 0.8173 and parameters: {'lr': 0.007713239212344241, 'weight_decay': 0.0009960861110796942, 'dropout': 0.7859932399073376, 'patience': 100, 'lr_reduce_freq': 90, 'spt_alg': 'kruskal', 'spt_attr': 'similarity', 'manifold': 'Hyperboloid', 'num_layers': 3, 'dim': 352, 'num_adj': 4, 'add_rate': 0.5167052855263878, 'tem': 1.0060241775424308, 'consis_rate': 0.9525851517636076, 'use_att': 1}. Best is trial 89 with value: 0.8181999999999998.[0m
[32m[I 2022-06-30 16:27:03,854][0m Trial 98 finished with value: 0.8157 and parameters: {'lr': 0.006531608870227388, 'weight_decay': 0.0011267023078878628, 'dropout': 0.7891923852431869, 'patience': 100, 'lr_reduce_freq': 80, 'spt_alg': 'kruskal', 'spt_attr': 'similarity', 'manifold': 'Hyperboloid', 'num_layers': 3, 'dim': 336, 'num_adj': 4, 'add_rate': 0.5089766665616323, 'tem': 1.0239643707144344, 'consis_rate': 0.8533362351733261, 'use_att': 1}. Best is trial 89 with value: 0.8181999999999998.[0m
[32m[I 2022-06-30 16:47:00,930][0m Trial 99 finished with value: 0.7985 and parameters: {'lr': 0.007648756718675182, 'weight_decay': 0.002073942829631291, 'dropout': 0.7860618047192617, 'patience': 100, 'lr_reduce_freq': 90, 'spt_alg': 'kruskal', 'spt_attr': 'similarity', 'manifold': 'Hyperboloid', 'num_layers': 3, 'dim': 352, 'num_adj': 4, 'add_rate': 0.5116378619991555, 'tem': 1.0166202298386735, 'consis_rate': 1.006555092617381, 'use_att': 1}. Best is trial 89 with value: 0.8181999999999998.[0m
[32m[I 2022-06-30 17:12:23,820][0m Trial 100 finished with value: 0.5259999999999999 and parameters: {'lr': 0.005309633348271497, 'weight_decay': 0.0037420427555164824, 'dropout': 0.750127927568514, 'patience': 100, 'lr_reduce_freq': 70, 'spt_alg': 'kruskal', 'spt_attr': 'edge_degree', 'manifold': 'Hyperboloid', 'num_layers': 3, 'dim': 336, 'num_adj': 4, 'add_rate': 0.4718157701183032, 'tem': 1.1938319426832091, 'consis_rate': 0.8890564190745006, 'use_att': 1}. Best is trial 89 with value: 0.8181999999999998.[0m
[32m[I 2022-06-30 17:29:28,007][0m Trial 101 finished with value: 0.8087 and parameters: {'lr': 0.006389758538351159, 'weight_decay': 0.0011930398563097914, 'dropout': 0.7668607909123556, 'patience': 100, 'lr_reduce_freq': 80, 'spt_alg': 'kruskal', 'spt_attr': 'similarity', 'manifold': 'Hyperboloid', 'num_layers': 3, 'dim': 384, 'num_adj': 4, 'add_rate': 0.5512508506325519, 'tem': 0.9649281503611801, 'consis_rate': 0.8651009051626646, 'use_att': 1}. Best is trial 89 with value: 0.8181999999999998.[0m
[32m[I 2022-06-30 17:46:20,112][0m Trial 102 finished with value: 0.8143 and parameters: {'lr': 0.009396170072071145, 'weight_decay': 0.001069049673353806, 'dropout': 0.7954945530229227, 'patience': 100, 'lr_reduce_freq': 80, 'spt_alg': 'kruskal', 'spt_attr': 'similarity', 'manifold': 'Hyperboloid', 'num_layers': 3, 'dim': 352, 'num_adj': 4, 'add_rate': 0.4399198690617942, 'tem': 1.0277309293518746, 'consis_rate': 0.6163574428529425, 'use_att': 1}. Best is trial 89 with value: 0.8181999999999998.[0m
[32m[I 2022-06-30 18:03:52,540][0m Trial 103 finished with value: 0.8194000000000001 and parameters: {'lr': 0.009250999384460137, 'weight_decay': 0.0010409623683768179, 'dropout': 0.7854035457803722, 'patience': 100, 'lr_reduce_freq': 90, 'spt_alg': 'kruskal', 'spt_attr': 'similarity', 'manifold': 'Hyperboloid', 'num_layers': 3, 'dim': 352, 'num_adj': 4, 'add_rate': 0.4456428084909376, 'tem': 1.061721881094904, 'consis_rate': 0.7485495409609603, 'use_att': 1}. Best is trial 103 with value: 0.8194000000000001.[0m
[32m[I 2022-06-30 18:20:57,821][0m Trial 104 finished with value: 0.8089000000000001 and parameters: {'lr': 0.00782173027068609, 'weight_decay': 0.0013167301662262848, 'dropout': 0.7227772985512185, 'patience': 100, 'lr_reduce_freq': 90, 'spt_alg': 'kruskal', 'spt_attr': 'similarity', 'manifold': 'Hyperboloid', 'num_layers': 3, 'dim': 336, 'num_adj': 4, 'add_rate': 0.4500810813723065, 'tem': 1.0639653875461013, 'consis_rate': 0.7436703235822686, 'use_att': 1}. Best is trial 103 with value: 0.8194000000000001.[0m
[32m[I 2022-06-30 18:43:08,038][0m Trial 105 finished with value: 0.8103 and parameters: {'lr': 0.015112017977533601, 'weight_decay': 0.0017015836247901719, 'dropout': 0.7693784077755808, 'patience': 100, 'lr_reduce_freq': 90, 'spt_alg': 'kruskal', 'spt_attr': 'similarity', 'manifold': 'Hyperboloid', 'num_layers': 3, 'dim': 368, 'num_adj': 4, 'add_rate': 0.39661030949675075, 'tem': 1.1216267216163116, 'consis_rate': 0.8252479165805611, 'use_att': 1}. Best is trial 103 with value: 0.8194000000000001.[0m
[32m[I 2022-06-30 18:52:22,091][0m Trial 106 finished with value: 0.8016000000000002 and parameters: {'lr': 0.011071362967040931, 'weight_decay': 0.0008118398625048687, 'dropout': 0.13216026571236017, 'patience': 100, 'lr_reduce_freq': 100, 'spt_alg': 'kruskal', 'spt_attr': 'similarity', 'manifold': 'Hyperboloid', 'num_layers': 3, 'dim': 384, 'num_adj': 4, 'add_rate': 0.5256259870062493, 'tem': 0.9932595042725091, 'consis_rate': 0.7775909342953617, 'use_att': 1}. Best is trial 103 with value: 0.8194000000000001.[0m
