[32m[I 2022-06-29 21:52:14,406][0m Trial 53 finished with value: 0.8148 and parameters: {'lr': 0.013962438832791111, 'weight_decay': 0.002986347145852288, 'dropout': 0.7934379438757364, 'patience': 80, 'lr_reduce_freq': 30, 'spt_alg': 'prim', 'spt_attr': 'similarity', 'manifold': 'PoincareBall', 'num_layers': 3, 'dim': 448, 'num_adj': 4, 'add_rate': 0.43472044500606954, 'tem': 1.258180927156729, 'consis_rate': 1.515020013712837, 'use_att': 1}. Best is trial 48 with value: 0.8177.[0m
[32m[I 2022-06-29 22:05:33,497][0m Trial 54 finished with value: 0.8166 and parameters: {'lr': 0.012978101956770589, 'weight_decay': 0.0028176511657728087, 'dropout': 0.7889513654361886, 'patience': 80, 'lr_reduce_freq': 30, 'spt_alg': 'prim', 'spt_attr': 'similarity', 'manifold': 'PoincareBall', 'num_layers': 3, 'dim': 464, 'num_adj': 4, 'add_rate': 0.43857657507050696, 'tem': 1.2555789113204905, 'consis_rate': 1.4447961984314823, 'use_att': 1}. Best is trial 48 with value: 0.8177.[0m

mean: 0.7973000000000001
[0.809 0.788 0.807 0.795 0.792 0.799 0.782 0.793 0.807 0.801]
cur_param: {'lr': 0.003910997260407336, 'weight_decay': 0.0005082401016917534, 'dropout': 0.35283197592047183, 'patience': 70, 'lr_reduce_freq': 30, 'spt_alg': 'prim', 'spt_attr': 'edge_degree', 'manifold': 'PoincareBall', 'num_layers': 3, 'dim': 480, 'num_adj': 4, 'add_rate': 0.13947948037636465, 'tem': 0.6996625602073209, 'consis_rate': 0.246460367956856, 'use_att': 1}
mean: 0.8036
[0.812 0.795 0.8   0.803 0.785 0.809 0.801 0.811 0.805 0.815]
cur_param: {'lr': 0.0024437646357757152, 'weight_decay': 0.003977620249460379, 'dropout': 0.5331717691338473, 'patience': 50, 'lr_reduce_freq': 50, 'spt_alg': 'prim', 'spt_attr': 'edge_degree', 'manifold': 'Hyperboloid', 'num_layers': 3, 'dim': 336, 'num_adj': 2, 'add_rate': 0.194218803069083, 'tem': 0.6330972920510431, 'consis_rate': 1.889097949741097, 'use_att': 0}
mean: 0.35319999999999996
[0.172 0.488 0.287 0.498 0.453 0.417 0.282 0.313 0.387 0.235]
cur_param: {'lr': 0.003628778367192679, 'weight_decay': 0.02470495274315283, 'dropout': 0.32987297250495906, 'patience': 70, 'lr_reduce_freq': 60, 'spt_alg': 'prim', 'spt_attr': 'edge_degree', 'manifold': 'PoincareBall', 'num_layers': 4, 'dim': 320, 'num_adj': 4, 'add_rate': 0.25570644369939566, 'tem': 0.7547129348550816, 'consis_rate': 1.9895958912248508, 'use_att': 1}
mean: 0.2853
[0.322 0.149 0.319 0.319 0.319 0.149 0.319 0.319 0.319 0.319]
cur_param: {'lr': 0.001472255292211868, 'weight_decay': 0.01612735606664143, 'dropout': 0.4467411565966155, 'patience': 50, 'lr_reduce_freq': 60, 'spt_alg': 'prim', 'spt_attr': 'similarity', 'manifold': 'PoincareBall', 'num_layers': 3, 'dim': 256, 'num_adj': 4, 'add_rate': 0.6774010615520817, 'tem': 0.8329952305965236, 'consis_rate': 0.6798318133208848, 'use_att': 1}
mean: 0.24010000000000004
[0.145 0.277 0.245 0.37  0.064 0.232 0.177 0.354 0.208 0.329]
cur_param: {'lr': 0.006901234228508943, 'weight_decay': 0.0011568515327782722, 'dropout': 0.38643016296004734, 'patience': 60, 'lr_reduce_freq': 40, 'spt_alg': 'prim', 'spt_attr': 'edge_degree', 'manifold': 'PoincareBall', 'num_layers': 3, 'dim': 208, 'num_adj': 4, 'add_rate': 0.14601724712441053, 'tem': 0.9026608350842079, 'consis_rate': 0.9998556478810802, 'use_att': 1}
mean: 0.8055
[0.818 0.806 0.801 0.796 0.805 0.802 0.793 0.818 0.816 0.8  ]
cur_param: {'lr': 0.009734887934961096, 'weight_decay': 0.0007688280555421815, 'dropout': 0.43443524798001465, 'patience': 60, 'lr_reduce_freq': 30, 'spt_alg': 'prim', 'spt_attr': 'edge_degree', 'manifold': 'PoincareBall', 'num_layers': 3, 'dim': 304, 'num_adj': 6, 'add_rate': 0.2418208217891614, 'tem': 0.7976761128207, 'consis_rate': 1.3331019047884358, 'use_att': 1}
mean: 0.8073
[0.819 0.813 0.79  0.807 0.792 0.817 0.811 0.797 0.81  0.817]
cur_param: {'lr': 0.002781998123300432, 'weight_decay': 0.0009754255324763199, 'dropout': 0.3731432807679522, 'patience': 60, 'lr_reduce_freq': 90, 'spt_alg': 'prim', 'spt_attr': 'edge_degree', 'manifold': 'PoincareBall', 'num_layers': 3, 'dim': 160, 'num_adj': 4, 'add_rate': 0.39866996370225294, 'tem': 0.97385593032668, 'consis_rate': 1.9031542626266424, 'use_att': 1}
mean: 0.8088
[0.816 0.799 0.817 0.805 0.808 0.797 0.8   0.8   0.832 0.814]
cur_param: {'lr': 0.0057408318285182055, 'weight_decay': 0.0018697200739228135, 'dropout': 0.49745527568942505, 'patience': 60, 'lr_reduce_freq': 100, 'spt_alg': 'kruskal', 'spt_attr': 'edge_degree', 'manifold': 'PoincareBall', 'num_layers': 3, 'dim': 416, 'num_adj': 6, 'add_rate': 0.25870480124290796, 'tem': 0.8511239583330891, 'consis_rate': 1.674385577029384, 'use_att': 0}
mean: 0.7987
[0.794 0.796 0.804 0.806 0.787 0.809 0.805 0.784 0.807 0.795]
cur_param: {'lr': 0.01931758913246494, 'weight_decay': 0.0012958388398054371, 'dropout': 0.41937110979781833, 'patience': 70, 'lr_reduce_freq': 50, 'spt_alg': 'prim', 'spt_attr': 'similarity', 'manifold': 'PoincareBall', 'num_layers': 3, 'dim': 352, 'num_adj': 4, 'add_rate': 0.35438430523596853, 'tem': 1.0472812795086377, 'consis_rate': 1.8254582855762236, 'use_att': 1}
mean: 0.8101
[0.815 0.799 0.831 0.814 0.807 0.801 0.809 0.804 0.812 0.809]
cur_param: {'lr': 0.018707396307713637, 'weight_decay': 0.0010098929154971916, 'dropout': 0.24282470571064477, 'patience': 70, 'lr_reduce_freq': 50, 'spt_alg': 'prim', 'spt_attr': 'similarity', 'manifold': 'Hyperboloid', 'num_layers': 5, 'dim': 512, 'num_adj': 4, 'add_rate': 0.5529638072877593, 'tem': 1.05685666236418, 'consis_rate': 1.8526634098480388, 'use_att': 1}
mean: 0.7342000000000001
[0.705 0.758 0.714 0.793 0.714 0.758 0.744 0.672 0.705 0.779]
cur_param: {'lr': 0.0564171818339133, 'weight_decay': 0.0006567788763038437, 'dropout': 0.32002946295224566, 'patience': 70, 'lr_reduce_freq': 40, 'spt_alg': 'prim', 'spt_attr': 'similarity', 'manifold': 'PoincareBall', 'num_layers': 4, 'dim': 352, 'num_adj': 2, 'add_rate': 0.10025995362102641, 'tem': 1.1136107934309583, 'consis_rate': 1.8153725666839065, 'use_att': 0}
mean: 0.7912000000000001
[0.803 0.796 0.783 0.783 0.799 0.792 0.788 0.795 0.774 0.799]
cur_param: {'lr': 0.012990931361752467, 'weight_decay': 0.00298476443096909, 'dropout': 0.7947732220716717, 'patience': 70, 'lr_reduce_freq': 30, 'spt_alg': 'prim', 'spt_attr': 'similarity', 'manifold': 'PoincareBall', 'num_layers': 3, 'dim': 400, 'num_adj': 4, 'add_rate': 0.19437315064894378, 'tem': 1.2121567192912577, 'consis_rate': 1.5479553178378858, 'use_att': 1}
mean: 0.8177
[0.829 0.789 0.82  0.82  0.816 0.825 0.814 0.825 0.822 0.817]
cur_param: {'lr': 0.011930259506412421, 'weight_decay': 0.003223315597268952, 'dropout': 0.6633821157676422, 'patience': 80, 'lr_reduce_freq': 30, 'spt_alg': 'prim', 'spt_attr': 'similarity', 'manifold': 'PoincareBall', 'num_layers': 3, 'dim': 416, 'num_adj': 4, 'add_rate': 0.19663994418388672, 'tem': 1.2432289089937894, 'consis_rate': 1.53820444890777, 'use_att': 1}
mean: 0.8145
[0.827 0.811 0.787 0.804 0.825 0.821 0.812 0.827 0.816 0.815]
cur_param: {'lr': 0.012146314266735377, 'weight_decay': 0.0031807854284401334, 'dropout': 0.6938988017900997, 'patience': 80, 'lr_reduce_freq': 30, 'spt_alg': 'prim', 'spt_attr': 'similarity', 'manifold': 'PoincareBall', 'num_layers': 3, 'dim': 416, 'num_adj': 4, 'add_rate': 0.4559340421588934, 'tem': 1.2498787975154453, 'consis_rate': 1.5213119541225488, 'use_att': 1}
mean: 0.8111
[0.803 0.816 0.806 0.818 0.808 0.816 0.798 0.824 0.814 0.808]
cur_param: {'lr': 0.011932264537357847, 'weight_decay': 0.0031319219901717655, 'dropout': 0.7973517915583828, 'patience': 80, 'lr_reduce_freq': 30, 'spt_alg': 'prim', 'spt_attr': 'similarity', 'manifold': 'PoincareBall', 'num_layers': 3, 'dim': 400, 'num_adj': 4, 'add_rate': 0.43966032008871886, 'tem': 1.243478479496787, 'consis_rate': 1.4811151311436723, 'use_att': 1}
mean: 0.8158
[0.812 0.788 0.83  0.814 0.818 0.827 0.811 0.829 0.822 0.807]
cur_param: {'lr': 0.012340249960801311, 'weight_decay': 0.002111027825283151, 'dropout': 0.793990040689638, 'patience': 80, 'lr_reduce_freq': 30, 'spt_alg': 'prim', 'spt_attr': 'similarity', 'manifold': 'PoincareBall', 'num_layers': 3, 'dim': 416, 'num_adj': 4, 'add_rate': 0.4290353104117041, 'tem': 1.2462257333304805, 'consis_rate': 1.5155885099566593, 'use_att': 1}
mean: 0.8115
[0.834 0.785 0.797 0.815 0.798 0.827 0.8   0.813 0.83  0.816]
cur_param: {'lr': 0.013962438832791111, 'weight_decay': 0.002986347145852288, 'dropout': 0.7934379438757364, 'patience': 80, 'lr_reduce_freq': 30, 'spt_alg': 'prim', 'spt_attr': 'similarity', 'manifold': 'PoincareBall', 'num_layers': 3, 'dim': 448, 'num_adj': 4, 'add_rate': 0.43472044500606954, 'tem': 1.258180927156729, 'consis_rate': 1.515020013712837, 'use_att': 1}
mean: 0.8148
[0.828 0.83  0.801 0.805 0.811 0.825 0.811 0.812 0.81  0.815]
cur_param: {'lr': 0.012978101956770589, 'weight_decay': 0.0028176511657728087, 'dropout': 0.7889513654361886, 'patience': 80, 'lr_reduce_freq': 30, 'spt_alg': 'prim', 'spt_attr': 'similarity', 'manifold': 'PoincareBall', 'num_layers': 3, 'dim': 464, 'num_adj': 4, 'add_rate': 0.43857657507050696, 'tem': 1.2555789113204905, 'consis_rate': 1.4447961984314823, 'use_att': 1}
mean: 0.8166
[0.83  0.81  0.81  0.822 0.812 0.811 0.822 0.819 0.822 0.808]
cur_param: {'lr': 0.01418733404865888, 'weight_decay': 0.0031909053291637648, 'dropout': 0.7861606683257533, 'patience': 80, 'lr_reduce_freq': 30, 'spt_alg': 'prim', 'spt_attr': 'similarity', 'manifold': 'PoincareBall', 'num_layers': 3, 'dim': 464, 'num_adj': 4, 'add_rate': 0.42696404998709564, 'tem': 1.2649554849890845, 'consis_rate': 1.45356136966509, 'use_att': 1}[32m[I 2022-06-29 22:21:43,070][0m Trial 55 finished with value: 0.8142000000000001 and parameters: {'lr': 0.01418733404865888, 'weight_decay': 0.0031909053291637648, 'dropout': 0.7861606683257533, 'patience': 80, 'lr_reduce_freq': 30, 'spt_alg': 'prim', 'spt_attr': 'similarity', 'manifold': 'PoincareBall', 'num_layers': 3, 'dim': 464, 'num_adj': 4, 'add_rate': 0.42696404998709564, 'tem': 1.2649554849890845, 'consis_rate': 1.45356136966509, 'use_att': 1}. Best is trial 48 with value: 0.8177.[0m
[32m[I 2022-06-29 22:38:07,171][0m Trial 56 finished with value: 0.8149999999999998 and parameters: {'lr': 0.02408650740295233, 'weight_decay': 0.003057663094974801, 'dropout': 0.739064643167151, 'patience': 80, 'lr_reduce_freq': 30, 'spt_alg': 'prim', 'spt_attr': 'similarity', 'manifold': 'PoincareBall', 'num_layers': 3, 'dim': 464, 'num_adj': 4, 'add_rate': 0.49089649668185487, 'tem': 1.3046946193318512, 'consis_rate': 1.3991789223399314, 'use_att': 1}. Best is trial 48 with value: 0.8177.[0m
[32m[I 2022-06-29 22:46:40,880][0m Trial 57 finished with value: 0.42780000000000007 and parameters: {'lr': 0.02503113427276036, 'weight_decay': 0.004973123677308606, 'dropout': 0.7364884458658011, 'patience': 90, 'lr_reduce_freq': 30, 'spt_alg': 'prim', 'spt_attr': 'similarity', 'manifold': 'PoincareBall', 'num_layers': 5, 'dim': 448, 'num_adj': 4, 'add_rate': 0.5287014336694602, 'tem': 1.4462118315178702, 'consis_rate': 1.3905431333714844, 'use_att': 0}. Best is trial 48 with value: 0.8177.[0m
[32m[I 2022-06-29 23:00:42,544][0m Trial 58 finished with value: 0.8161999999999999 and parameters: {'lr': 0.01674167825630451, 'weight_decay': 0.002790374436653458, 'dropout': 0.6959328040796888, 'patience': 80, 'lr_reduce_freq': 50, 'spt_alg': 'prim', 'spt_attr': 'similarity', 'manifold': 'PoincareBall', 'num_layers': 3, 'dim': 480, 'num_adj': 4, 'add_rate': 0.4732673401590974, 'tem': 1.2076626707707052, 'consis_rate': 1.2995490255847748, 'use_att': 1}. Best is trial 48 with value: 0.8177.[0m
[32m[I 2022-06-29 23:19:39,209][0m Trial 59 finished with value: 0.8209 and parameters: {'lr': 0.01674869292188655, 'weight_decay': 0.0028167891353616135, 'dropout': 0.757489084520037, 'patience': 90, 'lr_reduce_freq': 50, 'spt_alg': 'prim', 'spt_attr': 'similarity', 'manifold': 'PoincareBall', 'num_layers': 3, 'dim': 480, 'num_adj': 4, 'add_rate': 0.624344731496036, 'tem': 1.3159627334446486, 'consis_rate': 1.2720565148822467, 'use_att': 1}. Best is trial 59 with value: 0.8209.[0m
[32m[I 2022-06-29 23:54:00,980][0m Trial 60 finished with value: 0.7963 and parameters: {'lr': 0.02938008928422968, 'weight_decay': 0.004801356703931924, 'dropout': 0.756824553143432, 'patience': 90, 'lr_reduce_freq': 50, 'spt_alg': 'prim', 'spt_attr': 'similarity', 'manifold': 'Hyperboloid', 'num_layers': 3, 'dim': 512, 'num_adj': 4, 'add_rate': 0.6277851347828547, 'tem': 1.3162749368567102, 'consis_rate': 1.2649643225326885, 'use_att': 1}. Best is trial 59 with value: 0.8209.[0m
[32m[I 2022-06-30 00:07:47,041][0m Trial 61 finished with value: 0.8122 and parameters: {'lr': 0.015923703816722208, 'weight_decay': 0.0026780311704446276, 'dropout': 0.6996789609248761, 'patience': 80, 'lr_reduce_freq': 40, 'spt_alg': 'prim', 'spt_attr': 'similarity', 'manifold': 'PoincareBall', 'num_layers': 3, 'dim': 480, 'num_adj': 4, 'add_rate': 0.4696524841126154, 'tem': 1.1988999648998122, 'consis_rate': 1.3678105015789268, 'use_att': 1}. Best is trial 59 with value: 0.8209.[0m
[32m[I 2022-06-30 00:25:05,637][0m Trial 62 finished with value: 0.8143 and parameters: {'lr': 0.020377029473970684, 'weight_decay': 0.0020007949565469052, 'dropout': 0.7248276778108906, 'patience': 80, 'lr_reduce_freq': 60, 'spt_alg': 'prim', 'spt_attr': 'similarity', 'manifold': 'PoincareBall', 'num_layers': 3, 'dim': 480, 'num_adj': 4, 'add_rate': 0.4932908831041816, 'tem': 1.3130404361438552, 'consis_rate': 1.2916412586079087, 'use_att': 1}. Best is trial 59 with value: 0.8209.[0m
[32m[I 2022-06-30 00:40:24,079][0m Trial 63 finished with value: 0.817 and parameters: {'lr': 0.017323764298463277, 'weight_decay': 0.0026068140904082094, 'dropout': 0.7742647076711846, 'patience': 90, 'lr_reduce_freq': 40, 'spt_alg': 'prim', 'spt_attr': 'similarity', 'manifold': 'PoincareBall', 'num_layers': 3, 'dim': 448, 'num_adj': 4, 'add_rate': 0.5664865574160566, 'tem': 1.411768913912723, 'consis_rate': 1.1049663597720951, 'use_att': 1}. Best is trial 59 with value: 0.8209.[0m
[32m[I 2022-06-30 00:56:14,857][0m Trial 64 finished with value: 0.8192999999999999 and parameters: {'lr': 0.017872380008902303, 'weight_decay': 0.0037956361448440675, 'dropout': 0.7603553090962609, 'patience': 90, 'lr_reduce_freq': 50, 'spt_alg': 'prim', 'spt_attr': 'similarity', 'manifold': 'PoincareBall', 'num_layers': 3, 'dim': 496, 'num_adj': 4, 'add_rate': 0.6449221167297949, 'tem': 1.4183231174715705, 'consis_rate': 1.0623503928449596, 'use_att': 1}. Best is trial 59 with value: 0.8209.[0m
[32m[I 2022-06-30 01:13:45,927][0m Trial 65 finished with value: 0.8084 and parameters: {'lr': 0.009048448345528771, 'weight_decay': 0.0038132703572175074, 'dropout': 0.7699344564246827, 'patience': 90, 'lr_reduce_freq': 50, 'spt_alg': 'prim', 'spt_attr': 'similarity', 'manifold': 'PoincareBall', 'num_layers': 3, 'dim': 496, 'num_adj': 4, 'add_rate': 0.645716028466522, 'tem': 1.3868709782686246, 'consis_rate': 1.1002763867965806, 'use_att': 1}. Best is trial 59 with value: 0.8209.[0m
[32m[I 2022-06-30 01:29:56,843][0m Trial 66 finished with value: 0.8091000000000002 and parameters: {'lr': 0.016582242387595234, 'weight_decay': 0.002347717536153769, 'dropout': 0.7238409021925464, 'patience': 90, 'lr_reduce_freq': 70, 'spt_alg': 'prim', 'spt_attr': 'similarity', 'manifold': 'PoincareBall', 'num_layers': 3, 'dim': 432, 'num_adj': 4, 'add_rate': 0.5762948659850294, 'tem': 1.444187891979646, 'consis_rate': 1.0726099974878731, 'use_att': 1}. Best is trial 59 with value: 0.8209.[0m
[32m[I 2022-06-30 01:55:50,424][0m Trial 67 finished with value: 0.8133000000000001 and parameters: {'lr': 0.047452996311190536, 'weight_decay': 0.005509210457458084, 'dropout': 0.6297878221491151, 'patience': 90, 'lr_reduce_freq': 60, 'spt_alg': 'prim', 'spt_attr': 'similarity', 'manifold': 'PoincareBall', 'num_layers': 3, 'dim': 480, 'num_adj': 4, 'add_rate': 0.7330577455944755, 'tem': 1.349847383323018, 'consis_rate': 0.9823516536263645, 'use_att': 1}. Best is trial 59 with value: 0.8209.[0m
[32m[I 2022-06-30 02:20:45,797][0m Trial 68 finished with value: 0.319 and parameters: {'lr': 0.022412752064366867, 'weight_decay': 0.004464625053623242, 'dropout': 0.7690624850630843, 'patience': 100, 'lr_reduce_freq': 40, 'spt_alg': 'prim', 'spt_attr': 'similarity', 'manifold': 'PoincareBall', 'num_layers': 5, 'dim': 512, 'num_adj': 4, 'add_rate': 0.5865874179151811, 'tem': 1.1876670116038508, 'consis_rate': 1.1512238089419438, 'use_att': 1}. Best is trial 59 with value: 0.8209.[0m
[32m[I 2022-06-30 02:25:13,218][0m Trial 69 finished with value: 0.29850000000000004 and parameters: {'lr': 0.01046376027693517, 'weight_decay': 0.007746049676587317, 'dropout': 0.660502731411717, 'patience': 90, 'lr_reduce_freq': 50, 'spt_alg': 'prim', 'spt_attr': 'similarity', 'manifold': 'PoincareBall', 'num_layers': 4, 'dim': 496, 'num_adj': 4, 'add_rate': 0.6645603816247131, 'tem': 1.4187447710228502, 'consis_rate': 0.9259156140608511, 'use_att': 0}. Best is trial 59 with value: 0.8209.[0m
[32m[I 2022-06-30 02:46:42,104][0m Trial 70 finished with value: 0.8133999999999999 and parameters: {'lr': 0.03132877296949507, 'weight_decay': 0.0036603994570277164, 'dropout': 0.71198791330523, 'patience': 100, 'lr_reduce_freq': 50, 'spt_alg': 'prim', 'spt_attr': 'similarity', 'manifold': 'PoincareBall', 'num_layers': 3, 'dim': 432, 'num_adj': 4, 'add_rate': 0.7156880058475739, 'tem': 1.4766177892793932, 'consis_rate': 1.259966324260374, 'use_att': 1}. Best is trial 59 with value: 0.8209.[0m
[32m[I 2022-06-30 03:04:08,329][0m Trial 71 finished with value: 0.8135999999999999 and parameters: {'lr': 0.017543085005036638, 'weight_decay': 0.002322687228495534, 'dropout': 0.7363037376567759, 'patience': 90, 'lr_reduce_freq': 40, 'spt_alg': 'prim', 'spt_attr': 'similarity', 'manifold': 'PoincareBall', 'num_layers': 3, 'dim': 464, 'num_adj': 4, 'add_rate': 0.5266896182507319, 'tem': 1.2932597284662, 'consis_rate': 1.4324500544547698, 'use_att': 1}. Best is trial 59 with value: 0.8209.[0m
