[32m[I 2022-07-01 14:49:51,432][0m Trial 90 finished with value: 0.319 and parameters: {'lr': 0.06173922434319777, 'weight_decay': 0.014685532330641533, 'dropout': 0.36066131348217445, 'patience': 100, 'lr_reduce_freq': 30, 'spt_alg': 'kruskal', 'spt_attr': 'edge_degree', 'manifold': 'PoincareBall', 'num_layers': 5, 'dim': 208, 'num_adj': 4, 'add_rate': 0.7838440684037002, 'tem': 1.3741171020312146, 'consis_rate': 1.9017621799058788, 'use_att': 1}. Best is trial 86 with value: 0.8253.[0m

mean: 0.8166999999999998
[0.814 0.812 0.815 0.824 0.811 0.81  0.821 0.817 0.821 0.822]
cur_param: {'lr': 0.048714119687941516, 'weight_decay': 0.007472897764397261, 'dropout': 0.43360599115346543, 'patience': 90, 'lr_reduce_freq': 30, 'spt_alg': 'prim', 'spt_attr': 'edge_degree', 'manifold': 'PoincareBall', 'num_layers': 3, 'dim': 160, 'num_adj': 4, 'add_rate': 0.46849903110884017, 'tem': 1.1842079737271962, 'consis_rate': 1.7587661627873905, 'use_att': 1}
mean: 0.8043999999999999
[0.81  0.795 0.81  0.807 0.813 0.809 0.809 0.797 0.805 0.789]
cur_param: {'lr': 0.08312525346908455, 'weight_decay': 0.010915251112294385, 'dropout': 0.38166424763435525, 'patience': 90, 'lr_reduce_freq': 30, 'spt_alg': 'prim', 'spt_attr': 'edge_degree', 'manifold': 'PoincareBall', 'num_layers': 3, 'dim': 208, 'num_adj': 4, 'add_rate': 0.41665549498009685, 'tem': 1.2760626885452468, 'consis_rate': 1.8869797072143508, 'use_att': 1}
mean: 0.8126999999999999
[0.813 0.806 0.81  0.818 0.816 0.815 0.8   0.804 0.826 0.819]
cur_param: {'lr': 0.08294523504183361, 'weight_decay': 0.015814687261448784, 'dropout': 0.3937112008069934, 'patience': 100, 'lr_reduce_freq': 30, 'spt_alg': 'prim', 'spt_attr': 'edge_degree', 'manifold': 'PoincareBall', 'num_layers': 3, 'dim': 208, 'num_adj': 4, 'add_rate': 0.40984410442795194, 'tem': 1.2899990031402444, 'consis_rate': 1.9852979496600565, 'use_att': 1}
mean: 0.8221999999999999
[0.808 0.811 0.826 0.817 0.828 0.815 0.825 0.836 0.829 0.827]
cur_param: {'lr': 0.08308769951174393, 'weight_decay': 0.0166636947129428, 'dropout': 0.3832582712259211, 'patience': 100, 'lr_reduce_freq': 30, 'spt_alg': 'prim', 'spt_attr': 'edge_degree', 'manifold': 'PoincareBall', 'num_layers': 3, 'dim': 208, 'num_adj': 4, 'add_rate': 0.5785059912824015, 'tem': 1.2789779933774141, 'consis_rate': 1.9736094862994062, 'use_att': 1}
mean: 0.8203000000000001
[0.822 0.82  0.816 0.821 0.807 0.818 0.831 0.819 0.823 0.826]
cur_param: {'lr': 0.08326863518106904, 'weight_decay': 0.017638798982526547, 'dropout': 0.38133505958474495, 'patience': 100, 'lr_reduce_freq': 30, 'spt_alg': 'prim', 'spt_attr': 'edge_degree', 'manifold': 'PoincareBall', 'num_layers': 3, 'dim': 208, 'num_adj': 4, 'add_rate': 0.6814678705485357, 'tem': 1.2805537012616652, 'consis_rate': 1.998373609044664, 'use_att': 1}
mean: 0.8238999999999999
[0.824 0.824 0.829 0.823 0.829 0.823 0.832 0.805 0.821 0.829]
cur_param: {'lr': 0.08638270142471295, 'weight_decay': 0.02051205894392695, 'dropout': 0.3790859221602531, 'patience': 100, 'lr_reduce_freq': 30, 'spt_alg': 'prim', 'spt_attr': 'edge_degree', 'manifold': 'PoincareBall', 'num_layers': 3, 'dim': 208, 'num_adj': 4, 'add_rate': 0.6513274756022436, 'tem': 1.3631069409913816, 'consis_rate': 1.9750523998204443, 'use_att': 1}
mean: 0.8225999999999999
[0.827 0.82  0.828 0.825 0.831 0.799 0.823 0.816 0.826 0.831]
cur_param: {'lr': 0.08296054365250101, 'weight_decay': 0.028690299304302485, 'dropout': 0.3499689598187516, 'patience': 100, 'lr_reduce_freq': 45, 'spt_alg': 'prim', 'spt_attr': 'edge_degree', 'manifold': 'Hyperboloid', 'num_layers': 3, 'dim': 512, 'num_adj': 4, 'add_rate': 0.6689959044258597, 'tem': 1.354271235048557, 'consis_rate': 1.97422071624446, 'use_att': 0}
mean: 0.5102
[0.771 0.783 0.319 0.353 0.319 0.332 0.784 0.328 0.319 0.794]
cur_param: {'lr': 0.07970062504765857, 'weight_decay': 0.018270365772049102, 'dropout': 0.371207456905635, 'patience': 100, 'lr_reduce_freq': 30, 'spt_alg': 'prim', 'spt_attr': 'edge_degree', 'manifold': 'PoincareBall', 'num_layers': 3, 'dim': 208, 'num_adj': 4, 'add_rate': 0.5873447954174397, 'tem': 1.2789639347388084, 'consis_rate': 1.9983997391648352, 'use_att': 1}
mean: 0.8208
[0.832 0.812 0.821 0.819 0.822 0.817 0.82  0.815 0.822 0.828]
cur_param: {'lr': 0.05676557295790093, 'weight_decay': 0.018996502781472344, 'dropout': 0.40378649351419904, 'patience': 100, 'lr_reduce_freq': 30, 'spt_alg': 'prim', 'spt_attr': 'edge_degree', 'manifold': 'PoincareBall', 'num_layers': 3, 'dim': 224, 'num_adj': 4, 'add_rate': 0.583259716023096, 'tem': 1.3965254456084186, 'consis_rate': 1.9972121417928759, 'use_att': 1}
mean: 0.8234
[0.813 0.823 0.82  0.823 0.829 0.809 0.84  0.825 0.83  0.822]
cur_param: {'lr': 0.0438314070612187, 'weight_decay': 0.02062120876720389, 'dropout': 0.4263514558254133, 'patience': 100, 'lr_reduce_freq': 30, 'spt_alg': 'prim', 'spt_attr': 'edge_degree', 'manifold': 'PoincareBall', 'num_layers': 3, 'dim': 224, 'num_adj': 4, 'add_rate': 0.5871822669183265, 'tem': 1.3825822682048001, 'consis_rate': 1.9952351864783553, 'use_att': 1}
mean: 0.32100000000000006
[0.337 0.319 0.319 0.319 0.319 0.319 0.319 0.319 0.321 0.319]
cur_param: {'lr': 0.07536177989147887, 'weight_decay': 0.026643445452991826, 'dropout': 0.4033144744766786, 'patience': 100, 'lr_reduce_freq': 135, 'spt_alg': 'prim', 'spt_attr': 'edge_degree', 'manifold': 'PoincareBall', 'num_layers': 3, 'dim': 208, 'num_adj': 4, 'add_rate': 0.626092098795368, 'tem': 1.4123736333340537, 'consis_rate': 1.9225621363327543, 'use_att': 1}
mean: 0.6314
[0.319 0.324 0.43  0.812 0.368 0.791 0.821 0.802 0.83  0.817]
cur_param: {'lr': 0.056710893702031896, 'weight_decay': 0.016921716824646958, 'dropout': 0.3775483119287709, 'patience': 100, 'lr_reduce_freq': 30, 'spt_alg': 'prim', 'spt_attr': 'edge_degree', 'manifold': 'PoincareBall', 'num_layers': 3, 'dim': 176, 'num_adj': 4, 'add_rate': 0.7509977203773295, 'tem': 1.3426754820794506, 'consis_rate': 1.9550736120060446, 'use_att': 1}
mean: 0.8195
[0.818 0.826 0.81  0.814 0.818 0.81  0.823 0.825 0.819 0.832]
cur_param: {'lr': 0.05846684918539945, 'weight_decay': 0.017502702661672396, 'dropout': 0.37212281392560226, 'patience': 100, 'lr_reduce_freq': 30, 'spt_alg': 'kruskal', 'spt_attr': 'edge_degree', 'manifold': 'PoincareBall', 'num_layers': 3, 'dim': 240, 'num_adj': 4, 'add_rate': 0.7399064651999409, 'tem': 1.3457974153441965, 'consis_rate': 1.9997140834389675, 'use_att': 1}
mean: 0.8253
[0.828 0.816 0.824 0.822 0.831 0.824 0.833 0.82  0.835 0.82 ]
cur_param: {'lr': 0.055178059464418366, 'weight_decay': 0.017287909196152026, 'dropout': 0.367277100912541, 'patience': 100, 'lr_reduce_freq': 30, 'spt_alg': 'kruskal', 'spt_attr': 'edge_degree', 'manifold': 'PoincareBall', 'num_layers': 4, 'dim': 240, 'num_adj': 4, 'add_rate': 0.7427102121489663, 'tem': 1.3433098602928446, 'consis_rate': 1.9993426483525192, 'use_att': 1}
mean: 0.32939999999999997
[0.319 0.319 0.319 0.319 0.319 0.319 0.423 0.319 0.319 0.319]
cur_param: {'lr': 0.09742128449179052, 'weight_decay': 0.03539681423172914, 'dropout': 0.3369362017025106, 'patience': 100, 'lr_reduce_freq': 30, 'spt_alg': 'kruskal', 'spt_attr': 'edge_degree', 'manifold': 'PoincareBall', 'num_layers': 3, 'dim': 144, 'num_adj': 4, 'add_rate': 0.7224494499550207, 'tem': 1.4634952490134547, 'consis_rate': 1.9463015187314805, 'use_att': 1}
mean: 0.37679999999999997
[0.327 0.338 0.826 0.335 0.342 0.319 0.33  0.319 0.316 0.316]
cur_param: {'lr': 0.036564215299802916, 'weight_decay': 0.017098370065404447, 'dropout': 0.38507526619290444, 'patience': 100, 'lr_reduce_freq': 45, 'spt_alg': 'kruskal', 'spt_attr': 'edge_degree', 'manifold': 'PoincareBall', 'num_layers': 3, 'dim': 224, 'num_adj': 4, 'add_rate': 0.6797108712941335, 'tem': 1.2917154159974065, 'consis_rate': 1.9461014860947712, 'use_att': 1}
mean: 0.33270000000000005
[0.319 0.319 0.331 0.319 0.319 0.319 0.319 0.319 0.373 0.39 ]
cur_param: {'lr': 0.06173922434319777, 'weight_decay': 0.014685532330641533, 'dropout': 0.36066131348217445, 'patience': 100, 'lr_reduce_freq': 30, 'spt_alg': 'kruskal', 'spt_attr': 'edge_degree', 'manifold': 'PoincareBall', 'num_layers': 5, 'dim': 208, 'num_adj': 4, 'add_rate': 0.7838440684037002, 'tem': 1.3741171020312146, 'consis_rate': 1.9017621799058788, 'use_att': 1}
mean: 0.319
[0.319 0.319 0.319 0.319 0.319 0.319 0.319 0.319 0.319 0.319]
cur_param: {'lr': 0.07336002450492621, 'weight_decay': 0.01980919269377383, 'dropout': 0.3933608725069764, 'patience': 100, 'lr_reduce_freq': 30, 'spt_alg': 'kruskal', 'spt_attr': 'edge_degree', 'manifold': 'PoincareBall', 'num_layers': 3, 'dim': 192, 'num_adj': 4, 'add_rate': 0.5821231548628565, 'tem': 1.32385609498831, 'consis_rate': 1.881115437323439, 'use_att': 1}[32m[I 2022-07-01 15:01:54,909][0m Trial 91 finished with value: 0.8251 and parameters: {'lr': 0.07336002450492621, 'weight_decay': 0.01980919269377383, 'dropout': 0.3933608725069764, 'patience': 100, 'lr_reduce_freq': 30, 'spt_alg': 'kruskal', 'spt_attr': 'edge_degree', 'manifold': 'PoincareBall', 'num_layers': 3, 'dim': 192, 'num_adj': 4, 'add_rate': 0.5821231548628565, 'tem': 1.32385609498831, 'consis_rate': 1.881115437323439, 'use_att': 1}. Best is trial 86 with value: 0.8253.[0m
[32m[I 2022-07-01 15:12:46,237][0m Trial 92 finished with value: 0.8227 and parameters: {'lr': 0.07470602596967583, 'weight_decay': 0.0200114127156453, 'dropout': 0.31811347605563256, 'patience': 100, 'lr_reduce_freq': 30, 'spt_alg': 'kruskal', 'spt_attr': 'edge_degree', 'manifold': 'PoincareBall', 'num_layers': 3, 'dim': 176, 'num_adj': 4, 'add_rate': 0.5717341714117685, 'tem': 1.3250801693417462, 'consis_rate': 1.9611523763828373, 'use_att': 1}. Best is trial 86 with value: 0.8253.[0m
[32m[I 2022-07-01 15:22:24,162][0m Trial 93 finished with value: 0.8186 and parameters: {'lr': 0.05324628644363829, 'weight_decay': 0.019672327341156152, 'dropout': 0.31736606545766943, 'patience': 100, 'lr_reduce_freq': 30, 'spt_alg': 'kruskal', 'spt_attr': 'edge_degree', 'manifold': 'PoincareBall', 'num_layers': 3, 'dim': 240, 'num_adj': 4, 'add_rate': 0.5796212994402915, 'tem': 1.3102276167798554, 'consis_rate': 1.9705834664356472, 'use_att': 1}. Best is trial 86 with value: 0.8253.[0m
[32m[I 2022-07-01 15:28:50,632][0m Trial 94 finished with value: 0.31989999999999996 and parameters: {'lr': 0.046327578231496656, 'weight_decay': 0.024855870912417245, 'dropout': 0.28647208324248197, 'patience': 100, 'lr_reduce_freq': 30, 'spt_alg': 'kruskal', 'spt_attr': 'edge_degree', 'manifold': 'PoincareBall', 'num_layers': 3, 'dim': 224, 'num_adj': 4, 'add_rate': 0.6494649451011407, 'tem': 1.3258230694301427, 'consis_rate': 1.9994457999044655, 'use_att': 1}. Best is trial 86 with value: 0.8253.[0m
[32m[I 2022-07-01 15:40:16,715][0m Trial 95 finished with value: 0.8168000000000001 and parameters: {'lr': 0.08751759201285399, 'weight_decay': 0.013954262593774127, 'dropout': 0.4442315795063265, 'patience': 100, 'lr_reduce_freq': 45, 'spt_alg': 'kruskal', 'spt_attr': 'edge_degree', 'manifold': 'PoincareBall', 'num_layers': 3, 'dim': 192, 'num_adj': 4, 'add_rate': 0.5953230519467179, 'tem': 1.4172956831844727, 'consis_rate': 1.9060609755197877, 'use_att': 1}. Best is trial 86 with value: 0.8253.[0m
[32m[I 2022-07-01 15:46:32,247][0m Trial 96 finished with value: 0.3204 and parameters: {'lr': 0.06004596984245197, 'weight_decay': 0.033751289995644036, 'dropout': 0.32302682275034456, 'patience': 100, 'lr_reduce_freq': 30, 'spt_alg': 'kruskal', 'spt_attr': 'edge_degree', 'manifold': 'PoincareBall', 'num_layers': 3, 'dim': 208, 'num_adj': 4, 'add_rate': 0.5612668265967917, 'tem': 1.3699499287861157, 'consis_rate': 1.9352768192315757, 'use_att': 1}. Best is trial 86 with value: 0.8253.[0m
[32m[I 2022-07-01 15:48:39,243][0m Trial 97 finished with value: 0.31429999999999997 and parameters: {'lr': 0.04120507591058453, 'weight_decay': 0.018244391651422703, 'dropout': 0.34886638925174235, 'patience': 100, 'lr_reduce_freq': 30, 'spt_alg': 'kruskal', 'spt_attr': 'edge_degree', 'manifold': 'PoincareBall', 'num_layers': 3, 'dim': 208, 'num_adj': 4, 'add_rate': 0.748396950655153, 'tem': 1.4407366573926945, 'consis_rate': 1.9597760005742175, 'use_att': 0}. Best is trial 86 with value: 0.8253.[0m
[32m[I 2022-07-01 15:52:47,268][0m Trial 98 finished with value: 0.3229 and parameters: {'lr': 0.03266681706180247, 'weight_decay': 0.023097833379701716, 'dropout': 0.37607673534795305, 'patience': 100, 'lr_reduce_freq': 45, 'spt_alg': 'kruskal', 'spt_attr': 'edge_degree', 'manifold': 'PoincareBall', 'num_layers': 3, 'dim': 144, 'num_adj': 2, 'add_rate': 0.616537840087231, 'tem': 1.2471663163668687, 'consis_rate': 0.9070797357642535, 'use_att': 1}. Best is trial 86 with value: 0.8253.[0m
[32m[I 2022-07-01 16:06:53,588][0m Trial 99 finished with value: 0.6801 and parameters: {'lr': 0.07636812039728785, 'weight_decay': 0.012965816883280235, 'dropout': 0.42746765674570764, 'patience': 100, 'lr_reduce_freq': 30, 'spt_alg': 'kruskal', 'spt_attr': 'edge_degree', 'manifold': 'Hyperboloid', 'num_layers': 3, 'dim': 160, 'num_adj': 4, 'add_rate': 0.8208919695549204, 'tem': 1.3976491893353595, 'consis_rate': 0.6485935915043965, 'use_att': 1}. Best is trial 86 with value: 0.8253.[0m
[32m[I 2022-07-01 16:13:18,490][0m Trial 100 finished with value: 0.31920000000000004 and parameters: {'lr': 0.06683610510932941, 'weight_decay': 0.03137374414770317, 'dropout': 0.2976462715912631, 'patience': 100, 'lr_reduce_freq': 30, 'spt_alg': 'kruskal', 'spt_attr': 'edge_degree', 'manifold': 'PoincareBall', 'num_layers': 3, 'dim': 192, 'num_adj': 4, 'add_rate': 0.6457439128771348, 'tem': 1.2890327616142447, 'consis_rate': 1.913312670379696, 'use_att': 1}. Best is trial 86 with value: 0.8253.[0m
[32m[I 2022-07-01 16:24:21,957][0m Trial 101 finished with value: 0.8244 and parameters: {'lr': 0.07419265414893234, 'weight_decay': 0.02287157526759226, 'dropout': 0.39115148225031354, 'patience': 100, 'lr_reduce_freq': 30, 'spt_alg': 'kruskal', 'spt_attr': 'edge_degree', 'manifold': 'PoincareBall', 'num_layers': 3, 'dim': 176, 'num_adj': 4, 'add_rate': 0.6023391679244237, 'tem': 1.3409668347922803, 'consis_rate': 1.8570343356026755, 'use_att': 1}. Best is trial 86 with value: 0.8253.[0m
[32m[I 2022-07-01 16:35:15,185][0m Trial 102 finished with value: 0.8145 and parameters: {'lr': 0.09995511239660822, 'weight_decay': 0.01549642344973012, 'dropout': 0.3921025581737008, 'patience': 100, 'lr_reduce_freq': 30, 'spt_alg': 'kruskal', 'spt_attr': 'edge_degree', 'manifold': 'PoincareBall', 'num_layers': 3, 'dim': 176, 'num_adj': 4, 'add_rate': 0.5530144875782502, 'tem': 1.3342237286009546, 'consis_rate': 1.7987017322681398, 'use_att': 1}. Best is trial 86 with value: 0.8253.[0m
[32m[I 2022-07-01 16:52:33,167][0m Trial 103 finished with value: 0.82 and parameters: {'lr': 0.09013531022270885, 'weight_decay': 0.019288253069470587, 'dropout': 0.3618522977205049, 'patience': 100, 'lr_reduce_freq': 45, 'spt_alg': 'kruskal', 'spt_attr': 'edge_degree', 'manifold': 'PoincareBall', 'num_layers': 3, 'dim': 224, 'num_adj': 4, 'add_rate': 0.7015305676033925, 'tem': 1.3015787405818378, 'consis_rate': 1.9716650863038543, 'use_att': 1}. Best is trial 86 with value: 0.8253.[0m
[32m[I 2022-07-01 17:09:20,556][0m Trial 104 finished with value: 0.8176 and parameters: {'lr': 0.09116546455183482, 'weight_decay': 0.01901582928173756, 'dropout': 0.4168205894458965, 'patience': 100, 'lr_reduce_freq': 45, 'spt_alg': 'kruskal', 'spt_attr': 'edge_degree', 'manifold': 'PoincareBall', 'num_layers': 3, 'dim': 224, 'num_adj': 4, 'add_rate': 0.7080228339983242, 'tem': 1.3141456501656699, 'consis_rate': 1.8926614610529222, 'use_att': 1}. Best is trial 86 with value: 0.8253.[0m
[32m[I 2022-07-01 17:28:02,761][0m Trial 105 finished with value: 0.8254999999999999 and parameters: {'lr': 0.07148263082191429, 'weight_decay': 0.02296123721831685, 'dropout': 0.3282534560666204, 'patience': 100, 'lr_reduce_freq': 30, 'spt_alg': 'kruskal', 'spt_attr': 'edge_degree', 'manifold': 'PoincareBall', 'num_layers': 3, 'dim': 240, 'num_adj': 4, 'add_rate': 0.6038422083998806, 'tem': 1.252812816244541, 'consis_rate': 1.9961422878114805, 'use_att': 1}. Best is trial 105 with value: 0.8254999999999999.[0m
[32m[I 2022-07-01 17:46:23,946][0m Trial 106 finished with value: 0.8181 and parameters: {'lr': 0.07711493053321122, 'weight_decay': 0.02285049124003063, 'dropout': 0.3293182979438305, 'patience': 100, 'lr_reduce_freq': 30, 'spt_alg': 'kruskal', 'spt_attr': 'edge_degree', 'manifold': 'PoincareBall', 'num_layers': 3, 'dim': 240, 'num_adj': 4, 'add_rate': 0.6028024331478249, 'tem': 1.2750704787070866, 'consis_rate': 1.9984188526592885, 'use_att': 1}. Best is trial 105 with value: 0.8254999999999999.[0m
[32m[I 2022-07-01 17:56:43,595][0m Trial 107 finished with value: 0.3205 and parameters: {'lr': 0.06844230470748762, 'weight_decay': 0.04094174780352234, 'dropout': 0.3434549666230579, 'patience': 100, 'lr_reduce_freq': 30, 'spt_alg': 'kruskal', 'spt_attr': 'edge_degree', 'manifold': 'PoincareBall', 'num_layers': 3, 'dim': 208, 'num_adj': 4, 'add_rate': 0.5688762625438194, 'tem': 1.2321796493998676, 'consis_rate': 1.8659186550067854, 'use_att': 1}. Best is trial 105 with value: 0.8254999999999999.[0m
