[32m[I 2022-06-27 04:33:17,269][0m Trial 88 finished with value: 0.8193999999999999 and parameters: {'lr': 0.004674238390013417, 'weight_decay': 0.000702580618168907, 'dropout': 0.779238087478331, 'patience': 80, 'lr_reduce_freq': 90, 'spt_alg': 'prim', 'spt_attr': 'edge_degree', 'manifold': 'PoincareBall', 'num_layers': 3, 'dim': 328, 'num_adj': 6, 'add_rate': 0.4351082776662541, 'tem': 1.1900034321562918, 'consis_rate': 1.6028086542050486, 'use_att': 1}. Best is trial 70 with value: 0.8281999999999998.[0m

mean: 0.8205
[0.811 0.825 0.825 0.834 0.836 0.799 0.817 0.835 0.812 0.811]
cur_param: {'lr': 0.0051572484621677985, 'weight_decay': 0.0007805932724964178, 'dropout': 0.7096364720855789, 'patience': 80, 'lr_reduce_freq': 100, 'spt_alg': 'prim', 'spt_attr': 'edge_degree', 'manifold': 'PoincareBall', 'num_layers': 3, 'dim': 332, 'num_adj': 6, 'add_rate': 0.48853468860211535, 'tem': 1.1016234333006332, 'consis_rate': 1.6486057950505986, 'use_att': 1}
mean: 0.8163
[0.813 0.813 0.823 0.827 0.836 0.8   0.811 0.815 0.812 0.813]
cur_param: {'lr': 0.00547188616392486, 'weight_decay': 0.0007996891312858483, 'dropout': 0.7027130670889169, 'patience': 80, 'lr_reduce_freq': 90, 'spt_alg': 'prim', 'spt_attr': 'edge_degree', 'manifold': 'PoincareBall', 'num_layers': 3, 'dim': 320, 'num_adj': 6, 'add_rate': 0.4574091857300735, 'tem': 1.0980611918249763, 'consis_rate': 1.6861101998803312, 'use_att': 1}
mean: 0.818
[0.822 0.819 0.802 0.821 0.809 0.813 0.838 0.824 0.808 0.824]
cur_param: {'lr': 0.004981648166328675, 'weight_decay': 0.0007733483406357571, 'dropout': 0.7251171653511136, 'patience': 80, 'lr_reduce_freq': 90, 'spt_alg': 'prim', 'spt_attr': 'edge_degree', 'manifold': 'PoincareBall', 'num_layers': 3, 'dim': 336, 'num_adj': 6, 'add_rate': 0.4981218241213921, 'tem': 1.1253414079981885, 'consis_rate': 1.632720083682671, 'use_att': 1}
mean: 0.8205
[0.822 0.82  0.826 0.823 0.827 0.804 0.834 0.827 0.806 0.816]
cur_param: {'lr': 0.005037653636875082, 'weight_decay': 0.000731927054705973, 'dropout': 0.7477187600767842, 'patience': 80, 'lr_reduce_freq': 90, 'spt_alg': 'prim', 'spt_attr': 'edge_degree', 'manifold': 'PoincareBall', 'num_layers': 3, 'dim': 336, 'num_adj': 6, 'add_rate': 0.4995884778605304, 'tem': 1.127980990389835, 'consis_rate': 1.6371578419234345, 'use_att': 1}
mean: 0.8248
[0.821 0.826 0.833 0.826 0.827 0.819 0.837 0.817 0.827 0.815]
cur_param: {'lr': 0.005013017827555491, 'weight_decay': 0.0007738510393627313, 'dropout': 0.7523093603659632, 'patience': 80, 'lr_reduce_freq': 100, 'spt_alg': 'prim', 'spt_attr': 'edge_degree', 'manifold': 'PoincareBall', 'num_layers': 3, 'dim': 336, 'num_adj': 6, 'add_rate': 0.4769436254417857, 'tem': 1.1322341536831806, 'consis_rate': 1.6362787437131487, 'use_att': 1}
mean: 0.821
[0.821 0.813 0.834 0.83  0.822 0.82  0.799 0.828 0.829 0.814]
cur_param: {'lr': 0.004813445856079344, 'weight_decay': 0.000738991511850291, 'dropout': 0.7523871270504794, 'patience': 80, 'lr_reduce_freq': 100, 'spt_alg': 'prim', 'spt_attr': 'similarity', 'manifold': 'PoincareBall', 'num_layers': 3, 'dim': 336, 'num_adj': 6, 'add_rate': 0.4999059785697976, 'tem': 1.1333544716405626, 'consis_rate': 1.6212947343588568, 'use_att': 0}
mean: 0.8070999999999999
[0.813 0.805 0.803 0.808 0.819 0.806 0.803 0.798 0.796 0.82 ]
cur_param: {'lr': 0.0058500589210670915, 'weight_decay': 0.0007162051771947082, 'dropout': 0.797287431693968, 'patience': 80, 'lr_reduce_freq': 90, 'spt_alg': 'prim', 'spt_attr': 'edge_degree', 'manifold': 'Hyperboloid', 'num_layers': 3, 'dim': 332, 'num_adj': 6, 'add_rate': 0.4760026505635223, 'tem': 1.1533242065923905, 'consis_rate': 1.6376187974116319, 'use_att': 1}
mean: 0.8165000000000001
[0.826 0.809 0.808 0.81  0.825 0.802 0.823 0.834 0.804 0.824]
cur_param: {'lr': 0.006299084474969543, 'weight_decay': 0.0007657473465614366, 'dropout': 0.7484224701390303, 'patience': 80, 'lr_reduce_freq': 100, 'spt_alg': 'prim', 'spt_attr': 'edge_degree', 'manifold': 'PoincareBall', 'num_layers': 3, 'dim': 328, 'num_adj': 6, 'add_rate': 0.5097125589378878, 'tem': 1.1369706327159672, 'consis_rate': 1.580550144466089, 'use_att': 1}
mean: 0.82
[0.816 0.825 0.832 0.83  0.824 0.807 0.829 0.816 0.814 0.807]
cur_param: {'lr': 0.005032199707696566, 'weight_decay': 0.0007734119678847637, 'dropout': 0.7662068082477844, 'patience': 80, 'lr_reduce_freq': 90, 'spt_alg': 'prim', 'spt_attr': 'edge_degree', 'manifold': 'PoincareBall', 'num_layers': 3, 'dim': 332, 'num_adj': 6, 'add_rate': 0.4663099627458372, 'tem': 1.114798465615045, 'consis_rate': 1.6003927358520202, 'use_att': 1}
mean: 0.8154999999999999
[0.827 0.829 0.818 0.807 0.821 0.795 0.809 0.814 0.81  0.825]
cur_param: {'lr': 0.005116191207024923, 'weight_decay': 0.0007376798786742269, 'dropout': 0.7163402708155393, 'patience': 80, 'lr_reduce_freq': 90, 'spt_alg': 'prim', 'spt_attr': 'edge_degree', 'manifold': 'PoincareBall', 'num_layers': 3, 'dim': 324, 'num_adj': 6, 'add_rate': 0.49001923756716476, 'tem': 1.073964483586729, 'consis_rate': 1.6576929163085263, 'use_att': 1}
mean: 0.818
[0.819 0.804 0.819 0.836 0.811 0.813 0.827 0.827 0.813 0.811]
cur_param: {'lr': 0.00559915052856242, 'weight_decay': 0.0007997422578698561, 'dropout': 0.7284877388552758, 'patience': 80, 'lr_reduce_freq': 100, 'spt_alg': 'prim', 'spt_attr': 'edge_degree', 'manifold': 'PoincareBall', 'num_layers': 3, 'dim': 316, 'num_adj': 6, 'add_rate': 0.48350074978368063, 'tem': 1.1676828836047666, 'consis_rate': 1.691669849676306, 'use_att': 1}
mean: 0.8185
[0.819 0.804 0.821 0.814 0.831 0.806 0.82  0.813 0.827 0.83 ]
cur_param: {'lr': 0.0047519845230988705, 'weight_decay': 0.0006997304101922534, 'dropout': 0.7432781804227478, 'patience': 80, 'lr_reduce_freq': 90, 'spt_alg': 'prim', 'spt_attr': 'edge_degree', 'manifold': 'PoincareBall', 'num_layers': 3, 'dim': 336, 'num_adj': 6, 'add_rate': 0.45427972192149035, 'tem': 1.119660227070227, 'consis_rate': 1.6380428336311206, 'use_att': 1}
mean: 0.8225
[0.824 0.83  0.84  0.829 0.827 0.821 0.827 0.813 0.813 0.801]
cur_param: {'lr': 0.004792575315592027, 'weight_decay': 0.0007504705832803701, 'dropout': 0.7474665170888216, 'patience': 80, 'lr_reduce_freq': 90, 'spt_alg': 'prim', 'spt_attr': 'edge_degree', 'manifold': 'PoincareBall', 'num_layers': 3, 'dim': 336, 'num_adj': 6, 'add_rate': 0.45090120384321286, 'tem': 1.1207716107799517, 'consis_rate': 1.6401562119025606, 'use_att': 1}
mean: 0.8209
[0.829 0.818 0.832 0.82  0.82  0.826 0.834 0.807 0.818 0.805]
cur_param: {'lr': 0.00976281107868359, 'weight_decay': 0.0007268342460114905, 'dropout': 0.7437048774292008, 'patience': 80, 'lr_reduce_freq': 90, 'spt_alg': 'prim', 'spt_attr': 'edge_degree', 'manifold': 'PoincareBall', 'num_layers': 3, 'dim': 336, 'num_adj': 6, 'add_rate': 0.4544707472858248, 'tem': 1.1170284830048647, 'consis_rate': 1.6368647028577596, 'use_att': 1}
mean: 0.8135
[0.787 0.827 0.815 0.813 0.807 0.805 0.827 0.806 0.828 0.82 ]
cur_param: {'lr': 0.004741649385726493, 'weight_decay': 0.0007502355693618022, 'dropout': 0.7332960143193252, 'patience': 80, 'lr_reduce_freq': 90, 'spt_alg': 'prim', 'spt_attr': 'edge_degree', 'manifold': 'PoincareBall', 'num_layers': 3, 'dim': 328, 'num_adj': 6, 'add_rate': 0.44506943041679636, 'tem': 1.1467314250416678, 'consis_rate': 1.665717400940405, 'use_att': 1}
mean: 0.8215
[0.832 0.823 0.818 0.821 0.838 0.822 0.815 0.824 0.802 0.82 ]
cur_param: {'lr': 0.004714075916333666, 'weight_decay': 0.0007020880282122292, 'dropout': 0.7591149254951294, 'patience': 80, 'lr_reduce_freq': 90, 'spt_alg': 'prim', 'spt_attr': 'edge_degree', 'manifold': 'PoincareBall', 'num_layers': 3, 'dim': 328, 'num_adj': 6, 'add_rate': 0.44524204833963965, 'tem': 1.195901726189246, 'consis_rate': 1.6116120572577357, 'use_att': 1}
mean: 0.8240999999999999
[0.814 0.833 0.831 0.827 0.83  0.824 0.824 0.83  0.823 0.805]
cur_param: {'lr': 0.004674238390013417, 'weight_decay': 0.000702580618168907, 'dropout': 0.779238087478331, 'patience': 80, 'lr_reduce_freq': 90, 'spt_alg': 'prim', 'spt_attr': 'edge_degree', 'manifold': 'PoincareBall', 'num_layers': 3, 'dim': 328, 'num_adj': 6, 'add_rate': 0.4351082776662541, 'tem': 1.1900034321562918, 'consis_rate': 1.6028086542050486, 'use_att': 1}
mean: 0.8193999999999999
[0.83  0.823 0.825 0.834 0.82  0.794 0.819 0.821 0.809 0.819]
cur_param: {'lr': 0.004209526925749673, 'weight_decay': 0.0006869313508043888, 'dropout': 0.7586249261045239, 'patience': 80, 'lr_reduce_freq': 90, 'spt_alg': 'prim', 'spt_attr': 'similarity', 'manifold': 'PoincareBall', 'num_layers': 3, 'dim': 324, 'num_adj': 6, 'add_rate': 0.44433437811496707, 'tem': 1.1690370366651432, 'consis_rate': 1.660871043130401, 'use_att': 0}
mean: 0.8100000000000002
[0.815 0.808 0.808 0.82  0.809 0.813 0.806 0.794 0.822 0.805][32m[I 2022-06-27 04:37:51,128][0m Trial 89 finished with value: 0.8100000000000002 and parameters: {'lr': 0.004209526925749673, 'weight_decay': 0.0006869313508043888, 'dropout': 0.7586249261045239, 'patience': 80, 'lr_reduce_freq': 90, 'spt_alg': 'prim', 'spt_attr': 'similarity', 'manifold': 'PoincareBall', 'num_layers': 3, 'dim': 324, 'num_adj': 6, 'add_rate': 0.44433437811496707, 'tem': 1.1690370366651432, 'consis_rate': 1.660871043130401, 'use_att': 0}. Best is trial 70 with value: 0.8281999999999998.[0m
[32m[I 2022-06-27 04:59:03,910][0m Trial 90 finished with value: 0.8137000000000001 and parameters: {'lr': 0.005315791417941914, 'weight_decay': 0.0007475512778578702, 'dropout': 0.7346124823956781, 'patience': 80, 'lr_reduce_freq': 100, 'spt_alg': 'prim', 'spt_attr': 'edge_degree', 'manifold': 'Hyperboloid', 'num_layers': 3, 'dim': 332, 'num_adj': 6, 'add_rate': 0.41903503368558837, 'tem': 1.1479833947709663, 'consis_rate': 1.571426861821551, 'use_att': 1}. Best is trial 70 with value: 0.8281999999999998.[0m
[32m[I 2022-06-27 05:19:09,636][0m Trial 91 finished with value: 0.8172 and parameters: {'lr': 0.0023663820665787228, 'weight_decay': 0.0007105534148153364, 'dropout': 0.7702600926378743, 'patience': 80, 'lr_reduce_freq': 90, 'spt_alg': 'prim', 'spt_attr': 'edge_degree', 'manifold': 'PoincareBall', 'num_layers': 3, 'dim': 328, 'num_adj': 6, 'add_rate': 0.4487146187071879, 'tem': 1.1693027102261453, 'consis_rate': 1.6108411018823146, 'use_att': 1}. Best is trial 70 with value: 0.8281999999999998.[0m
[32m[I 2022-06-27 05:37:08,174][0m Trial 92 finished with value: 0.8192 and parameters: {'lr': 0.004853365084247605, 'weight_decay': 0.0007606140368274897, 'dropout': 0.7856563534833177, 'patience': 80, 'lr_reduce_freq': 90, 'spt_alg': 'prim', 'spt_attr': 'edge_degree', 'manifold': 'PoincareBall', 'num_layers': 3, 'dim': 336, 'num_adj': 6, 'add_rate': 0.46479187914960657, 'tem': 1.1432089646600299, 'consis_rate': 1.6497271138539964, 'use_att': 1}. Best is trial 70 with value: 0.8281999999999998.[0m
[32m[I 2022-06-27 05:54:29,872][0m Trial 93 finished with value: 0.8194000000000001 and parameters: {'lr': 0.0047811281404132, 'weight_decay': 0.0007235456763133825, 'dropout': 0.746857725870956, 'patience': 80, 'lr_reduce_freq': 90, 'spt_alg': 'prim', 'spt_attr': 'edge_degree', 'manifold': 'PoincareBall', 'num_layers': 3, 'dim': 320, 'num_adj': 6, 'add_rate': 0.43259721617940217, 'tem': 1.1112580123294336, 'consis_rate': 1.6682600315338325, 'use_att': 1}. Best is trial 70 with value: 0.8281999999999998.[0m
[32m[I 2022-06-27 06:10:52,406][0m Trial 94 finished with value: 0.8213999999999999 and parameters: {'lr': 0.005400124360775092, 'weight_decay': 0.0006659782762257902, 'dropout': 0.7556087429237683, 'patience': 80, 'lr_reduce_freq': 100, 'spt_alg': 'prim', 'spt_attr': 'edge_degree', 'manifold': 'PoincareBall', 'num_layers': 3, 'dim': 324, 'num_adj': 6, 'add_rate': 0.4417170031297527, 'tem': 1.1236941941075629, 'consis_rate': 1.5462237515114898, 'use_att': 1}. Best is trial 70 with value: 0.8281999999999998.[0m
[32m[I 2022-06-27 06:27:40,994][0m Trial 95 finished with value: 0.8197999999999999 and parameters: {'lr': 0.005310613042510782, 'weight_decay': 0.0006757656765731589, 'dropout': 0.7557179327327729, 'patience': 80, 'lr_reduce_freq': 100, 'spt_alg': 'prim', 'spt_attr': 'edge_degree', 'manifold': 'PoincareBall', 'num_layers': 3, 'dim': 324, 'num_adj': 6, 'add_rate': 0.43957286609315327, 'tem': 1.157946238870991, 'consis_rate': 1.5186593420271544, 'use_att': 1}. Best is trial 70 with value: 0.8281999999999998.[0m
[32m[I 2022-06-27 06:45:35,583][0m Trial 96 finished with value: 0.8209 and parameters: {'lr': 0.004360229884616043, 'weight_decay': 0.0006949597713277807, 'dropout': 0.7376700669681707, 'patience': 80, 'lr_reduce_freq': 100, 'spt_alg': 'prim', 'spt_attr': 'edge_degree', 'manifold': 'PoincareBall', 'num_layers': 3, 'dim': 328, 'num_adj': 6, 'add_rate': 0.4536979544842022, 'tem': 1.1994504784948639, 'consis_rate': 1.5406729923279026, 'use_att': 1}. Best is trial 70 with value: 0.8281999999999998.[0m
[32m[I 2022-06-27 06:53:55,195][0m Trial 97 finished with value: 0.8187 and parameters: {'lr': 0.00579814260835161, 'weight_decay': 0.0006876749230109521, 'dropout': 0.7343408627851868, 'patience': 80, 'lr_reduce_freq': 100, 'spt_alg': 'prim', 'spt_attr': 'edge_degree', 'manifold': 'PoincareBall', 'num_layers': 3, 'dim': 324, 'num_adj': 2, 'add_rate': 0.47590468993362406, 'tem': 1.1931238052836877, 'consis_rate': 1.543040284127133, 'use_att': 1}. Best is trial 70 with value: 0.8281999999999998.[0m
[32m[I 2022-06-27 07:07:16,470][0m Trial 98 finished with value: 0.8199 and parameters: {'lr': 0.004341864706685753, 'weight_decay': 0.000662890474570104, 'dropout': 0.7393333429695335, 'patience': 80, 'lr_reduce_freq': 100, 'spt_alg': 'prim', 'spt_attr': 'edge_degree', 'manifold': 'PoincareBall', 'num_layers': 3, 'dim': 316, 'num_adj': 4, 'add_rate': 0.4681662279662479, 'tem': 1.1796323081494304, 'consis_rate': 1.5508533362584422, 'use_att': 1}. Best is trial 70 with value: 0.8281999999999998.[0m
[32m[I 2022-06-27 07:23:33,659][0m Trial 99 finished with value: 0.818 and parameters: {'lr': 0.005466363377274453, 'weight_decay': 0.0007027575175049958, 'dropout': 0.7607634218554007, 'patience': 80, 'lr_reduce_freq': 100, 'spt_alg': 'prim', 'spt_attr': 'edge_degree', 'manifold': 'PoincareBall', 'num_layers': 3, 'dim': 328, 'num_adj': 6, 'add_rate': 0.42218969278967, 'tem': 1.1031016969935725, 'consis_rate': 1.5111096528544792, 'use_att': 1}. Best is trial 70 with value: 0.8281999999999998.[0m
[32m[I 2022-06-27 07:42:16,300][0m Trial 100 finished with value: 0.8232999999999999 and parameters: {'lr': 0.004738891829558056, 'weight_decay': 0.0007365980382522116, 'dropout': 0.7510497832920059, 'patience': 80, 'lr_reduce_freq': 90, 'spt_alg': 'prim', 'spt_attr': 'edge_degree', 'manifold': 'PoincareBall', 'num_layers': 3, 'dim': 336, 'num_adj': 6, 'add_rate': 0.5192433733542129, 'tem': 1.1245913549452498, 'consis_rate': 1.5905347802760192, 'use_att': 1}. Best is trial 70 with value: 0.8281999999999998.[0m
[32m[I 2022-06-27 07:59:56,994][0m Trial 101 finished with value: 0.8207000000000001 and parameters: {'lr': 0.004565996943763855, 'weight_decay': 0.000736316499727434, 'dropout': 0.7523244237510152, 'patience': 80, 'lr_reduce_freq': 120, 'spt_alg': 'prim', 'spt_attr': 'edge_degree', 'manifold': 'PoincareBall', 'num_layers': 3, 'dim': 332, 'num_adj': 6, 'add_rate': 0.45838663991121964, 'tem': 1.1391460819762, 'consis_rate': 1.5875287762189831, 'use_att': 1}. Best is trial 70 with value: 0.8281999999999998.[0m
[32m[I 2022-06-27 08:17:09,981][0m Trial 102 finished with value: 0.8191 and parameters: {'lr': 0.0051956333829606465, 'weight_decay': 0.0006444018124593665, 'dropout': 0.7754251548277513, 'patience': 80, 'lr_reduce_freq': 100, 'spt_alg': 'prim', 'spt_attr': 'edge_degree', 'manifold': 'PoincareBall', 'num_layers': 3, 'dim': 332, 'num_adj': 6, 'add_rate': 0.5059781848144252, 'tem': 1.1976617480759753, 'consis_rate': 1.6264777075621242, 'use_att': 1}. Best is trial 70 with value: 0.8281999999999998.[0m
[32m[I 2022-06-27 08:35:27,985][0m Trial 103 finished with value: 0.8240999999999999 and parameters: {'lr': 0.004703135890500314, 'weight_decay': 0.0007461683907659564, 'dropout': 0.7665167465075309, 'patience': 80, 'lr_reduce_freq': 90, 'spt_alg': 'prim', 'spt_attr': 'edge_degree', 'manifold': 'PoincareBall', 'num_layers': 3, 'dim': 336, 'num_adj': 6, 'add_rate': 0.5165532346605597, 'tem': 1.1255054848027413, 'consis_rate': 1.6119818612035226, 'use_att': 1}. Best is trial 70 with value: 0.8281999999999998.[0m
[32m[I 2022-06-27 08:55:18,230][0m Trial 104 finished with value: 0.8226999999999999 and parameters: {'lr': 0.004073327831619582, 'weight_decay': 0.0007631425925363339, 'dropout': 0.7874962476831938, 'patience': 80, 'lr_reduce_freq': 90, 'spt_alg': 'prim', 'spt_attr': 'edge_degree', 'manifold': 'PoincareBall', 'num_layers': 3, 'dim': 336, 'num_adj': 6, 'add_rate': 0.5276821364742322, 'tem': 1.1270220478948052, 'consis_rate': 1.6138469803806608, 'use_att': 1}. Best is trial 70 with value: 0.8281999999999998.[0m
[32m[I 2022-06-27 09:14:32,929][0m Trial 105 finished with value: 0.8165000000000001 and parameters: {'lr': 0.00467982605150675, 'weight_decay': 0.0007143931736471792, 'dropout': 0.7925037660150548, 'patience': 80, 'lr_reduce_freq': 90, 'spt_alg': 'prim', 'spt_attr': 'edge_degree', 'manifold': 'PoincareBall', 'num_layers': 3, 'dim': 336, 'num_adj': 6, 'add_rate': 0.5220798628627054, 'tem': 1.108086806025929, 'consis_rate': 1.6143743881784534, 'use_att': 1}. Best is trial 70 with value: 0.8281999999999998.[0m
[32m[I 2022-06-27 09:34:04,397][0m Trial 106 finished with value: 0.8224 and parameters: {'lr': 0.0039921015512163, 'weight_decay': 0.0007448632867114817, 'dropout': 0.7885175762187373, 'patience': 80, 'lr_reduce_freq': 90, 'spt_alg': 'prim', 'spt_attr': 'edge_degree', 'manifold': 'PoincareBall', 'num_layers': 3, 'dim': 324, 'num_adj': 6, 'add_rate': 0.5151277387210919, 'tem': 1.0873977930826024, 'consis_rate': 1.5541851757564977, 'use_att': 1}. Best is trial 70 with value: 0.8281999999999998.[0m
