[32m[I 2022-06-23 02:08:42,244][0m Trial 93 finished with value: 0.8082 and parameters: {'lr': 0.0020257011124116537, 'weight_decay': 0.0005564933348171793, 'dropout': 0.7635696121523877, 'patience': 60, 'lr_reduce_freq': 130, 'spt_alg': 'kruskal', 'spt_attr': 'edge_degree', 'manifold': 'PoincareBall', 'num_layers': 3, 'num_adj': 6, 'add_rate': 0.40675493673291624, 'tem': 0.7383164370812606, 'consis_rate': 1.094644936487382, 'use_att': 1}. Best is trial 91 with value: 0.8135999999999999.[0m

mean: 0.7797
[0.804 0.794 0.806 0.801 0.818 0.811 0.789 0.8   0.802 0.572]
cur_param: {'lr': 0.0013075130788002798, 'weight_decay': 0.0013291693687955413, 'dropout': 0.7014818092478511, 'patience': 60, 'lr_reduce_freq': 110, 'spt_alg': 'kruskal', 'spt_attr': 'similarity', 'manifold': 'PoincareBall', 'num_layers': 3, 'num_adj': 6, 'add_rate': 0.35617114706827324, 'tem': 0.8134549404170426, 'consis_rate': 1.6894040025836738, 'use_att': 1}
mean: 0.7761
[0.799 0.798 0.811 0.805 0.556 0.813 0.789 0.788 0.799 0.803]
cur_param: {'lr': 0.0020928167872821327, 'weight_decay': 0.0008747776376450779, 'dropout': 0.7729548439983659, 'patience': 60, 'lr_reduce_freq': 150, 'spt_alg': 'kruskal', 'spt_attr': 'edge_degree', 'manifold': 'PoincareBall', 'num_layers': 3, 'num_adj': 6, 'add_rate': 0.3934649965208969, 'tem': 0.9687161977308819, 'consis_rate': 1.052600110509095, 'use_att': 1}
mean: 0.8131999999999999
[0.798 0.832 0.815 0.81  0.814 0.824 0.82  0.812 0.811 0.796]
cur_param: {'lr': 0.0022095480925142332, 'weight_decay': 0.0008808617276341216, 'dropout': 0.8771977156741525, 'patience': 60, 'lr_reduce_freq': 130, 'spt_alg': 'kruskal', 'spt_attr': 'edge_degree', 'manifold': 'PoincareBall', 'num_layers': 4, 'num_adj': 6, 'add_rate': 0.10169396840667463, 'tem': 0.8870798221906033, 'consis_rate': 1.033998172062593, 'use_att': 1}
mean: 0.2638
[0.149 0.364 0.091 0.322 0.174 0.431 0.32  0.318 0.32  0.149]
cur_param: {'lr': 0.003553116450257378, 'weight_decay': 0.0005770741144056958, 'dropout': 0.47152427680073694, 'patience': 60, 'lr_reduce_freq': 130, 'spt_alg': 'kruskal', 'spt_attr': 'edge_degree', 'manifold': 'PoincareBall', 'num_layers': 3, 'num_adj': 6, 'add_rate': 0.395243528258913, 'tem': 0.971373653270449, 'consis_rate': 1.1999224089855651, 'use_att': 1}
mean: 0.8096
[0.812 0.81  0.806 0.81  0.802 0.81  0.816 0.796 0.815 0.819]
cur_param: {'lr': 0.0030637938822555624, 'weight_decay': 0.0005615457170291271, 'dropout': 0.4678763428710287, 'patience': 60, 'lr_reduce_freq': 110, 'spt_alg': 'kruskal', 'spt_attr': 'similarity', 'manifold': 'PoincareBall', 'num_layers': 3, 'num_adj': 6, 'add_rate': 0.39584761940276886, 'tem': 0.9732366374144478, 'consis_rate': 1.0548551674460336, 'use_att': 1}
mean: 0.8047000000000001
[0.808 0.782 0.805 0.81  0.813 0.799 0.807 0.796 0.811 0.816]
cur_param: {'lr': 0.0021644777020958066, 'weight_decay': 0.0008185157963512234, 'dropout': 0.6060333098405637, 'patience': 60, 'lr_reduce_freq': 130, 'spt_alg': 'kruskal', 'spt_attr': 'edge_degree', 'manifold': 'PoincareBall', 'num_layers': 3, 'num_adj': 6, 'add_rate': 0.13949681531246894, 'tem': 0.9100229482020836, 'consis_rate': 1.1196942209867828, 'use_att': 1}
mean: 0.8088000000000001
[0.795 0.828 0.795 0.814 0.803 0.812 0.812 0.808 0.806 0.815]
cur_param: {'lr': 0.0016226712092837624, 'weight_decay': 0.0010920710354776983, 'dropout': 0.7906918282319498, 'patience': 60, 'lr_reduce_freq': 130, 'spt_alg': 'kruskal', 'spt_attr': 'edge_degree', 'manifold': 'PoincareBall', 'num_layers': 3, 'num_adj': 6, 'add_rate': 0.4495729077221433, 'tem': 0.5960215415459167, 'consis_rate': 1.1976240855007851, 'use_att': 1}
mean: 0.8078000000000001
[0.797 0.805 0.801 0.813 0.815 0.812 0.813 0.808 0.811 0.803]
cur_param: {'lr': 0.003719860455866173, 'weight_decay': 0.0005837053431532225, 'dropout': 0.4510300688827947, 'patience': 60, 'lr_reduce_freq': 150, 'spt_alg': 'kruskal', 'spt_attr': 'edge_degree', 'manifold': 'PoincareBall', 'num_layers': 3, 'num_adj': 6, 'add_rate': 0.392549458302808, 'tem': 0.7575080426853489, 'consis_rate': 1.2614890510182133, 'use_att': 1}
mean: 0.8034000000000001
[0.809 0.785 0.794 0.82  0.802 0.801 0.804 0.802 0.813 0.804]
cur_param: {'lr': 0.001446034841526908, 'weight_decay': 0.0016772115024369378, 'dropout': 0.501193578233952, 'patience': 60, 'lr_reduce_freq': 130, 'spt_alg': 'kruskal', 'spt_attr': 'edge_degree', 'manifold': 'PoincareBall', 'num_layers': 3, 'num_adj': 6, 'add_rate': 0.3080531943043396, 'tem': 1.0806498150759434, 'consis_rate': 1.4954599434287044, 'use_att': 1}
mean: 0.8067
[0.794 0.809 0.809 0.811 0.816 0.815 0.799 0.8   0.808 0.806]
cur_param: {'lr': 0.0047780070542625475, 'weight_decay': 0.0009537286334303925, 'dropout': 0.5389121390714888, 'patience': 60, 'lr_reduce_freq': 150, 'spt_alg': 'kruskal', 'spt_attr': 'edge_degree', 'manifold': 'PoincareBall', 'num_layers': 3, 'num_adj': 6, 'add_rate': 0.26098842161101005, 'tem': 0.9908053808383095, 'consis_rate': 1.5580108530448804, 'use_att': 1}
mean: 0.8083000000000002
[0.811 0.809 0.798 0.817 0.817 0.806 0.806 0.809 0.799 0.811]
cur_param: {'lr': 0.0036128383255436057, 'weight_decay': 0.023323540249487098, 'dropout': 0.6947821209378843, 'patience': 60, 'lr_reduce_freq': 130, 'spt_alg': 'kruskal', 'spt_attr': 'edge_degree', 'manifold': 'PoincareBall', 'num_layers': 3, 'num_adj': 6, 'add_rate': 0.19139622951002344, 'tem': 0.8634479096550796, 'consis_rate': 1.196037720130139, 'use_att': 1}
mean: 0.23679999999999998
[0.319 0.144 0.182 0.319 0.319 0.154 0.319 0.144 0.319 0.149]
cur_param: {'lr': 0.0020499527189787353, 'weight_decay': 0.0008061958647517574, 'dropout': 0.9383019296150523, 'patience': 60, 'lr_reduce_freq': 110, 'spt_alg': 'kruskal', 'spt_attr': 'edge_degree', 'manifold': 'PoincareBall', 'num_layers': 3, 'num_adj': 6, 'add_rate': 0.15925880072333218, 'tem': 1.761116617880539, 'consis_rate': 0.9661516745142535, 'use_att': 1}
mean: 0.221
[0.319 0.191 0.147 0.241 0.317 0.149 0.32  0.187 0.209 0.13 ]
cur_param: {'lr': 0.006691225384793535, 'weight_decay': 0.001167207027395622, 'dropout': 0.4689103094434101, 'patience': 60, 'lr_reduce_freq': 150, 'spt_alg': 'kruskal', 'spt_attr': 'edge_degree', 'manifold': 'PoincareBall', 'num_layers': 3, 'num_adj': 6, 'add_rate': 0.44087298350647763, 'tem': 1.2196791486073322, 'consis_rate': 1.278889118072836, 'use_att': 1}
mean: 0.8084000000000001
[0.816 0.796 0.81  0.823 0.805 0.816 0.805 0.802 0.808 0.803]
cur_param: {'lr': 0.0017061996116129, 'weight_decay': 0.0005010683177702376, 'dropout': 0.7602478566331825, 'patience': 60, 'lr_reduce_freq': 130, 'spt_alg': 'kruskal', 'spt_attr': 'edge_degree', 'manifold': 'PoincareBall', 'num_layers': 3, 'num_adj': 6, 'add_rate': 0.4028483044765392, 'tem': 0.7182889386636391, 'consis_rate': 1.1375912102192962, 'use_att': 1}
mean: 0.8108999999999998
[0.801 0.832 0.795 0.827 0.792 0.815 0.806 0.804 0.818 0.819]
cur_param: {'lr': 0.0017108876252696613, 'weight_decay': 0.0005969778236958813, 'dropout': 0.866918173592892, 'patience': 60, 'lr_reduce_freq': 130, 'spt_alg': 'prim', 'spt_attr': 'edge_degree', 'manifold': 'PoincareBall', 'num_layers': 4, 'num_adj': 6, 'add_rate': 0.47107929913249624, 'tem': 0.9106221505456625, 'consis_rate': 1.1389846536737702, 'use_att': 1}
mean: 0.197
[0.149 0.157 0.091 0.319 0.144 0.182 0.319 0.329 0.136 0.144]
cur_param: {'lr': 0.0014308678622871255, 'weight_decay': 0.0005250559238576774, 'dropout': 0.7516917106803588, 'patience': 60, 'lr_reduce_freq': 130, 'spt_alg': 'kruskal', 'spt_attr': 'edge_degree', 'manifold': 'PoincareBall', 'num_layers': 3, 'num_adj': 6, 'add_rate': 0.37725085836092453, 'tem': 0.7144159136477004, 'consis_rate': 1.0200398294022317, 'use_att': 1}
mean: 0.8135999999999999
[0.811 0.824 0.809 0.811 0.818 0.814 0.802 0.812 0.813 0.822]
cur_param: {'lr': 0.0014434751010437956, 'weight_decay': 0.000921457919793866, 'dropout': 0.7526964027072112, 'patience': 60, 'lr_reduce_freq': 130, 'spt_alg': 'kruskal', 'spt_attr': 'edge_degree', 'manifold': 'PoincareBall', 'num_layers': 3, 'num_adj': 6, 'add_rate': 0.37137539318728796, 'tem': 0.6242844359064721, 'consis_rate': 1.0185329241904377, 'use_att': 1}
mean: 0.8061
[0.8   0.81  0.808 0.785 0.816 0.823 0.802 0.791 0.809 0.817]
cur_param: {'lr': 0.0020257011124116537, 'weight_decay': 0.0005564933348171793, 'dropout': 0.7635696121523877, 'patience': 60, 'lr_reduce_freq': 130, 'spt_alg': 'kruskal', 'spt_attr': 'edge_degree', 'manifold': 'PoincareBall', 'num_layers': 3, 'num_adj': 6, 'add_rate': 0.40675493673291624, 'tem': 0.7383164370812606, 'consis_rate': 1.094644936487382, 'use_att': 1}
mean: 0.8082
[0.802 0.829 0.806 0.813 0.815 0.809 0.791 0.803 0.814 0.8  ]
cur_param: {'lr': 0.002411790836117635, 'weight_decay': 0.0005083427152339905, 'dropout': 0.8416433277020792, 'patience': 60, 'lr_reduce_freq': 110, 'spt_alg': 'kruskal', 'spt_attr': 'edge_degree', 'manifold': 'PoincareBall', 'num_layers': 3, 'num_adj': 6, 'add_rate': 0.3339653737247895, 'tem': 0.8020645182482364, 'consis_rate': 0.929404989286645, 'use_att': 1}[32m[I 2022-06-23 02:41:28,851][0m Trial 94 finished with value: 0.7968999999999999 and parameters: {'lr': 0.002411790836117635, 'weight_decay': 0.0005083427152339905, 'dropout': 0.8416433277020792, 'patience': 60, 'lr_reduce_freq': 110, 'spt_alg': 'kruskal', 'spt_attr': 'edge_degree', 'manifold': 'PoincareBall', 'num_layers': 3, 'num_adj': 6, 'add_rate': 0.3339653737247895, 'tem': 0.8020645182482364, 'consis_rate': 0.929404989286645, 'use_att': 1}. Best is trial 91 with value: 0.8135999999999999.[0m
[32m[I 2022-06-23 03:21:31,065][0m Trial 95 finished with value: 0.7462 and parameters: {'lr': 0.0013993873124019936, 'weight_decay': 0.0007633508447792646, 'dropout': 0.8285763183822089, 'patience': 60, 'lr_reduce_freq': 110, 'spt_alg': 'kruskal', 'spt_attr': 'edge_degree', 'manifold': 'PoincareBall', 'num_layers': 3, 'num_adj': 6, 'add_rate': 0.42172964575763655, 'tem': 0.8513332874325614, 'consis_rate': 1.0799565307104688, 'use_att': 1}. Best is trial 91 with value: 0.8135999999999999.[0m
[32m[I 2022-06-23 03:57:36,685][0m Trial 96 finished with value: 0.8090999999999999 and parameters: {'lr': 0.0017015753914962136, 'weight_decay': 0.0013930054417128155, 'dropout': 0.7164201349755941, 'patience': 60, 'lr_reduce_freq': 130, 'spt_alg': 'kruskal', 'spt_attr': 'edge_degree', 'manifold': 'PoincareBall', 'num_layers': 3, 'num_adj': 6, 'add_rate': 0.3890044789172044, 'tem': 0.7793902663892793, 'consis_rate': 1.0506501121978238, 'use_att': 1}. Best is trial 91 with value: 0.8135999999999999.[0m
[32m[I 2022-06-23 04:36:35,513][0m Trial 97 finished with value: 0.8104999999999999 and parameters: {'lr': 0.002709342457899565, 'weight_decay': 0.0012252959577815801, 'dropout': 0.7790566458605792, 'patience': 80, 'lr_reduce_freq': 130, 'spt_alg': 'prim', 'spt_attr': 'edge_degree', 'manifold': 'PoincareBall', 'num_layers': 3, 'num_adj': 6, 'add_rate': 0.43677812832514484, 'tem': 0.5536776106754099, 'consis_rate': 1.0033814271600032, 'use_att': 1}. Best is trial 91 with value: 0.8135999999999999.[0m
[32m[I 2022-06-23 05:25:18,752][0m Trial 98 finished with value: 0.805 and parameters: {'lr': 0.002621943285897697, 'weight_decay': 0.001909637408230529, 'dropout': 0.7876313429025961, 'patience': 80, 'lr_reduce_freq': 130, 'spt_alg': 'kruskal', 'spt_attr': 'similarity', 'manifold': 'PoincareBall', 'num_layers': 3, 'num_adj': 6, 'add_rate': 0.4399608982159949, 'tem': 0.5760628719207097, 'consis_rate': 0.9932045204809887, 'use_att': 1}. Best is trial 91 with value: 0.8135999999999999.[0m
[32m[I 2022-06-23 06:08:22,937][0m Trial 99 finished with value: 0.8056000000000001 and parameters: {'lr': 0.0011530664363085575, 'weight_decay': 0.000627923447362472, 'dropout': 0.7701953668246294, 'patience': 60, 'lr_reduce_freq': 130, 'spt_alg': 'prim', 'spt_attr': 'edge_degree', 'manifold': 'PoincareBall', 'num_layers': 3, 'num_adj': 6, 'add_rate': 0.49712355178063916, 'tem': 1.5260645791366545, 'consis_rate': 0.8134232236656479, 'use_att': 1}. Best is trial 91 with value: 0.8135999999999999.[0m
[32m[I 2022-06-23 06:25:00,570][0m Trial 100 finished with value: 0.7702000000000001 and parameters: {'lr': 0.04363763086931418, 'weight_decay': 0.0012185734783869526, 'dropout': 0.7383712652955817, 'patience': 80, 'lr_reduce_freq': 130, 'spt_alg': 'kruskal', 'spt_attr': 'edge_degree', 'manifold': 'PoincareBall', 'num_layers': 3, 'num_adj': 6, 'add_rate': 0.3724204019314758, 'tem': 0.6420528286665889, 'consis_rate': 0.8852053038607305, 'use_att': 1}. Best is trial 91 with value: 0.8135999999999999.[0m
[32m[I 2022-06-23 07:22:04,846][0m Trial 101 finished with value: 0.8096 and parameters: {'lr': 0.0019169183953528564, 'weight_decay': 0.0010203529161894231, 'dropout': 0.8051844275853635, 'patience': 80, 'lr_reduce_freq': 130, 'spt_alg': 'prim', 'spt_attr': 'edge_degree', 'manifold': 'PoincareBall', 'num_layers': 3, 'num_adj': 6, 'add_rate': 0.9370316660957856, 'tem': 0.9422251283383574, 'consis_rate': 1.1402612438434745, 'use_att': 1}. Best is trial 91 with value: 0.8135999999999999.[0m
[32m[I 2022-06-23 08:02:21,287][0m Trial 102 finished with value: 0.8102 and parameters: {'lr': 0.002368364398669879, 'weight_decay': 0.00082009271016247, 'dropout': 0.8040548998176564, 'patience': 80, 'lr_reduce_freq': 130, 'spt_alg': 'prim', 'spt_attr': 'edge_degree', 'manifold': 'PoincareBall', 'num_layers': 3, 'num_adj': 6, 'add_rate': 0.47998400911081934, 'tem': 0.9631309233269137, 'consis_rate': 1.1721188182095608, 'use_att': 1}. Best is trial 91 with value: 0.8135999999999999.[0m
[32m[I 2022-06-23 08:57:42,347][0m Trial 103 finished with value: 0.7980000000000002 and parameters: {'lr': 0.0023841851268700917, 'weight_decay': 0.0008252817727354494, 'dropout': 0.8443562394884541, 'patience': 80, 'lr_reduce_freq': 130, 'spt_alg': 'prim', 'spt_attr': 'edge_degree', 'manifold': 'PoincareBall', 'num_layers': 3, 'num_adj': 6, 'add_rate': 0.8492089490788567, 'tem': 1.027584500655267, 'consis_rate': 1.1767700453598444, 'use_att': 1}. Best is trial 91 with value: 0.8135999999999999.[0m
[32m[I 2022-06-23 09:31:28,247][0m Trial 104 finished with value: 0.8034000000000001 and parameters: {'lr': 0.003067966606811323, 'weight_decay': 0.0005019268801409883, 'dropout': 0.8045437862538708, 'patience': 80, 'lr_reduce_freq': 130, 'spt_alg': 'prim', 'spt_attr': 'edge_degree', 'manifold': 'PoincareBall', 'num_layers': 3, 'num_adj': 6, 'add_rate': 0.4755143978651716, 'tem': 0.4322065962852111, 'consis_rate': 1.2904678971494243, 'use_att': 1}. Best is trial 91 with value: 0.8135999999999999.[0m
[32m[I 2022-06-23 10:33:21,218][0m Trial 105 finished with value: 0.5698000000000001 and parameters: {'lr': 0.0019544219501460673, 'weight_decay': 0.0014970556104690696, 'dropout': 0.9136272671913904, 'patience': 80, 'lr_reduce_freq': 150, 'spt_alg': 'prim', 'spt_attr': 'edge_degree', 'manifold': 'PoincareBall', 'num_layers': 3, 'num_adj': 6, 'add_rate': 0.9069538744038153, 'tem': 1.1152626258198333, 'consis_rate': 1.2383514381702825, 'use_att': 1}. Best is trial 91 with value: 0.8135999999999999.[0m
[32m[I 2022-06-23 11:04:38,463][0m Trial 106 finished with value: 0.8118000000000001 and parameters: {'lr': 0.002851157792719235, 'weight_decay': 0.001022241716468847, 'dropout': 0.6843314975000004, 'patience': 80, 'lr_reduce_freq': 110, 'spt_alg': 'prim', 'spt_attr': 'edge_degree', 'manifold': 'PoincareBall', 'num_layers': 3, 'num_adj': 6, 'add_rate': 0.5208823464760182, 'tem': 0.9514589593995424, 'consis_rate': 0.9597562554332271, 'use_att': 1}. Best is trial 91 with value: 0.8135999999999999.[0m
[32m[I 2022-06-23 11:35:19,176][0m Trial 107 finished with value: 0.8168 and parameters: {'lr': 0.002811620933392091, 'weight_decay': 0.0010587788750608088, 'dropout': 0.6852879023460303, 'patience': 80, 'lr_reduce_freq': 110, 'spt_alg': 'prim', 'spt_attr': 'edge_degree', 'manifold': 'PoincareBall', 'num_layers': 3, 'num_adj': 6, 'add_rate': 0.5114129634416814, 'tem': 1.056068905303546, 'consis_rate': 0.9365966425970494, 'use_att': 1}. Best is trial 107 with value: 0.8168.[0m
[32m[I 2022-06-23 12:11:21,469][0m Trial 108 finished with value: 0.8106 and parameters: {'lr': 0.0026640306656095848, 'weight_decay': 0.0017517355527871124, 'dropout': 0.6830567576214706, 'patience': 80, 'lr_reduce_freq': 110, 'spt_alg': 'prim', 'spt_attr': 'edge_degree', 'manifold': 'PoincareBall', 'num_layers': 3, 'num_adj': 6, 'add_rate': 0.5238729788732072, 'tem': 0.5445771470364059, 'consis_rate': 0.96094690293012, 'use_att': 1}. Best is trial 107 with value: 0.8168.[0m
[32m[I 2022-06-23 12:46:03,168][0m Trial 109 finished with value: 0.8084000000000001 and parameters: {'lr': 0.0027373853778866197, 'weight_decay': 0.0016862224005648103, 'dropout': 0.6856359739335554, 'patience': 80, 'lr_reduce_freq': 110, 'spt_alg': 'prim', 'spt_attr': 'edge_degree', 'manifold': 'PoincareBall', 'num_layers': 3, 'num_adj': 6, 'add_rate': 0.5384698749018356, 'tem': 0.5484442541447457, 'consis_rate': 0.849377092469505, 'use_att': 1}. Best is trial 107 with value: 0.8168.[0m
[32m[I 2022-06-23 14:10:18,180][0m Trial 110 finished with value: 0.7438 and parameters: {'lr': 0.004247929787235546, 'weight_decay': 0.0011939454416564636, 'dropout': 0.7251092324232858, 'patience': 80, 'lr_reduce_freq': 110, 'spt_alg': 'prim', 'spt_attr': 'edge_degree', 'manifold': 'PoincareBall', 'num_layers': 4, 'num_adj': 6, 'add_rate': 0.5976095392080143, 'tem': 1.0711110804611126, 'consis_rate': 0.776853377320418, 'use_att': 1}. Best is trial 107 with value: 0.8168.[0m
[32m[I 2022-06-23 14:59:11,069][0m Trial 111 finished with value: 0.8026 and parameters: {'lr': 0.002959560264832406, 'weight_decay': 0.0027251175641886095, 'dropout': 0.7683637689506708, 'patience': 80, 'lr_reduce_freq': 110, 'spt_alg': 'prim', 'spt_attr': 'edge_degree', 'manifold': 'PoincareBall', 'num_layers': 3, 'num_adj': 6, 'add_rate': 0.5221635749738203, 'tem': 0.38035600678055026, 'consis_rate': 0.95762659153616, 'use_att': 1}. Best is trial 107 with value: 0.8168.[0m
