[32m[I 2022-06-27 14:25:05,978][0m Trial 125 finished with value: 0.8214 and parameters: {'lr': 0.004236328602193875, 'weight_decay': 0.0007326218108014671, 'dropout': 0.7922311903873124, 'patience': 80, 'lr_reduce_freq': 90, 'spt_alg': 'prim', 'spt_attr': 'edge_degree', 'manifold': 'PoincareBall', 'num_layers': 3, 'dim': 336, 'num_adj': 6, 'add_rate': 0.5566989740864914, 'tem': 1.0391560339474528, 'consis_rate': 1.5612109853354392, 'use_att': 1}. Best is trial 70 with value: 0.8281999999999998.[0m

mean: 0.8132999999999999
[0.814 0.813 0.828 0.82  0.804 0.809 0.824 0.798 0.811 0.812]
cur_param: {'lr': 0.0040058518631209275, 'weight_decay': 0.0007446109387237407, 'dropout': 0.7671049054666589, 'patience': 80, 'lr_reduce_freq': 90, 'spt_alg': 'prim', 'spt_attr': 'edge_degree', 'manifold': 'PoincareBall', 'num_layers': 3, 'dim': 332, 'num_adj': 6, 'add_rate': 0.5325690845595034, 'tem': 1.0846865879531944, 'consis_rate': 1.5936857286897816, 'use_att': 1}
mean: 0.8236999999999999
[0.824 0.833 0.819 0.835 0.82  0.813 0.817 0.831 0.818 0.827]
cur_param: {'lr': 0.0037847573338941547, 'weight_decay': 0.0007423736331238157, 'dropout': 0.7652708315463914, 'patience': 80, 'lr_reduce_freq': 90, 'spt_alg': 'prim', 'spt_attr': 'edge_degree', 'manifold': 'Hyperboloid', 'num_layers': 3, 'dim': 332, 'num_adj': 6, 'add_rate': 0.5318714199530588, 'tem': 1.0563265354105422, 'consis_rate': 1.597803079381728, 'use_att': 0}
mean: 0.8042
[0.771 0.813 0.81  0.813 0.802 0.802 0.805 0.826 0.802 0.798]
cur_param: {'lr': 0.004141970836915939, 'weight_decay': 0.0007332423254850439, 'dropout': 0.7995674239735285, 'patience': 80, 'lr_reduce_freq': 90, 'spt_alg': 'prim', 'spt_attr': 'edge_degree', 'manifold': 'PoincareBall', 'num_layers': 3, 'dim': 336, 'num_adj': 6, 'add_rate': 0.5464239387864147, 'tem': 1.0848400400792682, 'consis_rate': 1.607292846141994, 'use_att': 1}
mean: 0.8222999999999999
[0.835 0.819 0.829 0.819 0.802 0.82  0.83  0.829 0.811 0.829]
cur_param: {'lr': 0.0042017805311886855, 'weight_decay': 0.0007293651655484964, 'dropout': 0.7998103380411101, 'patience': 80, 'lr_reduce_freq': 90, 'spt_alg': 'prim', 'spt_attr': 'edge_degree', 'manifold': 'PoincareBall', 'num_layers': 3, 'dim': 336, 'num_adj': 6, 'add_rate': 0.5443509586935615, 'tem': 1.064386765977708, 'consis_rate': 1.5685853302016048, 'use_att': 1}
mean: 0.8234
[0.84  0.822 0.827 0.819 0.818 0.831 0.832 0.817 0.806 0.822]
cur_param: {'lr': 0.004198116337079132, 'weight_decay': 0.0007301677050545977, 'dropout': 0.7957577403486908, 'patience': 80, 'lr_reduce_freq': 90, 'spt_alg': 'prim', 'spt_attr': 'edge_degree', 'manifold': 'PoincareBall', 'num_layers': 3, 'dim': 336, 'num_adj': 6, 'add_rate': 0.5441879656727886, 'tem': 1.0632671380938508, 'consis_rate': 1.5620803837653678, 'use_att': 1}
mean: 0.8240999999999999
[0.835 0.823 0.819 0.808 0.826 0.822 0.831 0.827 0.821 0.829]
cur_param: {'lr': 0.003943537734675201, 'weight_decay': 0.0007279535592274113, 'dropout': 0.7988391809201356, 'patience': 80, 'lr_reduce_freq': 90, 'spt_alg': 'prim', 'spt_attr': 'edge_degree', 'manifold': 'PoincareBall', 'num_layers': 3, 'dim': 336, 'num_adj': 6, 'add_rate': 0.5455805751785681, 'tem': 1.0599273010472128, 'consis_rate': 1.5682542759286702, 'use_att': 1}
mean: 0.8238
[0.834 0.815 0.82  0.821 0.827 0.826 0.834 0.819 0.816 0.826]
cur_param: {'lr': 0.0036007810047095695, 'weight_decay': 0.0007241567700606938, 'dropout': 0.7919249315545749, 'patience': 80, 'lr_reduce_freq': 90, 'spt_alg': 'prim', 'spt_attr': 'edge_degree', 'manifold': 'PoincareBall', 'num_layers': 3, 'dim': 332, 'num_adj': 6, 'add_rate': 0.5513501025389709, 'tem': 1.0295516012734645, 'consis_rate': 1.566207894077029, 'use_att': 1}
mean: 0.8215
[0.815 0.832 0.824 0.83  0.824 0.819 0.835 0.821 0.8   0.815]
cur_param: {'lr': 0.003913783916287036, 'weight_decay': 0.0007127000223790031, 'dropout': 0.7804782725967001, 'patience': 80, 'lr_reduce_freq': 90, 'spt_alg': 'prim', 'spt_attr': 'edge_degree', 'manifold': 'PoincareBall', 'num_layers': 3, 'dim': 336, 'num_adj': 6, 'add_rate': 0.5336685728456485, 'tem': 1.0607466824549674, 'consis_rate': 1.5914265123806204, 'use_att': 1}
mean: 0.8229
[0.831 0.822 0.831 0.819 0.818 0.817 0.825 0.811 0.825 0.83 ]
cur_param: {'lr': 0.004295164286688442, 'weight_decay': 0.0007049510899884854, 'dropout': 0.7814106542430155, 'patience': 80, 'lr_reduce_freq': 90, 'spt_alg': 'prim', 'spt_attr': 'edge_degree', 'manifold': 'PoincareBall', 'num_layers': 3, 'dim': 336, 'num_adj': 6, 'add_rate': 0.5595123330349555, 'tem': 1.0698916860279213, 'consis_rate': 1.5328425655889943, 'use_att': 1}
mean: 0.8231999999999999
[0.825 0.815 0.837 0.821 0.827 0.816 0.833 0.821 0.819 0.818]
cur_param: {'lr': 0.003472526700475991, 'weight_decay': 0.0007080169913690421, 'dropout': 0.7818551991180157, 'patience': 80, 'lr_reduce_freq': 90, 'spt_alg': 'prim', 'spt_attr': 'edge_degree', 'manifold': 'PoincareBall', 'num_layers': 3, 'dim': 332, 'num_adj': 6, 'add_rate': 0.5638507645936068, 'tem': 1.063059913598248, 'consis_rate': 1.52497416812186, 'use_att': 1}
mean: 0.8209
[0.831 0.817 0.817 0.826 0.831 0.828 0.82  0.823 0.807 0.809]
cur_param: {'lr': 0.004286269618362045, 'weight_decay': 0.0007253187361234593, 'dropout': 0.7796940619782472, 'patience': 80, 'lr_reduce_freq': 90, 'spt_alg': 'prim', 'spt_attr': 'edge_degree', 'manifold': 'PoincareBall', 'num_layers': 3, 'dim': 336, 'num_adj': 6, 'add_rate': 0.5574997496712781, 'tem': 1.04986400858842, 'consis_rate': 1.5738023420795124, 'use_att': 1}
mean: 0.8212999999999999
[0.833 0.826 0.822 0.819 0.818 0.813 0.831 0.809 0.822 0.82 ]
cur_param: {'lr': 0.0037502965847669087, 'weight_decay': 0.0007635877115172928, 'dropout': 0.7949695873039927, 'patience': 80, 'lr_reduce_freq': 90, 'spt_alg': 'prim', 'spt_attr': 'edge_degree', 'manifold': 'PoincareBall', 'num_layers': 3, 'dim': 332, 'num_adj': 6, 'add_rate': 0.5448853420689937, 'tem': 1.0159740760594314, 'consis_rate': 1.57920242439329, 'use_att': 1}
mean: 0.8196999999999999
[0.809 0.831 0.819 0.813 0.823 0.831 0.829 0.817 0.808 0.817]
cur_param: {'lr': 0.003929672609163554, 'weight_decay': 0.0006970252985824736, 'dropout': 0.7705069254878776, 'patience': 80, 'lr_reduce_freq': 90, 'spt_alg': 'prim', 'spt_attr': 'edge_degree', 'manifold': 'PoincareBall', 'num_layers': 3, 'dim': 336, 'num_adj': 6, 'add_rate': 0.5381656352792317, 'tem': 1.0397335593719985, 'consis_rate': 1.532446836404076, 'use_att': 1}
mean: 0.8219
[0.833 0.829 0.823 0.8   0.823 0.833 0.82  0.811 0.818 0.829]
cur_param: {'lr': 0.004486617884475087, 'weight_decay': 0.0006833988956974327, 'dropout': 0.7670696564449323, 'patience': 80, 'lr_reduce_freq': 90, 'spt_alg': 'prim', 'spt_attr': 'edge_degree', 'manifold': 'PoincareBall', 'num_layers': 3, 'dim': 336, 'num_adj': 6, 'add_rate': 0.5279319563657296, 'tem': 1.0520495008189577, 'consis_rate': 1.5889684516458205, 'use_att': 1}
mean: 0.8202999999999999
[0.812 0.832 0.816 0.808 0.819 0.823 0.825 0.808 0.826 0.834]
cur_param: {'lr': 0.004082382875580824, 'weight_decay': 0.0006467246942156871, 'dropout': 0.7834817809952416, 'patience': 80, 'lr_reduce_freq': 90, 'spt_alg': 'prim', 'spt_attr': 'edge_degree', 'manifold': 'PoincareBall', 'num_layers': 3, 'dim': 328, 'num_adj': 6, 'add_rate': 0.5356155313287825, 'tem': 1.0634752914100984, 'consis_rate': 1.6223840245562373, 'use_att': 1}
mean: 0.8193999999999999
[0.806 0.821 0.804 0.818 0.834 0.817 0.838 0.816 0.817 0.823]
cur_param: {'lr': 0.004359312667391386, 'weight_decay': 0.0007182117947532683, 'dropout': 0.777663651398981, 'patience': 80, 'lr_reduce_freq': 90, 'spt_alg': 'prim', 'spt_attr': 'edge_degree', 'manifold': 'PoincareBall', 'num_layers': 3, 'dim': 332, 'num_adj': 6, 'add_rate': 0.5814563163524105, 'tem': 1.0713398463067398, 'consis_rate': 1.592213114447826, 'use_att': 1}
mean: 0.8176
[0.83  0.834 0.815 0.824 0.82  0.812 0.812 0.796 0.807 0.826]
cur_param: {'lr': 0.004236328602193875, 'weight_decay': 0.0007326218108014671, 'dropout': 0.7922311903873124, 'patience': 80, 'lr_reduce_freq': 90, 'spt_alg': 'prim', 'spt_attr': 'edge_degree', 'manifold': 'PoincareBall', 'num_layers': 3, 'dim': 336, 'num_adj': 6, 'add_rate': 0.5566989740864914, 'tem': 1.0391560339474528, 'consis_rate': 1.5612109853354392, 'use_att': 1}
mean: 0.8214
[0.824 0.831 0.831 0.823 0.821 0.818 0.829 0.82  0.822 0.795]
cur_param: {'lr': 0.003802274877031827, 'weight_decay': 0.0006745752514244468, 'dropout': 0.7988385608775361, 'patience': 80, 'lr_reduce_freq': 90, 'spt_alg': 'prim', 'spt_attr': 'edge_degree', 'manifold': 'PoincareBall', 'num_layers': 3, 'dim': 336, 'num_adj': 6, 'add_rate': 0.5680443054544362, 'tem': 1.1283290634496619, 'consis_rate': 1.594731180529937, 'use_att': 1}
mean: 0.8219999999999998
[0.839 0.812 0.827 0.822 0.813 0.817 0.836 0.823 0.811 0.82 ][32m[I 2022-06-27 14:35:14,661][0m Trial 126 finished with value: 0.8219999999999998 and parameters: {'lr': 0.003802274877031827, 'weight_decay': 0.0006745752514244468, 'dropout': 0.7988385608775361, 'patience': 80, 'lr_reduce_freq': 90, 'spt_alg': 'prim', 'spt_attr': 'edge_degree', 'manifold': 'PoincareBall', 'num_layers': 3, 'dim': 336, 'num_adj': 6, 'add_rate': 0.5680443054544362, 'tem': 1.1283290634496619, 'consis_rate': 1.594731180529937, 'use_att': 1}. Best is trial 70 with value: 0.8281999999999998.[0m
[32m[I 2022-06-27 14:44:06,128][0m Trial 127 finished with value: 0.8185 and parameters: {'lr': 0.0045703941905075535, 'weight_decay': 0.0002712271260833896, 'dropout': 0.7618027514645864, 'patience': 80, 'lr_reduce_freq': 90, 'spt_alg': 'prim', 'spt_attr': 'edge_degree', 'manifold': 'PoincareBall', 'num_layers': 3, 'dim': 332, 'num_adj': 6, 'add_rate': 0.5206864318342317, 'tem': 1.09357977114279, 'consis_rate': 1.501783491333403, 'use_att': 1}. Best is trial 70 with value: 0.8281999999999998.[0m
[32m[I 2022-06-27 14:53:47,648][0m Trial 128 finished with value: 0.8221999999999998 and parameters: {'lr': 0.003971363925062181, 'weight_decay': 0.000759636111757129, 'dropout': 0.788097222760538, 'patience': 80, 'lr_reduce_freq': 90, 'spt_alg': 'prim', 'spt_attr': 'edge_degree', 'manifold': 'PoincareBall', 'num_layers': 3, 'dim': 328, 'num_adj': 6, 'add_rate': 0.5320138788922005, 'tem': 1.0672173471325355, 'consis_rate': 1.6134558933986556, 'use_att': 1}. Best is trial 70 with value: 0.8281999999999998.[0m
[32m[I 2022-06-27 15:03:44,301][0m Trial 129 finished with value: 0.8206000000000001 and parameters: {'lr': 0.0034881418855193507, 'weight_decay': 0.000711494679794936, 'dropout': 0.7730735706022427, 'patience': 80, 'lr_reduce_freq': 90, 'spt_alg': 'prim', 'spt_attr': 'edge_degree', 'manifold': 'PoincareBall', 'num_layers': 3, 'dim': 336, 'num_adj': 6, 'add_rate': 0.5483135786939459, 'tem': 1.0815939901439775, 'consis_rate': 1.57408101094459, 'use_att': 1}. Best is trial 70 with value: 0.8281999999999998.[0m
[32m[I 2022-06-27 15:14:05,713][0m Trial 130 finished with value: 0.8194999999999999 and parameters: {'lr': 0.004413168860258786, 'weight_decay': 0.000788549869240009, 'dropout': 0.7833413729096075, 'patience': 80, 'lr_reduce_freq': 90, 'spt_alg': 'prim', 'spt_attr': 'similarity', 'manifold': 'PoincareBall', 'num_layers': 3, 'dim': 332, 'num_adj': 6, 'add_rate': 0.5079420676752671, 'tem': 1.1090927391864258, 'consis_rate': 1.5335292017347242, 'use_att': 1}. Best is trial 70 with value: 0.8281999999999998.[0m
[32m[I 2022-06-27 15:23:28,926][0m Trial 131 finished with value: 0.8208 and parameters: {'lr': 0.004070642643857587, 'weight_decay': 0.0007487029639963988, 'dropout': 0.7879668682161944, 'patience': 80, 'lr_reduce_freq': 90, 'spt_alg': 'prim', 'spt_attr': 'edge_degree', 'manifold': 'PoincareBall', 'num_layers': 3, 'dim': 320, 'num_adj': 6, 'add_rate': 0.5145044544488137, 'tem': 1.1002473111252902, 'consis_rate': 1.5548741701975062, 'use_att': 1}. Best is trial 70 with value: 0.8281999999999998.[0m
[32m[I 2022-06-27 15:33:14,880][0m Trial 132 finished with value: 0.8205 and parameters: {'lr': 0.0039504464517784, 'weight_decay': 0.0007419411179030974, 'dropout': 0.7896188426207997, 'patience': 80, 'lr_reduce_freq': 90, 'spt_alg': 'prim', 'spt_attr': 'edge_degree', 'manifold': 'PoincareBall', 'num_layers': 3, 'dim': 328, 'num_adj': 6, 'add_rate': 0.5412135285816939, 'tem': 1.1197730549168796, 'consis_rate': 1.6248631397375028, 'use_att': 1}. Best is trial 70 with value: 0.8281999999999998.[0m
[32m[I 2022-06-27 15:43:00,870][0m Trial 133 finished with value: 0.818 and parameters: {'lr': 0.003123270615177739, 'weight_decay': 0.0007678226261043819, 'dropout': 0.7687333303470535, 'patience': 80, 'lr_reduce_freq': 90, 'spt_alg': 'prim', 'spt_attr': 'edge_degree', 'manifold': 'PoincareBall', 'num_layers': 3, 'dim': 324, 'num_adj': 6, 'add_rate': 0.5198288101898495, 'tem': 1.0896768140906077, 'consis_rate': 1.5996191076945083, 'use_att': 1}. Best is trial 70 with value: 0.8281999999999998.[0m
[32m[I 2022-06-27 15:57:38,366][0m Trial 134 finished with value: 0.8251 and parameters: {'lr': 0.003672626846878668, 'weight_decay': 0.0006962100407682388, 'dropout': 0.7772314778435403, 'patience': 80, 'lr_reduce_freq': 90, 'spt_alg': 'prim', 'spt_attr': 'edge_degree', 'manifold': 'PoincareBall', 'num_layers': 3, 'dim': 336, 'num_adj': 6, 'add_rate': 0.5138186277111931, 'tem': 1.074217095523271, 'consis_rate': 1.5667877247059996, 'use_att': 1}. Best is trial 70 with value: 0.8281999999999998.[0m
[32m[I 2022-06-27 16:14:21,310][0m Trial 135 finished with value: 0.8251 and parameters: {'lr': 0.003223384164911468, 'weight_decay': 0.0006921116894870003, 'dropout': 0.799912408079864, 'patience': 80, 'lr_reduce_freq': 90, 'spt_alg': 'prim', 'spt_attr': 'edge_degree', 'manifold': 'PoincareBall', 'num_layers': 3, 'dim': 336, 'num_adj': 6, 'add_rate': 0.5027839215654214, 'tem': 1.0444582703483116, 'consis_rate': 1.5853287335836974, 'use_att': 1}. Best is trial 70 with value: 0.8281999999999998.[0m
[32m[I 2022-06-27 16:23:15,148][0m Trial 136 finished with value: 0.8084000000000001 and parameters: {'lr': 0.0032579895222479465, 'weight_decay': 0.0006911503094740113, 'dropout': 0.7996859911719407, 'patience': 80, 'lr_reduce_freq': 90, 'spt_alg': 'prim', 'spt_attr': 'edge_degree', 'manifold': 'Hyperboloid', 'num_layers': 3, 'dim': 332, 'num_adj': 6, 'add_rate': 0.4998640728222841, 'tem': 1.0441532868563936, 'consis_rate': 1.5657328580037047, 'use_att': 0}. Best is trial 70 with value: 0.8281999999999998.[0m
[32m[I 2022-06-27 16:45:28,590][0m Trial 137 finished with value: 0.8221999999999999 and parameters: {'lr': 0.00365421828439354, 'weight_decay': 0.0007227599209427042, 'dropout': 0.7778023688968873, 'patience': 80, 'lr_reduce_freq': 90, 'spt_alg': 'prim', 'spt_attr': 'edge_degree', 'manifold': 'PoincareBall', 'num_layers': 3, 'dim': 336, 'num_adj': 6, 'add_rate': 0.5106413729064594, 'tem': 1.0173647500444307, 'consis_rate': 1.5864637767096381, 'use_att': 1}. Best is trial 70 with value: 0.8281999999999998.[0m
[32m[I 2022-06-27 17:10:45,751][0m Trial 138 finished with value: 0.8181 and parameters: {'lr': 0.0037838633079156306, 'weight_decay': 0.0007316696416617396, 'dropout': 0.7933888029209247, 'patience': 80, 'lr_reduce_freq': 90, 'spt_alg': 'prim', 'spt_attr': 'edge_degree', 'manifold': 'PoincareBall', 'num_layers': 3, 'dim': 332, 'num_adj': 6, 'add_rate': 0.5258826071827668, 'tem': 1.0715047642338267, 'consis_rate': 1.6048105980062521, 'use_att': 1}. Best is trial 70 with value: 0.8281999999999998.[0m
[32m[I 2022-06-27 17:34:16,789][0m Trial 139 finished with value: 0.8196 and parameters: {'lr': 0.004188295206263189, 'weight_decay': 0.0007096835379399292, 'dropout': 0.7808781012987449, 'patience': 80, 'lr_reduce_freq': 90, 'spt_alg': 'prim', 'spt_attr': 'edge_degree', 'manifold': 'PoincareBall', 'num_layers': 3, 'dim': 328, 'num_adj': 6, 'add_rate': 0.495020016932928, 'tem': 1.0578186333122492, 'consis_rate': 1.5762786652478893, 'use_att': 1}. Best is trial 70 with value: 0.8281999999999998.[0m
[32m[I 2022-06-27 17:55:20,673][0m Trial 140 finished with value: 0.821 and parameters: {'lr': 0.003170681997770864, 'weight_decay': 0.0007544721610196509, 'dropout': 0.7610626323483615, 'patience': 80, 'lr_reduce_freq': 90, 'spt_alg': 'prim', 'spt_attr': 'edge_degree', 'manifold': 'PoincareBall', 'num_layers': 3, 'dim': 336, 'num_adj': 6, 'add_rate': 0.534290427908463, 'tem': 1.0478957615511286, 'consis_rate': 1.5656740489352188, 'use_att': 1}. Best is trial 70 with value: 0.8281999999999998.[0m
[32m[I 2022-06-27 18:17:07,226][0m Trial 141 finished with value: 0.8221999999999999 and parameters: {'lr': 0.00280458189780685, 'weight_decay': 0.0006997845879410146, 'dropout': 0.7721316937966145, 'patience': 80, 'lr_reduce_freq': 90, 'spt_alg': 'prim', 'spt_attr': 'edge_degree', 'manifold': 'PoincareBall', 'num_layers': 3, 'dim': 336, 'num_adj': 6, 'add_rate': 0.54249862218161, 'tem': 1.159738001215826, 'consis_rate': 1.5879237411147584, 'use_att': 1}. Best is trial 70 with value: 0.8281999999999998.[0m
[32m[I 2022-06-27 18:37:13,703][0m Trial 142 finished with value: 0.8190000000000002 and parameters: {'lr': 0.0034735872865523042, 'weight_decay': 0.0007171899618091198, 'dropout': 0.7662304137433279, 'patience': 80, 'lr_reduce_freq': 90, 'spt_alg': 'prim', 'spt_attr': 'edge_degree', 'manifold': 'PoincareBall', 'num_layers': 3, 'dim': 336, 'num_adj': 6, 'add_rate': 0.5520579933346847, 'tem': 1.0648459744748848, 'consis_rate': 1.6211287505479415, 'use_att': 1}. Best is trial 70 with value: 0.8281999999999998.[0m
[32m[I 2022-06-27 18:56:25,636][0m Trial 143 finished with value: 0.8161999999999999 and parameters: {'lr': 0.004902008348279194, 'weight_decay': 0.0006738797255307548, 'dropout': 0.7837309055263221, 'patience': 80, 'lr_reduce_freq': 90, 'spt_alg': 'prim', 'spt_attr': 'edge_degree', 'manifold': 'PoincareBall', 'num_layers': 3, 'dim': 332, 'num_adj': 6, 'add_rate': 0.506085637721707, 'tem': 1.075808926399246, 'consis_rate': 1.6474314531392855, 'use_att': 1}. Best is trial 70 with value: 0.8281999999999998.[0m
