[32m[I 2022-07-01 03:09:03,309][0m Trial 26 finished with value: 0.8105999999999998 and parameters: {'lr': 0.005732210930307999, 'weight_decay': 0.0008141629868364503, 'dropout': 0.15736885067611464, 'patience': 70, 'lr_reduce_freq': 45, 'spt_alg': 'prim', 'spt_attr': 'similarity', 'manifold': 'PoincareBall', 'num_layers': 3, 'dim': 320, 'num_adj': 6, 'add_rate': 0.28083887528940366, 'tem': 0.9525354785714193, 'consis_rate': 1.6659519883210796, 'use_att': 1}. Best is trial 20 with value: 0.8122.[0m
[32m[I 2022-07-01 03:17:21,111][0m Trial 27 finished with value: 0.7936 and parameters: {'lr': 0.00834726653419685, 'weight_decay': 0.0009748305108399843, 'dropout': 0.12731242396079628, 'patience': 60, 'lr_reduce_freq': 30, 'spt_alg': 'kruskal', 'spt_attr': 'edge_degree', 'manifold': 'Hyperboloid', 'num_layers': 5, 'dim': 320, 'num_adj': 6, 'add_rate': 0.2437333576104027, 'tem': 0.9714158175287988, 'consis_rate': 1.3491490879435175, 'use_att': 0}. Best is trial 20 with value: 0.8122.[0m
[32m[I 2022-07-01 03:37:09,838][0m Trial 28 finished with value: 0.7998000000000001 and parameters: {'lr': 0.013002587788926184, 'weight_decay': 0.0014850819503515605, 'dropout': 0.21651807053810077, 'patience': 70, 'lr_reduce_freq': 45, 'spt_alg': 'prim', 'spt_attr': 'similarity', 'manifold': 'PoincareBall', 'num_layers': 4, 'dim': 448, 'num_adj': 6, 'add_rate': 0.4678831823844259, 'tem': 0.942211195088311, 'consis_rate': 1.7828181262200127, 'use_att': 1}. Best is trial 20 with value: 0.8122.[0m
[32m[I 2022-07-01 03:42:12,941][0m Trial 29 finished with value: 0.8032000000000001 and parameters: {'lr': 0.00511473342978767, 'weight_decay': 0.000724408559202445, 'dropout': 0.13266675144177503, 'patience': 70, 'lr_reduce_freq': 45, 'spt_alg': 'prim', 'spt_attr': 'similarity', 'manifold': 'Hyperboloid', 'num_layers': 3, 'dim': 352, 'num_adj': 6, 'add_rate': 0.36701395859034835, 'tem': 0.8411767769250028, 'consis_rate': 0.8471295333783763, 'use_att': 0}. Best is trial 20 with value: 0.8122.[0m
[32m[I 2022-07-01 03:59:13,796][0m Trial 30 finished with value: 0.8051999999999999 and parameters: {'lr': 0.0231821851546164, 'weight_decay': 0.0020539403232750415, 'dropout': 0.3743830489540338, 'patience': 50, 'lr_reduce_freq': 60, 'spt_alg': 'prim', 'spt_attr': 'similarity', 'manifold': 'PoincareBall', 'num_layers': 4, 'dim': 416, 'num_adj': 6, 'add_rate': 0.2584786468270315, 'tem': 1.1781031765491672, 'consis_rate': 1.7397161486250263, 'use_att': 1}. Best is trial 20 with value: 0.8122.[0m
[32m[I 2022-07-01 04:16:05,243][0m Trial 31 finished with value: 0.8089000000000001 and parameters: {'lr': 0.002168329601000827, 'weight_decay': 0.000754725001558808, 'dropout': 0.24515839949728557, 'patience': 80, 'lr_reduce_freq': 75, 'spt_alg': 'prim', 'spt_attr': 'similarity', 'manifold': 'PoincareBall', 'num_layers': 3, 'dim': 288, 'num_adj': 6, 'add_rate': 0.2939294218360943, 'tem': 1.0427466847691713, 'consis_rate': 1.6021267655281204, 'use_att': 1}. Best is trial 20 with value: 0.8122.[0m
[32m[I 2022-07-01 04:34:36,328][0m Trial 32 finished with value: 0.8017 and parameters: {'lr': 0.0008284910907881459, 'weight_decay': 0.0006425422651905716, 'dropout': 0.15364064191877108, 'patience': 80, 'lr_reduce_freq': 60, 'spt_alg': 'prim', 'spt_attr': 'similarity', 'manifold': 'PoincareBall', 'num_layers': 3, 'dim': 240, 'num_adj': 6, 'add_rate': 0.19156149617049778, 'tem': 0.8900187249021938, 'consis_rate': 1.3728837287478903, 'use_att': 1}. Best is trial 20 with value: 0.8122.[0m
[32m[I 2022-07-01 04:53:20,601][0m Trial 33 finished with value: 0.8072000000000001 and parameters: {'lr': 0.0016122388108716422, 'weight_decay': 0.0010528306884078438, 'dropout': 0.15870259851509144, 'patience': 80, 'lr_reduce_freq': 30, 'spt_alg': 'prim', 'spt_attr': 'similarity', 'manifold': 'PoincareBall', 'num_layers': 3, 'dim': 304, 'num_adj': 6, 'add_rate': 0.3555881140408135, 'tem': 1.0198072600338868, 'consis_rate': 1.5479291991596775, 'use_att': 1}. Best is trial 20 with value: 0.8122.[0m
[32m[I 2022-07-01 05:06:10,167][0m Trial 34 finished with value: 0.8038000000000001 and parameters: {'lr': 0.0034200764291031993, 'weight_decay': 0.00050573218493039, 'dropout': 0.20082568215854393, 'patience': 70, 'lr_reduce_freq': 75, 'spt_alg': 'prim', 'spt_attr': 'similarity', 'manifold': 'PoincareBall', 'num_layers': 3, 'dim': 288, 'num_adj': 6, 'add_rate': 0.2649543229932402, 'tem': 1.124167987893861, 'consis_rate': 1.9023601196128541, 'use_att': 1}. Best is trial 20 with value: 0.8122.[0m
[32m[I 2022-07-01 05:11:44,361][0m Trial 35 finished with value: 0.7997 and parameters: {'lr': 0.000783421628241458, 'weight_decay': 0.0012612804611895367, 'dropout': 0.24806446142715943, 'patience': 60, 'lr_reduce_freq': 45, 'spt_alg': 'kruskal', 'spt_attr': 'similarity', 'manifold': 'PoincareBall', 'num_layers': 3, 'dim': 240, 'num_adj': 6, 'add_rate': 0.4185352074830035, 'tem': 1.311402939009486, 'consis_rate': 1.724785215956535, 'use_att': 0}. Best is trial 20 with value: 0.8122.[0m

mean: 0.16210000000000002
[0.103 0.141 0.12  0.319 0.13  0.15  0.065 0.316 0.134 0.143]
cur_param: {'lr': 0.005145389001744661, 'weight_decay': 0.04360871462017213, 'dropout': 0.4360982900402827, 'patience': 100, 'lr_reduce_freq': 105, 'spt_alg': 'prim', 'spt_attr': 'similarity', 'manifold': 'PoincareBall', 'num_layers': 4, 'dim': 160, 'num_adj': 4, 'add_rate': 0.4782053610838528, 'tem': 0.6584148132747865, 'consis_rate': 1.9998041340141928, 'use_att': 1}
mean: 0.3133
[0.319 0.319 0.319 0.319 0.319 0.319 0.319 0.262 0.319 0.319]
cur_param: {'lr': 0.001189564988036701, 'weight_decay': 0.0009350969007144237, 'dropout': 0.20158160664489777, 'patience': 80, 'lr_reduce_freq': 75, 'spt_alg': 'prim', 'spt_attr': 'similarity', 'manifold': 'PoincareBall', 'num_layers': 3, 'dim': 256, 'num_adj': 6, 'add_rate': 0.3522231532557707, 'tem': 1.0578970430099153, 'consis_rate': 1.6538794272314257, 'use_att': 1}
mean: 0.8122
[0.812 0.814 0.811 0.797 0.819 0.813 0.815 0.813 0.815 0.813]
cur_param: {'lr': 0.001057157629799774, 'weight_decay': 0.0007532604256517994, 'dropout': 0.17348684433444023, 'patience': 80, 'lr_reduce_freq': 75, 'spt_alg': 'prim', 'spt_attr': 'similarity', 'manifold': 'PoincareBall', 'num_layers': 3, 'dim': 256, 'num_adj': 6, 'add_rate': 0.3125776779434905, 'tem': 1.079510755660069, 'consis_rate': 1.647669406895563, 'use_att': 1}
mean: 0.8097999999999999
[0.805 0.806 0.812 0.803 0.817 0.814 0.813 0.802 0.816 0.81 ]
cur_param: {'lr': 0.0011587702488426754, 'weight_decay': 0.0007841171844459467, 'dropout': 0.1743074686380909, 'patience': 80, 'lr_reduce_freq': 75, 'spt_alg': 'prim', 'spt_attr': 'similarity', 'manifold': 'PoincareBall', 'num_layers': 3, 'dim': 256, 'num_adj': 6, 'add_rate': 0.3198716103731039, 'tem': 1.0295845886391115, 'consis_rate': 1.6356017264681868, 'use_att': 1}
mean: 0.8112
[0.81  0.814 0.814 0.802 0.82  0.817 0.798 0.808 0.814 0.815]
cur_param: {'lr': 0.0012262887073486736, 'weight_decay': 0.0007518907505931912, 'dropout': 0.17855279484499617, 'patience': 70, 'lr_reduce_freq': 75, 'spt_alg': 'prim', 'spt_attr': 'similarity', 'manifold': 'PoincareBall', 'num_layers': 3, 'dim': 256, 'num_adj': 6, 'add_rate': 0.3318717489805269, 'tem': 1.0901717380990925, 'consis_rate': 1.6901437674724338, 'use_att': 1}
mean: 0.8089000000000001
[0.803 0.815 0.803 0.792 0.819 0.813 0.802 0.811 0.817 0.814]
cur_param: {'lr': 0.002354677324394687, 'weight_decay': 0.0008669891912265404, 'dropout': 0.18546261656058333, 'patience': 80, 'lr_reduce_freq': 60, 'spt_alg': 'prim', 'spt_attr': 'similarity', 'manifold': 'PoincareBall', 'num_layers': 3, 'dim': 336, 'num_adj': 6, 'add_rate': 0.32284625158400887, 'tem': 1.0611364621681996, 'consis_rate': 1.663000283200623, 'use_att': 1}
mean: 0.8097
[0.8   0.821 0.814 0.807 0.811 0.808 0.814 0.803 0.812 0.807]
cur_param: {'lr': 0.0010481109864161286, 'weight_decay': 0.0005032324428531715, 'dropout': 0.2045291211432788, 'patience': 80, 'lr_reduce_freq': 75, 'spt_alg': 'prim', 'spt_attr': 'similarity', 'manifold': 'PoincareBall', 'num_layers': 3, 'dim': 272, 'num_adj': 6, 'add_rate': 0.39103505431592556, 'tem': 1.1832867444893016, 'consis_rate': 1.9977373988858482, 'use_att': 1}
mean: 0.8055999999999999
[0.802 0.81  0.815 0.81  0.797 0.78  0.824 0.805 0.798 0.815]
cur_param: {'lr': 0.005732210930307999, 'weight_decay': 0.0008141629868364503, 'dropout': 0.15736885067611464, 'patience': 70, 'lr_reduce_freq': 45, 'spt_alg': 'prim', 'spt_attr': 'similarity', 'manifold': 'PoincareBall', 'num_layers': 3, 'dim': 320, 'num_adj': 6, 'add_rate': 0.28083887528940366, 'tem': 0.9525354785714193, 'consis_rate': 1.6659519883210796, 'use_att': 1}
mean: 0.8105999999999998
[0.785 0.808 0.824 0.823 0.809 0.818 0.82  0.802 0.813 0.804]
cur_param: {'lr': 0.00834726653419685, 'weight_decay': 0.0009748305108399843, 'dropout': 0.12731242396079628, 'patience': 60, 'lr_reduce_freq': 30, 'spt_alg': 'kruskal', 'spt_attr': 'edge_degree', 'manifold': 'Hyperboloid', 'num_layers': 5, 'dim': 320, 'num_adj': 6, 'add_rate': 0.2437333576104027, 'tem': 0.9714158175287988, 'consis_rate': 1.3491490879435175, 'use_att': 0}
mean: 0.7936
[0.804 0.79  0.81  0.796 0.79  0.797 0.783 0.802 0.772 0.792]
cur_param: {'lr': 0.013002587788926184, 'weight_decay': 0.0014850819503515605, 'dropout': 0.21651807053810077, 'patience': 70, 'lr_reduce_freq': 45, 'spt_alg': 'prim', 'spt_attr': 'similarity', 'manifold': 'PoincareBall', 'num_layers': 4, 'dim': 448, 'num_adj': 6, 'add_rate': 0.4678831823844259, 'tem': 0.942211195088311, 'consis_rate': 1.7828181262200127, 'use_att': 1}
mean: 0.7998000000000001
[0.815 0.811 0.777 0.799 0.801 0.8   0.777 0.804 0.81  0.804]
cur_param: {'lr': 0.00511473342978767, 'weight_decay': 0.000724408559202445, 'dropout': 0.13266675144177503, 'patience': 70, 'lr_reduce_freq': 45, 'spt_alg': 'prim', 'spt_attr': 'similarity', 'manifold': 'Hyperboloid', 'num_layers': 3, 'dim': 352, 'num_adj': 6, 'add_rate': 0.36701395859034835, 'tem': 0.8411767769250028, 'consis_rate': 0.8471295333783763, 'use_att': 0}
mean: 0.8032000000000001
[0.805 0.792 0.804 0.794 0.809 0.809 0.81  0.805 0.801 0.803]
cur_param: {'lr': 0.0231821851546164, 'weight_decay': 0.0020539403232750415, 'dropout': 0.3743830489540338, 'patience': 50, 'lr_reduce_freq': 60, 'spt_alg': 'prim', 'spt_attr': 'similarity', 'manifold': 'PoincareBall', 'num_layers': 4, 'dim': 416, 'num_adj': 6, 'add_rate': 0.2584786468270315, 'tem': 1.1781031765491672, 'consis_rate': 1.7397161486250263, 'use_att': 1}
mean: 0.8051999999999999
[0.811 0.785 0.802 0.804 0.813 0.806 0.812 0.795 0.808 0.816]
cur_param: {'lr': 0.002168329601000827, 'weight_decay': 0.000754725001558808, 'dropout': 0.24515839949728557, 'patience': 80, 'lr_reduce_freq': 75, 'spt_alg': 'prim', 'spt_attr': 'similarity', 'manifold': 'PoincareBall', 'num_layers': 3, 'dim': 288, 'num_adj': 6, 'add_rate': 0.2939294218360943, 'tem': 1.0427466847691713, 'consis_rate': 1.6021267655281204, 'use_att': 1}
mean: 0.8089000000000001
[0.809 0.812 0.793 0.815 0.805 0.819 0.807 0.802 0.807 0.82 ]
cur_param: {'lr': 0.0008284910907881459, 'weight_decay': 0.0006425422651905716, 'dropout': 0.15364064191877108, 'patience': 80, 'lr_reduce_freq': 60, 'spt_alg': 'prim', 'spt_attr': 'similarity', 'manifold': 'PoincareBall', 'num_layers': 3, 'dim': 240, 'num_adj': 6, 'add_rate': 0.19156149617049778, 'tem': 0.8900187249021938, 'consis_rate': 1.3728837287478903, 'use_att': 1}
mean: 0.8017
[0.801 0.804 0.805 0.79  0.803 0.803 0.804 0.793 0.8   0.814]
cur_param: {'lr': 0.0016122388108716422, 'weight_decay': 0.0010528306884078438, 'dropout': 0.15870259851509144, 'patience': 80, 'lr_reduce_freq': 30, 'spt_alg': 'prim', 'spt_attr': 'similarity', 'manifold': 'PoincareBall', 'num_layers': 3, 'dim': 304, 'num_adj': 6, 'add_rate': 0.3555881140408135, 'tem': 1.0198072600338868, 'consis_rate': 1.5479291991596775, 'use_att': 1}
mean: 0.8072000000000001
[0.808 0.802 0.805 0.803 0.799 0.796 0.816 0.812 0.817 0.814]
cur_param: {'lr': 0.0034200764291031993, 'weight_decay': 0.00050573218493039, 'dropout': 0.20082568215854393, 'patience': 70, 'lr_reduce_freq': 75, 'spt_alg': 'prim', 'spt_attr': 'similarity', 'manifold': 'PoincareBall', 'num_layers': 3, 'dim': 288, 'num_adj': 6, 'add_rate': 0.2649543229932402, 'tem': 1.124167987893861, 'consis_rate': 1.9023601196128541, 'use_att': 1}
mean: 0.8038000000000001
[0.804 0.807 0.816 0.814 0.794 0.798 0.796 0.79  0.811 0.808]
cur_param: {'lr': 0.000783421628241458, 'weight_decay': 0.0012612804611895367, 'dropout': 0.24806446142715943, 'patience': 60, 'lr_reduce_freq': 45, 'spt_alg': 'kruskal', 'spt_attr': 'similarity', 'manifold': 'PoincareBall', 'num_layers': 3, 'dim': 240, 'num_adj': 6, 'add_rate': 0.4185352074830035, 'tem': 1.311402939009486, 'consis_rate': 1.724785215956535, 'use_att': 0}
mean: 0.7997
[0.798 0.796 0.8   0.803 0.804 0.788 0.797 0.808 0.802 0.801]
cur_param: {'lr': 0.0013003072306073382, 'weight_decay': 0.0009183008654531651, 'dropout': 0.10695262021517624, 'patience': 80, 'lr_reduce_freq': 60, 'spt_alg': 'prim', 'spt_attr': 'similarity', 'manifold': 'Hyperboloid', 'num_layers': 3, 'dim': 320, 'num_adj': 6, 'add_rate': 0.5214517624283616, 'tem': 1.1462883697836028, 'consis_rate': 0.40165624853152015, 'use_att': 1}[32m[I 2022-07-01 05:41:35,480][0m Trial 36 finished with value: 0.7996000000000001 and parameters: {'lr': 0.0013003072306073382, 'weight_decay': 0.0009183008654531651, 'dropout': 0.10695262021517624, 'patience': 80, 'lr_reduce_freq': 60, 'spt_alg': 'prim', 'spt_attr': 'similarity', 'manifold': 'Hyperboloid', 'num_layers': 3, 'dim': 320, 'num_adj': 6, 'add_rate': 0.5214517624283616, 'tem': 1.1462883697836028, 'consis_rate': 0.40165624853152015, 'use_att': 1}. Best is trial 20 with value: 0.8122.[0m
[32m[I 2022-07-01 06:01:15,292][0m Trial 37 finished with value: 0.7945 and parameters: {'lr': 0.005195987597296819, 'weight_decay': 0.0006682996873498527, 'dropout': 0.15860888733970874, 'patience': 80, 'lr_reduce_freq': 90, 'spt_alg': 'kruskal', 'spt_attr': 'edge_degree', 'manifold': 'PoincareBall', 'num_layers': 5, 'dim': 400, 'num_adj': 6, 'add_rate': 0.11266243753805183, 'tem': 1.2599966876195703, 'consis_rate': 1.2326457307584555, 'use_att': 1}. Best is trial 20 with value: 0.8122.[0m
[32m[I 2022-07-01 06:19:25,568][0m Trial 38 finished with value: 0.8024000000000001 and parameters: {'lr': 0.010306557932756703, 'weight_decay': 0.0009320733029045505, 'dropout': 0.5670366285063222, 'patience': 70, 'lr_reduce_freq': 75, 'spt_alg': 'prim', 'spt_attr': 'similarity', 'manifold': 'PoincareBall', 'num_layers': 4, 'dim': 368, 'num_adj': 6, 'add_rate': 0.19809134735933054, 'tem': 0.936131792379401, 'consis_rate': 0.6371693787497079, 'use_att': 1}. Best is trial 20 with value: 0.8122.[0m
[32m[I 2022-07-01 06:23:20,149][0m Trial 39 finished with value: 0.7992999999999999 and parameters: {'lr': 0.027149157914032877, 'weight_decay': 0.0012806824115765888, 'dropout': 0.33360211135314954, 'patience': 90, 'lr_reduce_freq': 90, 'spt_alg': 'prim', 'spt_attr': 'similarity', 'manifold': 'PoincareBall', 'num_layers': 3, 'dim': 272, 'num_adj': 6, 'add_rate': 0.28701933309200717, 'tem': 1.0182305929466928, 'consis_rate': 1.5854357916738555, 'use_att': 0}. Best is trial 20 with value: 0.8122.[0m
[32m[I 2022-07-01 06:43:19,058][0m Trial 40 finished with value: 0.3956 and parameters: {'lr': 0.0018997579231295884, 'weight_decay': 0.0036371357031420052, 'dropout': 0.7611127260526727, 'patience': 60, 'lr_reduce_freq': 45, 'spt_alg': 'kruskal', 'spt_attr': 'edge_degree', 'manifold': 'Hyperboloid', 'num_layers': 3, 'dim': 176, 'num_adj': 6, 'add_rate': 0.21914134502063365, 'tem': 0.800140125712524, 'consis_rate': 1.408933298996357, 'use_att': 1}. Best is trial 20 with value: 0.8122.[0m
[32m[I 2022-07-01 06:58:36,291][0m Trial 41 finished with value: 0.8073 and parameters: {'lr': 0.002452952465643069, 'weight_decay': 0.0008064544019255726, 'dropout': 0.19451472743649634, 'patience': 80, 'lr_reduce_freq': 60, 'spt_alg': 'prim', 'spt_attr': 'similarity', 'manifold': 'PoincareBall', 'num_layers': 3, 'dim': 336, 'num_adj': 6, 'add_rate': 0.3308602549957232, 'tem': 1.067615242141448, 'consis_rate': 1.6496815228897046, 'use_att': 1}. Best is trial 20 with value: 0.8122.[0m
[32m[I 2022-07-01 07:14:24,241][0m Trial 42 finished with value: 0.8077 and parameters: {'lr': 0.002722256242948252, 'weight_decay': 0.001096174787721338, 'dropout': 0.16432084646518336, 'patience': 80, 'lr_reduce_freq': 60, 'spt_alg': 'prim', 'spt_attr': 'similarity', 'manifold': 'PoincareBall', 'num_layers': 3, 'dim': 304, 'num_adj': 6, 'add_rate': 0.37256502311445666, 'tem': 1.0749597540588796, 'consis_rate': 1.794588750203797, 'use_att': 1}. Best is trial 20 with value: 0.8122.[0m
[32m[I 2022-07-01 07:32:23,559][0m Trial 43 finished with value: 0.8071999999999999 and parameters: {'lr': 0.0010489586099590037, 'weight_decay': 0.0006242622966981105, 'dropout': 0.2616370588022343, 'patience': 80, 'lr_reduce_freq': 60, 'spt_alg': 'prim', 'spt_attr': 'similarity', 'manifold': 'PoincareBall', 'num_layers': 3, 'dim': 352, 'num_adj': 6, 'add_rate': 0.4349030746614938, 'tem': 1.2358447868153624, 'consis_rate': 1.0675005739846894, 'use_att': 1}. Best is trial 20 with value: 0.8122.[0m
[32m[I 2022-07-01 07:45:43,103][0m Trial 44 finished with value: 0.8063 and parameters: {'lr': 0.0015147039668407334, 'weight_decay': 0.0015596333114915705, 'dropout': 0.22213577477123617, 'patience': 70, 'lr_reduce_freq': 75, 'spt_alg': 'prim', 'spt_attr': 'similarity', 'manifold': 'PoincareBall', 'num_layers': 3, 'dim': 240, 'num_adj': 6, 'add_rate': 0.15270750394844587, 'tem': 0.9829831908535086, 'consis_rate': 1.9423152625052338, 'use_att': 1}. Best is trial 20 with value: 0.8122.[0m
[32m[I 2022-07-01 07:58:33,908][0m Trial 45 finished with value: 0.8096 and parameters: {'lr': 0.004234860091444928, 'weight_decay': 0.0008344465784489283, 'dropout': 0.12949194582182083, 'patience': 90, 'lr_reduce_freq': 45, 'spt_alg': 'prim', 'spt_attr': 'similarity', 'manifold': 'PoincareBall', 'num_layers': 3, 'dim': 320, 'num_adj': 6, 'add_rate': 0.3311073704089222, 'tem': 1.1325239639501121, 'consis_rate': 1.6861973389109557, 'use_att': 1}. Best is trial 20 with value: 0.8122.[0m
[32m[I 2022-07-01 08:15:24,284][0m Trial 46 finished with value: 0.30910000000000004 and parameters: {'lr': 0.0019552998342084425, 'weight_decay': 0.01647493559260726, 'dropout': 0.2747209822391289, 'patience': 70, 'lr_reduce_freq': 90, 'spt_alg': 'prim', 'spt_attr': 'similarity', 'manifold': 'PoincareBall', 'num_layers': 5, 'dim': 272, 'num_adj': 6, 'add_rate': 0.39848042055165805, 'tem': 1.0470905933779426, 'consis_rate': 1.834562172816944, 'use_att': 1}. Best is trial 20 with value: 0.8122.[0m
[32m[I 2022-07-01 08:25:36,678][0m Trial 47 finished with value: 0.8089000000000001 and parameters: {'lr': 0.0009984130918502141, 'weight_decay': 0.0022458720690833297, 'dropout': 0.173913639224799, 'patience': 90, 'lr_reduce_freq': 60, 'spt_alg': 'prim', 'spt_attr': 'similarity', 'manifold': 'PoincareBall', 'num_layers': 3, 'dim': 384, 'num_adj': 6, 'add_rate': 0.23601236315385807, 'tem': 0.8962160320187114, 'consis_rate': 1.7796291541460696, 'use_att': 1}. Best is trial 20 with value: 0.8122.[0m
[32m[I 2022-07-01 08:36:24,286][0m Trial 48 finished with value: 0.7894 and parameters: {'lr': 0.0007403301080974492, 'weight_decay': 0.005147208355947801, 'dropout': 0.3093643148880202, 'patience': 80, 'lr_reduce_freq': 75, 'spt_alg': 'prim', 'spt_attr': 'edge_degree', 'manifold': 'PoincareBall', 'num_layers': 3, 'dim': 128, 'num_adj': 2, 'add_rate': 0.2857270593693431, 'tem': 0.9414314390420231, 'consis_rate': 1.5715861106016067, 'use_att': 1}. Best is trial 20 with value: 0.8122.[0m
[32m[I 2022-07-01 08:44:37,628][0m Trial 49 finished with value: 0.8036000000000001 and parameters: {'lr': 0.003004530209809715, 'weight_decay': 0.0006088742106654632, 'dropout': 0.10592705309706611, 'patience': 80, 'lr_reduce_freq': 90, 'spt_alg': 'prim', 'spt_attr': 'similarity', 'manifold': 'PoincareBall', 'num_layers': 3, 'dim': 224, 'num_adj': 6, 'add_rate': 0.4501592657764806, 'tem': 1.01107527307726, 'consis_rate': 1.4399173822151774, 'use_att': 1}. Best is trial 20 with value: 0.8122.[0m
[32m[I 2022-07-01 08:47:48,062][0m Trial 50 finished with value: 0.7995 and parameters: {'lr': 0.0013105689923359556, 'weight_decay': 0.0011968258983417847, 'dropout': 0.22670396871972262, 'patience': 80, 'lr_reduce_freq': 45, 'spt_alg': 'prim', 'spt_attr': 'similarity', 'manifold': 'PoincareBall', 'num_layers': 3, 'dim': 304, 'num_adj': 6, 'add_rate': 0.4996832444269744, 'tem': 0.8055953742972609, 'consis_rate': 1.2741708015225504, 'use_att': 0}. Best is trial 20 with value: 0.8122.[0m
[32m[I 2022-07-01 08:55:28,503][0m Trial 51 finished with value: 0.8115 and parameters: {'lr': 0.007069089515567104, 'weight_decay': 0.0008594460881482883, 'dropout': 0.13642104187324217, 'patience': 90, 'lr_reduce_freq': 45, 'spt_alg': 'prim', 'spt_attr': 'similarity', 'manifold': 'PoincareBall', 'num_layers': 3, 'dim': 336, 'num_adj': 6, 'add_rate': 0.33098789449889676, 'tem': 1.146773523055271, 'consis_rate': 1.6646260437499951, 'use_att': 1}. Best is trial 20 with value: 0.8122.[0m
[32m[I 2022-07-01 09:03:05,732][0m Trial 52 finished with value: 0.8119999999999999 and parameters: {'lr': 0.007120540483014683, 'weight_decay': 0.0008866753459122552, 'dropout': 0.1420661800247556, 'patience': 90, 'lr_reduce_freq': 30, 'spt_alg': 'prim', 'spt_attr': 'similarity', 'manifold': 'PoincareBall', 'num_layers': 3, 'dim': 336, 'num_adj': 6, 'add_rate': 0.31008712872092814, 'tem': 1.1516169408651473, 'consis_rate': 1.6306299023471786, 'use_att': 1}. Best is trial 20 with value: 0.8122.[0m
