[32m[I 2022-06-22 23:46:33,217][0m Trial 74 finished with value: 0.8126 and parameters: {'lr': 0.0012841970242946819, 'weight_decay': 0.0005979089511859547, 'dropout': 0.8300014792933997, 'patience': 100, 'lr_reduce_freq': 130, 'spt_alg': 'kruskal', 'spt_attr': 'edge_degree', 'manifold': 'PoincareBall', 'num_layers': 3, 'num_adj': 8, 'add_rate': 0.5659990224929098, 'tem': 1.7181202960967916, 'consis_rate': 1.4281235962698684, 'use_att': 1}. Best is trial 73 with value: 0.8196.[0m

mean: 0.8046000000000001
[0.801 0.798 0.797 0.816 0.818 0.802 0.815 0.791 0.793 0.815]
cur_param: {'lr': 0.001971567175726452, 'weight_decay': 0.0008051586985605673, 'dropout': 0.5037563551019331, 'patience': 100, 'lr_reduce_freq': 90, 'spt_alg': 'kruskal', 'spt_attr': 'edge_degree', 'manifold': 'PoincareBall', 'num_layers': 3, 'num_adj': 8, 'add_rate': 0.3547059990406723, 'tem': 1.9356142424886311, 'consis_rate': 1.6432443164516202, 'use_att': 1}
mean: 0.8110999999999999
[0.819 0.809 0.796 0.813 0.807 0.806 0.82  0.806 0.826 0.809]
cur_param: {'lr': 0.0028306198048054683, 'weight_decay': 0.001283473989523531, 'dropout': 0.5069328182237003, 'patience': 100, 'lr_reduce_freq': 110, 'spt_alg': 'kruskal', 'spt_attr': 'edge_degree', 'manifold': 'PoincareBall', 'num_layers': 3, 'num_adj': 8, 'add_rate': 0.35418924490149317, 'tem': 1.924012325860149, 'consis_rate': 1.70151056335847, 'use_att': 1}
mean: 0.8130000000000001
[0.814 0.803 0.823 0.81  0.817 0.808 0.83  0.798 0.823 0.804]
cur_param: {'lr': 0.002564827097346242, 'weight_decay': 0.00083170915595985, 'dropout': 0.5147471586444144, 'patience': 100, 'lr_reduce_freq': 110, 'spt_alg': 'kruskal', 'spt_attr': 'edge_degree', 'manifold': 'PoincareBall', 'num_layers': 3, 'num_adj': 8, 'add_rate': 0.3417461696783885, 'tem': 1.9280627431036215, 'consis_rate': 1.8149583870523895, 'use_att': 1}
mean: 0.8108000000000001
[0.8   0.807 0.809 0.812 0.808 0.821 0.827 0.79  0.82  0.814]
cur_param: {'lr': 0.0028079780080680844, 'weight_decay': 0.0008941598682288677, 'dropout': 0.5016079396477946, 'patience': 100, 'lr_reduce_freq': 110, 'spt_alg': 'prim', 'spt_attr': 'edge_degree', 'manifold': 'PoincareBall', 'num_layers': 4, 'num_adj': 8, 'add_rate': 0.34279320412648656, 'tem': 1.9174374867707902, 'consis_rate': 1.796629491934669, 'use_att': 1}
mean: 0.7889
[0.787 0.765 0.808 0.787 0.811 0.791 0.778 0.785 0.801 0.776]
cur_param: {'lr': 0.0025872868311712515, 'weight_decay': 0.001247555208597941, 'dropout': 0.44939472352727383, 'patience': 100, 'lr_reduce_freq': 110, 'spt_alg': 'kruskal', 'spt_attr': 'edge_degree', 'manifold': 'PoincareBall', 'num_layers': 3, 'num_adj': 8, 'add_rate': 0.4330345793020589, 'tem': 1.9486035121730232, 'consis_rate': 1.9900862932224215, 'use_att': 1}
mean: 0.8097999999999999
[0.807 0.815 0.82  0.809 0.813 0.816 0.812 0.79  0.806 0.81 ]
cur_param: {'lr': 0.003443359411564813, 'weight_decay': 0.0012277603188626408, 'dropout': 0.4284480250475252, 'patience': 100, 'lr_reduce_freq': 130, 'spt_alg': 'kruskal', 'spt_attr': 'edge_degree', 'manifold': 'PoincareBall', 'num_layers': 3, 'num_adj': 8, 'add_rate': 0.35953159399164986, 'tem': 1.9369224094554263, 'consis_rate': 1.9952985813651243, 'use_att': 1}
mean: 0.8154999999999999
[0.815 0.821 0.816 0.817 0.82  0.814 0.825 0.807 0.816 0.804]
cur_param: {'lr': 0.003520169804286634, 'weight_decay': 0.021822148339289322, 'dropout': 0.40707563814228637, 'patience': 100, 'lr_reduce_freq': 130, 'spt_alg': 'kruskal', 'spt_attr': 'edge_degree', 'manifold': 'PoincareBall', 'num_layers': 3, 'num_adj': 8, 'add_rate': 0.3632222238341369, 'tem': 1.7912468464768556, 'consis_rate': 1.6025532632610973, 'use_att': 1}
mean: 0.3283
[0.319 0.319 0.324 0.319 0.322 0.319 0.319 0.381 0.321 0.34 ]
cur_param: {'lr': 0.0018748229607000917, 'weight_decay': 0.0008554157959672346, 'dropout': 0.5100933563645809, 'patience': 100, 'lr_reduce_freq': 130, 'spt_alg': 'kruskal', 'spt_attr': 'edge_degree', 'manifold': 'PoincareBall', 'num_layers': 3, 'num_adj': 8, 'add_rate': 0.2741646042236817, 'tem': 1.9261386299555996, 'consis_rate': 1.8474232687066443, 'use_att': 1}
mean: 0.8078000000000001
[0.826 0.81  0.787 0.81  0.814 0.815 0.809 0.8   0.812 0.795]
cur_param: {'lr': 0.003211600059594868, 'weight_decay': 0.0011920239733044955, 'dropout': 0.6540404390886092, 'patience': 100, 'lr_reduce_freq': 110, 'spt_alg': 'kruskal', 'spt_attr': 'edge_degree', 'manifold': 'PoincareBall', 'num_layers': 3, 'num_adj': 8, 'add_rate': 0.3101524352242765, 'tem': 1.9984351265265285, 'consis_rate': 1.7346831514556666, 'use_att': 1}
mean: 0.8101
[0.794 0.803 0.811 0.817 0.799 0.826 0.812 0.818 0.798 0.823]
cur_param: {'lr': 0.0010286524520118296, 'weight_decay': 0.0005451136382287776, 'dropout': 0.636651503419458, 'patience': 100, 'lr_reduce_freq': 110, 'spt_alg': 'kruskal', 'spt_attr': 'edge_degree', 'manifold': 'PoincareBall', 'num_layers': 3, 'num_adj': 8, 'add_rate': 0.3113507986469051, 'tem': 1.829663552589079, 'consis_rate': 1.7034636170652886, 'use_att': 1}
mean: 0.8077
[0.804 0.807 0.815 0.81  0.802 0.81  0.817 0.8   0.809 0.803]
cur_param: {'lr': 0.0032534615532520197, 'weight_decay': 0.0011927997696869806, 'dropout': 0.7086433493707192, 'patience': 100, 'lr_reduce_freq': 110, 'spt_alg': 'kruskal', 'spt_attr': 'edge_degree', 'manifold': 'PoincareBall', 'num_layers': 3, 'num_adj': 8, 'add_rate': 0.389041747306814, 'tem': 1.9727061684612763, 'consis_rate': 1.905763264497347, 'use_att': 1}
mean: 0.8174999999999999
[0.822 0.808 0.824 0.824 0.812 0.818 0.822 0.818 0.818 0.809]
cur_param: {'lr': 0.003785451958520078, 'weight_decay': 0.0018967390447296685, 'dropout': 0.7438044449857291, 'patience': 100, 'lr_reduce_freq': 150, 'spt_alg': 'kruskal', 'spt_attr': 'edge_degree', 'manifold': 'PoincareBall', 'num_layers': 3, 'num_adj': 8, 'add_rate': 0.45878724166099627, 'tem': 1.8915808408152022, 'consis_rate': 1.9056967262151927, 'use_att': 0}
mean: 0.8031
[0.79  0.802 0.799 0.831 0.802 0.782 0.82  0.822 0.789 0.794]
cur_param: {'lr': 0.0012943192871648843, 'weight_decay': 0.0012932282479768509, 'dropout': 0.587603294236149, 'patience': 100, 'lr_reduce_freq': 110, 'spt_alg': 'kruskal', 'spt_attr': 'edge_degree', 'manifold': 'PoincareBall', 'num_layers': 3, 'num_adj': 8, 'add_rate': 0.49049864897036366, 'tem': 1.731077236617178, 'consis_rate': 1.5580854088076597, 'use_att': 1}
mean: 0.8135
[0.816 0.815 0.819 0.819 0.817 0.818 0.815 0.797 0.811 0.808]
cur_param: {'lr': 0.0014088070606466136, 'weight_decay': 0.000769848409672924, 'dropout': 0.6993597247493581, 'patience': 100, 'lr_reduce_freq': 110, 'spt_alg': 'kruskal', 'spt_attr': 'edge_degree', 'manifold': 'PoincareBall', 'num_layers': 3, 'num_adj': 8, 'add_rate': 0.48641289050893777, 'tem': 1.812280269442826, 'consis_rate': 1.5532168610807482, 'use_att': 1}
mean: 0.8112
[0.82  0.813 0.798 0.818 0.812 0.821 0.8   0.8   0.819 0.811]
cur_param: {'lr': 0.0013791803113789483, 'weight_decay': 0.0007654178801603685, 'dropout': 0.7096076451888563, 'patience': 100, 'lr_reduce_freq': 110, 'spt_alg': 'kruskal', 'spt_attr': 'edge_degree', 'manifold': 'PoincareBall', 'num_layers': 3, 'num_adj': 8, 'add_rate': 0.5131757045317479, 'tem': 1.8120748669401507, 'consis_rate': 1.5487455268740709, 'use_att': 1}
mean: 0.8179000000000001
[0.83  0.809 0.823 0.827 0.807 0.822 0.828 0.802 0.825 0.806]
cur_param: {'lr': 0.0012900664029236169, 'weight_decay': 0.0006019614424865227, 'dropout': 0.7023276639626513, 'patience': 100, 'lr_reduce_freq': 110, 'spt_alg': 'kruskal', 'spt_attr': 'edge_degree', 'manifold': 'PoincareBall', 'num_layers': 3, 'num_adj': 8, 'add_rate': 0.5106514661148389, 'tem': 1.811687932916696, 'consis_rate': 1.51716545634337, 'use_att': 1}
mean: 0.8170999999999999
[0.825 0.815 0.821 0.828 0.811 0.815 0.824 0.805 0.815 0.812]
cur_param: {'lr': 0.0012758469250208986, 'weight_decay': 0.0006251821282509948, 'dropout': 0.715386692216834, 'patience': 100, 'lr_reduce_freq': 110, 'spt_alg': 'kruskal', 'spt_attr': 'edge_degree', 'manifold': 'PoincareBall', 'num_layers': 3, 'num_adj': 8, 'add_rate': 0.4953143481838856, 'tem': 1.811854627137149, 'consis_rate': 1.5210434113452582, 'use_att': 1}
mean: 0.8196
[0.83  0.811 0.82  0.835 0.805 0.818 0.825 0.809 0.823 0.82 ]
cur_param: {'lr': 0.0012841970242946819, 'weight_decay': 0.0005979089511859547, 'dropout': 0.8300014792933997, 'patience': 100, 'lr_reduce_freq': 130, 'spt_alg': 'kruskal', 'spt_attr': 'edge_degree', 'manifold': 'PoincareBall', 'num_layers': 3, 'num_adj': 8, 'add_rate': 0.5659990224929098, 'tem': 1.7181202960967916, 'consis_rate': 1.4281235962698684, 'use_att': 1}
mean: 0.8126
[0.787 0.822 0.817 0.813 0.819 0.817 0.794 0.83  0.822 0.805]
cur_param: {'lr': 0.0016353352207319617, 'weight_decay': 0.05244048452965723, 'dropout': 0.7278485898945444, 'patience': 100, 'lr_reduce_freq': 110, 'spt_alg': 'kruskal', 'spt_attr': 'edge_degree', 'manifold': 'PoincareBall', 'num_layers': 3, 'num_adj': 8, 'add_rate': 0.505514837213209, 'tem': 1.8572714866100373, 'consis_rate': 1.5107487545627734, 'use_att': 1}[32m[I 2022-06-23 00:19:39,470][0m Trial 75 finished with value: 0.2735 and parameters: {'lr': 0.0016353352207319617, 'weight_decay': 0.05244048452965723, 'dropout': 0.7278485898945444, 'patience': 100, 'lr_reduce_freq': 110, 'spt_alg': 'kruskal', 'spt_attr': 'edge_degree', 'manifold': 'PoincareBall', 'num_layers': 3, 'num_adj': 8, 'add_rate': 0.505514837213209, 'tem': 1.8572714866100373, 'consis_rate': 1.5107487545627734, 'use_att': 1}. Best is trial 73 with value: 0.8196.[0m
[32m[I 2022-06-23 01:58:24,234][0m Trial 76 finished with value: 0.8091000000000002 and parameters: {'lr': 0.0012381483967700048, 'weight_decay': 0.001075856307118221, 'dropout': 0.8562527324020782, 'patience': 100, 'lr_reduce_freq': 110, 'spt_alg': 'kruskal', 'spt_attr': 'edge_degree', 'manifold': 'PoincareBall', 'num_layers': 3, 'num_adj': 8, 'add_rate': 0.6070765938857137, 'tem': 1.8075646047931138, 'consis_rate': 1.356350725760801, 'use_att': 1}. Best is trial 73 with value: 0.8196.[0m
[32m[I 2022-06-23 03:44:38,129][0m Trial 77 finished with value: 0.7478999999999999 and parameters: {'lr': 0.0014973081272592582, 'weight_decay': 0.0005909485009498059, 'dropout': 0.7571435427866131, 'patience': 100, 'lr_reduce_freq': 130, 'spt_alg': 'kruskal', 'spt_attr': 'edge_degree', 'manifold': 'PoincareBall', 'num_layers': 4, 'num_adj': 8, 'add_rate': 0.550372378056021, 'tem': 1.6131854754387644, 'consis_rate': 1.4448646342097717, 'use_att': 1}. Best is trial 73 with value: 0.8196.[0m
[32m[I 2022-06-23 04:31:44,176][0m Trial 78 finished with value: 0.8105 and parameters: {'lr': 0.001819802068194661, 'weight_decay': 0.001343847987804818, 'dropout': 0.5955901792753423, 'patience': 100, 'lr_reduce_freq': 110, 'spt_alg': 'prim', 'spt_attr': 'edge_degree', 'manifold': 'PoincareBall', 'num_layers': 3, 'num_adj': 8, 'add_rate': 0.6860557550624157, 'tem': 1.8831780946118473, 'consis_rate': 1.5395148789665216, 'use_att': 1}. Best is trial 73 with value: 0.8196.[0m
[32m[I 2022-06-23 04:39:59,361][0m Trial 79 finished with value: 0.8049 and parameters: {'lr': 0.0011804110736936403, 'weight_decay': 0.0005144397874195108, 'dropout': 0.6865643694139653, 'patience': 100, 'lr_reduce_freq': 110, 'spt_alg': 'kruskal', 'spt_attr': 'edge_degree', 'manifold': 'PoincareBall', 'num_layers': 3, 'num_adj': 6, 'add_rate': 0.4970876241358475, 'tem': 1.9780355625469817, 'consis_rate': 1.6144946402901392, 'use_att': 0}. Best is trial 73 with value: 0.8196.[0m
[32m[I 2022-06-23 05:19:36,457][0m Trial 80 finished with value: 0.8119999999999999 and parameters: {'lr': 0.00312156627731383, 'weight_decay': 0.0018532453624407609, 'dropout': 0.7695469047515687, 'patience': 100, 'lr_reduce_freq': 130, 'spt_alg': 'kruskal', 'spt_attr': 'edge_degree', 'manifold': 'PoincareBall', 'num_layers': 3, 'num_adj': 8, 'add_rate': 0.3991713775313048, 'tem': 1.783792100988132, 'consis_rate': 1.6803499422558277, 'use_att': 1}. Best is trial 73 with value: 0.8196.[0m
[32m[I 2022-06-23 06:15:56,972][0m Trial 81 finished with value: 0.8179000000000001 and parameters: {'lr': 0.0012830130469952392, 'weight_decay': 0.0006715963903194444, 'dropout': 0.7956546589136466, 'patience': 100, 'lr_reduce_freq': 130, 'spt_alg': 'kruskal', 'spt_attr': 'edge_degree', 'manifold': 'PoincareBall', 'num_layers': 3, 'num_adj': 8, 'add_rate': 0.565925838889864, 'tem': 1.7260608427724087, 'consis_rate': 1.4157988337314116, 'use_att': 1}. Best is trial 73 with value: 0.8196.[0m
[32m[I 2022-06-23 07:00:32,100][0m Trial 82 finished with value: 0.8147 and parameters: {'lr': 0.0014239987879409272, 'weight_decay': 0.0007348073210762062, 'dropout': 0.7145339412342642, 'patience': 100, 'lr_reduce_freq': 130, 'spt_alg': 'kruskal', 'spt_attr': 'edge_degree', 'manifold': 'PoincareBall', 'num_layers': 3, 'num_adj': 8, 'add_rate': 0.4509917378654599, 'tem': 1.7165184320364033, 'consis_rate': 1.3683885841868553, 'use_att': 1}. Best is trial 73 with value: 0.8196.[0m
[32m[I 2022-06-23 07:45:46,624][0m Trial 83 finished with value: 0.8176 and parameters: {'lr': 0.001391666307093202, 'weight_decay': 0.0007140115757330874, 'dropout': 0.7132115113815115, 'patience': 100, 'lr_reduce_freq': 150, 'spt_alg': 'kruskal', 'spt_attr': 'edge_degree', 'manifold': 'PoincareBall', 'num_layers': 3, 'num_adj': 8, 'add_rate': 0.4562370352319146, 'tem': 1.7267624082034678, 'consis_rate': 1.375521540233402, 'use_att': 1}. Best is trial 73 with value: 0.8196.[0m
[32m[I 2022-06-23 08:31:47,002][0m Trial 84 finished with value: 0.8186 and parameters: {'lr': 0.001706264316777631, 'weight_decay': 0.0007454967185226777, 'dropout': 0.806637936441413, 'patience': 100, 'lr_reduce_freq': 150, 'spt_alg': 'kruskal', 'spt_attr': 'edge_degree', 'manifold': 'PoincareBall', 'num_layers': 3, 'num_adj': 8, 'add_rate': 0.451323065757716, 'tem': 1.7082008897729126, 'consis_rate': 1.37211632577039, 'use_att': 1}. Best is trial 73 with value: 0.8196.[0m
[32m[I 2022-06-23 09:17:01,957][0m Trial 85 finished with value: 0.8183 and parameters: {'lr': 0.0016933359888737728, 'weight_decay': 0.0006914931266477695, 'dropout': 0.804785246347421, 'patience': 100, 'lr_reduce_freq': 150, 'spt_alg': 'kruskal', 'spt_attr': 'edge_degree', 'manifold': 'PoincareBall', 'num_layers': 3, 'num_adj': 8, 'add_rate': 0.4520566072274188, 'tem': 1.6444611815718824, 'consis_rate': 1.3453781369229667, 'use_att': 1}. Best is trial 73 with value: 0.8196.[0m
[32m[I 2022-06-23 10:09:02,038][0m Trial 86 finished with value: 0.8200999999999998 and parameters: {'lr': 0.0017109755907234701, 'weight_decay': 0.000672250795219083, 'dropout': 0.8079017327948128, 'patience': 100, 'lr_reduce_freq': 150, 'spt_alg': 'kruskal', 'spt_attr': 'edge_degree', 'manifold': 'PoincareBall', 'num_layers': 3, 'num_adj': 8, 'add_rate': 0.6387664500298785, 'tem': 1.6385946645277958, 'consis_rate': 1.3927676626662286, 'use_att': 1}. Best is trial 86 with value: 0.8200999999999998.[0m
[32m[I 2022-06-23 10:49:45,043][0m Trial 87 finished with value: 0.25210000000000005 and parameters: {'lr': 0.0011562132340546428, 'weight_decay': 0.0006602220484411743, 'dropout': 0.9341905553536204, 'patience': 100, 'lr_reduce_freq': 150, 'spt_alg': 'kruskal', 'spt_attr': 'edge_degree', 'manifold': 'PoincareBall', 'num_layers': 3, 'num_adj': 8, 'add_rate': 0.6475972912240648, 'tem': 1.616195439872799, 'consis_rate': 1.266138230092508, 'use_att': 1}. Best is trial 86 with value: 0.8200999999999998.[0m
[32m[I 2022-06-23 11:34:32,776][0m Trial 88 finished with value: 0.8159000000000001 and parameters: {'lr': 0.0017151975614578994, 'weight_decay': 0.0005006947040554228, 'dropout': 0.803246555848817, 'patience': 100, 'lr_reduce_freq': 150, 'spt_alg': 'kruskal', 'spt_attr': 'edge_degree', 'manifold': 'PoincareBall', 'num_layers': 3, 'num_adj': 8, 'add_rate': 0.509815015565922, 'tem': 1.6396169114864994, 'consis_rate': 1.3908359715320633, 'use_att': 1}. Best is trial 86 with value: 0.8200999999999998.[0m
[32m[I 2022-06-23 12:18:51,340][0m Trial 89 finished with value: 0.1359 and parameters: {'lr': 0.0014189423933901738, 'weight_decay': 0.0006909984305124808, 'dropout': 0.884278072447294, 'patience': 100, 'lr_reduce_freq': 150, 'spt_alg': 'kruskal', 'spt_attr': 'edge_degree', 'manifold': 'PoincareBall', 'num_layers': 4, 'num_adj': 8, 'add_rate': 0.5522304880134563, 'tem': 1.5602444802376523, 'consis_rate': 1.3106843441949338, 'use_att': 1}. Best is trial 86 with value: 0.8200999999999998.[0m
[32m[I 2022-06-23 13:08:58,269][0m Trial 90 finished with value: 0.8192999999999999 and parameters: {'lr': 0.0017799165799297892, 'weight_decay': 0.000986475854216286, 'dropout': 0.789106429239953, 'patience': 100, 'lr_reduce_freq': 150, 'spt_alg': 'prim', 'spt_attr': 'edge_degree', 'manifold': 'PoincareBall', 'num_layers': 3, 'num_adj': 8, 'add_rate': 0.6059731538612713, 'tem': 1.6872142817785636, 'consis_rate': 1.483979325833426, 'use_att': 1}. Best is trial 86 with value: 0.8200999999999998.[0m
[32m[I 2022-06-23 14:01:31,070][0m Trial 91 finished with value: 0.8195 and parameters: {'lr': 0.001712712396169526, 'weight_decay': 0.0009723182407685756, 'dropout': 0.8002784591102567, 'patience': 100, 'lr_reduce_freq': 150, 'spt_alg': 'prim', 'spt_attr': 'edge_degree', 'manifold': 'PoincareBall', 'num_layers': 3, 'num_adj': 8, 'add_rate': 0.6346257900507459, 'tem': 1.6894631710056607, 'consis_rate': 1.4614227284237475, 'use_att': 1}. Best is trial 86 with value: 0.8200999999999998.[0m
[32m[I 2022-06-23 14:54:30,683][0m Trial 92 finished with value: 0.8180999999999999 and parameters: {'lr': 0.001722483260938788, 'weight_decay': 0.0009983670746523386, 'dropout': 0.7904420230770904, 'patience': 100, 'lr_reduce_freq': 150, 'spt_alg': 'prim', 'spt_attr': 'edge_degree', 'manifold': 'PoincareBall', 'num_layers': 3, 'num_adj': 8, 'add_rate': 0.6547773395650016, 'tem': 1.574532123594747, 'consis_rate': 1.451649981024465, 'use_att': 1}. Best is trial 86 with value: 0.8200999999999998.[0m
