[32m[I 2022-06-29 15:13:36,853][0m Trial 52 finished with value: 0.7967000000000001 and parameters: {'lr': 0.053953178515175684, 'weight_decay': 0.0012754690743467963, 'dropout': 0.6360349538034352, 'patience': 70, 'lr_reduce_freq': 70, 'spt_alg': 'kruskal', 'spt_attr': 'edge_degree', 'manifold': 'Hyperboloid', 'num_layers': 3, 'dim': 464, 'num_adj': 6, 'add_rate': 0.4884564106182862, 'tem': 0.9411194650400436, 'consis_rate': 1.2955273750353382, 'use_att': 0}. Best is trial 25 with value: 0.8081000000000002.[0m
[32m[I 2022-06-29 15:20:33,650][0m Trial 53 finished with value: 0.7987 and parameters: {'lr': 0.03572929651043747, 'weight_decay': 0.0006656873820450729, 'dropout': 0.6504790445032541, 'patience': 80, 'lr_reduce_freq': 90, 'spt_alg': 'kruskal', 'spt_attr': 'edge_degree', 'manifold': 'Hyperboloid', 'num_layers': 3, 'dim': 480, 'num_adj': 6, 'add_rate': 0.41317359029466494, 'tem': 0.9824817307039732, 'consis_rate': 1.0375789084013671, 'use_att': 0}. Best is trial 25 with value: 0.8081000000000002.[0m

mean: 0.8025
[0.806 0.811 0.794 0.79  0.811 0.8   0.798 0.804 0.816 0.795]
cur_param: {'lr': 0.05717797537827988, 'weight_decay': 0.0019576136798857714, 'dropout': 0.6653942885916824, 'patience': 90, 'lr_reduce_freq': 120, 'spt_alg': 'kruskal', 'spt_attr': 'edge_degree', 'manifold': 'Hyperboloid', 'num_layers': 3, 'dim': 432, 'num_adj': 4, 'add_rate': 0.6185247060439036, 'tem': 1.0130001947870337, 'consis_rate': 1.3149856991408904, 'use_att': 0}
mean: 0.7991999999999999
[0.801 0.812 0.792 0.791 0.813 0.788 0.803 0.801 0.805 0.786]
cur_param: {'lr': 0.09602507256063633, 'weight_decay': 0.0009883548687836436, 'dropout': 0.7269002669526423, 'patience': 90, 'lr_reduce_freq': 150, 'spt_alg': 'kruskal', 'spt_attr': 'edge_degree', 'manifold': 'Hyperboloid', 'num_layers': 3, 'dim': 336, 'num_adj': 6, 'add_rate': 0.5381823173085546, 'tem': 1.1470907651021813, 'consis_rate': 1.5272970416812537, 'use_att': 1}
mean: 0.7116
[0.761 0.743 0.682 0.683 0.722 0.684 0.698 0.731 0.72  0.692]
cur_param: {'lr': 0.044643265649656545, 'weight_decay': 0.004086790011768521, 'dropout': 0.21141926186518722, 'patience': 80, 'lr_reduce_freq': 120, 'spt_alg': 'kruskal', 'spt_attr': 'similarity', 'manifold': 'Hyperboloid', 'num_layers': 3, 'dim': 448, 'num_adj': 6, 'add_rate': 0.4497978769895696, 'tem': 0.7548253671790218, 'consis_rate': 1.438836855439125, 'use_att': 0}
mean: 0.7832000000000001
[0.781 0.803 0.782 0.753 0.777 0.8   0.802 0.768 0.783 0.783]
cur_param: {'lr': 0.0005122461334245335, 'weight_decay': 0.006096679116348905, 'dropout': 0.5202645712417727, 'patience': 80, 'lr_reduce_freq': 130, 'spt_alg': 'kruskal', 'spt_attr': 'edge_degree', 'manifold': 'Hyperboloid', 'num_layers': 3, 'dim': 416, 'num_adj': 4, 'add_rate': 0.6444903336974844, 'tem': 0.859781359909599, 'consis_rate': 1.3130844892991822, 'use_att': 0}
mean: 0.2535
[0.328 0.339 0.238 0.291 0.178 0.13  0.269 0.247 0.194 0.321]
cur_param: {'lr': 0.03244271249023104, 'weight_decay': 0.0013009238257496469, 'dropout': 0.665994742760699, 'patience': 60, 'lr_reduce_freq': 80, 'spt_alg': 'kruskal', 'spt_attr': 'edge_degree', 'manifold': 'Hyperboloid', 'num_layers': 3, 'dim': 480, 'num_adj': 6, 'add_rate': 0.5090690948414985, 'tem': 0.9674506156962659, 'consis_rate': 1.1385888420630887, 'use_att': 0}
mean: 0.8012
[0.802 0.812 0.802 0.792 0.795 0.811 0.802 0.806 0.791 0.799]
cur_param: {'lr': 0.06770761117876803, 'weight_decay': 0.0025527684040574953, 'dropout': 0.6742986031181885, 'patience': 70, 'lr_reduce_freq': 80, 'spt_alg': 'kruskal', 'spt_attr': 'edge_degree', 'manifold': 'Hyperboloid', 'num_layers': 3, 'dim': 480, 'num_adj': 6, 'add_rate': 0.5077429210283323, 'tem': 0.914414198972511, 'consis_rate': 1.1435362122509625, 'use_att': 0}
mean: 0.7935000000000001
[0.797 0.805 0.809 0.785 0.795 0.788 0.776 0.795 0.803 0.782]
cur_param: {'lr': 0.020559717000826924, 'weight_decay': 0.0012761768809989326, 'dropout': 0.738282527990826, 'patience': 100, 'lr_reduce_freq': 100, 'spt_alg': 'kruskal', 'spt_attr': 'edge_degree', 'manifold': 'Hyperboloid', 'num_layers': 3, 'dim': 448, 'num_adj': 6, 'add_rate': 0.41013380479369294, 'tem': 0.9798943281582063, 'consis_rate': 1.256672444370011, 'use_att': 0}
mean: 0.8055
[0.798 0.795 0.803 0.797 0.819 0.811 0.803 0.823 0.822 0.784]
cur_param: {'lr': 0.007261230400444019, 'weight_decay': 0.0031698795241174573, 'dropout': 0.739457888685369, 'patience': 100, 'lr_reduce_freq': 100, 'spt_alg': 'kruskal', 'spt_attr': 'edge_degree', 'manifold': 'Hyperboloid', 'num_layers': 3, 'dim': 448, 'num_adj': 6, 'add_rate': 0.38338616718839064, 'tem': 1.0461155551785328, 'consis_rate': 1.4653026701277116, 'use_att': 0}
mean: 0.7659
[0.783 0.778 0.796 0.745 0.783 0.658 0.798 0.784 0.752 0.782]
cur_param: {'lr': 0.020993694246312523, 'weight_decay': 0.0009564201662761153, 'dropout': 0.3012527136392305, 'patience': 100, 'lr_reduce_freq': 110, 'spt_alg': 'kruskal', 'spt_attr': 'edge_degree', 'manifold': 'Hyperboloid', 'num_layers': 3, 'dim': 320, 'num_adj': 2, 'add_rate': 0.7088297058511612, 'tem': 0.7980796207569073, 'consis_rate': 1.2630648797067572, 'use_att': 0}
mean: 0.7967
[0.811 0.79  0.804 0.764 0.793 0.795 0.79  0.8   0.812 0.808]
cur_param: {'lr': 0.0263180874382427, 'weight_decay': 0.0018745684345984552, 'dropout': 0.7939295120154369, 'patience': 90, 'lr_reduce_freq': 130, 'spt_alg': 'kruskal', 'spt_attr': 'edge_degree', 'manifold': 'Hyperboloid', 'num_layers': 3, 'dim': 416, 'num_adj': 6, 'add_rate': 0.5820996188239168, 'tem': 1.1196436749620666, 'consis_rate': 1.6093528533060355, 'use_att': 1}
mean: 0.762
[0.76  0.772 0.742 0.743 0.772 0.77  0.77  0.783 0.767 0.741]
cur_param: {'lr': 0.012759336532554883, 'weight_decay': 0.0024396213216432315, 'dropout': 0.27240755970154634, 'patience': 90, 'lr_reduce_freq': 90, 'spt_alg': 'kruskal', 'spt_attr': 'edge_degree', 'manifold': 'Hyperboloid', 'num_layers': 3, 'dim': 160, 'num_adj': 6, 'add_rate': 0.4138062588469059, 'tem': 0.8828955601533746, 'consis_rate': 1.3540405220953606, 'use_att': 0}
mean: 0.7891
[0.779 0.793 0.786 0.792 0.79  0.804 0.803 0.784 0.795 0.765]
cur_param: {'lr': 0.017711507921414075, 'weight_decay': 0.0007860740207477614, 'dropout': 0.7565741602116571, 'patience': 80, 'lr_reduce_freq': 110, 'spt_alg': 'kruskal', 'spt_attr': 'edge_degree', 'manifold': 'Hyperboloid', 'num_layers': 3, 'dim': 464, 'num_adj': 6, 'add_rate': 0.4539344777945673, 'tem': 1.004571657183137, 'consis_rate': 1.0738317415245364, 'use_att': 0}
mean: 0.7964000000000001
[0.798 0.796 0.789 0.802 0.806 0.814 0.773 0.807 0.796 0.783]
cur_param: {'lr': 0.08026155701175712, 'weight_decay': 0.0010676116118289376, 'dropout': 0.6986360590792892, 'patience': 100, 'lr_reduce_freq': 120, 'spt_alg': 'kruskal', 'spt_attr': 'edge_degree', 'manifold': 'Hyperboloid', 'num_layers': 5, 'dim': 432, 'num_adj': 6, 'add_rate': 0.3540902320149101, 'tem': 0.7102382796226336, 'consis_rate': 1.2343452443448437, 'use_att': 0}
mean: 0.319
[0.319 0.319 0.319 0.319 0.319 0.319 0.319 0.319 0.319 0.319]
cur_param: {'lr': 0.039415978401445215, 'weight_decay': 0.017695381771174978, 'dropout': 0.3241926861914417, 'patience': 100, 'lr_reduce_freq': 100, 'spt_alg': 'prim', 'spt_attr': 'similarity', 'manifold': 'Hyperboloid', 'num_layers': 3, 'dim': 384, 'num_adj': 6, 'add_rate': 0.5122632385349081, 'tem': 0.8288738196856372, 'consis_rate': 1.5982746679900715, 'use_att': 0}
mean: 0.35740000000000005
[0.319 0.319 0.319 0.319 0.319 0.664 0.319 0.319 0.358 0.319]
cur_param: {'lr': 0.031813571938664104, 'weight_decay': 0.0012749778347043474, 'dropout': 0.6794202887327903, 'patience': 60, 'lr_reduce_freq': 90, 'spt_alg': 'kruskal', 'spt_attr': 'edge_degree', 'manifold': 'Hyperboloid', 'num_layers': 3, 'dim': 496, 'num_adj': 6, 'add_rate': 0.5236988042037384, 'tem': 0.9704684355050447, 'consis_rate': 1.1812705477514818, 'use_att': 0}
mean: 0.7972
[0.803 0.8   0.795 0.794 0.774 0.81  0.791 0.792 0.822 0.791]
cur_param: {'lr': 0.053953178515175684, 'weight_decay': 0.0012754690743467963, 'dropout': 0.6360349538034352, 'patience': 70, 'lr_reduce_freq': 70, 'spt_alg': 'kruskal', 'spt_attr': 'edge_degree', 'manifold': 'Hyperboloid', 'num_layers': 3, 'dim': 464, 'num_adj': 6, 'add_rate': 0.4884564106182862, 'tem': 0.9411194650400436, 'consis_rate': 1.2955273750353382, 'use_att': 0}
mean: 0.7967000000000001
[0.797 0.773 0.799 0.796 0.801 0.811 0.793 0.803 0.788 0.806]
cur_param: {'lr': 0.03572929651043747, 'weight_decay': 0.0006656873820450729, 'dropout': 0.6504790445032541, 'patience': 80, 'lr_reduce_freq': 90, 'spt_alg': 'kruskal', 'spt_attr': 'edge_degree', 'manifold': 'Hyperboloid', 'num_layers': 3, 'dim': 480, 'num_adj': 6, 'add_rate': 0.41317359029466494, 'tem': 0.9824817307039732, 'consis_rate': 1.0375789084013671, 'use_att': 0}
mean: 0.7987
[0.809 0.789 0.806 0.809 0.809 0.804 0.785 0.794 0.784 0.798]
cur_param: {'lr': 0.0024037078477380735, 'weight_decay': 0.001793556161413502, 'dropout': 0.599966222798594, 'patience': 60, 'lr_reduce_freq': 80, 'spt_alg': 'kruskal', 'spt_attr': 'edge_degree', 'manifold': 'Hyperboloid', 'num_layers': 3, 'dim': 448, 'num_adj': 6, 'add_rate': 0.6115216782191757, 'tem': 0.9305543526125273, 'consis_rate': 0.9848067019284775, 'use_att': 0}
mean: 0.7993
[0.812 0.799 0.806 0.793 0.799 0.783 0.792 0.803 0.811 0.795][32m[I 2022-06-29 15:28:01,745][0m Trial 54 finished with value: 0.7993 and parameters: {'lr': 0.0024037078477380735, 'weight_decay': 0.001793556161413502, 'dropout': 0.599966222798594, 'patience': 60, 'lr_reduce_freq': 80, 'spt_alg': 'kruskal', 'spt_attr': 'edge_degree', 'manifold': 'Hyperboloid', 'num_layers': 3, 'dim': 448, 'num_adj': 6, 'add_rate': 0.6115216782191757, 'tem': 0.9305543526125273, 'consis_rate': 0.9848067019284775, 'use_att': 0}. Best is trial 25 with value: 0.8081000000000002.[0m
[32m[I 2022-06-29 15:35:42,723][0m Trial 55 finished with value: 0.7967000000000001 and parameters: {'lr': 0.01853758647635587, 'weight_decay': 0.0013844089600620535, 'dropout': 0.37770654648931157, 'patience': 90, 'lr_reduce_freq': 100, 'spt_alg': 'prim', 'spt_attr': 'edge_degree', 'manifold': 'Hyperboloid', 'num_layers': 3, 'dim': 432, 'num_adj': 6, 'add_rate': 0.4740305408365702, 'tem': 1.0599117967840255, 'consis_rate': 1.105705611847137, 'use_att': 0}. Best is trial 25 with value: 0.8081000000000002.[0m
[32m[I 2022-06-29 15:42:13,666][0m Trial 56 finished with value: 0.8093999999999999 and parameters: {'lr': 0.024097010488998757, 'weight_decay': 0.0007160714485577922, 'dropout': 0.4379570396921523, 'patience': 70, 'lr_reduce_freq': 80, 'spt_alg': 'kruskal', 'spt_attr': 'edge_degree', 'manifold': 'Hyperboloid', 'num_layers': 3, 'dim': 496, 'num_adj': 6, 'add_rate': 0.7782585903066732, 'tem': 0.9865773926116411, 'consis_rate': 1.4905196850380684, 'use_att': 0}. Best is trial 56 with value: 0.8093999999999999.[0m
[32m[I 2022-06-29 15:50:36,056][0m Trial 57 finished with value: 0.3186 and parameters: {'lr': 0.012321795481524726, 'weight_decay': 0.04101944224943919, 'dropout': 0.4248050260721782, 'patience': 70, 'lr_reduce_freq': 140, 'spt_alg': 'prim', 'spt_attr': 'edge_degree', 'manifold': 'PoincareBall', 'num_layers': 5, 'dim': 496, 'num_adj': 6, 'add_rate': 0.8926997419924879, 'tem': 0.8581702931019234, 'consis_rate': 1.4985261796542981, 'use_att': 0}. Best is trial 56 with value: 0.8093999999999999.[0m
[32m[I 2022-06-29 15:54:35,412][0m Trial 58 finished with value: 0.8044 and parameters: {'lr': 0.007312752133939045, 'weight_decay': 0.0007253311239133243, 'dropout': 0.4547269030345795, 'patience': 80, 'lr_reduce_freq': 110, 'spt_alg': 'prim', 'spt_attr': 'edge_degree', 'manifold': 'PoincareBall', 'num_layers': 3, 'dim': 512, 'num_adj': 6, 'add_rate': 0.8294750660851804, 'tem': 1.1009845164552878, 'consis_rate': 1.3574495853852098, 'use_att': 0}. Best is trial 56 with value: 0.8093999999999999.[0m
[32m[I 2022-06-29 16:07:19,089][0m Trial 59 finished with value: 0.8132999999999999 and parameters: {'lr': 0.005139706158830381, 'weight_decay': 0.000683274610044689, 'dropout': 0.5364664310641712, 'patience': 80, 'lr_reduce_freq': 110, 'spt_alg': 'kruskal', 'spt_attr': 'edge_degree', 'manifold': 'Hyperboloid', 'num_layers': 3, 'dim': 512, 'num_adj': 2, 'add_rate': 0.8294003725062393, 'tem': 1.184276953959794, 'consis_rate': 1.370468875320379, 'use_att': 1}. Best is trial 59 with value: 0.8132999999999999.[0m
[32m[I 2022-06-29 16:18:29,528][0m Trial 60 finished with value: 0.8153 and parameters: {'lr': 0.004538489412366636, 'weight_decay': 0.0006857940352862421, 'dropout': 0.454238798069559, 'patience': 80, 'lr_reduce_freq': 110, 'spt_alg': 'prim', 'spt_attr': 'edge_degree', 'manifold': 'PoincareBall', 'num_layers': 3, 'dim': 512, 'num_adj': 2, 'add_rate': 0.7672167075967056, 'tem': 1.1833517668265454, 'consis_rate': 1.565115879446728, 'use_att': 1}. Best is trial 60 with value: 0.8153.[0m
[32m[I 2022-06-29 16:29:48,725][0m Trial 61 finished with value: 0.818 and parameters: {'lr': 0.00460814347874921, 'weight_decay': 0.0006690318142620254, 'dropout': 0.4580628479665416, 'patience': 80, 'lr_reduce_freq': 110, 'spt_alg': 'prim', 'spt_attr': 'edge_degree', 'manifold': 'PoincareBall', 'num_layers': 3, 'dim': 512, 'num_adj': 2, 'add_rate': 0.7776936130532195, 'tem': 1.1970590861812211, 'consis_rate': 1.6653204802868062, 'use_att': 1}. Best is trial 61 with value: 0.818.[0m
[32m[I 2022-06-29 16:41:31,381][0m Trial 62 finished with value: 0.8148 and parameters: {'lr': 0.0038611164262987076, 'weight_decay': 0.0005790517711389827, 'dropout': 0.4991631426147166, 'patience': 80, 'lr_reduce_freq': 100, 'spt_alg': 'prim', 'spt_attr': 'edge_degree', 'manifold': 'PoincareBall', 'num_layers': 3, 'dim': 496, 'num_adj': 2, 'add_rate': 0.761258740223476, 'tem': 1.2125116873142443, 'consis_rate': 1.7786501070465328, 'use_att': 1}. Best is trial 61 with value: 0.818.[0m
[32m[I 2022-06-29 16:52:50,974][0m Trial 63 finished with value: 0.8129 and parameters: {'lr': 0.004770352262551984, 'weight_decay': 0.0006181167264897018, 'dropout': 0.5475151421424957, 'patience': 80, 'lr_reduce_freq': 120, 'spt_alg': 'prim', 'spt_attr': 'edge_degree', 'manifold': 'PoincareBall', 'num_layers': 3, 'dim': 512, 'num_adj': 2, 'add_rate': 0.7773352810115843, 'tem': 1.2345441977514966, 'consis_rate': 1.7924139477330945, 'use_att': 1}. Best is trial 61 with value: 0.818.[0m
[32m[I 2022-06-29 17:04:20,025][0m Trial 64 finished with value: 0.8178999999999998 and parameters: {'lr': 0.003970680536490044, 'weight_decay': 0.000601523157531908, 'dropout': 0.5027748660605699, 'patience': 80, 'lr_reduce_freq': 110, 'spt_alg': 'prim', 'spt_attr': 'edge_degree', 'manifold': 'PoincareBall', 'num_layers': 3, 'dim': 512, 'num_adj': 2, 'add_rate': 0.7804221506455163, 'tem': 1.2312241779044168, 'consis_rate': 1.8418974420883463, 'use_att': 1}. Best is trial 61 with value: 0.818.[0m
[32m[I 2022-06-29 17:15:56,699][0m Trial 65 finished with value: 0.8114999999999999 and parameters: {'lr': 0.004158305649052252, 'weight_decay': 0.000578392575833282, 'dropout': 0.5377967931789174, 'patience': 80, 'lr_reduce_freq': 110, 'spt_alg': 'prim', 'spt_attr': 'edge_degree', 'manifold': 'PoincareBall', 'num_layers': 3, 'dim': 512, 'num_adj': 2, 'add_rate': 0.7792940522290129, 'tem': 1.2158421216459656, 'consis_rate': 1.8440947261956049, 'use_att': 1}. Best is trial 61 with value: 0.818.[0m
[32m[I 2022-06-29 17:27:24,427][0m Trial 66 finished with value: 0.8135 and parameters: {'lr': 0.004615160694389405, 'weight_decay': 0.0005728963652216811, 'dropout': 0.5406011798125785, 'patience': 80, 'lr_reduce_freq': 120, 'spt_alg': 'prim', 'spt_attr': 'edge_degree', 'manifold': 'PoincareBall', 'num_layers': 3, 'dim': 512, 'num_adj': 2, 'add_rate': 0.7770281433847647, 'tem': 1.2095225652496693, 'consis_rate': 1.8181883247752433, 'use_att': 1}. Best is trial 61 with value: 0.818.[0m
[32m[I 2022-06-29 17:39:17,181][0m Trial 67 finished with value: 0.8143 and parameters: {'lr': 0.003271818389107674, 'weight_decay': 0.0005011650896155942, 'dropout': 0.5046854450019476, 'patience': 80, 'lr_reduce_freq': 130, 'spt_alg': 'prim', 'spt_attr': 'edge_degree', 'manifold': 'PoincareBall', 'num_layers': 3, 'dim': 512, 'num_adj': 2, 'add_rate': 0.7314023840811646, 'tem': 1.278701568903493, 'consis_rate': 1.7793115370203982, 'use_att': 1}. Best is trial 61 with value: 0.818.[0m
[32m[I 2022-06-29 17:51:19,985][0m Trial 68 finished with value: 0.8175000000000001 and parameters: {'lr': 0.0032093728789476515, 'weight_decay': 0.0005099944875174439, 'dropout': 0.5017818508706239, 'patience': 80, 'lr_reduce_freq': 130, 'spt_alg': 'prim', 'spt_attr': 'similarity', 'manifold': 'PoincareBall', 'num_layers': 3, 'dim': 496, 'num_adj': 2, 'add_rate': 0.7328480156835294, 'tem': 1.2851578110994548, 'consis_rate': 1.6594786439121194, 'use_att': 1}. Best is trial 61 with value: 0.818.[0m
[32m[I 2022-06-29 18:19:23,314][0m Trial 69 finished with value: 0.7834000000000001 and parameters: {'lr': 0.0031705567759298054, 'weight_decay': 0.0005115516116083928, 'dropout': 0.49560267627868543, 'patience': 80, 'lr_reduce_freq': 140, 'spt_alg': 'prim', 'spt_attr': 'similarity', 'manifold': 'PoincareBall', 'num_layers': 5, 'dim': 496, 'num_adj': 2, 'add_rate': 0.7280877298571228, 'tem': 1.3227521249513468, 'consis_rate': 1.897858318401685, 'use_att': 1}. Best is trial 61 with value: 0.818.[0m
[32m[I 2022-06-29 18:32:38,085][0m Trial 70 finished with value: 0.8164999999999999 and parameters: {'lr': 0.003284702434307698, 'weight_decay': 0.0005069131191308934, 'dropout': 0.5703311156140293, 'patience': 80, 'lr_reduce_freq': 130, 'spt_alg': 'prim', 'spt_attr': 'similarity', 'manifold': 'PoincareBall', 'num_layers': 3, 'dim': 496, 'num_adj': 2, 'add_rate': 0.8602916379152153, 'tem': 1.2789519142197645, 'consis_rate': 1.6594901024722681, 'use_att': 1}. Best is trial 61 with value: 0.818.[0m
[32m[I 2022-06-29 18:45:16,439][0m Trial 71 finished with value: 0.8135999999999999 and parameters: {'lr': 0.0032370377853273937, 'weight_decay': 0.0005021164727153759, 'dropout': 0.4982156775631349, 'patience': 80, 'lr_reduce_freq': 130, 'spt_alg': 'prim', 'spt_attr': 'similarity', 'manifold': 'PoincareBall', 'num_layers': 3, 'dim': 496, 'num_adj': 2, 'add_rate': 0.8009826369308428, 'tem': 1.2796451403176885, 'consis_rate': 1.6826919153189515, 'use_att': 1}. Best is trial 61 with value: 0.818.[0m
