[32m[I 2022-06-30 04:23:34,115][0m Trial 71 finished with value: 0.8072000000000001 and parameters: {'lr': 0.020708483655871766, 'weight_decay': 0.0013013971708603468, 'dropout': 0.713695716492106, 'patience': 100, 'lr_reduce_freq': 100, 'spt_alg': 'kruskal', 'spt_attr': 'similarity', 'manifold': 'Hyperboloid', 'num_layers': 3, 'dim': 224, 'num_adj': 4, 'add_rate': 0.7315931910498218, 'tem': 1.224120289310829, 'consis_rate': 1.250272146132964, 'use_att': 1}. Best is trial 64 with value: 0.8172.[0m
 0.8098000000000001
[0.82  0.816 0.805 0.814 0.791 0.819 0.82  0.801 0.815 0.797]
cur_param: {'lr': 0.003219318770090648, 'weight_decay': 0.0006041847668314073, 'dropout': 0.46702408139861146, 'patience': 100, 'lr_reduce_freq': 120, 'spt_alg': 'kruskal', 'spt_attr': 'similarity', 'manifold': 'Hyperboloid', 'num_layers': 3, 'dim': 160, 'num_adj': 4, 'add_rate': 0.6269803238503611, 'tem': 1.4723963612769837, 'consis_rate': 1.7159539980391179, 'use_att': 1}
mean: 0.8084999999999999
[0.822 0.814 0.808 0.805 0.802 0.818 0.82  0.812 0.801 0.783]
cur_param: {'lr': 0.0011537940591875363, 'weight_decay': 0.0006494682203185937, 'dropout': 0.3492587893779867, 'patience': 100, 'lr_reduce_freq': 140, 'spt_alg': 'kruskal', 'spt_attr': 'similarity', 'manifold': 'Hyperboloid', 'num_layers': 3, 'dim': 160, 'num_adj': 4, 'add_rate': 0.6124089241263264, 'tem': 1.4748132129214742, 'consis_rate': 1.7202138015216117, 'use_att': 1}
mean: 0.7976
[0.797 0.799 0.805 0.79  0.803 0.8   0.786 0.808 0.797 0.791]
cur_param: {'lr': 0.007160163913827128, 'weight_decay': 0.0009653674890409558, 'dropout': 0.40419400827539864, 'patience': 100, 'lr_reduce_freq': 130, 'spt_alg': 'kruskal', 'spt_attr': 'similarity', 'manifold': 'Hyperboloid', 'num_layers': 3, 'dim': 192, 'num_adj': 4, 'add_rate': 0.6581070453840575, 'tem': 0.7098049653012708, 'consis_rate': 1.3103181148926613, 'use_att': 1}
mean: 0.8042
[0.807 0.799 0.798 0.809 0.796 0.809 0.807 0.804 0.814 0.799]
cur_param: {'lr': 0.003077272801659419, 'weight_decay': 0.0005007323272461124, 'dropout': 0.4798779801168745, 'patience': 100, 'lr_reduce_freq': 120, 'spt_alg': 'kruskal', 'spt_attr': 'similarity', 'manifold': 'Hyperboloid', 'num_layers': 3, 'dim': 160, 'num_adj': 4, 'add_rate': 0.5632960752512071, 'tem': 1.3349595496023927, 'consis_rate': 1.2002442305074594, 'use_att': 1}
mean: 0.8023999999999999
[0.819 0.788 0.796 0.796 0.8   0.808 0.804 0.814 0.805 0.794]
cur_param: {'lr': 0.01589975063419279, 'weight_decay': 0.0006136859783174466, 'dropout': 0.6040516235279794, 'patience': 100, 'lr_reduce_freq': 110, 'spt_alg': 'kruskal', 'spt_attr': 'similarity', 'manifold': 'Hyperboloid', 'num_layers': 3, 'dim': 144, 'num_adj': 4, 'add_rate': 0.7210303769799133, 'tem': 1.4329710031740128, 'consis_rate': 1.395271458225592, 'use_att': 1}
mean: 0.8100999999999999
[0.82  0.814 0.825 0.787 0.794 0.796 0.819 0.816 0.811 0.819]
cur_param: {'lr': 0.016206421374110512, 'weight_decay': 0.0006225699938816, 'dropout': 0.609211572575587, 'patience': 100, 'lr_reduce_freq': 110, 'spt_alg': 'kruskal', 'spt_attr': 'similarity', 'manifold': 'Hyperboloid', 'num_layers': 4, 'dim': 304, 'num_adj': 4, 'add_rate': 0.7890561407908014, 'tem': 1.4200490054214454, 'consis_rate': 1.3593737588599104, 'use_att': 1}
mean: 0.7994000000000001
[0.811 0.784 0.796 0.797 0.783 0.797 0.804 0.805 0.807 0.81 ]
cur_param: {'lr': 0.02274544192622196, 'weight_decay': 0.032715953534616184, 'dropout': 0.5622886049806173, 'patience': 100, 'lr_reduce_freq': 120, 'spt_alg': 'kruskal', 'spt_attr': 'similarity', 'manifold': 'Hyperboloid', 'num_layers': 3, 'dim': 144, 'num_adj': 4, 'add_rate': 0.7340884308794589, 'tem': 1.4247670053251213, 'consis_rate': 1.0628974852575093, 'use_att': 1}
mean: 0.3189
[0.319 0.319 0.319 0.319 0.319 0.319 0.318 0.319 0.319 0.319]
cur_param: {'lr': 0.012684168401093368, 'weight_decay': 0.0007862387755269403, 'dropout': 0.7467847427456373, 'patience': 100, 'lr_reduce_freq': 110, 'spt_alg': 'kruskal', 'spt_attr': 'similarity', 'manifold': 'Hyperboloid', 'num_layers': 3, 'dim': 176, 'num_adj': 4, 'add_rate': 0.6878049184840925, 'tem': 1.4980369409269716, 'consis_rate': 1.5772492365573947, 'use_att': 1}
mean: 0.8132999999999999
[0.809 0.822 0.801 0.815 0.837 0.809 0.807 0.823 0.821 0.789]
cur_param: {'lr': 0.013535976678930821, 'weight_decay': 0.0013176608322076238, 'dropout': 0.7965933439326921, 'patience': 100, 'lr_reduce_freq': 110, 'spt_alg': 'kruskal', 'spt_attr': 'similarity', 'manifold': 'Hyperboloid', 'num_layers': 3, 'dim': 176, 'num_adj': 4, 'add_rate': 0.6746215234201751, 'tem': 1.4961045850476016, 'consis_rate': 1.5770419658796468, 'use_att': 1}
mean: 0.8084000000000001
[0.814 0.803 0.803 0.807 0.818 0.795 0.814 0.813 0.814 0.803]
cur_param: {'lr': 0.008976279102267361, 'weight_decay': 0.0007707148794540221, 'dropout': 0.7324950843640361, 'patience': 100, 'lr_reduce_freq': 100, 'spt_alg': 'kruskal', 'spt_attr': 'similarity', 'manifold': 'Hyperboloid', 'num_layers': 3, 'dim': 192, 'num_adj': 4, 'add_rate': 0.7409102577604596, 'tem': 1.2037656178134086, 'consis_rate': 1.6929308934789693, 'use_att': 1}
mean: 0.8172
[0.815 0.802 0.826 0.81  0.826 0.816 0.808 0.822 0.821 0.826]
cur_param: {'lr': 0.00893988970325767, 'weight_decay': 0.0010599924036775177, 'dropout': 0.7230823493551355, 'patience': 100, 'lr_reduce_freq': 100, 'spt_alg': 'kruskal', 'spt_attr': 'similarity', 'manifold': 'Hyperboloid', 'num_layers': 3, 'dim': 192, 'num_adj': 4, 'add_rate': 0.7425166919944435, 'tem': 1.1433954548050052, 'consis_rate': 1.4637607492349825, 'use_att': 1}
mean: 0.8145
[0.81  0.823 0.821 0.81  0.817 0.805 0.807 0.815 0.821 0.816]
cur_param: {'lr': 0.017597951226755042, 'weight_decay': 0.001047313501324221, 'dropout': 0.7436517797654302, 'patience': 100, 'lr_reduce_freq': 90, 'spt_alg': 'kruskal', 'spt_attr': 'similarity', 'manifold': 'Hyperboloid', 'num_layers': 3, 'dim': 192, 'num_adj': 4, 'add_rate': 0.7862599372577278, 'tem': 1.1452020695538647, 'consis_rate': 1.482891320148782, 'use_att': 1}
mean: 0.8150000000000001
[0.823 0.814 0.81  0.81  0.823 0.815 0.807 0.817 0.819 0.812]
cur_param: {'lr': 0.017217319246301543, 'weight_decay': 0.001025065776910963, 'dropout': 0.7337653394173413, 'patience': 100, 'lr_reduce_freq': 90, 'spt_alg': 'kruskal', 'spt_attr': 'similarity', 'manifold': 'Hyperboloid', 'num_layers': 3, 'dim': 208, 'num_adj': 4, 'add_rate': 0.8026957489285665, 'tem': 1.2015613130103866, 'consis_rate': 1.435083628172255, 'use_att': 1}
mean: 0.8119999999999999
[0.797 0.806 0.823 0.832 0.806 0.822 0.825 0.809 0.804 0.796]
cur_param: {'lr': 0.023248392555531672, 'weight_decay': 0.0010580669519126592, 'dropout': 0.7555925051636767, 'patience': 100, 'lr_reduce_freq': 90, 'spt_alg': 'kruskal', 'spt_attr': 'similarity', 'manifold': 'Hyperboloid', 'num_layers': 3, 'dim': 208, 'num_adj': 4, 'add_rate': 0.8036533671616527, 'tem': 1.1467138063251099, 'consis_rate': 1.45694673133731, 'use_att': 1}
mean: 0.8025
[0.796 0.781 0.802 0.813 0.822 0.796 0.778 0.803 0.819 0.815]
cur_param: {'lr': 0.01765844549945957, 'weight_decay': 0.0014639536304191917, 'dropout': 0.7347502435242059, 'patience': 100, 'lr_reduce_freq': 90, 'spt_alg': 'kruskal', 'spt_attr': 'similarity', 'manifold': 'Hyperboloid', 'num_layers': 3, 'dim': 256, 'num_adj': 4, 'add_rate': 0.7384882379165627, 'tem': 1.0479952674675417, 'consis_rate': 1.1765861285488783, 'use_att': 1}
mean: 0.8122999999999999
[0.807 0.813 0.811 0.806 0.819 0.812 0.796 0.819 0.818 0.822]
cur_param: {'lr': 0.034982187846751805, 'weight_decay': 0.002604885430201351, 'dropout': 0.7374018526642574, 'patience': 100, 'lr_reduce_freq': 90, 'spt_alg': 'kruskal', 'spt_attr': 'similarity', 'manifold': 'Hyperboloid', 'num_layers': 3, 'dim': 240, 'num_adj': 4, 'add_rate': 0.8949142436554082, 'tem': 1.0467360619456532, 'consis_rate': 0.9295295425221882, 'use_att': 1}
mean: 0.7779
[0.771 0.767 0.775 0.79  0.77  0.78  0.792 0.782 0.763 0.789]
cur_param: {'lr': 0.020708483655871766, 'weight_decay': 0.0013013971708603468, 'dropout': 0.713695716492106, 'patience': 100, 'lr_reduce_freq': 100, 'spt_alg': 'kruskal', 'spt_attr': 'similarity', 'manifold': 'Hyperboloid', 'num_layers': 3, 'dim': 224, 'num_adj': 4, 'add_rate': 0.7315931910498218, 'tem': 1.224120289310829, 'consis_rate': 1.250272146132964, 'use_att': 1}
mean: 0.8072000000000001
[0.806 0.81  0.809 0.793 0.825 0.798 0.813 0.809 0.806 0.803]
cur_param: {'lr': 0.016775844299576466, 'weight_decay': 0.0017008362688293354, 'dropout': 0.7676365360820494, 'patience': 100, 'lr_reduce_freq': 80, 'spt_alg': 'kruskal', 'spt_attr': 'similarity', 'manifold': 'Hyperboloid', 'num_layers': 3, 'dim': 256, 'num_adj': 4, 'add_rate': 0.7622612030439979, 'tem': 0.9935242389569025, 'consis_rate': 1.1314993348570166, 'use_att': 1}[32m[I 2022-06-30 04:49:56,836][0m Trial 72 finished with value: 0.8149 and parameters: {'lr': 0.016775844299576466, 'weight_decay': 0.0017008362688293354, 'dropout': 0.7676365360820494, 'patience': 100, 'lr_reduce_freq': 80, 'spt_alg': 'kruskal', 'spt_attr': 'similarity', 'manifold': 'Hyperboloid', 'num_layers': 3, 'dim': 256, 'num_adj': 4, 'add_rate': 0.7622612030439979, 'tem': 0.9935242389569025, 'consis_rate': 1.1314993348570166, 'use_att': 1}. Best is trial 64 with value: 0.8172.[0m
[32m[I 2022-06-30 05:15:06,956][0m Trial 73 finished with value: 0.8041 and parameters: {'lr': 0.026610372236517427, 'weight_decay': 0.0015643411822588976, 'dropout': 0.7641963752612295, 'patience': 100, 'lr_reduce_freq': 80, 'spt_alg': 'kruskal', 'spt_attr': 'similarity', 'manifold': 'Hyperboloid', 'num_layers': 3, 'dim': 256, 'num_adj': 4, 'add_rate': 0.7544349427796716, 'tem': 0.9816364396751533, 'consis_rate': 1.0062311486254933, 'use_att': 1}. Best is trial 64 with value: 0.8172.[0m
[32m[I 2022-06-30 05:35:51,746][0m Trial 74 finished with value: 0.8037000000000001 and parameters: {'lr': 0.01757721255875361, 'weight_decay': 0.0015212847278173777, 'dropout': 0.6674563685112402, 'patience': 100, 'lr_reduce_freq': 90, 'spt_alg': 'kruskal', 'spt_attr': 'similarity', 'manifold': 'Hyperboloid', 'num_layers': 3, 'dim': 208, 'num_adj': 4, 'add_rate': 0.8208826279225484, 'tem': 0.8991656525727548, 'consis_rate': 1.1277275119736339, 'use_att': 1}. Best is trial 64 with value: 0.8172.[0m
[32m[I 2022-06-30 06:00:24,322][0m Trial 75 finished with value: 0.8088999999999998 and parameters: {'lr': 0.012596817623488474, 'weight_decay': 0.0010877493628801214, 'dropout': 0.7733288409560796, 'patience': 100, 'lr_reduce_freq': 80, 'spt_alg': 'kruskal', 'spt_attr': 'similarity', 'manifold': 'Hyperboloid', 'num_layers': 3, 'dim': 288, 'num_adj': 4, 'add_rate': 0.7604685822355743, 'tem': 1.0203818324479987, 'consis_rate': 1.4932548143072137, 'use_att': 1}. Best is trial 64 with value: 0.8172.[0m
[32m[I 2022-06-30 06:20:39,111][0m Trial 76 finished with value: 0.8145 and parameters: {'lr': 0.009091349032058027, 'weight_decay': 0.0008666703634119565, 'dropout': 0.7218990562929036, 'patience': 100, 'lr_reduce_freq': 90, 'spt_alg': 'kruskal', 'spt_attr': 'similarity', 'manifold': 'Hyperboloid', 'num_layers': 3, 'dim': 256, 'num_adj': 4, 'add_rate': 0.6980023170554254, 'tem': 1.1283639065351954, 'consis_rate': 1.3384869121446927, 'use_att': 1}. Best is trial 64 with value: 0.8172.[0m
[32m[I 2022-06-30 06:49:07,231][0m Trial 77 finished with value: 0.7982000000000001 and parameters: {'lr': 0.009416361475527962, 'weight_decay': 0.00230762251614851, 'dropout': 0.6988854356329957, 'patience': 100, 'lr_reduce_freq': 100, 'spt_alg': 'kruskal', 'spt_attr': 'edge_degree', 'manifold': 'Hyperboloid', 'num_layers': 3, 'dim': 256, 'num_adj': 4, 'add_rate': 0.6943386497854694, 'tem': 1.0847847821608276, 'consis_rate': 1.172137975823345, 'use_att': 1}. Best is trial 64 with value: 0.8172.[0m
[32m[I 2022-06-30 07:12:03,747][0m Trial 78 finished with value: 0.8022 and parameters: {'lr': 0.00841720988649579, 'weight_decay': 0.0018293901089036868, 'dropout': 0.6692142994335399, 'patience': 100, 'lr_reduce_freq': 100, 'spt_alg': 'kruskal', 'spt_attr': 'similarity', 'manifold': 'Hyperboloid', 'num_layers': 3, 'dim': 288, 'num_adj': 4, 'add_rate': 0.7025328188097698, 'tem': 1.1168855873725523, 'consis_rate': 1.23833705331208, 'use_att': 1}. Best is trial 64 with value: 0.8172.[0m
[32m[I 2022-06-30 08:49:45,626][0m Trial 79 finished with value: 0.7473 and parameters: {'lr': 0.011518670139925823, 'weight_decay': 0.0008905344667132935, 'dropout': 0.7178348006714511, 'patience': 100, 'lr_reduce_freq': 80, 'spt_alg': 'kruskal', 'spt_attr': 'similarity', 'manifold': 'Hyperboloid', 'num_layers': 5, 'dim': 256, 'num_adj': 4, 'add_rate': 0.8361326535988234, 'tem': 1.1527942113506426, 'consis_rate': 1.3840848409679436, 'use_att': 1}. Best is trial 64 with value: 0.8172.[0m
[32m[I 2022-06-30 09:18:44,760][0m Trial 80 finished with value: 0.8164999999999999 and parameters: {'lr': 0.013248066214670838, 'weight_decay': 0.0013136526146256932, 'dropout': 0.7772576936567106, 'patience': 100, 'lr_reduce_freq': 90, 'spt_alg': 'kruskal', 'spt_attr': 'similarity', 'manifold': 'Hyperboloid', 'num_layers': 3, 'dim': 352, 'num_adj': 4, 'add_rate': 0.644765898365198, 'tem': 1.0621445073069176, 'consis_rate': 1.3356910296503828, 'use_att': 1}. Best is trial 64 with value: 0.8172.[0m
[32m[I 2022-06-30 09:42:19,714][0m Trial 81 finished with value: 0.8093 and parameters: {'lr': 0.013064689711936079, 'weight_decay': 0.0012552466642783598, 'dropout': 0.7821237443919815, 'patience': 100, 'lr_reduce_freq': 90, 'spt_alg': 'kruskal', 'spt_attr': 'similarity', 'manifold': 'Hyperboloid', 'num_layers': 3, 'dim': 336, 'num_adj': 4, 'add_rate': 0.6509133407698249, 'tem': 1.0747902245724517, 'consis_rate': 1.3296320302805424, 'use_att': 1}. Best is trial 64 with value: 0.8172.[0m
[32m[I 2022-06-30 10:03:19,287][0m Trial 82 finished with value: 0.8089999999999999 and parameters: {'lr': 0.018918951340971518, 'weight_decay': 0.0008758438834547963, 'dropout': 0.7366567991805193, 'patience': 100, 'lr_reduce_freq': 100, 'spt_alg': 'kruskal', 'spt_attr': 'similarity', 'manifold': 'Hyperboloid', 'num_layers': 3, 'dim': 368, 'num_adj': 4, 'add_rate': 0.7681509562187377, 'tem': 0.9527200497095741, 'consis_rate': 1.5614010330282393, 'use_att': 1}. Best is trial 64 with value: 0.8172.[0m
[32m[I 2022-06-30 10:26:21,049][0m Trial 83 finished with value: 0.8069000000000001 and parameters: {'lr': 0.00992589917875716, 'weight_decay': 0.0014644592131534638, 'dropout': 0.7454285754610017, 'patience': 100, 'lr_reduce_freq': 70, 'spt_alg': 'kruskal', 'spt_attr': 'similarity', 'manifold': 'Hyperboloid', 'num_layers': 3, 'dim': 352, 'num_adj': 4, 'add_rate': 0.7014091257604529, 'tem': 1.0540055124585188, 'consis_rate': 1.136200350787755, 'use_att': 1}. Best is trial 64 with value: 0.8172.[0m
[32m[I 2022-06-30 10:44:52,893][0m Trial 84 finished with value: 0.8073 and parameters: {'lr': 0.028211930251716314, 'weight_decay': 0.0007473113637222327, 'dropout': 0.7143640402923924, 'patience': 100, 'lr_reduce_freq': 80, 'spt_alg': 'kruskal', 'spt_attr': 'similarity', 'manifold': 'Hyperboloid', 'num_layers': 3, 'dim': 192, 'num_adj': 4, 'add_rate': 0.7422285339739567, 'tem': 1.0054601399397187, 'consis_rate': 1.2084750446075874, 'use_att': 1}. Best is trial 64 with value: 0.8172.[0m
[32m[I 2022-06-30 11:11:14,495][0m Trial 85 finished with value: 0.8114000000000001 and parameters: {'lr': 0.014175659591195938, 'weight_decay': 0.0011574237686139965, 'dropout': 0.7808234535130789, 'patience': 100, 'lr_reduce_freq': 100, 'spt_alg': 'kruskal', 'spt_attr': 'similarity', 'manifold': 'Hyperboloid', 'num_layers': 3, 'dim': 224, 'num_adj': 4, 'add_rate': 0.7817287321216184, 'tem': 0.8412876333777575, 'consis_rate': 1.2869395375250643, 'use_att': 1}. Best is trial 64 with value: 0.8172.[0m
[32m[I 2022-06-30 11:36:32,657][0m Trial 86 finished with value: 0.7976 and parameters: {'lr': 0.021289616113462476, 'weight_decay': 0.0014020930434887429, 'dropout': 0.64890082510163, 'patience': 100, 'lr_reduce_freq': 90, 'spt_alg': 'kruskal', 'spt_attr': 'similarity', 'manifold': 'Hyperboloid', 'num_layers': 3, 'dim': 320, 'num_adj': 4, 'add_rate': 0.6713349718824035, 'tem': 1.1017110396179008, 'consis_rate': 1.3445232017416424, 'use_att': 1}. Best is trial 64 with value: 0.8172.[0m
[32m[I 2022-06-30 11:59:51,660][0m Trial 87 finished with value: 0.8105 and parameters: {'lr': 0.008282606585450129, 'weight_decay': 0.0016923810811313373, 'dropout': 0.6793868122587048, 'patience': 100, 'lr_reduce_freq': 30, 'spt_alg': 'kruskal', 'spt_attr': 'edge_degree', 'manifold': 'Hyperboloid', 'num_layers': 3, 'dim': 384, 'num_adj': 4, 'add_rate': 0.6342040034786184, 'tem': 1.137176265242531, 'consis_rate': 1.0853356021026295, 'use_att': 1}. Best is trial 64 with value: 0.8172.[0m
[32m[I 2022-06-30 12:23:15,103][0m Trial 88 finished with value: 0.8137000000000001 and parameters: {'lr': 0.010470008928918783, 'weight_decay': 0.0009505100187172323, 'dropout': 0.7622200777075244, 'patience': 100, 'lr_reduce_freq': 90, 'spt_alg': 'kruskal', 'spt_attr': 'similarity', 'manifold': 'Hyperboloid', 'num_layers': 3, 'dim': 176, 'num_adj': 4, 'add_rate': 0.7096645337860331, 'tem': 0.9345830355057598, 'consis_rate': 0.9568606878304251, 'use_att': 1}. Best is trial 64 with value: 0.8172.[0m
