[32m[I 2022-06-24 02:35:32,773][0m Trial 112 finished with value: 0.807 and parameters: {'lr': 0.006776548273322833, 'weight_decay': 0.0008732700125901195, 'dropout': 0.5547840807238712, 'patience': 80, 'lr_reduce_freq': 110, 'spt_alg': 'prim', 'spt_attr': 'similarity', 'manifold': 'PoincareBall', 'num_layers': 3, 'num_adj': 8, 'add_rate': 0.29450631278805456, 'tem': 1.2341499864458068, 'consis_rate': 1.1815277083487021, 'use_att': 1}. Best is trial 59 with value: 0.8093.[0m

mean: 0.8026
[0.777 0.824 0.815 0.791 0.797 0.824 0.796 0.788 0.813 0.801]
cur_param: {'lr': 0.011779623025852072, 'weight_decay': 0.0012533095284006064, 'dropout': 0.5720895705196701, 'patience': 80, 'lr_reduce_freq': 110, 'spt_alg': 'prim', 'spt_attr': 'edge_degree', 'manifold': 'PoincareBall', 'num_layers': 3, 'num_adj': 8, 'add_rate': 0.5061216852879892, 'tem': 0.7607955113731568, 'consis_rate': 0.6660059609630905, 'use_att': 1}
mean: 0.8004
[0.794 0.801 0.787 0.798 0.805 0.821 0.809 0.796 0.804 0.789]
cur_param: {'lr': 0.008619745223312832, 'weight_decay': 0.0005775420393276047, 'dropout': 0.5975332888072138, 'patience': 80, 'lr_reduce_freq': 90, 'spt_alg': 'prim', 'spt_attr': 'similarity', 'manifold': 'PoincareBall', 'num_layers': 3, 'num_adj': 8, 'add_rate': 0.39417996186093035, 'tem': 1.2573084633809575, 'consis_rate': 0.9254461687194839, 'use_att': 1}
mean: 0.8022
[0.79  0.803 0.806 0.801 0.813 0.821 0.787 0.816 0.806 0.779]
cur_param: {'lr': 0.0073050631672304965, 'weight_decay': 0.0015071047844427657, 'dropout': 0.47841358049409, 'patience': 80, 'lr_reduce_freq': 130, 'spt_alg': 'kruskal', 'spt_attr': 'similarity', 'manifold': 'PoincareBall', 'num_layers': 3, 'num_adj': 8, 'add_rate': 0.5851061309321575, 'tem': 1.0467807861439555, 'consis_rate': 1.1322793446012893, 'use_att': 1}
mean: 0.8023
[0.792 0.811 0.798 0.799 0.799 0.803 0.792 0.82  0.816 0.793]
cur_param: {'lr': 0.009034377677680058, 'weight_decay': 0.0035675032148440944, 'dropout': 0.4971497974094388, 'patience': 80, 'lr_reduce_freq': 110, 'spt_alg': 'prim', 'spt_attr': 'similarity', 'manifold': 'PoincareBall', 'num_layers': 3, 'num_adj': 8, 'add_rate': 0.37721506487569456, 'tem': 0.967586265005897, 'consis_rate': 0.9844198845136053, 'use_att': 1}
mean: 0.7935000000000001
[0.772 0.776 0.792 0.794 0.798 0.803 0.8   0.796 0.804 0.8  ]
cur_param: {'lr': 0.010709677572687612, 'weight_decay': 0.00078244918809816, 'dropout': 0.5265902515690994, 'patience': 100, 'lr_reduce_freq': 110, 'spt_alg': 'prim', 'spt_attr': 'edge_degree', 'manifold': 'PoincareBall', 'num_layers': 4, 'num_adj': 8, 'add_rate': 0.425089483655259, 'tem': 1.1660972192012384, 'consis_rate': 0.7406990078842662, 'use_att': 1}
mean: 0.7703000000000001
[0.757 0.757 0.786 0.759 0.796 0.785 0.767 0.752 0.78  0.764]
cur_param: {'lr': 0.00486150071725394, 'weight_decay': 0.001805740288564499, 'dropout': 0.6265767206437852, 'patience': 80, 'lr_reduce_freq': 130, 'spt_alg': 'prim', 'spt_attr': 'similarity', 'manifold': 'PoincareBall', 'num_layers': 3, 'num_adj': 6, 'add_rate': 0.5476129091515316, 'tem': 1.4172268200809117, 'consis_rate': 0.812599908471419, 'use_att': 0}
mean: 0.7972
[0.799 0.796 0.792 0.799 0.818 0.788 0.815 0.774 0.808 0.783]
cur_param: {'lr': 0.013201000293817784, 'weight_decay': 0.0010319041022372412, 'dropout': 0.5084514594698377, 'patience': 80, 'lr_reduce_freq': 110, 'spt_alg': 'prim', 'spt_attr': 'similarity', 'manifold': 'PoincareBall', 'num_layers': 3, 'num_adj': 8, 'add_rate': 0.4672926596199145, 'tem': 1.1075553015595319, 'consis_rate': 0.8612372999517975, 'use_att': 1}
mean: 0.7983
[0.781 0.816 0.783 0.799 0.805 0.811 0.789 0.816 0.803 0.78 ]
cur_param: {'lr': 0.018777600408457645, 'weight_decay': 0.0009720411236464571, 'dropout': 0.4493640571543743, 'patience': 80, 'lr_reduce_freq': 110, 'spt_alg': 'prim', 'spt_attr': 'similarity', 'manifold': 'PoincareBall', 'num_layers': 3, 'num_adj': 8, 'add_rate': 0.44249735660992245, 'tem': 1.334324929273793, 'consis_rate': 0.6117143801209731, 'use_att': 1}
mean: 0.7979
[0.778 0.805 0.812 0.798 0.793 0.815 0.792 0.791 0.809 0.786]
cur_param: {'lr': 0.015020569104627164, 'weight_decay': 0.0011291826268774354, 'dropout': 0.4172871425939436, 'patience': 80, 'lr_reduce_freq': 110, 'spt_alg': 'prim', 'spt_attr': 'similarity', 'manifold': 'PoincareBall', 'num_layers': 3, 'num_adj': 8, 'add_rate': 0.4835963055628279, 'tem': 1.5166685405903961, 'consis_rate': 0.706730895088133, 'use_att': 1}
mean: 0.7956
[0.785 0.791 0.809 0.809 0.784 0.805 0.79  0.786 0.805 0.792]
cur_param: {'lr': 0.009512909408952127, 'weight_decay': 0.000932663032377796, 'dropout': 0.533937145188328, 'patience': 80, 'lr_reduce_freq': 110, 'spt_alg': 'prim', 'spt_attr': 'similarity', 'manifold': 'PoincareBall', 'num_layers': 3, 'num_adj': 8, 'add_rate': 0.33949987411123356, 'tem': 1.083976816763157, 'consis_rate': 1.0600427561602324, 'use_att': 1}
mean: 0.808
[0.785 0.814 0.795 0.805 0.812 0.814 0.815 0.813 0.82  0.807]
cur_param: {'lr': 0.009797655259501848, 'weight_decay': 0.0007456654225311711, 'dropout': 0.5567844622068866, 'patience': 80, 'lr_reduce_freq': 110, 'spt_alg': 'prim', 'spt_attr': 'similarity', 'manifold': 'PoincareBall', 'num_layers': 3, 'num_adj': 8, 'add_rate': 0.3367925786435412, 'tem': 1.077554871388436, 'consis_rate': 1.0539046732356976, 'use_att': 1}
mean: 0.8058
[0.804 0.813 0.805 0.796 0.812 0.811 0.804 0.805 0.807 0.801]
cur_param: {'lr': 0.007509551449211471, 'weight_decay': 0.0006084790554380996, 'dropout': 0.5701300629932367, 'patience': 80, 'lr_reduce_freq': 90, 'spt_alg': 'prim', 'spt_attr': 'similarity', 'manifold': 'PoincareBall', 'num_layers': 3, 'num_adj': 8, 'add_rate': 0.2790113208117188, 'tem': 1.9265362527107852, 'consis_rate': 1.235268828382493, 'use_att': 1}
mean: 0.7999
[0.785 0.798 0.785 0.79  0.795 0.813 0.82  0.816 0.804 0.793]
cur_param: {'lr': 0.006101781070708168, 'weight_decay': 0.0007312066042297181, 'dropout': 0.5311823448546327, 'patience': 80, 'lr_reduce_freq': 110, 'spt_alg': 'prim', 'spt_attr': 'similarity', 'manifold': 'PoincareBall', 'num_layers': 3, 'num_adj': 8, 'add_rate': 0.3396381467220173, 'tem': 1.206900342681012, 'consis_rate': 1.0844029781010822, 'use_att': 1}
mean: 0.8055
[0.793 0.811 0.804 0.799 0.799 0.818 0.814 0.817 0.811 0.789]
cur_param: {'lr': 0.006158854091726424, 'weight_decay': 0.0005046659662897539, 'dropout': 0.5960563021481382, 'patience': 60, 'lr_reduce_freq': 130, 'spt_alg': 'prim', 'spt_attr': 'edge_degree', 'manifold': 'PoincareBall', 'num_layers': 3, 'num_adj': 8, 'add_rate': 0.2428020427277165, 'tem': 1.1944949653960566, 'consis_rate': 1.0703029001808606, 'use_att': 1}
mean: 0.7978000000000001
[0.791 0.791 0.789 0.8   0.791 0.829 0.783 0.819 0.802 0.783]
cur_param: {'lr': 0.005337642084489124, 'weight_decay': 0.000772211550967217, 'dropout': 0.5326669052377128, 'patience': 80, 'lr_reduce_freq': 50, 'spt_alg': 'prim', 'spt_attr': 'similarity', 'manifold': 'PoincareBall', 'num_layers': 3, 'num_adj': 8, 'add_rate': 0.33663388558322854, 'tem': 0.6152695262210217, 'consis_rate': 1.1518984445965188, 'use_att': 1}
mean: 0.8023
[0.794 0.804 0.799 0.802 0.799 0.816 0.808 0.811 0.798 0.792]
cur_param: {'lr': 0.006894405239333222, 'weight_decay': 0.0008693466934143548, 'dropout': 0.5562303709228391, 'patience': 80, 'lr_reduce_freq': 110, 'spt_alg': 'prim', 'spt_attr': 'similarity', 'manifold': 'PoincareBall', 'num_layers': 3, 'num_adj': 8, 'add_rate': 0.29224817884496324, 'tem': 1.230452560861948, 'consis_rate': 1.0347145320258482, 'use_att': 1}
mean: 0.8056000000000001
[0.791 0.812 0.806 0.782 0.801 0.819 0.815 0.821 0.806 0.803]
cur_param: {'lr': 0.00691273786052701, 'weight_decay': 0.000664056704989154, 'dropout': 0.5610903857388554, 'patience': 80, 'lr_reduce_freq': 110, 'spt_alg': 'prim', 'spt_attr': 'similarity', 'manifold': 'PoincareBall', 'num_layers': 3, 'num_adj': 8, 'add_rate': 0.3038254435744214, 'tem': 1.2349564462221032, 'consis_rate': 1.0241411075897047, 'use_att': 1}
mean: 0.8083
[0.792 0.818 0.81  0.81  0.809 0.807 0.819 0.813 0.807 0.798]
cur_param: {'lr': 0.006776548273322833, 'weight_decay': 0.0008732700125901195, 'dropout': 0.5547840807238712, 'patience': 80, 'lr_reduce_freq': 110, 'spt_alg': 'prim', 'spt_attr': 'similarity', 'manifold': 'PoincareBall', 'num_layers': 3, 'num_adj': 8, 'add_rate': 0.29450631278805456, 'tem': 1.2341499864458068, 'consis_rate': 1.1815277083487021, 'use_att': 1}
mean: 0.807
[0.785 0.814 0.802 0.794 0.808 0.821 0.817 0.817 0.814 0.798]
cur_param: {'lr': 0.006738951303563859, 'weight_decay': 0.0006315239819808453, 'dropout': 0.5540548624713593, 'patience': 80, 'lr_reduce_freq': 110, 'spt_alg': 'prim', 'spt_attr': 'similarity', 'manifold': 'PoincareBall', 'num_layers': 3, 'num_adj': 8, 'add_rate': 0.30391315209306835, 'tem': 1.2830725249451125, 'consis_rate': 1.0403018198701828, 'use_att': 1}[32m[I 2022-06-24 03:11:46,652][0m Trial 113 finished with value: 0.8073 and parameters: {'lr': 0.006738951303563859, 'weight_decay': 0.0006315239819808453, 'dropout': 0.5540548624713593, 'patience': 80, 'lr_reduce_freq': 110, 'spt_alg': 'prim', 'spt_attr': 'similarity', 'manifold': 'PoincareBall', 'num_layers': 3, 'num_adj': 8, 'add_rate': 0.30391315209306835, 'tem': 1.2830725249451125, 'consis_rate': 1.0403018198701828, 'use_att': 1}. Best is trial 59 with value: 0.8093.[0m
[32m[I 2022-06-24 03:46:48,282][0m Trial 114 finished with value: 0.8073 and parameters: {'lr': 0.007361415534228044, 'weight_decay': 0.0006340597717697056, 'dropout': 0.5580080700435146, 'patience': 80, 'lr_reduce_freq': 110, 'spt_alg': 'prim', 'spt_attr': 'similarity', 'manifold': 'PoincareBall', 'num_layers': 3, 'num_adj': 8, 'add_rate': 0.3022858373395299, 'tem': 1.3006916704692117, 'consis_rate': 1.0261516951792728, 'use_att': 1}. Best is trial 59 with value: 0.8093.[0m
[32m[I 2022-06-24 04:18:46,972][0m Trial 115 finished with value: 0.7968 and parameters: {'lr': 0.007433433444304501, 'weight_decay': 0.0006211339272242819, 'dropout': 0.6765233970955045, 'patience': 80, 'lr_reduce_freq': 110, 'spt_alg': 'prim', 'spt_attr': 'similarity', 'manifold': 'PoincareBall', 'num_layers': 3, 'num_adj': 8, 'add_rate': 0.24817603595678858, 'tem': 1.287686711991721, 'consis_rate': 1.1878592782269117, 'use_att': 1}. Best is trial 59 with value: 0.8093.[0m
[32m[I 2022-06-24 04:53:41,620][0m Trial 116 finished with value: 0.8046 and parameters: {'lr': 0.005669933442838797, 'weight_decay': 0.0006683439694865464, 'dropout': 0.6133187499396396, 'patience': 80, 'lr_reduce_freq': 110, 'spt_alg': 'prim', 'spt_attr': 'similarity', 'manifold': 'PoincareBall', 'num_layers': 3, 'num_adj': 8, 'add_rate': 0.2940815868496582, 'tem': 1.2483311099983108, 'consis_rate': 1.0489402547869535, 'use_att': 1}. Best is trial 59 with value: 0.8093.[0m
[32m[I 2022-06-24 05:32:42,717][0m Trial 117 finished with value: 0.8004999999999999 and parameters: {'lr': 0.004302169240834766, 'weight_decay': 0.0005710283633491199, 'dropout': 0.5792307384410816, 'patience': 80, 'lr_reduce_freq': 110, 'spt_alg': 'kruskal', 'spt_attr': 'similarity', 'manifold': 'PoincareBall', 'num_layers': 3, 'num_adj': 8, 'add_rate': 0.320669074380103, 'tem': 1.3485444339718644, 'consis_rate': 0.9910256591804608, 'use_att': 1}. Best is trial 59 with value: 0.8093.[0m
[32m[I 2022-06-24 06:04:58,408][0m Trial 118 finished with value: 0.805 and parameters: {'lr': 0.008994446528434353, 'weight_decay': 0.0005000929697698742, 'dropout': 0.645002004616593, 'patience': 80, 'lr_reduce_freq': 130, 'spt_alg': 'prim', 'spt_attr': 'similarity', 'manifold': 'PoincareBall', 'num_layers': 3, 'num_adj': 8, 'add_rate': 0.31309458750771063, 'tem': 1.2831264878057889, 'consis_rate': 1.1094248622908376, 'use_att': 1}. Best is trial 59 with value: 0.8093.[0m
[32m[I 2022-06-24 06:46:32,404][0m Trial 119 finished with value: 0.8066000000000001 and parameters: {'lr': 0.006578011796956075, 'weight_decay': 0.0013088283820888046, 'dropout': 0.5607289066808254, 'patience': 80, 'lr_reduce_freq': 70, 'spt_alg': 'prim', 'spt_attr': 'similarity', 'manifold': 'PoincareBall', 'num_layers': 3, 'num_adj': 8, 'add_rate': 0.27750338268357344, 'tem': 1.0058118641949345, 'consis_rate': 0.9323178407638831, 'use_att': 1}. Best is trial 59 with value: 0.8093.[0m
[32m[I 2022-06-24 06:56:06,266][0m Trial 120 finished with value: 0.2505 and parameters: {'lr': 0.004935961078843426, 'weight_decay': 0.19549617987835813, 'dropout': 0.6048551777271799, 'patience': 80, 'lr_reduce_freq': 70, 'spt_alg': 'prim', 'spt_attr': 'similarity', 'manifold': 'PoincareBall', 'num_layers': 4, 'num_adj': 8, 'add_rate': 0.21211322378534717, 'tem': 1.401636603025804, 'consis_rate': 1.0093055468318977, 'use_att': 0}. Best is trial 59 with value: 0.8093.[0m
[32m[I 2022-06-24 07:32:59,761][0m Trial 121 finished with value: 0.8095000000000001 and parameters: {'lr': 0.006509362942070111, 'weight_decay': 0.0008824042619009012, 'dropout': 0.5572836120470654, 'patience': 80, 'lr_reduce_freq': 70, 'spt_alg': 'prim', 'spt_attr': 'similarity', 'manifold': 'PoincareBall', 'num_layers': 3, 'num_adj': 8, 'add_rate': 0.26235845211447173, 'tem': 1.152537112477314, 'consis_rate': 0.9385931461101813, 'use_att': 1}. Best is trial 121 with value: 0.8095000000000001.[0m
[32m[I 2022-06-24 08:13:09,966][0m Trial 122 finished with value: 0.8087 and parameters: {'lr': 0.0067708710675115965, 'weight_decay': 0.0012220083158578988, 'dropout': 0.5830741662316464, 'patience': 80, 'lr_reduce_freq': 70, 'spt_alg': 'prim', 'spt_attr': 'similarity', 'manifold': 'PoincareBall', 'num_layers': 3, 'num_adj': 8, 'add_rate': 0.2651391593564241, 'tem': 1.1374435783012435, 'consis_rate': 0.932355704151577, 'use_att': 1}. Best is trial 121 with value: 0.8095000000000001.[0m
[32m[I 2022-06-24 08:56:15,218][0m Trial 123 finished with value: 0.8070999999999999 and parameters: {'lr': 0.006721513474522964, 'weight_decay': 0.0013662540276303588, 'dropout': 0.5801821504173558, 'patience': 80, 'lr_reduce_freq': 70, 'spt_alg': 'prim', 'spt_attr': 'similarity', 'manifold': 'PoincareBall', 'num_layers': 3, 'num_adj': 8, 'add_rate': 0.2744797851267676, 'tem': 1.148417020414803, 'consis_rate': 0.9294268065531426, 'use_att': 1}. Best is trial 121 with value: 0.8095000000000001.[0m
[32m[I 2022-06-24 09:35:16,909][0m Trial 124 finished with value: 0.805 and parameters: {'lr': 0.006540514183598396, 'weight_decay': 0.001387001122523121, 'dropout': 0.6235062586151221, 'patience': 80, 'lr_reduce_freq': 70, 'spt_alg': 'prim', 'spt_attr': 'similarity', 'manifold': 'PoincareBall', 'num_layers': 3, 'num_adj': 8, 'add_rate': 0.26679316487197924, 'tem': 1.1493180353304553, 'consis_rate': 0.9264448275382424, 'use_att': 1}. Best is trial 121 with value: 0.8095000000000001.[0m
[32m[I 2022-06-24 10:19:56,723][0m Trial 125 finished with value: 0.8038000000000001 and parameters: {'lr': 0.005791100483427011, 'weight_decay': 0.001160864161886998, 'dropout': 0.5889802502417251, 'patience': 80, 'lr_reduce_freq': 70, 'spt_alg': 'prim', 'spt_attr': 'similarity', 'manifold': 'PoincareBall', 'num_layers': 3, 'num_adj': 8, 'add_rate': 0.23610756412630307, 'tem': 1.1833940531678149, 'consis_rate': 0.8922094405689314, 'use_att': 1}. Best is trial 121 with value: 0.8095000000000001.[0m
[32m[I 2022-06-24 10:57:55,255][0m Trial 126 finished with value: 0.8052999999999999 and parameters: {'lr': 0.0067882683802311964, 'weight_decay': 0.0008975859825567531, 'dropout': 0.5775257881912711, 'patience': 80, 'lr_reduce_freq': 70, 'spt_alg': 'prim', 'spt_attr': 'similarity', 'manifold': 'PoincareBall', 'num_layers': 3, 'num_adj': 8, 'add_rate': 0.21027114245670014, 'tem': 1.00748721704247, 'consis_rate': 0.9588204188986728, 'use_att': 1}. Best is trial 121 with value: 0.8095000000000001.[0m
[32m[I 2022-06-24 11:41:38,914][0m Trial 127 finished with value: 0.7983 and parameters: {'lr': 0.005403412848973183, 'weight_decay': 0.0015048113724668666, 'dropout': 0.6363324283033187, 'patience': 80, 'lr_reduce_freq': 70, 'spt_alg': 'prim', 'spt_attr': 'similarity', 'manifold': 'PoincareBall', 'num_layers': 3, 'num_adj': 8, 'add_rate': 0.2595076427212066, 'tem': 1.0588571763865733, 'consis_rate': 0.9297647944347358, 'use_att': 1}. Best is trial 121 with value: 0.8095000000000001.[0m
[32m[I 2022-06-24 12:17:50,796][0m Trial 128 finished with value: 0.8018000000000001 and parameters: {'lr': 0.007554914265933364, 'weight_decay': 0.0009270288609727382, 'dropout': 0.5392105685382569, 'patience': 80, 'lr_reduce_freq': 70, 'spt_alg': 'prim', 'spt_attr': 'similarity', 'manifold': 'PoincareBall', 'num_layers': 3, 'num_adj': 8, 'add_rate': 0.2808597505921318, 'tem': 0.9600886749653954, 'consis_rate': 0.9950519155428521, 'use_att': 1}. Best is trial 121 with value: 0.8095000000000001.[0m
[32m[I 2022-06-24 13:10:44,304][0m Trial 129 finished with value: 0.7886 and parameters: {'lr': 0.004129650607472682, 'weight_decay': 0.0012524705239953615, 'dropout': 0.7087883349798825, 'patience': 80, 'lr_reduce_freq': 50, 'spt_alg': 'prim', 'spt_attr': 'similarity', 'manifold': 'PoincareBall', 'num_layers': 3, 'num_adj': 8, 'add_rate': 0.3042219020347821, 'tem': 1.3432803196013625, 'consis_rate': 0.8928789158387156, 'use_att': 1}. Best is trial 121 with value: 0.8095000000000001.[0m
[32m[I 2022-06-24 13:38:49,920][0m Trial 130 finished with value: 0.8019999999999999 and parameters: {'lr': 0.006191838663548278, 'weight_decay': 0.0007174045763991364, 'dropout': 0.6028612161453412, 'patience': 80, 'lr_reduce_freq': 70, 'spt_alg': 'prim', 'spt_attr': 'similarity', 'manifold': 'PoincareBall', 'num_layers': 3, 'num_adj': 8, 'add_rate': 0.2238457121644773, 'tem': 1.1390280204890078, 'consis_rate': 1.018422381675173, 'use_att': 1}. Best is trial 121 with value: 0.8095000000000001.[0m
