[32m[I 2022-06-23 05:31:43,208][0m Trial 74 finished with value: 0.8065 and parameters: {'lr': 0.008614222676256592, 'weight_decay': 0.0013016569594242542, 'dropout': 0.5182110385232147, 'patience': 80, 'lr_reduce_freq': 110, 'spt_alg': 'prim', 'spt_attr': 'similarity', 'manifold': 'PoincareBall', 'num_layers': 3, 'num_adj': 8, 'add_rate': 0.3595866106783416, 'tem': 0.5722239548344359, 'consis_rate': 0.6511907078328973, 'use_att': 1}. Best is trial 59 with value: 0.8093.[0m

mean: 0.8014000000000001
[0.794 0.804 0.826 0.785 0.795 0.819 0.793 0.816 0.814 0.768]
cur_param: {'lr': 0.012583882745318136, 'weight_decay': 0.0005231576864831208, 'dropout': 0.5330175103608213, 'patience': 80, 'lr_reduce_freq': 130, 'spt_alg': 'prim', 'spt_attr': 'similarity', 'manifold': 'PoincareBall', 'num_layers': 3, 'num_adj': 8, 'add_rate': 0.6896718312368395, 'tem': 0.8865564556817456, 'consis_rate': 1.1094691400161505, 'use_att': 1}
mean: 0.7974
[0.781 0.801 0.806 0.811 0.793 0.804 0.797 0.795 0.806 0.78 ]
cur_param: {'lr': 0.004530946576088389, 'weight_decay': 0.0016072576987585252, 'dropout': 0.7770278066436744, 'patience': 80, 'lr_reduce_freq': 150, 'spt_alg': 'prim', 'spt_attr': 'similarity', 'manifold': 'PoincareBall', 'num_layers': 3, 'num_adj': 8, 'add_rate': 0.1558035879282158, 'tem': 1.1518904979213103, 'consis_rate': 1.202320501028463, 'use_att': 1}
mean: 0.7676000000000001
[0.75  0.783 0.763 0.794 0.777 0.747 0.714 0.792 0.804 0.752]
cur_param: {'lr': 0.009419718239741318, 'weight_decay': 0.0010296404742399698, 'dropout': 0.47703998829972216, 'patience': 80, 'lr_reduce_freq': 110, 'spt_alg': 'prim', 'spt_attr': 'similarity', 'manifold': 'PoincareBall', 'num_layers': 3, 'num_adj': 8, 'add_rate': 0.4696773122372754, 'tem': 1.0465615237596635, 'consis_rate': 0.8466408048728727, 'use_att': 1}
mean: 0.8093
[0.796 0.818 0.802 0.809 0.802 0.823 0.807 0.827 0.803 0.806]
cur_param: {'lr': 0.003713430935375619, 'weight_decay': 0.002376349637920015, 'dropout': 0.46234606245961885, 'patience': 100, 'lr_reduce_freq': 110, 'spt_alg': 'prim', 'spt_attr': 'similarity', 'manifold': 'PoincareBall', 'num_layers': 3, 'num_adj': 8, 'add_rate': 0.5672618727907934, 'tem': 1.3190662225150127, 'consis_rate': 0.7242085455039908, 'use_att': 1}
mean: 0.7996000000000001
[0.791 0.808 0.787 0.812 0.787 0.811 0.8   0.809 0.807 0.784]
cur_param: {'lr': 0.008208435015223933, 'weight_decay': 0.0010618797869504253, 'dropout': 0.5830944009953712, 'patience': 80, 'lr_reduce_freq': 130, 'spt_alg': 'prim', 'spt_attr': 'similarity', 'manifold': 'PoincareBall', 'num_layers': 3, 'num_adj': 8, 'add_rate': 0.4708305087397131, 'tem': 1.0472614720142854, 'consis_rate': 0.854948839297194, 'use_att': 1}
mean: 0.8072000000000001
[0.782 0.813 0.804 0.809 0.797 0.821 0.798 0.821 0.824 0.803]
cur_param: {'lr': 0.009845919252081487, 'weight_decay': 0.0010304748422084382, 'dropout': 0.5037333649714245, 'patience': 80, 'lr_reduce_freq': 110, 'spt_alg': 'prim', 'spt_attr': 'similarity', 'manifold': 'PoincareBall', 'num_layers': 3, 'num_adj': 8, 'add_rate': 0.4624083863333831, 'tem': 1.118828404424911, 'consis_rate': 0.8531506295852918, 'use_att': 1}
mean: 0.8041
[0.794 0.803 0.806 0.806 0.803 0.825 0.805 0.793 0.803 0.803]
cur_param: {'lr': 0.014168006366868272, 'weight_decay': 0.0010175913236684414, 'dropout': 0.5111973311671709, 'patience': 80, 'lr_reduce_freq': 110, 'spt_alg': 'prim', 'spt_attr': 'similarity', 'manifold': 'PoincareBall', 'num_layers': 3, 'num_adj': 8, 'add_rate': 0.45841531098843524, 'tem': 1.126160407926572, 'consis_rate': 0.8281248238806899, 'use_att': 1}
mean: 0.8036999999999999
[0.782 0.799 0.821 0.797 0.814 0.811 0.795 0.812 0.81  0.796]
cur_param: {'lr': 0.014724113958613096, 'weight_decay': 0.0031362256629822124, 'dropout': 0.4969561371996899, 'patience': 80, 'lr_reduce_freq': 110, 'spt_alg': 'prim', 'spt_attr': 'similarity', 'manifold': 'PoincareBall', 'num_layers': 3, 'num_adj': 8, 'add_rate': 0.4669552206785938, 'tem': 1.115954430740332, 'consis_rate': 0.8352826390120314, 'use_att': 1}
mean: 0.7889
[0.762 0.785 0.778 0.798 0.807 0.782 0.797 0.774 0.795 0.811]
cur_param: {'lr': 0.022396940255595427, 'weight_decay': 0.0010288795527745426, 'dropout': 0.39984418800413946, 'patience': 80, 'lr_reduce_freq': 110, 'spt_alg': 'prim', 'spt_attr': 'similarity', 'manifold': 'PoincareBall', 'num_layers': 3, 'num_adj': 8, 'add_rate': 0.5088843989081716, 'tem': 0.7455153257929337, 'consis_rate': 0.5971602532110645, 'use_att': 1}
mean: 0.7889000000000002
[0.787 0.795 0.768 0.805 0.769 0.779 0.793 0.808 0.791 0.794]
cur_param: {'lr': 0.009354163937618322, 'weight_decay': 0.0017226083794501233, 'dropout': 0.5217890645817058, 'patience': 80, 'lr_reduce_freq': 110, 'spt_alg': 'prim', 'spt_attr': 'similarity', 'manifold': 'PoincareBall', 'num_layers': 3, 'num_adj': 8, 'add_rate': 0.44775246885119335, 'tem': 1.07075872287294, 'consis_rate': 0.4886039244641238, 'use_att': 0}
mean: 0.7907
[0.794 0.798 0.791 0.786 0.802 0.784 0.794 0.795 0.78  0.783]
cur_param: {'lr': 0.01629627196894693, 'weight_decay': 0.0014576777278781285, 'dropout': 0.6447748754040955, 'patience': 80, 'lr_reduce_freq': 110, 'spt_alg': 'prim', 'spt_attr': 'similarity', 'manifold': 'PoincareBall', 'num_layers': 3, 'num_adj': 8, 'add_rate': 0.35233891314349686, 'tem': 1.2093196774462245, 'consis_rate': 0.7969446527642825, 'use_att': 1}
mean: 0.7873
[0.788 0.776 0.797 0.78  0.795 0.787 0.757 0.798 0.814 0.781]
cur_param: {'lr': 0.01337646177084316, 'weight_decay': 0.0008732704846403323, 'dropout': 0.5560453669075858, 'patience': 80, 'lr_reduce_freq': 110, 'spt_alg': 'prim', 'spt_attr': 'similarity', 'manifold': 'PoincareBall', 'num_layers': 3, 'num_adj': 8, 'add_rate': 0.47288229716472957, 'tem': 0.9083747197494781, 'consis_rate': 0.6666295716679685, 'use_att': 1}
mean: 0.8056999999999999
[0.805 0.816 0.806 0.804 0.788 0.803 0.798 0.82  0.824 0.793]
cur_param: {'lr': 0.01303687163752585, 'weight_decay': 0.005949135037586389, 'dropout': 0.5582524814681066, 'patience': 80, 'lr_reduce_freq': 110, 'spt_alg': 'kruskal', 'spt_attr': 'similarity', 'manifold': 'PoincareBall', 'num_layers': 3, 'num_adj': 8, 'add_rate': 0.47312187435491115, 'tem': 0.9375874025436886, 'consis_rate': 0.5297745032220048, 'use_att': 1}
mean: 0.6231
[0.767 0.435 0.756 0.803 0.806 0.319 0.358 0.798 0.429 0.76 ]
cur_param: {'lr': 0.029479733752762697, 'weight_decay': 0.0009078139219415001, 'dropout': 0.35197338396471106, 'patience': 80, 'lr_reduce_freq': 110, 'spt_alg': 'prim', 'spt_attr': 'similarity', 'manifold': 'PoincareBall', 'num_layers': 4, 'num_adj': 2, 'add_rate': 0.5257906489594657, 'tem': 0.9907825242547162, 'consis_rate': 0.3459676115961109, 'use_att': 0}
mean: 0.7369
[0.715 0.749 0.735 0.772 0.776 0.677 0.764 0.75  0.741 0.69 ]
cur_param: {'lr': 0.02146232510643234, 'weight_decay': 0.0010885883878836338, 'dropout': 0.4841945484914652, 'patience': 80, 'lr_reduce_freq': 110, 'spt_alg': 'prim', 'spt_attr': 'similarity', 'manifold': 'PoincareBall', 'num_layers': 3, 'num_adj': 8, 'add_rate': 0.41187668415524736, 'tem': 0.877949951212003, 'consis_rate': 0.6806643937658764, 'use_att': 1}
mean: 0.8004000000000001
[0.776 0.81  0.796 0.808 0.802 0.792 0.808 0.814 0.807 0.791]
cur_param: {'lr': 0.01891491816801931, 'weight_decay': 0.0008606501205285837, 'dropout': 0.5479469715192965, 'patience': 80, 'lr_reduce_freq': 110, 'spt_alg': 'prim', 'spt_attr': 'similarity', 'manifold': 'PoincareBall', 'num_layers': 3, 'num_adj': 8, 'add_rate': 0.43602093711969764, 'tem': 0.8268878857276164, 'consis_rate': 0.7410541373387526, 'use_att': 1}
mean: 0.7979
[0.796 0.797 0.808 0.793 0.791 0.821 0.791 0.796 0.817 0.769]
cur_param: {'lr': 0.008266565124096648, 'weight_decay': 0.001828216725292792, 'dropout': 0.5152490977567488, 'patience': 80, 'lr_reduce_freq': 110, 'spt_alg': 'prim', 'spt_attr': 'similarity', 'manifold': 'PoincareBall', 'num_layers': 3, 'num_adj': 8, 'add_rate': 0.3824463557823234, 'tem': 0.5224154976067064, 'consis_rate': 0.6449061463841032, 'use_att': 1}
mean: 0.8051999999999999
[0.792 0.814 0.786 0.794 0.806 0.817 0.8   0.821 0.814 0.808]
cur_param: {'lr': 0.008614222676256592, 'weight_decay': 0.0013016569594242542, 'dropout': 0.5182110385232147, 'patience': 80, 'lr_reduce_freq': 110, 'spt_alg': 'prim', 'spt_attr': 'similarity', 'manifold': 'PoincareBall', 'num_layers': 3, 'num_adj': 8, 'add_rate': 0.3595866106783416, 'tem': 0.5722239548344359, 'consis_rate': 0.6511907078328973, 'use_att': 1}
mean: 0.8065
[0.8   0.818 0.791 0.789 0.821 0.811 0.803 0.822 0.814 0.796]
cur_param: {'lr': 0.008721119218070039, 'weight_decay': 0.0017935535517634698, 'dropout': 0.4062826516361927, 'patience': 80, 'lr_reduce_freq': 110, 'spt_alg': 'prim', 'spt_attr': 'similarity', 'manifold': 'PoincareBall', 'num_layers': 3, 'num_adj': 8, 'add_rate': 0.38194056067478344, 'tem': 0.49753520180563315, 'consis_rate': 0.6500613966559872, 'use_att': 1}[32m[I 2022-06-23 06:10:08,602][0m Trial 75 finished with value: 0.8009000000000001 and parameters: {'lr': 0.008721119218070039, 'weight_decay': 0.0017935535517634698, 'dropout': 0.4062826516361927, 'patience': 80, 'lr_reduce_freq': 110, 'spt_alg': 'prim', 'spt_attr': 'similarity', 'manifold': 'PoincareBall', 'num_layers': 3, 'num_adj': 8, 'add_rate': 0.38194056067478344, 'tem': 0.49753520180563315, 'consis_rate': 0.6500613966559872, 'use_att': 1}. Best is trial 59 with value: 0.8093.[0m
[32m[I 2022-06-23 07:01:07,028][0m Trial 76 finished with value: 0.8027000000000001 and parameters: {'lr': 0.00666508143433343, 'weight_decay': 0.002530742132242524, 'dropout': 0.4792757984096671, 'patience': 100, 'lr_reduce_freq': 110, 'spt_alg': 'prim', 'spt_attr': 'similarity', 'manifold': 'PoincareBall', 'num_layers': 3, 'num_adj': 8, 'add_rate': 0.36555763868753927, 'tem': 0.726576186622859, 'consis_rate': 0.6346211629675652, 'use_att': 1}. Best is trial 59 with value: 0.8093.[0m
[32m[I 2022-06-23 07:28:55,544][0m Trial 77 finished with value: 0.2877 and parameters: {'lr': 0.010456737500982133, 'weight_decay': 0.025906138464604076, 'dropout': 0.2893462848316758, 'patience': 80, 'lr_reduce_freq': 110, 'spt_alg': 'prim', 'spt_attr': 'similarity', 'manifold': 'PoincareBall', 'num_layers': 3, 'num_adj': 8, 'add_rate': 0.33624157707579155, 'tem': 0.31735130529096056, 'consis_rate': 0.3878421773740687, 'use_att': 1}. Best is trial 59 with value: 0.8093.[0m
[32m[I 2022-06-23 07:57:44,267][0m Trial 78 finished with value: 0.7917000000000001 and parameters: {'lr': 0.012205855844204805, 'weight_decay': 0.0031970735944417197, 'dropout': 0.5221100709014821, 'patience': 80, 'lr_reduce_freq': 90, 'spt_alg': 'prim', 'spt_attr': 'similarity', 'manifold': 'PoincareBall', 'num_layers': 3, 'num_adj': 6, 'add_rate': 0.3979748530996847, 'tem': 0.5502434103280149, 'consis_rate': 0.5326960225153485, 'use_att': 1}. Best is trial 59 with value: 0.8093.[0m
[32m[I 2022-06-23 08:35:58,337][0m Trial 79 finished with value: 0.7991000000000001 and parameters: {'lr': 0.007688761130801128, 'weight_decay': 0.0013945223742026051, 'dropout': 0.6286971410710239, 'patience': 80, 'lr_reduce_freq': 110, 'spt_alg': 'prim', 'spt_attr': 'similarity', 'manifold': 'PoincareBall', 'num_layers': 3, 'num_adj': 8, 'add_rate': 0.4856825776588931, 'tem': 0.4229211193916381, 'consis_rate': 0.7030645606708746, 'use_att': 1}. Best is trial 59 with value: 0.8093.[0m
[32m[I 2022-06-23 09:01:27,650][0m Trial 80 finished with value: 0.7337 and parameters: {'lr': 0.08102391338559753, 'weight_decay': 0.0008204651525042814, 'dropout': 0.5616607979501543, 'patience': 100, 'lr_reduce_freq': 110, 'spt_alg': 'kruskal', 'spt_attr': 'similarity', 'manifold': 'PoincareBall', 'num_layers': 3, 'num_adj': 8, 'add_rate': 0.2973351081716794, 'tem': 0.5793740582057271, 'consis_rate': 1.065217671917375, 'use_att': 1}. Best is trial 59 with value: 0.8093.[0m
[32m[I 2022-06-23 09:33:25,777][0m Trial 81 finished with value: 0.8029 and parameters: {'lr': 0.014441100012707023, 'weight_decay': 0.0011592737170604314, 'dropout': 0.5126359685558962, 'patience': 80, 'lr_reduce_freq': 110, 'spt_alg': 'prim', 'spt_attr': 'similarity', 'manifold': 'PoincareBall', 'num_layers': 3, 'num_adj': 8, 'add_rate': 0.4538894607779374, 'tem': 1.1669466824056107, 'consis_rate': 0.7648542925412227, 'use_att': 1}. Best is trial 59 with value: 0.8093.[0m
[32m[I 2022-06-23 10:12:25,097][0m Trial 82 finished with value: 0.7973000000000001 and parameters: {'lr': 0.009442446111864677, 'weight_decay': 0.0019271713159200769, 'dropout': 0.4699268994778621, 'patience': 80, 'lr_reduce_freq': 110, 'spt_alg': 'prim', 'spt_attr': 'similarity', 'manifold': 'PoincareBall', 'num_layers': 3, 'num_adj': 8, 'add_rate': 0.5114069876069269, 'tem': 1.072104235633518, 'consis_rate': 0.8355163819503749, 'use_att': 1}. Best is trial 59 with value: 0.8093.[0m
[32m[I 2022-06-23 10:42:07,202][0m Trial 83 finished with value: 0.7937000000000001 and parameters: {'lr': 0.014097372019285515, 'weight_decay': 0.0013139014395172842, 'dropout': 0.4279675378251752, 'patience': 80, 'lr_reduce_freq': 110, 'spt_alg': 'prim', 'spt_attr': 'similarity', 'manifold': 'PoincareBall', 'num_layers': 3, 'num_adj': 8, 'add_rate': 0.42799033648447177, 'tem': 0.6686120395924434, 'consis_rate': 0.9537428140726214, 'use_att': 1}. Best is trial 59 with value: 0.8093.[0m
[32m[I 2022-06-23 11:12:45,041][0m Trial 84 finished with value: 0.8074999999999999 and parameters: {'lr': 0.010468183065380181, 'weight_decay': 0.0009829636794570294, 'dropout': 0.5058965427165822, 'patience': 80, 'lr_reduce_freq': 90, 'spt_alg': 'prim', 'spt_attr': 'similarity', 'manifold': 'PoincareBall', 'num_layers': 3, 'num_adj': 8, 'add_rate': 0.39804764066253806, 'tem': 1.3283707642849585, 'consis_rate': 0.8469328608355264, 'use_att': 1}. Best is trial 59 with value: 0.8093.[0m
[32m[I 2022-06-23 11:37:15,094][0m Trial 85 finished with value: 0.3436 and parameters: {'lr': 0.006967246412573057, 'weight_decay': 0.009507610268890201, 'dropout': 0.5422955735835704, 'patience': 80, 'lr_reduce_freq': 90, 'spt_alg': 'prim', 'spt_attr': 'similarity', 'manifold': 'PoincareBall', 'num_layers': 3, 'num_adj': 8, 'add_rate': 0.3766646590890446, 'tem': 1.3021982023957543, 'consis_rate': 1.0189632394963013, 'use_att': 1}. Best is trial 59 with value: 0.8093.[0m
[32m[I 2022-06-23 11:47:50,148][0m Trial 86 finished with value: 0.7337999999999999 and parameters: {'lr': 0.010435845147482138, 'weight_decay': 0.0015517101559554686, 'dropout': 0.580954391857969, 'patience': 80, 'lr_reduce_freq': 90, 'spt_alg': 'prim', 'spt_attr': 'similarity', 'manifold': 'PoincareBall', 'num_layers': 4, 'num_adj': 6, 'add_rate': 0.35035237646952505, 'tem': 1.3773059533835816, 'consis_rate': 0.8746688270583025, 'use_att': 0}. Best is trial 59 with value: 0.8093.[0m
[32m[I 2022-06-23 12:15:46,793][0m Trial 87 finished with value: 0.2849 and parameters: {'lr': 0.008002425424497965, 'weight_decay': 0.03381637982808799, 'dropout': 0.3949095140417679, 'patience': 80, 'lr_reduce_freq': 90, 'spt_alg': 'prim', 'spt_attr': 'similarity', 'manifold': 'PoincareBall', 'num_layers': 3, 'num_adj': 8, 'add_rate': 0.4039242090352602, 'tem': 1.0301075411213887, 'consis_rate': 0.21135398253628024, 'use_att': 1}. Best is trial 59 with value: 0.8093.[0m
[32m[I 2022-06-23 12:52:42,533][0m Trial 88 finished with value: 0.8034000000000001 and parameters: {'lr': 0.006361761372846269, 'weight_decay': 0.0008220709409324016, 'dropout': 0.4391319874878082, 'patience': 80, 'lr_reduce_freq': 90, 'spt_alg': 'prim', 'spt_attr': 'similarity', 'manifold': 'PoincareBall', 'num_layers': 3, 'num_adj': 8, 'add_rate': 0.551877026681732, 'tem': 1.216051662219387, 'consis_rate': 0.6278802033312111, 'use_att': 1}. Best is trial 59 with value: 0.8093.[0m
[32m[I 2022-06-23 13:10:19,740][0m Trial 89 finished with value: 0.8009000000000001 and parameters: {'lr': 0.008352229082548443, 'weight_decay': 0.0006002762061933611, 'dropout': 0.33254722422067373, 'patience': 80, 'lr_reduce_freq': 70, 'spt_alg': 'prim', 'spt_attr': 'similarity', 'manifold': 'PoincareBall', 'num_layers': 3, 'num_adj': 4, 'add_rate': 0.42571579120148945, 'tem': 0.504849442522971, 'consis_rate': 0.9488424021545748, 'use_att': 1}. Best is trial 59 with value: 0.8093.[0m
[32m[I 2022-06-23 13:53:33,100][0m Trial 90 finished with value: 0.8015000000000001 and parameters: {'lr': 0.005538157481927824, 'weight_decay': 0.0011844149909259545, 'dropout': 0.6556360344524459, 'patience': 80, 'lr_reduce_freq': 130, 'spt_alg': 'prim', 'spt_attr': 'similarity', 'manifold': 'PoincareBall', 'num_layers': 3, 'num_adj': 8, 'add_rate': 0.32064839822406765, 'tem': 0.4423795318089129, 'consis_rate': 0.5633281566593784, 'use_att': 1}. Best is trial 59 with value: 0.8093.[0m
[32m[I 2022-06-23 14:24:19,779][0m Trial 91 finished with value: 0.7998000000000001 and parameters: {'lr': 0.012131165044088076, 'weight_decay': 0.0009714995609821532, 'dropout': 0.4576044460382433, 'patience': 80, 'lr_reduce_freq': 110, 'spt_alg': 'prim', 'spt_attr': 'similarity', 'manifold': 'PoincareBall', 'num_layers': 3, 'num_adj': 8, 'add_rate': 0.45469613693066646, 'tem': 1.1246842579338492, 'consis_rate': 0.8614201923608693, 'use_att': 1}. Best is trial 59 with value: 0.8093.[0m
[32m[I 2022-06-23 15:01:20,007][0m Trial 92 finished with value: 0.8037000000000001 and parameters: {'lr': 0.010038362988250607, 'weight_decay': 0.0010539171462615117, 'dropout': 0.4933312065299245, 'patience': 80, 'lr_reduce_freq': 110, 'spt_alg': 'prim', 'spt_attr': 'similarity', 'manifold': 'PoincareBall', 'num_layers': 3, 'num_adj': 8, 'add_rate': 0.4848541432501101, 'tem': 1.0791867852043602, 'consis_rate': 0.7815546840540936, 'use_att': 1}. Best is trial 59 with value: 0.8093.[0m
