[32m[I 2022-06-26 11:21:06,168][0m Trial 26 finished with value: 0.8168 and parameters: {'lr': 0.005094085179126481, 'weight_decay': 0.0005130640263944791, 'dropout': 0.7363712947145197, 'patience': 100, 'lr_reduce_freq': 80, 'spt_alg': 'kruskal', 'spt_attr': 'edge_degree', 'manifold': 'PoincareBall', 'num_layers': 3, 'dim': 272, 'num_adj': 6, 'add_rate': 0.3005550646266099, 'tem': 0.8350733101224185, 'consis_rate': 1.827084425989296, 'use_att': 1}. Best is trial 25 with value: 0.8219.[0m
[32m[I 2022-06-26 11:26:31,177][0m Trial 27 finished with value: 0.8149 and parameters: {'lr': 0.004887095188964356, 'weight_decay': 0.0003729792916569864, 'dropout': 0.6169973526406759, 'patience': 90, 'lr_reduce_freq': 80, 'spt_alg': 'kruskal', 'spt_attr': 'similarity', 'manifold': 'Hyperboloid', 'num_layers': 3, 'dim': 256, 'num_adj': 4, 'add_rate': 0.3802624131248299, 'tem': 0.8024190120811608, 'consis_rate': 1.7691377936014854, 'use_att': 0}. Best is trial 25 with value: 0.8219.[0m
[32m[I 2022-06-26 11:42:31,665][0m Trial 28 finished with value: 0.8201 and parameters: {'lr': 0.006982707946882627, 'weight_decay': 0.0005378864137964289, 'dropout': 0.6468270771286995, 'patience': 80, 'lr_reduce_freq': 80, 'spt_alg': 'kruskal', 'spt_attr': 'edge_degree', 'manifold': 'PoincareBall', 'num_layers': 3, 'dim': 220, 'num_adj': 6, 'add_rate': 0.5659419878897459, 'tem': 0.9919771862660176, 'consis_rate': 1.7071298371587522, 'use_att': 1}. Best is trial 25 with value: 0.8219.[0m
[32m[I 2022-06-26 11:44:20,836][0m Trial 29 finished with value: 0.8005000000000001 and parameters: {'lr': 0.007361488929161395, 'weight_decay': 0.000206214360671319, 'dropout': 0.6453243007249413, 'patience': 80, 'lr_reduce_freq': 110, 'spt_alg': 'kruskal', 'spt_attr': 'similarity', 'manifold': 'PoincareBall', 'num_layers': 3, 'dim': 220, 'num_adj': 2, 'add_rate': 0.5671043713371283, 'tem': 1.00211091513832, 'consis_rate': 1.7071638199415857, 'use_att': 0}. Best is trial 25 with value: 0.8219.[0m
[32m[I 2022-06-26 11:58:37,405][0m Trial 30 finished with value: 0.8156000000000001 and parameters: {'lr': 0.006872438864677426, 'weight_decay': 0.0005442679333156023, 'dropout': 0.6437351222581157, 'patience': 80, 'lr_reduce_freq': 100, 'spt_alg': 'kruskal', 'spt_attr': 'edge_degree', 'manifold': 'PoincareBall', 'num_layers': 3, 'dim': 224, 'num_adj': 6, 'add_rate': 0.36703770947206826, 'tem': 1.0868222360915916, 'consis_rate': 1.5689175512560694, 'use_att': 1}. Best is trial 25 with value: 0.8219.[0m
[32m[I 2022-06-26 12:14:14,761][0m Trial 31 finished with value: 0.8175000000000001 and parameters: {'lr': 0.008638963514594242, 'weight_decay': 0.0004582213723303998, 'dropout': 0.6658911718222377, 'patience': 80, 'lr_reduce_freq': 80, 'spt_alg': 'kruskal', 'spt_attr': 'edge_degree', 'manifold': 'PoincareBall', 'num_layers': 3, 'dim': 284, 'num_adj': 6, 'add_rate': 0.508306475525944, 'tem': 0.8331089312075927, 'consis_rate': 1.7109719272792383, 'use_att': 1}. Best is trial 25 with value: 0.8219.[0m
[32m[I 2022-06-26 12:33:24,981][0m Trial 32 finished with value: 0.8148 and parameters: {'lr': 0.0059972757645026025, 'weight_decay': 0.000536751981015009, 'dropout': 0.6333440224888648, 'patience': 90, 'lr_reduce_freq': 80, 'spt_alg': 'kruskal', 'spt_attr': 'edge_degree', 'manifold': 'PoincareBall', 'num_layers': 3, 'dim': 252, 'num_adj': 6, 'add_rate': 0.5614111528428642, 'tem': 0.9131249494664725, 'consis_rate': 1.7488412088860774, 'use_att': 1}. Best is trial 25 with value: 0.8219.[0m
[32m[I 2022-06-26 12:55:44,093][0m Trial 33 finished with value: 0.817 and parameters: {'lr': 0.006047303358594495, 'weight_decay': 0.0006842398763314294, 'dropout': 0.7031006869788217, 'patience': 100, 'lr_reduce_freq': 80, 'spt_alg': 'kruskal', 'spt_attr': 'edge_degree', 'manifold': 'PoincareBall', 'num_layers': 3, 'dim': 232, 'num_adj': 6, 'add_rate': 0.5890170902184412, 'tem': 1.1853230883379458, 'consis_rate': 1.6730821485597986, 'use_att': 1}. Best is trial 25 with value: 0.8219.[0m
[32m[I 2022-06-26 13:00:01,931][0m Trial 34 finished with value: 0.8094000000000001 and parameters: {'lr': 0.005314157237383533, 'weight_decay': 0.00048292661749182737, 'dropout': 0.5996621219928857, 'patience': 80, 'lr_reduce_freq': 80, 'spt_alg': 'kruskal', 'spt_attr': 'edge_degree', 'manifold': 'PoincareBall', 'num_layers': 3, 'dim': 272, 'num_adj': 6, 'add_rate': 0.5295994044621348, 'tem': 0.827166372589734, 'consis_rate': 1.9597688528753792, 'use_att': 0}. Best is trial 25 with value: 0.8219.[0m

mean: 0.8032
[0.814 0.82  0.79  0.792 0.797 0.818 0.816 0.811 0.776 0.798]
cur_param: {'lr': 0.006634809298656581, 'weight_decay': 0.0007166923760643061, 'dropout': 0.717936985438992, 'patience': 100, 'lr_reduce_freq': 90, 'spt_alg': 'kruskal', 'spt_attr': 'edge_degree', 'manifold': 'PoincareBall', 'num_layers': 3, 'dim': 320, 'num_adj': 4, 'add_rate': 0.4271327867851866, 'tem': 1.0912080479093162, 'consis_rate': 1.8055636235452914, 'use_att': 0}
mean: 0.8149
[0.807 0.811 0.811 0.816 0.807 0.826 0.822 0.82  0.821 0.808]
cur_param: {'lr': 0.004235549876505966, 'weight_decay': 0.00062312335362546, 'dropout': 0.6735083376909013, 'patience': 90, 'lr_reduce_freq': 80, 'spt_alg': 'kruskal', 'spt_attr': 'edge_degree', 'manifold': 'PoincareBall', 'num_layers': 3, 'dim': 284, 'num_adj': 6, 'add_rate': 0.5392767346403461, 'tem': 0.8480046854540185, 'consis_rate': 1.936045109525008, 'use_att': 1}
mean: 0.8192
[0.803 0.832 0.83  0.822 0.821 0.82  0.823 0.805 0.817 0.819]
cur_param: {'lr': 0.004404420206520782, 'weight_decay': 0.0005375711182455749, 'dropout': 0.7823294607563791, 'patience': 110, 'lr_reduce_freq': 80, 'spt_alg': 'kruskal', 'spt_attr': 'edge_degree', 'manifold': 'PoincareBall', 'num_layers': 3, 'dim': 244, 'num_adj': 6, 'add_rate': 0.5514500748697154, 'tem': 0.9232323407427854, 'consis_rate': 1.935361923229482, 'use_att': 1}
mean: 0.8168
[0.829 0.816 0.814 0.837 0.821 0.809 0.793 0.815 0.824 0.81 ]
cur_param: {'lr': 0.0029368957344845983, 'weight_decay': 0.000638328875585308, 'dropout': 0.671299036723133, 'patience': 90, 'lr_reduce_freq': 80, 'spt_alg': 'kruskal', 'spt_attr': 'edge_degree', 'manifold': 'PoincareBall', 'num_layers': 3, 'dim': 292, 'num_adj': 6, 'add_rate': 0.5369916346765876, 'tem': 0.8480997286129622, 'consis_rate': 1.9168269633858295, 'use_att': 1}
mean: 0.8144
[0.817 0.826 0.804 0.804 0.821 0.802 0.82  0.806 0.817 0.827]
cur_param: {'lr': 0.002127668488750603, 'weight_decay': 0.0006338021418471273, 'dropout': 0.7195668470154939, 'patience': 100, 'lr_reduce_freq': 90, 'spt_alg': 'kruskal', 'spt_attr': 'edge_degree', 'manifold': 'PoincareBall', 'num_layers': 3, 'dim': 324, 'num_adj': 6, 'add_rate': 0.48357759921432947, 'tem': 0.8529229240426562, 'consis_rate': 1.9522909309018428, 'use_att': 1}
mean: 0.8150000000000001
[0.808 0.817 0.826 0.809 0.823 0.827 0.792 0.806 0.822 0.82 ]
cur_param: {'lr': 0.004073822419415404, 'weight_decay': 0.0004558213742394424, 'dropout': 0.6199534606426683, 'patience': 90, 'lr_reduce_freq': 80, 'spt_alg': 'kruskal', 'spt_attr': 'edge_degree', 'manifold': 'PoincareBall', 'num_layers': 3, 'dim': 320, 'num_adj': 6, 'add_rate': 0.4448242289232488, 'tem': 0.9054616959338164, 'consis_rate': 1.8450619648217528, 'use_att': 1}
mean: 0.8167
[0.823 0.82  0.823 0.818 0.816 0.806 0.823 0.816 0.821 0.801]
cur_param: {'lr': 0.003338387452969463, 'weight_decay': 0.0007336626439351918, 'dropout': 0.6612464336022963, 'patience': 80, 'lr_reduce_freq': 90, 'spt_alg': 'kruskal', 'spt_attr': 'edge_degree', 'manifold': 'PoincareBall', 'num_layers': 3, 'dim': 296, 'num_adj': 4, 'add_rate': 0.5440847591620988, 'tem': 0.9626780371753108, 'consis_rate': 1.8892098650139058, 'use_att': 1}
mean: 0.817
[0.814 0.815 0.819 0.819 0.828 0.812 0.82  0.815 0.809 0.819]
cur_param: {'lr': 0.004958941782702637, 'weight_decay': 0.0005421978591618717, 'dropout': 0.6995507030196385, 'patience': 90, 'lr_reduce_freq': 80, 'spt_alg': 'kruskal', 'spt_attr': 'edge_degree', 'manifold': 'PoincareBall', 'num_layers': 3, 'dim': 280, 'num_adj': 6, 'add_rate': 0.37266333998562784, 'tem': 0.845880796174629, 'consis_rate': 1.8043617912211327, 'use_att': 1}
mean: 0.8219
[0.822 0.833 0.822 0.828 0.811 0.822 0.828 0.808 0.818 0.827]
cur_param: {'lr': 0.005094085179126481, 'weight_decay': 0.0005130640263944791, 'dropout': 0.7363712947145197, 'patience': 100, 'lr_reduce_freq': 80, 'spt_alg': 'kruskal', 'spt_attr': 'edge_degree', 'manifold': 'PoincareBall', 'num_layers': 3, 'dim': 272, 'num_adj': 6, 'add_rate': 0.3005550646266099, 'tem': 0.8350733101224185, 'consis_rate': 1.827084425989296, 'use_att': 1}
mean: 0.8168
[0.794 0.805 0.818 0.81  0.833 0.812 0.833 0.818 0.813 0.832]
cur_param: {'lr': 0.004887095188964356, 'weight_decay': 0.0003729792916569864, 'dropout': 0.6169973526406759, 'patience': 90, 'lr_reduce_freq': 80, 'spt_alg': 'kruskal', 'spt_attr': 'similarity', 'manifold': 'Hyperboloid', 'num_layers': 3, 'dim': 256, 'num_adj': 4, 'add_rate': 0.3802624131248299, 'tem': 0.8024190120811608, 'consis_rate': 1.7691377936014854, 'use_att': 0}
mean: 0.8149
[0.787 0.822 0.81  0.825 0.813 0.808 0.823 0.819 0.83  0.812]
cur_param: {'lr': 0.006982707946882627, 'weight_decay': 0.0005378864137964289, 'dropout': 0.6468270771286995, 'patience': 80, 'lr_reduce_freq': 80, 'spt_alg': 'kruskal', 'spt_attr': 'edge_degree', 'manifold': 'PoincareBall', 'num_layers': 3, 'dim': 220, 'num_adj': 6, 'add_rate': 0.5659419878897459, 'tem': 0.9919771862660176, 'consis_rate': 1.7071298371587522, 'use_att': 1}
mean: 0.8201
[0.826 0.81  0.827 0.831 0.809 0.832 0.812 0.812 0.821 0.821]
cur_param: {'lr': 0.007361488929161395, 'weight_decay': 0.000206214360671319, 'dropout': 0.6453243007249413, 'patience': 80, 'lr_reduce_freq': 110, 'spt_alg': 'kruskal', 'spt_attr': 'similarity', 'manifold': 'PoincareBall', 'num_layers': 3, 'dim': 220, 'num_adj': 2, 'add_rate': 0.5671043713371283, 'tem': 1.00211091513832, 'consis_rate': 1.7071638199415857, 'use_att': 0}
mean: 0.8005000000000001
[0.822 0.813 0.805 0.804 0.796 0.788 0.795 0.8   0.806 0.776]
cur_param: {'lr': 0.006872438864677426, 'weight_decay': 0.0005442679333156023, 'dropout': 0.6437351222581157, 'patience': 80, 'lr_reduce_freq': 100, 'spt_alg': 'kruskal', 'spt_attr': 'edge_degree', 'manifold': 'PoincareBall', 'num_layers': 3, 'dim': 224, 'num_adj': 6, 'add_rate': 0.36703770947206826, 'tem': 1.0868222360915916, 'consis_rate': 1.5689175512560694, 'use_att': 1}
mean: 0.8156000000000001
[0.809 0.822 0.809 0.826 0.815 0.821 0.812 0.802 0.816 0.824]
cur_param: {'lr': 0.008638963514594242, 'weight_decay': 0.0004582213723303998, 'dropout': 0.6658911718222377, 'patience': 80, 'lr_reduce_freq': 80, 'spt_alg': 'kruskal', 'spt_attr': 'edge_degree', 'manifold': 'PoincareBall', 'num_layers': 3, 'dim': 284, 'num_adj': 6, 'add_rate': 0.508306475525944, 'tem': 0.8331089312075927, 'consis_rate': 1.7109719272792383, 'use_att': 1}
mean: 0.8175000000000001
[0.817 0.823 0.812 0.824 0.83  0.813 0.816 0.81  0.804 0.826]
cur_param: {'lr': 0.0059972757645026025, 'weight_decay': 0.000536751981015009, 'dropout': 0.6333440224888648, 'patience': 90, 'lr_reduce_freq': 80, 'spt_alg': 'kruskal', 'spt_attr': 'edge_degree', 'manifold': 'PoincareBall', 'num_layers': 3, 'dim': 252, 'num_adj': 6, 'add_rate': 0.5614111528428642, 'tem': 0.9131249494664725, 'consis_rate': 1.7488412088860774, 'use_att': 1}
mean: 0.8148
[0.815 0.809 0.83  0.82  0.806 0.813 0.819 0.824 0.809 0.803]
cur_param: {'lr': 0.006047303358594495, 'weight_decay': 0.0006842398763314294, 'dropout': 0.7031006869788217, 'patience': 100, 'lr_reduce_freq': 80, 'spt_alg': 'kruskal', 'spt_attr': 'edge_degree', 'manifold': 'PoincareBall', 'num_layers': 3, 'dim': 232, 'num_adj': 6, 'add_rate': 0.5890170902184412, 'tem': 1.1853230883379458, 'consis_rate': 1.6730821485597986, 'use_att': 1}
mean: 0.817
[0.806 0.835 0.838 0.806 0.825 0.789 0.816 0.829 0.818 0.808]
cur_param: {'lr': 0.005314157237383533, 'weight_decay': 0.00048292661749182737, 'dropout': 0.5996621219928857, 'patience': 80, 'lr_reduce_freq': 80, 'spt_alg': 'kruskal', 'spt_attr': 'edge_degree', 'manifold': 'PoincareBall', 'num_layers': 3, 'dim': 272, 'num_adj': 6, 'add_rate': 0.5295994044621348, 'tem': 0.827166372589734, 'consis_rate': 1.9597688528753792, 'use_att': 0}
mean: 0.8094000000000001
[0.799 0.832 0.823 0.812 0.803 0.785 0.817 0.809 0.811 0.803]
cur_param: {'lr': 0.004485391341253225, 'weight_decay': 0.0003286730347031032, 'dropout': 0.67007687433088, 'patience': 110, 'lr_reduce_freq': 90, 'spt_alg': 'kruskal', 'spt_attr': 'edge_degree', 'manifold': 'Hyperboloid', 'num_layers': 3, 'dim': 288, 'num_adj': 6, 'add_rate': 0.4742624518308063, 'tem': 0.9307538223184075, 'consis_rate': 1.8962083428864664, 'use_att': 1}
mean: 0.8169000000000001[32m[I 2022-06-26 13:25:42,654][0m Trial 35 finished with value: 0.8169000000000001 and parameters: {'lr': 0.004485391341253225, 'weight_decay': 0.0003286730347031032, 'dropout': 0.67007687433088, 'patience': 110, 'lr_reduce_freq': 90, 'spt_alg': 'kruskal', 'spt_attr': 'edge_degree', 'manifold': 'Hyperboloid', 'num_layers': 3, 'dim': 288, 'num_adj': 6, 'add_rate': 0.4742624518308063, 'tem': 0.9307538223184075, 'consis_rate': 1.8962083428864664, 'use_att': 1}. Best is trial 25 with value: 0.8219.[0m
[32m[I 2022-06-26 13:45:10,692][0m Trial 36 finished with value: 0.8172 and parameters: {'lr': 0.007073453701428424, 'weight_decay': 0.0004323769740346818, 'dropout': 0.6827507573890262, 'patience': 100, 'lr_reduce_freq': 80, 'spt_alg': 'prim', 'spt_attr': 'edge_degree', 'manifold': 'PoincareBall', 'num_layers': 3, 'dim': 260, 'num_adj': 6, 'add_rate': 0.5017366593015421, 'tem': 1.0006406880408907, 'consis_rate': 1.7511155276539503, 'use_att': 1}. Best is trial 25 with value: 0.8219.[0m
[32m[I 2022-06-26 14:07:17,920][0m Trial 37 finished with value: 0.8141999999999999 and parameters: {'lr': 0.006103604202594668, 'weight_decay': 0.0006565278148748999, 'dropout': 0.6552389959253194, 'patience': 120, 'lr_reduce_freq': 90, 'spt_alg': 'kruskal', 'spt_attr': 'similarity', 'manifold': 'Hyperboloid', 'num_layers': 3, 'dim': 280, 'num_adj': 4, 'add_rate': 0.5754651247435667, 'tem': 0.9472874675465636, 'consis_rate': 1.6147550407194098, 'use_att': 1}. Best is trial 25 with value: 0.8219.[0m
[32m[I 2022-06-26 14:12:04,864][0m Trial 38 finished with value: 0.8150999999999999 and parameters: {'lr': 0.004808549851403571, 'weight_decay': 0.0006128114516923019, 'dropout': 0.6049359249897373, 'patience': 90, 'lr_reduce_freq': 80, 'spt_alg': 'prim', 'spt_attr': 'edge_degree', 'manifold': 'PoincareBall', 'num_layers': 3, 'dim': 208, 'num_adj': 6, 'add_rate': 0.5997800268767859, 'tem': 1.1526996708257062, 'consis_rate': 1.8207607989308816, 'use_att': 0}. Best is trial 25 with value: 0.8219.[0m
[32m[I 2022-06-26 14:27:45,246][0m Trial 39 finished with value: 0.8177 and parameters: {'lr': 0.008514081371373276, 'weight_decay': 0.0006972020877185267, 'dropout': 0.7416914505535936, 'patience': 80, 'lr_reduce_freq': 120, 'spt_alg': 'kruskal', 'spt_attr': 'edge_degree', 'manifold': 'Hyperboloid', 'num_layers': 3, 'dim': 272, 'num_adj': 4, 'add_rate': 0.5261940594142002, 'tem': 0.8619277050614957, 'consis_rate': 1.5442526627302868, 'use_att': 1}. Best is trial 25 with value: 0.8219.[0m
[32m[I 2022-06-26 14:49:05,744][0m Trial 40 finished with value: 0.8095000000000001 and parameters: {'lr': 0.008034220007153654, 'weight_decay': 0.0005497592012901994, 'dropout': 0.6255565179475461, 'patience': 90, 'lr_reduce_freq': 100, 'spt_alg': 'prim', 'spt_attr': 'similarity', 'manifold': 'PoincareBall', 'num_layers': 3, 'dim': 304, 'num_adj': 6, 'add_rate': 0.5526312340053479, 'tem': 0.8988648893338629, 'consis_rate': 1.6802028371995126, 'use_att': 1}. Best is trial 25 with value: 0.8219.[0m
[32m[I 2022-06-26 15:08:34,573][0m Trial 41 finished with value: 0.8164 and parameters: {'lr': 0.0031102144061019173, 'weight_decay': 0.0005945894752645241, 'dropout': 0.6939389785803495, 'patience': 90, 'lr_reduce_freq': 90, 'spt_alg': 'kruskal', 'spt_attr': 'edge_degree', 'manifold': 'PoincareBall', 'num_layers': 3, 'dim': 328, 'num_adj': 6, 'add_rate': 0.43477172340991227, 'tem': 0.8659973485244596, 'consis_rate': 1.9713904524965717, 'use_att': 1}. Best is trial 25 with value: 0.8219.[0m
[32m[I 2022-06-26 15:25:44,110][0m Trial 42 finished with value: 0.8183 and parameters: {'lr': 0.0040690015178503815, 'weight_decay': 0.0005142837681233751, 'dropout': 0.7211954431388254, 'patience': 90, 'lr_reduce_freq': 90, 'spt_alg': 'kruskal', 'spt_attr': 'edge_degree', 'manifold': 'PoincareBall', 'num_layers': 3, 'dim': 300, 'num_adj': 6, 'add_rate': 0.34106312997088495, 'tem': 0.8201629786747133, 'consis_rate': 1.8939603717115139, 'use_att': 1}. Best is trial 25 with value: 0.8219.[0m
[32m[I 2022-06-26 15:44:24,391][0m Trial 43 finished with value: 0.8207000000000001 and parameters: {'lr': 0.0038894202058760625, 'weight_decay': 0.000497182530881021, 'dropout': 0.7171990096591341, 'patience': 100, 'lr_reduce_freq': 80, 'spt_alg': 'kruskal', 'spt_attr': 'edge_degree', 'manifold': 'PoincareBall', 'num_layers': 3, 'dim': 280, 'num_adj': 6, 'add_rate': 0.3338779188274322, 'tem': 0.8231364976152491, 'consis_rate': 1.8727364210867243, 'use_att': 1}. Best is trial 25 with value: 0.8219.[0m
[32m[I 2022-06-26 16:01:26,186][0m Trial 44 finished with value: 0.8159000000000001 and parameters: {'lr': 0.005681795663853792, 'weight_decay': 0.00038292758640780076, 'dropout': 0.709233687960151, 'patience': 100, 'lr_reduce_freq': 80, 'spt_alg': 'kruskal', 'spt_attr': 'edge_degree', 'manifold': 'PoincareBall', 'num_layers': 3, 'dim': 264, 'num_adj': 6, 'add_rate': 0.30991544624292783, 'tem': 0.8427985307305903, 'consis_rate': 1.8660531739949773, 'use_att': 1}. Best is trial 25 with value: 0.8219.[0m
[32m[I 2022-06-26 16:22:06,019][0m Trial 45 finished with value: 0.8171999999999999 and parameters: {'lr': 0.003675944726094762, 'weight_decay': 0.00046617791380915066, 'dropout': 0.7629871013387994, 'patience': 110, 'lr_reduce_freq': 80, 'spt_alg': 'kruskal', 'spt_attr': 'edge_degree', 'manifold': 'PoincareBall', 'num_layers': 3, 'dim': 276, 'num_adj': 6, 'add_rate': 0.3399404745812811, 'tem': 0.8189332184075374, 'consis_rate': 1.7792371914174283, 'use_att': 1}. Best is trial 25 with value: 0.8219.[0m
[32m[I 2022-06-26 16:40:19,792][0m Trial 46 finished with value: 0.8153 and parameters: {'lr': 0.0025196872677674433, 'weight_decay': 0.0005013430561340331, 'dropout': 0.6796654766784347, 'patience': 80, 'lr_reduce_freq': 80, 'spt_alg': 'prim', 'spt_attr': 'edge_degree', 'manifold': 'PoincareBall', 'num_layers': 3, 'dim': 264, 'num_adj': 6, 'add_rate': 0.38808939549305965, 'tem': 0.8897671113210617, 'consis_rate': 1.8380150623154206, 'use_att': 1}. Best is trial 25 with value: 0.8219.[0m
[32m[I 2022-06-26 16:57:47,075][0m Trial 47 finished with value: 0.819 and parameters: {'lr': 0.004511103192900656, 'weight_decay': 0.0005592824339663683, 'dropout': 0.5776939859992972, 'patience': 100, 'lr_reduce_freq': 80, 'spt_alg': 'kruskal', 'spt_attr': 'edge_degree', 'manifold': 'PoincareBall', 'num_layers': 3, 'dim': 288, 'num_adj': 6, 'add_rate': 0.3212121469642993, 'tem': 0.8137761490786629, 'consis_rate': 1.8741214851256123, 'use_att': 1}. Best is trial 25 with value: 0.8219.[0m
[32m[I 2022-06-26 17:23:43,371][0m Trial 48 finished with value: 0.8117000000000001 and parameters: {'lr': 0.004063878877275627, 'weight_decay': 0.0007560305750905565, 'dropout': 0.7356039283339634, 'patience': 80, 'lr_reduce_freq': 80, 'spt_alg': 'kruskal', 'spt_attr': 'similarity', 'manifold': 'Hyperboloid', 'num_layers': 3, 'dim': 244, 'num_adj': 6, 'add_rate': 0.5759828590345835, 'tem': 1.025568009403007, 'consis_rate': 1.9822967544687722, 'use_att': 1}. Best is trial 25 with value: 0.8219.[0m
[32m[I 2022-06-26 17:27:47,892][0m Trial 49 finished with value: 0.8048 and parameters: {'lr': 0.0052288714906441585, 'weight_decay': 0.0004334596524845682, 'dropout': 0.6531682956703487, 'patience': 120, 'lr_reduce_freq': 110, 'spt_alg': 'kruskal', 'spt_attr': 'edge_degree', 'manifold': 'PoincareBall', 'num_layers': 3, 'dim': 312, 'num_adj': 4, 'add_rate': 0.3621999897406913, 'tem': 1.0588719836328553, 'consis_rate': 1.8018682124477012, 'use_att': 0}. Best is trial 25 with value: 0.8219.[0m
[32m[I 2022-06-26 17:36:43,646][0m Trial 50 finished with value: 0.8116 and parameters: {'lr': 0.006604125454575583, 'weight_decay': 0.0006207011112215497, 'dropout': 0.7747731208731788, 'patience': 80, 'lr_reduce_freq': 80, 'spt_alg': 'kruskal', 'spt_attr': 'edge_degree', 'manifold': 'PoincareBall', 'num_layers': 3, 'dim': 252, 'num_adj': 2, 'add_rate': 0.5144810074395008, 'tem': 0.9854349692717308, 'consis_rate': 1.9490565909102364, 'use_att': 1}. Best is trial 25 with value: 0.8219.[0m
[32m[I 2022-06-26 17:54:30,629][0m Trial 51 finished with value: 0.8179000000000001 and parameters: {'lr': 0.004637451923607638, 'weight_decay': 0.0005717839317728713, 'dropout': 0.5699790478376054, 'patience': 100, 'lr_reduce_freq': 80, 'spt_alg': 'kruskal', 'spt_attr': 'edge_degree', 'manifold': 'PoincareBall', 'num_layers': 3, 'dim': 288, 'num_adj': 6, 'add_rate': 0.32312120421219664, 'tem': 0.8155167861018651, 'consis_rate': 1.9074255271481602, 'use_att': 1}. Best is trial 25 with value: 0.8219.[0m
