[32m[I 2022-06-30 18:36:08,826][0m Trial 148 finished with value: 0.3178 and parameters: {'lr': 0.015338795860100698, 'weight_decay': 0.01014275851055022, 'dropout': 0.6879709985554427, 'patience': 90, 'lr_reduce_freq': 50, 'spt_alg': 'prim', 'spt_attr': 'similarity', 'manifold': 'PoincareBall', 'num_layers': 3, 'dim': 400, 'num_adj': 2, 'add_rate': 0.8146617807816234, 'tem': 1.4966277980038984, 'consis_rate': 0.2053146434467381, 'use_att': 0}. Best is trial 120 with value: 0.8225999999999999.[0m

mean: 0.319
[0.319 0.319 0.319 0.319 0.319 0.319 0.319 0.319 0.319 0.319]
cur_param: {'lr': 0.05202332403557525, 'weight_decay': 0.006466676157423702, 'dropout': 0.7190919821453483, 'patience': 90, 'lr_reduce_freq': 40, 'spt_alg': 'prim', 'spt_attr': 'similarity', 'manifold': 'PoincareBall', 'num_layers': 3, 'dim': 432, 'num_adj': 2, 'add_rate': 0.6072035497552744, 'tem': 1.0070751265810507, 'consis_rate': 1.249160639453325, 'use_att': 1}
mean: 0.8119999999999999
[0.814 0.818 0.815 0.817 0.803 0.796 0.8   0.826 0.823 0.808]
cur_param: {'lr': 0.019159346614457968, 'weight_decay': 0.011144786909069764, 'dropout': 0.7305262986551162, 'patience': 90, 'lr_reduce_freq': 40, 'spt_alg': 'prim', 'spt_attr': 'similarity', 'manifold': 'PoincareBall', 'num_layers': 3, 'dim': 400, 'num_adj': 2, 'add_rate': 0.7277694948549212, 'tem': 1.1924513229182676, 'consis_rate': 1.1108426082721923, 'use_att': 1}
mean: 0.32849999999999996
[0.318 0.321 0.322 0.35  0.319 0.319 0.37  0.323 0.319 0.324]
cur_param: {'lr': 0.021902455859975967, 'weight_decay': 0.007179834810188918, 'dropout': 0.7627904453382913, 'patience': 90, 'lr_reduce_freq': 50, 'spt_alg': 'prim', 'spt_attr': 'similarity', 'manifold': 'PoincareBall', 'num_layers': 3, 'dim': 384, 'num_adj': 2, 'add_rate': 0.8597116390825718, 'tem': 1.0706888686445348, 'consis_rate': 0.4725794581214694, 'use_att': 1}
mean: 0.8205
[0.828 0.815 0.835 0.811 0.82  0.822 0.821 0.825 0.803 0.825]
cur_param: {'lr': 0.022370801425328754, 'weight_decay': 0.009006135491442132, 'dropout': 0.779013065196834, 'patience': 90, 'lr_reduce_freq': 50, 'spt_alg': 'prim', 'spt_attr': 'similarity', 'manifold': 'PoincareBall', 'num_layers': 3, 'dim': 368, 'num_adj': 2, 'add_rate': 0.864479395404698, 'tem': 1.0525828919053575, 'consis_rate': 0.3730363263599689, 'use_att': 1}
mean: 0.8209
[0.829 0.816 0.83  0.813 0.827 0.828 0.809 0.819 0.827 0.811]
cur_param: {'lr': 0.022324099614814095, 'weight_decay': 0.008939675822846188, 'dropout': 0.7790805868401325, 'patience': 90, 'lr_reduce_freq': 50, 'spt_alg': 'prim', 'spt_attr': 'similarity', 'manifold': 'PoincareBall', 'num_layers': 3, 'dim': 368, 'num_adj': 2, 'add_rate': 0.8561488558656735, 'tem': 1.00179443717637, 'consis_rate': 0.4174573619804638, 'use_att': 1}
mean: 0.7688999999999999
[0.82  0.823 0.334 0.819 0.822 0.818 0.806 0.82  0.808 0.819]
cur_param: {'lr': 0.028142711253558477, 'weight_decay': 0.0074470956027864205, 'dropout': 0.7725364341133487, 'patience': 90, 'lr_reduce_freq': 60, 'spt_alg': 'prim', 'spt_attr': 'similarity', 'manifold': 'PoincareBall', 'num_layers': 3, 'dim': 352, 'num_adj': 2, 'add_rate': 0.8650542795053188, 'tem': 1.0844062302760897, 'consis_rate': 0.3498109197452892, 'use_att': 1}
mean: 0.8149000000000001
[0.793 0.817 0.823 0.81  0.824 0.809 0.818 0.813 0.823 0.819]
cur_param: {'lr': 0.024097471939994446, 'weight_decay': 0.010340989425717607, 'dropout': 0.7408585092005442, 'patience': 90, 'lr_reduce_freq': 50, 'spt_alg': 'prim', 'spt_attr': 'similarity', 'manifold': 'PoincareBall', 'num_layers': 3, 'dim': 384, 'num_adj': 2, 'add_rate': 0.8292794196462024, 'tem': 1.0588937793056954, 'consis_rate': 0.5184319216480335, 'use_att': 1}
mean: 0.6194
[0.812 0.319 0.817 0.319 0.828 0.319 0.319 0.823 0.828 0.81 ]
cur_param: {'lr': 0.020764775940047456, 'weight_decay': 0.008426142937291884, 'dropout': 0.7660889073639634, 'patience': 90, 'lr_reduce_freq': 50, 'spt_alg': 'prim', 'spt_attr': 'similarity', 'manifold': 'PoincareBall', 'num_layers': 3, 'dim': 384, 'num_adj': 2, 'add_rate': 0.8870050076180626, 'tem': 1.4991007523047486, 'consis_rate': 0.43826756751616225, 'use_att': 1}
mean: 0.8204
[0.827 0.811 0.828 0.825 0.83  0.823 0.802 0.814 0.828 0.816]
cur_param: {'lr': 0.020886646980603316, 'weight_decay': 0.01140304530535557, 'dropout': 0.7859183769108735, 'patience': 90, 'lr_reduce_freq': 60, 'spt_alg': 'prim', 'spt_attr': 'similarity', 'manifold': 'PoincareBall', 'num_layers': 3, 'dim': 384, 'num_adj': 2, 'add_rate': 0.8874594602882192, 'tem': 1.4422034542404625, 'consis_rate': 0.30162827548011406, 'use_att': 1}
mean: 0.3217
[0.332 0.319 0.319 0.319 0.319 0.319 0.319 0.333 0.319 0.319]
cur_param: {'lr': 0.03180369517900535, 'weight_decay': 0.01312946472272529, 'dropout': 0.763825204551153, 'patience': 90, 'lr_reduce_freq': 50, 'spt_alg': 'prim', 'spt_attr': 'similarity', 'manifold': 'PoincareBall', 'num_layers': 3, 'dim': 368, 'num_adj': 2, 'add_rate': 0.8968446163551931, 'tem': 1.4877555624655172, 'consis_rate': 0.4715372533015479, 'use_att': 1}
mean: 0.6436999999999999
[0.837 0.81  0.822 0.326 0.812 0.39  0.36  0.82  0.818 0.442]
cur_param: {'lr': 0.018268990994902527, 'weight_decay': 0.008504474903158442, 'dropout': 0.7511348372703511, 'patience': 90, 'lr_reduce_freq': 50, 'spt_alg': 'prim', 'spt_attr': 'similarity', 'manifold': 'PoincareBall', 'num_layers': 3, 'dim': 384, 'num_adj': 2, 'add_rate': 0.8443912433680506, 'tem': 1.46203983450938, 'consis_rate': 0.2722255507947337, 'use_att': 1}
mean: 0.7218
[0.831 0.319 0.823 0.828 0.829 0.34  0.807 0.823 0.819 0.799]
cur_param: {'lr': 0.023604866314756424, 'weight_decay': 0.009419092394715296, 'dropout': 0.7012352428868149, 'patience': 90, 'lr_reduce_freq': 50, 'spt_alg': 'prim', 'spt_attr': 'similarity', 'manifold': 'PoincareBall', 'num_layers': 3, 'dim': 320, 'num_adj': 2, 'add_rate': 0.874708131412674, 'tem': 1.0690195792564332, 'consis_rate': 0.37529688119116833, 'use_att': 1}
mean: 0.7191
[0.319 0.823 0.817 0.818 0.803 0.319 0.815 0.812 0.827 0.838]
cur_param: {'lr': 0.026969840105723713, 'weight_decay': 0.00720059062944078, 'dropout': 0.7709557202538021, 'patience': 90, 'lr_reduce_freq': 60, 'spt_alg': 'prim', 'spt_attr': 'similarity', 'manifold': 'PoincareBall', 'num_layers': 3, 'dim': 336, 'num_adj': 2, 'add_rate': 0.8168008986388655, 'tem': 1.13400561115937, 'consis_rate': 0.4485159525423358, 'use_att': 1}
mean: 0.8149999999999998
[0.818 0.826 0.809 0.817 0.811 0.827 0.809 0.82  0.813 0.8  ]
cur_param: {'lr': 0.020924836173533155, 'weight_decay': 0.005766058804796959, 'dropout': 0.7239260382199684, 'patience': 90, 'lr_reduce_freq': 70, 'spt_alg': 'prim', 'spt_attr': 'similarity', 'manifold': 'PoincareBall', 'num_layers': 3, 'dim': 416, 'num_adj': 2, 'add_rate': 0.8649835757566825, 'tem': 1.0159488800127985, 'consis_rate': 0.5759587375836066, 'use_att': 1}
mean: 0.8137000000000001
[0.822 0.809 0.82  0.808 0.822 0.815 0.814 0.816 0.809 0.802]
cur_param: {'lr': 0.0182496404396437, 'weight_decay': 0.008012292722490948, 'dropout': 0.737446328796516, 'patience': 90, 'lr_reduce_freq': 50, 'spt_alg': 'prim', 'spt_attr': 'similarity', 'manifold': 'PoincareBall', 'num_layers': 3, 'dim': 448, 'num_adj': 2, 'add_rate': 0.8350174121963702, 'tem': 1.0506397299971892, 'consis_rate': 0.4850222715153358, 'use_att': 1}
mean: 0.8122999999999999
[0.81  0.808 0.814 0.812 0.813 0.822 0.817 0.81  0.807 0.81 ]
cur_param: {'lr': 0.03756498703614161, 'weight_decay': 0.0070238745745844905, 'dropout': 0.7822006518691271, 'patience': 90, 'lr_reduce_freq': 80, 'spt_alg': 'prim', 'spt_attr': 'similarity', 'manifold': 'PoincareBall', 'num_layers': 3, 'dim': 480, 'num_adj': 2, 'add_rate': 0.662471842183777, 'tem': 0.9823025703443504, 'consis_rate': 0.41609806553471845, 'use_att': 1}
mean: 0.8126
[0.82  0.821 0.809 0.811 0.788 0.828 0.819 0.817 0.818 0.795]
cur_param: {'lr': 0.024642651165394998, 'weight_decay': 0.0054694467666940895, 'dropout': 0.7602000370509115, 'patience': 90, 'lr_reduce_freq': 50, 'spt_alg': 'prim', 'spt_attr': 'similarity', 'manifold': 'PoincareBall', 'num_layers': 3, 'dim': 368, 'num_adj': 2, 'add_rate': 0.6227256617610318, 'tem': 1.38186975550227, 'consis_rate': 0.5358739649578714, 'use_att': 1}
mean: 0.8173
[0.821 0.806 0.823 0.819 0.793 0.833 0.816 0.826 0.819 0.817]
cur_param: {'lr': 0.015338795860100698, 'weight_decay': 0.01014275851055022, 'dropout': 0.6879709985554427, 'patience': 90, 'lr_reduce_freq': 50, 'spt_alg': 'prim', 'spt_attr': 'similarity', 'manifold': 'PoincareBall', 'num_layers': 3, 'dim': 400, 'num_adj': 2, 'add_rate': 0.8146617807816234, 'tem': 1.4966277980038984, 'consis_rate': 0.2053146434467381, 'use_att': 0}
mean: 0.3178
[0.32  0.317 0.317 0.319 0.319 0.316 0.319 0.319 0.319 0.313]
cur_param: {'lr': 0.03319333917433566, 'weight_decay': 0.005982918484763844, 'dropout': 0.7130182122745148, 'patience': 100, 'lr_reduce_freq': 40, 'spt_alg': 'prim', 'spt_attr': 'similarity', 'manifold': 'PoincareBall', 'num_layers': 3, 'dim': 448, 'num_adj': 2, 'add_rate': 0.8879753002079356, 'tem': 1.1025011908842877, 'consis_rate': 0.3217026058966797, 'use_att': 1}[32m[I 2022-06-30 18:46:30,525][0m Trial 149 finished with value: 0.8132999999999999 and parameters: {'lr': 0.03319333917433566, 'weight_decay': 0.005982918484763844, 'dropout': 0.7130182122745148, 'patience': 100, 'lr_reduce_freq': 40, 'spt_alg': 'prim', 'spt_attr': 'similarity', 'manifold': 'PoincareBall', 'num_layers': 3, 'dim': 448, 'num_adj': 2, 'add_rate': 0.8879753002079356, 'tem': 1.1025011908842877, 'consis_rate': 0.3217026058966797, 'use_att': 1}. Best is trial 120 with value: 0.8225999999999999.[0m

mean: 0.8132999999999999
[0.802 0.819 0.817 0.8   0.82  0.803 0.818 0.819 0.812 0.823]
best param:--lr 0.02990095005649478 --weight_decay 0.009651366360400586 --dropout 0.7008146407378063 --patience 90 --lr_reduce_freq 40 --spt_alg kruskal --spt_attr similarity --manifold PoincareBall --num_layers 3 --dim 416 --num_adj 2 --add_rate 0.8829912018019117 --tem 1.0427956280652317 --consis_rate 0.6580238961292373 --use_att 1 
best score:0.8225999999999999

Final results: 
0.8225999999999999
