[32m[I 2022-06-30 08:25:51,586][0m Trial 127 finished with value: 0.8061 and parameters: {'lr': 0.0037187910512461618, 'weight_decay': 0.0007810109873737878, 'dropout': 0.47055229837252116, 'patience': 80, 'lr_reduce_freq': 130, 'spt_alg': 'prim', 'spt_attr': 'similarity', 'manifold': 'PoincareBall', 'num_layers': 3, 'dim': 320, 'num_adj': 2, 'add_rate': 0.6954581778583074, 'tem': 1.2946434954880766, 'consis_rate': 1.6773218388739102, 'use_att': 1}. Best is trial 83 with value: 0.8199.[0m

mean: 0.8153
[0.813 0.805 0.816 0.816 0.828 0.824 0.806 0.826 0.798 0.821]
cur_param: {'lr': 0.0030480636053592572, 'weight_decay': 0.0008943818861761815, 'dropout': 0.627808801174265, 'patience': 80, 'lr_reduce_freq': 140, 'spt_alg': 'prim', 'spt_attr': 'similarity', 'manifold': 'PoincareBall', 'num_layers': 3, 'dim': 176, 'num_adj': 2, 'add_rate': 0.7904052782904873, 'tem': 1.3334683653264936, 'consis_rate': 1.8120459764331804, 'use_att': 1}
mean: 0.8119
[0.807 0.83  0.814 0.82  0.82  0.803 0.81  0.805 0.789 0.821]
cur_param: {'lr': 0.0008675899864285086, 'weight_decay': 0.0006999069705280885, 'dropout': 0.612225321915074, 'patience': 80, 'lr_reduce_freq': 130, 'spt_alg': 'prim', 'spt_attr': 'similarity', 'manifold': 'PoincareBall', 'num_layers': 3, 'dim': 192, 'num_adj': 2, 'add_rate': 0.8375874924330844, 'tem': 1.3640553838876897, 'consis_rate': 1.6930955299184203, 'use_att': 1}
mean: 0.8142000000000001
[0.819 0.821 0.805 0.837 0.813 0.812 0.815 0.808 0.807 0.805]
cur_param: {'lr': 0.0019809259883079703, 'weight_decay': 0.0007798769309708406, 'dropout': 0.5631942745524334, 'patience': 80, 'lr_reduce_freq': 140, 'spt_alg': 'prim', 'spt_attr': 'similarity', 'manifold': 'PoincareBall', 'num_layers': 3, 'dim': 128, 'num_adj': 2, 'add_rate': 0.634330464054384, 'tem': 1.41473801498803, 'consis_rate': 1.538418592906849, 'use_att': 1}
mean: 0.818
[0.831 0.805 0.826 0.821 0.822 0.807 0.805 0.82  0.817 0.826]
cur_param: {'lr': 0.002264594225652485, 'weight_decay': 0.025382416182142268, 'dropout': 0.5582904608134621, 'patience': 80, 'lr_reduce_freq': 130, 'spt_alg': 'prim', 'spt_attr': 'similarity', 'manifold': 'PoincareBall', 'num_layers': 3, 'dim': 272, 'num_adj': 2, 'add_rate': 0.6996769749493192, 'tem': 1.4453460587130182, 'consis_rate': 1.4856775135131257, 'use_att': 1}
mean: 0.2622
[0.239 0.319 0.225 0.319 0.319 0.319 0.149 0.265 0.319 0.149]
cur_param: {'lr': 0.0011842426445878454, 'weight_decay': 0.0011025002673902243, 'dropout': 0.5365764743715163, 'patience': 80, 'lr_reduce_freq': 150, 'spt_alg': 'prim', 'spt_attr': 'similarity', 'manifold': 'PoincareBall', 'num_layers': 3, 'dim': 128, 'num_adj': 2, 'add_rate': 0.6384311598770376, 'tem': 1.4147679492420902, 'consis_rate': 1.5445830776924687, 'use_att': 1}
mean: 0.8149
[0.815 0.808 0.818 0.824 0.826 0.811 0.803 0.82  0.804 0.82 ]
cur_param: {'lr': 0.0014598387854950835, 'weight_decay': 0.0005894054764343458, 'dropout': 0.5101490073296037, 'patience': 80, 'lr_reduce_freq': 120, 'spt_alg': 'prim', 'spt_attr': 'similarity', 'manifold': 'PoincareBall', 'num_layers': 3, 'dim': 144, 'num_adj': 2, 'add_rate': 0.6043553707722812, 'tem': 1.481980518463695, 'consis_rate': 1.6196229943829739, 'use_att': 1}
mean: 0.8129
[0.804 0.814 0.819 0.815 0.822 0.819 0.806 0.802 0.815 0.813]
cur_param: {'lr': 0.0017911438482699712, 'weight_decay': 0.0007526322046956334, 'dropout': 0.48322845369908707, 'patience': 70, 'lr_reduce_freq': 130, 'spt_alg': 'prim', 'spt_attr': 'similarity', 'manifold': 'PoincareBall', 'num_layers': 4, 'dim': 144, 'num_adj': 2, 'add_rate': 0.6250403057955444, 'tem': 1.1974292175689107, 'consis_rate': 0.24295585439170442, 'use_att': 1}
mean: 0.7797000000000001
[0.792 0.761 0.792 0.804 0.78  0.747 0.77  0.774 0.79  0.787]
cur_param: {'lr': 0.0024314551527248327, 'weight_decay': 0.007510936351681013, 'dropout': 0.566918426448446, 'patience': 80, 'lr_reduce_freq': 140, 'spt_alg': 'prim', 'spt_attr': 'similarity', 'manifold': 'PoincareBall', 'num_layers': 3, 'dim': 480, 'num_adj': 2, 'add_rate': 0.7367539880000619, 'tem': 1.2872670941135103, 'consis_rate': 1.4389683911064692, 'use_att': 1}
mean: 0.3614
[0.491 0.31  0.396 0.319 0.332 0.319 0.369 0.322 0.437 0.319]
cur_param: {'lr': 0.003033911682983132, 'weight_decay': 0.0006576217526409041, 'dropout': 0.5303529522537406, 'patience': 80, 'lr_reduce_freq': 150, 'spt_alg': 'prim', 'spt_attr': 'similarity', 'manifold': 'PoincareBall', 'num_layers': 3, 'dim': 256, 'num_adj': 2, 'add_rate': 0.7596777623357462, 'tem': 1.2576527795723922, 'consis_rate': 1.9270456957207251, 'use_att': 1}
mean: 0.8131
[0.792 0.818 0.806 0.814 0.823 0.825 0.8   0.815 0.819 0.819]
cur_param: {'lr': 0.008441418621054296, 'weight_decay': 0.0005464566361572787, 'dropout': 0.5485530820951579, 'patience': 80, 'lr_reduce_freq': 110, 'spt_alg': 'prim', 'spt_attr': 'similarity', 'manifold': 'PoincareBall', 'num_layers': 3, 'dim': 128, 'num_adj': 2, 'add_rate': 0.7159773283128416, 'tem': 1.3855015238395716, 'consis_rate': 1.7533661567355951, 'use_att': 1}
mean: 0.8109999999999999
[0.806 0.81  0.809 0.823 0.813 0.809 0.807 0.82  0.806 0.807]
cur_param: {'lr': 0.002030807417864914, 'weight_decay': 0.000957105900558754, 'dropout': 0.6100087834693706, 'patience': 80, 'lr_reduce_freq': 140, 'spt_alg': 'prim', 'spt_attr': 'similarity', 'manifold': 'PoincareBall', 'num_layers': 3, 'dim': 208, 'num_adj': 2, 'add_rate': 0.8545796127665714, 'tem': 1.3137875051355972, 'consis_rate': 1.6696496387461566, 'use_att': 1}
mean: 0.8161999999999999
[0.826 0.809 0.821 0.828 0.82  0.804 0.822 0.804 0.819 0.809]
cur_param: {'lr': 0.0020574228497141096, 'weight_decay': 0.0007905902421570121, 'dropout': 0.5854730006818761, 'patience': 80, 'lr_reduce_freq': 140, 'spt_alg': 'prim', 'spt_attr': 'similarity', 'manifold': 'PoincareBall', 'num_layers': 3, 'dim': 208, 'num_adj': 2, 'add_rate': 0.8540295431455124, 'tem': 1.3987724842753808, 'consis_rate': 1.6507061554519584, 'use_att': 1}
mean: 0.8160999999999999
[0.823 0.809 0.82  0.814 0.827 0.821 0.823 0.817 0.8   0.807]
cur_param: {'lr': 0.0016320111562162227, 'weight_decay': 0.0009822108267223942, 'dropout': 0.5968066462920344, 'patience': 80, 'lr_reduce_freq': 130, 'spt_alg': 'prim', 'spt_attr': 'similarity', 'manifold': 'PoincareBall', 'num_layers': 3, 'dim': 240, 'num_adj': 2, 'add_rate': 0.8230308019896592, 'tem': 1.314266551882362, 'consis_rate': 1.572371062580646, 'use_att': 1}
mean: 0.8119999999999999
[0.825 0.827 0.791 0.814 0.806 0.815 0.816 0.809 0.8   0.817]
cur_param: {'lr': 0.004240558623768205, 'weight_decay': 0.0006058756764177532, 'dropout': 0.6255599271596102, 'patience': 80, 'lr_reduce_freq': 140, 'spt_alg': 'prim', 'spt_attr': 'similarity', 'manifold': 'PoincareBall', 'num_layers': 3, 'dim': 224, 'num_adj': 2, 'add_rate': 0.803520915463523, 'tem': 1.243495409126654, 'consis_rate': 1.7791075018881999, 'use_att': 1}
mean: 0.8136000000000001
[0.825 0.817 0.808 0.82  0.807 0.829 0.812 0.806 0.8   0.812]
cur_param: {'lr': 0.005046556959176651, 'weight_decay': 0.0007032993450034104, 'dropout': 0.567051913556975, 'patience': 80, 'lr_reduce_freq': 150, 'spt_alg': 'prim', 'spt_attr': 'similarity', 'manifold': 'PoincareBall', 'num_layers': 3, 'dim': 352, 'num_adj': 2, 'add_rate': 0.7772355791106208, 'tem': 1.4481768455502795, 'consis_rate': 1.9806858209154163, 'use_att': 1}
mean: 0.8128
[0.818 0.802 0.816 0.814 0.808 0.818 0.815 0.816 0.817 0.804]
cur_param: {'lr': 0.0013624581963533819, 'weight_decay': 0.0012016414991997046, 'dropout': 0.5138758267322826, 'patience': 80, 'lr_reduce_freq': 140, 'spt_alg': 'prim', 'spt_attr': 'similarity', 'manifold': 'PoincareBall', 'num_layers': 5, 'dim': 480, 'num_adj': 2, 'add_rate': 0.8631740102933697, 'tem': 1.333822005021725, 'consis_rate': 1.6252467366908347, 'use_att': 1}
mean: 0.7547
[0.766 0.73  0.743 0.765 0.723 0.741 0.759 0.77  0.764 0.786]
cur_param: {'lr': 0.0037187910512461618, 'weight_decay': 0.0007810109873737878, 'dropout': 0.47055229837252116, 'patience': 80, 'lr_reduce_freq': 130, 'spt_alg': 'prim', 'spt_attr': 'similarity', 'manifold': 'PoincareBall', 'num_layers': 3, 'dim': 320, 'num_adj': 2, 'add_rate': 0.6954581778583074, 'tem': 1.2946434954880766, 'consis_rate': 1.6773218388739102, 'use_att': 1}
mean: 0.8061
[0.807 0.804 0.809 0.81  0.809 0.806 0.796 0.805 0.805 0.81 ]
cur_param: {'lr': 0.0023911406863975962, 'weight_decay': 0.0005073918732293882, 'dropout': 0.4886577077350633, 'patience': 80, 'lr_reduce_freq': 120, 'spt_alg': 'prim', 'spt_attr': 'similarity', 'manifold': 'PoincareBall', 'num_layers': 3, 'dim': 496, 'num_adj': 2, 'add_rate': 0.5730484310861012, 'tem': 1.2662650527806567, 'consis_rate': 1.5107923117033397, 'use_att': 1}
mean: 0.8168
[0.814 0.813 0.822 0.818 0.811 0.83  0.818 0.812 0.828 0.802][32m[I 2022-06-30 08:35:51,685][0m Trial 128 finished with value: 0.8168 and parameters: {'lr': 0.0023911406863975962, 'weight_decay': 0.0005073918732293882, 'dropout': 0.4886577077350633, 'patience': 80, 'lr_reduce_freq': 120, 'spt_alg': 'prim', 'spt_attr': 'similarity', 'manifold': 'PoincareBall', 'num_layers': 3, 'dim': 496, 'num_adj': 2, 'add_rate': 0.5730484310861012, 'tem': 1.2662650527806567, 'consis_rate': 1.5107923117033397, 'use_att': 1}. Best is trial 83 with value: 0.8199.[0m
[32m[I 2022-06-30 08:51:15,570][0m Trial 129 finished with value: 0.8085000000000001 and parameters: {'lr': 0.002446282208997442, 'weight_decay': 0.0005438035704313008, 'dropout': 0.4164274776339579, 'patience': 90, 'lr_reduce_freq': 120, 'spt_alg': 'prim', 'spt_attr': 'similarity', 'manifold': 'PoincareBall', 'num_layers': 3, 'dim': 496, 'num_adj': 4, 'add_rate': 0.5902282437059126, 'tem': 1.223822480943212, 'consis_rate': 0.48430288790986387, 'use_att': 1}. Best is trial 83 with value: 0.8199.[0m
[32m[I 2022-06-30 09:00:13,034][0m Trial 130 finished with value: 0.8090999999999999 and parameters: {'lr': 0.00281028380621053, 'weight_decay': 0.0005100292386383217, 'dropout': 0.13846940372583622, 'patience': 80, 'lr_reduce_freq': 120, 'spt_alg': 'prim', 'spt_attr': 'similarity', 'manifold': 'PoincareBall', 'num_layers': 3, 'dim': 496, 'num_adj': 2, 'add_rate': 0.6383748349734559, 'tem': 1.1611554416821326, 'consis_rate': 1.5041531834557302, 'use_att': 1}. Best is trial 83 with value: 0.8199.[0m
[32m[I 2022-06-30 09:10:11,466][0m Trial 131 finished with value: 0.8160000000000001 and parameters: {'lr': 0.001890460298414694, 'weight_decay': 0.000635664704318449, 'dropout': 0.49338987558181663, 'patience': 80, 'lr_reduce_freq': 130, 'spt_alg': 'prim', 'spt_attr': 'similarity', 'manifold': 'PoincareBall', 'num_layers': 3, 'dim': 512, 'num_adj': 2, 'add_rate': 0.5613083195360259, 'tem': 1.265928860441394, 'consis_rate': 1.5350993773945283, 'use_att': 1}. Best is trial 83 with value: 0.8199.[0m
[32m[I 2022-06-30 09:22:49,672][0m Trial 132 finished with value: 0.8124 and parameters: {'lr': 0.00220132741627219, 'weight_decay': 0.000687124209222917, 'dropout': 0.5435532229376254, 'patience': 80, 'lr_reduce_freq': 140, 'spt_alg': 'prim', 'spt_attr': 'similarity', 'manifold': 'PoincareBall', 'num_layers': 3, 'dim': 208, 'num_adj': 2, 'add_rate': 0.664369929993757, 'tem': 1.4241091550943368, 'consis_rate': 1.5822334261620126, 'use_att': 1}. Best is trial 83 with value: 0.8199.[0m
[32m[I 2022-06-30 09:32:44,805][0m Trial 133 finished with value: 0.8137000000000001 and parameters: {'lr': 0.003395467388598534, 'weight_decay': 0.000586290729368359, 'dropout': 0.5276000357535954, 'patience': 80, 'lr_reduce_freq': 110, 'spt_alg': 'prim', 'spt_attr': 'similarity', 'manifold': 'PoincareBall', 'num_layers': 3, 'dim': 480, 'num_adj': 2, 'add_rate': 0.5704446470889375, 'tem': 1.3713853431838312, 'consis_rate': 1.7281188387937008, 'use_att': 1}. Best is trial 83 with value: 0.8199.[0m
[32m[I 2022-06-30 09:44:30,833][0m Trial 134 finished with value: 0.8082 and parameters: {'lr': 0.0025405959964321977, 'weight_decay': 0.0008463020753942896, 'dropout': 0.4530403522661161, 'patience': 80, 'lr_reduce_freq': 150, 'spt_alg': 'prim', 'spt_attr': 'similarity', 'manifold': 'PoincareBall', 'num_layers': 3, 'dim': 160, 'num_adj': 2, 'add_rate': 0.8315203522989065, 'tem': 1.2773161657329766, 'consis_rate': 1.8760918562321538, 'use_att': 1}. Best is trial 83 with value: 0.8199.[0m
[32m[I 2022-06-30 09:55:44,933][0m Trial 135 finished with value: 0.8158 and parameters: {'lr': 0.0020755316293135447, 'weight_decay': 0.0006390203005318569, 'dropout': 0.583136609537051, 'patience': 80, 'lr_reduce_freq': 140, 'spt_alg': 'prim', 'spt_attr': 'similarity', 'manifold': 'PoincareBall', 'num_layers': 3, 'dim': 496, 'num_adj': 2, 'add_rate': 0.7883325478879877, 'tem': 1.3111300870276885, 'consis_rate': 1.413660785519578, 'use_att': 1}. Best is trial 83 with value: 0.8199.[0m
[32m[I 2022-06-30 10:09:23,338][0m Trial 136 finished with value: 0.8179000000000001 and parameters: {'lr': 0.0016100750613164344, 'weight_decay': 0.0007435324623170103, 'dropout': 0.6143638875749474, 'patience': 80, 'lr_reduce_freq': 130, 'spt_alg': 'prim', 'spt_attr': 'similarity', 'manifold': 'PoincareBall', 'num_layers': 3, 'dim': 240, 'num_adj': 2, 'add_rate': 0.7517772019262943, 'tem': 1.1299686998911127, 'consis_rate': 1.4677938723800577, 'use_att': 1}. Best is trial 83 with value: 0.8199.[0m
[32m[I 2022-06-30 10:22:25,704][0m Trial 137 finished with value: 0.8160999999999999 and parameters: {'lr': 0.0015794307525795962, 'weight_decay': 0.0005777918961196362, 'dropout': 0.5669229008300672, 'patience': 80, 'lr_reduce_freq': 130, 'spt_alg': 'prim', 'spt_attr': 'similarity', 'manifold': 'PoincareBall', 'num_layers': 3, 'dim': 256, 'num_adj': 2, 'add_rate': 0.7482476831254703, 'tem': 1.204515122547651, 'consis_rate': 1.4799241007994903, 'use_att': 1}. Best is trial 83 with value: 0.8199.[0m
[32m[I 2022-06-30 10:46:42,794][0m Trial 138 finished with value: 0.7943 and parameters: {'lr': 0.0012117402863759327, 'weight_decay': 0.0007250812839225373, 'dropout': 0.6431965249911248, 'patience': 70, 'lr_reduce_freq': 120, 'spt_alg': 'prim', 'spt_attr': 'similarity', 'manifold': 'PoincareBall', 'num_layers': 4, 'dim': 272, 'num_adj': 2, 'add_rate': 0.7662732129916099, 'tem': 1.4601625694714646, 'consis_rate': 1.539150992856461, 'use_att': 1}. Best is trial 83 with value: 0.8199.[0m
[32m[I 2022-06-30 10:55:44,024][0m Trial 139 finished with value: 0.8131 and parameters: {'lr': 0.003041841278616801, 'weight_decay': 0.0005065933899222441, 'dropout': 0.4851425484446993, 'patience': 80, 'lr_reduce_freq': 120, 'spt_alg': 'prim', 'spt_attr': 'similarity', 'manifold': 'PoincareBall', 'num_layers': 3, 'dim': 240, 'num_adj': 2, 'add_rate': 0.5416449660319385, 'tem': 1.1443430720210372, 'consis_rate': 1.5864487661687359, 'use_att': 1}. Best is trial 83 with value: 0.8199.[0m
[32m[I 2022-06-30 11:09:18,377][0m Trial 140 finished with value: 0.8098000000000001 and parameters: {'lr': 0.0010657149023236782, 'weight_decay': 0.000798834863869305, 'dropout': 0.5045589398778145, 'patience': 80, 'lr_reduce_freq': 110, 'spt_alg': 'prim', 'spt_attr': 'similarity', 'manifold': 'PoincareBall', 'num_layers': 3, 'dim': 288, 'num_adj': 2, 'add_rate': 0.6807481119420534, 'tem': 1.1872287320767039, 'consis_rate': 1.4618762844184636, 'use_att': 1}. Best is trial 83 with value: 0.8199.[0m
[32m[I 2022-06-30 11:23:27,145][0m Trial 141 finished with value: 0.8160999999999999 and parameters: {'lr': 0.001733549302585701, 'weight_decay': 0.0009243824085260739, 'dropout': 0.6187503254652528, 'patience': 80, 'lr_reduce_freq': 130, 'spt_alg': 'prim', 'spt_attr': 'similarity', 'manifold': 'PoincareBall', 'num_layers': 3, 'dim': 224, 'num_adj': 2, 'add_rate': 0.8160263081604848, 'tem': 1.1284396810432717, 'consis_rate': 1.650774798742879, 'use_att': 1}. Best is trial 83 with value: 0.8199.[0m
[32m[I 2022-06-30 11:37:07,987][0m Trial 142 finished with value: 0.8183999999999999 and parameters: {'lr': 0.001390863185711752, 'weight_decay': 0.0010279571457893191, 'dropout': 0.6044398677446766, 'patience': 80, 'lr_reduce_freq': 130, 'spt_alg': 'prim', 'spt_attr': 'similarity', 'manifold': 'PoincareBall', 'num_layers': 3, 'dim': 512, 'num_adj': 2, 'add_rate': 0.8491149916988722, 'tem': 1.2381167645070252, 'consis_rate': 1.5980749902893243, 'use_att': 1}. Best is trial 83 with value: 0.8199.[0m
[32m[I 2022-06-30 11:52:12,818][0m Trial 143 finished with value: 0.8183 and parameters: {'lr': 0.0009007832795155702, 'weight_decay': 0.0006859175372003164, 'dropout': 0.5554523107786705, 'patience': 80, 'lr_reduce_freq': 130, 'spt_alg': 'prim', 'spt_attr': 'similarity', 'manifold': 'PoincareBall', 'num_layers': 3, 'dim': 512, 'num_adj': 2, 'add_rate': 0.880867120586083, 'tem': 1.2356680646066676, 'consis_rate': 1.6087603272895081, 'use_att': 1}. Best is trial 83 with value: 0.8199.[0m
[32m[I 2022-06-30 12:07:45,251][0m Trial 144 finished with value: 0.8167 and parameters: {'lr': 0.0008038309673714435, 'weight_decay': 0.0006915975521691529, 'dropout': 0.5968216664564346, 'patience': 80, 'lr_reduce_freq': 130, 'spt_alg': 'prim', 'spt_attr': 'similarity', 'manifold': 'PoincareBall', 'num_layers': 3, 'dim': 512, 'num_adj': 2, 'add_rate': 0.8805262802261414, 'tem': 1.2368550895131647, 'consis_rate': 1.3910069963750054, 'use_att': 1}. Best is trial 83 with value: 0.8199.[0m
[32m[I 2022-06-30 12:21:44,723][0m Trial 145 finished with value: 0.8170999999999999 and parameters: {'lr': 0.0008992020071494591, 'weight_decay': 0.0006808134473368593, 'dropout': 0.604444210834191, 'patience': 80, 'lr_reduce_freq': 120, 'spt_alg': 'prim', 'spt_attr': 'similarity', 'manifold': 'PoincareBall', 'num_layers': 3, 'dim': 512, 'num_adj': 2, 'add_rate': 0.8853537581209188, 'tem': 1.224410329449198, 'consis_rate': 1.5094385309837135, 'use_att': 1}. Best is trial 83 with value: 0.8199.[0m
