[32m[I 2022-06-24 14:09:06,118][0m Trial 131 finished with value: 0.8080000000000002 and parameters: {'lr': 0.00814931073241592, 'weight_decay': 0.0012540135064136187, 'dropout': 0.5668129896054873, 'patience': 80, 'lr_reduce_freq': 70, 'spt_alg': 'prim', 'spt_attr': 'similarity', 'manifold': 'PoincareBall', 'num_layers': 3, 'num_adj': 8, 'add_rate': 0.3551980036118696, 'tem': 1.243630424852672, 'consis_rate': 0.9643875284394691, 'use_att': 1}. Best is trial 121 with value: 0.8095000000000001.[0m

mean: 0.8073
[0.789 0.812 0.805 0.813 0.805 0.818 0.812 0.819 0.809 0.791]
cur_param: {'lr': 0.007361415534228044, 'weight_decay': 0.0006340597717697056, 'dropout': 0.5580080700435146, 'patience': 80, 'lr_reduce_freq': 110, 'spt_alg': 'prim', 'spt_attr': 'similarity', 'manifold': 'PoincareBall', 'num_layers': 3, 'num_adj': 8, 'add_rate': 0.3022858373395299, 'tem': 1.3006916704692117, 'consis_rate': 1.0261516951792728, 'use_att': 1}
mean: 0.8073
[0.788 0.819 0.801 0.806 0.801 0.812 0.817 0.82  0.807 0.802]
cur_param: {'lr': 0.007433433444304501, 'weight_decay': 0.0006211339272242819, 'dropout': 0.6765233970955045, 'patience': 80, 'lr_reduce_freq': 110, 'spt_alg': 'prim', 'spt_attr': 'similarity', 'manifold': 'PoincareBall', 'num_layers': 3, 'num_adj': 8, 'add_rate': 0.24817603595678858, 'tem': 1.287686711991721, 'consis_rate': 1.1878592782269117, 'use_att': 1}
mean: 0.7968
[0.772 0.801 0.78  0.811 0.782 0.814 0.792 0.803 0.815 0.798]
cur_param: {'lr': 0.005669933442838797, 'weight_decay': 0.0006683439694865464, 'dropout': 0.6133187499396396, 'patience': 80, 'lr_reduce_freq': 110, 'spt_alg': 'prim', 'spt_attr': 'similarity', 'manifold': 'PoincareBall', 'num_layers': 3, 'num_adj': 8, 'add_rate': 0.2940815868496582, 'tem': 1.2483311099983108, 'consis_rate': 1.0489402547869535, 'use_att': 1}
mean: 0.8046
[0.808 0.789 0.803 0.817 0.778 0.812 0.816 0.813 0.824 0.786]
cur_param: {'lr': 0.004302169240834766, 'weight_decay': 0.0005710283633491199, 'dropout': 0.5792307384410816, 'patience': 80, 'lr_reduce_freq': 110, 'spt_alg': 'kruskal', 'spt_attr': 'similarity', 'manifold': 'PoincareBall', 'num_layers': 3, 'num_adj': 8, 'add_rate': 0.320669074380103, 'tem': 1.3485444339718644, 'consis_rate': 0.9910256591804608, 'use_att': 1}
mean: 0.8004999999999999
[0.793 0.801 0.812 0.772 0.784 0.815 0.808 0.824 0.8   0.796]
cur_param: {'lr': 0.008994446528434353, 'weight_decay': 0.0005000929697698742, 'dropout': 0.645002004616593, 'patience': 80, 'lr_reduce_freq': 130, 'spt_alg': 'prim', 'spt_attr': 'similarity', 'manifold': 'PoincareBall', 'num_layers': 3, 'num_adj': 8, 'add_rate': 0.31309458750771063, 'tem': 1.2831264878057889, 'consis_rate': 1.1094248622908376, 'use_att': 1}
mean: 0.805
[0.791 0.805 0.809 0.809 0.797 0.822 0.798 0.809 0.818 0.792]
cur_param: {'lr': 0.006578011796956075, 'weight_decay': 0.0013088283820888046, 'dropout': 0.5607289066808254, 'patience': 80, 'lr_reduce_freq': 70, 'spt_alg': 'prim', 'spt_attr': 'similarity', 'manifold': 'PoincareBall', 'num_layers': 3, 'num_adj': 8, 'add_rate': 0.27750338268357344, 'tem': 1.0058118641949345, 'consis_rate': 0.9323178407638831, 'use_att': 1}
mean: 0.8066000000000001
[0.793 0.816 0.793 0.805 0.808 0.813 0.806 0.806 0.823 0.803]
cur_param: {'lr': 0.004935961078843426, 'weight_decay': 0.19549617987835813, 'dropout': 0.6048551777271799, 'patience': 80, 'lr_reduce_freq': 70, 'spt_alg': 'prim', 'spt_attr': 'similarity', 'manifold': 'PoincareBall', 'num_layers': 4, 'num_adj': 8, 'add_rate': 0.21211322378534717, 'tem': 1.401636603025804, 'consis_rate': 1.0093055468318977, 'use_att': 0}
mean: 0.2505
[0.319 0.319 0.317 0.149 0.317 0.148 0.149 0.319 0.319 0.149]
cur_param: {'lr': 0.006509362942070111, 'weight_decay': 0.0008824042619009012, 'dropout': 0.5572836120470654, 'patience': 80, 'lr_reduce_freq': 70, 'spt_alg': 'prim', 'spt_attr': 'similarity', 'manifold': 'PoincareBall', 'num_layers': 3, 'num_adj': 8, 'add_rate': 0.26235845211447173, 'tem': 1.152537112477314, 'consis_rate': 0.9385931461101813, 'use_att': 1}
mean: 0.8095000000000001
[0.79  0.812 0.806 0.806 0.797 0.819 0.825 0.825 0.817 0.798]
cur_param: {'lr': 0.0067708710675115965, 'weight_decay': 0.0012220083158578988, 'dropout': 0.5830741662316464, 'patience': 80, 'lr_reduce_freq': 70, 'spt_alg': 'prim', 'spt_attr': 'similarity', 'manifold': 'PoincareBall', 'num_layers': 3, 'num_adj': 8, 'add_rate': 0.2651391593564241, 'tem': 1.1374435783012435, 'consis_rate': 0.932355704151577, 'use_att': 1}
mean: 0.8087
[0.779 0.818 0.811 0.81  0.813 0.806 0.809 0.822 0.818 0.801]
cur_param: {'lr': 0.006721513474522964, 'weight_decay': 0.0013662540276303588, 'dropout': 0.5801821504173558, 'patience': 80, 'lr_reduce_freq': 70, 'spt_alg': 'prim', 'spt_attr': 'similarity', 'manifold': 'PoincareBall', 'num_layers': 3, 'num_adj': 8, 'add_rate': 0.2744797851267676, 'tem': 1.148417020414803, 'consis_rate': 0.9294268065531426, 'use_att': 1}
mean: 0.8070999999999999
[0.786 0.804 0.81  0.816 0.81  0.8   0.807 0.822 0.816 0.8  ]
cur_param: {'lr': 0.006540514183598396, 'weight_decay': 0.001387001122523121, 'dropout': 0.6235062586151221, 'patience': 80, 'lr_reduce_freq': 70, 'spt_alg': 'prim', 'spt_attr': 'similarity', 'manifold': 'PoincareBall', 'num_layers': 3, 'num_adj': 8, 'add_rate': 0.26679316487197924, 'tem': 1.1493180353304553, 'consis_rate': 0.9264448275382424, 'use_att': 1}
mean: 0.805
[0.791 0.82  0.809 0.82  0.808 0.801 0.803 0.81  0.799 0.789]
cur_param: {'lr': 0.005791100483427011, 'weight_decay': 0.001160864161886998, 'dropout': 0.5889802502417251, 'patience': 80, 'lr_reduce_freq': 70, 'spt_alg': 'prim', 'spt_attr': 'similarity', 'manifold': 'PoincareBall', 'num_layers': 3, 'num_adj': 8, 'add_rate': 0.23610756412630307, 'tem': 1.1833940531678149, 'consis_rate': 0.8922094405689314, 'use_att': 1}
mean: 0.8038000000000001
[0.793 0.797 0.806 0.808 0.8   0.805 0.801 0.816 0.807 0.805]
cur_param: {'lr': 0.0067882683802311964, 'weight_decay': 0.0008975859825567531, 'dropout': 0.5775257881912711, 'patience': 80, 'lr_reduce_freq': 70, 'spt_alg': 'prim', 'spt_attr': 'similarity', 'manifold': 'PoincareBall', 'num_layers': 3, 'num_adj': 8, 'add_rate': 0.21027114245670014, 'tem': 1.00748721704247, 'consis_rate': 0.9588204188986728, 'use_att': 1}
mean: 0.8052999999999999
[0.797 0.814 0.804 0.813 0.806 0.799 0.799 0.805 0.807 0.809]
cur_param: {'lr': 0.005403412848973183, 'weight_decay': 0.0015048113724668666, 'dropout': 0.6363324283033187, 'patience': 80, 'lr_reduce_freq': 70, 'spt_alg': 'prim', 'spt_attr': 'similarity', 'manifold': 'PoincareBall', 'num_layers': 3, 'num_adj': 8, 'add_rate': 0.2595076427212066, 'tem': 1.0588571763865733, 'consis_rate': 0.9297647944347358, 'use_att': 1}
mean: 0.7983
[0.784 0.807 0.803 0.807 0.79  0.808 0.788 0.797 0.811 0.788]
cur_param: {'lr': 0.007554914265933364, 'weight_decay': 0.0009270288609727382, 'dropout': 0.5392105685382569, 'patience': 80, 'lr_reduce_freq': 70, 'spt_alg': 'prim', 'spt_attr': 'similarity', 'manifold': 'PoincareBall', 'num_layers': 3, 'num_adj': 8, 'add_rate': 0.2808597505921318, 'tem': 0.9600886749653954, 'consis_rate': 0.9950519155428521, 'use_att': 1}
mean: 0.8018000000000001
[0.777 0.822 0.794 0.789 0.812 0.811 0.802 0.823 0.796 0.792]
cur_param: {'lr': 0.004129650607472682, 'weight_decay': 0.0012524705239953615, 'dropout': 0.7087883349798825, 'patience': 80, 'lr_reduce_freq': 50, 'spt_alg': 'prim', 'spt_attr': 'similarity', 'manifold': 'PoincareBall', 'num_layers': 3, 'num_adj': 8, 'add_rate': 0.3042219020347821, 'tem': 1.3432803196013625, 'consis_rate': 0.8928789158387156, 'use_att': 1}
mean: 0.7886
[0.786 0.775 0.795 0.79  0.752 0.794 0.779 0.803 0.827 0.785]
cur_param: {'lr': 0.006191838663548278, 'weight_decay': 0.0007174045763991364, 'dropout': 0.6028612161453412, 'patience': 80, 'lr_reduce_freq': 70, 'spt_alg': 'prim', 'spt_attr': 'similarity', 'manifold': 'PoincareBall', 'num_layers': 3, 'num_adj': 8, 'add_rate': 0.2238457121644773, 'tem': 1.1390280204890078, 'consis_rate': 1.018422381675173, 'use_att': 1}
mean: 0.8019999999999999
[0.79  0.804 0.815 0.805 0.786 0.806 0.802 0.808 0.811 0.793]
cur_param: {'lr': 0.00814931073241592, 'weight_decay': 0.0012540135064136187, 'dropout': 0.5668129896054873, 'patience': 80, 'lr_reduce_freq': 70, 'spt_alg': 'prim', 'spt_attr': 'similarity', 'manifold': 'PoincareBall', 'num_layers': 3, 'num_adj': 8, 'add_rate': 0.3551980036118696, 'tem': 1.243630424852672, 'consis_rate': 0.9643875284394691, 'use_att': 1}
mean: 0.8080000000000002
[0.781 0.809 0.81  0.795 0.819 0.819 0.816 0.818 0.81  0.803]
cur_param: {'lr': 0.007033196284643156, 'weight_decay': 0.08176280841626651, 'dropout': 0.6674973698237392, 'patience': 80, 'lr_reduce_freq': 70, 'spt_alg': 'prim', 'spt_attr': 'similarity', 'manifold': 'PoincareBall', 'num_layers': 3, 'num_adj': 8, 'add_rate': 0.2550872241172874, 'tem': 1.2641987204334681, 'consis_rate': 0.9851381520805197, 'use_att': 1}[32m[I 2022-06-24 14:31:41,553][0m Trial 132 finished with value: 0.26739999999999997 and parameters: {'lr': 0.007033196284643156, 'weight_decay': 0.08176280841626651, 'dropout': 0.6674973698237392, 'patience': 80, 'lr_reduce_freq': 70, 'spt_alg': 'prim', 'spt_attr': 'similarity', 'manifold': 'PoincareBall', 'num_layers': 3, 'num_adj': 8, 'add_rate': 0.2550872241172874, 'tem': 1.2641987204334681, 'consis_rate': 0.9851381520805197, 'use_att': 1}. Best is trial 121 with value: 0.8095000000000001.[0m
[32m[I 2022-06-24 15:03:26,736][0m Trial 133 finished with value: 0.8095000000000001 and parameters: {'lr': 0.004781167009189062, 'weight_decay': 0.0009319988579873718, 'dropout': 0.5648821152770587, 'patience': 80, 'lr_reduce_freq': 70, 'spt_alg': 'prim', 'spt_attr': 'similarity', 'manifold': 'PoincareBall', 'num_layers': 3, 'num_adj': 8, 'add_rate': 0.2839424791041448, 'tem': 1.2414992037278372, 'consis_rate': 0.9454758684048991, 'use_att': 1}. Best is trial 121 with value: 0.8095000000000001.[0m
[32m[I 2022-06-24 15:52:32,075][0m Trial 134 finished with value: 0.8064 and parameters: {'lr': 0.004684324147469559, 'weight_decay': 0.0009701140778431766, 'dropout': 0.5885170949831854, 'patience': 80, 'lr_reduce_freq': 70, 'spt_alg': 'prim', 'spt_attr': 'similarity', 'manifold': 'PoincareBall', 'num_layers': 3, 'num_adj': 8, 'add_rate': 0.30719192339395807, 'tem': 1.2246960944658973, 'consis_rate': 0.9642241248781104, 'use_att': 1}. Best is trial 121 with value: 0.8095000000000001.[0m
[32m[I 2022-06-24 16:37:19,181][0m Trial 135 finished with value: 0.7878000000000001 and parameters: {'lr': 0.007826008443644502, 'weight_decay': 0.0006315680222791412, 'dropout': 0.10684706226681273, 'patience': 80, 'lr_reduce_freq': 70, 'spt_alg': 'prim', 'spt_attr': 'similarity', 'manifold': 'PoincareBall', 'num_layers': 3, 'num_adj': 8, 'add_rate': 0.3550638722528826, 'tem': 1.179849850232242, 'consis_rate': 0.8849752777669713, 'use_att': 1}. Best is trial 121 with value: 0.8095000000000001.[0m
[32m[I 2022-06-24 17:50:01,671][0m Trial 136 finished with value: 0.8066000000000001 and parameters: {'lr': 0.003043005424021702, 'weight_decay': 0.0011161277507335395, 'dropout': 0.5400914878159164, 'patience': 80, 'lr_reduce_freq': 70, 'spt_alg': 'prim', 'spt_attr': 'similarity', 'manifold': 'PoincareBall', 'num_layers': 3, 'num_adj': 8, 'add_rate': 0.19944952892511647, 'tem': 1.3027650290973274, 'consis_rate': 1.104370333966723, 'use_att': 1}. Best is trial 121 with value: 0.8095000000000001.[0m
[32m[I 2022-06-24 19:06:12,658][0m Trial 137 finished with value: 0.7976 and parameters: {'lr': 0.0035281371907154003, 'weight_decay': 0.0016302910317933632, 'dropout': 0.5670192059295303, 'patience': 80, 'lr_reduce_freq': 50, 'spt_alg': 'prim', 'spt_attr': 'similarity', 'manifold': 'PoincareBall', 'num_layers': 3, 'num_adj': 8, 'add_rate': 0.28870478265840543, 'tem': 1.0970385133440876, 'consis_rate': 0.8265207102831233, 'use_att': 1}. Best is trial 121 with value: 0.8095000000000001.[0m
[32m[I 2022-06-24 20:06:09,386][0m Trial 138 finished with value: 0.8074 and parameters: {'lr': 0.005147700702979851, 'weight_decay': 0.0008395431877556901, 'dropout': 0.6249184711947204, 'patience': 80, 'lr_reduce_freq': 70, 'spt_alg': 'prim', 'spt_attr': 'similarity', 'manifold': 'PoincareBall', 'num_layers': 3, 'num_adj': 8, 'add_rate': 0.327747987353645, 'tem': 1.449481561447231, 'consis_rate': 1.1579309771197996, 'use_att': 1}. Best is trial 121 with value: 0.8095000000000001.[0m
[32m[I 2022-06-24 20:26:34,708][0m Trial 139 finished with value: 0.7973 and parameters: {'lr': 0.005065057218795594, 'weight_decay': 0.0007728127220003179, 'dropout': 0.6161812393854263, 'patience': 80, 'lr_reduce_freq': 70, 'spt_alg': 'kruskal', 'spt_attr': 'similarity', 'manifold': 'PoincareBall', 'num_layers': 3, 'num_adj': 2, 'add_rate': 0.3228208868203887, 'tem': 1.4411078753473117, 'consis_rate': 1.0359484895668347, 'use_att': 1}. Best is trial 121 with value: 0.8095000000000001.[0m
[32m[I 2022-06-24 21:36:49,946][0m Trial 140 finished with value: 0.8055 and parameters: {'lr': 0.0038654635327137806, 'weight_decay': 0.001083511302959705, 'dropout': 0.6240817886606116, 'patience': 80, 'lr_reduce_freq': 70, 'spt_alg': 'prim', 'spt_attr': 'similarity', 'manifold': 'PoincareBall', 'num_layers': 3, 'num_adj': 8, 'add_rate': 0.2356724468837728, 'tem': 1.5104305143864853, 'consis_rate': 0.9172811943377519, 'use_att': 1}. Best is trial 121 with value: 0.8095000000000001.[0m
[32m[I 2022-06-24 22:36:27,687][0m Trial 141 finished with value: 0.8107 and parameters: {'lr': 0.005915594773429954, 'weight_decay': 0.0008755965245766836, 'dropout': 0.5850846398793891, 'patience': 80, 'lr_reduce_freq': 70, 'spt_alg': 'prim', 'spt_attr': 'similarity', 'manifold': 'PoincareBall', 'num_layers': 3, 'num_adj': 8, 'add_rate': 0.2723247041480352, 'tem': 1.2416833927555864, 'consis_rate': 1.1887884688821728, 'use_att': 1}. Best is trial 141 with value: 0.8107.[0m
[32m[I 2022-06-24 23:42:16,428][0m Trial 142 finished with value: 0.8054 and parameters: {'lr': 0.005869342239272571, 'weight_decay': 0.0006608454385814475, 'dropout': 0.5886860377660575, 'patience': 80, 'lr_reduce_freq': 70, 'spt_alg': 'prim', 'spt_attr': 'similarity', 'manifold': 'PoincareBall', 'num_layers': 3, 'num_adj': 8, 'add_rate': 0.26589676369536663, 'tem': 1.3721963257187542, 'consis_rate': 1.1469986627370838, 'use_att': 1}. Best is trial 141 with value: 0.8107.[0m
[32m[I 2022-06-25 00:21:13,908][0m Trial 143 finished with value: 0.3339 and parameters: {'lr': 0.0082614702867391, 'weight_decay': 0.0009201143956067694, 'dropout': 0.9365311866478343, 'patience': 80, 'lr_reduce_freq': 70, 'spt_alg': 'prim', 'spt_attr': 'similarity', 'manifold': 'PoincareBall', 'num_layers': 3, 'num_adj': 8, 'add_rate': 0.32628987562706835, 'tem': 1.2751709317664444, 'consis_rate': 1.3005727516004573, 'use_att': 1}. Best is trial 141 with value: 0.8107.[0m
[32m[I 2022-06-25 01:21:31,240][0m Trial 144 finished with value: 0.8074999999999999 and parameters: {'lr': 0.004541193569841602, 'weight_decay': 0.0005557082315025336, 'dropout': 0.6382534000925228, 'patience': 80, 'lr_reduce_freq': 70, 'spt_alg': 'prim', 'spt_attr': 'similarity', 'manifold': 'PoincareBall', 'num_layers': 3, 'num_adj': 8, 'add_rate': 0.3513468209510529, 'tem': 1.3108942093250273, 'consis_rate': 1.0821389599571174, 'use_att': 1}. Best is trial 141 with value: 0.8107.[0m
[32m[I 2022-06-25 02:23:28,081][0m Trial 145 finished with value: 0.8088000000000001 and parameters: {'lr': 0.004411510772602115, 'weight_decay': 0.00059962518639288, 'dropout': 0.6385961183252731, 'patience': 80, 'lr_reduce_freq': 70, 'spt_alg': 'prim', 'spt_attr': 'similarity', 'manifold': 'PoincareBall', 'num_layers': 3, 'num_adj': 8, 'add_rate': 0.3668579229038763, 'tem': 1.3194282889881368, 'consis_rate': 1.0920179354447468, 'use_att': 1}. Best is trial 141 with value: 0.8107.[0m
[32m[I 2022-06-25 03:47:24,803][0m Trial 146 finished with value: 0.7952 and parameters: {'lr': 0.002674456990193649, 'weight_decay': 0.0005582634050579707, 'dropout': 0.662420225904487, 'patience': 80, 'lr_reduce_freq': 70, 'spt_alg': 'prim', 'spt_attr': 'similarity', 'manifold': 'PoincareBall', 'num_layers': 3, 'num_adj': 8, 'add_rate': 0.3695896644446472, 'tem': 1.3244647034490515, 'consis_rate': 1.2422191897153014, 'use_att': 1}. Best is trial 141 with value: 0.8107.[0m
[32m[I 2022-06-25 06:00:26,306][0m Trial 147 finished with value: 0.6618999999999999 and parameters: {'lr': 0.004336392836005752, 'weight_decay': 0.0006339542137968662, 'dropout': 0.6952736471846811, 'patience': 80, 'lr_reduce_freq': 70, 'spt_alg': 'prim', 'spt_attr': 'similarity', 'manifold': 'PoincareBall', 'num_layers': 4, 'num_adj': 8, 'add_rate': 0.3506781860778524, 'tem': 1.364173502771866, 'consis_rate': 1.0858298888818996, 'use_att': 1}. Best is trial 141 with value: 0.8107.[0m
[32m[I 2022-06-25 06:10:51,297][0m Trial 148 finished with value: 0.7892 and parameters: {'lr': 0.0048327111424869545, 'weight_decay': 0.0007831824920542937, 'dropout': 0.7182019638139073, 'patience': 80, 'lr_reduce_freq': 70, 'spt_alg': 'prim', 'spt_attr': 'similarity', 'manifold': 'PoincareBall', 'num_layers': 3, 'num_adj': 8, 'add_rate': 0.391390323359833, 'tem': 1.3128426050856852, 'consis_rate': 1.1272115274313264, 'use_att': 0}. Best is trial 141 with value: 0.8107.[0m
