[32m[I 2022-07-01 18:11:35,675][0m Trial 108 finished with value: 0.319 and parameters: {'lr': 0.051368177391712865, 'weight_decay': 0.02215284993207951, 'dropout': 0.3968650978094177, 'patience': 100, 'lr_reduce_freq': 30, 'spt_alg': 'kruskal', 'spt_attr': 'edge_degree', 'manifold': 'PoincareBall', 'num_layers': 4, 'dim': 240, 'num_adj': 4, 'add_rate': 0.5230290140602355, 'tem': 1.3619794440562096, 'consis_rate': 1.824659650263464, 'use_att': 1}. Best is trial 105 with value: 0.8254999999999999.[0m

mean: 0.8251
[0.818 0.829 0.813 0.827 0.824 0.829 0.818 0.827 0.833 0.833]
cur_param: {'lr': 0.07470602596967583, 'weight_decay': 0.0200114127156453, 'dropout': 0.31811347605563256, 'patience': 100, 'lr_reduce_freq': 30, 'spt_alg': 'kruskal', 'spt_attr': 'edge_degree', 'manifold': 'PoincareBall', 'num_layers': 3, 'dim': 176, 'num_adj': 4, 'add_rate': 0.5717341714117685, 'tem': 1.3250801693417462, 'consis_rate': 1.9611523763828373, 'use_att': 1}
mean: 0.8227
[0.819 0.83  0.816 0.819 0.827 0.825 0.829 0.816 0.825 0.821]
cur_param: {'lr': 0.05324628644363829, 'weight_decay': 0.019672327341156152, 'dropout': 0.31736606545766943, 'patience': 100, 'lr_reduce_freq': 30, 'spt_alg': 'kruskal', 'spt_attr': 'edge_degree', 'manifold': 'PoincareBall', 'num_layers': 3, 'dim': 240, 'num_adj': 4, 'add_rate': 0.5796212994402915, 'tem': 1.3102276167798554, 'consis_rate': 1.9705834664356472, 'use_att': 1}
mean: 0.8186
[0.822 0.809 0.819 0.821 0.805 0.817 0.806 0.836 0.825 0.826]
cur_param: {'lr': 0.046327578231496656, 'weight_decay': 0.024855870912417245, 'dropout': 0.28647208324248197, 'patience': 100, 'lr_reduce_freq': 30, 'spt_alg': 'kruskal', 'spt_attr': 'edge_degree', 'manifold': 'PoincareBall', 'num_layers': 3, 'dim': 224, 'num_adj': 4, 'add_rate': 0.6494649451011407, 'tem': 1.3258230694301427, 'consis_rate': 1.9994457999044655, 'use_att': 1}
mean: 0.31989999999999996
[0.319 0.319 0.319 0.319 0.319 0.319 0.328 0.319 0.319 0.319]
cur_param: {'lr': 0.08751759201285399, 'weight_decay': 0.013954262593774127, 'dropout': 0.4442315795063265, 'patience': 100, 'lr_reduce_freq': 45, 'spt_alg': 'kruskal', 'spt_attr': 'edge_degree', 'manifold': 'PoincareBall', 'num_layers': 3, 'dim': 192, 'num_adj': 4, 'add_rate': 0.5953230519467179, 'tem': 1.4172956831844727, 'consis_rate': 1.9060609755197877, 'use_att': 1}
mean: 0.8168000000000001
[0.81  0.798 0.821 0.815 0.817 0.812 0.813 0.814 0.839 0.829]
cur_param: {'lr': 0.06004596984245197, 'weight_decay': 0.033751289995644036, 'dropout': 0.32302682275034456, 'patience': 100, 'lr_reduce_freq': 30, 'spt_alg': 'kruskal', 'spt_attr': 'edge_degree', 'manifold': 'PoincareBall', 'num_layers': 3, 'dim': 208, 'num_adj': 4, 'add_rate': 0.5612668265967917, 'tem': 1.3699499287861157, 'consis_rate': 1.9352768192315757, 'use_att': 1}
mean: 0.3204
[0.319 0.342 0.319 0.319 0.319 0.319 0.319 0.319 0.31  0.319]
cur_param: {'lr': 0.04120507591058453, 'weight_decay': 0.018244391651422703, 'dropout': 0.34886638925174235, 'patience': 100, 'lr_reduce_freq': 30, 'spt_alg': 'kruskal', 'spt_attr': 'edge_degree', 'manifold': 'PoincareBall', 'num_layers': 3, 'dim': 208, 'num_adj': 4, 'add_rate': 0.748396950655153, 'tem': 1.4407366573926945, 'consis_rate': 1.9597760005742175, 'use_att': 0}
mean: 0.31429999999999997
[0.318 0.318 0.298 0.299 0.317 0.317 0.319 0.319 0.319 0.319]
cur_param: {'lr': 0.03266681706180247, 'weight_decay': 0.023097833379701716, 'dropout': 0.37607673534795305, 'patience': 100, 'lr_reduce_freq': 45, 'spt_alg': 'kruskal', 'spt_attr': 'edge_degree', 'manifold': 'PoincareBall', 'num_layers': 3, 'dim': 144, 'num_adj': 2, 'add_rate': 0.616537840087231, 'tem': 1.2471663163668687, 'consis_rate': 0.9070797357642535, 'use_att': 1}
mean: 0.3229
[0.319 0.319 0.319 0.319 0.319 0.319 0.319 0.319 0.319 0.358]
cur_param: {'lr': 0.07636812039728785, 'weight_decay': 0.012965816883280235, 'dropout': 0.42746765674570764, 'patience': 100, 'lr_reduce_freq': 30, 'spt_alg': 'kruskal', 'spt_attr': 'edge_degree', 'manifold': 'Hyperboloid', 'num_layers': 3, 'dim': 160, 'num_adj': 4, 'add_rate': 0.8208919695549204, 'tem': 1.3976491893353595, 'consis_rate': 0.6485935915043965, 'use_att': 1}
mean: 0.6801
[0.699 0.633 0.754 0.737 0.724 0.658 0.376 0.739 0.741 0.74 ]
cur_param: {'lr': 0.06683610510932941, 'weight_decay': 0.03137374414770317, 'dropout': 0.2976462715912631, 'patience': 100, 'lr_reduce_freq': 30, 'spt_alg': 'kruskal', 'spt_attr': 'edge_degree', 'manifold': 'PoincareBall', 'num_layers': 3, 'dim': 192, 'num_adj': 4, 'add_rate': 0.6457439128771348, 'tem': 1.2890327616142447, 'consis_rate': 1.913312670379696, 'use_att': 1}
mean: 0.31920000000000004
[0.319 0.319 0.321 0.319 0.319 0.319 0.319 0.319 0.319 0.319]
cur_param: {'lr': 0.07419265414893234, 'weight_decay': 0.02287157526759226, 'dropout': 0.39115148225031354, 'patience': 100, 'lr_reduce_freq': 30, 'spt_alg': 'kruskal', 'spt_attr': 'edge_degree', 'manifold': 'PoincareBall', 'num_layers': 3, 'dim': 176, 'num_adj': 4, 'add_rate': 0.6023391679244237, 'tem': 1.3409668347922803, 'consis_rate': 1.8570343356026755, 'use_att': 1}
mean: 0.8244
[0.828 0.827 0.827 0.81  0.828 0.832 0.82  0.834 0.825 0.813]
cur_param: {'lr': 0.09995511239660822, 'weight_decay': 0.01549642344973012, 'dropout': 0.3921025581737008, 'patience': 100, 'lr_reduce_freq': 30, 'spt_alg': 'kruskal', 'spt_attr': 'edge_degree', 'manifold': 'PoincareBall', 'num_layers': 3, 'dim': 176, 'num_adj': 4, 'add_rate': 0.5530144875782502, 'tem': 1.3342237286009546, 'consis_rate': 1.7987017322681398, 'use_att': 1}
mean: 0.8145
[0.821 0.821 0.798 0.819 0.822 0.826 0.795 0.81  0.818 0.815]
cur_param: {'lr': 0.09013531022270885, 'weight_decay': 0.019288253069470587, 'dropout': 0.3618522977205049, 'patience': 100, 'lr_reduce_freq': 45, 'spt_alg': 'kruskal', 'spt_attr': 'edge_degree', 'manifold': 'PoincareBall', 'num_layers': 3, 'dim': 224, 'num_adj': 4, 'add_rate': 0.7015305676033925, 'tem': 1.3015787405818378, 'consis_rate': 1.9716650863038543, 'use_att': 1}
mean: 0.82
[0.833 0.811 0.829 0.82  0.809 0.82  0.816 0.827 0.809 0.826]
cur_param: {'lr': 0.09116546455183482, 'weight_decay': 0.01901582928173756, 'dropout': 0.4168205894458965, 'patience': 100, 'lr_reduce_freq': 45, 'spt_alg': 'kruskal', 'spt_attr': 'edge_degree', 'manifold': 'PoincareBall', 'num_layers': 3, 'dim': 224, 'num_adj': 4, 'add_rate': 0.7080228339983242, 'tem': 1.3141456501656699, 'consis_rate': 1.8926614610529222, 'use_att': 1}
mean: 0.8176
[0.792 0.807 0.815 0.819 0.836 0.825 0.823 0.824 0.805 0.83 ]
cur_param: {'lr': 0.07148263082191429, 'weight_decay': 0.02296123721831685, 'dropout': 0.3282534560666204, 'patience': 100, 'lr_reduce_freq': 30, 'spt_alg': 'kruskal', 'spt_attr': 'edge_degree', 'manifold': 'PoincareBall', 'num_layers': 3, 'dim': 240, 'num_adj': 4, 'add_rate': 0.6038422083998806, 'tem': 1.252812816244541, 'consis_rate': 1.9961422878114805, 'use_att': 1}
mean: 0.8254999999999999
[0.827 0.831 0.828 0.828 0.827 0.821 0.82  0.821 0.83  0.822]
cur_param: {'lr': 0.07711493053321122, 'weight_decay': 0.02285049124003063, 'dropout': 0.3293182979438305, 'patience': 100, 'lr_reduce_freq': 30, 'spt_alg': 'kruskal', 'spt_attr': 'edge_degree', 'manifold': 'PoincareBall', 'num_layers': 3, 'dim': 240, 'num_adj': 4, 'add_rate': 0.6028024331478249, 'tem': 1.2750704787070866, 'consis_rate': 1.9984188526592885, 'use_att': 1}
mean: 0.8181
[0.829 0.82  0.831 0.826 0.812 0.804 0.813 0.813 0.823 0.81 ]
cur_param: {'lr': 0.06844230470748762, 'weight_decay': 0.04094174780352234, 'dropout': 0.3434549666230579, 'patience': 100, 'lr_reduce_freq': 30, 'spt_alg': 'kruskal', 'spt_attr': 'edge_degree', 'manifold': 'PoincareBall', 'num_layers': 3, 'dim': 208, 'num_adj': 4, 'add_rate': 0.5688762625438194, 'tem': 1.2321796493998676, 'consis_rate': 1.8659186550067854, 'use_att': 1}
mean: 0.3205
[0.319 0.319 0.319 0.319 0.318 0.319 0.319 0.319 0.319 0.335]
cur_param: {'lr': 0.051368177391712865, 'weight_decay': 0.02215284993207951, 'dropout': 0.3968650978094177, 'patience': 100, 'lr_reduce_freq': 30, 'spt_alg': 'kruskal', 'spt_attr': 'edge_degree', 'manifold': 'PoincareBall', 'num_layers': 4, 'dim': 240, 'num_adj': 4, 'add_rate': 0.5230290140602355, 'tem': 1.3619794440562096, 'consis_rate': 1.824659650263464, 'use_att': 1}
mean: 0.319
[0.319 0.319 0.319 0.319 0.319 0.319 0.319 0.319 0.319 0.319]
cur_param: {'lr': 0.0810594416829007, 'weight_decay': 0.027332025700918125, 'dropout': 0.3038068161972669, 'patience': 100, 'lr_reduce_freq': 30, 'spt_alg': 'kruskal', 'spt_attr': 'edge_degree', 'manifold': 'PoincareBall', 'num_layers': 3, 'dim': 192, 'num_adj': 4, 'add_rate': 0.6675405881819746, 'tem': 1.2534412354690023, 'consis_rate': 0.3195252801693016, 'use_att': 1}
mean: 0.7715
[0.819 0.806 0.819 0.822 0.821 0.826 0.825 0.382 0.796 0.799][32m[I 2022-07-01 18:30:36,375][0m Trial 109 finished with value: 0.7715 and parameters: {'lr': 0.0810594416829007, 'weight_decay': 0.027332025700918125, 'dropout': 0.3038068161972669, 'patience': 100, 'lr_reduce_freq': 30, 'spt_alg': 'kruskal', 'spt_attr': 'edge_degree', 'manifold': 'PoincareBall', 'num_layers': 3, 'dim': 192, 'num_adj': 4, 'add_rate': 0.6675405881819746, 'tem': 1.2534412354690023, 'consis_rate': 0.3195252801693016, 'use_att': 1}. Best is trial 105 with value: 0.8254999999999999.[0m
[32m[I 2022-07-01 18:50:50,228][0m Trial 110 finished with value: 0.7724 and parameters: {'lr': 0.0633248227879975, 'weight_decay': 0.024740059328968594, 'dropout': 0.44453649667648376, 'patience': 100, 'lr_reduce_freq': 30, 'spt_alg': 'kruskal', 'spt_attr': 'edge_degree', 'manifold': 'PoincareBall', 'num_layers': 3, 'dim': 256, 'num_adj': 4, 'add_rate': 0.6123173155048789, 'tem': 1.4020625576681442, 'consis_rate': 1.931512965153365, 'use_att': 1}. Best is trial 105 with value: 0.8254999999999999.[0m
[32m[I 2022-07-01 19:08:54,708][0m Trial 111 finished with value: 0.8129 and parameters: {'lr': 0.0893823540000462, 'weight_decay': 0.012790326257314268, 'dropout': 0.3616622833909802, 'patience': 100, 'lr_reduce_freq': 45, 'spt_alg': 'kruskal', 'spt_attr': 'edge_degree', 'manifold': 'PoincareBall', 'num_layers': 3, 'dim': 224, 'num_adj': 4, 'add_rate': 0.6446598280353978, 'tem': 1.3043340897954256, 'consis_rate': 1.9747316209250134, 'use_att': 1}. Best is trial 105 with value: 0.8254999999999999.[0m
[32m[I 2022-07-01 19:28:41,893][0m Trial 112 finished with value: 0.82 and parameters: {'lr': 0.07214911876699011, 'weight_decay': 0.018977326694498673, 'dropout': 0.36542258995788274, 'patience': 100, 'lr_reduce_freq': 30, 'spt_alg': 'kruskal', 'spt_attr': 'edge_degree', 'manifold': 'PoincareBall', 'num_layers': 3, 'dim': 208, 'num_adj': 4, 'add_rate': 0.6873487711137364, 'tem': 1.3315284667520955, 'consis_rate': 1.97417086381154, 'use_att': 1}. Best is trial 105 with value: 0.8254999999999999.[0m
[32m[I 2022-07-01 19:40:49,463][0m Trial 113 finished with value: 0.8192999999999999 and parameters: {'lr': 0.07182485378217277, 'weight_decay': 0.015725206869595925, 'dropout': 0.41629802982885333, 'patience': 100, 'lr_reduce_freq': 30, 'spt_alg': 'kruskal', 'spt_attr': 'edge_degree', 'manifold': 'PoincareBall', 'num_layers': 3, 'dim': 192, 'num_adj': 4, 'add_rate': 0.5004503914205655, 'tem': 1.276987777565206, 'consis_rate': 1.9142715279366505, 'use_att': 1}. Best is trial 105 with value: 0.8254999999999999.[0m
[32m[I 2022-07-01 19:47:17,324][0m Trial 114 finished with value: 0.30519999999999997 and parameters: {'lr': 0.057527812388306294, 'weight_decay': 0.02509795737077329, 'dropout': 0.38790852175542834, 'patience': 100, 'lr_reduce_freq': 30, 'spt_alg': 'kruskal', 'spt_attr': 'edge_degree', 'manifold': 'PoincareBall', 'num_layers': 3, 'dim': 208, 'num_adj': 4, 'add_rate': 0.6253645956587538, 'tem': 1.3276360207360498, 'consis_rate': 1.8718387595534611, 'use_att': 1}. Best is trial 105 with value: 0.8254999999999999.[0m
[32m[I 2022-07-01 19:56:17,770][0m Trial 115 finished with value: 0.7848999999999999 and parameters: {'lr': 0.08853972078581288, 'weight_decay': 0.021834312143881703, 'dropout': 0.3599074187820829, 'patience': 50, 'lr_reduce_freq': 45, 'spt_alg': 'kruskal', 'spt_attr': 'edge_degree', 'manifold': 'PoincareBall', 'num_layers': 3, 'dim': 240, 'num_adj': 4, 'add_rate': 0.5722311166425781, 'tem': 1.2948943769896246, 'consis_rate': 1.9291344383280509, 'use_att': 1}. Best is trial 105 with value: 0.8254999999999999.[0m
[32m[I 2022-07-01 20:17:47,429][0m Trial 116 finished with value: 0.319 and parameters: {'lr': 0.04534304934072769, 'weight_decay': 0.030650080844439095, 'dropout': 0.28265756501848455, 'patience': 100, 'lr_reduce_freq': 30, 'spt_alg': 'kruskal', 'spt_attr': 'edge_degree', 'manifold': 'PoincareBall', 'num_layers': 5, 'dim': 160, 'num_adj': 4, 'add_rate': 0.5412370649776621, 'tem': 1.446557730616834, 'consis_rate': 1.9997592412547123, 'use_att': 1}. Best is trial 105 with value: 0.8254999999999999.[0m
[32m[I 2022-07-01 20:21:29,255][0m Trial 117 finished with value: 0.8071999999999999 and parameters: {'lr': 0.07212816082842073, 'weight_decay': 0.01829339670580047, 'dropout': 0.33199797343835546, 'patience': 100, 'lr_reduce_freq': 30, 'spt_alg': 'kruskal', 'spt_attr': 'edge_degree', 'manifold': 'PoincareBall', 'num_layers': 3, 'dim': 208, 'num_adj': 4, 'add_rate': 0.665903188379456, 'tem': 1.3547917674536458, 'consis_rate': 1.7477168971176344, 'use_att': 0}. Best is trial 105 with value: 0.8254999999999999.[0m
[32m[I 2022-07-01 20:46:22,465][0m Trial 118 finished with value: 0.7295999999999999 and parameters: {'lr': 0.09981079321534432, 'weight_decay': 0.020269333981350637, 'dropout': 0.31236899404871765, 'patience': 100, 'lr_reduce_freq': 45, 'spt_alg': 'kruskal', 'spt_attr': 'edge_degree', 'manifold': 'Hyperboloid', 'num_layers': 3, 'dim': 224, 'num_adj': 4, 'add_rate': 0.7140514029848948, 'tem': 1.225393263090493, 'consis_rate': 1.116343430848085, 'use_att': 1}. Best is trial 105 with value: 0.8254999999999999.[0m
[32m[I 2022-07-01 21:03:12,090][0m Trial 119 finished with value: 0.8206999999999999 and parameters: {'lr': 0.08207809753477834, 'weight_decay': 0.01473685139936226, 'dropout': 0.4585275426230099, 'patience': 100, 'lr_reduce_freq': 30, 'spt_alg': 'kruskal', 'spt_attr': 'edge_degree', 'manifold': 'PoincareBall', 'num_layers': 3, 'dim': 176, 'num_adj': 4, 'add_rate': 0.5984025000336138, 'tem': 1.2608050741563783, 'consis_rate': 1.8331558789268678, 'use_att': 1}. Best is trial 105 with value: 0.8254999999999999.[0m
[32m[I 2022-07-01 21:27:08,867][0m Trial 120 finished with value: 0.8117999999999999 and parameters: {'lr': 0.08062461531381435, 'weight_decay': 0.01500903607770261, 'dropout': 0.4488296346357078, 'patience': 100, 'lr_reduce_freq': 120, 'spt_alg': 'kruskal', 'spt_attr': 'edge_degree', 'manifold': 'PoincareBall', 'num_layers': 3, 'dim': 176, 'num_adj': 4, 'add_rate': 0.5941417851570573, 'tem': 1.2532788516434175, 'consis_rate': 1.822951935110294, 'use_att': 1}. Best is trial 105 with value: 0.8254999999999999.[0m
[32m[I 2022-07-01 21:44:16,348][0m Trial 121 finished with value: 0.8177999999999999 and parameters: {'lr': 0.06785654804088358, 'weight_decay': 0.013420620516625527, 'dropout': 0.3727881631984241, 'patience': 100, 'lr_reduce_freq': 30, 'spt_alg': 'kruskal', 'spt_attr': 'edge_degree', 'manifold': 'PoincareBall', 'num_layers': 3, 'dim': 192, 'num_adj': 4, 'add_rate': 0.6881322510200112, 'tem': 1.3309697729260284, 'consis_rate': 1.9553942243049525, 'use_att': 1}. Best is trial 105 with value: 0.8254999999999999.[0m
[32m[I 2022-07-01 22:00:12,157][0m Trial 122 finished with value: 0.8202999999999999 and parameters: {'lr': 0.06254156706200688, 'weight_decay': 0.017678759466840818, 'dropout': 0.4636504854241877, 'patience': 100, 'lr_reduce_freq': 30, 'spt_alg': 'kruskal', 'spt_attr': 'edge_degree', 'manifold': 'PoincareBall', 'num_layers': 3, 'dim': 176, 'num_adj': 4, 'add_rate': 0.6297850416275335, 'tem': 1.3705613819668017, 'consis_rate': 1.886626992170171, 'use_att': 1}. Best is trial 105 with value: 0.8254999999999999.[0m
[32m[I 2022-07-01 22:10:39,861][0m Trial 123 finished with value: 0.8218 and parameters: {'lr': 0.052504726702101295, 'weight_decay': 0.011895504947192263, 'dropout': 0.503525731300628, 'patience': 100, 'lr_reduce_freq': 30, 'spt_alg': 'kruskal', 'spt_attr': 'edge_degree', 'manifold': 'PoincareBall', 'num_layers': 3, 'dim': 160, 'num_adj': 4, 'add_rate': 0.6080525826510303, 'tem': 1.4911651763307576, 'consis_rate': 1.7887234159846142, 'use_att': 1}. Best is trial 105 with value: 0.8254999999999999.[0m
[32m[I 2022-07-01 22:25:58,089][0m Trial 124 finished with value: 0.8155999999999999 and parameters: {'lr': 0.058006491835342205, 'weight_decay': 0.016203777493865573, 'dropout': 0.4018698617459339, 'patience': 100, 'lr_reduce_freq': 30, 'spt_alg': 'kruskal', 'spt_attr': 'edge_degree', 'manifold': 'PoincareBall', 'num_layers': 3, 'dim': 160, 'num_adj': 4, 'add_rate': 0.6097008438361511, 'tem': 1.432676432316919, 'consis_rate': 1.7795270483484606, 'use_att': 1}. Best is trial 105 with value: 0.8254999999999999.[0m
[32m[I 2022-07-01 22:41:43,410][0m Trial 125 finished with value: 0.8193999999999999 and parameters: {'lr': 0.049652448090044134, 'weight_decay': 0.012222935356371986, 'dropout': 0.42386149477894197, 'patience': 100, 'lr_reduce_freq': 30, 'spt_alg': 'kruskal', 'spt_attr': 'edge_degree', 'manifold': 'PoincareBall', 'num_layers': 3, 'dim': 144, 'num_adj': 4, 'add_rate': 0.5858531139512788, 'tem': 1.3936067976239461, 'consis_rate': 1.845437158242666, 'use_att': 1}. Best is trial 105 with value: 0.8254999999999999.[0m
