[32m[I 2022-06-25 07:16:21,923][0m Trial 149 finished with value: 0.7984000000000001 and parameters: {'lr': 0.003584093438512708, 'weight_decay': 0.000548779822344089, 'dropout': 0.6516906251154638, 'patience': 80, 'lr_reduce_freq': 70, 'spt_alg': 'prim', 'spt_attr': 'similarity', 'manifold': 'PoincareBall', 'num_layers': 3, 'num_adj': 8, 'add_rate': 0.3065906439291219, 'tem': 1.4257076167755223, 'consis_rate': 1.1845511938323023, 'use_att': 1}. Best is trial 141 with value: 0.8107.[0m

mean: 0.26739999999999997
[0.319 0.319 0.149 0.319 0.319 0.144 0.149 0.319 0.318 0.319]
cur_param: {'lr': 0.004781167009189062, 'weight_decay': 0.0009319988579873718, 'dropout': 0.5648821152770587, 'patience': 80, 'lr_reduce_freq': 70, 'spt_alg': 'prim', 'spt_attr': 'similarity', 'manifold': 'PoincareBall', 'num_layers': 3, 'num_adj': 8, 'add_rate': 0.2839424791041448, 'tem': 1.2414992037278372, 'consis_rate': 0.9454758684048991, 'use_att': 1}
mean: 0.8095000000000001
[0.796 0.815 0.804 0.812 0.804 0.809 0.807 0.82  0.823 0.805]
cur_param: {'lr': 0.004684324147469559, 'weight_decay': 0.0009701140778431766, 'dropout': 0.5885170949831854, 'patience': 80, 'lr_reduce_freq': 70, 'spt_alg': 'prim', 'spt_attr': 'similarity', 'manifold': 'PoincareBall', 'num_layers': 3, 'num_adj': 8, 'add_rate': 0.30719192339395807, 'tem': 1.2246960944658973, 'consis_rate': 0.9642241248781104, 'use_att': 1}
mean: 0.8064
[0.794 0.815 0.818 0.809 0.809 0.806 0.79  0.811 0.81  0.802]
cur_param: {'lr': 0.007826008443644502, 'weight_decay': 0.0006315680222791412, 'dropout': 0.10684706226681273, 'patience': 80, 'lr_reduce_freq': 70, 'spt_alg': 'prim', 'spt_attr': 'similarity', 'manifold': 'PoincareBall', 'num_layers': 3, 'num_adj': 8, 'add_rate': 0.3550638722528826, 'tem': 1.179849850232242, 'consis_rate': 0.8849752777669713, 'use_att': 1}
mean: 0.7878000000000001
[0.775 0.794 0.769 0.793 0.78  0.794 0.791 0.799 0.807 0.776]
cur_param: {'lr': 0.003043005424021702, 'weight_decay': 0.0011161277507335395, 'dropout': 0.5400914878159164, 'patience': 80, 'lr_reduce_freq': 70, 'spt_alg': 'prim', 'spt_attr': 'similarity', 'manifold': 'PoincareBall', 'num_layers': 3, 'num_adj': 8, 'add_rate': 0.19944952892511647, 'tem': 1.3027650290973274, 'consis_rate': 1.104370333966723, 'use_att': 1}
mean: 0.8066000000000001
[0.8   0.81  0.809 0.8   0.794 0.803 0.809 0.821 0.81  0.81 ]
cur_param: {'lr': 0.0035281371907154003, 'weight_decay': 0.0016302910317933632, 'dropout': 0.5670192059295303, 'patience': 80, 'lr_reduce_freq': 50, 'spt_alg': 'prim', 'spt_attr': 'similarity', 'manifold': 'PoincareBall', 'num_layers': 3, 'num_adj': 8, 'add_rate': 0.28870478265840543, 'tem': 1.0970385133440876, 'consis_rate': 0.8265207102831233, 'use_att': 1}
mean: 0.7976
[0.797 0.803 0.784 0.795 0.779 0.795 0.793 0.811 0.813 0.806]
cur_param: {'lr': 0.005147700702979851, 'weight_decay': 0.0008395431877556901, 'dropout': 0.6249184711947204, 'patience': 80, 'lr_reduce_freq': 70, 'spt_alg': 'prim', 'spt_attr': 'similarity', 'manifold': 'PoincareBall', 'num_layers': 3, 'num_adj': 8, 'add_rate': 0.327747987353645, 'tem': 1.449481561447231, 'consis_rate': 1.1579309771197996, 'use_att': 1}
mean: 0.8074
[0.795 0.812 0.809 0.814 0.812 0.812 0.808 0.799 0.813 0.8  ]
cur_param: {'lr': 0.005065057218795594, 'weight_decay': 0.0007728127220003179, 'dropout': 0.6161812393854263, 'patience': 80, 'lr_reduce_freq': 70, 'spt_alg': 'kruskal', 'spt_attr': 'similarity', 'manifold': 'PoincareBall', 'num_layers': 3, 'num_adj': 2, 'add_rate': 0.3228208868203887, 'tem': 1.4411078753473117, 'consis_rate': 1.0359484895668347, 'use_att': 1}
mean: 0.7973
[0.793 0.793 0.794 0.814 0.806 0.812 0.777 0.804 0.776 0.804]
cur_param: {'lr': 0.0038654635327137806, 'weight_decay': 0.001083511302959705, 'dropout': 0.6240817886606116, 'patience': 80, 'lr_reduce_freq': 70, 'spt_alg': 'prim', 'spt_attr': 'similarity', 'manifold': 'PoincareBall', 'num_layers': 3, 'num_adj': 8, 'add_rate': 0.2356724468837728, 'tem': 1.5104305143864853, 'consis_rate': 0.9172811943377519, 'use_att': 1}
mean: 0.8055
[0.789 0.806 0.814 0.807 0.787 0.809 0.808 0.806 0.818 0.811]
cur_param: {'lr': 0.005915594773429954, 'weight_decay': 0.0008755965245766836, 'dropout': 0.5850846398793891, 'patience': 80, 'lr_reduce_freq': 70, 'spt_alg': 'prim', 'spt_attr': 'similarity', 'manifold': 'PoincareBall', 'num_layers': 3, 'num_adj': 8, 'add_rate': 0.2723247041480352, 'tem': 1.2416833927555864, 'consis_rate': 1.1887884688821728, 'use_att': 1}
mean: 0.8107
[0.798 0.821 0.806 0.818 0.801 0.82  0.808 0.815 0.816 0.804]
cur_param: {'lr': 0.005869342239272571, 'weight_decay': 0.0006608454385814475, 'dropout': 0.5886860377660575, 'patience': 80, 'lr_reduce_freq': 70, 'spt_alg': 'prim', 'spt_attr': 'similarity', 'manifold': 'PoincareBall', 'num_layers': 3, 'num_adj': 8, 'add_rate': 0.26589676369536663, 'tem': 1.3721963257187542, 'consis_rate': 1.1469986627370838, 'use_att': 1}
mean: 0.8054
[0.793 0.806 0.813 0.813 0.801 0.817 0.795 0.81  0.81  0.796]
cur_param: {'lr': 0.0082614702867391, 'weight_decay': 0.0009201143956067694, 'dropout': 0.9365311866478343, 'patience': 80, 'lr_reduce_freq': 70, 'spt_alg': 'prim', 'spt_attr': 'similarity', 'manifold': 'PoincareBall', 'num_layers': 3, 'num_adj': 8, 'add_rate': 0.32628987562706835, 'tem': 1.2751709317664444, 'consis_rate': 1.3005727516004573, 'use_att': 1}
mean: 0.3339
[0.319 0.319 0.316 0.471 0.319 0.319 0.319 0.319 0.319 0.319]
cur_param: {'lr': 0.004541193569841602, 'weight_decay': 0.0005557082315025336, 'dropout': 0.6382534000925228, 'patience': 80, 'lr_reduce_freq': 70, 'spt_alg': 'prim', 'spt_attr': 'similarity', 'manifold': 'PoincareBall', 'num_layers': 3, 'num_adj': 8, 'add_rate': 0.3513468209510529, 'tem': 1.3108942093250273, 'consis_rate': 1.0821389599571174, 'use_att': 1}
mean: 0.8074999999999999
[0.795 0.815 0.813 0.806 0.81  0.811 0.811 0.81  0.798 0.806]
cur_param: {'lr': 0.004411510772602115, 'weight_decay': 0.00059962518639288, 'dropout': 0.6385961183252731, 'patience': 80, 'lr_reduce_freq': 70, 'spt_alg': 'prim', 'spt_attr': 'similarity', 'manifold': 'PoincareBall', 'num_layers': 3, 'num_adj': 8, 'add_rate': 0.3668579229038763, 'tem': 1.3194282889881368, 'consis_rate': 1.0920179354447468, 'use_att': 1}
mean: 0.8088000000000001
[0.79  0.814 0.816 0.813 0.797 0.82  0.814 0.813 0.806 0.805]
cur_param: {'lr': 0.002674456990193649, 'weight_decay': 0.0005582634050579707, 'dropout': 0.662420225904487, 'patience': 80, 'lr_reduce_freq': 70, 'spt_alg': 'prim', 'spt_attr': 'similarity', 'manifold': 'PoincareBall', 'num_layers': 3, 'num_adj': 8, 'add_rate': 0.3695896644446472, 'tem': 1.3244647034490515, 'consis_rate': 1.2422191897153014, 'use_att': 1}
mean: 0.7952
[0.769 0.802 0.803 0.788 0.775 0.796 0.799 0.802 0.818 0.8  ]
cur_param: {'lr': 0.004336392836005752, 'weight_decay': 0.0006339542137968662, 'dropout': 0.6952736471846811, 'patience': 80, 'lr_reduce_freq': 70, 'spt_alg': 'prim', 'spt_attr': 'similarity', 'manifold': 'PoincareBall', 'num_layers': 4, 'num_adj': 8, 'add_rate': 0.3506781860778524, 'tem': 1.364173502771866, 'consis_rate': 1.0858298888818996, 'use_att': 1}
mean: 0.6618999999999999
[0.579 0.672 0.509 0.753 0.771 0.726 0.68  0.58  0.736 0.613]
cur_param: {'lr': 0.0048327111424869545, 'weight_decay': 0.0007831824920542937, 'dropout': 0.7182019638139073, 'patience': 80, 'lr_reduce_freq': 70, 'spt_alg': 'prim', 'spt_attr': 'similarity', 'manifold': 'PoincareBall', 'num_layers': 3, 'num_adj': 8, 'add_rate': 0.391390323359833, 'tem': 1.3128426050856852, 'consis_rate': 1.1272115274313264, 'use_att': 0}
mean: 0.7892
[0.784 0.786 0.802 0.77  0.823 0.783 0.758 0.795 0.809 0.782]
cur_param: {'lr': 0.003584093438512708, 'weight_decay': 0.000548779822344089, 'dropout': 0.6516906251154638, 'patience': 80, 'lr_reduce_freq': 70, 'spt_alg': 'prim', 'spt_attr': 'similarity', 'manifold': 'PoincareBall', 'num_layers': 3, 'num_adj': 8, 'add_rate': 0.3065906439291219, 'tem': 1.4257076167755223, 'consis_rate': 1.1845511938323023, 'use_att': 1}
mean: 0.7984000000000001
[0.782 0.805 0.801 0.809 0.792 0.808 0.801 0.808 0.799 0.779]
best param:{'lr': 0.005915594773429954, 'weight_decay': 0.0008755965245766836, 'dropout': 0.5850846398793891, 'patience': 80, 'lr_reduce_freq': 70, 'spt_alg': 'prim', 'spt_attr': 'similarity', 'manifold': 'PoincareBall', 'num_layers': 3, 'num_adj': 8, 'add_rate': 0.2723247041480352, 'tem': 1.2416833927555864, 'consis_rate': 1.1887884688821728, 'use_att': 1}
best score:0.8107

Final results:

0.8107
