[32m[I 2022-07-01 09:10:43,554][0m Trial 53 finished with value: 0.8093 and parameters: {'lr': 0.007036734695285445, 'weight_decay': 0.0005846172213614549, 'dropout': 0.14137921611407783, 'patience': 90, 'lr_reduce_freq': 30, 'spt_alg': 'prim', 'spt_attr': 'similarity', 'manifold': 'PoincareBall', 'num_layers': 3, 'dim': 352, 'num_adj': 6, 'add_rate': 0.35792050902957284, 'tem': 1.2309145090940392, 'consis_rate': 1.5827534014403162, 'use_att': 1}. Best is trial 20 with value: 0.8122.[0m

mean: 0.7996000000000001
[0.794 0.797 0.8   0.803 0.813 0.807 0.805 0.78  0.802 0.795]
cur_param: {'lr': 0.005195987597296819, 'weight_decay': 0.0006682996873498527, 'dropout': 0.15860888733970874, 'patience': 80, 'lr_reduce_freq': 90, 'spt_alg': 'kruskal', 'spt_attr': 'edge_degree', 'manifold': 'PoincareBall', 'num_layers': 5, 'dim': 400, 'num_adj': 6, 'add_rate': 0.11266243753805183, 'tem': 1.2599966876195703, 'consis_rate': 1.2326457307584555, 'use_att': 1}
mean: 0.7945
[0.787 0.812 0.767 0.795 0.791 0.811 0.807 0.791 0.797 0.787]
cur_param: {'lr': 0.010306557932756703, 'weight_decay': 0.0009320733029045505, 'dropout': 0.5670366285063222, 'patience': 70, 'lr_reduce_freq': 75, 'spt_alg': 'prim', 'spt_attr': 'similarity', 'manifold': 'PoincareBall', 'num_layers': 4, 'dim': 368, 'num_adj': 6, 'add_rate': 0.19809134735933054, 'tem': 0.936131792379401, 'consis_rate': 0.6371693787497079, 'use_att': 1}
mean: 0.8024000000000001
[0.813 0.786 0.804 0.813 0.823 0.78  0.813 0.775 0.812 0.805]
cur_param: {'lr': 0.027149157914032877, 'weight_decay': 0.0012806824115765888, 'dropout': 0.33360211135314954, 'patience': 90, 'lr_reduce_freq': 90, 'spt_alg': 'prim', 'spt_attr': 'similarity', 'manifold': 'PoincareBall', 'num_layers': 3, 'dim': 272, 'num_adj': 6, 'add_rate': 0.28701933309200717, 'tem': 1.0182305929466928, 'consis_rate': 1.5854357916738555, 'use_att': 0}
mean: 0.7992999999999999
[0.789 0.795 0.8   0.793 0.804 0.797 0.807 0.807 0.802 0.799]
cur_param: {'lr': 0.0018997579231295884, 'weight_decay': 0.0036371357031420052, 'dropout': 0.7611127260526727, 'patience': 60, 'lr_reduce_freq': 45, 'spt_alg': 'kruskal', 'spt_attr': 'edge_degree', 'manifold': 'Hyperboloid', 'num_layers': 3, 'dim': 176, 'num_adj': 6, 'add_rate': 0.21914134502063365, 'tem': 0.800140125712524, 'consis_rate': 1.408933298996357, 'use_att': 1}
mean: 0.3956
[0.553 0.416 0.33  0.263 0.423 0.323 0.31  0.471 0.561 0.306]
cur_param: {'lr': 0.002452952465643069, 'weight_decay': 0.0008064544019255726, 'dropout': 0.19451472743649634, 'patience': 80, 'lr_reduce_freq': 60, 'spt_alg': 'prim', 'spt_attr': 'similarity', 'manifold': 'PoincareBall', 'num_layers': 3, 'dim': 336, 'num_adj': 6, 'add_rate': 0.3308602549957232, 'tem': 1.067615242141448, 'consis_rate': 1.6496815228897046, 'use_att': 1}
mean: 0.8073
[0.797 0.802 0.815 0.808 0.811 0.806 0.794 0.815 0.819 0.806]
cur_param: {'lr': 0.002722256242948252, 'weight_decay': 0.001096174787721338, 'dropout': 0.16432084646518336, 'patience': 80, 'lr_reduce_freq': 60, 'spt_alg': 'prim', 'spt_attr': 'similarity', 'manifold': 'PoincareBall', 'num_layers': 3, 'dim': 304, 'num_adj': 6, 'add_rate': 0.37256502311445666, 'tem': 1.0749597540588796, 'consis_rate': 1.794588750203797, 'use_att': 1}
mean: 0.8077
[0.812 0.814 0.804 0.807 0.795 0.804 0.809 0.811 0.804 0.817]
cur_param: {'lr': 0.0010489586099590037, 'weight_decay': 0.0006242622966981105, 'dropout': 0.2616370588022343, 'patience': 80, 'lr_reduce_freq': 60, 'spt_alg': 'prim', 'spt_attr': 'similarity', 'manifold': 'PoincareBall', 'num_layers': 3, 'dim': 352, 'num_adj': 6, 'add_rate': 0.4349030746614938, 'tem': 1.2358447868153624, 'consis_rate': 1.0675005739846894, 'use_att': 1}
mean: 0.8071999999999999
[0.803 0.812 0.813 0.818 0.797 0.795 0.805 0.813 0.814 0.802]
cur_param: {'lr': 0.0015147039668407334, 'weight_decay': 0.0015596333114915705, 'dropout': 0.22213577477123617, 'patience': 70, 'lr_reduce_freq': 75, 'spt_alg': 'prim', 'spt_attr': 'similarity', 'manifold': 'PoincareBall', 'num_layers': 3, 'dim': 240, 'num_adj': 6, 'add_rate': 0.15270750394844587, 'tem': 0.9829831908535086, 'consis_rate': 1.9423152625052338, 'use_att': 1}
mean: 0.8063
[0.81  0.802 0.815 0.804 0.811 0.808 0.803 0.797 0.804 0.809]
cur_param: {'lr': 0.004234860091444928, 'weight_decay': 0.0008344465784489283, 'dropout': 0.12949194582182083, 'patience': 90, 'lr_reduce_freq': 45, 'spt_alg': 'prim', 'spt_attr': 'similarity', 'manifold': 'PoincareBall', 'num_layers': 3, 'dim': 320, 'num_adj': 6, 'add_rate': 0.3311073704089222, 'tem': 1.1325239639501121, 'consis_rate': 1.6861973389109557, 'use_att': 1}
mean: 0.8096
[0.809 0.8   0.812 0.81  0.812 0.806 0.821 0.796 0.82  0.81 ]
cur_param: {'lr': 0.0019552998342084425, 'weight_decay': 0.01647493559260726, 'dropout': 0.2747209822391289, 'patience': 70, 'lr_reduce_freq': 90, 'spt_alg': 'prim', 'spt_attr': 'similarity', 'manifold': 'PoincareBall', 'num_layers': 5, 'dim': 272, 'num_adj': 6, 'add_rate': 0.39848042055165805, 'tem': 1.0470905933779426, 'consis_rate': 1.834562172816944, 'use_att': 1}
mean: 0.30910000000000004
[0.319 0.319 0.395 0.233 0.186 0.319 0.503 0.319 0.272 0.226]
cur_param: {'lr': 0.0009984130918502141, 'weight_decay': 0.0022458720690833297, 'dropout': 0.173913639224799, 'patience': 90, 'lr_reduce_freq': 60, 'spt_alg': 'prim', 'spt_attr': 'similarity', 'manifold': 'PoincareBall', 'num_layers': 3, 'dim': 384, 'num_adj': 6, 'add_rate': 0.23601236315385807, 'tem': 0.8962160320187114, 'consis_rate': 1.7796291541460696, 'use_att': 1}
mean: 0.8089000000000001
[0.811 0.822 0.8   0.804 0.809 0.806 0.814 0.804 0.815 0.804]
cur_param: {'lr': 0.0007403301080974492, 'weight_decay': 0.005147208355947801, 'dropout': 0.3093643148880202, 'patience': 80, 'lr_reduce_freq': 75, 'spt_alg': 'prim', 'spt_attr': 'edge_degree', 'manifold': 'PoincareBall', 'num_layers': 3, 'dim': 128, 'num_adj': 2, 'add_rate': 0.2857270593693431, 'tem': 0.9414314390420231, 'consis_rate': 1.5715861106016067, 'use_att': 1}
mean: 0.7894
[0.796 0.768 0.786 0.787 0.799 0.81  0.791 0.789 0.779 0.789]
cur_param: {'lr': 0.003004530209809715, 'weight_decay': 0.0006088742106654632, 'dropout': 0.10592705309706611, 'patience': 80, 'lr_reduce_freq': 90, 'spt_alg': 'prim', 'spt_attr': 'similarity', 'manifold': 'PoincareBall', 'num_layers': 3, 'dim': 224, 'num_adj': 6, 'add_rate': 0.4501592657764806, 'tem': 1.01107527307726, 'consis_rate': 1.4399173822151774, 'use_att': 1}
mean: 0.8036000000000001
[0.804 0.799 0.816 0.814 0.798 0.781 0.793 0.804 0.803 0.824]
cur_param: {'lr': 0.0013105689923359556, 'weight_decay': 0.0011968258983417847, 'dropout': 0.22670396871972262, 'patience': 80, 'lr_reduce_freq': 45, 'spt_alg': 'prim', 'spt_attr': 'similarity', 'manifold': 'PoincareBall', 'num_layers': 3, 'dim': 304, 'num_adj': 6, 'add_rate': 0.4996832444269744, 'tem': 0.8055953742972609, 'consis_rate': 1.2741708015225504, 'use_att': 0}
mean: 0.7995
[0.793 0.809 0.798 0.807 0.806 0.804 0.788 0.795 0.798 0.797]
cur_param: {'lr': 0.007069089515567104, 'weight_decay': 0.0008594460881482883, 'dropout': 0.13642104187324217, 'patience': 90, 'lr_reduce_freq': 45, 'spt_alg': 'prim', 'spt_attr': 'similarity', 'manifold': 'PoincareBall', 'num_layers': 3, 'dim': 336, 'num_adj': 6, 'add_rate': 0.33098789449889676, 'tem': 1.146773523055271, 'consis_rate': 1.6646260437499951, 'use_att': 1}
mean: 0.8115
[0.802 0.817 0.812 0.803 0.822 0.803 0.816 0.812 0.82  0.808]
cur_param: {'lr': 0.007120540483014683, 'weight_decay': 0.0008866753459122552, 'dropout': 0.1420661800247556, 'patience': 90, 'lr_reduce_freq': 30, 'spt_alg': 'prim', 'spt_attr': 'similarity', 'manifold': 'PoincareBall', 'num_layers': 3, 'dim': 336, 'num_adj': 6, 'add_rate': 0.31008712872092814, 'tem': 1.1516169408651473, 'consis_rate': 1.6306299023471786, 'use_att': 1}
mean: 0.8119999999999999
[0.805 0.807 0.817 0.802 0.818 0.803 0.815 0.82  0.818 0.815]
cur_param: {'lr': 0.007036734695285445, 'weight_decay': 0.0005846172213614549, 'dropout': 0.14137921611407783, 'patience': 90, 'lr_reduce_freq': 30, 'spt_alg': 'prim', 'spt_attr': 'similarity', 'manifold': 'PoincareBall', 'num_layers': 3, 'dim': 352, 'num_adj': 6, 'add_rate': 0.35792050902957284, 'tem': 1.2309145090940392, 'consis_rate': 1.5827534014403162, 'use_att': 1}
mean: 0.8093
[0.804 0.813 0.802 0.811 0.823 0.806 0.795 0.814 0.812 0.813]
cur_param: {'lr': 0.01691869377733249, 'weight_decay': 0.0013704280052185174, 'dropout': 0.1010379414530954, 'patience': 90, 'lr_reduce_freq': 30, 'spt_alg': 'prim', 'spt_attr': 'similarity', 'manifold': 'PoincareBall', 'num_layers': 3, 'dim': 256, 'num_adj': 6, 'add_rate': 0.26831164570040833, 'tem': 1.31781373565157, 'consis_rate': 1.5232369903112652, 'use_att': 1}
mean: 0.8125
[0.781 0.815 0.823 0.818 0.83  0.82  0.808 0.808 0.807 0.815][32m[I 2022-07-01 09:17:59,998][0m Trial 54 finished with value: 0.8125 and parameters: {'lr': 0.01691869377733249, 'weight_decay': 0.0013704280052185174, 'dropout': 0.1010379414530954, 'patience': 90, 'lr_reduce_freq': 30, 'spt_alg': 'prim', 'spt_attr': 'similarity', 'manifold': 'PoincareBall', 'num_layers': 3, 'dim': 256, 'num_adj': 6, 'add_rate': 0.26831164570040833, 'tem': 1.31781373565157, 'consis_rate': 1.5232369903112652, 'use_att': 1}. Best is trial 54 with value: 0.8125.[0m
[32m[I 2022-07-01 09:25:12,586][0m Trial 55 finished with value: 0.8079000000000001 and parameters: {'lr': 0.018058818327005892, 'weight_decay': 0.001334477717361865, 'dropout': 0.10267213643371918, 'patience': 90, 'lr_reduce_freq': 30, 'spt_alg': 'prim', 'spt_attr': 'similarity', 'manifold': 'PoincareBall', 'num_layers': 3, 'dim': 288, 'num_adj': 6, 'add_rate': 0.16882976925847193, 'tem': 1.3865001369277936, 'consis_rate': 1.5272195200694716, 'use_att': 1}. Best is trial 54 with value: 0.8125.[0m
[32m[I 2022-07-01 09:33:56,180][0m Trial 56 finished with value: 0.8064 and parameters: {'lr': 0.039516888392751505, 'weight_decay': 0.0016897339163299645, 'dropout': 0.13971942398419224, 'patience': 100, 'lr_reduce_freq': 30, 'spt_alg': 'prim', 'spt_attr': 'similarity', 'manifold': 'PoincareBall', 'num_layers': 3, 'dim': 368, 'num_adj': 6, 'add_rate': 0.21699700138435346, 'tem': 1.2946732488364527, 'consis_rate': 1.9018818151468593, 'use_att': 1}. Best is trial 54 with value: 0.8125.[0m
[32m[I 2022-07-01 09:52:32,633][0m Trial 57 finished with value: 0.7815000000000001 and parameters: {'lr': 0.0064510485743596606, 'weight_decay': 0.0011015495677544264, 'dropout': 0.19035688868393608, 'patience': 90, 'lr_reduce_freq': 30, 'spt_alg': 'kruskal', 'spt_attr': 'similarity', 'manifold': 'Hyperboloid', 'num_layers': 5, 'dim': 224, 'num_adj': 4, 'add_rate': 0.2874994794385001, 'tem': 1.3535796124807773, 'consis_rate': 1.4271222892984212, 'use_att': 1}. Best is trial 54 with value: 0.8125.[0m
[32m[I 2022-07-01 10:04:23,254][0m Trial 58 finished with value: 0.808 and parameters: {'lr': 0.010494667410940009, 'weight_decay': 0.0009716898893663791, 'dropout': 0.10003492233893424, 'patience': 100, 'lr_reduce_freq': 30, 'spt_alg': 'prim', 'spt_attr': 'similarity', 'manifold': 'PoincareBall', 'num_layers': 4, 'dim': 272, 'num_adj': 6, 'add_rate': 0.26743396633849037, 'tem': 1.4757580011283142, 'consis_rate': 1.7280642548653995, 'use_att': 1}. Best is trial 54 with value: 0.8125.[0m
[32m[I 2022-07-01 10:12:49,339][0m Trial 59 finished with value: 0.8131999999999999 and parameters: {'lr': 0.01642333463188271, 'weight_decay': 0.003117745908993266, 'dropout': 0.48283176885729734, 'patience': 90, 'lr_reduce_freq': 45, 'spt_alg': 'prim', 'spt_attr': 'edge_degree', 'manifold': 'PoincareBall', 'num_layers': 3, 'dim': 320, 'num_adj': 6, 'add_rate': 0.39506463803504144, 'tem': 1.1503444033939925, 'consis_rate': 1.84673642646597, 'use_att': 1}. Best is trial 59 with value: 0.8131999999999999.[0m
[32m[I 2022-07-01 10:20:46,487][0m Trial 60 finished with value: 0.8126 and parameters: {'lr': 0.062455318396824104, 'weight_decay': 0.00966113034865956, 'dropout': 0.47576545473920817, 'patience': 90, 'lr_reduce_freq': 30, 'spt_alg': 'prim', 'spt_attr': 'edge_degree', 'manifold': 'PoincareBall', 'num_layers': 3, 'dim': 192, 'num_adj': 4, 'add_rate': 0.3987452794928441, 'tem': 1.1605560193800213, 'consis_rate': 1.8282331332935506, 'use_att': 1}. Best is trial 59 with value: 0.8131999999999999.[0m
[32m[I 2022-07-01 10:29:17,380][0m Trial 61 finished with value: 0.8112 and parameters: {'lr': 0.0810632648088608, 'weight_decay': 0.00877609928283991, 'dropout': 0.4661393357799919, 'patience': 90, 'lr_reduce_freq': 30, 'spt_alg': 'prim', 'spt_attr': 'edge_degree', 'manifold': 'PoincareBall', 'num_layers': 3, 'dim': 176, 'num_adj': 4, 'add_rate': 0.4019758411940155, 'tem': 1.161702065361768, 'consis_rate': 1.8447401685122682, 'use_att': 1}. Best is trial 59 with value: 0.8131999999999999.[0m
[32m[I 2022-07-01 10:35:29,000][0m Trial 62 finished with value: 0.8101 and parameters: {'lr': 0.058191117256672836, 'weight_decay': 0.0030102835496132996, 'dropout': 0.48662463820578683, 'patience': 90, 'lr_reduce_freq': 30, 'spt_alg': 'prim', 'spt_attr': 'edge_degree', 'manifold': 'PoincareBall', 'num_layers': 3, 'dim': 192, 'num_adj': 4, 'add_rate': 0.3536817258501751, 'tem': 1.2114164909827048, 'consis_rate': 1.9149507070792358, 'use_att': 1}. Best is trial 59 with value: 0.8131999999999999.[0m
[32m[I 2022-07-01 10:43:57,301][0m Trial 63 finished with value: 0.8103999999999999 and parameters: {'lr': 0.07142973592416035, 'weight_decay': 0.009159832152599611, 'dropout': 0.45668548967130496, 'patience': 90, 'lr_reduce_freq': 30, 'spt_alg': 'prim', 'spt_attr': 'edge_degree', 'manifold': 'PoincareBall', 'num_layers': 3, 'dim': 144, 'num_adj': 4, 'add_rate': 0.3883194220988665, 'tem': 1.1543542854933282, 'consis_rate': 1.8521021267306386, 'use_att': 1}. Best is trial 59 with value: 0.8131999999999999.[0m
[32m[I 2022-07-01 10:52:25,420][0m Trial 64 finished with value: 0.8150000000000001 and parameters: {'lr': 0.08946703175697465, 'weight_decay': 0.006508276145447672, 'dropout': 0.5609099574664672, 'patience': 90, 'lr_reduce_freq': 30, 'spt_alg': 'prim', 'spt_attr': 'edge_degree', 'manifold': 'PoincareBall', 'num_layers': 3, 'dim': 176, 'num_adj': 4, 'add_rate': 0.4106968539251101, 'tem': 1.1130661956973746, 'consis_rate': 1.8036622009118177, 'use_att': 1}. Best is trial 64 with value: 0.8150000000000001.[0m
[32m[I 2022-07-01 11:01:51,026][0m Trial 65 finished with value: 0.8092 and parameters: {'lr': 0.04991515428164128, 'weight_decay': 0.00600774848004567, 'dropout': 0.5633658671930436, 'patience': 90, 'lr_reduce_freq': 45, 'spt_alg': 'prim', 'spt_attr': 'edge_degree', 'manifold': 'PoincareBall', 'num_layers': 3, 'dim': 176, 'num_adj': 4, 'add_rate': 0.47871959121925045, 'tem': 1.110289387974033, 'consis_rate': 1.768983515864402, 'use_att': 1}. Best is trial 64 with value: 0.8150000000000001.[0m
[32m[I 2022-07-01 11:08:40,462][0m Trial 66 finished with value: 0.4239 and parameters: {'lr': 0.034449280615157965, 'weight_decay': 0.014081913857548027, 'dropout': 0.5484446700663428, 'patience': 100, 'lr_reduce_freq': 45, 'spt_alg': 'prim', 'spt_attr': 'edge_degree', 'manifold': 'PoincareBall', 'num_layers': 3, 'dim': 208, 'num_adj': 4, 'add_rate': 0.4407413595347952, 'tem': 1.2667220381057072, 'consis_rate': 1.9430532900431592, 'use_att': 1}. Best is trial 64 with value: 0.8150000000000001.[0m
[32m[I 2022-07-01 11:11:37,129][0m Trial 67 finished with value: 0.8036 and parameters: {'lr': 0.017117131475846873, 'weight_decay': 0.007465082778504392, 'dropout': 0.6171402068786076, 'patience': 100, 'lr_reduce_freq': 30, 'spt_alg': 'prim', 'spt_attr': 'edge_degree', 'manifold': 'PoincareBall', 'num_layers': 3, 'dim': 128, 'num_adj': 4, 'add_rate': 0.42704365027231406, 'tem': 1.194461924455846, 'consis_rate': 1.8219033663382205, 'use_att': 0}. Best is trial 64 with value: 0.8150000000000001.[0m
[32m[I 2022-07-01 11:24:11,323][0m Trial 68 finished with value: 0.8037000000000001 and parameters: {'lr': 0.02618837780888644, 'weight_decay': 0.004947375702166286, 'dropout': 0.511083196132493, 'patience': 90, 'lr_reduce_freq': 45, 'spt_alg': 'prim', 'spt_attr': 'edge_degree', 'manifold': 'Hyperboloid', 'num_layers': 3, 'dim': 160, 'num_adj': 4, 'add_rate': 0.5359382122957711, 'tem': 1.0908947247850345, 'consis_rate': 1.71052621628902, 'use_att': 1}. Best is trial 64 with value: 0.8150000000000001.[0m
[32m[I 2022-07-01 11:31:45,059][0m Trial 69 finished with value: 0.32880000000000004 and parameters: {'lr': 0.09785553373078101, 'weight_decay': 0.021292314242236977, 'dropout': 0.5871666271688354, 'patience': 90, 'lr_reduce_freq': 30, 'spt_alg': 'kruskal', 'spt_attr': 'edge_degree', 'manifold': 'PoincareBall', 'num_layers': 4, 'dim': 336, 'num_adj': 4, 'add_rate': 0.38258003221291476, 'tem': 1.4261177832060896, 'consis_rate': 1.9607626175715687, 'use_att': 1}. Best is trial 64 with value: 0.8150000000000001.[0m
[32m[I 2022-07-01 11:43:12,027][0m Trial 70 finished with value: 0.319 and parameters: {'lr': 0.00862232507875393, 'weight_decay': 0.009074151427228361, 'dropout': 0.6811585286995573, 'patience': 100, 'lr_reduce_freq': 45, 'spt_alg': 'prim', 'spt_attr': 'edge_degree', 'manifold': 'PoincareBall', 'num_layers': 5, 'dim': 416, 'num_adj': 4, 'add_rate': 0.315607101737834, 'tem': 1.210799263818888, 'consis_rate': 1.5190169990387306, 'use_att': 1}. Best is trial 64 with value: 0.8150000000000001.[0m
[32m[I 2022-07-01 11:51:28,454][0m Trial 71 finished with value: 0.8189 and parameters: {'lr': 0.07424634005316566, 'weight_decay': 0.009868201465074479, 'dropout': 0.41216974429561526, 'patience': 90, 'lr_reduce_freq': 30, 'spt_alg': 'prim', 'spt_attr': 'edge_degree', 'manifold': 'PoincareBall', 'num_layers': 3, 'dim': 176, 'num_adj': 4, 'add_rate': 0.39559603318487113, 'tem': 1.1700485673817664, 'consis_rate': 1.8675044912473866, 'use_att': 1}. Best is trial 71 with value: 0.8189.[0m
