[32m[I 2022-06-22 04:32:42,033][0m Trial 27 finished with value: 0.5318999999999999 and parameters: {'lr': 0.03172626668135754, 'weight_decay': 0.0029963276617792547, 'dropout': 0.5262134828232494, 'patience': 100, 'lr_reduce_freq': 90, 'spt_alg': 'prim', 'spt_attr': 'edge_degree', 'manifold': 'PoincareBall', 'num_layers': 4, 'num_adj': 8, 'add_rate': 0.567251045301888, 'tem': 0.7380742338246543, 'consis_rate': 1.1180887394917591, 'use_att': 1}. Best is trial 20 with value: 0.8097.[0m
[32m[I 2022-06-22 04:52:29,567][0m Trial 28 finished with value: 0.8067 and parameters: {'lr': 0.013811517831782812, 'weight_decay': 0.0012073735642049237, 'dropout': 0.27607857190833995, 'patience': 80, 'lr_reduce_freq': 110, 'spt_alg': 'kruskal', 'spt_attr': 'edge_degree', 'manifold': 'PoincareBall', 'num_layers': 3, 'num_adj': 6, 'add_rate': 0.4704984817291449, 'tem': 1.8446010032664009, 'consis_rate': 0.4374820881732025, 'use_att': 1}. Best is trial 20 with value: 0.8097.[0m
[32m[I 2022-06-22 04:59:36,615][0m Trial 29 finished with value: 0.8049999999999999 and parameters: {'lr': 0.008247363913027682, 'weight_decay': 0.0007412742625260009, 'dropout': 0.8012034733495129, 'patience': 100, 'lr_reduce_freq': 130, 'spt_alg': 'kruskal', 'spt_attr': 'edge_degree', 'manifold': 'PoincareBall', 'num_layers': 3, 'num_adj': 8, 'add_rate': 0.6412287165290508, 'tem': 0.9486244379254825, 'consis_rate': 1.3552382102820468, 'use_att': 0}. Best is trial 20 with value: 0.8097.[0m
[32m[I 2022-06-22 05:20:16,587][0m Trial 30 finished with value: 0.8074000000000001 and parameters: {'lr': 0.0053036860655128314, 'weight_decay': 0.002345642360738643, 'dropout': 0.1937905324592639, 'patience': 80, 'lr_reduce_freq': 70, 'spt_alg': 'kruskal', 'spt_attr': 'edge_degree', 'manifold': 'PoincareBall', 'num_layers': 3, 'num_adj': 4, 'add_rate': 0.5896446572675431, 'tem': 1.3097417639963849, 'consis_rate': 1.0465742771243884, 'use_att': 1}. Best is trial 20 with value: 0.8097.[0m
[32m[I 2022-06-22 05:38:03,056][0m Trial 31 finished with value: 0.8083 and parameters: {'lr': 0.0050040251996067145, 'weight_decay': 0.0023807208341161084, 'dropout': 0.2022387126498129, 'patience': 80, 'lr_reduce_freq': 70, 'spt_alg': 'kruskal', 'spt_attr': 'edge_degree', 'manifold': 'PoincareBall', 'num_layers': 3, 'num_adj': 4, 'add_rate': 0.3874051997584932, 'tem': 1.4935306238072632, 'consis_rate': 1.0404042108871348, 'use_att': 1}. Best is trial 20 with value: 0.8097.[0m
[32m[I 2022-06-22 05:55:16,441][0m Trial 32 finished with value: 0.8003 and parameters: {'lr': 0.004841694946749604, 'weight_decay': 0.002695591453739855, 'dropout': 0.1523953891916603, 'patience': 80, 'lr_reduce_freq': 70, 'spt_alg': 'kruskal', 'spt_attr': 'edge_degree', 'manifold': 'PoincareBall', 'num_layers': 3, 'num_adj': 4, 'add_rate': 0.3808975611632773, 'tem': 1.2721092270964593, 'consis_rate': 1.0611868420698292, 'use_att': 1}. Best is trial 20 with value: 0.8097.[0m
[32m[I 2022-06-22 06:09:35,934][0m Trial 33 finished with value: 0.7889000000000002 and parameters: {'lr': 0.004047473309015221, 'weight_decay': 0.004792576329738541, 'dropout': 0.09381470964593927, 'patience': 80, 'lr_reduce_freq': 50, 'spt_alg': 'kruskal', 'spt_attr': 'edge_degree', 'manifold': 'PoincareBall', 'num_layers': 3, 'num_adj': 2, 'add_rate': 0.5356056624376128, 'tem': 1.1050292795157741, 'consis_rate': 0.8893138311109434, 'use_att': 1}. Best is trial 20 with value: 0.8097.[0m
[32m[I 2022-06-22 06:13:45,016][0m Trial 34 finished with value: 0.7574 and parameters: {'lr': 0.047950739172951624, 'weight_decay': 0.001390364190419525, 'dropout': 0.43405011504289304, 'patience': 80, 'lr_reduce_freq': 70, 'spt_alg': 'kruskal', 'spt_attr': 'similarity', 'manifold': 'PoincareBall', 'num_layers': 4, 'num_adj': 4, 'add_rate': 0.30352199024366167, 'tem': 1.360325503694749, 'consis_rate': 0.6497011459439515, 'use_att': 0}. Best is trial 20 with value: 0.8097.[0m
[32m[I 2022-06-22 06:32:42,004][0m Trial 35 finished with value: 0.7968 and parameters: {'lr': 0.02221048154194777, 'weight_decay': 0.0027831841710147472, 'dropout': 0.20966839905691723, 'patience': 80, 'lr_reduce_freq': 70, 'spt_alg': 'kruskal', 'spt_attr': 'similarity', 'manifold': 'PoincareBall', 'num_layers': 3, 'num_adj': 4, 'add_rate': 0.47389033293977467, 'tem': 1.0905355330310142, 'consis_rate': 1.1233330034232145, 'use_att': 1}. Best is trial 20 with value: 0.8097.[0m
[32m[I 2022-06-22 06:37:19,289][0m Trial 36 finished with value: 0.79 and parameters: {'lr': 0.010906730689200936, 'weight_decay': 0.0048060585961552, 'dropout': 0.459179071982075, 'patience': 80, 'lr_reduce_freq': 50, 'spt_alg': 'prim', 'spt_attr': 'edge_degree', 'manifold': 'PoincareBall', 'num_layers': 3, 'num_adj': 4, 'add_rate': 0.3670568201852663, 'tem': 1.1848182875678859, 'consis_rate': 0.8184550617710845, 'use_att': 0}. Best is trial 20 with value: 0.8097.[0m

mean: 0.1783
[0.144 0.383 0.13  0.319 0.064 0.103 0.165 0.103 0.176 0.196]
cur_param: {'lr': 0.003395015530861378, 'weight_decay': 0.006597510976425351, 'dropout': 0.8907946349880729, 'patience': 100, 'lr_reduce_freq': 90, 'spt_alg': 'kruskal', 'spt_attr': 'edge_degree', 'manifold': 'PoincareBall', 'num_layers': 3, 'num_adj': 4, 'add_rate': 0.49045526766725, 'tem': 1.8000202983246292, 'consis_rate': 1.2282325097546796, 'use_att': 1}
mean: 0.33380000000000004
[0.318 0.37  0.319 0.319 0.388 0.315 0.328 0.333 0.329 0.319]
cur_param: {'lr': 0.02357680434646212, 'weight_decay': 0.0016640407655683915, 'dropout': 0.5385006443030298, 'patience': 80, 'lr_reduce_freq': 70, 'spt_alg': 'kruskal', 'spt_attr': 'edge_degree', 'manifold': 'PoincareBall', 'num_layers': 3, 'num_adj': 8, 'add_rate': 0.42924057642694, 'tem': 1.4945790329665414, 'consis_rate': 0.7875974040686526, 'use_att': 1}
mean: 0.8097
[0.825 0.794 0.827 0.8   0.792 0.827 0.795 0.794 0.834 0.809]
cur_param: {'lr': 0.0259422679084481, 'weight_decay': 0.0014821559467350558, 'dropout': 0.5460621612566342, 'patience': 80, 'lr_reduce_freq': 70, 'spt_alg': 'kruskal', 'spt_attr': 'edge_degree', 'manifold': 'PoincareBall', 'num_layers': 3, 'num_adj': 8, 'add_rate': 0.41107722588190565, 'tem': 1.4741181166595088, 'consis_rate': 0.78985034678308, 'use_att': 1}
mean: 0.8085000000000001
[0.811 0.811 0.804 0.823 0.787 0.813 0.806 0.799 0.81  0.821]
cur_param: {'lr': 0.02267065371318519, 'weight_decay': 0.0011844442446528492, 'dropout': 0.6148099740949476, 'patience': 80, 'lr_reduce_freq': 70, 'spt_alg': 'kruskal', 'spt_attr': 'edge_degree', 'manifold': 'PoincareBall', 'num_layers': 3, 'num_adj': 8, 'add_rate': 0.42430104600237495, 'tem': 1.4133170009999325, 'consis_rate': 0.7469997026591008, 'use_att': 1}
mean: 0.8063
[0.808 0.817 0.792 0.815 0.794 0.827 0.815 0.808 0.799 0.788]
cur_param: {'lr': 0.028976457725820054, 'weight_decay': 0.0015351570232397362, 'dropout': 0.7799400633064785, 'patience': 80, 'lr_reduce_freq': 50, 'spt_alg': 'kruskal', 'spt_attr': 'edge_degree', 'manifold': 'PoincareBall', 'num_layers': 3, 'num_adj': 6, 'add_rate': 0.23752192679809656, 'tem': 1.5871558555641152, 'consis_rate': 1.6426692611749945, 'use_att': 1}
mean: 0.7962999999999999
[0.793 0.755 0.797 0.801 0.819 0.813 0.803 0.793 0.776 0.813]
cur_param: {'lr': 0.013066798119677508, 'weight_decay': 0.006850778934784914, 'dropout': 0.597076758695648, 'patience': 80, 'lr_reduce_freq': 70, 'spt_alg': 'kruskal', 'spt_attr': 'edge_degree', 'manifold': 'PoincareBall', 'num_layers': 3, 'num_adj': 8, 'add_rate': 0.521431421525276, 'tem': 1.357375014146862, 'consis_rate': 0.8760841550131624, 'use_att': 1}
mean: 0.3196
[0.319 0.319 0.319 0.319 0.319 0.319 0.319 0.32  0.324 0.319]
cur_param: {'lr': 0.007086479478876618, 'weight_decay': 0.0490898606560143, 'dropout': 0.39844348271470875, 'patience': 80, 'lr_reduce_freq': 50, 'spt_alg': 'kruskal', 'spt_attr': 'edge_degree', 'manifold': 'PoincareBall', 'num_layers': 3, 'num_adj': 6, 'add_rate': 0.41135984635294864, 'tem': 0.2675412049069552, 'consis_rate': 1.0814999788650643, 'use_att': 1}
mean: 0.3083
[0.319 0.319 0.209 0.322 0.319 0.319 0.319 0.319 0.319 0.319]
cur_param: {'lr': 0.09347076042719409, 'weight_decay': 0.00644705530138487, 'dropout': 0.6746302666745827, 'patience': 60, 'lr_reduce_freq': 70, 'spt_alg': 'kruskal', 'spt_attr': 'edge_degree', 'manifold': 'PoincareBall', 'num_layers': 3, 'num_adj': 8, 'add_rate': 0.24802429036328477, 'tem': 1.6827870190061271, 'consis_rate': 0.8218543698582373, 'use_att': 1}
mean: 0.2958
[0.344 0.319 0.319 0.319 0.317 0.216 0.167 0.319 0.319 0.319]
cur_param: {'lr': 0.03172626668135754, 'weight_decay': 0.0029963276617792547, 'dropout': 0.5262134828232494, 'patience': 100, 'lr_reduce_freq': 90, 'spt_alg': 'prim', 'spt_attr': 'edge_degree', 'manifold': 'PoincareBall', 'num_layers': 4, 'num_adj': 8, 'add_rate': 0.567251045301888, 'tem': 0.7380742338246543, 'consis_rate': 1.1180887394917591, 'use_att': 1}
mean: 0.5318999999999999
[0.438 0.455 0.711 0.725 0.488 0.777 0.319 0.694 0.319 0.393]
cur_param: {'lr': 0.013811517831782812, 'weight_decay': 0.0012073735642049237, 'dropout': 0.27607857190833995, 'patience': 80, 'lr_reduce_freq': 110, 'spt_alg': 'kruskal', 'spt_attr': 'edge_degree', 'manifold': 'PoincareBall', 'num_layers': 3, 'num_adj': 6, 'add_rate': 0.4704984817291449, 'tem': 1.8446010032664009, 'consis_rate': 0.4374820881732025, 'use_att': 1}
mean: 0.8067
[0.787 0.805 0.798 0.813 0.798 0.821 0.799 0.807 0.816 0.823]
cur_param: {'lr': 0.008247363913027682, 'weight_decay': 0.0007412742625260009, 'dropout': 0.8012034733495129, 'patience': 100, 'lr_reduce_freq': 130, 'spt_alg': 'kruskal', 'spt_attr': 'edge_degree', 'manifold': 'PoincareBall', 'num_layers': 3, 'num_adj': 8, 'add_rate': 0.6412287165290508, 'tem': 0.9486244379254825, 'consis_rate': 1.3552382102820468, 'use_att': 0}
mean: 0.8049999999999999
[0.793 0.819 0.784 0.811 0.823 0.788 0.804 0.818 0.8   0.81 ]
cur_param: {'lr': 0.0053036860655128314, 'weight_decay': 0.002345642360738643, 'dropout': 0.1937905324592639, 'patience': 80, 'lr_reduce_freq': 70, 'spt_alg': 'kruskal', 'spt_attr': 'edge_degree', 'manifold': 'PoincareBall', 'num_layers': 3, 'num_adj': 4, 'add_rate': 0.5896446572675431, 'tem': 1.3097417639963849, 'consis_rate': 1.0465742771243884, 'use_att': 1}
mean: 0.8074000000000001
[0.801 0.821 0.812 0.811 0.81  0.805 0.791 0.805 0.799 0.819]
cur_param: {'lr': 0.0050040251996067145, 'weight_decay': 0.0023807208341161084, 'dropout': 0.2022387126498129, 'patience': 80, 'lr_reduce_freq': 70, 'spt_alg': 'kruskal', 'spt_attr': 'edge_degree', 'manifold': 'PoincareBall', 'num_layers': 3, 'num_adj': 4, 'add_rate': 0.3874051997584932, 'tem': 1.4935306238072632, 'consis_rate': 1.0404042108871348, 'use_att': 1}
mean: 0.8083
[0.82  0.809 0.812 0.813 0.804 0.814 0.818 0.777 0.808 0.808]
cur_param: {'lr': 0.004841694946749604, 'weight_decay': 0.002695591453739855, 'dropout': 0.1523953891916603, 'patience': 80, 'lr_reduce_freq': 70, 'spt_alg': 'kruskal', 'spt_attr': 'edge_degree', 'manifold': 'PoincareBall', 'num_layers': 3, 'num_adj': 4, 'add_rate': 0.3808975611632773, 'tem': 1.2721092270964593, 'consis_rate': 1.0611868420698292, 'use_att': 1}
mean: 0.8003
[0.792 0.794 0.81  0.8   0.807 0.8   0.809 0.786 0.803 0.802]
cur_param: {'lr': 0.004047473309015221, 'weight_decay': 0.004792576329738541, 'dropout': 0.09381470964593927, 'patience': 80, 'lr_reduce_freq': 50, 'spt_alg': 'kruskal', 'spt_attr': 'edge_degree', 'manifold': 'PoincareBall', 'num_layers': 3, 'num_adj': 2, 'add_rate': 0.5356056624376128, 'tem': 1.1050292795157741, 'consis_rate': 0.8893138311109434, 'use_att': 1}
mean: 0.7889000000000002
[0.785 0.8   0.793 0.791 0.799 0.79  0.773 0.776 0.796 0.786]
cur_param: {'lr': 0.047950739172951624, 'weight_decay': 0.001390364190419525, 'dropout': 0.43405011504289304, 'patience': 80, 'lr_reduce_freq': 70, 'spt_alg': 'kruskal', 'spt_attr': 'similarity', 'manifold': 'PoincareBall', 'num_layers': 4, 'num_adj': 4, 'add_rate': 0.30352199024366167, 'tem': 1.360325503694749, 'consis_rate': 0.6497011459439515, 'use_att': 0}
mean: 0.7574
[0.787 0.731 0.746 0.71  0.773 0.714 0.784 0.783 0.784 0.762]
cur_param: {'lr': 0.02221048154194777, 'weight_decay': 0.0027831841710147472, 'dropout': 0.20966839905691723, 'patience': 80, 'lr_reduce_freq': 70, 'spt_alg': 'kruskal', 'spt_attr': 'similarity', 'manifold': 'PoincareBall', 'num_layers': 3, 'num_adj': 4, 'add_rate': 0.47389033293977467, 'tem': 1.0905355330310142, 'consis_rate': 1.1233330034232145, 'use_att': 1}
mean: 0.7968
[0.801 0.793 0.793 0.799 0.8   0.784 0.798 0.798 0.801 0.801]
cur_param: {'lr': 0.010906730689200936, 'weight_decay': 0.0048060585961552, 'dropout': 0.459179071982075, 'patience': 80, 'lr_reduce_freq': 50, 'spt_alg': 'prim', 'spt_attr': 'edge_degree', 'manifold': 'PoincareBall', 'num_layers': 3, 'num_adj': 4, 'add_rate': 0.3670568201852663, 'tem': 1.1848182875678859, 'consis_rate': 0.8184550617710845, 'use_att': 0}
mean: 0.79
[0.793 0.769 0.772 0.809 0.811 0.789 0.785 0.801 0.799 0.772]
cur_param: {'lr': 0.0023167452029875146, 'weight_decay': 0.0022646532557957675, 'dropout': 0.35793991165212813, 'patience': 60, 'lr_reduce_freq': 70, 'spt_alg': 'kruskal', 'spt_attr': 'similarity', 'manifold': 'PoincareBall', 'num_layers': 3, 'num_adj': 2, 'add_rate': 0.25306209251930517, 'tem': 1.6630492558531915, 'consis_rate': 0.981316695543452, 'use_att': 1}[32m[I 2022-06-22 06:50:02,147][0m Trial 37 finished with value: 0.8099000000000001 and parameters: {'lr': 0.0023167452029875146, 'weight_decay': 0.0022646532557957675, 'dropout': 0.35793991165212813, 'patience': 60, 'lr_reduce_freq': 70, 'spt_alg': 'kruskal', 'spt_attr': 'similarity', 'manifold': 'PoincareBall', 'num_layers': 3, 'num_adj': 2, 'add_rate': 0.25306209251930517, 'tem': 1.6630492558531915, 'consis_rate': 0.981316695543452, 'use_att': 1}. Best is trial 37 with value: 0.8099000000000001.[0m
[32m[I 2022-06-22 07:22:51,200][0m Trial 38 finished with value: 0.7433000000000001 and parameters: {'lr': 0.0023121191916868826, 'weight_decay': 0.003888472063888155, 'dropout': 0.3596106726965316, 'patience': 60, 'lr_reduce_freq': 50, 'spt_alg': 'kruskal', 'spt_attr': 'similarity', 'manifold': 'PoincareBall', 'num_layers': 4, 'num_adj': 2, 'add_rate': 0.24748532676817311, 'tem': 1.6114650109127313, 'consis_rate': 0.9221640147289935, 'use_att': 1}. Best is trial 37 with value: 0.8099000000000001.[0m
[32m[I 2022-06-22 07:24:52,470][0m Trial 39 finished with value: 0.2165 and parameters: {'lr': 0.0018853288876631753, 'weight_decay': 0.00961746585743007, 'dropout': 0.564600729290604, 'patience': 60, 'lr_reduce_freq': 70, 'spt_alg': 'kruskal', 'spt_attr': 'similarity', 'manifold': 'PoincareBall', 'num_layers': 3, 'num_adj': 2, 'add_rate': 0.28791675663192695, 'tem': 1.8602894921966984, 'consis_rate': 0.6992480426828946, 'use_att': 0}. Best is trial 37 with value: 0.8099000000000001.[0m
[32m[I 2022-06-22 07:34:39,246][0m Trial 40 finished with value: 0.8061 and parameters: {'lr': 0.00351648467132786, 'weight_decay': 0.0009739753572163157, 'dropout': 0.4869811728188226, 'patience': 60, 'lr_reduce_freq': 70, 'spt_alg': 'prim', 'spt_attr': 'similarity', 'manifold': 'PoincareBall', 'num_layers': 3, 'num_adj': 2, 'add_rate': 0.13093481608918106, 'tem': 1.6886726567459667, 'consis_rate': 0.9772631012758265, 'use_att': 1}. Best is trial 37 with value: 0.8099000000000001.[0m
[32m[I 2022-06-22 07:51:44,347][0m Trial 41 finished with value: 0.8019999999999999 and parameters: {'lr': 0.004517748873859643, 'weight_decay': 0.002264560404614274, 'dropout': 0.14773650299143248, 'patience': 60, 'lr_reduce_freq': 70, 'spt_alg': 'kruskal', 'spt_attr': 'similarity', 'manifold': 'PoincareBall', 'num_layers': 3, 'num_adj': 4, 'add_rate': 0.4021634968985144, 'tem': 1.517382413030335, 'consis_rate': 1.1503377598079165, 'use_att': 1}. Best is trial 37 with value: 0.8099000000000001.[0m
[32m[I 2022-06-22 08:17:21,948][0m Trial 42 finished with value: 0.7992000000000001 and parameters: {'lr': 0.005719142679374784, 'weight_decay': 0.0015066066321594571, 'dropout': 0.2589131586617984, 'patience': 100, 'lr_reduce_freq': 70, 'spt_alg': 'kruskal', 'spt_attr': 'similarity', 'manifold': 'PoincareBall', 'num_layers': 3, 'num_adj': 4, 'add_rate': 0.3417277214651731, 'tem': 1.292946692735668, 'consis_rate': 1.0159591620907937, 'use_att': 1}. Best is trial 37 with value: 0.8099000000000001.[0m
[32m[I 2022-06-22 08:34:37,987][0m Trial 43 finished with value: 0.7988 and parameters: {'lr': 0.008936307350279817, 'weight_decay': 0.000704067016932585, 'dropout': 0.061251982282769485, 'patience': 80, 'lr_reduce_freq': 90, 'spt_alg': 'kruskal', 'spt_attr': 'similarity', 'manifold': 'PoincareBall', 'num_layers': 3, 'num_adj': 4, 'add_rate': 0.446737804190571, 'tem': 1.4905894316535073, 'consis_rate': 0.8307215938495428, 'use_att': 1}. Best is trial 37 with value: 0.8099000000000001.[0m
[32m[I 2022-06-22 08:46:42,313][0m Trial 44 finished with value: 0.7941999999999999 and parameters: {'lr': 0.013102515815093132, 'weight_decay': 0.003907532718050814, 'dropout': 0.20503480471596364, 'patience': 60, 'lr_reduce_freq': 50, 'spt_alg': 'kruskal', 'spt_attr': 'edge_degree', 'manifold': 'PoincareBall', 'num_layers': 3, 'num_adj': 2, 'add_rate': 0.5300404589743368, 'tem': 1.4412467553385746, 'consis_rate': 1.3101301548451536, 'use_att': 1}. Best is trial 37 with value: 0.8099000000000001.[0m
[32m[I 2022-06-22 09:07:22,553][0m Trial 45 finished with value: 0.8078000000000001 and parameters: {'lr': 0.0015734598279153445, 'weight_decay': 0.0010508666559460435, 'dropout': 0.359570050715164, 'patience': 100, 'lr_reduce_freq': 70, 'spt_alg': 'kruskal', 'spt_attr': 'edge_degree', 'manifold': 'PoincareBall', 'num_layers': 3, 'num_adj': 4, 'add_rate': 0.208679828327889, 'tem': 1.186321625101682, 'consis_rate': 0.430093652613599, 'use_att': 1}. Best is trial 37 with value: 0.8099000000000001.[0m
[32m[I 2022-06-22 09:35:37,942][0m Trial 46 finished with value: 0.8035 and parameters: {'lr': 0.0016284595764993292, 'weight_decay': 0.0010306692402512862, 'dropout': 0.36720575771165825, 'patience': 100, 'lr_reduce_freq': 90, 'spt_alg': 'kruskal', 'spt_attr': 'similarity', 'manifold': 'PoincareBall', 'num_layers': 3, 'num_adj': 6, 'add_rate': 0.21255898313204008, 'tem': 1.199469436437748, 'consis_rate': 0.21195428925347615, 'use_att': 1}. Best is trial 37 with value: 0.8099000000000001.[0m
[32m[I 2022-06-22 09:47:54,128][0m Trial 47 finished with value: 0.8083 and parameters: {'lr': 0.0021606789177229914, 'weight_decay': 0.0006827611537760466, 'dropout': 0.3097833146377372, 'patience': 100, 'lr_reduce_freq': 70, 'spt_alg': 'kruskal', 'spt_attr': 'edge_degree', 'manifold': 'PoincareBall', 'num_layers': 3, 'num_adj': 2, 'add_rate': 0.19521640357272485, 'tem': 1.6707339417822673, 'consis_rate': 0.4849493625345883, 'use_att': 1}. Best is trial 37 with value: 0.8099000000000001.[0m
[32m[I 2022-06-22 09:50:49,653][0m Trial 48 finished with value: 0.7934000000000001 and parameters: {'lr': 0.0021732297825846013, 'weight_decay': 0.0006385271035543056, 'dropout': 0.3017992720502951, 'patience': 100, 'lr_reduce_freq': 50, 'spt_alg': 'kruskal', 'spt_attr': 'edge_degree', 'manifold': 'PoincareBall', 'num_layers': 3, 'num_adj': 2, 'add_rate': 0.2891414150109308, 'tem': 1.7505356813236939, 'consis_rate': 0.47870854169140803, 'use_att': 0}. Best is trial 37 with value: 0.8099000000000001.[0m
[32m[I 2022-06-22 09:59:32,103][0m Trial 49 finished with value: 0.26549999999999996 and parameters: {'lr': 0.0028952388810282005, 'weight_decay': 0.1854988431975021, 'dropout': 0.461260456575105, 'patience': 60, 'lr_reduce_freq': 90, 'spt_alg': 'kruskal', 'spt_attr': 'edge_degree', 'manifold': 'PoincareBall', 'num_layers': 4, 'num_adj': 2, 'add_rate': 0.18069768959253338, 'tem': 1.9990313976756893, 'consis_rate': 0.6556370817997368, 'use_att': 1}. Best is trial 37 with value: 0.8099000000000001.[0m
[32m[I 2022-06-22 10:08:09,028][0m Trial 50 finished with value: 0.6444 and parameters: {'lr': 0.06764294379187169, 'weight_decay': 0.0017207772069519553, 'dropout': 0.6647570114468789, 'patience': 100, 'lr_reduce_freq': 70, 'spt_alg': 'prim', 'spt_attr': 'similarity', 'manifold': 'PoincareBall', 'num_layers': 3, 'num_adj': 2, 'add_rate': 0.10554322326498194, 'tem': 1.6552008519440162, 'consis_rate': 0.7589846435222465, 'use_att': 1}. Best is trial 37 with value: 0.8099000000000001.[0m
[32m[I 2022-06-22 10:22:35,093][0m Trial 51 finished with value: 0.8071000000000002 and parameters: {'lr': 0.0013263850887001642, 'weight_decay': 0.0005026824940140226, 'dropout': 0.37632771818031024, 'patience': 100, 'lr_reduce_freq': 70, 'spt_alg': 'kruskal', 'spt_attr': 'edge_degree', 'manifold': 'PoincareBall', 'num_layers': 3, 'num_adj': 2, 'add_rate': 0.18198374724505378, 'tem': 1.5399021205338244, 'consis_rate': 0.37125883034760643, 'use_att': 1}. Best is trial 37 with value: 0.8099000000000001.[0m
[32m[I 2022-06-22 10:43:24,125][0m Trial 52 finished with value: 0.8038000000000001 and parameters: {'lr': 0.0015852741143121613, 'weight_decay': 0.0009383101918705315, 'dropout': 0.31039533550356047, 'patience': 100, 'lr_reduce_freq': 70, 'spt_alg': 'kruskal', 'spt_attr': 'edge_degree', 'manifold': 'PoincareBall', 'num_layers': 3, 'num_adj': 4, 'add_rate': 0.2672685857992006, 'tem': 1.3853314136560981, 'consis_rate': 0.43610527400603805, 'use_att': 1}. Best is trial 37 with value: 0.8099000000000001.[0m
[32m[I 2022-06-22 11:13:05,550][0m Trial 53 finished with value: 0.8106 and parameters: {'lr': 0.0010231502355153193, 'weight_decay': 0.0012626580457720318, 'dropout': 0.536135373115251, 'patience': 100, 'lr_reduce_freq': 90, 'spt_alg': 'kruskal', 'spt_attr': 'edge_degree', 'manifold': 'PoincareBall', 'num_layers': 3, 'num_adj': 4, 'add_rate': 0.32419158093665446, 'tem': 1.7477619145178886, 'consis_rate': 1.989656021932314, 'use_att': 1}. Best is trial 53 with value: 0.8106.[0m
