nohup: ignoring input
[32m[I 2022-06-26 04:27:00,632][0m A new study created in memory with name: no-name-1fafe7c8-1e5b-498f-b583-cb328d6f82fb[0m
[32m[I 2022-06-26 04:29:29,477][0m Trial 0 finished with value: 0.8041 and parameters: {'lr': 0.008817803843006275, 'weight_decay': 0.00047850374689503337, 'dropout': 0.6414686187085108, 'patience': 110, 'lr_reduce_freq': 100, 'spt_alg': 'kruskal', 'spt_attr': 'similarity', 'manifold': 'PoincareBall', 'num_layers': 3, 'dim': 312, 'num_adj': 2, 'add_rate': 0.5966818246538341, 'tem': 0.9240505512260722, 'consis_rate': 1.622041909086315, 'use_att': 0}. Best is trial 0 with value: 0.8041.[0m
[32m[I 2022-06-26 04:34:26,911][0m Trial 1 finished with value: 0.8059 and parameters: {'lr': 0.006361980582117662, 'weight_decay': 0.0003156646473549275, 'dropout': 0.5897437698379419, 'patience': 110, 'lr_reduce_freq': 120, 'spt_alg': 'kruskal', 'spt_attr': 'edge_degree', 'manifold': 'PoincareBall', 'num_layers': 3, 'dim': 236, 'num_adj': 6, 'add_rate': 0.5946847677428041, 'tem': 0.8220009637830665, 'consis_rate': 1.7504900518342272, 'use_att': 0}. Best is trial 1 with value: 0.8059.[0m
[32m[I 2022-06-26 04:47:18,831][0m Trial 2 finished with value: 0.8139999999999998 and parameters: {'lr': 0.0049922537190934604, 'weight_decay': 0.0006781392758080054, 'dropout': 0.6841443792324275, 'patience': 100, 'lr_reduce_freq': 120, 'spt_alg': 'prim', 'spt_attr': 'edge_degree', 'manifold': 'Hyperboloid', 'num_layers': 3, 'dim': 264, 'num_adj': 2, 'add_rate': 0.5748433782270733, 'tem': 1.1998745623016691, 'consis_rate': 1.6583026173902569, 'use_att': 1}. Best is trial 2 with value: 0.8139999999999998.[0m
[32m[I 2022-06-26 04:52:59,589][0m Trial 3 finished with value: 0.8072000000000001 and parameters: {'lr': 0.004453642964640386, 'weight_decay': 0.0006389062321886047, 'dropout': 0.5888039623238448, 'patience': 80, 'lr_reduce_freq': 110, 'spt_alg': 'kruskal', 'spt_attr': 'similarity', 'manifold': 'Hyperboloid', 'num_layers': 3, 'dim': 284, 'num_adj': 4, 'add_rate': 0.4145359737945145, 'tem': 1.1302499600632196, 'consis_rate': 1.8683659794169363, 'use_att': 0}. Best is trial 2 with value: 0.8139999999999998.[0m
[32m[I 2022-06-26 05:09:23,519][0m Trial 4 finished with value: 0.8150999999999999 and parameters: {'lr': 0.0035461324593925835, 'weight_decay': 0.00041486053382666974, 'dropout': 0.5364836816523493, 'patience': 100, 'lr_reduce_freq': 120, 'spt_alg': 'prim', 'spt_attr': 'edge_degree', 'manifold': 'Hyperboloid', 'num_layers': 3, 'dim': 300, 'num_adj': 4, 'add_rate': 0.3321650570005902, 'tem': 0.9250220583116896, 'consis_rate': 1.8779823875855712, 'use_att': 1}. Best is trial 4 with value: 0.8150999999999999.[0m
[32m[I 2022-06-26 05:33:16,464][0m Trial 5 finished with value: 0.8146999999999999 and parameters: {'lr': 0.005547451446069933, 'weight_decay': 0.00040484662864795915, 'dropout': 0.7546525104989262, 'patience': 120, 'lr_reduce_freq': 90, 'spt_alg': 'prim', 'spt_attr': 'edge_degree', 'manifold': 'Hyperboloid', 'num_layers': 3, 'dim': 264, 'num_adj': 6, 'add_rate': 0.3282575451795637, 'tem': 0.9687025802161826, 'consis_rate': 1.5923515909113555, 'use_att': 1}. Best is trial 4 with value: 0.8150999999999999.[0m
[32m[I 2022-06-26 05:54:47,460][0m Trial 6 finished with value: 0.8125 and parameters: {'lr': 0.007656870827129468, 'weight_decay': 0.0004964151344936979, 'dropout': 0.5274368275253556, 'patience': 90, 'lr_reduce_freq': 100, 'spt_alg': 'prim', 'spt_attr': 'similarity', 'manifold': 'PoincareBall', 'num_layers': 3, 'dim': 280, 'num_adj': 6, 'add_rate': 0.5163770555887878, 'tem': 0.9655222924642395, 'consis_rate': 1.5027777580390747, 'use_att': 1}. Best is trial 4 with value: 0.8150999999999999.[0m
[32m[I 2022-06-26 05:58:12,106][0m Trial 7 finished with value: 0.8137000000000001 and parameters: {'lr': 0.0056524748796021075, 'weight_decay': 0.0007214004595158668, 'dropout': 0.7058467819301903, 'patience': 90, 'lr_reduce_freq': 110, 'spt_alg': 'prim', 'spt_attr': 'similarity', 'manifold': 'PoincareBall', 'num_layers': 3, 'dim': 304, 'num_adj': 4, 'add_rate': 0.5872578403136838, 'tem': 0.8903038376702732, 'consis_rate': 1.7126973997485444, 'use_att': 0}. Best is trial 4 with value: 0.8150999999999999.[0m
[32m[I 2022-06-26 06:16:03,609][0m Trial 8 finished with value: 0.8161999999999999 and parameters: {'lr': 0.0026183917306290124, 'weight_decay': 0.0006735708197667337, 'dropout': 0.6407482276246121, 'patience': 80, 'lr_reduce_freq': 100, 'spt_alg': 'kruskal', 'spt_attr': 'edge_degree', 'manifold': 'PoincareBall', 'num_layers': 3, 'dim': 312, 'num_adj': 6, 'add_rate': 0.5216353964663444, 'tem': 0.8245998329185384, 'consis_rate': 1.7908009170282095, 'use_att': 1}. Best is trial 8 with value: 0.8161999999999999.[0m
[32m[I 2022-06-26 06:34:29,622][0m Trial 9 finished with value: 0.8123000000000001 and parameters: {'lr': 0.007934359912141153, 'weight_decay': 0.00024299821217807797, 'dropout': 0.75884812392817, 'patience': 90, 'lr_reduce_freq': 80, 'spt_alg': 'prim', 'spt_attr': 'similarity', 'manifold': 'Hyperboloid', 'num_layers': 3, 'dim': 308, 'num_adj': 4, 'add_rate': 0.40401354547775287, 'tem': 1.0307169104279548, 'consis_rate': 1.651416498347466, 'use_att': 1}. Best is trial 8 with value: 0.8161999999999999.[0m
[32m[I 2022-06-26 06:52:10,677][0m Trial 10 finished with value: 0.8163 and parameters: {'lr': 0.0028161682743067617, 'weight_decay': 0.0007876677084800902, 'dropout': 0.6194681311872998, 'patience': 80, 'lr_reduce_freq': 80, 'spt_alg': 'kruskal', 'spt_attr': 'edge_degree', 'manifold': 'PoincareBall', 'num_layers': 3, 'dim': 336, 'num_adj': 6, 'add_rate': 0.4958677321781506, 'tem': 0.8049327027119125, 'consis_rate': 1.9731856919663433, 'use_att': 1}. Best is trial 10 with value: 0.8163.[0m
[32m[I 2022-06-26 07:11:06,707][0m Trial 11 finished with value: 0.8216999999999999 and parameters: {'lr': 0.002153954751218005, 'weight_decay': 0.0007816507581843803, 'dropout': 0.6235670646143449, 'patience': 80, 'lr_reduce_freq': 80, 'spt_alg': 'kruskal', 'spt_attr': 'edge_degree', 'manifold': 'PoincareBall', 'num_layers': 3, 'dim': 336, 'num_adj': 6, 'add_rate': 0.48743939751053833, 'tem': 0.8017846831058102, 'consis_rate': 1.9921405470402025, 'use_att': 1}. Best is trial 11 with value: 0.8216999999999999.[0m
[32m[I 2022-06-26 07:29:27,294][0m Trial 12 finished with value: 0.8175999999999999 and parameters: {'lr': 0.002134091549081607, 'weight_decay': 0.000762521122928321, 'dropout': 0.5880587968169332, 'patience': 80, 'lr_reduce_freq': 80, 'spt_alg': 'kruskal', 'spt_attr': 'edge_degree', 'manifold': 'PoincareBall', 'num_layers': 3, 'dim': 336, 'num_adj': 6, 'add_rate': 0.48830128520128147, 'tem': 0.8022042571759689, 'consis_rate': 1.9904558988306762, 'use_att': 1}. Best is trial 11 with value: 0.8216999999999999.[0m
[32m[I 2022-06-26 07:46:51,008][0m Trial 13 finished with value: 0.8178000000000001 and parameters: {'lr': 0.0023515276882793896, 'weight_decay': 0.0005855388672830518, 'dropout': 0.5665695273738106, 'patience': 80, 'lr_reduce_freq': 90, 'spt_alg': 'kruskal', 'spt_attr': 'edge_degree', 'manifold': 'PoincareBall', 'num_layers': 3, 'dim': 336, 'num_adj': 6, 'add_rate': 0.46345657326654077, 'tem': 0.8787529083940535, 'consis_rate': 1.999326398528871, 'use_att': 1}. Best is trial 11 with value: 0.8216999999999999.[0m
[32m[I 2022-06-26 08:05:08,027][0m Trial 14 finished with value: 0.8145 and parameters: {'lr': 0.0038285936158169893, 'weight_decay': 0.0005755706605410966, 'dropout': 0.505690701830707, 'patience': 90, 'lr_reduce_freq': 90, 'spt_alg': 'kruskal', 'spt_attr': 'edge_degree', 'manifold': 'PoincareBall', 'num_layers': 3, 'dim': 208, 'num_adj': 6, 'add_rate': 0.46117426826427566, 'tem': 0.8820072909636001, 'consis_rate': 1.928305560764592, 'use_att': 1}. Best is trial 11 with value: 0.8216999999999999.[0m
[32m[I 2022-06-26 08:17:03,078][0m Trial 15 finished with value: 0.8169000000000001 and parameters: {'lr': 0.003388597424270243, 'weight_decay': 0.0005852505744249362, 'dropout': 0.562321164358671, 'patience': 80, 'lr_reduce_freq': 90, 'spt_alg': 'kruskal', 'spt_attr': 'edge_degree', 'manifold': 'PoincareBall', 'num_layers': 3, 'dim': 328, 'num_adj': 4, 'add_rate': 0.4080417593342687, 'tem': 1.0436013821050283, 'consis_rate': 1.8545467763729686, 'use_att': 1}. Best is trial 11 with value: 0.8216999999999999.[0m
[32m[I 2022-06-26 08:37:19,584][0m Trial 16 finished with value: 0.8179000000000001 and parameters: {'lr': 0.0020457479603138663, 'weight_decay': 0.0006008532401942468, 'dropout': 0.692828193454415, 'patience': 90, 'lr_reduce_freq': 90, 'spt_alg': 'kruskal', 'spt_attr': 'edge_degree', 'manifold': 'PoincareBall', 'num_layers': 3, 'dim': 324, 'num_adj': 6, 'add_rate': 0.44549011207093553, 'tem': 0.8702778542360403, 'consis_rate': 1.92759895144693, 'use_att': 1}. Best is trial 11 with value: 0.8216999999999999.[0m
cmd: --dataset cora --dropout 0.7 --weight-decay 0.0005 --lr 0.005 --lr-reduce-freq 100 --patience 100 --spt-alg kruskal --spt-attr edge_degree --model HGCN --manifold PoincareBall --num-layers 3 --dim 256 --num-adj 4 --add-rate 0.5 --tem 0.89 --consis-rate 1.63 --c None --use-att 1
cur_param: {'lr': 0.008817803843006275, 'weight_decay': 0.00047850374689503337, 'dropout': 0.6414686187085108, 'patience': 110, 'lr_reduce_freq': 100, 'spt_alg': 'kruskal', 'spt_attr': 'similarity', 'manifold': 'PoincareBall', 'num_layers': 3, 'dim': 312, 'num_adj': 2, 'add_rate': 0.5966818246538341, 'tem': 0.9240505512260722, 'consis_rate': 1.622041909086315, 'use_att': 0}
mean: 0.8041
[0.806 0.817 0.803 0.797 0.807 0.812 0.806 0.792 0.8   0.801]
cur_param: {'lr': 0.006361980582117662, 'weight_decay': 0.0003156646473549275, 'dropout': 0.5897437698379419, 'patience': 110, 'lr_reduce_freq': 120, 'spt_alg': 'kruskal', 'spt_attr': 'edge_degree', 'manifold': 'PoincareBall', 'num_layers': 3, 'dim': 236, 'num_adj': 6, 'add_rate': 0.5946847677428041, 'tem': 0.8220009637830665, 'consis_rate': 1.7504900518342272, 'use_att': 0}
mean: 0.8059
[0.792 0.808 0.796 0.814 0.824 0.809 0.797 0.803 0.818 0.798]
cur_param: {'lr': 0.0049922537190934604, 'weight_decay': 0.0006781392758080054, 'dropout': 0.6841443792324275, 'patience': 100, 'lr_reduce_freq': 120, 'spt_alg': 'prim', 'spt_attr': 'edge_degree', 'manifold': 'Hyperboloid', 'num_layers': 3, 'dim': 264, 'num_adj': 2, 'add_rate': 0.5748433782270733, 'tem': 1.1998745623016691, 'consis_rate': 1.6583026173902569, 'use_att': 1}
mean: 0.8139999999999998
[0.831 0.811 0.827 0.817 0.813 0.784 0.815 0.83  0.818 0.794]
cur_param: {'lr': 0.004453642964640386, 'weight_decay': 0.0006389062321886047, 'dropout': 0.5888039623238448, 'patience': 80, 'lr_reduce_freq': 110, 'spt_alg': 'kruskal', 'spt_attr': 'similarity', 'manifold': 'Hyperboloid', 'num_layers': 3, 'dim': 284, 'num_adj': 4, 'add_rate': 0.4145359737945145, 'tem': 1.1302499600632196, 'consis_rate': 1.8683659794169363, 'use_att': 0}
mean: 0.8072000000000001
[0.809 0.819 0.796 0.812 0.802 0.817 0.808 0.813 0.813 0.783]
cur_param: {'lr': 0.0035461324593925835, 'weight_decay': 0.00041486053382666974, 'dropout': 0.5364836816523493, 'patience': 100, 'lr_reduce_freq': 120, 'spt_alg': 'prim', 'spt_attr': 'edge_degree', 'manifold': 'Hyperboloid', 'num_layers': 3, 'dim': 300, 'num_adj': 4, 'add_rate': 0.3321650570005902, 'tem': 0.9250220583116896, 'consis_rate': 1.8779823875855712, 'use_att': 1}
mean: 0.8150999999999999
[0.818 0.814 0.816 0.821 0.816 0.803 0.816 0.819 0.828 0.8  ]
cur_param: {'lr': 0.005547451446069933, 'weight_decay': 0.00040484662864795915, 'dropout': 0.7546525104989262, 'patience': 120, 'lr_reduce_freq': 90, 'spt_alg': 'prim', 'spt_attr': 'edge_degree', 'manifold': 'Hyperboloid', 'num_layers': 3, 'dim': 264, 'num_adj': 6, 'add_rate': 0.3282575451795637, 'tem': 0.9687025802161826, 'consis_rate': 1.5923515909113555, 'use_att': 1}
mean: 0.8146999999999999
[0.831 0.823 0.794 0.791 0.809 0.829 0.821 0.829 0.815 0.805]
cur_param: {'lr': 0.007656870827129468, 'weight_decay': 0.0004964151344936979, 'dropout': 0.5274368275253556, 'patience': 90, 'lr_reduce_freq': 100, 'spt_alg': 'prim', 'spt_attr': 'similarity', 'manifold': 'PoincareBall', 'num_layers': 3, 'dim': 280, 'num_adj': 6, 'add_rate': 0.5163770555887878, 'tem': 0.9655222924642395, 'consis_rate': 1.5027777580390747, 'use_att': 1}
mean: 0.8125
[0.805 0.814 0.821 0.817 0.817 0.806 0.795 0.813 0.828 0.809]
cur_param: {'lr': 0.0056524748796021075, 'weight_decay': 0.0007214004595158668, 'dropout': 0.7058467819301903, 'patience': 90, 'lr_reduce_freq': 110, 'spt_alg': 'prim', 'spt_attr': 'similarity', 'manifold': 'PoincareBall', 'num_layers': 3, 'dim': 304, 'num_adj': 4, 'add_rate': 0.5872578403136838, 'tem': 0.8903038376702732, 'consis_rate': 1.7126973997485444, 'use_att': 0}
mean: 0.8137000000000001
[0.828 0.819 0.786 0.81  0.809 0.806 0.826 0.82  0.812 0.821]
cur_param: {'lr': 0.0026183917306290124, 'weight_decay': 0.0006735708197667337, 'dropout': 0.6407482276246121, 'patience': 80, 'lr_reduce_freq': 100, 'spt_alg': 'kruskal', 'spt_attr': 'edge_degree', 'manifold': 'PoincareBall', 'num_layers': 3, 'dim': 312, 'num_adj': 6, 'add_rate': 0.5216353964663444, 'tem': 0.8245998329185384, 'consis_rate': 1.7908009170282095, 'use_att': 1}
mean: 0.8161999999999999
[0.836 0.823 0.813 0.811 0.828 0.795 0.793 0.828 0.816 0.819]
cur_param: {'lr': 0.007934359912141153, 'weight_decay': 0.00024299821217807797, 'dropout': 0.75884812392817, 'patience': 90, 'lr_reduce_freq': 80, 'spt_alg': 'prim', 'spt_attr': 'similarity', 'manifold': 'Hyperboloid', 'num_layers': 3, 'dim': 308, 'num_adj': 4, 'add_rate': 0.40401354547775287, 'tem': 1.0307169104279548, 'consis_rate': 1.651416498347466, 'use_att': 1}
mean: 0.8123000000000001
[0.823 0.808 0.806 0.817 0.803 0.808 0.817 0.818 0.817 0.806]
cur_param: {'lr': 0.0028161682743067617, 'weight_decay': 0.0007876677084800902, 'dropout': 0.6194681311872998, 'patience': 80, 'lr_reduce_freq': 80, 'spt_alg': 'kruskal', 'spt_attr': 'edge_degree', 'manifold': 'PoincareBall', 'num_layers': 3, 'dim': 336, 'num_adj': 6, 'add_rate': 0.4958677321781506, 'tem': 0.8049327027119125, 'consis_rate': 1.9731856919663433, 'use_att': 1}
mean: 0.8163
[0.813 0.824 0.823 0.817 0.823 0.812 0.827 0.812 0.794 0.818]
cur_param: {'lr': 0.002153954751218005, 'weight_decay': 0.0007816507581843803, 'dropout': 0.6235670646143449, 'patience': 80, 'lr_reduce_freq': 80, 'spt_alg': 'kruskal', 'spt_attr': 'edge_degree', 'manifold': 'PoincareBall', 'num_layers': 3, 'dim': 336, 'num_adj': 6, 'add_rate': 0.48743939751053833, 'tem': 0.8017846831058102, 'consis_rate': 1.9921405470402025, 'use_att': 1}
mean: 0.8216999999999999
[0.822 0.821 0.816 0.83  0.83  0.832 0.818 0.818 0.815 0.815]
cur_param: {'lr': 0.002134091549081607, 'weight_decay': 0.000762521122928321, 'dropout': 0.5880587968169332, 'patience': 80, 'lr_reduce_freq': 80, 'spt_alg': 'kruskal', 'spt_attr': 'edge_degree', 'manifold': 'PoincareBall', 'num_layers': 3, 'dim': 336, 'num_adj': 6, 'add_rate': 0.48830128520128147, 'tem': 0.8022042571759689, 'consis_rate': 1.9904558988306762, 'use_att': 1}
mean: 0.8175999999999999
[0.824 0.826 0.815 0.813 0.826 0.829 0.8   0.797 0.824 0.822]
cur_param: {'lr': 0.0023515276882793896, 'weight_decay': 0.0005855388672830518, 'dropout': 0.5665695273738106, 'patience': 80, 'lr_reduce_freq': 90, 'spt_alg': 'kruskal', 'spt_attr': 'edge_degree', 'manifold': 'PoincareBall', 'num_layers': 3, 'dim': 336, 'num_adj': 6, 'add_rate': 0.46345657326654077, 'tem': 0.8787529083940535, 'consis_rate': 1.999326398528871, 'use_att': 1}
mean: 0.8178000000000001
[0.826 0.817 0.836 0.798 0.817 0.809 0.824 0.812 0.82  0.819]
cur_param: {'lr': 0.0038285936158169893, 'weight_decay': 0.0005755706605410966, 'dropout': 0.505690701830707, 'patience': 90, 'lr_reduce_freq': 90, 'spt_alg': 'kruskal', 'spt_attr': 'edge_degree', 'manifold': 'PoincareBall', 'num_layers': 3, 'dim': 208, 'num_adj': 6, 'add_rate': 0.46117426826427566, 'tem': 0.8820072909636001, 'consis_rate': 1.928305560764592, 'use_att': 1}
mean: 0.8145
[0.82  0.813 0.825 0.806 0.82  0.815 0.815 0.802 0.823 0.806]
cur_param: {'lr': 0.003388597424270243, 'weight_decay': 0.0005852505744249362, 'dropout': 0.562321164358671, 'patience': 80, 'lr_reduce_freq': 90, 'spt_alg': 'kruskal', 'spt_attr': 'edge_degree', 'manifold': 'PoincareBall', 'num_layers': 3, 'dim': 328, 'num_adj': 4, 'add_rate': 0.4080417593342687, 'tem': 1.0436013821050283, 'consis_rate': 1.8545467763729686, 'use_att': 1}
mean: 0.8169000000000001
[0.818 0.809 0.829 0.829 0.807 0.816 0.809 0.829 0.805 0.818]
cur_param: {'lr': 0.0020457479603138663, 'weight_decay': 0.0006008532401942468, 'dropout': 0.692828193454415, 'patience': 90, 'lr_reduce_freq': 90, 'spt_alg': 'kruskal', 'spt_attr': 'edge_degree', 'manifold': 'PoincareBall', 'num_layers': 3, 'dim': 324, 'num_adj': 6, 'add_rate': 0.44549011207093553, 'tem': 0.8702778542360403, 'consis_rate': 1.92759895144693, 'use_att': 1}
mean: 0.8179000000000001
[0.819 0.827 0.817 0.829 0.827 0.827 0.8   0.806 0.814 0.813]
cur_param: {'lr': 0.00995712266109908, 'weight_decay': 0.000790487537788189, 'dropout': 0.6847141860458398, 'patience': 90, 'lr_reduce_freq': 80, 'spt_alg': 'kruskal', 'spt_attr': 'edge_degree', 'manifold': 'PoincareBall', 'num_layers': 3, 'dim': 244, 'num_adj': 2, 'add_rate': 0.36237140284801167, 'tem': 0.8571802591288125, 'consis_rate': 1.9223358964750492, 'use_att': 1}[32m[I 2022-06-26 08:45:30,234][0m Trial 17 finished with value: 0.8032 and parameters: {'lr': 0.00995712266109908, 'weight_decay': 0.000790487537788189, 'dropout': 0.6847141860458398, 'patience': 90, 'lr_reduce_freq': 80, 'spt_alg': 'kruskal', 'spt_attr': 'edge_degree', 'manifold': 'PoincareBall', 'num_layers': 3, 'dim': 244, 'num_adj': 2, 'add_rate': 0.36237140284801167, 'tem': 0.8571802591288125, 'consis_rate': 1.9223358964750492, 'use_att': 1}. Best is trial 11 with value: 0.8216999999999999.[0m
[32m[I 2022-06-26 08:49:06,271][0m Trial 18 finished with value: 0.8149 and parameters: {'lr': 0.006634809298656581, 'weight_decay': 0.0007166923760643061, 'dropout': 0.717936985438992, 'patience': 100, 'lr_reduce_freq': 90, 'spt_alg': 'kruskal', 'spt_attr': 'edge_degree', 'manifold': 'PoincareBall', 'num_layers': 3, 'dim': 320, 'num_adj': 4, 'add_rate': 0.4271327867851866, 'tem': 1.0912080479093162, 'consis_rate': 1.8055636235452914, 'use_att': 0}. Best is trial 11 with value: 0.8216999999999999.[0m
[32m[I 2022-06-26 09:07:20,093][0m Trial 19 finished with value: 0.8192 and parameters: {'lr': 0.004235549876505966, 'weight_decay': 0.00062312335362546, 'dropout': 0.6735083376909013, 'patience': 90, 'lr_reduce_freq': 80, 'spt_alg': 'kruskal', 'spt_attr': 'edge_degree', 'manifold': 'PoincareBall', 'num_layers': 3, 'dim': 284, 'num_adj': 6, 'add_rate': 0.5392767346403461, 'tem': 0.8480046854540185, 'consis_rate': 1.936045109525008, 'use_att': 1}. Best is trial 11 with value: 0.8216999999999999.[0m
[32m[I 2022-06-26 09:30:46,529][0m Trial 20 finished with value: 0.8168 and parameters: {'lr': 0.004404420206520782, 'weight_decay': 0.0005375711182455749, 'dropout': 0.7823294607563791, 'patience': 110, 'lr_reduce_freq': 80, 'spt_alg': 'kruskal', 'spt_attr': 'edge_degree', 'manifold': 'PoincareBall', 'num_layers': 3, 'dim': 244, 'num_adj': 6, 'add_rate': 0.5514500748697154, 'tem': 0.9232323407427854, 'consis_rate': 1.935361923229482, 'use_att': 1}. Best is trial 11 with value: 0.8216999999999999.[0m
[32m[I 2022-06-26 09:51:38,071][0m Trial 21 finished with value: 0.8144 and parameters: {'lr': 0.0029368957344845983, 'weight_decay': 0.000638328875585308, 'dropout': 0.671299036723133, 'patience': 90, 'lr_reduce_freq': 80, 'spt_alg': 'kruskal', 'spt_attr': 'edge_degree', 'manifold': 'PoincareBall', 'num_layers': 3, 'dim': 292, 'num_adj': 6, 'add_rate': 0.5369916346765876, 'tem': 0.8480997286129622, 'consis_rate': 1.9168269633858295, 'use_att': 1}. Best is trial 11 with value: 0.8216999999999999.[0m
[32m[I 2022-06-26 10:14:47,492][0m Trial 22 finished with value: 0.8150000000000001 and parameters: {'lr': 0.002127668488750603, 'weight_decay': 0.0006338021418471273, 'dropout': 0.7195668470154939, 'patience': 100, 'lr_reduce_freq': 90, 'spt_alg': 'kruskal', 'spt_attr': 'edge_degree', 'manifold': 'PoincareBall', 'num_layers': 3, 'dim': 324, 'num_adj': 6, 'add_rate': 0.48357759921432947, 'tem': 0.8529229240426562, 'consis_rate': 1.9522909309018428, 'use_att': 1}. Best is trial 11 with value: 0.8216999999999999.[0m
[32m[I 2022-06-26 10:32:41,545][0m Trial 23 finished with value: 0.8167 and parameters: {'lr': 0.004073822419415404, 'weight_decay': 0.0004558213742394424, 'dropout': 0.6199534606426683, 'patience': 90, 'lr_reduce_freq': 80, 'spt_alg': 'kruskal', 'spt_attr': 'edge_degree', 'manifold': 'PoincareBall', 'num_layers': 3, 'dim': 320, 'num_adj': 6, 'add_rate': 0.4448242289232488, 'tem': 0.9054616959338164, 'consis_rate': 1.8450619648217528, 'use_att': 1}. Best is trial 11 with value: 0.8216999999999999.[0m
[32m[I 2022-06-26 10:46:27,948][0m Trial 24 finished with value: 0.817 and parameters: {'lr': 0.003338387452969463, 'weight_decay': 0.0007336626439351918, 'dropout': 0.6612464336022963, 'patience': 80, 'lr_reduce_freq': 90, 'spt_alg': 'kruskal', 'spt_attr': 'edge_degree', 'manifold': 'PoincareBall', 'num_layers': 3, 'dim': 296, 'num_adj': 4, 'add_rate': 0.5440847591620988, 'tem': 0.9626780371753108, 'consis_rate': 1.8892098650139058, 'use_att': 1}. Best is trial 11 with value: 0.8216999999999999.[0m
[32m[I 2022-06-26 11:03:06,863][0m Trial 25 finished with value: 0.8219 and parameters: {'lr': 0.004958941782702637, 'weight_decay': 0.0005421978591618717, 'dropout': 0.6995507030196385, 'patience': 90, 'lr_reduce_freq': 80, 'spt_alg': 'kruskal', 'spt_attr': 'edge_degree', 'manifold': 'PoincareBall', 'num_layers': 3, 'dim': 280, 'num_adj': 6, 'add_rate': 0.37266333998562784, 'tem': 0.845880796174629, 'consis_rate': 1.8043617912211327, 'use_att': 1}. Best is trial 25 with value: 0.8219.[0m
