nohup: ignoring input
[32m[I 2022-06-30 19:55:07,338][0m A new study created in memory with name: no-name-3f4aeb55-a97e-421d-83a3-d7bc58b1cdae[0m
[32m[I 2022-06-30 20:01:51,004][0m Trial 0 finished with value: 0.316 and parameters: {'lr': 0.013484904153530845, 'weight_decay': 0.023092025575143674, 'dropout': 0.4145981295567912, 'patience': 80, 'lr_reduce_freq': 45, 'spt_alg': 'prim', 'spt_attr': 'similarity', 'manifold': 'Hyperboloid', 'num_layers': 4, 'dim': 384, 'num_adj': 6, 'add_rate': 0.20707598009914696, 'tem': 0.8379031398321362, 'consis_rate': 0.4883355149282893, 'use_att': 0}. Best is trial 0 with value: 0.316.[0m
[32m[I 2022-06-30 20:23:28,888][0m Trial 1 finished with value: 0.7625 and parameters: {'lr': 0.0016568205796184403, 'weight_decay': 0.000613400464579485, 'dropout': 0.5291528260930308, 'patience': 80, 'lr_reduce_freq': 60, 'spt_alg': 'prim', 'spt_attr': 'similarity', 'manifold': 'Hyperboloid', 'num_layers': 4, 'dim': 128, 'num_adj': 2, 'add_rate': 0.24014943408054956, 'tem': 0.6280881174767661, 'consis_rate': 0.6137528614621758, 'use_att': 1}. Best is trial 1 with value: 0.7625.[0m
[32m[I 2022-06-30 20:25:36,756][0m Trial 2 finished with value: 0.7933 and parameters: {'lr': 0.03530612144111195, 'weight_decay': 0.0010600555477731544, 'dropout': 0.25971456886036415, 'patience': 60, 'lr_reduce_freq': 120, 'spt_alg': 'kruskal', 'spt_attr': 'edge_degree', 'manifold': 'PoincareBall', 'num_layers': 3, 'dim': 384, 'num_adj': 6, 'add_rate': 0.4160067859604565, 'tem': 1.334357001366485, 'consis_rate': 1.1129188169401651, 'use_att': 0}. Best is trial 2 with value: 0.7933.[0m
[32m[I 2022-06-30 20:28:52,705][0m Trial 3 finished with value: 0.7859 and parameters: {'lr': 0.0008313444732744777, 'weight_decay': 0.0011231782615747725, 'dropout': 0.18109891762912467, 'patience': 90, 'lr_reduce_freq': 75, 'spt_alg': 'kruskal', 'spt_attr': 'similarity', 'manifold': 'PoincareBall', 'num_layers': 5, 'dim': 304, 'num_adj': 2, 'add_rate': 0.6109193527595674, 'tem': 1.3957268701354992, 'consis_rate': 0.2784958816907381, 'use_att': 0}. Best is trial 2 with value: 0.7933.[0m
[32m[I 2022-06-30 20:34:17,336][0m Trial 4 finished with value: 0.319 and parameters: {'lr': 0.05155542953930386, 'weight_decay': 0.028664599021943293, 'dropout': 0.6319731769166783, 'patience': 50, 'lr_reduce_freq': 45, 'spt_alg': 'kruskal', 'spt_attr': 'similarity', 'manifold': 'PoincareBall', 'num_layers': 5, 'dim': 368, 'num_adj': 2, 'add_rate': 0.10130163030984135, 'tem': 1.2528036260730164, 'consis_rate': 0.7841307874318086, 'use_att': 1}. Best is trial 2 with value: 0.7933.[0m
[32m[I 2022-06-30 20:57:25,094][0m Trial 5 finished with value: 0.8033000000000001 and parameters: {'lr': 0.0014166650897391368, 'weight_decay': 0.0039173063160956026, 'dropout': 0.12198800041474248, 'patience': 100, 'lr_reduce_freq': 90, 'spt_alg': 'prim', 'spt_attr': 'similarity', 'manifold': 'PoincareBall', 'num_layers': 3, 'dim': 160, 'num_adj': 6, 'add_rate': 0.7797463782994877, 'tem': 0.5755075271075903, 'consis_rate': 0.9660530043043598, 'use_att': 1}. Best is trial 5 with value: 0.8033000000000001.[0m
[32m[I 2022-06-30 21:04:29,535][0m Trial 6 finished with value: 0.7782000000000001 and parameters: {'lr': 0.014461780761892164, 'weight_decay': 0.006194011219821609, 'dropout': 0.5079590822862653, 'patience': 90, 'lr_reduce_freq': 150, 'spt_alg': 'prim', 'spt_attr': 'edge_degree', 'manifold': 'Hyperboloid', 'num_layers': 3, 'dim': 512, 'num_adj': 2, 'add_rate': 0.14820060239333818, 'tem': 1.1990667352335058, 'consis_rate': 1.8577198868441591, 'use_att': 1}. Best is trial 5 with value: 0.8033000000000001.[0m
[32m[I 2022-06-30 21:10:35,887][0m Trial 7 finished with value: 0.7847000000000002 and parameters: {'lr': 0.007886993888486382, 'weight_decay': 0.002620660604866174, 'dropout': 0.49293259386899413, 'patience': 60, 'lr_reduce_freq': 120, 'spt_alg': 'kruskal', 'spt_attr': 'edge_degree', 'manifold': 'PoincareBall', 'num_layers': 5, 'dim': 336, 'num_adj': 6, 'add_rate': 0.43238521001685004, 'tem': 1.4960054629418433, 'consis_rate': 1.0679948560576775, 'use_att': 0}. Best is trial 5 with value: 0.8033000000000001.[0m
[32m[I 2022-06-30 21:31:14,333][0m Trial 8 finished with value: 0.7945 and parameters: {'lr': 0.0009973518533255138, 'weight_decay': 0.0071465081806942115, 'dropout': 0.39520742821138477, 'patience': 100, 'lr_reduce_freq': 75, 'spt_alg': 'prim', 'spt_attr': 'similarity', 'manifold': 'PoincareBall', 'num_layers': 3, 'dim': 144, 'num_adj': 2, 'add_rate': 0.6959783514683718, 'tem': 1.105386794869064, 'consis_rate': 1.1741463361984605, 'use_att': 1}. Best is trial 5 with value: 0.8033000000000001.[0m
[32m[I 2022-06-30 21:38:04,574][0m Trial 9 finished with value: 0.8053000000000001 and parameters: {'lr': 0.0017496081029854903, 'weight_decay': 0.0019506565534867049, 'dropout': 0.2709371150489492, 'patience': 100, 'lr_reduce_freq': 60, 'spt_alg': 'prim', 'spt_attr': 'similarity', 'manifold': 'PoincareBall', 'num_layers': 3, 'dim': 288, 'num_adj': 2, 'add_rate': 0.17791473452071438, 'tem': 1.443446936695429, 'consis_rate': 1.8365155275519096, 'use_att': 1}. Best is trial 9 with value: 0.8053000000000001.[0m
[32m[I 2022-06-30 21:48:33,168][0m Trial 10 finished with value: 0.3234 and parameters: {'lr': 0.0036770479561656906, 'weight_decay': 0.012576289829531783, 'dropout': 0.7406248379013051, 'patience': 70, 'lr_reduce_freq': 105, 'spt_alg': 'prim', 'spt_attr': 'edge_degree', 'manifold': 'Hyperboloid', 'num_layers': 3, 'dim': 256, 'num_adj': 4, 'add_rate': 0.3091843610579532, 'tem': 0.9088370819888374, 'consis_rate': 1.8651177120176439, 'use_att': 1}. Best is trial 9 with value: 0.8053000000000001.[0m
[32m[I 2022-06-30 22:04:06,977][0m Trial 11 finished with value: 0.8006 and parameters: {'lr': 0.0024115851036438725, 'weight_decay': 0.0026482312945944873, 'dropout': 0.10324871917430392, 'patience': 100, 'lr_reduce_freq': 30, 'spt_alg': 'prim', 'spt_attr': 'similarity', 'manifold': 'PoincareBall', 'num_layers': 3, 'dim': 208, 'num_adj': 4, 'add_rate': 0.8871692744977058, 'tem': 0.5110111430375011, 'consis_rate': 1.4806621788986885, 'use_att': 1}. Best is trial 9 with value: 0.8053000000000001.[0m
[32m[I 2022-06-30 22:36:25,387][0m Trial 12 finished with value: 0.8070999999999999 and parameters: {'lr': 0.0005337396955259801, 'weight_decay': 0.002825680558043306, 'dropout': 0.28937526942508185, 'patience': 100, 'lr_reduce_freq': 90, 'spt_alg': 'prim', 'spt_attr': 'similarity', 'manifold': 'PoincareBall', 'num_layers': 3, 'dim': 208, 'num_adj': 4, 'add_rate': 0.8752940742173695, 'tem': 0.725622213184284, 'consis_rate': 1.4797741932923891, 'use_att': 1}. Best is trial 12 with value: 0.8070999999999999.[0m
[32m[I 2022-06-30 23:02:25,390][0m Trial 13 finished with value: 0.8058000000000002 and parameters: {'lr': 0.0005372666925948914, 'weight_decay': 0.0017943214806366702, 'dropout': 0.29633664169598795, 'patience': 90, 'lr_reduce_freq': 90, 'spt_alg': 'prim', 'spt_attr': 'similarity', 'manifold': 'PoincareBall', 'num_layers': 3, 'dim': 256, 'num_adj': 4, 'add_rate': 0.5501983747642207, 'tem': 0.7390668791280159, 'consis_rate': 1.4971134508870876, 'use_att': 1}. Best is trial 12 with value: 0.8070999999999999.[0m
[32m[I 2022-06-30 23:28:39,772][0m Trial 14 finished with value: 0.8084 and parameters: {'lr': 0.0005511876530598026, 'weight_decay': 0.0015387023545016015, 'dropout': 0.3123690482188758, 'patience': 90, 'lr_reduce_freq': 105, 'spt_alg': 'prim', 'spt_attr': 'similarity', 'manifold': 'PoincareBall', 'num_layers': 3, 'dim': 192, 'num_adj': 4, 'add_rate': 0.580951939109182, 'tem': 0.7388973214985628, 'consis_rate': 1.4939550732357376, 'use_att': 1}. Best is trial 14 with value: 0.8084.[0m
[32m[I 2022-07-01 00:01:41,842][0m Trial 15 finished with value: 0.7955 and parameters: {'lr': 0.0006840936570880151, 'weight_decay': 0.0005438561653615117, 'dropout': 0.3393370700194146, 'patience': 90, 'lr_reduce_freq': 150, 'spt_alg': 'prim', 'spt_attr': 'similarity', 'manifold': 'PoincareBall', 'num_layers': 4, 'dim': 208, 'num_adj': 4, 'add_rate': 0.8458428694383773, 'tem': 0.7326861475930815, 'consis_rate': 1.4832503893431845, 'use_att': 1}. Best is trial 14 with value: 0.8084.[0m
[32m[I 2022-07-01 00:19:51,193][0m Trial 16 finished with value: 0.8029 and parameters: {'lr': 0.003257493802555491, 'weight_decay': 0.011141477480995608, 'dropout': 0.23445354759677717, 'patience': 80, 'lr_reduce_freq': 120, 'spt_alg': 'prim', 'spt_attr': 'similarity', 'manifold': 'PoincareBall', 'num_layers': 3, 'dim': 224, 'num_adj': 4, 'add_rate': 0.699717243344198, 'tem': 0.9864363260344822, 'consis_rate': 1.3402782422442945, 'use_att': 1}. Best is trial 14 with value: 0.8084.[0m
[32m[I 2022-07-01 00:35:36,977][0m Trial 17 finished with value: 0.7936 and parameters: {'lr': 0.09693669342886221, 'weight_decay': 0.0012773939680315138, 'dropout': 0.3535404291658821, 'patience': 90, 'lr_reduce_freq': 105, 'spt_alg': 'prim', 'spt_attr': 'similarity', 'manifold': 'PoincareBall', 'num_layers': 3, 'dim': 192, 'num_adj': 4, 'add_rate': 0.6358318901302917, 'tem': 0.7381436996922276, 'consis_rate': 1.6469098312494757, 'use_att': 1}. Best is trial 14 with value: 0.8084.[0m
cmd: --dataset cora --model HGCN --c 4
cur_param: {'lr': 0.013484904153530845, 'weight_decay': 0.023092025575143674, 'dropout': 0.4145981295567912, 'patience': 80, 'lr_reduce_freq': 45, 'spt_alg': 'prim', 'spt_attr': 'similarity', 'manifold': 'Hyperboloid', 'num_layers': 4, 'dim': 384, 'num_adj': 6, 'add_rate': 0.20707598009914696, 'tem': 0.8379031398321362, 'consis_rate': 0.4883355149282893, 'use_att': 0}
mean: 0.316
[0.315 0.309 0.319 0.319 0.319 0.32  0.303 0.318 0.319 0.319]
cur_param: {'lr': 0.0016568205796184403, 'weight_decay': 0.000613400464579485, 'dropout': 0.5291528260930308, 'patience': 80, 'lr_reduce_freq': 60, 'spt_alg': 'prim', 'spt_attr': 'similarity', 'manifold': 'Hyperboloid', 'num_layers': 4, 'dim': 128, 'num_adj': 2, 'add_rate': 0.24014943408054956, 'tem': 0.6280881174767661, 'consis_rate': 0.6137528614621758, 'use_att': 1}
mean: 0.7625
[0.769 0.77  0.735 0.768 0.789 0.737 0.774 0.761 0.764 0.758]
cur_param: {'lr': 0.03530612144111195, 'weight_decay': 0.0010600555477731544, 'dropout': 0.25971456886036415, 'patience': 60, 'lr_reduce_freq': 120, 'spt_alg': 'kruskal', 'spt_attr': 'edge_degree', 'manifold': 'PoincareBall', 'num_layers': 3, 'dim': 384, 'num_adj': 6, 'add_rate': 0.4160067859604565, 'tem': 1.334357001366485, 'consis_rate': 1.1129188169401651, 'use_att': 0}
mean: 0.7933
[0.801 0.785 0.8   0.813 0.786 0.775 0.802 0.791 0.791 0.789]
cur_param: {'lr': 0.0008313444732744777, 'weight_decay': 0.0011231782615747725, 'dropout': 0.18109891762912467, 'patience': 90, 'lr_reduce_freq': 75, 'spt_alg': 'kruskal', 'spt_attr': 'similarity', 'manifold': 'PoincareBall', 'num_layers': 5, 'dim': 304, 'num_adj': 2, 'add_rate': 0.6109193527595674, 'tem': 1.3957268701354992, 'consis_rate': 0.2784958816907381, 'use_att': 0}
mean: 0.7859
[0.783 0.794 0.771 0.796 0.795 0.784 0.788 0.774 0.784 0.79 ]
cur_param: {'lr': 0.05155542953930386, 'weight_decay': 0.028664599021943293, 'dropout': 0.6319731769166783, 'patience': 50, 'lr_reduce_freq': 45, 'spt_alg': 'kruskal', 'spt_attr': 'similarity', 'manifold': 'PoincareBall', 'num_layers': 5, 'dim': 368, 'num_adj': 2, 'add_rate': 0.10130163030984135, 'tem': 1.2528036260730164, 'consis_rate': 0.7841307874318086, 'use_att': 1}
mean: 0.319
[0.319 0.319 0.319 0.319 0.319 0.319 0.319 0.319 0.319 0.319]
cur_param: {'lr': 0.0014166650897391368, 'weight_decay': 0.0039173063160956026, 'dropout': 0.12198800041474248, 'patience': 100, 'lr_reduce_freq': 90, 'spt_alg': 'prim', 'spt_attr': 'similarity', 'manifold': 'PoincareBall', 'num_layers': 3, 'dim': 160, 'num_adj': 6, 'add_rate': 0.7797463782994877, 'tem': 0.5755075271075903, 'consis_rate': 0.9660530043043598, 'use_att': 1}
mean: 0.8033000000000001
[0.808 0.798 0.797 0.805 0.805 0.807 0.803 0.799 0.798 0.813]
cur_param: {'lr': 0.014461780761892164, 'weight_decay': 0.006194011219821609, 'dropout': 0.5079590822862653, 'patience': 90, 'lr_reduce_freq': 150, 'spt_alg': 'prim', 'spt_attr': 'edge_degree', 'manifold': 'Hyperboloid', 'num_layers': 3, 'dim': 512, 'num_adj': 2, 'add_rate': 0.14820060239333818, 'tem': 1.1990667352335058, 'consis_rate': 1.8577198868441591, 'use_att': 1}
mean: 0.7782000000000001
[0.773 0.783 0.753 0.778 0.779 0.78  0.791 0.776 0.776 0.793]
cur_param: {'lr': 0.007886993888486382, 'weight_decay': 0.002620660604866174, 'dropout': 0.49293259386899413, 'patience': 60, 'lr_reduce_freq': 120, 'spt_alg': 'kruskal', 'spt_attr': 'edge_degree', 'manifold': 'PoincareBall', 'num_layers': 5, 'dim': 336, 'num_adj': 6, 'add_rate': 0.43238521001685004, 'tem': 1.4960054629418433, 'consis_rate': 1.0679948560576775, 'use_att': 0}
mean: 0.7847000000000002
[0.768 0.795 0.801 0.798 0.787 0.783 0.783 0.785 0.783 0.764]
cur_param: {'lr': 0.0009973518533255138, 'weight_decay': 0.0071465081806942115, 'dropout': 0.39520742821138477, 'patience': 100, 'lr_reduce_freq': 75, 'spt_alg': 'prim', 'spt_attr': 'similarity', 'manifold': 'PoincareBall', 'num_layers': 3, 'dim': 144, 'num_adj': 2, 'add_rate': 0.6959783514683718, 'tem': 1.105386794869064, 'consis_rate': 1.1741463361984605, 'use_att': 1}
mean: 0.7945
[0.808 0.795 0.797 0.801 0.788 0.786 0.787 0.793 0.795 0.795]
cur_param: {'lr': 0.0017496081029854903, 'weight_decay': 0.0019506565534867049, 'dropout': 0.2709371150489492, 'patience': 100, 'lr_reduce_freq': 60, 'spt_alg': 'prim', 'spt_attr': 'similarity', 'manifold': 'PoincareBall', 'num_layers': 3, 'dim': 288, 'num_adj': 2, 'add_rate': 0.17791473452071438, 'tem': 1.443446936695429, 'consis_rate': 1.8365155275519096, 'use_att': 1}
mean: 0.8053000000000001
[0.822 0.808 0.805 0.808 0.8   0.812 0.801 0.805 0.797 0.795]
cur_param: {'lr': 0.0036770479561656906, 'weight_decay': 0.012576289829531783, 'dropout': 0.7406248379013051, 'patience': 70, 'lr_reduce_freq': 105, 'spt_alg': 'prim', 'spt_attr': 'edge_degree', 'manifold': 'Hyperboloid', 'num_layers': 3, 'dim': 256, 'num_adj': 4, 'add_rate': 0.3091843610579532, 'tem': 0.9088370819888374, 'consis_rate': 1.8651177120176439, 'use_att': 1}
mean: 0.3234
[0.319 0.319 0.319 0.319 0.358 0.319 0.319 0.319 0.324 0.319]
cur_param: {'lr': 0.0024115851036438725, 'weight_decay': 0.0026482312945944873, 'dropout': 0.10324871917430392, 'patience': 100, 'lr_reduce_freq': 30, 'spt_alg': 'prim', 'spt_attr': 'similarity', 'manifold': 'PoincareBall', 'num_layers': 3, 'dim': 208, 'num_adj': 4, 'add_rate': 0.8871692744977058, 'tem': 0.5110111430375011, 'consis_rate': 1.4806621788986885, 'use_att': 1}
mean: 0.8006
[0.802 0.812 0.792 0.805 0.791 0.811 0.791 0.789 0.812 0.801]
cur_param: {'lr': 0.0005337396955259801, 'weight_decay': 0.002825680558043306, 'dropout': 0.28937526942508185, 'patience': 100, 'lr_reduce_freq': 90, 'spt_alg': 'prim', 'spt_attr': 'similarity', 'manifold': 'PoincareBall', 'num_layers': 3, 'dim': 208, 'num_adj': 4, 'add_rate': 0.8752940742173695, 'tem': 0.725622213184284, 'consis_rate': 1.4797741932923891, 'use_att': 1}
mean: 0.8070999999999999
[0.818 0.803 0.8   0.805 0.802 0.812 0.808 0.807 0.809 0.807]
cur_param: {'lr': 0.0005372666925948914, 'weight_decay': 0.0017943214806366702, 'dropout': 0.29633664169598795, 'patience': 90, 'lr_reduce_freq': 90, 'spt_alg': 'prim', 'spt_attr': 'similarity', 'manifold': 'PoincareBall', 'num_layers': 3, 'dim': 256, 'num_adj': 4, 'add_rate': 0.5501983747642207, 'tem': 0.7390668791280159, 'consis_rate': 1.4971134508870876, 'use_att': 1}
mean: 0.8058000000000002
[0.808 0.809 0.776 0.812 0.812 0.798 0.816 0.807 0.812 0.808]
cur_param: {'lr': 0.0005511876530598026, 'weight_decay': 0.0015387023545016015, 'dropout': 0.3123690482188758, 'patience': 90, 'lr_reduce_freq': 105, 'spt_alg': 'prim', 'spt_attr': 'similarity', 'manifold': 'PoincareBall', 'num_layers': 3, 'dim': 192, 'num_adj': 4, 'add_rate': 0.580951939109182, 'tem': 0.7388973214985628, 'consis_rate': 1.4939550732357376, 'use_att': 1}
mean: 0.8084
[0.807 0.808 0.809 0.813 0.8   0.812 0.807 0.81  0.804 0.814]
cur_param: {'lr': 0.0006840936570880151, 'weight_decay': 0.0005438561653615117, 'dropout': 0.3393370700194146, 'patience': 90, 'lr_reduce_freq': 150, 'spt_alg': 'prim', 'spt_attr': 'similarity', 'manifold': 'PoincareBall', 'num_layers': 4, 'dim': 208, 'num_adj': 4, 'add_rate': 0.8458428694383773, 'tem': 0.7326861475930815, 'consis_rate': 1.4832503893431845, 'use_att': 1}
mean: 0.7955
[0.805 0.813 0.79  0.785 0.799 0.803 0.766 0.775 0.816 0.803]
cur_param: {'lr': 0.003257493802555491, 'weight_decay': 0.011141477480995608, 'dropout': 0.23445354759677717, 'patience': 80, 'lr_reduce_freq': 120, 'spt_alg': 'prim', 'spt_attr': 'similarity', 'manifold': 'PoincareBall', 'num_layers': 3, 'dim': 224, 'num_adj': 4, 'add_rate': 0.699717243344198, 'tem': 0.9864363260344822, 'consis_rate': 1.3402782422442945, 'use_att': 1}
mean: 0.8029
[0.795 0.804 0.812 0.79  0.795 0.815 0.792 0.811 0.805 0.81 ]
cur_param: {'lr': 0.09693669342886221, 'weight_decay': 0.0012773939680315138, 'dropout': 0.3535404291658821, 'patience': 90, 'lr_reduce_freq': 105, 'spt_alg': 'prim', 'spt_attr': 'similarity', 'manifold': 'PoincareBall', 'num_layers': 3, 'dim': 192, 'num_adj': 4, 'add_rate': 0.6358318901302917, 'tem': 0.7381436996922276, 'consis_rate': 1.6469098312494757, 'use_att': 1}
mean: 0.7936
[0.8   0.799 0.778 0.782 0.805 0.797 0.814 0.788 0.782 0.791]
cur_param: {'lr': 0.0005331396480418249, 'weight_decay': 0.0038565185722844253, 'dropout': 0.6312792591922884, 'patience': 70, 'lr_reduce_freq': 135, 'spt_alg': 'kruskal', 'spt_attr': 'edge_degree', 'manifold': 'Hyperboloid', 'num_layers': 5, 'dim': 448, 'num_adj': 4, 'add_rate': 0.7902584253123306, 'tem': 0.8554850523593012, 'consis_rate': 1.272274955359276, 'use_att': 0}[32m[I 2022-07-01 00:43:36,980][0m Trial 18 finished with value: 0.16210000000000002 and parameters: {'lr': 0.0005331396480418249, 'weight_decay': 0.0038565185722844253, 'dropout': 0.6312792591922884, 'patience': 70, 'lr_reduce_freq': 135, 'spt_alg': 'kruskal', 'spt_attr': 'edge_degree', 'manifold': 'Hyperboloid', 'num_layers': 5, 'dim': 448, 'num_adj': 4, 'add_rate': 0.7902584253123306, 'tem': 0.8554850523593012, 'consis_rate': 1.272274955359276, 'use_att': 0}. Best is trial 14 with value: 0.8084.[0m
[32m[I 2022-07-01 01:06:16,885][0m Trial 19 finished with value: 0.3133 and parameters: {'lr': 0.005145389001744661, 'weight_decay': 0.04360871462017213, 'dropout': 0.4360982900402827, 'patience': 100, 'lr_reduce_freq': 105, 'spt_alg': 'prim', 'spt_attr': 'similarity', 'manifold': 'PoincareBall', 'num_layers': 4, 'dim': 160, 'num_adj': 4, 'add_rate': 0.4782053610838528, 'tem': 0.6584148132747865, 'consis_rate': 1.9998041340141928, 'use_att': 1}. Best is trial 14 with value: 0.8084.[0m
[32m[I 2022-07-01 01:25:42,988][0m Trial 20 finished with value: 0.8122 and parameters: {'lr': 0.001189564988036701, 'weight_decay': 0.0009350969007144237, 'dropout': 0.20158160664489777, 'patience': 80, 'lr_reduce_freq': 75, 'spt_alg': 'prim', 'spt_attr': 'similarity', 'manifold': 'PoincareBall', 'num_layers': 3, 'dim': 256, 'num_adj': 6, 'add_rate': 0.3522231532557707, 'tem': 1.0578970430099153, 'consis_rate': 1.6538794272314257, 'use_att': 1}. Best is trial 20 with value: 0.8122.[0m
[32m[I 2022-07-01 01:45:02,607][0m Trial 21 finished with value: 0.8097999999999999 and parameters: {'lr': 0.001057157629799774, 'weight_decay': 0.0007532604256517994, 'dropout': 0.17348684433444023, 'patience': 80, 'lr_reduce_freq': 75, 'spt_alg': 'prim', 'spt_attr': 'similarity', 'manifold': 'PoincareBall', 'num_layers': 3, 'dim': 256, 'num_adj': 6, 'add_rate': 0.3125776779434905, 'tem': 1.079510755660069, 'consis_rate': 1.647669406895563, 'use_att': 1}. Best is trial 20 with value: 0.8122.[0m
[32m[I 2022-07-01 02:03:58,412][0m Trial 22 finished with value: 0.8112 and parameters: {'lr': 0.0011587702488426754, 'weight_decay': 0.0007841171844459467, 'dropout': 0.1743074686380909, 'patience': 80, 'lr_reduce_freq': 75, 'spt_alg': 'prim', 'spt_attr': 'similarity', 'manifold': 'PoincareBall', 'num_layers': 3, 'dim': 256, 'num_adj': 6, 'add_rate': 0.3198716103731039, 'tem': 1.0295845886391115, 'consis_rate': 1.6356017264681868, 'use_att': 1}. Best is trial 20 with value: 0.8122.[0m
[32m[I 2022-07-01 02:21:36,092][0m Trial 23 finished with value: 0.8089000000000001 and parameters: {'lr': 0.0012262887073486736, 'weight_decay': 0.0007518907505931912, 'dropout': 0.17855279484499617, 'patience': 70, 'lr_reduce_freq': 75, 'spt_alg': 'prim', 'spt_attr': 'similarity', 'manifold': 'PoincareBall', 'num_layers': 3, 'dim': 256, 'num_adj': 6, 'add_rate': 0.3318717489805269, 'tem': 1.0901717380990925, 'consis_rate': 1.6901437674724338, 'use_att': 1}. Best is trial 20 with value: 0.8122.[0m
[32m[I 2022-07-01 02:37:27,509][0m Trial 24 finished with value: 0.8097 and parameters: {'lr': 0.002354677324394687, 'weight_decay': 0.0008669891912265404, 'dropout': 0.18546261656058333, 'patience': 80, 'lr_reduce_freq': 60, 'spt_alg': 'prim', 'spt_attr': 'similarity', 'manifold': 'PoincareBall', 'num_layers': 3, 'dim': 336, 'num_adj': 6, 'add_rate': 0.32284625158400887, 'tem': 1.0611364621681996, 'consis_rate': 1.663000283200623, 'use_att': 1}. Best is trial 20 with value: 0.8122.[0m
[32m[I 2022-07-01 02:57:04,050][0m Trial 25 finished with value: 0.8055999999999999 and parameters: {'lr': 0.0010481109864161286, 'weight_decay': 0.0005032324428531715, 'dropout': 0.2045291211432788, 'patience': 80, 'lr_reduce_freq': 75, 'spt_alg': 'prim', 'spt_attr': 'similarity', 'manifold': 'PoincareBall', 'num_layers': 3, 'dim': 272, 'num_adj': 6, 'add_rate': 0.39103505431592556, 'tem': 1.1832867444893016, 'consis_rate': 1.9977373988858482, 'use_att': 1}. Best is trial 20 with value: 0.8122.[0m
