[32m[I 2022-06-30 12:18:39,544][0m Trial 110 finished with value: 0.8112 and parameters: {'lr': 0.018189164695931494, 'weight_decay': 0.0075359260698160385, 'dropout': 0.6481778865968748, 'patience': 70, 'lr_reduce_freq': 50, 'spt_alg': 'prim', 'spt_attr': 'similarity', 'manifold': 'PoincareBall', 'num_layers': 3, 'dim': 464, 'num_adj': 2, 'add_rate': 0.7626118599876861, 'tem': 1.1829926978929326, 'consis_rate': 0.7405276120640316, 'use_att': 1}. Best is trial 84 with value: 0.8213999999999999.[0m

mean: 0.8183
[0.821 0.828 0.807 0.82  0.818 0.803 0.826 0.815 0.826 0.819]
cur_param: {'lr': 0.03364629212621941, 'weight_decay': 0.00658287850550531, 'dropout': 0.7250035656806867, 'patience': 90, 'lr_reduce_freq': 40, 'spt_alg': 'prim', 'spt_attr': 'similarity', 'manifold': 'PoincareBall', 'num_layers': 3, 'dim': 432, 'num_adj': 2, 'add_rate': 0.8676345237622685, 'tem': 1.0904839640117865, 'consis_rate': 1.0623870449582726, 'use_att': 1}
mean: 0.8205
[0.819 0.825 0.824 0.813 0.808 0.834 0.822 0.816 0.827 0.817]
cur_param: {'lr': 0.03325937718067949, 'weight_decay': 0.009232658405586288, 'dropout': 0.7283290300765249, 'patience': 90, 'lr_reduce_freq': 50, 'spt_alg': 'prim', 'spt_attr': 'similarity', 'manifold': 'PoincareBall', 'num_layers': 3, 'dim': 432, 'num_adj': 2, 'add_rate': 0.7766104210232233, 'tem': 1.087481757058542, 'consis_rate': 1.052644663568709, 'use_att': 1}
mean: 0.821
[0.823 0.817 0.822 0.821 0.827 0.825 0.813 0.814 0.829 0.819]
cur_param: {'lr': 0.03425854804972608, 'weight_decay': 0.008914941087910872, 'dropout': 0.7296368810958546, 'patience': 90, 'lr_reduce_freq': 50, 'spt_alg': 'prim', 'spt_attr': 'similarity', 'manifold': 'PoincareBall', 'num_layers': 3, 'dim': 368, 'num_adj': 2, 'add_rate': 0.7683411836449184, 'tem': 1.0860308987224951, 'consis_rate': 1.0646654427106053, 'use_att': 1}
mean: 0.8150999999999999
[0.825 0.806 0.811 0.817 0.825 0.807 0.81  0.827 0.813 0.81 ]
cur_param: {'lr': 0.0407638601816973, 'weight_decay': 0.006184242609019994, 'dropout': 0.6097613425948318, 'patience': 100, 'lr_reduce_freq': 50, 'spt_alg': 'prim', 'spt_attr': 'similarity', 'manifold': 'PoincareBall', 'num_layers': 3, 'dim': 432, 'num_adj': 2, 'add_rate': 0.8766285089605128, 'tem': 1.1734711998613119, 'consis_rate': 0.8787313101026778, 'use_att': 1}
mean: 0.8128
[0.82  0.812 0.807 0.816 0.802 0.822 0.818 0.804 0.808 0.819]
cur_param: {'lr': 0.025511725199432376, 'weight_decay': 0.006750778359513602, 'dropout': 0.6872093196258926, 'patience': 90, 'lr_reduce_freq': 60, 'spt_alg': 'prim', 'spt_attr': 'similarity', 'manifold': 'PoincareBall', 'num_layers': 3, 'dim': 384, 'num_adj': 2, 'add_rate': 0.8608830572524644, 'tem': 1.0929022794161325, 'consis_rate': 0.996088487543429, 'use_att': 1}
mean: 0.8165999999999999
[0.817 0.805 0.806 0.824 0.816 0.823 0.819 0.811 0.823 0.822]
cur_param: {'lr': 0.014291128559005164, 'weight_decay': 0.00868687654680343, 'dropout': 0.7111231549798425, 'patience': 90, 'lr_reduce_freq': 50, 'spt_alg': 'prim', 'spt_attr': 'similarity', 'manifold': 'PoincareBall', 'num_layers': 3, 'dim': 400, 'num_adj': 2, 'add_rate': 0.8199953484722128, 'tem': 1.0193536389503097, 'consis_rate': 0.797691000788543, 'use_att': 1}
mean: 0.38570000000000004
[0.394 0.321 0.319 0.319 0.828 0.319 0.319 0.319 0.364 0.355]
cur_param: {'lr': 0.057866152475144914, 'weight_decay': 0.009847695246288755, 'dropout': 0.7453190106863189, 'patience': 90, 'lr_reduce_freq': 70, 'spt_alg': 'prim', 'spt_attr': 'similarity', 'manifold': 'PoincareBall', 'num_layers': 3, 'dim': 432, 'num_adj': 2, 'add_rate': 0.7842162906432707, 'tem': 1.3325432056162774, 'consis_rate': 1.1887664963138282, 'use_att': 1}
mean: 0.8144
[0.818 0.827 0.819 0.809 0.801 0.825 0.807 0.794 0.809 0.835]
cur_param: {'lr': 0.02193475272620852, 'weight_decay': 0.012277048566524666, 'dropout': 0.7040975845631697, 'patience': 100, 'lr_reduce_freq': 40, 'spt_alg': 'prim', 'spt_attr': 'similarity', 'manifold': 'PoincareBall', 'num_layers': 4, 'dim': 416, 'num_adj': 2, 'add_rate': 0.8504626953496044, 'tem': 1.2189303573845836, 'consis_rate': 0.9469019784038467, 'use_att': 1}
mean: 0.3191
[0.319 0.319 0.319 0.319 0.319 0.32  0.319 0.319 0.319 0.319]
cur_param: {'lr': 0.02708640219900922, 'weight_decay': 0.005660142869494764, 'dropout': 0.7306303725955949, 'patience': 70, 'lr_reduce_freq': 40, 'spt_alg': 'prim', 'spt_attr': 'similarity', 'manifold': 'PoincareBall', 'num_layers': 3, 'dim': 448, 'num_adj': 2, 'add_rate': 0.7188384597447826, 'tem': 1.2220612881583306, 'consis_rate': 1.1647853444737946, 'use_att': 1}
mean: 0.8193999999999999
[0.837 0.825 0.826 0.82  0.822 0.822 0.81  0.8   0.81  0.822]
cur_param: {'lr': 0.026050289191749804, 'weight_decay': 0.005685407899606153, 'dropout': 0.7284769908534231, 'patience': 70, 'lr_reduce_freq': 40, 'spt_alg': 'prim', 'spt_attr': 'similarity', 'manifold': 'PoincareBall', 'num_layers': 3, 'dim': 400, 'num_adj': 2, 'add_rate': 0.7088393776603236, 'tem': 1.2313731896243114, 'consis_rate': 1.2354159435957413, 'use_att': 1}
mean: 0.8153
[0.813 0.818 0.82  0.808 0.816 0.8   0.817 0.823 0.815 0.823]
cur_param: {'lr': 0.032030507982513, 'weight_decay': 0.005302346000738841, 'dropout': 0.678229618279051, 'patience': 70, 'lr_reduce_freq': 30, 'spt_alg': 'prim', 'spt_attr': 'similarity', 'manifold': 'PoincareBall', 'num_layers': 3, 'dim': 416, 'num_adj': 2, 'add_rate': 0.7575373343920195, 'tem': 1.138892684892479, 'consis_rate': 1.0234401642950273, 'use_att': 1}
mean: 0.8151999999999999
[0.827 0.826 0.808 0.815 0.813 0.809 0.819 0.807 0.812 0.816]
cur_param: {'lr': 0.015149151896097989, 'weight_decay': 0.006977135149022124, 'dropout': 0.7535744655749731, 'patience': 70, 'lr_reduce_freq': 50, 'spt_alg': 'prim', 'spt_attr': 'similarity', 'manifold': 'PoincareBall', 'num_layers': 3, 'dim': 432, 'num_adj': 2, 'add_rate': 0.7324936813168421, 'tem': 1.1773977687781882, 'consis_rate': 1.0650383518336128, 'use_att': 1}
mean: 0.8185999999999998
[0.83  0.82  0.824 0.826 0.793 0.83  0.798 0.825 0.818 0.822]
cur_param: {'lr': 0.014986056613175234, 'weight_decay': 0.006908936815855968, 'dropout': 0.7167169268248597, 'patience': 90, 'lr_reduce_freq': 50, 'spt_alg': 'prim', 'spt_attr': 'similarity', 'manifold': 'PoincareBall', 'num_layers': 3, 'dim': 432, 'num_adj': 2, 'add_rate': 0.7368450713767273, 'tem': 1.0681692474459257, 'consis_rate': 1.067451819773898, 'use_att': 1}
mean: 0.8124
[0.823 0.803 0.811 0.817 0.825 0.806 0.815 0.809 0.81  0.805]
cur_param: {'lr': 0.023224121336290916, 'weight_decay': 0.008041852176306322, 'dropout': 0.7580898878323087, 'patience': 70, 'lr_reduce_freq': 60, 'spt_alg': 'prim', 'spt_attr': 'similarity', 'manifold': 'PoincareBall', 'num_layers': 3, 'dim': 480, 'num_adj': 2, 'add_rate': 0.7884504727954933, 'tem': 1.1752365544549543, 'consis_rate': 1.1604526568179194, 'use_att': 1}
mean: 0.817
[0.823 0.803 0.826 0.815 0.82  0.812 0.829 0.822 0.789 0.831]
cur_param: {'lr': 0.019985455480460643, 'weight_decay': 0.0047058393078963125, 'dropout': 0.7425010754155124, 'patience': 90, 'lr_reduce_freq': 50, 'spt_alg': 'prim', 'spt_attr': 'similarity', 'manifold': 'PoincareBall', 'num_layers': 3, 'dim': 448, 'num_adj': 2, 'add_rate': 0.724796482534994, 'tem': 1.1449843268832727, 'consis_rate': 0.9668986450013646, 'use_att': 0}
mean: 0.8053000000000001
[0.798 0.813 0.813 0.81  0.794 0.817 0.792 0.805 0.808 0.803]
cur_param: {'lr': 0.03966203502819761, 'weight_decay': 0.011925786718994792, 'dropout': 0.6947128688082194, 'patience': 90, 'lr_reduce_freq': 60, 'spt_alg': 'prim', 'spt_attr': 'similarity', 'manifold': 'PoincareBall', 'num_layers': 5, 'dim': 464, 'num_adj': 2, 'add_rate': 0.6795554350091827, 'tem': 1.373816767617195, 'consis_rate': 0.8987655134925485, 'use_att': 1}
mean: 0.319
[0.319 0.319 0.319 0.319 0.319 0.319 0.319 0.319 0.319 0.319]
cur_param: {'lr': 0.01108491684994623, 'weight_decay': 0.0062228086290572245, 'dropout': 0.7281249212205468, 'patience': 90, 'lr_reduce_freq': 50, 'spt_alg': 'prim', 'spt_attr': 'similarity', 'manifold': 'Hyperboloid', 'num_layers': 3, 'dim': 496, 'num_adj': 2, 'add_rate': 0.8154739919539236, 'tem': 1.2950225150067858, 'consis_rate': 1.0108797866817611, 'use_att': 1}
mean: 0.546
[0.728 0.319 0.319 0.58  0.319 0.32  0.632 0.773 0.801 0.669]
cur_param: {'lr': 0.018189164695931494, 'weight_decay': 0.0075359260698160385, 'dropout': 0.6481778865968748, 'patience': 70, 'lr_reduce_freq': 50, 'spt_alg': 'prim', 'spt_attr': 'similarity', 'manifold': 'PoincareBall', 'num_layers': 3, 'dim': 464, 'num_adj': 2, 'add_rate': 0.7626118599876861, 'tem': 1.1829926978929326, 'consis_rate': 0.7405276120640316, 'use_att': 1}
mean: 0.8112
[0.818 0.828 0.803 0.804 0.814 0.808 0.82  0.809 0.812 0.796]
cur_param: {'lr': 0.00893734970151369, 'weight_decay': 0.0040699255512042405, 'dropout': 0.7839934941586669, 'patience': 70, 'lr_reduce_freq': 40, 'spt_alg': 'prim', 'spt_attr': 'similarity', 'manifold': 'PoincareBall', 'num_layers': 3, 'dim': 416, 'num_adj': 2, 'add_rate': 0.8991469168333827, 'tem': 1.2288935460243158, 'consis_rate': 1.0775763820839819, 'use_att': 1}[32m[I 2022-06-30 12:29:53,349][0m Trial 111 finished with value: 0.8145 and parameters: {'lr': 0.00893734970151369, 'weight_decay': 0.0040699255512042405, 'dropout': 0.7839934941586669, 'patience': 70, 'lr_reduce_freq': 40, 'spt_alg': 'prim', 'spt_attr': 'similarity', 'manifold': 'PoincareBall', 'num_layers': 3, 'dim': 416, 'num_adj': 2, 'add_rate': 0.8991469168333827, 'tem': 1.2288935460243158, 'consis_rate': 1.0775763820839819, 'use_att': 1}. Best is trial 84 with value: 0.8213999999999999.[0m
[32m[I 2022-06-30 12:41:28,512][0m Trial 112 finished with value: 0.818 and parameters: {'lr': 0.013123101756998231, 'weight_decay': 0.0050476284552631485, 'dropout': 0.7997128638335957, 'patience': 70, 'lr_reduce_freq': 40, 'spt_alg': 'prim', 'spt_attr': 'similarity', 'manifold': 'PoincareBall', 'num_layers': 3, 'dim': 448, 'num_adj': 2, 'add_rate': 0.7948978808451295, 'tem': 1.2822986386889905, 'consis_rate': 0.8561962715723699, 'use_att': 1}. Best is trial 84 with value: 0.8213999999999999.[0m
[32m[I 2022-06-30 12:53:26,159][0m Trial 113 finished with value: 0.8145 and parameters: {'lr': 0.015577723514697314, 'weight_decay': 0.005115620257815938, 'dropout': 0.7576431753893995, 'patience': 70, 'lr_reduce_freq': 40, 'spt_alg': 'prim', 'spt_attr': 'similarity', 'manifold': 'PoincareBall', 'num_layers': 3, 'dim': 448, 'num_adj': 2, 'add_rate': 0.7950109396208643, 'tem': 1.1550329566384145, 'consis_rate': 1.1322659798144517, 'use_att': 1}. Best is trial 84 with value: 0.8213999999999999.[0m
[32m[I 2022-06-30 13:05:45,991][0m Trial 114 finished with value: 0.8161999999999999 and parameters: {'lr': 0.013420225009124383, 'weight_decay': 0.006589432049247804, 'dropout': 0.7802670401885504, 'patience': 70, 'lr_reduce_freq': 40, 'spt_alg': 'prim', 'spt_attr': 'similarity', 'manifold': 'PoincareBall', 'num_layers': 3, 'dim': 432, 'num_adj': 2, 'add_rate': 0.8387592252146765, 'tem': 1.4592135149991075, 'consis_rate': 0.8427938442534797, 'use_att': 1}. Best is trial 84 with value: 0.8213999999999999.[0m
[32m[I 2022-06-30 13:22:01,723][0m Trial 115 finished with value: 0.8166 and parameters: {'lr': 0.007467281638518032, 'weight_decay': 0.005738332071411042, 'dropout': 0.742611790375882, 'patience': 90, 'lr_reduce_freq': 50, 'spt_alg': 'prim', 'spt_attr': 'similarity', 'manifold': 'PoincareBall', 'num_layers': 3, 'dim': 480, 'num_adj': 2, 'add_rate': 0.748805390387421, 'tem': 1.3316171474579288, 'consis_rate': 0.9381879129122269, 'use_att': 1}. Best is trial 84 with value: 0.8213999999999999.[0m
[32m[I 2022-06-30 13:32:39,219][0m Trial 116 finished with value: 0.8170999999999999 and parameters: {'lr': 0.009948480910294044, 'weight_decay': 0.004421485705852437, 'dropout': 0.7997585567955243, 'patience': 70, 'lr_reduce_freq': 40, 'spt_alg': 'prim', 'spt_attr': 'similarity', 'manifold': 'PoincareBall', 'num_layers': 3, 'dim': 448, 'num_adj': 2, 'add_rate': 0.7163721732037396, 'tem': 1.0970035908671616, 'consis_rate': 1.1990837073036982, 'use_att': 1}. Best is trial 84 with value: 0.8213999999999999.[0m
[32m[I 2022-06-30 13:38:20,379][0m Trial 117 finished with value: 0.3062 and parameters: {'lr': 0.019978355398194297, 'weight_decay': 0.01428071443593577, 'dropout': 0.7146458805411734, 'patience': 90, 'lr_reduce_freq': 50, 'spt_alg': 'prim', 'spt_attr': 'similarity', 'manifold': 'PoincareBall', 'num_layers': 3, 'dim': 432, 'num_adj': 2, 'add_rate': 0.7706449472208711, 'tem': 1.2717550677277112, 'consis_rate': 1.0510173041603643, 'use_att': 1}. Best is trial 84 with value: 0.8213999999999999.[0m
[32m[I 2022-06-30 13:49:50,627][0m Trial 118 finished with value: 0.8151999999999999 and parameters: {'lr': 0.01655642495766629, 'weight_decay': 0.007257830616382529, 'dropout': 0.7629673775276561, 'patience': 100, 'lr_reduce_freq': 60, 'spt_alg': 'prim', 'spt_attr': 'similarity', 'manifold': 'PoincareBall', 'num_layers': 3, 'dim': 464, 'num_adj': 2, 'add_rate': 0.6968847845238584, 'tem': 1.1244707803719265, 'consis_rate': 0.8149675814349494, 'use_att': 1}. Best is trial 84 with value: 0.8213999999999999.[0m
[32m[I 2022-06-30 13:58:52,309][0m Trial 119 finished with value: 0.8200000000000001 and parameters: {'lr': 0.023113168597282973, 'weight_decay': 0.009424444852772931, 'dropout': 0.729112713255771, 'patience': 90, 'lr_reduce_freq': 40, 'spt_alg': 'prim', 'spt_attr': 'similarity', 'manifold': 'PoincareBall', 'num_layers': 3, 'dim': 416, 'num_adj': 2, 'add_rate': 0.6626535797431111, 'tem': 1.2749387610124063, 'consis_rate': 0.7620526571329289, 'use_att': 1}. Best is trial 84 with value: 0.8213999999999999.[0m
[32m[I 2022-06-30 14:10:31,488][0m Trial 120 finished with value: 0.8225999999999999 and parameters: {'lr': 0.02990095005649478, 'weight_decay': 0.009651366360400586, 'dropout': 0.7008146407378063, 'patience': 90, 'lr_reduce_freq': 40, 'spt_alg': 'kruskal', 'spt_attr': 'similarity', 'manifold': 'PoincareBall', 'num_layers': 3, 'dim': 416, 'num_adj': 2, 'add_rate': 0.8829912018019117, 'tem': 1.0427956280652317, 'consis_rate': 0.6580238961292373, 'use_att': 1}. Best is trial 120 with value: 0.8225999999999999.[0m
[32m[I 2022-06-30 14:20:34,040][0m Trial 121 finished with value: 0.8176 and parameters: {'lr': 0.030689933638912942, 'weight_decay': 0.009468294847976021, 'dropout': 0.7001442959254386, 'patience': 90, 'lr_reduce_freq': 40, 'spt_alg': 'kruskal', 'spt_attr': 'similarity', 'manifold': 'PoincareBall', 'num_layers': 3, 'dim': 416, 'num_adj': 2, 'add_rate': 0.6658797461107581, 'tem': 0.9607792423153902, 'consis_rate': 0.519736880548547, 'use_att': 1}. Best is trial 120 with value: 0.8225999999999999.[0m
[32m[I 2022-06-30 14:30:29,986][0m Trial 122 finished with value: 0.76 and parameters: {'lr': 0.026119625606169858, 'weight_decay': 0.010211046065933486, 'dropout': 0.7302111797808127, 'patience': 90, 'lr_reduce_freq': 40, 'spt_alg': 'kruskal', 'spt_attr': 'similarity', 'manifold': 'PoincareBall', 'num_layers': 3, 'dim': 416, 'num_adj': 2, 'add_rate': 0.8729091800737379, 'tem': 1.0363847990490203, 'consis_rate': 0.7354434208108016, 'use_att': 1}. Best is trial 120 with value: 0.8225999999999999.[0m
[32m[I 2022-06-30 14:41:26,254][0m Trial 123 finished with value: 0.8139 and parameters: {'lr': 0.04351504429863692, 'weight_decay': 0.011061739780643537, 'dropout': 0.6833168124047564, 'patience': 90, 'lr_reduce_freq': 50, 'spt_alg': 'kruskal', 'spt_attr': 'similarity', 'manifold': 'PoincareBall', 'num_layers': 3, 'dim': 432, 'num_adj': 2, 'add_rate': 0.682952779339118, 'tem': 0.9930611818209564, 'consis_rate': 0.6477518364861465, 'use_att': 1}. Best is trial 120 with value: 0.8225999999999999.[0m
[32m[I 2022-06-30 14:49:37,385][0m Trial 124 finished with value: 0.8083 and parameters: {'lr': 0.03601523004573536, 'weight_decay': 0.008515613069237468, 'dropout': 0.5472896216906673, 'patience': 90, 'lr_reduce_freq': 40, 'spt_alg': 'kruskal', 'spt_attr': 'similarity', 'manifold': 'PoincareBall', 'num_layers': 3, 'dim': 400, 'num_adj': 2, 'add_rate': 0.643502095232753, 'tem': 1.230980998436168, 'consis_rate': 0.768536326276463, 'use_att': 1}. Best is trial 120 with value: 0.8225999999999999.[0m
[32m[I 2022-06-30 14:55:27,687][0m Trial 125 finished with value: 0.319 and parameters: {'lr': 0.02268839321404666, 'weight_decay': 0.01383104002715792, 'dropout': 0.7433027631703868, 'patience': 90, 'lr_reduce_freq': 30, 'spt_alg': 'kruskal', 'spt_attr': 'similarity', 'manifold': 'PoincareBall', 'num_layers': 3, 'dim': 432, 'num_adj': 2, 'add_rate': 0.8460909707469437, 'tem': 1.0793601854131871, 'consis_rate': 0.5625988483635906, 'use_att': 1}. Best is trial 120 with value: 0.8225999999999999.[0m
[32m[I 2022-06-30 14:56:59,908][0m Trial 126 finished with value: 0.31870000000000004 and parameters: {'lr': 0.027620675503292832, 'weight_decay': 0.016189936308644785, 'dropout': 0.6714157681545642, 'patience': 90, 'lr_reduce_freq': 50, 'spt_alg': 'prim', 'spt_attr': 'similarity', 'manifold': 'PoincareBall', 'num_layers': 3, 'dim': 416, 'num_adj': 2, 'add_rate': 0.8872629095583799, 'tem': 1.0458229481614558, 'consis_rate': 1.0132283676919236, 'use_att': 0}. Best is trial 120 with value: 0.8225999999999999.[0m
[32m[I 2022-06-30 15:07:27,491][0m Trial 127 finished with value: 0.8193999999999999 and parameters: {'lr': 0.024130970297396817, 'weight_decay': 0.009359827729521687, 'dropout': 0.7172699691746067, 'patience': 90, 'lr_reduce_freq': 40, 'spt_alg': 'prim', 'spt_attr': 'similarity', 'manifold': 'PoincareBall', 'num_layers': 3, 'dim': 384, 'num_adj': 2, 'add_rate': 0.6639484876246137, 'tem': 0.9294243463750893, 'consis_rate': 0.6618461701655303, 'use_att': 1}. Best is trial 120 with value: 0.8225999999999999.[0m
[32m[I 2022-06-30 15:13:15,510][0m Trial 128 finished with value: 0.3198 and parameters: {'lr': 0.03098729220847258, 'weight_decay': 0.03562082775512469, 'dropout': 0.7087128207274039, 'patience': 90, 'lr_reduce_freq': 30, 'spt_alg': 'prim', 'spt_attr': 'similarity', 'manifold': 'PoincareBall', 'num_layers': 3, 'dim': 384, 'num_adj': 2, 'add_rate': 0.6578546997007585, 'tem': 0.9222867433045899, 'consis_rate': 0.702997962187149, 'use_att': 1}. Best is trial 120 with value: 0.8225999999999999.[0m
