[32m[I 2022-06-26 18:12:07,727][0m Trial 52 finished with value: 0.8104000000000001 and parameters: {'lr': 0.005529582326481514, 'weight_decay': 0.000554498320943484, 'dropout': 0.549070298351557, 'patience': 100, 'lr_reduce_freq': 80, 'spt_alg': 'kruskal', 'spt_attr': 'edge_degree', 'manifold': 'PoincareBall', 'num_layers': 3, 'dim': 280, 'num_adj': 6, 'add_rate': 0.3505537706942535, 'tem': 0.8039837649206903, 'consis_rate': 1.8578391966402927, 'use_att': 1}. Best is trial 25 with value: 0.8219.[0m

[0.818 0.816 0.794 0.825 0.828 0.824 0.807 0.813 0.819 0.825]
cur_param: {'lr': 0.007073453701428424, 'weight_decay': 0.0004323769740346818, 'dropout': 0.6827507573890262, 'patience': 100, 'lr_reduce_freq': 80, 'spt_alg': 'prim', 'spt_attr': 'edge_degree', 'manifold': 'PoincareBall', 'num_layers': 3, 'dim': 260, 'num_adj': 6, 'add_rate': 0.5017366593015421, 'tem': 1.0006406880408907, 'consis_rate': 1.7511155276539503, 'use_att': 1}
mean: 0.8172
[0.831 0.829 0.814 0.83  0.82  0.809 0.805 0.809 0.801 0.824]
cur_param: {'lr': 0.006103604202594668, 'weight_decay': 0.0006565278148748999, 'dropout': 0.6552389959253194, 'patience': 120, 'lr_reduce_freq': 90, 'spt_alg': 'kruskal', 'spt_attr': 'similarity', 'manifold': 'Hyperboloid', 'num_layers': 3, 'dim': 280, 'num_adj': 4, 'add_rate': 0.5754651247435667, 'tem': 0.9472874675465636, 'consis_rate': 1.6147550407194098, 'use_att': 1}
mean: 0.8141999999999999
[0.818 0.815 0.824 0.813 0.802 0.819 0.812 0.824 0.808 0.807]
cur_param: {'lr': 0.004808549851403571, 'weight_decay': 0.0006128114516923019, 'dropout': 0.6049359249897373, 'patience': 90, 'lr_reduce_freq': 80, 'spt_alg': 'prim', 'spt_attr': 'edge_degree', 'manifold': 'PoincareBall', 'num_layers': 3, 'dim': 208, 'num_adj': 6, 'add_rate': 0.5997800268767859, 'tem': 1.1526996708257062, 'consis_rate': 1.8207607989308816, 'use_att': 0}
mean: 0.8150999999999999
[0.801 0.827 0.828 0.804 0.818 0.815 0.805 0.808 0.827 0.818]
cur_param: {'lr': 0.008514081371373276, 'weight_decay': 0.0006972020877185267, 'dropout': 0.7416914505535936, 'patience': 80, 'lr_reduce_freq': 120, 'spt_alg': 'kruskal', 'spt_attr': 'edge_degree', 'manifold': 'Hyperboloid', 'num_layers': 3, 'dim': 272, 'num_adj': 4, 'add_rate': 0.5261940594142002, 'tem': 0.8619277050614957, 'consis_rate': 1.5442526627302868, 'use_att': 1}
mean: 0.8177
[0.802 0.83  0.821 0.833 0.803 0.815 0.817 0.815 0.817 0.824]
cur_param: {'lr': 0.008034220007153654, 'weight_decay': 0.0005497592012901994, 'dropout': 0.6255565179475461, 'patience': 90, 'lr_reduce_freq': 100, 'spt_alg': 'prim', 'spt_attr': 'similarity', 'manifold': 'PoincareBall', 'num_layers': 3, 'dim': 304, 'num_adj': 6, 'add_rate': 0.5526312340053479, 'tem': 0.8988648893338629, 'consis_rate': 1.6802028371995126, 'use_att': 1}
mean: 0.8095000000000001
[0.821 0.807 0.8   0.823 0.804 0.803 0.785 0.81  0.826 0.816]
cur_param: {'lr': 0.0031102144061019173, 'weight_decay': 0.0005945894752645241, 'dropout': 0.6939389785803495, 'patience': 90, 'lr_reduce_freq': 90, 'spt_alg': 'kruskal', 'spt_attr': 'edge_degree', 'manifold': 'PoincareBall', 'num_layers': 3, 'dim': 328, 'num_adj': 6, 'add_rate': 0.43477172340991227, 'tem': 0.8659973485244596, 'consis_rate': 1.9713904524965717, 'use_att': 1}
mean: 0.8164
[0.8   0.822 0.816 0.802 0.823 0.833 0.811 0.82  0.826 0.811]
cur_param: {'lr': 0.0040690015178503815, 'weight_decay': 0.0005142837681233751, 'dropout': 0.7211954431388254, 'patience': 90, 'lr_reduce_freq': 90, 'spt_alg': 'kruskal', 'spt_attr': 'edge_degree', 'manifold': 'PoincareBall', 'num_layers': 3, 'dim': 300, 'num_adj': 6, 'add_rate': 0.34106312997088495, 'tem': 0.8201629786747133, 'consis_rate': 1.8939603717115139, 'use_att': 1}
mean: 0.8183
[0.819 0.838 0.799 0.83  0.811 0.809 0.82  0.831 0.815 0.811]
cur_param: {'lr': 0.0038894202058760625, 'weight_decay': 0.000497182530881021, 'dropout': 0.7171990096591341, 'patience': 100, 'lr_reduce_freq': 80, 'spt_alg': 'kruskal', 'spt_attr': 'edge_degree', 'manifold': 'PoincareBall', 'num_layers': 3, 'dim': 280, 'num_adj': 6, 'add_rate': 0.3338779188274322, 'tem': 0.8231364976152491, 'consis_rate': 1.8727364210867243, 'use_att': 1}
mean: 0.8207000000000001
[0.813 0.823 0.808 0.833 0.815 0.821 0.826 0.833 0.82  0.815]
cur_param: {'lr': 0.005681795663853792, 'weight_decay': 0.00038292758640780076, 'dropout': 0.709233687960151, 'patience': 100, 'lr_reduce_freq': 80, 'spt_alg': 'kruskal', 'spt_attr': 'edge_degree', 'manifold': 'PoincareBall', 'num_layers': 3, 'dim': 264, 'num_adj': 6, 'add_rate': 0.30991544624292783, 'tem': 0.8427985307305903, 'consis_rate': 1.8660531739949773, 'use_att': 1}
mean: 0.8159000000000001
[0.825 0.827 0.811 0.821 0.813 0.811 0.823 0.807 0.818 0.803]
cur_param: {'lr': 0.003675944726094762, 'weight_decay': 0.00046617791380915066, 'dropout': 0.7629871013387994, 'patience': 110, 'lr_reduce_freq': 80, 'spt_alg': 'kruskal', 'spt_attr': 'edge_degree', 'manifold': 'PoincareBall', 'num_layers': 3, 'dim': 276, 'num_adj': 6, 'add_rate': 0.3399404745812811, 'tem': 0.8189332184075374, 'consis_rate': 1.7792371914174283, 'use_att': 1}
mean: 0.8171999999999999
[0.81  0.824 0.82  0.809 0.831 0.823 0.828 0.821 0.821 0.785]
cur_param: {'lr': 0.0025196872677674433, 'weight_decay': 0.0005013430561340331, 'dropout': 0.6796654766784347, 'patience': 80, 'lr_reduce_freq': 80, 'spt_alg': 'prim', 'spt_attr': 'edge_degree', 'manifold': 'PoincareBall', 'num_layers': 3, 'dim': 264, 'num_adj': 6, 'add_rate': 0.38808939549305965, 'tem': 0.8897671113210617, 'consis_rate': 1.8380150623154206, 'use_att': 1}
mean: 0.8153
[0.784 0.807 0.819 0.829 0.822 0.816 0.834 0.805 0.828 0.809]
cur_param: {'lr': 0.004511103192900656, 'weight_decay': 0.0005592824339663683, 'dropout': 0.5776939859992972, 'patience': 100, 'lr_reduce_freq': 80, 'spt_alg': 'kruskal', 'spt_attr': 'edge_degree', 'manifold': 'PoincareBall', 'num_layers': 3, 'dim': 288, 'num_adj': 6, 'add_rate': 0.3212121469642993, 'tem': 0.8137761490786629, 'consis_rate': 1.8741214851256123, 'use_att': 1}
mean: 0.819
[0.82  0.826 0.827 0.816 0.825 0.816 0.811 0.812 0.819 0.818]
cur_param: {'lr': 0.004063878877275627, 'weight_decay': 0.0007560305750905565, 'dropout': 0.7356039283339634, 'patience': 80, 'lr_reduce_freq': 80, 'spt_alg': 'kruskal', 'spt_attr': 'similarity', 'manifold': 'Hyperboloid', 'num_layers': 3, 'dim': 244, 'num_adj': 6, 'add_rate': 0.5759828590345835, 'tem': 1.025568009403007, 'consis_rate': 1.9822967544687722, 'use_att': 1}
mean: 0.8117000000000001
[0.813 0.813 0.802 0.806 0.815 0.814 0.813 0.819 0.811 0.811]
cur_param: {'lr': 0.0052288714906441585, 'weight_decay': 0.0004334596524845682, 'dropout': 0.6531682956703487, 'patience': 120, 'lr_reduce_freq': 110, 'spt_alg': 'kruskal', 'spt_attr': 'edge_degree', 'manifold': 'PoincareBall', 'num_layers': 3, 'dim': 312, 'num_adj': 4, 'add_rate': 0.3621999897406913, 'tem': 1.0588719836328553, 'consis_rate': 1.8018682124477012, 'use_att': 0}
mean: 0.8048
[0.803 0.804 0.8   0.799 0.809 0.802 0.824 0.803 0.8   0.804]
cur_param: {'lr': 0.006604125454575583, 'weight_decay': 0.0006207011112215497, 'dropout': 0.7747731208731788, 'patience': 80, 'lr_reduce_freq': 80, 'spt_alg': 'kruskal', 'spt_attr': 'edge_degree', 'manifold': 'PoincareBall', 'num_layers': 3, 'dim': 252, 'num_adj': 2, 'add_rate': 0.5144810074395008, 'tem': 0.9854349692717308, 'consis_rate': 1.9490565909102364, 'use_att': 1}
mean: 0.8116
[0.803 0.818 0.807 0.829 0.822 0.827 0.785 0.799 0.812 0.814]
cur_param: {'lr': 0.004637451923607638, 'weight_decay': 0.0005717839317728713, 'dropout': 0.5699790478376054, 'patience': 100, 'lr_reduce_freq': 80, 'spt_alg': 'kruskal', 'spt_attr': 'edge_degree', 'manifold': 'PoincareBall', 'num_layers': 3, 'dim': 288, 'num_adj': 6, 'add_rate': 0.32312120421219664, 'tem': 0.8155167861018651, 'consis_rate': 1.9074255271481602, 'use_att': 1}
mean: 0.8179000000000001
[0.821 0.813 0.826 0.824 0.828 0.807 0.82  0.814 0.818 0.808]
cur_param: {'lr': 0.005529582326481514, 'weight_decay': 0.000554498320943484, 'dropout': 0.549070298351557, 'patience': 100, 'lr_reduce_freq': 80, 'spt_alg': 'kruskal', 'spt_attr': 'edge_degree', 'manifold': 'PoincareBall', 'num_layers': 3, 'dim': 280, 'num_adj': 6, 'add_rate': 0.3505537706942535, 'tem': 0.8039837649206903, 'consis_rate': 1.8578391966402927, 'use_att': 1}
mean: 0.8104000000000001
[0.812 0.807 0.796 0.831 0.825 0.794 0.816 0.813 0.805 0.805]
cur_param: {'lr': 0.004323869840087995, 'weight_decay': 0.0005181051565130015, 'dropout': 0.5985604736393493, 'patience': 110, 'lr_reduce_freq': 80, 'spt_alg': 'kruskal', 'spt_attr': 'edge_degree', 'manifold': 'PoincareBall', 'num_layers': 3, 'dim': 292, 'num_adj': 6, 'add_rate': 0.3170481624651031, 'tem': 0.8762885010815715, 'consis_rate': 1.8746969537329075, 'use_att': 1}[32m[I 2022-06-26 18:31:41,820][0m Trial 53 finished with value: 0.8099999999999999 and parameters: {'lr': 0.004323869840087995, 'weight_decay': 0.0005181051565130015, 'dropout': 0.5985604736393493, 'patience': 110, 'lr_reduce_freq': 80, 'spt_alg': 'kruskal', 'spt_attr': 'edge_degree', 'manifold': 'PoincareBall', 'num_layers': 3, 'dim': 292, 'num_adj': 6, 'add_rate': 0.3170481624651031, 'tem': 0.8762885010815715, 'consis_rate': 1.8746969537329075, 'use_att': 1}. Best is trial 25 with value: 0.8219.[0m
[32m[I 2022-06-26 18:50:09,520][0m Trial 54 finished with value: 0.8170999999999999 and parameters: {'lr': 0.003670272995220415, 'weight_decay': 0.0005707696764810353, 'dropout': 0.5878370422510737, 'patience': 100, 'lr_reduce_freq': 90, 'spt_alg': 'kruskal', 'spt_attr': 'edge_degree', 'manifold': 'PoincareBall', 'num_layers': 3, 'dim': 268, 'num_adj': 6, 'add_rate': 0.33089472468173725, 'tem': 0.843829799774127, 'consis_rate': 1.7426672189088888, 'use_att': 1}. Best is trial 25 with value: 0.8219.[0m
[32m[I 2022-06-26 19:09:42,765][0m Trial 55 finished with value: 0.8093 and parameters: {'lr': 0.0032805014899363084, 'weight_decay': 0.000499844454223118, 'dropout': 0.5203212215777839, 'patience': 110, 'lr_reduce_freq': 80, 'spt_alg': 'kruskal', 'spt_attr': 'edge_degree', 'manifold': 'PoincareBall', 'num_layers': 3, 'dim': 296, 'num_adj': 6, 'add_rate': 0.39001576072836086, 'tem': 0.815790248845823, 'consis_rate': 1.9946019958628718, 'use_att': 1}. Best is trial 25 with value: 0.8219.[0m
[32m[I 2022-06-26 19:29:18,115][0m Trial 56 finished with value: 0.8148 and parameters: {'lr': 0.002696764624203404, 'weight_decay': 0.0006616708835861571, 'dropout': 0.6968177419530508, 'patience': 100, 'lr_reduce_freq': 80, 'spt_alg': 'kruskal', 'spt_attr': 'edge_degree', 'manifold': 'PoincareBall', 'num_layers': 3, 'dim': 280, 'num_adj': 6, 'add_rate': 0.3101570120735873, 'tem': 0.8518380107649054, 'consis_rate': 1.909789442497908, 'use_att': 1}. Best is trial 25 with value: 0.8219.[0m
[32m[I 2022-06-26 19:46:02,692][0m Trial 57 finished with value: 0.8156000000000001 and parameters: {'lr': 0.004226928867141102, 'weight_decay': 0.00047606273970038316, 'dropout': 0.5808163197773748, 'patience': 90, 'lr_reduce_freq': 80, 'spt_alg': 'prim', 'spt_attr': 'edge_degree', 'manifold': 'PoincareBall', 'num_layers': 3, 'dim': 288, 'num_adj': 6, 'add_rate': 0.3490647096038247, 'tem': 0.8346326019667766, 'consis_rate': 1.8196156684988534, 'use_att': 1}. Best is trial 25 with value: 0.8219.[0m
[32m[I 2022-06-26 20:03:38,145][0m Trial 58 finished with value: 0.8150000000000001 and parameters: {'lr': 0.004678858590779894, 'weight_decay': 0.0005289119178261054, 'dropout': 0.61252173766926, 'patience': 100, 'lr_reduce_freq': 90, 'spt_alg': 'kruskal', 'spt_attr': 'edge_degree', 'manifold': 'PoincareBall', 'num_layers': 3, 'dim': 308, 'num_adj': 6, 'add_rate': 0.41508121503967443, 'tem': 0.800746297301631, 'consis_rate': 1.9397211673009274, 'use_att': 1}. Best is trial 25 with value: 0.8219.[0m
[32m[I 2022-06-26 20:21:02,272][0m Trial 59 finished with value: 0.8189 and parameters: {'lr': 0.0038656943528901605, 'weight_decay': 0.0005596961284712677, 'dropout': 0.6283838397911137, 'patience': 90, 'lr_reduce_freq': 80, 'spt_alg': 'kruskal', 'spt_attr': 'edge_degree', 'manifold': 'PoincareBall', 'num_layers': 3, 'dim': 276, 'num_adj': 6, 'add_rate': 0.3752977197368568, 'tem': 0.882947597757066, 'consis_rate': 1.9604906288774568, 'use_att': 1}. Best is trial 25 with value: 0.8219.[0m
[32m[I 2022-06-26 20:38:46,857][0m Trial 60 finished with value: 0.8109999999999999 and parameters: {'lr': 0.0049393214219449096, 'weight_decay': 0.0006016731909833091, 'dropout': 0.6733513583337579, 'patience': 80, 'lr_reduce_freq': 90, 'spt_alg': 'kruskal', 'spt_attr': 'similarity', 'manifold': 'Hyperboloid', 'num_layers': 3, 'dim': 296, 'num_adj': 4, 'add_rate': 0.472443481054721, 'tem': 0.8595250696233283, 'consis_rate': 1.7282177988496426, 'use_att': 1}. Best is trial 25 with value: 0.8219.[0m
[32m[I 2022-06-26 20:56:22,193][0m Trial 61 finished with value: 0.8173 and parameters: {'lr': 0.0039084503291101184, 'weight_decay': 0.0005602500380369658, 'dropout': 0.6272395653579571, 'patience': 90, 'lr_reduce_freq': 80, 'spt_alg': 'kruskal', 'spt_attr': 'edge_degree', 'manifold': 'PoincareBall', 'num_layers': 3, 'dim': 276, 'num_adj': 6, 'add_rate': 0.37573042226292325, 'tem': 0.8824874475250156, 'consis_rate': 1.9695406972672678, 'use_att': 1}. Best is trial 25 with value: 0.8219.[0m
[32m[I 2022-06-26 21:15:00,945][0m Trial 62 finished with value: 0.8158999999999998 and parameters: {'lr': 0.0030590619457960596, 'weight_decay': 0.000583932121484587, 'dropout': 0.6417168569869617, 'patience': 90, 'lr_reduce_freq': 80, 'spt_alg': 'kruskal', 'spt_attr': 'edge_degree', 'manifold': 'PoincareBall', 'num_layers': 3, 'dim': 284, 'num_adj': 6, 'add_rate': 0.39863616337539526, 'tem': 0.8383973260822373, 'consis_rate': 1.94891956794151, 'use_att': 1}. Best is trial 25 with value: 0.8219.[0m
[32m[I 2022-06-26 21:31:48,250][0m Trial 63 finished with value: 0.8161999999999999 and parameters: {'lr': 0.0035706301374477745, 'weight_decay': 0.0006288862850536658, 'dropout': 0.5484129194795256, 'patience': 90, 'lr_reduce_freq': 80, 'spt_alg': 'kruskal', 'spt_attr': 'edge_degree', 'manifold': 'PoincareBall', 'num_layers': 3, 'dim': 268, 'num_adj': 6, 'add_rate': 0.35204447145364787, 'tem': 0.817028560773498, 'consis_rate': 1.9848020330865692, 'use_att': 1}. Best is trial 25 with value: 0.8219.[0m
[32m[I 2022-06-26 21:49:25,907][0m Trial 64 finished with value: 0.8192999999999999 and parameters: {'lr': 0.004504711734828637, 'weight_decay': 0.0004902040271131098, 'dropout': 0.6328218784558278, 'patience': 100, 'lr_reduce_freq': 80, 'spt_alg': 'kruskal', 'spt_attr': 'edge_degree', 'manifold': 'PoincareBall', 'num_layers': 3, 'dim': 216, 'num_adj': 6, 'add_rate': 0.30001369383399623, 'tem': 0.8725045599191691, 'consis_rate': 1.9264305550546879, 'use_att': 1}. Best is trial 25 with value: 0.8219.[0m
[32m[I 2022-06-26 22:06:37,813][0m Trial 65 finished with value: 0.8140000000000001 and parameters: {'lr': 0.005373543964915981, 'weight_decay': 0.0004866954038191994, 'dropout': 0.6362519611624304, 'patience': 100, 'lr_reduce_freq': 80, 'spt_alg': 'kruskal', 'spt_attr': 'edge_degree', 'manifold': 'PoincareBall', 'num_layers': 3, 'dim': 224, 'num_adj': 6, 'add_rate': 0.3039193902201917, 'tem': 0.827070494480596, 'consis_rate': 1.8791744094853506, 'use_att': 1}. Best is trial 25 with value: 0.8219.[0m
[32m[I 2022-06-26 22:11:47,086][0m Trial 66 finished with value: 0.8086 and parameters: {'lr': 0.005794012041582736, 'weight_decay': 0.00043870492715905785, 'dropout': 0.6591319186372263, 'patience': 100, 'lr_reduce_freq': 80, 'spt_alg': 'kruskal', 'spt_attr': 'edge_degree', 'manifold': 'PoincareBall', 'num_layers': 3, 'dim': 216, 'num_adj': 6, 'add_rate': 0.3212417227647639, 'tem': 0.8660252268420414, 'consis_rate': 1.9171982501609723, 'use_att': 0}. Best is trial 25 with value: 0.8219.[0m
[32m[I 2022-06-26 22:29:53,305][0m Trial 67 finished with value: 0.8164 and parameters: {'lr': 0.006371900589681151, 'weight_decay': 0.0005239337624277751, 'dropout': 0.727071416409221, 'patience': 100, 'lr_reduce_freq': 80, 'spt_alg': 'kruskal', 'spt_attr': 'edge_degree', 'manifold': 'PoincareBall', 'num_layers': 3, 'dim': 232, 'num_adj': 6, 'add_rate': 0.3357935763776414, 'tem': 0.8473551357582947, 'consis_rate': 1.9322641797234628, 'use_att': 1}. Best is trial 25 with value: 0.8219.[0m
[32m[I 2022-06-26 22:54:14,410][0m Trial 68 finished with value: 0.8157 and parameters: {'lr': 0.004498359500357777, 'weight_decay': 0.0007517970394688636, 'dropout': 0.6899391435392251, 'patience': 110, 'lr_reduce_freq': 110, 'spt_alg': 'kruskal', 'spt_attr': 'edge_degree', 'manifold': 'PoincareBall', 'num_layers': 3, 'dim': 212, 'num_adj': 6, 'add_rate': 0.5387158793518484, 'tem': 0.9037488486688374, 'consis_rate': 1.8401142123664962, 'use_att': 1}. Best is trial 25 with value: 0.8219.[0m
[32m[I 2022-06-26 23:12:00,955][0m Trial 69 finished with value: 0.8202 and parameters: {'lr': 0.005072969319991233, 'weight_decay': 0.0007848656789685412, 'dropout': 0.7099916694274472, 'patience': 80, 'lr_reduce_freq': 80, 'spt_alg': 'kruskal', 'spt_attr': 'edge_degree', 'manifold': 'PoincareBall', 'num_layers': 3, 'dim': 316, 'num_adj': 6, 'add_rate': 0.4894087024970862, 'tem': 0.8110950488622811, 'consis_rate': 1.6912459739925825, 'use_att': 1}. Best is trial 25 with value: 0.8219.[0m
