[32m[I 2022-06-24 02:43:43,670][0m Trial 131 finished with value: 0.8092 and parameters: {'lr': 0.0029710808279317033, 'weight_decay': 0.0011091950127209945, 'dropout': 0.7283085046206249, 'patience': 80, 'lr_reduce_freq': 90, 'spt_alg': 'prim', 'spt_attr': 'similarity', 'manifold': 'PoincareBall', 'num_layers': 3, 'num_adj': 6, 'add_rate': 0.49040717138972467, 'tem': 0.614055460435784, 'consis_rate': 0.21972516895999317, 'use_att': 1}. Best is trial 107 with value: 0.8168.[0m

mean: 0.8049000000000002
[0.792 0.796 0.796 0.803 0.815 0.812 0.804 0.807 0.813 0.811]
cur_param: {'lr': 0.002580528732295819, 'weight_decay': 0.0018254686949130856, 'dropout': 0.6629846594303793, 'patience': 80, 'lr_reduce_freq': 90, 'spt_alg': 'prim', 'spt_attr': 'edge_degree', 'manifold': 'PoincareBall', 'num_layers': 3, 'num_adj': 6, 'add_rate': 0.45783673569577926, 'tem': 0.7023107413236294, 'consis_rate': 0.6986547713306307, 'use_att': 1}
mean: 0.8121
[0.811 0.821 0.816 0.805 0.815 0.806 0.813 0.809 0.8   0.825]
cur_param: {'lr': 0.003227520465125654, 'weight_decay': 0.0021501908968915343, 'dropout': 0.6718232342029747, 'patience': 80, 'lr_reduce_freq': 90, 'spt_alg': 'prim', 'spt_attr': 'edge_degree', 'manifold': 'PoincareBall', 'num_layers': 3, 'num_adj': 6, 'add_rate': 0.45479596455465, 'tem': 0.9168093885883047, 'consis_rate': 0.6256693081190223, 'use_att': 1}
mean: 0.8051
[0.814 0.8   0.793 0.811 0.815 0.813 0.793 0.808 0.799 0.805]
cur_param: {'lr': 0.0027179807922442386, 'weight_decay': 0.0007503618796107076, 'dropout': 0.6566955498535678, 'patience': 80, 'lr_reduce_freq': 90, 'spt_alg': 'prim', 'spt_attr': 'edge_degree', 'manifold': 'PoincareBall', 'num_layers': 3, 'num_adj': 6, 'add_rate': 0.4778419576449018, 'tem': 0.6939830303016341, 'consis_rate': 0.42237508111617716, 'use_att': 1}
mean: 0.8122
[0.806 0.803 0.825 0.817 0.817 0.803 0.803 0.813 0.819 0.816]
cur_param: {'lr': 0.0039003614779111817, 'weight_decay': 0.0007398944557880159, 'dropout': 0.6547166902892507, 'patience': 80, 'lr_reduce_freq': 90, 'spt_alg': 'prim', 'spt_attr': 'edge_degree', 'manifold': 'PoincareBall', 'num_layers': 3, 'num_adj': 6, 'add_rate': 0.4787948945558728, 'tem': 0.6605748326247989, 'consis_rate': 0.7003919424254909, 'use_att': 1}
mean: 0.8088999999999998
[0.796 0.803 0.81  0.815 0.816 0.794 0.803 0.819 0.806 0.827]
cur_param: {'lr': 0.0025890375608946625, 'weight_decay': 0.0010330237653660603, 'dropout': 0.7425428043821313, 'patience': 80, 'lr_reduce_freq': 90, 'spt_alg': 'prim', 'spt_attr': 'similarity', 'manifold': 'PoincareBall', 'num_layers': 3, 'num_adj': 6, 'add_rate': 0.46284303473290594, 'tem': 0.6910798727796092, 'consis_rate': 0.34031477102794366, 'use_att': 1}
mean: 0.8115
[0.807 0.808 0.804 0.821 0.819 0.809 0.81  0.806 0.819 0.812]
cur_param: {'lr': 0.0028899525012088963, 'weight_decay': 0.0010652737980180907, 'dropout': 0.7385044882523553, 'patience': 80, 'lr_reduce_freq': 90, 'spt_alg': 'prim', 'spt_attr': 'similarity', 'manifold': 'PoincareBall', 'num_layers': 3, 'num_adj': 6, 'add_rate': 0.4581575915368086, 'tem': 0.6970162657554028, 'consis_rate': 0.5133189825614417, 'use_att': 1}
mean: 0.8116999999999999
[0.811 0.815 0.799 0.815 0.82  0.803 0.798 0.818 0.824 0.814]
cur_param: {'lr': 0.0025911001609345585, 'weight_decay': 0.0010038069832983725, 'dropout': 0.7423331189500677, 'patience': 80, 'lr_reduce_freq': 90, 'spt_alg': 'prim', 'spt_attr': 'similarity', 'manifold': 'PoincareBall', 'num_layers': 3, 'num_adj': 6, 'add_rate': 0.5495153343680443, 'tem': 0.6842185570876944, 'consis_rate': 0.37212017722762797, 'use_att': 1}
mean: 0.8119
[0.808 0.801 0.803 0.822 0.823 0.812 0.813 0.811 0.82  0.806]
cur_param: {'lr': 0.0029332585542201656, 'weight_decay': 0.0009833278440709457, 'dropout': 0.7329092009611781, 'patience': 80, 'lr_reduce_freq': 90, 'spt_alg': 'prim', 'spt_attr': 'similarity', 'manifold': 'PoincareBall', 'num_layers': 3, 'num_adj': 6, 'add_rate': 0.5470070053827267, 'tem': 0.6982051791050459, 'consis_rate': 0.3088805319660674, 'use_att': 1}
mean: 0.8108000000000001
[0.812 0.812 0.805 0.82  0.818 0.802 0.791 0.815 0.822 0.811]
cur_param: {'lr': 0.0029312162674152735, 'weight_decay': 0.0009959204329804186, 'dropout': 0.7474394301062844, 'patience': 80, 'lr_reduce_freq': 90, 'spt_alg': 'prim', 'spt_attr': 'similarity', 'manifold': 'PoincareBall', 'num_layers': 3, 'num_adj': 6, 'add_rate': 0.548396581323449, 'tem': 0.6893903851165953, 'consis_rate': 0.32437168272394423, 'use_att': 1}
mean: 0.8129000000000002
[0.803 0.821 0.806 0.822 0.818 0.815 0.807 0.807 0.82  0.81 ]
cur_param: {'lr': 0.0032771584486916932, 'weight_decay': 0.0006867652638152086, 'dropout': 0.7487011583347669, 'patience': 80, 'lr_reduce_freq': 90, 'spt_alg': 'prim', 'spt_attr': 'similarity', 'manifold': 'PoincareBall', 'num_layers': 3, 'num_adj': 6, 'add_rate': 0.6116472823563567, 'tem': 0.7087948683230028, 'consis_rate': 0.47711610295422396, 'use_att': 1}
mean: 0.8090999999999999
[0.813 0.785 0.81  0.822 0.81  0.806 0.81  0.816 0.808 0.811]
cur_param: {'lr': 0.002517352162207484, 'weight_decay': 0.001114847723479951, 'dropout': 0.7017274504943726, 'patience': 80, 'lr_reduce_freq': 90, 'spt_alg': 'prim', 'spt_attr': 'similarity', 'manifold': 'PoincareBall', 'num_layers': 3, 'num_adj': 6, 'add_rate': 0.5669879966372904, 'tem': 0.735949536707263, 'consis_rate': 0.26512847074427376, 'use_att': 1}
mean: 0.8107999999999999
[0.807 0.799 0.798 0.827 0.818 0.804 0.809 0.814 0.823 0.809]
cur_param: {'lr': 0.0030949197471961906, 'weight_decay': 0.0006467100895236841, 'dropout': 0.7388092788090557, 'patience': 80, 'lr_reduce_freq': 90, 'spt_alg': 'prim', 'spt_attr': 'similarity', 'manifold': 'PoincareBall', 'num_layers': 3, 'num_adj': 6, 'add_rate': 0.4910150255499427, 'tem': 0.6666957516492463, 'consis_rate': 0.3643884826425053, 'use_att': 1}
mean: 0.8131
[0.815 0.809 0.816 0.818 0.814 0.806 0.807 0.818 0.824 0.804]
cur_param: {'lr': 0.0040419863878398445, 'weight_decay': 0.0008979922181664576, 'dropout': 0.7128369344990207, 'patience': 80, 'lr_reduce_freq': 90, 'spt_alg': 'prim', 'spt_attr': 'similarity', 'manifold': 'PoincareBall', 'num_layers': 3, 'num_adj': 6, 'add_rate': 0.45827302407072545, 'tem': 0.668025282499792, 'consis_rate': 0.40685633113231906, 'use_att': 1}
mean: 0.8093
[0.811 0.791 0.804 0.823 0.815 0.808 0.801 0.811 0.806 0.823]
cur_param: {'lr': 0.004633485247606349, 'weight_decay': 0.001007021320860622, 'dropout': 0.6664637976191047, 'patience': 80, 'lr_reduce_freq': 90, 'spt_alg': 'prim', 'spt_attr': 'similarity', 'manifold': 'PoincareBall', 'num_layers': 3, 'num_adj': 6, 'add_rate': 0.5808478933210734, 'tem': 0.6408116818392786, 'consis_rate': 0.34752363388568397, 'use_att': 1}
mean: 0.8076000000000001
[0.807 0.796 0.787 0.816 0.815 0.803 0.805 0.81  0.82  0.817]
cur_param: {'lr': 0.003356519225221185, 'weight_decay': 0.0006576191439615046, 'dropout': 0.7369342582133555, 'patience': 80, 'lr_reduce_freq': 90, 'spt_alg': 'prim', 'spt_attr': 'similarity', 'manifold': 'PoincareBall', 'num_layers': 3, 'num_adj': 6, 'add_rate': 0.5052107760933913, 'tem': 0.7751398855939313, 'consis_rate': 0.5462921056581675, 'use_att': 1}
mean: 0.8107999999999999
[0.806 0.799 0.813 0.824 0.819 0.799 0.807 0.821 0.811 0.809]
cur_param: {'lr': 0.00272527978583942, 'weight_decay': 0.000774010792655043, 'dropout': 0.7015697132916202, 'patience': 80, 'lr_reduce_freq': 90, 'spt_alg': 'prim', 'spt_attr': 'similarity', 'manifold': 'PoincareBall', 'num_layers': 3, 'num_adj': 6, 'add_rate': 0.5484838387572409, 'tem': 0.5891927307867991, 'consis_rate': 0.24078710859712094, 'use_att': 1}
mean: 0.8122999999999999
[0.809 0.81  0.809 0.824 0.822 0.793 0.808 0.806 0.825 0.817]
cur_param: {'lr': 0.09378986638907023, 'weight_decay': 0.0007658379575535482, 'dropout': 0.6886975045510662, 'patience': 80, 'lr_reduce_freq': 90, 'spt_alg': 'prim', 'spt_attr': 'similarity', 'manifold': 'PoincareBall', 'num_layers': 3, 'num_adj': 6, 'add_rate': 0.5430758728818789, 'tem': 0.5079494656706806, 'consis_rate': 0.26364080107221155, 'use_att': 1}
mean: 0.5352
[0.39  0.629 0.703 0.499 0.462 0.457 0.628 0.49  0.506 0.588]
cur_param: {'lr': 0.0029710808279317033, 'weight_decay': 0.0011091950127209945, 'dropout': 0.7283085046206249, 'patience': 80, 'lr_reduce_freq': 90, 'spt_alg': 'prim', 'spt_attr': 'similarity', 'manifold': 'PoincareBall', 'num_layers': 3, 'num_adj': 6, 'add_rate': 0.49040717138972467, 'tem': 0.614055460435784, 'consis_rate': 0.21972516895999317, 'use_att': 1}
mean: 0.8092
[0.809 0.82  0.802 0.819 0.817 0.794 0.791 0.811 0.826 0.803]
cur_param: {'lr': 0.0025942663535665055, 'weight_decay': 0.0008190265355432325, 'dropout': 0.6131344653589941, 'patience': 80, 'lr_reduce_freq': 90, 'spt_alg': 'prim', 'spt_attr': 'similarity', 'manifold': 'PoincareBall', 'num_layers': 3, 'num_adj': 6, 'add_rate': 0.5545221852617149, 'tem': 0.6819085338812663, 'consis_rate': 0.4418153943175158, 'use_att': 1}[32m[I 2022-06-24 03:16:06,833][0m Trial 132 finished with value: 0.8076000000000001 and parameters: {'lr': 0.0025942663535665055, 'weight_decay': 0.0008190265355432325, 'dropout': 0.6131344653589941, 'patience': 80, 'lr_reduce_freq': 90, 'spt_alg': 'prim', 'spt_attr': 'similarity', 'manifold': 'PoincareBall', 'num_layers': 3, 'num_adj': 6, 'add_rate': 0.5545221852617149, 'tem': 0.6819085338812663, 'consis_rate': 0.4418153943175158, 'use_att': 1}. Best is trial 107 with value: 0.8168.[0m
[32m[I 2022-06-24 03:51:06,376][0m Trial 133 finished with value: 0.8112999999999999 and parameters: {'lr': 0.0022584690758217364, 'weight_decay': 0.0009151358998787842, 'dropout': 0.6537494894206654, 'patience': 80, 'lr_reduce_freq': 90, 'spt_alg': 'prim', 'spt_attr': 'similarity', 'manifold': 'PoincareBall', 'num_layers': 3, 'num_adj': 6, 'add_rate': 0.46206633582638545, 'tem': 0.5778229200066411, 'consis_rate': 0.38613704681192, 'use_att': 1}. Best is trial 107 with value: 0.8168.[0m
[32m[I 2022-06-24 04:23:42,733][0m Trial 134 finished with value: 0.8119999999999999 and parameters: {'lr': 0.002831532666516546, 'weight_decay': 0.0006287476147276247, 'dropout': 0.7028145432387763, 'patience': 80, 'lr_reduce_freq': 90, 'spt_alg': 'prim', 'spt_attr': 'similarity', 'manifold': 'PoincareBall', 'num_layers': 3, 'num_adj': 6, 'add_rate': 0.5147434431852705, 'tem': 0.7499176306687666, 'consis_rate': 0.31521011872788884, 'use_att': 1}. Best is trial 107 with value: 0.8168.[0m
[32m[I 2022-06-24 04:56:31,747][0m Trial 135 finished with value: 0.8125 and parameters: {'lr': 0.0029917568501488783, 'weight_decay': 0.0006319426656524252, 'dropout': 0.7015880964292787, 'patience': 80, 'lr_reduce_freq': 90, 'spt_alg': 'prim', 'spt_attr': 'similarity', 'manifold': 'PoincareBall', 'num_layers': 3, 'num_adj': 6, 'add_rate': 0.6188315092003606, 'tem': 0.7673459957672282, 'consis_rate': 0.46359332925439756, 'use_att': 1}. Best is trial 107 with value: 0.8168.[0m
[32m[I 2022-06-24 06:05:52,418][0m Trial 136 finished with value: 0.7636 and parameters: {'lr': 0.0034301857570260604, 'weight_decay': 0.0006260181674079204, 'dropout': 0.702813344005518, 'patience': 80, 'lr_reduce_freq': 90, 'spt_alg': 'prim', 'spt_attr': 'similarity', 'manifold': 'PoincareBall', 'num_layers': 4, 'num_adj': 6, 'add_rate': 0.6646272520439293, 'tem': 0.7682540094235298, 'consis_rate': 0.29455600918689195, 'use_att': 1}. Best is trial 107 with value: 0.8168.[0m
[32m[I 2022-06-24 06:37:45,085][0m Trial 137 finished with value: 0.8044 and parameters: {'lr': 0.0031099882516387395, 'weight_decay': 0.0006276599732798447, 'dropout': 0.6684742455273277, 'patience': 80, 'lr_reduce_freq': 90, 'spt_alg': 'prim', 'spt_attr': 'similarity', 'manifold': 'PoincareBall', 'num_layers': 3, 'num_adj': 6, 'add_rate': 0.6178717100637827, 'tem': 0.8411445852993391, 'consis_rate': 0.20773897439081682, 'use_att': 1}. Best is trial 107 with value: 0.8168.[0m
[32m[I 2022-06-24 07:25:00,095][0m Trial 138 finished with value: 0.8063 and parameters: {'lr': 0.002273622607594082, 'weight_decay': 0.000705131429482633, 'dropout': 0.7813987729190695, 'patience': 80, 'lr_reduce_freq': 90, 'spt_alg': 'prim', 'spt_attr': 'similarity', 'manifold': 'PoincareBall', 'num_layers': 3, 'num_adj': 6, 'add_rate': 0.5886811229828144, 'tem': 0.7354692014635039, 'consis_rate': 0.4326341420744446, 'use_att': 1}. Best is trial 107 with value: 0.8168.[0m
[32m[I 2022-06-24 08:00:56,779][0m Trial 139 finished with value: 0.8102 and parameters: {'lr': 0.002790389318318248, 'weight_decay': 0.0007433583743039487, 'dropout': 0.6904187093583518, 'patience': 80, 'lr_reduce_freq': 70, 'spt_alg': 'prim', 'spt_attr': 'similarity', 'manifold': 'PoincareBall', 'num_layers': 3, 'num_adj': 6, 'add_rate': 0.6553708113455705, 'tem': 0.8899072922815717, 'consis_rate': 0.35631190582649697, 'use_att': 1}. Best is trial 107 with value: 0.8168.[0m
[32m[I 2022-06-24 08:37:41,051][0m Trial 140 finished with value: 0.8097999999999999 and parameters: {'lr': 0.002070414523422337, 'weight_decay': 0.0005838051162212045, 'dropout': 0.6301714433752421, 'patience': 80, 'lr_reduce_freq': 90, 'spt_alg': 'prim', 'spt_attr': 'similarity', 'manifold': 'PoincareBall', 'num_layers': 3, 'num_adj': 6, 'add_rate': 0.5273102101303146, 'tem': 1.1996859144264727, 'consis_rate': 0.47505252585810376, 'use_att': 1}. Best is trial 107 with value: 0.8168.[0m
[32m[I 2022-06-24 09:11:31,446][0m Trial 141 finished with value: 0.8089999999999999 and parameters: {'lr': 0.0029532456598275283, 'weight_decay': 0.0008575259652560464, 'dropout': 0.7181931571191086, 'patience': 80, 'lr_reduce_freq': 90, 'spt_alg': 'prim', 'spt_attr': 'similarity', 'manifold': 'PoincareBall', 'num_layers': 3, 'num_adj': 6, 'add_rate': 0.5106958286140547, 'tem': 0.6179424797080483, 'consis_rate': 0.49915711289277714, 'use_att': 1}. Best is trial 107 with value: 0.8168.[0m
[32m[I 2022-06-24 09:32:23,059][0m Trial 142 finished with value: 0.29500000000000004 and parameters: {'lr': 0.0037458768266802724, 'weight_decay': 0.01245662150352655, 'dropout': 0.7586815153700862, 'patience': 80, 'lr_reduce_freq': 90, 'spt_alg': 'prim', 'spt_attr': 'similarity', 'manifold': 'PoincareBall', 'num_layers': 3, 'num_adj': 6, 'add_rate': 0.5375883669552375, 'tem': 0.7991679235976155, 'consis_rate': 0.31465048825620134, 'use_att': 1}. Best is trial 107 with value: 0.8168.[0m
[32m[I 2022-06-24 09:59:43,377][0m Trial 143 finished with value: 0.26609999999999995 and parameters: {'lr': 0.0032803716228886936, 'weight_decay': 0.0956167265457451, 'dropout': 0.8241186574325876, 'patience': 80, 'lr_reduce_freq': 90, 'spt_alg': 'prim', 'spt_attr': 'similarity', 'manifold': 'PoincareBall', 'num_layers': 3, 'num_adj': 6, 'add_rate': 0.7304400787535255, 'tem': 0.6397712121386767, 'consis_rate': 0.558297783326433, 'use_att': 1}. Best is trial 107 with value: 0.8168.[0m
[32m[I 2022-06-24 10:28:47,138][0m Trial 144 finished with value: 0.8061 and parameters: {'lr': 0.0054522093620073455, 'weight_decay': 0.0012479117830805275, 'dropout': 0.7015009083880354, 'patience': 80, 'lr_reduce_freq': 90, 'spt_alg': 'prim', 'spt_attr': 'similarity', 'manifold': 'PoincareBall', 'num_layers': 3, 'num_adj': 6, 'add_rate': 0.5676370662091168, 'tem': 0.7553697530044637, 'consis_rate': 0.40506209107997315, 'use_att': 1}. Best is trial 107 with value: 0.8168.[0m
[32m[I 2022-06-24 10:54:37,185][0m Trial 145 finished with value: 0.2506 and parameters: {'lr': 0.0024981514374339485, 'weight_decay': 0.20710959058591558, 'dropout': 0.5708724259113973, 'patience': 80, 'lr_reduce_freq': 90, 'spt_alg': 'prim', 'spt_attr': 'similarity', 'manifold': 'PoincareBall', 'num_layers': 3, 'num_adj': 6, 'add_rate': 0.49451667529150756, 'tem': 0.7056035089775442, 'consis_rate': 0.27222743659496623, 'use_att': 1}. Best is trial 107 with value: 0.8168.[0m
[32m[I 2022-06-24 11:22:28,286][0m Trial 146 finished with value: 0.26849999999999996 and parameters: {'lr': 0.00288192452852506, 'weight_decay': 0.06060810408527387, 'dropout': 0.6721310275554749, 'patience': 80, 'lr_reduce_freq': 90, 'spt_alg': 'prim', 'spt_attr': 'similarity', 'manifold': 'PoincareBall', 'num_layers': 3, 'num_adj': 6, 'add_rate': 0.6297062760726798, 'tem': 0.6670147550218741, 'consis_rate': 0.5159144305728698, 'use_att': 1}. Best is trial 107 with value: 0.8168.[0m
[32m[I 2022-06-24 12:04:29,477][0m Trial 147 finished with value: 0.8095000000000001 and parameters: {'lr': 0.0023935475166281944, 'weight_decay': 0.0009670858735940247, 'dropout': 0.7292449877902137, 'patience': 80, 'lr_reduce_freq': 90, 'spt_alg': 'prim', 'spt_attr': 'similarity', 'manifold': 'PoincareBall', 'num_layers': 3, 'num_adj': 6, 'add_rate': 0.6912331696286544, 'tem': 0.7235603345147982, 'consis_rate': 0.6029291950493441, 'use_att': 1}. Best is trial 107 with value: 0.8168.[0m
[32m[I 2022-06-24 12:26:59,469][0m Trial 148 finished with value: 0.3021 and parameters: {'lr': 0.0043619940419480936, 'weight_decay': 0.49277108718269313, 'dropout': 0.790301380543203, 'patience': 80, 'lr_reduce_freq': 90, 'spt_alg': 'prim', 'spt_attr': 'similarity', 'manifold': 'PoincareBall', 'num_layers': 3, 'num_adj': 6, 'add_rate': 0.4335533764066747, 'tem': 0.7908255460770994, 'consis_rate': 0.38557898598453977, 'use_att': 1}. Best is trial 107 with value: 0.8168.[0m
