[32m[I 2022-06-16 18:09:56,324][0m Trial 103 finished with value: 0.6728000000000001 and parameters: {'dropout': 0.5929590793551925, 'weight_decay': 0.0006718296722817344, 'lr': 0.007551292449095269, 'patience': 130, 'spt-alg': 'kruskal', 'manifold': 'PoincareBall', 'dim': 256, 'num-adj': 8, 'add-rate': 0.1, 'tem': 1.1, 'consis-rate': 1.7000000000000002, 'use-att': 1, 'num-layers': 3}. Best is trial 101 with value: 0.682.[0m

mean: 0.6796
[0.682 0.67  0.697 0.682 0.681 0.675 0.691 0.684 0.667 0.667]
cur_param: {'dropout': 0.5908092065030646, 'weight-decay': 0.0016883569115765103, 'lr': 0.0016605092938453618, 'lr-reduce-freq': 110, 'patience': 110, 'spt-alg': 'kruskal', 'manifold': 'PoincareBall', 'dim': 256, 'num-adj': 8, 'add-rate': 0.1, 'tem': 1.2000000000000002, 'consis-rate': 1.7000000000000002, 'use-att': 1, 'num-layers': 3}
mean: 0.6797
[0.692 0.667 0.675 0.673 0.685 0.679 0.694 0.684 0.677 0.671]
cur_param: {'dropout': 0.5378528394739427, 'weight-decay': 0.002397972061688719, 'lr': 0.0011550529266109008, 'lr-reduce-freq': 120, 'patience': 120, 'spt-alg': 'kruskal', 'manifold': 'PoincareBall', 'dim': 256, 'num-adj': 8, 'add-rate': 0.1, 'tem': 1.2000000000000002, 'consis-rate': 1.9000000000000001, 'use-att': 1, 'num-layers': 3}
mean: 0.6764
[0.692 0.66  0.677 0.671 0.673 0.69  0.684 0.679 0.675 0.663]
cur_param: {'dropout': 0.5604160138085224, 'weight-decay': 0.002285668453060203, 'lr': 0.0014674348105875, 'lr-reduce-freq': 120, 'patience': 120, 'spt-alg': 'kruskal', 'manifold': 'PoincareBall', 'dim': 256, 'num-adj': 8, 'add-rate': 0.1, 'tem': 1.3, 'consis-rate': 1.8, 'use-att': 1, 'num-layers': 3}
mean: 0.6805
[0.686 0.677 0.678 0.683 0.684 0.68  0.69  0.687 0.673 0.667]
cur_param: {'dropout': 0.5727324532984616, 'weight-decay': 0.0009012795763041711, 'lr': 0.0014635223115450641, 'lr-reduce-freq': 130, 'patience': 130, 'spt-alg': 'kruskal', 'manifold': 'PoincareBall', 'dim': 192, 'num-adj': 8, 'add-rate': 0.1, 'tem': 1.4, 'consis-rate': 1.8, 'use-att': 0, 'num-layers': 3}
mean: 0.6791
[0.681 0.679 0.677 0.669 0.686 0.682 0.687 0.676 0.676 0.678]
cur_param: {'dropout': 0.5931820554176777, 'weight-decay': 0.0019578682876470192, 'lr': 0.0019564095711187284, 'lr-reduce-freq': 130, 'patience': 130, 'spt-alg': 'prim', 'manifold': 'PoincareBall', 'dim': 256, 'num-adj': 8, 'add-rate': 0.1, 'tem': 1.3, 'consis-rate': 1.6, 'use-att': 1, 'num-layers': 3}
mean: 0.6797000000000001
[0.681 0.668 0.695 0.682 0.684 0.674 0.694 0.686 0.663 0.67 ]
cur_param: {'dropout': 0.5576122810645019, 'weight-decay': 0.001335203343179334, 'lr': 0.0022952837350482453, 'lr-reduce-freq': 110, 'patience': 110, 'spt-alg': 'kruskal', 'manifold': 'Hyperboloid', 'dim': 256, 'num-adj': 8, 'add-rate': 0.1, 'tem': 0.8, 'consis-rate': 1.8, 'use-att': 1, 'num-layers': 3}
mean: 0.6809999999999999
[0.685 0.666 0.691 0.69  0.681 0.678 0.693 0.675 0.675 0.676]
cur_param: {'dropout': 0.536125241052899, 'weight-decay': 0.0012346626210599787, 'lr': 0.0024144348490066914, 'lr-reduce-freq': 110, 'patience': 110, 'spt-alg': 'kruskal', 'manifold': 'Hyperboloid', 'dim': 256, 'num-adj': 8, 'add-rate': 0.1, 'tem': 0.8, 'consis-rate': 1.8, 'use-att': 1, 'num-layers': 3}
mean: 0.6781
[0.681 0.671 0.68  0.691 0.687 0.676 0.687 0.669 0.669 0.67 ]
cur_param: {'dropout': 0.5576888000281623, 'weight-decay': 0.001484691981792395, 'lr': 0.0017916852051883675, 'lr-reduce-freq': 110, 'patience': 110, 'spt-alg': 'kruskal', 'manifold': 'Hyperboloid', 'dim': 256, 'num-adj': 8, 'add-rate': 0.1, 'tem': 0.8, 'consis-rate': 1.8, 'use-att': 1, 'num-layers': 3}
mean: 0.6789
[0.688 0.67  0.681 0.685 0.674 0.686 0.684 0.668 0.675 0.678]
cur_param: {'dropout': 0.568487617615547, 'weight-decay': 0.003490580185493236, 'lr': 0.000856498407348164, 'lr-reduce-freq': 120, 'patience': 120, 'spt-alg': 'kruskal', 'manifold': 'Hyperboloid', 'dim': 256, 'num-adj': 8, 'add-rate': 0.1, 'tem': 1.3, 'consis-rate': 1.9000000000000001, 'use-att': 1, 'num-layers': 3}
mean: 0.6742000000000001
[0.674 0.681 0.678 0.671 0.661 0.676 0.677 0.671 0.669 0.684]
cur_param: {'dropout': 0.2310944240576189, 'weight-decay': 0.002950086430320821, 'lr': 0.0013033978247517439, 'lr-reduce-freq': 100, 'patience': 100, 'spt-alg': 'kruskal', 'manifold': 'Hyperboloid', 'dim': 256, 'num-adj': 8, 'add-rate': 0.1, 'tem': 0.8, 'consis-rate': 1.9000000000000001, 'use-att': 1, 'num-layers': 3}
mean: 0.6685
[0.669 0.668 0.667 0.672 0.662 0.68  0.67  0.665 0.66  0.672]
cur_param: {'dropout': 0.5877234510511177, 'weight-decay': 0.0013329521775384654, 'lr': 0.002125682149872976, 'lr-reduce-freq': 120, 'patience': 120, 'spt-alg': 'kruskal', 'manifold': 'Hyperboloid', 'dim': 256, 'num-adj': 8, 'add-rate': 0.1, 'tem': 1.1, 'consis-rate': 2.0, 'use-att': 1, 'num-layers': 3}
mean: 0.6799
[0.68  0.672 0.688 0.692 0.675 0.675 0.688 0.669 0.683 0.677]
cur_param: {'dropout': 0.575285419788343, 'weight-decay': 0.0040494589686956226, 'lr': 0.0013670930740527043, 'lr-reduce-freq': 110, 'patience': 110, 'spt-alg': 'kruskal', 'manifold': 'PoincareBall', 'dim': 256, 'num-adj': 8, 'add-rate': 0.1, 'tem': 0.8, 'consis-rate': 1.7000000000000002, 'use-att': 1, 'num-layers': 3}
mean: 0.6769000000000001
[0.675 0.671 0.673 0.68  0.671 0.684 0.687 0.678 0.678 0.672]
cur_param: {'dropout': 0.5444855918309098, 'weight-decay': 0.0009532932394945267, 'lr': 0.0016178929773230089, 'lr-reduce-freq': 130, 'patience': 130, 'spt-alg': 'kruskal', 'manifold': 'PoincareBall', 'dim': 256, 'num-adj': 8, 'add-rate': 0.1, 'tem': 1.3, 'consis-rate': 1.6, 'use-att': 1, 'num-layers': 5}
mean: 0.6797000000000001
[0.689 0.674 0.671 0.689 0.678 0.678 0.686 0.685 0.681 0.666]
cur_param: {'dropout': 0.5623024398784561, 'weight-decay': 0.002081722600499103, 'lr': 0.001137810866983017, 'lr-reduce-freq': 130, 'patience': 130, 'spt-alg': 'kruskal', 'manifold': 'Hyperboloid', 'dim': 256, 'num-adj': 8, 'add-rate': 0.1, 'tem': 0.9, 'consis-rate': 1.1, 'use-att': 1, 'num-layers': 3}
mean: 0.6758000000000001
[0.682 0.667 0.681 0.691 0.672 0.668 0.679 0.671 0.67  0.677]
cur_param: {'dropout': 0.5564563550397368, 'weight-decay': 0.0024218714729960567, 'lr': 0.0009185457608122631, 'lr-reduce-freq': 120, 'patience': 120, 'spt-alg': 'kruskal', 'manifold': 'PoincareBall', 'dim': 192, 'num-adj': 8, 'add-rate': 0.1, 'tem': 1.2000000000000002, 'consis-rate': 1.8, 'use-att': 1, 'num-layers': 3}
mean: 0.6733
[0.673 0.67  0.674 0.665 0.679 0.662 0.675 0.673 0.675 0.687]
cur_param: {'dropout': 0.4412496766671872, 'weight-decay': 0.0010867907210753102, 'lr': 0.0022508903459237633, 'lr-reduce-freq': 120, 'patience': 120, 'spt-alg': 'kruskal', 'manifold': 'PoincareBall', 'dim': 256, 'num-adj': 8, 'add-rate': 0.1, 'tem': 1.2000000000000002, 'consis-rate': 1.7000000000000002, 'use-att': 1, 'num-layers': 3}
mean: 0.6758000000000001
[0.679 0.673 0.682 0.68  0.666 0.684 0.681 0.677 0.675 0.661]
cur_param: {'dropout': 0.5185290811803374, 'weight-decay': 0.00341854204676351, 'lr': 0.001533615212241958, 'lr-reduce-freq': 60, 'patience': 60, 'spt-alg': 'prim', 'manifold': 'PoincareBall', 'dim': 256, 'num-adj': 8, 'add-rate': 0.2, 'tem': 1.1, 'consis-rate': 1.0, 'use-att': 0, 'num-layers': 3}
mean: 0.6794
[0.69  0.673 0.689 0.68  0.677 0.673 0.691 0.686 0.672 0.663]
cur_param: {'dropout': 0.5794501915896177, 'weight-decay': 0.0018590209171681327, 'lr': 0.0017437191083878698, 'lr-reduce-freq': 130, 'patience': 130, 'spt-alg': 'kruskal', 'manifold': 'PoincareBall', 'dim': 256, 'num-adj': 8, 'add-rate': 0.1, 'tem': 1.3, 'consis-rate': 1.8, 'use-att': 1, 'num-layers': 3}
mean: 0.682
[0.689 0.671 0.698 0.672 0.682 0.68  0.696 0.686 0.675 0.671]
cur_param: {'dropout': 0.5774477604681407, 'weight-decay': 0.001372319875620772, 'lr': 0.0017164429410725264, 'lr-reduce-freq': 130, 'patience': 130, 'spt-alg': 'kruskal', 'manifold': 'PoincareBall', 'dim': 256, 'num-adj': 8, 'add-rate': 0.1, 'tem': 1.2000000000000002, 'consis-rate': 1.8, 'use-att': 1, 'num-layers': 3}
mean: 0.6787000000000001
[0.68  0.674 0.684 0.668 0.682 0.676 0.694 0.683 0.677 0.669]
cur_param: {'dropout': 0.5929590793551925, 'weight-decay': 0.0006718296722817344, 'lr': 0.007551292449095269, 'lr-reduce-freq': 130, 'patience': 130, 'spt-alg': 'kruskal', 'manifold': 'PoincareBall', 'dim': 256, 'num-adj': 8, 'add-rate': 0.1, 'tem': 1.1, 'consis-rate': 1.7000000000000002, 'use-att': 1, 'num-layers': 3}
mean: 0.6728000000000001
[0.673 0.672 0.688 0.678 0.671 0.67  0.661 0.673 0.659 0.683]
cur_param: {'dropout': 0.5676992185087738, 'weight-decay': 0.0018456209351068995, 'lr': 0.0019071597701122343, 'lr-reduce-freq': 130, 'patience': 130, 'spt-alg': 'kruskal', 'manifold': 'PoincareBall', 'dim': 256, 'num-adj': 8, 'add-rate': 0.1, 'tem': 1.4, 'consis-rate': 1.6, 'use-att': 1, 'num-layers': 4}[32m[I 2022-06-16 18:12:43,833][0m Trial 104 finished with value: 0.6795 and parameters: {'dropout': 0.5676992185087738, 'weight_decay': 0.0018456209351068995, 'lr': 0.0019071597701122343, 'patience': 130, 'spt-alg': 'kruskal', 'manifold': 'PoincareBall', 'dim': 256, 'num-adj': 8, 'add-rate': 0.1, 'tem': 1.4, 'consis-rate': 1.6, 'use-att': 1, 'num-layers': 4}. Best is trial 101 with value: 0.682.[0m
[32m[I 2022-06-16 18:15:29,761][0m Trial 105 finished with value: 0.6776 and parameters: {'dropout': 0.5815405700015285, 'weight_decay': 0.0025605897086627767, 'lr': 0.0014107959399156601, 'patience': 120, 'spt-alg': 'kruskal', 'manifold': 'PoincareBall', 'dim': 256, 'num-adj': 8, 'add-rate': 0.2, 'tem': 1.3, 'consis-rate': 2.0, 'use-att': 1, 'num-layers': 3}. Best is trial 101 with value: 0.682.[0m
[32m[I 2022-06-16 18:18:25,451][0m Trial 106 finished with value: 0.6806 and parameters: {'dropout': 0.5286603615782033, 'weight_decay': 0.0030269793478487077, 'lr': 0.0007675289479255003, 'patience': 100, 'spt-alg': 'kruskal', 'manifold': 'PoincareBall', 'dim': 256, 'num-adj': 8, 'add-rate': 0.1, 'tem': 0.9, 'consis-rate': 1.6, 'use-att': 1, 'num-layers': 4}. Best is trial 101 with value: 0.682.[0m
[32m[I 2022-06-16 18:21:27,077][0m Trial 107 finished with value: 0.6793000000000001 and parameters: {'dropout': 0.528344625353223, 'weight_decay': 0.0030241523222726396, 'lr': 0.0007595078781101027, 'patience': 100, 'spt-alg': 'kruskal', 'manifold': 'PoincareBall', 'dim': 256, 'num-adj': 6, 'add-rate': 0.1, 'tem': 0.9, 'consis-rate': 1.3, 'use-att': 1, 'num-layers': 4}. Best is trial 101 with value: 0.682.[0m
[32m[I 2022-06-16 18:24:27,053][0m Trial 108 finished with value: 0.6804 and parameters: {'dropout': 0.5518253565751273, 'weight_decay': 0.0039037961394831127, 'lr': 0.0008571031998931653, 'patience': 100, 'spt-alg': 'kruskal', 'manifold': 'PoincareBall', 'dim': 256, 'num-adj': 8, 'add-rate': 0.2, 'tem': 0.8, 'consis-rate': 0.9, 'use-att': 1, 'num-layers': 5}. Best is trial 101 with value: 0.682.[0m
[32m[I 2022-06-16 18:28:14,395][0m Trial 109 finished with value: 0.6713000000000001 and parameters: {'dropout': 0.5992157243906804, 'weight_decay': 0.001741461565811619, 'lr': 0.0008190306827501059, 'patience': 110, 'spt-alg': 'kruskal', 'manifold': 'PoincareBall', 'dim': 64, 'num-adj': 6, 'add-rate': 0.5, 'tem': 0.9, 'consis-rate': 1.1, 'use-att': 1, 'num-layers': 4}. Best is trial 101 with value: 0.682.[0m
[32m[I 2022-06-16 18:32:38,162][0m Trial 110 finished with value: 0.6748000000000001 and parameters: {'dropout': 0.5429408410507885, 'weight_decay': 0.0016427298011867507, 'lr': 0.0009955524593426458, 'patience': 90, 'spt-alg': 'kruskal', 'manifold': 'Hyperboloid', 'dim': 256, 'num-adj': 6, 'add-rate': 0.1, 'tem': 0.8, 'consis-rate': 1.0, 'use-att': 1, 'num-layers': 4}. Best is trial 101 with value: 0.682.[0m
[32m[I 2022-06-16 18:35:21,286][0m Trial 111 finished with value: 0.6799999999999999 and parameters: {'dropout': 0.5867247085559403, 'weight_decay': 0.002066954726690985, 'lr': 0.0018478989536136103, 'patience': 130, 'spt-alg': 'kruskal', 'manifold': 'PoincareBall', 'dim': 256, 'num-adj': 8, 'add-rate': 0.1, 'tem': 1.3, 'consis-rate': 1.6, 'use-att': 1, 'num-layers': 4}. Best is trial 101 with value: 0.682.[0m
[32m[I 2022-06-16 18:37:21,294][0m Trial 112 finished with value: 0.6759999999999999 and parameters: {'dropout': 0.41172578072006677, 'weight_decay': 0.002609745567783193, 'lr': 0.0020904745132166794, 'patience': 90, 'spt-alg': 'kruskal', 'manifold': 'PoincareBall', 'dim': 256, 'num-adj': 8, 'add-rate': 0.1, 'tem': 0.9, 'consis-rate': 1.1, 'use-att': 1, 'num-layers': 4}. Best is trial 101 with value: 0.682.[0m
[32m[I 2022-06-16 18:39:51,716][0m Trial 113 finished with value: 0.6786 and parameters: {'dropout': 0.5683462529612217, 'weight_decay': 0.0022397106181270966, 'lr': 0.0010906930568602418, 'patience': 100, 'spt-alg': 'kruskal', 'manifold': 'PoincareBall', 'dim': 256, 'num-adj': 8, 'add-rate': 0.1, 'tem': 1.2000000000000002, 'consis-rate': 1.7000000000000002, 'use-att': 1, 'num-layers': 3}. Best is trial 101 with value: 0.682.[0m
[32m[I 2022-06-16 18:42:52,062][0m Trial 114 finished with value: 0.6811 and parameters: {'dropout': 0.5771129100407901, 'weight_decay': 0.0029339849330375363, 'lr': 0.0007103066439260588, 'patience': 140, 'spt-alg': 'kruskal', 'manifold': 'PoincareBall', 'dim': 256, 'num-adj': 8, 'add-rate': 0.1, 'tem': 1.2000000000000002, 'consis-rate': 1.9000000000000001, 'use-att': 1, 'num-layers': 3}. Best is trial 101 with value: 0.682.[0m
[32m[I 2022-06-16 18:45:47,368][0m Trial 115 finished with value: 0.6829000000000001 and parameters: {'dropout': 0.5777789502632026, 'weight_decay': 0.003704308448339366, 'lr': 0.0007352172206044276, 'patience': 140, 'spt-alg': 'kruskal', 'manifold': 'PoincareBall', 'dim': 256, 'num-adj': 8, 'add-rate': 0.4, 'tem': 1.1, 'consis-rate': 1.9000000000000001, 'use-att': 1, 'num-layers': 3}. Best is trial 115 with value: 0.6829000000000001.[0m
[32m[I 2022-06-16 18:48:46,302][0m Trial 116 finished with value: 0.6816000000000001 and parameters: {'dropout': 0.5788777029141033, 'weight_decay': 0.003345530848169214, 'lr': 0.0007420544618193936, 'patience': 140, 'spt-alg': 'kruskal', 'manifold': 'PoincareBall', 'dim': 256, 'num-adj': 8, 'add-rate': 0.4, 'tem': 1.1, 'consis-rate': 1.9000000000000001, 'use-att': 1, 'num-layers': 3}. Best is trial 115 with value: 0.6829000000000001.[0m
[32m[I 2022-06-16 18:51:54,108][0m Trial 117 finished with value: 0.6805 and parameters: {'dropout': 0.5783148125223617, 'weight_decay': 0.004460505136661477, 'lr': 0.0007204201291326909, 'patience': 140, 'spt-alg': 'kruskal', 'manifold': 'PoincareBall', 'dim': 256, 'num-adj': 8, 'add-rate': 0.4, 'tem': 1.1, 'consis-rate': 1.9000000000000001, 'use-att': 1, 'num-layers': 3}. Best is trial 115 with value: 0.6829000000000001.[0m
[32m[I 2022-06-16 18:55:10,477][0m Trial 118 finished with value: 0.6774000000000001 and parameters: {'dropout': 0.5549622369133357, 'weight_decay': 0.004243413544793281, 'lr': 0.0006058098279756552, 'patience': 140, 'spt-alg': 'kruskal', 'manifold': 'PoincareBall', 'dim': 256, 'num-adj': 8, 'add-rate': 0.4, 'tem': 1.1, 'consis-rate': 2.0, 'use-att': 1, 'num-layers': 3}. Best is trial 115 with value: 0.6829000000000001.[0m
[32m[I 2022-06-16 18:58:12,284][0m Trial 119 finished with value: 0.6799999999999999 and parameters: {'dropout': 0.580831173828937, 'weight_decay': 0.0035675984225364233, 'lr': 0.00070378297574735, 'patience': 150, 'spt-alg': 'prim', 'manifold': 'PoincareBall', 'dim': 256, 'num-adj': 8, 'add-rate': 0.4, 'tem': 1.1, 'consis-rate': 1.9000000000000001, 'use-att': 0, 'num-layers': 3}. Best is trial 115 with value: 0.6829000000000001.[0m
[32m[I 2022-06-16 19:01:41,069][0m Trial 120 finished with value: 0.6764000000000001 and parameters: {'dropout': 0.5998651517091343, 'weight_decay': 0.0032678193245075306, 'lr': 0.0005582653958475164, 'patience': 140, 'spt-alg': 'kruskal', 'manifold': 'PoincareBall', 'dim': 256, 'num-adj': 2, 'add-rate': 0.6, 'tem': 1.0, 'consis-rate': 2.0, 'use-att': 1, 'num-layers': 3}. Best is trial 115 with value: 0.6829000000000001.[0m
[32m[I 2022-06-16 19:05:18,248][0m Trial 121 finished with value: 0.6778000000000001 and parameters: {'dropout': 0.5718714989479712, 'weight_decay': 0.002955603741039474, 'lr': 0.0006401504920338242, 'patience': 150, 'spt-alg': 'kruskal', 'manifold': 'PoincareBall', 'dim': 256, 'num-adj': 8, 'add-rate': 0.5, 'tem': 1.1, 'consis-rate': 1.9000000000000001, 'use-att': 1, 'num-layers': 3}. Best is trial 115 with value: 0.6829000000000001.[0m
[32m[I 2022-06-16 19:08:41,041][0m Trial 122 finished with value: 0.6766 and parameters: {'dropout': 0.5447990344854596, 'weight_decay': 0.0027870920317611745, 'lr': 0.0007818844448337528, 'patience': 140, 'spt-alg': 'kruskal', 'manifold': 'PoincareBall', 'dim': 256, 'num-adj': 8, 'add-rate': 0.4, 'tem': 1.0, 'consis-rate': 1.9000000000000001, 'use-att': 1, 'num-layers': 3}. Best is trial 115 with value: 0.6829000000000001.[0m
[32m[I 2022-06-16 19:11:17,581][0m Trial 123 finished with value: 0.675 and parameters: {'dropout': 0.5634763802748565, 'weight_decay': 0.0030977439275512134, 'lr': 0.004472358532339596, 'patience': 140, 'spt-alg': 'kruskal', 'manifold': 'PoincareBall', 'dim': 256, 'num-adj': 8, 'add-rate': 0.4, 'tem': 1.2000000000000002, 'consis-rate': 1.8, 'use-att': 1, 'num-layers': 3}. Best is trial 115 with value: 0.6829000000000001.[0m
