[32m[I 2022-06-16 20:26:29,097][0m Trial 145 finished with value: 0.6811000000000001 and parameters: {'dropout': 0.5983412495165845, 'weight_decay': 0.0039880912058408, 'lr': 0.0008265824623592603, 'patience': 130, 'spt-alg': 'kruskal', 'manifold': 'PoincareBall', 'dim': 256, 'num-adj': 6, 'add-rate': 0.4, 'tem': 0.7, 'consis-rate': 1.1, 'use-att': 1, 'num-layers': 4}. Best is trial 115 with value: 0.6829000000000001.[0m

mean: 0.6791
[0.679 0.672 0.686 0.678 0.676 0.674 0.683 0.682 0.679 0.682]
cur_param: {'dropout': 0.5830312095724914, 'weight-decay': 0.0048735625910889075, 'lr': 0.0007218114056165357, 'lr-reduce-freq': 130, 'patience': 130, 'spt-alg': 'kruskal', 'manifold': 'PoincareBall', 'dim': 256, 'num-adj': 6, 'add-rate': 0.30000000000000004, 'tem': 1.1, 'consis-rate': 1.2000000000000002, 'use-att': 1, 'num-layers': 3}
mean: 0.6815
[0.674 0.675 0.676 0.684 0.681 0.669 0.69  0.687 0.683 0.696]
cur_param: {'dropout': 0.5824877493860673, 'weight-decay': 0.005613816458714888, 'lr': 0.0037192324294944993, 'lr-reduce-freq': 130, 'patience': 130, 'spt-alg': 'kruskal', 'manifold': 'PoincareBall', 'dim': 256, 'num-adj': 6, 'add-rate': 0.30000000000000004, 'tem': 1.1, 'consis-rate': 1.2000000000000002, 'use-att': 1, 'num-layers': 3}
mean: 0.6754
[0.666 0.678 0.672 0.689 0.665 0.686 0.673 0.686 0.677 0.662]
cur_param: {'dropout': 0.5711702595465368, 'weight-decay': 0.004761557047285592, 'lr': 0.0006976315343248055, 'lr-reduce-freq': 140, 'patience': 140, 'spt-alg': 'kruskal', 'manifold': 'PoincareBall', 'dim': 256, 'num-adj': 6, 'add-rate': 0.30000000000000004, 'tem': 1.1, 'consis-rate': 1.2000000000000002, 'use-att': 1, 'num-layers': 3}
mean: 0.6792
[0.676 0.671 0.674 0.664 0.679 0.68  0.691 0.687 0.677 0.693]
cur_param: {'dropout': 0.5558814977748875, 'weight-decay': 0.004178439377255795, 'lr': 0.0008197494699407974, 'lr-reduce-freq': 140, 'patience': 140, 'spt-alg': 'kruskal', 'manifold': 'Hyperboloid', 'dim': 256, 'num-adj': 8, 'add-rate': 0.5, 'tem': 1.0, 'consis-rate': 2.0, 'use-att': 1, 'num-layers': 3}
mean: 0.6725000000000001
[0.667 0.672 0.675 0.673 0.666 0.678 0.681 0.67  0.668 0.675]
cur_param: {'dropout': 0.2873174854845062, 'weight-decay': 0.007019570576499496, 'lr': 0.0005332976816022138, 'lr-reduce-freq': 130, 'patience': 130, 'spt-alg': 'kruskal', 'manifold': 'PoincareBall', 'dim': 256, 'num-adj': 4, 'add-rate': 0.30000000000000004, 'tem': 1.2000000000000002, 'consis-rate': 1.3, 'use-att': 1, 'num-layers': 3}
mean: 0.6677000000000001
[0.661 0.657 0.678 0.673 0.659 0.674 0.673 0.664 0.673 0.665]
cur_param: {'dropout': 0.5882931036223487, 'weight-decay': 0.003650422836689077, 'lr': 0.0007499914228865789, 'lr-reduce-freq': 130, 'patience': 130, 'spt-alg': 'kruskal', 'manifold': 'PoincareBall', 'dim': 256, 'num-adj': 6, 'add-rate': 0.2, 'tem': 1.1, 'consis-rate': 1.1, 'use-att': 1, 'num-layers': 3}
mean: 0.6799
[0.663 0.672 0.69  0.684 0.68  0.675 0.679 0.688 0.675 0.693]
cur_param: {'dropout': 0.5764301277577696, 'weight-decay': 0.003384956590866602, 'lr': 0.0023648146447075315, 'lr-reduce-freq': 130, 'patience': 130, 'spt-alg': 'kruskal', 'manifold': 'PoincareBall', 'dim': 256, 'num-adj': 6, 'add-rate': 0.4, 'tem': 0.7, 'consis-rate': 1.2000000000000002, 'use-att': 1, 'num-layers': 3}
mean: 0.6780999999999999
[0.688 0.666 0.7   0.684 0.677 0.668 0.688 0.678 0.665 0.667]
cur_param: {'dropout': 0.5639462225088904, 'weight-decay': 0.001911214318321252, 'lr': 0.000667303537281879, 'lr-reduce-freq': 140, 'patience': 140, 'spt-alg': 'kruskal', 'manifold': 'PoincareBall', 'dim': 256, 'num-adj': 8, 'add-rate': 0.1, 'tem': 1.0, 'consis-rate': 1.7000000000000002, 'use-att': 1, 'num-layers': 3}
mean: 0.6794
[0.678 0.673 0.682 0.677 0.673 0.675 0.686 0.68  0.679 0.691]
cur_param: {'dropout': 0.5908407511683818, 'weight-decay': 0.005153703098745251, 'lr': 0.0009010250619394948, 'lr-reduce-freq': 130, 'patience': 130, 'spt-alg': 'kruskal', 'manifold': 'PoincareBall', 'dim': 256, 'num-adj': 6, 'add-rate': 0.2, 'tem': 0.8, 'consis-rate': 1.1, 'use-att': 1, 'num-layers': 3}
mean: 0.6791
[0.691 0.67  0.688 0.676 0.669 0.678 0.677 0.68  0.684 0.678]
cur_param: {'dropout': 0.37334332325733266, 'weight-decay': 0.0025965194102003644, 'lr': 0.0026991943019488806, 'lr-reduce-freq': 150, 'patience': 150, 'spt-alg': 'kruskal', 'manifold': 'PoincareBall', 'dim': 256, 'num-adj': 8, 'add-rate': 0.1, 'tem': 1.2000000000000002, 'consis-rate': 1.8, 'use-att': 1, 'num-layers': 5}
mean: 0.6744
[0.675 0.662 0.673 0.677 0.666 0.68  0.678 0.677 0.679 0.677]
cur_param: {'dropout': 0.5505054642276448, 'weight-decay': 0.0030269224106004027, 'lr': 0.0007445722099828874, 'lr-reduce-freq': 140, 'patience': 140, 'spt-alg': 'kruskal', 'manifold': 'PoincareBall', 'dim': 256, 'num-adj': 8, 'add-rate': 0.1, 'tem': 1.1, 'consis-rate': 1.8, 'use-att': 1, 'num-layers': 3}
mean: 0.6785000000000001
[0.681 0.672 0.689 0.669 0.674 0.683 0.683 0.68  0.672 0.682]
cur_param: {'dropout': 0.5406619047725546, 'weight-decay': 0.004466424435868464, 'lr': 0.0007957341064351497, 'lr-reduce-freq': 130, 'patience': 130, 'spt-alg': 'kruskal', 'manifold': 'PoincareBall', 'dim': 256, 'num-adj': 8, 'add-rate': 0.7, 'tem': 1.0, 'consis-rate': 1.9000000000000001, 'use-att': 1, 'num-layers': 4}
mean: 0.6802
[0.682 0.678 0.69  0.673 0.669 0.702 0.678 0.675 0.681 0.674]
cur_param: {'dropout': 0.5717503031372169, 'weight-decay': 0.004019151914553885, 'lr': 0.0006167651903893601, 'lr-reduce-freq': 140, 'patience': 140, 'spt-alg': 'kruskal', 'manifold': 'PoincareBall', 'dim': 256, 'num-adj': 8, 'add-rate': 0.1, 'tem': 1.5, 'consis-rate': 1.8, 'use-att': 1, 'num-layers': 3}
mean: 0.6777000000000001
[0.67  0.671 0.675 0.681 0.668 0.675 0.692 0.684 0.674 0.687]
cur_param: {'dropout': 0.5614642247870065, 'weight-decay': 0.001572118381463496, 'lr': 0.0006655496257232927, 'lr-reduce-freq': 120, 'patience': 120, 'spt-alg': 'kruskal', 'manifold': 'PoincareBall', 'dim': 256, 'num-adj': 8, 'add-rate': 0.1, 'tem': 1.2000000000000002, 'consis-rate': 1.7000000000000002, 'use-att': 1, 'num-layers': 4}
mean: 0.6796999999999999
[0.68  0.671 0.673 0.678 0.674 0.685 0.687 0.682 0.677 0.69 ]
cur_param: {'dropout': 0.5814408804630441, 'weight-decay': 0.0037140784131810736, 'lr': 0.0009627362669870028, 'lr-reduce-freq': 130, 'patience': 130, 'spt-alg': 'prim', 'manifold': 'Hyperboloid', 'dim': 256, 'num-adj': 6, 'add-rate': 0.30000000000000004, 'tem': 1.1, 'consis-rate': 1.2000000000000002, 'use-att': 0, 'num-layers': 3}
mean: 0.6753
[0.667 0.683 0.673 0.677 0.676 0.67  0.68  0.668 0.677 0.682]
cur_param: {'dropout': 0.5926104298755368, 'weight-decay': 0.00332461636744191, 'lr': 0.0008257565336321201, 'lr-reduce-freq': 130, 'patience': 130, 'spt-alg': 'kruskal', 'manifold': 'PoincareBall', 'dim': 256, 'num-adj': 6, 'add-rate': 0.4, 'tem': 0.9, 'consis-rate': 1.1, 'use-att': 1, 'num-layers': 4}
mean: 0.681
[0.675 0.674 0.687 0.679 0.677 0.678 0.681 0.686 0.684 0.689]
cur_param: {'dropout': 0.5849437202595859, 'weight-decay': 0.0024139691688449885, 'lr': 0.0007793508999663362, 'lr-reduce-freq': 130, 'patience': 130, 'spt-alg': 'kruskal', 'manifold': 'PoincareBall', 'dim': 256, 'num-adj': 6, 'add-rate': 0.4, 'tem': 0.9, 'consis-rate': 1.0, 'use-att': 1, 'num-layers': 4}
mean: 0.6803000000000001
[0.665 0.675 0.694 0.682 0.678 0.678 0.682 0.687 0.677 0.685]
cur_param: {'dropout': 0.5940370591449169, 'weight-decay': 0.003393870102804288, 'lr': 0.002958302010463511, 'lr-reduce-freq': 130, 'patience': 130, 'spt-alg': 'kruskal', 'manifold': 'PoincareBall', 'dim': 256, 'num-adj': 6, 'add-rate': 0.4, 'tem': 0.8, 'consis-rate': 1.1, 'use-att': 1, 'num-layers': 4}
mean: 0.6762
[0.687 0.657 0.691 0.686 0.676 0.668 0.682 0.683 0.667 0.665]
cur_param: {'dropout': 0.5702422545197663, 'weight-decay': 0.0028730531749936194, 'lr': 0.000710971002168173, 'lr-reduce-freq': 100, 'patience': 100, 'spt-alg': 'kruskal', 'manifold': 'PoincareBall', 'dim': 256, 'num-adj': 8, 'add-rate': 0.4, 'tem': 0.9, 'consis-rate': 1.2000000000000002, 'use-att': 1, 'num-layers': 4}
mean: 0.6799000000000001
[0.681 0.672 0.675 0.674 0.681 0.679 0.688 0.682 0.675 0.692]
cur_param: {'dropout': 0.5983412495165845, 'weight-decay': 0.0039880912058408, 'lr': 0.0008265824623592603, 'lr-reduce-freq': 130, 'patience': 130, 'spt-alg': 'kruskal', 'manifold': 'PoincareBall', 'dim': 256, 'num-adj': 6, 'add-rate': 0.4, 'tem': 0.7, 'consis-rate': 1.1, 'use-att': 1, 'num-layers': 4}
mean: 0.6811000000000001
[0.683 0.672 0.686 0.682 0.676 0.677 0.685 0.68  0.685 0.685]
cur_param: {'dropout': 0.5949360478126219, 'weight-decay': 0.005145466206282185, 'lr': 0.0008382492999245399, 'lr-reduce-freq': 130, 'patience': 130, 'spt-alg': 'kruskal', 'manifold': 'PoincareBall', 'dim': 128, 'num-adj': 6, 'add-rate': 0.4, 'tem': 0.7, 'consis-rate': 1.1, 'use-att': 1, 'num-layers': 4}[32m[I 2022-06-16 20:29:59,126][0m Trial 146 finished with value: 0.6778000000000001 and parameters: {'dropout': 0.5949360478126219, 'weight_decay': 0.005145466206282185, 'lr': 0.0008382492999245399, 'patience': 130, 'spt-alg': 'kruskal', 'manifold': 'PoincareBall', 'dim': 128, 'num-adj': 6, 'add-rate': 0.4, 'tem': 0.7, 'consis-rate': 1.1, 'use-att': 1, 'num-layers': 4}. Best is trial 115 with value: 0.6829000000000001.[0m
[32m[I 2022-06-16 20:33:02,366][0m Trial 147 finished with value: 0.6793 and parameters: {'dropout': 0.5775311425068889, 'weight_decay': 0.0046802394664262415, 'lr': 0.00089871266508283, 'patience': 120, 'spt-alg': 'kruskal', 'manifold': 'PoincareBall', 'dim': 256, 'num-adj': 6, 'add-rate': 0.4, 'tem': 1.1, 'consis-rate': 1.1, 'use-att': 1, 'num-layers': 4}. Best is trial 115 with value: 0.6829000000000001.[0m
[32m[I 2022-06-16 20:36:04,710][0m Trial 148 finished with value: 0.68 and parameters: {'dropout': 0.5854627471254081, 'weight_decay': 0.006195984864251215, 'lr': 0.0010368052841278367, 'patience': 130, 'spt-alg': 'kruskal', 'manifold': 'PoincareBall', 'dim': 256, 'num-adj': 6, 'add-rate': 0.5, 'tem': 1.2000000000000002, 'consis-rate': 1.0, 'use-att': 1, 'num-layers': 3}. Best is trial 115 with value: 0.6829000000000001.[0m
[32m[I 2022-06-16 20:40:20,503][0m Trial 149 finished with value: 0.6762000000000001 and parameters: {'dropout': 0.5977176455599744, 'weight_decay': 0.00407829899495677, 'lr': 0.0007252821707353549, 'patience': 140, 'spt-alg': 'kruskal', 'manifold': 'PoincareBall', 'dim': 64, 'num-adj': 6, 'add-rate': 0.4, 'tem': 0.7, 'consis-rate': 1.2000000000000002, 'use-att': 1, 'num-layers': 4}. Best is trial 115 with value: 0.6829000000000001.[0m
[32m[I 2022-06-16 20:42:06,668][0m Trial 150 finished with value: 0.6703 and parameters: {'dropout': 0.5580608104327468, 'weight_decay': 0.001412439802075028, 'lr': 0.005419823864790672, 'patience': 70, 'spt-alg': 'kruskal', 'manifold': 'PoincareBall', 'dim': 256, 'num-adj': 4, 'add-rate': 0.4, 'tem': 1.1, 'consis-rate': 1.0, 'use-att': 1, 'num-layers': 3}. Best is trial 115 with value: 0.6829000000000001.[0m
[32m[I 2022-06-16 20:45:18,298][0m Trial 151 finished with value: 0.6824 and parameters: {'dropout': 0.5743887233514235, 'weight_decay': 0.003193982134554508, 'lr': 0.0007754846954684416, 'patience': 130, 'spt-alg': 'kruskal', 'manifold': 'PoincareBall', 'dim': 256, 'num-adj': 6, 'add-rate': 0.1, 'tem': 0.9, 'consis-rate': 1.2000000000000002, 'use-att': 1, 'num-layers': 4}. Best is trial 115 with value: 0.6829000000000001.[0m
[32m[I 2022-06-16 20:48:10,192][0m Trial 152 finished with value: 0.6793000000000001 and parameters: {'dropout': 0.5745921059767647, 'weight_decay': 0.00328448548390928, 'lr': 0.0017352011050109928, 'patience': 130, 'spt-alg': 'kruskal', 'manifold': 'PoincareBall', 'dim': 256, 'num-adj': 6, 'add-rate': 0.1, 'tem': 1.0, 'consis-rate': 1.3, 'use-att': 1, 'num-layers': 4}. Best is trial 115 with value: 0.6829000000000001.[0m
[32m[I 2022-06-16 20:51:24,092][0m Trial 153 finished with value: 0.6788000000000001 and parameters: {'dropout': 0.5662334139084547, 'weight_decay': 0.0026236849920589582, 'lr': 0.000822229354400047, 'patience': 130, 'spt-alg': 'kruskal', 'manifold': 'PoincareBall', 'dim': 256, 'num-adj': 6, 'add-rate': 0.4, 'tem': 0.9, 'consis-rate': 1.2000000000000002, 'use-att': 1, 'num-layers': 4}. Best is trial 115 with value: 0.6829000000000001.[0m
[32m[I 2022-06-16 20:54:48,036][0m Trial 154 finished with value: 0.6793 and parameters: {'dropout': 0.5996475168690201, 'weight_decay': 0.003517319731897027, 'lr': 0.0006801994575532273, 'patience': 130, 'spt-alg': 'kruskal', 'manifold': 'PoincareBall', 'dim': 256, 'num-adj': 6, 'add-rate': 0.1, 'tem': 1.0, 'consis-rate': 1.1, 'use-att': 1, 'num-layers': 4}. Best is trial 115 with value: 0.6829000000000001.[0m
[32m[I 2022-06-16 20:58:14,162][0m Trial 155 finished with value: 0.6799000000000001 and parameters: {'dropout': 0.5854185476990911, 'weight_decay': 0.002241107920203154, 'lr': 0.0007479228825850645, 'patience': 140, 'spt-alg': 'kruskal', 'manifold': 'PoincareBall', 'dim': 256, 'num-adj': 6, 'add-rate': 0.1, 'tem': 0.9, 'consis-rate': 1.1, 'use-att': 1, 'num-layers': 4}. Best is trial 115 with value: 0.6829000000000001.[0m
[32m[I 2022-06-16 21:01:42,717][0m Trial 156 finished with value: 0.677 and parameters: {'dropout': 0.5779802616594807, 'weight_decay': 0.0039043383516876805, 'lr': 0.0005896966341228361, 'patience': 120, 'spt-alg': 'kruskal', 'manifold': 'PoincareBall', 'dim': 256, 'num-adj': 6, 'add-rate': 0.4, 'tem': 1.1, 'consis-rate': 1.3, 'use-att': 1, 'num-layers': 4}. Best is trial 115 with value: 0.6829000000000001.[0m
[32m[I 2022-06-16 21:07:00,887][0m Trial 157 finished with value: 0.6736000000000001 and parameters: {'dropout': 0.5512198369756155, 'weight_decay': 0.003177395562629775, 'lr': 0.0009339418129750886, 'patience': 140, 'spt-alg': 'kruskal', 'manifold': 'Hyperboloid', 'dim': 256, 'num-adj': 6, 'add-rate': 0.1, 'tem': 0.6, 'consis-rate': 1.2000000000000002, 'use-att': 1, 'num-layers': 3}. Best is trial 115 with value: 0.6829000000000001.[0m
[32m[I 2022-06-16 21:09:52,792][0m Trial 158 finished with value: 0.6775 and parameters: {'dropout': 0.5684277018018772, 'weight_decay': 0.004305526903728781, 'lr': 0.0011915277362500182, 'patience': 130, 'spt-alg': 'kruskal', 'manifold': 'PoincareBall', 'dim': 256, 'num-adj': 6, 'add-rate': 0.30000000000000004, 'tem': 1.2000000000000002, 'consis-rate': 1.9000000000000001, 'use-att': 1, 'num-layers': 5}. Best is trial 115 with value: 0.6829000000000001.[0m
[32m[I 2022-06-16 21:13:18,503][0m Trial 159 finished with value: 0.6786000000000001 and parameters: {'dropout': 0.5883985280366374, 'weight_decay': 0.0028445939238460048, 'lr': 0.0006462497992873133, 'patience': 120, 'spt-alg': 'kruskal', 'manifold': 'PoincareBall', 'dim': 256, 'num-adj': 6, 'add-rate': 0.1, 'tem': 1.0, 'consis-rate': 1.0, 'use-att': 1, 'num-layers': 4}. Best is trial 115 with value: 0.6829000000000001.[0m
[32m[I 2022-06-16 21:16:15,455][0m Trial 160 finished with value: 0.6777 and parameters: {'dropout': 0.5579355168097012, 'weight_decay': 0.005694541725244243, 'lr': 0.0010941642486969796, 'patience': 130, 'spt-alg': 'kruskal', 'manifold': 'PoincareBall', 'dim': 256, 'num-adj': 4, 'add-rate': 0.1, 'tem': 1.1, 'consis-rate': 1.1, 'use-att': 1, 'num-layers': 3}. Best is trial 115 with value: 0.6829000000000001.[0m
[32m[I 2022-06-16 21:19:36,647][0m Trial 161 finished with value: 0.6787000000000001 and parameters: {'dropout': 0.5879908953556767, 'weight_decay': 0.003645262269298976, 'lr': 0.0007854060220170953, 'patience': 130, 'spt-alg': 'kruskal', 'manifold': 'PoincareBall', 'dim': 256, 'num-adj': 6, 'add-rate': 0.2, 'tem': 0.8, 'consis-rate': 1.2000000000000002, 'use-att': 1, 'num-layers': 4}. Best is trial 115 with value: 0.6829000000000001.[0m
[32m[I 2022-06-16 21:22:51,315][0m Trial 162 finished with value: 0.6764 and parameters: {'dropout': 0.5789036594323128, 'weight_decay': 0.004925288027953479, 'lr': 0.0008454027870498863, 'patience': 130, 'spt-alg': 'kruskal', 'manifold': 'PoincareBall', 'dim': 256, 'num-adj': 6, 'add-rate': 0.2, 'tem': 0.8, 'consis-rate': 1.1, 'use-att': 1, 'num-layers': 4}. Best is trial 115 with value: 0.6829000000000001.[0m
[32m[I 2022-06-16 21:26:15,038][0m Trial 163 finished with value: 0.6802000000000001 and parameters: {'dropout': 0.5471869437412556, 'weight_decay': 0.003080800809228251, 'lr': 0.0006998620072347724, 'patience': 140, 'spt-alg': 'kruskal', 'manifold': 'PoincareBall', 'dim': 256, 'num-adj': 8, 'add-rate': 0.1, 'tem': 0.9, 'consis-rate': 1.8, 'use-att': 1, 'num-layers': 4}. Best is trial 115 with value: 0.6829000000000001.[0m
[32m[I 2022-06-16 21:29:26,467][0m Trial 164 finished with value: 0.6777000000000001 and parameters: {'dropout': 0.5913674562315433, 'weight_decay': 0.0037316447990817406, 'lr': 0.0008677859632520182, 'patience': 130, 'spt-alg': 'kruskal', 'manifold': 'PoincareBall', 'dim': 256, 'num-adj': 6, 'add-rate': 0.4, 'tem': 0.7, 'consis-rate': 1.2000000000000002, 'use-att': 1, 'num-layers': 4}. Best is trial 115 with value: 0.6829000000000001.[0m
[32m[I 2022-06-16 21:32:11,783][0m Trial 165 finished with value: 0.6803 and parameters: {'dropout': 0.5635175014140827, 'weight_decay': 0.002419478889359789, 'lr': 0.0007512926666160235, 'patience': 90, 'spt-alg': 'kruskal', 'manifold': 'PoincareBall', 'dim': 256, 'num-adj': 8, 'add-rate': 0.1, 'tem': 0.9, 'consis-rate': 1.9000000000000001, 'use-att': 1, 'num-layers': 4}. Best is trial 115 with value: 0.6829000000000001.[0m
