[32m[I 2022-06-16 17:04:35,913][0m Trial 82 finished with value: 0.6807 and parameters: {'dropout': 0.5626162978710274, 'weight_decay': 0.0020271405090322536, 'lr': 0.0016454603348528974, 'patience': 120, 'spt-alg': 'kruskal', 'manifold': 'PoincareBall', 'dim': 256, 'num-adj': 8, 'add-rate': 0.1, 'tem': 1.2000000000000002, 'consis-rate': 1.7000000000000002, 'use-att': 1, 'num-layers': 3}. Best is trial 16 with value: 0.6812000000000001.[0m

mean: 0.6795000000000001
[0.676 0.674 0.68  0.675 0.674 0.699 0.686 0.684 0.673 0.674]
cur_param: {'dropout': 0.5589457897358308, 'weight-decay': 0.005234241145739344, 'lr': 0.0007527986644544436, 'lr-reduce-freq': 140, 'patience': 140, 'spt-alg': 'kruskal', 'manifold': 'PoincareBall', 'dim': 256, 'num-adj': 6, 'add-rate': 0.2, 'tem': 1.1, 'consis-rate': 1.1, 'use-att': 1, 'num-layers': 4}
mean: 0.6807000000000001
[0.673 0.673 0.692 0.671 0.674 0.69  0.688 0.684 0.675 0.687]
cur_param: {'dropout': 0.48665009149120475, 'weight-decay': 0.01077220929097612, 'lr': 0.0005820613591836204, 'lr-reduce-freq': 140, 'patience': 140, 'spt-alg': 'kruskal', 'manifold': 'PoincareBall', 'dim': 256, 'num-adj': 6, 'add-rate': 0.30000000000000004, 'tem': 1.4, 'consis-rate': 1.1, 'use-att': 1, 'num-layers': 4}
mean: 0.6775
[0.674 0.661 0.685 0.675 0.67  0.697 0.683 0.684 0.674 0.672]
cur_param: {'dropout': 0.5103981923375037, 'weight-decay': 0.007983781909967444, 'lr': 0.0006917676227177151, 'lr-reduce-freq': 140, 'patience': 140, 'spt-alg': 'kruskal', 'manifold': 'PoincareBall', 'dim': 256, 'num-adj': 6, 'add-rate': 0.1, 'tem': 1.1, 'consis-rate': 1.0, 'use-att': 1, 'num-layers': 4}
mean: 0.679
[0.681 0.67  0.684 0.677 0.67  0.699 0.679 0.677 0.674 0.679]
cur_param: {'dropout': 0.5554804278684149, 'weight-decay': 0.0027598635312249295, 'lr': 0.000625193647705505, 'lr-reduce-freq': 130, 'patience': 130, 'spt-alg': 'kruskal', 'manifold': 'PoincareBall', 'dim': 256, 'num-adj': 6, 'add-rate': 0.2, 'tem': 1.1, 'consis-rate': 0.9, 'use-att': 1, 'num-layers': 4}
mean: 0.6782
[0.67  0.675 0.68  0.679 0.667 0.677 0.688 0.684 0.676 0.686]
cur_param: {'dropout': 0.5212155712584551, 'weight-decay': 0.006355151730211729, 'lr': 0.0007697132220017859, 'lr-reduce-freq': 120, 'patience': 120, 'spt-alg': 'kruskal', 'manifold': 'PoincareBall', 'dim': 256, 'num-adj': 2, 'add-rate': 0.30000000000000004, 'tem': 1.0, 'consis-rate': 1.3, 'use-att': 1, 'num-layers': 4}
mean: 0.679
[0.679 0.674 0.685 0.673 0.669 0.693 0.684 0.676 0.683 0.674]
cur_param: {'dropout': 0.5669871774533077, 'weight-decay': 0.004138861500019565, 'lr': 0.0005551173256888638, 'lr-reduce-freq': 140, 'patience': 140, 'spt-alg': 'kruskal', 'manifold': 'PoincareBall', 'dim': 256, 'num-adj': 4, 'add-rate': 0.1, 'tem': 1.2000000000000002, 'consis-rate': 1.1, 'use-att': 1, 'num-layers': 4}
mean: 0.6748000000000001
[0.67  0.664 0.679 0.676 0.659 0.678 0.686 0.687 0.677 0.672]
cur_param: {'dropout': 0.46789063220768035, 'weight-decay': 0.005523996638828386, 'lr': 0.0007425968129849428, 'lr-reduce-freq': 130, 'patience': 130, 'spt-alg': 'prim', 'manifold': 'PoincareBall', 'dim': 256, 'num-adj': 6, 'add-rate': 0.4, 'tem': 0.9, 'consis-rate': 1.0, 'use-att': 0, 'num-layers': 5}
mean: 0.6767000000000001
[0.682 0.669 0.681 0.681 0.667 0.692 0.681 0.67  0.671 0.673]
cur_param: {'dropout': 0.5333069200088079, 'weight-decay': 0.007150231418218825, 'lr': 0.0008724482137476733, 'lr-reduce-freq': 150, 'patience': 150, 'spt-alg': 'kruskal', 'manifold': 'Hyperboloid', 'dim': 256, 'num-adj': 6, 'add-rate': 0.2, 'tem': 1.0, 'consis-rate': 1.3, 'use-att': 1, 'num-layers': 4}
mean: 0.6729
[0.66  0.667 0.679 0.688 0.665 0.673 0.68  0.673 0.671 0.673]
cur_param: {'dropout': 0.5868164145742661, 'weight-decay': 0.00531698997083637, 'lr': 0.0010379357354353758, 'lr-reduce-freq': 140, 'patience': 140, 'spt-alg': 'kruskal', 'manifold': 'PoincareBall', 'dim': 256, 'num-adj': 6, 'add-rate': 0.2, 'tem': 1.0, 'consis-rate': 1.2000000000000002, 'use-att': 1, 'num-layers': 4}
mean: 0.6792
[0.691 0.673 0.688 0.684 0.673 0.691 0.676 0.673 0.667 0.676]
cur_param: {'dropout': 0.5726663652141297, 'weight-decay': 0.0032534934149580645, 'lr': 0.0006773637516799848, 'lr-reduce-freq': 140, 'patience': 140, 'spt-alg': 'kruskal', 'manifold': 'PoincareBall', 'dim': 256, 'num-adj': 6, 'add-rate': 0.2, 'tem': 1.1, 'consis-rate': 1.2000000000000002, 'use-att': 1, 'num-layers': 4}
mean: 0.6786
[0.674 0.674 0.675 0.674 0.675 0.678 0.687 0.68  0.678 0.691]
cur_param: {'dropout': 0.3024515660955317, 'weight-decay': 0.004857924342709903, 'lr': 0.0009712117310649996, 'lr-reduce-freq': 140, 'patience': 140, 'spt-alg': 'kruskal', 'manifold': 'PoincareBall', 'dim': 256, 'num-adj': 6, 'add-rate': 0.2, 'tem': 1.0, 'consis-rate': 1.4, 'use-att': 1, 'num-layers': 4}
mean: 0.6685
[0.67  0.662 0.677 0.674 0.662 0.672 0.679 0.668 0.662 0.659]
cur_param: {'dropout': 0.5894951489172744, 'weight-decay': 0.0037244348332596657, 'lr': 0.0008532299074901962, 'lr-reduce-freq': 130, 'patience': 130, 'spt-alg': 'kruskal', 'manifold': 'PoincareBall', 'dim': 256, 'num-adj': 6, 'add-rate': 0.2, 'tem': 0.8, 'consis-rate': 1.1, 'use-att': 1, 'num-layers': 4}
mean: 0.6806
[0.673 0.669 0.688 0.68  0.676 0.696 0.679 0.678 0.686 0.681]
cur_param: {'dropout': 0.5506002377465402, 'weight-decay': 0.003442773702645102, 'lr': 0.0011601710072005158, 'lr-reduce-freq': 130, 'patience': 130, 'spt-alg': 'kruskal', 'manifold': 'PoincareBall', 'dim': 256, 'num-adj': 6, 'add-rate': 0.1, 'tem': 1.1, 'consis-rate': 1.2000000000000002, 'use-att': 1, 'num-layers': 4}
mean: 0.6811
[0.691 0.674 0.682 0.684 0.672 0.692 0.696 0.679 0.673 0.668]
cur_param: {'dropout': 0.5492323842811925, 'weight-decay': 0.002775458149184321, 'lr': 0.0012102013346874298, 'lr-reduce-freq': 130, 'patience': 130, 'spt-alg': 'kruskal', 'manifold': 'PoincareBall', 'dim': 256, 'num-adj': 6, 'add-rate': 0.1, 'tem': 1.1, 'consis-rate': 1.5, 'use-att': 1, 'num-layers': 4}
mean: 0.6799
[0.694 0.667 0.678 0.682 0.675 0.692 0.689 0.675 0.675 0.672]
cur_param: {'dropout': 0.5495564576132882, 'weight-decay': 0.002735044164612314, 'lr': 0.0012410228255787998, 'lr-reduce-freq': 130, 'patience': 130, 'spt-alg': 'kruskal', 'manifold': 'PoincareBall', 'dim': 256, 'num-adj': 6, 'add-rate': 0.1, 'tem': 1.3, 'consis-rate': 1.5, 'use-att': 1, 'num-layers': 4}
mean: 0.6796
[0.697 0.672 0.674 0.677 0.671 0.69  0.692 0.678 0.675 0.67 ]
cur_param: {'dropout': 0.5483633598352959, 'weight-decay': 0.0017326233879744865, 'lr': 0.0013489813289073909, 'lr-reduce-freq': 130, 'patience': 130, 'spt-alg': 'kruskal', 'manifold': 'PoincareBall', 'dim': 256, 'num-adj': 6, 'add-rate': 0.1, 'tem': 1.4, 'consis-rate': 1.5, 'use-att': 1, 'num-layers': 4}
mean: 0.6774
[0.697 0.673 0.666 0.665 0.675 0.677 0.691 0.682 0.678 0.67 ]
cur_param: {'dropout': 0.562446021476547, 'weight-decay': 0.002075411253702791, 'lr': 0.0016004544662401132, 'lr-reduce-freq': 130, 'patience': 130, 'spt-alg': 'kruskal', 'manifold': 'PoincareBall', 'dim': 256, 'num-adj': 8, 'add-rate': 0.1, 'tem': 1.3, 'consis-rate': 1.6, 'use-att': 1, 'num-layers': 4}
mean: 0.6805
[0.687 0.673 0.694 0.685 0.678 0.676 0.688 0.68  0.675 0.669]
cur_param: {'dropout': 0.5626096277443964, 'weight-decay': 0.00223308620507586, 'lr': 0.0015946234870314658, 'lr-reduce-freq': 120, 'patience': 120, 'spt-alg': 'kruskal', 'manifold': 'PoincareBall', 'dim': 256, 'num-adj': 8, 'add-rate': 0.1, 'tem': 1.2000000000000002, 'consis-rate': 1.7000000000000002, 'use-att': 1, 'num-layers': 3}
mean: 0.6805
[0.686 0.676 0.695 0.673 0.677 0.674 0.694 0.688 0.674 0.668]
cur_param: {'dropout': 0.5619791257780323, 'weight-decay': 0.0020856840561892173, 'lr': 0.0016249455120346075, 'lr-reduce-freq': 130, 'patience': 130, 'spt-alg': 'kruskal', 'manifold': 'PoincareBall', 'dim': 256, 'num-adj': 8, 'add-rate': 0.1, 'tem': 1.2000000000000002, 'consis-rate': 1.7000000000000002, 'use-att': 1, 'num-layers': 3}
mean: 0.681
[0.686 0.675 0.694 0.686 0.678 0.672 0.694 0.682 0.673 0.67 ]
cur_param: {'dropout': 0.5626162978710274, 'weight-decay': 0.0020271405090322536, 'lr': 0.0016454603348528974, 'lr-reduce-freq': 120, 'patience': 120, 'spt-alg': 'kruskal', 'manifold': 'PoincareBall', 'dim': 256, 'num-adj': 8, 'add-rate': 0.1, 'tem': 1.2000000000000002, 'consis-rate': 1.7000000000000002, 'use-att': 1, 'num-layers': 3}
mean: 0.6807
[0.686 0.677 0.695 0.672 0.678 0.673 0.691 0.693 0.675 0.667]
cur_param: {'dropout': 0.5733700080338219, 'weight-decay': 0.0012317137470255687, 'lr': 0.001980838825021745, 'lr-reduce-freq': 120, 'patience': 120, 'spt-alg': 'kruskal', 'manifold': 'PoincareBall', 'dim': 256, 'num-adj': 8, 'add-rate': 0.1, 'tem': 1.2000000000000002, 'consis-rate': 1.7000000000000002, 'use-att': 1, 'num-layers': 3}[32m[I 2022-06-16 17:06:57,509][0m Trial 83 finished with value: 0.6796 and parameters: {'dropout': 0.5733700080338219, 'weight_decay': 0.0012317137470255687, 'lr': 0.001980838825021745, 'patience': 120, 'spt-alg': 'kruskal', 'manifold': 'PoincareBall', 'dim': 256, 'num-adj': 8, 'add-rate': 0.1, 'tem': 1.2000000000000002, 'consis-rate': 1.7000000000000002, 'use-att': 1, 'num-layers': 3}. Best is trial 16 with value: 0.6812000000000001.[0m
[32m[I 2022-06-16 17:09:25,592][0m Trial 84 finished with value: 0.6797 and parameters: {'dropout': 0.5908092065030646, 'weight_decay': 0.0016883569115765103, 'lr': 0.0016605092938453618, 'patience': 110, 'spt-alg': 'kruskal', 'manifold': 'PoincareBall', 'dim': 256, 'num-adj': 8, 'add-rate': 0.1, 'tem': 1.2000000000000002, 'consis-rate': 1.7000000000000002, 'use-att': 1, 'num-layers': 3}. Best is trial 16 with value: 0.6812000000000001.[0m
[32m[I 2022-06-16 17:12:09,204][0m Trial 85 finished with value: 0.6764 and parameters: {'dropout': 0.5378528394739427, 'weight_decay': 0.002397972061688719, 'lr': 0.0011550529266109008, 'patience': 120, 'spt-alg': 'kruskal', 'manifold': 'PoincareBall', 'dim': 256, 'num-adj': 8, 'add-rate': 0.1, 'tem': 1.2000000000000002, 'consis-rate': 1.9000000000000001, 'use-att': 1, 'num-layers': 3}. Best is trial 16 with value: 0.6812000000000001.[0m
[32m[I 2022-06-16 17:14:56,001][0m Trial 86 finished with value: 0.6805 and parameters: {'dropout': 0.5604160138085224, 'weight_decay': 0.002285668453060203, 'lr': 0.0014674348105875, 'patience': 120, 'spt-alg': 'kruskal', 'manifold': 'PoincareBall', 'dim': 256, 'num-adj': 8, 'add-rate': 0.1, 'tem': 1.3, 'consis-rate': 1.8, 'use-att': 1, 'num-layers': 3}. Best is trial 16 with value: 0.6812000000000001.[0m
[32m[I 2022-06-16 17:17:58,180][0m Trial 87 finished with value: 0.6791 and parameters: {'dropout': 0.5727324532984616, 'weight_decay': 0.0009012795763041711, 'lr': 0.0014635223115450641, 'patience': 130, 'spt-alg': 'kruskal', 'manifold': 'PoincareBall', 'dim': 192, 'num-adj': 8, 'add-rate': 0.1, 'tem': 1.4, 'consis-rate': 1.8, 'use-att': 0, 'num-layers': 3}. Best is trial 16 with value: 0.6812000000000001.[0m
[32m[I 2022-06-16 17:20:26,975][0m Trial 88 finished with value: 0.6797000000000001 and parameters: {'dropout': 0.5931820554176777, 'weight_decay': 0.0019578682876470192, 'lr': 0.0019564095711187284, 'patience': 130, 'spt-alg': 'prim', 'manifold': 'PoincareBall', 'dim': 256, 'num-adj': 8, 'add-rate': 0.1, 'tem': 1.3, 'consis-rate': 1.6, 'use-att': 1, 'num-layers': 3}. Best is trial 16 with value: 0.6812000000000001.[0m
[32m[I 2022-06-16 17:23:52,187][0m Trial 89 finished with value: 0.6809999999999999 and parameters: {'dropout': 0.5576122810645019, 'weight_decay': 0.001335203343179334, 'lr': 0.0022952837350482453, 'patience': 110, 'spt-alg': 'kruskal', 'manifold': 'Hyperboloid', 'dim': 256, 'num-adj': 8, 'add-rate': 0.1, 'tem': 0.8, 'consis-rate': 1.8, 'use-att': 1, 'num-layers': 3}. Best is trial 16 with value: 0.6812000000000001.[0m
[32m[I 2022-06-16 17:27:33,886][0m Trial 90 finished with value: 0.6781 and parameters: {'dropout': 0.536125241052899, 'weight_decay': 0.0012346626210599787, 'lr': 0.0024144348490066914, 'patience': 110, 'spt-alg': 'kruskal', 'manifold': 'Hyperboloid', 'dim': 256, 'num-adj': 8, 'add-rate': 0.1, 'tem': 0.8, 'consis-rate': 1.8, 'use-att': 1, 'num-layers': 3}. Best is trial 16 with value: 0.6812000000000001.[0m
[32m[I 2022-06-16 17:31:22,879][0m Trial 91 finished with value: 0.6789 and parameters: {'dropout': 0.5576888000281623, 'weight_decay': 0.001484691981792395, 'lr': 0.0017916852051883675, 'patience': 110, 'spt-alg': 'kruskal', 'manifold': 'Hyperboloid', 'dim': 256, 'num-adj': 8, 'add-rate': 0.1, 'tem': 0.8, 'consis-rate': 1.8, 'use-att': 1, 'num-layers': 3}. Best is trial 16 with value: 0.6812000000000001.[0m
[32m[I 2022-06-16 17:36:30,063][0m Trial 92 finished with value: 0.6742000000000001 and parameters: {'dropout': 0.568487617615547, 'weight_decay': 0.003490580185493236, 'lr': 0.000856498407348164, 'patience': 120, 'spt-alg': 'kruskal', 'manifold': 'Hyperboloid', 'dim': 256, 'num-adj': 8, 'add-rate': 0.1, 'tem': 1.3, 'consis-rate': 1.9000000000000001, 'use-att': 1, 'num-layers': 3}. Best is trial 16 with value: 0.6812000000000001.[0m
[32m[I 2022-06-16 17:40:18,265][0m Trial 93 finished with value: 0.6685 and parameters: {'dropout': 0.2310944240576189, 'weight_decay': 0.002950086430320821, 'lr': 0.0013033978247517439, 'patience': 100, 'spt-alg': 'kruskal', 'manifold': 'Hyperboloid', 'dim': 256, 'num-adj': 8, 'add-rate': 0.1, 'tem': 0.8, 'consis-rate': 1.9000000000000001, 'use-att': 1, 'num-layers': 3}. Best is trial 16 with value: 0.6812000000000001.[0m
[32m[I 2022-06-16 17:44:00,298][0m Trial 94 finished with value: 0.6799 and parameters: {'dropout': 0.5877234510511177, 'weight_decay': 0.0013329521775384654, 'lr': 0.002125682149872976, 'patience': 120, 'spt-alg': 'kruskal', 'manifold': 'Hyperboloid', 'dim': 256, 'num-adj': 8, 'add-rate': 0.1, 'tem': 1.1, 'consis-rate': 2.0, 'use-att': 1, 'num-layers': 3}. Best is trial 16 with value: 0.6812000000000001.[0m
[32m[I 2022-06-16 17:46:48,008][0m Trial 95 finished with value: 0.6769000000000001 and parameters: {'dropout': 0.575285419788343, 'weight_decay': 0.0040494589686956226, 'lr': 0.0013670930740527043, 'patience': 110, 'spt-alg': 'kruskal', 'manifold': 'PoincareBall', 'dim': 256, 'num-adj': 8, 'add-rate': 0.1, 'tem': 0.8, 'consis-rate': 1.7000000000000002, 'use-att': 1, 'num-layers': 3}. Best is trial 16 with value: 0.6812000000000001.[0m
[32m[I 2022-06-16 17:49:35,097][0m Trial 96 finished with value: 0.6797000000000001 and parameters: {'dropout': 0.5444855918309098, 'weight_decay': 0.0009532932394945267, 'lr': 0.0016178929773230089, 'patience': 130, 'spt-alg': 'kruskal', 'manifold': 'PoincareBall', 'dim': 256, 'num-adj': 8, 'add-rate': 0.1, 'tem': 1.3, 'consis-rate': 1.6, 'use-att': 1, 'num-layers': 5}. Best is trial 16 with value: 0.6812000000000001.[0m
[32m[I 2022-06-16 17:54:20,374][0m Trial 97 finished with value: 0.6758000000000001 and parameters: {'dropout': 0.5623024398784561, 'weight_decay': 0.002081722600499103, 'lr': 0.001137810866983017, 'patience': 130, 'spt-alg': 'kruskal', 'manifold': 'Hyperboloid', 'dim': 256, 'num-adj': 8, 'add-rate': 0.1, 'tem': 0.9, 'consis-rate': 1.1, 'use-att': 1, 'num-layers': 3}. Best is trial 16 with value: 0.6812000000000001.[0m
[32m[I 2022-06-16 17:57:27,365][0m Trial 98 finished with value: 0.6733 and parameters: {'dropout': 0.5564563550397368, 'weight_decay': 0.0024218714729960567, 'lr': 0.0009185457608122631, 'patience': 120, 'spt-alg': 'kruskal', 'manifold': 'PoincareBall', 'dim': 192, 'num-adj': 8, 'add-rate': 0.1, 'tem': 1.2000000000000002, 'consis-rate': 1.8, 'use-att': 1, 'num-layers': 3}. Best is trial 16 with value: 0.6812000000000001.[0m
[32m[I 2022-06-16 17:59:49,886][0m Trial 99 finished with value: 0.6758000000000001 and parameters: {'dropout': 0.4412496766671872, 'weight_decay': 0.0010867907210753102, 'lr': 0.0022508903459237633, 'patience': 120, 'spt-alg': 'kruskal', 'manifold': 'PoincareBall', 'dim': 256, 'num-adj': 8, 'add-rate': 0.1, 'tem': 1.2000000000000002, 'consis-rate': 1.7000000000000002, 'use-att': 1, 'num-layers': 3}. Best is trial 16 with value: 0.6812000000000001.[0m
[32m[I 2022-06-16 18:01:57,751][0m Trial 100 finished with value: 0.6794 and parameters: {'dropout': 0.5185290811803374, 'weight_decay': 0.00341854204676351, 'lr': 0.001533615212241958, 'patience': 60, 'spt-alg': 'prim', 'manifold': 'PoincareBall', 'dim': 256, 'num-adj': 8, 'add-rate': 0.2, 'tem': 1.1, 'consis-rate': 1.0, 'use-att': 0, 'num-layers': 3}. Best is trial 16 with value: 0.6812000000000001.[0m
[32m[I 2022-06-16 18:04:47,779][0m Trial 101 finished with value: 0.682 and parameters: {'dropout': 0.5794501915896177, 'weight_decay': 0.0018590209171681327, 'lr': 0.0017437191083878698, 'patience': 130, 'spt-alg': 'kruskal', 'manifold': 'PoincareBall', 'dim': 256, 'num-adj': 8, 'add-rate': 0.1, 'tem': 1.3, 'consis-rate': 1.8, 'use-att': 1, 'num-layers': 3}. Best is trial 101 with value: 0.682.[0m
[32m[I 2022-06-16 18:07:34,842][0m Trial 102 finished with value: 0.6787000000000001 and parameters: {'dropout': 0.5774477604681407, 'weight_decay': 0.001372319875620772, 'lr': 0.0017164429410725264, 'patience': 130, 'spt-alg': 'kruskal', 'manifold': 'PoincareBall', 'dim': 256, 'num-adj': 8, 'add-rate': 0.1, 'tem': 1.2000000000000002, 'consis-rate': 1.8, 'use-att': 1, 'num-layers': 3}. Best is trial 101 with value: 0.682.[0m
