[32m[I 2022-06-16 14:29:00,874][0m Trial 32 finished with value: 0.6761 and parameters: {'dropout': 0.5942028510047388, 'weight_decay': 0.0026688202776900026, 'lr': 0.004059066619821587, 'patience': 120, 'spt-alg': 'kruskal', 'manifold': 'PoincareBall', 'dim': 192, 'num-adj': 6, 'add-rate': 0.1, 'tem': 0.8, 'consis-rate': 0.9, 'use-att': 1, 'num-layers': 4}. Best is trial 16 with value: 0.6812000000000001.[0m
[32m[I 2022-06-16 14:31:06,335][0m Trial 33 finished with value: 0.6687000000000001 and parameters: {'dropout': 0.2817735694134509, 'weight_decay': 0.014155780264585333, 'lr': 0.0024836189493923893, 'patience': 100, 'spt-alg': 'kruskal', 'manifold': 'PoincareBall', 'dim': 128, 'num-adj': 6, 'add-rate': 0.1, 'tem': 1.1, 'consis-rate': 1.3, 'use-att': 1, 'num-layers': 4}. Best is trial 16 with value: 0.6812000000000001.[0m
[32m[I 2022-06-16 14:33:31,389][0m Trial 34 finished with value: 0.6708 and parameters: {'dropout': 0.5100317805805877, 'weight_decay': 0.0018146938362851586, 'lr': 0.007380666101021659, 'patience': 150, 'spt-alg': 'kruskal', 'manifold': 'PoincareBall', 'dim': 64, 'num-adj': 8, 'add-rate': 0.2, 'tem': 0.9, 'consis-rate': 1.1, 'use-att': 0, 'num-layers': 3}. Best is trial 16 with value: 0.6812000000000001.[0m
[32m[I 2022-06-16 14:35:27,206][0m Trial 35 finished with value: 0.6757 and parameters: {'dropout': 0.5649005901703604, 'weight_decay': 0.0031076276391293687, 'lr': 0.0035462179773202564, 'patience': 90, 'spt-alg': 'kruskal', 'manifold': 'PoincareBall', 'dim': 192, 'num-adj': 4, 'add-rate': 0.1, 'tem': 0.7, 'consis-rate': 0.8, 'use-att': 1, 'num-layers': 5}. Best is trial 16 with value: 0.6812000000000001.[0m
[32m[I 2022-06-16 14:37:34,637][0m Trial 36 finished with value: 0.6751000000000001 and parameters: {'dropout': 0.5430154870504261, 'weight_decay': 0.04914514248343993, 'lr': 0.0041847004153965145, 'patience': 120, 'spt-alg': 'kruskal', 'manifold': 'PoincareBall', 'dim': 192, 'num-adj': 6, 'add-rate': 0.30000000000000004, 'tem': 0.8, 'consis-rate': 1.4, 'use-att': 1, 'num-layers': 3}. Best is trial 16 with value: 0.6812000000000001.[0m
[32m[I 2022-06-16 14:40:13,003][0m Trial 37 finished with value: 0.6717000000000001 and parameters: {'dropout': 0.4662701355828319, 'weight_decay': 0.004594876393539541, 'lr': 0.0018028563575866003, 'patience': 140, 'spt-alg': 'kruskal', 'manifold': 'PoincareBall', 'dim': 128, 'num-adj': 8, 'add-rate': 0.2, 'tem': 0.6, 'consis-rate': 0.9, 'use-att': 1, 'num-layers': 4}. Best is trial 16 with value: 0.6812000000000001.[0m
[32m[I 2022-06-16 14:42:31,037][0m Trial 38 finished with value: 0.6679 and parameters: {'dropout': 0.43100628243517874, 'weight_decay': 0.025780389392428316, 'lr': 0.0021565733155757805, 'patience': 100, 'spt-alg': 'kruskal', 'manifold': 'PoincareBall', 'dim': 64, 'num-adj': 2, 'add-rate': 0.1, 'tem': 1.1, 'consis-rate': 1.9000000000000001, 'use-att': 0, 'num-layers': 3}. Best is trial 16 with value: 0.6812000000000001.[0m
[32m[I 2022-06-16 14:46:25,971][0m Trial 39 finished with value: 0.6716 and parameters: {'dropout': 0.569591853560967, 'weight_decay': 0.01689849378767014, 'lr': 0.002790965204426899, 'patience': 150, 'spt-alg': 'prim', 'manifold': 'Hyperboloid', 'dim': 128, 'num-adj': 4, 'add-rate': 0.30000000000000004, 'tem': 0.5, 'consis-rate': 1.6, 'use-att': 1, 'num-layers': 3}. Best is trial 16 with value: 0.6812000000000001.[0m
[32m[I 2022-06-16 14:48:17,514][0m Trial 40 finished with value: 0.6727000000000001 and parameters: {'dropout': 0.5389612058186618, 'weight_decay': 0.009035002979049392, 'lr': 0.005425348679479874, 'patience': 80, 'spt-alg': 'kruskal', 'manifold': 'PoincareBall', 'dim': 64, 'num-adj': 6, 'add-rate': 0.1, 'tem': 0.7, 'consis-rate': 1.3, 'use-att': 1, 'num-layers': 5}. Best is trial 16 with value: 0.6812000000000001.[0m

cur_param: {'dropout': 0.5018671071130784, 'weight-decay': 0.003738149465591338, 'lr': 0.0028045993673044304, 'lr-reduce-freq': 140, 'patience': 140, 'spt-alg': 'kruskal', 'manifold': 'PoincareBall', 'dim': 128, 'num-adj': 4, 'add-rate': 0.2, 'tem': 0.5, 'consis-rate': 1.2000000000000002, 'use-att': 1, 'num-layers': 4}
mean: 0.6757000000000001
[0.681 0.678 0.686 0.674 0.666 0.675 0.686 0.665 0.673 0.673]
cur_param: {'dropout': 0.5508822005049323, 'weight-decay': 0.007019908802297688, 'lr': 0.001762609261006877, 'lr-reduce-freq': 130, 'patience': 130, 'spt-alg': 'kruskal', 'manifold': 'PoincareBall', 'dim': 128, 'num-adj': 4, 'add-rate': 0.2, 'tem': 0.6, 'consis-rate': 1.1, 'use-att': 1, 'num-layers': 4}
mean: 0.6775
[0.683 0.678 0.686 0.676 0.67  0.662 0.688 0.673 0.684 0.675]
cur_param: {'dropout': 0.457187443082589, 'weight-decay': 0.0035644615594188464, 'lr': 0.0030513209139845583, 'lr-reduce-freq': 120, 'patience': 120, 'spt-alg': 'kruskal', 'manifold': 'PoincareBall', 'dim': 128, 'num-adj': 6, 'add-rate': 0.30000000000000004, 'tem': 0.6, 'consis-rate': 1.2000000000000002, 'use-att': 1, 'num-layers': 4}
mean: 0.6738000000000001
[0.676 0.673 0.684 0.685 0.661 0.668 0.679 0.677 0.661 0.674]
cur_param: {'dropout': 0.5627034053950833, 'weight-decay': 0.0011233142434284812, 'lr': 0.00666819170987055, 'lr-reduce-freq': 140, 'patience': 140, 'spt-alg': 'kruskal', 'manifold': 'PoincareBall', 'dim': 128, 'num-adj': 6, 'add-rate': 0.2, 'tem': 0.7, 'consis-rate': 0.9, 'use-att': 1, 'num-layers': 4}
mean: 0.6723999999999999
[0.68  0.674 0.682 0.671 0.662 0.665 0.688 0.673 0.68  0.649]
cur_param: {'dropout': 0.5989801487576691, 'weight-decay': 0.002905255403590655, 'lr': 0.00194205925131139, 'lr-reduce-freq': 110, 'patience': 110, 'spt-alg': 'kruskal', 'manifold': 'PoincareBall', 'dim': 128, 'num-adj': 4, 'add-rate': 0.1, 'tem': 0.5, 'consis-rate': 1.3, 'use-att': 1, 'num-layers': 4}
mean: 0.6758
[0.673 0.68  0.693 0.675 0.653 0.673 0.683 0.674 0.681 0.673]
cur_param: {'dropout': 0.5206665318351044, 'weight-decay': 0.006723604297332533, 'lr': 0.0039694311362588755, 'lr-reduce-freq': 140, 'patience': 140, 'spt-alg': 'kruskal', 'manifold': 'PoincareBall', 'dim': 192, 'num-adj': 6, 'add-rate': 0.30000000000000004, 'tem': 0.8, 'consis-rate': 1.1, 'use-att': 1, 'num-layers': 4}
mean: 0.6748999999999999
[0.666 0.683 0.677 0.678 0.669 0.673 0.676 0.676 0.672 0.679]
cur_param: {'dropout': 0.4018481335715332, 'weight-decay': 0.001177447905893433, 'lr': 0.004875720127969271, 'lr-reduce-freq': 120, 'patience': 120, 'spt-alg': 'prim', 'manifold': 'PoincareBall', 'dim': 128, 'num-adj': 4, 'add-rate': 0.6, 'tem': 1.0, 'consis-rate': 1.4, 'use-att': 0, 'num-layers': 4}
mean: 0.6731
[0.683 0.659 0.686 0.678 0.661 0.674 0.684 0.669 0.674 0.663]
cur_param: {'dropout': 0.5448348905545708, 'weight-decay': 0.007594010497187958, 'lr': 0.0005054461508555988, 'lr-reduce-freq': 150, 'patience': 150, 'spt-alg': 'kruskal', 'manifold': 'PoincareBall', 'dim': 192, 'num-adj': 6, 'add-rate': 0.2, 'tem': 0.6, 'consis-rate': 0.6, 'use-att': 1, 'num-layers': 4}
mean: 0.6775
[0.676 0.674 0.675 0.678 0.687 0.673 0.681 0.675 0.678 0.678]
cur_param: {'dropout': 0.4788939754304301, 'weight-decay': 0.0008140677628643969, 'lr': 0.0030782852358089904, 'lr-reduce-freq': 110, 'patience': 110, 'spt-alg': 'prim', 'manifold': 'PoincareBall', 'dim': 192, 'num-adj': 4, 'add-rate': 0.30000000000000004, 'tem': 0.7, 'consis-rate': 1.0, 'use-att': 1, 'num-layers': 5}
mean: 0.6752
[0.685 0.677 0.677 0.685 0.664 0.672 0.675 0.678 0.673 0.666]
cur_param: {'dropout': 0.5681667699494319, 'weight-decay': 0.004439153730826257, 'lr': 0.0014882993186175098, 'lr-reduce-freq': 130, 'patience': 130, 'spt-alg': 'kruskal', 'manifold': 'PoincareBall', 'dim': 128, 'num-adj': 6, 'add-rate': 0.4, 'tem': 0.8, 'consis-rate': 1.6, 'use-att': 1, 'num-layers': 4}
mean: 0.6759999999999999
[0.678 0.679 0.675 0.664 0.668 0.674 0.684 0.678 0.677 0.683]
cur_param: {'dropout': 0.5935343418117419, 'weight-decay': 0.012758011502812326, 'lr': 0.004884091166184023, 'lr-reduce-freq': 140, 'patience': 140, 'spt-alg': 'kruskal', 'manifold': 'PoincareBall', 'dim': 128, 'num-adj': 6, 'add-rate': 0.1, 'tem': 1.0, 'consis-rate': 1.2000000000000002, 'use-att': 1, 'num-layers': 4}
mean: 0.6736
[0.674 0.674 0.69  0.682 0.654 0.677 0.687 0.673 0.67  0.655]
cur_param: {'dropout': 0.5942028510047388, 'weight-decay': 0.0026688202776900026, 'lr': 0.004059066619821587, 'lr-reduce-freq': 120, 'patience': 120, 'spt-alg': 'kruskal', 'manifold': 'PoincareBall', 'dim': 192, 'num-adj': 6, 'add-rate': 0.1, 'tem': 0.8, 'consis-rate': 0.9, 'use-att': 1, 'num-layers': 4}
mean: 0.6761
[0.686 0.682 0.678 0.68  0.672 0.669 0.677 0.666 0.688 0.663]
cur_param: {'dropout': 0.2817735694134509, 'weight-decay': 0.014155780264585333, 'lr': 0.0024836189493923893, 'lr-reduce-freq': 100, 'patience': 100, 'spt-alg': 'kruskal', 'manifold': 'PoincareBall', 'dim': 128, 'num-adj': 6, 'add-rate': 0.1, 'tem': 1.1, 'consis-rate': 1.3, 'use-att': 1, 'num-layers': 4}
mean: 0.6687000000000001
[0.666 0.667 0.681 0.672 0.653 0.665 0.674 0.671 0.671 0.667]
cur_param: {'dropout': 0.5100317805805877, 'weight-decay': 0.0018146938362851586, 'lr': 0.007380666101021659, 'lr-reduce-freq': 150, 'patience': 150, 'spt-alg': 'kruskal', 'manifold': 'PoincareBall', 'dim': 64, 'num-adj': 8, 'add-rate': 0.2, 'tem': 0.9, 'consis-rate': 1.1, 'use-att': 0, 'num-layers': 3}
mean: 0.6708
[0.672 0.689 0.682 0.691 0.664 0.654 0.672 0.672 0.653 0.659]
cur_param: {'dropout': 0.5649005901703604, 'weight-decay': 0.0031076276391293687, 'lr': 0.0035462179773202564, 'lr-reduce-freq': 90, 'patience': 90, 'spt-alg': 'kruskal', 'manifold': 'PoincareBall', 'dim': 192, 'num-adj': 4, 'add-rate': 0.1, 'tem': 0.7, 'consis-rate': 0.8, 'use-att': 1, 'num-layers': 5}
mean: 0.6757
[0.682 0.677 0.683 0.677 0.676 0.66  0.691 0.674 0.668 0.669]
cur_param: {'dropout': 0.5430154870504261, 'weight-decay': 0.04914514248343993, 'lr': 0.0041847004153965145, 'lr-reduce-freq': 120, 'patience': 120, 'spt-alg': 'kruskal', 'manifold': 'PoincareBall', 'dim': 192, 'num-adj': 6, 'add-rate': 0.30000000000000004, 'tem': 0.8, 'consis-rate': 1.4, 'use-att': 1, 'num-layers': 3}
mean: 0.6751000000000001
[0.671 0.681 0.68  0.674 0.678 0.67  0.672 0.675 0.673 0.677]
cur_param: {'dropout': 0.4662701355828319, 'weight-decay': 0.004594876393539541, 'lr': 0.0018028563575866003, 'lr-reduce-freq': 140, 'patience': 140, 'spt-alg': 'kruskal', 'manifold': 'PoincareBall', 'dim': 128, 'num-adj': 8, 'add-rate': 0.2, 'tem': 0.6, 'consis-rate': 0.9, 'use-att': 1, 'num-layers': 4}
mean: 0.6717000000000001
[0.673 0.666 0.688 0.675 0.655 0.673 0.678 0.67  0.674 0.665]
cur_param: {'dropout': 0.43100628243517874, 'weight-decay': 0.025780389392428316, 'lr': 0.0021565733155757805, 'lr-reduce-freq': 100, 'patience': 100, 'spt-alg': 'kruskal', 'manifold': 'PoincareBall', 'dim': 64, 'num-adj': 2, 'add-rate': 0.1, 'tem': 1.1, 'consis-rate': 1.9000000000000001, 'use-att': 0, 'num-layers': 3}
mean: 0.6679
[0.687 0.67  0.654 0.689 0.655 0.653 0.671 0.671 0.657 0.672]
cur_param: {'dropout': 0.569591853560967, 'weight-decay': 0.01689849378767014, 'lr': 0.002790965204426899, 'lr-reduce-freq': 150, 'patience': 150, 'spt-alg': 'prim', 'manifold': 'Hyperboloid', 'dim': 128, 'num-adj': 4, 'add-rate': 0.30000000000000004, 'tem': 0.5, 'consis-rate': 1.6, 'use-att': 1, 'num-layers': 3}
mean: 0.6716
[0.686 0.672 0.671 0.653 0.682 0.665 0.677 0.666 0.68  0.664]
cur_param: {'dropout': 0.5389612058186618, 'weight-decay': 0.009035002979049392, 'lr': 0.005425348679479874, 'lr-reduce-freq': 80, 'patience': 80, 'spt-alg': 'kruskal', 'manifold': 'PoincareBall', 'dim': 64, 'num-adj': 6, 'add-rate': 0.1, 'tem': 0.7, 'consis-rate': 1.3, 'use-att': 1, 'num-layers': 5}
mean: 0.6727000000000001
[0.673 0.682 0.675 0.69  0.659 0.669 0.683 0.675 0.668 0.653]
cur_param: {'dropout': 0.5997405885879492, 'weight-decay': 0.00650324163569657, 'lr': 0.0008644727150959648, 'lr-reduce-freq': 150, 'patience': 150, 'spt-alg': 'kruskal', 'manifold': 'PoincareBall', 'dim': 256, 'num-adj': 6, 'add-rate': 0.2, 'tem': 0.6, 'consis-rate': 0.6, 'use-att': 1, 'num-layers': 4}
mean: 0.6775
[0.685 0.672 0.685 0.676 0.671 0.675 0.682 0.681 0.664 0.684][32m[I 2022-06-16 14:51:31,615][0m Trial 41 finished with value: 0.6775 and parameters: {'dropout': 0.5997405885879492, 'weight_decay': 0.00650324163569657, 'lr': 0.0008644727150959648, 'patience': 150, 'spt-alg': 'kruskal', 'manifold': 'PoincareBall', 'dim': 256, 'num-adj': 6, 'add-rate': 0.2, 'tem': 0.6, 'consis-rate': 0.6, 'use-att': 1, 'num-layers': 4}. Best is trial 16 with value: 0.6812000000000001.[0m
[32m[I 2022-06-16 14:55:11,052][0m Trial 42 finished with value: 0.6783 and parameters: {'dropout': 0.5506037265058766, 'weight_decay': 0.008321165920504572, 'lr': 0.0005076607228438369, 'patience': 150, 'spt-alg': 'kruskal', 'manifold': 'PoincareBall', 'dim': 192, 'num-adj': 6, 'add-rate': 0.2, 'tem': 0.6, 'consis-rate': 0.7, 'use-att': 1, 'num-layers': 4}. Best is trial 16 with value: 0.6812000000000001.[0m
[32m[I 2022-06-16 14:57:54,844][0m Trial 43 finished with value: 0.6783 and parameters: {'dropout': 0.5799633059061625, 'weight_decay': 0.002169385565362999, 'lr': 0.0012710489126418127, 'patience': 130, 'spt-alg': 'kruskal', 'manifold': 'PoincareBall', 'dim': 256, 'num-adj': 6, 'add-rate': 0.2, 'tem': 0.7, 'consis-rate': 0.7, 'use-att': 1, 'num-layers': 4}. Best is trial 16 with value: 0.6812000000000001.[0m
[32m[I 2022-06-16 15:00:46,074][0m Trial 44 finished with value: 0.6769999999999999 and parameters: {'dropout': 0.5760937160657417, 'weight_decay': 0.0019863159196591294, 'lr': 0.0010414850460435283, 'patience': 130, 'spt-alg': 'kruskal', 'manifold': 'PoincareBall', 'dim': 192, 'num-adj': 6, 'add-rate': 0.4, 'tem': 0.5, 'consis-rate': 0.7, 'use-att': 1, 'num-layers': 4}. Best is trial 16 with value: 0.6812000000000001.[0m
[32m[I 2022-06-16 15:04:31,380][0m Trial 45 finished with value: 0.6747 and parameters: {'dropout': 0.5285476117645852, 'weight_decay': 0.0015501023373661184, 'lr': 0.0005058300940112432, 'patience': 140, 'spt-alg': 'kruskal', 'manifold': 'PoincareBall', 'dim': 192, 'num-adj': 4, 'add-rate': 0.2, 'tem': 0.6, 'consis-rate': 0.5, 'use-att': 1, 'num-layers': 4}. Best is trial 16 with value: 0.6812000000000001.[0m
[32m[I 2022-06-16 15:08:36,263][0m Trial 46 finished with value: 0.6722000000000001 and parameters: {'dropout': 0.5064467888629272, 'weight_decay': 0.002364201164074932, 'lr': 0.0011303520203222507, 'patience': 130, 'spt-alg': 'kruskal', 'manifold': 'Hyperboloid', 'dim': 256, 'num-adj': 6, 'add-rate': 0.30000000000000004, 'tem': 0.7, 'consis-rate': 0.7, 'use-att': 0, 'num-layers': 4}. Best is trial 16 with value: 0.6812000000000001.[0m
[32m[I 2022-06-16 15:11:30,190][0m Trial 47 finished with value: 0.6747000000000001 and parameters: {'dropout': 0.5550330248588484, 'weight_decay': 0.0037273886287723067, 'lr': 0.0014228064458427032, 'patience': 150, 'spt-alg': 'prim', 'manifold': 'PoincareBall', 'dim': 128, 'num-adj': 8, 'add-rate': 0.5, 'tem': 1.2000000000000002, 'consis-rate': 0.8, 'use-att': 1, 'num-layers': 4}. Best is trial 16 with value: 0.6812000000000001.[0m
[32m[I 2022-06-16 15:14:33,890][0m Trial 48 finished with value: 0.6791 and parameters: {'dropout': 0.5841321795264046, 'weight_decay': 0.004847056583753866, 'lr': 0.0006551279673969522, 'patience': 120, 'spt-alg': 'kruskal', 'manifold': 'PoincareBall', 'dim': 256, 'num-adj': 6, 'add-rate': 0.2, 'tem': 0.9, 'consis-rate': 1.1, 'use-att': 1, 'num-layers': 4}. Best is trial 16 with value: 0.6812000000000001.[0m
[32m[I 2022-06-16 15:19:39,954][0m Trial 49 finished with value: 0.6729 and parameters: {'dropout': 0.5801187189065222, 'weight_decay': 0.005755709774292071, 'lr': 0.0006574830529847286, 'patience': 110, 'spt-alg': 'kruskal', 'manifold': 'Hyperboloid', 'dim': 256, 'num-adj': 6, 'add-rate': 0.4, 'tem': 0.9, 'consis-rate': 1.1, 'use-att': 1, 'num-layers': 4}. Best is trial 16 with value: 0.6812000000000001.[0m
[32m[I 2022-06-16 15:22:44,602][0m Trial 50 finished with value: 0.6709 and parameters: {'dropout': 0.40120845443995534, 'weight_decay': 0.0014667134303976317, 'lr': 0.0006141056244197463, 'patience': 120, 'spt-alg': 'kruskal', 'manifold': 'PoincareBall', 'dim': 256, 'num-adj': 2, 'add-rate': 0.6, 'tem': 0.9, 'consis-rate': 1.0, 'use-att': 1, 'num-layers': 4}. Best is trial 16 with value: 0.6812000000000001.[0m
[32m[I 2022-06-16 15:25:51,731][0m Trial 51 finished with value: 0.6784 and parameters: {'dropout': 0.5808381510841422, 'weight_decay': 0.0045601771137897896, 'lr': 0.0009220134882852459, 'patience': 140, 'spt-alg': 'kruskal', 'manifold': 'PoincareBall', 'dim': 256, 'num-adj': 6, 'add-rate': 0.2, 'tem': 0.7, 'consis-rate': 1.2000000000000002, 'use-att': 1, 'num-layers': 4}. Best is trial 16 with value: 0.6812000000000001.[0m
[32m[I 2022-06-16 15:28:49,652][0m Trial 52 finished with value: 0.6809000000000001 and parameters: {'dropout': 0.5825985233347514, 'weight_decay': 0.0032340383642412407, 'lr': 0.0008442827444636766, 'patience': 130, 'spt-alg': 'kruskal', 'manifold': 'PoincareBall', 'dim': 256, 'num-adj': 6, 'add-rate': 0.2, 'tem': 0.8, 'consis-rate': 1.2000000000000002, 'use-att': 1, 'num-layers': 4}. Best is trial 16 with value: 0.6812000000000001.[0m
[32m[I 2022-06-16 15:31:53,220][0m Trial 53 finished with value: 0.6784000000000001 and parameters: {'dropout': 0.5829190857492011, 'weight_decay': 0.0047672701669143145, 'lr': 0.0009540020123205163, 'patience': 140, 'spt-alg': 'kruskal', 'manifold': 'PoincareBall', 'dim': 256, 'num-adj': 6, 'add-rate': 0.2, 'tem': 0.9, 'consis-rate': 1.2000000000000002, 'use-att': 1, 'num-layers': 4}. Best is trial 16 with value: 0.6812000000000001.[0m
[32m[I 2022-06-16 15:34:54,149][0m Trial 54 finished with value: 0.6812 and parameters: {'dropout': 0.5603565596845272, 'weight_decay': 0.003061447064208701, 'lr': 0.0007581060523657117, 'patience': 130, 'spt-alg': 'kruskal', 'manifold': 'PoincareBall', 'dim': 256, 'num-adj': 4, 'add-rate': 0.30000000000000004, 'tem': 1.0, 'consis-rate': 1.1, 'use-att': 1, 'num-layers': 4}. Best is trial 16 with value: 0.6812000000000001.[0m
[32m[I 2022-06-16 15:37:57,895][0m Trial 55 finished with value: 0.677 and parameters: {'dropout': 0.5300599349875591, 'weight_decay': 0.00320614185132382, 'lr': 0.0007131530277453826, 'patience': 120, 'spt-alg': 'kruskal', 'manifold': 'PoincareBall', 'dim': 256, 'num-adj': 4, 'add-rate': 0.30000000000000004, 'tem': 1.0, 'consis-rate': 1.3, 'use-att': 1, 'num-layers': 4}. Best is trial 16 with value: 0.6812000000000001.[0m
[32m[I 2022-06-16 15:41:23,654][0m Trial 56 finished with value: 0.6782 and parameters: {'dropout': 0.5603928276137853, 'weight_decay': 0.002500776723175966, 'lr': 0.0005843807499378704, 'patience': 130, 'spt-alg': 'kruskal', 'manifold': 'PoincareBall', 'dim': 256, 'num-adj': 4, 'add-rate': 0.30000000000000004, 'tem': 1.1, 'consis-rate': 1.4, 'use-att': 1, 'num-layers': 4}. Best is trial 16 with value: 0.6812000000000001.[0m
[32m[I 2022-06-16 15:46:16,522][0m Trial 57 finished with value: 0.6667000000000001 and parameters: {'dropout': 0.3717843046019164, 'weight_decay': 0.005967832283605759, 'lr': 0.0008004918672993673, 'patience': 110, 'spt-alg': 'kruskal', 'manifold': 'Hyperboloid', 'dim': 128, 'num-adj': 4, 'add-rate': 0.30000000000000004, 'tem': 1.0, 'consis-rate': 1.1, 'use-att': 0, 'num-layers': 4}. Best is trial 16 with value: 0.6812000000000001.[0m
[32m[I 2022-06-16 15:48:33,406][0m Trial 58 finished with value: 0.674 and parameters: {'dropout': 0.4949758474743636, 'weight_decay': 0.0038299409537951804, 'lr': 0.0032727653913265566, 'patience': 130, 'spt-alg': 'prim', 'manifold': 'PoincareBall', 'dim': 256, 'num-adj': 4, 'add-rate': 0.2, 'tem': 0.9, 'consis-rate': 1.0, 'use-att': 1, 'num-layers': 5}. Best is trial 16 with value: 0.6812000000000001.[0m
[32m[I 2022-06-16 15:52:12,516][0m Trial 59 finished with value: 0.6775 and parameters: {'dropout': 0.5999624108257808, 'weight_decay': 0.003214195925816793, 'lr': 0.0008083978068214835, 'patience': 120, 'spt-alg': 'kruskal', 'manifold': 'PoincareBall', 'dim': 128, 'num-adj': 4, 'add-rate': 0.1, 'tem': 0.8, 'consis-rate': 1.1, 'use-att': 1, 'num-layers': 4}. Best is trial 16 with value: 0.6812000000000001.[0m
[32m[I 2022-06-16 15:54:42,584][0m Trial 60 finished with value: 0.6747 and parameters: {'dropout': 0.5403610928833877, 'weight_decay': 0.00432156443936697, 'lr': 0.002562040424017636, 'patience': 130, 'spt-alg': 'kruskal', 'manifold': 'PoincareBall', 'dim': 256, 'num-adj': 8, 'add-rate': 0.2, 'tem': 1.2000000000000002, 'consis-rate': 1.2000000000000002, 'use-att': 1, 'num-layers': 4}. Best is trial 16 with value: 0.6812000000000001.[0m
