[32m[I 2022-06-16 19:14:31,016][0m Trial 124 finished with value: 0.6801 and parameters: {'dropout': 0.5322445575633774, 'weight_decay': 0.0038062587874328185, 'lr': 0.000923910084601629, 'patience': 140, 'spt-alg': 'kruskal', 'manifold': 'PoincareBall', 'dim': 256, 'num-adj': 8, 'add-rate': 0.30000000000000004, 'tem': 1.1, 'consis-rate': 1.8, 'use-att': 1, 'num-layers': 3}. Best is trial 115 with value: 0.6829000000000001.[0m

mean: 0.6795
[0.681 0.674 0.695 0.678 0.677 0.676 0.686 0.677 0.668 0.683]
cur_param: {'dropout': 0.5815405700015285, 'weight-decay': 0.0025605897086627767, 'lr': 0.0014107959399156601, 'lr-reduce-freq': 120, 'patience': 120, 'spt-alg': 'kruskal', 'manifold': 'PoincareBall', 'dim': 256, 'num-adj': 8, 'add-rate': 0.2, 'tem': 1.3, 'consis-rate': 2.0, 'use-att': 1, 'num-layers': 3}
mean: 0.6776
[0.673 0.658 0.678 0.677 0.674 0.68  0.693 0.689 0.677 0.677]
cur_param: {'dropout': 0.5286603615782033, 'weight-decay': 0.0030269793478487077, 'lr': 0.0007675289479255003, 'lr-reduce-freq': 100, 'patience': 100, 'spt-alg': 'kruskal', 'manifold': 'PoincareBall', 'dim': 256, 'num-adj': 8, 'add-rate': 0.1, 'tem': 0.9, 'consis-rate': 1.6, 'use-att': 1, 'num-layers': 4}
mean: 0.6806
[0.682 0.677 0.686 0.672 0.67  0.698 0.685 0.681 0.683 0.672]
cur_param: {'dropout': 0.528344625353223, 'weight-decay': 0.0030241523222726396, 'lr': 0.0007595078781101027, 'lr-reduce-freq': 100, 'patience': 100, 'spt-alg': 'kruskal', 'manifold': 'PoincareBall', 'dim': 256, 'num-adj': 6, 'add-rate': 0.1, 'tem': 0.9, 'consis-rate': 1.3, 'use-att': 1, 'num-layers': 4}
mean: 0.6793000000000001
[0.68  0.674 0.686 0.675 0.671 0.698 0.684 0.679 0.672 0.674]
cur_param: {'dropout': 0.5518253565751273, 'weight-decay': 0.0039037961394831127, 'lr': 0.0008571031998931653, 'lr-reduce-freq': 100, 'patience': 100, 'spt-alg': 'kruskal', 'manifold': 'PoincareBall', 'dim': 256, 'num-adj': 8, 'add-rate': 0.2, 'tem': 0.8, 'consis-rate': 0.9, 'use-att': 1, 'num-layers': 5}
mean: 0.6804
[0.686 0.674 0.69  0.674 0.668 0.697 0.679 0.676 0.684 0.676]
cur_param: {'dropout': 0.5992157243906804, 'weight-decay': 0.001741461565811619, 'lr': 0.0008190306827501059, 'lr-reduce-freq': 110, 'patience': 110, 'spt-alg': 'kruskal', 'manifold': 'PoincareBall', 'dim': 64, 'num-adj': 6, 'add-rate': 0.5, 'tem': 0.9, 'consis-rate': 1.1, 'use-att': 1, 'num-layers': 4}
mean: 0.6713000000000001
[0.688 0.684 0.662 0.687 0.639 0.666 0.666 0.671 0.665 0.685]
cur_param: {'dropout': 0.5429408410507885, 'weight-decay': 0.0016427298011867507, 'lr': 0.0009955524593426458, 'lr-reduce-freq': 90, 'patience': 90, 'spt-alg': 'kruskal', 'manifold': 'Hyperboloid', 'dim': 256, 'num-adj': 6, 'add-rate': 0.1, 'tem': 0.8, 'consis-rate': 1.0, 'use-att': 1, 'num-layers': 4}
mean: 0.6748000000000001
[0.675 0.677 0.678 0.684 0.671 0.674 0.682 0.67  0.665 0.672]
cur_param: {'dropout': 0.5867247085559403, 'weight-decay': 0.002066954726690985, 'lr': 0.0018478989536136103, 'lr-reduce-freq': 130, 'patience': 130, 'spt-alg': 'kruskal', 'manifold': 'PoincareBall', 'dim': 256, 'num-adj': 8, 'add-rate': 0.1, 'tem': 1.3, 'consis-rate': 1.6, 'use-att': 1, 'num-layers': 4}
mean: 0.6799999999999999
[0.684 0.663 0.695 0.68  0.683 0.677 0.692 0.682 0.676 0.668]
cur_param: {'dropout': 0.41172578072006677, 'weight-decay': 0.002609745567783193, 'lr': 0.0020904745132166794, 'lr-reduce-freq': 90, 'patience': 90, 'spt-alg': 'kruskal', 'manifold': 'PoincareBall', 'dim': 256, 'num-adj': 8, 'add-rate': 0.1, 'tem': 0.9, 'consis-rate': 1.1, 'use-att': 1, 'num-layers': 4}
mean: 0.6759999999999999
[0.681 0.671 0.682 0.678 0.67  0.685 0.677 0.672 0.675 0.669]
cur_param: {'dropout': 0.5683462529612217, 'weight-decay': 0.0022397106181270966, 'lr': 0.0010906930568602418, 'lr-reduce-freq': 100, 'patience': 100, 'spt-alg': 'kruskal', 'manifold': 'PoincareBall', 'dim': 256, 'num-adj': 8, 'add-rate': 0.1, 'tem': 1.2000000000000002, 'consis-rate': 1.7000000000000002, 'use-att': 1, 'num-layers': 3}
mean: 0.6786
[0.686 0.668 0.679 0.679 0.675 0.694 0.682 0.68  0.67  0.673]
cur_param: {'dropout': 0.5771129100407901, 'weight-decay': 0.0029339849330375363, 'lr': 0.0007103066439260588, 'lr-reduce-freq': 140, 'patience': 140, 'spt-alg': 'kruskal', 'manifold': 'PoincareBall', 'dim': 256, 'num-adj': 8, 'add-rate': 0.1, 'tem': 1.2000000000000002, 'consis-rate': 1.9000000000000001, 'use-att': 1, 'num-layers': 3}
mean: 0.6811
[0.682 0.671 0.676 0.676 0.677 0.674 0.689 0.686 0.686 0.694]
cur_param: {'dropout': 0.5777789502632026, 'weight-decay': 0.003704308448339366, 'lr': 0.0007352172206044276, 'lr-reduce-freq': 140, 'patience': 140, 'spt-alg': 'kruskal', 'manifold': 'PoincareBall', 'dim': 256, 'num-adj': 8, 'add-rate': 0.4, 'tem': 1.1, 'consis-rate': 1.9000000000000001, 'use-att': 1, 'num-layers': 3}
mean: 0.6829000000000001
[0.681 0.67  0.685 0.682 0.681 0.676 0.691 0.685 0.685 0.693]
cur_param: {'dropout': 0.5788777029141033, 'weight-decay': 0.003345530848169214, 'lr': 0.0007420544618193936, 'lr-reduce-freq': 140, 'patience': 140, 'spt-alg': 'kruskal', 'manifold': 'PoincareBall', 'dim': 256, 'num-adj': 8, 'add-rate': 0.4, 'tem': 1.1, 'consis-rate': 1.9000000000000001, 'use-att': 1, 'num-layers': 3}
mean: 0.6816000000000001
[0.678 0.67  0.677 0.684 0.683 0.672 0.69  0.687 0.682 0.693]
cur_param: {'dropout': 0.5783148125223617, 'weight-decay': 0.004460505136661477, 'lr': 0.0007204201291326909, 'lr-reduce-freq': 140, 'patience': 140, 'spt-alg': 'kruskal', 'manifold': 'PoincareBall', 'dim': 256, 'num-adj': 8, 'add-rate': 0.4, 'tem': 1.1, 'consis-rate': 1.9000000000000001, 'use-att': 1, 'num-layers': 3}
mean: 0.6805
[0.678 0.67  0.677 0.674 0.68  0.673 0.689 0.686 0.684 0.694]
cur_param: {'dropout': 0.5549622369133357, 'weight-decay': 0.004243413544793281, 'lr': 0.0006058098279756552, 'lr-reduce-freq': 140, 'patience': 140, 'spt-alg': 'kruskal', 'manifold': 'PoincareBall', 'dim': 256, 'num-adj': 8, 'add-rate': 0.4, 'tem': 1.1, 'consis-rate': 2.0, 'use-att': 1, 'num-layers': 3}
mean: 0.6774000000000001
[0.671 0.672 0.68  0.681 0.662 0.678 0.687 0.682 0.674 0.687]
cur_param: {'dropout': 0.580831173828937, 'weight-decay': 0.0035675984225364233, 'lr': 0.00070378297574735, 'lr-reduce-freq': 150, 'patience': 150, 'spt-alg': 'prim', 'manifold': 'PoincareBall', 'dim': 256, 'num-adj': 8, 'add-rate': 0.4, 'tem': 1.1, 'consis-rate': 1.9000000000000001, 'use-att': 0, 'num-layers': 3}
mean: 0.6799999999999999
[0.677 0.675 0.673 0.683 0.675 0.672 0.689 0.683 0.685 0.688]
cur_param: {'dropout': 0.5998651517091343, 'weight-decay': 0.0032678193245075306, 'lr': 0.0005582653958475164, 'lr-reduce-freq': 140, 'patience': 140, 'spt-alg': 'kruskal', 'manifold': 'PoincareBall', 'dim': 256, 'num-adj': 2, 'add-rate': 0.6, 'tem': 1.0, 'consis-rate': 2.0, 'use-att': 1, 'num-layers': 3}
mean: 0.6764000000000001
[0.673 0.671 0.683 0.679 0.663 0.678 0.69  0.68  0.673 0.674]
cur_param: {'dropout': 0.5718714989479712, 'weight-decay': 0.002955603741039474, 'lr': 0.0006401504920338242, 'lr-reduce-freq': 150, 'patience': 150, 'spt-alg': 'kruskal', 'manifold': 'PoincareBall', 'dim': 256, 'num-adj': 8, 'add-rate': 0.5, 'tem': 1.1, 'consis-rate': 1.9000000000000001, 'use-att': 1, 'num-layers': 3}
mean: 0.6778000000000001
[0.674 0.672 0.681 0.672 0.674 0.674 0.688 0.681 0.673 0.689]
cur_param: {'dropout': 0.5447990344854596, 'weight-decay': 0.0027870920317611745, 'lr': 0.0007818844448337528, 'lr-reduce-freq': 140, 'patience': 140, 'spt-alg': 'kruskal', 'manifold': 'PoincareBall', 'dim': 256, 'num-adj': 8, 'add-rate': 0.4, 'tem': 1.0, 'consis-rate': 1.9000000000000001, 'use-att': 1, 'num-layers': 3}
mean: 0.6766
[0.676 0.678 0.686 0.666 0.67  0.682 0.675 0.677 0.683 0.673]
cur_param: {'dropout': 0.5634763802748565, 'weight-decay': 0.0030977439275512134, 'lr': 0.004472358532339596, 'lr-reduce-freq': 140, 'patience': 140, 'spt-alg': 'kruskal', 'manifold': 'PoincareBall', 'dim': 256, 'num-adj': 8, 'add-rate': 0.4, 'tem': 1.2000000000000002, 'consis-rate': 1.8, 'use-att': 1, 'num-layers': 3}
mean: 0.675
[0.671 0.683 0.671 0.69  0.678 0.667 0.675 0.68  0.682 0.653]
cur_param: {'dropout': 0.5322445575633774, 'weight-decay': 0.0038062587874328185, 'lr': 0.000923910084601629, 'lr-reduce-freq': 140, 'patience': 140, 'spt-alg': 'kruskal', 'manifold': 'PoincareBall', 'dim': 256, 'num-adj': 8, 'add-rate': 0.30000000000000004, 'tem': 1.1, 'consis-rate': 1.8, 'use-att': 1, 'num-layers': 3}
mean: 0.6801
[0.686 0.679 0.686 0.682 0.668 0.696 0.676 0.678 0.678 0.672]
cur_param: {'dropout': 0.5914598423405623, 'weight-decay': 0.006061618964215826, 'lr': 0.000859526456349572, 'lr-reduce-freq': 130, 'patience': 130, 'spt-alg': 'kruskal', 'manifold': 'PoincareBall', 'dim': 256, 'num-adj': 6, 'add-rate': 0.4, 'tem': 1.2000000000000002, 'consis-rate': 1.9000000000000001, 'use-att': 1, 'num-layers': 3}[32m[I 2022-06-16 19:17:50,321][0m Trial 125 finished with value: 0.6791 and parameters: {'dropout': 0.5914598423405623, 'weight_decay': 0.006061618964215826, 'lr': 0.000859526456349572, 'patience': 130, 'spt-alg': 'kruskal', 'manifold': 'PoincareBall', 'dim': 256, 'num-adj': 6, 'add-rate': 0.4, 'tem': 1.2000000000000002, 'consis-rate': 1.9000000000000001, 'use-att': 1, 'num-layers': 3}. Best is trial 115 with value: 0.6829000000000001.[0m
[32m[I 2022-06-16 19:21:10,969][0m Trial 126 finished with value: 0.6815 and parameters: {'dropout': 0.5830312095724914, 'weight_decay': 0.0048735625910889075, 'lr': 0.0007218114056165357, 'patience': 130, 'spt-alg': 'kruskal', 'manifold': 'PoincareBall', 'dim': 256, 'num-adj': 6, 'add-rate': 0.30000000000000004, 'tem': 1.1, 'consis-rate': 1.2000000000000002, 'use-att': 1, 'num-layers': 3}. Best is trial 115 with value: 0.6829000000000001.[0m
[32m[I 2022-06-16 19:23:50,953][0m Trial 127 finished with value: 0.6754 and parameters: {'dropout': 0.5824877493860673, 'weight_decay': 0.005613816458714888, 'lr': 0.0037192324294944993, 'patience': 130, 'spt-alg': 'kruskal', 'manifold': 'PoincareBall', 'dim': 256, 'num-adj': 6, 'add-rate': 0.30000000000000004, 'tem': 1.1, 'consis-rate': 1.2000000000000002, 'use-att': 1, 'num-layers': 3}. Best is trial 115 with value: 0.6829000000000001.[0m
[32m[I 2022-06-16 19:27:21,401][0m Trial 128 finished with value: 0.6792 and parameters: {'dropout': 0.5711702595465368, 'weight_decay': 0.004761557047285592, 'lr': 0.0006976315343248055, 'patience': 140, 'spt-alg': 'kruskal', 'manifold': 'PoincareBall', 'dim': 256, 'num-adj': 6, 'add-rate': 0.30000000000000004, 'tem': 1.1, 'consis-rate': 1.2000000000000002, 'use-att': 1, 'num-layers': 3}. Best is trial 115 with value: 0.6829000000000001.[0m
[32m[I 2022-06-16 19:33:10,241][0m Trial 129 finished with value: 0.6725000000000001 and parameters: {'dropout': 0.5558814977748875, 'weight_decay': 0.004178439377255795, 'lr': 0.0008197494699407974, 'patience': 140, 'spt-alg': 'kruskal', 'manifold': 'Hyperboloid', 'dim': 256, 'num-adj': 8, 'add-rate': 0.5, 'tem': 1.0, 'consis-rate': 2.0, 'use-att': 1, 'num-layers': 3}. Best is trial 115 with value: 0.6829000000000001.[0m
[32m[I 2022-06-16 19:36:46,667][0m Trial 130 finished with value: 0.6677000000000001 and parameters: {'dropout': 0.2873174854845062, 'weight_decay': 0.007019570576499496, 'lr': 0.0005332976816022138, 'patience': 130, 'spt-alg': 'kruskal', 'manifold': 'PoincareBall', 'dim': 256, 'num-adj': 4, 'add-rate': 0.30000000000000004, 'tem': 1.2000000000000002, 'consis-rate': 1.3, 'use-att': 1, 'num-layers': 3}. Best is trial 115 with value: 0.6829000000000001.[0m
[32m[I 2022-06-16 19:40:02,591][0m Trial 131 finished with value: 0.6799 and parameters: {'dropout': 0.5882931036223487, 'weight_decay': 0.003650422836689077, 'lr': 0.0007499914228865789, 'patience': 130, 'spt-alg': 'kruskal', 'manifold': 'PoincareBall', 'dim': 256, 'num-adj': 6, 'add-rate': 0.2, 'tem': 1.1, 'consis-rate': 1.1, 'use-att': 1, 'num-layers': 3}. Best is trial 115 with value: 0.6829000000000001.[0m
[32m[I 2022-06-16 19:42:49,113][0m Trial 132 finished with value: 0.6780999999999999 and parameters: {'dropout': 0.5764301277577696, 'weight_decay': 0.003384956590866602, 'lr': 0.0023648146447075315, 'patience': 130, 'spt-alg': 'kruskal', 'manifold': 'PoincareBall', 'dim': 256, 'num-adj': 6, 'add-rate': 0.4, 'tem': 0.7, 'consis-rate': 1.2000000000000002, 'use-att': 1, 'num-layers': 3}. Best is trial 115 with value: 0.6829000000000001.[0m
[32m[I 2022-06-16 19:46:20,873][0m Trial 133 finished with value: 0.6794 and parameters: {'dropout': 0.5639462225088904, 'weight_decay': 0.001911214318321252, 'lr': 0.000667303537281879, 'patience': 140, 'spt-alg': 'kruskal', 'manifold': 'PoincareBall', 'dim': 256, 'num-adj': 8, 'add-rate': 0.1, 'tem': 1.0, 'consis-rate': 1.7000000000000002, 'use-att': 1, 'num-layers': 3}. Best is trial 115 with value: 0.6829000000000001.[0m
[32m[I 2022-06-16 19:49:39,086][0m Trial 134 finished with value: 0.6791 and parameters: {'dropout': 0.5908407511683818, 'weight_decay': 0.005153703098745251, 'lr': 0.0009010250619394948, 'patience': 130, 'spt-alg': 'kruskal', 'manifold': 'PoincareBall', 'dim': 256, 'num-adj': 6, 'add-rate': 0.2, 'tem': 0.8, 'consis-rate': 1.1, 'use-att': 1, 'num-layers': 3}. Best is trial 115 with value: 0.6829000000000001.[0m
[32m[I 2022-06-16 19:52:22,683][0m Trial 135 finished with value: 0.6744 and parameters: {'dropout': 0.37334332325733266, 'weight_decay': 0.0025965194102003644, 'lr': 0.0026991943019488806, 'patience': 150, 'spt-alg': 'kruskal', 'manifold': 'PoincareBall', 'dim': 256, 'num-adj': 8, 'add-rate': 0.1, 'tem': 1.2000000000000002, 'consis-rate': 1.8, 'use-att': 1, 'num-layers': 5}. Best is trial 115 with value: 0.6829000000000001.[0m
[32m[I 2022-06-16 19:55:46,741][0m Trial 136 finished with value: 0.6785000000000001 and parameters: {'dropout': 0.5505054642276448, 'weight_decay': 0.0030269224106004027, 'lr': 0.0007445722099828874, 'patience': 140, 'spt-alg': 'kruskal', 'manifold': 'PoincareBall', 'dim': 256, 'num-adj': 8, 'add-rate': 0.1, 'tem': 1.1, 'consis-rate': 1.8, 'use-att': 1, 'num-layers': 3}. Best is trial 115 with value: 0.6829000000000001.[0m
[32m[I 2022-06-16 19:59:02,477][0m Trial 137 finished with value: 0.6802 and parameters: {'dropout': 0.5406619047725546, 'weight_decay': 0.004466424435868464, 'lr': 0.0007957341064351497, 'patience': 130, 'spt-alg': 'kruskal', 'manifold': 'PoincareBall', 'dim': 256, 'num-adj': 8, 'add-rate': 0.7, 'tem': 1.0, 'consis-rate': 1.9000000000000001, 'use-att': 1, 'num-layers': 4}. Best is trial 115 with value: 0.6829000000000001.[0m
[32m[I 2022-06-16 20:02:36,427][0m Trial 138 finished with value: 0.6777000000000001 and parameters: {'dropout': 0.5717503031372169, 'weight_decay': 0.004019151914553885, 'lr': 0.0006167651903893601, 'patience': 140, 'spt-alg': 'kruskal', 'manifold': 'PoincareBall', 'dim': 256, 'num-adj': 8, 'add-rate': 0.1, 'tem': 1.5, 'consis-rate': 1.8, 'use-att': 1, 'num-layers': 3}. Best is trial 115 with value: 0.6829000000000001.[0m
[32m[I 2022-06-16 20:05:57,525][0m Trial 139 finished with value: 0.6796999999999999 and parameters: {'dropout': 0.5614642247870065, 'weight_decay': 0.001572118381463496, 'lr': 0.0006655496257232927, 'patience': 120, 'spt-alg': 'kruskal', 'manifold': 'PoincareBall', 'dim': 256, 'num-adj': 8, 'add-rate': 0.1, 'tem': 1.2000000000000002, 'consis-rate': 1.7000000000000002, 'use-att': 1, 'num-layers': 4}. Best is trial 115 with value: 0.6829000000000001.[0m
[32m[I 2022-06-16 20:10:53,261][0m Trial 140 finished with value: 0.6753 and parameters: {'dropout': 0.5814408804630441, 'weight_decay': 0.0037140784131810736, 'lr': 0.0009627362669870028, 'patience': 130, 'spt-alg': 'prim', 'manifold': 'Hyperboloid', 'dim': 256, 'num-adj': 6, 'add-rate': 0.30000000000000004, 'tem': 1.1, 'consis-rate': 1.2000000000000002, 'use-att': 0, 'num-layers': 3}. Best is trial 115 with value: 0.6829000000000001.[0m
[32m[I 2022-06-16 20:14:14,026][0m Trial 141 finished with value: 0.681 and parameters: {'dropout': 0.5926104298755368, 'weight_decay': 0.00332461636744191, 'lr': 0.0008257565336321201, 'patience': 130, 'spt-alg': 'kruskal', 'manifold': 'PoincareBall', 'dim': 256, 'num-adj': 6, 'add-rate': 0.4, 'tem': 0.9, 'consis-rate': 1.1, 'use-att': 1, 'num-layers': 4}. Best is trial 115 with value: 0.6829000000000001.[0m
[32m[I 2022-06-16 20:17:27,192][0m Trial 142 finished with value: 0.6803000000000001 and parameters: {'dropout': 0.5849437202595859, 'weight_decay': 0.0024139691688449885, 'lr': 0.0007793508999663362, 'patience': 130, 'spt-alg': 'kruskal', 'manifold': 'PoincareBall', 'dim': 256, 'num-adj': 6, 'add-rate': 0.4, 'tem': 0.9, 'consis-rate': 1.0, 'use-att': 1, 'num-layers': 4}. Best is trial 115 with value: 0.6829000000000001.[0m
[32m[I 2022-06-16 20:20:04,172][0m Trial 143 finished with value: 0.6762 and parameters: {'dropout': 0.5940370591449169, 'weight_decay': 0.003393870102804288, 'lr': 0.002958302010463511, 'patience': 130, 'spt-alg': 'kruskal', 'manifold': 'PoincareBall', 'dim': 256, 'num-adj': 6, 'add-rate': 0.4, 'tem': 0.8, 'consis-rate': 1.1, 'use-att': 1, 'num-layers': 4}. Best is trial 115 with value: 0.6829000000000001.[0m
[32m[I 2022-06-16 20:23:11,373][0m Trial 144 finished with value: 0.6799000000000001 and parameters: {'dropout': 0.5702422545197663, 'weight_decay': 0.0028730531749936194, 'lr': 0.000710971002168173, 'patience': 100, 'spt-alg': 'kruskal', 'manifold': 'PoincareBall', 'dim': 256, 'num-adj': 8, 'add-rate': 0.4, 'tem': 0.9, 'consis-rate': 1.2000000000000002, 'use-att': 1, 'num-layers': 4}. Best is trial 115 with value: 0.6829000000000001.[0m
