nohup: ignoring input
[32m[I 2022-06-16 13:01:23,241][0m A new study created in memory with name: no-name-e286436f-5ae4-4b05-9291-10d3ef0beec6[0m
[32m[I 2022-06-16 13:04:01,871][0m Trial 0 finished with value: 0.6680000000000001 and parameters: {'dropout': 0.2820590345615631, 'weight_decay': 0.000988170185346114, 'lr': 0.0015247592618764846, 'patience': 120, 'spt-alg': 'prim', 'manifold': 'PoincareBall', 'dim': 192, 'num-adj': 2, 'add-rate': 0.30000000000000004, 'tem': 1.3, 'consis-rate': 1.1, 'use-att': 1, 'num-layers': 3}. Best is trial 0 with value: 0.6680000000000001.[0m
[32m[I 2022-06-16 13:07:02,755][0m Trial 1 finished with value: 0.6656000000000001 and parameters: {'dropout': 0.2365460605109096, 'weight_decay': 0.00224845750319129, 'lr': 0.0011318674156080256, 'patience': 150, 'spt-alg': 'kruskal', 'manifold': 'PoincareBall', 'dim': 192, 'num-adj': 2, 'add-rate': 0.5, 'tem': 1.2000000000000002, 'consis-rate': 0.8, 'use-att': 0, 'num-layers': 4}. Best is trial 0 with value: 0.6680000000000001.[0m
[32m[I 2022-06-16 13:09:16,640][0m Trial 2 finished with value: 0.6724 and parameters: {'dropout': 0.34827597829935686, 'weight_decay': 0.024398900707845252, 'lr': 0.0022847711059292494, 'patience': 60, 'spt-alg': 'kruskal', 'manifold': 'Hyperboloid', 'dim': 256, 'num-adj': 8, 'add-rate': 0.30000000000000004, 'tem': 1.5, 'consis-rate': 0.8, 'use-att': 1, 'num-layers': 3}. Best is trial 2 with value: 0.6724.[0m
[32m[I 2022-06-16 13:15:13,001][0m Trial 3 finished with value: 0.6675000000000001 and parameters: {'dropout': 0.4462234885551663, 'weight_decay': 0.03936665016041828, 'lr': 0.0007107873995644292, 'patience': 90, 'spt-alg': 'kruskal', 'manifold': 'Hyperboloid', 'dim': 64, 'num-adj': 2, 'add-rate': 0.5, 'tem': 1.3, 'consis-rate': 1.8, 'use-att': 0, 'num-layers': 3}. Best is trial 2 with value: 0.6724.[0m
[32m[I 2022-06-16 13:17:14,152][0m Trial 4 finished with value: 0.6703 and parameters: {'dropout': 0.4277954704413841, 'weight_decay': 0.003925067983106617, 'lr': 0.0026156366425723024, 'patience': 100, 'spt-alg': 'kruskal', 'manifold': 'PoincareBall', 'dim': 192, 'num-adj': 4, 'add-rate': 0.1, 'tem': 0.7, 'consis-rate': 1.5, 'use-att': 1, 'num-layers': 5}. Best is trial 2 with value: 0.6724.[0m
[32m[I 2022-06-16 13:21:46,080][0m Trial 5 finished with value: 0.6700999999999999 and parameters: {'dropout': 0.395101474041489, 'weight_decay': 0.0015502805619446761, 'lr': 0.0007252015191860624, 'patience': 90, 'spt-alg': 'kruskal', 'manifold': 'Hyperboloid', 'dim': 128, 'num-adj': 8, 'add-rate': 0.4, 'tem': 1.1, 'consis-rate': 1.3, 'use-att': 1, 'num-layers': 3}. Best is trial 2 with value: 0.6724.[0m
[32m[I 2022-06-16 13:24:57,136][0m Trial 6 finished with value: 0.6673 and parameters: {'dropout': 0.5515663721271571, 'weight_decay': 0.0323404862516471, 'lr': 0.008843081087054358, 'patience': 150, 'spt-alg': 'prim', 'manifold': 'Hyperboloid', 'dim': 64, 'num-adj': 4, 'add-rate': 0.7, 'tem': 0.6, 'consis-rate': 1.4, 'use-att': 1, 'num-layers': 3}. Best is trial 2 with value: 0.6724.[0m
[32m[I 2022-06-16 13:29:45,503][0m Trial 7 finished with value: 0.6715000000000002 and parameters: {'dropout': 0.5304841182983613, 'weight_decay': 0.0018602331580202345, 'lr': 0.0012708515892432503, 'patience': 110, 'spt-alg': 'prim', 'manifold': 'Hyperboloid', 'dim': 64, 'num-adj': 2, 'add-rate': 0.5, 'tem': 0.9, 'consis-rate': 0.7, 'use-att': 0, 'num-layers': 3}. Best is trial 2 with value: 0.6724.[0m
[32m[I 2022-06-16 13:32:49,823][0m Trial 8 finished with value: 0.6722 and parameters: {'dropout': 0.5845333536365542, 'weight_decay': 0.02058230772244425, 'lr': 0.0008186206465065135, 'patience': 70, 'spt-alg': 'kruskal', 'manifold': 'PoincareBall', 'dim': 64, 'num-adj': 2, 'add-rate': 0.1, 'tem': 0.7, 'consis-rate': 1.5, 'use-att': 1, 'num-layers': 3}. Best is trial 2 with value: 0.6724.[0m
[32m[I 2022-06-16 13:36:04,436][0m Trial 9 finished with value: 0.6701 and parameters: {'dropout': 0.4911204647194248, 'weight_decay': 0.002352552364279496, 'lr': 0.0007244768422800734, 'patience': 80, 'spt-alg': 'prim', 'manifold': 'PoincareBall', 'dim': 64, 'num-adj': 6, 'add-rate': 0.4, 'tem': 1.3, 'consis-rate': 1.5, 'use-att': 0, 'num-layers': 5}. Best is trial 2 with value: 0.6724.[0m
[32m[I 2022-06-16 13:38:05,132][0m Trial 10 finished with value: 0.6706000000000001 and parameters: {'dropout': 0.3356819865348783, 'weight_decay': 0.011777485481633635, 'lr': 0.003548392857327624, 'patience': 50, 'spt-alg': 'kruskal', 'manifold': 'Hyperboloid', 'dim': 256, 'num-adj': 8, 'add-rate': 0.2, 'tem': 1.5, 'consis-rate': 0.5, 'use-att': 1, 'num-layers': 4}. Best is trial 2 with value: 0.6724.[0m
[32m[I 2022-06-16 13:39:36,878][0m Trial 11 finished with value: 0.6778 and parameters: {'dropout': 0.596834946644124, 'weight_decay': 0.013326996199259755, 'lr': 0.004201345785347518, 'patience': 50, 'spt-alg': 'kruskal', 'manifold': 'PoincareBall', 'dim': 256, 'num-adj': 6, 'add-rate': 0.1, 'tem': 0.8, 'consis-rate': 1.9000000000000001, 'use-att': 1, 'num-layers': 3}. Best is trial 11 with value: 0.6778.[0m
[32m[I 2022-06-16 13:41:05,206][0m Trial 12 finished with value: 0.6718 and parameters: {'dropout': 0.34816320354027963, 'weight_decay': 0.009499682450327422, 'lr': 0.004908707548372992, 'patience': 50, 'spt-alg': 'kruskal', 'manifold': 'PoincareBall', 'dim': 256, 'num-adj': 6, 'add-rate': 0.2, 'tem': 0.9, 'consis-rate': 2.0, 'use-att': 1, 'num-layers': 3}. Best is trial 11 with value: 0.6778.[0m
[32m[I 2022-06-16 13:43:04,312][0m Trial 13 finished with value: 0.6667 and parameters: {'dropout': 0.35244372064721113, 'weight_decay': 0.010114679602999213, 'lr': 0.006266707853584117, 'patience': 60, 'spt-alg': 'kruskal', 'manifold': 'Hyperboloid', 'dim': 256, 'num-adj': 8, 'add-rate': 0.2, 'tem': 1.5, 'consis-rate': 1.0, 'use-att': 1, 'num-layers': 5}. Best is trial 11 with value: 0.6778.[0m
[32m[I 2022-06-16 13:45:30,779][0m Trial 14 finished with value: 0.6655 and parameters: {'dropout': 0.212206025582145, 'weight_decay': 0.018604406456230387, 'lr': 0.002187093928604936, 'patience': 70, 'spt-alg': 'kruskal', 'manifold': 'Hyperboloid', 'dim': 256, 'num-adj': 6, 'add-rate': 0.30000000000000004, 'tem': 0.5, 'consis-rate': 1.8, 'use-att': 1, 'num-layers': 3}. Best is trial 11 with value: 0.6778.[0m
[32m[I 2022-06-16 13:47:04,719][0m Trial 15 finished with value: 0.675 and parameters: {'dropout': 0.48114835341514284, 'weight_decay': 0.005439380831451517, 'lr': 0.0035772092415139248, 'patience': 50, 'spt-alg': 'kruskal', 'manifold': 'PoincareBall', 'dim': 128, 'num-adj': 8, 'add-rate': 0.1, 'tem': 0.9, 'consis-rate': 1.0, 'use-att': 1, 'num-layers': 4}. Best is trial 11 with value: 0.6778.[0m
[32m[I 2022-06-16 13:49:25,898][0m Trial 16 finished with value: 0.6812000000000001 and parameters: {'dropout': 0.5991868315709509, 'weight_decay': 0.005343701148306888, 'lr': 0.0039042233917885717, 'patience': 130, 'spt-alg': 'kruskal', 'manifold': 'PoincareBall', 'dim': 128, 'num-adj': 6, 'add-rate': 0.1, 'tem': 0.9, 'consis-rate': 1.1, 'use-att': 1, 'num-layers': 4}. Best is trial 16 with value: 0.6812000000000001.[0m
[32m[I 2022-06-16 13:51:30,123][0m Trial 17 finished with value: 0.6703 and parameters: {'dropout': 0.577838933327656, 'weight_decay': 0.0005146924146362324, 'lr': 0.009950208306800084, 'patience': 130, 'spt-alg': 'kruskal', 'manifold': 'PoincareBall', 'dim': 128, 'num-adj': 4, 'add-rate': 0.7, 'tem': 0.8, 'consis-rate': 1.7000000000000002, 'use-att': 1, 'num-layers': 4}. Best is trial 16 with value: 0.6812000000000001.[0m
[32m[I 2022-06-16 13:53:42,255][0m Trial 18 finished with value: 0.675 and parameters: {'dropout': 0.5239335577871218, 'weight_decay': 0.00532543784094039, 'lr': 0.005685319715278709, 'patience': 130, 'spt-alg': 'prim', 'manifold': 'PoincareBall', 'dim': 192, 'num-adj': 6, 'add-rate': 0.1, 'tem': 1.0, 'consis-rate': 2.0, 'use-att': 0, 'num-layers': 4}. Best is trial 16 with value: 0.6812000000000001.[0m
[32m[I 2022-06-16 13:56:07,997][0m Trial 19 finished with value: 0.6788000000000001 and parameters: {'dropout': 0.598691602732811, 'weight_decay': 0.0035553268648461167, 'lr': 0.0032043813177827585, 'patience': 130, 'spt-alg': 'kruskal', 'manifold': 'PoincareBall', 'dim': 128, 'num-adj': 6, 'add-rate': 0.2, 'tem': 0.7, 'consis-rate': 1.2000000000000002, 'use-att': 1, 'num-layers': 4}. Best is trial 16 with value: 0.6812000000000001.[0m
--dataset citeseer --model HGCN --c None --spt-attr edge_degree
cur_param: {'dropout': 0.2820590345615631, 'weight-decay': 0.000988170185346114, 'lr': 0.0015247592618764846, 'lr-reduce-freq': 120, 'patience': 120, 'spt-alg': 'prim', 'manifold': 'PoincareBall', 'dim': 192, 'num-adj': 2, 'add-rate': 0.30000000000000004, 'tem': 1.3, 'consis-rate': 1.1, 'use-att': 1, 'num-layers': 3}
mean: 0.6680000000000001
[0.66  0.663 0.658 0.669 0.674 0.674 0.681 0.672 0.66  0.669]
cur_param: {'dropout': 0.2365460605109096, 'weight-decay': 0.00224845750319129, 'lr': 0.0011318674156080256, 'lr-reduce-freq': 150, 'patience': 150, 'spt-alg': 'kruskal', 'manifold': 'PoincareBall', 'dim': 192, 'num-adj': 2, 'add-rate': 0.5, 'tem': 1.2000000000000002, 'consis-rate': 0.8, 'use-att': 0, 'num-layers': 4}
mean: 0.6656000000000001
[0.668 0.667 0.668 0.662 0.673 0.661 0.675 0.663 0.653 0.666]
cur_param: {'dropout': 0.34827597829935686, 'weight-decay': 0.024398900707845252, 'lr': 0.0022847711059292494, 'lr-reduce-freq': 60, 'patience': 60, 'spt-alg': 'kruskal', 'manifold': 'Hyperboloid', 'dim': 256, 'num-adj': 8, 'add-rate': 0.30000000000000004, 'tem': 1.5, 'consis-rate': 0.8, 'use-att': 1, 'num-layers': 3}
mean: 0.6724
[0.67  0.674 0.667 0.679 0.669 0.673 0.68  0.669 0.668 0.675]
cur_param: {'dropout': 0.4462234885551663, 'weight-decay': 0.03936665016041828, 'lr': 0.0007107873995644292, 'lr-reduce-freq': 90, 'patience': 90, 'spt-alg': 'kruskal', 'manifold': 'Hyperboloid', 'dim': 64, 'num-adj': 2, 'add-rate': 0.5, 'tem': 1.3, 'consis-rate': 1.8, 'use-att': 0, 'num-layers': 3}
mean: 0.6675000000000001
[0.671 0.674 0.663 0.679 0.665 0.667 0.661 0.665 0.672 0.658]
cur_param: {'dropout': 0.4277954704413841, 'weight-decay': 0.003925067983106617, 'lr': 0.0026156366425723024, 'lr-reduce-freq': 100, 'patience': 100, 'spt-alg': 'kruskal', 'manifold': 'PoincareBall', 'dim': 192, 'num-adj': 4, 'add-rate': 0.1, 'tem': 0.7, 'consis-rate': 1.5, 'use-att': 1, 'num-layers': 5}
mean: 0.6703
[0.659 0.676 0.672 0.667 0.68  0.666 0.685 0.662 0.671 0.665]
cur_param: {'dropout': 0.395101474041489, 'weight-decay': 0.0015502805619446761, 'lr': 0.0007252015191860624, 'lr-reduce-freq': 90, 'patience': 90, 'spt-alg': 'kruskal', 'manifold': 'Hyperboloid', 'dim': 128, 'num-adj': 8, 'add-rate': 0.4, 'tem': 1.1, 'consis-rate': 1.3, 'use-att': 1, 'num-layers': 3}
mean: 0.6700999999999999
[0.673 0.672 0.678 0.667 0.676 0.658 0.672 0.666 0.664 0.675]
cur_param: {'dropout': 0.5515663721271571, 'weight-decay': 0.0323404862516471, 'lr': 0.008843081087054358, 'lr-reduce-freq': 150, 'patience': 150, 'spt-alg': 'prim', 'manifold': 'Hyperboloid', 'dim': 64, 'num-adj': 4, 'add-rate': 0.7, 'tem': 0.6, 'consis-rate': 1.4, 'use-att': 1, 'num-layers': 3}
mean: 0.6673
[0.672 0.691 0.678 0.666 0.658 0.66  0.666 0.664 0.678 0.64 ]
cur_param: {'dropout': 0.5304841182983613, 'weight-decay': 0.0018602331580202345, 'lr': 0.0012708515892432503, 'lr-reduce-freq': 110, 'patience': 110, 'spt-alg': 'prim', 'manifold': 'Hyperboloid', 'dim': 64, 'num-adj': 2, 'add-rate': 0.5, 'tem': 0.9, 'consis-rate': 0.7, 'use-att': 0, 'num-layers': 3}
mean: 0.6715000000000002
[0.665 0.676 0.676 0.682 0.67  0.672 0.676 0.666 0.669 0.663]
cur_param: {'dropout': 0.5845333536365542, 'weight-decay': 0.02058230772244425, 'lr': 0.0008186206465065135, 'lr-reduce-freq': 70, 'patience': 70, 'spt-alg': 'kruskal', 'manifold': 'PoincareBall', 'dim': 64, 'num-adj': 2, 'add-rate': 0.1, 'tem': 0.7, 'consis-rate': 1.5, 'use-att': 1, 'num-layers': 3}
mean: 0.6722
[0.696 0.679 0.662 0.682 0.65  0.663 0.67  0.674 0.67  0.676]
cur_param: {'dropout': 0.4911204647194248, 'weight-decay': 0.002352552364279496, 'lr': 0.0007244768422800734, 'lr-reduce-freq': 80, 'patience': 80, 'spt-alg': 'prim', 'manifold': 'PoincareBall', 'dim': 64, 'num-adj': 6, 'add-rate': 0.4, 'tem': 1.3, 'consis-rate': 1.5, 'use-att': 0, 'num-layers': 5}
mean: 0.6701
[0.69  0.675 0.663 0.672 0.666 0.655 0.681 0.666 0.658 0.675]
cur_param: {'dropout': 0.3356819865348783, 'weight-decay': 0.011777485481633635, 'lr': 0.003548392857327624, 'lr-reduce-freq': 50, 'patience': 50, 'spt-alg': 'kruskal', 'manifold': 'Hyperboloid', 'dim': 256, 'num-adj': 8, 'add-rate': 0.2, 'tem': 1.5, 'consis-rate': 0.5, 'use-att': 1, 'num-layers': 4}
mean: 0.6706000000000001
[0.668 0.665 0.675 0.688 0.677 0.666 0.673 0.666 0.662 0.666]
cur_param: {'dropout': 0.596834946644124, 'weight-decay': 0.013326996199259755, 'lr': 0.004201345785347518, 'lr-reduce-freq': 50, 'patience': 50, 'spt-alg': 'kruskal', 'manifold': 'PoincareBall', 'dim': 256, 'num-adj': 6, 'add-rate': 0.1, 'tem': 0.8, 'consis-rate': 1.9000000000000001, 'use-att': 1, 'num-layers': 3}
mean: 0.6778
[0.677 0.678 0.675 0.689 0.672 0.686 0.677 0.686 0.676 0.662]
cur_param: {'dropout': 0.34816320354027963, 'weight-decay': 0.009499682450327422, 'lr': 0.004908707548372992, 'lr-reduce-freq': 50, 'patience': 50, 'spt-alg': 'kruskal', 'manifold': 'PoincareBall', 'dim': 256, 'num-adj': 6, 'add-rate': 0.2, 'tem': 0.9, 'consis-rate': 2.0, 'use-att': 1, 'num-layers': 3}
mean: 0.6718
[0.67  0.671 0.679 0.678 0.677 0.665 0.672 0.67  0.672 0.664]
cur_param: {'dropout': 0.35244372064721113, 'weight-decay': 0.010114679602999213, 'lr': 0.006266707853584117, 'lr-reduce-freq': 60, 'patience': 60, 'spt-alg': 'kruskal', 'manifold': 'Hyperboloid', 'dim': 256, 'num-adj': 8, 'add-rate': 0.2, 'tem': 1.5, 'consis-rate': 1.0, 'use-att': 1, 'num-layers': 5}
mean: 0.6667
[0.675 0.671 0.655 0.687 0.657 0.653 0.672 0.664 0.653 0.68 ]
cur_param: {'dropout': 0.212206025582145, 'weight-decay': 0.018604406456230387, 'lr': 0.002187093928604936, 'lr-reduce-freq': 70, 'patience': 70, 'spt-alg': 'kruskal', 'manifold': 'Hyperboloid', 'dim': 256, 'num-adj': 6, 'add-rate': 0.30000000000000004, 'tem': 0.5, 'consis-rate': 1.8, 'use-att': 1, 'num-layers': 3}
mean: 0.6655
[0.661 0.67  0.664 0.665 0.66  0.669 0.676 0.668 0.651 0.671]
cur_param: {'dropout': 0.48114835341514284, 'weight-decay': 0.005439380831451517, 'lr': 0.0035772092415139248, 'lr-reduce-freq': 50, 'patience': 50, 'spt-alg': 'kruskal', 'manifold': 'PoincareBall', 'dim': 128, 'num-adj': 8, 'add-rate': 0.1, 'tem': 0.9, 'consis-rate': 1.0, 'use-att': 1, 'num-layers': 4}
mean: 0.675
[0.683 0.68  0.683 0.68  0.649 0.678 0.683 0.681 0.675 0.658]
cur_param: {'dropout': 0.5991868315709509, 'weight-decay': 0.005343701148306888, 'lr': 0.0039042233917885717, 'lr-reduce-freq': 130, 'patience': 130, 'spt-alg': 'kruskal', 'manifold': 'PoincareBall', 'dim': 128, 'num-adj': 6, 'add-rate': 0.1, 'tem': 0.9, 'consis-rate': 1.1, 'use-att': 1, 'num-layers': 4}
mean: 0.6812000000000001
[0.677 0.69  0.694 0.69  0.657 0.682 0.686 0.678 0.679 0.679]
cur_param: {'dropout': 0.577838933327656, 'weight-decay': 0.0005146924146362324, 'lr': 0.009950208306800084, 'lr-reduce-freq': 130, 'patience': 130, 'spt-alg': 'kruskal', 'manifold': 'PoincareBall', 'dim': 128, 'num-adj': 4, 'add-rate': 0.7, 'tem': 0.8, 'consis-rate': 1.7000000000000002, 'use-att': 1, 'num-layers': 4}
mean: 0.6703
[0.667 0.681 0.67  0.674 0.652 0.673 0.684 0.667 0.672 0.663]
cur_param: {'dropout': 0.5239335577871218, 'weight-decay': 0.00532543784094039, 'lr': 0.005685319715278709, 'lr-reduce-freq': 130, 'patience': 130, 'spt-alg': 'prim', 'manifold': 'PoincareBall', 'dim': 192, 'num-adj': 6, 'add-rate': 0.1, 'tem': 1.0, 'consis-rate': 2.0, 'use-att': 0, 'num-layers': 4}
mean: 0.675
[0.677 0.667 0.679 0.678 0.679 0.659 0.676 0.676 0.681 0.678]
cur_param: {'dropout': 0.598691602732811, 'weight-decay': 0.0035553268648461167, 'lr': 0.0032043813177827585, 'lr-reduce-freq': 130, 'patience': 130, 'spt-alg': 'kruskal', 'manifold': 'PoincareBall', 'dim': 128, 'num-adj': 6, 'add-rate': 0.2, 'tem': 0.7, 'consis-rate': 1.2000000000000002, 'use-att': 1, 'num-layers': 4}
mean: 0.6788000000000001
[0.687 0.688 0.692 0.678 0.651 0.675 0.691 0.67  0.681 0.675]
cur_param: {'dropout': 0.4966264109409894, 'weight-decay': 0.003527926674643261, 'lr': 0.0027415531605388945, 'lr-reduce-freq': 140, 'patience': 140, 'spt-alg': 'kruskal', 'manifold': 'PoincareBall', 'dim': 128, 'num-adj': 4, 'add-rate': 0.2, 'tem': 0.5, 'consis-rate': 1.2000000000000002, 'use-att': 1, 'num-layers': 4}
mean: 0.6791
[0.677 0.683 0.687 0.677 0.671 0.676 0.692 0.673 0.673 0.682][32m[I 2022-06-16 13:58:34,716][0m Trial 20 finished with value: 0.6791 and parameters: {'dropout': 0.4966264109409894, 'weight_decay': 0.003527926674643261, 'lr': 0.0027415531605388945, 'patience': 140, 'spt-alg': 'kruskal', 'manifold': 'PoincareBall', 'dim': 128, 'num-adj': 4, 'add-rate': 0.2, 'tem': 0.5, 'consis-rate': 1.2000000000000002, 'use-att': 1, 'num-layers': 4}. Best is trial 16 with value: 0.6812000000000001.[0m
[32m[I 2022-06-16 14:01:03,529][0m Trial 21 finished with value: 0.6757000000000001 and parameters: {'dropout': 0.5018671071130784, 'weight_decay': 0.003738149465591338, 'lr': 0.0028045993673044304, 'patience': 140, 'spt-alg': 'kruskal', 'manifold': 'PoincareBall', 'dim': 128, 'num-adj': 4, 'add-rate': 0.2, 'tem': 0.5, 'consis-rate': 1.2000000000000002, 'use-att': 1, 'num-layers': 4}. Best is trial 16 with value: 0.6812000000000001.[0m
[32m[I 2022-06-16 14:03:37,016][0m Trial 22 finished with value: 0.6775 and parameters: {'dropout': 0.5508822005049323, 'weight_decay': 0.007019908802297688, 'lr': 0.001762609261006877, 'patience': 130, 'spt-alg': 'kruskal', 'manifold': 'PoincareBall', 'dim': 128, 'num-adj': 4, 'add-rate': 0.2, 'tem': 0.6, 'consis-rate': 1.1, 'use-att': 1, 'num-layers': 4}. Best is trial 16 with value: 0.6812000000000001.[0m
[32m[I 2022-06-16 14:05:58,816][0m Trial 23 finished with value: 0.6738000000000001 and parameters: {'dropout': 0.457187443082589, 'weight_decay': 0.0035644615594188464, 'lr': 0.0030513209139845583, 'patience': 120, 'spt-alg': 'kruskal', 'manifold': 'PoincareBall', 'dim': 128, 'num-adj': 6, 'add-rate': 0.30000000000000004, 'tem': 0.6, 'consis-rate': 1.2000000000000002, 'use-att': 1, 'num-layers': 4}. Best is trial 16 with value: 0.6812000000000001.[0m
[32m[I 2022-06-16 14:08:17,805][0m Trial 24 finished with value: 0.6723999999999999 and parameters: {'dropout': 0.5627034053950833, 'weight_decay': 0.0011233142434284812, 'lr': 0.00666819170987055, 'patience': 140, 'spt-alg': 'kruskal', 'manifold': 'PoincareBall', 'dim': 128, 'num-adj': 6, 'add-rate': 0.2, 'tem': 0.7, 'consis-rate': 0.9, 'use-att': 1, 'num-layers': 4}. Best is trial 16 with value: 0.6812000000000001.[0m
[32m[I 2022-06-16 14:10:48,739][0m Trial 25 finished with value: 0.6758 and parameters: {'dropout': 0.5989801487576691, 'weight_decay': 0.002905255403590655, 'lr': 0.00194205925131139, 'patience': 110, 'spt-alg': 'kruskal', 'manifold': 'PoincareBall', 'dim': 128, 'num-adj': 4, 'add-rate': 0.1, 'tem': 0.5, 'consis-rate': 1.3, 'use-att': 1, 'num-layers': 4}. Best is trial 16 with value: 0.6812000000000001.[0m
[32m[I 2022-06-16 14:13:06,935][0m Trial 26 finished with value: 0.6748999999999999 and parameters: {'dropout': 0.5206665318351044, 'weight_decay': 0.006723604297332533, 'lr': 0.0039694311362588755, 'patience': 140, 'spt-alg': 'kruskal', 'manifold': 'PoincareBall', 'dim': 192, 'num-adj': 6, 'add-rate': 0.30000000000000004, 'tem': 0.8, 'consis-rate': 1.1, 'use-att': 1, 'num-layers': 4}. Best is trial 16 with value: 0.6812000000000001.[0m
[32m[I 2022-06-16 14:15:16,521][0m Trial 27 finished with value: 0.6731 and parameters: {'dropout': 0.4018481335715332, 'weight_decay': 0.001177447905893433, 'lr': 0.004875720127969271, 'patience': 120, 'spt-alg': 'prim', 'manifold': 'PoincareBall', 'dim': 128, 'num-adj': 4, 'add-rate': 0.6, 'tem': 1.0, 'consis-rate': 1.4, 'use-att': 0, 'num-layers': 4}. Best is trial 16 with value: 0.6812000000000001.[0m
[32m[I 2022-06-16 14:19:15,565][0m Trial 28 finished with value: 0.6775 and parameters: {'dropout': 0.5448348905545708, 'weight_decay': 0.007594010497187958, 'lr': 0.0005054461508555988, 'patience': 150, 'spt-alg': 'kruskal', 'manifold': 'PoincareBall', 'dim': 192, 'num-adj': 6, 'add-rate': 0.2, 'tem': 0.6, 'consis-rate': 0.6, 'use-att': 1, 'num-layers': 4}. Best is trial 16 with value: 0.6812000000000001.[0m
[32m[I 2022-06-16 14:21:26,608][0m Trial 29 finished with value: 0.6752 and parameters: {'dropout': 0.4788939754304301, 'weight_decay': 0.0008140677628643969, 'lr': 0.0030782852358089904, 'patience': 110, 'spt-alg': 'prim', 'manifold': 'PoincareBall', 'dim': 192, 'num-adj': 4, 'add-rate': 0.30000000000000004, 'tem': 0.7, 'consis-rate': 1.0, 'use-att': 1, 'num-layers': 5}. Best is trial 16 with value: 0.6812000000000001.[0m
[32m[I 2022-06-16 14:24:16,384][0m Trial 30 finished with value: 0.6759999999999999 and parameters: {'dropout': 0.5681667699494319, 'weight_decay': 0.004439153730826257, 'lr': 0.0014882993186175098, 'patience': 130, 'spt-alg': 'kruskal', 'manifold': 'PoincareBall', 'dim': 128, 'num-adj': 6, 'add-rate': 0.4, 'tem': 0.8, 'consis-rate': 1.6, 'use-att': 1, 'num-layers': 4}. Best is trial 16 with value: 0.6812000000000001.[0m
[32m[I 2022-06-16 14:26:41,346][0m Trial 31 finished with value: 0.6736 and parameters: {'dropout': 0.5935343418117419, 'weight_decay': 0.012758011502812326, 'lr': 0.004884091166184023, 'patience': 140, 'spt-alg': 'kruskal', 'manifold': 'PoincareBall', 'dim': 128, 'num-adj': 6, 'add-rate': 0.1, 'tem': 1.0, 'consis-rate': 1.2000000000000002, 'use-att': 1, 'num-layers': 4}. Best is trial 16 with value: 0.6812000000000001.[0m
