[32m[I 2022-06-16 21:35:21,298][0m Trial 166 finished with value: 0.6785 and parameters: {'dropout': 0.5749801453088019, 'weight_decay': 0.004446738533500659, 'lr': 0.000992748737669119, 'patience': 130, 'spt-alg': 'kruskal', 'manifold': 'PoincareBall', 'dim': 256, 'num-adj': 6, 'add-rate': 0.2, 'tem': 0.8, 'consis-rate': 1.1, 'use-att': 1, 'num-layers': 3}. Best is trial 115 with value: 0.6829000000000001.[0m

mean: 0.6778000000000001
[0.683 0.667 0.687 0.677 0.671 0.67  0.688 0.675 0.675 0.685]
cur_param: {'dropout': 0.5775311425068889, 'weight-decay': 0.0046802394664262415, 'lr': 0.00089871266508283, 'lr-reduce-freq': 120, 'patience': 120, 'spt-alg': 'kruskal', 'manifold': 'PoincareBall', 'dim': 256, 'num-adj': 6, 'add-rate': 0.4, 'tem': 1.1, 'consis-rate': 1.1, 'use-att': 1, 'num-layers': 4}
mean: 0.6793
[0.687 0.668 0.686 0.685 0.672 0.679 0.678 0.677 0.68  0.681]
cur_param: {'dropout': 0.5854627471254081, 'weight-decay': 0.006195984864251215, 'lr': 0.0010368052841278367, 'lr-reduce-freq': 130, 'patience': 130, 'spt-alg': 'kruskal', 'manifold': 'PoincareBall', 'dim': 256, 'num-adj': 6, 'add-rate': 0.5, 'tem': 1.2000000000000002, 'consis-rate': 1.0, 'use-att': 1, 'num-layers': 3}
mean: 0.68
[0.685 0.674 0.685 0.685 0.674 0.692 0.676 0.685 0.666 0.678]
cur_param: {'dropout': 0.5977176455599744, 'weight-decay': 0.00407829899495677, 'lr': 0.0007252821707353549, 'lr-reduce-freq': 140, 'patience': 140, 'spt-alg': 'kruskal', 'manifold': 'PoincareBall', 'dim': 64, 'num-adj': 6, 'add-rate': 0.4, 'tem': 0.7, 'consis-rate': 1.2000000000000002, 'use-att': 1, 'num-layers': 4}
mean: 0.6762000000000001
[0.692 0.683 0.668 0.689 0.661 0.668 0.684 0.67  0.669 0.678]
cur_param: {'dropout': 0.5580608104327468, 'weight-decay': 0.001412439802075028, 'lr': 0.005419823864790672, 'lr-reduce-freq': 70, 'patience': 70, 'spt-alg': 'kruskal', 'manifold': 'PoincareBall', 'dim': 256, 'num-adj': 4, 'add-rate': 0.4, 'tem': 1.1, 'consis-rate': 1.0, 'use-att': 1, 'num-layers': 3}
mean: 0.6703
[0.668 0.665 0.669 0.682 0.678 0.67  0.662 0.673 0.679 0.657]
cur_param: {'dropout': 0.5743887233514235, 'weight-decay': 0.003193982134554508, 'lr': 0.0007754846954684416, 'lr-reduce-freq': 130, 'patience': 130, 'spt-alg': 'kruskal', 'manifold': 'PoincareBall', 'dim': 256, 'num-adj': 6, 'add-rate': 0.1, 'tem': 0.9, 'consis-rate': 1.2000000000000002, 'use-att': 1, 'num-layers': 4}
mean: 0.6824
[0.675 0.669 0.687 0.683 0.677 0.692 0.681 0.687 0.68  0.693]
cur_param: {'dropout': 0.5745921059767647, 'weight-decay': 0.00328448548390928, 'lr': 0.0017352011050109928, 'lr-reduce-freq': 130, 'patience': 130, 'spt-alg': 'kruskal', 'manifold': 'PoincareBall', 'dim': 256, 'num-adj': 6, 'add-rate': 0.1, 'tem': 1.0, 'consis-rate': 1.3, 'use-att': 1, 'num-layers': 4}
mean: 0.6793000000000001
[0.694 0.675 0.686 0.667 0.68  0.677 0.691 0.682 0.671 0.67 ]
cur_param: {'dropout': 0.5662334139084547, 'weight-decay': 0.0026236849920589582, 'lr': 0.000822229354400047, 'lr-reduce-freq': 130, 'patience': 130, 'spt-alg': 'kruskal', 'manifold': 'PoincareBall', 'dim': 256, 'num-adj': 6, 'add-rate': 0.4, 'tem': 0.9, 'consis-rate': 1.2000000000000002, 'use-att': 1, 'num-layers': 4}
mean: 0.6788000000000001
[0.671 0.668 0.683 0.675 0.668 0.7   0.679 0.679 0.683 0.682]
cur_param: {'dropout': 0.5996475168690201, 'weight-decay': 0.003517319731897027, 'lr': 0.0006801994575532273, 'lr-reduce-freq': 130, 'patience': 130, 'spt-alg': 'kruskal', 'manifold': 'PoincareBall', 'dim': 256, 'num-adj': 6, 'add-rate': 0.1, 'tem': 1.0, 'consis-rate': 1.1, 'use-att': 1, 'num-layers': 4}
mean: 0.6793
[0.667 0.677 0.677 0.673 0.68  0.673 0.689 0.687 0.679 0.691]
cur_param: {'dropout': 0.5854185476990911, 'weight-decay': 0.002241107920203154, 'lr': 0.0007479228825850645, 'lr-reduce-freq': 140, 'patience': 140, 'spt-alg': 'kruskal', 'manifold': 'PoincareBall', 'dim': 256, 'num-adj': 6, 'add-rate': 0.1, 'tem': 0.9, 'consis-rate': 1.1, 'use-att': 1, 'num-layers': 4}
mean: 0.6799000000000001
[0.662 0.669 0.677 0.685 0.683 0.676 0.687 0.687 0.685 0.688]
cur_param: {'dropout': 0.5779802616594807, 'weight-decay': 0.0039043383516876805, 'lr': 0.0005896966341228361, 'lr-reduce-freq': 120, 'patience': 120, 'spt-alg': 'kruskal', 'manifold': 'PoincareBall', 'dim': 256, 'num-adj': 6, 'add-rate': 0.4, 'tem': 1.1, 'consis-rate': 1.3, 'use-att': 1, 'num-layers': 4}
mean: 0.677
[0.669 0.671 0.684 0.679 0.669 0.678 0.686 0.682 0.679 0.673]
cur_param: {'dropout': 0.5512198369756155, 'weight-decay': 0.003177395562629775, 'lr': 0.0009339418129750886, 'lr-reduce-freq': 140, 'patience': 140, 'spt-alg': 'kruskal', 'manifold': 'Hyperboloid', 'dim': 256, 'num-adj': 6, 'add-rate': 0.1, 'tem': 0.6, 'consis-rate': 1.2000000000000002, 'use-att': 1, 'num-layers': 3}
mean: 0.6736000000000001
[0.672 0.669 0.677 0.677 0.671 0.669 0.677 0.677 0.673 0.674]
cur_param: {'dropout': 0.5684277018018772, 'weight-decay': 0.004305526903728781, 'lr': 0.0011915277362500182, 'lr-reduce-freq': 130, 'patience': 130, 'spt-alg': 'kruskal', 'manifold': 'PoincareBall', 'dim': 256, 'num-adj': 6, 'add-rate': 0.30000000000000004, 'tem': 1.2000000000000002, 'consis-rate': 1.9000000000000001, 'use-att': 1, 'num-layers': 5}
mean: 0.6775
[0.666 0.661 0.677 0.682 0.673 0.693 0.693 0.679 0.676 0.675]
cur_param: {'dropout': 0.5883985280366374, 'weight-decay': 0.0028445939238460048, 'lr': 0.0006462497992873133, 'lr-reduce-freq': 120, 'patience': 120, 'spt-alg': 'kruskal', 'manifold': 'PoincareBall', 'dim': 256, 'num-adj': 6, 'add-rate': 0.1, 'tem': 1.0, 'consis-rate': 1.0, 'use-att': 1, 'num-layers': 4}
mean: 0.6786000000000001
[0.666 0.677 0.678 0.679 0.674 0.676 0.688 0.687 0.679 0.682]
cur_param: {'dropout': 0.5579355168097012, 'weight-decay': 0.005694541725244243, 'lr': 0.0010941642486969796, 'lr-reduce-freq': 130, 'patience': 130, 'spt-alg': 'kruskal', 'manifold': 'PoincareBall', 'dim': 256, 'num-adj': 4, 'add-rate': 0.1, 'tem': 1.1, 'consis-rate': 1.1, 'use-att': 1, 'num-layers': 3}
mean: 0.6777
[0.676 0.669 0.681 0.674 0.675 0.695 0.68  0.68  0.675 0.672]
cur_param: {'dropout': 0.5879908953556767, 'weight-decay': 0.003645262269298976, 'lr': 0.0007854060220170953, 'lr-reduce-freq': 130, 'patience': 130, 'spt-alg': 'kruskal', 'manifold': 'PoincareBall', 'dim': 256, 'num-adj': 6, 'add-rate': 0.2, 'tem': 0.8, 'consis-rate': 1.2000000000000002, 'use-att': 1, 'num-layers': 4}
mean: 0.6787000000000001
[0.665 0.676 0.68  0.683 0.676 0.678 0.684 0.686 0.673 0.686]
cur_param: {'dropout': 0.5789036594323128, 'weight-decay': 0.004925288027953479, 'lr': 0.0008454027870498863, 'lr-reduce-freq': 130, 'patience': 130, 'spt-alg': 'kruskal', 'manifold': 'PoincareBall', 'dim': 256, 'num-adj': 6, 'add-rate': 0.2, 'tem': 0.8, 'consis-rate': 1.1, 'use-att': 1, 'num-layers': 4}
mean: 0.6764
[0.658 0.668 0.679 0.684 0.674 0.677 0.677 0.679 0.684 0.684]
cur_param: {'dropout': 0.5471869437412556, 'weight-decay': 0.003080800809228251, 'lr': 0.0006998620072347724, 'lr-reduce-freq': 140, 'patience': 140, 'spt-alg': 'kruskal', 'manifold': 'PoincareBall', 'dim': 256, 'num-adj': 8, 'add-rate': 0.1, 'tem': 0.9, 'consis-rate': 1.8, 'use-att': 1, 'num-layers': 4}
mean: 0.6802000000000001
[0.682 0.675 0.688 0.674 0.673 0.68  0.686 0.679 0.678 0.687]
cur_param: {'dropout': 0.5913674562315433, 'weight-decay': 0.0037316447990817406, 'lr': 0.0008677859632520182, 'lr-reduce-freq': 130, 'patience': 130, 'spt-alg': 'kruskal', 'manifold': 'PoincareBall', 'dim': 256, 'num-adj': 6, 'add-rate': 0.4, 'tem': 0.7, 'consis-rate': 1.2000000000000002, 'use-att': 1, 'num-layers': 4}
mean: 0.6777000000000001
[0.694 0.663 0.683 0.677 0.672 0.673 0.677 0.68  0.674 0.684]
cur_param: {'dropout': 0.5635175014140827, 'weight-decay': 0.002419478889359789, 'lr': 0.0007512926666160235, 'lr-reduce-freq': 90, 'patience': 90, 'spt-alg': 'kruskal', 'manifold': 'PoincareBall', 'dim': 256, 'num-adj': 8, 'add-rate': 0.1, 'tem': 0.9, 'consis-rate': 1.9000000000000001, 'use-att': 1, 'num-layers': 4}
mean: 0.6803
[0.671 0.668 0.688 0.663 0.676 0.7   0.687 0.684 0.684 0.682]
cur_param: {'dropout': 0.5749801453088019, 'weight-decay': 0.004446738533500659, 'lr': 0.000992748737669119, 'lr-reduce-freq': 130, 'patience': 130, 'spt-alg': 'kruskal', 'manifold': 'PoincareBall', 'dim': 256, 'num-adj': 6, 'add-rate': 0.2, 'tem': 0.8, 'consis-rate': 1.1, 'use-att': 1, 'num-layers': 3}
mean: 0.6785
[0.693 0.671 0.683 0.677 0.664 0.693 0.679 0.676 0.67  0.679]
cur_param: {'dropout': 0.5553405419548855, 'weight-decay': 0.0027903256229473536, 'lr': 0.0008105669147022777, 'lr-reduce-freq': 140, 'patience': 140, 'spt-alg': 'kruskal', 'manifold': 'PoincareBall', 'dim': 256, 'num-adj': 8, 'add-rate': 0.1, 'tem': 0.9, 'consis-rate': 1.3, 'use-att': 1, 'num-layers': 4}[32m[I 2022-06-16 21:38:39,349][0m Trial 167 finished with value: 0.6785000000000001 and parameters: {'dropout': 0.5553405419548855, 'weight_decay': 0.0027903256229473536, 'lr': 0.0008105669147022777, 'patience': 140, 'spt-alg': 'kruskal', 'manifold': 'PoincareBall', 'dim': 256, 'num-adj': 8, 'add-rate': 0.1, 'tem': 0.9, 'consis-rate': 1.3, 'use-att': 1, 'num-layers': 4}. Best is trial 115 with value: 0.6829000000000001.[0m
[32m[I 2022-06-16 21:42:00,739][0m Trial 168 finished with value: 0.6805000000000001 and parameters: {'dropout': 0.5830317407630405, 'weight_decay': 0.001096556439276521, 'lr': 0.0006325894922831599, 'patience': 120, 'spt-alg': 'kruskal', 'manifold': 'PoincareBall', 'dim': 256, 'num-adj': 6, 'add-rate': 0.30000000000000004, 'tem': 0.8, 'consis-rate': 1.2000000000000002, 'use-att': 0, 'num-layers': 3}. Best is trial 115 with value: 0.6829000000000001.[0m
[32m[I 2022-06-16 21:46:05,912][0m Trial 169 finished with value: 0.677 and parameters: {'dropout': 0.5683055176383716, 'weight_decay': 0.003363075801676407, 'lr': 0.0015183003860179214, 'patience': 130, 'spt-alg': 'prim', 'manifold': 'Hyperboloid', 'dim': 256, 'num-adj': 6, 'add-rate': 0.4, 'tem': 1.3, 'consis-rate': 1.1, 'use-att': 1, 'num-layers': 4}. Best is trial 115 with value: 0.6829000000000001.[0m
[32m[I 2022-06-16 21:48:44,085][0m Trial 170 finished with value: 0.6814000000000001 and parameters: {'dropout': 0.5988920269484156, 'weight_decay': 0.003992859055897797, 'lr': 0.0008959148878573338, 'patience': 130, 'spt-alg': 'kruskal', 'manifold': 'PoincareBall', 'dim': 256, 'num-adj': 6, 'add-rate': 0.1, 'tem': 1.4, 'consis-rate': 2.0, 'use-att': 1, 'num-layers': 3}. Best is trial 115 with value: 0.6829000000000001.[0m
[32m[I 2022-06-16 21:51:26,823][0m Trial 171 finished with value: 0.6782 and parameters: {'dropout': 0.5932671226150342, 'weight_decay': 0.0038429289353552097, 'lr': 0.0009038260498152263, 'patience': 130, 'spt-alg': 'kruskal', 'manifold': 'PoincareBall', 'dim': 256, 'num-adj': 6, 'add-rate': 0.1, 'tem': 1.4, 'consis-rate': 2.0, 'use-att': 1, 'num-layers': 3}. Best is trial 115 with value: 0.6829000000000001.[0m
[32m[I 2022-06-16 21:53:58,003][0m Trial 172 finished with value: 0.6815 and parameters: {'dropout': 0.5761380505964891, 'weight_decay': 0.0031701440790889972, 'lr': 0.0007477717606536625, 'patience': 100, 'spt-alg': 'kruskal', 'manifold': 'PoincareBall', 'dim': 256, 'num-adj': 8, 'add-rate': 0.1, 'tem': 1.3, 'consis-rate': 2.0, 'use-att': 1, 'num-layers': 3}. Best is trial 115 with value: 0.6829000000000001.[0m
[32m[I 2022-06-16 21:55:55,661][0m Trial 173 finished with value: 0.6797000000000001 and parameters: {'dropout': 0.5988063720869571, 'weight_decay': 0.0041376009614026, 'lr': 0.003333229782380387, 'patience': 110, 'spt-alg': 'kruskal', 'manifold': 'PoincareBall', 'dim': 256, 'num-adj': 8, 'add-rate': 0.1, 'tem': 1.4, 'consis-rate': 2.0, 'use-att': 1, 'num-layers': 3}. Best is trial 115 with value: 0.6829000000000001.[0m
[32m[I 2022-06-16 21:58:14,367][0m Trial 174 finished with value: 0.6792 and parameters: {'dropout': 0.5772631724450052, 'weight_decay': 0.0020536849052094287, 'lr': 0.0020428007590032114, 'patience': 130, 'spt-alg': 'kruskal', 'manifold': 'PoincareBall', 'dim': 256, 'num-adj': 8, 'add-rate': 0.1, 'tem': 1.3, 'consis-rate': 2.0, 'use-att': 1, 'num-layers': 3}. Best is trial 115 with value: 0.6829000000000001.[0m
[32m[I 2022-06-16 22:01:09,098][0m Trial 175 finished with value: 0.6797000000000001 and parameters: {'dropout': 0.583050998678721, 'weight_decay': 0.003287396087481045, 'lr': 0.000734202344988655, 'patience': 140, 'spt-alg': 'kruskal', 'manifold': 'PoincareBall', 'dim': 256, 'num-adj': 8, 'add-rate': 0.1, 'tem': 1.5, 'consis-rate': 2.0, 'use-att': 1, 'num-layers': 3}. Best is trial 115 with value: 0.6829000000000001.[0m
[32m[I 2022-06-16 22:03:45,386][0m Trial 176 finished with value: 0.6727000000000001 and parameters: {'dropout': 0.32522311923025127, 'weight_decay': 0.0018149995833095089, 'lr': 0.0007784329103771541, 'patience': 130, 'spt-alg': 'kruskal', 'manifold': 'PoincareBall', 'dim': 256, 'num-adj': 6, 'add-rate': 0.1, 'tem': 1.3, 'consis-rate': 1.9000000000000001, 'use-att': 1, 'num-layers': 3}. Best is trial 115 with value: 0.6829000000000001.[0m
[32m[I 2022-06-16 22:06:46,608][0m Trial 177 finished with value: 0.6809000000000001 and parameters: {'dropout': 0.5711581058012026, 'weight_decay': 0.0026068833732903075, 'lr': 0.0006806086709486967, 'patience': 140, 'spt-alg': 'kruskal', 'manifold': 'PoincareBall', 'dim': 256, 'num-adj': 8, 'add-rate': 0.1, 'tem': 1.4, 'consis-rate': 2.0, 'use-att': 1, 'num-layers': 3}. Best is trial 115 with value: 0.6829000000000001.[0m
[32m[I 2022-06-16 22:09:09,422][0m Trial 178 finished with value: 0.6789 and parameters: {'dropout': 0.5720214971461641, 'weight_decay': 0.0026301147291612373, 'lr': 0.000691367529649735, 'patience': 80, 'spt-alg': 'kruskal', 'manifold': 'PoincareBall', 'dim': 256, 'num-adj': 8, 'add-rate': 0.1, 'tem': 1.4, 'consis-rate': 2.0, 'use-att': 1, 'num-layers': 3}. Best is trial 115 with value: 0.6829000000000001.[0m
[32m[I 2022-06-16 22:12:03,177][0m Trial 179 finished with value: 0.6799999999999999 and parameters: {'dropout': 0.5911607941683469, 'weight_decay': 0.0029691488650029417, 'lr': 0.0008083937435056311, 'patience': 150, 'spt-alg': 'kruskal', 'manifold': 'PoincareBall', 'dim': 256, 'num-adj': 6, 'add-rate': 0.1, 'tem': 1.4, 'consis-rate': 2.0, 'use-att': 1, 'num-layers': 3}. Best is trial 115 with value: 0.6829000000000001.[0m
[32m[I 2022-06-16 22:15:17,667][0m Trial 180 finished with value: 0.6771 and parameters: {'dropout': 0.5805661408871426, 'weight_decay': 0.003462580625556645, 'lr': 0.0007286657792683737, 'patience': 140, 'spt-alg': 'kruskal', 'manifold': 'PoincareBall', 'dim': 128, 'num-adj': 8, 'add-rate': 0.1, 'tem': 1.4, 'consis-rate': 1.9000000000000001, 'use-att': 1, 'num-layers': 3}. Best is trial 115 with value: 0.6829000000000001.[0m
[32m[I 2022-06-16 22:18:20,504][0m Trial 181 finished with value: 0.6795000000000001 and parameters: {'dropout': 0.5624646330164231, 'weight_decay': 0.002251687189063335, 'lr': 0.0006566890891264434, 'patience': 140, 'spt-alg': 'kruskal', 'manifold': 'PoincareBall', 'dim': 256, 'num-adj': 8, 'add-rate': 0.1, 'tem': 1.3, 'consis-rate': 2.0, 'use-att': 1, 'num-layers': 3}. Best is trial 115 with value: 0.6829000000000001.[0m
[32m[I 2022-06-16 22:21:02,824][0m Trial 182 finished with value: 0.6809999999999999 and parameters: {'dropout': 0.5704097573666468, 'weight_decay': 0.0026627833665190783, 'lr': 0.0007834105835307744, 'patience': 130, 'spt-alg': 'kruskal', 'manifold': 'PoincareBall', 'dim': 256, 'num-adj': 8, 'add-rate': 0.1, 'tem': 1.4, 'consis-rate': 1.9000000000000001, 'use-att': 1, 'num-layers': 3}. Best is trial 115 with value: 0.6829000000000001.[0m
[32m[I 2022-06-16 22:23:42,769][0m Trial 183 finished with value: 0.682 and parameters: {'dropout': 0.5997115076083589, 'weight_decay': 0.0025527333039532065, 'lr': 0.0007791251200186849, 'patience': 130, 'spt-alg': 'kruskal', 'manifold': 'PoincareBall', 'dim': 256, 'num-adj': 8, 'add-rate': 0.1, 'tem': 1.4, 'consis-rate': 1.9000000000000001, 'use-att': 1, 'num-layers': 3}. Best is trial 115 with value: 0.6829000000000001.[0m
[32m[I 2022-06-16 22:26:22,333][0m Trial 184 finished with value: 0.6791 and parameters: {'dropout': 0.5994896361309366, 'weight_decay': 0.002514762070992468, 'lr': 0.000869800224285479, 'patience': 130, 'spt-alg': 'kruskal', 'manifold': 'PoincareBall', 'dim': 256, 'num-adj': 8, 'add-rate': 0.1, 'tem': 1.4, 'consis-rate': 1.9000000000000001, 'use-att': 1, 'num-layers': 3}. Best is trial 115 with value: 0.6829000000000001.[0m
[32m[I 2022-06-16 22:29:09,697][0m Trial 185 finished with value: 0.6793 and parameters: {'dropout': 0.5880289672293233, 'weight_decay': 0.002732135125311773, 'lr': 0.0007888727928885448, 'patience': 130, 'spt-alg': 'kruskal', 'manifold': 'PoincareBall', 'dim': 256, 'num-adj': 8, 'add-rate': 0.1, 'tem': 1.5, 'consis-rate': 1.9000000000000001, 'use-att': 1, 'num-layers': 3}. Best is trial 115 with value: 0.6829000000000001.[0m
[32m[I 2022-06-16 22:31:56,852][0m Trial 186 finished with value: 0.6799999999999999 and parameters: {'dropout': 0.5737392243714371, 'weight_decay': 0.0030221913399901303, 'lr': 0.0006766512129285008, 'patience': 130, 'spt-alg': 'kruskal', 'manifold': 'PoincareBall', 'dim': 256, 'num-adj': 8, 'add-rate': 0.1, 'tem': 1.4, 'consis-rate': 2.0, 'use-att': 1, 'num-layers': 3}. Best is trial 115 with value: 0.6829000000000001.[0m
