[32m[I 2022-06-16 22:34:46,780][0m Trial 187 finished with value: 0.6801 and parameters: {'dropout': 0.5924328864607915, 'weight_decay': 0.0023644314106470343, 'lr': 0.0007182531139071948, 'patience': 130, 'spt-alg': 'kruskal', 'manifold': 'PoincareBall', 'dim': 256, 'num-adj': 8, 'add-rate': 0.1, 'tem': 1.4, 'consis-rate': 1.9000000000000001, 'use-att': 1, 'num-layers': 3}. Best is trial 115 with value: 0.6829000000000001.[0m

mean: 0.6785000000000001
[0.678 0.671 0.69  0.673 0.67  0.683 0.678 0.678 0.684 0.68 ]
cur_param: {'dropout': 0.5830317407630405, 'weight-decay': 0.001096556439276521, 'lr': 0.0006325894922831599, 'lr-reduce-freq': 120, 'patience': 120, 'spt-alg': 'kruskal', 'manifold': 'PoincareBall', 'dim': 256, 'num-adj': 6, 'add-rate': 0.30000000000000004, 'tem': 0.8, 'consis-rate': 1.2000000000000002, 'use-att': 0, 'num-layers': 3}
mean: 0.6805000000000001
[0.678 0.675 0.681 0.671 0.676 0.68  0.689 0.69  0.681 0.684]
cur_param: {'dropout': 0.5683055176383716, 'weight-decay': 0.003363075801676407, 'lr': 0.0015183003860179214, 'lr-reduce-freq': 130, 'patience': 130, 'spt-alg': 'prim', 'manifold': 'Hyperboloid', 'dim': 256, 'num-adj': 6, 'add-rate': 0.4, 'tem': 1.3, 'consis-rate': 1.1, 'use-att': 1, 'num-layers': 4}
mean: 0.677
[0.683 0.673 0.675 0.686 0.676 0.682 0.678 0.67  0.675 0.672]
cur_param: {'dropout': 0.5988920269484156, 'weight-decay': 0.003992859055897797, 'lr': 0.0008959148878573338, 'lr-reduce-freq': 130, 'patience': 130, 'spt-alg': 'kruskal', 'manifold': 'PoincareBall', 'dim': 256, 'num-adj': 6, 'add-rate': 0.1, 'tem': 1.4, 'consis-rate': 2.0, 'use-att': 1, 'num-layers': 3}
mean: 0.6814000000000001
[0.694 0.673 0.692 0.685 0.673 0.68  0.677 0.68  0.682 0.678]
cur_param: {'dropout': 0.5932671226150342, 'weight-decay': 0.0038429289353552097, 'lr': 0.0009038260498152263, 'lr-reduce-freq': 130, 'patience': 130, 'spt-alg': 'kruskal', 'manifold': 'PoincareBall', 'dim': 256, 'num-adj': 6, 'add-rate': 0.1, 'tem': 1.4, 'consis-rate': 2.0, 'use-att': 1, 'num-layers': 3}
mean: 0.6782
[0.681 0.674 0.688 0.679 0.673 0.672 0.678 0.678 0.681 0.678]
cur_param: {'dropout': 0.5761380505964891, 'weight-decay': 0.0031701440790889972, 'lr': 0.0007477717606536625, 'lr-reduce-freq': 100, 'patience': 100, 'spt-alg': 'kruskal', 'manifold': 'PoincareBall', 'dim': 256, 'num-adj': 8, 'add-rate': 0.1, 'tem': 1.3, 'consis-rate': 2.0, 'use-att': 1, 'num-layers': 3}
mean: 0.6815
[0.68  0.668 0.689 0.681 0.68  0.676 0.681 0.682 0.683 0.695]
cur_param: {'dropout': 0.5988063720869571, 'weight-decay': 0.0041376009614026, 'lr': 0.003333229782380387, 'lr-reduce-freq': 110, 'patience': 110, 'spt-alg': 'kruskal', 'manifold': 'PoincareBall', 'dim': 256, 'num-adj': 8, 'add-rate': 0.1, 'tem': 1.4, 'consis-rate': 2.0, 'use-att': 1, 'num-layers': 3}
mean: 0.6797000000000001
[0.687 0.682 0.677 0.689 0.671 0.678 0.677 0.686 0.677 0.673]
cur_param: {'dropout': 0.5772631724450052, 'weight-decay': 0.0020536849052094287, 'lr': 0.0020428007590032114, 'lr-reduce-freq': 130, 'patience': 130, 'spt-alg': 'kruskal', 'manifold': 'PoincareBall', 'dim': 256, 'num-adj': 8, 'add-rate': 0.1, 'tem': 1.3, 'consis-rate': 2.0, 'use-att': 1, 'num-layers': 3}
mean: 0.6792
[0.689 0.661 0.698 0.678 0.68  0.678 0.691 0.681 0.668 0.668]
cur_param: {'dropout': 0.583050998678721, 'weight-decay': 0.003287396087481045, 'lr': 0.000734202344988655, 'lr-reduce-freq': 140, 'patience': 140, 'spt-alg': 'kruskal', 'manifold': 'PoincareBall', 'dim': 256, 'num-adj': 8, 'add-rate': 0.1, 'tem': 1.5, 'consis-rate': 2.0, 'use-att': 1, 'num-layers': 3}
mean: 0.6797000000000001
[0.673 0.67  0.691 0.682 0.673 0.672 0.678 0.683 0.683 0.692]
cur_param: {'dropout': 0.32522311923025127, 'weight-decay': 0.0018149995833095089, 'lr': 0.0007784329103771541, 'lr-reduce-freq': 130, 'patience': 130, 'spt-alg': 'kruskal', 'manifold': 'PoincareBall', 'dim': 256, 'num-adj': 6, 'add-rate': 0.1, 'tem': 1.3, 'consis-rate': 1.9000000000000001, 'use-att': 1, 'num-layers': 3}
mean: 0.6727000000000001
[0.677 0.658 0.68  0.68  0.663 0.677 0.681 0.674 0.672 0.665]
cur_param: {'dropout': 0.5711581058012026, 'weight-decay': 0.0026068833732903075, 'lr': 0.0006806086709486967, 'lr-reduce-freq': 140, 'patience': 140, 'spt-alg': 'kruskal', 'manifold': 'PoincareBall', 'dim': 256, 'num-adj': 8, 'add-rate': 0.1, 'tem': 1.4, 'consis-rate': 2.0, 'use-att': 1, 'num-layers': 3}
mean: 0.6809000000000001
[0.677 0.671 0.678 0.675 0.678 0.677 0.688 0.685 0.687 0.693]
cur_param: {'dropout': 0.5720214971461641, 'weight-decay': 0.0026301147291612373, 'lr': 0.000691367529649735, 'lr-reduce-freq': 80, 'patience': 80, 'spt-alg': 'kruskal', 'manifold': 'PoincareBall', 'dim': 256, 'num-adj': 8, 'add-rate': 0.1, 'tem': 1.4, 'consis-rate': 2.0, 'use-att': 1, 'num-layers': 3}
mean: 0.6789
[0.671 0.672 0.676 0.665 0.678 0.677 0.689 0.685 0.683 0.693]
cur_param: {'dropout': 0.5911607941683469, 'weight-decay': 0.0029691488650029417, 'lr': 0.0008083937435056311, 'lr-reduce-freq': 150, 'patience': 150, 'spt-alg': 'kruskal', 'manifold': 'PoincareBall', 'dim': 256, 'num-adj': 6, 'add-rate': 0.1, 'tem': 1.4, 'consis-rate': 2.0, 'use-att': 1, 'num-layers': 3}
mean: 0.6799999999999999
[0.679 0.672 0.688 0.679 0.677 0.673 0.674 0.688 0.683 0.687]
cur_param: {'dropout': 0.5805661408871426, 'weight-decay': 0.003462580625556645, 'lr': 0.0007286657792683737, 'lr-reduce-freq': 140, 'patience': 140, 'spt-alg': 'kruskal', 'manifold': 'PoincareBall', 'dim': 128, 'num-adj': 8, 'add-rate': 0.1, 'tem': 1.4, 'consis-rate': 1.9000000000000001, 'use-att': 1, 'num-layers': 3}
mean: 0.6771
[0.672 0.677 0.673 0.684 0.675 0.671 0.693 0.676 0.678 0.672]
cur_param: {'dropout': 0.5624646330164231, 'weight-decay': 0.002251687189063335, 'lr': 0.0006566890891264434, 'lr-reduce-freq': 140, 'patience': 140, 'spt-alg': 'kruskal', 'manifold': 'PoincareBall', 'dim': 256, 'num-adj': 8, 'add-rate': 0.1, 'tem': 1.3, 'consis-rate': 2.0, 'use-att': 1, 'num-layers': 3}
mean: 0.6795000000000001
[0.676 0.673 0.675 0.679 0.673 0.679 0.687 0.683 0.679 0.691]
cur_param: {'dropout': 0.5704097573666468, 'weight-decay': 0.0026627833665190783, 'lr': 0.0007834105835307744, 'lr-reduce-freq': 130, 'patience': 130, 'spt-alg': 'kruskal', 'manifold': 'PoincareBall', 'dim': 256, 'num-adj': 8, 'add-rate': 0.1, 'tem': 1.4, 'consis-rate': 1.9000000000000001, 'use-att': 1, 'num-layers': 3}
mean: 0.6809999999999999
[0.681 0.665 0.691 0.673 0.673 0.697 0.676 0.68  0.683 0.691]
cur_param: {'dropout': 0.5997115076083589, 'weight-decay': 0.0025527333039532065, 'lr': 0.0007791251200186849, 'lr-reduce-freq': 130, 'patience': 130, 'spt-alg': 'kruskal', 'manifold': 'PoincareBall', 'dim': 256, 'num-adj': 8, 'add-rate': 0.1, 'tem': 1.4, 'consis-rate': 1.9000000000000001, 'use-att': 1, 'num-layers': 3}
mean: 0.682
[0.684 0.681 0.689 0.673 0.678 0.678 0.68  0.683 0.681 0.693]
cur_param: {'dropout': 0.5994896361309366, 'weight-decay': 0.002514762070992468, 'lr': 0.000869800224285479, 'lr-reduce-freq': 130, 'patience': 130, 'spt-alg': 'kruskal', 'manifold': 'PoincareBall', 'dim': 256, 'num-adj': 8, 'add-rate': 0.1, 'tem': 1.4, 'consis-rate': 1.9000000000000001, 'use-att': 1, 'num-layers': 3}
mean: 0.6791
[0.672 0.675 0.693 0.67  0.676 0.68  0.678 0.681 0.687 0.679]
cur_param: {'dropout': 0.5880289672293233, 'weight-decay': 0.002732135125311773, 'lr': 0.0007888727928885448, 'lr-reduce-freq': 130, 'patience': 130, 'spt-alg': 'kruskal', 'manifold': 'PoincareBall', 'dim': 256, 'num-adj': 8, 'add-rate': 0.1, 'tem': 1.5, 'consis-rate': 1.9000000000000001, 'use-att': 1, 'num-layers': 3}
mean: 0.6793
[0.67  0.672 0.691 0.673 0.676 0.675 0.673 0.689 0.681 0.693]
cur_param: {'dropout': 0.5737392243714371, 'weight-decay': 0.0030221913399901303, 'lr': 0.0006766512129285008, 'lr-reduce-freq': 130, 'patience': 130, 'spt-alg': 'kruskal', 'manifold': 'PoincareBall', 'dim': 256, 'num-adj': 8, 'add-rate': 0.1, 'tem': 1.4, 'consis-rate': 2.0, 'use-att': 1, 'num-layers': 3}
mean: 0.6799999999999999
[0.677 0.671 0.677 0.666 0.678 0.676 0.69  0.686 0.686 0.693]
cur_param: {'dropout': 0.5924328864607915, 'weight-decay': 0.0023644314106470343, 'lr': 0.0007182531139071948, 'lr-reduce-freq': 130, 'patience': 130, 'spt-alg': 'kruskal', 'manifold': 'PoincareBall', 'dim': 256, 'num-adj': 8, 'add-rate': 0.1, 'tem': 1.4, 'consis-rate': 1.9000000000000001, 'use-att': 1, 'num-layers': 3}
mean: 0.6801
[0.676 0.665 0.685 0.674 0.677 0.67  0.689 0.69  0.681 0.694]
cur_param: {'dropout': 0.5807247026626687, 'weight-decay': 0.003178919918114607, 'lr': 0.0008422721467213568, 'lr-reduce-freq': 130, 'patience': 130, 'spt-alg': 'kruskal', 'manifold': 'PoincareBall', 'dim': 256, 'num-adj': 8, 'add-rate': 0.1, 'tem': 1.4, 'consis-rate': 2.0, 'use-att': 1, 'num-layers': 3}[32m[I 2022-06-16 22:37:36,698][0m Trial 188 finished with value: 0.6796 and parameters: {'dropout': 0.5807247026626687, 'weight_decay': 0.003178919918114607, 'lr': 0.0008422721467213568, 'patience': 130, 'spt-alg': 'kruskal', 'manifold': 'PoincareBall', 'dim': 256, 'num-adj': 8, 'add-rate': 0.1, 'tem': 1.4, 'consis-rate': 2.0, 'use-att': 1, 'num-layers': 3}. Best is trial 115 with value: 0.6829000000000001.[0m
[32m[I 2022-06-16 22:40:21,024][0m Trial 189 finished with value: 0.6796000000000001 and parameters: {'dropout': 0.5856519561719886, 'weight_decay': 0.00274569162327904, 'lr': 0.0007707853106626778, 'patience': 130, 'spt-alg': 'kruskal', 'manifold': 'PoincareBall', 'dim': 256, 'num-adj': 8, 'add-rate': 0.1, 'tem': 1.5, 'consis-rate': 1.9000000000000001, 'use-att': 1, 'num-layers': 3}. Best is trial 115 with value: 0.6829000000000001.[0m
[32m[I 2022-06-16 22:42:42,342][0m Trial 190 finished with value: 0.6731 and parameters: {'dropout': 0.5997352275672119, 'weight_decay': 0.0034379276918681495, 'lr': 0.00631919957132379, 'patience': 90, 'spt-alg': 'kruskal', 'manifold': 'Hyperboloid', 'dim': 192, 'num-adj': 8, 'add-rate': 0.1, 'tem': 1.4, 'consis-rate': 1.9000000000000001, 'use-att': 1, 'num-layers': 3}. Best is trial 115 with value: 0.6829000000000001.[0m
[32m[I 2022-06-16 22:45:32,697][0m Trial 191 finished with value: 0.6798 and parameters: {'dropout': 0.5663821303325723, 'weight_decay': 0.004589070066778587, 'lr': 0.0007276723019105714, 'patience': 140, 'spt-alg': 'kruskal', 'manifold': 'PoincareBall', 'dim': 256, 'num-adj': 8, 'add-rate': 0.1, 'tem': 1.4, 'consis-rate': 1.8, 'use-att': 1, 'num-layers': 3}. Best is trial 115 with value: 0.6829000000000001.[0m
[32m[I 2022-06-16 22:48:28,024][0m Trial 192 finished with value: 0.6773999999999999 and parameters: {'dropout': 0.5750835869012825, 'weight_decay': 0.03161060913666041, 'lr': 0.000810817745790068, 'patience': 140, 'spt-alg': 'kruskal', 'manifold': 'PoincareBall', 'dim': 256, 'num-adj': 8, 'add-rate': 0.4, 'tem': 1.4, 'consis-rate': 2.0, 'use-att': 1, 'num-layers': 3}. Best is trial 115 with value: 0.6829000000000001.[0m
[32m[I 2022-06-16 22:51:04,078][0m Trial 193 finished with value: 0.6803999999999999 and parameters: {'dropout': 0.5675548073946346, 'weight_decay': 0.003967677834680678, 'lr': 0.0009504325932748803, 'patience': 130, 'spt-alg': 'kruskal', 'manifold': 'PoincareBall', 'dim': 256, 'num-adj': 6, 'add-rate': 0.1, 'tem': 1.1, 'consis-rate': 1.9000000000000001, 'use-att': 1, 'num-layers': 3}. Best is trial 115 with value: 0.6829000000000001.[0m
[32m[I 2022-06-16 22:54:03,953][0m Trial 194 finished with value: 0.6795 and parameters: {'dropout': 0.5914890093872852, 'weight_decay': 0.0028898128470742127, 'lr': 0.0006173412720818512, 'patience': 140, 'spt-alg': 'kruskal', 'manifold': 'PoincareBall', 'dim': 256, 'num-adj': 2, 'add-rate': 0.1, 'tem': 1.3, 'consis-rate': 2.0, 'use-att': 1, 'num-layers': 3}. Best is trial 115 with value: 0.6829000000000001.[0m
[32m[I 2022-06-16 22:56:43,246][0m Trial 195 finished with value: 0.6794 and parameters: {'dropout': 0.5564800088561276, 'weight_decay': 0.003149529844767496, 'lr': 0.0007494330109260925, 'patience': 130, 'spt-alg': 'kruskal', 'manifold': 'PoincareBall', 'dim': 256, 'num-adj': 6, 'add-rate': 0.1, 'tem': 1.1, 'consis-rate': 1.9000000000000001, 'use-att': 1, 'num-layers': 3}. Best is trial 115 with value: 0.6829000000000001.[0m
[32m[I 2022-06-16 22:58:52,459][0m Trial 196 finished with value: 0.665 and parameters: {'dropout': 0.580910186811478, 'weight_decay': 0.002495256481294447, 'lr': 0.008809742407287555, 'patience': 140, 'spt-alg': 'kruskal', 'manifold': 'PoincareBall', 'dim': 256, 'num-adj': 8, 'add-rate': 0.4, 'tem': 1.3, 'consis-rate': 1.8, 'use-att': 1, 'num-layers': 5}. Best is trial 115 with value: 0.6829000000000001.[0m
[32m[I 2022-06-16 23:01:30,902][0m Trial 197 finished with value: 0.6805999999999999 and parameters: {'dropout': 0.5727496248389763, 'weight_decay': 0.005378955843366139, 'lr': 0.0008760514036127567, 'patience': 130, 'spt-alg': 'kruskal', 'manifold': 'PoincareBall', 'dim': 256, 'num-adj': 6, 'add-rate': 0.1, 'tem': 1.4, 'consis-rate': 1.2000000000000002, 'use-att': 1, 'num-layers': 3}. Best is trial 115 with value: 0.6829000000000001.[0m
[32m[I 2022-06-16 23:04:15,523][0m Trial 198 finished with value: 0.68 and parameters: {'dropout': 0.5858662456126739, 'weight_decay': 0.0036905146168492286, 'lr': 0.0007054704498889017, 'patience': 130, 'spt-alg': 'kruskal', 'manifold': 'PoincareBall', 'dim': 256, 'num-adj': 8, 'add-rate': 0.30000000000000004, 'tem': 1.5, 'consis-rate': 1.9000000000000001, 'use-att': 0, 'num-layers': 4}. Best is trial 115 with value: 0.6829000000000001.[0m
[32m[I 2022-06-16 23:07:11,527][0m Trial 199 finished with value: 0.682 and parameters: {'dropout': 0.5610904569943538, 'weight_decay': 0.002728937359674479, 'lr': 0.0007790488511364283, 'patience': 140, 'spt-alg': 'prim', 'manifold': 'PoincareBall', 'dim': 256, 'num-adj': 8, 'add-rate': 0.1, 'tem': 1.0, 'consis-rate': 2.0, 'use-att': 1, 'num-layers': 3}. Best is trial 115 with value: 0.6829000000000001.[0m

mean: 0.6796
[0.682 0.672 0.69  0.68  0.677 0.678 0.687 0.68  0.668 0.682]
cur_param: {'dropout': 0.5856519561719886, 'weight-decay': 0.00274569162327904, 'lr': 0.0007707853106626778, 'lr-reduce-freq': 130, 'patience': 130, 'spt-alg': 'kruskal', 'manifold': 'PoincareBall', 'dim': 256, 'num-adj': 8, 'add-rate': 0.1, 'tem': 1.5, 'consis-rate': 1.9000000000000001, 'use-att': 1, 'num-layers': 3}
mean: 0.6796000000000001
[0.668 0.671 0.694 0.683 0.677 0.686 0.673 0.686 0.674 0.684]
cur_param: {'dropout': 0.5997352275672119, 'weight-decay': 0.0034379276918681495, 'lr': 0.00631919957132379, 'lr-reduce-freq': 90, 'patience': 90, 'spt-alg': 'kruskal', 'manifold': 'Hyperboloid', 'dim': 192, 'num-adj': 8, 'add-rate': 0.1, 'tem': 1.4, 'consis-rate': 1.9000000000000001, 'use-att': 1, 'num-layers': 3}
mean: 0.6731
[0.679 0.671 0.67  0.686 0.651 0.679 0.677 0.674 0.657 0.687]
cur_param: {'dropout': 0.5663821303325723, 'weight-decay': 0.004589070066778587, 'lr': 0.0007276723019105714, 'lr-reduce-freq': 140, 'patience': 140, 'spt-alg': 'kruskal', 'manifold': 'PoincareBall', 'dim': 256, 'num-adj': 8, 'add-rate': 0.1, 'tem': 1.4, 'consis-rate': 1.8, 'use-att': 1, 'num-layers': 3}
mean: 0.6798
[0.681 0.661 0.691 0.675 0.672 0.677 0.688 0.681 0.683 0.689]
cur_param: {'dropout': 0.5750835869012825, 'weight-decay': 0.03161060913666041, 'lr': 0.000810817745790068, 'lr-reduce-freq': 140, 'patience': 140, 'spt-alg': 'kruskal', 'manifold': 'PoincareBall', 'dim': 256, 'num-adj': 8, 'add-rate': 0.4, 'tem': 1.4, 'consis-rate': 2.0, 'use-att': 1, 'num-layers': 3}
mean: 0.6773999999999999
[0.662 0.674 0.679 0.668 0.674 0.69  0.678 0.681 0.683 0.685]
cur_param: {'dropout': 0.5675548073946346, 'weight-decay': 0.003967677834680678, 'lr': 0.0009504325932748803, 'lr-reduce-freq': 130, 'patience': 130, 'spt-alg': 'kruskal', 'manifold': 'PoincareBall', 'dim': 256, 'num-adj': 6, 'add-rate': 0.1, 'tem': 1.1, 'consis-rate': 1.9000000000000001, 'use-att': 1, 'num-layers': 3}
mean: 0.6803999999999999
[0.689 0.675 0.684 0.682 0.666 0.7   0.681 0.672 0.675 0.68 ]
cur_param: {'dropout': 0.5914890093872852, 'weight-decay': 0.0028898128470742127, 'lr': 0.0006173412720818512, 'lr-reduce-freq': 140, 'patience': 140, 'spt-alg': 'kruskal', 'manifold': 'PoincareBall', 'dim': 256, 'num-adj': 2, 'add-rate': 0.1, 'tem': 1.3, 'consis-rate': 2.0, 'use-att': 1, 'num-layers': 3}
mean: 0.6795
[0.667 0.68  0.676 0.68  0.671 0.675 0.688 0.692 0.681 0.685]
cur_param: {'dropout': 0.5564800088561276, 'weight-decay': 0.003149529844767496, 'lr': 0.0007494330109260925, 'lr-reduce-freq': 130, 'patience': 130, 'spt-alg': 'kruskal', 'manifold': 'PoincareBall', 'dim': 256, 'num-adj': 6, 'add-rate': 0.1, 'tem': 1.1, 'consis-rate': 1.9000000000000001, 'use-att': 1, 'num-layers': 3}
mean: 0.6794
[0.665 0.672 0.69  0.67  0.674 0.701 0.68  0.684 0.674 0.684]
cur_param: {'dropout': 0.580910186811478, 'weight-decay': 0.002495256481294447, 'lr': 0.008809742407287555, 'lr-reduce-freq': 140, 'patience': 140, 'spt-alg': 'kruskal', 'manifold': 'PoincareBall', 'dim': 256, 'num-adj': 8, 'add-rate': 0.4, 'tem': 1.3, 'consis-rate': 1.8, 'use-att': 1, 'num-layers': 5}
mean: 0.665
[0.664 0.673 0.656 0.681 0.666 0.656 0.668 0.652 0.673 0.661]
cur_param: {'dropout': 0.5727496248389763, 'weight-decay': 0.005378955843366139, 'lr': 0.0008760514036127567, 'lr-reduce-freq': 130, 'patience': 130, 'spt-alg': 'kruskal', 'manifold': 'PoincareBall', 'dim': 256, 'num-adj': 6, 'add-rate': 0.1, 'tem': 1.4, 'consis-rate': 1.2000000000000002, 'use-att': 1, 'num-layers': 3}
mean: 0.6805999999999999
[0.684 0.67  0.687 0.684 0.67  0.697 0.678 0.673 0.683 0.68 ]
cur_param: {'dropout': 0.5858662456126739, 'weight-decay': 0.0036905146168492286, 'lr': 0.0007054704498889017, 'lr-reduce-freq': 130, 'patience': 130, 'spt-alg': 'kruskal', 'manifold': 'PoincareBall', 'dim': 256, 'num-adj': 8, 'add-rate': 0.30000000000000004, 'tem': 1.5, 'consis-rate': 1.9000000000000001, 'use-att': 0, 'num-layers': 4}
mean: 0.68
[0.671 0.666 0.686 0.683 0.676 0.671 0.687 0.683 0.685 0.692]
cur_param: {'dropout': 0.5610904569943538, 'weight-decay': 0.002728937359674479, 'lr': 0.0007790488511364283, 'lr-reduce-freq': 140, 'patience': 140, 'spt-alg': 'prim', 'manifold': 'PoincareBall', 'dim': 256, 'num-adj': 8, 'add-rate': 0.1, 'tem': 1.0, 'consis-rate': 2.0, 'use-att': 1, 'num-layers': 3}
mean: 0.682
[0.685 0.671 0.692 0.677 0.668 0.7   0.679 0.68  0.683 0.685]
best param:{'dropout': 0.5777789502632026, 'weight_decay': 0.003704308448339366, 'lr': 0.0007352172206044276, 'patience': 140, 'spt-alg': 'kruskal', 'manifold': 'PoincareBall', 'dim': 256, 'num-adj': 8, 'add-rate': 0.4, 'tem': 1.1, 'consis-rate': 1.9000000000000001, 'use-att': 1, 'num-layers': 3}
best score:0.6829000000000001

Final results:

0.6829000000000001
