[32m[I 2022-06-16 15:57:51,434][0m Trial 61 finished with value: 0.6790999999999999 and parameters: {'dropout': 0.5867831146778494, 'weight_decay': 0.005149919870185536, 'lr': 0.0010328536720645449, 'patience': 140, 'spt-alg': 'kruskal', 'manifold': 'PoincareBall', 'dim': 256, 'num-adj': 6, 'add-rate': 0.2, 'tem': 1.0, 'consis-rate': 1.2000000000000002, 'use-att': 1, 'num-layers': 4}. Best is trial 16 with value: 0.6812000000000001.[0m

cur_param: {'dropout': 0.5506037265058766, 'weight-decay': 0.008321165920504572, 'lr': 0.0005076607228438369, 'lr-reduce-freq': 150, 'patience': 150, 'spt-alg': 'kruskal', 'manifold': 'PoincareBall', 'dim': 192, 'num-adj': 6, 'add-rate': 0.2, 'tem': 0.6, 'consis-rate': 0.7, 'use-att': 1, 'num-layers': 4}
mean: 0.6783
[0.678 0.672 0.676 0.676 0.687 0.675 0.682 0.676 0.681 0.68 ]
cur_param: {'dropout': 0.5799633059061625, 'weight-decay': 0.002169385565362999, 'lr': 0.0012710489126418127, 'lr-reduce-freq': 130, 'patience': 130, 'spt-alg': 'kruskal', 'manifold': 'PoincareBall', 'dim': 256, 'num-adj': 6, 'add-rate': 0.2, 'tem': 0.7, 'consis-rate': 0.7, 'use-att': 1, 'num-layers': 4}
mean: 0.6783
[0.665 0.671 0.682 0.685 0.676 0.691 0.688 0.677 0.675 0.673]
cur_param: {'dropout': 0.5760937160657417, 'weight-decay': 0.0019863159196591294, 'lr': 0.0010414850460435283, 'lr-reduce-freq': 130, 'patience': 130, 'spt-alg': 'kruskal', 'manifold': 'PoincareBall', 'dim': 192, 'num-adj': 6, 'add-rate': 0.4, 'tem': 0.5, 'consis-rate': 0.7, 'use-att': 1, 'num-layers': 4}
mean: 0.6769999999999999
[0.675 0.667 0.671 0.668 0.68  0.66  0.69  0.677 0.693 0.689]
cur_param: {'dropout': 0.5285476117645852, 'weight-decay': 0.0015501023373661184, 'lr': 0.0005058300940112432, 'lr-reduce-freq': 140, 'patience': 140, 'spt-alg': 'kruskal', 'manifold': 'PoincareBall', 'dim': 192, 'num-adj': 4, 'add-rate': 0.2, 'tem': 0.6, 'consis-rate': 0.5, 'use-att': 1, 'num-layers': 4}
mean: 0.6747
[0.678 0.673 0.675 0.675 0.685 0.673 0.666 0.669 0.678 0.675]
cur_param: {'dropout': 0.5064467888629272, 'weight-decay': 0.002364201164074932, 'lr': 0.0011303520203222507, 'lr-reduce-freq': 130, 'patience': 130, 'spt-alg': 'kruskal', 'manifold': 'Hyperboloid', 'dim': 256, 'num-adj': 6, 'add-rate': 0.30000000000000004, 'tem': 0.7, 'consis-rate': 0.7, 'use-att': 0, 'num-layers': 4}
mean: 0.6722000000000001
[0.666 0.672 0.678 0.697 0.668 0.664 0.661 0.668 0.666 0.682]
cur_param: {'dropout': 0.5550330248588484, 'weight-decay': 0.0037273886287723067, 'lr': 0.0014228064458427032, 'lr-reduce-freq': 150, 'patience': 150, 'spt-alg': 'prim', 'manifold': 'PoincareBall', 'dim': 128, 'num-adj': 8, 'add-rate': 0.5, 'tem': 1.2000000000000002, 'consis-rate': 0.8, 'use-att': 1, 'num-layers': 4}
mean: 0.6747000000000001
[0.671 0.678 0.682 0.654 0.668 0.669 0.682 0.682 0.678 0.683]
cur_param: {'dropout': 0.5841321795264046, 'weight-decay': 0.004847056583753866, 'lr': 0.0006551279673969522, 'lr-reduce-freq': 120, 'patience': 120, 'spt-alg': 'kruskal', 'manifold': 'PoincareBall', 'dim': 256, 'num-adj': 6, 'add-rate': 0.2, 'tem': 0.9, 'consis-rate': 1.1, 'use-att': 1, 'num-layers': 4}
mean: 0.6791
[0.671 0.672 0.678 0.68  0.68  0.677 0.688 0.686 0.676 0.683]
cur_param: {'dropout': 0.5801187189065222, 'weight-decay': 0.005755709774292071, 'lr': 0.0006574830529847286, 'lr-reduce-freq': 110, 'patience': 110, 'spt-alg': 'kruskal', 'manifold': 'Hyperboloid', 'dim': 256, 'num-adj': 6, 'add-rate': 0.4, 'tem': 0.9, 'consis-rate': 1.1, 'use-att': 1, 'num-layers': 4}
mean: 0.6729
[0.668 0.681 0.674 0.679 0.678 0.66  0.669 0.67  0.673 0.677]
cur_param: {'dropout': 0.40120845443995534, 'weight-decay': 0.0014667134303976317, 'lr': 0.0006141056244197463, 'lr-reduce-freq': 120, 'patience': 120, 'spt-alg': 'kruskal', 'manifold': 'PoincareBall', 'dim': 256, 'num-adj': 2, 'add-rate': 0.6, 'tem': 0.9, 'consis-rate': 1.0, 'use-att': 1, 'num-layers': 4}
mean: 0.6709
[0.668 0.659 0.685 0.667 0.659 0.678 0.68  0.672 0.673 0.668]
cur_param: {'dropout': 0.5808381510841422, 'weight-decay': 0.0045601771137897896, 'lr': 0.0009220134882852459, 'lr-reduce-freq': 140, 'patience': 140, 'spt-alg': 'kruskal', 'manifold': 'PoincareBall', 'dim': 256, 'num-adj': 6, 'add-rate': 0.2, 'tem': 0.7, 'consis-rate': 1.2000000000000002, 'use-att': 1, 'num-layers': 4}
mean: 0.6784
[0.685 0.666 0.685 0.683 0.668 0.68  0.677 0.677 0.68  0.683]
cur_param: {'dropout': 0.5825985233347514, 'weight-decay': 0.0032340383642412407, 'lr': 0.0008442827444636766, 'lr-reduce-freq': 130, 'patience': 130, 'spt-alg': 'kruskal', 'manifold': 'PoincareBall', 'dim': 256, 'num-adj': 6, 'add-rate': 0.2, 'tem': 0.8, 'consis-rate': 1.2000000000000002, 'use-att': 1, 'num-layers': 4}
mean: 0.6809000000000001
[0.681 0.671 0.689 0.683 0.676 0.683 0.675 0.681 0.684 0.686]
cur_param: {'dropout': 0.5829190857492011, 'weight-decay': 0.0047672701669143145, 'lr': 0.0009540020123205163, 'lr-reduce-freq': 140, 'patience': 140, 'spt-alg': 'kruskal', 'manifold': 'PoincareBall', 'dim': 256, 'num-adj': 6, 'add-rate': 0.2, 'tem': 0.9, 'consis-rate': 1.2000000000000002, 'use-att': 1, 'num-layers': 4}
mean: 0.6784000000000001
[0.686 0.666 0.689 0.683 0.671 0.679 0.677 0.676 0.679 0.678]
cur_param: {'dropout': 0.5603565596845272, 'weight-decay': 0.003061447064208701, 'lr': 0.0007581060523657117, 'lr-reduce-freq': 130, 'patience': 130, 'spt-alg': 'kruskal', 'manifold': 'PoincareBall', 'dim': 256, 'num-adj': 4, 'add-rate': 0.30000000000000004, 'tem': 1.0, 'consis-rate': 1.1, 'use-att': 1, 'num-layers': 4}
mean: 0.6812
[0.674 0.671 0.692 0.674 0.677 0.7   0.681 0.682 0.673 0.688]
cur_param: {'dropout': 0.5300599349875591, 'weight-decay': 0.00320614185132382, 'lr': 0.0007131530277453826, 'lr-reduce-freq': 120, 'patience': 120, 'spt-alg': 'kruskal', 'manifold': 'PoincareBall', 'dim': 256, 'num-adj': 4, 'add-rate': 0.30000000000000004, 'tem': 1.0, 'consis-rate': 1.3, 'use-att': 1, 'num-layers': 4}
mean: 0.677
[0.676 0.669 0.68  0.676 0.674 0.688 0.68  0.679 0.673 0.675]
cur_param: {'dropout': 0.5603928276137853, 'weight-decay': 0.002500776723175966, 'lr': 0.0005843807499378704, 'lr-reduce-freq': 130, 'patience': 130, 'spt-alg': 'kruskal', 'manifold': 'PoincareBall', 'dim': 256, 'num-adj': 4, 'add-rate': 0.30000000000000004, 'tem': 1.1, 'consis-rate': 1.4, 'use-att': 1, 'num-layers': 4}
mean: 0.6782
[0.674 0.668 0.684 0.676 0.661 0.695 0.686 0.68  0.674 0.684]
cur_param: {'dropout': 0.3717843046019164, 'weight-decay': 0.005967832283605759, 'lr': 0.0008004918672993673, 'lr-reduce-freq': 110, 'patience': 110, 'spt-alg': 'kruskal', 'manifold': 'Hyperboloid', 'dim': 128, 'num-adj': 4, 'add-rate': 0.30000000000000004, 'tem': 1.0, 'consis-rate': 1.1, 'use-att': 0, 'num-layers': 4}
mean: 0.6667000000000001
[0.677 0.67  0.668 0.664 0.665 0.656 0.672 0.661 0.66  0.674]
cur_param: {'dropout': 0.4949758474743636, 'weight-decay': 0.0038299409537951804, 'lr': 0.0032727653913265566, 'lr-reduce-freq': 130, 'patience': 130, 'spt-alg': 'prim', 'manifold': 'PoincareBall', 'dim': 256, 'num-adj': 4, 'add-rate': 0.2, 'tem': 0.9, 'consis-rate': 1.0, 'use-att': 1, 'num-layers': 5}
mean: 0.674
[0.669 0.665 0.679 0.685 0.661 0.678 0.673 0.675 0.678 0.677]
cur_param: {'dropout': 0.5999624108257808, 'weight-decay': 0.003214195925816793, 'lr': 0.0008083978068214835, 'lr-reduce-freq': 120, 'patience': 120, 'spt-alg': 'kruskal', 'manifold': 'PoincareBall', 'dim': 128, 'num-adj': 4, 'add-rate': 0.1, 'tem': 0.8, 'consis-rate': 1.1, 'use-att': 1, 'num-layers': 4}
mean: 0.6775
[0.681 0.669 0.685 0.671 0.674 0.669 0.691 0.678 0.675 0.682]
cur_param: {'dropout': 0.5403610928833877, 'weight-decay': 0.00432156443936697, 'lr': 0.002562040424017636, 'lr-reduce-freq': 130, 'patience': 130, 'spt-alg': 'kruskal', 'manifold': 'PoincareBall', 'dim': 256, 'num-adj': 8, 'add-rate': 0.2, 'tem': 1.2000000000000002, 'consis-rate': 1.2000000000000002, 'use-att': 1, 'num-layers': 4}
mean: 0.6747
[0.675 0.66  0.686 0.684 0.676 0.679 0.678 0.676 0.665 0.668]
cur_param: {'dropout': 0.5867831146778494, 'weight-decay': 0.005149919870185536, 'lr': 0.0010328536720645449, 'lr-reduce-freq': 140, 'patience': 140, 'spt-alg': 'kruskal', 'manifold': 'PoincareBall', 'dim': 256, 'num-adj': 6, 'add-rate': 0.2, 'tem': 1.0, 'consis-rate': 1.2000000000000002, 'use-att': 1, 'num-layers': 4}
mean: 0.6790999999999999
[0.689 0.673 0.689 0.684 0.67  0.694 0.677 0.673 0.667 0.675]
cur_param: {'dropout': 0.5166308029888649, 'weight-decay': 0.005214385535496186, 'lr': 0.0006596435817904947, 'lr-reduce-freq': 140, 'patience': 140, 'spt-alg': 'kruskal', 'manifold': 'PoincareBall', 'dim': 256, 'num-adj': 6, 'add-rate': 0.2, 'tem': 1.0, 'consis-rate': 1.2000000000000002, 'use-att': 1, 'num-layers': 4}[32m[I 2022-06-16 16:01:13,126][0m Trial 62 finished with value: 0.6795000000000001 and parameters: {'dropout': 0.5166308029888649, 'weight_decay': 0.005214385535496186, 'lr': 0.0006596435817904947, 'patience': 140, 'spt-alg': 'kruskal', 'manifold': 'PoincareBall', 'dim': 256, 'num-adj': 6, 'add-rate': 0.2, 'tem': 1.0, 'consis-rate': 1.2000000000000002, 'use-att': 1, 'num-layers': 4}. Best is trial 16 with value: 0.6812000000000001.[0m
[32m[I 2022-06-16 16:04:25,115][0m Trial 63 finished with value: 0.6807000000000001 and parameters: {'dropout': 0.5589457897358308, 'weight_decay': 0.005234241145739344, 'lr': 0.0007527986644544436, 'patience': 140, 'spt-alg': 'kruskal', 'manifold': 'PoincareBall', 'dim': 256, 'num-adj': 6, 'add-rate': 0.2, 'tem': 1.1, 'consis-rate': 1.1, 'use-att': 1, 'num-layers': 4}. Best is trial 16 with value: 0.6812000000000001.[0m
[32m[I 2022-06-16 16:07:48,206][0m Trial 64 finished with value: 0.6775 and parameters: {'dropout': 0.48665009149120475, 'weight_decay': 0.01077220929097612, 'lr': 0.0005820613591836204, 'patience': 140, 'spt-alg': 'kruskal', 'manifold': 'PoincareBall', 'dim': 256, 'num-adj': 6, 'add-rate': 0.30000000000000004, 'tem': 1.4, 'consis-rate': 1.1, 'use-att': 1, 'num-layers': 4}. Best is trial 16 with value: 0.6812000000000001.[0m
[32m[I 2022-06-16 16:11:19,473][0m Trial 65 finished with value: 0.679 and parameters: {'dropout': 0.5103981923375037, 'weight_decay': 0.007983781909967444, 'lr': 0.0006917676227177151, 'patience': 140, 'spt-alg': 'kruskal', 'manifold': 'PoincareBall', 'dim': 256, 'num-adj': 6, 'add-rate': 0.1, 'tem': 1.1, 'consis-rate': 1.0, 'use-att': 1, 'num-layers': 4}. Best is trial 16 with value: 0.6812000000000001.[0m
[32m[I 2022-06-16 16:14:42,826][0m Trial 66 finished with value: 0.6782 and parameters: {'dropout': 0.5554804278684149, 'weight_decay': 0.0027598635312249295, 'lr': 0.000625193647705505, 'patience': 130, 'spt-alg': 'kruskal', 'manifold': 'PoincareBall', 'dim': 256, 'num-adj': 6, 'add-rate': 0.2, 'tem': 1.1, 'consis-rate': 0.9, 'use-att': 1, 'num-layers': 4}. Best is trial 16 with value: 0.6812000000000001.[0m
[32m[I 2022-06-16 16:17:44,739][0m Trial 67 finished with value: 0.679 and parameters: {'dropout': 0.5212155712584551, 'weight_decay': 0.006355151730211729, 'lr': 0.0007697132220017859, 'patience': 120, 'spt-alg': 'kruskal', 'manifold': 'PoincareBall', 'dim': 256, 'num-adj': 2, 'add-rate': 0.30000000000000004, 'tem': 1.0, 'consis-rate': 1.3, 'use-att': 1, 'num-layers': 4}. Best is trial 16 with value: 0.6812000000000001.[0m
[32m[I 2022-06-16 16:21:10,309][0m Trial 68 finished with value: 0.6748000000000001 and parameters: {'dropout': 0.5669871774533077, 'weight_decay': 0.004138861500019565, 'lr': 0.0005551173256888638, 'patience': 140, 'spt-alg': 'kruskal', 'manifold': 'PoincareBall', 'dim': 256, 'num-adj': 4, 'add-rate': 0.1, 'tem': 1.2000000000000002, 'consis-rate': 1.1, 'use-att': 1, 'num-layers': 4}. Best is trial 16 with value: 0.6812000000000001.[0m
[32m[I 2022-06-16 16:24:13,512][0m Trial 69 finished with value: 0.6767000000000001 and parameters: {'dropout': 0.46789063220768035, 'weight_decay': 0.005523996638828386, 'lr': 0.0007425968129849428, 'patience': 130, 'spt-alg': 'prim', 'manifold': 'PoincareBall', 'dim': 256, 'num-adj': 6, 'add-rate': 0.4, 'tem': 0.9, 'consis-rate': 1.0, 'use-att': 0, 'num-layers': 5}. Best is trial 16 with value: 0.6812000000000001.[0m
[32m[I 2022-06-16 16:29:20,472][0m Trial 70 finished with value: 0.6729 and parameters: {'dropout': 0.5333069200088079, 'weight_decay': 0.007150231418218825, 'lr': 0.0008724482137476733, 'patience': 150, 'spt-alg': 'kruskal', 'manifold': 'Hyperboloid', 'dim': 256, 'num-adj': 6, 'add-rate': 0.2, 'tem': 1.0, 'consis-rate': 1.3, 'use-att': 1, 'num-layers': 4}. Best is trial 16 with value: 0.6812000000000001.[0m
[32m[I 2022-06-16 16:32:23,632][0m Trial 71 finished with value: 0.6792 and parameters: {'dropout': 0.5868164145742661, 'weight_decay': 0.00531698997083637, 'lr': 0.0010379357354353758, 'patience': 140, 'spt-alg': 'kruskal', 'manifold': 'PoincareBall', 'dim': 256, 'num-adj': 6, 'add-rate': 0.2, 'tem': 1.0, 'consis-rate': 1.2000000000000002, 'use-att': 1, 'num-layers': 4}. Best is trial 16 with value: 0.6812000000000001.[0m
[32m[I 2022-06-16 16:35:43,226][0m Trial 72 finished with value: 0.6786 and parameters: {'dropout': 0.5726663652141297, 'weight_decay': 0.0032534934149580645, 'lr': 0.0006773637516799848, 'patience': 140, 'spt-alg': 'kruskal', 'manifold': 'PoincareBall', 'dim': 256, 'num-adj': 6, 'add-rate': 0.2, 'tem': 1.1, 'consis-rate': 1.2000000000000002, 'use-att': 1, 'num-layers': 4}. Best is trial 16 with value: 0.6812000000000001.[0m
[32m[I 2022-06-16 16:38:37,267][0m Trial 73 finished with value: 0.6685 and parameters: {'dropout': 0.3024515660955317, 'weight_decay': 0.004857924342709903, 'lr': 0.0009712117310649996, 'patience': 140, 'spt-alg': 'kruskal', 'manifold': 'PoincareBall', 'dim': 256, 'num-adj': 6, 'add-rate': 0.2, 'tem': 1.0, 'consis-rate': 1.4, 'use-att': 1, 'num-layers': 4}. Best is trial 16 with value: 0.6812000000000001.[0m
[32m[I 2022-06-16 16:41:44,885][0m Trial 74 finished with value: 0.6806 and parameters: {'dropout': 0.5894951489172744, 'weight_decay': 0.0037244348332596657, 'lr': 0.0008532299074901962, 'patience': 130, 'spt-alg': 'kruskal', 'manifold': 'PoincareBall', 'dim': 256, 'num-adj': 6, 'add-rate': 0.2, 'tem': 0.8, 'consis-rate': 1.1, 'use-att': 1, 'num-layers': 4}. Best is trial 16 with value: 0.6812000000000001.[0m
[32m[I 2022-06-16 16:44:47,905][0m Trial 75 finished with value: 0.6811 and parameters: {'dropout': 0.5506002377465402, 'weight_decay': 0.003442773702645102, 'lr': 0.0011601710072005158, 'patience': 130, 'spt-alg': 'kruskal', 'manifold': 'PoincareBall', 'dim': 256, 'num-adj': 6, 'add-rate': 0.1, 'tem': 1.1, 'consis-rate': 1.2000000000000002, 'use-att': 1, 'num-layers': 4}. Best is trial 16 with value: 0.6812000000000001.[0m
[32m[I 2022-06-16 16:47:46,016][0m Trial 76 finished with value: 0.6799 and parameters: {'dropout': 0.5492323842811925, 'weight_decay': 0.002775458149184321, 'lr': 0.0012102013346874298, 'patience': 130, 'spt-alg': 'kruskal', 'manifold': 'PoincareBall', 'dim': 256, 'num-adj': 6, 'add-rate': 0.1, 'tem': 1.1, 'consis-rate': 1.5, 'use-att': 1, 'num-layers': 4}. Best is trial 16 with value: 0.6812000000000001.[0m
[32m[I 2022-06-16 16:50:25,485][0m Trial 77 finished with value: 0.6796 and parameters: {'dropout': 0.5495564576132882, 'weight_decay': 0.002735044164612314, 'lr': 0.0012410228255787998, 'patience': 130, 'spt-alg': 'kruskal', 'manifold': 'PoincareBall', 'dim': 256, 'num-adj': 6, 'add-rate': 0.1, 'tem': 1.3, 'consis-rate': 1.5, 'use-att': 1, 'num-layers': 4}. Best is trial 16 with value: 0.6812000000000001.[0m
[32m[I 2022-06-16 16:53:21,970][0m Trial 78 finished with value: 0.6774 and parameters: {'dropout': 0.5483633598352959, 'weight_decay': 0.0017326233879744865, 'lr': 0.0013489813289073909, 'patience': 130, 'spt-alg': 'kruskal', 'manifold': 'PoincareBall', 'dim': 256, 'num-adj': 6, 'add-rate': 0.1, 'tem': 1.4, 'consis-rate': 1.5, 'use-att': 1, 'num-layers': 4}. Best is trial 16 with value: 0.6812000000000001.[0m
[32m[I 2022-06-16 16:56:06,764][0m Trial 79 finished with value: 0.6805 and parameters: {'dropout': 0.562446021476547, 'weight_decay': 0.002075411253702791, 'lr': 0.0016004544662401132, 'patience': 130, 'spt-alg': 'kruskal', 'manifold': 'PoincareBall', 'dim': 256, 'num-adj': 8, 'add-rate': 0.1, 'tem': 1.3, 'consis-rate': 1.6, 'use-att': 1, 'num-layers': 4}. Best is trial 16 with value: 0.6812000000000001.[0m
[32m[I 2022-06-16 16:58:48,945][0m Trial 80 finished with value: 0.6805 and parameters: {'dropout': 0.5626096277443964, 'weight_decay': 0.00223308620507586, 'lr': 0.0015946234870314658, 'patience': 120, 'spt-alg': 'kruskal', 'manifold': 'PoincareBall', 'dim': 256, 'num-adj': 8, 'add-rate': 0.1, 'tem': 1.2000000000000002, 'consis-rate': 1.7000000000000002, 'use-att': 1, 'num-layers': 3}. Best is trial 16 with value: 0.6812000000000001.[0m
[32m[I 2022-06-16 17:01:45,745][0m Trial 81 finished with value: 0.681 and parameters: {'dropout': 0.5619791257780323, 'weight_decay': 0.0020856840561892173, 'lr': 0.0016249455120346075, 'patience': 130, 'spt-alg': 'kruskal', 'manifold': 'PoincareBall', 'dim': 256, 'num-adj': 8, 'add-rate': 0.1, 'tem': 1.2000000000000002, 'consis-rate': 1.7000000000000002, 'use-att': 1, 'num-layers': 3}. Best is trial 16 with value: 0.6812000000000001.[0m
