[32m[I 2022-06-16 15:59:10,507][0m Trial 61 finished with value: 0.6777 and parameters: {'dropout': 0.5483270141043075, 'weight_decay': 0.0005898575776890941, 'lr': 0.0012348014373780285, 'patience': 150, 'spt-alg': 'kruskal', 'manifold': 'Hyperboloid', 'dim': 192, 'num-adj': 2, 'add-rate': 0.4, 'tem': 0.9, 'consis-rate': 0.6, 'use-att': 0, 'num-layers': 5}. Best is trial 57 with value: 0.679.[0m

mean: 0.6759000000000002
[0.676 0.686 0.676 0.666 0.673 0.667 0.69  0.672 0.666 0.687]
cur_param: {'dropout': 0.5997433543716181, 'weight-decay': 0.00065621694025104, 'lr': 0.003222739517064615, 'lr-reduce-freq': 60, 'patience': 60, 'spt-alg': 'prim', 'manifold': 'Hyperboloid', 'dim': 128, 'num-adj': 6, 'add-rate': 0.5, 'tem': 1.1, 'consis-rate': 1.9000000000000001, 'use-att': 1, 'num-layers': 5}
mean: 0.6765999999999999
[0.68  0.68  0.668 0.671 0.676 0.663 0.7   0.664 0.677 0.687]
cur_param: {'dropout': 0.5994488253931379, 'weight-decay': 0.0006553985097508787, 'lr': 0.002261913727079204, 'lr-reduce-freq': 60, 'patience': 60, 'spt-alg': 'prim', 'manifold': 'Hyperboloid', 'dim': 128, 'num-adj': 6, 'add-rate': 0.6, 'tem': 1.2000000000000002, 'consis-rate': 1.8, 'use-att': 1, 'num-layers': 5}
mean: 0.6748999999999999
[0.687 0.675 0.666 0.669 0.668 0.669 0.692 0.665 0.672 0.686]
cur_param: {'dropout': 0.5767607172594813, 'weight-decay': 0.0008523015101860956, 'lr': 0.0032069452965511934, 'lr-reduce-freq': 50, 'patience': 50, 'spt-alg': 'prim', 'manifold': 'Hyperboloid', 'dim': 128, 'num-adj': 6, 'add-rate': 0.5, 'tem': 1.0, 'consis-rate': 2.0, 'use-att': 1, 'num-layers': 5}
mean: 0.675
[0.688 0.688 0.67  0.665 0.673 0.667 0.695 0.658 0.672 0.674]
cur_param: {'dropout': 0.5701130364128228, 'weight-decay': 0.0011956146403406, 'lr': 0.004193217138270467, 'lr-reduce-freq': 60, 'patience': 60, 'spt-alg': 'prim', 'manifold': 'Hyperboloid', 'dim': 128, 'num-adj': 4, 'add-rate': 0.5, 'tem': 1.1, 'consis-rate': 1.7000000000000002, 'use-att': 1, 'num-layers': 5}
mean: 0.6735
[0.683 0.676 0.679 0.663 0.67  0.66  0.698 0.664 0.667 0.675]
cur_param: {'dropout': 0.5451859400717799, 'weight-decay': 0.000641861845489236, 'lr': 0.0017567952466802854, 'lr-reduce-freq': 70, 'patience': 70, 'spt-alg': 'prim', 'manifold': 'PoincareBall', 'dim': 192, 'num-adj': 6, 'add-rate': 0.6, 'tem': 1.3, 'consis-rate': 0.9, 'use-att': 1, 'num-layers': 5}
mean: 0.675
[0.675 0.687 0.67  0.657 0.681 0.673 0.687 0.683 0.665 0.672]
cur_param: {'dropout': 0.5244995441914693, 'weight-decay': 0.0005044289964685438, 'lr': 0.0035680335426331645, 'lr-reduce-freq': 50, 'patience': 50, 'spt-alg': 'prim', 'manifold': 'Hyperboloid', 'dim': 128, 'num-adj': 2, 'add-rate': 0.4, 'tem': 0.9, 'consis-rate': 1.5, 'use-att': 1, 'num-layers': 5}
mean: 0.6782000000000001
[0.691 0.666 0.675 0.675 0.671 0.674 0.693 0.668 0.682 0.687]
cur_param: {'dropout': 0.5221232765077344, 'weight-decay': 0.000510547047350826, 'lr': 0.0037132020565343467, 'lr-reduce-freq': 50, 'patience': 50, 'spt-alg': 'prim', 'manifold': 'Hyperboloid', 'dim': 64, 'num-adj': 2, 'add-rate': 0.30000000000000004, 'tem': 0.8, 'consis-rate': 1.5, 'use-att': 1, 'num-layers': 5}
mean: 0.6735000000000001
[0.679 0.681 0.675 0.687 0.662 0.671 0.671 0.679 0.669 0.661]
cur_param: {'dropout': 0.517081676225306, 'weight-decay': 0.0006291387616170776, 'lr': 0.0026181042939050847, 'lr-reduce-freq': 150, 'patience': 150, 'spt-alg': 'kruskal', 'manifold': 'Hyperboloid', 'dim': 128, 'num-adj': 2, 'add-rate': 0.4, 'tem': 0.9, 'consis-rate': 1.4, 'use-att': 0, 'num-layers': 5}
mean: 0.6772
[0.676 0.674 0.676 0.664 0.692 0.667 0.696 0.668 0.68  0.679]
cur_param: {'dropout': 0.5084613593936025, 'weight-decay': 0.0009824657741121206, 'lr': 0.0026783830210761524, 'lr-reduce-freq': 150, 'patience': 150, 'spt-alg': 'kruskal', 'manifold': 'PoincareBall', 'dim': 256, 'num-adj': 2, 'add-rate': 0.4, 'tem': 0.9, 'consis-rate': 1.2000000000000002, 'use-att': 0, 'num-layers': 5}
mean: 0.6737
[0.676 0.664 0.672 0.679 0.673 0.685 0.676 0.671 0.671 0.67 ]
cur_param: {'dropout': 0.5999060260971417, 'weight-decay': 0.0006192059622849994, 'lr': 0.002456489930551745, 'lr-reduce-freq': 140, 'patience': 140, 'spt-alg': 'kruskal', 'manifold': 'Hyperboloid', 'dim': 128, 'num-adj': 2, 'add-rate': 0.4, 'tem': 0.7, 'consis-rate': 1.4, 'use-att': 0, 'num-layers': 5}
mean: 0.6762
[0.679 0.679 0.672 0.668 0.681 0.671 0.676 0.674 0.677 0.685]
cur_param: {'dropout': 0.5349368610947469, 'weight-decay': 0.0005117806193611152, 'lr': 0.001980760281641413, 'lr-reduce-freq': 130, 'patience': 130, 'spt-alg': 'kruskal', 'manifold': 'Hyperboloid', 'dim': 128, 'num-adj': 2, 'add-rate': 0.30000000000000004, 'tem': 0.8, 'consis-rate': 1.3, 'use-att': 0, 'num-layers': 5}
mean: 0.6756
[0.681 0.672 0.675 0.663 0.666 0.665 0.695 0.671 0.675 0.693]
cur_param: {'dropout': 0.5814187336840371, 'weight-decay': 0.0006801465796937284, 'lr': 0.0035168010209736308, 'lr-reduce-freq': 50, 'patience': 50, 'spt-alg': 'kruskal', 'manifold': 'Hyperboloid', 'dim': 128, 'num-adj': 2, 'add-rate': 0.4, 'tem': 0.9, 'consis-rate': 0.5, 'use-att': 0, 'num-layers': 5}
mean: 0.6780000000000002
[0.677 0.687 0.676 0.672 0.686 0.673 0.692 0.663 0.669 0.685]
cur_param: {'dropout': 0.520618267706793, 'weight-decay': 0.001227065271168083, 'lr': 0.00405235465586369, 'lr-reduce-freq': 50, 'patience': 50, 'spt-alg': 'kruskal', 'manifold': 'Hyperboloid', 'dim': 128, 'num-adj': 2, 'add-rate': 0.4, 'tem': 0.9, 'consis-rate': 0.8, 'use-att': 0, 'num-layers': 5}
mean: 0.6725000000000001
[0.688 0.658 0.666 0.662 0.671 0.678 0.696 0.658 0.67  0.678]
cur_param: {'dropout': 0.4910409044609903, 'weight-decay': 0.0009022605478298742, 'lr': 0.004847884712416325, 'lr-reduce-freq': 140, 'patience': 140, 'spt-alg': 'kruskal', 'manifold': 'Hyperboloid', 'dim': 128, 'num-adj': 2, 'add-rate': 0.2, 'tem': 0.6, 'consis-rate': 1.2000000000000002, 'use-att': 0, 'num-layers': 4}
mean: 0.6714000000000001
[0.671 0.652 0.675 0.657 0.69  0.681 0.67  0.665 0.671 0.682]
cur_param: {'dropout': 0.47008259520588913, 'weight-decay': 0.0006994988262193289, 'lr': 0.002712183437236874, 'lr-reduce-freq': 110, 'patience': 110, 'spt-alg': 'kruskal', 'manifold': 'Hyperboloid', 'dim': 128, 'num-adj': 2, 'add-rate': 0.30000000000000004, 'tem': 0.8, 'consis-rate': 0.6, 'use-att': 0, 'num-layers': 5}
mean: 0.6736000000000001
[0.677 0.675 0.665 0.666 0.678 0.661 0.695 0.664 0.67  0.685]
cur_param: {'dropout': 0.5867924799846715, 'weight-decay': 0.0010638833550438835, 'lr': 0.001163421464978209, 'lr-reduce-freq': 120, 'patience': 120, 'spt-alg': 'kruskal', 'manifold': 'Hyperboloid', 'dim': 192, 'num-adj': 2, 'add-rate': 0.4, 'tem': 1.0, 'consis-rate': 1.0, 'use-att': 0, 'num-layers': 4}
mean: 0.679
[0.69  0.671 0.67  0.682 0.681 0.683 0.675 0.672 0.678 0.688]
cur_param: {'dropout': 0.5854698797657507, 'weight-decay': 0.0010050209168815042, 'lr': 0.0011937194899289975, 'lr-reduce-freq': 140, 'patience': 140, 'spt-alg': 'kruskal', 'manifold': 'Hyperboloid', 'dim': 192, 'num-adj': 2, 'add-rate': 0.4, 'tem': 0.9, 'consis-rate': 0.5, 'use-att': 0, 'num-layers': 5}
mean: 0.6788000000000001
[0.687 0.666 0.68  0.683 0.675 0.691 0.669 0.674 0.679 0.684]
cur_param: {'dropout': 0.5819872389076947, 'weight-decay': 0.0010424246484193045, 'lr': 0.0011359483843914264, 'lr-reduce-freq': 120, 'patience': 120, 'spt-alg': 'kruskal', 'manifold': 'Hyperboloid', 'dim': 192, 'num-adj': 2, 'add-rate': 0.30000000000000004, 'tem': 1.0, 'consis-rate': 0.5, 'use-att': 0, 'num-layers': 4}
mean: 0.6771
[0.685 0.669 0.678 0.682 0.678 0.681 0.669 0.668 0.681 0.68 ]
cur_param: {'dropout': 0.580791226611304, 'weight-decay': 0.0017803269567386708, 'lr': 0.0008335620704577295, 'lr-reduce-freq': 140, 'patience': 140, 'spt-alg': 'kruskal', 'manifold': 'Hyperboloid', 'dim': 192, 'num-adj': 2, 'add-rate': 0.4, 'tem': 0.9, 'consis-rate': 0.5, 'use-att': 0, 'num-layers': 4}
mean: 0.6739999999999999
[0.676 0.664 0.675 0.684 0.669 0.683 0.677 0.662 0.68  0.67 ]
cur_param: {'dropout': 0.5483270141043075, 'weight-decay': 0.0005898575776890941, 'lr': 0.0012348014373780285, 'lr-reduce-freq': 150, 'patience': 150, 'spt-alg': 'kruskal', 'manifold': 'Hyperboloid', 'dim': 192, 'num-adj': 2, 'add-rate': 0.4, 'tem': 0.9, 'consis-rate': 0.6, 'use-att': 0, 'num-layers': 5}
mean: 0.6777
[0.681 0.663 0.679 0.677 0.673 0.697 0.675 0.669 0.685 0.678]
cur_param: {'dropout': 0.5484842799990692, 'weight-decay': 0.0008506751060563667, 'lr': 0.0012331264856691969, 'lr-reduce-freq': 130, 'patience': 130, 'spt-alg': 'kruskal', 'manifold': 'Hyperboloid', 'dim': 192, 'num-adj': 2, 'add-rate': 0.4, 'tem': 1.0, 'consis-rate': 0.6, 'use-att': 0, 'num-layers': 5}[32m[I 2022-06-16 16:03:21,795][0m Trial 62 finished with value: 0.6774 and parameters: {'dropout': 0.5484842799990692, 'weight_decay': 0.0008506751060563667, 'lr': 0.0012331264856691969, 'patience': 130, 'spt-alg': 'kruskal', 'manifold': 'Hyperboloid', 'dim': 192, 'num-adj': 2, 'add-rate': 0.4, 'tem': 1.0, 'consis-rate': 0.6, 'use-att': 0, 'num-layers': 5}. Best is trial 57 with value: 0.679.[0m
[32m[I 2022-06-16 16:08:55,923][0m Trial 63 finished with value: 0.6768000000000001 and parameters: {'dropout': 0.5594317875848853, 'weight_decay': 0.0005825766793293355, 'lr': 0.0006499316910869257, 'patience': 150, 'spt-alg': 'kruskal', 'manifold': 'Hyperboloid', 'dim': 256, 'num-adj': 2, 'add-rate': 0.4, 'tem': 0.7, 'consis-rate': 0.7, 'use-att': 0, 'num-layers': 5}. Best is trial 57 with value: 0.679.[0m
[32m[I 2022-06-16 16:13:31,636][0m Trial 64 finished with value: 0.6743 and parameters: {'dropout': 0.5693687287944562, 'weight_decay': 0.001048240208858509, 'lr': 0.0009541399228518609, 'patience': 140, 'spt-alg': 'kruskal', 'manifold': 'Hyperboloid', 'dim': 192, 'num-adj': 2, 'add-rate': 0.2, 'tem': 0.9, 'consis-rate': 0.7, 'use-att': 0, 'num-layers': 5}. Best is trial 57 with value: 0.679.[0m
[32m[I 2022-06-16 16:17:24,050][0m Trial 65 finished with value: 0.6748999999999999 and parameters: {'dropout': 0.5865011256782123, 'weight_decay': 0.0013138225767558669, 'lr': 0.0016013805258192429, 'patience': 130, 'spt-alg': 'kruskal', 'manifold': 'Hyperboloid', 'dim': 192, 'num-adj': 2, 'add-rate': 0.30000000000000004, 'tem': 1.0, 'consis-rate': 0.5, 'use-att': 0, 'num-layers': 5}. Best is trial 57 with value: 0.679.[0m
[32m[I 2022-06-16 16:20:26,879][0m Trial 66 finished with value: 0.6783 and parameters: {'dropout': 0.5518430230020668, 'weight_decay': 0.000567725650180915, 'lr': 0.0011602734737074627, 'patience': 50, 'spt-alg': 'kruskal', 'manifold': 'Hyperboloid', 'dim': 192, 'num-adj': 2, 'add-rate': 0.4, 'tem': 0.9, 'consis-rate': 1.0, 'use-att': 0, 'num-layers': 4}. Best is trial 57 with value: 0.679.[0m
[32m[I 2022-06-16 16:22:19,156][0m Trial 67 finished with value: 0.676 and parameters: {'dropout': 0.5312427211214171, 'weight_decay': 0.009634011246472144, 'lr': 0.0013535764669056313, 'patience': 50, 'spt-alg': 'kruskal', 'manifold': 'PoincareBall', 'dim': 192, 'num-adj': 2, 'add-rate': 0.4, 'tem': 0.9, 'consis-rate': 1.0, 'use-att': 0, 'num-layers': 4}. Best is trial 57 with value: 0.679.[0m
[32m[I 2022-06-16 16:27:12,742][0m Trial 68 finished with value: 0.6770000000000002 and parameters: {'dropout': 0.5884005355674581, 'weight_decay': 0.0005583941882227305, 'lr': 0.0010406763283381916, 'patience': 140, 'spt-alg': 'kruskal', 'manifold': 'Hyperboloid', 'dim': 192, 'num-adj': 2, 'add-rate': 0.30000000000000004, 'tem': 0.8, 'consis-rate': 0.8, 'use-att': 0, 'num-layers': 4}. Best is trial 57 with value: 0.679.[0m
[32m[I 2022-06-16 16:32:26,811][0m Trial 69 finished with value: 0.6752 and parameters: {'dropout': 0.5683463662769246, 'weight_decay': 0.0008002385278291534, 'lr': 0.0008276785229481615, 'patience': 150, 'spt-alg': 'kruskal', 'manifold': 'Hyperboloid', 'dim': 192, 'num-adj': 2, 'add-rate': 0.4, 'tem': 0.8, 'consis-rate': 0.9, 'use-att': 0, 'num-layers': 4}. Best is trial 57 with value: 0.679.[0m
[32m[I 2022-06-16 16:37:15,017][0m Trial 70 finished with value: 0.6725 and parameters: {'dropout': 0.5420516151534247, 'weight_decay': 0.0005039872360771167, 'lr': 0.0007362364608928163, 'patience': 120, 'spt-alg': 'kruskal', 'manifold': 'Hyperboloid', 'dim': 192, 'num-adj': 2, 'add-rate': 0.30000000000000004, 'tem': 0.9, 'consis-rate': 0.6, 'use-att': 0, 'num-layers': 4}. Best is trial 57 with value: 0.679.[0m
[32m[I 2022-06-16 16:40:16,456][0m Trial 71 finished with value: 0.6778000000000001 and parameters: {'dropout': 0.5590733049978421, 'weight_decay': 0.0007164128661595493, 'lr': 0.001126228155757161, 'patience': 50, 'spt-alg': 'kruskal', 'manifold': 'Hyperboloid', 'dim': 192, 'num-adj': 2, 'add-rate': 0.4, 'tem': 1.0, 'consis-rate': 0.6, 'use-att': 0, 'num-layers': 4}. Best is trial 57 with value: 0.679.[0m
[32m[I 2022-06-16 16:43:42,995][0m Trial 72 finished with value: 0.6771 and parameters: {'dropout': 0.5603348713615471, 'weight_decay': 0.0009098717284308721, 'lr': 0.0011258693216726005, 'patience': 50, 'spt-alg': 'kruskal', 'manifold': 'Hyperboloid', 'dim': 192, 'num-adj': 2, 'add-rate': 0.4, 'tem': 1.0, 'consis-rate': 0.6, 'use-att': 0, 'num-layers': 4}. Best is trial 57 with value: 0.679.[0m
[32m[I 2022-06-16 16:46:55,352][0m Trial 73 finished with value: 0.6775 and parameters: {'dropout': 0.573054578728344, 'weight_decay': 0.0016005281336287198, 'lr': 0.001361304512507362, 'patience': 50, 'spt-alg': 'kruskal', 'manifold': 'Hyperboloid', 'dim': 192, 'num-adj': 2, 'add-rate': 0.4, 'tem': 1.0, 'consis-rate': 0.5, 'use-att': 0, 'num-layers': 4}. Best is trial 57 with value: 0.679.[0m
[32m[I 2022-06-16 16:49:59,023][0m Trial 74 finished with value: 0.6757000000000001 and parameters: {'dropout': 0.5476197589408737, 'weight_decay': 0.0005868740573176048, 'lr': 0.0011850240092842789, 'patience': 50, 'spt-alg': 'kruskal', 'manifold': 'Hyperboloid', 'dim': 192, 'num-adj': 2, 'add-rate': 0.4, 'tem': 0.9, 'consis-rate': 0.7, 'use-att': 0, 'num-layers': 4}. Best is trial 57 with value: 0.679.[0m
[32m[I 2022-06-16 16:53:36,200][0m Trial 75 finished with value: 0.6735 and parameters: {'dropout': 0.5908767794535901, 'weight_decay': 0.0007525165744113347, 'lr': 0.001040980846103735, 'patience': 60, 'spt-alg': 'kruskal', 'manifold': 'Hyperboloid', 'dim': 256, 'num-adj': 2, 'add-rate': 0.4, 'tem': 0.8, 'consis-rate': 0.8, 'use-att': 0, 'num-layers': 4}. Best is trial 57 with value: 0.679.[0m
[32m[I 2022-06-16 16:56:24,250][0m Trial 76 finished with value: 0.675 and parameters: {'dropout': 0.5342539120557123, 'weight_decay': 0.04625584905508416, 'lr': 0.0016262012309745594, 'patience': 50, 'spt-alg': 'kruskal', 'manifold': 'Hyperboloid', 'dim': 192, 'num-adj': 2, 'add-rate': 0.4, 'tem': 1.0, 'consis-rate': 1.1, 'use-att': 0, 'num-layers': 4}. Best is trial 57 with value: 0.679.[0m
[32m[I 2022-06-16 16:59:26,742][0m Trial 77 finished with value: 0.6767 and parameters: {'dropout': 0.49654864576038654, 'weight_decay': 0.0010896148830101958, 'lr': 0.001429145802779577, 'patience': 60, 'spt-alg': 'kruskal', 'manifold': 'Hyperboloid', 'dim': 192, 'num-adj': 2, 'add-rate': 0.30000000000000004, 'tem': 0.9, 'consis-rate': 0.6, 'use-att': 0, 'num-layers': 4}. Best is trial 57 with value: 0.679.[0m
[32m[I 2022-06-16 17:03:03,687][0m Trial 78 finished with value: 0.6643999999999999 and parameters: {'dropout': 0.2058004202407718, 'weight_decay': 0.0006953948778865301, 'lr': 0.0008865238569733827, 'patience': 50, 'spt-alg': 'kruskal', 'manifold': 'Hyperboloid', 'dim': 192, 'num-adj': 2, 'add-rate': 0.4, 'tem': 0.9, 'consis-rate': 0.9, 'use-att': 0, 'num-layers': 4}. Best is trial 57 with value: 0.679.[0m
[32m[I 2022-06-16 17:06:10,179][0m Trial 79 finished with value: 0.6753 and parameters: {'dropout': 0.511409009888071, 'weight_decay': 0.0005813383477069383, 'lr': 0.0012867450216943238, 'patience': 60, 'spt-alg': 'kruskal', 'manifold': 'Hyperboloid', 'dim': 192, 'num-adj': 2, 'add-rate': 0.2, 'tem': 1.0, 'consis-rate': 1.0, 'use-att': 0, 'num-layers': 4}. Best is trial 57 with value: 0.679.[0m
[32m[I 2022-06-16 17:07:58,334][0m Trial 80 finished with value: 0.6778000000000001 and parameters: {'dropout': 0.5558167720053566, 'weight_decay': 0.0008379556998237631, 'lr': 0.0018312394191335446, 'patience': 50, 'spt-alg': 'kruskal', 'manifold': 'PoincareBall', 'dim': 192, 'num-adj': 2, 'add-rate': 0.4, 'tem': 0.8, 'consis-rate': 0.5, 'use-att': 0, 'num-layers': 4}. Best is trial 57 with value: 0.679.[0m
[32m[I 2022-06-16 17:09:55,728][0m Trial 81 finished with value: 0.6767000000000001 and parameters: {'dropout': 0.5613213040486698, 'weight_decay': 0.0021136599742835474, 'lr': 0.0018309111572611847, 'patience': 50, 'spt-alg': 'kruskal', 'manifold': 'PoincareBall', 'dim': 192, 'num-adj': 2, 'add-rate': 0.4, 'tem': 0.8, 'consis-rate': 0.5, 'use-att': 0, 'num-layers': 4}. Best is trial 57 with value: 0.679.[0m
