[32m[I 2022-06-16 14:33:43,228][0m Trial 32 finished with value: 0.6688000000000001 and parameters: {'dropout': 0.4460467126776999, 'weight_decay': 0.0005131170584429286, 'lr': 0.0014623171096089067, 'patience': 50, 'spt-alg': 'prim', 'manifold': 'Hyperboloid', 'dim': 128, 'num-adj': 6, 'add-rate': 0.4, 'tem': 1.1, 'consis-rate': 1.9000000000000001, 'use-att': 1, 'num-layers': 3}. Best is trial 15 with value: 0.6789000000000001.[0m
[32m[I 2022-06-16 14:36:06,104][0m Trial 33 finished with value: 0.6706 and parameters: {'dropout': 0.4999282333106712, 'weight_decay': 0.001436112909864445, 'lr': 0.009090744633624415, 'patience': 100, 'spt-alg': 'prim', 'manifold': 'Hyperboloid', 'dim': 128, 'num-adj': 6, 'add-rate': 0.6, 'tem': 1.4, 'consis-rate': 1.6, 'use-att': 0, 'num-layers': 3}. Best is trial 15 with value: 0.6789000000000001.[0m
[32m[I 2022-06-16 14:38:33,053][0m Trial 34 finished with value: 0.6775 and parameters: {'dropout': 0.5514122229492344, 'weight_decay': 0.0006938490860315277, 'lr': 0.0033221008648369136, 'patience': 70, 'spt-alg': 'prim', 'manifold': 'Hyperboloid', 'dim': 128, 'num-adj': 4, 'add-rate': 0.5, 'tem': 1.2000000000000002, 'consis-rate': 1.8, 'use-att': 1, 'num-layers': 5}. Best is trial 15 with value: 0.6789000000000001.[0m
[32m[I 2022-06-16 14:40:52,012][0m Trial 35 finished with value: 0.6698999999999999 and parameters: {'dropout': 0.5398390029351261, 'weight_decay': 0.002636331424834615, 'lr': 0.004639613901716804, 'patience': 70, 'spt-alg': 'prim', 'manifold': 'Hyperboloid', 'dim': 128, 'num-adj': 4, 'add-rate': 0.5, 'tem': 1.1, 'consis-rate': 1.8, 'use-att': 1, 'num-layers': 5}. Best is trial 15 with value: 0.6789000000000001.[0m
[32m[I 2022-06-16 14:43:20,246][0m Trial 36 finished with value: 0.6738999999999999 and parameters: {'dropout': 0.5281948071019945, 'weight_decay': 0.0007371778309096201, 'lr': 0.005884379261600373, 'patience': 90, 'spt-alg': 'prim', 'manifold': 'Hyperboloid', 'dim': 128, 'num-adj': 4, 'add-rate': 0.4, 'tem': 1.0, 'consis-rate': 2.0, 'use-att': 1, 'num-layers': 5}. Best is trial 15 with value: 0.6789000000000001.[0m
[32m[I 2022-06-16 14:47:10,852][0m Trial 37 finished with value: 0.6742000000000001 and parameters: {'dropout': 0.5558195892688715, 'weight_decay': 0.0017081291893689095, 'lr': 0.0020532368652338836, 'patience': 100, 'spt-alg': 'prim', 'manifold': 'Hyperboloid', 'dim': 64, 'num-adj': 4, 'add-rate': 0.4, 'tem': 1.2000000000000002, 'consis-rate': 1.6, 'use-att': 1, 'num-layers': 5}. Best is trial 15 with value: 0.6789000000000001.[0m
[32m[I 2022-06-16 14:48:49,324][0m Trial 38 finished with value: 0.6670999999999999 and parameters: {'dropout': 0.31179274738592067, 'weight_decay': 0.005361574175606933, 'lr': 0.0033081357833413595, 'patience': 80, 'spt-alg': 'prim', 'manifold': 'PoincareBall', 'dim': 192, 'num-adj': 4, 'add-rate': 0.5, 'tem': 1.0, 'consis-rate': 1.9000000000000001, 'use-att': 1, 'num-layers': 3}. Best is trial 15 with value: 0.6789000000000001.[0m
[32m[I 2022-06-16 14:51:45,153][0m Trial 39 finished with value: 0.6721 and parameters: {'dropout': 0.41471678519924376, 'weight_decay': 0.020664723822789804, 'lr': 0.004267572930131491, 'patience': 120, 'spt-alg': 'prim', 'manifold': 'Hyperboloid', 'dim': 128, 'num-adj': 2, 'add-rate': 0.4, 'tem': 0.9, 'consis-rate': 1.8, 'use-att': 1, 'num-layers': 5}. Best is trial 15 with value: 0.6789000000000001.[0m
[32m[I 2022-06-16 14:53:14,423][0m Trial 40 finished with value: 0.6649999999999999 and parameters: {'dropout': 0.4609411905058255, 'weight_decay': 0.002485583229740129, 'lr': 0.008119149594582684, 'patience': 70, 'spt-alg': 'prim', 'manifold': 'PoincareBall', 'dim': 64, 'num-adj': 4, 'add-rate': 0.30000000000000004, 'tem': 1.2000000000000002, 'consis-rate': 1.4, 'use-att': 1, 'num-layers': 3}. Best is trial 15 with value: 0.6789000000000001.[0m

cur_param: {'dropout': 0.5553374562378856, 'weight-decay': 0.0006520367926083595, 'lr': 0.006185774657773671, 'lr-reduce-freq': 70, 'patience': 70, 'spt-alg': 'kruskal', 'manifold': 'Hyperboloid', 'dim': 128, 'num-adj': 6, 'add-rate': 0.30000000000000004, 'tem': 0.9, 'consis-rate': 1.5, 'use-att': 0, 'num-layers': 4}
mean: 0.6688000000000001
[0.672 0.653 0.668 0.651 0.681 0.67  0.699 0.667 0.675 0.652]
cur_param: {'dropout': 0.4829072288186463, 'weight-decay': 0.0007154708202304946, 'lr': 0.0031234075179517895, 'lr-reduce-freq': 90, 'patience': 90, 'spt-alg': 'kruskal', 'manifold': 'Hyperboloid', 'dim': 128, 'num-adj': 4, 'add-rate': 0.5, 'tem': 1.1, 'consis-rate': 2.0, 'use-att': 0, 'num-layers': 4}
mean: 0.6771
[0.689 0.671 0.675 0.67  0.677 0.664 0.703 0.666 0.664 0.692]
cur_param: {'dropout': 0.47203701588300007, 'weight-decay': 0.000779558913395065, 'lr': 0.0028876097079428105, 'lr-reduce-freq': 60, 'patience': 60, 'spt-alg': 'kruskal', 'manifold': 'Hyperboloid', 'dim': 128, 'num-adj': 6, 'add-rate': 0.6, 'tem': 1.2000000000000002, 'consis-rate': 1.9000000000000001, 'use-att': 0, 'num-layers': 4}
mean: 0.6734
[0.684 0.674 0.668 0.662 0.674 0.664 0.689 0.655 0.68  0.684]
cur_param: {'dropout': 0.48522250091581887, 'weight-decay': 0.0017984697536675036, 'lr': 0.001528861655915904, 'lr-reduce-freq': 90, 'patience': 90, 'spt-alg': 'kruskal', 'manifold': 'Hyperboloid', 'dim': 64, 'num-adj': 6, 'add-rate': 0.5, 'tem': 1.1, 'consis-rate': 1.6, 'use-att': 0, 'num-layers': 4}
mean: 0.67
[0.671 0.672 0.666 0.676 0.667 0.676 0.66  0.671 0.676 0.665]
cur_param: {'dropout': 0.4518745548034222, 'weight-decay': 0.0008983710193738039, 'lr': 0.002906910288611978, 'lr-reduce-freq': 50, 'patience': 50, 'spt-alg': 'kruskal', 'manifold': 'Hyperboloid', 'dim': 128, 'num-adj': 4, 'add-rate': 0.7, 'tem': 1.3, 'consis-rate': 2.0, 'use-att': 0, 'num-layers': 4}
mean: 0.6716000000000001
[0.67  0.674 0.678 0.668 0.663 0.663 0.686 0.662 0.671 0.681]
cur_param: {'dropout': 0.3722175462403753, 'weight-decay': 0.0014571191588786396, 'lr': 0.002240853932475954, 'lr-reduce-freq': 70, 'patience': 70, 'spt-alg': 'kruskal', 'manifold': 'Hyperboloid', 'dim': 192, 'num-adj': 8, 'add-rate': 0.6, 'tem': 1.4, 'consis-rate': 1.8, 'use-att': 0, 'num-layers': 4}
mean: 0.6692
[0.683 0.662 0.664 0.669 0.664 0.675 0.665 0.658 0.665 0.687]
cur_param: {'dropout': 0.5046506295502075, 'weight-decay': 0.003955737416578074, 'lr': 0.005960495846270853, 'lr-reduce-freq': 90, 'patience': 90, 'spt-alg': 'prim', 'manifold': 'Hyperboloid', 'dim': 128, 'num-adj': 6, 'add-rate': 0.5, 'tem': 1.1, 'consis-rate': 1.9000000000000001, 'use-att': 1, 'num-layers': 3}
mean: 0.6759000000000001
[0.67  0.661 0.688 0.687 0.672 0.668 0.707 0.672 0.67  0.664]
cur_param: {'dropout': 0.5039482588895314, 'weight-decay': 0.003704700576814755, 'lr': 0.007640129125608586, 'lr-reduce-freq': 90, 'patience': 90, 'spt-alg': 'prim', 'manifold': 'Hyperboloid', 'dim': 64, 'num-adj': 4, 'add-rate': 0.5, 'tem': 1.0, 'consis-rate': 1.9000000000000001, 'use-att': 1, 'num-layers': 3}
mean: 0.6676
[0.667 0.676 0.668 0.669 0.668 0.677 0.67  0.667 0.672 0.642]
cur_param: {'dropout': 0.43507028694852967, 'weight-decay': 0.02629029119972412, 'lr': 0.0005363034194544314, 'lr-reduce-freq': 100, 'patience': 100, 'spt-alg': 'prim', 'manifold': 'Hyperboloid', 'dim': 128, 'num-adj': 6, 'add-rate': 0.30000000000000004, 'tem': 0.8, 'consis-rate': 1.9000000000000001, 'use-att': 1, 'num-layers': 3}
mean: 0.6613
[0.669 0.679 0.667 0.671 0.662 0.664 0.669 0.656 0.6   0.676]
cur_param: {'dropout': 0.3976378546540682, 'weight-decay': 0.003579865506756732, 'lr': 0.005291809400732947, 'lr-reduce-freq': 90, 'patience': 90, 'spt-alg': 'prim', 'manifold': 'Hyperboloid', 'dim': 192, 'num-adj': 8, 'add-rate': 0.4, 'tem': 1.1, 'consis-rate': 2.0, 'use-att': 1, 'num-layers': 3}
mean: 0.6689999999999999
[0.686 0.673 0.672 0.659 0.662 0.657 0.669 0.678 0.664 0.67 ]
cur_param: {'dropout': 0.557706910014594, 'weight-decay': 0.0007719867987798806, 'lr': 0.0033741889604876015, 'lr-reduce-freq': 60, 'patience': 60, 'spt-alg': 'prim', 'manifold': 'Hyperboloid', 'dim': 128, 'num-adj': 6, 'add-rate': 0.5, 'tem': 1.2000000000000002, 'consis-rate': 1.7000000000000002, 'use-att': 1, 'num-layers': 5}
mean: 0.6752
[0.685 0.667 0.676 0.666 0.676 0.674 0.675 0.672 0.677 0.684]
cur_param: {'dropout': 0.4460467126776999, 'weight-decay': 0.0005131170584429286, 'lr': 0.0014623171096089067, 'lr-reduce-freq': 50, 'patience': 50, 'spt-alg': 'prim', 'manifold': 'Hyperboloid', 'dim': 128, 'num-adj': 6, 'add-rate': 0.4, 'tem': 1.1, 'consis-rate': 1.9000000000000001, 'use-att': 1, 'num-layers': 3}
mean: 0.6688000000000001
[0.675 0.668 0.664 0.656 0.67  0.669 0.682 0.661 0.666 0.677]
cur_param: {'dropout': 0.4999282333106712, 'weight-decay': 0.001436112909864445, 'lr': 0.009090744633624415, 'lr-reduce-freq': 100, 'patience': 100, 'spt-alg': 'prim', 'manifold': 'Hyperboloid', 'dim': 128, 'num-adj': 6, 'add-rate': 0.6, 'tem': 1.4, 'consis-rate': 1.6, 'use-att': 0, 'num-layers': 3}
mean: 0.6706
[0.683 0.657 0.68  0.663 0.676 0.671 0.697 0.661 0.659 0.659]
cur_param: {'dropout': 0.5514122229492344, 'weight-decay': 0.0006938490860315277, 'lr': 0.0033221008648369136, 'lr-reduce-freq': 70, 'patience': 70, 'spt-alg': 'prim', 'manifold': 'Hyperboloid', 'dim': 128, 'num-adj': 4, 'add-rate': 0.5, 'tem': 1.2000000000000002, 'consis-rate': 1.8, 'use-att': 1, 'num-layers': 5}
mean: 0.6775
[0.69  0.677 0.671 0.679 0.674 0.674 0.699 0.658 0.664 0.689]
cur_param: {'dropout': 0.5398390029351261, 'weight-decay': 0.002636331424834615, 'lr': 0.004639613901716804, 'lr-reduce-freq': 70, 'patience': 70, 'spt-alg': 'prim', 'manifold': 'Hyperboloid', 'dim': 128, 'num-adj': 4, 'add-rate': 0.5, 'tem': 1.1, 'consis-rate': 1.8, 'use-att': 1, 'num-layers': 5}
mean: 0.6698999999999999
[0.676 0.659 0.672 0.667 0.671 0.673 0.672 0.662 0.672 0.675]
cur_param: {'dropout': 0.5281948071019945, 'weight-decay': 0.0007371778309096201, 'lr': 0.005884379261600373, 'lr-reduce-freq': 90, 'patience': 90, 'spt-alg': 'prim', 'manifold': 'Hyperboloid', 'dim': 128, 'num-adj': 4, 'add-rate': 0.4, 'tem': 1.0, 'consis-rate': 2.0, 'use-att': 1, 'num-layers': 5}
mean: 0.6738999999999999
[0.676 0.676 0.672 0.664 0.686 0.674 0.695 0.665 0.669 0.662]
cur_param: {'dropout': 0.5558195892688715, 'weight-decay': 0.0017081291893689095, 'lr': 0.0020532368652338836, 'lr-reduce-freq': 100, 'patience': 100, 'spt-alg': 'prim', 'manifold': 'Hyperboloid', 'dim': 64, 'num-adj': 4, 'add-rate': 0.4, 'tem': 1.2000000000000002, 'consis-rate': 1.6, 'use-att': 1, 'num-layers': 5}
mean: 0.6742000000000001
[0.666 0.683 0.671 0.67  0.673 0.681 0.677 0.676 0.679 0.666]
cur_param: {'dropout': 0.31179274738592067, 'weight-decay': 0.005361574175606933, 'lr': 0.0033081357833413595, 'lr-reduce-freq': 80, 'patience': 80, 'spt-alg': 'prim', 'manifold': 'PoincareBall', 'dim': 192, 'num-adj': 4, 'add-rate': 0.5, 'tem': 1.0, 'consis-rate': 1.9000000000000001, 'use-att': 1, 'num-layers': 3}
mean: 0.6670999999999999
[0.659 0.677 0.668 0.671 0.669 0.673 0.653 0.674 0.66  0.667]
cur_param: {'dropout': 0.41471678519924376, 'weight-decay': 0.020664723822789804, 'lr': 0.004267572930131491, 'lr-reduce-freq': 120, 'patience': 120, 'spt-alg': 'prim', 'manifold': 'Hyperboloid', 'dim': 128, 'num-adj': 2, 'add-rate': 0.4, 'tem': 0.9, 'consis-rate': 1.8, 'use-att': 1, 'num-layers': 5}
mean: 0.6721
[0.675 0.66  0.664 0.668 0.669 0.681 0.677 0.672 0.671 0.684]
cur_param: {'dropout': 0.4609411905058255, 'weight-decay': 0.002485583229740129, 'lr': 0.008119149594582684, 'lr-reduce-freq': 70, 'patience': 70, 'spt-alg': 'prim', 'manifold': 'PoincareBall', 'dim': 64, 'num-adj': 4, 'add-rate': 0.30000000000000004, 'tem': 1.2000000000000002, 'consis-rate': 1.4, 'use-att': 1, 'num-layers': 3}
mean: 0.6649999999999999
[0.67  0.687 0.67  0.675 0.651 0.651 0.673 0.669 0.656 0.648]
cur_param: {'dropout': 0.5652637719127778, 'weight-decay': 0.0007722516331082779, 'lr': 0.003162356117661786, 'lr-reduce-freq': 60, 'patience': 60, 'spt-alg': 'prim', 'manifold': 'Hyperboloid', 'dim': 128, 'num-adj': 6, 'add-rate': 0.5, 'tem': 1.2000000000000002, 'consis-rate': 1.7000000000000002, 'use-att': 1, 'num-layers': 5}[32m[I 2022-06-16 14:55:40,619][0m Trial 41 finished with value: 0.6759000000000002 and parameters: {'dropout': 0.5652637719127778, 'weight_decay': 0.0007722516331082779, 'lr': 0.003162356117661786, 'patience': 60, 'spt-alg': 'prim', 'manifold': 'Hyperboloid', 'dim': 128, 'num-adj': 6, 'add-rate': 0.5, 'tem': 1.2000000000000002, 'consis-rate': 1.7000000000000002, 'use-att': 1, 'num-layers': 5}. Best is trial 15 with value: 0.6789000000000001.[0m
[32m[I 2022-06-16 14:58:06,495][0m Trial 42 finished with value: 0.6765999999999999 and parameters: {'dropout': 0.5997433543716181, 'weight_decay': 0.00065621694025104, 'lr': 0.003222739517064615, 'patience': 60, 'spt-alg': 'prim', 'manifold': 'Hyperboloid', 'dim': 128, 'num-adj': 6, 'add-rate': 0.5, 'tem': 1.1, 'consis-rate': 1.9000000000000001, 'use-att': 1, 'num-layers': 5}. Best is trial 15 with value: 0.6789000000000001.[0m
[32m[I 2022-06-16 15:00:49,424][0m Trial 43 finished with value: 0.6748999999999999 and parameters: {'dropout': 0.5994488253931379, 'weight_decay': 0.0006553985097508787, 'lr': 0.002261913727079204, 'patience': 60, 'spt-alg': 'prim', 'manifold': 'Hyperboloid', 'dim': 128, 'num-adj': 6, 'add-rate': 0.6, 'tem': 1.2000000000000002, 'consis-rate': 1.8, 'use-att': 1, 'num-layers': 5}. Best is trial 15 with value: 0.6789000000000001.[0m
[32m[I 2022-06-16 15:03:15,056][0m Trial 44 finished with value: 0.675 and parameters: {'dropout': 0.5767607172594813, 'weight_decay': 0.0008523015101860956, 'lr': 0.0032069452965511934, 'patience': 50, 'spt-alg': 'prim', 'manifold': 'Hyperboloid', 'dim': 128, 'num-adj': 6, 'add-rate': 0.5, 'tem': 1.0, 'consis-rate': 2.0, 'use-att': 1, 'num-layers': 5}. Best is trial 15 with value: 0.6789000000000001.[0m
[32m[I 2022-06-16 15:05:42,165][0m Trial 45 finished with value: 0.6735 and parameters: {'dropout': 0.5701130364128228, 'weight_decay': 0.0011956146403406, 'lr': 0.004193217138270467, 'patience': 60, 'spt-alg': 'prim', 'manifold': 'Hyperboloid', 'dim': 128, 'num-adj': 4, 'add-rate': 0.5, 'tem': 1.1, 'consis-rate': 1.7000000000000002, 'use-att': 1, 'num-layers': 5}. Best is trial 15 with value: 0.6789000000000001.[0m
[32m[I 2022-06-16 15:07:41,069][0m Trial 46 finished with value: 0.675 and parameters: {'dropout': 0.5451859400717799, 'weight_decay': 0.000641861845489236, 'lr': 0.0017567952466802854, 'patience': 70, 'spt-alg': 'prim', 'manifold': 'PoincareBall', 'dim': 192, 'num-adj': 6, 'add-rate': 0.6, 'tem': 1.3, 'consis-rate': 0.9, 'use-att': 1, 'num-layers': 5}. Best is trial 15 with value: 0.6789000000000001.[0m
[32m[I 2022-06-16 15:09:54,520][0m Trial 47 finished with value: 0.6782000000000001 and parameters: {'dropout': 0.5244995441914693, 'weight_decay': 0.0005044289964685438, 'lr': 0.0035680335426331645, 'patience': 50, 'spt-alg': 'prim', 'manifold': 'Hyperboloid', 'dim': 128, 'num-adj': 2, 'add-rate': 0.4, 'tem': 0.9, 'consis-rate': 1.5, 'use-att': 1, 'num-layers': 5}. Best is trial 15 with value: 0.6789000000000001.[0m
[32m[I 2022-06-16 15:12:22,237][0m Trial 48 finished with value: 0.6735000000000001 and parameters: {'dropout': 0.5221232765077344, 'weight_decay': 0.000510547047350826, 'lr': 0.0037132020565343467, 'patience': 50, 'spt-alg': 'prim', 'manifold': 'Hyperboloid', 'dim': 64, 'num-adj': 2, 'add-rate': 0.30000000000000004, 'tem': 0.8, 'consis-rate': 1.5, 'use-att': 1, 'num-layers': 5}. Best is trial 15 with value: 0.6789000000000001.[0m
[32m[I 2022-06-16 15:16:05,730][0m Trial 49 finished with value: 0.6772 and parameters: {'dropout': 0.517081676225306, 'weight_decay': 0.0006291387616170776, 'lr': 0.0026181042939050847, 'patience': 150, 'spt-alg': 'kruskal', 'manifold': 'Hyperboloid', 'dim': 128, 'num-adj': 2, 'add-rate': 0.4, 'tem': 0.9, 'consis-rate': 1.4, 'use-att': 0, 'num-layers': 5}. Best is trial 15 with value: 0.6789000000000001.[0m
[32m[I 2022-06-16 15:18:51,174][0m Trial 50 finished with value: 0.6737 and parameters: {'dropout': 0.5084613593936025, 'weight_decay': 0.0009824657741121206, 'lr': 0.0026783830210761524, 'patience': 150, 'spt-alg': 'kruskal', 'manifold': 'PoincareBall', 'dim': 256, 'num-adj': 2, 'add-rate': 0.4, 'tem': 0.9, 'consis-rate': 1.2000000000000002, 'use-att': 0, 'num-layers': 5}. Best is trial 15 with value: 0.6789000000000001.[0m
[32m[I 2022-06-16 15:22:32,748][0m Trial 51 finished with value: 0.6762 and parameters: {'dropout': 0.5999060260971417, 'weight_decay': 0.0006192059622849994, 'lr': 0.002456489930551745, 'patience': 140, 'spt-alg': 'kruskal', 'manifold': 'Hyperboloid', 'dim': 128, 'num-adj': 2, 'add-rate': 0.4, 'tem': 0.7, 'consis-rate': 1.4, 'use-att': 0, 'num-layers': 5}. Best is trial 15 with value: 0.6789000000000001.[0m
[32m[I 2022-06-16 15:26:09,513][0m Trial 52 finished with value: 0.6756 and parameters: {'dropout': 0.5349368610947469, 'weight_decay': 0.0005117806193611152, 'lr': 0.001980760281641413, 'patience': 130, 'spt-alg': 'kruskal', 'manifold': 'Hyperboloid', 'dim': 128, 'num-adj': 2, 'add-rate': 0.30000000000000004, 'tem': 0.8, 'consis-rate': 1.3, 'use-att': 0, 'num-layers': 5}. Best is trial 15 with value: 0.6789000000000001.[0m
[32m[I 2022-06-16 15:28:24,929][0m Trial 53 finished with value: 0.6780000000000002 and parameters: {'dropout': 0.5814187336840371, 'weight_decay': 0.0006801465796937284, 'lr': 0.0035168010209736308, 'patience': 50, 'spt-alg': 'kruskal', 'manifold': 'Hyperboloid', 'dim': 128, 'num-adj': 2, 'add-rate': 0.4, 'tem': 0.9, 'consis-rate': 0.5, 'use-att': 0, 'num-layers': 5}. Best is trial 15 with value: 0.6789000000000001.[0m
[32m[I 2022-06-16 15:30:33,962][0m Trial 54 finished with value: 0.6725000000000001 and parameters: {'dropout': 0.520618267706793, 'weight_decay': 0.001227065271168083, 'lr': 0.00405235465586369, 'patience': 50, 'spt-alg': 'kruskal', 'manifold': 'Hyperboloid', 'dim': 128, 'num-adj': 2, 'add-rate': 0.4, 'tem': 0.9, 'consis-rate': 0.8, 'use-att': 0, 'num-layers': 5}. Best is trial 15 with value: 0.6789000000000001.[0m
[32m[I 2022-06-16 15:33:55,115][0m Trial 55 finished with value: 0.6714000000000001 and parameters: {'dropout': 0.4910409044609903, 'weight_decay': 0.0009022605478298742, 'lr': 0.004847884712416325, 'patience': 140, 'spt-alg': 'kruskal', 'manifold': 'Hyperboloid', 'dim': 128, 'num-adj': 2, 'add-rate': 0.2, 'tem': 0.6, 'consis-rate': 1.2000000000000002, 'use-att': 0, 'num-layers': 4}. Best is trial 15 with value: 0.6789000000000001.[0m
[32m[I 2022-06-16 15:37:10,693][0m Trial 56 finished with value: 0.6736000000000001 and parameters: {'dropout': 0.47008259520588913, 'weight_decay': 0.0006994988262193289, 'lr': 0.002712183437236874, 'patience': 110, 'spt-alg': 'kruskal', 'manifold': 'Hyperboloid', 'dim': 128, 'num-adj': 2, 'add-rate': 0.30000000000000004, 'tem': 0.8, 'consis-rate': 0.6, 'use-att': 0, 'num-layers': 5}. Best is trial 15 with value: 0.6789000000000001.[0m
[32m[I 2022-06-16 15:41:15,160][0m Trial 57 finished with value: 0.679 and parameters: {'dropout': 0.5867924799846715, 'weight_decay': 0.0010638833550438835, 'lr': 0.001163421464978209, 'patience': 120, 'spt-alg': 'kruskal', 'manifold': 'Hyperboloid', 'dim': 192, 'num-adj': 2, 'add-rate': 0.4, 'tem': 1.0, 'consis-rate': 1.0, 'use-att': 0, 'num-layers': 4}. Best is trial 57 with value: 0.679.[0m
[32m[I 2022-06-16 15:45:43,097][0m Trial 58 finished with value: 0.6788000000000001 and parameters: {'dropout': 0.5854698797657507, 'weight_decay': 0.0010050209168815042, 'lr': 0.0011937194899289975, 'patience': 140, 'spt-alg': 'kruskal', 'manifold': 'Hyperboloid', 'dim': 192, 'num-adj': 2, 'add-rate': 0.4, 'tem': 0.9, 'consis-rate': 0.5, 'use-att': 0, 'num-layers': 5}. Best is trial 57 with value: 0.679.[0m
[32m[I 2022-06-16 15:49:45,600][0m Trial 59 finished with value: 0.6771 and parameters: {'dropout': 0.5819872389076947, 'weight_decay': 0.0010424246484193045, 'lr': 0.0011359483843914264, 'patience': 120, 'spt-alg': 'kruskal', 'manifold': 'Hyperboloid', 'dim': 192, 'num-adj': 2, 'add-rate': 0.30000000000000004, 'tem': 1.0, 'consis-rate': 0.5, 'use-att': 0, 'num-layers': 4}. Best is trial 57 with value: 0.679.[0m
[32m[I 2022-06-16 15:54:43,955][0m Trial 60 finished with value: 0.6739999999999999 and parameters: {'dropout': 0.580791226611304, 'weight_decay': 0.0017803269567386708, 'lr': 0.0008335620704577295, 'patience': 140, 'spt-alg': 'kruskal', 'manifold': 'Hyperboloid', 'dim': 192, 'num-adj': 2, 'add-rate': 0.4, 'tem': 0.9, 'consis-rate': 0.5, 'use-att': 0, 'num-layers': 4}. Best is trial 57 with value: 0.679.[0m
