[32m[I 2022-06-16 20:31:52,817][0m Trial 167 finished with value: 0.6777000000000001 and parameters: {'dropout': 0.5995898089042997, 'weight_decay': 0.004277674808596186, 'lr': 0.0032430639305900356, 'patience': 100, 'spt-alg': 'kruskal', 'manifold': 'PoincareBall', 'dim': 256, 'num-adj': 6, 'add-rate': 0.5, 'tem': 0.9, 'consis-rate': 1.5, 'use-att': 0, 'num-layers': 4}. Best is trial 107 with value: 0.6813.[0m
cur_param: {'dropout': 0.592432858236706, 'weight-decay': 0.013381498142195167, 'lr': 0.003337898345816729, 'lr-reduce-freq': 110, 'patience': 110, 'spt-alg': 'kruskal', 'manifold': 'PoincareBall', 'dim': 256, 'num-adj': 2, 'add-rate': 0.4, 'tem': 0.9, 'consis-rate': 1.1, 'use-att': 0, 'num-layers': 4}
mean: 0.6785
[0.673 0.689 0.685 0.669 0.677 0.682 0.678 0.696 0.665 0.671]
cur_param: {'dropout': 0.5565759289049211, 'weight-decay': 0.012326096688983521, 'lr': 0.0038460280381461534, 'lr-reduce-freq': 110, 'patience': 110, 'spt-alg': 'kruskal', 'manifold': 'PoincareBall', 'dim': 256, 'num-adj': 4, 'add-rate': 0.4, 'tem': 0.8, 'consis-rate': 1.3, 'use-att': 0, 'num-layers': 3}
mean: 0.6745
[0.672 0.676 0.674 0.677 0.672 0.682 0.668 0.682 0.662 0.68 ]
cur_param: {'dropout': 0.4565360226382473, 'weight-decay': 0.015577490898305986, 'lr': 0.004579106693500498, 'lr-reduce-freq': 120, 'patience': 120, 'spt-alg': 'kruskal', 'manifold': 'PoincareBall', 'dim': 256, 'num-adj': 2, 'add-rate': 0.30000000000000004, 'tem': 0.7, 'consis-rate': 0.9, 'use-att': 0, 'num-layers': 3}
mean: 0.6748000000000001
[0.682 0.676 0.671 0.678 0.672 0.678 0.669 0.676 0.674 0.672]
cur_param: {'dropout': 0.5990840489988699, 'weight-decay': 0.0006459184318474801, 'lr': 0.0035873896594892825, 'lr-reduce-freq': 110, 'patience': 110, 'spt-alg': 'kruskal', 'manifold': 'PoincareBall', 'dim': 256, 'num-adj': 4, 'add-rate': 0.1, 'tem': 0.6, 'consis-rate': 1.0, 'use-att': 0, 'num-layers': 3}
mean: 0.6771
[0.671 0.686 0.684 0.687 0.671 0.676 0.673 0.684 0.66  0.679]
cur_param: {'dropout': 0.5740371971269922, 'weight-decay': 0.010720486839661935, 'lr': 0.004101534753282377, 'lr-reduce-freq': 120, 'patience': 120, 'spt-alg': 'kruskal', 'manifold': 'PoincareBall', 'dim': 256, 'num-adj': 2, 'add-rate': 0.4, 'tem': 0.7, 'consis-rate': 0.9, 'use-att': 0, 'num-layers': 3}
mean: 0.6775000000000001
[0.673 0.684 0.677 0.684 0.675 0.683 0.663 0.685 0.676 0.675]
cur_param: {'dropout': 0.5419728515260263, 'weight-decay': 0.007493090121884653, 'lr': 0.0038940452673206422, 'lr-reduce-freq': 100, 'patience': 100, 'spt-alg': 'kruskal', 'manifold': 'PoincareBall', 'dim': 256, 'num-adj': 2, 'add-rate': 0.4, 'tem': 0.7, 'consis-rate': 0.8, 'use-att': 0, 'num-layers': 3}
mean: 0.6769000000000001
[0.674 0.683 0.672 0.687 0.671 0.685 0.669 0.678 0.668 0.682]
cur_param: {'dropout': 0.5803503447858376, 'weight-decay': 0.008193896801950732, 'lr': 0.0043252469219356585, 'lr-reduce-freq': 110, 'patience': 110, 'spt-alg': 'kruskal', 'manifold': 'PoincareBall', 'dim': 256, 'num-adj': 2, 'add-rate': 0.4, 'tem': 0.8, 'consis-rate': 1.2000000000000002, 'use-att': 0, 'num-layers': 4}
mean: 0.6787000000000001
[0.664 0.684 0.675 0.688 0.675 0.684 0.672 0.677 0.684 0.684]
cur_param: {'dropout': 0.5843847452074507, 'weight-decay': 0.006769673885531623, 'lr': 0.0036728145095112326, 'lr-reduce-freq': 110, 'patience': 110, 'spt-alg': 'kruskal', 'manifold': 'PoincareBall', 'dim': 256, 'num-adj': 2, 'add-rate': 0.4, 'tem': 0.8, 'consis-rate': 1.2000000000000002, 'use-att': 0, 'num-layers': 4}
mean: 0.6793000000000001
[0.673 0.685 0.685 0.687 0.668 0.686 0.672 0.687 0.668 0.682]
cur_param: {'dropout': 0.5858392117931037, 'weight-decay': 0.0007274713489291875, 'lr': 0.0031955703931125976, 'lr-reduce-freq': 110, 'patience': 110, 'spt-alg': 'kruskal', 'manifold': 'PoincareBall', 'dim': 256, 'num-adj': 2, 'add-rate': 0.6, 'tem': 0.8, 'consis-rate': 1.2000000000000002, 'use-att': 0, 'num-layers': 4}
mean: 0.6756000000000001
[0.675 0.683 0.684 0.674 0.673 0.68  0.678 0.684 0.673 0.652]
cur_param: {'dropout': 0.5922899411698999, 'weight-decay': 0.006950742442118336, 'lr': 0.003438034003552082, 'lr-reduce-freq': 110, 'patience': 110, 'spt-alg': 'kruskal', 'manifold': 'PoincareBall', 'dim': 256, 'num-adj': 2, 'add-rate': 0.4, 'tem': 0.8, 'consis-rate': 1.3, 'use-att': 0, 'num-layers': 4}
mean: 0.68
[0.672 0.687 0.685 0.685 0.678 0.686 0.673 0.695 0.662 0.677]
cur_param: {'dropout': 0.5994283145767035, 'weight-decay': 0.004674823379999935, 'lr': 0.0033945806159207254, 'lr-reduce-freq': 110, 'patience': 110, 'spt-alg': 'kruskal', 'manifold': 'PoincareBall', 'dim': 256, 'num-adj': 2, 'add-rate': 0.4, 'tem': 0.8, 'consis-rate': 1.4, 'use-att': 0, 'num-layers': 4}
mean: 0.6785000000000001
[0.677 0.687 0.687 0.676 0.673 0.674 0.68  0.687 0.674 0.67 ]
cur_param: {'dropout': 0.5910273564302572, 'weight-decay': 0.005908437197177488, 'lr': 0.00364025874552627, 'lr-reduce-freq': 110, 'patience': 110, 'spt-alg': 'kruskal', 'manifold': 'PoincareBall', 'dim': 256, 'num-adj': 6, 'add-rate': 0.5, 'tem': 0.9, 'consis-rate': 1.3, 'use-att': 0, 'num-layers': 4}
mean: 0.6791
[0.679 0.687 0.674 0.688 0.671 0.682 0.672 0.696 0.665 0.677]
cur_param: {'dropout': 0.5919499327053768, 'weight-decay': 0.0060705849359835, 'lr': 0.0036524637604891364, 'lr-reduce-freq': 110, 'patience': 110, 'spt-alg': 'kruskal', 'manifold': 'PoincareBall', 'dim': 256, 'num-adj': 6, 'add-rate': 0.5, 'tem': 0.9, 'consis-rate': 1.3, 'use-att': 0, 'num-layers': 4}
mean: 0.679
[0.673 0.692 0.675 0.687 0.671 0.681 0.67  0.7   0.664 0.677]
cur_param: {'dropout': 0.5921209080317092, 'weight-decay': 0.0061250500530943405, 'lr': 0.003086178455924853, 'lr-reduce-freq': 110, 'patience': 110, 'spt-alg': 'kruskal', 'manifold': 'PoincareBall', 'dim': 256, 'num-adj': 6, 'add-rate': 0.5, 'tem': 0.9, 'consis-rate': 1.3, 'use-att': 0, 'num-layers': 4}
mean: 0.6767
[0.679 0.68  0.688 0.666 0.676 0.679 0.68  0.692 0.668 0.659]
cur_param: {'dropout': 0.584061112271279, 'weight-decay': 0.006586442872684196, 'lr': 0.0038134764989152664, 'lr-reduce-freq': 110, 'patience': 110, 'spt-alg': 'kruskal', 'manifold': 'PoincareBall', 'dim': 256, 'num-adj': 6, 'add-rate': 0.5, 'tem': 0.9, 'consis-rate': 1.3, 'use-att': 0, 'num-layers': 4}
mean: 0.6788000000000001
[0.664 0.687 0.683 0.691 0.673 0.683 0.668 0.692 0.666 0.681]
cur_param: {'dropout': 0.5996101724941856, 'weight-decay': 0.00599097436394709, 'lr': 0.003636917214652333, 'lr-reduce-freq': 110, 'patience': 110, 'spt-alg': 'kruskal', 'manifold': 'PoincareBall', 'dim': 256, 'num-adj': 6, 'add-rate': 0.5, 'tem': 0.9, 'consis-rate': 1.4, 'use-att': 0, 'num-layers': 4}
mean: 0.6804
[0.678 0.69  0.675 0.693 0.672 0.681 0.676 0.696 0.665 0.678]
cur_param: {'dropout': 0.5926616686025018, 'weight-decay': 0.005044257389752895, 'lr': 0.0036888171908415345, 'lr-reduce-freq': 110, 'patience': 110, 'spt-alg': 'kruskal', 'manifold': 'PoincareBall', 'dim': 256, 'num-adj': 6, 'add-rate': 0.5, 'tem': 0.9, 'consis-rate': 1.4, 'use-att': 0, 'num-layers': 4}
mean: 0.6797
[0.673 0.687 0.679 0.689 0.674 0.679 0.672 0.697 0.667 0.68 ]
cur_param: {'dropout': 0.5999171437062072, 'weight-decay': 0.004805621478353618, 'lr': 0.0036057791211921335, 'lr-reduce-freq': 110, 'patience': 110, 'spt-alg': 'kruskal', 'manifold': 'PoincareBall', 'dim': 256, 'num-adj': 6, 'add-rate': 0.5, 'tem': 0.9, 'consis-rate': 1.4, 'use-att': 0, 'num-layers': 4}
mean: 0.6801
[0.679 0.689 0.68  0.688 0.673 0.681 0.673 0.693 0.666 0.679]
cur_param: {'dropout': 0.591162484178826, 'weight-decay': 0.0057695296112040845, 'lr': 0.0034507251817108026, 'lr-reduce-freq': 110, 'patience': 110, 'spt-alg': 'kruskal', 'manifold': 'PoincareBall', 'dim': 256, 'num-adj': 6, 'add-rate': 0.5, 'tem': 0.9, 'consis-rate': 1.4, 'use-att': 0, 'num-layers': 4}
mean: 0.6786000000000001
[0.671 0.686 0.681 0.669 0.675 0.69  0.673 0.694 0.669 0.678]
cur_param: {'dropout': 0.5994619316109618, 'weight-decay': 0.004346488142718233, 'lr': 0.0036773552522400897, 'lr-reduce-freq': 100, 'patience': 100, 'spt-alg': 'kruskal', 'manifold': 'PoincareBall', 'dim': 256, 'num-adj': 6, 'add-rate': 0.5, 'tem': 0.9, 'consis-rate': 1.4, 'use-att': 0, 'num-layers': 4}
mean: 0.6806000000000001
[0.682 0.692 0.676 0.687 0.669 0.683 0.674 0.695 0.671 0.677]
cur_param: {'dropout': 0.5995898089042997, 'weight-decay': 0.004277674808596186, 'lr': 0.0032430639305900356, 'lr-reduce-freq': 100, 'patience': 100, 'spt-alg': 'kruskal', 'manifold': 'PoincareBall', 'dim': 256, 'num-adj': 6, 'add-rate': 0.5, 'tem': 0.9, 'consis-rate': 1.5, 'use-att': 0, 'num-layers': 4}
mean: 0.6777000000000001
[0.673 0.687 0.681 0.676 0.677 0.681 0.675 0.691 0.675 0.661]
cur_param: {'dropout': 0.5796354424728334, 'weight-decay': 0.003872262706339671, 'lr': 0.003462199858747662, 'lr-reduce-freq': 110, 'patience': 110, 'spt-alg': 'kruskal', 'manifold': 'PoincareBall', 'dim': 256, 'num-adj': 6, 'add-rate': 0.5, 'tem': 0.9, 'consis-rate': 1.4, 'use-att': 0, 'num-layers': 4}[32m[I 2022-06-16 20:34:11,444][0m Trial 168 finished with value: 0.6774000000000001 and parameters: {'dropout': 0.5796354424728334, 'weight_decay': 0.003872262706339671, 'lr': 0.003462199858747662, 'patience': 110, 'spt-alg': 'kruskal', 'manifold': 'PoincareBall', 'dim': 256, 'num-adj': 6, 'add-rate': 0.5, 'tem': 0.9, 'consis-rate': 1.4, 'use-att': 0, 'num-layers': 4}. Best is trial 107 with value: 0.6813.[0m
[32m[I 2022-06-16 20:36:23,390][0m Trial 169 finished with value: 0.6774000000000001 and parameters: {'dropout': 0.5850796389706283, 'weight_decay': 0.005108986992361604, 'lr': 0.004145693036008774, 'patience': 100, 'spt-alg': 'kruskal', 'manifold': 'PoincareBall', 'dim': 256, 'num-adj': 6, 'add-rate': 0.5, 'tem': 0.9, 'consis-rate': 1.4, 'use-att': 0, 'num-layers': 4}. Best is trial 107 with value: 0.6813.[0m
[32m[I 2022-06-16 20:38:35,308][0m Trial 170 finished with value: 0.6799000000000001 and parameters: {'dropout': 0.5928346179347697, 'weight_decay': 0.004973557159535574, 'lr': 0.0037248550350187774, 'patience': 110, 'spt-alg': 'kruskal', 'manifold': 'PoincareBall', 'dim': 256, 'num-adj': 6, 'add-rate': 0.5, 'tem': 0.9, 'consis-rate': 1.5, 'use-att': 0, 'num-layers': 4}. Best is trial 107 with value: 0.6813.[0m
[32m[I 2022-06-16 20:40:53,682][0m Trial 171 finished with value: 0.6795000000000001 and parameters: {'dropout': 0.5912568534857057, 'weight_decay': 0.004934121039005704, 'lr': 0.0037001967589996563, 'patience': 110, 'spt-alg': 'kruskal', 'manifold': 'PoincareBall', 'dim': 256, 'num-adj': 6, 'add-rate': 0.5, 'tem': 0.9, 'consis-rate': 1.5, 'use-att': 0, 'num-layers': 4}. Best is trial 107 with value: 0.6813.[0m
[32m[I 2022-06-16 20:43:18,157][0m Trial 172 finished with value: 0.6793000000000001 and parameters: {'dropout': 0.5928675785604304, 'weight_decay': 0.00491140200994079, 'lr': 0.003656007701271142, 'patience': 110, 'spt-alg': 'kruskal', 'manifold': 'PoincareBall', 'dim': 256, 'num-adj': 6, 'add-rate': 0.5, 'tem': 0.9, 'consis-rate': 1.5, 'use-att': 0, 'num-layers': 4}. Best is trial 107 with value: 0.6813.[0m
[32m[I 2022-06-16 20:45:30,416][0m Trial 173 finished with value: 0.6637000000000001 and parameters: {'dropout': 0.24161700870929254, 'weight_decay': 0.004736405413272956, 'lr': 0.003706406383550613, 'patience': 110, 'spt-alg': 'kruskal', 'manifold': 'PoincareBall', 'dim': 256, 'num-adj': 6, 'add-rate': 0.5, 'tem': 0.9, 'consis-rate': 1.5, 'use-att': 0, 'num-layers': 4}. Best is trial 107 with value: 0.6813.[0m
[32m[I 2022-06-16 20:47:55,618][0m Trial 174 finished with value: 0.6767000000000001 and parameters: {'dropout': 0.5920698482793955, 'weight_decay': 0.005139520849268524, 'lr': 0.0033293508245557366, 'patience': 110, 'spt-alg': 'kruskal', 'manifold': 'PoincareBall', 'dim': 256, 'num-adj': 6, 'add-rate': 0.5, 'tem': 0.9, 'consis-rate': 1.5, 'use-att': 0, 'num-layers': 4}. Best is trial 107 with value: 0.6813.[0m
[32m[I 2022-06-16 20:50:18,248][0m Trial 175 finished with value: 0.6777 and parameters: {'dropout': 0.5801336216167771, 'weight_decay': 0.004879884359141563, 'lr': 0.0036202187025459985, 'patience': 110, 'spt-alg': 'kruskal', 'manifold': 'PoincareBall', 'dim': 256, 'num-adj': 6, 'add-rate': 0.5, 'tem': 0.9, 'consis-rate': 1.6, 'use-att': 0, 'num-layers': 4}. Best is trial 107 with value: 0.6813.[0m
[32m[I 2022-06-16 20:52:44,399][0m Trial 176 finished with value: 0.6750999999999999 and parameters: {'dropout': 0.588669649841831, 'weight_decay': 0.00364932320267972, 'lr': 0.0028946611478551276, 'patience': 110, 'spt-alg': 'kruskal', 'manifold': 'PoincareBall', 'dim': 256, 'num-adj': 6, 'add-rate': 0.5, 'tem': 0.9, 'consis-rate': 1.5, 'use-att': 0, 'num-layers': 4}. Best is trial 107 with value: 0.6813.[0m
[32m[I 2022-06-16 20:55:04,040][0m Trial 177 finished with value: 0.6765000000000001 and parameters: {'dropout': 0.5685952099199353, 'weight_decay': 0.004474175392175059, 'lr': 0.0030463346522966867, 'patience': 110, 'spt-alg': 'kruskal', 'manifold': 'PoincareBall', 'dim': 256, 'num-adj': 6, 'add-rate': 0.5, 'tem': 0.9, 'consis-rate': 1.5, 'use-att': 0, 'num-layers': 4}. Best is trial 107 with value: 0.6813.[0m
[32m[I 2022-06-16 20:57:14,896][0m Trial 178 finished with value: 0.6769000000000001 and parameters: {'dropout': 0.5786665746667102, 'weight_decay': 0.005613841183014327, 'lr': 0.003975867342109813, 'patience': 100, 'spt-alg': 'kruskal', 'manifold': 'PoincareBall', 'dim': 256, 'num-adj': 6, 'add-rate': 0.5, 'tem': 0.9, 'consis-rate': 1.4, 'use-att': 0, 'num-layers': 4}. Best is trial 107 with value: 0.6813.[0m
[32m[I 2022-06-16 20:59:31,837][0m Trial 179 finished with value: 0.6784 and parameters: {'dropout': 0.5925949071489905, 'weight_decay': 0.00431587873516779, 'lr': 0.003498248497244518, 'patience': 110, 'spt-alg': 'kruskal', 'manifold': 'PoincareBall', 'dim': 256, 'num-adj': 6, 'add-rate': 0.5, 'tem': 0.9, 'consis-rate': 1.5, 'use-att': 0, 'num-layers': 4}. Best is trial 107 with value: 0.6813.[0m
[32m[I 2022-06-16 21:01:50,905][0m Trial 180 finished with value: 0.679 and parameters: {'dropout': 0.5999733277522525, 'weight_decay': 0.006974730607166782, 'lr': 0.0037706240259654765, 'patience': 110, 'spt-alg': 'kruskal', 'manifold': 'PoincareBall', 'dim': 256, 'num-adj': 6, 'add-rate': 0.5, 'tem': 0.9, 'consis-rate': 1.6, 'use-att': 0, 'num-layers': 3}. Best is trial 107 with value: 0.6813.[0m
[32m[I 2022-06-16 21:04:17,578][0m Trial 181 finished with value: 0.6798 and parameters: {'dropout': 0.599471954187992, 'weight_decay': 0.006857696569410469, 'lr': 0.003883717184857987, 'patience': 110, 'spt-alg': 'kruskal', 'manifold': 'PoincareBall', 'dim': 256, 'num-adj': 6, 'add-rate': 0.5, 'tem': 0.9, 'consis-rate': 1.6, 'use-att': 0, 'num-layers': 3}. Best is trial 107 with value: 0.6813.[0m
[32m[I 2022-06-16 21:06:46,734][0m Trial 182 finished with value: 0.6754 and parameters: {'dropout': 0.5846693777561897, 'weight_decay': 0.005382007933850436, 'lr': 0.004232835370831552, 'patience': 110, 'spt-alg': 'kruskal', 'manifold': 'PoincareBall', 'dim': 256, 'num-adj': 6, 'add-rate': 0.5, 'tem': 0.9, 'consis-rate': 1.6, 'use-att': 0, 'num-layers': 3}. Best is trial 107 with value: 0.6813.[0m
[32m[I 2022-06-16 21:09:09,025][0m Trial 183 finished with value: 0.6774 and parameters: {'dropout': 0.5923689905268177, 'weight_decay': 0.006796273486425689, 'lr': 0.003228152111050076, 'patience': 110, 'spt-alg': 'kruskal', 'manifold': 'PoincareBall', 'dim': 256, 'num-adj': 6, 'add-rate': 0.5, 'tem': 0.9, 'consis-rate': 1.4, 'use-att': 0, 'num-layers': 3}. Best is trial 107 with value: 0.6813.[0m
[32m[I 2022-06-16 21:11:27,652][0m Trial 184 finished with value: 0.6769999999999999 and parameters: {'dropout': 0.5851932619281286, 'weight_decay': 0.00601148548283479, 'lr': 0.003605863382428727, 'patience': 110, 'spt-alg': 'kruskal', 'manifold': 'PoincareBall', 'dim': 256, 'num-adj': 6, 'add-rate': 0.5, 'tem': 1.0, 'consis-rate': 1.4, 'use-att': 0, 'num-layers': 3}. Best is trial 107 with value: 0.6813.[0m
[32m[I 2022-06-16 21:13:45,705][0m Trial 185 finished with value: 0.6766 and parameters: {'dropout': 0.593593233104383, 'weight_decay': 0.0049674244295771905, 'lr': 0.004017538875753114, 'patience': 110, 'spt-alg': 'kruskal', 'manifold': 'PoincareBall', 'dim': 256, 'num-adj': 6, 'add-rate': 0.5, 'tem': 0.9, 'consis-rate': 1.5, 'use-att': 0, 'num-layers': 3}. Best is trial 107 with value: 0.6813.[0m
[32m[I 2022-06-16 21:16:00,392][0m Trial 186 finished with value: 0.6758000000000001 and parameters: {'dropout': 0.5769414164422624, 'weight_decay': 0.005577550573632802, 'lr': 0.0037599126191426614, 'patience': 100, 'spt-alg': 'kruskal', 'manifold': 'PoincareBall', 'dim': 256, 'num-adj': 6, 'add-rate': 0.5, 'tem': 0.8, 'consis-rate': 1.4, 'use-att': 0, 'num-layers': 4}. Best is trial 107 with value: 0.6813.[0m
[32m[I 2022-06-16 21:18:17,974][0m Trial 187 finished with value: 0.6769999999999999 and parameters: {'dropout': 0.5999575227884176, 'weight_decay': 0.0062017396759147456, 'lr': 0.003402786610002488, 'patience': 110, 'spt-alg': 'kruskal', 'manifold': 'PoincareBall', 'dim': 256, 'num-adj': 6, 'add-rate': 0.5, 'tem': 0.9, 'consis-rate': 1.6, 'use-att': 0, 'num-layers': 4}. Best is trial 107 with value: 0.6813.[0m
