nohup: ignoring input
[32m[I 2022-06-16 13:01:16,698][0m A new study created in memory with name: no-name-0c685be9-6f29-4c88-bda6-efe706c6e92f[0m
[32m[I 2022-06-16 13:06:14,207][0m Trial 0 finished with value: 0.6695 and parameters: {'dropout': 0.42585962113897324, 'weight_decay': 0.016245838068447874, 'lr': 0.0005042532532569422, 'patience': 110, 'spt-alg': 'prim', 'manifold': 'Hyperboloid', 'dim': 256, 'num-adj': 2, 'add-rate': 0.1, 'tem': 0.8, 'consis-rate': 0.5, 'use-att': 0, 'num-layers': 5}. Best is trial 0 with value: 0.6695.[0m
[32m[I 2022-06-16 13:08:09,746][0m Trial 1 finished with value: 0.6706000000000001 and parameters: {'dropout': 0.43058170777745275, 'weight_decay': 0.02552790190620132, 'lr': 0.0012807673209388627, 'patience': 60, 'spt-alg': 'kruskal', 'manifold': 'PoincareBall', 'dim': 128, 'num-adj': 2, 'add-rate': 0.4, 'tem': 1.1, 'consis-rate': 0.8, 'use-att': 0, 'num-layers': 4}. Best is trial 1 with value: 0.6706000000000001.[0m
[32m[I 2022-06-16 13:12:46,846][0m Trial 2 finished with value: 0.6642 and parameters: {'dropout': 0.2852572552334359, 'weight_decay': 0.00226121507345463, 'lr': 0.000961506157797439, 'patience': 110, 'spt-alg': 'prim', 'manifold': 'Hyperboloid', 'dim': 128, 'num-adj': 2, 'add-rate': 0.4, 'tem': 0.5, 'consis-rate': 0.7, 'use-att': 1, 'num-layers': 3}. Best is trial 1 with value: 0.6706000000000001.[0m
[32m[I 2022-06-16 13:14:57,512][0m Trial 3 finished with value: 0.6601 and parameters: {'dropout': 0.26355110166301954, 'weight_decay': 0.002293046795545408, 'lr': 0.0017838225552286075, 'patience': 110, 'spt-alg': 'kruskal', 'manifold': 'PoincareBall', 'dim': 192, 'num-adj': 6, 'add-rate': 0.30000000000000004, 'tem': 1.5, 'consis-rate': 1.5, 'use-att': 0, 'num-layers': 3}. Best is trial 1 with value: 0.6706000000000001.[0m
[32m[I 2022-06-16 13:16:55,726][0m Trial 4 finished with value: 0.6662000000000001 and parameters: {'dropout': 0.23824389429633497, 'weight_decay': 0.011166448753324152, 'lr': 0.00985100615970354, 'patience': 130, 'spt-alg': 'prim', 'manifold': 'PoincareBall', 'dim': 256, 'num-adj': 2, 'add-rate': 0.6, 'tem': 0.8, 'consis-rate': 1.7000000000000002, 'use-att': 1, 'num-layers': 3}. Best is trial 1 with value: 0.6706000000000001.[0m
[32m[I 2022-06-16 13:19:39,187][0m Trial 5 finished with value: 0.6617 and parameters: {'dropout': 0.2722218713251941, 'weight_decay': 0.002003274983462806, 'lr': 0.0007846928836503557, 'patience': 120, 'spt-alg': 'kruskal', 'manifold': 'PoincareBall', 'dim': 256, 'num-adj': 8, 'add-rate': 0.5, 'tem': 1.5, 'consis-rate': 1.8, 'use-att': 1, 'num-layers': 4}. Best is trial 1 with value: 0.6706000000000001.[0m
[32m[I 2022-06-16 13:22:18,688][0m Trial 6 finished with value: 0.6584 and parameters: {'dropout': 0.2623957920139736, 'weight_decay': 0.003206842299166164, 'lr': 0.00173452248910213, 'patience': 130, 'spt-alg': 'prim', 'manifold': 'PoincareBall', 'dim': 64, 'num-adj': 2, 'add-rate': 0.5, 'tem': 1.2000000000000002, 'consis-rate': 0.7, 'use-att': 1, 'num-layers': 3}. Best is trial 1 with value: 0.6706000000000001.[0m
[32m[I 2022-06-16 13:25:19,118][0m Trial 7 finished with value: 0.6502 and parameters: {'dropout': 0.20098369917057468, 'weight_decay': 0.0010046633956218138, 'lr': 0.0009427667570602059, 'patience': 110, 'spt-alg': 'prim', 'manifold': 'PoincareBall', 'dim': 64, 'num-adj': 6, 'add-rate': 0.4, 'tem': 1.4, 'consis-rate': 1.3, 'use-att': 0, 'num-layers': 4}. Best is trial 1 with value: 0.6706000000000001.[0m
[32m[I 2022-06-16 13:27:19,224][0m Trial 8 finished with value: 0.674 and parameters: {'dropout': 0.40502404882343146, 'weight_decay': 0.01448341555113012, 'lr': 0.004732077628916715, 'patience': 110, 'spt-alg': 'kruskal', 'manifold': 'PoincareBall', 'dim': 256, 'num-adj': 2, 'add-rate': 0.2, 'tem': 1.0, 'consis-rate': 1.3, 'use-att': 0, 'num-layers': 4}. Best is trial 8 with value: 0.674.[0m
[32m[I 2022-06-16 13:32:25,313][0m Trial 9 finished with value: 0.6724 and parameters: {'dropout': 0.5906107120433166, 'weight_decay': 0.0005722944300421037, 'lr': 0.001012771613835766, 'patience': 100, 'spt-alg': 'kruskal', 'manifold': 'Hyperboloid', 'dim': 64, 'num-adj': 2, 'add-rate': 0.1, 'tem': 0.9, 'consis-rate': 0.6, 'use-att': 0, 'num-layers': 4}. Best is trial 8 with value: 0.674.[0m
[32m[I 2022-06-16 13:34:48,530][0m Trial 10 finished with value: 0.6699 and parameters: {'dropout': 0.5233421791558994, 'weight_decay': 0.04500675542293772, 'lr': 0.004730208939565385, 'patience': 80, 'spt-alg': 'kruskal', 'manifold': 'Hyperboloid', 'dim': 192, 'num-adj': 4, 'add-rate': 0.2, 'tem': 0.5, 'consis-rate': 1.1, 'use-att': 0, 'num-layers': 5}. Best is trial 8 with value: 0.674.[0m
[32m[I 2022-06-16 13:37:34,071][0m Trial 11 finished with value: 0.6743999999999999 and parameters: {'dropout': 0.5843330657024545, 'weight_decay': 0.0005461757202617822, 'lr': 0.003806957986543307, 'patience': 80, 'spt-alg': 'kruskal', 'manifold': 'Hyperboloid', 'dim': 128, 'num-adj': 4, 'add-rate': 0.1, 'tem': 0.9, 'consis-rate': 1.1, 'use-att': 0, 'num-layers': 4}. Best is trial 11 with value: 0.6743999999999999.[0m
[32m[I 2022-06-16 13:40:54,880][0m Trial 12 finished with value: 0.6711000000000001 and parameters: {'dropout': 0.36325419829856453, 'weight_decay': 0.008562009130365839, 'lr': 0.003702395112701819, 'patience': 150, 'spt-alg': 'kruskal', 'manifold': 'Hyperboloid', 'dim': 192, 'num-adj': 4, 'add-rate': 0.2, 'tem': 1.0, 'consis-rate': 1.1, 'use-att': 0, 'num-layers': 4}. Best is trial 11 with value: 0.6743999999999999.[0m
[32m[I 2022-06-16 13:43:34,657][0m Trial 13 finished with value: 0.6712 and parameters: {'dropout': 0.5140629480936734, 'weight_decay': 0.004792303486086336, 'lr': 0.003848328368505036, 'patience': 80, 'spt-alg': 'kruskal', 'manifold': 'Hyperboloid', 'dim': 128, 'num-adj': 4, 'add-rate': 0.2, 'tem': 1.2000000000000002, 'consis-rate': 1.4, 'use-att': 0, 'num-layers': 4}. Best is trial 11 with value: 0.6743999999999999.[0m
[32m[I 2022-06-16 13:45:10,657][0m Trial 14 finished with value: 0.6704 and parameters: {'dropout': 0.35048262852900597, 'weight_decay': 0.006660054521049671, 'lr': 0.006902896270149939, 'patience': 80, 'spt-alg': 'kruskal', 'manifold': 'PoincareBall', 'dim': 192, 'num-adj': 4, 'add-rate': 0.1, 'tem': 0.7, 'consis-rate': 1.0, 'use-att': 0, 'num-layers': 4}. Best is trial 11 with value: 0.6743999999999999.[0m
[32m[I 2022-06-16 13:47:27,103][0m Trial 15 finished with value: 0.6789000000000001 and parameters: {'dropout': 0.4836072560968796, 'weight_decay': 0.000535107496199095, 'lr': 0.0025895553275686665, 'patience': 50, 'spt-alg': 'kruskal', 'manifold': 'Hyperboloid', 'dim': 128, 'num-adj': 6, 'add-rate': 0.30000000000000004, 'tem': 1.0, 'consis-rate': 2.0, 'use-att': 0, 'num-layers': 4}. Best is trial 15 with value: 0.6789000000000001.[0m
[32m[I 2022-06-16 13:49:50,184][0m Trial 16 finished with value: 0.6734000000000001 and parameters: {'dropout': 0.5757345894421609, 'weight_decay': 0.0005538679717506809, 'lr': 0.002495608366007021, 'patience': 50, 'spt-alg': 'kruskal', 'manifold': 'Hyperboloid', 'dim': 128, 'num-adj': 8, 'add-rate': 0.30000000000000004, 'tem': 0.7, 'consis-rate': 2.0, 'use-att': 0, 'num-layers': 5}. Best is trial 15 with value: 0.6789000000000001.[0m
[32m[I 2022-06-16 13:52:17,284][0m Trial 17 finished with value: 0.6752 and parameters: {'dropout': 0.4904759747084407, 'weight_decay': 0.000950179591938216, 'lr': 0.0026658111181825516, 'patience': 60, 'spt-alg': 'kruskal', 'manifold': 'Hyperboloid', 'dim': 128, 'num-adj': 6, 'add-rate': 0.7, 'tem': 1.3, 'consis-rate': 1.7000000000000002, 'use-att': 0, 'num-layers': 4}. Best is trial 15 with value: 0.6789000000000001.[0m
[32m[I 2022-06-16 13:55:04,779][0m Trial 18 finished with value: 0.6698000000000001 and parameters: {'dropout': 0.47173050577984094, 'weight_decay': 0.0011338743475079645, 'lr': 0.002453541030898796, 'patience': 60, 'spt-alg': 'kruskal', 'manifold': 'Hyperboloid', 'dim': 64, 'num-adj': 6, 'add-rate': 0.7, 'tem': 1.3, 'consis-rate': 2.0, 'use-att': 1, 'num-layers': 4}. Best is trial 15 with value: 0.6789000000000001.[0m
[32m[I 2022-06-16 13:57:35,130][0m Trial 19 finished with value: 0.6728000000000001 and parameters: {'dropout': 0.4816933011166989, 'weight_decay': 0.0010716509135527805, 'lr': 0.0019481419643435456, 'patience': 50, 'spt-alg': 'kruskal', 'manifold': 'Hyperboloid', 'dim': 128, 'num-adj': 6, 'add-rate': 0.7, 'tem': 1.3, 'consis-rate': 1.7000000000000002, 'use-att': 0, 'num-layers': 5}. Best is trial 15 with value: 0.6789000000000001.[0m
--dataset citeseer --model HGCN --c None --spt-attr None
cur_param: {'dropout': 0.42585962113897324, 'weight-decay': 0.016245838068447874, 'lr': 0.0005042532532569422, 'lr-reduce-freq': 110, 'patience': 110, 'spt-alg': 'prim', 'manifold': 'Hyperboloid', 'dim': 256, 'num-adj': 2, 'add-rate': 0.1, 'tem': 0.8, 'consis-rate': 0.5, 'use-att': 0, 'num-layers': 5}
mean: 0.6695
[0.674 0.673 0.665 0.668 0.66  0.678 0.663 0.67  0.667 0.677]
cur_param: {'dropout': 0.43058170777745275, 'weight-decay': 0.02552790190620132, 'lr': 0.0012807673209388627, 'lr-reduce-freq': 60, 'patience': 60, 'spt-alg': 'kruskal', 'manifold': 'PoincareBall', 'dim': 128, 'num-adj': 2, 'add-rate': 0.4, 'tem': 1.1, 'consis-rate': 0.8, 'use-att': 0, 'num-layers': 4}
mean: 0.6706000000000001
[0.665 0.667 0.683 0.675 0.663 0.667 0.666 0.668 0.678 0.674]
cur_param: {'dropout': 0.2852572552334359, 'weight-decay': 0.00226121507345463, 'lr': 0.000961506157797439, 'lr-reduce-freq': 110, 'patience': 110, 'spt-alg': 'prim', 'manifold': 'Hyperboloid', 'dim': 128, 'num-adj': 2, 'add-rate': 0.4, 'tem': 0.5, 'consis-rate': 0.7, 'use-att': 1, 'num-layers': 3}
mean: 0.6642
[0.663 0.675 0.662 0.662 0.661 0.661 0.664 0.659 0.662 0.673]
cur_param: {'dropout': 0.26355110166301954, 'weight-decay': 0.002293046795545408, 'lr': 0.0017838225552286075, 'lr-reduce-freq': 110, 'patience': 110, 'spt-alg': 'kruskal', 'manifold': 'PoincareBall', 'dim': 192, 'num-adj': 6, 'add-rate': 0.30000000000000004, 'tem': 1.5, 'consis-rate': 1.5, 'use-att': 0, 'num-layers': 3}
mean: 0.6601
[0.655 0.675 0.661 0.665 0.672 0.668 0.659 0.631 0.652 0.663]
cur_param: {'dropout': 0.23824389429633497, 'weight-decay': 0.011166448753324152, 'lr': 0.00985100615970354, 'lr-reduce-freq': 130, 'patience': 130, 'spt-alg': 'prim', 'manifold': 'PoincareBall', 'dim': 256, 'num-adj': 2, 'add-rate': 0.6, 'tem': 0.8, 'consis-rate': 1.7000000000000002, 'use-att': 1, 'num-layers': 3}
mean: 0.6662000000000001
[0.675 0.665 0.678 0.671 0.651 0.67  0.65  0.653 0.671 0.678]
cur_param: {'dropout': 0.2722218713251941, 'weight-decay': 0.002003274983462806, 'lr': 0.0007846928836503557, 'lr-reduce-freq': 120, 'patience': 120, 'spt-alg': 'kruskal', 'manifold': 'PoincareBall', 'dim': 256, 'num-adj': 8, 'add-rate': 0.5, 'tem': 1.5, 'consis-rate': 1.8, 'use-att': 1, 'num-layers': 4}
mean: 0.6617
[0.665 0.655 0.665 0.666 0.655 0.667 0.656 0.659 0.664 0.665]
cur_param: {'dropout': 0.2623957920139736, 'weight-decay': 0.003206842299166164, 'lr': 0.00173452248910213, 'lr-reduce-freq': 130, 'patience': 130, 'spt-alg': 'prim', 'manifold': 'PoincareBall', 'dim': 64, 'num-adj': 2, 'add-rate': 0.5, 'tem': 1.2000000000000002, 'consis-rate': 0.7, 'use-att': 1, 'num-layers': 3}
mean: 0.6584
[0.672 0.671 0.646 0.668 0.653 0.647 0.659 0.658 0.638 0.672]
cur_param: {'dropout': 0.20098369917057468, 'weight-decay': 0.0010046633956218138, 'lr': 0.0009427667570602059, 'lr-reduce-freq': 110, 'patience': 110, 'spt-alg': 'prim', 'manifold': 'PoincareBall', 'dim': 64, 'num-adj': 6, 'add-rate': 0.4, 'tem': 1.4, 'consis-rate': 1.3, 'use-att': 0, 'num-layers': 4}
mean: 0.6502
[0.657 0.67  0.63  0.653 0.639 0.638 0.652 0.658 0.641 0.664]
cur_param: {'dropout': 0.40502404882343146, 'weight-decay': 0.01448341555113012, 'lr': 0.004732077628916715, 'lr-reduce-freq': 110, 'patience': 110, 'spt-alg': 'kruskal', 'manifold': 'PoincareBall', 'dim': 256, 'num-adj': 2, 'add-rate': 0.2, 'tem': 1.0, 'consis-rate': 1.3, 'use-att': 0, 'num-layers': 4}
mean: 0.674
[0.675 0.666 0.675 0.68  0.669 0.673 0.661 0.677 0.676 0.688]
cur_param: {'dropout': 0.5906107120433166, 'weight-decay': 0.0005722944300421037, 'lr': 0.001012771613835766, 'lr-reduce-freq': 100, 'patience': 100, 'spt-alg': 'kruskal', 'manifold': 'Hyperboloid', 'dim': 64, 'num-adj': 2, 'add-rate': 0.1, 'tem': 0.9, 'consis-rate': 0.6, 'use-att': 0, 'num-layers': 4}
mean: 0.6724
[0.672 0.669 0.67  0.686 0.671 0.682 0.658 0.673 0.676 0.667]
cur_param: {'dropout': 0.5233421791558994, 'weight-decay': 0.04500675542293772, 'lr': 0.004730208939565385, 'lr-reduce-freq': 80, 'patience': 80, 'spt-alg': 'kruskal', 'manifold': 'Hyperboloid', 'dim': 192, 'num-adj': 4, 'add-rate': 0.2, 'tem': 0.5, 'consis-rate': 1.1, 'use-att': 0, 'num-layers': 5}
mean: 0.6699
[0.688 0.674 0.675 0.657 0.674 0.662 0.677 0.666 0.668 0.658]
cur_param: {'dropout': 0.5843330657024545, 'weight-decay': 0.0005461757202617822, 'lr': 0.003806957986543307, 'lr-reduce-freq': 80, 'patience': 80, 'spt-alg': 'kruskal', 'manifold': 'Hyperboloid', 'dim': 128, 'num-adj': 4, 'add-rate': 0.1, 'tem': 0.9, 'consis-rate': 1.1, 'use-att': 0, 'num-layers': 4}
mean: 0.6743999999999999
[0.671 0.676 0.68  0.656 0.673 0.663 0.701 0.659 0.677 0.688]
cur_param: {'dropout': 0.36325419829856453, 'weight-decay': 0.008562009130365839, 'lr': 0.003702395112701819, 'lr-reduce-freq': 150, 'patience': 150, 'spt-alg': 'kruskal', 'manifold': 'Hyperboloid', 'dim': 192, 'num-adj': 4, 'add-rate': 0.2, 'tem': 1.0, 'consis-rate': 1.1, 'use-att': 0, 'num-layers': 4}
mean: 0.6711000000000001
[0.686 0.668 0.684 0.677 0.667 0.665 0.671 0.656 0.666 0.671]
cur_param: {'dropout': 0.5140629480936734, 'weight-decay': 0.004792303486086336, 'lr': 0.003848328368505036, 'lr-reduce-freq': 80, 'patience': 80, 'spt-alg': 'kruskal', 'manifold': 'Hyperboloid', 'dim': 128, 'num-adj': 4, 'add-rate': 0.2, 'tem': 1.2000000000000002, 'consis-rate': 1.4, 'use-att': 0, 'num-layers': 4}
mean: 0.6712
[0.687 0.659 0.672 0.665 0.67  0.677 0.669 0.663 0.657 0.693]
cur_param: {'dropout': 0.35048262852900597, 'weight-decay': 0.006660054521049671, 'lr': 0.006902896270149939, 'lr-reduce-freq': 80, 'patience': 80, 'spt-alg': 'kruskal', 'manifold': 'PoincareBall', 'dim': 192, 'num-adj': 4, 'add-rate': 0.1, 'tem': 0.7, 'consis-rate': 1.0, 'use-att': 0, 'num-layers': 4}
mean: 0.6704
[0.669 0.666 0.674 0.681 0.669 0.667 0.668 0.666 0.663 0.681]
cur_param: {'dropout': 0.4836072560968796, 'weight-decay': 0.000535107496199095, 'lr': 0.0025895553275686665, 'lr-reduce-freq': 50, 'patience': 50, 'spt-alg': 'kruskal', 'manifold': 'Hyperboloid', 'dim': 128, 'num-adj': 6, 'add-rate': 0.30000000000000004, 'tem': 1.0, 'consis-rate': 2.0, 'use-att': 0, 'num-layers': 4}
mean: 0.6789000000000001
[0.686 0.672 0.669 0.671 0.679 0.665 0.704 0.669 0.68  0.694]
cur_param: {'dropout': 0.5757345894421609, 'weight-decay': 0.0005538679717506809, 'lr': 0.002495608366007021, 'lr-reduce-freq': 50, 'patience': 50, 'spt-alg': 'kruskal', 'manifold': 'Hyperboloid', 'dim': 128, 'num-adj': 8, 'add-rate': 0.30000000000000004, 'tem': 0.7, 'consis-rate': 2.0, 'use-att': 0, 'num-layers': 5}
mean: 0.6734000000000001
[0.686 0.675 0.66  0.661 0.658 0.669 0.702 0.673 0.674 0.676]
cur_param: {'dropout': 0.4904759747084407, 'weight-decay': 0.000950179591938216, 'lr': 0.0026658111181825516, 'lr-reduce-freq': 60, 'patience': 60, 'spt-alg': 'kruskal', 'manifold': 'Hyperboloid', 'dim': 128, 'num-adj': 6, 'add-rate': 0.7, 'tem': 1.3, 'consis-rate': 1.7000000000000002, 'use-att': 0, 'num-layers': 4}
mean: 0.6752
[0.677 0.673 0.673 0.669 0.673 0.663 0.691 0.665 0.674 0.694]
cur_param: {'dropout': 0.47173050577984094, 'weight-decay': 0.0011338743475079645, 'lr': 0.002453541030898796, 'lr-reduce-freq': 60, 'patience': 60, 'spt-alg': 'kruskal', 'manifold': 'Hyperboloid', 'dim': 64, 'num-adj': 6, 'add-rate': 0.7, 'tem': 1.3, 'consis-rate': 2.0, 'use-att': 1, 'num-layers': 4}
mean: 0.6698000000000001
[0.662 0.679 0.663 0.683 0.663 0.671 0.667 0.67  0.673 0.667]
cur_param: {'dropout': 0.4816933011166989, 'weight-decay': 0.0010716509135527805, 'lr': 0.0019481419643435456, 'lr-reduce-freq': 50, 'patience': 50, 'spt-alg': 'kruskal', 'manifold': 'Hyperboloid', 'dim': 128, 'num-adj': 6, 'add-rate': 0.7, 'tem': 1.3, 'consis-rate': 1.7000000000000002, 'use-att': 0, 'num-layers': 5}
mean: 0.6728000000000001
[0.68  0.669 0.667 0.666 0.663 0.655 0.69  0.674 0.68  0.684]
cur_param: {'dropout': 0.5373578425970369, 'weight-decay': 0.0013406096681391198, 'lr': 0.002968417829863911, 'lr-reduce-freq': 70, 'patience': 70, 'spt-alg': 'kruskal', 'manifold': 'Hyperboloid', 'dim': 192, 'num-adj': 8, 'add-rate': 0.6, 'tem': 1.1, 'consis-rate': 1.8, 'use-att': 0, 'num-layers': 4}
mean: 0.6729
[0.674 0.679 0.663 0.667 0.673 0.676 0.675 0.675 0.669 0.678][32m[I 2022-06-16 14:00:04,372][0m Trial 20 finished with value: 0.6729 and parameters: {'dropout': 0.5373578425970369, 'weight_decay': 0.0013406096681391198, 'lr': 0.002968417829863911, 'patience': 70, 'spt-alg': 'kruskal', 'manifold': 'Hyperboloid', 'dim': 192, 'num-adj': 8, 'add-rate': 0.6, 'tem': 1.1, 'consis-rate': 1.8, 'use-att': 0, 'num-layers': 4}. Best is trial 15 with value: 0.6789000000000001.[0m
[32m[I 2022-06-16 14:02:14,743][0m Trial 21 finished with value: 0.6688000000000001 and parameters: {'dropout': 0.5553374562378856, 'weight_decay': 0.0006520367926083595, 'lr': 0.006185774657773671, 'patience': 70, 'spt-alg': 'kruskal', 'manifold': 'Hyperboloid', 'dim': 128, 'num-adj': 6, 'add-rate': 0.30000000000000004, 'tem': 0.9, 'consis-rate': 1.5, 'use-att': 0, 'num-layers': 4}. Best is trial 15 with value: 0.6789000000000001.[0m
[32m[I 2022-06-16 14:05:03,393][0m Trial 22 finished with value: 0.6771 and parameters: {'dropout': 0.4829072288186463, 'weight_decay': 0.0007154708202304946, 'lr': 0.0031234075179517895, 'patience': 90, 'spt-alg': 'kruskal', 'manifold': 'Hyperboloid', 'dim': 128, 'num-adj': 4, 'add-rate': 0.5, 'tem': 1.1, 'consis-rate': 2.0, 'use-att': 0, 'num-layers': 4}. Best is trial 15 with value: 0.6789000000000001.[0m
[32m[I 2022-06-16 14:07:18,892][0m Trial 23 finished with value: 0.6734 and parameters: {'dropout': 0.47203701588300007, 'weight_decay': 0.000779558913395065, 'lr': 0.0028876097079428105, 'patience': 60, 'spt-alg': 'kruskal', 'manifold': 'Hyperboloid', 'dim': 128, 'num-adj': 6, 'add-rate': 0.6, 'tem': 1.2000000000000002, 'consis-rate': 1.9000000000000001, 'use-att': 0, 'num-layers': 4}. Best is trial 15 with value: 0.6789000000000001.[0m
[32m[I 2022-06-16 14:11:15,939][0m Trial 24 finished with value: 0.67 and parameters: {'dropout': 0.48522250091581887, 'weight_decay': 0.0017984697536675036, 'lr': 0.001528861655915904, 'patience': 90, 'spt-alg': 'kruskal', 'manifold': 'Hyperboloid', 'dim': 64, 'num-adj': 6, 'add-rate': 0.5, 'tem': 1.1, 'consis-rate': 1.6, 'use-att': 0, 'num-layers': 4}. Best is trial 15 with value: 0.6789000000000001.[0m
[32m[I 2022-06-16 14:13:29,624][0m Trial 25 finished with value: 0.6716000000000001 and parameters: {'dropout': 0.4518745548034222, 'weight_decay': 0.0008983710193738039, 'lr': 0.002906910288611978, 'patience': 50, 'spt-alg': 'kruskal', 'manifold': 'Hyperboloid', 'dim': 128, 'num-adj': 4, 'add-rate': 0.7, 'tem': 1.3, 'consis-rate': 2.0, 'use-att': 0, 'num-layers': 4}. Best is trial 15 with value: 0.6789000000000001.[0m
[32m[I 2022-06-16 14:15:57,498][0m Trial 26 finished with value: 0.6692 and parameters: {'dropout': 0.3722175462403753, 'weight_decay': 0.0014571191588786396, 'lr': 0.002240853932475954, 'patience': 70, 'spt-alg': 'kruskal', 'manifold': 'Hyperboloid', 'dim': 192, 'num-adj': 8, 'add-rate': 0.6, 'tem': 1.4, 'consis-rate': 1.8, 'use-att': 0, 'num-layers': 4}. Best is trial 15 with value: 0.6789000000000001.[0m
[32m[I 2022-06-16 14:18:27,842][0m Trial 27 finished with value: 0.6759000000000001 and parameters: {'dropout': 0.5046506295502075, 'weight_decay': 0.003955737416578074, 'lr': 0.005960495846270853, 'patience': 90, 'spt-alg': 'prim', 'manifold': 'Hyperboloid', 'dim': 128, 'num-adj': 6, 'add-rate': 0.5, 'tem': 1.1, 'consis-rate': 1.9000000000000001, 'use-att': 1, 'num-layers': 3}. Best is trial 15 with value: 0.6789000000000001.[0m
[32m[I 2022-06-16 14:21:04,089][0m Trial 28 finished with value: 0.6676 and parameters: {'dropout': 0.5039482588895314, 'weight_decay': 0.003704700576814755, 'lr': 0.007640129125608586, 'patience': 90, 'spt-alg': 'prim', 'manifold': 'Hyperboloid', 'dim': 64, 'num-adj': 4, 'add-rate': 0.5, 'tem': 1.0, 'consis-rate': 1.9000000000000001, 'use-att': 1, 'num-layers': 3}. Best is trial 15 with value: 0.6789000000000001.[0m
[32m[I 2022-06-16 14:26:14,095][0m Trial 29 finished with value: 0.6613 and parameters: {'dropout': 0.43507028694852967, 'weight_decay': 0.02629029119972412, 'lr': 0.0005363034194544314, 'patience': 100, 'spt-alg': 'prim', 'manifold': 'Hyperboloid', 'dim': 128, 'num-adj': 6, 'add-rate': 0.30000000000000004, 'tem': 0.8, 'consis-rate': 1.9000000000000001, 'use-att': 1, 'num-layers': 3}. Best is trial 15 with value: 0.6789000000000001.[0m
[32m[I 2022-06-16 14:28:39,441][0m Trial 30 finished with value: 0.6689999999999999 and parameters: {'dropout': 0.3976378546540682, 'weight_decay': 0.003579865506756732, 'lr': 0.005291809400732947, 'patience': 90, 'spt-alg': 'prim', 'manifold': 'Hyperboloid', 'dim': 192, 'num-adj': 8, 'add-rate': 0.4, 'tem': 1.1, 'consis-rate': 2.0, 'use-att': 1, 'num-layers': 3}. Best is trial 15 with value: 0.6789000000000001.[0m
[32m[I 2022-06-16 14:31:01,925][0m Trial 31 finished with value: 0.6752 and parameters: {'dropout': 0.557706910014594, 'weight_decay': 0.0007719867987798806, 'lr': 0.0033741889604876015, 'patience': 60, 'spt-alg': 'prim', 'manifold': 'Hyperboloid', 'dim': 128, 'num-adj': 6, 'add-rate': 0.5, 'tem': 1.2000000000000002, 'consis-rate': 1.7000000000000002, 'use-att': 1, 'num-layers': 5}. Best is trial 15 with value: 0.6789000000000001.[0m
