[32m[I 2022-06-16 17:12:09,364][0m Trial 82 finished with value: 0.6791000000000001 and parameters: {'dropout': 0.5772813736656637, 'weight_decay': 0.0008086078438840859, 'lr': 0.0010865373911595824, 'patience': 50, 'spt-alg': 'kruskal', 'manifold': 'PoincareBall', 'dim': 192, 'num-adj': 2, 'add-rate': 0.4, 'tem': 0.9, 'consis-rate': 0.5, 'use-att': 0, 'num-layers': 4}. Best is trial 82 with value: 0.6791000000000001.[0m

mean: 0.6774
[0.683 0.665 0.679 0.678 0.666 0.695 0.673 0.671 0.683 0.681]
cur_param: {'dropout': 0.5594317875848853, 'weight-decay': 0.0005825766793293355, 'lr': 0.0006499316910869257, 'lr-reduce-freq': 150, 'patience': 150, 'spt-alg': 'kruskal', 'manifold': 'Hyperboloid', 'dim': 256, 'num-adj': 2, 'add-rate': 0.4, 'tem': 0.7, 'consis-rate': 0.7, 'use-att': 0, 'num-layers': 5}
mean: 0.6768000000000001
[0.686 0.677 0.666 0.677 0.679 0.682 0.67  0.676 0.682 0.673]
cur_param: {'dropout': 0.5693687287944562, 'weight-decay': 0.001048240208858509, 'lr': 0.0009541399228518609, 'lr-reduce-freq': 140, 'patience': 140, 'spt-alg': 'kruskal', 'manifold': 'Hyperboloid', 'dim': 192, 'num-adj': 2, 'add-rate': 0.2, 'tem': 0.9, 'consis-rate': 0.7, 'use-att': 0, 'num-layers': 5}
mean: 0.6743
[0.682 0.671 0.658 0.678 0.671 0.681 0.675 0.666 0.681 0.68 ]
cur_param: {'dropout': 0.5865011256782123, 'weight-decay': 0.0013138225767558669, 'lr': 0.0016013805258192429, 'lr-reduce-freq': 130, 'patience': 130, 'spt-alg': 'kruskal', 'manifold': 'Hyperboloid', 'dim': 192, 'num-adj': 2, 'add-rate': 0.30000000000000004, 'tem': 1.0, 'consis-rate': 0.5, 'use-att': 0, 'num-layers': 5}
mean: 0.6748999999999999
[0.674 0.669 0.674 0.681 0.673 0.69  0.665 0.669 0.682 0.672]
cur_param: {'dropout': 0.5518430230020668, 'weight-decay': 0.000567725650180915, 'lr': 0.0011602734737074627, 'lr-reduce-freq': 50, 'patience': 50, 'spt-alg': 'kruskal', 'manifold': 'Hyperboloid', 'dim': 192, 'num-adj': 2, 'add-rate': 0.4, 'tem': 0.9, 'consis-rate': 1.0, 'use-att': 0, 'num-layers': 4}
mean: 0.6783
[0.685 0.666 0.68  0.677 0.667 0.697 0.677 0.672 0.683 0.679]
cur_param: {'dropout': 0.5312427211214171, 'weight-decay': 0.009634011246472144, 'lr': 0.0013535764669056313, 'lr-reduce-freq': 50, 'patience': 50, 'spt-alg': 'kruskal', 'manifold': 'PoincareBall', 'dim': 192, 'num-adj': 2, 'add-rate': 0.4, 'tem': 0.9, 'consis-rate': 1.0, 'use-att': 0, 'num-layers': 4}
mean: 0.676
[0.663 0.688 0.682 0.672 0.69  0.685 0.676 0.685 0.662 0.657]
cur_param: {'dropout': 0.5884005355674581, 'weight-decay': 0.0005583941882227305, 'lr': 0.0010406763283381916, 'lr-reduce-freq': 140, 'patience': 140, 'spt-alg': 'kruskal', 'manifold': 'Hyperboloid', 'dim': 192, 'num-adj': 2, 'add-rate': 0.30000000000000004, 'tem': 0.8, 'consis-rate': 0.8, 'use-att': 0, 'num-layers': 4}
mean: 0.6770000000000002
[0.683 0.674 0.678 0.679 0.669 0.681 0.676 0.665 0.682 0.683]
cur_param: {'dropout': 0.5683463662769246, 'weight-decay': 0.0008002385278291534, 'lr': 0.0008276785229481615, 'lr-reduce-freq': 150, 'patience': 150, 'spt-alg': 'kruskal', 'manifold': 'Hyperboloid', 'dim': 192, 'num-adj': 2, 'add-rate': 0.4, 'tem': 0.8, 'consis-rate': 0.9, 'use-att': 0, 'num-layers': 4}
mean: 0.6752
[0.676 0.676 0.676 0.678 0.669 0.682 0.672 0.663 0.683 0.677]
cur_param: {'dropout': 0.5420516151534247, 'weight-decay': 0.0005039872360771167, 'lr': 0.0007362364608928163, 'lr-reduce-freq': 120, 'patience': 120, 'spt-alg': 'kruskal', 'manifold': 'Hyperboloid', 'dim': 192, 'num-adj': 2, 'add-rate': 0.30000000000000004, 'tem': 0.9, 'consis-rate': 0.6, 'use-att': 0, 'num-layers': 4}
mean: 0.6725
[0.672 0.666 0.67  0.667 0.666 0.684 0.68  0.664 0.681 0.675]
cur_param: {'dropout': 0.5590733049978421, 'weight-decay': 0.0007164128661595493, 'lr': 0.001126228155757161, 'lr-reduce-freq': 50, 'patience': 50, 'spt-alg': 'kruskal', 'manifold': 'Hyperboloid', 'dim': 192, 'num-adj': 2, 'add-rate': 0.4, 'tem': 1.0, 'consis-rate': 0.6, 'use-att': 0, 'num-layers': 4}
mean: 0.6778000000000001
[0.686 0.667 0.673 0.68  0.662 0.697 0.679 0.671 0.68  0.683]
cur_param: {'dropout': 0.5603348713615471, 'weight-decay': 0.0009098717284308721, 'lr': 0.0011258693216726005, 'lr-reduce-freq': 50, 'patience': 50, 'spt-alg': 'kruskal', 'manifold': 'Hyperboloid', 'dim': 192, 'num-adj': 2, 'add-rate': 0.4, 'tem': 1.0, 'consis-rate': 0.6, 'use-att': 0, 'num-layers': 4}
mean: 0.6771
[0.684 0.668 0.668 0.683 0.665 0.698 0.68  0.671 0.681 0.673]
cur_param: {'dropout': 0.573054578728344, 'weight-decay': 0.0016005281336287198, 'lr': 0.001361304512507362, 'lr-reduce-freq': 50, 'patience': 50, 'spt-alg': 'kruskal', 'manifold': 'Hyperboloid', 'dim': 192, 'num-adj': 2, 'add-rate': 0.4, 'tem': 1.0, 'consis-rate': 0.5, 'use-att': 0, 'num-layers': 4}
mean: 0.6775
[0.681 0.667 0.681 0.684 0.67  0.684 0.672 0.678 0.672 0.686]
cur_param: {'dropout': 0.5476197589408737, 'weight-decay': 0.0005868740573176048, 'lr': 0.0011850240092842789, 'lr-reduce-freq': 50, 'patience': 50, 'spt-alg': 'kruskal', 'manifold': 'Hyperboloid', 'dim': 192, 'num-adj': 2, 'add-rate': 0.4, 'tem': 0.9, 'consis-rate': 0.7, 'use-att': 0, 'num-layers': 4}
mean: 0.6757000000000001
[0.681 0.665 0.675 0.685 0.67  0.688 0.667 0.67  0.68  0.676]
cur_param: {'dropout': 0.5908767794535901, 'weight-decay': 0.0007525165744113347, 'lr': 0.001040980846103735, 'lr-reduce-freq': 60, 'patience': 60, 'spt-alg': 'kruskal', 'manifold': 'Hyperboloid', 'dim': 256, 'num-adj': 2, 'add-rate': 0.4, 'tem': 0.8, 'consis-rate': 0.8, 'use-att': 0, 'num-layers': 4}
mean: 0.6735
[0.68  0.675 0.668 0.674 0.665 0.676 0.668 0.678 0.679 0.672]
cur_param: {'dropout': 0.5342539120557123, 'weight-decay': 0.04625584905508416, 'lr': 0.0016262012309745594, 'lr-reduce-freq': 50, 'patience': 50, 'spt-alg': 'kruskal', 'manifold': 'Hyperboloid', 'dim': 192, 'num-adj': 2, 'add-rate': 0.4, 'tem': 1.0, 'consis-rate': 1.1, 'use-att': 0, 'num-layers': 4}
mean: 0.675
[0.672 0.674 0.68  0.681 0.668 0.683 0.674 0.666 0.675 0.677]
cur_param: {'dropout': 0.49654864576038654, 'weight-decay': 0.0010896148830101958, 'lr': 0.001429145802779577, 'lr-reduce-freq': 60, 'patience': 60, 'spt-alg': 'kruskal', 'manifold': 'Hyperboloid', 'dim': 192, 'num-adj': 2, 'add-rate': 0.30000000000000004, 'tem': 0.9, 'consis-rate': 0.6, 'use-att': 0, 'num-layers': 4}
mean: 0.6767
[0.683 0.661 0.678 0.685 0.669 0.685 0.677 0.666 0.683 0.68 ]
cur_param: {'dropout': 0.2058004202407718, 'weight-decay': 0.0006953948778865301, 'lr': 0.0008865238569733827, 'lr-reduce-freq': 50, 'patience': 50, 'spt-alg': 'kruskal', 'manifold': 'Hyperboloid', 'dim': 192, 'num-adj': 2, 'add-rate': 0.4, 'tem': 0.9, 'consis-rate': 0.9, 'use-att': 0, 'num-layers': 4}
mean: 0.6643999999999999
[0.665 0.654 0.665 0.678 0.665 0.662 0.678 0.645 0.667 0.665]
cur_param: {'dropout': 0.511409009888071, 'weight-decay': 0.0005813383477069383, 'lr': 0.0012867450216943238, 'lr-reduce-freq': 60, 'patience': 60, 'spt-alg': 'kruskal', 'manifold': 'Hyperboloid', 'dim': 192, 'num-adj': 2, 'add-rate': 0.2, 'tem': 1.0, 'consis-rate': 1.0, 'use-att': 0, 'num-layers': 4}
mean: 0.6753
[0.684 0.662 0.674 0.68  0.667 0.68  0.672 0.674 0.68  0.68 ]
cur_param: {'dropout': 0.5558167720053566, 'weight-decay': 0.0008379556998237631, 'lr': 0.0018312394191335446, 'lr-reduce-freq': 50, 'patience': 50, 'spt-alg': 'kruskal', 'manifold': 'PoincareBall', 'dim': 192, 'num-adj': 2, 'add-rate': 0.4, 'tem': 0.8, 'consis-rate': 0.5, 'use-att': 0, 'num-layers': 4}
mean: 0.6778000000000001
[0.664 0.69  0.669 0.662 0.696 0.675 0.684 0.685 0.681 0.672]
cur_param: {'dropout': 0.5613213040486698, 'weight-decay': 0.0021136599742835474, 'lr': 0.0018309111572611847, 'lr-reduce-freq': 50, 'patience': 50, 'spt-alg': 'kruskal', 'manifold': 'PoincareBall', 'dim': 192, 'num-adj': 2, 'add-rate': 0.4, 'tem': 0.8, 'consis-rate': 0.5, 'use-att': 0, 'num-layers': 4}
mean: 0.6767000000000001
[0.665 0.692 0.671 0.66  0.679 0.678 0.681 0.687 0.681 0.673]
cur_param: {'dropout': 0.5772813736656637, 'weight-decay': 0.0008086078438840859, 'lr': 0.0010865373911595824, 'lr-reduce-freq': 50, 'patience': 50, 'spt-alg': 'kruskal', 'manifold': 'PoincareBall', 'dim': 192, 'num-adj': 2, 'add-rate': 0.4, 'tem': 0.9, 'consis-rate': 0.5, 'use-att': 0, 'num-layers': 4}
mean: 0.6791000000000001
[0.68  0.673 0.669 0.671 0.695 0.683 0.684 0.676 0.686 0.674]
cur_param: {'dropout': 0.5772772096419452, 'weight-decay': 0.0008425133090027412, 'lr': 0.0010558851127091583, 'lr-reduce-freq': 50, 'patience': 50, 'spt-alg': 'kruskal', 'manifold': 'PoincareBall', 'dim': 192, 'num-adj': 2, 'add-rate': 0.4, 'tem': 0.9, 'consis-rate': 0.5, 'use-att': 0, 'num-layers': 4}
mean: 0.6780999999999999
[0.677 0.672 0.673 0.67  0.692 0.685 0.682 0.666 0.683 0.681][32m[I 2022-06-16 17:14:32,740][0m Trial 83 finished with value: 0.6780999999999999 and parameters: {'dropout': 0.5772772096419452, 'weight_decay': 0.0008425133090027412, 'lr': 0.0010558851127091583, 'patience': 50, 'spt-alg': 'kruskal', 'manifold': 'PoincareBall', 'dim': 192, 'num-adj': 2, 'add-rate': 0.4, 'tem': 0.9, 'consis-rate': 0.5, 'use-att': 0, 'num-layers': 4}. Best is trial 82 with value: 0.6791000000000001.[0m
[32m[I 2022-06-16 17:16:53,739][0m Trial 84 finished with value: 0.6782 and parameters: {'dropout': 0.576862683577994, 'weight_decay': 0.0009456896805949882, 'lr': 0.0010333451079357738, 'patience': 60, 'spt-alg': 'kruskal', 'manifold': 'PoincareBall', 'dim': 192, 'num-adj': 2, 'add-rate': 0.30000000000000004, 'tem': 0.7, 'consis-rate': 0.5, 'use-att': 0, 'num-layers': 4}. Best is trial 82 with value: 0.6791000000000001.[0m
[32m[I 2022-06-16 17:19:22,841][0m Trial 85 finished with value: 0.6768000000000001 and parameters: {'dropout': 0.5861377427145454, 'weight_decay': 0.0015297840379919943, 'lr': 0.0006881559101769555, 'patience': 60, 'spt-alg': 'kruskal', 'manifold': 'PoincareBall', 'dim': 256, 'num-adj': 2, 'add-rate': 0.30000000000000004, 'tem': 0.6, 'consis-rate': 0.5, 'use-att': 0, 'num-layers': 4}. Best is trial 82 with value: 0.6791000000000001.[0m
[32m[I 2022-06-16 17:21:31,211][0m Trial 86 finished with value: 0.6763 and parameters: {'dropout': 0.5747021241295575, 'weight_decay': 0.0009762175052795503, 'lr': 0.0010255519249150985, 'patience': 50, 'spt-alg': 'kruskal', 'manifold': 'PoincareBall', 'dim': 192, 'num-adj': 8, 'add-rate': 0.30000000000000004, 'tem': 0.6, 'consis-rate': 0.7, 'use-att': 0, 'num-layers': 4}. Best is trial 82 with value: 0.6791000000000001.[0m
[32m[I 2022-06-16 17:24:12,767][0m Trial 87 finished with value: 0.6772 and parameters: {'dropout': 0.5961768486145416, 'weight_decay': 0.001191819349592051, 'lr': 0.0008915388656084913, 'patience': 60, 'spt-alg': 'kruskal', 'manifold': 'PoincareBall', 'dim': 192, 'num-adj': 2, 'add-rate': 0.2, 'tem': 0.5, 'consis-rate': 0.5, 'use-att': 0, 'num-layers': 4}. Best is trial 82 with value: 0.6791000000000001.[0m
[32m[I 2022-06-16 17:27:06,632][0m Trial 88 finished with value: 0.648 and parameters: {'dropout': 0.5784577072912427, 'weight_decay': 0.0009428168259660785, 'lr': 0.0005926891900021592, 'patience': 50, 'spt-alg': 'kruskal', 'manifold': 'PoincareBall', 'dim': 192, 'num-adj': 2, 'add-rate': 0.5, 'tem': 0.7, 'consis-rate': 0.7, 'use-att': 0, 'num-layers': 4}. Best is trial 82 with value: 0.6791000000000001.[0m
[32m[I 2022-06-16 17:29:32,551][0m Trial 89 finished with value: 0.676 and parameters: {'dropout': 0.5679409321840063, 'weight_decay': 0.0013139966698853462, 'lr': 0.0009683156914919955, 'patience': 50, 'spt-alg': 'kruskal', 'manifold': 'PoincareBall', 'dim': 192, 'num-adj': 2, 'add-rate': 0.30000000000000004, 'tem': 0.9, 'consis-rate': 1.5, 'use-att': 0, 'num-layers': 4}. Best is trial 82 with value: 0.6791000000000001.[0m
[32m[I 2022-06-16 17:31:23,990][0m Trial 90 finished with value: 0.6788000000000001 and parameters: {'dropout': 0.5919246497248066, 'weight_decay': 0.0007802656842396979, 'lr': 0.003591093398395608, 'patience': 60, 'spt-alg': 'kruskal', 'manifold': 'PoincareBall', 'dim': 256, 'num-adj': 2, 'add-rate': 0.4, 'tem': 0.7, 'consis-rate': 1.3, 'use-att': 0, 'num-layers': 4}. Best is trial 82 with value: 0.6791000000000001.[0m
[32m[I 2022-06-16 17:33:51,366][0m Trial 91 finished with value: 0.6808000000000001 and parameters: {'dropout': 0.591491370254848, 'weight_decay': 0.0008059831858800175, 'lr': 0.003617000543547389, 'patience': 110, 'spt-alg': 'kruskal', 'manifold': 'PoincareBall', 'dim': 256, 'num-adj': 2, 'add-rate': 0.4, 'tem': 0.7, 'consis-rate': 1.3, 'use-att': 0, 'num-layers': 4}. Best is trial 91 with value: 0.6808000000000001.[0m
[32m[I 2022-06-16 17:36:13,867][0m Trial 92 finished with value: 0.6794 and parameters: {'dropout': 0.5912040632045068, 'weight_decay': 0.0007657345211336385, 'lr': 0.003589250167625899, 'patience': 110, 'spt-alg': 'kruskal', 'manifold': 'PoincareBall', 'dim': 256, 'num-adj': 2, 'add-rate': 0.4, 'tem': 0.7, 'consis-rate': 1.2000000000000002, 'use-att': 0, 'num-layers': 4}. Best is trial 91 with value: 0.6808000000000001.[0m
[32m[I 2022-06-16 17:38:51,384][0m Trial 93 finished with value: 0.6761000000000001 and parameters: {'dropout': 0.5912131855669279, 'weight_decay': 0.0007732951203242821, 'lr': 0.0029271785883537866, 'patience': 110, 'spt-alg': 'kruskal', 'manifold': 'PoincareBall', 'dim': 256, 'num-adj': 2, 'add-rate': 0.4, 'tem': 0.6, 'consis-rate': 1.3, 'use-att': 0, 'num-layers': 4}. Best is trial 91 with value: 0.6808000000000001.[0m
[32m[I 2022-06-16 17:41:16,616][0m Trial 94 finished with value: 0.6772 and parameters: {'dropout': 0.5934884630883394, 'weight_decay': 0.0011014392716922404, 'lr': 0.00447167824488316, 'patience': 110, 'spt-alg': 'kruskal', 'manifold': 'PoincareBall', 'dim': 256, 'num-adj': 2, 'add-rate': 0.4, 'tem': 0.7, 'consis-rate': 1.2000000000000002, 'use-att': 0, 'num-layers': 4}. Best is trial 91 with value: 0.6808000000000001.[0m
[32m[I 2022-06-16 17:43:38,161][0m Trial 95 finished with value: 0.6671 and parameters: {'dropout': 0.3380583406141239, 'weight_decay': 0.0005456151939690902, 'lr': 0.0021497689613233233, 'patience': 100, 'spt-alg': 'kruskal', 'manifold': 'PoincareBall', 'dim': 256, 'num-adj': 2, 'add-rate': 0.30000000000000004, 'tem': 0.7, 'consis-rate': 1.2000000000000002, 'use-att': 0, 'num-layers': 4}. Best is trial 91 with value: 0.6808000000000001.[0m
[32m[I 2022-06-16 17:45:53,369][0m Trial 96 finished with value: 0.6782999999999999 and parameters: {'dropout': 0.5849120136603768, 'weight_decay': 0.006880443604512881, 'lr': 0.0038914797568047293, 'patience': 110, 'spt-alg': 'kruskal', 'manifold': 'PoincareBall', 'dim': 256, 'num-adj': 2, 'add-rate': 0.5, 'tem': 0.7, 'consis-rate': 1.3, 'use-att': 0, 'num-layers': 4}. Best is trial 91 with value: 0.6808000000000001.[0m
[32m[I 2022-06-16 17:48:09,579][0m Trial 97 finished with value: 0.6769000000000001 and parameters: {'dropout': 0.5861144918903345, 'weight_decay': 0.00703015586436547, 'lr': 0.00390746266659004, 'patience': 110, 'spt-alg': 'kruskal', 'manifold': 'PoincareBall', 'dim': 256, 'num-adj': 2, 'add-rate': 0.5, 'tem': 0.6, 'consis-rate': 1.1, 'use-att': 0, 'num-layers': 4}. Best is trial 91 with value: 0.6808000000000001.[0m
[32m[I 2022-06-16 17:50:39,497][0m Trial 98 finished with value: 0.6808 and parameters: {'dropout': 0.5949226846212027, 'weight_decay': 0.007604426511955602, 'lr': 0.0035513497898049307, 'patience': 120, 'spt-alg': 'kruskal', 'manifold': 'PoincareBall', 'dim': 256, 'num-adj': 4, 'add-rate': 0.5, 'tem': 0.8, 'consis-rate': 1.3, 'use-att': 0, 'num-layers': 4}. Best is trial 91 with value: 0.6808000000000001.[0m
[32m[I 2022-06-16 17:53:07,415][0m Trial 99 finished with value: 0.6744000000000001 and parameters: {'dropout': 0.597137221664449, 'weight_decay': 0.0058704977110318945, 'lr': 0.00492884100919968, 'patience': 120, 'spt-alg': 'kruskal', 'manifold': 'PoincareBall', 'dim': 256, 'num-adj': 4, 'add-rate': 0.5, 'tem': 0.7, 'consis-rate': 1.4, 'use-att': 0, 'num-layers': 4}. Best is trial 91 with value: 0.6808000000000001.[0m
[32m[I 2022-06-16 17:55:24,521][0m Trial 100 finished with value: 0.6719999999999999 and parameters: {'dropout': 0.3873917842183807, 'weight_decay': 0.011966693382640366, 'lr': 0.003545276481510838, 'patience': 120, 'spt-alg': 'kruskal', 'manifold': 'PoincareBall', 'dim': 256, 'num-adj': 4, 'add-rate': 0.5, 'tem': 0.7, 'consis-rate': 1.3, 'use-att': 0, 'num-layers': 4}. Best is trial 91 with value: 0.6808000000000001.[0m
[32m[I 2022-06-16 17:57:39,486][0m Trial 101 finished with value: 0.6763000000000001 and parameters: {'dropout': 0.5866634955056906, 'weight_decay': 0.004642261891697432, 'lr': 0.005258859906364557, 'patience': 110, 'spt-alg': 'kruskal', 'manifold': 'PoincareBall', 'dim': 256, 'num-adj': 2, 'add-rate': 0.5, 'tem': 0.8, 'consis-rate': 1.3, 'use-att': 0, 'num-layers': 4}. Best is trial 91 with value: 0.6808000000000001.[0m
[32m[I 2022-06-16 17:59:42,927][0m Trial 102 finished with value: 0.6741 and parameters: {'dropout': 0.5660416406160995, 'weight_decay': 0.006376878729719651, 'lr': 0.0036625200315025417, 'patience': 100, 'spt-alg': 'kruskal', 'manifold': 'PoincareBall', 'dim': 256, 'num-adj': 2, 'add-rate': 0.4, 'tem': 0.8, 'consis-rate': 1.1, 'use-att': 0, 'num-layers': 4}. Best is trial 91 with value: 0.6808000000000001.[0m
