[32m[I 2022-06-16 19:40:44,516][0m Trial 145 finished with value: 0.6759000000000001 and parameters: {'dropout': 0.5859058499567191, 'weight_decay': 0.009600717666458014, 'lr': 0.004273040159059072, 'patience': 120, 'spt-alg': 'kruskal', 'manifold': 'PoincareBall', 'dim': 256, 'num-adj': 2, 'add-rate': 0.1, 'tem': 0.8, 'consis-rate': 1.0, 'use-att': 0, 'num-layers': 4}. Best is trial 107 with value: 0.6813.[0m

cur_param: {'dropout': 0.5794142570395383, 'weight-decay': 0.017277036192008984, 'lr': 0.0023106609644031623, 'lr-reduce-freq': 130, 'patience': 130, 'spt-alg': 'kruskal', 'manifold': 'PoincareBall', 'dim': 256, 'num-adj': 6, 'add-rate': 0.1, 'tem': 0.8, 'consis-rate': 1.3, 'use-att': 0, 'num-layers': 3}
mean: 0.677
[0.686 0.676 0.685 0.68  0.675 0.667 0.683 0.677 0.665 0.676]
cur_param: {'dropout': 0.5619464767607508, 'weight-decay': 0.004038754343258973, 'lr': 0.004762614241345602, 'lr-reduce-freq': 120, 'patience': 120, 'spt-alg': 'kruskal', 'manifold': 'PoincareBall', 'dim': 256, 'num-adj': 4, 'add-rate': 0.4, 'tem': 0.8, 'consis-rate': 1.4, 'use-att': 0, 'num-layers': 4}
mean: 0.6747000000000002
[0.667 0.683 0.667 0.683 0.678 0.682 0.67  0.671 0.677 0.669]
cur_param: {'dropout': 0.5997635668335684, 'weight-decay': 0.005085760880787909, 'lr': 0.003776131251715789, 'lr-reduce-freq': 110, 'patience': 110, 'spt-alg': 'kruskal', 'manifold': 'PoincareBall', 'dim': 256, 'num-adj': 4, 'add-rate': 0.4, 'tem': 1.1, 'consis-rate': 1.3, 'use-att': 0, 'num-layers': 4}
mean: 0.6785
[0.675 0.692 0.675 0.687 0.668 0.682 0.671 0.697 0.667 0.671]
cur_param: {'dropout': 0.5867551814708624, 'weight-decay': 0.013331554140112292, 'lr': 0.0032269597643660784, 'lr-reduce-freq': 120, 'patience': 120, 'spt-alg': 'kruskal', 'manifold': 'PoincareBall', 'dim': 256, 'num-adj': 6, 'add-rate': 0.4, 'tem': 1.5, 'consis-rate': 1.1, 'use-att': 0, 'num-layers': 4}
mean: 0.6781
[0.669 0.687 0.686 0.674 0.675 0.684 0.668 0.689 0.671 0.678]
cur_param: {'dropout': 0.5757034481827434, 'weight-decay': 0.031014229790683016, 'lr': 0.004324298268857611, 'lr-reduce-freq': 140, 'patience': 140, 'spt-alg': 'kruskal', 'manifold': 'PoincareBall', 'dim': 256, 'num-adj': 4, 'add-rate': 0.5, 'tem': 0.9, 'consis-rate': 1.2000000000000002, 'use-att': 0, 'num-layers': 4}
mean: 0.6773
[0.671 0.685 0.672 0.686 0.671 0.679 0.666 0.693 0.682 0.668]
cur_param: {'dropout': 0.5738268354192398, 'weight-decay': 0.00825637698642703, 'lr': 0.004065899000640575, 'lr-reduce-freq': 130, 'patience': 130, 'spt-alg': 'kruskal', 'manifold': 'PoincareBall', 'dim': 256, 'num-adj': 4, 'add-rate': 0.4, 'tem': 0.8, 'consis-rate': 1.6, 'use-att': 0, 'num-layers': 4}
mean: 0.6761000000000001
[0.661 0.685 0.675 0.68  0.677 0.685 0.668 0.688 0.665 0.677]
cur_param: {'dropout': 0.5922311413467253, 'weight-decay': 0.006471836195202725, 'lr': 0.003937907430506662, 'lr-reduce-freq': 80, 'patience': 80, 'spt-alg': 'kruskal', 'manifold': 'PoincareBall', 'dim': 256, 'num-adj': 4, 'add-rate': 0.4, 'tem': 0.7, 'consis-rate': 1.2000000000000002, 'use-att': 0, 'num-layers': 4}
mean: 0.6769000000000001
[0.673 0.689 0.673 0.692 0.677 0.681 0.668 0.683 0.667 0.666]
cur_param: {'dropout': 0.5849082211070336, 'weight-decay': 0.0033586033418566436, 'lr': 0.003485219000368722, 'lr-reduce-freq': 100, 'patience': 100, 'spt-alg': 'kruskal', 'manifold': 'PoincareBall', 'dim': 256, 'num-adj': 4, 'add-rate': 0.4, 'tem': 0.8, 'consis-rate': 1.0, 'use-att': 0, 'num-layers': 4}
mean: 0.6785
[0.668 0.684 0.685 0.684 0.672 0.68  0.672 0.688 0.671 0.681]
cur_param: {'dropout': 0.5722897340213687, 'weight-decay': 0.0077879601847651355, 'lr': 0.003050709694923306, 'lr-reduce-freq': 100, 'patience': 100, 'spt-alg': 'kruskal', 'manifold': 'PoincareBall', 'dim': 256, 'num-adj': 4, 'add-rate': 0.4, 'tem': 1.0, 'consis-rate': 1.2000000000000002, 'use-att': 0, 'num-layers': 4}
mean: 0.677
[0.676 0.679 0.686 0.677 0.673 0.678 0.675 0.688 0.679 0.659]
cur_param: {'dropout': 0.5998555190096794, 'weight-decay': 0.015410561361435465, 'lr': 0.0050587429714117, 'lr-reduce-freq': 110, 'patience': 110, 'spt-alg': 'kruskal', 'manifold': 'PoincareBall', 'dim': 256, 'num-adj': 4, 'add-rate': 0.4, 'tem': 0.7, 'consis-rate': 1.3, 'use-att': 0, 'num-layers': 4}
mean: 0.673
[0.673 0.687 0.654 0.689 0.667 0.679 0.667 0.671 0.672 0.671]
cur_param: {'dropout': 0.5819078381992548, 'weight-decay': 0.009019504361155818, 'lr': 0.0040691362735724695, 'lr-reduce-freq': 120, 'patience': 120, 'spt-alg': 'kruskal', 'manifold': 'PoincareBall', 'dim': 256, 'num-adj': 8, 'add-rate': 0.4, 'tem': 0.9, 'consis-rate': 1.2000000000000002, 'use-att': 0, 'num-layers': 4}
mean: 0.6763000000000001
[0.661 0.685 0.672 0.686 0.68  0.681 0.669 0.69  0.663 0.676]
cur_param: {'dropout': 0.591081484222351, 'weight-decay': 0.010510731261146804, 'lr': 0.002586188378410975, 'lr-reduce-freq': 140, 'patience': 140, 'spt-alg': 'kruskal', 'manifold': 'PoincareBall', 'dim': 256, 'num-adj': 2, 'add-rate': 0.4, 'tem': 0.8, 'consis-rate': 1.3, 'use-att': 0, 'num-layers': 4}
mean: 0.6753000000000001
[0.679 0.674 0.685 0.687 0.671 0.674 0.678 0.676 0.67  0.659]
cur_param: {'dropout': 0.5623210626363864, 'weight-decay': 0.007320650219717982, 'lr': 0.003821751591721411, 'lr-reduce-freq': 90, 'patience': 90, 'spt-alg': 'kruskal', 'manifold': 'PoincareBall', 'dim': 256, 'num-adj': 2, 'add-rate': 0.5, 'tem': 0.8, 'consis-rate': 1.4, 'use-att': 0, 'num-layers': 4}
mean: 0.6761999999999999
[0.675 0.68  0.668 0.691 0.672 0.679 0.668 0.691 0.664 0.674]
cur_param: {'dropout': 0.2966225173016303, 'weight-decay': 0.0008186009834492478, 'lr': 0.0028349424163516524, 'lr-reduce-freq': 130, 'patience': 130, 'spt-alg': 'kruskal', 'manifold': 'PoincareBall', 'dim': 256, 'num-adj': 6, 'add-rate': 0.4, 'tem': 1.0, 'consis-rate': 1.1, 'use-att': 0, 'num-layers': 4}
mean: 0.6636000000000001
[0.651 0.658 0.662 0.675 0.658 0.663 0.668 0.672 0.658 0.671]
cur_param: {'dropout': 0.5742514527036505, 'weight-decay': 0.00839930973366197, 'lr': 0.004465266281272893, 'lr-reduce-freq': 120, 'patience': 120, 'spt-alg': 'kruskal', 'manifold': 'PoincareBall', 'dim': 256, 'num-adj': 2, 'add-rate': 0.2, 'tem': 0.7, 'consis-rate': 0.9, 'use-att': 0, 'num-layers': 4}
mean: 0.6786000000000001
[0.672 0.685 0.674 0.685 0.673 0.684 0.666 0.691 0.678 0.678]
cur_param: {'dropout': 0.57377178732531, 'weight-decay': 0.008628003934265856, 'lr': 0.004418710223063226, 'lr-reduce-freq': 120, 'patience': 120, 'spt-alg': 'kruskal', 'manifold': 'PoincareBall', 'dim': 256, 'num-adj': 2, 'add-rate': 0.2, 'tem': 0.7, 'consis-rate': 0.9, 'use-att': 0, 'num-layers': 4}
mean: 0.6721000000000001
[0.671 0.67  0.675 0.684 0.675 0.664 0.667 0.671 0.679 0.665]
cur_param: {'dropout': 0.5924414503357647, 'weight-decay': 0.005639384212770958, 'lr': 0.004782571238441318, 'lr-reduce-freq': 120, 'patience': 120, 'spt-alg': 'kruskal', 'manifold': 'PoincareBall', 'dim': 256, 'num-adj': 2, 'add-rate': 0.2, 'tem': 0.6, 'consis-rate': 1.1, 'use-att': 0, 'num-layers': 4}
mean: 0.6763000000000001
[0.67  0.689 0.675 0.682 0.671 0.686 0.665 0.671 0.674 0.68 ]
cur_param: {'dropout': 0.5814516665094139, 'weight-decay': 0.006491946388409631, 'lr': 0.005431768086054729, 'lr-reduce-freq': 110, 'patience': 110, 'spt-alg': 'kruskal', 'manifold': 'PoincareBall', 'dim': 256, 'num-adj': 2, 'add-rate': 0.1, 'tem': 0.7, 'consis-rate': 1.0, 'use-att': 0, 'num-layers': 4}
mean: 0.6734
[0.662 0.682 0.67  0.682 0.673 0.673 0.666 0.676 0.681 0.669]
cur_param: {'dropout': 0.5665643627655969, 'weight-decay': 0.021746601360839307, 'lr': 0.00358430498749534, 'lr-reduce-freq': 130, 'patience': 130, 'spt-alg': 'kruskal', 'manifold': 'PoincareBall', 'dim': 256, 'num-adj': 2, 'add-rate': 0.2, 'tem': 0.7, 'consis-rate': 1.2000000000000002, 'use-att': 0, 'num-layers': 4}
mean: 0.6759000000000001
[0.675 0.681 0.677 0.685 0.662 0.678 0.671 0.684 0.662 0.684]
cur_param: {'dropout': 0.5859058499567191, 'weight-decay': 0.009600717666458014, 'lr': 0.004273040159059072, 'lr-reduce-freq': 120, 'patience': 120, 'spt-alg': 'kruskal', 'manifold': 'PoincareBall', 'dim': 256, 'num-adj': 2, 'add-rate': 0.1, 'tem': 0.8, 'consis-rate': 1.0, 'use-att': 0, 'num-layers': 4}
mean: 0.6759000000000001
[0.672 0.686 0.664 0.684 0.678 0.684 0.668 0.677 0.661 0.685]
cur_param: {'dropout': 0.5755181899157737, 'weight-decay': 0.012321571395146154, 'lr': 0.0038705036563139944, 'lr-reduce-freq': 110, 'patience': 110, 'spt-alg': 'kruskal', 'manifold': 'PoincareBall', 'dim': 256, 'num-adj': 2, 'add-rate': 0.4, 'tem': 0.7, 'consis-rate': 0.9, 'use-att': 0, 'num-layers': 3}
mean: 0.6796
[0.671 0.687 0.673 0.691 0.673 0.681 0.672 0.692 0.665 0.691]
[32m[I 2022-06-16 19:43:00,882][0m Trial 146 finished with value: 0.6796 and parameters: {'dropout': 0.5755181899157737, 'weight_decay': 0.012321571395146154, 'lr': 0.0038705036563139944, 'patience': 110, 'spt-alg': 'kruskal', 'manifold': 'PoincareBall', 'dim': 256, 'num-adj': 2, 'add-rate': 0.4, 'tem': 0.7, 'consis-rate': 0.9, 'use-att': 0, 'num-layers': 3}. Best is trial 107 with value: 0.6813.[0m
[32m[I 2022-06-16 19:45:22,967][0m Trial 147 finished with value: 0.6785 and parameters: {'dropout': 0.592432858236706, 'weight_decay': 0.013381498142195167, 'lr': 0.003337898345816729, 'patience': 110, 'spt-alg': 'kruskal', 'manifold': 'PoincareBall', 'dim': 256, 'num-adj': 2, 'add-rate': 0.4, 'tem': 0.9, 'consis-rate': 1.1, 'use-att': 0, 'num-layers': 4}. Best is trial 107 with value: 0.6813.[0m
[32m[I 2022-06-16 19:47:37,225][0m Trial 148 finished with value: 0.6745 and parameters: {'dropout': 0.5565759289049211, 'weight_decay': 0.012326096688983521, 'lr': 0.0038460280381461534, 'patience': 110, 'spt-alg': 'kruskal', 'manifold': 'PoincareBall', 'dim': 256, 'num-adj': 4, 'add-rate': 0.4, 'tem': 0.8, 'consis-rate': 1.3, 'use-att': 0, 'num-layers': 3}. Best is trial 107 with value: 0.6813.[0m
[32m[I 2022-06-16 19:50:00,339][0m Trial 149 finished with value: 0.6748000000000001 and parameters: {'dropout': 0.4565360226382473, 'weight_decay': 0.015577490898305986, 'lr': 0.004579106693500498, 'patience': 120, 'spt-alg': 'kruskal', 'manifold': 'PoincareBall', 'dim': 256, 'num-adj': 2, 'add-rate': 0.30000000000000004, 'tem': 0.7, 'consis-rate': 0.9, 'use-att': 0, 'num-layers': 3}. Best is trial 107 with value: 0.6813.[0m
[32m[I 2022-06-16 19:52:20,285][0m Trial 150 finished with value: 0.6771 and parameters: {'dropout': 0.5990840489988699, 'weight_decay': 0.0006459184318474801, 'lr': 0.0035873896594892825, 'patience': 110, 'spt-alg': 'kruskal', 'manifold': 'PoincareBall', 'dim': 256, 'num-adj': 4, 'add-rate': 0.1, 'tem': 0.6, 'consis-rate': 1.0, 'use-att': 0, 'num-layers': 3}. Best is trial 107 with value: 0.6813.[0m
[32m[I 2022-06-16 19:54:43,307][0m Trial 151 finished with value: 0.6775000000000001 and parameters: {'dropout': 0.5740371971269922, 'weight_decay': 0.010720486839661935, 'lr': 0.004101534753282377, 'patience': 120, 'spt-alg': 'kruskal', 'manifold': 'PoincareBall', 'dim': 256, 'num-adj': 2, 'add-rate': 0.4, 'tem': 0.7, 'consis-rate': 0.9, 'use-att': 0, 'num-layers': 3}. Best is trial 107 with value: 0.6813.[0m
[32m[I 2022-06-16 19:56:54,220][0m Trial 152 finished with value: 0.6769000000000001 and parameters: {'dropout': 0.5419728515260263, 'weight_decay': 0.007493090121884653, 'lr': 0.0038940452673206422, 'patience': 100, 'spt-alg': 'kruskal', 'manifold': 'PoincareBall', 'dim': 256, 'num-adj': 2, 'add-rate': 0.4, 'tem': 0.7, 'consis-rate': 0.8, 'use-att': 0, 'num-layers': 3}. Best is trial 107 with value: 0.6813.[0m
[32m[I 2022-06-16 19:59:06,564][0m Trial 153 finished with value: 0.6787000000000001 and parameters: {'dropout': 0.5803503447858376, 'weight_decay': 0.008193896801950732, 'lr': 0.0043252469219356585, 'patience': 110, 'spt-alg': 'kruskal', 'manifold': 'PoincareBall', 'dim': 256, 'num-adj': 2, 'add-rate': 0.4, 'tem': 0.8, 'consis-rate': 1.2000000000000002, 'use-att': 0, 'num-layers': 4}. Best is trial 107 with value: 0.6813.[0m
[32m[I 2022-06-16 20:01:27,063][0m Trial 154 finished with value: 0.6793000000000001 and parameters: {'dropout': 0.5843847452074507, 'weight_decay': 0.006769673885531623, 'lr': 0.0036728145095112326, 'patience': 110, 'spt-alg': 'kruskal', 'manifold': 'PoincareBall', 'dim': 256, 'num-adj': 2, 'add-rate': 0.4, 'tem': 0.8, 'consis-rate': 1.2000000000000002, 'use-att': 0, 'num-layers': 4}. Best is trial 107 with value: 0.6813.[0m
[32m[I 2022-06-16 20:03:45,342][0m Trial 155 finished with value: 0.6756000000000001 and parameters: {'dropout': 0.5858392117931037, 'weight_decay': 0.0007274713489291875, 'lr': 0.0031955703931125976, 'patience': 110, 'spt-alg': 'kruskal', 'manifold': 'PoincareBall', 'dim': 256, 'num-adj': 2, 'add-rate': 0.6, 'tem': 0.8, 'consis-rate': 1.2000000000000002, 'use-att': 0, 'num-layers': 4}. Best is trial 107 with value: 0.6813.[0m
[32m[I 2022-06-16 20:06:07,024][0m Trial 156 finished with value: 0.68 and parameters: {'dropout': 0.5922899411698999, 'weight_decay': 0.006950742442118336, 'lr': 0.003438034003552082, 'patience': 110, 'spt-alg': 'kruskal', 'manifold': 'PoincareBall', 'dim': 256, 'num-adj': 2, 'add-rate': 0.4, 'tem': 0.8, 'consis-rate': 1.3, 'use-att': 0, 'num-layers': 4}. Best is trial 107 with value: 0.6813.[0m
[32m[I 2022-06-16 20:08:38,069][0m Trial 157 finished with value: 0.6785000000000001 and parameters: {'dropout': 0.5994283145767035, 'weight_decay': 0.004674823379999935, 'lr': 0.0033945806159207254, 'patience': 110, 'spt-alg': 'kruskal', 'manifold': 'PoincareBall', 'dim': 256, 'num-adj': 2, 'add-rate': 0.4, 'tem': 0.8, 'consis-rate': 1.4, 'use-att': 0, 'num-layers': 4}. Best is trial 107 with value: 0.6813.[0m
[32m[I 2022-06-16 20:11:08,274][0m Trial 158 finished with value: 0.6791 and parameters: {'dropout': 0.5910273564302572, 'weight_decay': 0.005908437197177488, 'lr': 0.00364025874552627, 'patience': 110, 'spt-alg': 'kruskal', 'manifold': 'PoincareBall', 'dim': 256, 'num-adj': 6, 'add-rate': 0.5, 'tem': 0.9, 'consis-rate': 1.3, 'use-att': 0, 'num-layers': 4}. Best is trial 107 with value: 0.6813.[0m
[32m[I 2022-06-16 20:13:28,032][0m Trial 159 finished with value: 0.679 and parameters: {'dropout': 0.5919499327053768, 'weight_decay': 0.0060705849359835, 'lr': 0.0036524637604891364, 'patience': 110, 'spt-alg': 'kruskal', 'manifold': 'PoincareBall', 'dim': 256, 'num-adj': 6, 'add-rate': 0.5, 'tem': 0.9, 'consis-rate': 1.3, 'use-att': 0, 'num-layers': 4}. Best is trial 107 with value: 0.6813.[0m
[32m[I 2022-06-16 20:15:53,651][0m Trial 160 finished with value: 0.6767 and parameters: {'dropout': 0.5921209080317092, 'weight_decay': 0.0061250500530943405, 'lr': 0.003086178455924853, 'patience': 110, 'spt-alg': 'kruskal', 'manifold': 'PoincareBall', 'dim': 256, 'num-adj': 6, 'add-rate': 0.5, 'tem': 0.9, 'consis-rate': 1.3, 'use-att': 0, 'num-layers': 4}. Best is trial 107 with value: 0.6813.[0m
[32m[I 2022-06-16 20:18:13,030][0m Trial 161 finished with value: 0.6788000000000001 and parameters: {'dropout': 0.584061112271279, 'weight_decay': 0.006586442872684196, 'lr': 0.0038134764989152664, 'patience': 110, 'spt-alg': 'kruskal', 'manifold': 'PoincareBall', 'dim': 256, 'num-adj': 6, 'add-rate': 0.5, 'tem': 0.9, 'consis-rate': 1.3, 'use-att': 0, 'num-layers': 4}. Best is trial 107 with value: 0.6813.[0m
[32m[I 2022-06-16 20:20:29,081][0m Trial 162 finished with value: 0.6804 and parameters: {'dropout': 0.5996101724941856, 'weight_decay': 0.00599097436394709, 'lr': 0.003636917214652333, 'patience': 110, 'spt-alg': 'kruskal', 'manifold': 'PoincareBall', 'dim': 256, 'num-adj': 6, 'add-rate': 0.5, 'tem': 0.9, 'consis-rate': 1.4, 'use-att': 0, 'num-layers': 4}. Best is trial 107 with value: 0.6813.[0m
[32m[I 2022-06-16 20:22:50,205][0m Trial 163 finished with value: 0.6797 and parameters: {'dropout': 0.5926616686025018, 'weight_decay': 0.005044257389752895, 'lr': 0.0036888171908415345, 'patience': 110, 'spt-alg': 'kruskal', 'manifold': 'PoincareBall', 'dim': 256, 'num-adj': 6, 'add-rate': 0.5, 'tem': 0.9, 'consis-rate': 1.4, 'use-att': 0, 'num-layers': 4}. Best is trial 107 with value: 0.6813.[0m
[32m[I 2022-06-16 20:25:10,784][0m Trial 164 finished with value: 0.6801 and parameters: {'dropout': 0.5999171437062072, 'weight_decay': 0.004805621478353618, 'lr': 0.0036057791211921335, 'patience': 110, 'spt-alg': 'kruskal', 'manifold': 'PoincareBall', 'dim': 256, 'num-adj': 6, 'add-rate': 0.5, 'tem': 0.9, 'consis-rate': 1.4, 'use-att': 0, 'num-layers': 4}. Best is trial 107 with value: 0.6813.[0m
[32m[I 2022-06-16 20:27:28,719][0m Trial 165 finished with value: 0.6786000000000001 and parameters: {'dropout': 0.591162484178826, 'weight_decay': 0.0057695296112040845, 'lr': 0.0034507251817108026, 'patience': 110, 'spt-alg': 'kruskal', 'manifold': 'PoincareBall', 'dim': 256, 'num-adj': 6, 'add-rate': 0.5, 'tem': 0.9, 'consis-rate': 1.4, 'use-att': 0, 'num-layers': 4}. Best is trial 107 with value: 0.6813.[0m
[32m[I 2022-06-16 20:29:35,710][0m Trial 166 finished with value: 0.6806000000000001 and parameters: {'dropout': 0.5994619316109618, 'weight_decay': 0.004346488142718233, 'lr': 0.0036773552522400897, 'patience': 100, 'spt-alg': 'kruskal', 'manifold': 'PoincareBall', 'dim': 256, 'num-adj': 6, 'add-rate': 0.5, 'tem': 0.9, 'consis-rate': 1.4, 'use-att': 0, 'num-layers': 4}. Best is trial 107 with value: 0.6813.[0m
