[32m[I 2022-06-16 18:51:26,446][0m Trial 124 finished with value: 0.6740000000000002 and parameters: {'dropout': 0.424540435071698, 'weight_decay': 0.03919453703761504, 'lr': 0.004073005135039607, 'patience': 120, 'spt-alg': 'kruskal', 'manifold': 'PoincareBall', 'dim': 256, 'num-adj': 4, 'add-rate': 0.2, 'tem': 0.8, 'consis-rate': 1.2000000000000002, 'use-att': 0, 'num-layers': 4}. Best is trial 107 with value: 0.6813.[0m

cur_param: {'dropout': 0.5997914208047823, 'weight-decay': 0.007777279825649812, 'lr': 0.004096220736517195, 'lr-reduce-freq': 130, 'patience': 130, 'spt-alg': 'kruskal', 'manifold': 'PoincareBall', 'dim': 256, 'num-adj': 4, 'add-rate': 0.5, 'tem': 0.8, 'consis-rate': 1.2000000000000002, 'use-att': 0, 'num-layers': 4}
mean: 0.6796
[0.665 0.693 0.675 0.688 0.676 0.684 0.666 0.691 0.672 0.686]
cur_param: {'dropout': 0.5994025073248768, 'weight-decay': 0.00783987167342391, 'lr': 0.00400768713668618, 'lr-reduce-freq': 120, 'patience': 120, 'spt-alg': 'kruskal', 'manifold': 'PoincareBall', 'dim': 256, 'num-adj': 4, 'add-rate': 0.1, 'tem': 0.8, 'consis-rate': 1.2000000000000002, 'use-att': 0, 'num-layers': 4}
mean: 0.679
[0.668 0.685 0.673 0.693 0.673 0.682 0.673 0.69  0.665 0.688]
cur_param: {'dropout': 0.5963674686519118, 'weight-decay': 0.007790782250865948, 'lr': 0.004061666316952351, 'lr-reduce-freq': 120, 'patience': 120, 'spt-alg': 'kruskal', 'manifold': 'PoincareBall', 'dim': 256, 'num-adj': 4, 'add-rate': 0.6, 'tem': 0.8, 'consis-rate': 1.2000000000000002, 'use-att': 0, 'num-layers': 4}
mean: 0.6813
[0.678 0.692 0.672 0.691 0.676 0.686 0.671 0.692 0.674 0.681]
cur_param: {'dropout': 0.5990311547628906, 'weight-decay': 0.007700970294707133, 'lr': 0.0031318239189825287, 'lr-reduce-freq': 120, 'patience': 120, 'spt-alg': 'kruskal', 'manifold': 'PoincareBall', 'dim': 256, 'num-adj': 4, 'add-rate': 0.1, 'tem': 0.8, 'consis-rate': 1.2000000000000002, 'use-att': 0, 'num-layers': 3}
mean: 0.6747000000000001
[0.664 0.679 0.682 0.669 0.673 0.68  0.68  0.685 0.678 0.657]
cur_param: {'dropout': 0.5935482053643448, 'weight-decay': 0.013288098637071213, 'lr': 0.0051604219793958996, 'lr-reduce-freq': 130, 'patience': 130, 'spt-alg': 'kruskal', 'manifold': 'PoincareBall', 'dim': 256, 'num-adj': 4, 'add-rate': 0.6, 'tem': 0.8, 'consis-rate': 1.4, 'use-att': 0, 'num-layers': 4}
mean: 0.6755
[0.678 0.687 0.673 0.686 0.671 0.68  0.67  0.673 0.673 0.664]
cur_param: {'dropout': 0.5914152513416139, 'weight-decay': 0.00925042919784405, 'lr': 0.004148398266141963, 'lr-reduce-freq': 120, 'patience': 120, 'spt-alg': 'kruskal', 'manifold': 'PoincareBall', 'dim': 256, 'num-adj': 4, 'add-rate': 0.6, 'tem': 0.8, 'consis-rate': 1.1, 'use-att': 0, 'num-layers': 4}
mean: 0.6742000000000001
[0.67  0.689 0.665 0.692 0.668 0.682 0.666 0.679 0.668 0.663]
cur_param: {'dropout': 0.5686991758399826, 'weight-decay': 0.008065981979570438, 'lr': 0.003480195569957035, 'lr-reduce-freq': 130, 'patience': 130, 'spt-alg': 'kruskal', 'manifold': 'PoincareBall', 'dim': 256, 'num-adj': 4, 'add-rate': 0.7, 'tem': 0.8, 'consis-rate': 1.2000000000000002, 'use-att': 0, 'num-layers': 4}
mean: 0.6776
[0.672 0.681 0.676 0.688 0.658 0.675 0.683 0.688 0.669 0.686]
cur_param: {'dropout': 0.5790768461100574, 'weight-decay': 0.00885841803228137, 'lr': 0.003019251517277251, 'lr-reduce-freq': 120, 'patience': 120, 'spt-alg': 'kruskal', 'manifold': 'PoincareBall', 'dim': 256, 'num-adj': 4, 'add-rate': 0.1, 'tem': 0.7, 'consis-rate': 1.2000000000000002, 'use-att': 0, 'num-layers': 4}
mean: 0.6758000000000001
[0.669 0.681 0.685 0.688 0.671 0.682 0.68  0.679 0.668 0.655]
cur_param: {'dropout': 0.571657253147911, 'weight-decay': 0.01152072286811153, 'lr': 0.005629119310093826, 'lr-reduce-freq': 130, 'patience': 130, 'spt-alg': 'kruskal', 'manifold': 'PoincareBall', 'dim': 256, 'num-adj': 4, 'add-rate': 0.6, 'tem': 0.8, 'consis-rate': 1.3, 'use-att': 0, 'num-layers': 4}
mean: 0.6708000000000001
[0.659 0.677 0.672 0.68  0.671 0.673 0.651 0.669 0.683 0.673]
cur_param: {'dropout': 0.58205110941169, 'weight-decay': 0.010459870902149952, 'lr': 0.004620026053904406, 'lr-reduce-freq': 120, 'patience': 120, 'spt-alg': 'kruskal', 'manifold': 'PoincareBall', 'dim': 256, 'num-adj': 4, 'add-rate': 0.7, 'tem': 0.6, 'consis-rate': 1.2000000000000002, 'use-att': 0, 'num-layers': 4}
mean: 0.6771
[0.666 0.687 0.674 0.681 0.675 0.681 0.667 0.673 0.681 0.686]
cur_param: {'dropout': 0.5992598303760839, 'weight-decay': 0.005342130272632128, 'lr': 0.0040220912627268535, 'lr-reduce-freq': 130, 'patience': 130, 'spt-alg': 'kruskal', 'manifold': 'PoincareBall', 'dim': 256, 'num-adj': 4, 'add-rate': 0.4, 'tem': 0.8, 'consis-rate': 1.1, 'use-att': 0, 'num-layers': 4}
mean: 0.6793
[0.671 0.686 0.676 0.696 0.671 0.681 0.673 0.688 0.664 0.687]
cur_param: {'dropout': 0.5993289662362611, 'weight-decay': 0.004334334538329653, 'lr': 0.003328232585356363, 'lr-reduce-freq': 130, 'patience': 130, 'spt-alg': 'kruskal', 'manifold': 'PoincareBall', 'dim': 256, 'num-adj': 4, 'add-rate': 0.4, 'tem': 0.7, 'consis-rate': 1.1, 'use-att': 0, 'num-layers': 4}
mean: 0.6783000000000001
[0.678 0.678 0.684 0.681 0.675 0.685 0.671 0.686 0.674 0.671]
cur_param: {'dropout': 0.43947026332468164, 'weight-decay': 0.005353322892272499, 'lr': 0.006501835712661446, 'lr-reduce-freq': 120, 'patience': 120, 'spt-alg': 'kruskal', 'manifold': 'PoincareBall', 'dim': 256, 'num-adj': 4, 'add-rate': 0.4, 'tem': 0.8, 'consis-rate': 1.0, 'use-att': 0, 'num-layers': 4}
mean: 0.6724
[0.67  0.673 0.674 0.686 0.658 0.661 0.663 0.676 0.672 0.691]
cur_param: {'dropout': 0.5878861570574251, 'weight-decay': 0.006069512288666138, 'lr': 0.00423425109174962, 'lr-reduce-freq': 140, 'patience': 140, 'spt-alg': 'kruskal', 'manifold': 'PoincareBall', 'dim': 256, 'num-adj': 4, 'add-rate': 0.6, 'tem': 0.8, 'consis-rate': 1.1, 'use-att': 0, 'num-layers': 4}
mean: 0.6748000000000001
[0.658 0.686 0.673 0.69  0.666 0.682 0.667 0.678 0.664 0.684]
cur_param: {'dropout': 0.5994548863964254, 'weight-decay': 0.01674818227464754, 'lr': 0.0038079690664322282, 'lr-reduce-freq': 130, 'patience': 130, 'spt-alg': 'kruskal', 'manifold': 'PoincareBall', 'dim': 256, 'num-adj': 4, 'add-rate': 0.1, 'tem': 0.7, 'consis-rate': 1.3, 'use-att': 0, 'num-layers': 4}
mean: 0.679
[0.677 0.682 0.674 0.689 0.677 0.683 0.667 0.695 0.664 0.682]
cur_param: {'dropout': 0.5995957674313316, 'weight-decay': 0.01892567457405074, 'lr': 0.0028335824674584906, 'lr-reduce-freq': 130, 'patience': 130, 'spt-alg': 'kruskal', 'manifold': 'PoincareBall', 'dim': 256, 'num-adj': 4, 'add-rate': 0.1, 'tem': 0.7, 'consis-rate': 1.1, 'use-att': 0, 'num-layers': 4}
mean: 0.6764000000000001
[0.68  0.676 0.688 0.678 0.679 0.671 0.674 0.674 0.678 0.666]
cur_param: {'dropout': 0.5905934475514174, 'weight-decay': 0.0029663388946652674, 'lr': 0.003764339422912207, 'lr-reduce-freq': 130, 'patience': 130, 'spt-alg': 'kruskal', 'manifold': 'PoincareBall', 'dim': 256, 'num-adj': 4, 'add-rate': 0.1, 'tem': 0.7, 'consis-rate': 1.3, 'use-att': 0, 'num-layers': 4}
mean: 0.6773
[0.671 0.691 0.677 0.692 0.674 0.679 0.663 0.688 0.668 0.67 ]
cur_param: {'dropout': 0.5817211302736899, 'weight-decay': 0.007293307713827144, 'lr': 0.004530871426571263, 'lr-reduce-freq': 120, 'patience': 120, 'spt-alg': 'kruskal', 'manifold': 'PoincareBall', 'dim': 256, 'num-adj': 4, 'add-rate': 0.1, 'tem': 0.7, 'consis-rate': 1.3, 'use-att': 0, 'num-layers': 4}
mean: 0.6766
[0.672 0.687 0.675 0.685 0.672 0.68  0.666 0.674 0.675 0.68 ]
cur_param: {'dropout': 0.5656130673240404, 'weight-decay': 0.026859566526943986, 'lr': 0.003658007502869563, 'lr-reduce-freq': 140, 'patience': 140, 'spt-alg': 'kruskal', 'manifold': 'PoincareBall', 'dim': 256, 'num-adj': 4, 'add-rate': 0.1, 'tem': 0.6, 'consis-rate': 1.4, 'use-att': 0, 'num-layers': 4}
mean: 0.6778
[0.671 0.68  0.673 0.689 0.667 0.678 0.665 0.691 0.672 0.692]
cur_param: {'dropout': 0.424540435071698, 'weight-decay': 0.03919453703761504, 'lr': 0.004073005135039607, 'lr-reduce-freq': 120, 'patience': 120, 'spt-alg': 'kruskal', 'manifold': 'PoincareBall', 'dim': 256, 'num-adj': 4, 'add-rate': 0.2, 'tem': 0.8, 'consis-rate': 1.2000000000000002, 'use-att': 0, 'num-layers': 4}
mean: 0.6740000000000002
[0.676 0.666 0.676 0.682 0.675 0.678 0.661 0.685 0.675 0.666]
cur_param: {'dropout': 0.5927593769455054, 'weight-decay': 0.005487327385494587, 'lr': 0.0033819870093664463, 'lr-reduce-freq': 130, 'patience': 130, 'spt-alg': 'kruskal', 'manifold': 'PoincareBall', 'dim': 256, 'num-adj': 4, 'add-rate': 0.4, 'tem': 0.7, 'consis-rate': 1.2000000000000002, 'use-att': 0, 'num-layers': 4}
mean: 0.6764
[0.672 0.685 0.682 0.667 0.68  0.686 0.678 0.689 0.662 0.663][32m[I 2022-06-16 18:53:45,819][0m Trial 125 finished with value: 0.6764 and parameters: {'dropout': 0.5927593769455054, 'weight_decay': 0.005487327385494587, 'lr': 0.0033819870093664463, 'patience': 130, 'spt-alg': 'kruskal', 'manifold': 'PoincareBall', 'dim': 256, 'num-adj': 4, 'add-rate': 0.4, 'tem': 0.7, 'consis-rate': 1.2000000000000002, 'use-att': 0, 'num-layers': 4}. Best is trial 107 with value: 0.6813.[0m
[32m[I 2022-06-16 18:56:10,012][0m Trial 126 finished with value: 0.677 and parameters: {'dropout': 0.5794142570395383, 'weight_decay': 0.017277036192008984, 'lr': 0.0023106609644031623, 'patience': 130, 'spt-alg': 'kruskal', 'manifold': 'PoincareBall', 'dim': 256, 'num-adj': 6, 'add-rate': 0.1, 'tem': 0.8, 'consis-rate': 1.3, 'use-att': 0, 'num-layers': 3}. Best is trial 107 with value: 0.6813.[0m
[32m[I 2022-06-16 18:58:12,374][0m Trial 127 finished with value: 0.6747000000000002 and parameters: {'dropout': 0.5619464767607508, 'weight_decay': 0.004038754343258973, 'lr': 0.004762614241345602, 'patience': 120, 'spt-alg': 'kruskal', 'manifold': 'PoincareBall', 'dim': 256, 'num-adj': 4, 'add-rate': 0.4, 'tem': 0.8, 'consis-rate': 1.4, 'use-att': 0, 'num-layers': 4}. Best is trial 107 with value: 0.6813.[0m
[32m[I 2022-06-16 19:00:15,085][0m Trial 128 finished with value: 0.6785 and parameters: {'dropout': 0.5997635668335684, 'weight_decay': 0.005085760880787909, 'lr': 0.003776131251715789, 'patience': 110, 'spt-alg': 'kruskal', 'manifold': 'PoincareBall', 'dim': 256, 'num-adj': 4, 'add-rate': 0.4, 'tem': 1.1, 'consis-rate': 1.3, 'use-att': 0, 'num-layers': 4}. Best is trial 107 with value: 0.6813.[0m
[32m[I 2022-06-16 19:02:25,321][0m Trial 129 finished with value: 0.6781 and parameters: {'dropout': 0.5867551814708624, 'weight_decay': 0.013331554140112292, 'lr': 0.0032269597643660784, 'patience': 120, 'spt-alg': 'kruskal', 'manifold': 'PoincareBall', 'dim': 256, 'num-adj': 6, 'add-rate': 0.4, 'tem': 1.5, 'consis-rate': 1.1, 'use-att': 0, 'num-layers': 4}. Best is trial 107 with value: 0.6813.[0m
[32m[I 2022-06-16 19:05:04,099][0m Trial 130 finished with value: 0.6773 and parameters: {'dropout': 0.5757034481827434, 'weight_decay': 0.031014229790683016, 'lr': 0.004324298268857611, 'patience': 140, 'spt-alg': 'kruskal', 'manifold': 'PoincareBall', 'dim': 256, 'num-adj': 4, 'add-rate': 0.5, 'tem': 0.9, 'consis-rate': 1.2000000000000002, 'use-att': 0, 'num-layers': 4}. Best is trial 107 with value: 0.6813.[0m
[32m[I 2022-06-16 19:07:30,938][0m Trial 131 finished with value: 0.6761000000000001 and parameters: {'dropout': 0.5738268354192398, 'weight_decay': 0.00825637698642703, 'lr': 0.004065899000640575, 'patience': 130, 'spt-alg': 'kruskal', 'manifold': 'PoincareBall', 'dim': 256, 'num-adj': 4, 'add-rate': 0.4, 'tem': 0.8, 'consis-rate': 1.6, 'use-att': 0, 'num-layers': 4}. Best is trial 107 with value: 0.6813.[0m
[32m[I 2022-06-16 19:09:32,558][0m Trial 132 finished with value: 0.6769000000000001 and parameters: {'dropout': 0.5922311413467253, 'weight_decay': 0.006471836195202725, 'lr': 0.003937907430506662, 'patience': 80, 'spt-alg': 'kruskal', 'manifold': 'PoincareBall', 'dim': 256, 'num-adj': 4, 'add-rate': 0.4, 'tem': 0.7, 'consis-rate': 1.2000000000000002, 'use-att': 0, 'num-layers': 4}. Best is trial 107 with value: 0.6813.[0m
[32m[I 2022-06-16 19:11:43,372][0m Trial 133 finished with value: 0.6785 and parameters: {'dropout': 0.5849082211070336, 'weight_decay': 0.0033586033418566436, 'lr': 0.003485219000368722, 'patience': 100, 'spt-alg': 'kruskal', 'manifold': 'PoincareBall', 'dim': 256, 'num-adj': 4, 'add-rate': 0.4, 'tem': 0.8, 'consis-rate': 1.0, 'use-att': 0, 'num-layers': 4}. Best is trial 107 with value: 0.6813.[0m
[32m[I 2022-06-16 19:13:56,253][0m Trial 134 finished with value: 0.677 and parameters: {'dropout': 0.5722897340213687, 'weight_decay': 0.0077879601847651355, 'lr': 0.003050709694923306, 'patience': 100, 'spt-alg': 'kruskal', 'manifold': 'PoincareBall', 'dim': 256, 'num-adj': 4, 'add-rate': 0.4, 'tem': 1.0, 'consis-rate': 1.2000000000000002, 'use-att': 0, 'num-layers': 4}. Best is trial 107 with value: 0.6813.[0m
[32m[I 2022-06-16 19:16:12,989][0m Trial 135 finished with value: 0.673 and parameters: {'dropout': 0.5998555190096794, 'weight_decay': 0.015410561361435465, 'lr': 0.0050587429714117, 'patience': 110, 'spt-alg': 'kruskal', 'manifold': 'PoincareBall', 'dim': 256, 'num-adj': 4, 'add-rate': 0.4, 'tem': 0.7, 'consis-rate': 1.3, 'use-att': 0, 'num-layers': 4}. Best is trial 107 with value: 0.6813.[0m
[32m[I 2022-06-16 19:18:36,704][0m Trial 136 finished with value: 0.6763000000000001 and parameters: {'dropout': 0.5819078381992548, 'weight_decay': 0.009019504361155818, 'lr': 0.0040691362735724695, 'patience': 120, 'spt-alg': 'kruskal', 'manifold': 'PoincareBall', 'dim': 256, 'num-adj': 8, 'add-rate': 0.4, 'tem': 0.9, 'consis-rate': 1.2000000000000002, 'use-att': 0, 'num-layers': 4}. Best is trial 107 with value: 0.6813.[0m
[32m[I 2022-06-16 19:21:18,262][0m Trial 137 finished with value: 0.6753000000000001 and parameters: {'dropout': 0.591081484222351, 'weight_decay': 0.010510731261146804, 'lr': 0.002586188378410975, 'patience': 140, 'spt-alg': 'kruskal', 'manifold': 'PoincareBall', 'dim': 256, 'num-adj': 2, 'add-rate': 0.4, 'tem': 0.8, 'consis-rate': 1.3, 'use-att': 0, 'num-layers': 4}. Best is trial 107 with value: 0.6813.[0m
[32m[I 2022-06-16 19:23:29,512][0m Trial 138 finished with value: 0.6761999999999999 and parameters: {'dropout': 0.5623210626363864, 'weight_decay': 0.007320650219717982, 'lr': 0.003821751591721411, 'patience': 90, 'spt-alg': 'kruskal', 'manifold': 'PoincareBall', 'dim': 256, 'num-adj': 2, 'add-rate': 0.5, 'tem': 0.8, 'consis-rate': 1.4, 'use-att': 0, 'num-layers': 4}. Best is trial 107 with value: 0.6813.[0m
[32m[I 2022-06-16 19:25:54,376][0m Trial 139 finished with value: 0.6636000000000001 and parameters: {'dropout': 0.2966225173016303, 'weight_decay': 0.0008186009834492478, 'lr': 0.0028349424163516524, 'patience': 130, 'spt-alg': 'kruskal', 'manifold': 'PoincareBall', 'dim': 256, 'num-adj': 6, 'add-rate': 0.4, 'tem': 1.0, 'consis-rate': 1.1, 'use-att': 0, 'num-layers': 4}. Best is trial 107 with value: 0.6813.[0m
[32m[I 2022-06-16 19:28:25,471][0m Trial 140 finished with value: 0.6786000000000001 and parameters: {'dropout': 0.5742514527036505, 'weight_decay': 0.00839930973366197, 'lr': 0.004465266281272893, 'patience': 120, 'spt-alg': 'kruskal', 'manifold': 'PoincareBall', 'dim': 256, 'num-adj': 2, 'add-rate': 0.2, 'tem': 0.7, 'consis-rate': 0.9, 'use-att': 0, 'num-layers': 4}. Best is trial 107 with value: 0.6813.[0m
[32m[I 2022-06-16 19:31:02,194][0m Trial 141 finished with value: 0.6721000000000001 and parameters: {'dropout': 0.57377178732531, 'weight_decay': 0.008628003934265856, 'lr': 0.004418710223063226, 'patience': 120, 'spt-alg': 'kruskal', 'manifold': 'PoincareBall', 'dim': 256, 'num-adj': 2, 'add-rate': 0.2, 'tem': 0.7, 'consis-rate': 0.9, 'use-att': 0, 'num-layers': 4}. Best is trial 107 with value: 0.6813.[0m
[32m[I 2022-06-16 19:33:29,352][0m Trial 142 finished with value: 0.6763000000000001 and parameters: {'dropout': 0.5924414503357647, 'weight_decay': 0.005639384212770958, 'lr': 0.004782571238441318, 'patience': 120, 'spt-alg': 'kruskal', 'manifold': 'PoincareBall', 'dim': 256, 'num-adj': 2, 'add-rate': 0.2, 'tem': 0.6, 'consis-rate': 1.1, 'use-att': 0, 'num-layers': 4}. Best is trial 107 with value: 0.6813.[0m
[32m[I 2022-06-16 19:35:47,577][0m Trial 143 finished with value: 0.6734 and parameters: {'dropout': 0.5814516665094139, 'weight_decay': 0.006491946388409631, 'lr': 0.005431768086054729, 'patience': 110, 'spt-alg': 'kruskal', 'manifold': 'PoincareBall', 'dim': 256, 'num-adj': 2, 'add-rate': 0.1, 'tem': 0.7, 'consis-rate': 1.0, 'use-att': 0, 'num-layers': 4}. Best is trial 107 with value: 0.6813.[0m
[32m[I 2022-06-16 19:38:17,297][0m Trial 144 finished with value: 0.6759000000000001 and parameters: {'dropout': 0.5665643627655969, 'weight_decay': 0.021746601360839307, 'lr': 0.00358430498749534, 'patience': 130, 'spt-alg': 'kruskal', 'manifold': 'PoincareBall', 'dim': 256, 'num-adj': 2, 'add-rate': 0.2, 'tem': 0.7, 'consis-rate': 1.2000000000000002, 'use-att': 0, 'num-layers': 4}. Best is trial 107 with value: 0.6813.[0m
