[32m[I 2022-06-16 18:01:56,825][0m Trial 103 finished with value: 0.6772 and parameters: {'dropout': 0.5515999461409282, 'weight_decay': 0.010113612102166523, 'lr': 0.004374377222553164, 'patience': 110, 'spt-alg': 'kruskal', 'manifold': 'PoincareBall', 'dim': 256, 'num-adj': 2, 'add-rate': 0.5, 'tem': 0.7, 'consis-rate': 1.5, 'use-att': 0, 'num-layers': 4}. Best is trial 91 with value: 0.6808000000000001.[0m

cur_param: {'dropout': 0.576862683577994, 'weight-decay': 0.0009456896805949882, 'lr': 0.0010333451079357738, 'lr-reduce-freq': 60, 'patience': 60, 'spt-alg': 'kruskal', 'manifold': 'PoincareBall', 'dim': 192, 'num-adj': 2, 'add-rate': 0.30000000000000004, 'tem': 0.7, 'consis-rate': 0.5, 'use-att': 0, 'num-layers': 4}
mean: 0.6782
[0.677 0.675 0.668 0.671 0.682 0.69  0.678 0.671 0.688 0.682]
cur_param: {'dropout': 0.5861377427145454, 'weight-decay': 0.0015297840379919943, 'lr': 0.0006881559101769555, 'lr-reduce-freq': 60, 'patience': 60, 'spt-alg': 'kruskal', 'manifold': 'PoincareBall', 'dim': 256, 'num-adj': 2, 'add-rate': 0.30000000000000004, 'tem': 0.6, 'consis-rate': 0.5, 'use-att': 0, 'num-layers': 4}
mean: 0.6768000000000001
[0.667 0.669 0.676 0.677 0.666 0.697 0.668 0.683 0.678 0.687]
cur_param: {'dropout': 0.5747021241295575, 'weight-decay': 0.0009762175052795503, 'lr': 0.0010255519249150985, 'lr-reduce-freq': 50, 'patience': 50, 'spt-alg': 'kruskal', 'manifold': 'PoincareBall', 'dim': 192, 'num-adj': 8, 'add-rate': 0.30000000000000004, 'tem': 0.6, 'consis-rate': 0.7, 'use-att': 0, 'num-layers': 4}
mean: 0.6763
[0.676 0.672 0.67  0.666 0.684 0.687 0.677 0.669 0.688 0.674]
cur_param: {'dropout': 0.5961768486145416, 'weight-decay': 0.001191819349592051, 'lr': 0.0008915388656084913, 'lr-reduce-freq': 60, 'patience': 60, 'spt-alg': 'kruskal', 'manifold': 'PoincareBall', 'dim': 192, 'num-adj': 2, 'add-rate': 0.2, 'tem': 0.5, 'consis-rate': 0.5, 'use-att': 0, 'num-layers': 4}
mean: 0.6772
[0.668 0.68  0.666 0.663 0.682 0.674 0.673 0.689 0.692 0.685]
cur_param: {'dropout': 0.5784577072912427, 'weight-decay': 0.0009428168259660785, 'lr': 0.0005926891900021592, 'lr-reduce-freq': 50, 'patience': 50, 'spt-alg': 'kruskal', 'manifold': 'PoincareBall', 'dim': 192, 'num-adj': 2, 'add-rate': 0.5, 'tem': 0.7, 'consis-rate': 0.7, 'use-att': 0, 'num-layers': 4}
mean: 0.648
[0.662 0.678 0.4   0.676 0.684 0.68  0.678 0.678 0.675 0.669]
cur_param: {'dropout': 0.5679409321840063, 'weight-decay': 0.0013139966698853462, 'lr': 0.0009683156914919955, 'lr-reduce-freq': 50, 'patience': 50, 'spt-alg': 'kruskal', 'manifold': 'PoincareBall', 'dim': 192, 'num-adj': 2, 'add-rate': 0.30000000000000004, 'tem': 0.9, 'consis-rate': 1.5, 'use-att': 0, 'num-layers': 4}
mean: 0.676
[0.676 0.676 0.669 0.661 0.699 0.683 0.668 0.667 0.681 0.68 ]
cur_param: {'dropout': 0.5919246497248066, 'weight-decay': 0.0007802656842396979, 'lr': 0.003591093398395608, 'lr-reduce-freq': 60, 'patience': 60, 'spt-alg': 'kruskal', 'manifold': 'PoincareBall', 'dim': 256, 'num-adj': 2, 'add-rate': 0.4, 'tem': 0.7, 'consis-rate': 1.3, 'use-att': 0, 'num-layers': 4}
mean: 0.6788000000000001
[0.671 0.687 0.676 0.682 0.676 0.682 0.669 0.7   0.664 0.681]
cur_param: {'dropout': 0.591491370254848, 'weight-decay': 0.0008059831858800175, 'lr': 0.003617000543547389, 'lr-reduce-freq': 110, 'patience': 110, 'spt-alg': 'kruskal', 'manifold': 'PoincareBall', 'dim': 256, 'num-adj': 2, 'add-rate': 0.4, 'tem': 0.7, 'consis-rate': 1.3, 'use-att': 0, 'num-layers': 4}
mean: 0.6808000000000001
[0.671 0.687 0.677 0.692 0.673 0.684 0.672 0.701 0.665 0.686]
cur_param: {'dropout': 0.5912040632045068, 'weight-decay': 0.0007657345211336385, 'lr': 0.003589250167625899, 'lr-reduce-freq': 110, 'patience': 110, 'spt-alg': 'kruskal', 'manifold': 'PoincareBall', 'dim': 256, 'num-adj': 2, 'add-rate': 0.4, 'tem': 0.7, 'consis-rate': 1.2000000000000002, 'use-att': 0, 'num-layers': 4}
mean: 0.6794
[0.671 0.684 0.684 0.688 0.672 0.679 0.668 0.698 0.668 0.682]
cur_param: {'dropout': 0.5912131855669279, 'weight-decay': 0.0007732951203242821, 'lr': 0.0029271785883537866, 'lr-reduce-freq': 110, 'patience': 110, 'spt-alg': 'kruskal', 'manifold': 'PoincareBall', 'dim': 256, 'num-adj': 2, 'add-rate': 0.4, 'tem': 0.6, 'consis-rate': 1.3, 'use-att': 0, 'num-layers': 4}
mean: 0.6761000000000001
[0.685 0.678 0.684 0.68  0.675 0.671 0.675 0.68  0.667 0.666]
cur_param: {'dropout': 0.5934884630883394, 'weight-decay': 0.0011014392716922404, 'lr': 0.00447167824488316, 'lr-reduce-freq': 110, 'patience': 110, 'spt-alg': 'kruskal', 'manifold': 'PoincareBall', 'dim': 256, 'num-adj': 2, 'add-rate': 0.4, 'tem': 0.7, 'consis-rate': 1.2000000000000002, 'use-att': 0, 'num-layers': 4}
mean: 0.6772
[0.67  0.675 0.678 0.692 0.665 0.682 0.669 0.679 0.675 0.687]
cur_param: {'dropout': 0.3380583406141239, 'weight-decay': 0.0005456151939690902, 'lr': 0.0021497689613233233, 'lr-reduce-freq': 100, 'patience': 100, 'spt-alg': 'kruskal', 'manifold': 'PoincareBall', 'dim': 256, 'num-adj': 2, 'add-rate': 0.30000000000000004, 'tem': 0.7, 'consis-rate': 1.2000000000000002, 'use-att': 0, 'num-layers': 4}
mean: 0.6671
[0.659 0.669 0.67  0.674 0.655 0.671 0.665 0.678 0.663 0.667]
cur_param: {'dropout': 0.5849120136603768, 'weight-decay': 0.006880443604512881, 'lr': 0.0038914797568047293, 'lr-reduce-freq': 110, 'patience': 110, 'spt-alg': 'kruskal', 'manifold': 'PoincareBall', 'dim': 256, 'num-adj': 2, 'add-rate': 0.5, 'tem': 0.7, 'consis-rate': 1.3, 'use-att': 0, 'num-layers': 4}
mean: 0.6782999999999999
[0.672 0.688 0.678 0.686 0.675 0.684 0.675 0.691 0.665 0.669]
cur_param: {'dropout': 0.5861144918903345, 'weight-decay': 0.00703015586436547, 'lr': 0.00390746266659004, 'lr-reduce-freq': 110, 'patience': 110, 'spt-alg': 'kruskal', 'manifold': 'PoincareBall', 'dim': 256, 'num-adj': 2, 'add-rate': 0.5, 'tem': 0.6, 'consis-rate': 1.1, 'use-att': 0, 'num-layers': 4}
mean: 0.6769000000000001
[0.67  0.69  0.676 0.688 0.677 0.68  0.656 0.691 0.673 0.668]
cur_param: {'dropout': 0.5949226846212027, 'weight-decay': 0.007604426511955602, 'lr': 0.0035513497898049307, 'lr-reduce-freq': 120, 'patience': 120, 'spt-alg': 'kruskal', 'manifold': 'PoincareBall', 'dim': 256, 'num-adj': 4, 'add-rate': 0.5, 'tem': 0.8, 'consis-rate': 1.3, 'use-att': 0, 'num-layers': 4}
mean: 0.6808
[0.675 0.689 0.687 0.688 0.675 0.685 0.675 0.698 0.669 0.667]
cur_param: {'dropout': 0.597137221664449, 'weight-decay': 0.0058704977110318945, 'lr': 0.00492884100919968, 'lr-reduce-freq': 120, 'patience': 120, 'spt-alg': 'kruskal', 'manifold': 'PoincareBall', 'dim': 256, 'num-adj': 4, 'add-rate': 0.5, 'tem': 0.7, 'consis-rate': 1.4, 'use-att': 0, 'num-layers': 4}
mean: 0.6744000000000001
[0.675 0.686 0.671 0.687 0.67  0.682 0.663 0.669 0.666 0.675]
cur_param: {'dropout': 0.3873917842183807, 'weight-decay': 0.011966693382640366, 'lr': 0.003545276481510838, 'lr-reduce-freq': 120, 'patience': 120, 'spt-alg': 'kruskal', 'manifold': 'PoincareBall', 'dim': 256, 'num-adj': 4, 'add-rate': 0.5, 'tem': 0.7, 'consis-rate': 1.3, 'use-att': 0, 'num-layers': 4}
mean: 0.6719999999999999
[0.669 0.667 0.665 0.688 0.669 0.67  0.662 0.679 0.68  0.671]
cur_param: {'dropout': 0.5866634955056906, 'weight-decay': 0.004642261891697432, 'lr': 0.005258859906364557, 'lr-reduce-freq': 110, 'patience': 110, 'spt-alg': 'kruskal', 'manifold': 'PoincareBall', 'dim': 256, 'num-adj': 2, 'add-rate': 0.5, 'tem': 0.8, 'consis-rate': 1.3, 'use-att': 0, 'num-layers': 4}
mean: 0.6763000000000001
[0.676 0.681 0.678 0.679 0.676 0.677 0.671 0.677 0.673 0.675]
cur_param: {'dropout': 0.5660416406160995, 'weight-decay': 0.006376878729719651, 'lr': 0.0036625200315025417, 'lr-reduce-freq': 100, 'patience': 100, 'spt-alg': 'kruskal', 'manifold': 'PoincareBall', 'dim': 256, 'num-adj': 2, 'add-rate': 0.4, 'tem': 0.8, 'consis-rate': 1.1, 'use-att': 0, 'num-layers': 4}
mean: 0.6741
[0.672 0.681 0.676 0.683 0.664 0.68  0.667 0.69  0.657 0.671]
cur_param: {'dropout': 0.5515999461409282, 'weight-decay': 0.010113612102166523, 'lr': 0.004374377222553164, 'lr-reduce-freq': 110, 'patience': 110, 'spt-alg': 'kruskal', 'manifold': 'PoincareBall', 'dim': 256, 'num-adj': 2, 'add-rate': 0.5, 'tem': 0.7, 'consis-rate': 1.5, 'use-att': 0, 'num-layers': 4}
mean: 0.6772
[0.673 0.684 0.672 0.676 0.677 0.68  0.675 0.678 0.677 0.68 ]
cur_param: {'dropout': 0.5733279411953385, 'weight-decay': 0.008409869438811474, 'lr': 0.003974517459896257, 'lr-reduce-freq': 100, 'patience': 100, 'spt-alg': 'kruskal', 'manifold': 'PoincareBall', 'dim': 256, 'num-adj': 2, 'add-rate': 0.4, 'tem': 0.8, 'consis-rate': 1.2000000000000002, 'use-att': 0, 'num-layers': 4}
mean: 0.6786000000000001
[0.672 0.687 0.673 0.69  0.677 0.684 0.666 0.689 0.662 0.686][32m[I 2022-06-16 18:04:08,893][0m Trial 104 finished with value: 0.6786000000000001 and parameters: {'dropout': 0.5733279411953385, 'weight_decay': 0.008409869438811474, 'lr': 0.003974517459896257, 'patience': 100, 'spt-alg': 'kruskal', 'manifold': 'PoincareBall', 'dim': 256, 'num-adj': 2, 'add-rate': 0.4, 'tem': 0.8, 'consis-rate': 1.2000000000000002, 'use-att': 0, 'num-layers': 4}. Best is trial 91 with value: 0.6808000000000001.[0m
[32m[I 2022-06-16 18:06:32,546][0m Trial 105 finished with value: 0.6796 and parameters: {'dropout': 0.5997914208047823, 'weight_decay': 0.007777279825649812, 'lr': 0.004096220736517195, 'patience': 130, 'spt-alg': 'kruskal', 'manifold': 'PoincareBall', 'dim': 256, 'num-adj': 4, 'add-rate': 0.5, 'tem': 0.8, 'consis-rate': 1.2000000000000002, 'use-att': 0, 'num-layers': 4}. Best is trial 91 with value: 0.6808000000000001.[0m
[32m[I 2022-06-16 18:08:54,546][0m Trial 106 finished with value: 0.679 and parameters: {'dropout': 0.5994025073248768, 'weight_decay': 0.00783987167342391, 'lr': 0.00400768713668618, 'patience': 120, 'spt-alg': 'kruskal', 'manifold': 'PoincareBall', 'dim': 256, 'num-adj': 4, 'add-rate': 0.1, 'tem': 0.8, 'consis-rate': 1.2000000000000002, 'use-att': 0, 'num-layers': 4}. Best is trial 91 with value: 0.6808000000000001.[0m
[32m[I 2022-06-16 18:11:14,105][0m Trial 107 finished with value: 0.6813 and parameters: {'dropout': 0.5963674686519118, 'weight_decay': 0.007790782250865948, 'lr': 0.004061666316952351, 'patience': 120, 'spt-alg': 'kruskal', 'manifold': 'PoincareBall', 'dim': 256, 'num-adj': 4, 'add-rate': 0.6, 'tem': 0.8, 'consis-rate': 1.2000000000000002, 'use-att': 0, 'num-layers': 4}. Best is trial 107 with value: 0.6813.[0m
[32m[I 2022-06-16 18:13:43,644][0m Trial 108 finished with value: 0.6747000000000001 and parameters: {'dropout': 0.5990311547628906, 'weight_decay': 0.007700970294707133, 'lr': 0.0031318239189825287, 'patience': 120, 'spt-alg': 'kruskal', 'manifold': 'PoincareBall', 'dim': 256, 'num-adj': 4, 'add-rate': 0.1, 'tem': 0.8, 'consis-rate': 1.2000000000000002, 'use-att': 0, 'num-layers': 3}. Best is trial 107 with value: 0.6813.[0m
[32m[I 2022-06-16 18:16:06,927][0m Trial 109 finished with value: 0.6755 and parameters: {'dropout': 0.5935482053643448, 'weight_decay': 0.013288098637071213, 'lr': 0.0051604219793958996, 'patience': 130, 'spt-alg': 'kruskal', 'manifold': 'PoincareBall', 'dim': 256, 'num-adj': 4, 'add-rate': 0.6, 'tem': 0.8, 'consis-rate': 1.4, 'use-att': 0, 'num-layers': 4}. Best is trial 107 with value: 0.6813.[0m
[32m[I 2022-06-16 18:18:27,923][0m Trial 110 finished with value: 0.6742000000000001 and parameters: {'dropout': 0.5914152513416139, 'weight_decay': 0.00925042919784405, 'lr': 0.004148398266141963, 'patience': 120, 'spt-alg': 'kruskal', 'manifold': 'PoincareBall', 'dim': 256, 'num-adj': 4, 'add-rate': 0.6, 'tem': 0.8, 'consis-rate': 1.1, 'use-att': 0, 'num-layers': 4}. Best is trial 107 with value: 0.6813.[0m
[32m[I 2022-06-16 18:21:00,418][0m Trial 111 finished with value: 0.6776 and parameters: {'dropout': 0.5686991758399826, 'weight_decay': 0.008065981979570438, 'lr': 0.003480195569957035, 'patience': 130, 'spt-alg': 'kruskal', 'manifold': 'PoincareBall', 'dim': 256, 'num-adj': 4, 'add-rate': 0.7, 'tem': 0.8, 'consis-rate': 1.2000000000000002, 'use-att': 0, 'num-layers': 4}. Best is trial 107 with value: 0.6813.[0m
[32m[I 2022-06-16 18:23:33,257][0m Trial 112 finished with value: 0.6758000000000001 and parameters: {'dropout': 0.5790768461100574, 'weight_decay': 0.00885841803228137, 'lr': 0.003019251517277251, 'patience': 120, 'spt-alg': 'kruskal', 'manifold': 'PoincareBall', 'dim': 256, 'num-adj': 4, 'add-rate': 0.1, 'tem': 0.7, 'consis-rate': 1.2000000000000002, 'use-att': 0, 'num-layers': 4}. Best is trial 107 with value: 0.6813.[0m
[32m[I 2022-06-16 18:25:54,807][0m Trial 113 finished with value: 0.6708000000000001 and parameters: {'dropout': 0.571657253147911, 'weight_decay': 0.01152072286811153, 'lr': 0.005629119310093826, 'patience': 130, 'spt-alg': 'kruskal', 'manifold': 'PoincareBall', 'dim': 256, 'num-adj': 4, 'add-rate': 0.6, 'tem': 0.8, 'consis-rate': 1.3, 'use-att': 0, 'num-layers': 4}. Best is trial 107 with value: 0.6813.[0m
[32m[I 2022-06-16 18:28:16,154][0m Trial 114 finished with value: 0.6771 and parameters: {'dropout': 0.58205110941169, 'weight_decay': 0.010459870902149952, 'lr': 0.004620026053904406, 'patience': 120, 'spt-alg': 'kruskal', 'manifold': 'PoincareBall', 'dim': 256, 'num-adj': 4, 'add-rate': 0.7, 'tem': 0.6, 'consis-rate': 1.2000000000000002, 'use-att': 0, 'num-layers': 4}. Best is trial 107 with value: 0.6813.[0m
[32m[I 2022-06-16 18:30:54,512][0m Trial 115 finished with value: 0.6793 and parameters: {'dropout': 0.5992598303760839, 'weight_decay': 0.005342130272632128, 'lr': 0.0040220912627268535, 'patience': 130, 'spt-alg': 'kruskal', 'manifold': 'PoincareBall', 'dim': 256, 'num-adj': 4, 'add-rate': 0.4, 'tem': 0.8, 'consis-rate': 1.1, 'use-att': 0, 'num-layers': 4}. Best is trial 107 with value: 0.6813.[0m
[32m[I 2022-06-16 18:33:41,528][0m Trial 116 finished with value: 0.6783000000000001 and parameters: {'dropout': 0.5993289662362611, 'weight_decay': 0.004334334538329653, 'lr': 0.003328232585356363, 'patience': 130, 'spt-alg': 'kruskal', 'manifold': 'PoincareBall', 'dim': 256, 'num-adj': 4, 'add-rate': 0.4, 'tem': 0.7, 'consis-rate': 1.1, 'use-att': 0, 'num-layers': 4}. Best is trial 107 with value: 0.6813.[0m
[32m[I 2022-06-16 18:35:55,346][0m Trial 117 finished with value: 0.6724 and parameters: {'dropout': 0.43947026332468164, 'weight_decay': 0.005353322892272499, 'lr': 0.006501835712661446, 'patience': 120, 'spt-alg': 'kruskal', 'manifold': 'PoincareBall', 'dim': 256, 'num-adj': 4, 'add-rate': 0.4, 'tem': 0.8, 'consis-rate': 1.0, 'use-att': 0, 'num-layers': 4}. Best is trial 107 with value: 0.6813.[0m
[32m[I 2022-06-16 18:38:07,379][0m Trial 118 finished with value: 0.6748000000000001 and parameters: {'dropout': 0.5878861570574251, 'weight_decay': 0.006069512288666138, 'lr': 0.00423425109174962, 'patience': 140, 'spt-alg': 'kruskal', 'manifold': 'PoincareBall', 'dim': 256, 'num-adj': 4, 'add-rate': 0.6, 'tem': 0.8, 'consis-rate': 1.1, 'use-att': 0, 'num-layers': 4}. Best is trial 107 with value: 0.6813.[0m
[32m[I 2022-06-16 18:40:18,833][0m Trial 119 finished with value: 0.679 and parameters: {'dropout': 0.5994548863964254, 'weight_decay': 0.01674818227464754, 'lr': 0.0038079690664322282, 'patience': 130, 'spt-alg': 'kruskal', 'manifold': 'PoincareBall', 'dim': 256, 'num-adj': 4, 'add-rate': 0.1, 'tem': 0.7, 'consis-rate': 1.3, 'use-att': 0, 'num-layers': 4}. Best is trial 107 with value: 0.6813.[0m
[32m[I 2022-06-16 18:42:48,377][0m Trial 120 finished with value: 0.6764000000000001 and parameters: {'dropout': 0.5995957674313316, 'weight_decay': 0.01892567457405074, 'lr': 0.0028335824674584906, 'patience': 130, 'spt-alg': 'kruskal', 'manifold': 'PoincareBall', 'dim': 256, 'num-adj': 4, 'add-rate': 0.1, 'tem': 0.7, 'consis-rate': 1.1, 'use-att': 0, 'num-layers': 4}. Best is trial 107 with value: 0.6813.[0m
[32m[I 2022-06-16 18:44:53,751][0m Trial 121 finished with value: 0.6773 and parameters: {'dropout': 0.5905934475514174, 'weight_decay': 0.0029663388946652674, 'lr': 0.003764339422912207, 'patience': 130, 'spt-alg': 'kruskal', 'manifold': 'PoincareBall', 'dim': 256, 'num-adj': 4, 'add-rate': 0.1, 'tem': 0.7, 'consis-rate': 1.3, 'use-att': 0, 'num-layers': 4}. Best is trial 107 with value: 0.6813.[0m
[32m[I 2022-06-16 18:46:59,654][0m Trial 122 finished with value: 0.6766 and parameters: {'dropout': 0.5817211302736899, 'weight_decay': 0.007293307713827144, 'lr': 0.004530871426571263, 'patience': 120, 'spt-alg': 'kruskal', 'manifold': 'PoincareBall', 'dim': 256, 'num-adj': 4, 'add-rate': 0.1, 'tem': 0.7, 'consis-rate': 1.3, 'use-att': 0, 'num-layers': 4}. Best is trial 107 with value: 0.6813.[0m
[32m[I 2022-06-16 18:49:24,237][0m Trial 123 finished with value: 0.6778 and parameters: {'dropout': 0.5656130673240404, 'weight_decay': 0.026859566526943986, 'lr': 0.003658007502869563, 'patience': 140, 'spt-alg': 'kruskal', 'manifold': 'PoincareBall', 'dim': 256, 'num-adj': 4, 'add-rate': 0.1, 'tem': 0.6, 'consis-rate': 1.4, 'use-att': 0, 'num-layers': 4}. Best is trial 107 with value: 0.6813.[0m
