[32m[I 2022-06-16 21:20:37,195][0m Trial 188 finished with value: 0.6780000000000002 and parameters: {'dropout': 0.567708879865753, 'weight_decay': 0.003924529314074812, 'lr': 0.003932377772883674, 'patience': 110, 'spt-alg': 'kruskal', 'manifold': 'PoincareBall', 'dim': 256, 'num-adj': 6, 'add-rate': 0.5, 'tem': 0.9, 'consis-rate': 1.4, 'use-att': 0, 'num-layers': 4}. Best is trial 107 with value: 0.6813.[0m

mean: 0.6774000000000001
[0.671 0.682 0.683 0.686 0.67  0.683 0.668 0.682 0.674 0.675]
cur_param: {'dropout': 0.5850796389706283, 'weight-decay': 0.005108986992361604, 'lr': 0.004145693036008774, 'lr-reduce-freq': 100, 'patience': 100, 'spt-alg': 'kruskal', 'manifold': 'PoincareBall', 'dim': 256, 'num-adj': 6, 'add-rate': 0.5, 'tem': 0.9, 'consis-rate': 1.4, 'use-att': 0, 'num-layers': 4}
mean: 0.6774000000000001
[0.666 0.686 0.668 0.689 0.674 0.688 0.671 0.692 0.663 0.677]
cur_param: {'dropout': 0.5928346179347697, 'weight-decay': 0.004973557159535574, 'lr': 0.0037248550350187774, 'lr-reduce-freq': 110, 'patience': 110, 'spt-alg': 'kruskal', 'manifold': 'PoincareBall', 'dim': 256, 'num-adj': 6, 'add-rate': 0.5, 'tem': 0.9, 'consis-rate': 1.5, 'use-att': 0, 'num-layers': 4}
mean: 0.6799000000000001
[0.674 0.688 0.678 0.69  0.673 0.68  0.672 0.696 0.668 0.68 ]
cur_param: {'dropout': 0.5912568534857057, 'weight-decay': 0.004934121039005704, 'lr': 0.0037001967589996563, 'lr-reduce-freq': 110, 'patience': 110, 'spt-alg': 'kruskal', 'manifold': 'PoincareBall', 'dim': 256, 'num-adj': 6, 'add-rate': 0.5, 'tem': 0.9, 'consis-rate': 1.5, 'use-att': 0, 'num-layers': 4}
mean: 0.6795000000000001
[0.671 0.691 0.674 0.689 0.67  0.682 0.67  0.698 0.668 0.682]
cur_param: {'dropout': 0.5928675785604304, 'weight-decay': 0.00491140200994079, 'lr': 0.003656007701271142, 'lr-reduce-freq': 110, 'patience': 110, 'spt-alg': 'kruskal', 'manifold': 'PoincareBall', 'dim': 256, 'num-adj': 6, 'add-rate': 0.5, 'tem': 0.9, 'consis-rate': 1.5, 'use-att': 0, 'num-layers': 4}
mean: 0.6793000000000001
[0.674 0.689 0.677 0.687 0.674 0.682 0.671 0.694 0.663 0.682]
cur_param: {'dropout': 0.24161700870929254, 'weight-decay': 0.004736405413272956, 'lr': 0.003706406383550613, 'lr-reduce-freq': 110, 'patience': 110, 'spt-alg': 'kruskal', 'manifold': 'PoincareBall', 'dim': 256, 'num-adj': 6, 'add-rate': 0.5, 'tem': 0.9, 'consis-rate': 1.5, 'use-att': 0, 'num-layers': 4}
mean: 0.6637000000000001
[0.657 0.667 0.672 0.665 0.659 0.664 0.661 0.657 0.665 0.67 ]
cur_param: {'dropout': 0.5920698482793955, 'weight-decay': 0.005139520849268524, 'lr': 0.0033293508245557366, 'lr-reduce-freq': 110, 'patience': 110, 'spt-alg': 'kruskal', 'manifold': 'PoincareBall', 'dim': 256, 'num-adj': 6, 'add-rate': 0.5, 'tem': 0.9, 'consis-rate': 1.5, 'use-att': 0, 'num-layers': 4}
mean: 0.6767000000000001
[0.669 0.688 0.686 0.676 0.675 0.68  0.671 0.695 0.667 0.66 ]
cur_param: {'dropout': 0.5801336216167771, 'weight-decay': 0.004879884359141563, 'lr': 0.0036202187025459985, 'lr-reduce-freq': 110, 'patience': 110, 'spt-alg': 'kruskal', 'manifold': 'PoincareBall', 'dim': 256, 'num-adj': 6, 'add-rate': 0.5, 'tem': 0.9, 'consis-rate': 1.6, 'use-att': 0, 'num-layers': 4}
mean: 0.6777
[0.671 0.686 0.677 0.688 0.672 0.679 0.666 0.688 0.667 0.683]
cur_param: {'dropout': 0.588669649841831, 'weight-decay': 0.00364932320267972, 'lr': 0.0028946611478551276, 'lr-reduce-freq': 110, 'patience': 110, 'spt-alg': 'kruskal', 'manifold': 'PoincareBall', 'dim': 256, 'num-adj': 6, 'add-rate': 0.5, 'tem': 0.9, 'consis-rate': 1.5, 'use-att': 0, 'num-layers': 4}
mean: 0.6750999999999999
[0.677 0.672 0.686 0.684 0.674 0.677 0.675 0.675 0.672 0.659]
cur_param: {'dropout': 0.5685952099199353, 'weight-decay': 0.004474175392175059, 'lr': 0.0030463346522966867, 'lr-reduce-freq': 110, 'patience': 110, 'spt-alg': 'kruskal', 'manifold': 'PoincareBall', 'dim': 256, 'num-adj': 6, 'add-rate': 0.5, 'tem': 0.9, 'consis-rate': 1.5, 'use-att': 0, 'num-layers': 4}
mean: 0.6765000000000001
[0.674 0.681 0.683 0.681 0.675 0.675 0.677 0.689 0.67  0.66 ]
cur_param: {'dropout': 0.5786665746667102, 'weight-decay': 0.005613841183014327, 'lr': 0.003975867342109813, 'lr-reduce-freq': 100, 'patience': 100, 'spt-alg': 'kruskal', 'manifold': 'PoincareBall', 'dim': 256, 'num-adj': 6, 'add-rate': 0.5, 'tem': 0.9, 'consis-rate': 1.4, 'use-att': 0, 'num-layers': 4}
mean: 0.6769000000000001
[0.661 0.685 0.671 0.688 0.679 0.684 0.666 0.688 0.661 0.686]
cur_param: {'dropout': 0.5925949071489905, 'weight-decay': 0.00431587873516779, 'lr': 0.003498248497244518, 'lr-reduce-freq': 110, 'patience': 110, 'spt-alg': 'kruskal', 'manifold': 'PoincareBall', 'dim': 256, 'num-adj': 6, 'add-rate': 0.5, 'tem': 0.9, 'consis-rate': 1.5, 'use-att': 0, 'num-layers': 4}
mean: 0.6784
[0.673 0.685 0.681 0.681 0.676 0.679 0.669 0.696 0.662 0.682]
cur_param: {'dropout': 0.5999733277522525, 'weight-decay': 0.006974730607166782, 'lr': 0.0037706240259654765, 'lr-reduce-freq': 110, 'patience': 110, 'spt-alg': 'kruskal', 'manifold': 'PoincareBall', 'dim': 256, 'num-adj': 6, 'add-rate': 0.5, 'tem': 0.9, 'consis-rate': 1.6, 'use-att': 0, 'num-layers': 3}
mean: 0.679
[0.668 0.69  0.675 0.692 0.668 0.68  0.672 0.696 0.674 0.675]
cur_param: {'dropout': 0.599471954187992, 'weight-decay': 0.006857696569410469, 'lr': 0.003883717184857987, 'lr-reduce-freq': 110, 'patience': 110, 'spt-alg': 'kruskal', 'manifold': 'PoincareBall', 'dim': 256, 'num-adj': 6, 'add-rate': 0.5, 'tem': 0.9, 'consis-rate': 1.6, 'use-att': 0, 'num-layers': 3}
mean: 0.6798
[0.674 0.692 0.674 0.694 0.67  0.681 0.674 0.689 0.667 0.683]
cur_param: {'dropout': 0.5846693777561897, 'weight-decay': 0.005382007933850436, 'lr': 0.004232835370831552, 'lr-reduce-freq': 110, 'patience': 110, 'spt-alg': 'kruskal', 'manifold': 'PoincareBall', 'dim': 256, 'num-adj': 6, 'add-rate': 0.5, 'tem': 0.9, 'consis-rate': 1.6, 'use-att': 0, 'num-layers': 3}
mean: 0.6754
[0.661 0.684 0.67  0.686 0.674 0.684 0.674 0.676 0.665 0.68 ]
cur_param: {'dropout': 0.5923689905268177, 'weight-decay': 0.006796273486425689, 'lr': 0.003228152111050076, 'lr-reduce-freq': 110, 'patience': 110, 'spt-alg': 'kruskal', 'manifold': 'PoincareBall', 'dim': 256, 'num-adj': 6, 'add-rate': 0.5, 'tem': 0.9, 'consis-rate': 1.4, 'use-att': 0, 'num-layers': 3}
mean: 0.6774
[0.673 0.687 0.688 0.67  0.676 0.679 0.681 0.685 0.667 0.668]
cur_param: {'dropout': 0.5851932619281286, 'weight-decay': 0.00601148548283479, 'lr': 0.003605863382428727, 'lr-reduce-freq': 110, 'patience': 110, 'spt-alg': 'kruskal', 'manifold': 'PoincareBall', 'dim': 256, 'num-adj': 6, 'add-rate': 0.5, 'tem': 1.0, 'consis-rate': 1.4, 'use-att': 0, 'num-layers': 3}
mean: 0.6769999999999999
[0.668 0.687 0.68  0.688 0.67  0.682 0.669 0.687 0.662 0.677]
cur_param: {'dropout': 0.593593233104383, 'weight-decay': 0.0049674244295771905, 'lr': 0.004017538875753114, 'lr-reduce-freq': 110, 'patience': 110, 'spt-alg': 'kruskal', 'manifold': 'PoincareBall', 'dim': 256, 'num-adj': 6, 'add-rate': 0.5, 'tem': 0.9, 'consis-rate': 1.5, 'use-att': 0, 'num-layers': 3}
mean: 0.6766
[0.664 0.687 0.673 0.689 0.676 0.685 0.67  0.682 0.672 0.668]
cur_param: {'dropout': 0.5769414164422624, 'weight-decay': 0.005577550573632802, 'lr': 0.0037599126191426614, 'lr-reduce-freq': 100, 'patience': 100, 'spt-alg': 'kruskal', 'manifold': 'PoincareBall', 'dim': 256, 'num-adj': 6, 'add-rate': 0.5, 'tem': 0.8, 'consis-rate': 1.4, 'use-att': 0, 'num-layers': 4}
mean: 0.6758000000000001
[0.672 0.682 0.676 0.69  0.672 0.681 0.665 0.69  0.662 0.668]
cur_param: {'dropout': 0.5999575227884176, 'weight-decay': 0.0062017396759147456, 'lr': 0.003402786610002488, 'lr-reduce-freq': 110, 'patience': 110, 'spt-alg': 'kruskal', 'manifold': 'PoincareBall', 'dim': 256, 'num-adj': 6, 'add-rate': 0.5, 'tem': 0.9, 'consis-rate': 1.6, 'use-att': 0, 'num-layers': 4}
mean: 0.6769999999999999
[0.674 0.687 0.687 0.675 0.675 0.677 0.676 0.691 0.672 0.656]
cur_param: {'dropout': 0.567708879865753, 'weight-decay': 0.003924529314074812, 'lr': 0.003932377772883674, 'lr-reduce-freq': 110, 'patience': 110, 'spt-alg': 'kruskal', 'manifold': 'PoincareBall', 'dim': 256, 'num-adj': 6, 'add-rate': 0.5, 'tem': 0.9, 'consis-rate': 1.4, 'use-att': 0, 'num-layers': 4}
mean: 0.6780000000000002
[0.671 0.685 0.676 0.687 0.674 0.68  0.671 0.691 0.658 0.687]
cur_param: {'dropout': 0.5876019280356196, 'weight-decay': 0.006882285073754158, 'lr': 0.004243872430260958, 'lr-reduce-freq': 100, 'patience': 100, 'spt-alg': 'kruskal', 'manifold': 'PoincareBall', 'dim': 256, 'num-adj': 6, 'add-rate': 0.6, 'tem': 0.8, 'consis-rate': 1.5, 'use-att': 0, 'num-layers': 4}
mean: 0.676
[0.656 0.685 0.676 0.691 0.67  0.688 0.665 0.679 0.668 0.682][32m[I 2022-06-16 21:22:47,331][0m Trial 189 finished with value: 0.676 and parameters: {'dropout': 0.5876019280356196, 'weight_decay': 0.006882285073754158, 'lr': 0.004243872430260958, 'patience': 100, 'spt-alg': 'kruskal', 'manifold': 'PoincareBall', 'dim': 256, 'num-adj': 6, 'add-rate': 0.6, 'tem': 0.8, 'consis-rate': 1.5, 'use-att': 0, 'num-layers': 4}. Best is trial 107 with value: 0.6813.[0m
[32m[I 2022-06-16 21:25:03,974][0m Trial 190 finished with value: 0.6768 and parameters: {'dropout': 0.5758117739469206, 'weight_decay': 0.004594945844470527, 'lr': 0.0035794170721084977, 'patience': 110, 'spt-alg': 'kruskal', 'manifold': 'PoincareBall', 'dim': 256, 'num-adj': 6, 'add-rate': 0.5, 'tem': 1.0, 'consis-rate': 1.7000000000000002, 'use-att': 0, 'num-layers': 4}. Best is trial 107 with value: 0.6813.[0m
[32m[I 2022-06-16 21:27:21,166][0m Trial 191 finished with value: 0.6804 and parameters: {'dropout': 0.5933447203645497, 'weight_decay': 0.006172239645065309, 'lr': 0.003670621301808514, 'patience': 110, 'spt-alg': 'kruskal', 'manifold': 'PoincareBall', 'dim': 256, 'num-adj': 6, 'add-rate': 0.5, 'tem': 0.9, 'consis-rate': 1.3, 'use-att': 0, 'num-layers': 4}. Best is trial 107 with value: 0.6813.[0m
[32m[I 2022-06-16 21:29:40,703][0m Trial 192 finished with value: 0.6789999999999999 and parameters: {'dropout': 0.5931521776121251, 'weight_decay': 0.005702245470425407, 'lr': 0.003766597798587491, 'patience': 110, 'spt-alg': 'kruskal', 'manifold': 'PoincareBall', 'dim': 256, 'num-adj': 6, 'add-rate': 0.5, 'tem': 0.9, 'consis-rate': 1.3, 'use-att': 0, 'num-layers': 4}. Best is trial 107 with value: 0.6813.[0m
[32m[I 2022-06-16 21:31:56,921][0m Trial 193 finished with value: 0.6784000000000001 and parameters: {'dropout': 0.599530329522785, 'weight_decay': 0.007319515291098156, 'lr': 0.0033249823867561664, 'patience': 110, 'spt-alg': 'kruskal', 'manifold': 'PoincareBall', 'dim': 256, 'num-adj': 6, 'add-rate': 0.5, 'tem': 0.9, 'consis-rate': 1.3, 'use-att': 0, 'num-layers': 4}. Best is trial 107 with value: 0.6813.[0m
[32m[I 2022-06-16 21:34:17,500][0m Trial 194 finished with value: 0.6782 and parameters: {'dropout': 0.586804497310398, 'weight_decay': 0.005068583180245804, 'lr': 0.003980126249923482, 'patience': 110, 'spt-alg': 'kruskal', 'manifold': 'PoincareBall', 'dim': 256, 'num-adj': 6, 'add-rate': 0.5, 'tem': 0.9, 'consis-rate': 1.3, 'use-att': 0, 'num-layers': 4}. Best is trial 107 with value: 0.6813.[0m
[32m[I 2022-06-16 21:36:34,896][0m Trial 195 finished with value: 0.6770999999999999 and parameters: {'dropout': 0.581550703248448, 'weight_decay': 0.0064749780658337865, 'lr': 0.0035165882538143963, 'patience': 110, 'spt-alg': 'kruskal', 'manifold': 'PoincareBall', 'dim': 256, 'num-adj': 6, 'add-rate': 0.5, 'tem': 0.9, 'consis-rate': 1.4, 'use-att': 0, 'num-layers': 4}. Best is trial 107 with value: 0.6813.[0m
[32m[I 2022-06-16 21:38:59,756][0m Trial 196 finished with value: 0.6773 and parameters: {'dropout': 0.5997509262779587, 'weight_decay': 0.003167682359296915, 'lr': 0.0031755920704879116, 'patience': 110, 'spt-alg': 'kruskal', 'manifold': 'PoincareBall', 'dim': 256, 'num-adj': 6, 'add-rate': 0.5, 'tem': 0.8, 'consis-rate': 1.4, 'use-att': 1, 'num-layers': 4}. Best is trial 107 with value: 0.6813.[0m
[32m[I 2022-06-16 21:41:11,824][0m Trial 197 finished with value: 0.6762 and parameters: {'dropout': 0.5909125168213397, 'weight_decay': 0.0053169287781230515, 'lr': 0.004197941383692143, 'patience': 100, 'spt-alg': 'kruskal', 'manifold': 'PoincareBall', 'dim': 256, 'num-adj': 6, 'add-rate': 0.5, 'tem': 1.0, 'consis-rate': 1.3, 'use-att': 0, 'num-layers': 4}. Best is trial 107 with value: 0.6813.[0m
[32m[I 2022-06-16 21:43:33,550][0m Trial 198 finished with value: 0.678 and parameters: {'dropout': 0.582080398959487, 'weight_decay': 0.004256963445710928, 'lr': 0.003714547350183207, 'patience': 110, 'spt-alg': 'prim', 'manifold': 'PoincareBall', 'dim': 256, 'num-adj': 6, 'add-rate': 0.5, 'tem': 0.8, 'consis-rate': 1.5, 'use-att': 0, 'num-layers': 3}. Best is trial 107 with value: 0.6813.[0m
[32m[I 2022-06-16 21:45:48,282][0m Trial 199 finished with value: 0.6674000000000001 and parameters: {'dropout': 0.348136093857667, 'weight_decay': 0.006091156045843032, 'lr': 0.004691669028497326, 'patience': 110, 'spt-alg': 'kruskal', 'manifold': 'PoincareBall', 'dim': 256, 'num-adj': 6, 'add-rate': 0.5, 'tem': 0.9, 'consis-rate': 1.3, 'use-att': 0, 'num-layers': 4}. Best is trial 107 with value: 0.6813.[0m

cur_param: {'dropout': 0.5758117739469206, 'weight-decay': 0.004594945844470527, 'lr': 0.0035794170721084977, 'lr-reduce-freq': 110, 'patience': 110, 'spt-alg': 'kruskal', 'manifold': 'PoincareBall', 'dim': 256, 'num-adj': 6, 'add-rate': 0.5, 'tem': 1.0, 'consis-rate': 1.7000000000000002, 'use-att': 0, 'num-layers': 4}
mean: 0.6768
[0.668 0.681 0.676 0.682 0.666 0.686 0.681 0.69  0.666 0.672]
cur_param: {'dropout': 0.5933447203645497, 'weight-decay': 0.006172239645065309, 'lr': 0.003670621301808514, 'lr-reduce-freq': 110, 'patience': 110, 'spt-alg': 'kruskal', 'manifold': 'PoincareBall', 'dim': 256, 'num-adj': 6, 'add-rate': 0.5, 'tem': 0.9, 'consis-rate': 1.3, 'use-att': 0, 'num-layers': 4}
mean: 0.6804
[0.674 0.689 0.676 0.69  0.675 0.683 0.671 0.697 0.67  0.679]
cur_param: {'dropout': 0.5931521776121251, 'weight-decay': 0.005702245470425407, 'lr': 0.003766597798587491, 'lr-reduce-freq': 110, 'patience': 110, 'spt-alg': 'kruskal', 'manifold': 'PoincareBall', 'dim': 256, 'num-adj': 6, 'add-rate': 0.5, 'tem': 0.9, 'consis-rate': 1.3, 'use-att': 0, 'num-layers': 4}
mean: 0.6789999999999999
[0.673 0.691 0.674 0.69  0.675 0.685 0.669 0.691 0.667 0.675]
cur_param: {'dropout': 0.599530329522785, 'weight-decay': 0.007319515291098156, 'lr': 0.0033249823867561664, 'lr-reduce-freq': 110, 'patience': 110, 'spt-alg': 'kruskal', 'manifold': 'PoincareBall', 'dim': 256, 'num-adj': 6, 'add-rate': 0.5, 'tem': 0.9, 'consis-rate': 1.3, 'use-att': 0, 'num-layers': 4}
mean: 0.6784000000000001
[0.678 0.685 0.686 0.668 0.674 0.678 0.685 0.69  0.668 0.672]
cur_param: {'dropout': 0.586804497310398, 'weight-decay': 0.005068583180245804, 'lr': 0.003980126249923482, 'lr-reduce-freq': 110, 'patience': 110, 'spt-alg': 'kruskal', 'manifold': 'PoincareBall', 'dim': 256, 'num-adj': 6, 'add-rate': 0.5, 'tem': 0.9, 'consis-rate': 1.3, 'use-att': 0, 'num-layers': 4}
mean: 0.6782
[0.672 0.688 0.67  0.686 0.678 0.687 0.673 0.691 0.673 0.664]
cur_param: {'dropout': 0.581550703248448, 'weight-decay': 0.0064749780658337865, 'lr': 0.0035165882538143963, 'lr-reduce-freq': 110, 'patience': 110, 'spt-alg': 'kruskal', 'manifold': 'PoincareBall', 'dim': 256, 'num-adj': 6, 'add-rate': 0.5, 'tem': 0.9, 'consis-rate': 1.4, 'use-att': 0, 'num-layers': 4}
mean: 0.6770999999999999
[0.671 0.69  0.678 0.684 0.667 0.68  0.668 0.687 0.669 0.677]
cur_param: {'dropout': 0.5997509262779587, 'weight-decay': 0.003167682359296915, 'lr': 0.0031755920704879116, 'lr-reduce-freq': 110, 'patience': 110, 'spt-alg': 'kruskal', 'manifold': 'PoincareBall', 'dim': 256, 'num-adj': 6, 'add-rate': 0.5, 'tem': 0.8, 'consis-rate': 1.4, 'use-att': 1, 'num-layers': 4}
mean: 0.6773
[0.676 0.682 0.685 0.679 0.671 0.674 0.68  0.691 0.675 0.66 ]
cur_param: {'dropout': 0.5909125168213397, 'weight-decay': 0.0053169287781230515, 'lr': 0.004197941383692143, 'lr-reduce-freq': 100, 'patience': 100, 'spt-alg': 'kruskal', 'manifold': 'PoincareBall', 'dim': 256, 'num-adj': 6, 'add-rate': 0.5, 'tem': 1.0, 'consis-rate': 1.3, 'use-att': 0, 'num-layers': 4}
mean: 0.6762
[0.671 0.681 0.664 0.692 0.677 0.683 0.676 0.677 0.662 0.679]
cur_param: {'dropout': 0.582080398959487, 'weight-decay': 0.004256963445710928, 'lr': 0.003714547350183207, 'lr-reduce-freq': 110, 'patience': 110, 'spt-alg': 'prim', 'manifold': 'PoincareBall', 'dim': 256, 'num-adj': 6, 'add-rate': 0.5, 'tem': 0.8, 'consis-rate': 1.5, 'use-att': 0, 'num-layers': 3}
mean: 0.678
[0.67  0.686 0.677 0.688 0.672 0.678 0.668 0.691 0.666 0.684]
cur_param: {'dropout': 0.348136093857667, 'weight-decay': 0.006091156045843032, 'lr': 0.004691669028497326, 'lr-reduce-freq': 110, 'patience': 110, 'spt-alg': 'kruskal', 'manifold': 'PoincareBall', 'dim': 256, 'num-adj': 6, 'add-rate': 0.5, 'tem': 0.9, 'consis-rate': 1.3, 'use-att': 0, 'num-layers': 4}
mean: 0.6674000000000001
[0.66  0.668 0.676 0.673 0.673 0.669 0.654 0.661 0.674 0.666]
best param:{'dropout': 0.5963674686519118, 'weight_decay': 0.007790782250865948, 'lr': 0.004061666316952351, 'patience': 120, 'spt-alg': 'kruskal', 'manifold': 'PoincareBall', 'dim': 256, 'num-adj': 4, 'add-rate': 0.6, 'tem': 0.8, 'consis-rate': 1.2000000000000002, 'use-att': 0, 'num-layers': 4}
best score:0.6813

Final results:

0.6813
