nohup: ignoring input
[32m[I 2022-06-12 15:07:25,914][0m A new study created in memory with name: no-name-b84af2d4-cef4-42d3-80ea-a8a204fb9414[0m
[32m[I 2022-06-12 15:09:12,146][0m Trial 0 finished with value: 0.6706 and parameters: {'dropout': 0.5715898164757476, 'weight_decay': 0.002049851485032152, 'lr': 0.004164660805459022, 'patience': 60, 'spt-alg': 'prim', 'manifold': 'PoincareBall', 'dim': 64, 'num-adj': 6, 'add-rate': 0.6, 'tem': 1.1, 'consis-rate': 0.5, 'use-att': 1}. Best is trial 0 with value: 0.6706.[0m
[32m[I 2022-06-12 15:12:41,235][0m Trial 1 finished with value: 0.6589 and parameters: {'dropout': 0.5686276036838869, 'weight_decay': 0.014898102285426991, 'lr': 0.00390914872519724, 'patience': 90, 'spt-alg': 'prim', 'manifold': 'Hyperboloid', 'dim': 64, 'num-adj': 8, 'add-rate': 0.4, 'tem': 0.9, 'consis-rate': 1.5, 'use-att': 1}. Best is trial 0 with value: 0.6706.[0m
[32m[I 2022-06-12 15:17:54,345][0m Trial 2 finished with value: 0.6576000000000001 and parameters: {'dropout': 0.40415969408450925, 'weight_decay': 0.0006880680385324705, 'lr': 0.0007829084457239828, 'patience': 70, 'spt-alg': 'kruskal', 'manifold': 'Hyperboloid', 'dim': 64, 'num-adj': 8, 'add-rate': 0.5, 'tem': 0.9, 'consis-rate': 0.8, 'use-att': 1}. Best is trial 0 with value: 0.6706.[0m
[32m[I 2022-06-12 15:22:12,356][0m Trial 3 finished with value: 0.6681 and parameters: {'dropout': 0.2219054867105201, 'weight_decay': 0.021654564546506654, 'lr': 0.0005618852755083695, 'patience': 60, 'spt-alg': 'prim', 'manifold': 'Hyperboloid', 'dim': 128, 'num-adj': 8, 'add-rate': 0.1, 'tem': 1.3, 'consis-rate': 1.6, 'use-att': 1}. Best is trial 0 with value: 0.6706.[0m
[32m[I 2022-06-12 15:26:44,316][0m Trial 4 finished with value: 0.6741 and parameters: {'dropout': 0.23382969310584298, 'weight_decay': 0.001412236752535425, 'lr': 0.002490209529308003, 'patience': 110, 'spt-alg': 'prim', 'manifold': 'Hyperboloid', 'dim': 128, 'num-adj': 8, 'add-rate': 0.5, 'tem': 1.3, 'consis-rate': 1.7000000000000002, 'use-att': 0}. Best is trial 4 with value: 0.6741.[0m
[32m[I 2022-06-12 15:30:16,061][0m Trial 5 finished with value: 0.6865 and parameters: {'dropout': 0.3538159656927785, 'weight_decay': 0.0016616949495237504, 'lr': 0.002387352402587431, 'patience': 130, 'spt-alg': 'kruskal', 'manifold': 'PoincareBall', 'dim': 256, 'num-adj': 6, 'add-rate': 0.2, 'tem': 0.5, 'consis-rate': 1.0, 'use-att': 1}. Best is trial 5 with value: 0.6865.[0m
[32m[I 2022-06-12 15:33:03,114][0m Trial 6 finished with value: 0.6788000000000001 and parameters: {'dropout': 0.2055446438500774, 'weight_decay': 0.008182231944631945, 'lr': 0.0019569633532284117, 'patience': 90, 'spt-alg': 'prim', 'manifold': 'PoincareBall', 'dim': 128, 'num-adj': 4, 'add-rate': 0.4, 'tem': 1.5, 'consis-rate': 1.3, 'use-att': 0}. Best is trial 5 with value: 0.6865.[0m
[32m[I 2022-06-12 15:37:26,591][0m Trial 7 finished with value: 0.6852999999999999 and parameters: {'dropout': 0.529110707724167, 'weight_decay': 0.001452280664663823, 'lr': 0.009444305559497683, 'patience': 130, 'spt-alg': 'prim', 'manifold': 'Hyperboloid', 'dim': 192, 'num-adj': 8, 'add-rate': 0.4, 'tem': 0.5, 'consis-rate': 2.0, 'use-att': 0}. Best is trial 5 with value: 0.6865.[0m
[32m[I 2022-06-12 15:47:29,071][0m Trial 8 finished with value: 0.6651000000000001 and parameters: {'dropout': 0.3244246028131713, 'weight_decay': 0.0017897069549297952, 'lr': 0.0006697033335035693, 'patience': 120, 'spt-alg': 'kruskal', 'manifold': 'Hyperboloid', 'dim': 64, 'num-adj': 2, 'add-rate': 0.7, 'tem': 1.0, 'consis-rate': 1.9000000000000001, 'use-att': 1}. Best is trial 5 with value: 0.6865.[0m
[32m[I 2022-06-12 15:53:55,093][0m Trial 9 finished with value: 0.6613 and parameters: {'dropout': 0.3220248478354842, 'weight_decay': 0.005828348944126111, 'lr': 0.002756503672543092, 'patience': 150, 'spt-alg': 'kruskal', 'manifold': 'Hyperboloid', 'dim': 64, 'num-adj': 8, 'add-rate': 0.4, 'tem': 0.5, 'consis-rate': 1.8, 'use-att': 0}. Best is trial 5 with value: 0.6865.[0m
[32m[I 2022-06-12 15:58:18,122][0m Trial 10 finished with value: 0.6935999999999999 and parameters: {'dropout': 0.4610415591584812, 'weight_decay': 0.0007072895186776281, 'lr': 0.0012416646806506049, 'patience': 150, 'spt-alg': 'kruskal', 'manifold': 'PoincareBall', 'dim': 256, 'num-adj': 4, 'add-rate': 0.1, 'tem': 0.7, 'consis-rate': 1.0, 'use-att': 1}. Best is trial 10 with value: 0.6935999999999999.[0m
[32m[I 2022-06-12 16:02:47,505][0m Trial 11 finished with value: 0.6942 and parameters: {'dropout': 0.4590411507508527, 'weight_decay': 0.0006632263227336552, 'lr': 0.0010875622091280298, 'patience': 150, 'spt-alg': 'kruskal', 'manifold': 'PoincareBall', 'dim': 256, 'num-adj': 4, 'add-rate': 0.1, 'tem': 0.7, 'consis-rate': 1.0, 'use-att': 1}. Best is trial 11 with value: 0.6942.[0m
[32m[I 2022-06-12 16:06:58,372][0m Trial 12 finished with value: 0.6945 and parameters: {'dropout': 0.46139338735683544, 'weight_decay': 0.0005032305040758756, 'lr': 0.001217245696452469, 'patience': 150, 'spt-alg': 'kruskal', 'manifold': 'PoincareBall', 'dim': 256, 'num-adj': 4, 'add-rate': 0.2, 'tem': 0.7, 'consis-rate': 1.0, 'use-att': 1}. Best is trial 12 with value: 0.6945.[0m
[32m[I 2022-06-12 16:11:33,880][0m Trial 13 finished with value: 0.6952999999999999 and parameters: {'dropout': 0.47007416028277654, 'weight_decay': 0.0005050467494284653, 'lr': 0.0012123691496071108, 'patience': 150, 'spt-alg': 'kruskal', 'manifold': 'PoincareBall', 'dim': 256, 'num-adj': 2, 'add-rate': 0.2, 'tem': 0.7, 'consis-rate': 0.7, 'use-att': 1}. Best is trial 13 with value: 0.6952999999999999.[0m
[32m[I 2022-06-12 16:15:42,488][0m Trial 14 finished with value: 0.6847 and parameters: {'dropout': 0.4743502229802705, 'weight_decay': 0.0005051655293580085, 'lr': 0.0013039259766054626, 'patience': 130, 'spt-alg': 'kruskal', 'manifold': 'PoincareBall', 'dim': 192, 'num-adj': 2, 'add-rate': 0.2, 'tem': 0.7, 'consis-rate': 0.5, 'use-att': 1}. Best is trial 13 with value: 0.6952999999999999.[0m
[32m[I 2022-06-12 16:20:11,333][0m Trial 15 finished with value: 0.6860999999999999 and parameters: {'dropout': 0.41186432244107274, 'weight_decay': 0.003703384113817863, 'lr': 0.000967323014637617, 'patience': 140, 'spt-alg': 'kruskal', 'manifold': 'PoincareBall', 'dim': 192, 'num-adj': 2, 'add-rate': 0.30000000000000004, 'tem': 0.8, 'consis-rate': 0.7, 'use-att': 1}. Best is trial 13 with value: 0.6952999999999999.[0m
[32m[I 2022-06-12 16:23:50,846][0m Trial 16 finished with value: 0.6931999999999999 and parameters: {'dropout': 0.5084769507508191, 'weight_decay': 0.044323692169020976, 'lr': 0.0016105759496808946, 'patience': 110, 'spt-alg': 'kruskal', 'manifold': 'PoincareBall', 'dim': 256, 'num-adj': 2, 'add-rate': 0.2, 'tem': 0.6, 'consis-rate': 1.2000000000000002, 'use-att': 1}. Best is trial 13 with value: 0.6952999999999999.[0m
[32m[I 2022-06-12 16:29:11,824][0m Trial 17 finished with value: 0.6874 and parameters: {'dropout': 0.5227533122109832, 'weight_decay': 0.0009994514662895206, 'lr': 0.0005021198688323923, 'patience': 140, 'spt-alg': 'kruskal', 'manifold': 'PoincareBall', 'dim': 192, 'num-adj': 4, 'add-rate': 0.30000000000000004, 'tem': 0.8, 'consis-rate': 0.8, 'use-att': 1}. Best is trial 13 with value: 0.6952999999999999.[0m
[32m[I 2022-06-12 16:33:00,366][0m Trial 18 finished with value: 0.6949999999999998 and parameters: {'dropout': 0.4261726388878219, 'weight_decay': 0.0030379332422675927, 'lr': 0.000830024001919118, 'patience': 100, 'spt-alg': 'kruskal', 'manifold': 'PoincareBall', 'dim': 256, 'num-adj': 6, 'add-rate': 0.30000000000000004, 'tem': 1.0, 'consis-rate': 1.3, 'use-att': 0}. Best is trial 13 with value: 0.6952999999999999.[0m
[32m[I 2022-06-12 16:36:28,964][0m Trial 19 finished with value: 0.6936 and parameters: {'dropout': 0.37683593465951065, 'weight_decay': 0.0032644581401848195, 'lr': 0.0008140701710516344, 'patience': 90, 'spt-alg': 'kruskal', 'manifold': 'PoincareBall', 'dim': 256, 'num-adj': 6, 'add-rate': 0.30000000000000004, 'tem': 1.1, 'consis-rate': 1.4, 'use-att': 0}. Best is trial 13 with value: 0.6952999999999999.[0m
[32m[I 2022-06-12 16:39:21,767][0m Trial 20 finished with value: 0.6839 and parameters: {'dropout': 0.284615972889286, 'weight_decay': 0.009975310853029827, 'lr': 0.0016001920701934835, 'patience': 80, 'spt-alg': 'kruskal', 'manifold': 'PoincareBall', 'dim': 192, 'num-adj': 6, 'add-rate': 0.30000000000000004, 'tem': 1.2000000000000002, 'consis-rate': 1.3, 'use-att': 0}. Best is trial 13 with value: 0.6952999999999999.[0m
cur_param: {'dropout': 0.5715898164757476, 'weight-decay': 0.002049851485032152, 'lr': 0.004164660805459022, 'lr-reduce-freq': 60, 'patience': 60, 'spt-alg': 'prim', 'manifold': 'PoincareBall', 'dim': 64, 'num-adj': 6, 'add-rate': 0.6, 'tem': 1.1, 'consis-rate': 0.5, 'use-att': 1}
mean: 0.6706
[0.699 0.66  0.684 0.681 0.659 0.67  0.648 0.664 0.664 0.677]
cur_param: {'dropout': 0.5686276036838869, 'weight-decay': 0.014898102285426991, 'lr': 0.00390914872519724, 'lr-reduce-freq': 90, 'patience': 90, 'spt-alg': 'prim', 'manifold': 'Hyperboloid', 'dim': 64, 'num-adj': 8, 'add-rate': 0.4, 'tem': 0.9, 'consis-rate': 1.5, 'use-att': 1}
mean: 0.6589
[0.67  0.65  0.642 0.677 0.665 0.674 0.651 0.635 0.664 0.661]
cur_param: {'dropout': 0.40415969408450925, 'weight-decay': 0.0006880680385324705, 'lr': 0.0007829084457239828, 'lr-reduce-freq': 70, 'patience': 70, 'spt-alg': 'kruskal', 'manifold': 'Hyperboloid', 'dim': 64, 'num-adj': 8, 'add-rate': 0.5, 'tem': 0.9, 'consis-rate': 0.8, 'use-att': 1}
mean: 0.6576000000000001
[0.665 0.643 0.685 0.673 0.563 0.661 0.678 0.657 0.682 0.669]
cur_param: {'dropout': 0.2219054867105201, 'weight-decay': 0.021654564546506654, 'lr': 0.0005618852755083695, 'lr-reduce-freq': 60, 'patience': 60, 'spt-alg': 'prim', 'manifold': 'Hyperboloid', 'dim': 128, 'num-adj': 8, 'add-rate': 0.1, 'tem': 1.3, 'consis-rate': 1.6, 'use-att': 1}
mean: 0.6681
[0.676 0.678 0.68  0.662 0.668 0.646 0.666 0.655 0.667 0.683]
cur_param: {'dropout': 0.23382969310584298, 'weight-decay': 0.001412236752535425, 'lr': 0.002490209529308003, 'lr-reduce-freq': 110, 'patience': 110, 'spt-alg': 'prim', 'manifold': 'Hyperboloid', 'dim': 128, 'num-adj': 8, 'add-rate': 0.5, 'tem': 1.3, 'consis-rate': 1.7000000000000002, 'use-att': 0}
mean: 0.6741
[0.696 0.68  0.683 0.675 0.664 0.665 0.673 0.657 0.672 0.676]
cur_param: {'dropout': 0.3538159656927785, 'weight-decay': 0.0016616949495237504, 'lr': 0.002387352402587431, 'lr-reduce-freq': 130, 'patience': 130, 'spt-alg': 'kruskal', 'manifold': 'PoincareBall', 'dim': 256, 'num-adj': 6, 'add-rate': 0.2, 'tem': 0.5, 'consis-rate': 1.0, 'use-att': 1}
mean: 0.6865
[0.709 0.69  0.682 0.691 0.68  0.685 0.677 0.686 0.679 0.686]
cur_param: {'dropout': 0.2055446438500774, 'weight-decay': 0.008182231944631945, 'lr': 0.0019569633532284117, 'lr-reduce-freq': 90, 'patience': 90, 'spt-alg': 'prim', 'manifold': 'PoincareBall', 'dim': 128, 'num-adj': 4, 'add-rate': 0.4, 'tem': 1.5, 'consis-rate': 1.3, 'use-att': 0}
mean: 0.6788000000000001
[0.694 0.684 0.668 0.692 0.686 0.639 0.681 0.67  0.679 0.695]
cur_param: {'dropout': 0.529110707724167, 'weight-decay': 0.001452280664663823, 'lr': 0.009444305559497683, 'lr-reduce-freq': 130, 'patience': 130, 'spt-alg': 'prim', 'manifold': 'Hyperboloid', 'dim': 192, 'num-adj': 8, 'add-rate': 0.4, 'tem': 0.5, 'consis-rate': 2.0, 'use-att': 0}
mean: 0.6852999999999999
[0.692 0.702 0.692 0.697 0.67  0.686 0.672 0.684 0.696 0.662]
cur_param: {'dropout': 0.3244246028131713, 'weight-decay': 0.0017897069549297952, 'lr': 0.0006697033335035693, 'lr-reduce-freq': 120, 'patience': 120, 'spt-alg': 'kruskal', 'manifold': 'Hyperboloid', 'dim': 64, 'num-adj': 2, 'add-rate': 0.7, 'tem': 1.0, 'consis-rate': 1.9000000000000001, 'use-att': 1}
mean: 0.6651000000000001
[0.662 0.648 0.669 0.663 0.676 0.661 0.671 0.659 0.679 0.663]
cur_param: {'dropout': 0.3220248478354842, 'weight-decay': 0.005828348944126111, 'lr': 0.002756503672543092, 'lr-reduce-freq': 150, 'patience': 150, 'spt-alg': 'kruskal', 'manifold': 'Hyperboloid', 'dim': 64, 'num-adj': 8, 'add-rate': 0.4, 'tem': 0.5, 'consis-rate': 1.8, 'use-att': 0}
mean: 0.6613
[0.664 0.643 0.671 0.661 0.653 0.654 0.678 0.652 0.676 0.661]
cur_param: {'dropout': 0.4610415591584812, 'weight-decay': 0.0007072895186776281, 'lr': 0.0012416646806506049, 'lr-reduce-freq': 150, 'patience': 150, 'spt-alg': 'kruskal', 'manifold': 'PoincareBall', 'dim': 256, 'num-adj': 4, 'add-rate': 0.1, 'tem': 0.7, 'consis-rate': 1.0, 'use-att': 1}
mean: 0.6935999999999999
[0.708 0.676 0.71  0.696 0.69  0.679 0.691 0.694 0.691 0.701]
cur_param: {'dropout': 0.4590411507508527, 'weight-decay': 0.0006632263227336552, 'lr': 0.0010875622091280298, 'lr-reduce-freq': 150, 'patience': 150, 'spt-alg': 'kruskal', 'manifold': 'PoincareBall', 'dim': 256, 'num-adj': 4, 'add-rate': 0.1, 'tem': 0.7, 'consis-rate': 1.0, 'use-att': 1}
mean: 0.6942
[0.714 0.695 0.707 0.696 0.687 0.68  0.676 0.697 0.684 0.706]
cur_param: {'dropout': 0.46139338735683544, 'weight-decay': 0.0005032305040758756, 'lr': 0.001217245696452469, 'lr-reduce-freq': 150, 'patience': 150, 'spt-alg': 'kruskal', 'manifold': 'PoincareBall', 'dim': 256, 'num-adj': 4, 'add-rate': 0.2, 'tem': 0.7, 'consis-rate': 1.0, 'use-att': 1}
mean: 0.6945
[0.706 0.689 0.708 0.7   0.691 0.686 0.686 0.691 0.694 0.694]
cur_param: {'dropout': 0.47007416028277654, 'weight-decay': 0.0005050467494284653, 'lr': 0.0012123691496071108, 'lr-reduce-freq': 150, 'patience': 150, 'spt-alg': 'kruskal', 'manifold': 'PoincareBall', 'dim': 256, 'num-adj': 2, 'add-rate': 0.2, 'tem': 0.7, 'consis-rate': 0.7, 'use-att': 1}
mean: 0.6952999999999999
[0.707 0.69  0.713 0.699 0.688 0.682 0.685 0.695 0.695 0.699]
cur_param: {'dropout': 0.4743502229802705, 'weight-decay': 0.0005051655293580085, 'lr': 0.0013039259766054626, 'lr-reduce-freq': 130, 'patience': 130, 'spt-alg': 'kruskal', 'manifold': 'PoincareBall', 'dim': 192, 'num-adj': 2, 'add-rate': 0.2, 'tem': 0.7, 'consis-rate': 0.5, 'use-att': 1}
mean: 0.6847
[0.698 0.69  0.7   0.688 0.679 0.688 0.687 0.684 0.691 0.642]
cur_param: {'dropout': 0.41186432244107274, 'weight-decay': 0.003703384113817863, 'lr': 0.000967323014637617, 'lr-reduce-freq': 140, 'patience': 140, 'spt-alg': 'kruskal', 'manifold': 'PoincareBall', 'dim': 192, 'num-adj': 2, 'add-rate': 0.30000000000000004, 'tem': 0.8, 'consis-rate': 0.7, 'use-att': 1}
mean: 0.6860999999999999
[0.703 0.691 0.692 0.694 0.678 0.68  0.691 0.678 0.682 0.672]
cur_param: {'dropout': 0.5084769507508191, 'weight-decay': 0.044323692169020976, 'lr': 0.0016105759496808946, 'lr-reduce-freq': 110, 'patience': 110, 'spt-alg': 'kruskal', 'manifold': 'PoincareBall', 'dim': 256, 'num-adj': 2, 'add-rate': 0.2, 'tem': 0.6, 'consis-rate': 1.2000000000000002, 'use-att': 1}
mean: 0.6931999999999999
[0.71  0.696 0.707 0.695 0.685 0.67  0.705 0.684 0.689 0.691]
cur_param: {'dropout': 0.5227533122109832, 'weight-decay': 0.0009994514662895206, 'lr': 0.0005021198688323923, 'lr-reduce-freq': 140, 'patience': 140, 'spt-alg': 'kruskal', 'manifold': 'PoincareBall', 'dim': 192, 'num-adj': 4, 'add-rate': 0.30000000000000004, 'tem': 0.8, 'consis-rate': 0.8, 'use-att': 1}
mean: 0.6874
[0.673 0.695 0.696 0.706 0.685 0.674 0.682 0.691 0.69  0.682]
cur_param: {'dropout': 0.4261726388878219, 'weight-decay': 0.0030379332422675927, 'lr': 0.000830024001919118, 'lr-reduce-freq': 100, 'patience': 100, 'spt-alg': 'kruskal', 'manifold': 'PoincareBall', 'dim': 256, 'num-adj': 6, 'add-rate': 0.30000000000000004, 'tem': 1.0, 'consis-rate': 1.3, 'use-att': 0}
mean: 0.6949999999999998
[0.706 0.699 0.695 0.699 0.689 0.676 0.703 0.702 0.688 0.693]
cur_param: {'dropout': 0.37683593465951065, 'weight-decay': 0.0032644581401848195, 'lr': 0.0008140701710516344, 'lr-reduce-freq': 90, 'patience': 90, 'spt-alg': 'kruskal', 'manifold': 'PoincareBall', 'dim': 256, 'num-adj': 6, 'add-rate': 0.30000000000000004, 'tem': 1.1, 'consis-rate': 1.4, 'use-att': 0}
mean: 0.6936
[0.706 0.687 0.699 0.697 0.7   0.678 0.692 0.695 0.683 0.699]
cur_param: {'dropout': 0.284615972889286, 'weight-decay': 0.009975310853029827, 'lr': 0.0016001920701934835, 'lr-reduce-freq': 80, 'patience': 80, 'spt-alg': 'kruskal', 'manifold': 'PoincareBall', 'dim': 192, 'num-adj': 6, 'add-rate': 0.30000000000000004, 'tem': 1.2000000000000002, 'consis-rate': 1.3, 'use-att': 0}
mean: 0.6839
[0.69  0.687 0.697 0.697 0.672 0.672 0.694 0.672 0.678 0.68 ]
cur_param: {'dropout': 0.43073175342650744, 'weight-decay': 0.001098811684393502, 'lr': 0.0008993560746784092, 'lr-reduce-freq': 110, 'patience': 110, 'spt-alg': 'kruskal', 'manifold': 'PoincareBall', 'dim': 256, 'num-adj': 4, 'add-rate': 0.2, 'tem': 0.9, 'consis-rate': 1.1, 'use-att': 0}
mean: 0.6973999999999999
[0.721 0.706 0.703 0.699 0.689 0.676 0.702 0.695 0.682 0.701][32m[I 2022-06-12 16:43:10,993][0m Trial 21 finished with value: 0.6973999999999999 and parameters: {'dropout': 0.43073175342650744, 'weight_decay': 0.001098811684393502, 'lr': 0.0008993560746784092, 'patience': 110, 'spt-alg': 'kruskal', 'manifold': 'PoincareBall', 'dim': 256, 'num-adj': 4, 'add-rate': 0.2, 'tem': 0.9, 'consis-rate': 1.1, 'use-att': 0}. Best is trial 21 with value: 0.6973999999999999.[0m
[32m[I 2022-06-12 16:47:33,644][0m Trial 22 finished with value: 0.6944 and parameters: {'dropout': 0.43234261802059437, 'weight_decay': 0.002780330539803232, 'lr': 0.0008423778130989719, 'patience': 110, 'spt-alg': 'kruskal', 'manifold': 'PoincareBall', 'dim': 256, 'num-adj': 6, 'add-rate': 0.2, 'tem': 0.9, 'consis-rate': 1.2000000000000002, 'use-att': 0}. Best is trial 21 with value: 0.6973999999999999.[0m
[32m[I 2022-06-12 16:51:35,153][0m Trial 23 finished with value: 0.6919 and parameters: {'dropout': 0.42792059273691135, 'weight_decay': 0.0010908011493974883, 'lr': 0.0006110113826880488, 'patience': 100, 'spt-alg': 'kruskal', 'manifold': 'PoincareBall', 'dim': 256, 'num-adj': 2, 'add-rate': 0.30000000000000004, 'tem': 1.0, 'consis-rate': 0.7, 'use-att': 0}. Best is trial 21 with value: 0.6973999999999999.[0m
[32m[I 2022-06-12 16:55:15,716][0m Trial 24 finished with value: 0.689 and parameters: {'dropout': 0.49559465399212, 'weight_decay': 0.001056799626350313, 'lr': 0.0015981654527217064, 'patience': 100, 'spt-alg': 'kruskal', 'manifold': 'PoincareBall', 'dim': 192, 'num-adj': 4, 'add-rate': 0.1, 'tem': 0.8, 'consis-rate': 1.1, 'use-att': 0}. Best is trial 21 with value: 0.6973999999999999.[0m
[32m[I 2022-06-12 16:59:03,842][0m Trial 25 finished with value: 0.692 and parameters: {'dropout': 0.3832126086636705, 'weight_decay': 0.0026965126409587686, 'lr': 0.0009475968199661971, 'patience': 120, 'spt-alg': 'kruskal', 'manifold': 'PoincareBall', 'dim': 256, 'num-adj': 6, 'add-rate': 0.2, 'tem': 1.0, 'consis-rate': 1.5, 'use-att': 0}. Best is trial 21 with value: 0.6973999999999999.[0m
[32m[I 2022-06-12 17:02:26,089][0m Trial 26 finished with value: 0.6931999999999999 and parameters: {'dropout': 0.5973689139233141, 'weight_decay': 0.0055167950722367935, 'lr': 0.0007192476099301443, 'patience': 50, 'spt-alg': 'kruskal', 'manifold': 'PoincareBall', 'dim': 256, 'num-adj': 2, 'add-rate': 0.30000000000000004, 'tem': 1.1, 'consis-rate': 0.8, 'use-att': 0}. Best is trial 21 with value: 0.6973999999999999.[0m
[32m[I 2022-06-12 17:06:13,602][0m Trial 27 finished with value: 0.6890000000000001 and parameters: {'dropout': 0.4352455505912205, 'weight_decay': 0.0009880555663077204, 'lr': 0.0010015561429334839, 'patience': 80, 'spt-alg': 'kruskal', 'manifold': 'PoincareBall', 'dim': 192, 'num-adj': 4, 'add-rate': 0.5, 'tem': 0.6, 'consis-rate': 0.6, 'use-att': 0}. Best is trial 21 with value: 0.6973999999999999.[0m
[32m[I 2022-06-12 17:09:23,839][0m Trial 28 finished with value: 0.6854 and parameters: {'dropout': 0.3577349009276872, 'weight_decay': 0.0022201214843447924, 'lr': 0.00998282598607583, 'patience': 120, 'spt-alg': 'kruskal', 'manifold': 'PoincareBall', 'dim': 256, 'num-adj': 6, 'add-rate': 0.2, 'tem': 0.9, 'consis-rate': 0.9, 'use-att': 0}. Best is trial 21 with value: 0.6973999999999999.[0m
